[I 2025-03-01 22:24:13,654] Using an existing study with name 'R8-GATv2-google-bert-bert-base-uncased-Surrogate-No_Aggregation-No_Ablation-1.0-0.75' instead of creating a new one.
Token indices sequence length is longer than the specified maximum sequence length for this model (639 > 512). Running this sequence through the model will result in indexing errors
[I 2025-03-01 22:34:19,052] Trial 253 finished with value: 0.9207825475098664 and parameters: {'left_stride': 0, 'right_stride': 0, 'attention_pooling_operation': 'mean', 'embedding_pooling_operation': 'mean', 'threshold': 0.8993002819588347, 'batch_size': 122, 'attention_heads': 7, 'hidden_dimension': 145, 'number_of_hidden_layers': 0, 'dropout_rate': 0.32275474760503947, 'global_pooling': 'max', 'learning_rate': 0.0008152020399224768, 'weight_decay': 7.394108091201311e-05, 'beta_0': 0.808570911588037, 'beta_1': 0.9914133203173263, 'epsilon': 8.154703125721245e-05, 'balanced_loss': True, 'epochs': 112, 'early_stopping_patience': 18, 'plateau_patience': 25, 'plateau_divider': 8}. Best is trial 228 with value: 0.940926033029364.
[I 2025-03-01 22:45:38,674] Trial 254 finished with value: 0.9256029770804048 and parameters: {'left_stride': 0, 'right_stride': 32, 'attention_pooling_operation': 'mean', 'embedding_pooling_operation': 'mean', 'threshold': 0.9072827522594303, 'batch_size': 105, 'attention_heads': 12, 'hidden_dimension': 152, 'number_of_hidden_layers': 0, 'dropout_rate': 0.33963795393634, 'global_pooling': 'max', 'learning_rate': 0.0012555395842962325, 'weight_decay': 3.1198908798129594e-05, 'beta_0': 0.8046942810419149, 'beta_1': 0.986013967868247, 'epsilon': 4.2328982857167464e-05, 'balanced_loss': True, 'epochs': 144, 'early_stopping_patience': 18, 'plateau_patience': 22, 'plateau_divider': 10}. Best is trial 228 with value: 0.940926033029364.
[I 2025-03-01 22:57:34,451] Trial 255 finished with value: 0.9254622200303857 and parameters: {'left_stride': 64, 'right_stride': 32, 'attention_pooling_operation': 'mean', 'embedding_pooling_operation': 'mean', 'threshold': 0.9218290022294754, 'batch_size': 109, 'attention_heads': 13, 'hidden_dimension': 178, 'number_of_hidden_layers': 0, 'dropout_rate': 0.31774618077596983, 'global_pooling': 'max', 'learning_rate': 0.0017207440661523073, 'weight_decay': 0.0001232626691072652, 'beta_0': 0.8001443751501068, 'beta_1': 0.9886544983215708, 'epsilon': 2.0296533463332624e-05, 'balanced_loss': True, 'epochs': 126, 'early_stopping_patience': 19, 'plateau_patience': 24, 'plateau_divider': 8}. Best is trial 228 with value: 0.940926033029364.
[I 2025-03-01 23:07:29,361] Trial 256 finished with value: 0.9165979758887587 and parameters: {'left_stride': 0, 'right_stride': 128, 'attention_pooling_operation': 'mean', 'embedding_pooling_operation': 'mean', 'threshold': 0.9117637371174395, 'batch_size': 93, 'attention_heads': 10, 'hidden_dimension': 156, 'number_of_hidden_layers': 0, 'dropout_rate': 0.3316095938424348, 'global_pooling': 'mean', 'learning_rate': 0.0010365359173123848, 'weight_decay': 5.657252855073836e-05, 'beta_0': 0.8063570336028629, 'beta_1': 0.9894820783637132, 'epsilon': 2.5827371118690756e-05, 'balanced_loss': True, 'epochs': 119, 'early_stopping_patience': 18, 'plateau_patience': 23, 'plateau_divider': 7}. Best is trial 228 with value: 0.940926033029364.
[I 2025-03-01 23:16:49,620] Trial 257 finished with value: 0.9085560017214922 and parameters: {'left_stride': 0, 'right_stride': 32, 'attention_pooling_operation': 'mean', 'embedding_pooling_operation': 'mean', 'threshold': 0.8987399725906388, 'batch_size': 115, 'attention_heads': 6, 'hidden_dimension': 139, 'number_of_hidden_layers': 0, 'dropout_rate': 0.3253522253349762, 'global_pooling': 'max', 'learning_rate': 0.0006823582214327598, 'weight_decay': 2.640500614210044e-05, 'beta_0': 0.8019534228144077, 'beta_1': 0.9854352121215196, 'epsilon': 6.804739404523889e-06, 'balanced_loss': True, 'epochs': 106, 'early_stopping_patience': 18, 'plateau_patience': 20, 'plateau_divider': 6}. Best is trial 228 with value: 0.940926033029364.
CUDA out of memory. Tried to allocate 3.81 GiB. GPU 0 has a total capacity of 44.56 GiB of which 3.80 GiB is free. Including non-PyTorch memory, this process has 40.76 GiB memory in use. Of the allocated memory 36.15 GiB is allocated by PyTorch, and 3.45 GiB is reserved by PyTorch but unallocated. If reserved but unallocated memory is large try setting PYTORCH_CUDA_ALLOC_CONF=expandable_segments:True to avoid fragmentation.  See documentation for Memory Management  (https://pytorch.org/docs/stable/notes/cuda.html#environment-variables)
[I 2025-03-01 23:26:10,236] Trial 258 finished with value: -1.0 and parameters: {'left_stride': 0, 'right_stride': 32, 'attention_pooling_operation': 'mean', 'embedding_pooling_operation': 'mean', 'threshold': 0.8855196374673694, 'batch_size': 83, 'attention_heads': 14, 'hidden_dimension': 146, 'number_of_hidden_layers': 0, 'dropout_rate': 0.3457648235015966, 'global_pooling': 'sum', 'learning_rate': 0.0012659877426844633, 'weight_decay': 0.0001452168254736098, 'beta_0': 0.8089271407094889, 'beta_1': 0.9868216834176764, 'epsilon': 2.95063590060809e-05, 'balanced_loss': False, 'epochs': 153, 'early_stopping_patience': 17, 'plateau_patience': 21, 'plateau_divider': 8}. Best is trial 228 with value: 0.940926033029364.
[I 2025-03-01 23:36:13,538] Trial 259 finished with value: 0.9017085245312231 and parameters: {'left_stride': 0, 'right_stride': 32, 'attention_pooling_operation': 'mean', 'embedding_pooling_operation': 'mean', 'threshold': 0.9122019154840582, 'batch_size': 146, 'attention_heads': 8, 'hidden_dimension': 159, 'number_of_hidden_layers': 0, 'dropout_rate': 0.33486863931642424, 'global_pooling': 'max', 'learning_rate': 0.0008621710882676753, 'weight_decay': 0.00016678137193369425, 'beta_0': 0.8041465223329738, 'beta_1': 0.9863685319994204, 'epsilon': 6.568564421872565e-05, 'balanced_loss': True, 'epochs': 148, 'early_stopping_patience': 19, 'plateau_patience': 23, 'plateau_divider': 10}. Best is trial 228 with value: 0.940926033029364.
CUDA out of memory. Tried to allocate 4.09 GiB. GPU 0 has a total capacity of 44.56 GiB of which 2.54 GiB is free. Including non-PyTorch memory, this process has 42.02 GiB memory in use. Of the allocated memory 36.82 GiB is allocated by PyTorch, and 4.04 GiB is reserved by PyTorch but unallocated. If reserved but unallocated memory is large try setting PYTORCH_CUDA_ALLOC_CONF=expandable_segments:True to avoid fragmentation.  See documentation for Memory Management  (https://pytorch.org/docs/stable/notes/cuda.html#environment-variables)
[I 2025-03-01 23:45:17,626] Trial 260 finished with value: -1.0 and parameters: {'left_stride': 64, 'right_stride': 0, 'attention_pooling_operation': 'mean', 'embedding_pooling_operation': 'mean', 'threshold': 0.8928300140100308, 'batch_size': 101, 'attention_heads': 12, 'hidden_dimension': 172, 'number_of_hidden_layers': 0, 'dropout_rate': 0.50832887599105, 'global_pooling': 'max', 'learning_rate': 0.0014944605584959853, 'weight_decay': 0.0003088834080177111, 'beta_0': 0.8079195084540451, 'beta_1': 0.9858273364155409, 'epsilon': 1.6457472449620934e-05, 'balanced_loss': True, 'epochs': 93, 'early_stopping_patience': 19, 'plateau_patience': 21, 'plateau_divider': 3}. Best is trial 228 with value: 0.940926033029364.
[I 2025-03-01 23:55:06,346] Trial 261 finished with value: 0.9168043949650881 and parameters: {'left_stride': 0, 'right_stride': 32, 'attention_pooling_operation': 'mean', 'embedding_pooling_operation': 'mean', 'threshold': 0.9301512954535986, 'batch_size': 88, 'attention_heads': 11, 'hidden_dimension': 151, 'number_of_hidden_layers': 0, 'dropout_rate': 0.3513859076973219, 'global_pooling': 'mean', 'learning_rate': 0.0011115750623175544, 'weight_decay': 4.198067921574523e-05, 'beta_0': 0.802939316813373, 'beta_1': 0.9877473564257363, 'epsilon': 1.3559329883414478e-05, 'balanced_loss': True, 'epochs': 123, 'early_stopping_patience': 18, 'plateau_patience': 22, 'plateau_divider': 8}. Best is trial 228 with value: 0.940926033029364.
[I 2025-03-02 00:05:16,945] Trial 262 finished with value: 0.9216359999649468 and parameters: {'left_stride': 0, 'right_stride': 128, 'attention_pooling_operation': 'mean', 'embedding_pooling_operation': 'mean', 'threshold': 0.9017167640310925, 'batch_size': 105, 'attention_heads': 9, 'hidden_dimension': 164, 'number_of_hidden_layers': 0, 'dropout_rate': 0.36305009944973543, 'global_pooling': 'max', 'learning_rate': 0.0019489494148570996, 'weight_decay': 0.00010550188817216557, 'beta_0': 0.8059405083916777, 'beta_1': 0.9848435558130662, 'epsilon': 4.823139292464214e-05, 'balanced_loss': True, 'epochs': 135, 'early_stopping_patience': 17, 'plateau_patience': 24, 'plateau_divider': 7}. Best is trial 228 with value: 0.940926033029364.
[I 2025-03-02 00:15:32,636] Trial 263 finished with value: 0.9141984957435532 and parameters: {'left_stride': 0, 'right_stride': 32, 'attention_pooling_operation': 'mean', 'embedding_pooling_operation': 'max', 'threshold': 0.9173051766921944, 'batch_size': 97, 'attention_heads': 11, 'hidden_dimension': 137, 'number_of_hidden_layers': 0, 'dropout_rate': 0.3124477418005105, 'global_pooling': 'max', 'learning_rate': 0.0010051006370947833, 'weight_decay': 8.605534063286785e-05, 'beta_0': 0.8014489159418358, 'beta_1': 0.9906300002284472, 'epsilon': 8.73032886246034e-05, 'balanced_loss': True, 'epochs': 115, 'early_stopping_patience': 18, 'plateau_patience': 20, 'plateau_divider': 8}. Best is trial 228 with value: 0.940926033029364.
[I 2025-03-02 00:26:23,488] Trial 264 finished with value: 0.9169044522722399 and parameters: {'left_stride': 0, 'right_stride': 32, 'attention_pooling_operation': 'mean', 'embedding_pooling_operation': 'mean', 'threshold': 0.9064839205879882, 'batch_size': 112, 'attention_heads': 12, 'hidden_dimension': 143, 'number_of_hidden_layers': 0, 'dropout_rate': 0.320226873609912, 'global_pooling': 'max', 'learning_rate': 0.000739528425208494, 'weight_decay': 6.122995430114849e-05, 'beta_0': 0.8049428457564626, 'beta_1': 0.9872593863268383, 'epsilon': 3.8087441076817306e-05, 'balanced_loss': True, 'epochs': 110, 'early_stopping_patience': 16, 'plateau_patience': 23, 'plateau_divider': 10}. Best is trial 228 with value: 0.940926033029364.
CUDA out of memory. Tried to allocate 5.21 GiB. GPU 0 has a total capacity of 44.56 GiB of which 2.81 GiB is free. Including non-PyTorch memory, this process has 41.75 GiB memory in use. Of the allocated memory 39.51 GiB is allocated by PyTorch, and 1.09 GiB is reserved by PyTorch but unallocated. If reserved but unallocated memory is large try setting PYTORCH_CUDA_ALLOC_CONF=expandable_segments:True to avoid fragmentation.  See documentation for Memory Management  (https://pytorch.org/docs/stable/notes/cuda.html#environment-variables)
[I 2025-03-02 00:32:32,663] Trial 265 finished with value: -1.0 and parameters: {'left_stride': 128, 'right_stride': 256, 'attention_pooling_operation': 'max', 'embedding_pooling_operation': 'mean', 'threshold': 0.7979771610074435, 'batch_size': 102, 'attention_heads': 12, 'hidden_dimension': 152, 'number_of_hidden_layers': 0, 'dropout_rate': 0.34072217867993454, 'global_pooling': 'mean', 'learning_rate': 0.0013419901652936444, 'weight_decay': 0.00022998146967028132, 'beta_0': 0.8103187881277224, 'beta_1': 0.9864333329529134, 'epsilon': 1.9400582923134842e-05, 'balanced_loss': True, 'epochs': 102, 'early_stopping_patience': 20, 'plateau_patience': 22, 'plateau_divider': 8}. Best is trial 228 with value: 0.940926033029364.
[I 2025-03-02 00:41:46,451] Trial 266 finished with value: 0.9187134313005533 and parameters: {'left_stride': 64, 'right_stride': 32, 'attention_pooling_operation': 'min', 'embedding_pooling_operation': 'mean', 'threshold': 0.9203215209633118, 'batch_size': 117, 'attention_heads': 12, 'hidden_dimension': 158, 'number_of_hidden_layers': 0, 'dropout_rate': 0.3284797355717741, 'global_pooling': 'max', 'learning_rate': 0.001753418547829703, 'weight_decay': 4.783694432531325e-05, 'beta_0': 0.8068919624481146, 'beta_1': 0.9854755981472982, 'epsilon': 2.3679163118160968e-05, 'balanced_loss': True, 'epochs': 131, 'early_stopping_patience': 19, 'plateau_patience': 24, 'plateau_divider': 7}. Best is trial 228 with value: 0.940926033029364.
[I 2025-03-02 00:52:47,611] Trial 267 finished with value: 0.9217483835264542 and parameters: {'left_stride': 0, 'right_stride': 32, 'attention_pooling_operation': 'mean', 'embedding_pooling_operation': 'mean', 'threshold': 0.8961339944447803, 'batch_size': 107, 'attention_heads': 13, 'hidden_dimension': 148, 'number_of_hidden_layers': 0, 'dropout_rate': 0.33431770998952715, 'global_pooling': 'max', 'learning_rate': 0.0022899204303731286, 'weight_decay': 0.0001257383521276914, 'beta_0': 0.8031642367850583, 'beta_1': 0.9859411832860018, 'epsilon': 6.279641168607148e-05, 'balanced_loss': True, 'epochs': 98, 'early_stopping_patience': 18, 'plateau_patience': 23, 'plateau_divider': 8}. Best is trial 228 with value: 0.940926033029364.
[I 2025-03-02 01:02:28,511] Trial 268 finished with value: 0.9297919392546696 and parameters: {'left_stride': 0, 'right_stride': 0, 'attention_pooling_operation': 'mean', 'embedding_pooling_operation': 'mean', 'threshold': 0.8806922921033086, 'batch_size': 60, 'attention_heads': 13, 'hidden_dimension': 143, 'number_of_hidden_layers': 0, 'dropout_rate': 0.32489043117790306, 'global_pooling': 'max', 'learning_rate': 0.0009128304190000053, 'weight_decay': 7.080077159415704e-05, 'beta_0': 0.8607800724783692, 'beta_1': 0.9844137154458972, 'epsilon': 2.900258780375283e-05, 'balanced_loss': True, 'epochs': 126, 'early_stopping_patience': 10, 'plateau_patience': 25, 'plateau_divider': 10}. Best is trial 228 with value: 0.940926033029364.
[I 2025-03-02 01:12:53,300] Trial 269 finished with value: 0.9057955676498407 and parameters: {'left_stride': 0, 'right_stride': 0, 'attention_pooling_operation': 'mean', 'embedding_pooling_operation': 'mean', 'threshold': 0.8752226892416817, 'batch_size': 59, 'attention_heads': 13, 'hidden_dimension': 135, 'number_of_hidden_layers': 0, 'dropout_rate': 0.5298721420781565, 'global_pooling': 'max', 'learning_rate': 0.0011836368876144319, 'weight_decay': 7.253248570885176e-05, 'beta_0': 0.8711251881143734, 'beta_1': 0.9845855486764491, 'epsilon': 8.658527593053043e-06, 'balanced_loss': True, 'epochs': 126, 'early_stopping_patience': 13, 'plateau_patience': 25, 'plateau_divider': 10}. Best is trial 228 with value: 0.940926033029364.
[I 2025-03-02 01:22:34,683] Trial 270 finished with value: 0.9212920859865471 and parameters: {'left_stride': 0, 'right_stride': 0, 'attention_pooling_operation': 'mean', 'embedding_pooling_operation': 'mean', 'threshold': 0.8851399177736129, 'batch_size': 47, 'attention_heads': 13, 'hidden_dimension': 125, 'number_of_hidden_layers': 0, 'dropout_rate': 0.3139928771325949, 'global_pooling': 'max', 'learning_rate': 0.0015336192090158274, 'weight_decay': 6.502682605522987e-05, 'beta_0': 0.860861454196597, 'beta_1': 0.9842582450418076, 'epsilon': 1.1450968316664674e-05, 'balanced_loss': True, 'epochs': 121, 'early_stopping_patience': 11, 'plateau_patience': 25, 'plateau_divider': 8}. Best is trial 228 with value: 0.940926033029364.
CUDA out of memory. Tried to allocate 4.11 GiB. GPU 0 has a total capacity of 44.56 GiB of which 262.69 MiB is free. Including non-PyTorch memory, this process has 44.30 GiB memory in use. Of the allocated memory 38.98 GiB is allocated by PyTorch, and 4.17 GiB is reserved by PyTorch but unallocated. If reserved but unallocated memory is large try setting PYTORCH_CUDA_ALLOC_CONF=expandable_segments:True to avoid fragmentation.  See documentation for Memory Management  (https://pytorch.org/docs/stable/notes/cuda.html#environment-variables)
[I 2025-03-02 01:32:20,768] Trial 271 finished with value: -1.0 and parameters: {'left_stride': 0, 'right_stride': 0, 'attention_pooling_operation': 'mean', 'embedding_pooling_operation': 'mean', 'threshold': 0.8721567975017009, 'batch_size': 66, 'attention_heads': 13, 'hidden_dimension': 167, 'number_of_hidden_layers': 0, 'dropout_rate': 0.32176427998248397, 'global_pooling': 'max', 'learning_rate': 0.0005762943225436946, 'weight_decay': 8.218437754422738e-05, 'beta_0': 0.8333097119309992, 'beta_1': 0.9852116534554899, 'epsilon': 1.6710415427240985e-05, 'balanced_loss': True, 'epochs': 127, 'early_stopping_patience': 13, 'plateau_patience': 25, 'plateau_divider': 7}. Best is trial 228 with value: 0.940926033029364.
[I 2025-03-02 01:41:51,492] Trial 272 finished with value: 0.9173889483198604 and parameters: {'left_stride': 0, 'right_stride': 0, 'attention_pooling_operation': 'mean', 'embedding_pooling_operation': 'mean', 'threshold': 0.9407870259127232, 'batch_size': 75, 'attention_heads': 13, 'hidden_dimension': 110, 'number_of_hidden_layers': 0, 'dropout_rate': 0.34662899046075535, 'global_pooling': 'max', 'learning_rate': 0.0030040706249315186, 'weight_decay': 9.354477556596838e-05, 'beta_0': 0.8017105527359757, 'beta_1': 0.9945134299262866, 'epsilon': 2.9745368014716636e-05, 'balanced_loss': True, 'epochs': 130, 'early_stopping_patience': 20, 'plateau_patience': 21, 'plateau_divider': 10}. Best is trial 228 with value: 0.940926033029364.
[I 2025-03-02 01:52:34,245] Trial 273 finished with value: 0.9201599101469424 and parameters: {'left_stride': 0, 'right_stride': 0, 'attention_pooling_operation': 'min', 'embedding_pooling_operation': 'mean', 'threshold': 0.8795585370721438, 'batch_size': 55, 'attention_heads': 14, 'hidden_dimension': 141, 'number_of_hidden_layers': 0, 'dropout_rate': 0.3384871801430937, 'global_pooling': 'max', 'learning_rate': 0.0008442408038958429, 'weight_decay': 0.00011112541598245992, 'beta_0': 0.876002826179507, 'beta_1': 0.9843919158588517, 'epsilon': 2.0636325164225637e-05, 'balanced_loss': True, 'epochs': 124, 'early_stopping_patience': 19, 'plateau_patience': 25, 'plateau_divider': 8}. Best is trial 228 with value: 0.940926033029364.
[I 2025-03-02 02:04:18,153] Trial 274 finished with value: 0.9251054182141185 and parameters: {'left_stride': 0, 'right_stride': 128, 'attention_pooling_operation': 'mean', 'embedding_pooling_operation': 'mean', 'threshold': 0.8880097384862757, 'batch_size': 61, 'attention_heads': 11, 'hidden_dimension': 154, 'number_of_hidden_layers': 0, 'dropout_rate': 0.35537541333409545, 'global_pooling': 'max', 'learning_rate': 0.001052993123427486, 'weight_decay': 0.00014429516905729376, 'beta_0': 0.883401908001342, 'beta_1': 0.9861727462522883, 'epsilon': 1.4517341772385861e-05, 'balanced_loss': True, 'epochs': 118, 'early_stopping_patience': 19, 'plateau_patience': 24, 'plateau_divider': 8}. Best is trial 228 with value: 0.940926033029364.
CUDA out of memory. Tried to allocate 4.50 GiB. GPU 0 has a total capacity of 44.56 GiB of which 3.09 GiB is free. Including non-PyTorch memory, this process has 41.46 GiB memory in use. Of the allocated memory 39.30 GiB is allocated by PyTorch, and 1.01 GiB is reserved by PyTorch but unallocated. If reserved but unallocated memory is large try setting PYTORCH_CUDA_ALLOC_CONF=expandable_segments:True to avoid fragmentation.  See documentation for Memory Management  (https://pytorch.org/docs/stable/notes/cuda.html#environment-variables)
[I 2025-03-02 02:11:43,344] Trial 275 finished with value: -1.0 and parameters: {'left_stride': 0, 'right_stride': 256, 'attention_pooling_operation': 'mean', 'embedding_pooling_operation': 'mean', 'threshold': 0.8592668915633824, 'batch_size': 215, 'attention_heads': 8, 'hidden_dimension': 173, 'number_of_hidden_layers': 0, 'dropout_rate': 0.39780078059785823, 'global_pooling': 'max', 'learning_rate': 0.0013008352279866439, 'weight_decay': 7.43049117460941e-05, 'beta_0': 0.8003221446155923, 'beta_1': 0.9856414614577594, 'epsilon': 2.5951322424849775e-05, 'balanced_loss': True, 'epochs': 134, 'early_stopping_patience': 11, 'plateau_patience': 21, 'plateau_divider': 10}. Best is trial 228 with value: 0.940926033029364.
[I 2025-03-02 02:22:28,694] Trial 276 finished with value: 0.9250890220625236 and parameters: {'left_stride': 0, 'right_stride': 0, 'attention_pooling_operation': 'mean', 'embedding_pooling_operation': 'mean', 'threshold': 0.8932516231788571, 'batch_size': 93, 'attention_heads': 14, 'hidden_dimension': 132, 'number_of_hidden_layers': 0, 'dropout_rate': 0.32414647530902246, 'global_pooling': 'max', 'learning_rate': 0.0007560494963003018, 'weight_decay': 0.0002069505191402915, 'beta_0': 0.8524651898578538, 'beta_1': 0.989796026354716, 'epsilon': 1.738520669122339e-05, 'balanced_loss': True, 'epochs': 169, 'early_stopping_patience': 12, 'plateau_patience': 22, 'plateau_divider': 6}. Best is trial 228 with value: 0.940926033029364.
[I 2025-03-02 02:33:26,412] Trial 277 finished with value: 0.9167915740553473 and parameters: {'left_stride': 0, 'right_stride': 256, 'attention_pooling_operation': 'mean', 'embedding_pooling_operation': 'mean', 'threshold': 0.9103794795039392, 'batch_size': 96, 'attention_heads': 11, 'hidden_dimension': 162, 'number_of_hidden_layers': 0, 'dropout_rate': 0.3168803775336579, 'global_pooling': 'max', 'learning_rate': 0.0016170148706985538, 'weight_decay': 0.00016445381876648309, 'beta_0': 0.8975062657209482, 'beta_1': 0.9839952037006248, 'epsilon': 9.765797460238786e-05, 'balanced_loss': False, 'epochs': 114, 'early_stopping_patience': 19, 'plateau_patience': 24, 'plateau_divider': 8}. Best is trial 228 with value: 0.940926033029364.
