[I 2025-02-28 16:41:17,649] Trial 284 finished with value: -1.0 and parameters: {'left_stride': 128, 'right_stride': 128, 'attention_pooling_operation': 'mean', 'embedding_pooling_operation': 'max', 'threshold': 0.8255699327006795, 'batch_size': 124, 'attention_heads': 5, 'hidden_dimension': 40, 'number_of_hidden_layers': 4, 'dropout_rate': 0.5203193255451299, 'global_pooling': 'max', 'learning_rate': 0.00038751221212909745, 'weight_decay': 0.0003731445730413135, 'beta_0': 0.8967962645467898, 'beta_1': 0.9886032951095411, 'epsilon': 6.390052772326608e-08, 'balanced_loss': False, 'epochs': 157, 'early_stopping_patience': 24, 'plateau_patience': 14, 'plateau_divider': 2}. Best is trial 257 with value: 0.9507714196182853.
[I 2025-02-28 16:52:16,037] Trial 285 finished with value: 0.9347869377490621 and parameters: {'left_stride': 0, 'right_stride': 0, 'attention_pooling_operation': 'max', 'embedding_pooling_operation': 'max', 'threshold': 0.8153915309276142, 'batch_size': 57, 'attention_heads': 7, 'hidden_dimension': 54, 'number_of_hidden_layers': 2, 'dropout_rate': 0.5738878696110317, 'global_pooling': 'mean', 'learning_rate': 0.0008170020995571705, 'weight_decay': 0.00011865223708082923, 'beta_0': 0.8706875966707964, 'beta_1': 0.9824499645180104, 'epsilon': 2.361248122621241e-05, 'balanced_loss': False, 'epochs': 129, 'early_stopping_patience': 20, 'plateau_patience': 16, 'plateau_divider': 5}. Best is trial 257 with value: 0.9507714196182853.
[I 2025-02-28 17:08:08,950] Trial 286 finished with value: 0.9313093915758353 and parameters: {'left_stride': 0, 'right_stride': 0, 'attention_pooling_operation': 'mean', 'embedding_pooling_operation': 'max', 'threshold': 0.8322339136028979, 'batch_size': 83, 'attention_heads': 5, 'hidden_dimension': 44, 'number_of_hidden_layers': 4, 'dropout_rate': 0.5140476088995409, 'global_pooling': 'max', 'learning_rate': 0.0013250175820152127, 'weight_decay': 0.0005685547427995355, 'beta_0': 0.8609015544190883, 'beta_1': 0.9819068125624666, 'epsilon': 1.7092467500706487e-05, 'balanced_loss': False, 'epochs': 57, 'early_stopping_patience': 23, 'plateau_patience': 13, 'plateau_divider': 4}. Best is trial 257 with value: 0.9507714196182853.
[I 2025-02-28 17:19:35,469] Trial 287 finished with value: 0.8888141550168924 and parameters: {'left_stride': 0, 'right_stride': 0, 'attention_pooling_operation': 'mean', 'embedding_pooling_operation': 'min', 'threshold': 0.9868710557517423, 'batch_size': 74, 'attention_heads': 4, 'hidden_dimension': 157, 'number_of_hidden_layers': 2, 'dropout_rate': 0.5669610484686114, 'global_pooling': 'max', 'learning_rate': 0.00029419074137780913, 'weight_decay': 0.000801629139839682, 'beta_0': 0.8741178906676887, 'beta_1': 0.9877047131746874, 'epsilon': 2.881523235952737e-07, 'balanced_loss': False, 'epochs': 113, 'early_stopping_patience': 21, 'plateau_patience': 12, 'plateau_divider': 2}. Best is trial 257 with value: 0.9507714196182853.
[I 2025-02-28 17:33:30,680] Trial 288 finished with value: 0.9376424235627786 and parameters: {'left_stride': 64, 'right_stride': 0, 'attention_pooling_operation': 'max', 'embedding_pooling_operation': 'max', 'threshold': 0.8393997754541478, 'batch_size': 68, 'attention_heads': 9, 'hidden_dimension': 50, 'number_of_hidden_layers': 4, 'dropout_rate': 0.37416621524880617, 'global_pooling': 'sum', 'learning_rate': 0.0007540993725889779, 'weight_decay': 0.0004474937394144454, 'beta_0': 0.8677339814188119, 'beta_1': 0.9855030291491476, 'epsilon': 1.0416306121565994e-07, 'balanced_loss': False, 'epochs': 96, 'early_stopping_patience': 21, 'plateau_patience': 14, 'plateau_divider': 5}. Best is trial 257 with value: 0.9507714196182853.
CUDA out of memory. Tried to allocate 1.19 GiB. GPU 0 has a total capacity of 44.56 GiB of which 234.69 MiB is free. Including non-PyTorch memory, this process has 44.32 GiB memory in use. Of the allocated memory 42.83 GiB is allocated by PyTorch, and 348.75 MiB is reserved by PyTorch but unallocated. If reserved but unallocated memory is large try setting PYTORCH_CUDA_ALLOC_CONF=expandable_segments:True to avoid fragmentation.  See documentation for Memory Management  (https://pytorch.org/docs/stable/notes/cuda.html#environment-variables)
[I 2025-02-28 17:43:01,062] Trial 289 finished with value: -1.0 and parameters: {'left_stride': 0, 'right_stride': 0, 'attention_pooling_operation': 'max', 'embedding_pooling_operation': 'max', 'threshold': 0.8394839495640315, 'batch_size': 78, 'attention_heads': 9, 'hidden_dimension': 52, 'number_of_hidden_layers': 4, 'dropout_rate': 0.3784021013703584, 'global_pooling': 'sum', 'learning_rate': 0.0009394149671370462, 'weight_decay': 4.899133531859542e-05, 'beta_0': 0.8678355575386916, 'beta_1': 0.9858714740809313, 'epsilon': 1.0527554375648557e-07, 'balanced_loss': False, 'epochs': 97, 'early_stopping_patience': 21, 'plateau_patience': 15, 'plateau_divider': 5}. Best is trial 257 with value: 0.9507714196182853.
[I 2025-02-28 17:55:10,116] Trial 290 finished with value: 0.9286072227405948 and parameters: {'left_stride': 0, 'right_stride': 0, 'attention_pooling_operation': 'max', 'embedding_pooling_operation': 'max', 'threshold': 0.8229323671285315, 'batch_size': 67, 'attention_heads': 9, 'hidden_dimension': 58, 'number_of_hidden_layers': 2, 'dropout_rate': 0.3284736590584836, 'global_pooling': 'sum', 'learning_rate': 0.0011830052284770467, 'weight_decay': 0.00046433906985553767, 'beta_0': 0.869868735207745, 'beta_1': 0.9854448385792717, 'epsilon': 6.230629376495638e-05, 'balanced_loss': False, 'epochs': 100, 'early_stopping_patience': 21, 'plateau_patience': 17, 'plateau_divider': 7}. Best is trial 257 with value: 0.9507714196182853.
CUDA out of memory. Tried to allocate 1.49 GiB. GPU 0 has a total capacity of 44.56 GiB of which 750.69 MiB is free. Including non-PyTorch memory, this process has 43.82 GiB memory in use. Of the allocated memory 41.82 GiB is allocated by PyTorch, and 868.54 MiB is reserved by PyTorch but unallocated. If reserved but unallocated memory is large try setting PYTORCH_CUDA_ALLOC_CONF=expandable_segments:True to avoid fragmentation.  See documentation for Memory Management  (https://pytorch.org/docs/stable/notes/cuda.html#environment-variables)
[I 2025-02-28 18:01:34,143] Trial 291 finished with value: -1.0 and parameters: {'left_stride': 64, 'right_stride': 0, 'attention_pooling_operation': 'max', 'embedding_pooling_operation': 'max', 'threshold': 0.8043218571532661, 'batch_size': 73, 'attention_heads': 10, 'hidden_dimension': 49, 'number_of_hidden_layers': 2, 'dropout_rate': 0.37092229600606524, 'global_pooling': 'max', 'learning_rate': 0.00046061561962581305, 'weight_decay': 0.0006526948185157194, 'beta_0': 0.8658012872342751, 'beta_1': 0.9869716733057233, 'epsilon': 1.1177920078761922e-07, 'balanced_loss': False, 'epochs': 94, 'early_stopping_patience': 21, 'plateau_patience': 14, 'plateau_divider': 5}. Best is trial 257 with value: 0.9507714196182853.
CUDA out of memory. Tried to allocate 1.26 GiB. GPU 0 has a total capacity of 44.56 GiB of which 420.69 MiB is free. Including non-PyTorch memory, this process has 44.14 GiB memory in use. Of the allocated memory 42.67 GiB is allocated by PyTorch, and 334.63 MiB is reserved by PyTorch but unallocated. If reserved but unallocated memory is large try setting PYTORCH_CUDA_ALLOC_CONF=expandable_segments:True to avoid fragmentation.  See documentation for Memory Management  (https://pytorch.org/docs/stable/notes/cuda.html#environment-variables)
[I 2025-02-28 18:07:33,528] Trial 292 finished with value: -1.0 and parameters: {'left_stride': 64, 'right_stride': 0, 'attention_pooling_operation': 'max', 'embedding_pooling_operation': 'max', 'threshold': 0.8314555065499294, 'batch_size': 97, 'attention_heads': 9, 'hidden_dimension': 66, 'number_of_hidden_layers': 4, 'dropout_rate': 0.5409865516462686, 'global_pooling': 'sum', 'learning_rate': 0.0007515888397205729, 'weight_decay': 0.0005505920883313677, 'beta_0': 0.86831194022198, 'beta_1': 0.9898050595355931, 'epsilon': 1.4422569813883256e-07, 'balanced_loss': False, 'epochs': 104, 'early_stopping_patience': 21, 'plateau_patience': 19, 'plateau_divider': 5}. Best is trial 257 with value: 0.9507714196182853.
CUDA out of memory. Tried to allocate 1.65 GiB. GPU 0 has a total capacity of 44.56 GiB of which 1.38 GiB is free. Including non-PyTorch memory, this process has 43.18 GiB memory in use. Of the allocated memory 41.06 GiB is allocated by PyTorch, and 986.11 MiB is reserved by PyTorch but unallocated. If reserved but unallocated memory is large try setting PYTORCH_CUDA_ALLOC_CONF=expandable_segments:True to avoid fragmentation.  See documentation for Memory Management  (https://pytorch.org/docs/stable/notes/cuda.html#environment-variables)
[I 2025-02-28 18:16:42,122] Trial 293 finished with value: -1.0 and parameters: {'left_stride': 64, 'right_stride': 0, 'attention_pooling_operation': 'max', 'embedding_pooling_operation': 'max', 'threshold': 0.8378803841529483, 'batch_size': 61, 'attention_heads': 8, 'hidden_dimension': 87, 'number_of_hidden_layers': 2, 'dropout_rate': 0.358851307223353, 'global_pooling': 'sum', 'learning_rate': 0.0006093070903990967, 'weight_decay': 0.00046661111046608633, 'beta_0': 0.8769038498317168, 'beta_1': 0.9861455145750841, 'epsilon': 8.126576408251265e-08, 'balanced_loss': False, 'epochs': 89, 'early_stopping_patience': 20, 'plateau_patience': 15, 'plateau_divider': 5}. Best is trial 257 with value: 0.9507714196182853.
CUDA out of memory. Tried to allocate 1.14 GiB. GPU 0 has a total capacity of 44.56 GiB of which 836.69 MiB is free. Including non-PyTorch memory, this process has 43.74 GiB memory in use. Of the allocated memory 42.37 GiB is allocated by PyTorch, and 222.41 MiB is reserved by PyTorch but unallocated. If reserved but unallocated memory is large try setting PYTORCH_CUDA_ALLOC_CONF=expandable_segments:True to avoid fragmentation.  See documentation for Memory Management  (https://pytorch.org/docs/stable/notes/cuda.html#environment-variables)
[I 2025-02-28 18:22:41,146] Trial 294 finished with value: -1.0 and parameters: {'left_stride': 64, 'right_stride': 0, 'attention_pooling_operation': 'max', 'embedding_pooling_operation': 'max', 'threshold': 0.8191422896676479, 'batch_size': 106, 'attention_heads': 9, 'hidden_dimension': 55, 'number_of_hidden_layers': 4, 'dropout_rate': 0.3865689695126068, 'global_pooling': 'sum', 'learning_rate': 0.0009848479481546957, 'weight_decay': 0.0008473555770234806, 'beta_0': 0.8816068912878254, 'beta_1': 0.9943151794671321, 'epsilon': 1.53042004974464e-06, 'balanced_loss': False, 'epochs': 64, 'early_stopping_patience': 20, 'plateau_patience': 14, 'plateau_divider': 5}. Best is trial 257 with value: 0.9507714196182853.
CUDA out of memory. Tried to allocate 1.54 GiB. GPU 0 has a total capacity of 44.56 GiB of which 1.32 GiB is free. Including non-PyTorch memory, this process has 43.24 GiB memory in use. Of the allocated memory 41.23 GiB is allocated by PyTorch, and 876.33 MiB is reserved by PyTorch but unallocated. If reserved but unallocated memory is large try setting PYTORCH_CUDA_ALLOC_CONF=expandable_segments:True to avoid fragmentation.  See documentation for Memory Management  (https://pytorch.org/docs/stable/notes/cuda.html#environment-variables)
[I 2025-02-28 18:29:06,816] Trial 295 finished with value: -1.0 and parameters: {'left_stride': 64, 'right_stride': 0, 'attention_pooling_operation': 'max', 'embedding_pooling_operation': 'max', 'threshold': 0.8126200400598528, 'batch_size': 68, 'attention_heads': 9, 'hidden_dimension': 62, 'number_of_hidden_layers': 2, 'dropout_rate': 0.4132141171939776, 'global_pooling': 'sum', 'learning_rate': 0.0014196971537304669, 'weight_decay': 0.0006407412616565198, 'beta_0': 0.8406116365349737, 'beta_1': 0.9856603689299457, 'epsilon': 1.2530697415298954e-07, 'balanced_loss': False, 'epochs': 95, 'early_stopping_patience': 19, 'plateau_patience': 12, 'plateau_divider': 2}. Best is trial 257 with value: 0.9507714196182853.
CUDA out of memory. Tried to allocate 958.00 MiB. GPU 0 has a total capacity of 44.56 GiB of which 918.69 MiB is free. Including non-PyTorch memory, this process has 43.66 GiB memory in use. Of the allocated memory 37.55 GiB is allocated by PyTorch, and 4.96 GiB is reserved by PyTorch but unallocated. If reserved but unallocated memory is large try setting PYTORCH_CUDA_ALLOC_CONF=expandable_segments:True to avoid fragmentation.  See documentation for Memory Management  (https://pytorch.org/docs/stable/notes/cuda.html#environment-variables)
[I 2025-02-28 18:36:48,914] Trial 296 finished with value: -1.0 and parameters: {'left_stride': 0, 'right_stride': 0, 'attention_pooling_operation': 'max', 'embedding_pooling_operation': 'max', 'threshold': 0.8461095468634128, 'batch_size': 81, 'attention_heads': 10, 'hidden_dimension': 49, 'number_of_hidden_layers': 4, 'dropout_rate': 0.5029504172317144, 'global_pooling': 'sum', 'learning_rate': 0.00021522167444354065, 'weight_decay': 0.0003956151894607002, 'beta_0': 0.8632432738454456, 'beta_1': 0.9916086463909429, 'epsilon': 9.78954928261094e-08, 'balanced_loss': False, 'epochs': 83, 'early_stopping_patience': 22, 'plateau_patience': 15, 'plateau_divider': 5}. Best is trial 257 with value: 0.9507714196182853.
[I 2025-02-28 18:50:00,032] Trial 297 finished with value: 0.9409967063353902 and parameters: {'left_stride': 64, 'right_stride': 0, 'attention_pooling_operation': 'max', 'embedding_pooling_operation': 'max', 'threshold': 0.828856621365309, 'batch_size': 87, 'attention_heads': 8, 'hidden_dimension': 45, 'number_of_hidden_layers': 2, 'dropout_rate': 0.5477909594713164, 'global_pooling': 'max', 'learning_rate': 0.0007925164073459625, 'weight_decay': 0.0007280510193104273, 'beta_0': 0.8750048195870336, 'beta_1': 0.9932152077535996, 'epsilon': 7.713570502154055e-08, 'balanced_loss': False, 'epochs': 97, 'early_stopping_patience': 21, 'plateau_patience': 16, 'plateau_divider': 5}. Best is trial 257 with value: 0.9507714196182853.
[I 2025-02-28 19:02:35,272] Trial 298 finished with value: 0.9410800147910803 and parameters: {'left_stride': 0, 'right_stride': 64, 'attention_pooling_operation': 'min', 'embedding_pooling_operation': 'max', 'threshold': 0.82701630990511, 'batch_size': 90, 'attention_heads': 8, 'hidden_dimension': 40, 'number_of_hidden_layers': 2, 'dropout_rate': 0.5542427257946979, 'global_pooling': 'max', 'learning_rate': 0.0011426773828885684, 'weight_decay': 0.0007600263333896023, 'beta_0': 0.8753738264626116, 'beta_1': 0.9950447683961532, 'epsilon': 6.808134239394546e-08, 'balanced_loss': False, 'epochs': 196, 'early_stopping_patience': 22, 'plateau_patience': 15, 'plateau_divider': 2}. Best is trial 257 with value: 0.9507714196182853.
CUDA out of memory. Tried to allocate 2.82 GiB. GPU 0 has a total capacity of 44.56 GiB of which 1.69 GiB is free. Including non-PyTorch memory, this process has 42.86 GiB memory in use. Of the allocated memory 41.04 GiB is allocated by PyTorch, and 685.83 MiB is reserved by PyTorch but unallocated. If reserved but unallocated memory is large try setting PYTORCH_CUDA_ALLOC_CONF=expandable_segments:True to avoid fragmentation.  See documentation for Memory Management  (https://pytorch.org/docs/stable/notes/cuda.html#environment-variables)
[I 2025-02-28 19:08:39,703] Trial 299 finished with value: -1.0 and parameters: {'left_stride': 0, 'right_stride': 64, 'attention_pooling_operation': 'min', 'embedding_pooling_operation': 'max', 'threshold': 0.8266275518721203, 'batch_size': 88, 'attention_heads': 8, 'hidden_dimension': 168, 'number_of_hidden_layers': 2, 'dropout_rate': 0.5526027201480527, 'global_pooling': 'max', 'learning_rate': 0.0012047574574599559, 'weight_decay': 0.000725482739266833, 'beta_0': 0.8759704282861597, 'beta_1': 0.995172445067949, 'epsilon': 6.192086788233664e-08, 'balanced_loss': False, 'epochs': 196, 'early_stopping_patience': 22, 'plateau_patience': 16, 'plateau_divider': 2}. Best is trial 257 with value: 0.9507714196182853.
CUDA out of memory. Tried to allocate 3.72 GiB. GPU 0 has a total capacity of 44.56 GiB of which 1.14 GiB is free. Including non-PyTorch memory, this process has 43.41 GiB memory in use. Of the allocated memory 41.82 GiB is allocated by PyTorch, and 452.09 MiB is reserved by PyTorch but unallocated. If reserved but unallocated memory is large try setting PYTORCH_CUDA_ALLOC_CONF=expandable_segments:True to avoid fragmentation.  See documentation for Memory Management  (https://pytorch.org/docs/stable/notes/cuda.html#environment-variables)
[I 2025-02-28 19:14:36,285] Trial 300 finished with value: -1.0 and parameters: {'left_stride': 0, 'right_stride': 0, 'attention_pooling_operation': 'min', 'embedding_pooling_operation': 'min', 'threshold': 0.8302094029522363, 'batch_size': 93, 'attention_heads': 8, 'hidden_dimension': 226, 'number_of_hidden_layers': 1, 'dropout_rate': 0.5466339936263827, 'global_pooling': 'max', 'learning_rate': 0.0009202192889687582, 'weight_decay': 0.0009055882305312122, 'beta_0': 0.874304685106756, 'beta_1': 0.99365391657879, 'epsilon': 7.814828930613214e-08, 'balanced_loss': False, 'epochs': 102, 'early_stopping_patience': 22, 'plateau_patience': 16, 'plateau_divider': 2}. Best is trial 257 with value: 0.9507714196182853.
[I 2025-02-28 19:28:26,751] Trial 301 finished with value: 0.9293358594154513 and parameters: {'left_stride': 0, 'right_stride': 64, 'attention_pooling_operation': 'min', 'embedding_pooling_operation': 'max', 'threshold': 0.8201881591756063, 'batch_size': 87, 'attention_heads': 8, 'hidden_dimension': 41, 'number_of_hidden_layers': 2, 'dropout_rate': 0.5614787690215342, 'global_pooling': 'max', 'learning_rate': 0.0013384349370665473, 'weight_decay': 0.0007777167818632199, 'beta_0': 0.8787933832675654, 'beta_1': 0.9945632743192031, 'epsilon': 6.639081585169759e-08, 'balanced_loss': False, 'epochs': 53, 'early_stopping_patience': 22, 'plateau_patience': 15, 'plateau_divider': 2}. Best is trial 257 with value: 0.9507714196182853.
[I 2025-02-28 19:45:10,166] Trial 302 finished with value: 0.93862422733142 and parameters: {'left_stride': 0, 'right_stride': 0, 'attention_pooling_operation': 'min', 'embedding_pooling_operation': 'max', 'threshold': 0.8116812918902245, 'batch_size': 95, 'attention_heads': 8, 'hidden_dimension': 45, 'number_of_hidden_layers': 2, 'dropout_rate': 0.5502634885070302, 'global_pooling': 'max', 'learning_rate': 0.001504773870919937, 'weight_decay': 0.0007082355923650793, 'beta_0': 0.8718329359833211, 'beta_1': 0.99511430241778, 'epsilon': 6.395053051803874e-06, 'balanced_loss': False, 'epochs': 107, 'early_stopping_patience': 21, 'plateau_patience': 15, 'plateau_divider': 2}. Best is trial 257 with value: 0.9507714196182853.
[I 2025-02-28 19:56:57,680] Trial 303 finished with value: 0.9187917284758895 and parameters: {'left_stride': 0, 'right_stride': 64, 'attention_pooling_operation': 'min', 'embedding_pooling_operation': 'max', 'threshold': 0.8093607120272699, 'batch_size': 97, 'attention_heads': 8, 'hidden_dimension': 44, 'number_of_hidden_layers': 2, 'dropout_rate': 0.5551018664448473, 'global_pooling': 'max', 'learning_rate': 0.0010858206323335732, 'weight_decay': 0.0007161965161036406, 'beta_0': 0.8718336699259267, 'beta_1': 0.9956176616182522, 'epsilon': 2.8691910793660242e-05, 'balanced_loss': False, 'epochs': 108, 'early_stopping_patience': 22, 'plateau_patience': 15, 'plateau_divider': 2}. Best is trial 257 with value: 0.9507714196182853.
[I 2025-02-28 20:09:07,343] Trial 304 finished with value: 0.9193948828335932 and parameters: {'left_stride': 0, 'right_stride': 64, 'attention_pooling_operation': 'min', 'embedding_pooling_operation': 'max', 'threshold': 0.8017322416626464, 'batch_size': 90, 'attention_heads': 8, 'hidden_dimension': 37, 'number_of_hidden_layers': 2, 'dropout_rate': 0.5501086332481508, 'global_pooling': 'max', 'learning_rate': 0.00108479087108742, 'weight_decay': 0.0008627322025866784, 'beta_0': 0.87324721197797, 'beta_1': 0.9949899275085375, 'epsilon': 4.851541677308772e-06, 'balanced_loss': False, 'epochs': 198, 'early_stopping_patience': 21, 'plateau_patience': 16, 'plateau_divider': 2}. Best is trial 257 with value: 0.9507714196182853.
[I 2025-02-28 20:21:25,232] Trial 305 finished with value: 0.9306596735795419 and parameters: {'left_stride': 0, 'right_stride': 64, 'attention_pooling_operation': 'min', 'embedding_pooling_operation': 'max', 'threshold': 0.8145662422733875, 'batch_size': 96, 'attention_heads': 8, 'hidden_dimension': 44, 'number_of_hidden_layers': 2, 'dropout_rate': 0.5372783966617808, 'global_pooling': 'max', 'learning_rate': 0.0008450452821995857, 'weight_decay': 0.000646265029926632, 'beta_0': 0.8710627626415726, 'beta_1': 0.9958428275942687, 'epsilon': 7.795619951739934e-08, 'balanced_loss': False, 'epochs': 111, 'early_stopping_patience': 20, 'plateau_patience': 15, 'plateau_divider': 2}. Best is trial 257 with value: 0.9507714196182853.
[I 2025-02-28 20:34:40,425] Trial 306 finished with value: 0.9305351791682599 and parameters: {'left_stride': 0, 'right_stride': 0, 'attention_pooling_operation': 'min', 'embedding_pooling_operation': 'min', 'threshold': 0.8252131770833548, 'batch_size': 85, 'attention_heads': 12, 'hidden_dimension': 40, 'number_of_hidden_layers': 2, 'dropout_rate': 0.5562637321232522, 'global_pooling': 'max', 'learning_rate': 0.0015331559763777766, 'weight_decay': 0.0007722592493801067, 'beta_0': 0.8753978939169842, 'beta_1': 0.995099845808774, 'epsilon': 5.602256082784683e-08, 'balanced_loss': False, 'epochs': 103, 'early_stopping_patience': 21, 'plateau_patience': 15, 'plateau_divider': 2}. Best is trial 257 with value: 0.9507714196182853.
