[I 2025-03-02 07:13:35,143] Trial 305 finished with value: 0.9290845602711255 and parameters: {'left_stride': 0, 'right_stride': 0, 'attention_pooling_operation': 'mean', 'embedding_pooling_operation': 'mean', 'threshold': 0.9311174342642743, 'batch_size': 59, 'attention_heads': 11, 'hidden_dimension': 185, 'number_of_hidden_layers': 0, 'dropout_rate': 0.47108061720590466, 'global_pooling': 'max', 'learning_rate': 0.002123956647570029, 'weight_decay': 8.812163460561166e-05, 'beta_0': 0.8036903003651067, 'beta_1': 0.9972917969866146, 'epsilon': 2.2435300856053708e-05, 'balanced_loss': True, 'epochs': 124, 'early_stopping_patience': 19, 'plateau_patience': 21, 'plateau_divider': 6}. Best is trial 228 with value: 0.940926033029364.
[I 2025-03-02 07:23:27,123] Trial 306 finished with value: 0.8867552492272393 and parameters: {'left_stride': 0, 'right_stride': 0, 'attention_pooling_operation': 'mean', 'embedding_pooling_operation': 'mean', 'threshold': 0.9377342677356919, 'batch_size': 57, 'attention_heads': 11, 'hidden_dimension': 186, 'number_of_hidden_layers': 0, 'dropout_rate': 0.46112608643805547, 'global_pooling': 'max', 'learning_rate': 0.0036767284900237943, 'weight_decay': 8.339685986275657e-05, 'beta_0': 0.8035436321253987, 'beta_1': 0.9975516539034017, 'epsilon': 5.740609029024587e-06, 'balanced_loss': True, 'epochs': 121, 'early_stopping_patience': 19, 'plateau_patience': 21, 'plateau_divider': 7}. Best is trial 228 with value: 0.940926033029364.
[I 2025-03-02 07:33:13,104] Trial 307 finished with value: 0.8738785271056065 and parameters: {'left_stride': 0, 'right_stride': 0, 'attention_pooling_operation': 'mean', 'embedding_pooling_operation': 'max', 'threshold': 0.9324131993215242, 'batch_size': 63, 'attention_heads': 11, 'hidden_dimension': 196, 'number_of_hidden_layers': 0, 'dropout_rate': 0.46982202730929656, 'global_pooling': 'max', 'learning_rate': 0.0154033431805622, 'weight_decay': 8.275757391975636e-05, 'beta_0': 0.8000814303905037, 'beta_1': 0.9933004990856124, 'epsilon': 2.2295432410126256e-05, 'balanced_loss': True, 'epochs': 118, 'early_stopping_patience': 19, 'plateau_patience': 22, 'plateau_divider': 6}. Best is trial 228 with value: 0.940926033029364.
[I 2025-03-02 07:41:56,906] Trial 308 finished with value: 0.8905228977980013 and parameters: {'left_stride': 0, 'right_stride': 0, 'attention_pooling_operation': 'min', 'embedding_pooling_operation': 'mean', 'threshold': 0.9414974499330792, 'batch_size': 57, 'attention_heads': 11, 'hidden_dimension': 185, 'number_of_hidden_layers': 0, 'dropout_rate': 0.4996742675692636, 'global_pooling': 'max', 'learning_rate': 0.0021582595859818365, 'weight_decay': 9.166898318053326e-05, 'beta_0': 0.8430714485754283, 'beta_1': 0.9970667626323196, 'epsilon': 1.7623001611902462e-05, 'balanced_loss': True, 'epochs': 124, 'early_stopping_patience': 20, 'plateau_patience': 21, 'plateau_divider': 6}. Best is trial 228 with value: 0.940926033029364.
CUDA out of memory. Tried to allocate 2.78 GiB. GPU 0 has a total capacity of 44.56 GiB of which 1.58 GiB is free. Including non-PyTorch memory, this process has 42.97 GiB memory in use. Of the allocated memory 41.50 GiB is allocated by PyTorch, and 329.52 MiB is reserved by PyTorch but unallocated. If reserved but unallocated memory is large try setting PYTORCH_CUDA_ALLOC_CONF=expandable_segments:True to avoid fragmentation.  See documentation for Memory Management  (https://pytorch.org/docs/stable/notes/cuda.html#environment-variables)
[I 2025-03-02 07:49:13,182] Trial 309 finished with value: -1.0 and parameters: {'left_stride': 32, 'right_stride': 0, 'attention_pooling_operation': 'mean', 'embedding_pooling_operation': 'mean', 'threshold': 0.8428970176148111, 'batch_size': 69, 'attention_heads': 10, 'hidden_dimension': 180, 'number_of_hidden_layers': 3, 'dropout_rate': 0.48958318922975314, 'global_pooling': 'max', 'learning_rate': 0.0012596789273733229, 'weight_decay': 6.910538575867898e-05, 'beta_0': 0.8034866671881075, 'beta_1': 0.9982949895974796, 'epsilon': 1.3282097168003e-05, 'balanced_loss': True, 'epochs': 115, 'early_stopping_patience': 19, 'plateau_patience': 23, 'plateau_divider': 7}. Best is trial 228 with value: 0.940926033029364.
[I 2025-03-02 07:59:32,507] Trial 310 finished with value: 0.915125200563758 and parameters: {'left_stride': 0, 'right_stride': 0, 'attention_pooling_operation': 'mean', 'embedding_pooling_operation': 'mean', 'threshold': 0.9302440355297569, 'batch_size': 64, 'attention_heads': 11, 'hidden_dimension': 204, 'number_of_hidden_layers': 0, 'dropout_rate': 0.4767066687284416, 'global_pooling': 'max', 'learning_rate': 0.0014492026048641513, 'weight_decay': 0.00010425234228853346, 'beta_0': 0.8018039797306534, 'beta_1': 0.9970753539874456, 'epsilon': 2.220713670909783e-05, 'balanced_loss': True, 'epochs': 125, 'early_stopping_patience': 18, 'plateau_patience': 22, 'plateau_divider': 6}. Best is trial 228 with value: 0.940926033029364.
CUDA out of memory. Tried to allocate 4.73 GiB. GPU 0 has a total capacity of 44.56 GiB of which 2.53 GiB is free. Including non-PyTorch memory, this process has 42.02 GiB memory in use. Of the allocated memory 37.16 GiB is allocated by PyTorch, and 3.71 GiB is reserved by PyTorch but unallocated. If reserved but unallocated memory is large try setting PYTORCH_CUDA_ALLOC_CONF=expandable_segments:True to avoid fragmentation.  See documentation for Memory Management  (https://pytorch.org/docs/stable/notes/cuda.html#environment-variables)
[I 2025-03-02 08:05:49,571] Trial 311 finished with value: -1.0 and parameters: {'left_stride': 0, 'right_stride': 0, 'attention_pooling_operation': 'max', 'embedding_pooling_operation': 'mean', 'threshold': 0.9186427771226607, 'batch_size': 192, 'attention_heads': 11, 'hidden_dimension': 191, 'number_of_hidden_layers': 0, 'dropout_rate': 0.3481390154618831, 'global_pooling': 'max', 'learning_rate': 0.0011573803279655453, 'weight_decay': 7.922095736336295e-05, 'beta_0': 0.8058038412969638, 'beta_1': 0.997764773197108, 'epsilon': 1.4842199428710502e-05, 'balanced_loss': True, 'epochs': 121, 'early_stopping_patience': 19, 'plateau_patience': 22, 'plateau_divider': 6}. Best is trial 228 with value: 0.940926033029364.
[I 2025-03-02 08:15:32,076] Trial 312 finished with value: 0.9169321560710602 and parameters: {'left_stride': 0, 'right_stride': 0, 'attention_pooling_operation': 'mean', 'embedding_pooling_operation': 'mean', 'threshold': 0.9232364334925376, 'batch_size': 59, 'attention_heads': 11, 'hidden_dimension': 116, 'number_of_hidden_layers': 0, 'dropout_rate': 0.44552232163808214, 'global_pooling': 'max', 'learning_rate': 0.0020585135444897346, 'weight_decay': 6.155984686072906e-06, 'beta_0': 0.8233913039734972, 'beta_1': 0.9977932688946518, 'epsilon': 1.067661080108291e-05, 'balanced_loss': True, 'epochs': 130, 'early_stopping_patience': 19, 'plateau_patience': 23, 'plateau_divider': 7}. Best is trial 228 with value: 0.940926033029364.
[I 2025-03-02 08:29:22,299] Trial 313 finished with value: 0.8991075488323572 and parameters: {'left_stride': 0, 'right_stride': 0, 'attention_pooling_operation': 'mean', 'embedding_pooling_operation': 'mean', 'threshold': 0.9167110226227534, 'batch_size': 53, 'attention_heads': 10, 'hidden_dimension': 184, 'number_of_hidden_layers': 1, 'dropout_rate': 0.40427030489517424, 'global_pooling': 'sum', 'learning_rate': 0.0015260439113808002, 'weight_decay': 9.60254374764392e-05, 'beta_0': 0.8042193734781619, 'beta_1': 0.9938958427678959, 'epsilon': 4.514856014078276e-05, 'balanced_loss': True, 'epochs': 140, 'early_stopping_patience': 18, 'plateau_patience': 21, 'plateau_divider': 7}. Best is trial 228 with value: 0.940926033029364.
CUDA out of memory. Tried to allocate 240.00 MiB. GPU 0 has a total capacity of 44.56 GiB of which 146.69 MiB is free. Including non-PyTorch memory, this process has 44.41 GiB memory in use. Of the allocated memory 42.64 GiB is allocated by PyTorch, and 631.92 MiB is reserved by PyTorch but unallocated. If reserved but unallocated memory is large try setting PYTORCH_CUDA_ALLOC_CONF=expandable_segments:True to avoid fragmentation.  See documentation for Memory Management  (https://pytorch.org/docs/stable/notes/cuda.html#environment-variables)
[I 2025-03-02 08:36:26,626] Trial 314 finished with value: -1.0 and parameters: {'left_stride': 0, 'right_stride': 128, 'attention_pooling_operation': 'mean', 'embedding_pooling_operation': 'mean', 'threshold': 0.6536941901394503, 'batch_size': 107, 'attention_heads': 9, 'hidden_dimension': 176, 'number_of_hidden_layers': 0, 'dropout_rate': 0.3612218944784784, 'global_pooling': 'max', 'learning_rate': 0.0029836125464569505, 'weight_decay': 0.00020787747200461346, 'beta_0': 0.8018815931467947, 'beta_1': 0.9963531138721343, 'epsilon': 1.7888069174510526e-05, 'balanced_loss': True, 'epochs': 117, 'early_stopping_patience': 18, 'plateau_patience': 22, 'plateau_divider': 6}. Best is trial 228 with value: 0.940926033029364.
[I 2025-03-02 08:46:40,178] Trial 315 finished with value: 0.9275698990623192 and parameters: {'left_stride': 0, 'right_stride': 0, 'attention_pooling_operation': 'mean', 'embedding_pooling_operation': 'mean', 'threshold': 0.9424095182835021, 'batch_size': 47, 'attention_heads': 11, 'hidden_dimension': 154, 'number_of_hidden_layers': 0, 'dropout_rate': 0.4722453002933209, 'global_pooling': 'max', 'learning_rate': 0.001152491764271183, 'weight_decay': 0.00015659716555727036, 'beta_0': 0.8855490599887967, 'beta_1': 0.996753986865398, 'epsilon': 4.7425955848857464e-07, 'balanced_loss': True, 'epochs': 103, 'early_stopping_patience': 20, 'plateau_patience': 20, 'plateau_divider': 7}. Best is trial 228 with value: 0.940926033029364.
[I 2025-03-02 08:56:30,983] Trial 316 finished with value: 0.9182646180142449 and parameters: {'left_stride': 0, 'right_stride': 0, 'attention_pooling_operation': 'mean', 'embedding_pooling_operation': 'mean', 'threshold': 0.942716817501287, 'batch_size': 45, 'attention_heads': 11, 'hidden_dimension': 148, 'number_of_hidden_layers': 0, 'dropout_rate': 0.4704809835302574, 'global_pooling': 'max', 'learning_rate': 0.0012194475984049229, 'weight_decay': 0.00015546097075488848, 'beta_0': 0.8076324418370293, 'beta_1': 0.9967915671628028, 'epsilon': 9.984573857741273e-05, 'balanced_loss': True, 'epochs': 103, 'early_stopping_patience': 20, 'plateau_patience': 20, 'plateau_divider': 7}. Best is trial 228 with value: 0.940926033029364.
[I 2025-03-02 09:04:58,159] Trial 317 finished with value: 0.9199355167175536 and parameters: {'left_stride': 0, 'right_stride': 0, 'attention_pooling_operation': 'min', 'embedding_pooling_operation': 'mean', 'threshold': 0.9404019929383224, 'batch_size': 49, 'attention_heads': 11, 'hidden_dimension': 153, 'number_of_hidden_layers': 0, 'dropout_rate': 0.46409006860952273, 'global_pooling': 'max', 'learning_rate': 0.0023344388409278073, 'weight_decay': 0.00011640562907336138, 'beta_0': 0.8060369608839175, 'beta_1': 0.9967373675483817, 'epsilon': 2.592191703477973e-07, 'balanced_loss': False, 'epochs': 104, 'early_stopping_patience': 20, 'plateau_patience': 19, 'plateau_divider': 7}. Best is trial 228 with value: 0.940926033029364.
[I 2025-03-02 09:15:02,635] Trial 318 finished with value: 0.923251525731053 and parameters: {'left_stride': 0, 'right_stride': 0, 'attention_pooling_operation': 'mean', 'embedding_pooling_operation': 'mean', 'threshold': 0.9339097705972886, 'batch_size': 69, 'attention_heads': 11, 'hidden_dimension': 151, 'number_of_hidden_layers': 0, 'dropout_rate': 0.48476255494177367, 'global_pooling': 'max', 'learning_rate': 0.00179120552609937, 'weight_decay': 0.00016454323645779403, 'beta_0': 0.8865313818273418, 'beta_1': 0.9954109637916428, 'epsilon': 1.665782005911741e-07, 'balanced_loss': True, 'epochs': 99, 'early_stopping_patience': 20, 'plateau_patience': 20, 'plateau_divider': 7}. Best is trial 228 with value: 0.940926033029364.
[I 2025-03-02 09:24:37,188] Trial 319 finished with value: 0.9117370629011536 and parameters: {'left_stride': 0, 'right_stride': 0, 'attention_pooling_operation': 'mean', 'embedding_pooling_operation': 'mean', 'threshold': 0.944293887274837, 'batch_size': 44, 'attention_heads': 10, 'hidden_dimension': 141, 'number_of_hidden_layers': 0, 'dropout_rate': 0.4749155696494275, 'global_pooling': 'max', 'learning_rate': 0.0013942131309455203, 'weight_decay': 0.00014234187499310833, 'beta_0': 0.874980214607308, 'beta_1': 0.9962582363031682, 'epsilon': 8.424549232859537e-07, 'balanced_loss': True, 'epochs': 113, 'early_stopping_patience': 20, 'plateau_patience': 23, 'plateau_divider': 7}. Best is trial 228 with value: 0.940926033029364.
[I 2025-03-02 09:54:47,827] Trial 320 finished with value: 0.7575341564108604 and parameters: {'left_stride': 0, 'right_stride': 0, 'attention_pooling_operation': 'mean', 'embedding_pooling_operation': 'mean', 'threshold': 0.9574044441176253, 'batch_size': 61, 'attention_heads': 14, 'hidden_dimension': 190, 'number_of_hidden_layers': 4, 'dropout_rate': 0.47917007709066106, 'global_pooling': 'max', 'learning_rate': 0.0010109713192774973, 'weight_decay': 0.00022999826397343697, 'beta_0': 0.804836266545464, 'beta_1': 0.9971477250510374, 'epsilon': 4.0488278359779275e-07, 'balanced_loss': True, 'epochs': 106, 'early_stopping_patience': 20, 'plateau_patience': 22, 'plateau_divider': 7}. Best is trial 228 with value: 0.940926033029364.
[I 2025-03-02 10:04:36,496] Trial 321 finished with value: 0.9253093077648178 and parameters: {'left_stride': 128, 'right_stride': 0, 'attention_pooling_operation': 'mean', 'embedding_pooling_operation': 'mean', 'threshold': 0.9467015470728014, 'batch_size': 73, 'attention_heads': 11, 'hidden_dimension': 147, 'number_of_hidden_layers': 0, 'dropout_rate': 0.4195724441475809, 'global_pooling': 'max', 'learning_rate': 0.0013588577711277563, 'weight_decay': 0.0001927792748591035, 'beta_0': 0.8079914222926023, 'beta_1': 0.9973988969419106, 'epsilon': 6.754784228946469e-05, 'balanced_loss': True, 'epochs': 124, 'early_stopping_patience': 19, 'plateau_patience': 19, 'plateau_divider': 6}. Best is trial 228 with value: 0.940926033029364.
[I 2025-03-02 10:13:26,725] Trial 322 finished with value: 0.9093971534188916 and parameters: {'left_stride': 32, 'right_stride': 128, 'attention_pooling_operation': 'mean', 'embedding_pooling_operation': 'mean', 'threshold': 0.9527375940358976, 'batch_size': 50, 'attention_heads': 10, 'hidden_dimension': 95, 'number_of_hidden_layers': 0, 'dropout_rate': 0.45925591136813726, 'global_pooling': 'max', 'learning_rate': 0.0016657394258300408, 'weight_decay': 0.0003490619648645305, 'beta_0': 0.8000266985482923, 'beta_1': 0.9974125137561409, 'epsilon': 5.635154272115806e-05, 'balanced_loss': True, 'epochs': 101, 'early_stopping_patience': 19, 'plateau_patience': 22, 'plateau_divider': 7}. Best is trial 228 with value: 0.940926033029364.
[I 2025-03-02 10:23:10,103] Trial 323 finished with value: 0.9273466043154028 and parameters: {'left_stride': 0, 'right_stride': 0, 'attention_pooling_operation': 'mean', 'embedding_pooling_operation': 'mean', 'threshold': 0.9304809245398473, 'batch_size': 36, 'attention_heads': 10, 'hidden_dimension': 155, 'number_of_hidden_layers': 0, 'dropout_rate': 0.35546253051464805, 'global_pooling': 'max', 'learning_rate': 0.0011241003931714312, 'weight_decay': 0.0002772878251177619, 'beta_0': 0.803419861071794, 'beta_1': 0.9976027981033722, 'epsilon': 8.050782793963609e-05, 'balanced_loss': True, 'epochs': 115, 'early_stopping_patience': 19, 'plateau_patience': 23, 'plateau_divider': 7}. Best is trial 228 with value: 0.940926033029364.
slurmstepd: error: *** JOB 15068786 ON gpu049 CANCELLED AT 2025-03-02T10:24:12 DUE TO TIME LIMIT ***
