[I 2025-02-28 20:45:23,958] Trial 307 finished with value: 0.9295555252736196 and parameters: {'left_stride': 0, 'right_stride': 0, 'attention_pooling_operation': 'min', 'embedding_pooling_operation': 'max', 'threshold': 0.8222876006526042, 'batch_size': 91, 'attention_heads': 8, 'hidden_dimension': 32, 'number_of_hidden_layers': 2, 'dropout_rate': 0.5441777007885145, 'global_pooling': 'max', 'learning_rate': 0.0005636989768283932, 'weight_decay': 0.0006458585090359773, 'beta_0': 0.8729225015661447, 'beta_1': 0.9953262468125088, 'epsilon': 5.948886943125914e-06, 'balanced_loss': False, 'epochs': 106, 'early_stopping_patience': 20, 'plateau_patience': 15, 'plateau_divider': 2}. Best is trial 257 with value: 0.9507714196182853.
CUDA out of memory. Tried to allocate 1.44 GiB. GPU 0 has a total capacity of 44.56 GiB of which 82.69 MiB is free. Including non-PyTorch memory, this process has 44.47 GiB memory in use. Of the allocated memory 42.33 GiB is allocated by PyTorch, and 1011.40 MiB is reserved by PyTorch but unallocated. If reserved but unallocated memory is large try setting PYTORCH_CUDA_ALLOC_CONF=expandable_segments:True to avoid fragmentation.  See documentation for Memory Management  (https://pytorch.org/docs/stable/notes/cuda.html#environment-variables)
[I 2025-02-28 20:51:29,987] Trial 308 finished with value: -1.0 and parameters: {'left_stride': 32, 'right_stride': 32, 'attention_pooling_operation': 'min', 'embedding_pooling_operation': 'max', 'threshold': 0.7946311728502103, 'batch_size': 82, 'attention_heads': 11, 'hidden_dimension': 47, 'number_of_hidden_layers': 2, 'dropout_rate': 0.5286598029614138, 'global_pooling': 'max', 'learning_rate': 0.0007493656221818698, 'weight_decay': 0.0009867385799736702, 'beta_0': 0.8751437018340141, 'beta_1': 0.9968791482603412, 'epsilon': 1.5037845724188553e-05, 'balanced_loss': False, 'epochs': 98, 'early_stopping_patience': 19, 'plateau_patience': 16, 'plateau_divider': 6}. Best is trial 257 with value: 0.9507714196182853.
slurmstepd: error: *** JOB 15063695 ON gpu054 CANCELLED AT 2025-02-28T21:03:02 DUE TO TIME LIMIT ***
