[I 2025-03-02 02:43:36,651] Trial 278 finished with value: 0.9207709512589416 and parameters: {'left_stride': 0, 'right_stride': 128, 'attention_pooling_operation': 'mean', 'embedding_pooling_operation': 'mean', 'threshold': 0.9032352204016482, 'batch_size': 89, 'attention_heads': 12, 'hidden_dimension': 144, 'number_of_hidden_layers': 0, 'dropout_rate': 0.3289183050563676, 'global_pooling': 'max', 'learning_rate': 0.0009504987774132778, 'weight_decay': 9.590730476518263e-05, 'beta_0': 0.8037569751228527, 'beta_1': 0.9849905970103712, 'epsilon': 3.3314101922875074e-05, 'balanced_loss': True, 'epochs': 138, 'early_stopping_patience': 10, 'plateau_patience': 21, 'plateau_divider': 8}. Best is trial 228 with value: 0.940926033029364.
[I 2025-03-02 02:53:48,080] Trial 279 finished with value: 0.9315673046182901 and parameters: {'left_stride': 32, 'right_stride': 32, 'attention_pooling_operation': 'mean', 'embedding_pooling_operation': 'mean', 'threshold': 0.9249290232049638, 'batch_size': 71, 'attention_heads': 10, 'hidden_dimension': 180, 'number_of_hidden_layers': 0, 'dropout_rate': 0.42683331644206013, 'global_pooling': 'max', 'learning_rate': 0.0012060668265688017, 'weight_decay': 6.715100242835032e-05, 'beta_0': 0.8000522773213219, 'beta_1': 0.9868323351149834, 'epsilon': 2.2656363743660732e-05, 'balanced_loss': True, 'epochs': 108, 'early_stopping_patience': 20, 'plateau_patience': 22, 'plateau_divider': 6}. Best is trial 228 with value: 0.940926033029364.
[I 2025-03-02 03:04:05,087] Trial 280 finished with value: 0.9164769456311496 and parameters: {'left_stride': 32, 'right_stride': 256, 'attention_pooling_operation': 'mean', 'embedding_pooling_operation': 'mean', 'threshold': 0.9252766382312125, 'batch_size': 82, 'attention_heads': 10, 'hidden_dimension': 178, 'number_of_hidden_layers': 0, 'dropout_rate': 0.4292067054999889, 'global_pooling': 'max', 'learning_rate': 0.001162007329184364, 'weight_decay': 5.183520797314693e-05, 'beta_0': 0.8015484153719329, 'beta_1': 0.9867202679248684, 'epsilon': 2.6602909395973182e-05, 'balanced_loss': True, 'epochs': 109, 'early_stopping_patience': 20, 'plateau_patience': 20, 'plateau_divider': 6}. Best is trial 228 with value: 0.940926033029364.
[I 2025-03-02 03:14:35,535] Trial 281 finished with value: 0.9162387656610101 and parameters: {'left_stride': 32, 'right_stride': 32, 'attention_pooling_operation': 'min', 'embedding_pooling_operation': 'mean', 'threshold': 0.93244484272263, 'batch_size': 72, 'attention_heads': 10, 'hidden_dimension': 182, 'number_of_hidden_layers': 0, 'dropout_rate': 0.48419638730090403, 'global_pooling': 'max', 'learning_rate': 0.0006426308119709554, 'weight_decay': 6.498426279457869e-05, 'beta_0': 0.800105422539977, 'beta_1': 0.9869798078182856, 'epsilon': 7.309441248245203e-05, 'balanced_loss': True, 'epochs': 105, 'early_stopping_patience': 20, 'plateau_patience': 24, 'plateau_divider': 7}. Best is trial 228 with value: 0.940926033029364.
CUDA out of memory. Tried to allocate 3.60 GiB. GPU 0 has a total capacity of 44.56 GiB of which 1.33 GiB is free. Including non-PyTorch memory, this process has 43.22 GiB memory in use. Of the allocated memory 41.65 GiB is allocated by PyTorch, and 429.15 MiB is reserved by PyTorch but unallocated. If reserved but unallocated memory is large try setting PYTORCH_CUDA_ALLOC_CONF=expandable_segments:True to avoid fragmentation.  See documentation for Memory Management  (https://pytorch.org/docs/stable/notes/cuda.html#environment-variables)
[I 2025-03-02 03:21:52,113] Trial 282 finished with value: -1.0 and parameters: {'left_stride': 32, 'right_stride': 0, 'attention_pooling_operation': 'mean', 'embedding_pooling_operation': 'mean', 'threshold': 0.8266741238491848, 'batch_size': 62, 'attention_heads': 13, 'hidden_dimension': 188, 'number_of_hidden_layers': 0, 'dropout_rate': 0.37482954617688125, 'global_pooling': 'max', 'learning_rate': 0.0009769596775295731, 'weight_decay': 5.767304397710395e-05, 'beta_0': 0.8026781910742509, 'beta_1': 0.9832987635328736, 'epsilon': 2.1967197467071677e-05, 'balanced_loss': True, 'epochs': 113, 'early_stopping_patience': 20, 'plateau_patience': 21, 'plateau_divider': 5}. Best is trial 228 with value: 0.940926033029364.
[I 2025-03-02 03:31:21,480] Trial 283 finished with value: 0.8705261208363387 and parameters: {'left_stride': 32, 'right_stride': 32, 'attention_pooling_operation': 'mean', 'embedding_pooling_operation': 'mean', 'threshold': 0.9221304586109903, 'batch_size': 70, 'attention_heads': 8, 'hidden_dimension': 178, 'number_of_hidden_layers': 0, 'dropout_rate': 0.3441337889352091, 'global_pooling': 'sum', 'learning_rate': 0.039348461092948, 'weight_decay': 7.698794525649397e-05, 'beta_0': 0.8484352146215216, 'beta_1': 0.9865231218521645, 'epsilon': 8.224885818414417e-05, 'balanced_loss': True, 'epochs': 107, 'early_stopping_patience': 20, 'plateau_patience': 25, 'plateau_divider': 6}. Best is trial 228 with value: 0.940926033029364.
[I 2025-03-02 03:42:03,495] Trial 284 finished with value: 0.9213114375478968 and parameters: {'left_stride': 32, 'right_stride': 128, 'attention_pooling_operation': 'mean', 'embedding_pooling_operation': 'max', 'threshold': 0.881773843409383, 'batch_size': 79, 'attention_heads': 9, 'hidden_dimension': 175, 'number_of_hidden_layers': 0, 'dropout_rate': 0.3364301724351765, 'global_pooling': 'max', 'learning_rate': 0.0021388068537596524, 'weight_decay': 6.62377373910097e-05, 'beta_0': 0.8673994337011018, 'beta_1': 0.9862343002492687, 'epsilon': 1.2906212322795553e-05, 'balanced_loss': True, 'epochs': 128, 'early_stopping_patience': 18, 'plateau_patience': 22, 'plateau_divider': 6}. Best is trial 228 with value: 0.940926033029364.
[I 2025-03-02 03:58:47,707] Trial 285 finished with value: 0.9256936116873481 and parameters: {'left_stride': 0, 'right_stride': 32, 'attention_pooling_operation': 'mean', 'embedding_pooling_operation': 'mean', 'threshold': 0.9382844516188898, 'batch_size': 68, 'attention_heads': 12, 'hidden_dimension': 172, 'number_of_hidden_layers': 2, 'dropout_rate': 0.465383472464152, 'global_pooling': 'max', 'learning_rate': 0.0008149866161228261, 'weight_decay': 8.65911001535532e-05, 'beta_0': 0.892739122232157, 'beta_1': 0.9867447435287088, 'epsilon': 3.419022127068659e-05, 'balanced_loss': True, 'epochs': 121, 'early_stopping_patience': 21, 'plateau_patience': 22, 'plateau_divider': 7}. Best is trial 228 with value: 0.940926033029364.
[I 2025-03-02 04:07:54,097] Trial 286 finished with value: 0.9260075136216868 and parameters: {'left_stride': 0, 'right_stride': 256, 'attention_pooling_operation': 'max', 'embedding_pooling_operation': 'mean', 'threshold': 0.8900487903451947, 'batch_size': 73, 'attention_heads': 12, 'hidden_dimension': 166, 'number_of_hidden_layers': 0, 'dropout_rate': 0.3315227879797534, 'global_pooling': 'max', 'learning_rate': 0.0012104569338874996, 'weight_decay': 0.00018722622302885282, 'beta_0': 0.8129504060952712, 'beta_1': 0.9858841569931877, 'epsilon': 2.375450217477622e-05, 'balanced_loss': True, 'epochs': 111, 'early_stopping_patience': 12, 'plateau_patience': 24, 'plateau_divider': 10}. Best is trial 228 with value: 0.940926033029364.
[I 2025-03-02 04:18:13,804] Trial 287 finished with value: 0.9234879676813649 and parameters: {'left_stride': 0, 'right_stride': 64, 'attention_pooling_operation': 'mean', 'embedding_pooling_operation': 'mean', 'threshold': 0.9156977002223674, 'batch_size': 54, 'attention_heads': 13, 'hidden_dimension': 138, 'number_of_hidden_layers': 0, 'dropout_rate': 0.34149060540046894, 'global_pooling': 'max', 'learning_rate': 0.0014113945875743024, 'weight_decay': 0.0002502410006480892, 'beta_0': 0.8562884279792924, 'beta_1': 0.9909104976699193, 'epsilon': 3.080620561763718e-08, 'balanced_loss': True, 'epochs': 132, 'early_stopping_patience': 18, 'plateau_patience': 21, 'plateau_divider': 10}. Best is trial 228 with value: 0.940926033029364.
[I 2025-03-02 04:27:10,027] Trial 288 finished with value: 0.9245919424625091 and parameters: {'left_stride': 32, 'right_stride': 32, 'attention_pooling_operation': 'mean', 'embedding_pooling_operation': 'mean', 'threshold': 0.9479688983346306, 'batch_size': 99, 'attention_heads': 10, 'hidden_dimension': 158, 'number_of_hidden_layers': 0, 'dropout_rate': 0.35198719818356644, 'global_pooling': 'max', 'learning_rate': 0.0019025451192631543, 'weight_decay': 5.424992630709786e-05, 'beta_0': 0.8165899730704458, 'beta_1': 0.9903007137480148, 'epsilon': 1.5882096513046637e-05, 'balanced_loss': True, 'epochs': 117, 'early_stopping_patience': 18, 'plateau_patience': 22, 'plateau_divider': 10}. Best is trial 228 with value: 0.940926033029364.
[I 2025-03-02 04:36:46,408] Trial 289 finished with value: 0.920685622509441 and parameters: {'left_stride': 0, 'right_stride': 32, 'attention_pooling_operation': 'mean', 'embedding_pooling_operation': 'mean', 'threshold': 0.9300503078711425, 'batch_size': 85, 'attention_heads': 12, 'hidden_dimension': 129, 'number_of_hidden_layers': 0, 'dropout_rate': 0.3251649984635405, 'global_pooling': 'max', 'learning_rate': 0.0009917392067690454, 'weight_decay': 7.367348501484586e-05, 'beta_0': 0.8378856460655116, 'beta_1': 0.9870837523244879, 'epsilon': 5.719211456427298e-05, 'balanced_loss': True, 'epochs': 124, 'early_stopping_patience': 14, 'plateau_patience': 24, 'plateau_divider': 7}. Best is trial 228 with value: 0.940926033029364.
CUDA out of memory. Tried to allocate 4.60 GiB. GPU 0 has a total capacity of 44.56 GiB of which 3.24 GiB is free. Including non-PyTorch memory, this process has 41.31 GiB memory in use. Of the allocated memory 39.27 GiB is allocated by PyTorch, and 908.94 MiB is reserved by PyTorch but unallocated. If reserved but unallocated memory is large try setting PYTORCH_CUDA_ALLOC_CONF=expandable_segments:True to avoid fragmentation.  See documentation for Memory Management  (https://pytorch.org/docs/stable/notes/cuda.html#environment-variables)
[I 2025-03-02 04:44:41,201] Trial 290 finished with value: -1.0 and parameters: {'left_stride': 0, 'right_stride': 256, 'attention_pooling_operation': 'mean', 'embedding_pooling_operation': 'mean', 'threshold': 0.8990460961623116, 'batch_size': 103, 'attention_heads': 12, 'hidden_dimension': 170, 'number_of_hidden_layers': 0, 'dropout_rate': 0.3345746611464374, 'global_pooling': 'max', 'learning_rate': 0.0007510993958496776, 'weight_decay': 4.81535994299996e-05, 'beta_0': 0.8307104291776675, 'beta_1': 0.9862882714296797, 'epsilon': 9.785738779910386e-06, 'balanced_loss': True, 'epochs': 108, 'early_stopping_patience': 18, 'plateau_patience': 23, 'plateau_divider': 5}. Best is trial 228 with value: 0.940926033029364.
[I 2025-03-02 04:55:11,296] Trial 291 finished with value: 0.9105189031122043 and parameters: {'left_stride': 0, 'right_stride': 32, 'attention_pooling_operation': 'min', 'embedding_pooling_operation': 'mean', 'threshold': 0.9070923163719217, 'batch_size': 76, 'attention_heads': 13, 'hidden_dimension': 192, 'number_of_hidden_layers': 0, 'dropout_rate': 0.3201084241884389, 'global_pooling': 'max', 'learning_rate': 0.0026182753083264527, 'weight_decay': 0.00010263540282399247, 'beta_0': 0.8000682077387881, 'beta_1': 0.9856015498860133, 'epsilon': 1.9071809843540096e-05, 'balanced_loss': True, 'epochs': 129, 'early_stopping_patience': 19, 'plateau_patience': 21, 'plateau_divider': 10}. Best is trial 228 with value: 0.940926033029364.
[I 2025-03-02 05:06:55,762] Trial 292 finished with value: 0.9342030260239873 and parameters: {'left_stride': 0, 'right_stride': 0, 'attention_pooling_operation': 'mean', 'embedding_pooling_operation': 'mean', 'threshold': 0.8964583169410468, 'batch_size': 91, 'attention_heads': 10, 'hidden_dimension': 183, 'number_of_hidden_layers': 0, 'dropout_rate': 0.32800959646617983, 'global_pooling': 'max', 'learning_rate': 0.0016739205590408587, 'weight_decay': 0.0001296412092077529, 'beta_0': 0.8046724520595107, 'beta_1': 0.9974504929626943, 'epsilon': 2.9442934090546713e-05, 'balanced_loss': True, 'epochs': 125, 'early_stopping_patience': 18, 'plateau_patience': 22, 'plateau_divider': 7}. Best is trial 228 with value: 0.940926033029364.
CUDA out of memory. Tried to allocate 3.62 GiB. GPU 0 has a total capacity of 44.56 GiB of which 2.45 GiB is free. Including non-PyTorch memory, this process has 42.10 GiB memory in use. Of the allocated memory 37.28 GiB is allocated by PyTorch, and 3.67 GiB is reserved by PyTorch but unallocated. If reserved but unallocated memory is large try setting PYTORCH_CUDA_ALLOC_CONF=expandable_segments:True to avoid fragmentation.  See documentation for Memory Management  (https://pytorch.org/docs/stable/notes/cuda.html#environment-variables)
[I 2025-03-02 05:14:17,837] Trial 293 finished with value: -1.0 and parameters: {'left_stride': 0, 'right_stride': 0, 'attention_pooling_operation': 'mean', 'embedding_pooling_operation': 'mean', 'threshold': 0.8659156802860463, 'batch_size': 91, 'attention_heads': 10, 'hidden_dimension': 186, 'number_of_hidden_layers': 0, 'dropout_rate': 0.41654671593414705, 'global_pooling': 'max', 'learning_rate': 0.0016405836784496133, 'weight_decay': 0.0001419019282128171, 'beta_0': 0.8091918330904168, 'beta_1': 0.9987185466546301, 'epsilon': 3.093500605948067e-05, 'balanced_loss': True, 'epochs': 125, 'early_stopping_patience': 18, 'plateau_patience': 22, 'plateau_divider': 7}. Best is trial 228 with value: 0.940926033029364.
[I 2025-03-02 05:24:50,698] Trial 294 finished with value: 0.9341850465593842 and parameters: {'left_stride': 0, 'right_stride': 0, 'attention_pooling_operation': 'mean', 'embedding_pooling_operation': 'mean', 'threshold': 0.9248474908920914, 'batch_size': 64, 'attention_heads': 10, 'hidden_dimension': 182, 'number_of_hidden_layers': 0, 'dropout_rate': 0.3613697767265685, 'global_pooling': 'max', 'learning_rate': 0.0017553507940094553, 'weight_decay': 0.0001255164047677881, 'beta_0': 0.8051558578370408, 'beta_1': 0.9960403931325764, 'epsilon': 4.137082205600356e-05, 'balanced_loss': True, 'epochs': 121, 'early_stopping_patience': 19, 'plateau_patience': 22, 'plateau_divider': 7}. Best is trial 228 with value: 0.940926033029364.
[I 2025-03-02 05:34:46,025] Trial 295 finished with value: 0.9289532999978265 and parameters: {'left_stride': 0, 'right_stride': 0, 'attention_pooling_operation': 'mean', 'embedding_pooling_operation': 'mean', 'threshold': 0.9346057377217036, 'batch_size': 63, 'attention_heads': 10, 'hidden_dimension': 177, 'number_of_hidden_layers': 0, 'dropout_rate': 0.4454467581539779, 'global_pooling': 'max', 'learning_rate': 0.0021066123314083638, 'weight_decay': 0.0001254268586284939, 'beta_0': 0.8053204833383325, 'beta_1': 0.9981141760779337, 'epsilon': 4.2297337014947415e-05, 'balanced_loss': True, 'epochs': 121, 'early_stopping_patience': 18, 'plateau_patience': 22, 'plateau_divider': 7}. Best is trial 228 with value: 0.940926033029364.
[I 2025-03-02 05:45:02,659] Trial 296 finished with value: 0.9195280891299942 and parameters: {'left_stride': 0, 'right_stride': 0, 'attention_pooling_operation': 'mean', 'embedding_pooling_operation': 'mean', 'threshold': 0.9352386311249673, 'batch_size': 66, 'attention_heads': 10, 'hidden_dimension': 182, 'number_of_hidden_layers': 0, 'dropout_rate': 0.38451859220950907, 'global_pooling': 'max', 'learning_rate': 0.0025516352735470674, 'weight_decay': 0.00012406315863089094, 'beta_0': 0.8053089421923291, 'beta_1': 0.9984007480937047, 'epsilon': 4.1196503380184226e-05, 'balanced_loss': True, 'epochs': 121, 'early_stopping_patience': 19, 'plateau_patience': 22, 'plateau_divider': 7}. Best is trial 228 with value: 0.940926033029364.
[I 2025-03-02 05:54:38,598] Trial 297 finished with value: 0.905110766946172 and parameters: {'left_stride': 0, 'right_stride': 0, 'attention_pooling_operation': 'mean', 'embedding_pooling_operation': 'mean', 'threshold': 0.9394292946516203, 'batch_size': 66, 'attention_heads': 10, 'hidden_dimension': 190, 'number_of_hidden_layers': 0, 'dropout_rate': 0.4338067325639927, 'global_pooling': 'max', 'learning_rate': 0.0031989773328268546, 'weight_decay': 0.00016487492968649808, 'beta_0': 0.8030966921063583, 'beta_1': 0.99730311148735, 'epsilon': 5.0201080829818346e-05, 'balanced_loss': False, 'epochs': 127, 'early_stopping_patience': 20, 'plateau_patience': 22, 'plateau_divider': 7}. Best is trial 228 with value: 0.940926033029364.
[I 2025-03-02 06:04:59,463] Trial 298 finished with value: 0.9252969699642722 and parameters: {'left_stride': 0, 'right_stride': 0, 'attention_pooling_operation': 'mean', 'embedding_pooling_operation': 'mean', 'threshold': 0.9272424193305914, 'batch_size': 60, 'attention_heads': 10, 'hidden_dimension': 182, 'number_of_hidden_layers': 0, 'dropout_rate': 0.361829574731196, 'global_pooling': 'max', 'learning_rate': 0.0020904913775469033, 'weight_decay': 0.0001359014280147725, 'beta_0': 0.8071340811422545, 'beta_1': 0.9982010911064749, 'epsilon': 4.038157714523684e-05, 'balanced_loss': True, 'epochs': 118, 'early_stopping_patience': 18, 'plateau_patience': 22, 'plateau_divider': 7}. Best is trial 228 with value: 0.940926033029364.
[I 2025-03-02 06:13:06,342] Trial 299 finished with value: 0.9109867348736195 and parameters: {'left_stride': 128, 'right_stride': 0, 'attention_pooling_operation': 'min', 'embedding_pooling_operation': 'mean', 'threshold': 0.9493901319503516, 'batch_size': 63, 'attention_heads': 10, 'hidden_dimension': 186, 'number_of_hidden_layers': 0, 'dropout_rate': 0.4521038758563753, 'global_pooling': 'max', 'learning_rate': 0.0018203085085794586, 'weight_decay': 0.0001129087983292285, 'beta_0': 0.8814065493410206, 'beta_1': 0.9943625005494655, 'epsilon': 3.7480973437340196e-05, 'balanced_loss': True, 'epochs': 123, 'early_stopping_patience': 19, 'plateau_patience': 22, 'plateau_divider': 7}. Best is trial 228 with value: 0.940926033029364.
[I 2025-03-02 06:23:16,428] Trial 300 finished with value: 0.9170760073175704 and parameters: {'left_stride': 0, 'right_stride': 0, 'attention_pooling_operation': 'mean', 'embedding_pooling_operation': 'mean', 'threshold': 0.925060677587113, 'batch_size': 51, 'attention_heads': 10, 'hidden_dimension': 178, 'number_of_hidden_layers': 0, 'dropout_rate': 0.4367255712816919, 'global_pooling': 'max', 'learning_rate': 0.0022785200817726477, 'weight_decay': 0.00015239616142831127, 'beta_0': 0.8025179062625538, 'beta_1': 0.9925295831171533, 'epsilon': 2.7190533814539188e-05, 'balanced_loss': True, 'epochs': 130, 'early_stopping_patience': 18, 'plateau_patience': 22, 'plateau_divider': 7}. Best is trial 228 with value: 0.940926033029364.
[I 2025-03-02 06:33:30,742] Trial 301 finished with value: 0.9188225074409172 and parameters: {'left_stride': 0, 'right_stride': 0, 'attention_pooling_operation': 'mean', 'embedding_pooling_operation': 'mean', 'threshold': 0.9353089444620009, 'batch_size': 57, 'attention_heads': 10, 'hidden_dimension': 179, 'number_of_hidden_layers': 0, 'dropout_rate': 0.44600256367077934, 'global_pooling': 'max', 'learning_rate': 0.0018574868274010355, 'weight_decay': 9.15392881432161e-05, 'beta_0': 0.805445035831805, 'beta_1': 0.9982722608990725, 'epsilon': 5.0622551271027095e-05, 'balanced_loss': True, 'epochs': 135, 'early_stopping_patience': 18, 'plateau_patience': 22, 'plateau_divider': 7}. Best is trial 228 with value: 0.940926033029364.
[I 2025-03-02 06:43:40,673] Trial 302 finished with value: 0.9059002833598939 and parameters: {'left_stride': 0, 'right_stride': 0, 'attention_pooling_operation': 'mean', 'embedding_pooling_operation': 'mean', 'threshold': 0.9194641996872672, 'batch_size': 71, 'attention_heads': 9, 'hidden_dimension': 181, 'number_of_hidden_layers': 0, 'dropout_rate': 0.44567327166271725, 'global_pooling': 'max', 'learning_rate': 0.0015557984161329622, 'weight_decay': 0.00012852379803226903, 'beta_0': 0.8045064498606704, 'beta_1': 0.9959246794482661, 'epsilon': 3.389134676953608e-05, 'balanced_loss': True, 'epochs': 120, 'early_stopping_patience': 21, 'plateau_patience': 21, 'plateau_divider': 6}. Best is trial 228 with value: 0.940926033029364.
[I 2025-03-02 06:53:02,415] Trial 303 finished with value: 0.9194592201830425 and parameters: {'left_stride': 0, 'right_stride': 0, 'attention_pooling_operation': 'mean', 'embedding_pooling_operation': 'mean', 'threshold': 0.9582978709573571, 'batch_size': 64, 'attention_heads': 10, 'hidden_dimension': 193, 'number_of_hidden_layers': 0, 'dropout_rate': 0.36866813437313667, 'global_pooling': 'max', 'learning_rate': 0.0026520709346670155, 'weight_decay': 0.00010325411988764838, 'beta_0': 0.8017580620686056, 'beta_1': 0.9977532280480795, 'epsilon': 2.6550059943140066e-05, 'balanced_loss': True, 'epochs': 127, 'early_stopping_patience': 22, 'plateau_patience': 22, 'plateau_divider': 7}. Best is trial 228 with value: 0.940926033029364.
[I 2025-03-02 07:02:50,197] Trial 304 finished with value: 0.9207420441153329 and parameters: {'left_stride': 0, 'right_stride': 0, 'attention_pooling_operation': 'mean', 'embedding_pooling_operation': 'mean', 'threshold': 0.925798960528286, 'batch_size': 78, 'attention_heads': 12, 'hidden_dimension': 175, 'number_of_hidden_layers': 0, 'dropout_rate': 0.35774859198354, 'global_pooling': 'max', 'learning_rate': 0.0016768434635951598, 'weight_decay': 0.00018520192317904028, 'beta_0': 0.8072386645952135, 'beta_1': 0.9963230388031128, 'epsilon': 6.472133359035703e-05, 'balanced_loss': True, 'epochs': 132, 'early_stopping_patience': 10, 'plateau_patience': 22, 'plateau_divider': 7}. Best is trial 228 with value: 0.940926033029364.
