[I 2025-02-28 09:03:14,651] Using an existing study with name 'R8-GATv2-google-bert-bert-base-uncased-Surrogate-No_Aggregation-No_Ablation-1.0-0.25' instead of creating a new one.
Token indices sequence length is longer than the specified maximum sequence length for this model (639 > 512). Running this sequence through the model will result in indexing errors
[I 2025-02-28 09:17:14,656] Trial 240 finished with value: 0.9303637670423663 and parameters: {'left_stride': 0, 'right_stride': 0, 'attention_pooling_operation': 'mean', 'embedding_pooling_operation': 'max', 'threshold': 0.8163913613978244, 'batch_size': 75, 'attention_heads': 9, 'hidden_dimension': 44, 'number_of_hidden_layers': 2, 'dropout_rate': 0.5543556754118554, 'global_pooling': 'max', 'learning_rate': 0.0006575449219527969, 'weight_decay': 0.0004940931977178178, 'beta_0': 0.865067975287972, 'beta_1': 0.9850432862936814, 'epsilon': 1.0856468303532115e-07, 'balanced_loss': False, 'epochs': 89, 'early_stopping_patience': 21, 'plateau_patience': 15, 'plateau_divider': 2}. Best is trial 225 with value: 0.9507461710473065.
[I 2025-02-28 09:32:28,887] Trial 241 finished with value: 0.9356494913234268 and parameters: {'left_stride': 0, 'right_stride': 0, 'attention_pooling_operation': 'mean', 'embedding_pooling_operation': 'max', 'threshold': 0.83450951498039, 'batch_size': 57, 'attention_heads': 9, 'hidden_dimension': 63, 'number_of_hidden_layers': 2, 'dropout_rate': 0.5473797336254252, 'global_pooling': 'sum', 'learning_rate': 0.0002564237460314689, 'weight_decay': 0.00041498350809409323, 'beta_0': 0.8663671515076814, 'beta_1': 0.9854141813047891, 'epsilon': 7.068662957607434e-08, 'balanced_loss': False, 'epochs': 95, 'early_stopping_patience': 22, 'plateau_patience': 14, 'plateau_divider': 2}. Best is trial 225 with value: 0.9507461710473065.
CUDA out of memory. Tried to allocate 3.01 GiB. GPU 0 has a total capacity of 44.56 GiB of which 1.03 GiB is free. Including non-PyTorch memory, this process has 43.52 GiB memory in use. Of the allocated memory 42.03 GiB is allocated by PyTorch, and 351.25 MiB is reserved by PyTorch but unallocated. If reserved but unallocated memory is large try setting PYTORCH_CUDA_ALLOC_CONF=expandable_segments:True to avoid fragmentation.  See documentation for Memory Management  (https://pytorch.org/docs/stable/notes/cuda.html#environment-variables)
[I 2025-02-28 09:38:19,980] Trial 242 finished with value: -1.0 and parameters: {'left_stride': 0, 'right_stride': 0, 'attention_pooling_operation': 'max', 'embedding_pooling_operation': 'max', 'threshold': 0.8239585740166897, 'batch_size': 65, 'attention_heads': 9, 'hidden_dimension': 202, 'number_of_hidden_layers': 2, 'dropout_rate': 0.583117618553539, 'global_pooling': 'max', 'learning_rate': 0.00041044732893177037, 'weight_decay': 0.0007121650612263862, 'beta_0': 0.8592093538419192, 'beta_1': 0.9866368709151822, 'epsilon': 9.54315151823035e-08, 'balanced_loss': False, 'epochs': 101, 'early_stopping_patience': 21, 'plateau_patience': 14, 'plateau_divider': 2}. Best is trial 225 with value: 0.9507461710473065.
[I 2025-02-28 09:50:21,668] Trial 243 finished with value: 0.9251803510163394 and parameters: {'left_stride': 32, 'right_stride': 0, 'attention_pooling_operation': 'mean', 'embedding_pooling_operation': 'max', 'threshold': 0.9223557856718364, 'batch_size': 70, 'attention_heads': 9, 'hidden_dimension': 78, 'number_of_hidden_layers': 2, 'dropout_rate': 0.5544452277663426, 'global_pooling': 'mean', 'learning_rate': 0.0005318258116025201, 'weight_decay': 0.00036239035997107446, 'beta_0': 0.8702061344004005, 'beta_1': 0.9944144995737124, 'epsilon': 1.5485975557552904e-07, 'balanced_loss': False, 'epochs': 110, 'early_stopping_patience': 21, 'plateau_patience': 15, 'plateau_divider': 2}. Best is trial 225 with value: 0.9507461710473065.
CUDA out of memory. Tried to allocate 1.27 GiB. GPU 0 has a total capacity of 44.56 GiB of which 316.69 MiB is free. Including non-PyTorch memory, this process has 44.24 GiB memory in use. Of the allocated memory 42.54 GiB is allocated by PyTorch, and 571.14 MiB is reserved by PyTorch but unallocated. If reserved but unallocated memory is large try setting PYTORCH_CUDA_ALLOC_CONF=expandable_segments:True to avoid fragmentation.  See documentation for Memory Management  (https://pytorch.org/docs/stable/notes/cuda.html#environment-variables)
[I 2025-02-28 09:57:53,604] Trial 244 finished with value: -1.0 and parameters: {'left_stride': 0, 'right_stride': 64, 'attention_pooling_operation': 'mean', 'embedding_pooling_operation': 'max', 'threshold': 0.8001008354555714, 'batch_size': 63, 'attention_heads': 8, 'hidden_dimension': 55, 'number_of_hidden_layers': 3, 'dropout_rate': 0.5490536206837584, 'global_pooling': 'max', 'learning_rate': 0.0008126395397937389, 'weight_decay': 0.0007775386905841436, 'beta_0': 0.8673754223577738, 'beta_1': 0.9934942516801992, 'epsilon': 6.935940928657304e-08, 'balanced_loss': False, 'epochs': 92, 'early_stopping_patience': 23, 'plateau_patience': 14, 'plateau_divider': 2}. Best is trial 225 with value: 0.9507461710473065.
[I 2025-02-28 10:09:11,513] Trial 245 finished with value: 0.9378305694747003 and parameters: {'left_stride': 0, 'right_stride': 0, 'attention_pooling_operation': 'max', 'embedding_pooling_operation': 'min', 'threshold': 0.8177524067241485, 'batch_size': 87, 'attention_heads': 8, 'hidden_dimension': 50, 'number_of_hidden_layers': 2, 'dropout_rate': 0.4221752944838412, 'global_pooling': 'max', 'learning_rate': 0.0007713110085205419, 'weight_decay': 0.0004561578894095279, 'beta_0': 0.8629895425863667, 'beta_1': 0.986030909987602, 'epsilon': 4.901889126169232e-08, 'balanced_loss': False, 'epochs': 106, 'early_stopping_patience': 21, 'plateau_patience': 14, 'plateau_divider': 2}. Best is trial 225 with value: 0.9507461710473065.
[I 2025-02-28 10:22:19,066] Trial 246 finished with value: 0.9402397939836394 and parameters: {'left_stride': 0, 'right_stride': 0, 'attention_pooling_operation': 'max', 'embedding_pooling_operation': 'min', 'threshold': 0.8140551532930843, 'batch_size': 92, 'attention_heads': 8, 'hidden_dimension': 48, 'number_of_hidden_layers': 2, 'dropout_rate': 0.5068714963381926, 'global_pooling': 'max', 'learning_rate': 0.0007478918380974337, 'weight_decay': 0.00047215663097237125, 'beta_0': 0.8611006906309476, 'beta_1': 0.9858708325128167, 'epsilon': 4.9531184111266044e-08, 'balanced_loss': False, 'epochs': 106, 'early_stopping_patience': 21, 'plateau_patience': 14, 'plateau_divider': 2}. Best is trial 225 with value: 0.9507461710473065.
CUDA out of memory. Tried to allocate 3.43 GiB. GPU 0 has a total capacity of 44.56 GiB of which 692.69 MiB is free. Including non-PyTorch memory, this process has 43.88 GiB memory in use. Of the allocated memory 42.05 GiB is allocated by PyTorch, and 689.07 MiB is reserved by PyTorch but unallocated. If reserved but unallocated memory is large try setting PYTORCH_CUDA_ALLOC_CONF=expandable_segments:True to avoid fragmentation.  See documentation for Memory Management  (https://pytorch.org/docs/stable/notes/cuda.html#environment-variables)
[I 2025-02-28 10:28:08,672] Trial 247 finished with value: -1.0 and parameters: {'left_stride': 0, 'right_stride': 0, 'attention_pooling_operation': 'max', 'embedding_pooling_operation': 'min', 'threshold': 0.815205275254782, 'batch_size': 89, 'attention_heads': 8, 'hidden_dimension': 197, 'number_of_hidden_layers': 2, 'dropout_rate': 0.5066951597960437, 'global_pooling': 'max', 'learning_rate': 0.0007328699844517237, 'weight_decay': 0.0004365649996662158, 'beta_0': 0.8628579780491519, 'beta_1': 0.9862338448976151, 'epsilon': 4.7321073957581094e-08, 'balanced_loss': False, 'epochs': 106, 'early_stopping_patience': 21, 'plateau_patience': 14, 'plateau_divider': 2}. Best is trial 225 with value: 0.9507461710473065.
[I 2025-02-28 10:39:40,076] Trial 248 finished with value: 0.9231020507315011 and parameters: {'left_stride': 0, 'right_stride': 0, 'attention_pooling_operation': 'max', 'embedding_pooling_operation': 'min', 'threshold': 0.8061679307418741, 'batch_size': 85, 'attention_heads': 8, 'hidden_dimension': 50, 'number_of_hidden_layers': 2, 'dropout_rate': 0.4198747030203146, 'global_pooling': 'max', 'learning_rate': 0.000628310667923391, 'weight_decay': 0.00031967743313024216, 'beta_0': 0.8615476571574662, 'beta_1': 0.9866394713150625, 'epsilon': 4.277117707883431e-08, 'balanced_loss': False, 'epochs': 107, 'early_stopping_patience': 21, 'plateau_patience': 14, 'plateau_divider': 2}. Best is trial 225 with value: 0.9507461710473065.
CUDA out of memory. Tried to allocate 1.74 GiB. GPU 0 has a total capacity of 44.56 GiB of which 1.54 GiB is free. Including non-PyTorch memory, this process has 43.01 GiB memory in use. Of the allocated memory 41.26 GiB is allocated by PyTorch, and 615.77 MiB is reserved by PyTorch but unallocated. If reserved but unallocated memory is large try setting PYTORCH_CUDA_ALLOC_CONF=expandable_segments:True to avoid fragmentation.  See documentation for Memory Management  (https://pytorch.org/docs/stable/notes/cuda.html#environment-variables)
[I 2025-02-28 10:45:56,197] Trial 249 finished with value: -1.0 and parameters: {'left_stride': 0, 'right_stride': 0, 'attention_pooling_operation': 'max', 'embedding_pooling_operation': 'min', 'threshold': 0.8124752046670263, 'batch_size': 81, 'attention_heads': 10, 'hidden_dimension': 60, 'number_of_hidden_layers': 2, 'dropout_rate': 0.5123141986123718, 'global_pooling': 'max', 'learning_rate': 0.0008709533087250165, 'weight_decay': 0.0004744207552053475, 'beta_0': 0.8639952028264016, 'beta_1': 0.9857317548030103, 'epsilon': 5.5789182258039716e-08, 'balanced_loss': False, 'epochs': 111, 'early_stopping_patience': 21, 'plateau_patience': 14, 'plateau_divider': 2}. Best is trial 225 with value: 0.9507461710473065.
[I 2025-02-28 10:57:38,999] Trial 250 finished with value: 0.9303418621921727 and parameters: {'left_stride': 0, 'right_stride': 0, 'attention_pooling_operation': 'max', 'embedding_pooling_operation': 'min', 'threshold': 0.8206464330499081, 'batch_size': 92, 'attention_heads': 8, 'hidden_dimension': 41, 'number_of_hidden_layers': 2, 'dropout_rate': 0.5203274830556134, 'global_pooling': 'max', 'learning_rate': 0.00048535091804720337, 'weight_decay': 0.0003793579792849514, 'beta_0': 0.8655670244317971, 'beta_1': 0.9858992469186513, 'epsilon': 3.447113750553969e-08, 'balanced_loss': False, 'epochs': 101, 'early_stopping_patience': 22, 'plateau_patience': 15, 'plateau_divider': 2}. Best is trial 225 with value: 0.9507461710473065.
[I 2025-02-28 11:11:35,178] Trial 251 finished with value: 0.9372902186731498 and parameters: {'left_stride': 0, 'right_stride': 0, 'attention_pooling_operation': 'max', 'embedding_pooling_operation': 'min', 'threshold': 0.8293964603197566, 'batch_size': 100, 'attention_heads': 9, 'hidden_dimension': 56, 'number_of_hidden_layers': 2, 'dropout_rate': 0.4992246934602176, 'global_pooling': 'max', 'learning_rate': 0.000729417830673755, 'weight_decay': 0.0006057215737158265, 'beta_0': 0.8602704405001415, 'beta_1': 0.9871471584109336, 'epsilon': 7.648560504443713e-08, 'balanced_loss': False, 'epochs': 104, 'early_stopping_patience': 21, 'plateau_patience': 15, 'plateau_divider': 2}. Best is trial 225 with value: 0.9507461710473065.
[I 2025-02-28 11:25:04,305] Trial 252 finished with value: 0.9373445865332624 and parameters: {'left_stride': 0, 'right_stride': 0, 'attention_pooling_operation': 'max', 'embedding_pooling_operation': 'min', 'threshold': 0.8274248941929087, 'batch_size': 93, 'attention_heads': 9, 'hidden_dimension': 54, 'number_of_hidden_layers': 2, 'dropout_rate': 0.5158497771561065, 'global_pooling': 'max', 'learning_rate': 0.0006915829932706228, 'weight_decay': 0.0006040548720597059, 'beta_0': 0.8590447687422107, 'beta_1': 0.9871563140339604, 'epsilon': 7.31006463927152e-08, 'balanced_loss': False, 'epochs': 104, 'early_stopping_patience': 21, 'plateau_patience': 15, 'plateau_divider': 2}. Best is trial 225 with value: 0.9507461710473065.
[I 2025-02-28 11:36:31,313] Trial 253 finished with value: 0.9276100659207498 and parameters: {'left_stride': 0, 'right_stride': 0, 'attention_pooling_operation': 'max', 'embedding_pooling_operation': 'min', 'threshold': 0.8105382877857382, 'batch_size': 88, 'attention_heads': 9, 'hidden_dimension': 47, 'number_of_hidden_layers': 2, 'dropout_rate': 0.3641287571169788, 'global_pooling': 'max', 'learning_rate': 0.0006394556597096496, 'weight_decay': 0.0005275308113987565, 'beta_0': 0.8574169695358989, 'beta_1': 0.9875584599006721, 'epsilon': 5.252686638068647e-08, 'balanced_loss': False, 'epochs': 109, 'early_stopping_patience': 21, 'plateau_patience': 15, 'plateau_divider': 2}. Best is trial 225 with value: 0.9507461710473065.
[I 2025-02-28 11:48:09,352] Trial 254 finished with value: 0.9362281361631274 and parameters: {'left_stride': 0, 'right_stride': 0, 'attention_pooling_operation': 'max', 'embedding_pooling_operation': 'min', 'threshold': 0.8239569323499282, 'batch_size': 99, 'attention_heads': 9, 'hidden_dimension': 38, 'number_of_hidden_layers': 2, 'dropout_rate': 0.5045944762042162, 'global_pooling': 'max', 'learning_rate': 0.0009065532893502821, 'weight_decay': 0.000618604320761581, 'beta_0': 0.860097291795719, 'beta_1': 0.9866587129398743, 'epsilon': 6.305648964546238e-08, 'balanced_loss': False, 'epochs': 106, 'early_stopping_patience': 21, 'plateau_patience': 15, 'plateau_divider': 2}. Best is trial 225 with value: 0.9507461710473065.
[I 2025-02-28 11:59:43,307] Trial 255 finished with value: 0.9341907031038826 and parameters: {'left_stride': 0, 'right_stride': 0, 'attention_pooling_operation': 'max', 'embedding_pooling_operation': 'min', 'threshold': 0.8337091339816449, 'batch_size': 78, 'attention_heads': 9, 'hidden_dimension': 32, 'number_of_hidden_layers': 2, 'dropout_rate': 0.5128440382931614, 'global_pooling': 'max', 'learning_rate': 0.000552834305728222, 'weight_decay': 0.00043537522932791993, 'beta_0': 0.8620014573046655, 'beta_1': 0.9857273008242003, 'epsilon': 4.4128728986232995e-08, 'balanced_loss': False, 'epochs': 102, 'early_stopping_patience': 24, 'plateau_patience': 15, 'plateau_divider': 2}. Best is trial 225 with value: 0.9507461710473065.
[I 2025-02-28 12:11:42,776] Trial 256 finished with value: 0.9275123629208475 and parameters: {'left_stride': 0, 'right_stride': 0, 'attention_pooling_operation': 'max', 'embedding_pooling_operation': 'min', 'threshold': 0.8175331927123248, 'batch_size': 92, 'attention_heads': 8, 'hidden_dimension': 51, 'number_of_hidden_layers': 2, 'dropout_rate': 0.5235783190569067, 'global_pooling': 'max', 'learning_rate': 0.0007687872011684721, 'weight_decay': 0.0004858726051756724, 'beta_0': 0.8585237450552781, 'beta_1': 0.9860348545594706, 'epsilon': 8.27068757696777e-08, 'balanced_loss': False, 'epochs': 99, 'early_stopping_patience': 21, 'plateau_patience': 14, 'plateau_divider': 2}. Best is trial 225 with value: 0.9507461710473065.
[I 2025-02-28 12:24:56,304] Trial 257 finished with value: 0.9507714196182853 and parameters: {'left_stride': 64, 'right_stride': 0, 'attention_pooling_operation': 'max', 'embedding_pooling_operation': 'min', 'threshold': 0.8266156715424157, 'batch_size': 75, 'attention_heads': 10, 'hidden_dimension': 43, 'number_of_hidden_layers': 2, 'dropout_rate': 0.5171473110049466, 'global_pooling': 'max', 'learning_rate': 0.0009550761101699984, 'weight_decay': 0.0005513969871411423, 'beta_0': 0.8634311870476901, 'beta_1': 0.9883866092533207, 'epsilon': 4.9607682742848286e-08, 'balanced_loss': False, 'epochs': 105, 'early_stopping_patience': 21, 'plateau_patience': 14, 'plateau_divider': 2}. Best is trial 257 with value: 0.9507714196182853.
[I 2025-02-28 12:39:26,229] Trial 258 finished with value: 0.9348766313389545 and parameters: {'left_stride': 64, 'right_stride': 0, 'attention_pooling_operation': 'max', 'embedding_pooling_operation': 'min', 'threshold': 0.8202922578366575, 'batch_size': 76, 'attention_heads': 11, 'hidden_dimension': 42, 'number_of_hidden_layers': 2, 'dropout_rate': 0.5330230013726631, 'global_pooling': 'max', 'learning_rate': 0.001017073670575269, 'weight_decay': 0.0005306512272252873, 'beta_0': 0.8646401294277545, 'beta_1': 0.9852703369492717, 'epsilon': 3.281708043619503e-08, 'balanced_loss': False, 'epochs': 97, 'early_stopping_patience': 23, 'plateau_patience': 14, 'plateau_divider': 2}. Best is trial 257 with value: 0.9507714196182853.
[I 2025-02-28 12:50:49,038] Trial 259 finished with value: 0.92585491826235 and parameters: {'left_stride': 64, 'right_stride': 0, 'attention_pooling_operation': 'max', 'embedding_pooling_operation': 'min', 'threshold': 0.8101847285827899, 'batch_size': 69, 'attention_heads': 10, 'hidden_dimension': 37, 'number_of_hidden_layers': 2, 'dropout_rate': 0.5302540441316552, 'global_pooling': 'max', 'learning_rate': 0.0009940554517256688, 'weight_decay': 0.0009565734829499641, 'beta_0': 0.8688129105543291, 'beta_1': 0.9883270287784631, 'epsilon': 2.83262368393003e-08, 'balanced_loss': False, 'epochs': 104, 'early_stopping_patience': 21, 'plateau_patience': 14, 'plateau_divider': 3}. Best is trial 257 with value: 0.9507714196182853.
CUDA out of memory. Tried to allocate 3.32 GiB. GPU 0 has a total capacity of 44.56 GiB of which 418.69 MiB is free. Including non-PyTorch memory, this process has 44.14 GiB memory in use. Of the allocated memory 39.69 GiB is allocated by PyTorch, and 3.31 GiB is reserved by PyTorch but unallocated. If reserved but unallocated memory is large try setting PYTORCH_CUDA_ALLOC_CONF=expandable_segments:True to avoid fragmentation.  See documentation for Memory Management  (https://pytorch.org/docs/stable/notes/cuda.html#environment-variables)
[I 2025-02-28 12:56:49,462] Trial 260 finished with value: -1.0 and parameters: {'left_stride': 64, 'right_stride': 32, 'attention_pooling_operation': 'max', 'embedding_pooling_operation': 'min', 'threshold': 0.8373890365499308, 'batch_size': 74, 'attention_heads': 8, 'hidden_dimension': 248, 'number_of_hidden_layers': 2, 'dropout_rate': 0.5261491192737612, 'global_pooling': 'max', 'learning_rate': 0.0003656486570821933, 'weight_decay': 0.00040820856013940797, 'beta_0': 0.8642453283916477, 'beta_1': 0.9876166838169369, 'epsilon': 3.9986261710087445e-08, 'balanced_loss': False, 'epochs': 71, 'early_stopping_patience': 24, 'plateau_patience': 24, 'plateau_divider': 2}. Best is trial 257 with value: 0.9507714196182853.
CUDA out of memory. Tried to allocate 1.44 GiB. GPU 0 has a total capacity of 44.56 GiB of which 498.69 MiB is free. Including non-PyTorch memory, this process has 44.07 GiB memory in use. Of the allocated memory 42.13 GiB is allocated by PyTorch, and 801.86 MiB is reserved by PyTorch but unallocated. If reserved but unallocated memory is large try setting PYTORCH_CUDA_ALLOC_CONF=expandable_segments:True to avoid fragmentation.  See documentation for Memory Management  (https://pytorch.org/docs/stable/notes/cuda.html#environment-variables)
[I 2025-02-28 13:03:07,287] Trial 261 finished with value: -1.0 and parameters: {'left_stride': 64, 'right_stride': 0, 'attention_pooling_operation': 'max', 'embedding_pooling_operation': 'min', 'threshold': 0.7973764503010908, 'batch_size': 84, 'attention_heads': 10, 'hidden_dimension': 46, 'number_of_hidden_layers': 2, 'dropout_rate': 0.520941638526666, 'global_pooling': 'max', 'learning_rate': 0.0008488049751714995, 'weight_decay': 0.0007454200003506239, 'beta_0': 0.8724472635568739, 'beta_1': 0.9889472866473589, 'epsilon': 2.521777402553311e-05, 'balanced_loss': False, 'epochs': 60, 'early_stopping_patience': 21, 'plateau_patience': 14, 'plateau_divider': 2}. Best is trial 257 with value: 0.9507714196182853.
[I 2025-02-28 13:12:37,217] Trial 262 finished with value: 0.8709939242423043 and parameters: {'left_stride': 64, 'right_stride': 0, 'attention_pooling_operation': 'max', 'embedding_pooling_operation': 'max', 'threshold': 0.9378283583366657, 'batch_size': 81, 'attention_heads': 9, 'hidden_dimension': 42, 'number_of_hidden_layers': 4, 'dropout_rate': 0.31963607026896457, 'global_pooling': 'max', 'learning_rate': 0.00020500067338091399, 'weight_decay': 0.0004585686758726413, 'beta_0': 0.862322841121816, 'beta_1': 0.9883736216816574, 'epsilon': 5.099192821418674e-08, 'balanced_loss': False, 'epochs': 95, 'early_stopping_patience': 11, 'plateau_patience': 14, 'plateau_divider': 2}. Best is trial 257 with value: 0.9507714196182853.
CUDA out of memory. Tried to allocate 1.60 GiB. GPU 0 has a total capacity of 44.56 GiB of which 806.69 MiB is free. Including non-PyTorch memory, this process has 43.77 GiB memory in use. Of the allocated memory 41.89 GiB is allocated by PyTorch, and 744.67 MiB is reserved by PyTorch but unallocated. If reserved but unallocated memory is large try setting PYTORCH_CUDA_ALLOC_CONF=expandable_segments:True to avoid fragmentation.  See documentation for Memory Management  (https://pytorch.org/docs/stable/notes/cuda.html#environment-variables)
