[I 2025-02-28 13:19:18,074] Trial 263 finished with value: -1.0 and parameters: {'left_stride': 0, 'right_stride': 0, 'attention_pooling_operation': 'max', 'embedding_pooling_operation': 'min', 'threshold': 0.8283480030888589, 'batch_size': 213, 'attention_heads': 8, 'hidden_dimension': 37, 'number_of_hidden_layers': 2, 'dropout_rate': 0.3567462754747118, 'global_pooling': 'max', 'learning_rate': 0.0004733890101921108, 'weight_decay': 0.0003457448693183432, 'beta_0': 0.866816675012877, 'beta_1': 0.9928144520250517, 'epsilon': 4.468797285892804e-08, 'balanced_loss': False, 'epochs': 67, 'early_stopping_patience': 22, 'plateau_patience': 14, 'plateau_divider': 3}. Best is trial 257 with value: 0.9507714196182853.
CUDA out of memory. Tried to allocate 1.68 GiB. GPU 0 has a total capacity of 44.56 GiB of which 62.69 MiB is free. Including non-PyTorch memory, this process has 44.49 GiB memory in use. Of the allocated memory 41.63 GiB is allocated by PyTorch, and 1.71 GiB is reserved by PyTorch but unallocated. If reserved but unallocated memory is large try setting PYTORCH_CUDA_ALLOC_CONF=expandable_segments:True to avoid fragmentation.  See documentation for Memory Management  (https://pytorch.org/docs/stable/notes/cuda.html#environment-variables)
[I 2025-02-28 13:25:13,007] Trial 264 finished with value: -1.0 and parameters: {'left_stride': 128, 'right_stride': 0, 'attention_pooling_operation': 'max', 'embedding_pooling_operation': 'max', 'threshold': 0.842624538961302, 'batch_size': 201, 'attention_heads': 10, 'hidden_dimension': 48, 'number_of_hidden_layers': 4, 'dropout_rate': 0.5083963301439418, 'global_pooling': 'mean', 'learning_rate': 0.001081162904880756, 'weight_decay': 0.0005654015615023706, 'beta_0': 0.8692548483168605, 'beta_1': 0.995514397066399, 'epsilon': 2.950924525332413e-05, 'balanced_loss': False, 'epochs': 53, 'early_stopping_patience': 20, 'plateau_patience': 14, 'plateau_divider': 2}. Best is trial 257 with value: 0.9507714196182853.
[I 2025-02-28 13:35:27,228] Trial 265 finished with value: 0.9338903255103561 and parameters: {'left_stride': 0, 'right_stride': 0, 'attention_pooling_operation': 'mean', 'embedding_pooling_operation': 'max', 'threshold': 0.8182385580420382, 'batch_size': 70, 'attention_heads': 4, 'hidden_dimension': 44, 'number_of_hidden_layers': 2, 'dropout_rate': 0.42934782046068604, 'global_pooling': 'max', 'learning_rate': 0.0009343588708977658, 'weight_decay': 0.0006581759095227661, 'beta_0': 0.8888125206455132, 'beta_1': 0.9880002492717497, 'epsilon': 6.233074861197327e-08, 'balanced_loss': False, 'epochs': 99, 'early_stopping_patience': 24, 'plateau_patience': 14, 'plateau_divider': 2}. Best is trial 257 with value: 0.9507714196182853.
[I 2025-02-28 13:46:19,233] Trial 266 finished with value: 0.9020180389238615 and parameters: {'left_stride': 0, 'right_stride': 0, 'attention_pooling_operation': 'mean', 'embedding_pooling_operation': 'max', 'threshold': 0.9627310379313895, 'batch_size': 76, 'attention_heads': 9, 'hidden_dimension': 35, 'number_of_hidden_layers': 4, 'dropout_rate': 0.48606238705243027, 'global_pooling': 'max', 'learning_rate': 0.0006037999832843102, 'weight_decay': 0.00085570031496789, 'beta_0': 0.8634352854670659, 'beta_1': 0.9863276089817417, 'epsilon': 2.0613592154683876e-05, 'balanced_loss': False, 'epochs': 106, 'early_stopping_patience': 20, 'plateau_patience': 15, 'plateau_divider': 2}. Best is trial 257 with value: 0.9507714196182853.
CUDA out of memory. Tried to allocate 2.29 GiB. GPU 0 has a total capacity of 44.56 GiB of which 1.94 GiB is free. Including non-PyTorch memory, this process has 42.61 GiB memory in use. Of the allocated memory 41.21 GiB is allocated by PyTorch, and 262.83 MiB is reserved by PyTorch but unallocated. If reserved but unallocated memory is large try setting PYTORCH_CUDA_ALLOC_CONF=expandable_segments:True to avoid fragmentation.  See documentation for Memory Management  (https://pytorch.org/docs/stable/notes/cuda.html#environment-variables)
[I 2025-02-28 13:52:16,620] Trial 267 finished with value: -1.0 and parameters: {'left_stride': 64, 'right_stride': 0, 'attention_pooling_operation': 'max', 'embedding_pooling_operation': 'max', 'threshold': 0.8354166717441748, 'batch_size': 53, 'attention_heads': 11, 'hidden_dimension': 163, 'number_of_hidden_layers': 2, 'dropout_rate': 0.5378984899547161, 'global_pooling': 'max', 'learning_rate': 0.00028772886185207897, 'weight_decay': 0.00027515490910063017, 'beta_0': 0.8661817115373784, 'beta_1': 0.9854226126245041, 'epsilon': 1.6142811163790846e-05, 'balanced_loss': False, 'epochs': 114, 'early_stopping_patience': 22, 'plateau_patience': 16, 'plateau_divider': 4}. Best is trial 257 with value: 0.9507714196182853.
[I 2025-02-28 14:08:10,090] Trial 268 finished with value: 0.9228888846651787 and parameters: {'left_stride': 0, 'right_stride': 0, 'attention_pooling_operation': 'mean', 'embedding_pooling_operation': 'max', 'threshold': 0.9082976048265523, 'batch_size': 41, 'attention_heads': 4, 'hidden_dimension': 187, 'number_of_hidden_layers': 3, 'dropout_rate': 0.5288195587093509, 'global_pooling': 'max', 'learning_rate': 0.0007856568014088881, 'weight_decay': 0.0004633264710013613, 'beta_0': 0.8714751448509739, 'beta_1': 0.9879270403993856, 'epsilon': 4.7666656430780195e-07, 'balanced_loss': False, 'epochs': 96, 'early_stopping_patience': 23, 'plateau_patience': 14, 'plateau_divider': 4}. Best is trial 257 with value: 0.9507714196182853.
CUDA out of memory. Tried to allocate 1.01 GiB. GPU 0 has a total capacity of 44.56 GiB of which 280.69 MiB is free. Including non-PyTorch memory, this process has 44.28 GiB memory in use. Of the allocated memory 42.71 GiB is allocated by PyTorch, and 424.90 MiB is reserved by PyTorch but unallocated. If reserved but unallocated memory is large try setting PYTORCH_CUDA_ALLOC_CONF=expandable_segments:True to avoid fragmentation.  See documentation for Memory Management  (https://pytorch.org/docs/stable/notes/cuda.html#environment-variables)
[I 2025-02-28 14:14:03,402] Trial 269 finished with value: -1.0 and parameters: {'left_stride': 0, 'right_stride': 0, 'attention_pooling_operation': 'max', 'embedding_pooling_operation': 'max', 'threshold': 0.8021352127809802, 'batch_size': 67, 'attention_heads': 8, 'hidden_dimension': 67, 'number_of_hidden_layers': 4, 'dropout_rate': 0.5180906674820184, 'global_pooling': 'max', 'learning_rate': 0.0011820815756970152, 'weight_decay': 0.00039287687468769625, 'beta_0': 0.8612438345348893, 'beta_1': 0.9848992296752309, 'epsilon': 1.2551791748418949e-07, 'balanced_loss': False, 'epochs': 50, 'early_stopping_patience': 21, 'plateau_patience': 13, 'plateau_divider': 2}. Best is trial 257 with value: 0.9507714196182853.
[I 2025-02-28 14:25:16,609] Trial 270 finished with value: 0.9259162078428795 and parameters: {'left_stride': 0, 'right_stride': 0, 'attention_pooling_operation': 'mean', 'embedding_pooling_operation': 'max', 'threshold': 0.8255308213925502, 'batch_size': 184, 'attention_heads': 4, 'hidden_dimension': 51, 'number_of_hidden_layers': 1, 'dropout_rate': 0.5410527843099309, 'global_pooling': 'max', 'learning_rate': 0.0004312313864848281, 'weight_decay': 0.000536907341409499, 'beta_0': 0.8727845749378202, 'beta_1': 0.994950876579554, 'epsilon': 3.873463819407426e-08, 'balanced_loss': False, 'epochs': 92, 'early_stopping_patience': 23, 'plateau_patience': 15, 'plateau_divider': 3}. Best is trial 257 with value: 0.9507714196182853.
[I 2025-02-28 14:34:37,874] Trial 271 finished with value: 0.9300207799265956 and parameters: {'left_stride': 0, 'right_stride': 64, 'attention_pooling_operation': 'max', 'embedding_pooling_operation': 'max', 'threshold': 0.8130490679639016, 'batch_size': 72, 'attention_heads': 7, 'hidden_dimension': 32, 'number_of_hidden_layers': 2, 'dropout_rate': 0.33895262934117376, 'global_pooling': 'max', 'learning_rate': 0.0009663066247279671, 'weight_decay': 0.0006800648581665662, 'beta_0': 0.867796986828966, 'beta_1': 0.9861781225400169, 'epsilon': 2.202129368474955e-05, 'balanced_loss': False, 'epochs': 109, 'early_stopping_patience': 24, 'plateau_patience': 15, 'plateau_divider': 4}. Best is trial 257 with value: 0.9507714196182853.
[I 2025-02-28 14:50:48,006] Trial 272 finished with value: 0.9350357354393785 and parameters: {'left_stride': 0, 'right_stride': 0, 'attention_pooling_operation': 'mean', 'embedding_pooling_operation': 'min', 'threshold': 0.8412730169582684, 'batch_size': 60, 'attention_heads': 4, 'hidden_dimension': 59, 'number_of_hidden_layers': 4, 'dropout_rate': 0.47770669459483, 'global_pooling': 'max', 'learning_rate': 0.0006765604501591547, 'weight_decay': 0.0009942988622470765, 'beta_0': 0.8775367243328976, 'beta_1': 0.9965741126666154, 'epsilon': 9.963655957898086e-08, 'balanced_loss': False, 'epochs': 102, 'early_stopping_patience': 21, 'plateau_patience': 14, 'plateau_divider': 4}. Best is trial 257 with value: 0.9507714196182853.
CUDA out of memory. Tried to allocate 4.31 GiB. GPU 0 has a total capacity of 44.56 GiB of which 1.86 GiB is free. Including non-PyTorch memory, this process has 42.69 GiB memory in use. Of the allocated memory 40.88 GiB is allocated by PyTorch, and 678.10 MiB is reserved by PyTorch but unallocated. If reserved but unallocated memory is large try setting PYTORCH_CUDA_ALLOC_CONF=expandable_segments:True to avoid fragmentation.  See documentation for Memory Management  (https://pytorch.org/docs/stable/notes/cuda.html#environment-variables)
[I 2025-02-28 14:57:58,441] Trial 273 finished with value: -1.0 and parameters: {'left_stride': 32, 'right_stride': 0, 'attention_pooling_operation': 'mean', 'embedding_pooling_operation': 'max', 'threshold': 0.8310325440295226, 'batch_size': 221, 'attention_heads': 9, 'hidden_dimension': 124, 'number_of_hidden_layers': 2, 'dropout_rate': 0.5628675558734538, 'global_pooling': 'max', 'learning_rate': 0.000535896350892749, 'weight_decay': 0.0004901153349999301, 'beta_0': 0.8696618823108077, 'beta_1': 0.9822572509290592, 'epsilon': 1.6646074679298462e-07, 'balanced_loss': False, 'epochs': 88, 'early_stopping_patience': 22, 'plateau_patience': 16, 'plateau_divider': 2}. Best is trial 257 with value: 0.9507714196182853.
CUDA out of memory. Tried to allocate 1.04 GiB. GPU 0 has a total capacity of 44.56 GiB of which 836.69 MiB is free. Including non-PyTorch memory, this process has 43.74 GiB memory in use. Of the allocated memory 42.07 GiB is allocated by PyTorch, and 527.39 MiB is reserved by PyTorch but unallocated. If reserved but unallocated memory is large try setting PYTORCH_CUDA_ALLOC_CONF=expandable_segments:True to avoid fragmentation.  See documentation for Memory Management  (https://pytorch.org/docs/stable/notes/cuda.html#environment-variables)
[I 2025-02-28 15:06:32,149] Trial 274 finished with value: -1.0 and parameters: {'left_stride': 0, 'right_stride': 0, 'attention_pooling_operation': 'max', 'embedding_pooling_operation': 'max', 'threshold': 0.8239413017401829, 'batch_size': 87, 'attention_heads': 9, 'hidden_dimension': 41, 'number_of_hidden_layers': 4, 'dropout_rate': 0.535880942076987, 'global_pooling': 'max', 'learning_rate': 0.0011204751518585048, 'weight_decay': 0.0007795016237604039, 'beta_0': 0.8641215565732263, 'beta_1': 0.9857282694854141, 'epsilon': 2.330132288313087e-08, 'balanced_loss': False, 'epochs': 94, 'early_stopping_patience': 20, 'plateau_patience': 13, 'plateau_divider': 2}. Best is trial 257 with value: 0.9507714196182853.
CUDA out of memory. Tried to allocate 1.36 GiB. GPU 0 has a total capacity of 44.56 GiB of which 1.12 GiB is free. Including non-PyTorch memory, this process has 43.43 GiB memory in use. Of the allocated memory 41.05 GiB is allocated by PyTorch, and 1.23 GiB is reserved by PyTorch but unallocated. If reserved but unallocated memory is large try setting PYTORCH_CUDA_ALLOC_CONF=expandable_segments:True to avoid fragmentation.  See documentation for Memory Management  (https://pytorch.org/docs/stable/notes/cuda.html#environment-variables)
[I 2025-02-28 15:15:10,509] Trial 275 finished with value: -1.0 and parameters: {'left_stride': 0, 'right_stride': 0, 'attention_pooling_operation': 'mean', 'embedding_pooling_operation': 'max', 'threshold': 0.8081846626373427, 'batch_size': 120, 'attention_heads': 8, 'hidden_dimension': 45, 'number_of_hidden_layers': 2, 'dropout_rate': 0.5101820378713224, 'global_pooling': 'mean', 'learning_rate': 0.000816089462224876, 'weight_decay': 0.0003256895659650367, 'beta_0': 0.8830897934560545, 'beta_1': 0.9940455074966158, 'epsilon': 5.209952982081947e-08, 'balanced_loss': False, 'epochs': 100, 'early_stopping_patience': 20, 'plateau_patience': 15, 'plateau_divider': 4}. Best is trial 257 with value: 0.9507714196182853.
CUDA out of memory. Tried to allocate 1.02 GiB. GPU 0 has a total capacity of 44.56 GiB of which 354.69 MiB is free. Including non-PyTorch memory, this process has 44.21 GiB memory in use. Of the allocated memory 42.84 GiB is allocated by PyTorch, and 226.14 MiB is reserved by PyTorch but unallocated. If reserved but unallocated memory is large try setting PYTORCH_CUDA_ALLOC_CONF=expandable_segments:True to avoid fragmentation.  See documentation for Memory Management  (https://pytorch.org/docs/stable/notes/cuda.html#environment-variables)
[I 2025-02-28 15:21:11,436] Trial 276 finished with value: -1.0 and parameters: {'left_stride': 0, 'right_stride': 128, 'attention_pooling_operation': 'max', 'embedding_pooling_operation': 'max', 'threshold': 0.7887439202536886, 'batch_size': 37, 'attention_heads': 4, 'hidden_dimension': 208, 'number_of_hidden_layers': 4, 'dropout_rate': 0.4381940548039887, 'global_pooling': 'max', 'learning_rate': 0.0003569490189199434, 'weight_decay': 0.0006063255313141769, 'beta_0': 0.8731987267987247, 'beta_1': 0.9957868713349066, 'epsilon': 3.613387790273582e-05, 'balanced_loss': False, 'epochs': 135, 'early_stopping_patience': 18, 'plateau_patience': 14, 'plateau_divider': 3}. Best is trial 257 with value: 0.9507714196182853.
CUDA out of memory. Tried to allocate 1.05 GiB. GPU 0 has a total capacity of 44.56 GiB of which 302.69 MiB is free. Including non-PyTorch memory, this process has 44.26 GiB memory in use. Of the allocated memory 42.60 GiB is allocated by PyTorch, and 520.93 MiB is reserved by PyTorch but unallocated. If reserved but unallocated memory is large try setting PYTORCH_CUDA_ALLOC_CONF=expandable_segments:True to avoid fragmentation.  See documentation for Memory Management  (https://pytorch.org/docs/stable/notes/cuda.html#environment-variables)
[I 2025-02-28 15:28:26,872] Trial 277 finished with value: -1.0 and parameters: {'left_stride': 0, 'right_stride': 32, 'attention_pooling_operation': 'mean', 'embedding_pooling_operation': 'max', 'threshold': 0.697830228005001, 'batch_size': 64, 'attention_heads': 8, 'hidden_dimension': 51, 'number_of_hidden_layers': 4, 'dropout_rate': 0.5268977989314907, 'global_pooling': 'max', 'learning_rate': 0.0012337813041069597, 'weight_decay': 0.000201874545021964, 'beta_0': 0.8566772794803843, 'beta_1': 0.9892877163588478, 'epsilon': 1.8570952832462738e-05, 'balanced_loss': False, 'epochs': 90, 'early_stopping_patience': 23, 'plateau_patience': 14, 'plateau_divider': 4}. Best is trial 257 with value: 0.9507714196182853.
CUDA out of memory. Tried to allocate 1.39 GiB. GPU 0 has a total capacity of 44.56 GiB of which 808.69 MiB is free. Including non-PyTorch memory, this process has 43.76 GiB memory in use. Of the allocated memory 42.29 GiB is allocated by PyTorch, and 326.69 MiB is reserved by PyTorch but unallocated. If reserved but unallocated memory is large try setting PYTORCH_CUDA_ALLOC_CONF=expandable_segments:True to avoid fragmentation.  See documentation for Memory Management  (https://pytorch.org/docs/stable/notes/cuda.html#environment-variables)
[I 2025-02-28 15:35:39,728] Trial 278 finished with value: -1.0 and parameters: {'left_stride': 64, 'right_stride': 0, 'attention_pooling_operation': 'mean', 'embedding_pooling_operation': 'max', 'threshold': 0.7637980067203133, 'batch_size': 79, 'attention_heads': 10, 'hidden_dimension': 56, 'number_of_hidden_layers': 2, 'dropout_rate': 0.3483595617290453, 'global_pooling': 'max', 'learning_rate': 0.0001609653085009803, 'weight_decay': 0.00041825337577799227, 'beta_0': 0.8660342990546369, 'beta_1': 0.985012243152884, 'epsilon': 7.945564308182335e-06, 'balanced_loss': False, 'epochs': 188, 'early_stopping_patience': 24, 'plateau_patience': 13, 'plateau_divider': 2}. Best is trial 257 with value: 0.9507714196182853.
CUDA out of memory. Tried to allocate 1.38 GiB. GPU 0 has a total capacity of 44.56 GiB of which 712.69 MiB is free. Including non-PyTorch memory, this process has 43.86 GiB memory in use. Of the allocated memory 42.53 GiB is allocated by PyTorch, and 177.01 MiB is reserved by PyTorch but unallocated. If reserved but unallocated memory is large try setting PYTORCH_CUDA_ALLOC_CONF=expandable_segments:True to avoid fragmentation.  See documentation for Memory Management  (https://pytorch.org/docs/stable/notes/cuda.html#environment-variables)
[I 2025-02-28 15:41:38,162] Trial 279 finished with value: -1.0 and parameters: {'left_stride': 0, 'right_stride': 0, 'attention_pooling_operation': 'max', 'embedding_pooling_operation': 'max', 'threshold': 0.8183111718652332, 'batch_size': 71, 'attention_heads': 4, 'hidden_dimension': 194, 'number_of_hidden_layers': 3, 'dropout_rate': 0.4963674717263134, 'global_pooling': 'max', 'learning_rate': 0.0006938707784164005, 'weight_decay': 6.282459843356561e-06, 'beta_0': 0.8334570698487809, 'beta_1': 0.9866046676657254, 'epsilon': 7.230504781278686e-07, 'balanced_loss': False, 'epochs': 97, 'early_stopping_patience': 21, 'plateau_patience': 15, 'plateau_divider': 3}. Best is trial 257 with value: 0.9507714196182853.
[I 2025-02-28 15:51:42,219] Trial 280 finished with value: 0.9228327895969177 and parameters: {'left_stride': 0, 'right_stride': 0, 'attention_pooling_operation': 'mean', 'embedding_pooling_operation': 'min', 'threshold': 0.7418030657435342, 'batch_size': 50, 'attention_heads': 4, 'hidden_dimension': 37, 'number_of_hidden_layers': 2, 'dropout_rate': 0.5451941295898384, 'global_pooling': 'max', 'learning_rate': 0.0009039492984566536, 'weight_decay': 4.0841229297252746e-05, 'beta_0': 0.8006453265052721, 'beta_1': 0.9947259219029423, 'epsilon': 3.0334515274192024e-08, 'balanced_loss': False, 'epochs': 93, 'early_stopping_patience': 14, 'plateau_patience': 13, 'plateau_divider': 4}. Best is trial 257 with value: 0.9507714196182853.
[I 2025-02-28 16:06:46,001] Trial 281 finished with value: 0.9090271246047301 and parameters: {'left_stride': 0, 'right_stride': 0, 'attention_pooling_operation': 'max', 'embedding_pooling_operation': 'max', 'threshold': 0.8956017998633949, 'batch_size': 255, 'attention_heads': 4, 'hidden_dimension': 62, 'number_of_hidden_layers': 4, 'dropout_rate': 0.5584543725374864, 'global_pooling': 'max', 'learning_rate': 0.0005115791459415403, 'weight_decay': 0.0005210116149669817, 'beta_0': 0.8922962844957422, 'beta_1': 0.9961739921091898, 'epsilon': 2.3454802591559e-07, 'balanced_loss': False, 'epochs': 86, 'early_stopping_patience': 22, 'plateau_patience': 14, 'plateau_divider': 4}. Best is trial 257 with value: 0.9507714196182853.
CUDA out of memory. Tried to allocate 2.21 GiB. GPU 0 has a total capacity of 44.56 GiB of which 390.69 MiB is free. Including non-PyTorch memory, this process has 44.17 GiB memory in use. Of the allocated memory 40.63 GiB is allocated by PyTorch, and 2.39 GiB is reserved by PyTorch but unallocated. If reserved but unallocated memory is large try setting PYTORCH_CUDA_ALLOC_CONF=expandable_segments:True to avoid fragmentation.  See documentation for Memory Management  (https://pytorch.org/docs/stable/notes/cuda.html#environment-variables)
[I 2025-02-28 16:14:02,733] Trial 282 finished with value: -1.0 and parameters: {'left_stride': 0, 'right_stride': 0, 'attention_pooling_operation': 'mean', 'embedding_pooling_operation': 'max', 'threshold': 0.8352013783306379, 'batch_size': 116, 'attention_heads': 15, 'hidden_dimension': 71, 'number_of_hidden_layers': 2, 'dropout_rate': 0.30638132995893713, 'global_pooling': 'max', 'learning_rate': 0.00061812007529612, 'weight_decay': 0.000704739601154645, 'beta_0': 0.8372453789585343, 'beta_1': 0.9938767908041897, 'epsilon': 1.3747084665975988e-05, 'balanced_loss': False, 'epochs': 152, 'early_stopping_patience': 21, 'plateau_patience': 20, 'plateau_divider': 2}. Best is trial 257 with value: 0.9507714196182853.
[I 2025-02-28 16:22:01,087] Trial 283 finished with value: 0.9361911846450492 and parameters: {'left_stride': 0, 'right_stride': 0, 'attention_pooling_operation': 'max', 'embedding_pooling_operation': 'max', 'threshold': 0.8443779980635409, 'batch_size': 66, 'attention_heads': 9, 'hidden_dimension': 47, 'number_of_hidden_layers': 0, 'dropout_rate': 0.53284307510137, 'global_pooling': 'max', 'learning_rate': 0.0010542627967970394, 'weight_decay': 0.00015871562307201927, 'beta_0': 0.8794492429472137, 'beta_1': 0.992229801674064, 'epsilon': 4.6058196611711515e-08, 'balanced_loss': False, 'epochs': 91, 'early_stopping_patience': 24, 'plateau_patience': 15, 'plateau_divider': 4}. Best is trial 257 with value: 0.9507714196182853.
CUDA out of memory. Tried to allocate 744.00 MiB. GPU 0 has a total capacity of 44.56 GiB of which 646.69 MiB is free. Including non-PyTorch memory, this process has 43.92 GiB memory in use. Of the allocated memory 37.84 GiB is allocated by PyTorch, and 4.93 GiB is reserved by PyTorch but unallocated. If reserved but unallocated memory is large try setting PYTORCH_CUDA_ALLOC_CONF=expandable_segments:True to avoid fragmentation.  See documentation for Memory Management  (https://pytorch.org/docs/stable/notes/cuda.html#environment-variables)
