[I 2025-02-23 04:29:31,250] Using an existing study with name 'R8-GATv2-google-bert-bert-base-uncased-Surrogate-No_Aggregation-Single_Unitary_Weight-0.0-0.0' instead of creating a new one.
Token indices sequence length is longer than the specified maximum sequence length for this model (639 > 512). Running this sequence through the model will result in indexing errors
CUDA out of memory. Tried to allocate 4.62 GiB. GPU 0 has a total capacity of 44.56 GiB of which 1.12 GiB is free. Including non-PyTorch memory, this process has 43.43 GiB memory in use. Of the allocated memory 41.60 GiB is allocated by PyTorch, and 703.61 MiB is reserved by PyTorch but unallocated. If reserved but unallocated memory is large try setting PYTORCH_CUDA_ALLOC_CONF=expandable_segments:True to avoid fragmentation.  See documentation for Memory Management  (https://pytorch.org/docs/stable/notes/cuda.html#environment-variables)
[I 2025-02-23 04:35:37,928] Trial 279 finished with value: -1.0 and parameters: {'left_stride': 32, 'right_stride': 32, 'attention_pooling_operation': 'max', 'embedding_pooling_operation': 'min', 'threshold': 0.8001456383247375, 'batch_size': 225, 'attention_heads': 10, 'hidden_dimension': 100, 'number_of_hidden_layers': 2, 'dropout_rate': 0.5809465067915401, 'global_pooling': 'max', 'learning_rate': 4.576754022750641e-05, 'weight_decay': 7.038077824459506e-05, 'beta_0': 0.8528490223042429, 'beta_1': 0.9807877970459647, 'epsilon': 7.580130328136675e-08, 'balanced_loss': False, 'epochs': 142, 'early_stopping_patience': 24, 'plateau_patience': 18, 'plateau_divider': 6}. Best is trial 36 with value: 0.966858574697526.
[I 2025-02-23 04:53:15,703] Trial 280 finished with value: 0.9536383993960427 and parameters: {'left_stride': 32, 'right_stride': 32, 'attention_pooling_operation': 'max', 'embedding_pooling_operation': 'min', 'threshold': 0.8276224813268617, 'batch_size': 60, 'attention_heads': 8, 'hidden_dimension': 99, 'number_of_hidden_layers': 2, 'dropout_rate': 0.5915887123968793, 'global_pooling': 'max', 'learning_rate': 0.00033493482741201185, 'weight_decay': 4.083508722969738e-05, 'beta_0': 0.8499545785172807, 'beta_1': 0.9905682273430942, 'epsilon': 1.8558163490295888e-06, 'balanced_loss': False, 'epochs': 145, 'early_stopping_patience': 25, 'plateau_patience': 19, 'plateau_divider': 6}. Best is trial 36 with value: 0.966858574697526.
CUDA out of memory. Tried to allocate 3.04 GiB. GPU 0 has a total capacity of 44.56 GiB of which 2.04 GiB is free. Including non-PyTorch memory, this process has 42.51 GiB memory in use. Of the allocated memory 38.02 GiB is allocated by PyTorch, and 3.34 GiB is reserved by PyTorch but unallocated. If reserved but unallocated memory is large try setting PYTORCH_CUDA_ALLOC_CONF=expandable_segments:True to avoid fragmentation.  See documentation for Memory Management  (https://pytorch.org/docs/stable/notes/cuda.html#environment-variables)
[I 2025-02-23 05:04:29,295] Trial 281 finished with value: -1.0 and parameters: {'left_stride': 32, 'right_stride': 32, 'attention_pooling_operation': 'max', 'embedding_pooling_operation': 'min', 'threshold': 0.835806542579417, 'batch_size': 71, 'attention_heads': 11, 'hidden_dimension': 111, 'number_of_hidden_layers': 2, 'dropout_rate': 0.5932363025186727, 'global_pooling': 'max', 'learning_rate': 0.00044320409202714843, 'weight_decay': 7.77013763334686e-05, 'beta_0': 0.849433508099493, 'beta_1': 0.9912388790393043, 'epsilon': 4.158120608425374e-08, 'balanced_loss': False, 'epochs': 147, 'early_stopping_patience': 21, 'plateau_patience': 19, 'plateau_divider': 2}. Best is trial 36 with value: 0.966858574697526.
CUDA out of memory. Tried to allocate 3.23 GiB. GPU 0 has a total capacity of 44.56 GiB of which 2.59 GiB is free. Including non-PyTorch memory, this process has 41.96 GiB memory in use. Of the allocated memory 40.09 GiB is allocated by PyTorch, and 739.61 MiB is reserved by PyTorch but unallocated. If reserved but unallocated memory is large try setting PYTORCH_CUDA_ALLOC_CONF=expandable_segments:True to avoid fragmentation.  See documentation for Memory Management  (https://pytorch.org/docs/stable/notes/cuda.html#environment-variables)
[I 2025-02-23 05:15:58,768] Trial 282 finished with value: -1.0 and parameters: {'left_stride': 32, 'right_stride': 32, 'attention_pooling_operation': 'max', 'embedding_pooling_operation': 'min', 'threshold': 0.8085478440872376, 'batch_size': 64, 'attention_heads': 11, 'hidden_dimension': 104, 'number_of_hidden_layers': 2, 'dropout_rate': 0.5859961281358707, 'global_pooling': 'mean', 'learning_rate': 0.0006567118934690313, 'weight_decay': 5.05969874776987e-05, 'beta_0': 0.8477533943436479, 'beta_1': 0.9919686885018305, 'epsilon': 1.360229798221236e-06, 'balanced_loss': False, 'epochs': 140, 'early_stopping_patience': 24, 'plateau_patience': 14, 'plateau_divider': 6}. Best is trial 36 with value: 0.966858574697526.
[I 2025-02-23 05:35:47,732] Trial 283 finished with value: 0.9499041907481243 and parameters: {'left_stride': 32, 'right_stride': 32, 'attention_pooling_operation': 'max', 'embedding_pooling_operation': 'min', 'threshold': 0.8457406018758383, 'batch_size': 54, 'attention_heads': 10, 'hidden_dimension': 114, 'number_of_hidden_layers': 2, 'dropout_rate': 0.5791673463544057, 'global_pooling': 'max', 'learning_rate': 0.0003671327342458381, 'weight_decay': 6.075888780164327e-05, 'beta_0': 0.8452091128810536, 'beta_1': 0.9902627315767202, 'epsilon': 1.859897588639842e-07, 'balanced_loss': False, 'epochs': 142, 'early_stopping_patience': 25, 'plateau_patience': 18, 'plateau_divider': 6}. Best is trial 36 with value: 0.966858574697526.
[I 2025-02-23 05:53:05,469] Trial 284 finished with value: 0.9469603331302852 and parameters: {'left_stride': 32, 'right_stride': 32, 'attention_pooling_operation': 'max', 'embedding_pooling_operation': 'min', 'threshold': 0.8193417517582999, 'batch_size': 58, 'attention_heads': 9, 'hidden_dimension': 95, 'number_of_hidden_layers': 2, 'dropout_rate': 0.5944396726866713, 'global_pooling': 'max', 'learning_rate': 0.00082214842723883, 'weight_decay': 0.0001006122264125751, 'beta_0': 0.8503512883568357, 'beta_1': 0.9915180915722694, 'epsilon': 1.6047848884919935e-06, 'balanced_loss': False, 'epochs': 137, 'early_stopping_patience': 22, 'plateau_patience': 18, 'plateau_divider': 6}. Best is trial 36 with value: 0.966858574697526.
[I 2025-02-23 06:14:21,324] Trial 285 finished with value: 0.9417690538251613 and parameters: {'left_stride': 32, 'right_stride': 32, 'attention_pooling_operation': 'max', 'embedding_pooling_operation': 'min', 'threshold': 0.8284913234114745, 'batch_size': 73, 'attention_heads': 9, 'hidden_dimension': 109, 'number_of_hidden_layers': 2, 'dropout_rate': 0.5880510140671045, 'global_pooling': 'sum', 'learning_rate': 0.0005248294547309317, 'weight_decay': 7.615502710660462e-05, 'beta_0': 0.8719578894985973, 'beta_1': 0.9909736347883954, 'epsilon': 8.11437380215421e-08, 'balanced_loss': False, 'epochs': 150, 'early_stopping_patience': 23, 'plateau_patience': 19, 'plateau_divider': 6}. Best is trial 36 with value: 0.966858574697526.
[I 2025-02-23 06:34:45,087] Trial 286 finished with value: 0.9651474054862577 and parameters: {'left_stride': 64, 'right_stride': 32, 'attention_pooling_operation': 'max', 'embedding_pooling_operation': 'min', 'threshold': 0.8340456685379937, 'batch_size': 62, 'attention_heads': 10, 'hidden_dimension': 103, 'number_of_hidden_layers': 2, 'dropout_rate': 0.5802340070142271, 'global_pooling': 'max', 'learning_rate': 0.00044342703589779877, 'weight_decay': 4.16378729940875e-05, 'beta_0': 0.8544314269962864, 'beta_1': 0.9912006853456066, 'epsilon': 1.5040400390103922e-08, 'balanced_loss': False, 'epochs': 147, 'early_stopping_patience': 23, 'plateau_patience': 18, 'plateau_divider': 3}. Best is trial 36 with value: 0.966858574697526.
CUDA out of memory. Tried to allocate 3.53 GiB. GPU 0 has a total capacity of 44.56 GiB of which 3.09 GiB is free. Including non-PyTorch memory, this process has 41.47 GiB memory in use. Of the allocated memory 40.03 GiB is allocated by PyTorch, and 297.67 MiB is reserved by PyTorch but unallocated. If reserved but unallocated memory is large try setting PYTORCH_CUDA_ALLOC_CONF=expandable_segments:True to avoid fragmentation.  See documentation for Memory Management  (https://pytorch.org/docs/stable/notes/cuda.html#environment-variables)
[I 2025-02-23 06:40:53,988] Trial 287 finished with value: -1.0 and parameters: {'left_stride': 64, 'right_stride': 32, 'attention_pooling_operation': 'max', 'embedding_pooling_operation': 'min', 'threshold': 0.838939303957634, 'batch_size': 157, 'attention_heads': 10, 'hidden_dimension': 104, 'number_of_hidden_layers': 2, 'dropout_rate': 0.5793902175041962, 'global_pooling': 'max', 'learning_rate': 0.0004068778166317582, 'weight_decay': 4.2390833724656864e-05, 'beta_0': 0.8541602103016073, 'beta_1': 0.9905096863350911, 'epsilon': 3.007091200981574e-06, 'balanced_loss': True, 'epochs': 148, 'early_stopping_patience': 23, 'plateau_patience': 18, 'plateau_divider': 4}. Best is trial 36 with value: 0.966858574697526.
[I 2025-02-23 07:03:05,543] Trial 288 finished with value: 0.9479743086922994 and parameters: {'left_stride': 64, 'right_stride': 256, 'attention_pooling_operation': 'max', 'embedding_pooling_operation': 'mean', 'threshold': 0.8498261767874616, 'batch_size': 57, 'attention_heads': 10, 'hidden_dimension': 115, 'number_of_hidden_layers': 2, 'dropout_rate': 0.5830090230992229, 'global_pooling': 'max', 'learning_rate': 0.00031262377537020103, 'weight_decay': 3.433455380824881e-05, 'beta_0': 0.8513909692954518, 'beta_1': 0.9817872127587747, 'epsilon': 1.654338688016816e-08, 'balanced_loss': False, 'epochs': 145, 'early_stopping_patience': 24, 'plateau_patience': 25, 'plateau_divider': 4}. Best is trial 36 with value: 0.966858574697526.
[I 2025-02-23 07:23:12,631] Trial 289 finished with value: 0.934598175429791 and parameters: {'left_stride': 64, 'right_stride': 32, 'attention_pooling_operation': 'min', 'embedding_pooling_operation': 'min', 'threshold': 0.8149540867184609, 'batch_size': 69, 'attention_heads': 10, 'hidden_dimension': 106, 'number_of_hidden_layers': 2, 'dropout_rate': 0.5898218139409557, 'global_pooling': 'max', 'learning_rate': 0.00047169054470275895, 'weight_decay': 0.00011420747194714189, 'beta_0': 0.8531669522066445, 'beta_1': 0.9897585384793858, 'epsilon': 4.796040228361861e-08, 'balanced_loss': False, 'epochs': 150, 'early_stopping_patience': 23, 'plateau_patience': 19, 'plateau_divider': 3}. Best is trial 36 with value: 0.966858574697526.
[I 2025-02-23 07:44:20,906] Trial 290 finished with value: 0.9576335268007857 and parameters: {'left_stride': 64, 'right_stride': 32, 'attention_pooling_operation': 'max', 'embedding_pooling_operation': 'min', 'threshold': 0.8216732382869167, 'batch_size': 51, 'attention_heads': 11, 'hidden_dimension': 98, 'number_of_hidden_layers': 2, 'dropout_rate': 0.5718119938834735, 'global_pooling': 'max', 'learning_rate': 0.00035629117585183484, 'weight_decay': 3.954629321374678e-05, 'beta_0': 0.8559834028269787, 'beta_1': 0.9924328829941088, 'epsilon': 1.2912458642257596e-08, 'balanced_loss': False, 'epochs': 143, 'early_stopping_patience': 23, 'plateau_patience': 19, 'plateau_divider': 3}. Best is trial 36 with value: 0.966858574697526.
[I 2025-02-23 08:03:13,299] Trial 291 finished with value: 0.9625941514241132 and parameters: {'left_stride': 64, 'right_stride': 32, 'attention_pooling_operation': 'max', 'embedding_pooling_operation': 'min', 'threshold': 0.8234376188325893, 'batch_size': 48, 'attention_heads': 11, 'hidden_dimension': 97, 'number_of_hidden_layers': 2, 'dropout_rate': 0.5728736334671682, 'global_pooling': 'max', 'learning_rate': 0.00034741962127951776, 'weight_decay': 3.716025261092876e-05, 'beta_0': 0.8552286023862653, 'beta_1': 0.9927312047085852, 'epsilon': 1.0709351668048542e-08, 'balanced_loss': False, 'epochs': 142, 'early_stopping_patience': 23, 'plateau_patience': 19, 'plateau_divider': 3}. Best is trial 36 with value: 0.966858574697526.
CUDA out of memory. Tried to allocate 3.48 GiB. GPU 0 has a total capacity of 44.56 GiB of which 6.69 MiB is free. Including non-PyTorch memory, this process has 44.55 GiB memory in use. Of the allocated memory 42.91 GiB is allocated by PyTorch, and 501.65 MiB is reserved by PyTorch but unallocated. If reserved but unallocated memory is large try setting PYTORCH_CUDA_ALLOC_CONF=expandable_segments:True to avoid fragmentation.  See documentation for Memory Management  (https://pytorch.org/docs/stable/notes/cuda.html#environment-variables)
[I 2025-02-23 08:10:16,630] Trial 292 finished with value: -1.0 and parameters: {'left_stride': 64, 'right_stride': 32, 'attention_pooling_operation': 'max', 'embedding_pooling_operation': 'min', 'threshold': 0.8039583428815971, 'batch_size': 48, 'attention_heads': 15, 'hidden_dimension': 99, 'number_of_hidden_layers': 2, 'dropout_rate': 0.5730682478287786, 'global_pooling': 'max', 'learning_rate': 0.00042102692206495154, 'weight_decay': 4.0379006931163645e-05, 'beta_0': 0.8551013458018368, 'beta_1': 0.9918171828833968, 'epsilon': 2.5621321495165936e-06, 'balanced_loss': False, 'epochs': 146, 'early_stopping_patience': 23, 'plateau_patience': 19, 'plateau_divider': 3}. Best is trial 36 with value: 0.966858574697526.
CUDA out of memory. Tried to allocate 3.38 GiB. GPU 0 has a total capacity of 44.56 GiB of which 1.34 GiB is free. Including non-PyTorch memory, this process has 43.21 GiB memory in use. Of the allocated memory 38.52 GiB is allocated by PyTorch, and 3.54 GiB is reserved by PyTorch but unallocated. If reserved but unallocated memory is large try setting PYTORCH_CUDA_ALLOC_CONF=expandable_segments:True to avoid fragmentation.  See documentation for Memory Management  (https://pytorch.org/docs/stable/notes/cuda.html#environment-variables)
[I 2025-02-23 08:16:53,745] Trial 293 finished with value: -1.0 and parameters: {'left_stride': 64, 'right_stride': 32, 'attention_pooling_operation': 'max', 'embedding_pooling_operation': 'min', 'threshold': 0.8202248425625939, 'batch_size': 110, 'attention_heads': 11, 'hidden_dimension': 96, 'number_of_hidden_layers': 2, 'dropout_rate': 0.5740330296209303, 'global_pooling': 'max', 'learning_rate': 0.00036388599837221594, 'weight_decay': 4.882068382964327e-05, 'beta_0': 0.857046590772558, 'beta_1': 0.9927448039994738, 'epsilon': 1.0921088730625003e-08, 'balanced_loss': False, 'epochs': 142, 'early_stopping_patience': 23, 'plateau_patience': 19, 'plateau_divider': 3}. Best is trial 36 with value: 0.966858574697526.
CUDA out of memory. Tried to allocate 3.35 GiB. GPU 0 has a total capacity of 44.56 GiB of which 1.11 GiB is free. Including non-PyTorch memory, this process has 43.44 GiB memory in use. Of the allocated memory 41.48 GiB is allocated by PyTorch, and 828.34 MiB is reserved by PyTorch but unallocated. If reserved but unallocated memory is large try setting PYTORCH_CUDA_ALLOC_CONF=expandable_segments:True to avoid fragmentation.  See documentation for Memory Management  (https://pytorch.org/docs/stable/notes/cuda.html#environment-variables)
[I 2025-02-23 08:23:36,330] Trial 294 finished with value: -1.0 and parameters: {'left_stride': 64, 'right_stride': 32, 'attention_pooling_operation': 'max', 'embedding_pooling_operation': 'min', 'threshold': 0.8104446415960427, 'batch_size': 75, 'attention_heads': 11, 'hidden_dimension': 102, 'number_of_hidden_layers': 2, 'dropout_rate': 0.5791255301931941, 'global_pooling': 'max', 'learning_rate': 0.00046720576073942794, 'weight_decay': 3.906973713827868e-05, 'beta_0': 0.8568998405793702, 'beta_1': 0.9930717989047445, 'epsilon': 1.0084200360250169e-08, 'balanced_loss': False, 'epochs': 137, 'early_stopping_patience': 23, 'plateau_patience': 19, 'plateau_divider': 3}. Best is trial 36 with value: 0.966858574697526.
CUDA out of memory. Tried to allocate 3.24 GiB. GPU 0 has a total capacity of 44.56 GiB of which 2.72 GiB is free. Including non-PyTorch memory, this process has 41.84 GiB memory in use. Of the allocated memory 40.32 GiB is allocated by PyTorch, and 370.37 MiB is reserved by PyTorch but unallocated. If reserved but unallocated memory is large try setting PYTORCH_CUDA_ALLOC_CONF=expandable_segments:True to avoid fragmentation.  See documentation for Memory Management  (https://pytorch.org/docs/stable/notes/cuda.html#environment-variables)
[I 2025-02-23 08:29:52,293] Trial 295 finished with value: -1.0 and parameters: {'left_stride': 64, 'right_stride': 0, 'attention_pooling_operation': 'max', 'embedding_pooling_operation': 'min', 'threshold': 0.8237107129432795, 'batch_size': 121, 'attention_heads': 11, 'hidden_dimension': 98, 'number_of_hidden_layers': 2, 'dropout_rate': 0.5999743383291046, 'global_pooling': 'max', 'learning_rate': 0.0002845909911735124, 'weight_decay': 1.476624792687571e-06, 'beta_0': 0.8553762750387853, 'beta_1': 0.992465953116841, 'epsilon': 1.445563992489178e-08, 'balanced_loss': False, 'epochs': 65, 'early_stopping_patience': 24, 'plateau_patience': 19, 'plateau_divider': 3}. Best is trial 36 with value: 0.966858574697526.
[I 2025-02-23 08:52:59,270] Trial 296 finished with value: 0.9639241333502799 and parameters: {'left_stride': 64, 'right_stride': 32, 'attention_pooling_operation': 'max', 'embedding_pooling_operation': 'min', 'threshold': 0.8160113938230755, 'batch_size': 63, 'attention_heads': 11, 'hidden_dimension': 102, 'number_of_hidden_layers': 2, 'dropout_rate': 0.5716549947052384, 'global_pooling': 'max', 'learning_rate': 0.0005490736731500998, 'weight_decay': 5.24553466034071e-06, 'beta_0': 0.8594475347226679, 'beta_1': 0.9927513149573747, 'epsilon': 1.4528359422103528e-08, 'balanced_loss': False, 'epochs': 140, 'early_stopping_patience': 23, 'plateau_patience': 18, 'plateau_divider': 3}. Best is trial 36 with value: 0.966858574697526.
[I 2025-02-23 09:15:17,673] Trial 297 finished with value: 0.951161914036482 and parameters: {'left_stride': 64, 'right_stride': 32, 'attention_pooling_operation': 'max', 'embedding_pooling_operation': 'min', 'threshold': 0.8138943008788216, 'batch_size': 63, 'attention_heads': 11, 'hidden_dimension': 101, 'number_of_hidden_layers': 2, 'dropout_rate': 0.5693958865164335, 'global_pooling': 'max', 'learning_rate': 0.0006564983892394096, 'weight_decay': 3.152785349140387e-06, 'beta_0': 0.8579108748112249, 'beta_1': 0.9928780725353862, 'epsilon': 1.2767641201576213e-08, 'balanced_loss': False, 'epochs': 143, 'early_stopping_patience': 23, 'plateau_patience': 18, 'plateau_divider': 3}. Best is trial 36 with value: 0.966858574697526.
[I 2025-02-23 09:29:54,084] Trial 298 finished with value: 0.9524025201748054 and parameters: {'left_stride': 64, 'right_stride': 0, 'attention_pooling_operation': 'max', 'embedding_pooling_operation': 'min', 'threshold': 0.9001974940180065, 'batch_size': 67, 'attention_heads': 11, 'hidden_dimension': 90, 'number_of_hidden_layers': 2, 'dropout_rate': 0.5718075584324974, 'global_pooling': 'max', 'learning_rate': 0.0008805938219117012, 'weight_decay': 4.8470663335103116e-05, 'beta_0': 0.8591396367855234, 'beta_1': 0.9925140546809037, 'epsilon': 1.2993998641081584e-08, 'balanced_loss': False, 'epochs': 140, 'early_stopping_patience': 20, 'plateau_patience': 18, 'plateau_divider': 3}. Best is trial 36 with value: 0.966858574697526.
CUDA out of memory. Tried to allocate 3.34 GiB. GPU 0 has a total capacity of 44.56 GiB of which 1.72 GiB is free. Including non-PyTorch memory, this process has 42.84 GiB memory in use. Of the allocated memory 41.44 GiB is allocated by PyTorch, and 255.43 MiB is reserved by PyTorch but unallocated. If reserved but unallocated memory is large try setting PYTORCH_CUDA_ALLOC_CONF=expandable_segments:True to avoid fragmentation.  See documentation for Memory Management  (https://pytorch.org/docs/stable/notes/cuda.html#environment-variables)
[I 2025-02-23 09:36:48,355] Trial 299 finished with value: -1.0 and parameters: {'left_stride': 64, 'right_stride': 32, 'attention_pooling_operation': 'max', 'embedding_pooling_operation': 'min', 'threshold': 0.7950186473604686, 'batch_size': 78, 'attention_heads': 11, 'hidden_dimension': 108, 'number_of_hidden_layers': 2, 'dropout_rate': 0.5778693289456123, 'global_pooling': 'sum', 'learning_rate': 0.0005727832589590144, 'weight_decay': 2.7037093377624727e-06, 'beta_0': 0.8547025906621644, 'beta_1': 0.9924994429703298, 'epsilon': 1.7133129911437322e-08, 'balanced_loss': False, 'epochs': 146, 'early_stopping_patience': 23, 'plateau_patience': 18, 'plateau_divider': 3}. Best is trial 36 with value: 0.966858574697526.
[I 2025-02-23 09:56:39,272] Trial 300 finished with value: 0.953955157306305 and parameters: {'left_stride': 64, 'right_stride': 64, 'attention_pooling_operation': 'max', 'embedding_pooling_operation': 'min', 'threshold': 0.80599611983679, 'batch_size': 61, 'attention_heads': 11, 'hidden_dimension': 95, 'number_of_hidden_layers': 2, 'dropout_rate': 0.5933656940458065, 'global_pooling': 'max', 'learning_rate': 0.0011162599744580157, 'weight_decay': 5.451005080347649e-05, 'beta_0': 0.8553281349861319, 'beta_1': 0.9931222084252145, 'epsilon': 2.2199605140410256e-08, 'balanced_loss': False, 'epochs': 140, 'early_stopping_patience': 23, 'plateau_patience': 18, 'plateau_divider': 3}. Best is trial 36 with value: 0.966858574697526.
