[I 2025-02-23 15:03:38,846] Trial 322 finished with value: 0.9510975651245046 and parameters: {'left_stride': 64, 'right_stride': 0, 'attention_pooling_operation': 'max', 'embedding_pooling_operation': 'min', 'threshold': 0.8333670881214965, 'batch_size': 81, 'attention_heads': 10, 'hidden_dimension': 101, 'number_of_hidden_layers': 2, 'dropout_rate': 0.5998566017638592, 'global_pooling': 'max', 'learning_rate': 0.0008992149871600284, 'weight_decay': 8.626963465976662e-05, 'beta_0': 0.864011530883716, 'beta_1': 0.9914540009157515, 'epsilon': 2.0512397306533742e-08, 'balanced_loss': False, 'epochs': 147, 'early_stopping_patience': 23, 'plateau_patience': 18, 'plateau_divider': 3}. Best is trial 36 with value: 0.966858574697526.

[TRIAL] 36 [VALIDATION PERFORMANCE] 0.966858574697526 [TRAINING LOSS] 0.00923021720134582 [VALIDATION LOSS] 0.10200644160310428 

number                                      36
value                                 0.966859
params_threshold                      0.784221
params_attention_heads                      12
params_balanced_loss                     False
params_embedding_pooling_operation        mean
params_attention_pooling_operation         min
params_batch_size                          125
params_dropout_rate                   0.589338
params_early_stopping_patience              23
params_epochs                              161
params_global_pooling                      max
params_hidden_dimension                     53
params_learning_rate                   0.00073
params_number_of_hidden_layers               1
params_plateau_divider                       5
params_plateau_patience                     20
params_weight_decay                   0.000033
params_beta_0                         0.866316
params_beta_1                         0.989715
params_epsilon                        0.000027
user_attrs_epoch                          40.0
user_attrs_training_loss               0.00923
user_attrs_validation_loss            0.102006
params_left_stride                          64
params_right_stride                         32
Name: 36, dtype: object
37 Val: 0.9443999586143679 Test: 0.9452117793407238
38 Val: 0.9536603188838721 Test: 0.9398625011933768
39 Val: 0.9442013384637556 Test: 0.9233642435572791
40 Val: 0.949558111163791 Test: 0.9391107670234313
41 Val: 0.9525650501300333 Test: 0.9364905740968067
42 Val: 0.9579911371791188 Test: 0.9358157765615963
slurmstepd: error: *** JOB 15004848 ON gpu013 CANCELLED AT 2025-02-23T16:29:40 DUE TO TIME LIMIT ***
