[I 2025-02-23 10:21:11,403] Trial 301 finished with value: 0.9572680056183652 and parameters: {'left_stride': 64, 'right_stride': 32, 'attention_pooling_operation': 'max', 'embedding_pooling_operation': 'min', 'threshold': 0.819270764304446, 'batch_size': 67, 'attention_heads': 11, 'hidden_dimension': 106, 'number_of_hidden_layers': 2, 'dropout_rate': 0.5861368936826903, 'global_pooling': 'max', 'learning_rate': 0.0007356983848341112, 'weight_decay': 8.600269979891797e-05, 'beta_0': 0.8526760547669414, 'beta_1': 0.9921366880688864, 'epsilon': 2.2647188384633818e-08, 'balanced_loss': False, 'epochs': 143, 'early_stopping_patience': 24, 'plateau_patience': 17, 'plateau_divider': 3}. Best is trial 36 with value: 0.966858574697526.
CUDA out of memory. Tried to allocate 4.40 GiB. GPU 0 has a total capacity of 44.56 GiB of which 2.78 GiB is free. Including non-PyTorch memory, this process has 41.78 GiB memory in use. Of the allocated memory 39.84 GiB is allocated by PyTorch, and 810.52 MiB is reserved by PyTorch but unallocated. If reserved but unallocated memory is large try setting PYTORCH_CUDA_ALLOC_CONF=expandable_segments:True to avoid fragmentation.  See documentation for Memory Management  (https://pytorch.org/docs/stable/notes/cuda.html#environment-variables)
[I 2025-02-23 10:27:10,861] Trial 302 finished with value: -1.0 and parameters: {'left_stride': 64, 'right_stride': 32, 'attention_pooling_operation': 'max', 'embedding_pooling_operation': 'min', 'threshold': 0.8195469891014391, 'batch_size': 193, 'attention_heads': 11, 'hidden_dimension': 104, 'number_of_hidden_layers': 2, 'dropout_rate': 0.5878650456506214, 'global_pooling': 'max', 'learning_rate': 0.0008012135686550648, 'weight_decay': 5.401686135076023e-06, 'beta_0': 0.8533287486348649, 'beta_1': 0.9921893242351563, 'epsilon': 1.9680036278831973e-08, 'balanced_loss': False, 'epochs': 144, 'early_stopping_patience': 24, 'plateau_patience': 17, 'plateau_divider': 3}. Best is trial 36 with value: 0.966858574697526.
CUDA out of memory. Tried to allocate 3.38 GiB. GPU 0 has a total capacity of 44.56 GiB of which 1.36 GiB is free. Including non-PyTorch memory, this process has 43.20 GiB memory in use. Of the allocated memory 41.83 GiB is allocated by PyTorch, and 216.02 MiB is reserved by PyTorch but unallocated. If reserved but unallocated memory is large try setting PYTORCH_CUDA_ALLOC_CONF=expandable_segments:True to avoid fragmentation.  See documentation for Memory Management  (https://pytorch.org/docs/stable/notes/cuda.html#environment-variables)
[I 2025-02-23 10:33:55,969] Trial 303 finished with value: -1.0 and parameters: {'left_stride': 64, 'right_stride': 0, 'attention_pooling_operation': 'max', 'embedding_pooling_operation': 'min', 'threshold': 0.8090913434422295, 'batch_size': 67, 'attention_heads': 11, 'hidden_dimension': 109, 'number_of_hidden_layers': 2, 'dropout_rate': 0.5998630601034026, 'global_pooling': 'max', 'learning_rate': 0.0007203691671702841, 'weight_decay': 8.220339807713128e-05, 'beta_0': 0.8585828217154721, 'beta_1': 0.9922288214085544, 'epsilon': 1.08357169601105e-08, 'balanced_loss': False, 'epochs': 147, 'early_stopping_patience': 25, 'plateau_patience': 16, 'plateau_divider': 3}. Best is trial 36 with value: 0.966858574697526.
CUDA out of memory. Tried to allocate 3.18 GiB. GPU 0 has a total capacity of 44.56 GiB of which 2.80 GiB is free. Including non-PyTorch memory, this process has 41.75 GiB memory in use. Of the allocated memory 39.70 GiB is allocated by PyTorch, and 926.25 MiB is reserved by PyTorch but unallocated. If reserved but unallocated memory is large try setting PYTORCH_CUDA_ALLOC_CONF=expandable_segments:True to avoid fragmentation.  See documentation for Memory Management  (https://pytorch.org/docs/stable/notes/cuda.html#environment-variables)
[I 2025-02-23 10:41:08,905] Trial 304 finished with value: -1.0 and parameters: {'left_stride': 64, 'right_stride': 32, 'attention_pooling_operation': 'mean', 'embedding_pooling_operation': 'min', 'threshold': 0.8157242418211399, 'batch_size': 134, 'attention_heads': 11, 'hidden_dimension': 104, 'number_of_hidden_layers': 2, 'dropout_rate': 0.5851367614310491, 'global_pooling': 'max', 'learning_rate': 0.0005243976777392627, 'weight_decay': 8.226835002786609e-05, 'beta_0': 0.8525347347971545, 'beta_1': 0.992835399068582, 'epsilon': 1.525045537191355e-08, 'balanced_loss': False, 'epochs': 138, 'early_stopping_patience': 23, 'plateau_patience': 17, 'plateau_divider': 3}. Best is trial 36 with value: 0.966858574697526.
CUDA out of memory. Tried to allocate 3.22 GiB. GPU 0 has a total capacity of 44.56 GiB of which 2.82 GiB is free. Including non-PyTorch memory, this process has 41.74 GiB memory in use. Of the allocated memory 40.04 GiB is allocated by PyTorch, and 558.89 MiB is reserved by PyTorch but unallocated. If reserved but unallocated memory is large try setting PYTORCH_CUDA_ALLOC_CONF=expandable_segments:True to avoid fragmentation.  See documentation for Memory Management  (https://pytorch.org/docs/stable/notes/cuda.html#environment-variables)
[I 2025-02-23 10:48:17,918] Trial 305 finished with value: -1.0 and parameters: {'left_stride': 64, 'right_stride': 32, 'attention_pooling_operation': 'max', 'embedding_pooling_operation': 'min', 'threshold': 0.800054148089391, 'batch_size': 71, 'attention_heads': 10, 'hidden_dimension': 111, 'number_of_hidden_layers': 2, 'dropout_rate': 0.5921451395219125, 'global_pooling': 'max', 'learning_rate': 0.0003602692014858494, 'weight_decay': 6.805871148703845e-05, 'beta_0': 0.860003066961451, 'beta_1': 0.9919405402900323, 'epsilon': 2.5406990464152036e-08, 'balanced_loss': False, 'epochs': 143, 'early_stopping_patience': 24, 'plateau_patience': 17, 'plateau_divider': 3}. Best is trial 36 with value: 0.966858574697526.
CUDA out of memory. Tried to allocate 3.00 GiB. GPU 0 has a total capacity of 44.56 GiB of which 2.72 GiB is free. Including non-PyTorch memory, this process has 41.83 GiB memory in use. Of the allocated memory 37.53 GiB is allocated by PyTorch, and 3.15 GiB is reserved by PyTorch but unallocated. If reserved but unallocated memory is large try setting PYTORCH_CUDA_ALLOC_CONF=expandable_segments:True to avoid fragmentation.  See documentation for Memory Management  (https://pytorch.org/docs/stable/notes/cuda.html#environment-variables)
[I 2025-02-23 10:58:05,185] Trial 306 finished with value: -1.0 and parameters: {'left_stride': 64, 'right_stride': 0, 'attention_pooling_operation': 'min', 'embedding_pooling_operation': 'min', 'threshold': 0.824550402215234, 'batch_size': 89, 'attention_heads': 10, 'hidden_dimension': 100, 'number_of_hidden_layers': 2, 'dropout_rate': 0.5944953759382083, 'global_pooling': 'mean', 'learning_rate': 0.0010062325325155671, 'weight_decay': 9.48371852399786e-05, 'beta_0': 0.8550399042474341, 'beta_1': 0.9915520102815314, 'epsilon': 1.3893173564751513e-08, 'balanced_loss': False, 'epochs': 141, 'early_stopping_patience': 23, 'plateau_patience': 18, 'plateau_divider': 3}. Best is trial 36 with value: 0.966858574697526.
[I 2025-02-23 11:17:40,853] Trial 307 finished with value: 0.9466808116413805 and parameters: {'left_stride': 64, 'right_stride': 32, 'attention_pooling_operation': 'max', 'embedding_pooling_operation': 'min', 'threshold': 0.8288580531527914, 'batch_size': 58, 'attention_heads': 11, 'hidden_dimension': 106, 'number_of_hidden_layers': 2, 'dropout_rate': 0.58248524994793, 'global_pooling': 'max', 'learning_rate': 0.0006192940876084337, 'weight_decay': 5.490943194338108e-06, 'beta_0': 0.851750026308912, 'beta_1': 0.9920475434312253, 'epsilon': 2.0451668038923394e-08, 'balanced_loss': False, 'epochs': 190, 'early_stopping_patience': 24, 'plateau_patience': 17, 'plateau_divider': 2}. Best is trial 36 with value: 0.966858574697526.
CUDA out of memory. Tried to allocate 3.24 GiB. GPU 0 has a total capacity of 44.56 GiB of which 2.55 GiB is free. Including non-PyTorch memory, this process has 42.00 GiB memory in use. Of the allocated memory 40.27 GiB is allocated by PyTorch, and 597.14 MiB is reserved by PyTorch but unallocated. If reserved but unallocated memory is large try setting PYTORCH_CUDA_ALLOC_CONF=expandable_segments:True to avoid fragmentation.  See documentation for Memory Management  (https://pytorch.org/docs/stable/notes/cuda.html#environment-variables)
[I 2025-02-23 11:24:29,685] Trial 308 finished with value: -1.0 and parameters: {'left_stride': 64, 'right_stride': 32, 'attention_pooling_operation': 'max', 'embedding_pooling_operation': 'min', 'threshold': 0.8126308985123569, 'batch_size': 64, 'attention_heads': 11, 'hidden_dimension': 111, 'number_of_hidden_layers': 2, 'dropout_rate': 0.5765645470512814, 'global_pooling': 'max', 'learning_rate': 0.0004470165704865112, 'weight_decay': 5.868837581495365e-05, 'beta_0': 0.8558582611772877, 'beta_1': 0.9934029444358086, 'epsilon': 3.8315949235621535e-08, 'balanced_loss': True, 'epochs': 135, 'early_stopping_patience': 23, 'plateau_patience': 18, 'plateau_divider': 3}. Best is trial 36 with value: 0.966858574697526.
[I 2025-02-23 11:43:12,778] Trial 309 finished with value: 0.9588135204053078 and parameters: {'left_stride': 64, 'right_stride': 0, 'attention_pooling_operation': 'max', 'embedding_pooling_operation': 'min', 'threshold': 0.8213037912894638, 'batch_size': 74, 'attention_heads': 11, 'hidden_dimension': 100, 'number_of_hidden_layers': 2, 'dropout_rate': 0.5885893068077356, 'global_pooling': 'max', 'learning_rate': 0.0002919867147455458, 'weight_decay': 4.547300192579648e-05, 'beta_0': 0.8572482084934192, 'beta_1': 0.9925997308696919, 'epsilon': 1.1401630144669356e-08, 'balanced_loss': False, 'epochs': 148, 'early_stopping_patience': 23, 'plateau_patience': 22, 'plateau_divider': 3}. Best is trial 36 with value: 0.966858574697526.
[I 2025-02-23 11:54:10,471] Trial 310 finished with value: 0.9458750751531602 and parameters: {'left_stride': 64, 'right_stride': 0, 'attention_pooling_operation': 'max', 'embedding_pooling_operation': 'min', 'threshold': 0.8251486537670709, 'batch_size': 83, 'attention_heads': 11, 'hidden_dimension': 98, 'number_of_hidden_layers': 0, 'dropout_rate': 0.5890106735558376, 'global_pooling': 'max', 'learning_rate': 0.0006968599863320463, 'weight_decay': 6.881247568953021e-05, 'beta_0': 0.8574716264883995, 'beta_1': 0.9925077870371481, 'epsilon': 1.1316660524245207e-08, 'balanced_loss': False, 'epochs': 149, 'early_stopping_patience': 23, 'plateau_patience': 22, 'plateau_divider': 3}. Best is trial 36 with value: 0.966858574697526.
[I 2025-02-23 12:13:37,011] Trial 311 finished with value: 0.9558279101682672 and parameters: {'left_stride': 64, 'right_stride': 0, 'attention_pooling_operation': 'max', 'embedding_pooling_operation': 'min', 'threshold': 0.8206818064982332, 'batch_size': 76, 'attention_heads': 11, 'hidden_dimension': 101, 'number_of_hidden_layers': 2, 'dropout_rate': 0.5953552223962219, 'global_pooling': 'max', 'learning_rate': 0.0005317898643988767, 'weight_decay': 8.903695659120072e-05, 'beta_0': 0.8588411896641195, 'beta_1': 0.9928697516258971, 'epsilon': 1.3452105236673773e-08, 'balanced_loss': False, 'epochs': 139, 'early_stopping_patience': 24, 'plateau_patience': 22, 'plateau_divider': 3}. Best is trial 36 with value: 0.966858574697526.
[I 2025-02-23 12:32:35,011] Trial 312 finished with value: 0.9483227546953417 and parameters: {'left_stride': 64, 'right_stride': 0, 'attention_pooling_operation': 'max', 'embedding_pooling_operation': 'min', 'threshold': 0.8320469137430213, 'batch_size': 77, 'attention_heads': 11, 'hidden_dimension': 98, 'number_of_hidden_layers': 2, 'dropout_rate': 0.5998131658040519, 'global_pooling': 'max', 'learning_rate': 0.0003770552866851544, 'weight_decay': 7.905543774731563e-05, 'beta_0': 0.8594985622191522, 'beta_1': 0.9930599475515229, 'epsilon': 1.761840286976066e-08, 'balanced_loss': False, 'epochs': 137, 'early_stopping_patience': 23, 'plateau_patience': 22, 'plateau_divider': 3}. Best is trial 36 with value: 0.966858574697526.
CUDA out of memory. Tried to allocate 3.19 GiB. GPU 0 has a total capacity of 44.56 GiB of which 3.15 GiB is free. Including non-PyTorch memory, this process has 41.40 GiB memory in use. Of the allocated memory 39.64 GiB is allocated by PyTorch, and 625.61 MiB is reserved by PyTorch but unallocated. If reserved but unallocated memory is large try setting PYTORCH_CUDA_ALLOC_CONF=expandable_segments:True to avoid fragmentation.  See documentation for Memory Management  (https://pytorch.org/docs/stable/notes/cuda.html#environment-variables)
[I 2025-02-23 12:39:14,458] Trial 313 finished with value: -1.0 and parameters: {'left_stride': 64, 'right_stride': 0, 'attention_pooling_operation': 'max', 'embedding_pooling_operation': 'min', 'threshold': 0.8226797029556652, 'batch_size': 81, 'attention_heads': 11, 'hidden_dimension': 102, 'number_of_hidden_layers': 2, 'dropout_rate': 0.5895953428693504, 'global_pooling': 'sum', 'learning_rate': 0.0005329603816870535, 'weight_decay': 5.2229034004476444e-05, 'beta_0': 0.8611859769772309, 'beta_1': 0.9927467426131383, 'epsilon': 1.3118889351376285e-08, 'balanced_loss': False, 'epochs': 139, 'early_stopping_patience': 22, 'plateau_patience': 22, 'plateau_divider': 3}. Best is trial 36 with value: 0.966858574697526.
[I 2025-02-23 12:58:09,986] Trial 314 finished with value: 0.951095056330135 and parameters: {'left_stride': 64, 'right_stride': 0, 'attention_pooling_operation': 'max', 'embedding_pooling_operation': 'min', 'threshold': 0.8317135673654532, 'batch_size': 71, 'attention_heads': 12, 'hidden_dimension': 93, 'number_of_hidden_layers': 2, 'dropout_rate': 0.5942100253377184, 'global_pooling': 'max', 'learning_rate': 0.000481626531911128, 'weight_decay': 8.943144492665087e-05, 'beta_0': 0.8563198323747595, 'beta_1': 0.9933170129813842, 'epsilon': 1.176963187890799e-08, 'balanced_loss': False, 'epochs': 145, 'early_stopping_patience': 24, 'plateau_patience': 24, 'plateau_divider': 3}. Best is trial 36 with value: 0.966858574697526.
CUDA out of memory. Tried to allocate 3.50 GiB. GPU 0 has a total capacity of 44.56 GiB of which 3.14 GiB is free. Including non-PyTorch memory, this process has 41.41 GiB memory in use. Of the allocated memory 39.61 GiB is allocated by PyTorch, and 670.73 MiB is reserved by PyTorch but unallocated. If reserved but unallocated memory is large try setting PYTORCH_CUDA_ALLOC_CONF=expandable_segments:True to avoid fragmentation.  See documentation for Memory Management  (https://pytorch.org/docs/stable/notes/cuda.html#environment-variables)
[I 2025-02-23 13:04:52,026] Trial 315 finished with value: -1.0 and parameters: {'left_stride': 64, 'right_stride': 0, 'attention_pooling_operation': 'min', 'embedding_pooling_operation': 'min', 'threshold': 0.8171722330843871, 'batch_size': 86, 'attention_heads': 11, 'hidden_dimension': 103, 'number_of_hidden_layers': 2, 'dropout_rate': 0.3556325156614351, 'global_pooling': 'max', 'learning_rate': 0.00032178539021473276, 'weight_decay': 4.6426726205989656e-05, 'beta_0': 0.853485957103326, 'beta_1': 0.9922641225627911, 'epsilon': 1.5623508942403967e-08, 'balanced_loss': False, 'epochs': 135, 'early_stopping_patience': 22, 'plateau_patience': 23, 'plateau_divider': 3}. Best is trial 36 with value: 0.966858574697526.
[I 2025-02-23 13:25:26,654] Trial 316 finished with value: 0.9509012589793224 and parameters: {'left_stride': 64, 'right_stride': 0, 'attention_pooling_operation': 'max', 'embedding_pooling_operation': 'min', 'threshold': 0.82337849383552, 'batch_size': 77, 'attention_heads': 11, 'hidden_dimension': 94, 'number_of_hidden_layers': 2, 'dropout_rate': 0.5855054589067981, 'global_pooling': 'max', 'learning_rate': 0.0003988575078401198, 'weight_decay': 6.401648975384462e-05, 'beta_0': 0.8580672117948858, 'beta_1': 0.9919060740682576, 'epsilon': 1.2899883629598904e-08, 'balanced_loss': False, 'epochs': 149, 'early_stopping_patience': 23, 'plateau_patience': 17, 'plateau_divider': 3}. Best is trial 36 with value: 0.966858574697526.
[I 2025-02-23 13:47:09,527] Trial 317 finished with value: 0.9508231485464889 and parameters: {'left_stride': 64, 'right_stride': 0, 'attention_pooling_operation': 'mean', 'embedding_pooling_operation': 'min', 'threshold': 0.8349215109620133, 'batch_size': 75, 'attention_heads': 10, 'hidden_dimension': 88, 'number_of_hidden_layers': 2, 'dropout_rate': 0.5776175977710419, 'global_pooling': 'max', 'learning_rate': 0.00026980468441531387, 'weight_decay': 7.509765499730612e-05, 'beta_0': 0.8598409603682262, 'beta_1': 0.9926331635084339, 'epsilon': 1.5179011909787775e-08, 'balanced_loss': False, 'epochs': 152, 'early_stopping_patience': 23, 'plateau_patience': 16, 'plateau_divider': 3}. Best is trial 36 with value: 0.966858574697526.
[I 2025-02-23 14:11:36,500] Trial 318 finished with value: 0.9500767882212603 and parameters: {'left_stride': 64, 'right_stride': 0, 'attention_pooling_operation': 'max', 'embedding_pooling_operation': 'min', 'threshold': 0.8270775290757337, 'batch_size': 71, 'attention_heads': 10, 'hidden_dimension': 117, 'number_of_hidden_layers': 2, 'dropout_rate': 0.594597908875934, 'global_pooling': 'max', 'learning_rate': 0.0005406594861370479, 'weight_decay': 5.5192470338668094e-05, 'beta_0': 0.8565316126005703, 'beta_1': 0.9915733817234957, 'epsilon': 2.6519875526138388e-08, 'balanced_loss': False, 'epochs': 140, 'early_stopping_patience': 23, 'plateau_patience': 17, 'plateau_divider': 3}. Best is trial 36 with value: 0.966858574697526.
[I 2025-02-23 14:29:44,589] Trial 319 finished with value: 0.9426677998648062 and parameters: {'left_stride': 64, 'right_stride': 0, 'attention_pooling_operation': 'max', 'embedding_pooling_operation': 'min', 'threshold': 0.8415241179890883, 'batch_size': 67, 'attention_heads': 11, 'hidden_dimension': 106, 'number_of_hidden_layers': 2, 'dropout_rate': 0.584212419896849, 'global_pooling': 'max', 'learning_rate': 0.00043275218187720606, 'weight_decay': 3.196554799415632e-05, 'beta_0': 0.8618763012629207, 'beta_1': 0.9923067399901461, 'epsilon': 6.291557731435621e-08, 'balanced_loss': False, 'epochs': 143, 'early_stopping_patience': 23, 'plateau_patience': 22, 'plateau_divider': 2}. Best is trial 36 with value: 0.966858574697526.
CUDA out of memory. Tried to allocate 3.23 GiB. GPU 0 has a total capacity of 44.56 GiB of which 2.63 GiB is free. Including non-PyTorch memory, this process has 41.92 GiB memory in use. Of the allocated memory 40.19 GiB is allocated by PyTorch, and 596.20 MiB is reserved by PyTorch but unallocated. If reserved but unallocated memory is large try setting PYTORCH_CUDA_ALLOC_CONF=expandable_segments:True to avoid fragmentation.  See documentation for Memory Management  (https://pytorch.org/docs/stable/notes/cuda.html#environment-variables)
[I 2025-02-23 14:36:59,433] Trial 320 finished with value: -1.0 and parameters: {'left_stride': 256, 'right_stride': 0, 'attention_pooling_operation': 'max', 'embedding_pooling_operation': 'min', 'threshold': 0.8038656613675177, 'batch_size': 74, 'attention_heads': 11, 'hidden_dimension': 97, 'number_of_hidden_layers': 2, 'dropout_rate': 0.5705898786736991, 'global_pooling': 'max', 'learning_rate': 0.0006123060596883008, 'weight_decay': 8.001823701360805e-06, 'beta_0': 0.8545251954616919, 'beta_1': 0.9912479790273058, 'epsilon': 1.161223319276473e-08, 'balanced_loss': False, 'epochs': 137, 'early_stopping_patience': 25, 'plateau_patience': 23, 'plateau_divider': 3}. Best is trial 36 with value: 0.966858574697526.
CUDA out of memory. Tried to allocate 3.39 GiB. GPU 0 has a total capacity of 44.56 GiB of which 654.69 MiB is free. Including non-PyTorch memory, this process has 43.91 GiB memory in use. Of the allocated memory 41.90 GiB is allocated by PyTorch, and 888.73 MiB is reserved by PyTorch but unallocated. If reserved but unallocated memory is large try setting PYTORCH_CUDA_ALLOC_CONF=expandable_segments:True to avoid fragmentation.  See documentation for Memory Management  (https://pytorch.org/docs/stable/notes/cuda.html#environment-variables)
[I 2025-02-23 14:43:53,259] Trial 321 finished with value: -1.0 and parameters: {'left_stride': 64, 'right_stride': 64, 'attention_pooling_operation': 'max', 'embedding_pooling_operation': 'mean', 'threshold': 0.8162051515859154, 'batch_size': 66, 'attention_heads': 12, 'hidden_dimension': 113, 'number_of_hidden_layers': 2, 'dropout_rate': 0.5893985800856151, 'global_pooling': 'max', 'learning_rate': 0.0003524767960007465, 'weight_decay': 4.4059157526421716e-05, 'beta_0': 0.85314412172137, 'beta_1': 0.9928550660532278, 'epsilon': 1.0585124663945148e-08, 'balanced_loss': False, 'epochs': 131, 'early_stopping_patience': 23, 'plateau_patience': 17, 'plateau_divider': 3}. Best is trial 36 with value: 0.966858574697526.
