[I 2024-11-29 10:43:01,309] Trial 143 finished with value: 0.6375650943648382 and parameters: {'left_stride': 32, 'right_stride': 256, 'attention_pooling_operation': 'max', 'embedding_pooling_operation': 'mean', 'threshold': 0.9107296804175302, 'batch_size': 62, 'attention_heads': 10, 'hidden_dimension': 113, 'number_of_hidden_layers': 2, 'dropout_rate': 0.48510600645554036, 'global_pooling': 'max', 'learning_rate': 0.0005659151214131624, 'weight_decay': 4.613901108375028e-05, 'beta_0': 0.851164110676872, 'beta_1': 0.9986316260121797, 'epsilon': 4.627524252386476e-05, 'balanced_loss': False, 'epochs': 110, 'early_stopping_patience': 21, 'plateau_patience': 12, 'plateau_divider': 2}. Best is trial 91 with value: 0.647956342753587.
[I 2024-11-29 10:55:23,243] Trial 144 finished with value: 0.6068521091876559 and parameters: {'left_stride': 32, 'right_stride': 256, 'attention_pooling_operation': 'max', 'embedding_pooling_operation': 'mean', 'threshold': 0.9077893211939124, 'batch_size': 63, 'attention_heads': 10, 'hidden_dimension': 114, 'number_of_hidden_layers': 2, 'dropout_rate': 0.48575501206531657, 'global_pooling': 'max', 'learning_rate': 0.00043538222938920224, 'weight_decay': 5.681366762152782e-05, 'beta_0': 0.8515135305218035, 'beta_1': 0.9987049541354509, 'epsilon': 4.7444724057328005e-05, 'balanced_loss': False, 'epochs': 110, 'early_stopping_patience': 22, 'plateau_patience': 13, 'plateau_divider': 2}. Best is trial 91 with value: 0.647956342753587.
The selected strides are greater or equal to the total chunk size.
[I 2024-11-29 10:55:24,731] Trial 145 finished with value: -1.0 and parameters: {'left_stride': 256, 'right_stride': 256, 'attention_pooling_operation': 'max', 'embedding_pooling_operation': 'mean', 'threshold': 0.8977791095014584, 'batch_size': 67, 'attention_heads': 11, 'hidden_dimension': 97, 'number_of_hidden_layers': 2, 'dropout_rate': 0.46637256438192093, 'global_pooling': 'max', 'learning_rate': 0.00025199059507187557, 'weight_decay': 1.8688987999721452e-05, 'beta_0': 0.8548054027208066, 'beta_1': 0.9989686155700859, 'epsilon': 5.596117147378619e-05, 'balanced_loss': False, 'epochs': 113, 'early_stopping_patience': 23, 'plateau_patience': 11, 'plateau_divider': 2}. Best is trial 91 with value: 0.647956342753587.
[I 2024-11-29 11:15:44,100] Trial 146 finished with value: 0.5248527943038406 and parameters: {'left_stride': 32, 'right_stride': 256, 'attention_pooling_operation': 'max', 'embedding_pooling_operation': 'mean', 'threshold': 0.9119288565965316, 'batch_size': 62, 'attention_heads': 10, 'hidden_dimension': 106, 'number_of_hidden_layers': 2, 'dropout_rate': 0.4567707668782086, 'global_pooling': 'max', 'learning_rate': 2.0093459031116522e-05, 'weight_decay': 3.6287583287800126e-05, 'beta_0': 0.8495417860721135, 'beta_1': 0.9968911385380095, 'epsilon': 2.069663368365245e-05, 'balanced_loss': False, 'epochs': 118, 'early_stopping_patience': 22, 'plateau_patience': 12, 'plateau_divider': 2}. Best is trial 91 with value: 0.647956342753587.
[I 2024-11-29 11:28:23,396] Trial 147 finished with value: 0.5981810572004094 and parameters: {'left_stride': 32, 'right_stride': 0, 'attention_pooling_operation': 'mean', 'embedding_pooling_operation': 'mean', 'threshold': 0.8991632091816251, 'batch_size': 52, 'attention_heads': 11, 'hidden_dimension': 111, 'number_of_hidden_layers': 2, 'dropout_rate': 0.4733341934863799, 'global_pooling': 'max', 'learning_rate': 0.0005704016155380434, 'weight_decay': 4.7870332575472974e-05, 'beta_0': 0.8453240913596348, 'beta_1': 0.9942328835988348, 'epsilon': 2.6525873635765264e-05, 'balanced_loss': False, 'epochs': 122, 'early_stopping_patience': 21, 'plateau_patience': 13, 'plateau_divider': 3}. Best is trial 91 with value: 0.647956342753587.
[I 2024-11-29 11:38:50,996] Trial 148 finished with value: 0.5995131766917169 and parameters: {'left_stride': 32, 'right_stride': 256, 'attention_pooling_operation': 'max', 'embedding_pooling_operation': 'mean', 'threshold': 0.9351451114120598, 'batch_size': 65, 'attention_heads': 8, 'hidden_dimension': 116, 'number_of_hidden_layers': 2, 'dropout_rate': 0.43435701981592756, 'global_pooling': 'max', 'learning_rate': 0.0008208874011098959, 'weight_decay': 0.000629581447127171, 'beta_0': 0.853655495311924, 'beta_1': 0.9973896981170572, 'epsilon': 8.979363148348035e-05, 'balanced_loss': True, 'epochs': 129, 'early_stopping_patience': 23, 'plateau_patience': 12, 'plateau_divider': 2}. Best is trial 91 with value: 0.647956342753587.
[I 2024-11-29 11:51:34,346] Trial 149 finished with value: 0.6337548380076846 and parameters: {'left_stride': 32, 'right_stride': 256, 'attention_pooling_operation': 'max', 'embedding_pooling_operation': 'mean', 'threshold': 0.9035642259420347, 'batch_size': 68, 'attention_heads': 10, 'hidden_dimension': 121, 'number_of_hidden_layers': 2, 'dropout_rate': 0.4817648319238237, 'global_pooling': 'max', 'learning_rate': 0.00036716840322094087, 'weight_decay': 3.2122601012560203e-05, 'beta_0': 0.8380270963986785, 'beta_1': 0.9978352353535026, 'epsilon': 4.399811788356143e-05, 'balanced_loss': False, 'epochs': 110, 'early_stopping_patience': 21, 'plateau_patience': 13, 'plateau_divider': 6}. Best is trial 91 with value: 0.647956342753587.
[I 2024-11-29 12:04:16,771] Trial 150 finished with value: 0.6199080696103271 and parameters: {'left_stride': 32, 'right_stride': 256, 'attention_pooling_operation': 'max', 'embedding_pooling_operation': 'mean', 'threshold': 0.9036969210068467, 'batch_size': 68, 'attention_heads': 10, 'hidden_dimension': 110, 'number_of_hidden_layers': 2, 'dropout_rate': 0.47851357232112246, 'global_pooling': 'max', 'learning_rate': 0.0002999621222411456, 'weight_decay': 2.5281183812776266e-05, 'beta_0': 0.8472956384667747, 'beta_1': 0.997745446808851, 'epsilon': 4.5249083311626776e-05, 'balanced_loss': False, 'epochs': 109, 'early_stopping_patience': 21, 'plateau_patience': 15, 'plateau_divider': 6}. Best is trial 91 with value: 0.647956342753587.
[I 2024-11-29 12:16:30,073] Trial 151 finished with value: 0.6394856475797525 and parameters: {'left_stride': 32, 'right_stride': 256, 'attention_pooling_operation': 'max', 'embedding_pooling_operation': 'mean', 'threshold': 0.9099399394405451, 'batch_size': 59, 'attention_heads': 9, 'hidden_dimension': 121, 'number_of_hidden_layers': 2, 'dropout_rate': 0.4864499656294293, 'global_pooling': 'max', 'learning_rate': 0.0004029620266068401, 'weight_decay': 3.225689064341232e-05, 'beta_0': 0.8388828761265934, 'beta_1': 0.998267374434778, 'epsilon': 6.123959755278257e-05, 'balanced_loss': False, 'epochs': 105, 'early_stopping_patience': 21, 'plateau_patience': 13, 'plateau_divider': 6}. Best is trial 91 with value: 0.647956342753587.
[I 2024-11-29 12:29:06,043] Trial 152 finished with value: 0.6253623158923167 and parameters: {'left_stride': 32, 'right_stride': 256, 'attention_pooling_operation': 'max', 'embedding_pooling_operation': 'mean', 'threshold': 0.9099545923365823, 'batch_size': 60, 'attention_heads': 10, 'hidden_dimension': 125, 'number_of_hidden_layers': 2, 'dropout_rate': 0.4835869684038782, 'global_pooling': 'max', 'learning_rate': 0.00033956423404728393, 'weight_decay': 3.0066933292622872e-05, 'beta_0': 0.8382712668539295, 'beta_1': 0.9982418334593638, 'epsilon': 6.500781655785636e-05, 'balanced_loss': False, 'epochs': 104, 'early_stopping_patience': 21, 'plateau_patience': 13, 'plateau_divider': 6}. Best is trial 91 with value: 0.647956342753587.
[I 2024-11-29 12:41:33,907] Trial 153 finished with value: 0.6127255408870012 and parameters: {'left_stride': 32, 'right_stride': 256, 'attention_pooling_operation': 'max', 'embedding_pooling_operation': 'mean', 'threshold': 0.9110401550261621, 'batch_size': 62, 'attention_heads': 10, 'hidden_dimension': 126, 'number_of_hidden_layers': 2, 'dropout_rate': 0.49996873547108767, 'global_pooling': 'max', 'learning_rate': 0.0005328317045048829, 'weight_decay': 3.0416467431781735e-05, 'beta_0': 0.838113585843798, 'beta_1': 0.9981969651798084, 'epsilon': 6.911176364620944e-05, 'balanced_loss': False, 'epochs': 106, 'early_stopping_patience': 21, 'plateau_patience': 14, 'plateau_divider': 6}. Best is trial 91 with value: 0.647956342753587.
[I 2024-11-29 12:53:32,661] Trial 154 finished with value: 0.6199605238190984 and parameters: {'left_stride': 32, 'right_stride': 256, 'attention_pooling_operation': 'max', 'embedding_pooling_operation': 'mean', 'threshold': 0.9087032417172143, 'batch_size': 59, 'attention_heads': 10, 'hidden_dimension': 102, 'number_of_hidden_layers': 2, 'dropout_rate': 0.4840480127350562, 'global_pooling': 'max', 'learning_rate': 0.0003554293654125151, 'weight_decay': 3.3036547306626675e-05, 'beta_0': 0.840739524847048, 'beta_1': 0.996580179861144, 'epsilon': 5.8468717970342626e-05, 'balanced_loss': False, 'epochs': 116, 'early_stopping_patience': 21, 'plateau_patience': 13, 'plateau_divider': 6}. Best is trial 91 with value: 0.647956342753587.
[I 2024-11-29 13:06:28,243] Trial 155 finished with value: 0.6011277958267409 and parameters: {'left_stride': 32, 'right_stride': 256, 'attention_pooling_operation': 'max', 'embedding_pooling_operation': 'mean', 'threshold': 0.9153944898014956, 'batch_size': 64, 'attention_heads': 11, 'hidden_dimension': 121, 'number_of_hidden_layers': 2, 'dropout_rate': 0.4922375307280489, 'global_pooling': 'max', 'learning_rate': 0.00019313575127934284, 'weight_decay': 2.176005197079322e-05, 'beta_0': 0.8424127017448174, 'beta_1': 0.9971763722320872, 'epsilon': 8.105029426534884e-05, 'balanced_loss': False, 'epochs': 105, 'early_stopping_patience': 21, 'plateau_patience': 13, 'plateau_divider': 7}. Best is trial 91 with value: 0.647956342753587.
[I 2024-11-29 13:18:06,061] Trial 156 finished with value: 0.612817313826991 and parameters: {'left_stride': 32, 'right_stride': 256, 'attention_pooling_operation': 'max', 'embedding_pooling_operation': 'mean', 'threshold': 0.921458653750824, 'batch_size': 69, 'attention_heads': 10, 'hidden_dimension': 127, 'number_of_hidden_layers': 2, 'dropout_rate': 0.44766510460286957, 'global_pooling': 'max', 'learning_rate': 0.0006950785001844542, 'weight_decay': 2.5307025875340963e-05, 'beta_0': 0.8384541289095919, 'beta_1': 0.9983474339121499, 'epsilon': 7.002814777383873e-05, 'balanced_loss': False, 'epochs': 97, 'early_stopping_patience': 20, 'plateau_patience': 13, 'plateau_divider': 6}. Best is trial 91 with value: 0.647956342753587.
[I 2024-11-29 13:29:51,719] Trial 157 finished with value: 0.6317393077239067 and parameters: {'left_stride': 32, 'right_stride': 256, 'attention_pooling_operation': 'max', 'embedding_pooling_operation': 'mean', 'threshold': 0.9132215011456005, 'batch_size': 60, 'attention_heads': 10, 'hidden_dimension': 108, 'number_of_hidden_layers': 2, 'dropout_rate': 0.5140870979539407, 'global_pooling': 'max', 'learning_rate': 0.0004701130374025811, 'weight_decay': 2.8410432415681008e-05, 'beta_0': 0.8433557043197468, 'beta_1': 0.9975095005037796, 'epsilon': 5.0764104568574927e-05, 'balanced_loss': False, 'epochs': 104, 'early_stopping_patience': 20, 'plateau_patience': 14, 'plateau_divider': 7}. Best is trial 91 with value: 0.647956342753587.
[I 2024-11-29 13:40:26,851] Trial 158 finished with value: 0.4954989349442451 and parameters: {'left_stride': 32, 'right_stride': 256, 'attention_pooling_operation': 'max', 'embedding_pooling_operation': 'min', 'threshold': 0.9274192680577507, 'batch_size': 60, 'attention_heads': 9, 'hidden_dimension': 95, 'number_of_hidden_layers': 2, 'dropout_rate': 0.5181014091718031, 'global_pooling': 'sum', 'learning_rate': 0.0004947618700517427, 'weight_decay': 1.4470904335781275e-05, 'beta_0': 0.8426360089590452, 'beta_1': 0.9989596277627032, 'epsilon': 3.856231363424852e-05, 'balanced_loss': False, 'epochs': 104, 'early_stopping_patience': 20, 'plateau_patience': 12, 'plateau_divider': 7}. Best is trial 91 with value: 0.647956342753587.
[I 2024-11-29 13:52:54,524] Trial 159 finished with value: 0.5146058759993246 and parameters: {'left_stride': 32, 'right_stride': 256, 'attention_pooling_operation': 'min', 'embedding_pooling_operation': 'mean', 'threshold': 0.8948787887319423, 'batch_size': 58, 'attention_heads': 10, 'hidden_dimension': 106, 'number_of_hidden_layers': 2, 'dropout_rate': 0.5116281383626309, 'global_pooling': 'max', 'learning_rate': 0.0008701296690640274, 'weight_decay': 3.0212585101857164e-05, 'beta_0': 0.8437676052816679, 'beta_1': 0.9979504088672386, 'epsilon': 4.72790403239297e-05, 'balanced_loss': False, 'epochs': 112, 'early_stopping_patience': 21, 'plateau_patience': 14, 'plateau_divider': 7}. Best is trial 91 with value: 0.647956342753587.
[I 2024-11-29 14:04:38,212] Trial 160 finished with value: 0.6261384493796038 and parameters: {'left_stride': 32, 'right_stride': 256, 'attention_pooling_operation': 'max', 'embedding_pooling_operation': 'mean', 'threshold': 0.9055534875694325, 'batch_size': 55, 'attention_heads': 7, 'hidden_dimension': 135, 'number_of_hidden_layers': 2, 'dropout_rate': 0.4814800338611836, 'global_pooling': 'max', 'learning_rate': 0.0003065645162417211, 'weight_decay': 1.636157373973603e-05, 'beta_0': 0.8402963443014572, 'beta_1': 0.9986135623696665, 'epsilon': 3.181104454414132e-05, 'balanced_loss': False, 'epochs': 108, 'early_stopping_patience': 20, 'plateau_patience': 14, 'plateau_divider': 7}. Best is trial 91 with value: 0.647956342753587.
[I 2024-11-29 14:16:42,197] Trial 161 finished with value: 0.5973044787228323 and parameters: {'left_stride': 32, 'right_stride': 256, 'attention_pooling_operation': 'max', 'embedding_pooling_operation': 'mean', 'threshold': 0.904968534201125, 'batch_size': 61, 'attention_heads': 7, 'hidden_dimension': 134, 'number_of_hidden_layers': 2, 'dropout_rate': 0.4817696224946357, 'global_pooling': 'max', 'learning_rate': 0.00028878044605172364, 'weight_decay': 1.9309906238291682e-05, 'beta_0': 0.8409002510277922, 'beta_1': 0.998420413500443, 'epsilon': 3.1284122029594655e-05, 'balanced_loss': False, 'epochs': 108, 'early_stopping_patience': 20, 'plateau_patience': 14, 'plateau_divider': 7}. Best is trial 91 with value: 0.647956342753587.
[I 2024-11-29 14:27:40,627] Trial 162 finished with value: 0.6069420566222354 and parameters: {'left_stride': 32, 'right_stride': 256, 'attention_pooling_operation': 'max', 'embedding_pooling_operation': 'mean', 'threshold': 0.9172160146117897, 'batch_size': 55, 'attention_heads': 7, 'hidden_dimension': 120, 'number_of_hidden_layers': 2, 'dropout_rate': 0.5016352319211091, 'global_pooling': 'max', 'learning_rate': 0.0006165708250366522, 'weight_decay': 1.7016174539996975e-05, 'beta_0': 0.8388261506138306, 'beta_1': 0.9977133339938402, 'epsilon': 2.3654980464658038e-05, 'balanced_loss': False, 'epochs': 102, 'early_stopping_patience': 20, 'plateau_patience': 13, 'plateau_divider': 7}. Best is trial 91 with value: 0.647956342753587.
[I 2024-11-29 14:39:19,699] Trial 163 finished with value: 0.6190473989394156 and parameters: {'left_stride': 32, 'right_stride': 256, 'attention_pooling_operation': 'max', 'embedding_pooling_operation': 'mean', 'threshold': 0.9098157376552739, 'batch_size': 57, 'attention_heads': 6, 'hidden_dimension': 110, 'number_of_hidden_layers': 2, 'dropout_rate': 0.4724918521283926, 'global_pooling': 'max', 'learning_rate': 0.0002218733454020659, 'weight_decay': 1.2489186207754055e-05, 'beta_0': 0.8445135178911988, 'beta_1': 0.9985009656789168, 'epsilon': 5.357307174591286e-05, 'balanced_loss': False, 'epochs': 98, 'early_stopping_patience': 19, 'plateau_patience': 15, 'plateau_divider': 7}. Best is trial 91 with value: 0.647956342753587.
[I 2024-11-29 14:51:07,694] Trial 164 finished with value: 0.6277347222763202 and parameters: {'left_stride': 32, 'right_stride': 256, 'attention_pooling_operation': 'max', 'embedding_pooling_operation': 'mean', 'threshold': 0.9060478227900187, 'batch_size': 63, 'attention_heads': 9, 'hidden_dimension': 100, 'number_of_hidden_layers': 2, 'dropout_rate': 0.48701509979794183, 'global_pooling': 'max', 'learning_rate': 0.0004891399943050915, 'weight_decay': 2.6244798570145376e-05, 'beta_0': 0.8371414174219648, 'beta_1': 0.9918262114739671, 'epsilon': 3.6086078362241615e-05, 'balanced_loss': False, 'epochs': 108, 'early_stopping_patience': 21, 'plateau_patience': 14, 'plateau_divider': 6}. Best is trial 91 with value: 0.647956342753587.
[I 2024-11-29 15:03:00,595] Trial 165 finished with value: 0.6338306350237882 and parameters: {'left_stride': 128, 'right_stride': 256, 'attention_pooling_operation': 'max', 'embedding_pooling_operation': 'mean', 'threshold': 0.9004839806760441, 'batch_size': 63, 'attention_heads': 9, 'hidden_dimension': 102, 'number_of_hidden_layers': 2, 'dropout_rate': 0.47687434313670635, 'global_pooling': 'max', 'learning_rate': 0.0005401395218285862, 'weight_decay': 2.3456045511125288e-05, 'beta_0': 0.8360533878927937, 'beta_1': 0.9916712349401721, 'epsilon': 2.8247469633482154e-05, 'balanced_loss': False, 'epochs': 112, 'early_stopping_patience': 21, 'plateau_patience': 14, 'plateau_divider': 7}. Best is trial 91 with value: 0.647956342753587.
[I 2024-11-29 15:14:26,665] Trial 166 finished with value: 0.6286744812641799 and parameters: {'left_stride': 128, 'right_stride': 256, 'attention_pooling_operation': 'max', 'embedding_pooling_operation': 'mean', 'threshold': 0.8987768705111758, 'batch_size': 63, 'attention_heads': 9, 'hidden_dimension': 100, 'number_of_hidden_layers': 2, 'dropout_rate': 0.4961661373923094, 'global_pooling': 'max', 'learning_rate': 0.0007521772440720431, 'weight_decay': 2.670068983766458e-05, 'beta_0': 0.8367548353148749, 'beta_1': 0.9918959115546858, 'epsilon': 3.7588686573669655e-05, 'balanced_loss': False, 'epochs': 112, 'early_stopping_patience': 21, 'plateau_patience': 14, 'plateau_divider': 6}. Best is trial 91 with value: 0.647956342753587.
[I 2024-11-29 15:25:27,023] Trial 167 finished with value: 0.6215936966177772 and parameters: {'left_stride': 128, 'right_stride': 256, 'attention_pooling_operation': 'max', 'embedding_pooling_operation': 'mean', 'threshold': 0.9006454201492856, 'batch_size': 63, 'attention_heads': 9, 'hidden_dimension': 89, 'number_of_hidden_layers': 2, 'dropout_rate': 0.4951834168988958, 'global_pooling': 'mean', 'learning_rate': 0.0005496845733849468, 'weight_decay': 2.3423031995987805e-05, 'beta_0': 0.8364986057481298, 'beta_1': 0.9909354473771449, 'epsilon': 2.699792848503258e-05, 'balanced_loss': False, 'epochs': 112, 'early_stopping_patience': 21, 'plateau_patience': 15, 'plateau_divider': 7}. Best is trial 91 with value: 0.647956342753587.
[I 2024-11-29 15:36:46,080] Trial 168 finished with value: 0.6031945564535184 and parameters: {'left_stride': 128, 'right_stride': 256, 'attention_pooling_operation': 'max', 'embedding_pooling_operation': 'mean', 'threshold': 0.8963850403290466, 'batch_size': 65, 'attention_heads': 9, 'hidden_dimension': 98, 'number_of_hidden_layers': 2, 'dropout_rate': 0.5039931778637815, 'global_pooling': 'max', 'learning_rate': 0.0011039955105969909, 'weight_decay': 3.515546698488319e-05, 'beta_0': 0.8299739025758165, 'beta_1': 0.9918891496605365, 'epsilon': 3.790276891447732e-05, 'balanced_loss': False, 'epochs': 116, 'early_stopping_patience': 21, 'plateau_patience': 14, 'plateau_divider': 6}. Best is trial 91 with value: 0.647956342753587.
[I 2024-11-29 15:48:34,684] Trial 169 finished with value: 0.6085814148066214 and parameters: {'left_stride': 128, 'right_stride': 256, 'attention_pooling_operation': 'max', 'embedding_pooling_operation': 'mean', 'threshold': 0.8893298472761604, 'batch_size': 62, 'attention_heads': 8, 'hidden_dimension': 102, 'number_of_hidden_layers': 2, 'dropout_rate': 0.4901175944421627, 'global_pooling': 'max', 'learning_rate': 0.00048595536606332754, 'weight_decay': 2.774811024016596e-05, 'beta_0': 0.835867436353227, 'beta_1': 0.9915840887653302, 'epsilon': 2.214984665240711e-05, 'balanced_loss': False, 'epochs': 113, 'early_stopping_patience': 22, 'plateau_patience': 14, 'plateau_divider': 6}. Best is trial 91 with value: 0.647956342753587.
[I 2024-11-29 15:59:25,000] Trial 170 finished with value: 0.6085724541979604 and parameters: {'left_stride': 128, 'right_stride': 256, 'attention_pooling_operation': 'max', 'embedding_pooling_operation': 'mean', 'threshold': 0.9018563288457073, 'batch_size': 66, 'attention_heads': 9, 'hidden_dimension': 82, 'number_of_hidden_layers': 2, 'dropout_rate': 0.4761436408387009, 'global_pooling': 'max', 'learning_rate': 0.000770742946592971, 'weight_decay': 5.498746200734833e-06, 'beta_0': 0.8344139586607021, 'beta_1': 0.9929051188025725, 'epsilon': 1.531992041048479e-05, 'balanced_loss': True, 'epochs': 94, 'early_stopping_patience': 21, 'plateau_patience': 12, 'plateau_divider': 6}. Best is trial 91 with value: 0.647956342753587.
[I 2024-11-29 16:11:10,312] Trial 171 finished with value: 0.630138541796514 and parameters: {'left_stride': 128, 'right_stride': 256, 'attention_pooling_operation': 'max', 'embedding_pooling_operation': 'mean', 'threshold': 0.9144950513336908, 'batch_size': 63, 'attention_heads': 9, 'hidden_dimension': 105, 'number_of_hidden_layers': 2, 'dropout_rate': 0.48752336752224235, 'global_pooling': 'max', 'learning_rate': 0.0006698931384675058, 'weight_decay': 2.591731196980635e-05, 'beta_0': 0.8421749183409989, 'beta_1': 0.9906454817561173, 'epsilon': 3.000490089444832e-06, 'balanced_loss': False, 'epochs': 107, 'early_stopping_patience': 21, 'plateau_patience': 13, 'plateau_divider': 6}. Best is trial 91 with value: 0.647956342753587.
