[I 2024-12-04 10:48:56,416] Using an existing study with name 'Ohsumed-GATv2-xlnet-xlnet-base-cased-Grouped-No_Aggregation' instead of creating a new one.
[I 2024-12-04 11:07:47,541] Trial 177 finished with value: 0.5594853693070184 and parameters: {'attention_pooling_operation': 'max', 'embedding_pooling_operation': 'max', 'threshold': 0.8162888424088105, 'batch_size': 89, 'attention_heads': 5, 'hidden_dimension': 179, 'number_of_hidden_layers': 1, 'dropout_rate': 0.35826118309941773, 'global_pooling': 'mean', 'learning_rate': 0.00128300482062285, 'weight_decay': 9.652624869215323e-06, 'beta_0': 0.8286363772962065, 'beta_1': 0.9887392118364018, 'epsilon': 2.7529179122633776e-08, 'balanced_loss': True, 'epochs': 101, 'early_stopping_patience': 22, 'plateau_patience': 18, 'plateau_divider': 3}. Best is trial 146 with value: 0.6231222973387793.
[I 2024-12-04 11:24:14,686] Trial 178 finished with value: 0.5899708458744456 and parameters: {'attention_pooling_operation': 'mean', 'embedding_pooling_operation': 'max', 'threshold': 0.8088486210697163, 'batch_size': 77, 'attention_heads': 4, 'hidden_dimension': 159, 'number_of_hidden_layers': 1, 'dropout_rate': 0.349706333181019, 'global_pooling': 'mean', 'learning_rate': 0.0023861392968476483, 'weight_decay': 1.2047365197704407e-05, 'beta_0': 0.8226214987726824, 'beta_1': 0.9868972932591735, 'epsilon': 3.3830036311864347e-08, 'balanced_loss': True, 'epochs': 95, 'early_stopping_patience': 22, 'plateau_patience': 17, 'plateau_divider': 4}. Best is trial 146 with value: 0.6231222973387793.
CUDA out of memory. Tried to allocate 2.05 GiB. GPU 0 has a total capacity of 44.56 GiB of which 1.59 GiB is free. Including non-PyTorch memory, this process has 42.97 GiB memory in use. Of the allocated memory 38.50 GiB is allocated by PyTorch, and 3.32 GiB is reserved by PyTorch but unallocated. If reserved but unallocated memory is large try setting PYTORCH_CUDA_ALLOC_CONF=expandable_segments:True to avoid fragmentation.  See documentation for Memory Management  (https://pytorch.org/docs/stable/notes/cuda.html#environment-variables)
[I 2024-12-04 11:37:53,843] Trial 179 finished with value: -1.0 and parameters: {'attention_pooling_operation': 'mean', 'embedding_pooling_operation': 'max', 'threshold': 0.8086398369924266, 'batch_size': 74, 'attention_heads': 9, 'hidden_dimension': 171, 'number_of_hidden_layers': 1, 'dropout_rate': 0.3435098718526232, 'global_pooling': 'mean', 'learning_rate': 0.001871931195114184, 'weight_decay': 1.1647157955484876e-05, 'beta_0': 0.83830642619745, 'beta_1': 0.9871794712106984, 'epsilon': 5.171723223513157e-08, 'balanced_loss': True, 'epochs': 91, 'early_stopping_patience': 21, 'plateau_patience': 17, 'plateau_divider': 4}. Best is trial 146 with value: 0.6231222973387793.
[I 2024-12-04 11:55:22,042] Trial 180 finished with value: 0.5310153528633773 and parameters: {'attention_pooling_operation': 'mean', 'embedding_pooling_operation': 'max', 'threshold': 0.8051109708748323, 'batch_size': 79, 'attention_heads': 4, 'hidden_dimension': 196, 'number_of_hidden_layers': 1, 'dropout_rate': 0.3507720167436232, 'global_pooling': 'max', 'learning_rate': 0.002377338187555886, 'weight_decay': 1.5907403968255045e-05, 'beta_0': 0.8225617064557001, 'beta_1': 0.9877672100599876, 'epsilon': 2.2874544639843227e-08, 'balanced_loss': True, 'epochs': 95, 'early_stopping_patience': 23, 'plateau_patience': 18, 'plateau_divider': 5}. Best is trial 146 with value: 0.6231222973387793.
[I 2024-12-04 12:11:26,977] Trial 181 finished with value: 0.5728354323054625 and parameters: {'attention_pooling_operation': 'mean', 'embedding_pooling_operation': 'max', 'threshold': 0.8189853470972986, 'batch_size': 70, 'attention_heads': 4, 'hidden_dimension': 154, 'number_of_hidden_layers': 1, 'dropout_rate': 0.32931385226975185, 'global_pooling': 'mean', 'learning_rate': 0.0027885814315969475, 'weight_decay': 6.824274043559415e-06, 'beta_0': 0.8247172615933187, 'beta_1': 0.9861821642060383, 'epsilon': 4.550339636486078e-08, 'balanced_loss': True, 'epochs': 80, 'early_stopping_patience': 22, 'plateau_patience': 17, 'plateau_divider': 3}. Best is trial 146 with value: 0.6231222973387793.
[I 2024-12-04 12:29:05,167] Trial 182 finished with value: 0.5942579337213132 and parameters: {'attention_pooling_operation': 'mean', 'embedding_pooling_operation': 'max', 'threshold': 0.813011727754635, 'batch_size': 91, 'attention_heads': 4, 'hidden_dimension': 160, 'number_of_hidden_layers': 1, 'dropout_rate': 0.3563460326436556, 'global_pooling': 'mean', 'learning_rate': 0.0014920901036209082, 'weight_decay': 9.079626257039967e-06, 'beta_0': 0.8958623298002055, 'beta_1': 0.9867918371627176, 'epsilon': 3.5356468199428176e-08, 'balanced_loss': True, 'epochs': 98, 'early_stopping_patience': 22, 'plateau_patience': 17, 'plateau_divider': 3}. Best is trial 146 with value: 0.6231222973387793.
[I 2024-12-04 12:46:40,783] Trial 183 finished with value: 0.5516084170954875 and parameters: {'attention_pooling_operation': 'mean', 'embedding_pooling_operation': 'max', 'threshold': 0.8100252827577019, 'batch_size': 81, 'attention_heads': 4, 'hidden_dimension': 166, 'number_of_hidden_layers': 1, 'dropout_rate': 0.3546676325720601, 'global_pooling': 'mean', 'learning_rate': 0.0014958212681010531, 'weight_decay': 8.781384721968455e-06, 'beta_0': 0.8341066289356482, 'beta_1': 0.9869002697568686, 'epsilon': 3.6413297132368236e-08, 'balanced_loss': True, 'epochs': 107, 'early_stopping_patience': 22, 'plateau_patience': 17, 'plateau_divider': 3}. Best is trial 146 with value: 0.6231222973387793.
[I 2024-12-04 13:03:50,804] Trial 184 finished with value: 0.6008573798536642 and parameters: {'attention_pooling_operation': 'mean', 'embedding_pooling_operation': 'max', 'threshold': 0.8153708311857664, 'batch_size': 76, 'attention_heads': 4, 'hidden_dimension': 159, 'number_of_hidden_layers': 1, 'dropout_rate': 0.34724684715699583, 'global_pooling': 'mean', 'learning_rate': 0.0011482713840021293, 'weight_decay': 3.903372864481471e-05, 'beta_0': 0.8916456457542319, 'beta_1': 0.9855126648837523, 'epsilon': 2.8482165841788026e-08, 'balanced_loss': True, 'epochs': 96, 'early_stopping_patience': 22, 'plateau_patience': 17, 'plateau_divider': 2}. Best is trial 146 with value: 0.6231222973387793.
[I 2024-12-04 13:20:39,504] Trial 185 finished with value: 0.5935375432152451 and parameters: {'attention_pooling_operation': 'mean', 'embedding_pooling_operation': 'max', 'threshold': 0.8176719990958405, 'batch_size': 75, 'attention_heads': 4, 'hidden_dimension': 159, 'number_of_hidden_layers': 1, 'dropout_rate': 0.339695098181244, 'global_pooling': 'mean', 'learning_rate': 0.0011679449531978234, 'weight_decay': 3.1109092342235654e-05, 'beta_0': 0.8958403871330983, 'beta_1': 0.9875389287309603, 'epsilon': 2.934852240201235e-08, 'balanced_loss': True, 'epochs': 96, 'early_stopping_patience': 21, 'plateau_patience': 18, 'plateau_divider': 2}. Best is trial 146 with value: 0.6231222973387793.
[I 2024-12-04 13:38:02,012] Trial 186 finished with value: 0.5701354435344673 and parameters: {'attention_pooling_operation': 'mean', 'embedding_pooling_operation': 'max', 'threshold': 0.8233105330110347, 'batch_size': 84, 'attention_heads': 4, 'hidden_dimension': 163, 'number_of_hidden_layers': 1, 'dropout_rate': 0.33751852336193117, 'global_pooling': 'mean', 'learning_rate': 0.0011235883638598938, 'weight_decay': 4.4765876415504544e-05, 'beta_0': 0.8754291378095442, 'beta_1': 0.9849285206626224, 'epsilon': 2.5048813263316403e-08, 'balanced_loss': True, 'epochs': 85, 'early_stopping_patience': 21, 'plateau_patience': 18, 'plateau_divider': 2}. Best is trial 146 with value: 0.6231222973387793.
[I 2024-12-04 13:57:27,746] Trial 187 finished with value: 0.5602159436864931 and parameters: {'attention_pooling_operation': 'mean', 'embedding_pooling_operation': 'max', 'threshold': 0.8175394263583599, 'batch_size': 93, 'attention_heads': 5, 'hidden_dimension': 185, 'number_of_hidden_layers': 1, 'dropout_rate': 0.3450604492199764, 'global_pooling': 'mean', 'learning_rate': 0.001341231796531543, 'weight_decay': 3.113596968471748e-05, 'beta_0': 0.8946254622314894, 'beta_1': 0.9882769314847601, 'epsilon': 2.8682203892467212e-08, 'balanced_loss': True, 'epochs': 92, 'early_stopping_patience': 20, 'plateau_patience': 18, 'plateau_divider': 2}. Best is trial 146 with value: 0.6231222973387793.
[I 2024-12-04 14:15:00,576] Trial 188 finished with value: 0.593271943072696 and parameters: {'attention_pooling_operation': 'mean', 'embedding_pooling_operation': 'max', 'threshold': 0.8279367691764136, 'batch_size': 74, 'attention_heads': 4, 'hidden_dimension': 173, 'number_of_hidden_layers': 1, 'dropout_rate': 0.32223118207450235, 'global_pooling': 'mean', 'learning_rate': 0.001128605563110339, 'weight_decay': 3.699546553613037e-05, 'beta_0': 0.8988535283848831, 'beta_1': 0.9875249829291053, 'epsilon': 4.3225492898071e-08, 'balanced_loss': True, 'epochs': 89, 'early_stopping_patience': 21, 'plateau_patience': 19, 'plateau_divider': 2}. Best is trial 146 with value: 0.6231222973387793.
[I 2024-12-04 14:32:06,312] Trial 189 finished with value: 0.5785743523968447 and parameters: {'attention_pooling_operation': 'mean', 'embedding_pooling_operation': 'max', 'threshold': 0.8276780817066329, 'batch_size': 72, 'attention_heads': 4, 'hidden_dimension': 177, 'number_of_hidden_layers': 1, 'dropout_rate': 0.3294002015964259, 'global_pooling': 'mean', 'learning_rate': 0.0011163108152400932, 'weight_decay': 3.461095572599368e-05, 'beta_0': 0.8982016293930806, 'beta_1': 0.9914096888313986, 'epsilon': 4.163007286610022e-08, 'balanced_loss': True, 'epochs': 89, 'early_stopping_patience': 21, 'plateau_patience': 19, 'plateau_divider': 2}. Best is trial 146 with value: 0.6231222973387793.
[I 2024-12-04 14:48:00,277] Trial 190 finished with value: 0.56154141720548 and parameters: {'attention_pooling_operation': 'mean', 'embedding_pooling_operation': 'max', 'threshold': 0.82513573682627, 'batch_size': 74, 'attention_heads': 4, 'hidden_dimension': 166, 'number_of_hidden_layers': 1, 'dropout_rate': 0.3230045747165882, 'global_pooling': 'mean', 'learning_rate': 0.001559550377753028, 'weight_decay': 3.8874139814231794e-05, 'beta_0': 0.8952849002680654, 'beta_1': 0.9878677669521182, 'epsilon': 2.3552464451460498e-08, 'balanced_loss': True, 'epochs': 97, 'early_stopping_patience': 22, 'plateau_patience': 19, 'plateau_divider': 2}. Best is trial 146 with value: 0.6231222973387793.
[I 2024-12-04 15:08:24,267] Trial 191 finished with value: 0.58573540232084 and parameters: {'attention_pooling_operation': 'mean', 'embedding_pooling_operation': 'max', 'threshold': 0.8211023463879955, 'batch_size': 70, 'attention_heads': 5, 'hidden_dimension': 173, 'number_of_hidden_layers': 1, 'dropout_rate': 0.33887460937814445, 'global_pooling': 'mean', 'learning_rate': 0.001065583227398947, 'weight_decay': 5.330032864248379e-06, 'beta_0': 0.8923845881955904, 'beta_1': 0.9899872060365185, 'epsilon': 1.6311430649158266e-08, 'balanced_loss': True, 'epochs': 87, 'early_stopping_patience': 21, 'plateau_patience': 19, 'plateau_divider': 2}. Best is trial 146 with value: 0.6231222973387793.
[I 2024-12-04 15:24:54,283] Trial 192 finished with value: 0.5646754769625025 and parameters: {'attention_pooling_operation': 'mean', 'embedding_pooling_operation': 'max', 'threshold': 0.8136344652294994, 'batch_size': 86, 'attention_heads': 4, 'hidden_dimension': 158, 'number_of_hidden_layers': 1, 'dropout_rate': 0.3173845590640303, 'global_pooling': 'mean', 'learning_rate': 0.0013429530643729978, 'weight_decay': 1.9521880219849128e-05, 'beta_0': 0.8972425719384283, 'beta_1': 0.9855143505562616, 'epsilon': 5.738319337103225e-08, 'balanced_loss': True, 'epochs': 100, 'early_stopping_patience': 13, 'plateau_patience': 18, 'plateau_divider': 2}. Best is trial 146 with value: 0.6231222973387793.
[I 2024-12-04 15:42:46,523] Trial 193 finished with value: 0.5866127177737056 and parameters: {'attention_pooling_operation': 'mean', 'embedding_pooling_operation': 'max', 'threshold': 0.8166232704210836, 'batch_size': 78, 'attention_heads': 4, 'hidden_dimension': 182, 'number_of_hidden_layers': 1, 'dropout_rate': 0.3602899248992735, 'global_pooling': 'mean', 'learning_rate': 0.0011814609772874823, 'weight_decay': 2.5946800549799986e-05, 'beta_0': 0.8993872157057046, 'beta_1': 0.9875034216569706, 'epsilon': 3.13857893322906e-08, 'balanced_loss': True, 'epochs': 102, 'early_stopping_patience': 20, 'plateau_patience': 17, 'plateau_divider': 2}. Best is trial 146 with value: 0.6231222973387793.
[I 2024-12-04 16:00:23,879] Trial 194 finished with value: 0.5749895155226195 and parameters: {'attention_pooling_operation': 'mean', 'embedding_pooling_operation': 'max', 'threshold': 0.8126228162416849, 'batch_size': 96, 'attention_heads': 4, 'hidden_dimension': 173, 'number_of_hidden_layers': 1, 'dropout_rate': 0.3449960576931919, 'global_pooling': 'mean', 'learning_rate': 0.0015639378127618616, 'weight_decay': 3.5314973326765066e-05, 'beta_0': 0.8911606334111556, 'beta_1': 0.9864528922129572, 'epsilon': 4.056831679433991e-08, 'balanced_loss': True, 'epochs': 94, 'early_stopping_patience': 21, 'plateau_patience': 20, 'plateau_divider': 2}. Best is trial 146 with value: 0.6231222973387793.
[I 2024-12-04 16:18:12,422] Trial 195 finished with value: 0.5407541308815774 and parameters: {'attention_pooling_operation': 'mean', 'embedding_pooling_operation': 'max', 'threshold': 0.8194987721529521, 'batch_size': 82, 'attention_heads': 4, 'hidden_dimension': 181, 'number_of_hidden_layers': 1, 'dropout_rate': 0.33420259347747056, 'global_pooling': 'mean', 'learning_rate': 0.0007869564570187801, 'weight_decay': 2.9850908160549797e-05, 'beta_0': 0.8892115957735104, 'beta_1': 0.9873792618336161, 'epsilon': 6.979916614400944e-08, 'balanced_loss': True, 'epochs': 98, 'early_stopping_patience': 22, 'plateau_patience': 18, 'plateau_divider': 3}. Best is trial 146 with value: 0.6231222973387793.
[I 2024-12-04 16:35:20,838] Trial 196 finished with value: 0.6028214746380185 and parameters: {'attention_pooling_operation': 'mean', 'embedding_pooling_operation': 'max', 'threshold': 0.8295613374096316, 'batch_size': 75, 'attention_heads': 4, 'hidden_dimension': 148, 'number_of_hidden_layers': 1, 'dropout_rate': 0.3566566776248787, 'global_pooling': 'mean', 'learning_rate': 0.0010186214369235233, 'weight_decay': 1.4708455117168397e-05, 'beta_0': 0.8930322004410047, 'beta_1': 0.9852087303231478, 'epsilon': 4.900579052894286e-08, 'balanced_loss': True, 'epochs': 90, 'early_stopping_patience': 22, 'plateau_patience': 17, 'plateau_divider': 2}. Best is trial 146 with value: 0.6231222973387793.
[I 2024-12-04 16:53:28,265] Trial 197 finished with value: 0.6026495605669159 and parameters: {'attention_pooling_operation': 'mean', 'embedding_pooling_operation': 'max', 'threshold': 0.8307835010041447, 'batch_size': 76, 'attention_heads': 4, 'hidden_dimension': 151, 'number_of_hidden_layers': 1, 'dropout_rate': 0.3414851370986216, 'global_pooling': 'mean', 'learning_rate': 0.0009724462226782936, 'weight_decay': 1.3926853668287679e-05, 'beta_0': 0.8938724417210355, 'beta_1': 0.9853291318197247, 'epsilon': 4.7836808122725696e-08, 'balanced_loss': True, 'epochs': 90, 'early_stopping_patience': 22, 'plateau_patience': 19, 'plateau_divider': 2}. Best is trial 146 with value: 0.6231222973387793.
[I 2024-12-04 17:10:41,292] Trial 198 finished with value: 0.5994691888876791 and parameters: {'attention_pooling_operation': 'mean', 'embedding_pooling_operation': 'max', 'threshold': 0.8351947196198011, 'batch_size': 76, 'attention_heads': 4, 'hidden_dimension': 150, 'number_of_hidden_layers': 1, 'dropout_rate': 0.3419200717608217, 'global_pooling': 'mean', 'learning_rate': 0.0009316582345361303, 'weight_decay': 1.5100815683426998e-05, 'beta_0': 0.894721678861872, 'beta_1': 0.9853785322966928, 'epsilon': 4.8789926337190083e-08, 'balanced_loss': True, 'epochs': 91, 'early_stopping_patience': 22, 'plateau_patience': 19, 'plateau_divider': 2}. Best is trial 146 with value: 0.6231222973387793.
[I 2024-12-04 17:27:05,541] Trial 199 finished with value: 0.5578058734938217 and parameters: {'attention_pooling_operation': 'mean', 'embedding_pooling_operation': 'max', 'threshold': 0.8334946883610309, 'batch_size': 75, 'attention_heads': 4, 'hidden_dimension': 146, 'number_of_hidden_layers': 1, 'dropout_rate': 0.34244832841996914, 'global_pooling': 'mean', 'learning_rate': 0.0007579044268924345, 'weight_decay': 1.532908153747257e-05, 'beta_0': 0.8922140212447592, 'beta_1': 0.9853055037821395, 'epsilon': 5.0661572522948814e-08, 'balanced_loss': True, 'epochs': 92, 'early_stopping_patience': 22, 'plateau_patience': 16, 'plateau_divider': 2}. Best is trial 146 with value: 0.6231222973387793.
[I 2024-12-04 17:44:05,011] Trial 200 finished with value: 0.5868811425208367 and parameters: {'attention_pooling_operation': 'mean', 'embedding_pooling_operation': 'max', 'threshold': 0.8337406811126082, 'batch_size': 76, 'attention_heads': 4, 'hidden_dimension': 151, 'number_of_hidden_layers': 1, 'dropout_rate': 0.3639676860759344, 'global_pooling': 'mean', 'learning_rate': 0.0009155171365526757, 'weight_decay': 1.4460315803822353e-05, 'beta_0': 0.8849322395692318, 'beta_1': 0.9848028821879675, 'epsilon': 5.5378966065017235e-08, 'balanced_loss': True, 'epochs': 95, 'early_stopping_patience': 22, 'plateau_patience': 20, 'plateau_divider': 2}. Best is trial 146 with value: 0.6231222973387793.
[I 2024-12-04 18:00:14,204] Trial 201 finished with value: 0.5814818007147836 and parameters: {'attention_pooling_operation': 'mean', 'embedding_pooling_operation': 'max', 'threshold': 0.8303813705475089, 'batch_size': 72, 'attention_heads': 4, 'hidden_dimension': 146, 'number_of_hidden_layers': 1, 'dropout_rate': 0.33751222761828126, 'global_pooling': 'mean', 'learning_rate': 0.0016992387638064424, 'weight_decay': 2.0396449974592163e-05, 'beta_0': 0.8907554903339431, 'beta_1': 0.9856086946436577, 'epsilon': 2.8618049146739797e-08, 'balanced_loss': True, 'epochs': 81, 'early_stopping_patience': 22, 'plateau_patience': 19, 'plateau_divider': 2}. Best is trial 146 with value: 0.6231222973387793.
[I 2024-12-04 18:15:51,315] Trial 202 finished with value: 0.5343446047192338 and parameters: {'attention_pooling_operation': 'mean', 'embedding_pooling_operation': 'max', 'threshold': 0.8379845891323294, 'batch_size': 76, 'attention_heads': 4, 'hidden_dimension': 156, 'number_of_hidden_layers': 1, 'dropout_rate': 0.32895206713918895, 'global_pooling': 'mean', 'learning_rate': 0.0010129613822962933, 'weight_decay': 1.6586051614759125e-05, 'beta_0': 0.8879533823891697, 'beta_1': 0.9852444820798203, 'epsilon': 4.336297554712501e-08, 'balanced_loss': True, 'epochs': 89, 'early_stopping_patience': 22, 'plateau_patience': 19, 'plateau_divider': 2}. Best is trial 146 with value: 0.6231222973387793.
[I 2024-12-04 18:32:30,053] Trial 203 finished with value: 0.573345669002868 and parameters: {'attention_pooling_operation': 'mean', 'embedding_pooling_operation': 'max', 'threshold': 0.8277896190220506, 'batch_size': 71, 'attention_heads': 4, 'hidden_dimension': 150, 'number_of_hidden_layers': 1, 'dropout_rate': 0.3236779819644925, 'global_pooling': 'mean', 'learning_rate': 0.001398009244226929, 'weight_decay': 2.3711451424891524e-05, 'beta_0': 0.8950824687091067, 'beta_1': 0.9858299218725598, 'epsilon': 4.64215378998147e-08, 'balanced_loss': True, 'epochs': 85, 'early_stopping_patience': 22, 'plateau_patience': 19, 'plateau_divider': 2}. Best is trial 146 with value: 0.6231222973387793.
[I 2024-12-04 18:49:22,433] Trial 204 finished with value: 0.5572432727035386 and parameters: {'attention_pooling_operation': 'mean', 'embedding_pooling_operation': 'max', 'threshold': 0.8233972744794282, 'batch_size': 77, 'attention_heads': 4, 'hidden_dimension': 140, 'number_of_hidden_layers': 1, 'dropout_rate': 0.3505218621647025, 'global_pooling': 'mean', 'learning_rate': 0.0009301635436478657, 'weight_decay': 1.2177120387794094e-05, 'beta_0': 0.8966099577089564, 'beta_1': 0.9848039170021426, 'epsilon': 3.691783143420529e-08, 'balanced_loss': True, 'epochs': 97, 'early_stopping_patience': 22, 'plateau_patience': 17, 'plateau_divider': 2}. Best is trial 146 with value: 0.6231222973387793.
[I 2024-12-04 19:10:05,735] Trial 205 finished with value: 0.14131327412447764 and parameters: {'attention_pooling_operation': 'mean', 'embedding_pooling_operation': 'max', 'threshold': 0.8290161455470891, 'batch_size': 74, 'attention_heads': 4, 'hidden_dimension': 156, 'number_of_hidden_layers': 1, 'dropout_rate': 0.3409747665052248, 'global_pooling': 'mean', 'learning_rate': 1.0011048409199246e-05, 'weight_decay': 1.4451460469540998e-05, 'beta_0': 0.8929906388685508, 'beta_1': 0.984526660055582, 'epsilon': 2.154795310490856e-08, 'balanced_loss': True, 'epochs': 92, 'early_stopping_patience': 21, 'plateau_patience': 20, 'plateau_divider': 2}. Best is trial 146 with value: 0.6231222973387793.
[I 2024-12-04 19:26:46,484] Trial 206 finished with value: 0.5921928221879167 and parameters: {'attention_pooling_operation': 'mean', 'embedding_pooling_operation': 'max', 'threshold': 0.8359827304626121, 'batch_size': 67, 'attention_heads': 4, 'hidden_dimension': 161, 'number_of_hidden_layers': 1, 'dropout_rate': 0.3564119287422463, 'global_pooling': 'mean', 'learning_rate': 0.0012152469410217877, 'weight_decay': 5.272409670030491e-05, 'beta_0': 0.8994729657166516, 'beta_1': 0.9863169746368186, 'epsilon': 6.018155964583547e-08, 'balanced_loss': True, 'epochs': 77, 'early_stopping_patience': 22, 'plateau_patience': 19, 'plateau_divider': 2}. Best is trial 146 with value: 0.6231222973387793.
