[I 2024-11-29 21:58:41,816] Trial 201 finished with value: 0.6477685792596104 and parameters: {'left_stride': 128, 'right_stride': 32, 'attention_pooling_operation': 'max', 'embedding_pooling_operation': 'mean', 'threshold': 0.8989188527001164, 'batch_size': 70, 'attention_heads': 9, 'hidden_dimension': 106, 'number_of_hidden_layers': 2, 'dropout_rate': 0.4787881954886884, 'global_pooling': 'max', 'learning_rate': 0.0004168294543280047, 'weight_decay': 3.637620946134618e-06, 'beta_0': 0.8457967976118971, 'beta_1': 0.9906697326616677, 'epsilon': 1.6631666124347035e-06, 'balanced_loss': False, 'epochs': 108, 'early_stopping_patience': 20, 'plateau_patience': 13, 'plateau_divider': 5}. Best is trial 91 with value: 0.647956342753587.
[I 2024-11-29 22:10:39,714] Trial 202 finished with value: 0.6318864854522883 and parameters: {'left_stride': 128, 'right_stride': 32, 'attention_pooling_operation': 'max', 'embedding_pooling_operation': 'mean', 'threshold': 0.8971035859712864, 'batch_size': 70, 'attention_heads': 9, 'hidden_dimension': 106, 'number_of_hidden_layers': 2, 'dropout_rate': 0.4796789245863327, 'global_pooling': 'max', 'learning_rate': 0.00040425080351857957, 'weight_decay': 1.769847454842817e-06, 'beta_0': 0.8448921225787708, 'beta_1': 0.9884040305713779, 'epsilon': 1.3560600963306962e-06, 'balanced_loss': False, 'epochs': 108, 'early_stopping_patience': 20, 'plateau_patience': 13, 'plateau_divider': 5}. Best is trial 91 with value: 0.647956342753587.
[I 2024-11-29 22:22:25,860] Trial 203 finished with value: 0.6310325426828399 and parameters: {'left_stride': 128, 'right_stride': 32, 'attention_pooling_operation': 'max', 'embedding_pooling_operation': 'mean', 'threshold': 0.8986741596663407, 'batch_size': 70, 'attention_heads': 9, 'hidden_dimension': 105, 'number_of_hidden_layers': 2, 'dropout_rate': 0.4776517472858101, 'global_pooling': 'max', 'learning_rate': 0.00040060263747177525, 'weight_decay': 3.2756835969499665e-06, 'beta_0': 0.8460949897019681, 'beta_1': 0.9872978340071572, 'epsilon': 1.3245141483543385e-06, 'balanced_loss': False, 'epochs': 108, 'early_stopping_patience': 19, 'plateau_patience': 13, 'plateau_divider': 5}. Best is trial 91 with value: 0.647956342753587.
[I 2024-11-29 22:34:30,543] Trial 204 finished with value: 0.6187075510389966 and parameters: {'left_stride': 128, 'right_stride': 32, 'attention_pooling_operation': 'max', 'embedding_pooling_operation': 'mean', 'threshold': 0.8921872593867993, 'batch_size': 71, 'attention_heads': 9, 'hidden_dimension': 105, 'number_of_hidden_layers': 2, 'dropout_rate': 0.4788782656786323, 'global_pooling': 'max', 'learning_rate': 0.0003041205710792451, 'weight_decay': 3.470567512519477e-06, 'beta_0': 0.8451912475819855, 'beta_1': 0.9873474434938657, 'epsilon': 1.0406606160137422e-06, 'balanced_loss': False, 'epochs': 110, 'early_stopping_patience': 19, 'plateau_patience': 13, 'plateau_divider': 5}. Best is trial 91 with value: 0.647956342753587.
[I 2024-11-29 22:46:13,985] Trial 205 finished with value: 0.6329217711314293 and parameters: {'left_stride': 128, 'right_stride': 32, 'attention_pooling_operation': 'max', 'embedding_pooling_operation': 'mean', 'threshold': 0.8971443211446599, 'batch_size': 65, 'attention_heads': 8, 'hidden_dimension': 115, 'number_of_hidden_layers': 2, 'dropout_rate': 0.48267836080148213, 'global_pooling': 'max', 'learning_rate': 0.0004438256427207168, 'weight_decay': 1.1151302887521414e-06, 'beta_0': 0.8490134343750044, 'beta_1': 0.987519752638108, 'epsilon': 1.4062495045392673e-06, 'balanced_loss': False, 'epochs': 102, 'early_stopping_patience': 19, 'plateau_patience': 13, 'plateau_divider': 5}. Best is trial 91 with value: 0.647956342753587.
[I 2024-11-29 22:57:47,726] Trial 206 finished with value: 0.6072633750683587 and parameters: {'left_stride': 128, 'right_stride': 32, 'attention_pooling_operation': 'max', 'embedding_pooling_operation': 'mean', 'threshold': 0.8962690571015444, 'batch_size': 69, 'attention_heads': 8, 'hidden_dimension': 114, 'number_of_hidden_layers': 2, 'dropout_rate': 0.47557148120036086, 'global_pooling': 'mean', 'learning_rate': 0.0004351997307377192, 'weight_decay': 1.590294941136579e-06, 'beta_0': 0.8519432471988857, 'beta_1': 0.9877332592997499, 'epsilon': 1.2268522819045845e-06, 'balanced_loss': False, 'epochs': 102, 'early_stopping_patience': 18, 'plateau_patience': 13, 'plateau_divider': 5}. Best is trial 91 with value: 0.647956342753587.
[I 2024-11-29 23:09:46,333] Trial 207 finished with value: 0.6127894659710978 and parameters: {'left_stride': 128, 'right_stride': 32, 'attention_pooling_operation': 'max', 'embedding_pooling_operation': 'mean', 'threshold': 0.90120764815963, 'batch_size': 66, 'attention_heads': 8, 'hidden_dimension': 118, 'number_of_hidden_layers': 2, 'dropout_rate': 0.482759944469173, 'global_pooling': 'max', 'learning_rate': 0.00024151929500681893, 'weight_decay': 1.4535597070126574e-06, 'beta_0': 0.8487602612495067, 'beta_1': 0.9869170809529391, 'epsilon': 1.4011935459748138e-06, 'balanced_loss': False, 'epochs': 92, 'early_stopping_patience': 19, 'plateau_patience': 13, 'plateau_divider': 5}. Best is trial 91 with value: 0.647956342753587.
[I 2024-11-29 23:21:18,267] Trial 208 finished with value: 0.6169202906219209 and parameters: {'left_stride': 128, 'right_stride': 32, 'attention_pooling_operation': 'max', 'embedding_pooling_operation': 'mean', 'threshold': 0.8887537863583829, 'batch_size': 65, 'attention_heads': 8, 'hidden_dimension': 107, 'number_of_hidden_layers': 2, 'dropout_rate': 0.46982241923840073, 'global_pooling': 'max', 'learning_rate': 0.0003451419774445663, 'weight_decay': 1.1322865045387887e-06, 'beta_0': 0.8507502152552002, 'beta_1': 0.9871953219817329, 'epsilon': 6.692490032738194e-07, 'balanced_loss': True, 'epochs': 104, 'early_stopping_patience': 18, 'plateau_patience': 13, 'plateau_divider': 5}. Best is trial 91 with value: 0.647956342753587.
[I 2024-11-29 23:33:36,393] Trial 209 finished with value: 0.6178060753870068 and parameters: {'left_stride': 128, 'right_stride': 32, 'attention_pooling_operation': 'max', 'embedding_pooling_operation': 'mean', 'threshold': 0.8965124758604008, 'batch_size': 70, 'attention_heads': 10, 'hidden_dimension': 112, 'number_of_hidden_layers': 2, 'dropout_rate': 0.47750997886572194, 'global_pooling': 'max', 'learning_rate': 0.0004933849646273661, 'weight_decay': 1.0190234105143043e-06, 'beta_0': 0.8471054464264431, 'beta_1': 0.9876427056948404, 'epsilon': 8.230527445582227e-07, 'balanced_loss': False, 'epochs': 100, 'early_stopping_patience': 19, 'plateau_patience': 13, 'plateau_divider': 5}. Best is trial 91 with value: 0.647956342753587.
[I 2024-11-29 23:45:47,002] Trial 210 finished with value: 0.6159928332610505 and parameters: {'left_stride': 64, 'right_stride': 32, 'attention_pooling_operation': 'max', 'embedding_pooling_operation': 'mean', 'threshold': 0.8924037490666789, 'batch_size': 67, 'attention_heads': 8, 'hidden_dimension': 123, 'number_of_hidden_layers': 2, 'dropout_rate': 0.4721954735308552, 'global_pooling': 'max', 'learning_rate': 0.00040261851946686334, 'weight_decay': 2.070923237775942e-06, 'beta_0': 0.8531068611579344, 'beta_1': 0.9881891550921197, 'epsilon': 1.3637268460017476e-06, 'balanced_loss': False, 'epochs': 97, 'early_stopping_patience': 20, 'plateau_patience': 14, 'plateau_divider': 5}. Best is trial 91 with value: 0.647956342753587.
[I 2024-11-29 23:57:24,534] Trial 211 finished with value: 0.6181744457960252 and parameters: {'left_stride': 128, 'right_stride': 32, 'attention_pooling_operation': 'max', 'embedding_pooling_operation': 'mean', 'threshold': 0.9083207110156059, 'batch_size': 61, 'attention_heads': 9, 'hidden_dimension': 106, 'number_of_hidden_layers': 2, 'dropout_rate': 0.4837147202654338, 'global_pooling': 'max', 'learning_rate': 0.000530482662228915, 'weight_decay': 2.7937760954375785e-06, 'beta_0': 0.8448958964272745, 'beta_1': 0.990488703994788, 'epsilon': 1.5607970305554507e-06, 'balanced_loss': False, 'epochs': 106, 'early_stopping_patience': 20, 'plateau_patience': 13, 'plateau_divider': 5}. Best is trial 91 with value: 0.647956342753587.
[I 2024-11-30 00:08:48,806] Trial 212 finished with value: 0.6226699316102335 and parameters: {'left_stride': 128, 'right_stride': 32, 'attention_pooling_operation': 'max', 'embedding_pooling_operation': 'mean', 'threshold': 0.9035612171976444, 'batch_size': 64, 'attention_heads': 9, 'hidden_dimension': 103, 'number_of_hidden_layers': 2, 'dropout_rate': 0.48120098418324403, 'global_pooling': 'max', 'learning_rate': 0.0004566072871031983, 'weight_decay': 4.554172227536143e-06, 'beta_0': 0.8481299337576905, 'beta_1': 0.9866776691723183, 'epsilon': 2.1337696072756374e-06, 'balanced_loss': False, 'epochs': 109, 'early_stopping_patience': 17, 'plateau_patience': 13, 'plateau_divider': 5}. Best is trial 91 with value: 0.647956342753587.
[I 2024-11-30 00:21:04,996] Trial 213 finished with value: 0.6305038606845587 and parameters: {'left_stride': 128, 'right_stride': 32, 'attention_pooling_operation': 'max', 'embedding_pooling_operation': 'mean', 'threshold': 0.8999871948313668, 'batch_size': 65, 'attention_heads': 9, 'hidden_dimension': 114, 'number_of_hidden_layers': 2, 'dropout_rate': 0.4889717749685147, 'global_pooling': 'max', 'learning_rate': 0.0005647555495520121, 'weight_decay': 1.8839212331063142e-06, 'beta_0': 0.8463975015961591, 'beta_1': 0.98938150147433, 'epsilon': 1.0381095522848216e-06, 'balanced_loss': False, 'epochs': 200, 'early_stopping_patience': 19, 'plateau_patience': 13, 'plateau_divider': 5}. Best is trial 91 with value: 0.647956342753587.
[I 2024-11-30 00:33:08,127] Trial 214 finished with value: 0.6207104421246065 and parameters: {'left_stride': 128, 'right_stride': 32, 'attention_pooling_operation': 'max', 'embedding_pooling_operation': 'mean', 'threshold': 0.8973011176789755, 'batch_size': 67, 'attention_heads': 9, 'hidden_dimension': 116, 'number_of_hidden_layers': 2, 'dropout_rate': 0.4681509116619965, 'global_pooling': 'max', 'learning_rate': 0.0003107822619826747, 'weight_decay': 3.047020232155697e-06, 'beta_0': 0.8464183134607056, 'beta_1': 0.9884858274023133, 'epsilon': 9.182969672791856e-07, 'balanced_loss': False, 'epochs': 152, 'early_stopping_patience': 18, 'plateau_patience': 12, 'plateau_divider': 5}. Best is trial 91 with value: 0.647956342753587.
[I 2024-11-30 00:45:00,188] Trial 215 finished with value: 0.6089488691839537 and parameters: {'left_stride': 128, 'right_stride': 32, 'attention_pooling_operation': 'max', 'embedding_pooling_operation': 'mean', 'threshold': 0.9006254630671916, 'batch_size': 65, 'attention_heads': 9, 'hidden_dimension': 112, 'number_of_hidden_layers': 2, 'dropout_rate': 0.475194028410561, 'global_pooling': 'max', 'learning_rate': 0.0005327562298143475, 'weight_decay': 1.301016695488833e-06, 'beta_0': 0.850147843785383, 'beta_1': 0.9893294623982726, 'epsilon': 1.2171696167023691e-06, 'balanced_loss': False, 'epochs': 103, 'early_stopping_patience': 19, 'plateau_patience': 13, 'plateau_divider': 5}. Best is trial 91 with value: 0.647956342753587.
[I 2024-11-30 00:57:31,887] Trial 216 finished with value: 0.6173806331025183 and parameters: {'left_stride': 128, 'right_stride': 32, 'attention_pooling_operation': 'mean', 'embedding_pooling_operation': 'mean', 'threshold': 0.9053289636642181, 'batch_size': 60, 'attention_heads': 9, 'hidden_dimension': 118, 'number_of_hidden_layers': 2, 'dropout_rate': 0.49299234700058586, 'global_pooling': 'max', 'learning_rate': 0.000376102888953388, 'weight_decay': 2.2391301183720885e-06, 'beta_0': 0.8451663669288324, 'beta_1': 0.988096255358124, 'epsilon': 1.5454713798623675e-06, 'balanced_loss': False, 'epochs': 101, 'early_stopping_patience': 19, 'plateau_patience': 14, 'plateau_divider': 5}. Best is trial 91 with value: 0.647956342753587.
[I 2024-11-30 01:10:07,238] Trial 217 finished with value: 0.6169054799521964 and parameters: {'left_stride': 128, 'right_stride': 32, 'attention_pooling_operation': 'max', 'embedding_pooling_operation': 'mean', 'threshold': 0.8931250774870179, 'batch_size': 75, 'attention_heads': 10, 'hidden_dimension': 109, 'number_of_hidden_layers': 2, 'dropout_rate': 0.48257681329717517, 'global_pooling': 'max', 'learning_rate': 0.0005603702652838395, 'weight_decay': 1.7125592492197424e-06, 'beta_0': 0.8563485378688509, 'beta_1': 0.9890523725318472, 'epsilon': 1.1433024510654217e-06, 'balanced_loss': False, 'epochs': 104, 'early_stopping_patience': 20, 'plateau_patience': 13, 'plateau_divider': 5}. Best is trial 91 with value: 0.647956342753587.
[I 2024-11-30 01:22:55,352] Trial 218 finished with value: 0.6272337899060318 and parameters: {'left_stride': 128, 'right_stride': 32, 'attention_pooling_operation': 'max', 'embedding_pooling_operation': 'mean', 'threshold': 0.8850344761811739, 'batch_size': 70, 'attention_heads': 9, 'hidden_dimension': 120, 'number_of_hidden_layers': 2, 'dropout_rate': 0.47622701110184923, 'global_pooling': 'max', 'learning_rate': 0.00044609999104601304, 'weight_decay': 2.665648445004385e-06, 'beta_0': 0.8485325039681327, 'beta_1': 0.9855713708521566, 'epsilon': 1.0648205042924026e-06, 'balanced_loss': False, 'epochs': 110, 'early_stopping_patience': 20, 'plateau_patience': 12, 'plateau_divider': 5}. Best is trial 91 with value: 0.647956342753587.
[I 2024-11-30 01:35:01,014] Trial 219 finished with value: 0.6143419438067451 and parameters: {'left_stride': 128, 'right_stride': 32, 'attention_pooling_operation': 'max', 'embedding_pooling_operation': 'mean', 'threshold': 0.8995838525331398, 'batch_size': 68, 'attention_heads': 9, 'hidden_dimension': 115, 'number_of_hidden_layers': 2, 'dropout_rate': 0.46838290296135826, 'global_pooling': 'max', 'learning_rate': 0.0002717136406437053, 'weight_decay': 1.3062120039866643e-06, 'beta_0': 0.851406291964579, 'beta_1': 0.9883286159748385, 'epsilon': 7.510706237540127e-07, 'balanced_loss': False, 'epochs': 98, 'early_stopping_patience': 19, 'plateau_patience': 13, 'plateau_divider': 5}. Best is trial 91 with value: 0.647956342753587.
[I 2024-11-30 01:46:38,236] Trial 220 finished with value: 0.6140512629712258 and parameters: {'left_stride': 0, 'right_stride': 32, 'attention_pooling_operation': 'max', 'embedding_pooling_operation': 'mean', 'threshold': 0.9075422578307784, 'batch_size': 62, 'attention_heads': 8, 'hidden_dimension': 107, 'number_of_hidden_layers': 2, 'dropout_rate': 0.5039221523409175, 'global_pooling': 'max', 'learning_rate': 0.0003790529994174157, 'weight_decay': 1.7859048503684485e-06, 'beta_0': 0.8439563638269829, 'beta_1': 0.9874315134398441, 'epsilon': 1.4990577599448281e-06, 'balanced_loss': False, 'epochs': 177, 'early_stopping_patience': 20, 'plateau_patience': 12, 'plateau_divider': 4}. Best is trial 91 with value: 0.647956342753587.
[I 2024-11-30 01:58:04,728] Trial 221 finished with value: 0.604136009907117 and parameters: {'left_stride': 128, 'right_stride': 64, 'attention_pooling_operation': 'max', 'embedding_pooling_operation': 'mean', 'threshold': 0.9119513917783525, 'batch_size': 64, 'attention_heads': 9, 'hidden_dimension': 104, 'number_of_hidden_layers': 2, 'dropout_rate': 0.48787948158987865, 'global_pooling': 'max', 'learning_rate': 0.0006137427931202344, 'weight_decay': 1.891586251842214e-06, 'beta_0': 0.8438345968129429, 'beta_1': 0.989461893614466, 'epsilon': 3.0142392359196398e-06, 'balanced_loss': False, 'epochs': 108, 'early_stopping_patience': 20, 'plateau_patience': 13, 'plateau_divider': 5}. Best is trial 91 with value: 0.647956342753587.
[I 2024-11-30 02:09:54,015] Trial 222 finished with value: 0.6356973811301545 and parameters: {'left_stride': 128, 'right_stride': 32, 'attention_pooling_operation': 'max', 'embedding_pooling_operation': 'mean', 'threshold': 0.9061653075560854, 'batch_size': 59, 'attention_heads': 9, 'hidden_dimension': 112, 'number_of_hidden_layers': 2, 'dropout_rate': 0.4851302499585804, 'global_pooling': 'max', 'learning_rate': 0.00047988759865065153, 'weight_decay': 3.6505224679353127e-06, 'beta_0': 0.8466671314961695, 'beta_1': 0.9906344593031645, 'epsilon': 1.80452975063895e-06, 'balanced_loss': False, 'epochs': 200, 'early_stopping_patience': 18, 'plateau_patience': 13, 'plateau_divider': 2}. Best is trial 91 with value: 0.647956342753587.
[I 2024-11-30 02:21:48,859] Trial 223 finished with value: 0.6293249286954685 and parameters: {'left_stride': 128, 'right_stride': 32, 'attention_pooling_operation': 'max', 'embedding_pooling_operation': 'mean', 'threshold': 0.9033017224400485, 'batch_size': 59, 'attention_heads': 9, 'hidden_dimension': 112, 'number_of_hidden_layers': 2, 'dropout_rate': 0.48119205093706463, 'global_pooling': 'max', 'learning_rate': 0.00048491439582618983, 'weight_decay': 3.322322483623199e-06, 'beta_0': 0.8470585635192482, 'beta_1': 0.9908204496576203, 'epsilon': 1.795131884003952e-06, 'balanced_loss': False, 'epochs': 195, 'early_stopping_patience': 18, 'plateau_patience': 13, 'plateau_divider': 2}. Best is trial 91 with value: 0.647956342753587.
[I 2024-11-30 02:33:52,088] Trial 224 finished with value: 0.617369236656815 and parameters: {'left_stride': 128, 'right_stride': 32, 'attention_pooling_operation': 'max', 'embedding_pooling_operation': 'mean', 'threshold': 0.9066201843963184, 'batch_size': 57, 'attention_heads': 9, 'hidden_dimension': 122, 'number_of_hidden_layers': 2, 'dropout_rate': 0.4904866270223917, 'global_pooling': 'max', 'learning_rate': 0.00043371661371504526, 'weight_decay': 3.8105071427058576e-06, 'beta_0': 0.8489694402448736, 'beta_1': 0.9864951417088313, 'epsilon': 2.269712403072741e-06, 'balanced_loss': False, 'epochs': 181, 'early_stopping_patience': 19, 'plateau_patience': 14, 'plateau_divider': 2}. Best is trial 91 with value: 0.647956342753587.
[I 2024-11-30 02:46:10,348] Trial 225 finished with value: 0.6174323832426432 and parameters: {'left_stride': 128, 'right_stride': 32, 'attention_pooling_operation': 'max', 'embedding_pooling_operation': 'mean', 'threshold': 0.8986233100680705, 'batch_size': 61, 'attention_heads': 10, 'hidden_dimension': 113, 'number_of_hidden_layers': 2, 'dropout_rate': 0.4725542240492254, 'global_pooling': 'max', 'learning_rate': 0.0005726913551469488, 'weight_decay': 2.5689505610087287e-06, 'beta_0': 0.8464811738112703, 'beta_1': 0.9902005732321949, 'epsilon': 1.3131732087630962e-06, 'balanced_loss': False, 'epochs': 200, 'early_stopping_patience': 18, 'plateau_patience': 12, 'plateau_divider': 2}. Best is trial 91 with value: 0.647956342753587.
[I 2024-11-30 03:00:52,813] Trial 226 finished with value: 0.6179000906504316 and parameters: {'left_stride': 256, 'right_stride': 32, 'attention_pooling_operation': 'max', 'embedding_pooling_operation': 'mean', 'threshold': 0.9098184796689386, 'batch_size': 59, 'attention_heads': 9, 'hidden_dimension': 225, 'number_of_hidden_layers': 2, 'dropout_rate': 0.5222109890418272, 'global_pooling': 'mean', 'learning_rate': 0.0003330749008814469, 'weight_decay': 3.868774081804443e-06, 'beta_0': 0.8536148540415365, 'beta_1': 0.9901224463709913, 'epsilon': 9.784436678688476e-07, 'balanced_loss': False, 'epochs': 105, 'early_stopping_patience': 19, 'plateau_patience': 13, 'plateau_divider': 2}. Best is trial 91 with value: 0.647956342753587.
[I 2024-11-30 03:11:09,069] Trial 227 finished with value: 0.6158764237618726 and parameters: {'left_stride': 128, 'right_stride': 32, 'attention_pooling_operation': 'max', 'embedding_pooling_operation': 'mean', 'threshold': 0.9586634717928508, 'batch_size': 72, 'attention_heads': 9, 'hidden_dimension': 108, 'number_of_hidden_layers': 2, 'dropout_rate': 0.4789017178891556, 'global_pooling': 'max', 'learning_rate': 0.00047662576224070653, 'weight_decay': 0.0004720657490672337, 'beta_0': 0.8457787371014708, 'beta_1': 0.9862442121722617, 'epsilon': 1.841850669481198e-06, 'balanced_loss': False, 'epochs': 194, 'early_stopping_patience': 16, 'plateau_patience': 14, 'plateau_divider': 5}. Best is trial 91 with value: 0.647956342753587.
[I 2024-11-30 03:22:23,879] Trial 228 finished with value: 0.604968593459584 and parameters: {'left_stride': 64, 'right_stride': 32, 'attention_pooling_operation': 'max', 'embedding_pooling_operation': 'min', 'threshold': 0.9009890034751019, 'batch_size': 65, 'attention_heads': 8, 'hidden_dimension': 96, 'number_of_hidden_layers': 2, 'dropout_rate': 0.48551940872786176, 'global_pooling': 'max', 'learning_rate': 0.0003756354197922609, 'weight_decay': 4.105000826924213e-06, 'beta_0': 0.8392669885875529, 'beta_1': 0.9895721309901105, 'epsilon': 1.9047092852575447e-05, 'balanced_loss': False, 'epochs': 200, 'early_stopping_patience': 17, 'plateau_patience': 12, 'plateau_divider': 4}. Best is trial 91 with value: 0.647956342753587.
[I 2024-11-30 03:34:43,452] Trial 229 finished with value: 0.6229068946395617 and parameters: {'left_stride': 128, 'right_stride': 32, 'attention_pooling_operation': 'max', 'embedding_pooling_operation': 'mean', 'threshold': 0.8959030339098041, 'batch_size': 61, 'attention_heads': 9, 'hidden_dimension': 116, 'number_of_hidden_layers': 2, 'dropout_rate': 0.4661321007373611, 'global_pooling': 'max', 'learning_rate': 0.0005379032421239153, 'weight_decay': 5.190348414640554e-06, 'beta_0': 0.8496839465508488, 'beta_1': 0.9840096131898526, 'epsilon': 1.4150825908516736e-05, 'balanced_loss': False, 'epochs': 200, 'early_stopping_patience': 20, 'plateau_patience': 13, 'plateau_divider': 5}. Best is trial 91 with value: 0.647956342753587.
