[I 2024-12-05 05:00:29,822] Trial 238 finished with value: 0.5692994366654616 and parameters: {'attention_pooling_operation': 'mean', 'embedding_pooling_operation': 'max', 'threshold': 0.8202382562788886, 'batch_size': 80, 'attention_heads': 4, 'hidden_dimension': 181, 'number_of_hidden_layers': 1, 'dropout_rate': 0.3452338339054141, 'global_pooling': 'mean', 'learning_rate': 0.0019473455012757874, 'weight_decay': 1.3901369524648708e-05, 'beta_0': 0.8644046762347264, 'beta_1': 0.9881311214476235, 'epsilon': 5.187021795016454e-08, 'balanced_loss': True, 'epochs': 94, 'early_stopping_patience': 23, 'plateau_patience': 18, 'plateau_divider': 2}. Best is trial 146 with value: 0.6231222973387793.
[I 2024-12-05 05:18:02,435] Trial 239 finished with value: 0.5776782021072603 and parameters: {'attention_pooling_operation': 'max', 'embedding_pooling_operation': 'max', 'threshold': 0.8320426380016084, 'batch_size': 98, 'attention_heads': 4, 'hidden_dimension': 171, 'number_of_hidden_layers': 1, 'dropout_rate': 0.33848566008137604, 'global_pooling': 'mean', 'learning_rate': 0.0007850622070472515, 'weight_decay': 2.65639093779049e-05, 'beta_0': 0.8353755616573204, 'beta_1': 0.9846733752799884, 'epsilon': 3.772342543554825e-08, 'balanced_loss': True, 'epochs': 101, 'early_stopping_patience': 22, 'plateau_patience': 17, 'plateau_divider': 5}. Best is trial 146 with value: 0.6231222973387793.
[I 2024-12-05 05:34:39,127] Trial 240 finished with value: 0.54272114072798 and parameters: {'attention_pooling_operation': 'mean', 'embedding_pooling_operation': 'mean', 'threshold': 0.8112722071697116, 'batch_size': 102, 'attention_heads': 4, 'hidden_dimension': 141, 'number_of_hidden_layers': 1, 'dropout_rate': 0.35897280891060407, 'global_pooling': 'mean', 'learning_rate': 0.0011865646421550132, 'weight_decay': 3.17693526019427e-05, 'beta_0': 0.8267527314463359, 'beta_1': 0.9850772518638022, 'epsilon': 2.699546286381534e-08, 'balanced_loss': True, 'epochs': 98, 'early_stopping_patience': 22, 'plateau_patience': 16, 'plateau_divider': 3}. Best is trial 146 with value: 0.6231222973387793.
[I 2024-12-05 05:52:56,262] Trial 241 finished with value: 0.5239203900939415 and parameters: {'attention_pooling_operation': 'max', 'embedding_pooling_operation': 'max', 'threshold': 0.8175181878714877, 'batch_size': 88, 'attention_heads': 5, 'hidden_dimension': 176, 'number_of_hidden_layers': 1, 'dropout_rate': 0.33207898671235764, 'global_pooling': 'max', 'learning_rate': 0.001671669305743235, 'weight_decay': 1.97413801944328e-05, 'beta_0': 0.833310357000109, 'beta_1': 0.9870697381350257, 'epsilon': 6.973905452630921e-08, 'balanced_loss': True, 'epochs': 104, 'early_stopping_patience': 23, 'plateau_patience': 18, 'plateau_divider': 2}. Best is trial 146 with value: 0.6231222973387793.
[I 2024-12-05 06:10:22,717] Trial 242 finished with value: 0.5685390596863803 and parameters: {'attention_pooling_operation': 'mean', 'embedding_pooling_operation': 'max', 'threshold': 0.8273691311315774, 'batch_size': 76, 'attention_heads': 4, 'hidden_dimension': 175, 'number_of_hidden_layers': 1, 'dropout_rate': 0.3484522562834178, 'global_pooling': 'mean', 'learning_rate': 0.0010419992392566193, 'weight_decay': 3.6578302467264825e-05, 'beta_0': 0.8938416482850193, 'beta_1': 0.9878132497935178, 'epsilon': 4.2736802386304004e-08, 'balanced_loss': True, 'epochs': 90, 'early_stopping_patience': 21, 'plateau_patience': 17, 'plateau_divider': 2}. Best is trial 146 with value: 0.6231222973387793.
[I 2024-12-05 06:27:54,445] Trial 243 finished with value: 0.5615424775311482 and parameters: {'attention_pooling_operation': 'mean', 'embedding_pooling_operation': 'max', 'threshold': 0.8297647676819636, 'batch_size': 84, 'attention_heads': 4, 'hidden_dimension': 173, 'number_of_hidden_layers': 1, 'dropout_rate': 0.3543017960002939, 'global_pooling': 'mean', 'learning_rate': 0.0012098782280153574, 'weight_decay': 4.4980839619197606e-05, 'beta_0': 0.8963687347209351, 'beta_1': 0.9874016030557359, 'epsilon': 4.8313093614045415e-08, 'balanced_loss': True, 'epochs': 94, 'early_stopping_patience': 22, 'plateau_patience': 18, 'plateau_divider': 2}. Best is trial 146 with value: 0.6231222973387793.
[I 2024-12-05 06:44:47,466] Trial 244 finished with value: 0.5619616590039547 and parameters: {'attention_pooling_operation': 'mean', 'embedding_pooling_operation': 'max', 'threshold': 0.8377021028260045, 'batch_size': 105, 'attention_heads': 4, 'hidden_dimension': 162, 'number_of_hidden_layers': 1, 'dropout_rate': 0.33834381655817175, 'global_pooling': 'mean', 'learning_rate': 0.0014367070600754177, 'weight_decay': 3.984935723810525e-05, 'beta_0': 0.8308564245767115, 'beta_1': 0.9876055615369022, 'epsilon': 3.2576465642268575e-08, 'balanced_loss': True, 'epochs': 91, 'early_stopping_patience': 21, 'plateau_patience': 17, 'plateau_divider': 2}. Best is trial 146 with value: 0.6231222973387793.
[I 2024-12-05 07:02:23,898] Trial 245 finished with value: 0.5741386099614462 and parameters: {'attention_pooling_operation': 'mean', 'embedding_pooling_operation': 'max', 'threshold': 0.8246575700919027, 'batch_size': 94, 'attention_heads': 4, 'hidden_dimension': 153, 'number_of_hidden_layers': 1, 'dropout_rate': 0.33138006101222073, 'global_pooling': 'mean', 'learning_rate': 0.0009923472729992922, 'weight_decay': 2.9744329528383684e-05, 'beta_0': 0.8404617973064196, 'beta_1': 0.9854745421650708, 'epsilon': 3.9538280336482e-08, 'balanced_loss': True, 'epochs': 87, 'early_stopping_patience': 22, 'plateau_patience': 19, 'plateau_divider': 2}. Best is trial 146 with value: 0.6231222973387793.
[I 2024-12-05 07:22:02,733] Trial 246 finished with value: 0.5576051126978612 and parameters: {'attention_pooling_operation': 'mean', 'embedding_pooling_operation': 'max', 'threshold': 0.8208195999295959, 'batch_size': 91, 'attention_heads': 4, 'hidden_dimension': 180, 'number_of_hidden_layers': 1, 'dropout_rate': 0.4557070814394407, 'global_pooling': 'mean', 'learning_rate': 0.0012261883414079633, 'weight_decay': 0.00013069761058890077, 'beta_0': 0.8384103195200425, 'beta_1': 0.9867715583534986, 'epsilon': 5.9135762540605317e-08, 'balanced_loss': True, 'epochs': 96, 'early_stopping_patience': 22, 'plateau_patience': 17, 'plateau_divider': 2}. Best is trial 146 with value: 0.6231222973387793.
[I 2024-12-05 07:39:24,053] Trial 247 finished with value: 0.5937764191746996 and parameters: {'attention_pooling_operation': 'max', 'embedding_pooling_operation': 'max', 'threshold': 0.8145049180589113, 'batch_size': 97, 'attention_heads': 4, 'hidden_dimension': 168, 'number_of_hidden_layers': 1, 'dropout_rate': 0.31867200202104223, 'global_pooling': 'mean', 'learning_rate': 0.0008354941918039695, 'weight_decay': 6.617486186473676e-05, 'beta_0': 0.8914189799715129, 'beta_1': 0.9863112940398329, 'epsilon': 4.731242180697246e-08, 'balanced_loss': True, 'epochs': 99, 'early_stopping_patience': 20, 'plateau_patience': 18, 'plateau_divider': 3}. Best is trial 146 with value: 0.6231222973387793.
[I 2024-12-05 07:58:30,431] Trial 248 finished with value: 0.2556617156850752 and parameters: {'attention_pooling_operation': 'max', 'embedding_pooling_operation': 'max', 'threshold': 0.8149349472429878, 'batch_size': 96, 'attention_heads': 4, 'hidden_dimension': 159, 'number_of_hidden_layers': 1, 'dropout_rate': 0.3620802360147052, 'global_pooling': 'sum', 'learning_rate': 0.0008291764633675925, 'weight_decay': 7.138583771174578e-05, 'beta_0': 0.892154124470306, 'beta_1': 0.9862280440208256, 'epsilon': 5.0295690623480574e-08, 'balanced_loss': True, 'epochs': 101, 'early_stopping_patience': 22, 'plateau_patience': 18, 'plateau_divider': 3}. Best is trial 146 with value: 0.6231222973387793.
[I 2024-12-05 08:14:40,860] Trial 249 finished with value: 0.5142052023906549 and parameters: {'attention_pooling_operation': 'max', 'embedding_pooling_operation': 'max', 'threshold': 0.8087912019832685, 'batch_size': 97, 'attention_heads': 4, 'hidden_dimension': 166, 'number_of_hidden_layers': 1, 'dropout_rate': 0.3171817275873596, 'global_pooling': 'mean', 'learning_rate': 0.0006662381624406799, 'weight_decay': 9.003779044523668e-05, 'beta_0': 0.8916334362969301, 'beta_1': 0.9858492051333008, 'epsilon': 2.8274532224293954e-08, 'balanced_loss': False, 'epochs': 98, 'early_stopping_patience': 22, 'plateau_patience': 18, 'plateau_divider': 3}. Best is trial 146 with value: 0.6231222973387793.
[I 2024-12-05 08:31:15,751] Trial 250 finished with value: 0.5482760596764706 and parameters: {'attention_pooling_operation': 'max', 'embedding_pooling_operation': 'max', 'threshold': 0.8132082797514393, 'batch_size': 100, 'attention_heads': 4, 'hidden_dimension': 149, 'number_of_hidden_layers': 1, 'dropout_rate': 0.34538363027643165, 'global_pooling': 'mean', 'learning_rate': 0.0009296842904792744, 'weight_decay': 6.738606818058063e-05, 'beta_0': 0.8328463042522942, 'beta_1': 0.9863405642889955, 'epsilon': 3.6319300294556176e-08, 'balanced_loss': True, 'epochs': 103, 'early_stopping_patience': 17, 'plateau_patience': 17, 'plateau_divider': 3}. Best is trial 146 with value: 0.6231222973387793.
[I 2024-12-05 08:48:11,203] Trial 251 finished with value: 0.561176021858794 and parameters: {'attention_pooling_operation': 'max', 'embedding_pooling_operation': 'max', 'threshold': 0.8059860209527393, 'batch_size': 86, 'attention_heads': 5, 'hidden_dimension': 155, 'number_of_hidden_layers': 1, 'dropout_rate': 0.35536838054404857, 'global_pooling': 'mean', 'learning_rate': 0.0016675564453414503, 'weight_decay': 0.00010754508162037153, 'beta_0': 0.8292410176141225, 'beta_1': 0.9840405504911524, 'epsilon': 1.7812584601352528e-08, 'balanced_loss': True, 'epochs': 99, 'early_stopping_patience': 19, 'plateau_patience': 18, 'plateau_divider': 3}. Best is trial 146 with value: 0.6231222973387793.
[I 2024-12-05 09:05:36,339] Trial 252 finished with value: 0.6098179788023349 and parameters: {'attention_pooling_operation': 'max', 'embedding_pooling_operation': 'max', 'threshold': 0.817270686375264, 'batch_size': 82, 'attention_heads': 4, 'hidden_dimension': 169, 'number_of_hidden_layers': 1, 'dropout_rate': 0.350290174960638, 'global_pooling': 'mean', 'learning_rate': 0.0014380566164433188, 'weight_decay': 0.00018866344012256664, 'beta_0': 0.887947059737681, 'beta_1': 0.9891491883991888, 'epsilon': 2.3810540393845217e-08, 'balanced_loss': True, 'epochs': 95, 'early_stopping_patience': 23, 'plateau_patience': 17, 'plateau_divider': 3}. Best is trial 146 with value: 0.6231222973387793.
[I 2024-12-05 09:22:53,134] Trial 253 finished with value: 0.5714034826673055 and parameters: {'attention_pooling_operation': 'max', 'embedding_pooling_operation': 'max', 'threshold': 0.8100668502372629, 'batch_size': 83, 'attention_heads': 4, 'hidden_dimension': 170, 'number_of_hidden_layers': 1, 'dropout_rate': 0.365515834470186, 'global_pooling': 'mean', 'learning_rate': 0.0021358957220792476, 'weight_decay': 0.0001915559765575721, 'beta_0': 0.8893778530010343, 'beta_1': 0.9893839006714203, 'epsilon': 2.300172738165312e-08, 'balanced_loss': True, 'epochs': 107, 'early_stopping_patience': 23, 'plateau_patience': 17, 'plateau_divider': 3}. Best is trial 146 with value: 0.6231222973387793.
[I 2024-12-05 09:38:21,601] Trial 254 finished with value: 0.5802006737616668 and parameters: {'attention_pooling_operation': 'max', 'embedding_pooling_operation': 'max', 'threshold': 0.8973583327543909, 'batch_size': 81, 'attention_heads': 4, 'hidden_dimension': 169, 'number_of_hidden_layers': 1, 'dropout_rate': 0.3500730909559198, 'global_pooling': 'mean', 'learning_rate': 0.0014477583885613697, 'weight_decay': 0.00015341988647571593, 'beta_0': 0.8872967011228113, 'beta_1': 0.9856848960149167, 'epsilon': 6.055029918955448e-08, 'balanced_loss': True, 'epochs': 93, 'early_stopping_patience': 23, 'plateau_patience': 16, 'plateau_divider': 3}. Best is trial 146 with value: 0.6231222973387793.
[I 2024-12-05 09:53:37,071] Trial 255 finished with value: 0.046943061803638955 and parameters: {'attention_pooling_operation': 'max', 'embedding_pooling_operation': 'max', 'threshold': 0.8159587912487765, 'batch_size': 93, 'attention_heads': 4, 'hidden_dimension': 187, 'number_of_hidden_layers': 1, 'dropout_rate': 0.36013423915612075, 'global_pooling': 'mean', 'learning_rate': 0.07066497681701205, 'weight_decay': 0.00013038355903973397, 'beta_0': 0.8354135830205424, 'beta_1': 0.9903158499620209, 'epsilon': 8.018105091836943e-08, 'balanced_loss': True, 'epochs': 101, 'early_stopping_patience': 22, 'plateau_patience': 17, 'plateau_divider': 3}. Best is trial 146 with value: 0.6231222973387793.
[I 2024-12-05 10:11:24,619] Trial 256 finished with value: 0.5827285802993017 and parameters: {'attention_pooling_operation': 'max', 'embedding_pooling_operation': 'max', 'threshold': 0.8222266367318917, 'batch_size': 90, 'attention_heads': 5, 'hidden_dimension': 181, 'number_of_hidden_layers': 1, 'dropout_rate': 0.35195205964496074, 'global_pooling': 'mean', 'learning_rate': 0.0018543459021398278, 'weight_decay': 2.0415629001066806e-06, 'beta_0': 0.8281151170320914, 'beta_1': 0.9852259540965612, 'epsilon': 4.7182306953849615e-08, 'balanced_loss': True, 'epochs': 95, 'early_stopping_patience': 23, 'plateau_patience': 17, 'plateau_divider': 3}. Best is trial 146 with value: 0.6231222973387793.
[I 2024-12-05 10:28:43,327] Trial 257 finished with value: 0.5878831651238147 and parameters: {'attention_pooling_operation': 'max', 'embedding_pooling_operation': 'max', 'threshold': 0.8113670763520233, 'batch_size': 87, 'attention_heads': 4, 'hidden_dimension': 177, 'number_of_hidden_layers': 1, 'dropout_rate': 0.34515226752328904, 'global_pooling': 'mean', 'learning_rate': 0.001490931361348686, 'weight_decay': 1.3218853837947917e-05, 'beta_0': 0.8907809049147078, 'beta_1': 0.9889747110075581, 'epsilon': 3.503276950016757e-08, 'balanced_loss': True, 'epochs': 104, 'early_stopping_patience': 22, 'plateau_patience': 17, 'plateau_divider': 3}. Best is trial 146 with value: 0.6231222973387793.
[I 2024-12-05 10:46:51,309] Trial 258 finished with value: 0.5459939059055645 and parameters: {'attention_pooling_operation': 'max', 'embedding_pooling_operation': 'max', 'threshold': 0.8031091437851691, 'batch_size': 84, 'attention_heads': 4, 'hidden_dimension': 137, 'number_of_hidden_layers': 1, 'dropout_rate': 0.3550763533493177, 'global_pooling': 'mean', 'learning_rate': 0.0008005469058557299, 'weight_decay': 0.00021949820725447497, 'beta_0': 0.8370382385730956, 'beta_1': 0.9859960193976796, 'epsilon': 2.3347831627818975e-08, 'balanced_loss': True, 'epochs': 98, 'early_stopping_patience': 23, 'plateau_patience': 17, 'plateau_divider': 5}. Best is trial 146 with value: 0.6231222973387793.
[I 2024-12-05 11:02:02,953] Trial 259 finished with value: 0.5661039053478529 and parameters: {'attention_pooling_operation': 'max', 'embedding_pooling_operation': 'max', 'threshold': 0.917418525782356, 'batch_size': 98, 'attention_heads': 4, 'hidden_dimension': 164, 'number_of_hidden_layers': 1, 'dropout_rate': 0.3674134506856579, 'global_pooling': 'mean', 'learning_rate': 0.0010126464964197797, 'weight_decay': 7.97416223029397e-06, 'beta_0': 0.8320142415673756, 'beta_1': 0.9936313728531893, 'epsilon': 5.611662541583436e-08, 'balanced_loss': True, 'epochs': 91, 'early_stopping_patience': 22, 'plateau_patience': 16, 'plateau_divider': 9}. Best is trial 146 with value: 0.6231222973387793.
[I 2024-12-05 11:19:16,064] Trial 260 finished with value: 0.5643164450739286 and parameters: {'attention_pooling_operation': 'max', 'embedding_pooling_operation': 'max', 'threshold': 0.8185395865383412, 'batch_size': 95, 'attention_heads': 4, 'hidden_dimension': 144, 'number_of_hidden_layers': 1, 'dropout_rate': 0.34360422902101795, 'global_pooling': 'mean', 'learning_rate': 0.0005693552413440151, 'weight_decay': 1.595042705724949e-05, 'beta_0': 0.8343811424650118, 'beta_1': 0.9866985653483645, 'epsilon': 4.171740790553859e-08, 'balanced_loss': True, 'epochs': 94, 'early_stopping_patience': 23, 'plateau_patience': 17, 'plateau_divider': 4}. Best is trial 146 with value: 0.6231222973387793.
[I 2024-12-05 11:39:14,863] Trial 261 finished with value: 0.5623800014084864 and parameters: {'attention_pooling_operation': 'max', 'embedding_pooling_operation': 'mean', 'threshold': 0.8072277129200511, 'batch_size': 80, 'attention_heads': 4, 'hidden_dimension': 184, 'number_of_hidden_layers': 1, 'dropout_rate': 0.3599590910510409, 'global_pooling': 'max', 'learning_rate': 0.001284095620185711, 'weight_decay': 8.275223300304483e-05, 'beta_0': 0.8929812463724741, 'beta_1': 0.9846508330615111, 'epsilon': 6.703652782615972e-08, 'balanced_loss': True, 'epochs': 111, 'early_stopping_patience': 20, 'plateau_patience': 10, 'plateau_divider': 6}. Best is trial 146 with value: 0.6231222973387793.
[I 2024-12-05 11:55:20,572] Trial 262 finished with value: 0.36453956439342755 and parameters: {'attention_pooling_operation': 'max', 'embedding_pooling_operation': 'max', 'threshold': 0.8133696757300001, 'batch_size': 82, 'attention_heads': 5, 'hidden_dimension': 174, 'number_of_hidden_layers': 1, 'dropout_rate': 0.497440362713505, 'global_pooling': 'mean', 'learning_rate': 0.0016580937803423613, 'weight_decay': 0.00018121417980783327, 'beta_0': 0.8421825212031684, 'beta_1': 0.9854503199367494, 'epsilon': 3.158031069951029e-08, 'balanced_loss': True, 'epochs': 100, 'early_stopping_patience': 22, 'plateau_patience': 17, 'plateau_divider': 9}. Best is trial 146 with value: 0.6231222973387793.
[I 2024-12-05 12:12:12,480] Trial 263 finished with value: 0.5910841651129012 and parameters: {'attention_pooling_operation': 'max', 'embedding_pooling_operation': 'max', 'threshold': 0.8210076082100851, 'batch_size': 48, 'attention_heads': 4, 'hidden_dimension': 165, 'number_of_hidden_layers': 1, 'dropout_rate': 0.33475680149207465, 'global_pooling': 'mean', 'learning_rate': 0.0010994018904322356, 'weight_decay': 0.00014682188582109876, 'beta_0': 0.8297990642387842, 'beta_1': 0.9883557595868853, 'epsilon': 2.055645900270181e-08, 'balanced_loss': True, 'epochs': 105, 'early_stopping_patience': 22, 'plateau_patience': 16, 'plateau_divider': 3}. Best is trial 146 with value: 0.6231222973387793.
[I 2024-12-05 12:28:32,734] Trial 264 finished with value: 0.546923667992055 and parameters: {'attention_pooling_operation': 'max', 'embedding_pooling_operation': 'max', 'threshold': 0.8000406529600167, 'batch_size': 92, 'attention_heads': 4, 'hidden_dimension': 152, 'number_of_hidden_layers': 1, 'dropout_rate': 0.3500795900011367, 'global_pooling': 'mean', 'learning_rate': 0.0022802462198887948, 'weight_decay': 0.00011168163889802943, 'beta_0': 0.8313558108407424, 'beta_1': 0.9864037336640832, 'epsilon': 2.5874299497735714e-08, 'balanced_loss': True, 'epochs': 98, 'early_stopping_patience': 22, 'plateau_patience': 17, 'plateau_divider': 10}. Best is trial 146 with value: 0.6231222973387793.
[I 2024-12-05 12:41:50,469] Trial 265 finished with value: 0.5296585341339118 and parameters: {'attention_pooling_operation': 'max', 'embedding_pooling_operation': 'max', 'threshold': 0.9871596350564519, 'batch_size': 88, 'attention_heads': 4, 'hidden_dimension': 170, 'number_of_hidden_layers': 1, 'dropout_rate': 0.3427995141287026, 'global_pooling': 'mean', 'learning_rate': 0.0008426905794641276, 'weight_decay': 5.989014983888206e-05, 'beta_0': 0.8378218054583807, 'beta_1': 0.9896524380493296, 'epsilon': 1.509286144585793e-08, 'balanced_loss': True, 'epochs': 84, 'early_stopping_patience': 23, 'plateau_patience': 17, 'plateau_divider': 3}. Best is trial 146 with value: 0.6231222973387793.
[I 2024-12-05 12:58:35,858] Trial 266 finished with value: 0.5623563217946327 and parameters: {'attention_pooling_operation': 'max', 'embedding_pooling_operation': 'max', 'threshold': 0.8403217434348191, 'batch_size': 99, 'attention_heads': 5, 'hidden_dimension': 133, 'number_of_hidden_layers': 1, 'dropout_rate': 0.3728221320598962, 'global_pooling': 'mean', 'learning_rate': 0.0012648886285788524, 'weight_decay': 1.7976731930627467e-05, 'beta_0': 0.8270338342684053, 'beta_1': 0.9849581447049535, 'epsilon': 4.7216463396759586e-08, 'balanced_loss': True, 'epochs': 90, 'early_stopping_patience': 22, 'plateau_patience': 18, 'plateau_divider': 9}. Best is trial 146 with value: 0.6231222973387793.
