[I 2024-11-29 16:23:18,153] Trial 172 finished with value: 0.6075145048360536 and parameters: {'left_stride': 128, 'right_stride': 256, 'attention_pooling_operation': 'max', 'embedding_pooling_operation': 'mean', 'threshold': 0.8933984202091426, 'batch_size': 64, 'attention_heads': 9, 'hidden_dimension': 104, 'number_of_hidden_layers': 2, 'dropout_rate': 0.4875997834348232, 'global_pooling': 'max', 'learning_rate': 0.0006253073127368895, 'weight_decay': 2.6120391959819135e-05, 'beta_0': 0.8421695146708618, 'beta_1': 0.9902521693753089, 'epsilon': 5.293273756054346e-05, 'balanced_loss': False, 'epochs': 109, 'early_stopping_patience': 21, 'plateau_patience': 15, 'plateau_divider': 6}. Best is trial 91 with value: 0.647956342753587.
[I 2024-11-29 16:36:57,751] Trial 173 finished with value: 0.6043347589450029 and parameters: {'left_stride': 128, 'right_stride': 256, 'attention_pooling_operation': 'max', 'embedding_pooling_operation': 'mean', 'threshold': 0.9058386424021753, 'batch_size': 59, 'attention_heads': 9, 'hidden_dimension': 95, 'number_of_hidden_layers': 4, 'dropout_rate': 0.49631634006601716, 'global_pooling': 'max', 'learning_rate': 0.0004155759995058708, 'weight_decay': 2.1928164861055604e-05, 'beta_0': 0.8315519975454737, 'beta_1': 0.9905316552448933, 'epsilon': 4.3017762845325745e-06, 'balanced_loss': False, 'epochs': 119, 'early_stopping_patience': 22, 'plateau_patience': 14, 'plateau_divider': 5}. Best is trial 91 with value: 0.647956342753587.
[I 2024-11-29 16:48:19,304] Trial 174 finished with value: 0.5987550228933202 and parameters: {'left_stride': 128, 'right_stride': 256, 'attention_pooling_operation': 'max', 'embedding_pooling_operation': 'mean', 'threshold': 0.9137464828591083, 'batch_size': 62, 'attention_heads': 9, 'hidden_dimension': 108, 'number_of_hidden_layers': 2, 'dropout_rate': 0.5155988775005457, 'global_pooling': 'max', 'learning_rate': 0.0008163381741319149, 'weight_decay': 1.9330237812294216e-05, 'beta_0': 0.836946126557341, 'beta_1': 0.9923936614696286, 'epsilon': 3.2119389991924576e-06, 'balanced_loss': False, 'epochs': 107, 'early_stopping_patience': 21, 'plateau_patience': 12, 'plateau_divider': 6}. Best is trial 91 with value: 0.647956342753587.
[I 2024-11-29 17:00:43,103] Trial 175 finished with value: 0.6227715866530747 and parameters: {'left_stride': 128, 'right_stride': 256, 'attention_pooling_operation': 'max', 'embedding_pooling_operation': 'mean', 'threshold': 0.8987545431993181, 'batch_size': 68, 'attention_heads': 9, 'hidden_dimension': 101, 'number_of_hidden_layers': 2, 'dropout_rate': 0.46983593563279685, 'global_pooling': 'max', 'learning_rate': 0.0005536042793650294, 'weight_decay': 3.236717554177345e-05, 'beta_0': 0.8397206394243528, 'beta_1': 0.9919916202418748, 'epsilon': 4.2105709070196355e-05, 'balanced_loss': False, 'epochs': 115, 'early_stopping_patience': 22, 'plateau_patience': 11, 'plateau_divider': 7}. Best is trial 91 with value: 0.647956342753587.
[I 2024-11-29 17:12:18,332] Trial 176 finished with value: 0.6347710571739749 and parameters: {'left_stride': 128, 'right_stride': 0, 'attention_pooling_operation': 'max', 'embedding_pooling_operation': 'mean', 'threshold': 0.9051362016479366, 'batch_size': 71, 'attention_heads': 9, 'hidden_dimension': 90, 'number_of_hidden_layers': 2, 'dropout_rate': 0.5064151336441923, 'global_pooling': 'max', 'learning_rate': 0.0004438408009965436, 'weight_decay': 2.6272343047739905e-05, 'beta_0': 0.8433900321783658, 'beta_1': 0.9910675060179099, 'epsilon': 1.7340566974220329e-06, 'balanced_loss': False, 'epochs': 111, 'early_stopping_patience': 21, 'plateau_patience': 13, 'plateau_divider': 5}. Best is trial 91 with value: 0.647956342753587.
[I 2024-11-29 17:23:34,429] Trial 177 finished with value: 0.5988022526936448 and parameters: {'left_stride': 128, 'right_stride': 32, 'attention_pooling_operation': 'mean', 'embedding_pooling_operation': 'mean', 'threshold': 0.9128708033180385, 'batch_size': 72, 'attention_heads': 8, 'hidden_dimension': 90, 'number_of_hidden_layers': 2, 'dropout_rate': 0.5077755865955341, 'global_pooling': 'max', 'learning_rate': 0.0009861793852151116, 'weight_decay': 3.6326124624345414e-05, 'beta_0': 0.8437880173075716, 'beta_1': 0.9896881316395251, 'epsilon': 2.710849527014758e-06, 'balanced_loss': False, 'epochs': 111, 'early_stopping_patience': 22, 'plateau_patience': 13, 'plateau_divider': 5}. Best is trial 91 with value: 0.647956342753587.
[I 2024-11-29 17:35:33,662] Trial 178 finished with value: 0.6227137973946268 and parameters: {'left_stride': 128, 'right_stride': 0, 'attention_pooling_operation': 'max', 'embedding_pooling_operation': 'mean', 'threshold': 0.9004382334484617, 'batch_size': 71, 'attention_heads': 9, 'hidden_dimension': 111, 'number_of_hidden_layers': 2, 'dropout_rate': 0.5250978952519205, 'global_pooling': 'max', 'learning_rate': 0.0006832768509064886, 'weight_decay': 0.0002550673219383513, 'beta_0': 0.8495660923915337, 'beta_1': 0.9911307890063707, 'epsilon': 1.761743826240216e-06, 'balanced_loss': False, 'epochs': 101, 'early_stopping_patience': 20, 'plateau_patience': 12, 'plateau_divider': 5}. Best is trial 91 with value: 0.647956342753587.
[I 2024-11-29 17:47:06,822] Trial 179 finished with value: 0.5955673475749663 and parameters: {'left_stride': 128, 'right_stride': 0, 'attention_pooling_operation': 'max', 'embedding_pooling_operation': 'mean', 'threshold': 0.9169685429745803, 'batch_size': 66, 'attention_heads': 9, 'hidden_dimension': 106, 'number_of_hidden_layers': 2, 'dropout_rate': 0.476821845624776, 'global_pooling': 'mean', 'learning_rate': 0.00043433005275104076, 'weight_decay': 0.0003769275714389363, 'beta_0': 0.846638886881423, 'beta_1': 0.9912839911145638, 'epsilon': 9.64373852963277e-07, 'balanced_loss': False, 'epochs': 56, 'early_stopping_patience': 22, 'plateau_patience': 13, 'plateau_divider': 5}. Best is trial 91 with value: 0.647956342753587.
[I 2024-11-29 17:57:59,364] Trial 180 finished with value: 0.6257593962200839 and parameters: {'left_stride': 128, 'right_stride': 0, 'attention_pooling_operation': 'max', 'embedding_pooling_operation': 'mean', 'threshold': 0.9238400162346866, 'batch_size': 76, 'attention_heads': 8, 'hidden_dimension': 93, 'number_of_hidden_layers': 2, 'dropout_rate': 0.5114562901321222, 'global_pooling': 'max', 'learning_rate': 0.0006052868985355931, 'weight_decay': 2.361808820376712e-05, 'beta_0': 0.8405697263062665, 'beta_1': 0.9909749840327156, 'epsilon': 1.5862031179160127e-06, 'balanced_loss': False, 'epochs': 120, 'early_stopping_patience': 21, 'plateau_patience': 13, 'plateau_divider': 5}. Best is trial 91 with value: 0.647956342753587.
[I 2024-11-29 18:09:49,724] Trial 181 finished with value: 0.6231789588680877 and parameters: {'left_stride': 128, 'right_stride': 0, 'attention_pooling_operation': 'max', 'embedding_pooling_operation': 'mean', 'threshold': 0.9076283191529005, 'batch_size': 64, 'attention_heads': 9, 'hidden_dimension': 99, 'number_of_hidden_layers': 2, 'dropout_rate': 0.4931287525767291, 'global_pooling': 'max', 'learning_rate': 0.0005180556819584426, 'weight_decay': 2.6661726113637005e-05, 'beta_0': 0.8426238673079902, 'beta_1': 0.9917754283270289, 'epsilon': 2.232734550122823e-06, 'balanced_loss': False, 'epochs': 105, 'early_stopping_patience': 21, 'plateau_patience': 14, 'plateau_divider': 6}. Best is trial 91 with value: 0.647956342753587.
[I 2024-11-29 18:22:04,235] Trial 182 finished with value: 0.6109106641291604 and parameters: {'left_stride': 128, 'right_stride': 256, 'attention_pooling_operation': 'max', 'embedding_pooling_operation': 'mean', 'threshold': 0.9036037379620349, 'batch_size': 61, 'attention_heads': 9, 'hidden_dimension': 104, 'number_of_hidden_layers': 2, 'dropout_rate': 0.488047584887039, 'global_pooling': 'max', 'learning_rate': 0.0004260389609147268, 'weight_decay': 3.0826049051926874e-05, 'beta_0': 0.8383712990419844, 'beta_1': 0.9924585939167113, 'epsilon': 1.1356696462765325e-06, 'balanced_loss': False, 'epochs': 110, 'early_stopping_patience': 21, 'plateau_patience': 16, 'plateau_divider': 6}. Best is trial 91 with value: 0.647956342753587.
[I 2024-11-29 18:33:45,776] Trial 183 finished with value: 0.6250390447472776 and parameters: {'left_stride': 128, 'right_stride': 0, 'attention_pooling_operation': 'max', 'embedding_pooling_operation': 'mean', 'threshold': 0.9085751696245291, 'batch_size': 58, 'attention_heads': 9, 'hidden_dimension': 114, 'number_of_hidden_layers': 2, 'dropout_rate': 0.4990248538740786, 'global_pooling': 'max', 'learning_rate': 0.0007025296099466187, 'weight_decay': 2.8413542395751967e-05, 'beta_0': 0.8351445678029483, 'beta_1': 0.9904764668352655, 'epsilon': 1.184917309132886e-05, 'balanced_loss': False, 'epochs': 115, 'early_stopping_patience': 21, 'plateau_patience': 13, 'plateau_divider': 6}. Best is trial 91 with value: 0.647956342753587.
[I 2024-11-29 18:45:10,055] Trial 184 finished with value: 0.6217365220306386 and parameters: {'left_stride': 0, 'right_stride': 256, 'attention_pooling_operation': 'max', 'embedding_pooling_operation': 'mean', 'threshold': 0.9122866388684214, 'batch_size': 63, 'attention_heads': 9, 'hidden_dimension': 97, 'number_of_hidden_layers': 2, 'dropout_rate': 0.4651867786531868, 'global_pooling': 'max', 'learning_rate': 0.00046868264524868114, 'weight_decay': 3.411186791515863e-05, 'beta_0': 0.8334035410691355, 'beta_1': 0.9913331254631035, 'epsilon': 3.119250344277436e-05, 'balanced_loss': False, 'epochs': 106, 'early_stopping_patience': 22, 'plateau_patience': 12, 'plateau_divider': 6}. Best is trial 91 with value: 0.647956342753587.
[I 2024-11-29 18:56:36,986] Trial 185 finished with value: 0.6245375451555074 and parameters: {'left_stride': 128, 'right_stride': 256, 'attention_pooling_operation': 'max', 'embedding_pooling_operation': 'mean', 'threshold': 0.8952261640945889, 'batch_size': 69, 'attention_heads': 8, 'hidden_dimension': 109, 'number_of_hidden_layers': 2, 'dropout_rate': 0.4802544678018874, 'global_pooling': 'max', 'learning_rate': 0.00087297819083805, 'weight_decay': 1.9978610415517382e-05, 'beta_0': 0.8450908309514708, 'beta_1': 0.9933196881608157, 'epsilon': 6.8095835860219716e-06, 'balanced_loss': False, 'epochs': 112, 'early_stopping_patience': 21, 'plateau_patience': 13, 'plateau_divider': 6}. Best is trial 91 with value: 0.647956342753587.
The selected strides are greater or equal to the total chunk size.
[I 2024-11-29 18:56:38,565] Trial 186 finished with value: -1.0 and parameters: {'left_stride': 256, 'right_stride': 256, 'attention_pooling_operation': 'max', 'embedding_pooling_operation': 'mean', 'threshold': 0.9051364878703049, 'batch_size': 60, 'attention_heads': 10, 'hidden_dimension': 101, 'number_of_hidden_layers': 2, 'dropout_rate': 0.487461797609122, 'global_pooling': 'max', 'learning_rate': 0.000564308839478641, 'weight_decay': 2.4887173183661657e-05, 'beta_0': 0.840678511811839, 'beta_1': 0.9922530089375167, 'epsilon': 4.8698077721088876e-05, 'balanced_loss': False, 'epochs': 99, 'early_stopping_patience': 22, 'plateau_patience': 12, 'plateau_divider': 7}. Best is trial 91 with value: 0.647956342753587.
[I 2024-11-29 19:08:39,557] Trial 187 finished with value: 0.6352239119911596 and parameters: {'left_stride': 128, 'right_stride': 32, 'attention_pooling_operation': 'max', 'embedding_pooling_operation': 'mean', 'threshold': 0.9013492310009736, 'batch_size': 66, 'attention_heads': 9, 'hidden_dimension': 113, 'number_of_hidden_layers': 2, 'dropout_rate': 0.47186334097528226, 'global_pooling': 'max', 'learning_rate': 0.00036078095737185676, 'weight_decay': 3.8898545019948185e-05, 'beta_0': 0.8375367549354584, 'beta_1': 0.9898951925615141, 'epsilon': 1.8816766372178753e-06, 'balanced_loss': False, 'epochs': 108, 'early_stopping_patience': 20, 'plateau_patience': 14, 'plateau_divider': 5}. Best is trial 91 with value: 0.647956342753587.
[I 2024-11-29 19:20:56,326] Trial 188 finished with value: 0.6332018337342241 and parameters: {'left_stride': 128, 'right_stride': 32, 'attention_pooling_operation': 'max', 'embedding_pooling_operation': 'mean', 'threshold': 0.8990436904617105, 'batch_size': 66, 'attention_heads': 9, 'hidden_dimension': 117, 'number_of_hidden_layers': 2, 'dropout_rate': 0.47307155047565447, 'global_pooling': 'max', 'learning_rate': 0.00039179071278224614, 'weight_decay': 3.934176401594224e-05, 'beta_0': 0.8427258956124611, 'beta_1': 0.9899932053754338, 'epsilon': 1.7274165931918431e-06, 'balanced_loss': False, 'epochs': 103, 'early_stopping_patience': 20, 'plateau_patience': 12, 'plateau_divider': 5}. Best is trial 91 with value: 0.647956342753587.
[I 2024-11-29 19:33:02,804] Trial 189 finished with value: 0.5905477235894834 and parameters: {'left_stride': 128, 'right_stride': 32, 'attention_pooling_operation': 'max', 'embedding_pooling_operation': 'min', 'threshold': 0.9163336419021991, 'batch_size': 67, 'attention_heads': 10, 'hidden_dimension': 117, 'number_of_hidden_layers': 2, 'dropout_rate': 0.47124446757676053, 'global_pooling': 'max', 'learning_rate': 0.00035423547842864306, 'weight_decay': 4.046105643938881e-05, 'beta_0': 0.8508280839340783, 'beta_1': 0.9905646535667618, 'epsilon': 1.5084949695968301e-06, 'balanced_loss': False, 'epochs': 103, 'early_stopping_patience': 20, 'plateau_patience': 11, 'plateau_divider': 5}. Best is trial 91 with value: 0.647956342753587.
[I 2024-11-29 19:44:51,802] Trial 190 finished with value: 0.5429807560567012 and parameters: {'left_stride': 128, 'right_stride': 32, 'attention_pooling_operation': 'max', 'embedding_pooling_operation': 'mean', 'threshold': 0.888308399887915, 'batch_size': 69, 'attention_heads': 9, 'hidden_dimension': 113, 'number_of_hidden_layers': 2, 'dropout_rate': 0.45716580589905975, 'global_pooling': 'sum', 'learning_rate': 0.0002544094024251338, 'weight_decay': 4.684555279960408e-05, 'beta_0': 0.8436835279608147, 'beta_1': 0.9900773143966285, 'epsilon': 1.906611237157502e-06, 'balanced_loss': False, 'epochs': 97, 'early_stopping_patience': 19, 'plateau_patience': 12, 'plateau_divider': 5}. Best is trial 91 with value: 0.647956342753587.
[I 2024-11-29 19:57:18,580] Trial 191 finished with value: 0.6294787342476059 and parameters: {'left_stride': 128, 'right_stride': 32, 'attention_pooling_operation': 'max', 'embedding_pooling_operation': 'mean', 'threshold': 0.8983062195996533, 'batch_size': 73, 'attention_heads': 9, 'hidden_dimension': 109, 'number_of_hidden_layers': 2, 'dropout_rate': 0.4644279432862163, 'global_pooling': 'max', 'learning_rate': 0.00039024370594628637, 'weight_decay': 3.450937682722794e-05, 'beta_0': 0.8418848359074007, 'beta_1': 0.9898025064453495, 'epsilon': 1.8314562342820453e-06, 'balanced_loss': False, 'epochs': 106, 'early_stopping_patience': 20, 'plateau_patience': 12, 'plateau_divider': 5}. Best is trial 91 with value: 0.647956342753587.
[I 2024-11-29 20:09:47,089] Trial 192 finished with value: 0.6308677414548068 and parameters: {'left_stride': 128, 'right_stride': 32, 'attention_pooling_operation': 'max', 'embedding_pooling_operation': 'mean', 'threshold': 0.8936268745313524, 'batch_size': 71, 'attention_heads': 9, 'hidden_dimension': 118, 'number_of_hidden_layers': 2, 'dropout_rate': 0.46195967820497813, 'global_pooling': 'max', 'learning_rate': 0.00037113918381507307, 'weight_decay': 3.7834703673686815e-05, 'beta_0': 0.8471851913352879, 'beta_1': 0.9892231907189322, 'epsilon': 2.9745265820745513e-06, 'balanced_loss': False, 'epochs': 102, 'early_stopping_patience': 20, 'plateau_patience': 12, 'plateau_divider': 5}. Best is trial 91 with value: 0.647956342753587.
[I 2024-11-29 20:22:04,003] Trial 193 finished with value: 0.6136568946731573 and parameters: {'left_stride': 128, 'right_stride': 32, 'attention_pooling_operation': 'max', 'embedding_pooling_operation': 'mean', 'threshold': 0.8813078157392097, 'batch_size': 71, 'attention_heads': 9, 'hidden_dimension': 119, 'number_of_hidden_layers': 2, 'dropout_rate': 0.4657383501448595, 'global_pooling': 'max', 'learning_rate': 0.0003664752339333583, 'weight_decay': 3.7981500795950574e-05, 'beta_0': 0.8422843579308587, 'beta_1': 0.9892583156110011, 'epsilon': 2.787228339984828e-06, 'balanced_loss': False, 'epochs': 101, 'early_stopping_patience': 19, 'plateau_patience': 12, 'plateau_divider': 5}. Best is trial 91 with value: 0.647956342753587.
[I 2024-11-29 20:34:13,766] Trial 194 finished with value: 0.6149928796932531 and parameters: {'left_stride': 128, 'right_stride': 32, 'attention_pooling_operation': 'max', 'embedding_pooling_operation': 'mean', 'threshold': 0.8902067868230498, 'batch_size': 74, 'attention_heads': 9, 'hidden_dimension': 112, 'number_of_hidden_layers': 2, 'dropout_rate': 0.46121524011243653, 'global_pooling': 'max', 'learning_rate': 0.0003878057800072188, 'weight_decay': 4.451552417059045e-05, 'beta_0': 0.846548422480486, 'beta_1': 0.9886330321689599, 'epsilon': 3.7575346247300694e-06, 'balanced_loss': False, 'epochs': 104, 'early_stopping_patience': 20, 'plateau_patience': 12, 'plateau_divider': 5}. Best is trial 91 with value: 0.647956342753587.
[I 2024-11-29 20:46:05,699] Trial 195 finished with value: 0.6251618831220632 and parameters: {'left_stride': 128, 'right_stride': 32, 'attention_pooling_operation': 'max', 'embedding_pooling_operation': 'mean', 'threshold': 0.8956725834378637, 'batch_size': 73, 'attention_heads': 8, 'hidden_dimension': 116, 'number_of_hidden_layers': 2, 'dropout_rate': 0.4712444369523313, 'global_pooling': 'max', 'learning_rate': 0.00032191841100998904, 'weight_decay': 3.399358930393402e-05, 'beta_0': 0.8489825989309023, 'beta_1': 0.9898483094731809, 'epsilon': 2.0927898672994836e-06, 'balanced_loss': False, 'epochs': 106, 'early_stopping_patience': 20, 'plateau_patience': 11, 'plateau_divider': 5}. Best is trial 91 with value: 0.647956342753587.
[I 2024-11-29 20:58:12,563] Trial 196 finished with value: 0.6261762050717468 and parameters: {'left_stride': 128, 'right_stride': 32, 'attention_pooling_operation': 'max', 'embedding_pooling_operation': 'mean', 'threshold': 0.9007920424157144, 'batch_size': 66, 'attention_heads': 9, 'hidden_dimension': 108, 'number_of_hidden_layers': 2, 'dropout_rate': 0.4767581376483973, 'global_pooling': 'max', 'learning_rate': 0.00043086469979369916, 'weight_decay': 3.909211468590546e-05, 'beta_0': 0.8395611110349055, 'beta_1': 0.9887121499814335, 'epsilon': 1.7144661714213642e-06, 'balanced_loss': False, 'epochs': 100, 'early_stopping_patience': 19, 'plateau_patience': 13, 'plateau_divider': 5}. Best is trial 91 with value: 0.647956342753587.
[I 2024-11-29 21:11:23,295] Trial 197 finished with value: 0.5238100658136383 and parameters: {'left_stride': 64, 'right_stride': 32, 'attention_pooling_operation': 'min', 'embedding_pooling_operation': 'mean', 'threshold': 0.8930850767950623, 'batch_size': 78, 'attention_heads': 10, 'hidden_dimension': 120, 'number_of_hidden_layers': 2, 'dropout_rate': 0.4522453863858306, 'global_pooling': 'max', 'learning_rate': 0.00027642517813757854, 'weight_decay': 3.2557564718462754e-05, 'beta_0': 0.8423342525292089, 'beta_1': 0.9897110399668096, 'epsilon': 2.768263487720974e-06, 'balanced_loss': False, 'epochs': 95, 'early_stopping_patience': 20, 'plateau_patience': 12, 'plateau_divider': 5}. Best is trial 91 with value: 0.647956342753587.
[I 2024-11-29 21:22:40,464] Trial 198 finished with value: 0.6104289880077287 and parameters: {'left_stride': 128, 'right_stride': 32, 'attention_pooling_operation': 'max', 'embedding_pooling_operation': 'mean', 'threshold': 0.9098644257430842, 'batch_size': 68, 'attention_heads': 9, 'hidden_dimension': 110, 'number_of_hidden_layers': 2, 'dropout_rate': 0.46340236943570723, 'global_pooling': 'max', 'learning_rate': 0.00048740887700071087, 'weight_decay': 5.1504759971725504e-05, 'beta_0': 0.8442406537191677, 'beta_1': 0.9893973937169764, 'epsilon': 2.4803733152358884e-06, 'balanced_loss': False, 'epochs': 103, 'early_stopping_patience': 20, 'plateau_patience': 13, 'plateau_divider': 5}. Best is trial 91 with value: 0.647956342753587.
[I 2024-11-29 21:34:23,674] Trial 199 finished with value: 0.6173130469233498 and parameters: {'left_stride': 128, 'right_stride': 32, 'attention_pooling_operation': 'max', 'embedding_pooling_operation': 'mean', 'threshold': 0.9025759403876313, 'batch_size': 58, 'attention_heads': 10, 'hidden_dimension': 116, 'number_of_hidden_layers': 2, 'dropout_rate': 0.47196452692563573, 'global_pooling': 'max', 'learning_rate': 0.0003437333080202767, 'weight_decay': 4.008467852767437e-05, 'beta_0': 0.8476934869889069, 'beta_1': 0.9889491254150071, 'epsilon': 5.0544149622360555e-06, 'balanced_loss': False, 'epochs': 107, 'early_stopping_patience': 13, 'plateau_patience': 12, 'plateau_divider': 5}. Best is trial 91 with value: 0.647956342753587.
[I 2024-11-29 21:46:46,462] Trial 200 finished with value: 0.6253682157281127 and parameters: {'left_stride': 128, 'right_stride': 32, 'attention_pooling_operation': 'max', 'embedding_pooling_operation': 'mean', 'threshold': 0.8844843137910094, 'batch_size': 56, 'attention_heads': 9, 'hidden_dimension': 123, 'number_of_hidden_layers': 2, 'dropout_rate': 0.4607082689411028, 'global_pooling': 'max', 'learning_rate': 0.0005987447212279112, 'weight_decay': 4.559404495378228e-05, 'beta_0': 0.8401548358706541, 'beta_1': 0.9900785585750707, 'epsilon': 1.9234535984091905e-06, 'balanced_loss': False, 'epochs': 98, 'early_stopping_patience': 20, 'plateau_patience': 12, 'plateau_divider': 5}. Best is trial 91 with value: 0.647956342753587.
