[I 2024-11-28 23:29:00,677] Trial 85 finished with value: 0.5908936980484089 and parameters: {'left_stride': 128, 'right_stride': 32, 'attention_pooling_operation': 'max', 'embedding_pooling_operation': 'mean', 'threshold': 0.9151302233230629, 'batch_size': 56, 'attention_heads': 8, 'hidden_dimension': 111, 'number_of_hidden_layers': 2, 'dropout_rate': 0.46686630664493434, 'global_pooling': 'mean', 'learning_rate': 0.0007567522165812516, 'weight_decay': 7.4538148482091114e-06, 'beta_0': 0.8391490123794358, 'beta_1': 0.9954364548040799, 'epsilon': 2.5671436365435338e-05, 'balanced_loss': False, 'epochs': 92, 'early_stopping_patience': 23, 'plateau_patience': 13, 'plateau_divider': 4}. Best is trial 82 with value: 0.6397713587522667.
[I 2024-11-28 23:40:43,220] Trial 86 finished with value: 0.5282524177599665 and parameters: {'left_stride': 128, 'right_stride': 32, 'attention_pooling_operation': 'max', 'embedding_pooling_operation': 'max', 'threshold': 0.9019828659197403, 'batch_size': 64, 'attention_heads': 8, 'hidden_dimension': 133, 'number_of_hidden_layers': 2, 'dropout_rate': 0.4724464947475313, 'global_pooling': 'sum', 'learning_rate': 0.0002698426141260857, 'weight_decay': 8.933264772680161e-06, 'beta_0': 0.8475125459480829, 'beta_1': 0.9939431907937633, 'epsilon': 3.931622366932075e-05, 'balanced_loss': True, 'epochs': 70, 'early_stopping_patience': 20, 'plateau_patience': 15, 'plateau_divider': 5}. Best is trial 82 with value: 0.6397713587522667.
[I 2024-11-28 23:52:21,929] Trial 87 finished with value: 0.622710354573027 and parameters: {'left_stride': 128, 'right_stride': 32, 'attention_pooling_operation': 'max', 'embedding_pooling_operation': 'mean', 'threshold': 0.9240871296809277, 'batch_size': 50, 'attention_heads': 10, 'hidden_dimension': 120, 'number_of_hidden_layers': 2, 'dropout_rate': 0.49093983365339394, 'global_pooling': 'max', 'learning_rate': 0.0004729367974728954, 'weight_decay': 9.682996416326983e-05, 'beta_0': 0.8328114426724669, 'beta_1': 0.9983400070215036, 'epsilon': 8.810551153970231e-06, 'balanced_loss': False, 'epochs': 107, 'early_stopping_patience': 22, 'plateau_patience': 12, 'plateau_divider': 5}. Best is trial 82 with value: 0.6397713587522667.
[I 2024-11-29 00:04:04,431] Trial 88 finished with value: 0.5100150542674285 and parameters: {'left_stride': 128, 'right_stride': 32, 'attention_pooling_operation': 'min', 'embedding_pooling_operation': 'mean', 'threshold': 0.9228916618587091, 'batch_size': 49, 'attention_heads': 10, 'hidden_dimension': 119, 'number_of_hidden_layers': 2, 'dropout_rate': 0.48990328826350515, 'global_pooling': 'max', 'learning_rate': 0.0008869136190173771, 'weight_decay': 8.977070835715187e-05, 'beta_0': 0.8309835622796669, 'beta_1': 0.9970668163333881, 'epsilon': 9.589263866912157e-06, 'balanced_loss': False, 'epochs': 108, 'early_stopping_patience': 21, 'plateau_patience': 12, 'plateau_divider': 4}. Best is trial 82 with value: 0.6397713587522667.
[I 2024-11-29 00:16:00,792] Trial 89 finished with value: 0.618778168886968 and parameters: {'left_stride': 32, 'right_stride': 32, 'attention_pooling_operation': 'max', 'embedding_pooling_operation': 'mean', 'threshold': 0.9394477553472462, 'batch_size': 58, 'attention_heads': 10, 'hidden_dimension': 139, 'number_of_hidden_layers': 2, 'dropout_rate': 0.507144724580411, 'global_pooling': 'max', 'learning_rate': 0.0005078571418911819, 'weight_decay': 5.282579377401017e-05, 'beta_0': 0.833720663029438, 'beta_1': 0.9985152150413418, 'epsilon': 1.3180615372990221e-05, 'balanced_loss': False, 'epochs': 95, 'early_stopping_patience': 22, 'plateau_patience': 11, 'plateau_divider': 5}. Best is trial 82 with value: 0.6397713587522667.
[I 2024-11-29 00:28:27,836] Trial 90 finished with value: 0.6122243701205433 and parameters: {'left_stride': 32, 'right_stride': 32, 'attention_pooling_operation': 'max', 'embedding_pooling_operation': 'mean', 'threshold': 0.9299552902205354, 'batch_size': 46, 'attention_heads': 10, 'hidden_dimension': 144, 'number_of_hidden_layers': 2, 'dropout_rate': 0.5075250265429044, 'global_pooling': 'max', 'learning_rate': 0.0005455148749948021, 'weight_decay': 4.957629463913154e-05, 'beta_0': 0.8332117201263693, 'beta_1': 0.9987188955789873, 'epsilon': 1.419282806504498e-05, 'balanced_loss': False, 'epochs': 79, 'early_stopping_patience': 24, 'plateau_patience': 11, 'plateau_divider': 5}. Best is trial 82 with value: 0.6397713587522667.
[I 2024-11-29 00:39:20,419] Trial 91 finished with value: 0.647956342753587 and parameters: {'left_stride': 32, 'right_stride': 32, 'attention_pooling_operation': 'max', 'embedding_pooling_operation': 'mean', 'threshold': 0.9391552735631981, 'batch_size': 59, 'attention_heads': 9, 'hidden_dimension': 110, 'number_of_hidden_layers': 2, 'dropout_rate': 0.479668618380472, 'global_pooling': 'max', 'learning_rate': 0.0004692774193371247, 'weight_decay': 3.4368729495498277e-05, 'beta_0': 0.8435867998413676, 'beta_1': 0.9978947336325812, 'epsilon': 3.4276687517275026e-05, 'balanced_loss': False, 'epochs': 97, 'early_stopping_patience': 22, 'plateau_patience': 12, 'plateau_divider': 5}. Best is trial 91 with value: 0.647956342753587.
[I 2024-11-29 00:50:23,931] Trial 92 finished with value: 0.5969602509370745 and parameters: {'left_stride': 32, 'right_stride': 32, 'attention_pooling_operation': 'max', 'embedding_pooling_operation': 'mean', 'threshold': 0.9366904641516359, 'batch_size': 59, 'attention_heads': 9, 'hidden_dimension': 109, 'number_of_hidden_layers': 2, 'dropout_rate': 0.5196546288281587, 'global_pooling': 'max', 'learning_rate': 0.0003911674486097179, 'weight_decay': 3.694611852586045e-05, 'beta_0': 0.8421000298952352, 'beta_1': 0.9981474206694825, 'epsilon': 3.171252203500186e-05, 'balanced_loss': False, 'epochs': 95, 'early_stopping_patience': 22, 'plateau_patience': 10, 'plateau_divider': 5}. Best is trial 91 with value: 0.647956342753587.
[I 2024-11-29 01:01:23,340] Trial 93 finished with value: 0.6199830659244244 and parameters: {'left_stride': 32, 'right_stride': 32, 'attention_pooling_operation': 'max', 'embedding_pooling_operation': 'mean', 'threshold': 0.9389241477121096, 'batch_size': 56, 'attention_heads': 9, 'hidden_dimension': 117, 'number_of_hidden_layers': 2, 'dropout_rate': 0.4811206424255237, 'global_pooling': 'max', 'learning_rate': 0.0006486631969733059, 'weight_decay': 5.982205102261516e-05, 'beta_0': 0.8357603585549521, 'beta_1': 0.9983992152473227, 'epsilon': 1.4742018997242502e-05, 'balanced_loss': False, 'epochs': 100, 'early_stopping_patience': 22, 'plateau_patience': 12, 'plateau_divider': 5}. Best is trial 91 with value: 0.647956342753587.
[I 2024-11-29 01:12:24,939] Trial 94 finished with value: 0.6248721116698056 and parameters: {'left_stride': 32, 'right_stride': 32, 'attention_pooling_operation': 'max', 'embedding_pooling_operation': 'mean', 'threshold': 0.940851309679837, 'batch_size': 56, 'attention_heads': 9, 'hidden_dimension': 120, 'number_of_hidden_layers': 2, 'dropout_rate': 0.4894721006352473, 'global_pooling': 'max', 'learning_rate': 0.00045562500216933587, 'weight_decay': 5.845686163596823e-05, 'beta_0': 0.8347253029401993, 'beta_1': 0.9984680192135712, 'epsilon': 1.6503510226300898e-05, 'balanced_loss': False, 'epochs': 100, 'early_stopping_patience': 22, 'plateau_patience': 12, 'plateau_divider': 4}. Best is trial 91 with value: 0.647956342753587.
[I 2024-11-29 01:23:16,309] Trial 95 finished with value: 0.6196029187361782 and parameters: {'left_stride': 32, 'right_stride': 32, 'attention_pooling_operation': 'max', 'embedding_pooling_operation': 'mean', 'threshold': 0.9407883223885064, 'batch_size': 56, 'attention_heads': 8, 'hidden_dimension': 119, 'number_of_hidden_layers': 2, 'dropout_rate': 0.5293059201654278, 'global_pooling': 'max', 'learning_rate': 0.00048405016893767096, 'weight_decay': 6.721480982932067e-05, 'beta_0': 0.8352939407007691, 'beta_1': 0.9983942816291855, 'epsilon': 5.189061023220657e-05, 'balanced_loss': False, 'epochs': 89, 'early_stopping_patience': 23, 'plateau_patience': 12, 'plateau_divider': 4}. Best is trial 91 with value: 0.647956342753587.
[I 2024-11-29 01:34:40,612] Trial 96 finished with value: 0.5771375986971957 and parameters: {'left_stride': 32, 'right_stride': 32, 'attention_pooling_operation': 'max', 'embedding_pooling_operation': 'mean', 'threshold': 0.9493923798687287, 'batch_size': 55, 'attention_heads': 8, 'hidden_dimension': 118, 'number_of_hidden_layers': 2, 'dropout_rate': 0.5507131664722935, 'global_pooling': 'max', 'learning_rate': 0.0001849679375034137, 'weight_decay': 8.452801219493972e-05, 'beta_0': 0.8366636180724388, 'beta_1': 0.9979836284552459, 'epsilon': 7.701835933189266e-05, 'balanced_loss': False, 'epochs': 89, 'early_stopping_patience': 23, 'plateau_patience': 12, 'plateau_divider': 4}. Best is trial 91 with value: 0.647956342753587.
[I 2024-11-29 01:45:32,516] Trial 97 finished with value: 0.5661934604206479 and parameters: {'left_stride': 32, 'right_stride': 32, 'attention_pooling_operation': 'mean', 'embedding_pooling_operation': 'mean', 'threshold': 0.9523915822299116, 'batch_size': 49, 'attention_heads': 7, 'hidden_dimension': 98, 'number_of_hidden_layers': 2, 'dropout_rate': 0.47950441217101564, 'global_pooling': 'max', 'learning_rate': 0.00026108318677891434, 'weight_decay': 6.96712277745891e-05, 'beta_0': 0.8268483386706369, 'beta_1': 0.998399511280703, 'epsilon': 5.295549135159388e-05, 'balanced_loss': False, 'epochs': 100, 'early_stopping_patience': 23, 'plateau_patience': 12, 'plateau_divider': 4}. Best is trial 91 with value: 0.647956342753587.
[I 2024-11-29 01:56:14,020] Trial 98 finished with value: 0.5775024905780594 and parameters: {'left_stride': 32, 'right_stride': 32, 'attention_pooling_operation': 'max', 'embedding_pooling_operation': 'mean', 'threshold': 0.9431046754707382, 'batch_size': 55, 'attention_heads': 8, 'hidden_dimension': 128, 'number_of_hidden_layers': 2, 'dropout_rate': 0.49546692921755875, 'global_pooling': 'mean', 'learning_rate': 0.00045520997429184543, 'weight_decay': 9.998657409015877e-05, 'beta_0': 0.8380314523765067, 'beta_1': 0.9989939799645338, 'epsilon': 1.6938198297310446e-05, 'balanced_loss': False, 'epochs': 111, 'early_stopping_patience': 24, 'plateau_patience': 13, 'plateau_divider': 4}. Best is trial 91 with value: 0.647956342753587.
[I 2024-11-29 02:08:14,802] Trial 99 finished with value: 0.6081670862508699 and parameters: {'left_stride': 32, 'right_stride': 32, 'attention_pooling_operation': 'max', 'embedding_pooling_operation': 'mean', 'threshold': 0.9071666074725927, 'batch_size': 60, 'attention_heads': 8, 'hidden_dimension': 99, 'number_of_hidden_layers': 3, 'dropout_rate': 0.48745042659559806, 'global_pooling': 'max', 'learning_rate': 0.00036543967009858806, 'weight_decay': 3.0266051824753356e-05, 'beta_0': 0.8298549168891702, 'beta_1': 0.9976489214361112, 'epsilon': 5.1869713843249554e-05, 'balanced_loss': False, 'epochs': 85, 'early_stopping_patience': 23, 'plateau_patience': 12, 'plateau_divider': 5}. Best is trial 91 with value: 0.647956342753587.
[I 2024-11-29 02:19:06,989] Trial 100 finished with value: 0.5881725720652922 and parameters: {'left_stride': 32, 'right_stride': 32, 'attention_pooling_operation': 'max', 'embedding_pooling_operation': 'mean', 'threshold': 0.9260670098109449, 'batch_size': 52, 'attention_heads': 9, 'hidden_dimension': 117, 'number_of_hidden_layers': 2, 'dropout_rate': 0.5259604757200944, 'global_pooling': 'max', 'learning_rate': 0.0006250073580060738, 'weight_decay': 4.4475740526543166e-05, 'beta_0': 0.8426335577685313, 'beta_1': 0.9973538276887209, 'epsilon': 2.5261696155350862e-05, 'balanced_loss': True, 'epochs': 80, 'early_stopping_patience': 22, 'plateau_patience': 14, 'plateau_divider': 3}. Best is trial 91 with value: 0.647956342753587.
[I 2024-11-29 02:30:57,308] Trial 101 finished with value: 0.6217890138484188 and parameters: {'left_stride': 32, 'right_stride': 32, 'attention_pooling_operation': 'max', 'embedding_pooling_operation': 'mean', 'threshold': 0.9402740544913158, 'batch_size': 61, 'attention_heads': 10, 'hidden_dimension': 140, 'number_of_hidden_layers': 2, 'dropout_rate': 0.5366956552280565, 'global_pooling': 'max', 'learning_rate': 0.000495401991063613, 'weight_decay': 5.663003197428513e-05, 'beta_0': 0.8337650911629749, 'beta_1': 0.9984282015924351, 'epsilon': 8.542952541033221e-06, 'balanced_loss': False, 'epochs': 95, 'early_stopping_patience': 22, 'plateau_patience': 11, 'plateau_divider': 5}. Best is trial 91 with value: 0.647956342753587.
[I 2024-11-29 02:43:07,490] Trial 102 finished with value: 0.5743172961030278 and parameters: {'left_stride': 32, 'right_stride': 32, 'attention_pooling_operation': 'max', 'embedding_pooling_operation': 'mean', 'threshold': 0.9327798855705833, 'batch_size': 60, 'attention_heads': 9, 'hidden_dimension': 107, 'number_of_hidden_layers': 2, 'dropout_rate': 0.5558697136070234, 'global_pooling': 'max', 'learning_rate': 0.00023645306175733326, 'weight_decay': 6.570776155435769e-05, 'beta_0': 0.8242105341262723, 'beta_1': 0.9982988608362432, 'epsilon': 5.897128086036591e-06, 'balanced_loss': False, 'epochs': 91, 'early_stopping_patience': 21, 'plateau_patience': 11, 'plateau_divider': 5}. Best is trial 91 with value: 0.647956342753587.
[I 2024-11-29 02:55:30,574] Trial 103 finished with value: 0.5993755343620585 and parameters: {'left_stride': 32, 'right_stride': 32, 'attention_pooling_operation': 'max', 'embedding_pooling_operation': 'mean', 'threshold': 0.9410391323183375, 'batch_size': 61, 'attention_heads': 10, 'hidden_dimension': 122, 'number_of_hidden_layers': 2, 'dropout_rate': 0.5396835129145287, 'global_pooling': 'max', 'learning_rate': 0.0003162420296753005, 'weight_decay': 5.748462453746451e-05, 'beta_0': 0.83425951760081, 'beta_1': 0.9978964741253071, 'epsilon': 8.531573244365616e-06, 'balanced_loss': False, 'epochs': 96, 'early_stopping_patience': 22, 'plateau_patience': 11, 'plateau_divider': 5}. Best is trial 91 with value: 0.647956342753587.
[I 2024-11-29 03:07:53,847] Trial 104 finished with value: 0.6237054983228465 and parameters: {'left_stride': 32, 'right_stride': 256, 'attention_pooling_operation': 'max', 'embedding_pooling_operation': 'mean', 'threshold': 0.9189074143021866, 'batch_size': 56, 'attention_heads': 9, 'hidden_dimension': 131, 'number_of_hidden_layers': 2, 'dropout_rate': 0.5638470117414592, 'global_pooling': 'max', 'learning_rate': 0.0006583324191448297, 'weight_decay': 4.121361631913407e-05, 'beta_0': 0.8363477958992597, 'beta_1': 0.9986526529571393, 'epsilon': 3.516911454461699e-05, 'balanced_loss': False, 'epochs': 101, 'early_stopping_patience': 21, 'plateau_patience': 12, 'plateau_divider': 4}. Best is trial 91 with value: 0.647956342753587.
[I 2024-11-29 03:19:41,298] Trial 105 finished with value: 0.6273026223936128 and parameters: {'left_stride': 32, 'right_stride': 256, 'attention_pooling_operation': 'max', 'embedding_pooling_operation': 'mean', 'threshold': 0.9193632087122983, 'batch_size': 49, 'attention_heads': 9, 'hidden_dimension': 129, 'number_of_hidden_layers': 2, 'dropout_rate': 0.5657382438711942, 'global_pooling': 'max', 'learning_rate': 0.0007108655574204125, 'weight_decay': 3.983787148521664e-05, 'beta_0': 0.8453801885680282, 'beta_1': 0.9986418074749068, 'epsilon': 3.647545370894802e-05, 'balanced_loss': False, 'epochs': 102, 'early_stopping_patience': 21, 'plateau_patience': 13, 'plateau_divider': 6}. Best is trial 91 with value: 0.647956342753587.
[I 2024-11-29 03:32:06,732] Trial 106 finished with value: 0.6029169046906884 and parameters: {'left_stride': 32, 'right_stride': 256, 'attention_pooling_operation': 'max', 'embedding_pooling_operation': 'mean', 'threshold': 0.9199890989175566, 'batch_size': 48, 'attention_heads': 10, 'hidden_dimension': 131, 'number_of_hidden_layers': 2, 'dropout_rate': 0.574664666406926, 'global_pooling': 'max', 'learning_rate': 0.0011055510498538849, 'weight_decay': 2.7359561460908748e-05, 'beta_0': 0.8453065951341585, 'beta_1': 0.9988067227052047, 'epsilon': 3.910208528169029e-05, 'balanced_loss': False, 'epochs': 103, 'early_stopping_patience': 21, 'plateau_patience': 13, 'plateau_divider': 6}. Best is trial 91 with value: 0.647956342753587.
[I 2024-11-29 03:44:14,269] Trial 107 finished with value: 0.5488642906556312 and parameters: {'left_stride': 32, 'right_stride': 256, 'attention_pooling_operation': 'max', 'embedding_pooling_operation': 'mean', 'threshold': 0.9184133846362028, 'batch_size': 43, 'attention_heads': 10, 'hidden_dimension': 137, 'number_of_hidden_layers': 2, 'dropout_rate': 0.560632472423822, 'global_pooling': 'sum', 'learning_rate': 0.00038127347799398316, 'weight_decay': 3.799343697550252e-05, 'beta_0': 0.8407140734949234, 'beta_1': 0.9967018302834522, 'epsilon': 9.677615898457585e-05, 'balanced_loss': False, 'epochs': 111, 'early_stopping_patience': 21, 'plateau_patience': 10, 'plateau_divider': 4}. Best is trial 91 with value: 0.647956342753587.
[I 2024-11-29 03:55:16,354] Trial 108 finished with value: 0.4904044473525545 and parameters: {'left_stride': 32, 'right_stride': 256, 'attention_pooling_operation': 'min', 'embedding_pooling_operation': 'mean', 'threshold': 0.9245612496476765, 'batch_size': 53, 'attention_heads': 9, 'hidden_dimension': 127, 'number_of_hidden_layers': 2, 'dropout_rate': 0.5843077921855825, 'global_pooling': 'max', 'learning_rate': 0.0008653086221521943, 'weight_decay': 2.0379812938742126e-05, 'beta_0': 0.849002549632099, 'beta_1': 0.9975624319930679, 'epsilon': 2.480279556066059e-05, 'balanced_loss': False, 'epochs': 97, 'early_stopping_patience': 11, 'plateau_patience': 14, 'plateau_divider': 6}. Best is trial 91 with value: 0.647956342753587.
[I 2024-11-29 04:09:33,692] Trial 109 finished with value: 0.6008991831121023 and parameters: {'left_stride': 32, 'right_stride': 256, 'attention_pooling_operation': 'max', 'embedding_pooling_operation': 'mean', 'threshold': 0.9305613745477329, 'batch_size': 65, 'attention_heads': 11, 'hidden_dimension': 140, 'number_of_hidden_layers': 2, 'dropout_rate': 0.5840443915747955, 'global_pooling': 'max', 'learning_rate': 0.00014058672313092618, 'weight_decay': 4.511529435951907e-05, 'beta_0': 0.8320938723057161, 'beta_1': 0.9973748148090329, 'epsilon': 3.646812483310829e-05, 'balanced_loss': False, 'epochs': 106, 'early_stopping_patience': 15, 'plateau_patience': 13, 'plateau_divider': 4}. Best is trial 91 with value: 0.647956342753587.
[I 2024-11-29 04:22:09,981] Trial 110 finished with value: 0.615824769023606 and parameters: {'left_stride': 32, 'right_stride': 256, 'attention_pooling_operation': 'max', 'embedding_pooling_operation': 'mean', 'threshold': 0.8970658162231622, 'batch_size': 71, 'attention_heads': 8, 'hidden_dimension': 149, 'number_of_hidden_layers': 2, 'dropout_rate': 0.5640307846075348, 'global_pooling': 'max', 'learning_rate': 0.000662343214248726, 'weight_decay': 2.2687672738959807e-05, 'beta_0': 0.8284130164382284, 'beta_1': 0.9981160061610781, 'epsilon': 3.013917991951722e-05, 'balanced_loss': False, 'epochs': 114, 'early_stopping_patience': 21, 'plateau_patience': 14, 'plateau_divider': 3}. Best is trial 91 with value: 0.647956342753587.
[I 2024-11-29 04:33:35,559] Trial 111 finished with value: 0.6334263033541448 and parameters: {'left_stride': 32, 'right_stride': 256, 'attention_pooling_operation': 'max', 'embedding_pooling_operation': 'mean', 'threshold': 0.90984345002802, 'batch_size': 57, 'attention_heads': 9, 'hidden_dimension': 113, 'number_of_hidden_layers': 2, 'dropout_rate': 0.4773377528716305, 'global_pooling': 'max', 'learning_rate': 0.0005506016072619029, 'weight_decay': 4.049840696132514e-05, 'beta_0': 0.8382989318515536, 'beta_1': 0.998653439314456, 'epsilon': 1.4718924872656786e-05, 'balanced_loss': False, 'epochs': 100, 'early_stopping_patience': 22, 'plateau_patience': 12, 'plateau_divider': 5}. Best is trial 91 with value: 0.647956342753587.
[I 2024-11-29 04:45:16,151] Trial 112 finished with value: 0.6350712190268912 and parameters: {'left_stride': 32, 'right_stride': 256, 'attention_pooling_operation': 'max', 'embedding_pooling_operation': 'mean', 'threshold': 0.911099268332458, 'batch_size': 61, 'attention_heads': 9, 'hidden_dimension': 114, 'number_of_hidden_layers': 2, 'dropout_rate': 0.46297352185049784, 'global_pooling': 'max', 'learning_rate': 0.0004889470890550633, 'weight_decay': 2.9954921418727855e-05, 'beta_0': 0.84410208430671, 'beta_1': 0.9987130584525445, 'epsilon': 1.6585082890001318e-05, 'balanced_loss': False, 'epochs': 101, 'early_stopping_patience': 22, 'plateau_patience': 12, 'plateau_divider': 5}. Best is trial 91 with value: 0.647956342753587.
[I 2024-11-29 04:56:15,330] Trial 113 finished with value: 0.6092469797422395 and parameters: {'left_stride': 32, 'right_stride': 256, 'attention_pooling_operation': 'max', 'embedding_pooling_operation': 'mean', 'threshold': 0.9095524597307701, 'batch_size': 47, 'attention_heads': 9, 'hidden_dimension': 107, 'number_of_hidden_layers': 2, 'dropout_rate': 0.46315959713183064, 'global_pooling': 'max', 'learning_rate': 0.0005617070259825496, 'weight_decay': 3.1657526372485914e-05, 'beta_0': 0.8387108248501164, 'beta_1': 0.9987671993308569, 'epsilon': 1.6167282341197537e-05, 'balanced_loss': False, 'epochs': 101, 'early_stopping_patience': 21, 'plateau_patience': 12, 'plateau_divider': 5}. Best is trial 91 with value: 0.647956342753587.
