[I 2024-11-28 06:11:39,081] A new study created in RDB with name: Ohsumed-GATv2-google-bert-bert-base-uncased-Grouped-Layer-wise_Aggregation
Token indices sequence length is longer than the specified maximum sequence length for this model (611 > 512). Running this sequence through the model will result in indexing errors
[I 2024-11-28 06:24:38,355] Trial 0 finished with value: 0.013427363206876715 and parameters: {'left_stride': 32, 'right_stride': 64, 'attention_pooling_operation': 'mean', 'embedding_pooling_operation': 'min', 'threshold': 0.860845406169478, 'batch_size': 82, 'attention_heads': 9, 'hidden_dimension': 97, 'number_of_hidden_layers': 3, 'dropout_rate': 0.34184815819561254, 'global_pooling': 'max', 'learning_rate': 0.013826232179369865, 'weight_decay': 3.972110727381911e-06, 'beta_0': 0.849951952030185, 'beta_1': 0.9912118037965686, 'epsilon': 1.5339162591163588e-08, 'balanced_loss': True, 'epochs': 59, 'early_stopping_patience': 25, 'plateau_patience': 25, 'plateau_divider': 9}. Best is trial 0 with value: 0.013427363206876715.
[I 2024-11-28 06:34:10,712] Trial 1 finished with value: 0.5480008201612453 and parameters: {'left_stride': 64, 'right_stride': 64, 'attention_pooling_operation': 'max', 'embedding_pooling_operation': 'mean', 'threshold': 0.9878903933234222, 'batch_size': 118, 'attention_heads': 11, 'hidden_dimension': 239, 'number_of_hidden_layers': 0, 'dropout_rate': 0.35879485872574357, 'global_pooling': 'max', 'learning_rate': 0.00012172958098369953, 'weight_decay': 0.0003063462210622083, 'beta_0': 0.834331843801655, 'beta_1': 0.9853009566677808, 'epsilon': 1.4817820606039087e-06, 'balanced_loss': False, 'epochs': 61, 'early_stopping_patience': 25, 'plateau_patience': 22, 'plateau_divider': 3}. Best is trial 1 with value: 0.5480008201612453.
[I 2024-11-28 06:43:20,379] Trial 2 finished with value: 0.39565016432860034 and parameters: {'left_stride': 32, 'right_stride': 128, 'attention_pooling_operation': 'min', 'embedding_pooling_operation': 'mean', 'threshold': 0.9774336763878396, 'batch_size': 77, 'attention_heads': 5, 'hidden_dimension': 192, 'number_of_hidden_layers': 3, 'dropout_rate': 0.46838315927084884, 'global_pooling': 'mean', 'learning_rate': 0.0005130551760589835, 'weight_decay': 1.1919481947918734e-06, 'beta_0': 0.8102310933924105, 'beta_1': 0.98059161803998, 'epsilon': 3.512704726270843e-06, 'balanced_loss': False, 'epochs': 187, 'early_stopping_patience': 13, 'plateau_patience': 16, 'plateau_divider': 8}. Best is trial 1 with value: 0.5480008201612453.
[I 2024-11-28 06:56:16,432] Trial 3 finished with value: 0.5009116773647777 and parameters: {'left_stride': 256, 'right_stride': 64, 'attention_pooling_operation': 'min', 'embedding_pooling_operation': 'min', 'threshold': 0.845584753156763, 'batch_size': 73, 'attention_heads': 14, 'hidden_dimension': 225, 'number_of_hidden_layers': 0, 'dropout_rate': 0.4532241907732697, 'global_pooling': 'mean', 'learning_rate': 0.00022410971619109496, 'weight_decay': 0.0006741074265640696, 'beta_0': 0.8310413476654125, 'beta_1': 0.9898114758541204, 'epsilon': 6.487477066058673e-06, 'balanced_loss': False, 'epochs': 195, 'early_stopping_patience': 14, 'plateau_patience': 17, 'plateau_divider': 4}. Best is trial 1 with value: 0.5480008201612453.
[I 2024-11-28 07:05:48,937] Trial 4 finished with value: 0.49103415379196924 and parameters: {'left_stride': 64, 'right_stride': 32, 'attention_pooling_operation': 'min', 'embedding_pooling_operation': 'min', 'threshold': 0.8735529487125235, 'batch_size': 93, 'attention_heads': 12, 'hidden_dimension': 152, 'number_of_hidden_layers': 0, 'dropout_rate': 0.5505907486767714, 'global_pooling': 'mean', 'learning_rate': 0.002309786149269356, 'weight_decay': 0.00010781845035122267, 'beta_0': 0.8015645397505602, 'beta_1': 0.9896841863656863, 'epsilon': 8.053471030316087e-08, 'balanced_loss': True, 'epochs': 154, 'early_stopping_patience': 16, 'plateau_patience': 24, 'plateau_divider': 3}. Best is trial 1 with value: 0.5480008201612453.
[I 2024-11-28 07:31:23,875] Trial 5 finished with value: 0.44310789386362076 and parameters: {'left_stride': 64, 'right_stride': 32, 'attention_pooling_operation': 'max', 'embedding_pooling_operation': 'min', 'threshold': 0.9451838762172592, 'batch_size': 119, 'attention_heads': 15, 'hidden_dimension': 207, 'number_of_hidden_layers': 3, 'dropout_rate': 0.3252419894985146, 'global_pooling': 'sum', 'learning_rate': 1.0883991813938131e-05, 'weight_decay': 2.015647705936503e-06, 'beta_0': 0.8650272248026284, 'beta_1': 0.9800952543380481, 'epsilon': 4.397766894483953e-08, 'balanced_loss': False, 'epochs': 148, 'early_stopping_patience': 13, 'plateau_patience': 21, 'plateau_divider': 4}. Best is trial 1 with value: 0.5480008201612453.
[I 2024-11-28 07:53:10,933] Trial 6 finished with value: 0.025117066025309994 and parameters: {'left_stride': 128, 'right_stride': 0, 'attention_pooling_operation': 'min', 'embedding_pooling_operation': 'mean', 'threshold': 0.9153750078864256, 'batch_size': 79, 'attention_heads': 6, 'hidden_dimension': 194, 'number_of_hidden_layers': 1, 'dropout_rate': 0.30729478992943615, 'global_pooling': 'max', 'learning_rate': 0.06542056762893128, 'weight_decay': 0.0005553837526912237, 'beta_0': 0.8356502322469728, 'beta_1': 0.9802909082956842, 'epsilon': 5.167425813322413e-05, 'balanced_loss': False, 'epochs': 195, 'early_stopping_patience': 23, 'plateau_patience': 14, 'plateau_divider': 5}. Best is trial 1 with value: 0.5480008201612453.
The selected strides are greater or equal to the total chunk size.
[I 2024-11-28 07:53:11,978] Trial 7 finished with value: -1.0 and parameters: {'left_stride': 256, 'right_stride': 256, 'attention_pooling_operation': 'max', 'embedding_pooling_operation': 'min', 'threshold': 0.8718946353324388, 'batch_size': 60, 'attention_heads': 14, 'hidden_dimension': 214, 'number_of_hidden_layers': 4, 'dropout_rate': 0.5739721657669414, 'global_pooling': 'max', 'learning_rate': 0.0039797493741031125, 'weight_decay': 0.0001276146788173022, 'beta_0': 0.8786113098385785, 'beta_1': 0.996892198716152, 'epsilon': 2.248954284391446e-07, 'balanced_loss': True, 'epochs': 137, 'early_stopping_patience': 10, 'plateau_patience': 17, 'plateau_divider': 6}. Best is trial 1 with value: 0.5480008201612453.
[I 2024-11-28 08:03:04,729] Trial 8 finished with value: 0.03370430331293984 and parameters: {'left_stride': 256, 'right_stride': 128, 'attention_pooling_operation': 'min', 'embedding_pooling_operation': 'max', 'threshold': 0.9452110058311951, 'batch_size': 126, 'attention_heads': 10, 'hidden_dimension': 104, 'number_of_hidden_layers': 3, 'dropout_rate': 0.38124967537862225, 'global_pooling': 'mean', 'learning_rate': 0.07089141723796885, 'weight_decay': 0.0003220626495993124, 'beta_0': 0.8683420313684149, 'beta_1': 0.9877260389162159, 'epsilon': 4.933751600448336e-08, 'balanced_loss': False, 'epochs': 132, 'early_stopping_patience': 21, 'plateau_patience': 20, 'plateau_divider': 4}. Best is trial 1 with value: 0.5480008201612453.
[I 2024-11-28 08:12:29,073] Trial 9 finished with value: 0.5436201090433738 and parameters: {'left_stride': 0, 'right_stride': 64, 'attention_pooling_operation': 'max', 'embedding_pooling_operation': 'min', 'threshold': 0.8983182588646154, 'batch_size': 77, 'attention_heads': 6, 'hidden_dimension': 129, 'number_of_hidden_layers': 1, 'dropout_rate': 0.48475502941566495, 'global_pooling': 'mean', 'learning_rate': 0.003187422711813414, 'weight_decay': 3.2315343430749745e-05, 'beta_0': 0.8849150937783302, 'beta_1': 0.9924741264147013, 'epsilon': 4.484744524732786e-08, 'balanced_loss': False, 'epochs': 54, 'early_stopping_patience': 19, 'plateau_patience': 25, 'plateau_divider': 7}. Best is trial 1 with value: 0.5480008201612453.
[I 2024-11-28 08:21:48,881] Trial 10 finished with value: 0.22107050192590166 and parameters: {'left_stride': 64, 'right_stride': 0, 'attention_pooling_operation': 'mean', 'embedding_pooling_operation': 'mean', 'threshold': 0.9967650044870775, 'batch_size': 35, 'attention_heads': 9, 'hidden_dimension': 48, 'number_of_hidden_layers': 1, 'dropout_rate': 0.3977762266143904, 'global_pooling': 'sum', 'learning_rate': 4.519442811197253e-05, 'weight_decay': 1.391414427795109e-05, 'beta_0': 0.8215105131549126, 'beta_1': 0.9849479143747095, 'epsilon': 5.948652419846486e-07, 'balanced_loss': True, 'epochs': 91, 'early_stopping_patience': 25, 'plateau_patience': 10, 'plateau_divider': 2}. Best is trial 1 with value: 0.5480008201612453.
[I 2024-11-28 08:36:10,273] Trial 11 finished with value: 0.5674060477854809 and parameters: {'left_stride': 0, 'right_stride': 64, 'attention_pooling_operation': 'max', 'embedding_pooling_operation': 'max', 'threshold': 0.8067168411280451, 'batch_size': 106, 'attention_heads': 4, 'hidden_dimension': 252, 'number_of_hidden_layers': 1, 'dropout_rate': 0.5093183654188389, 'global_pooling': 'max', 'learning_rate': 0.00012386356736714718, 'weight_decay': 2.511405901881224e-05, 'beta_0': 0.8994794194881102, 'beta_1': 0.9951767732392878, 'epsilon': 1.5282726063969226e-06, 'balanced_loss': False, 'epochs': 52, 'early_stopping_patience': 20, 'plateau_patience': 22, 'plateau_divider': 7}. Best is trial 11 with value: 0.5674060477854809.
[I 2024-11-28 08:49:20,130] Trial 12 finished with value: 0.5674719986533457 and parameters: {'left_stride': 0, 'right_stride': 64, 'attention_pooling_operation': 'max', 'embedding_pooling_operation': 'max', 'threshold': 0.8137059665546146, 'batch_size': 106, 'attention_heads': 4, 'hidden_dimension': 250, 'number_of_hidden_layers': 0, 'dropout_rate': 0.513663632952387, 'global_pooling': 'max', 'learning_rate': 0.00011292643020568445, 'weight_decay': 2.16270035595765e-05, 'beta_0': 0.8489397463775049, 'beta_1': 0.9986611516981762, 'epsilon': 3.1914768556465596e-06, 'balanced_loss': False, 'epochs': 93, 'early_stopping_patience': 20, 'plateau_patience': 21, 'plateau_divider': 10}. Best is trial 12 with value: 0.5674719986533457.
[I 2024-11-28 09:18:41,664] Trial 13 finished with value: 0.5564902907457177 and parameters: {'left_stride': 0, 'right_stride': 64, 'attention_pooling_operation': 'max', 'embedding_pooling_operation': 'max', 'threshold': 0.8021700833161449, 'batch_size': 104, 'attention_heads': 7, 'hidden_dimension': 256, 'number_of_hidden_layers': 1, 'dropout_rate': 0.5189708521711761, 'global_pooling': 'max', 'learning_rate': 3.665353273474652e-05, 'weight_decay': 1.9871782886417332e-05, 'beta_0': 0.8955458485549185, 'beta_1': 0.9985826163810505, 'epsilon': 1.883767727449406e-05, 'balanced_loss': False, 'epochs': 93, 'early_stopping_patience': 19, 'plateau_patience': 20, 'plateau_divider': 9}. Best is trial 12 with value: 0.5674719986533457.
[I 2024-11-28 09:31:18,525] Trial 14 finished with value: 0.5830402961694857 and parameters: {'left_stride': 0, 'right_stride': 256, 'attention_pooling_operation': 'max', 'embedding_pooling_operation': 'max', 'threshold': 0.8073304293743692, 'batch_size': 105, 'attention_heads': 4, 'hidden_dimension': 161, 'number_of_hidden_layers': 2, 'dropout_rate': 0.5182611788035248, 'global_pooling': 'max', 'learning_rate': 0.00045978127354703695, 'weight_decay': 9.08581703614988e-06, 'beta_0': 0.8527856485493529, 'beta_1': 0.9950845833799403, 'epsilon': 8.449946744593378e-07, 'balanced_loss': False, 'epochs': 90, 'early_stopping_patience': 21, 'plateau_patience': 22, 'plateau_divider': 10}. Best is trial 14 with value: 0.5830402961694857.
[I 2024-11-28 09:42:36,511] Trial 15 finished with value: 0.5781241690123878 and parameters: {'left_stride': 0, 'right_stride': 256, 'attention_pooling_operation': 'max', 'embedding_pooling_operation': 'max', 'threshold': 0.8299602936273466, 'batch_size': 101, 'attention_heads': 4, 'hidden_dimension': 158, 'number_of_hidden_layers': 2, 'dropout_rate': 0.4220813689450135, 'global_pooling': 'max', 'learning_rate': 0.0005567397883504541, 'weight_decay': 6.992934972302667e-06, 'beta_0': 0.8547513056737355, 'beta_1': 0.9946506297224307, 'epsilon': 3.555047907956901e-07, 'balanced_loss': False, 'epochs': 101, 'early_stopping_patience': 17, 'plateau_patience': 23, 'plateau_divider': 10}. Best is trial 14 with value: 0.5830402961694857.
[I 2024-11-28 09:56:10,621] Trial 16 finished with value: 0.4873866822418053 and parameters: {'left_stride': 0, 'right_stride': 256, 'attention_pooling_operation': 'mean', 'embedding_pooling_operation': 'max', 'threshold': 0.8366671810066327, 'batch_size': 94, 'attention_heads': 7, 'hidden_dimension': 164, 'number_of_hidden_layers': 2, 'dropout_rate': 0.4276209058285084, 'global_pooling': 'sum', 'learning_rate': 0.0007560231743620299, 'weight_decay': 6.170379185015804e-06, 'beta_0': 0.858155457419913, 'beta_1': 0.9940941165113897, 'epsilon': 3.0551483517330353e-07, 'balanced_loss': False, 'epochs': 109, 'early_stopping_patience': 17, 'plateau_patience': 23, 'plateau_divider': 10}. Best is trial 14 with value: 0.5830402961694857.
[I 2024-11-28 10:10:03,949] Trial 17 finished with value: 0.03537125975309869 and parameters: {'left_stride': 128, 'right_stride': 256, 'attention_pooling_operation': 'max', 'embedding_pooling_operation': 'max', 'threshold': 0.8295553071662841, 'batch_size': 53, 'attention_heads': 8, 'hidden_dimension': 178, 'number_of_hidden_layers': 2, 'dropout_rate': 0.4240024970648684, 'global_pooling': 'max', 'learning_rate': 0.009979551708709124, 'weight_decay': 5.395990342009608e-06, 'beta_0': 0.8434829525730748, 'beta_1': 0.9950000148779256, 'epsilon': 2.7494376052367026e-07, 'balanced_loss': False, 'epochs': 112, 'early_stopping_patience': 22, 'plateau_patience': 19, 'plateau_divider': 9}. Best is trial 14 with value: 0.5830402961694857.
[I 2024-11-28 10:21:44,427] Trial 18 finished with value: 0.5377930283234994 and parameters: {'left_stride': 0, 'right_stride': 256, 'attention_pooling_operation': 'max', 'embedding_pooling_operation': 'max', 'threshold': 0.8237943683052631, 'batch_size': 94, 'attention_heads': 5, 'hidden_dimension': 129, 'number_of_hidden_layers': 2, 'dropout_rate': 0.5772712347497964, 'global_pooling': 'max', 'learning_rate': 0.0004067087017057776, 'weight_decay': 6.403067271899226e-05, 'beta_0': 0.8622998965415634, 'beta_1': 0.9929433659457952, 'epsilon': 6.314000558306838e-07, 'balanced_loss': True, 'epochs': 75, 'early_stopping_patience': 15, 'plateau_patience': 14, 'plateau_divider': 10}. Best is trial 14 with value: 0.5830402961694857.
[I 2024-11-28 10:32:35,358] Trial 19 finished with value: 0.5458123944168632 and parameters: {'left_stride': 0, 'right_stride': 256, 'attention_pooling_operation': 'max', 'embedding_pooling_operation': 'max', 'threshold': 0.8520118207278381, 'batch_size': 114, 'attention_heads': 4, 'hidden_dimension': 76, 'number_of_hidden_layers': 4, 'dropout_rate': 0.5442747175498026, 'global_pooling': 'max', 'learning_rate': 0.0013631506709876884, 'weight_decay': 9.50051073786701e-06, 'beta_0': 0.8766267874498159, 'beta_1': 0.996431222384938, 'epsilon': 1.2081210399818732e-05, 'balanced_loss': False, 'epochs': 118, 'early_stopping_patience': 18, 'plateau_patience': 23, 'plateau_divider': 8}. Best is trial 14 with value: 0.5830402961694857.
[I 2024-11-28 10:44:41,505] Trial 20 finished with value: 0.11660096123318539 and parameters: {'left_stride': 0, 'right_stride': 256, 'attention_pooling_operation': 'mean', 'embedding_pooling_operation': 'max', 'threshold': 0.8916839902838027, 'batch_size': 91, 'attention_heads': 6, 'hidden_dimension': 138, 'number_of_hidden_layers': 2, 'dropout_rate': 0.4238987430369126, 'global_pooling': 'sum', 'learning_rate': 0.008838139998062877, 'weight_decay': 2.8220863013218478e-06, 'beta_0': 0.822224914622008, 'beta_1': 0.9869892531331371, 'epsilon': 1.3102346385988996e-07, 'balanced_loss': False, 'epochs': 77, 'early_stopping_patience': 23, 'plateau_patience': 19, 'plateau_divider': 8}. Best is trial 14 with value: 0.5830402961694857.
[I 2024-11-28 10:56:47,061] Trial 21 finished with value: 0.48817260160271664 and parameters: {'left_stride': 0, 'right_stride': 256, 'attention_pooling_operation': 'max', 'embedding_pooling_operation': 'max', 'threshold': 0.8202373487602569, 'batch_size': 107, 'attention_heads': 4, 'hidden_dimension': 171, 'number_of_hidden_layers': 0, 'dropout_rate': 0.4953868495534723, 'global_pooling': 'max', 'learning_rate': 5.131759996922853e-05, 'weight_decay': 1.011377133458066e-05, 'beta_0': 0.8505754247951693, 'beta_1': 0.9989586678939036, 'epsilon': 1.9010586333230044e-06, 'balanced_loss': False, 'epochs': 97, 'early_stopping_patience': 21, 'plateau_patience': 22, 'plateau_divider': 10}. Best is trial 14 with value: 0.5830402961694857.
[I 2024-11-28 11:11:58,772] Trial 22 finished with value: 0.5629889634498386 and parameters: {'left_stride': 0, 'right_stride': 256, 'attention_pooling_operation': 'max', 'embedding_pooling_operation': 'max', 'threshold': 0.8004844103946398, 'batch_size': 102, 'attention_heads': 5, 'hidden_dimension': 111, 'number_of_hidden_layers': 2, 'dropout_rate': 0.532014883726011, 'global_pooling': 'max', 'learning_rate': 0.00020811781167840565, 'weight_decay': 4.903915343891091e-05, 'beta_0': 0.8436654760912035, 'beta_1': 0.9967699512705895, 'epsilon': 3.93309660425035e-06, 'balanced_loss': False, 'epochs': 78, 'early_stopping_patience': 17, 'plateau_patience': 24, 'plateau_divider': 10}. Best is trial 14 with value: 0.5830402961694857.
[I 2024-11-28 11:22:40,664] Trial 23 finished with value: 0.5989142803882711 and parameters: {'left_stride': 0, 'right_stride': 128, 'attention_pooling_operation': 'max', 'embedding_pooling_operation': 'max', 'threshold': 0.8219756527459207, 'batch_size': 125, 'attention_heads': 4, 'hidden_dimension': 73, 'number_of_hidden_layers': 2, 'dropout_rate': 0.46925435211909494, 'global_pooling': 'max', 'learning_rate': 0.000945431758410047, 'weight_decay': 7.835383709214176e-06, 'beta_0': 0.8551013458018368, 'beta_1': 0.9977573596092334, 'epsilon': 8.313565430471124e-07, 'balanced_loss': False, 'epochs': 105, 'early_stopping_patience': 20, 'plateau_patience': 20, 'plateau_divider': 9}. Best is trial 23 with value: 0.5989142803882711.
[I 2024-11-28 11:33:39,090] Trial 24 finished with value: 0.5660257274196138 and parameters: {'left_stride': 0, 'right_stride': 128, 'attention_pooling_operation': 'max', 'embedding_pooling_operation': 'max', 'threshold': 0.8388437345852281, 'batch_size': 123, 'attention_heads': 7, 'hidden_dimension': 34, 'number_of_hidden_layers': 3, 'dropout_rate': 0.46739355370104946, 'global_pooling': 'max', 'learning_rate': 0.001207943187690446, 'weight_decay': 1.8474524510152672e-06, 'beta_0': 0.8565941827026226, 'beta_1': 0.9928095433448336, 'epsilon': 5.665995946672059e-07, 'balanced_loss': False, 'epochs': 102, 'early_stopping_patience': 18, 'plateau_patience': 19, 'plateau_divider': 9}. Best is trial 23 with value: 0.5989142803882711.
[I 2024-11-28 11:44:41,595] Trial 25 finished with value: 0.6134982975981166 and parameters: {'left_stride': 128, 'right_stride': 128, 'attention_pooling_operation': 'max', 'embedding_pooling_operation': 'max', 'threshold': 0.8650920783791005, 'batch_size': 113, 'attention_heads': 5, 'hidden_dimension': 75, 'number_of_hidden_layers': 2, 'dropout_rate': 0.3960594728740898, 'global_pooling': 'max', 'learning_rate': 0.0003383380043920071, 'weight_decay': 7.512673822383395e-06, 'beta_0': 0.871300256910348, 'beta_1': 0.9958666751245762, 'epsilon': 7.071156561269351e-07, 'balanced_loss': False, 'epochs': 124, 'early_stopping_patience': 23, 'plateau_patience': 21, 'plateau_divider': 7}. Best is trial 25 with value: 0.6134982975981166.
[I 2024-11-28 11:56:49,467] Trial 26 finished with value: 0.5368264419019034 and parameters: {'left_stride': 128, 'right_stride': 128, 'attention_pooling_operation': 'max', 'embedding_pooling_operation': 'max', 'threshold': 0.8730340044643164, 'batch_size': 128, 'attention_heads': 5, 'hidden_dimension': 69, 'number_of_hidden_layers': 2, 'dropout_rate': 0.5995589723505277, 'global_pooling': 'max', 'learning_rate': 0.0003314775037822391, 'weight_decay': 3.7371564397061684e-06, 'beta_0': 0.8730734174834317, 'beta_1': 0.9971575417382385, 'epsilon': 9.301654440020758e-07, 'balanced_loss': True, 'epochs': 169, 'early_stopping_patience': 23, 'plateau_patience': 18, 'plateau_divider': 7}. Best is trial 25 with value: 0.6134982975981166.
[I 2024-11-28 12:07:52,420] Trial 27 finished with value: 0.5651970230778557 and parameters: {'left_stride': 128, 'right_stride': 128, 'attention_pooling_operation': 'max', 'embedding_pooling_operation': 'max', 'threshold': 0.8577745125200452, 'batch_size': 113, 'attention_heads': 8, 'hidden_dimension': 81, 'number_of_hidden_layers': 2, 'dropout_rate': 0.39661451006047543, 'global_pooling': 'max', 'learning_rate': 0.0014950726037754895, 'weight_decay': 1.330341978605857e-05, 'beta_0': 0.8858880736720772, 'beta_1': 0.9914639086902604, 'epsilon': 1.2973691586977102e-07, 'balanced_loss': False, 'epochs': 120, 'early_stopping_patience': 22, 'plateau_patience': 15, 'plateau_divider': 6}. Best is trial 25 with value: 0.6134982975981166.
[I 2024-11-28 12:20:45,820] Trial 28 finished with value: 0.5748261338635766 and parameters: {'left_stride': 128, 'right_stride': 128, 'attention_pooling_operation': 'max', 'embedding_pooling_operation': 'max', 'threshold': 0.9170950352699586, 'batch_size': 116, 'attention_heads': 6, 'hidden_dimension': 54, 'number_of_hidden_layers': 3, 'dropout_rate': 0.48321466706488125, 'global_pooling': 'max', 'learning_rate': 0.004692305726722545, 'weight_decay': 1.029904476432445e-06, 'beta_0': 0.8687729476617873, 'beta_1': 0.9962890735884934, 'epsilon': 1.082212089066375e-05, 'balanced_loss': False, 'epochs': 136, 'early_stopping_patience': 24, 'plateau_patience': 21, 'plateau_divider': 8}. Best is trial 25 with value: 0.6134982975981166.
