[I 2024-12-14 12:15:39,952] Trial 208 finished with value: 0.968398123387329 and parameters: {'left_stride': 64, 'right_stride': 128, 'attention_pooling_operation': 'mean', 'embedding_pooling_operation': 'max', 'threshold': 0.7048305513116906, 'batch_size': 32, 'attention_heads': 16, 'hidden_dimension': 83, 'number_of_hidden_layers': 3, 'dropout_rate': 0.5741633416782639, 'global_pooling': 'max', 'learning_rate': 2.909390709224086e-05, 'weight_decay': 0.00040602314299270604, 'beta_0': 0.8835242999065858, 'beta_1': 0.9914043066984303, 'epsilon': 1.2664114292780513e-08, 'balanced_loss': True, 'epochs': 115, 'early_stopping_patience': 20, 'plateau_patience': 19, 'plateau_divider': 7}. Best is trial 136 with value: 0.9776229738062259.
[I 2024-12-14 12:49:20,562] Trial 209 finished with value: 0.969868797847923 and parameters: {'left_stride': 32, 'right_stride': 128, 'attention_pooling_operation': 'mean', 'embedding_pooling_operation': 'max', 'threshold': 0.7139405948425604, 'batch_size': 43, 'attention_heads': 16, 'hidden_dimension': 65, 'number_of_hidden_layers': 3, 'dropout_rate': 0.5548932875249606, 'global_pooling': 'max', 'learning_rate': 3.767572513071803e-05, 'weight_decay': 0.00055965136582977, 'beta_0': 0.8865345666165306, 'beta_1': 0.9885907264963051, 'epsilon': 7.972046098520844e-05, 'balanced_loss': True, 'epochs': 108, 'early_stopping_patience': 19, 'plateau_patience': 20, 'plateau_divider': 7}. Best is trial 136 with value: 0.9776229738062259.
[I 2024-12-14 13:24:06,264] Trial 210 finished with value: 0.9366510363899239 and parameters: {'left_stride': 64, 'right_stride': 128, 'attention_pooling_operation': 'min', 'embedding_pooling_operation': 'max', 'threshold': 0.6892414226451682, 'batch_size': 39, 'attention_heads': 16, 'hidden_dimension': 73, 'number_of_hidden_layers': 3, 'dropout_rate': 0.5704113271788637, 'global_pooling': 'max', 'learning_rate': 2.3710089369387628e-05, 'weight_decay': 0.0002989638359977181, 'beta_0': 0.8792306789118727, 'beta_1': 0.9893195378483014, 'epsilon': 7.661891010122419e-08, 'balanced_loss': True, 'epochs': 114, 'early_stopping_patience': 19, 'plateau_patience': 19, 'plateau_divider': 7}. Best is trial 136 with value: 0.9776229738062259.
[I 2024-12-14 14:06:27,055] Trial 211 finished with value: 0.9663574588844488 and parameters: {'left_stride': 64, 'right_stride': 128, 'attention_pooling_operation': 'mean', 'embedding_pooling_operation': 'max', 'threshold': 0.7296902787895319, 'batch_size': 45, 'attention_heads': 15, 'hidden_dimension': 78, 'number_of_hidden_layers': 3, 'dropout_rate': 0.5482000552777325, 'global_pooling': 'max', 'learning_rate': 1.6768095452257297e-05, 'weight_decay': 0.0003585683660473462, 'beta_0': 0.8886250251881667, 'beta_1': 0.9934314845278315, 'epsilon': 2.3180465848269636e-05, 'balanced_loss': True, 'epochs': 127, 'early_stopping_patience': 18, 'plateau_patience': 20, 'plateau_divider': 7}. Best is trial 136 with value: 0.9776229738062259.
[I 2024-12-14 14:37:14,529] Trial 212 finished with value: 0.9703133601073863 and parameters: {'left_stride': 64, 'right_stride': 128, 'attention_pooling_operation': 'mean', 'embedding_pooling_operation': 'max', 'threshold': 0.7466569641637343, 'batch_size': 32, 'attention_heads': 16, 'hidden_dimension': 82, 'number_of_hidden_layers': 3, 'dropout_rate': 0.5627767173538304, 'global_pooling': 'max', 'learning_rate': 3.3200618810765664e-05, 'weight_decay': 0.00043956487505416854, 'beta_0': 0.8833068986781959, 'beta_1': 0.9926611762468116, 'epsilon': 2.552662851395353e-08, 'balanced_loss': True, 'epochs': 135, 'early_stopping_patience': 20, 'plateau_patience': 10, 'plateau_divider': 7}. Best is trial 136 with value: 0.9776229738062259.
[I 2024-12-14 15:08:21,993] Trial 213 finished with value: 0.9803273479163068 and parameters: {'left_stride': 64, 'right_stride': 128, 'attention_pooling_operation': 'mean', 'embedding_pooling_operation': 'max', 'threshold': 0.7190071819077849, 'batch_size': 37, 'attention_heads': 16, 'hidden_dimension': 91, 'number_of_hidden_layers': 3, 'dropout_rate': 0.5803912567130826, 'global_pooling': 'max', 'learning_rate': 4.578712605717444e-05, 'weight_decay': 0.0001941669082036612, 'beta_0': 0.8857446053515984, 'beta_1': 0.9896061067375477, 'epsilon': 4.328100669809577e-05, 'balanced_loss': True, 'epochs': 111, 'early_stopping_patience': 20, 'plateau_patience': 19, 'plateau_divider': 7}. Best is trial 213 with value: 0.9803273479163068.
CUDA out of memory. Tried to allocate 2.05 GiB. GPU 0 has a total capacity of 44.56 GiB of which 314.69 MiB is free. Including non-PyTorch memory, this process has 44.25 GiB memory in use. Of the allocated memory 41.01 GiB is allocated by PyTorch, and 2.09 GiB is reserved by PyTorch but unallocated. If reserved but unallocated memory is large try setting PYTORCH_CUDA_ALLOC_CONF=expandable_segments:True to avoid fragmentation.  See documentation for Memory Management  (https://pytorch.org/docs/stable/notes/cuda.html#environment-variables)
[I 2024-12-14 15:15:34,478] Trial 214 finished with value: -1.0 and parameters: {'left_stride': 64, 'right_stride': 128, 'attention_pooling_operation': 'mean', 'embedding_pooling_operation': 'max', 'threshold': 0.7183801657983788, 'batch_size': 36, 'attention_heads': 16, 'hidden_dimension': 254, 'number_of_hidden_layers': 3, 'dropout_rate': 0.5792157766504215, 'global_pooling': 'max', 'learning_rate': 5.810709729601438e-05, 'weight_decay': 6.502414714004183e-06, 'beta_0': 0.8867815703407639, 'beta_1': 0.9881945294887364, 'epsilon': 4.317435075481698e-05, 'balanced_loss': True, 'epochs': 105, 'early_stopping_patience': 20, 'plateau_patience': 21, 'plateau_divider': 7}. Best is trial 213 with value: 0.9803273479163068.
[I 2024-12-14 15:47:12,360] Trial 215 finished with value: 0.9652165434757936 and parameters: {'left_stride': 64, 'right_stride': 128, 'attention_pooling_operation': 'mean', 'embedding_pooling_operation': 'max', 'threshold': 0.737313691734676, 'batch_size': 41, 'attention_heads': 16, 'hidden_dimension': 91, 'number_of_hidden_layers': 3, 'dropout_rate': 0.5898342773907117, 'global_pooling': 'max', 'learning_rate': 4.898097847624566e-05, 'weight_decay': 0.00021385310611398212, 'beta_0': 0.8845694323659952, 'beta_1': 0.9888983636231795, 'epsilon': 6.130587519685234e-05, 'balanced_loss': True, 'epochs': 111, 'early_stopping_patience': 20, 'plateau_patience': 19, 'plateau_divider': 7}. Best is trial 213 with value: 0.9803273479163068.
[I 2024-12-14 16:24:09,281] Trial 216 finished with value: 0.9727646254910345 and parameters: {'left_stride': 64, 'right_stride': 128, 'attention_pooling_operation': 'mean', 'embedding_pooling_operation': 'max', 'threshold': 0.7242799718528705, 'batch_size': 36, 'attention_heads': 16, 'hidden_dimension': 84, 'number_of_hidden_layers': 3, 'dropout_rate': 0.5556370490212847, 'global_pooling': 'max', 'learning_rate': 4.317075705942609e-05, 'weight_decay': 0.00019566105345144433, 'beta_0': 0.8815655216580399, 'beta_1': 0.9906513254947622, 'epsilon': 2.9034698093548937e-05, 'balanced_loss': True, 'epochs': 116, 'early_stopping_patience': 16, 'plateau_patience': 19, 'plateau_divider': 7}. Best is trial 213 with value: 0.9803273479163068.
[I 2024-12-14 16:56:58,193] Trial 217 finished with value: 0.9627576096667538 and parameters: {'left_stride': 64, 'right_stride': 128, 'attention_pooling_operation': 'mean', 'embedding_pooling_operation': 'max', 'threshold': 0.7092101027553975, 'batch_size': 36, 'attention_heads': 16, 'hidden_dimension': 85, 'number_of_hidden_layers': 3, 'dropout_rate': 0.5502977286493199, 'global_pooling': 'max', 'learning_rate': 4.558423928060309e-05, 'weight_decay': 0.0009844381126498404, 'beta_0': 0.891434743490847, 'beta_1': 0.9894236099259004, 'epsilon': 3.52685097515155e-05, 'balanced_loss': True, 'epochs': 108, 'early_stopping_patience': 16, 'plateau_patience': 19, 'plateau_divider': 7}. Best is trial 213 with value: 0.9803273479163068.
[I 2024-12-14 17:26:18,839] Trial 218 finished with value: 0.9670494518765945 and parameters: {'left_stride': 64, 'right_stride': 128, 'attention_pooling_operation': 'mean', 'embedding_pooling_operation': 'max', 'threshold': 0.7000182278103093, 'batch_size': 32, 'attention_heads': 15, 'hidden_dimension': 92, 'number_of_hidden_layers': 3, 'dropout_rate': 0.5573399803576333, 'global_pooling': 'max', 'learning_rate': 3.9319683299420064e-05, 'weight_decay': 0.0002830126882880878, 'beta_0': 0.8858224987368665, 'beta_1': 0.9907760048339731, 'epsilon': 2.604993774902115e-05, 'balanced_loss': True, 'epochs': 116, 'early_stopping_patience': 16, 'plateau_patience': 19, 'plateau_divider': 7}. Best is trial 213 with value: 0.9803273479163068.
[I 2024-12-14 18:02:15,527] Trial 219 finished with value: 0.9641812594647308 and parameters: {'left_stride': 64, 'right_stride': 128, 'attention_pooling_operation': 'mean', 'embedding_pooling_operation': 'max', 'threshold': 0.7179127535958515, 'batch_size': 40, 'attention_heads': 16, 'hidden_dimension': 74, 'number_of_hidden_layers': 3, 'dropout_rate': 0.544045537152964, 'global_pooling': 'max', 'learning_rate': 2.4984301913673654e-05, 'weight_decay': 0.000252947316462586, 'beta_0': 0.88838329770871, 'beta_1': 0.9897573033199561, 'epsilon': 2.8844489502050226e-05, 'balanced_loss': True, 'epochs': 112, 'early_stopping_patience': 17, 'plateau_patience': 20, 'plateau_divider': 7}. Best is trial 213 with value: 0.9803273479163068.
[I 2024-12-14 18:48:25,749] Trial 220 finished with value: 0.9723622292029004 and parameters: {'left_stride': 64, 'right_stride': 128, 'attention_pooling_operation': 'mean', 'embedding_pooling_operation': 'max', 'threshold': 0.7231577696104248, 'batch_size': 37, 'attention_heads': 16, 'hidden_dimension': 83, 'number_of_hidden_layers': 3, 'dropout_rate': 0.5359135986557547, 'global_pooling': 'max', 'learning_rate': 1.9793182992697223e-05, 'weight_decay': 5.389845869790738e-06, 'beta_0': 0.8777122358573697, 'beta_1': 0.9909453018453074, 'epsilon': 3.740136040269894e-05, 'balanced_loss': True, 'epochs': 132, 'early_stopping_patience': 14, 'plateau_patience': 19, 'plateau_divider': 7}. Best is trial 213 with value: 0.9803273479163068.
CUDA out of memory. Tried to allocate 1.56 GiB. GPU 0 has a total capacity of 44.56 GiB of which 698.69 MiB is free. Including non-PyTorch memory, this process has 43.87 GiB memory in use. Of the allocated memory 40.04 GiB is allocated by PyTorch, and 2.68 GiB is reserved by PyTorch but unallocated. If reserved but unallocated memory is large try setting PYTORCH_CUDA_ALLOC_CONF=expandable_segments:True to avoid fragmentation.  See documentation for Memory Management  (https://pytorch.org/docs/stable/notes/cuda.html#environment-variables)
[I 2024-12-14 19:19:06,328] Trial 221 finished with value: -1.0 and parameters: {'left_stride': 64, 'right_stride': 128, 'attention_pooling_operation': 'mean', 'embedding_pooling_operation': 'max', 'threshold': 0.7210740766974014, 'batch_size': 48, 'attention_heads': 15, 'hidden_dimension': 88, 'number_of_hidden_layers': 3, 'dropout_rate': 0.5346407648516138, 'global_pooling': 'max', 'learning_rate': 2.1333769037381913e-05, 'weight_decay': 5.336027328881711e-06, 'beta_0': 0.877980369154796, 'beta_1': 0.9909276602231089, 'epsilon': 4.5916753360873724e-05, 'balanced_loss': True, 'epochs': 141, 'early_stopping_patience': 14, 'plateau_patience': 19, 'plateau_divider': 7}. Best is trial 213 with value: 0.9803273479163068.
[I 2024-12-14 20:12:29,672] Trial 222 finished with value: 0.9746759007124359 and parameters: {'left_stride': 64, 'right_stride': 128, 'attention_pooling_operation': 'mean', 'embedding_pooling_operation': 'max', 'threshold': 0.7102762757805066, 'batch_size': 37, 'attention_heads': 16, 'hidden_dimension': 83, 'number_of_hidden_layers': 3, 'dropout_rate': 0.5515937649242035, 'global_pooling': 'max', 'learning_rate': 1.507105010468602e-05, 'weight_decay': 4.557191686880772e-06, 'beta_0': 0.8802285509050221, 'beta_1': 0.9918826456168011, 'epsilon': 3.623898857884215e-05, 'balanced_loss': True, 'epochs': 139, 'early_stopping_patience': 15, 'plateau_patience': 18, 'plateau_divider': 7}. Best is trial 213 with value: 0.9803273479163068.
[I 2024-12-14 20:57:27,008] Trial 223 finished with value: 0.9626275312906372 and parameters: {'left_stride': 64, 'right_stride': 128, 'attention_pooling_operation': 'mean', 'embedding_pooling_operation': 'max', 'threshold': 0.7336423813214792, 'batch_size': 37, 'attention_heads': 16, 'hidden_dimension': 83, 'number_of_hidden_layers': 3, 'dropout_rate': 0.5381875761524947, 'global_pooling': 'max', 'learning_rate': 1.4059694348648851e-05, 'weight_decay': 3.6557584235921098e-06, 'beta_0': 0.8736327222301942, 'beta_1': 0.991840566048427, 'epsilon': 3.553243470570697e-05, 'balanced_loss': True, 'epochs': 102, 'early_stopping_patience': 13, 'plateau_patience': 18, 'plateau_divider': 7}. Best is trial 213 with value: 0.9803273479163068.
[I 2024-12-14 21:10:51,791] Trial 224 finished with value: 0.08862858842778522 and parameters: {'left_stride': 64, 'right_stride': 128, 'attention_pooling_operation': 'mean', 'embedding_pooling_operation': 'max', 'threshold': 0.7271460037800723, 'batch_size': 39, 'attention_heads': 16, 'hidden_dimension': 81, 'number_of_hidden_layers': 3, 'dropout_rate': 0.5449259918491147, 'global_pooling': 'sum', 'learning_rate': 0.04440540239698851, 'weight_decay': 4.3222044306152425e-06, 'beta_0': 0.8763166731180022, 'beta_1': 0.9912389941943144, 'epsilon': 3.924776060270106e-05, 'balanced_loss': True, 'epochs': 144, 'early_stopping_patience': 14, 'plateau_patience': 18, 'plateau_divider': 7}. Best is trial 213 with value: 0.9803273479163068.
CUDA out of memory. Tried to allocate 1.51 GiB. GPU 0 has a total capacity of 44.56 GiB of which 828.69 MiB is free. Including non-PyTorch memory, this process has 43.74 GiB memory in use. Of the allocated memory 39.96 GiB is allocated by PyTorch, and 2.63 GiB is reserved by PyTorch but unallocated. If reserved but unallocated memory is large try setting PYTORCH_CUDA_ALLOC_CONF=expandable_segments:True to avoid fragmentation.  See documentation for Memory Management  (https://pytorch.org/docs/stable/notes/cuda.html#environment-variables)
[I 2024-12-14 21:36:07,788] Trial 225 finished with value: -1.0 and parameters: {'left_stride': 64, 'right_stride': 128, 'attention_pooling_operation': 'mean', 'embedding_pooling_operation': 'max', 'threshold': 0.7093177259991023, 'batch_size': 43, 'attention_heads': 16, 'hidden_dimension': 89, 'number_of_hidden_layers': 3, 'dropout_rate': 0.552859533082132, 'global_pooling': 'max', 'learning_rate': 1.619851156820447e-05, 'weight_decay': 5.044169873633895e-06, 'beta_0': 0.8823904977015898, 'beta_1': 0.9899495820975995, 'epsilon': 4.655039173681495e-05, 'balanced_loss': True, 'epochs': 138, 'early_stopping_patience': 15, 'plateau_patience': 19, 'plateau_divider': 7}. Best is trial 213 with value: 0.9803273479163068.
[I 2024-12-14 22:17:32,705] Trial 226 finished with value: 0.9740125452083093 and parameters: {'left_stride': 64, 'right_stride': 128, 'attention_pooling_operation': 'mean', 'embedding_pooling_operation': 'max', 'threshold': 0.7158714664860398, 'batch_size': 36, 'attention_heads': 16, 'hidden_dimension': 95, 'number_of_hidden_layers': 3, 'dropout_rate': 0.5535126757093127, 'global_pooling': 'max', 'learning_rate': 2.5797475153727362e-05, 'weight_decay': 5.843790550921147e-06, 'beta_0': 0.8801164378724097, 'beta_1': 0.9906490628752723, 'epsilon': 2.656110599686055e-05, 'balanced_loss': True, 'epochs': 137, 'early_stopping_patience': 15, 'plateau_patience': 18, 'plateau_divider': 7}. Best is trial 213 with value: 0.9803273479163068.
[I 2024-12-14 22:54:33,770] Trial 227 finished with value: 0.963329897497077 and parameters: {'left_stride': 64, 'right_stride': 128, 'attention_pooling_operation': 'mean', 'embedding_pooling_operation': 'max', 'threshold': 0.7169077802988687, 'batch_size': 36, 'attention_heads': 16, 'hidden_dimension': 84, 'number_of_hidden_layers': 3, 'dropout_rate': 0.5504356789504136, 'global_pooling': 'max', 'learning_rate': 2.7183576203365732e-05, 'weight_decay': 5.997355744796594e-06, 'beta_0': 0.8797561066113937, 'beta_1': 0.9905563715667502, 'epsilon': 2.3063879063063053e-05, 'balanced_loss': True, 'epochs': 133, 'early_stopping_patience': 14, 'plateau_patience': 18, 'plateau_divider': 7}. Best is trial 213 with value: 0.9803273479163068.
[I 2024-12-14 23:38:24,257] Trial 228 finished with value: 0.9607913334019234 and parameters: {'left_stride': 256, 'right_stride': 128, 'attention_pooling_operation': 'mean', 'embedding_pooling_operation': 'max', 'threshold': 0.7236839943917166, 'batch_size': 36, 'attention_heads': 16, 'hidden_dimension': 78, 'number_of_hidden_layers': 3, 'dropout_rate': 0.5324551633793211, 'global_pooling': 'max', 'learning_rate': 1.9239017659530505e-05, 'weight_decay': 4.63108098350473e-06, 'beta_0': 0.8805261053496316, 'beta_1': 0.9910053888456065, 'epsilon': 2.8680279021411387e-05, 'balanced_loss': True, 'epochs': 139, 'early_stopping_patience': 16, 'plateau_patience': 18, 'plateau_divider': 7}. Best is trial 213 with value: 0.9803273479163068.
CUDA out of memory. Tried to allocate 1.90 GiB. GPU 0 has a total capacity of 44.56 GiB of which 914.69 MiB is free. Including non-PyTorch memory, this process has 43.66 GiB memory in use. Of the allocated memory 40.18 GiB is allocated by PyTorch, and 2.33 GiB is reserved by PyTorch but unallocated. If reserved but unallocated memory is large try setting PYTORCH_CUDA_ALLOC_CONF=expandable_segments:True to avoid fragmentation.  See documentation for Memory Management  (https://pytorch.org/docs/stable/notes/cuda.html#environment-variables)
[I 2024-12-14 23:45:35,813] Trial 229 finished with value: -1.0 and parameters: {'left_stride': 64, 'right_stride': 128, 'attention_pooling_operation': 'mean', 'embedding_pooling_operation': 'max', 'threshold': 0.6991889914437661, 'batch_size': 117, 'attention_heads': 16, 'hidden_dimension': 98, 'number_of_hidden_layers': 3, 'dropout_rate': 0.5418850413805374, 'global_pooling': 'max', 'learning_rate': 3.482455072248264e-05, 'weight_decay': 6.120882034412597e-06, 'beta_0': 0.8777859671485828, 'beta_1': 0.9922061022064756, 'epsilon': 2.0509753737738534e-05, 'balanced_loss': True, 'epochs': 131, 'early_stopping_patience': 15, 'plateau_patience': 18, 'plateau_divider': 7}. Best is trial 213 with value: 0.9803273479163068.
[I 2024-12-15 00:25:38,715] Trial 230 finished with value: 0.9669872130052353 and parameters: {'left_stride': 64, 'right_stride': 128, 'attention_pooling_operation': 'mean', 'embedding_pooling_operation': 'min', 'threshold': 0.7158773813455738, 'batch_size': 40, 'attention_heads': 16, 'hidden_dimension': 87, 'number_of_hidden_layers': 3, 'dropout_rate': 0.570212031573333, 'global_pooling': 'max', 'learning_rate': 2.6336815943315534e-05, 'weight_decay': 6.928204607372849e-06, 'beta_0': 0.8977049915843757, 'beta_1': 0.9901824784787768, 'epsilon': 3.552412192362031e-05, 'balanced_loss': True, 'epochs': 114, 'early_stopping_patience': 15, 'plateau_patience': 19, 'plateau_divider': 7}. Best is trial 213 with value: 0.9803273479163068.
[I 2024-12-15 01:09:41,609] Trial 231 finished with value: 0.9414562514176159 and parameters: {'left_stride': 64, 'right_stride': 128, 'attention_pooling_operation': 'mean', 'embedding_pooling_operation': 'max', 'threshold': 0.7328024805126861, 'batch_size': 32, 'attention_heads': 16, 'hidden_dimension': 69, 'number_of_hidden_layers': 3, 'dropout_rate': 0.5471188305009721, 'global_pooling': 'max', 'learning_rate': 1.5334686395804834e-05, 'weight_decay': 5.340356107260447e-06, 'beta_0': 0.8811588413527185, 'beta_1': 0.9917292750266986, 'epsilon': 3.403465427373641e-08, 'balanced_loss': False, 'epochs': 130, 'early_stopping_patience': 15, 'plateau_patience': 18, 'plateau_divider': 7}. Best is trial 213 with value: 0.9803273479163068.
[I 2024-12-15 01:36:05,824] Trial 232 finished with value: 0.9701934916306005 and parameters: {'left_stride': 64, 'right_stride': 0, 'attention_pooling_operation': 'mean', 'embedding_pooling_operation': 'max', 'threshold': 0.7393905651059277, 'batch_size': 40, 'attention_heads': 16, 'hidden_dimension': 81, 'number_of_hidden_layers': 3, 'dropout_rate': 0.5553669085563415, 'global_pooling': 'max', 'learning_rate': 4.208576003994605e-05, 'weight_decay': 0.00016526021242771143, 'beta_0': 0.8756164651245981, 'beta_1': 0.9909712482666319, 'epsilon': 2.5851234247849054e-05, 'balanced_loss': True, 'epochs': 108, 'early_stopping_patience': 14, 'plateau_patience': 19, 'plateau_divider': 7}. Best is trial 213 with value: 0.9803273479163068.
[I 2024-12-15 02:07:32,972] Trial 233 finished with value: 0.958068143271537 and parameters: {'left_stride': 64, 'right_stride': 128, 'attention_pooling_operation': 'mean', 'embedding_pooling_operation': 'max', 'threshold': 0.7244766989916721, 'batch_size': 48, 'attention_heads': 16, 'hidden_dimension': 76, 'number_of_hidden_layers': 3, 'dropout_rate': 0.5384861860571214, 'global_pooling': 'max', 'learning_rate': 3.0629889094758565e-05, 'weight_decay': 4.722032932335393e-06, 'beta_0': 0.8789294015682477, 'beta_1': 0.9905963262212124, 'epsilon': 3.948116156228427e-05, 'balanced_loss': True, 'epochs': 70, 'early_stopping_patience': 13, 'plateau_patience': 18, 'plateau_divider': 7}. Best is trial 213 with value: 0.9803273479163068.
CUDA out of memory. Tried to allocate 1.50 GiB. GPU 0 has a total capacity of 44.56 GiB of which 388.69 MiB is free. Including non-PyTorch memory, this process has 44.17 GiB memory in use. Of the allocated memory 39.86 GiB is allocated by PyTorch, and 3.17 GiB is reserved by PyTorch but unallocated. If reserved but unallocated memory is large try setting PYTORCH_CUDA_ALLOC_CONF=expandable_segments:True to avoid fragmentation.  See documentation for Memory Management  (https://pytorch.org/docs/stable/notes/cuda.html#environment-variables)
