[I 2024-12-03 17:07:21,549] Using an existing study with name 'R8-GATv2-facebook-bart-base-Grouped-No_Aggregation' instead of creating a new one.
[I 2024-12-03 17:16:53,184] Trial 144 finished with value: 0.9513734147113369 and parameters: {'left_stride': 128, 'right_stride': 256, 'attention_pooling_operation': 'max', 'embedding_pooling_operation': 'max', 'threshold': 0.6889404356032497, 'batch_size': 40, 'attention_heads': 4, 'hidden_dimension': 151, 'number_of_hidden_layers': 2, 'dropout_rate': 0.3345705570054114, 'global_pooling': 'max', 'learning_rate': 8.898050358800507e-05, 'weight_decay': 8.415620564810938e-06, 'beta_0': 0.8415526811122526, 'beta_1': 0.994088768028342, 'epsilon': 1.3313986959991822e-08, 'balanced_loss': False, 'epochs': 137, 'early_stopping_patience': 18, 'plateau_patience': 12, 'plateau_divider': 5}. Best is trial 122 with value: 0.9609051244746034.
[I 2024-12-03 17:34:47,940] Trial 145 finished with value: 0.9245284633776515 and parameters: {'left_stride': 128, 'right_stride': 256, 'attention_pooling_operation': 'max', 'embedding_pooling_operation': 'max', 'threshold': 0.6689109420599022, 'batch_size': 151, 'attention_heads': 4, 'hidden_dimension': 124, 'number_of_hidden_layers': 2, 'dropout_rate': 0.3468457531057771, 'global_pooling': 'max', 'learning_rate': 2.429137691169776e-05, 'weight_decay': 7.010833463746858e-06, 'beta_0': 0.850592845835905, 'beta_1': 0.9948531482658136, 'epsilon': 1.6027532524646188e-08, 'balanced_loss': False, 'epochs': 110, 'early_stopping_patience': 20, 'plateau_patience': 15, 'plateau_divider': 5}. Best is trial 122 with value: 0.9609051244746034.
[I 2024-12-03 17:45:00,523] Trial 146 finished with value: 0.9484643683512146 and parameters: {'left_stride': 128, 'right_stride': 256, 'attention_pooling_operation': 'max', 'embedding_pooling_operation': 'max', 'threshold': 0.658191472025699, 'batch_size': 33, 'attention_heads': 5, 'hidden_dimension': 163, 'number_of_hidden_layers': 2, 'dropout_rate': 0.30578902597792446, 'global_pooling': 'max', 'learning_rate': 0.00014717010888124562, 'weight_decay': 0.000674293608225281, 'beta_0': 0.8478298243240158, 'beta_1': 0.9905260475859383, 'epsilon': 1.0102584839571142e-08, 'balanced_loss': False, 'epochs': 114, 'early_stopping_patience': 19, 'plateau_patience': 14, 'plateau_divider': 5}. Best is trial 122 with value: 0.9609051244746034.
[I 2024-12-03 18:00:54,558] Trial 147 finished with value: 0.942482804965996 and parameters: {'left_stride': 128, 'right_stride': 32, 'attention_pooling_operation': 'max', 'embedding_pooling_operation': 'max', 'threshold': 0.6836734772062434, 'batch_size': 162, 'attention_heads': 4, 'hidden_dimension': 143, 'number_of_hidden_layers': 2, 'dropout_rate': 0.3266946433837334, 'global_pooling': 'max', 'learning_rate': 4.7613646221434626e-05, 'weight_decay': 4.479734077163875e-06, 'beta_0': 0.8400973184668359, 'beta_1': 0.9945008852369915, 'epsilon': 5.1446564989035636e-08, 'balanced_loss': False, 'epochs': 102, 'early_stopping_patience': 21, 'plateau_patience': 11, 'plateau_divider': 5}. Best is trial 122 with value: 0.9609051244746034.
[I 2024-12-03 18:09:06,066] Trial 148 finished with value: 0.24140487027776203 and parameters: {'left_stride': 128, 'right_stride': 256, 'attention_pooling_operation': 'max', 'embedding_pooling_operation': 'max', 'threshold': 0.674261360180566, 'batch_size': 138, 'attention_heads': 5, 'hidden_dimension': 133, 'number_of_hidden_layers': 2, 'dropout_rate': 0.3164501792016319, 'global_pooling': 'sum', 'learning_rate': 0.04111834324236489, 'weight_decay': 3.3882603123787426e-06, 'beta_0': 0.8436517251641169, 'beta_1': 0.9918044652488915, 'epsilon': 2.2303559951543767e-08, 'balanced_loss': False, 'epochs': 121, 'early_stopping_patience': 19, 'plateau_patience': 13, 'plateau_divider': 5}. Best is trial 122 with value: 0.9609051244746034.
[I 2024-12-03 18:19:04,767] Trial 149 finished with value: 0.9489858897189598 and parameters: {'left_stride': 128, 'right_stride': 256, 'attention_pooling_operation': 'max', 'embedding_pooling_operation': 'max', 'threshold': 0.7028190911149209, 'batch_size': 78, 'attention_heads': 4, 'hidden_dimension': 158, 'number_of_hidden_layers': 2, 'dropout_rate': 0.43962734982768675, 'global_pooling': 'max', 'learning_rate': 0.0001943317450630054, 'weight_decay': 2.194713212151839e-06, 'beta_0': 0.8371651664650033, 'beta_1': 0.9936897399642319, 'epsilon': 7.875785754146778e-07, 'balanced_loss': False, 'epochs': 105, 'early_stopping_patience': 18, 'plateau_patience': 10, 'plateau_divider': 5}. Best is trial 122 with value: 0.9609051244746034.
[I 2024-12-03 18:31:41,824] Trial 150 finished with value: 0.9534073286100169 and parameters: {'left_stride': 128, 'right_stride': 0, 'attention_pooling_operation': 'max', 'embedding_pooling_operation': 'max', 'threshold': 0.6632432749681505, 'batch_size': 156, 'attention_heads': 6, 'hidden_dimension': 115, 'number_of_hidden_layers': 2, 'dropout_rate': 0.3313189459781738, 'global_pooling': 'max', 'learning_rate': 0.00012449060435974259, 'weight_decay': 1.29471991306592e-05, 'beta_0': 0.8520133065746834, 'beta_1': 0.9939289965957645, 'epsilon': 2.529195368826863e-08, 'balanced_loss': False, 'epochs': 127, 'early_stopping_patience': 22, 'plateau_patience': 14, 'plateau_divider': 4}. Best is trial 122 with value: 0.9609051244746034.
[I 2024-12-03 18:44:36,104] Trial 151 finished with value: 0.9463401549017294 and parameters: {'left_stride': 128, 'right_stride': 0, 'attention_pooling_operation': 'max', 'embedding_pooling_operation': 'max', 'threshold': 0.6645579533551066, 'batch_size': 131, 'attention_heads': 6, 'hidden_dimension': 112, 'number_of_hidden_layers': 2, 'dropout_rate': 0.3652561684815445, 'global_pooling': 'max', 'learning_rate': 0.0001158927849931407, 'weight_decay': 1.1414274365114703e-05, 'beta_0': 0.8542880730110242, 'beta_1': 0.9933053082130106, 'epsilon': 3.471342232266223e-08, 'balanced_loss': False, 'epochs': 129, 'early_stopping_patience': 22, 'plateau_patience': 14, 'plateau_divider': 4}. Best is trial 122 with value: 0.9609051244746034.
[I 2024-12-03 18:59:06,766] Trial 152 finished with value: 0.9554957690420036 and parameters: {'left_stride': 128, 'right_stride': 0, 'attention_pooling_operation': 'max', 'embedding_pooling_operation': 'max', 'threshold': 0.6566087781087049, 'batch_size': 143, 'attention_heads': 7, 'hidden_dimension': 122, 'number_of_hidden_layers': 2, 'dropout_rate': 0.3008327885777343, 'global_pooling': 'max', 'learning_rate': 8.345771899398933e-05, 'weight_decay': 8.42125582755087e-06, 'beta_0': 0.8515020198236315, 'beta_1': 0.9958765043002273, 'epsilon': 2.6780414834718837e-08, 'balanced_loss': False, 'epochs': 135, 'early_stopping_patience': 19, 'plateau_patience': 15, 'plateau_divider': 4}. Best is trial 122 with value: 0.9609051244746034.
[I 2024-12-03 19:13:12,004] Trial 153 finished with value: 0.9533532271477352 and parameters: {'left_stride': 128, 'right_stride': 0, 'attention_pooling_operation': 'max', 'embedding_pooling_operation': 'max', 'threshold': 0.6568833424071284, 'batch_size': 142, 'attention_heads': 7, 'hidden_dimension': 116, 'number_of_hidden_layers': 2, 'dropout_rate': 0.30251578509135796, 'global_pooling': 'max', 'learning_rate': 7.531752244674423e-05, 'weight_decay': 8.344941796813508e-06, 'beta_0': 0.8513049141624611, 'beta_1': 0.9959871073727392, 'epsilon': 2.842059565358186e-08, 'balanced_loss': False, 'epochs': 135, 'early_stopping_patience': 19, 'plateau_patience': 15, 'plateau_divider': 4}. Best is trial 122 with value: 0.9609051244746034.
[I 2024-12-03 19:29:16,578] Trial 154 finished with value: 0.9433420700810865 and parameters: {'left_stride': 128, 'right_stride': 0, 'attention_pooling_operation': 'max', 'embedding_pooling_operation': 'max', 'threshold': 0.6573969435867499, 'batch_size': 155, 'attention_heads': 7, 'hidden_dimension': 118, 'number_of_hidden_layers': 2, 'dropout_rate': 0.3042920901638749, 'global_pooling': 'max', 'learning_rate': 5.903454335017406e-05, 'weight_decay': 1.3169149211091349e-05, 'beta_0': 0.852239155487731, 'beta_1': 0.9960723806695749, 'epsilon': 2.7462952381945513e-08, 'balanced_loss': False, 'epochs': 124, 'early_stopping_patience': 19, 'plateau_patience': 15, 'plateau_divider': 4}. Best is trial 122 with value: 0.9609051244746034.
CUDA out of memory. Tried to allocate 2.82 GiB. GPU 0 has a total capacity of 44.56 GiB of which 722.69 MiB is free. Including non-PyTorch memory, this process has 43.85 GiB memory in use. Of the allocated memory 40.66 GiB is allocated by PyTorch, and 2.04 GiB is reserved by PyTorch but unallocated. If reserved but unallocated memory is large try setting PYTORCH_CUDA_ALLOC_CONF=expandable_segments:True to avoid fragmentation.  See documentation for Memory Management  (https://pytorch.org/docs/stable/notes/cuda.html#environment-variables)
[I 2024-12-03 19:41:19,322] Trial 155 finished with value: -1.0 and parameters: {'left_stride': 128, 'right_stride': 0, 'attention_pooling_operation': 'max', 'embedding_pooling_operation': 'max', 'threshold': 0.6578593540687212, 'batch_size': 240, 'attention_heads': 7, 'hidden_dimension': 99, 'number_of_hidden_layers': 2, 'dropout_rate': 0.42629742249238084, 'global_pooling': 'max', 'learning_rate': 8.51008294109086e-05, 'weight_decay': 9.017542443163626e-06, 'beta_0': 0.8283768104022667, 'beta_1': 0.997323854001008, 'epsilon': 2.390467985370609e-08, 'balanced_loss': False, 'epochs': 131, 'early_stopping_patience': 23, 'plateau_patience': 14, 'plateau_divider': 3}. Best is trial 122 with value: 0.9609051244746034.
CUDA out of memory. Tried to allocate 2.78 GiB. GPU 0 has a total capacity of 44.56 GiB of which 878.69 MiB is free. Including non-PyTorch memory, this process has 43.70 GiB memory in use. Of the allocated memory 40.17 GiB is allocated by PyTorch, and 2.37 GiB is reserved by PyTorch but unallocated. If reserved but unallocated memory is large try setting PYTORCH_CUDA_ALLOC_CONF=expandable_segments:True to avoid fragmentation.  See documentation for Memory Management  (https://pytorch.org/docs/stable/notes/cuda.html#environment-variables)
[I 2024-12-03 19:55:29,199] Trial 156 finished with value: -1.0 and parameters: {'left_stride': 128, 'right_stride': 0, 'attention_pooling_operation': 'max', 'embedding_pooling_operation': 'max', 'threshold': 0.650501104295804, 'batch_size': 150, 'attention_heads': 8, 'hidden_dimension': 115, 'number_of_hidden_layers': 2, 'dropout_rate': 0.3026485082014746, 'global_pooling': 'max', 'learning_rate': 7.584508485026392e-05, 'weight_decay': 1.0596130667366409e-05, 'beta_0': 0.8501968884552438, 'beta_1': 0.995814012354135, 'epsilon': 1.4870681275291542e-08, 'balanced_loss': False, 'epochs': 127, 'early_stopping_patience': 20, 'plateau_patience': 15, 'plateau_divider': 4}. Best is trial 122 with value: 0.9609051244746034.
[I 2024-12-03 20:09:32,341] Trial 157 finished with value: 0.9553527475986185 and parameters: {'left_stride': 128, 'right_stride': 0, 'attention_pooling_operation': 'max', 'embedding_pooling_operation': 'max', 'threshold': 0.6638177622481725, 'batch_size': 141, 'attention_heads': 7, 'hidden_dimension': 119, 'number_of_hidden_layers': 2, 'dropout_rate': 0.30972402593998954, 'global_pooling': 'max', 'learning_rate': 0.00010099157973137087, 'weight_decay': 7.67889481124793e-06, 'beta_0': 0.8465037968429521, 'beta_1': 0.9952153824558845, 'epsilon': 1.75712791081938e-08, 'balanced_loss': False, 'epochs': 140, 'early_stopping_patience': 19, 'plateau_patience': 15, 'plateau_divider': 4}. Best is trial 122 with value: 0.9609051244746034.
[I 2024-12-03 20:21:48,384] Trial 158 finished with value: 0.9442883853609292 and parameters: {'left_stride': 0, 'right_stride': 0, 'attention_pooling_operation': 'max', 'embedding_pooling_operation': 'max', 'threshold': 0.6645827209696261, 'batch_size': 166, 'attention_heads': 7, 'hidden_dimension': 109, 'number_of_hidden_layers': 2, 'dropout_rate': 0.30940342405812615, 'global_pooling': 'max', 'learning_rate': 0.00012822487933748043, 'weight_decay': 7.959776869321036e-06, 'beta_0': 0.8565815390110246, 'beta_1': 0.995235579983061, 'epsilon': 3.020735068347361e-08, 'balanced_loss': False, 'epochs': 140, 'early_stopping_patience': 19, 'plateau_patience': 14, 'plateau_divider': 4}. Best is trial 122 with value: 0.9609051244746034.
[I 2024-12-03 20:32:52,061] Trial 159 finished with value: 0.9488470987693871 and parameters: {'left_stride': 128, 'right_stride': 0, 'attention_pooling_operation': 'max', 'embedding_pooling_operation': 'max', 'threshold': 0.650084161152638, 'batch_size': 135, 'attention_heads': 6, 'hidden_dimension': 121, 'number_of_hidden_layers': 2, 'dropout_rate': 0.31125842008841015, 'global_pooling': 'max', 'learning_rate': 0.00016256992143301905, 'weight_decay': 1.2727135546699677e-05, 'beta_0': 0.8477609239768783, 'beta_1': 0.9955425941497017, 'epsilon': 4.5110283553692917e-08, 'balanced_loss': False, 'epochs': 135, 'early_stopping_patience': 20, 'plateau_patience': 13, 'plateau_divider': 3}. Best is trial 122 with value: 0.9609051244746034.
[I 2024-12-03 20:46:43,673] Trial 160 finished with value: 0.9544917307511993 and parameters: {'left_stride': 128, 'right_stride': 0, 'attention_pooling_operation': 'max', 'embedding_pooling_operation': 'max', 'threshold': 0.6617137306530166, 'batch_size': 147, 'attention_heads': 8, 'hidden_dimension': 116, 'number_of_hidden_layers': 2, 'dropout_rate': 0.3194104831017516, 'global_pooling': 'max', 'learning_rate': 0.00011378786051688384, 'weight_decay': 9.570877803466679e-06, 'beta_0': 0.8511577370286858, 'beta_1': 0.9948559295778364, 'epsilon': 1.8032638358347142e-08, 'balanced_loss': False, 'epochs': 147, 'early_stopping_patience': 19, 'plateau_patience': 16, 'plateau_divider': 4}. Best is trial 122 with value: 0.9609051244746034.
[I 2024-12-03 21:01:08,454] Trial 161 finished with value: 0.9441085346721836 and parameters: {'left_stride': 128, 'right_stride': 0, 'attention_pooling_operation': 'max', 'embedding_pooling_operation': 'max', 'threshold': 0.6592239880327194, 'batch_size': 146, 'attention_heads': 8, 'hidden_dimension': 107, 'number_of_hidden_layers': 2, 'dropout_rate': 0.3216799458499805, 'global_pooling': 'max', 'learning_rate': 9.827253420676679e-05, 'weight_decay': 1.542321552999443e-05, 'beta_0': 0.8528799430036335, 'beta_1': 0.9969374185804225, 'epsilon': 1.8237955287741225e-08, 'balanced_loss': False, 'epochs': 146, 'early_stopping_patience': 19, 'plateau_patience': 15, 'plateau_divider': 4}. Best is trial 122 with value: 0.9609051244746034.
[I 2024-12-03 21:12:49,183] Trial 162 finished with value: 0.9508262805018128 and parameters: {'left_stride': 128, 'right_stride': 0, 'attention_pooling_operation': 'max', 'embedding_pooling_operation': 'max', 'threshold': 0.6648452548123013, 'batch_size': 53, 'attention_heads': 7, 'hidden_dimension': 116, 'number_of_hidden_layers': 2, 'dropout_rate': 0.3190918066445653, 'global_pooling': 'max', 'learning_rate': 0.00011132180356964301, 'weight_decay': 9.971746427277502e-06, 'beta_0': 0.8502844563419335, 'beta_1': 0.996018163386514, 'epsilon': 1.2234607400172054e-08, 'balanced_loss': False, 'epochs': 118, 'early_stopping_patience': 18, 'plateau_patience': 14, 'plateau_divider': 4}. Best is trial 122 with value: 0.9609051244746034.
[I 2024-12-03 21:29:30,447] Trial 163 finished with value: 0.9582741330130676 and parameters: {'left_stride': 128, 'right_stride': 0, 'attention_pooling_operation': 'max', 'embedding_pooling_operation': 'max', 'threshold': 0.6578254560104159, 'batch_size': 158, 'attention_heads': 7, 'hidden_dimension': 125, 'number_of_hidden_layers': 2, 'dropout_rate': 0.30119017652703167, 'global_pooling': 'max', 'learning_rate': 6.577328734192508e-05, 'weight_decay': 7.746318800063039e-06, 'beta_0': 0.8460872302092759, 'beta_1': 0.9949306631319799, 'epsilon': 2.5012263855048927e-08, 'balanced_loss': False, 'epochs': 138, 'early_stopping_patience': 19, 'plateau_patience': 16, 'plateau_divider': 4}. Best is trial 122 with value: 0.9609051244746034.
[I 2024-12-03 21:47:26,769] Trial 164 finished with value: 0.9510290971966322 and parameters: {'left_stride': 128, 'right_stride': 0, 'attention_pooling_operation': 'max', 'embedding_pooling_operation': 'max', 'threshold': 0.6554634819883333, 'batch_size': 156, 'attention_heads': 7, 'hidden_dimension': 122, 'number_of_hidden_layers': 2, 'dropout_rate': 0.30149203845660444, 'global_pooling': 'max', 'learning_rate': 6.268373659998047e-05, 'weight_decay': 8.877241205344045e-06, 'beta_0': 0.8455520953792565, 'beta_1': 0.9949582992981478, 'epsilon': 2.5644967337481264e-08, 'balanced_loss': False, 'epochs': 138, 'early_stopping_patience': 19, 'plateau_patience': 16, 'plateau_divider': 4}. Best is trial 122 with value: 0.9609051244746034.
[I 2024-12-03 22:02:02,151] Trial 165 finished with value: 0.9533765093196074 and parameters: {'left_stride': 128, 'right_stride': 0, 'attention_pooling_operation': 'max', 'embedding_pooling_operation': 'max', 'threshold': 0.6667917272671726, 'batch_size': 152, 'attention_heads': 7, 'hidden_dimension': 112, 'number_of_hidden_layers': 2, 'dropout_rate': 0.308783127773517, 'global_pooling': 'max', 'learning_rate': 7.056907385917764e-05, 'weight_decay': 1.0205083387062674e-05, 'beta_0': 0.8545993658850951, 'beta_1': 0.9953730531446299, 'epsilon': 1.9640703797037722e-08, 'balanced_loss': False, 'epochs': 145, 'early_stopping_patience': 19, 'plateau_patience': 16, 'plateau_divider': 4}. Best is trial 122 with value: 0.9609051244746034.
CUDA out of memory. Tried to allocate 2.88 GiB. GPU 0 has a total capacity of 44.56 GiB of which 2.01 GiB is free. Including non-PyTorch memory, this process has 42.54 GiB memory in use. Of the allocated memory 41.01 GiB is allocated by PyTorch, and 387.11 MiB is reserved by PyTorch but unallocated. If reserved but unallocated memory is large try setting PYTORCH_CUDA_ALLOC_CONF=expandable_segments:True to avoid fragmentation.  See documentation for Memory Management  (https://pytorch.org/docs/stable/notes/cuda.html#environment-variables)
[I 2024-12-03 22:16:33,755] Trial 166 finished with value: -1.0 and parameters: {'left_stride': 128, 'right_stride': 0, 'attention_pooling_operation': 'max', 'embedding_pooling_operation': 'max', 'threshold': 0.6676299684491704, 'batch_size': 153, 'attention_heads': 8, 'hidden_dimension': 124, 'number_of_hidden_layers': 2, 'dropout_rate': 0.3099770624578752, 'global_pooling': 'max', 'learning_rate': 5.0098251887906265e-05, 'weight_decay': 1.1312120616715439e-05, 'beta_0': 0.8556247531630767, 'beta_1': 0.9952981855567633, 'epsilon': 2.0201809972594365e-08, 'balanced_loss': False, 'epochs': 148, 'early_stopping_patience': 19, 'plateau_patience': 13, 'plateau_divider': 4}. Best is trial 122 with value: 0.9609051244746034.
[I 2024-12-03 22:36:00,582] Trial 167 finished with value: 0.9409168159422239 and parameters: {'left_stride': 128, 'right_stride': 0, 'attention_pooling_operation': 'max', 'embedding_pooling_operation': 'max', 'threshold': 0.6641304119253867, 'batch_size': 159, 'attention_heads': 6, 'hidden_dimension': 103, 'number_of_hidden_layers': 2, 'dropout_rate': 0.3274149862813036, 'global_pooling': 'max', 'learning_rate': 3.415444736624525e-05, 'weight_decay': 7.122690773458637e-06, 'beta_0': 0.8467139399484729, 'beta_1': 0.9942432615369245, 'epsilon': 1.6885151096454534e-08, 'balanced_loss': False, 'epochs': 150, 'early_stopping_patience': 20, 'plateau_patience': 16, 'plateau_divider': 3}. Best is trial 122 with value: 0.9609051244746034.
[I 2024-12-03 22:49:35,247] Trial 168 finished with value: 0.95569198920132 and parameters: {'left_stride': 128, 'right_stride': 0, 'attention_pooling_operation': 'max', 'embedding_pooling_operation': 'max', 'threshold': 0.6718519275056967, 'batch_size': 149, 'attention_heads': 8, 'hidden_dimension': 126, 'number_of_hidden_layers': 2, 'dropout_rate': 0.3156457063935826, 'global_pooling': 'max', 'learning_rate': 0.0001415583362137864, 'weight_decay': 9.69624028732734e-06, 'beta_0': 0.8544129258949692, 'beta_1': 0.9947097795621257, 'epsilon': 2.102209930265667e-08, 'balanced_loss': False, 'epochs': 122, 'early_stopping_patience': 20, 'plateau_patience': 16, 'plateau_divider': 4}. Best is trial 122 with value: 0.9609051244746034.
CUDA out of memory. Tried to allocate 2.64 GiB. GPU 0 has a total capacity of 44.56 GiB of which 2.46 GiB is free. Including non-PyTorch memory, this process has 42.09 GiB memory in use. Of the allocated memory 38.16 GiB is allocated by PyTorch, and 2.78 GiB is reserved by PyTorch but unallocated. If reserved but unallocated memory is large try setting PYTORCH_CUDA_ALLOC_CONF=expandable_segments:True to avoid fragmentation.  See documentation for Memory Management  (https://pytorch.org/docs/stable/notes/cuda.html#environment-variables)
[I 2024-12-03 23:00:18,846] Trial 169 finished with value: -1.0 and parameters: {'left_stride': 128, 'right_stride': 0, 'attention_pooling_operation': 'max', 'embedding_pooling_operation': 'max', 'threshold': 0.6773517822015023, 'batch_size': 149, 'attention_heads': 8, 'hidden_dimension': 127, 'number_of_hidden_layers': 2, 'dropout_rate': 0.3164900952274372, 'global_pooling': 'max', 'learning_rate': 0.00013636017744761308, 'weight_decay': 5.71625136039438e-06, 'beta_0': 0.8424667360058434, 'beta_1': 0.9947521000486582, 'epsilon': 3.461813357731077e-08, 'balanced_loss': False, 'epochs': 122, 'early_stopping_patience': 22, 'plateau_patience': 15, 'plateau_divider': 4}. Best is trial 122 with value: 0.9609051244746034.
