[I 2024-12-03 23:13:54,446] Trial 170 finished with value: 0.9685678381952185 and parameters: {'left_stride': 128, 'right_stride': 0, 'attention_pooling_operation': 'max', 'embedding_pooling_operation': 'max', 'threshold': 0.673496459248764, 'batch_size': 163, 'attention_heads': 6, 'hidden_dimension': 132, 'number_of_hidden_layers': 2, 'dropout_rate': 0.32463739329990426, 'global_pooling': 'max', 'learning_rate': 0.00010591619204082997, 'weight_decay': 1.3188529007318123e-05, 'beta_0': 0.8487854939776684, 'beta_1': 0.9940625436732407, 'epsilon': 2.2778598175844155e-08, 'balanced_loss': False, 'epochs': 116, 'early_stopping_patience': 20, 'plateau_patience': 12, 'plateau_divider': 4}. Best is trial 170 with value: 0.9685678381952185.
[I 2024-12-03 23:24:44,460] Trial 171 finished with value: 0.9598017002242358 and parameters: {'left_stride': 128, 'right_stride': 0, 'attention_pooling_operation': 'max', 'embedding_pooling_operation': 'max', 'threshold': 0.8691523005483968, 'batch_size': 162, 'attention_heads': 6, 'hidden_dimension': 133, 'number_of_hidden_layers': 2, 'dropout_rate': 0.4593178724954647, 'global_pooling': 'max', 'learning_rate': 0.00010091487359082375, 'weight_decay': 9.375586598560591e-06, 'beta_0': 0.8485222396166001, 'beta_1': 0.9944920379117214, 'epsilon': 1.576155726569048e-08, 'balanced_loss': False, 'epochs': 116, 'early_stopping_patience': 20, 'plateau_patience': 12, 'plateau_divider': 4}. Best is trial 170 with value: 0.9685678381952185.
[I 2024-12-03 23:36:00,696] Trial 172 finished with value: 0.9429265418624423 and parameters: {'left_stride': 128, 'right_stride': 0, 'attention_pooling_operation': 'max', 'embedding_pooling_operation': 'max', 'threshold': 0.7863484743832818, 'batch_size': 166, 'attention_heads': 6, 'hidden_dimension': 134, 'number_of_hidden_layers': 2, 'dropout_rate': 0.38946138736402625, 'global_pooling': 'sum', 'learning_rate': 0.00010183993120548068, 'weight_decay': 9.13400031146229e-06, 'beta_0': 0.8487589636034616, 'beta_1': 0.9884700956555884, 'epsilon': 1.2109113961325729e-08, 'balanced_loss': False, 'epochs': 117, 'early_stopping_patience': 20, 'plateau_patience': 12, 'plateau_divider': 4}. Best is trial 170 with value: 0.9685678381952185.
[I 2024-12-03 23:47:12,088] Trial 173 finished with value: 0.9441053321466428 and parameters: {'left_stride': 128, 'right_stride': 0, 'attention_pooling_operation': 'max', 'embedding_pooling_operation': 'max', 'threshold': 0.8592157879285113, 'batch_size': 163, 'attention_heads': 9, 'hidden_dimension': 121, 'number_of_hidden_layers': 2, 'dropout_rate': 0.3220647983360734, 'global_pooling': 'max', 'learning_rate': 9.025445317933753e-05, 'weight_decay': 6.478287782524552e-06, 'beta_0': 0.8460238655632536, 'beta_1': 0.9944655103498087, 'epsilon': 1.8026378529878864e-08, 'balanced_loss': False, 'epochs': 119, 'early_stopping_patience': 21, 'plateau_patience': 12, 'plateau_divider': 4}. Best is trial 170 with value: 0.9685678381952185.
[I 2024-12-03 23:57:27,440] Trial 174 finished with value: 0.9520709069033811 and parameters: {'left_stride': 128, 'right_stride': 0, 'attention_pooling_operation': 'max', 'embedding_pooling_operation': 'max', 'threshold': 0.8255308213925502, 'batch_size': 147, 'attention_heads': 8, 'hidden_dimension': 130, 'number_of_hidden_layers': 2, 'dropout_rate': 0.4585568863580442, 'global_pooling': 'max', 'learning_rate': 0.000165027901565911, 'weight_decay': 7.485598213773197e-06, 'beta_0': 0.848430871121841, 'beta_1': 0.9949929321111214, 'epsilon': 2.1011965070624157e-08, 'balanced_loss': False, 'epochs': 112, 'early_stopping_patience': 20, 'plateau_patience': 11, 'plateau_divider': 3}. Best is trial 170 with value: 0.9685678381952185.
[I 2024-12-04 00:09:50,811] Trial 175 finished with value: 0.9464765399096918 and parameters: {'left_stride': 128, 'right_stride': 0, 'attention_pooling_operation': 'max', 'embedding_pooling_operation': 'max', 'threshold': 0.8712475703635572, 'batch_size': 159, 'attention_heads': 7, 'hidden_dimension': 127, 'number_of_hidden_layers': 2, 'dropout_rate': 0.31579037561261747, 'global_pooling': 'max', 'learning_rate': 4.159246696427816e-05, 'weight_decay': 2.023042823199391e-05, 'beta_0': 0.843417684356176, 'beta_1': 0.9941620371906115, 'epsilon': 1.4366193017333937e-08, 'balanced_loss': False, 'epochs': 115, 'early_stopping_patience': 20, 'plateau_patience': 12, 'plateau_divider': 4}. Best is trial 170 with value: 0.9685678381952185.
[I 2024-12-04 00:23:34,856] Trial 176 finished with value: 0.9473415641113245 and parameters: {'left_stride': 128, 'right_stride': 0, 'attention_pooling_operation': 'max', 'embedding_pooling_operation': 'max', 'threshold': 0.6719350434741801, 'batch_size': 142, 'attention_heads': 6, 'hidden_dimension': 133, 'number_of_hidden_layers': 2, 'dropout_rate': 0.3733016643584086, 'global_pooling': 'max', 'learning_rate': 0.00011502741801507058, 'weight_decay': 5.24144797310467e-06, 'beta_0': 0.8388630154219925, 'beta_1': 0.9946300297352042, 'epsilon': 1.6631888479026937e-08, 'balanced_loss': False, 'epochs': 108, 'early_stopping_patience': 20, 'plateau_patience': 16, 'plateau_divider': 3}. Best is trial 170 with value: 0.9685678381952185.
[I 2024-12-04 00:40:04,798] Trial 177 finished with value: 0.9394803486042457 and parameters: {'left_stride': 128, 'right_stride': 0, 'attention_pooling_operation': 'max', 'embedding_pooling_operation': 'max', 'threshold': 0.6501992739657906, 'batch_size': 138, 'attention_heads': 6, 'hidden_dimension': 141, 'number_of_hidden_layers': 2, 'dropout_rate': 0.300000721045518, 'global_pooling': 'max', 'learning_rate': 5.791089718628955e-05, 'weight_decay': 4.3569168399706705e-05, 'beta_0': 0.8445182107226469, 'beta_1': 0.9934263403770307, 'epsilon': 1.1237139774054866e-08, 'balanced_loss': False, 'epochs': 122, 'early_stopping_patience': 19, 'plateau_patience': 11, 'plateau_divider': 4}. Best is trial 170 with value: 0.9685678381952185.
CUDA out of memory. Tried to allocate 2.62 GiB. GPU 0 has a total capacity of 44.56 GiB of which 2.45 GiB is free. Including non-PyTorch memory, this process has 42.11 GiB memory in use. Of the allocated memory 38.24 GiB is allocated by PyTorch, and 2.72 GiB is reserved by PyTorch but unallocated. If reserved but unallocated memory is large try setting PYTORCH_CUDA_ALLOC_CONF=expandable_segments:True to avoid fragmentation.  See documentation for Memory Management  (https://pytorch.org/docs/stable/notes/cuda.html#environment-variables)
[I 2024-12-04 00:47:14,757] Trial 178 finished with value: -1.0 and parameters: {'left_stride': 128, 'right_stride': 0, 'attention_pooling_operation': 'max', 'embedding_pooling_operation': 'max', 'threshold': 0.6573402135450827, 'batch_size': 168, 'attention_heads': 7, 'hidden_dimension': 126, 'number_of_hidden_layers': 2, 'dropout_rate': 0.4145594113270973, 'global_pooling': 'max', 'learning_rate': 0.0001442291424755845, 'weight_decay': 9.786517858087557e-06, 'beta_0': 0.8487294950128993, 'beta_1': 0.995645257932446, 'epsilon': 2.330180634568526e-08, 'balanced_loss': False, 'epochs': 112, 'early_stopping_patience': 21, 'plateau_patience': 12, 'plateau_divider': 4}. Best is trial 170 with value: 0.9685678381952185.
[I 2024-12-04 00:55:34,567] Trial 179 finished with value: 0.9178438664474508 and parameters: {'left_stride': 128, 'right_stride': 0, 'attention_pooling_operation': 'min', 'embedding_pooling_operation': 'max', 'threshold': 0.9046781396859744, 'batch_size': 88, 'attention_heads': 6, 'hidden_dimension': 135, 'number_of_hidden_layers': 2, 'dropout_rate': 0.3217922362690599, 'global_pooling': 'max', 'learning_rate': 7.966010280552983e-05, 'weight_decay': 8.376111950778682e-06, 'beta_0': 0.841657667052445, 'beta_1': 0.9942912049251027, 'epsilon': 4.218673111065767e-05, 'balanced_loss': False, 'epochs': 124, 'early_stopping_patience': 20, 'plateau_patience': 13, 'plateau_divider': 4}. Best is trial 170 with value: 0.9685678381952185.
[I 2024-12-04 01:03:25,855] Trial 180 finished with value: 0.9435180113413223 and parameters: {'left_stride': 128, 'right_stride': 0, 'attention_pooling_operation': 'max', 'embedding_pooling_operation': 'max', 'threshold': 0.9374665462179838, 'batch_size': 150, 'attention_heads': 6, 'hidden_dimension': 151, 'number_of_hidden_layers': 2, 'dropout_rate': 0.3109271211151174, 'global_pooling': 'max', 'learning_rate': 9.393330074279968e-05, 'weight_decay': 1.4494964914482038e-05, 'beta_0': 0.8352475165407376, 'beta_1': 0.9930300317898851, 'epsilon': 3.926103522145806e-08, 'balanced_loss': False, 'epochs': 159, 'early_stopping_patience': 19, 'plateau_patience': 16, 'plateau_divider': 4}. Best is trial 170 with value: 0.9685678381952185.
CUDA out of memory. Tried to allocate 2.71 GiB. GPU 0 has a total capacity of 44.56 GiB of which 1.70 GiB is free. Including non-PyTorch memory, this process has 42.86 GiB memory in use. Of the allocated memory 38.90 GiB is allocated by PyTorch, and 2.81 GiB is reserved by PyTorch but unallocated. If reserved but unallocated memory is large try setting PYTORCH_CUDA_ALLOC_CONF=expandable_segments:True to avoid fragmentation.  See documentation for Memory Management  (https://pytorch.org/docs/stable/notes/cuda.html#environment-variables)
[I 2024-12-04 01:08:48,094] Trial 181 finished with value: -1.0 and parameters: {'left_stride': 128, 'right_stride': 0, 'attention_pooling_operation': 'max', 'embedding_pooling_operation': 'max', 'threshold': 0.6770396822475325, 'batch_size': 162, 'attention_heads': 9, 'hidden_dimension': 121, 'number_of_hidden_layers': 2, 'dropout_rate': 0.32998619543041197, 'global_pooling': 'max', 'learning_rate': 6.507720603319054e-05, 'weight_decay': 4.307900823491816e-06, 'beta_0': 0.8466626950148528, 'beta_1': 0.9950315243696213, 'epsilon': 6.048505638054013e-07, 'balanced_loss': False, 'epochs': 116, 'early_stopping_patience': 20, 'plateau_patience': 16, 'plateau_divider': 4}. Best is trial 170 with value: 0.9685678381952185.
[I 2024-12-04 01:19:41,298] Trial 182 finished with value: 0.9363398731263988 and parameters: {'left_stride': 128, 'right_stride': 32, 'attention_pooling_operation': 'max', 'embedding_pooling_operation': 'max', 'threshold': 0.6700784324285709, 'batch_size': 59, 'attention_heads': 7, 'hidden_dimension': 138, 'number_of_hidden_layers': 2, 'dropout_rate': 0.32461993248101306, 'global_pooling': 'max', 'learning_rate': 0.00020206088837078002, 'weight_decay': 1.1237898423144691e-05, 'beta_0': 0.8509597198385184, 'beta_1': 0.9937748064135077, 'epsilon': 1.3651322008365944e-08, 'balanced_loss': False, 'epochs': 65, 'early_stopping_patience': 18, 'plateau_patience': 11, 'plateau_divider': 4}. Best is trial 170 with value: 0.9685678381952185.
[I 2024-12-04 01:27:14,432] Trial 183 finished with value: 0.9399541347425948 and parameters: {'left_stride': 128, 'right_stride': 0, 'attention_pooling_operation': 'max', 'embedding_pooling_operation': 'max', 'threshold': 0.9175126986774254, 'batch_size': 157, 'attention_heads': 6, 'hidden_dimension': 130, 'number_of_hidden_layers': 2, 'dropout_rate': 0.3339382604779817, 'global_pooling': 'max', 'learning_rate': 0.00013141914696144786, 'weight_decay': 1.2584460547866574e-05, 'beta_0': 0.8522759582567508, 'beta_1': 0.9939184409205111, 'epsilon': 2.591509681270223e-08, 'balanced_loss': False, 'epochs': 127, 'early_stopping_patience': 21, 'plateau_patience': 14, 'plateau_divider': 4}. Best is trial 170 with value: 0.9685678381952185.
[I 2024-12-04 01:41:22,101] Trial 184 finished with value: 0.9483083704233068 and parameters: {'left_stride': 128, 'right_stride': 0, 'attention_pooling_operation': 'max', 'embedding_pooling_operation': 'max', 'threshold': 0.6612634441222699, 'batch_size': 155, 'attention_heads': 6, 'hidden_dimension': 117, 'number_of_hidden_layers': 2, 'dropout_rate': 0.3293126591960532, 'global_pooling': 'max', 'learning_rate': 0.00011402086113323325, 'weight_decay': 1.678084661630616e-05, 'beta_0': 0.8529324227580269, 'beta_1': 0.9946985637346755, 'epsilon': 3.173072264569848e-08, 'balanced_loss': False, 'epochs': 129, 'early_stopping_patience': 22, 'plateau_patience': 13, 'plateau_divider': 4}. Best is trial 170 with value: 0.9685678381952185.
[I 2024-12-04 01:52:36,559] Trial 185 finished with value: 0.9455362725034935 and parameters: {'left_stride': 128, 'right_stride': 0, 'attention_pooling_operation': 'max', 'embedding_pooling_operation': 'max', 'threshold': 0.6620987893223322, 'batch_size': 172, 'attention_heads': 6, 'hidden_dimension': 121, 'number_of_hidden_layers': 2, 'dropout_rate': 0.3419097918290744, 'global_pooling': 'max', 'learning_rate': 0.0001579062109013325, 'weight_decay': 1.3186823543020754e-05, 'beta_0': 0.8496795106881913, 'beta_1': 0.9940727208870008, 'epsilon': 2.3938277517124697e-08, 'balanced_loss': False, 'epochs': 119, 'early_stopping_patience': 19, 'plateau_patience': 12, 'plateau_divider': 4}. Best is trial 170 with value: 0.9685678381952185.
[I 2024-12-04 01:59:11,004] Trial 186 finished with value: 0.9188755775632058 and parameters: {'left_stride': 0, 'right_stride': 0, 'attention_pooling_operation': 'max', 'embedding_pooling_operation': 'max', 'threshold': 0.8935985646345487, 'batch_size': 148, 'attention_heads': 6, 'hidden_dimension': 111, 'number_of_hidden_layers': 2, 'dropout_rate': 0.31419089890326507, 'global_pooling': 'max', 'learning_rate': 0.007070820001461421, 'weight_decay': 6.420461348120171e-06, 'beta_0': 0.8450163378775642, 'beta_1': 0.9872194201525444, 'epsilon': 1.7503884058455804e-08, 'balanced_loss': False, 'epochs': 125, 'early_stopping_patience': 19, 'plateau_patience': 14, 'plateau_divider': 4}. Best is trial 170 with value: 0.9685678381952185.
[I 2024-12-04 02:12:01,673] Trial 187 finished with value: 0.9463016641445663 and parameters: {'left_stride': 128, 'right_stride': 0, 'attention_pooling_operation': 'max', 'embedding_pooling_operation': 'max', 'threshold': 0.680514190981072, 'batch_size': 143, 'attention_heads': 7, 'hidden_dimension': 124, 'number_of_hidden_layers': 2, 'dropout_rate': 0.35201193316886054, 'global_pooling': 'max', 'learning_rate': 0.00010498578488556581, 'weight_decay': 9.816830916162588e-06, 'beta_0': 0.847085867758054, 'beta_1': 0.9935260304924075, 'epsilon': 2.1174599168456292e-08, 'balanced_loss': False, 'epochs': 110, 'early_stopping_patience': 19, 'plateau_patience': 13, 'plateau_divider': 5}. Best is trial 170 with value: 0.9685678381952185.
CUDA out of memory. Tried to allocate 2.86 GiB. GPU 0 has a total capacity of 44.56 GiB of which 1.82 GiB is free. Including non-PyTorch memory, this process has 42.73 GiB memory in use. Of the allocated memory 40.99 GiB is allocated by PyTorch, and 604.81 MiB is reserved by PyTorch but unallocated. If reserved but unallocated memory is large try setting PYTORCH_CUDA_ALLOC_CONF=expandable_segments:True to avoid fragmentation.  See documentation for Memory Management  (https://pytorch.org/docs/stable/notes/cuda.html#environment-variables)
[I 2024-12-04 02:17:02,121] Trial 188 finished with value: -1.0 and parameters: {'left_stride': 128, 'right_stride': 0, 'attention_pooling_operation': 'max', 'embedding_pooling_operation': 'max', 'threshold': 0.6556310809906238, 'batch_size': 154, 'attention_heads': 10, 'hidden_dimension': 142, 'number_of_hidden_layers': 2, 'dropout_rate': 0.3354642586256782, 'global_pooling': 'max', 'learning_rate': 0.00012384148553152029, 'weight_decay': 2.2297676761821913e-05, 'beta_0': 0.8401656254161585, 'beta_1': 0.9953536135165119, 'epsilon': 2.7061031336343386e-08, 'balanced_loss': False, 'epochs': 121, 'early_stopping_patience': 20, 'plateau_patience': 10, 'plateau_divider': 5}. Best is trial 170 with value: 0.9685678381952185.
[I 2024-12-04 02:27:34,697] Trial 189 finished with value: 0.9414673685662033 and parameters: {'left_stride': 128, 'right_stride': 0, 'attention_pooling_operation': 'max', 'embedding_pooling_operation': 'max', 'threshold': 0.8440125787173685, 'batch_size': 160, 'attention_heads': 8, 'hidden_dimension': 131, 'number_of_hidden_layers': 2, 'dropout_rate': 0.3189890583783079, 'global_pooling': 'max', 'learning_rate': 8.471245041258424e-05, 'weight_decay': 7.5311826843045315e-06, 'beta_0': 0.8572869538345159, 'beta_1': 0.9924063867822039, 'epsilon': 1.595751910029543e-08, 'balanced_loss': False, 'epochs': 72, 'early_stopping_patience': 18, 'plateau_patience': 16, 'plateau_divider': 4}. Best is trial 170 with value: 0.9685678381952185.
[I 2024-12-04 02:42:51,532] Trial 190 finished with value: 0.9527047797324774 and parameters: {'left_stride': 128, 'right_stride': 256, 'attention_pooling_operation': 'max', 'embedding_pooling_operation': 'max', 'threshold': 0.6707858196561164, 'batch_size': 146, 'attention_heads': 6, 'hidden_dimension': 137, 'number_of_hidden_layers': 2, 'dropout_rate': 0.30770704852892755, 'global_pooling': 'max', 'learning_rate': 7.167754647128486e-05, 'weight_decay': 5.464256857698544e-06, 'beta_0': 0.8513479544814029, 'beta_1': 0.9945106423088226, 'epsilon': 3.178190750180272e-08, 'balanced_loss': False, 'epochs': 114, 'early_stopping_patience': 19, 'plateau_patience': 17, 'plateau_divider': 5}. Best is trial 170 with value: 0.9685678381952185.
[I 2024-12-04 02:55:15,462] Trial 191 finished with value: 0.9422990833555825 and parameters: {'left_stride': 128, 'right_stride': 0, 'attention_pooling_operation': 'max', 'embedding_pooling_operation': 'max', 'threshold': 0.6501867144991021, 'batch_size': 137, 'attention_heads': 5, 'hidden_dimension': 127, 'number_of_hidden_layers': 2, 'dropout_rate': 0.3256255956810087, 'global_pooling': 'max', 'learning_rate': 0.00013805009923713334, 'weight_decay': 3.326819252158976e-05, 'beta_0': 0.8539424375290185, 'beta_1': 0.9939634292601518, 'epsilon': 2.015922190385001e-08, 'balanced_loss': False, 'epochs': 126, 'early_stopping_patience': 21, 'plateau_patience': 14, 'plateau_divider': 3}. Best is trial 170 with value: 0.9685678381952185.
CUDA out of memory. Tried to allocate 2.79 GiB. GPU 0 has a total capacity of 44.56 GiB of which 2.74 GiB is free. Including non-PyTorch memory, this process has 41.81 GiB memory in use. Of the allocated memory 40.04 GiB is allocated by PyTorch, and 638.33 MiB is reserved by PyTorch but unallocated. If reserved but unallocated memory is large try setting PYTORCH_CUDA_ALLOC_CONF=expandable_segments:True to avoid fragmentation.  See documentation for Memory Management  (https://pytorch.org/docs/stable/notes/cuda.html#environment-variables)
[I 2024-12-04 03:04:58,884] Trial 192 finished with value: -1.0 and parameters: {'left_stride': 128, 'right_stride': 256, 'attention_pooling_operation': 'max', 'embedding_pooling_operation': 'max', 'threshold': 0.6608164564282665, 'batch_size': 152, 'attention_heads': 7, 'hidden_dimension': 149, 'number_of_hidden_layers': 2, 'dropout_rate': 0.3142427079461305, 'global_pooling': 'max', 'learning_rate': 5.3944744870534865e-05, 'weight_decay': 1.094971164219279e-05, 'beta_0': 0.8421622223613168, 'beta_1': 0.9948486178789218, 'epsilon': 1.0021161125180555e-08, 'balanced_loss': False, 'epochs': 134, 'early_stopping_patience': 19, 'plateau_patience': 15, 'plateau_divider': 4}. Best is trial 170 with value: 0.9685678381952185.
[I 2024-12-04 03:19:34,150] Trial 193 finished with value: 0.9382953246680032 and parameters: {'left_stride': 128, 'right_stride': 0, 'attention_pooling_operation': 'max', 'embedding_pooling_operation': 'max', 'threshold': 0.6667742457875396, 'batch_size': 152, 'attention_heads': 7, 'hidden_dimension': 119, 'number_of_hidden_layers': 2, 'dropout_rate': 0.3082154107474238, 'global_pooling': 'max', 'learning_rate': 6.640007957877124e-05, 'weight_decay': 9.36743084020256e-06, 'beta_0': 0.8487683766911414, 'beta_1': 0.9954816816636202, 'epsilon': 2.0788394604695713e-08, 'balanced_loss': False, 'epochs': 143, 'early_stopping_patience': 19, 'plateau_patience': 16, 'plateau_divider': 4}. Best is trial 170 with value: 0.9685678381952185.
[I 2024-12-04 03:36:09,730] Trial 194 finished with value: 0.9524532240949927 and parameters: {'left_stride': 128, 'right_stride': 0, 'attention_pooling_operation': 'max', 'embedding_pooling_operation': 'max', 'threshold': 0.6681708011343215, 'batch_size': 157, 'attention_heads': 7, 'hidden_dimension': 114, 'number_of_hidden_layers': 2, 'dropout_rate': 0.3069023203580723, 'global_pooling': 'max', 'learning_rate': 7.654455191886207e-05, 'weight_decay': 1.0452872697724049e-05, 'beta_0': 0.8594744795178888, 'beta_1': 0.995100980879339, 'epsilon': 1.8034925609827536e-08, 'balanced_loss': False, 'epochs': 144, 'early_stopping_patience': 19, 'plateau_patience': 16, 'plateau_divider': 4}. Best is trial 170 with value: 0.9685678381952185.
[I 2024-12-04 03:51:33,500] Trial 195 finished with value: 0.9472307714118168 and parameters: {'left_stride': 128, 'right_stride': 0, 'attention_pooling_operation': 'max', 'embedding_pooling_operation': 'max', 'threshold': 0.6756022407795178, 'batch_size': 165, 'attention_heads': 8, 'hidden_dimension': 111, 'number_of_hidden_layers': 2, 'dropout_rate': 0.3183397079877937, 'global_pooling': 'max', 'learning_rate': 0.00010078921161306573, 'weight_decay': 8.320736756449008e-06, 'beta_0': 0.8543641867965616, 'beta_1': 0.9963298822716897, 'epsilon': 1.348838983770801e-08, 'balanced_loss': False, 'epochs': 140, 'early_stopping_patience': 19, 'plateau_patience': 17, 'plateau_divider': 4}. Best is trial 170 with value: 0.9685678381952185.
