Some weights of RobertaModel were not initialized from the model checkpoint at FacebookAI/roberta-large and are newly initialized: ['roberta.pooler.dense.bias', 'roberta.pooler.dense.weight']
You should probably TRAIN this model on a down-stream task to be able to use it for predictions and inference.
[I 2024-12-20 05:56:01,866] Using an existing study with name 'R8-GATv2-FacebookAI-roberta-large-Surrogate-No_Aggregation' instead of creating a new one.
Token indices sequence length is longer than the specified maximum sequence length for this model (655 > 512). Running this sequence through the model will result in indexing errors
[I 2024-12-20 06:13:14,219] Trial 135 finished with value: 0.951873544646578 and parameters: {'left_stride': 256, 'right_stride': 128, 'attention_pooling_operation': 'max', 'embedding_pooling_operation': 'max', 'threshold': 0.9839065619079422, 'batch_size': 77, 'attention_heads': 14, 'hidden_dimension': 62, 'number_of_hidden_layers': 3, 'dropout_rate': 0.4416119194135287, 'global_pooling': 'max', 'learning_rate': 0.00011135436516631248, 'weight_decay': 1.8661823317671122e-05, 'beta_0': 0.8089182727018691, 'beta_1': 0.9850883894661855, 'epsilon': 4.8627633835527853e-08, 'balanced_loss': False, 'epochs': 121, 'early_stopping_patience': 14, 'plateau_patience': 11, 'plateau_divider': 9}. Best is trial 94 with value: 0.9681287289875429.
[I 2024-12-20 06:32:57,885] Trial 136 finished with value: 0.9457128632586014 and parameters: {'left_stride': 256, 'right_stride': 128, 'attention_pooling_operation': 'max', 'embedding_pooling_operation': 'max', 'threshold': 0.9921370453788462, 'batch_size': 72, 'attention_heads': 14, 'hidden_dimension': 160, 'number_of_hidden_layers': 3, 'dropout_rate': 0.47499866910580346, 'global_pooling': 'max', 'learning_rate': 0.00016142760454621329, 'weight_decay': 1.7278388292125184e-06, 'beta_0': 0.806762958183907, 'beta_1': 0.9843267199609568, 'epsilon': 6.344701805715723e-08, 'balanced_loss': False, 'epochs': 111, 'early_stopping_patience': 10, 'plateau_patience': 11, 'plateau_divider': 8}. Best is trial 94 with value: 0.9681287289875429.
[I 2024-12-20 06:50:05,807] Trial 137 finished with value: 0.9149663744997811 and parameters: {'left_stride': 256, 'right_stride': 128, 'attention_pooling_operation': 'max', 'embedding_pooling_operation': 'max', 'threshold': 0.9741980460381977, 'batch_size': 83, 'attention_heads': 15, 'hidden_dimension': 57, 'number_of_hidden_layers': 3, 'dropout_rate': 0.4886353113015526, 'global_pooling': 'max', 'learning_rate': 0.00012350589360765276, 'weight_decay': 1.0102420214527649e-06, 'beta_0': 0.8003508477688449, 'beta_1': 0.9858450826797466, 'epsilon': 3.68549043729222e-08, 'balanced_loss': False, 'epochs': 119, 'early_stopping_patience': 14, 'plateau_patience': 10, 'plateau_divider': 4}. Best is trial 94 with value: 0.9681287289875429.
[I 2024-12-20 07:05:49,966] Trial 138 finished with value: 0.9288469080336625 and parameters: {'left_stride': 256, 'right_stride': 128, 'attention_pooling_operation': 'max', 'embedding_pooling_operation': 'max', 'threshold': 0.9473819120007192, 'batch_size': 68, 'attention_heads': 13, 'hidden_dimension': 48, 'number_of_hidden_layers': 3, 'dropout_rate': 0.4335058067002867, 'global_pooling': 'mean', 'learning_rate': 0.00018239873831784822, 'weight_decay': 1.51832957630876e-06, 'beta_0': 0.8058531652696455, 'beta_1': 0.983244302269163, 'epsilon': 2.0542794517004692e-08, 'balanced_loss': False, 'epochs': 182, 'early_stopping_patience': 12, 'plateau_patience': 10, 'plateau_divider': 8}. Best is trial 94 with value: 0.9681287289875429.
CUDA out of memory. Tried to allocate 1.52 GiB. GPU 0 has a total capacity of 44.56 GiB of which 750.69 MiB is free. Including non-PyTorch memory, this process has 43.82 GiB memory in use. Of the allocated memory 40.76 GiB is allocated by PyTorch, and 1.91 GiB is reserved by PyTorch but unallocated. If reserved but unallocated memory is large try setting PYTORCH_CUDA_ALLOC_CONF=expandable_segments:True to avoid fragmentation.  See documentation for Memory Management  (https://pytorch.org/docs/stable/notes/cuda.html#environment-variables)
[I 2024-12-20 07:16:58,511] Trial 139 finished with value: -1.0 and parameters: {'left_stride': 256, 'right_stride': 128, 'attention_pooling_operation': 'max', 'embedding_pooling_operation': 'max', 'threshold': 0.9612539746349472, 'batch_size': 90, 'attention_heads': 14, 'hidden_dimension': 145, 'number_of_hidden_layers': 3, 'dropout_rate': 0.5508081874271521, 'global_pooling': 'max', 'learning_rate': 0.04111834324236489, 'weight_decay': 1.980259157447303e-06, 'beta_0': 0.8155125664074695, 'beta_1': 0.9870627331320219, 'epsilon': 8.32434912022424e-08, 'balanced_loss': False, 'epochs': 196, 'early_stopping_patience': 11, 'plateau_patience': 11, 'plateau_divider': 8}. Best is trial 94 with value: 0.9681287289875429.
[I 2024-12-20 07:29:22,705] Trial 140 finished with value: 0.9560180155293654 and parameters: {'left_stride': 256, 'right_stride': 0, 'attention_pooling_operation': 'max', 'embedding_pooling_operation': 'max', 'threshold': 0.9864210830997423, 'batch_size': 55, 'attention_heads': 13, 'hidden_dimension': 42, 'number_of_hidden_layers': 3, 'dropout_rate': 0.4116448782061201, 'global_pooling': 'max', 'learning_rate': 0.00032762153578358, 'weight_decay': 1.3148187361985317e-06, 'beta_0': 0.8955441674289719, 'beta_1': 0.986590028370459, 'epsilon': 2.5323791294180666e-08, 'balanced_loss': False, 'epochs': 122, 'early_stopping_patience': 13, 'plateau_patience': 11, 'plateau_divider': 8}. Best is trial 94 with value: 0.9681287289875429.
[I 2024-12-20 07:44:22,776] Trial 141 finished with value: 0.9505190368933645 and parameters: {'left_stride': 256, 'right_stride': 128, 'attention_pooling_operation': 'max', 'embedding_pooling_operation': 'max', 'threshold': 0.9762335091141862, 'batch_size': 78, 'attention_heads': 15, 'hidden_dimension': 36, 'number_of_hidden_layers': 3, 'dropout_rate': 0.46165447230553797, 'global_pooling': 'max', 'learning_rate': 0.00013723087703235333, 'weight_decay': 6.094525117098268e-06, 'beta_0': 0.8875759830491341, 'beta_1': 0.9970739955440469, 'epsilon': 3.54857271564784e-08, 'balanced_loss': False, 'epochs': 129, 'early_stopping_patience': 11, 'plateau_patience': 14, 'plateau_divider': 9}. Best is trial 94 with value: 0.9681287289875429.
[I 2024-12-20 07:56:21,781] Trial 142 finished with value: 0.9201653386092817 and parameters: {'left_stride': 128, 'right_stride': 128, 'attention_pooling_operation': 'max', 'embedding_pooling_operation': 'min', 'threshold': 0.9942295657287838, 'batch_size': 34, 'attention_heads': 6, 'hidden_dimension': 135, 'number_of_hidden_layers': 3, 'dropout_rate': 0.5050223915659778, 'global_pooling': 'max', 'learning_rate': 0.0007641955367341402, 'weight_decay': 1.823028077133408e-06, 'beta_0': 0.8711821882443921, 'beta_1': 0.9847963701109279, 'epsilon': 1.1758233458727527e-08, 'balanced_loss': True, 'epochs': 124, 'early_stopping_patience': 10, 'plateau_patience': 10, 'plateau_divider': 2}. Best is trial 94 with value: 0.9681287289875429.
[I 2024-12-20 08:12:16,201] Trial 143 finished with value: 0.9568742976865132 and parameters: {'left_stride': 256, 'right_stride': 128, 'attention_pooling_operation': 'max', 'embedding_pooling_operation': 'max', 'threshold': 0.9697417360667605, 'batch_size': 62, 'attention_heads': 15, 'hidden_dimension': 53, 'number_of_hidden_layers': 3, 'dropout_rate': 0.4504196489949366, 'global_pooling': 'max', 'learning_rate': 0.00024785432676771227, 'weight_decay': 2.3206106189424796e-06, 'beta_0': 0.8046394568557333, 'beta_1': 0.9861043137274844, 'epsilon': 2.9185291692591785e-08, 'balanced_loss': False, 'epochs': 200, 'early_stopping_patience': 12, 'plateau_patience': 12, 'plateau_divider': 8}. Best is trial 94 with value: 0.9681287289875429.
[I 2024-12-20 08:27:58,468] Trial 144 finished with value: 0.9602779942696467 and parameters: {'left_stride': 256, 'right_stride': 128, 'attention_pooling_operation': 'max', 'embedding_pooling_operation': 'max', 'threshold': 0.9652991257603034, 'batch_size': 58, 'attention_heads': 15, 'hidden_dimension': 46, 'number_of_hidden_layers': 3, 'dropout_rate': 0.4701104553651465, 'global_pooling': 'max', 'learning_rate': 0.0002300990959208334, 'weight_decay': 2.6964135607555006e-06, 'beta_0': 0.8019868131929682, 'beta_1': 0.985454095186793, 'epsilon': 4.73772279152038e-08, 'balanced_loss': False, 'epochs': 105, 'early_stopping_patience': 11, 'plateau_patience': 13, 'plateau_divider': 8}. Best is trial 94 with value: 0.9681287289875429.
[I 2024-12-20 08:44:00,696] Trial 145 finished with value: 0.952265265687757 and parameters: {'left_stride': 256, 'right_stride': 128, 'attention_pooling_operation': 'max', 'embedding_pooling_operation': 'max', 'threshold': 0.9535006169999256, 'batch_size': 51, 'attention_heads': 14, 'hidden_dimension': 47, 'number_of_hidden_layers': 3, 'dropout_rate': 0.47016074602760055, 'global_pooling': 'max', 'learning_rate': 0.0005089796436963927, 'weight_decay': 3.0128984699176126e-06, 'beta_0': 0.8036408261175281, 'beta_1': 0.9854463455841389, 'epsilon': 4.2083261156794104e-08, 'balanced_loss': False, 'epochs': 113, 'early_stopping_patience': 11, 'plateau_patience': 13, 'plateau_divider': 8}. Best is trial 94 with value: 0.9681287289875429.
[I 2024-12-20 08:58:37,133] Trial 146 finished with value: 0.9666293650414182 and parameters: {'left_stride': 256, 'right_stride': 128, 'attention_pooling_operation': 'max', 'embedding_pooling_operation': 'max', 'threshold': 0.9827838248530225, 'batch_size': 68, 'attention_heads': 14, 'hidden_dimension': 61, 'number_of_hidden_layers': 3, 'dropout_rate': 0.47571323869507115, 'global_pooling': 'max', 'learning_rate': 0.00021056936995785718, 'weight_decay': 1.527180881162934e-06, 'beta_0': 0.8000389427569079, 'beta_1': 0.9874475785329071, 'epsilon': 5.189913094436616e-08, 'balanced_loss': False, 'epochs': 107, 'early_stopping_patience': 10, 'plateau_patience': 11, 'plateau_divider': 8}. Best is trial 94 with value: 0.9681287289875429.
The selected strides are greater or equal to the total chunk size.
[I 2024-12-20 08:58:38,376] Trial 147 finished with value: -1.0 and parameters: {'left_stride': 256, 'right_stride': 256, 'attention_pooling_operation': 'max', 'embedding_pooling_operation': 'max', 'threshold': 0.9842070204845602, 'batch_size': 72, 'attention_heads': 14, 'hidden_dimension': 62, 'number_of_hidden_layers': 3, 'dropout_rate': 0.4823371344473414, 'global_pooling': 'max', 'learning_rate': 0.00016473350834984168, 'weight_decay': 1.5478353780134098e-06, 'beta_0': 0.8002029492800029, 'beta_1': 0.9892521520723777, 'epsilon': 6.628578254765214e-08, 'balanced_loss': False, 'epochs': 107, 'early_stopping_patience': 10, 'plateau_patience': 11, 'plateau_divider': 8}. Best is trial 94 with value: 0.9681287289875429.
[I 2024-12-20 09:20:32,612] Trial 148 finished with value: 0.9455741147153827 and parameters: {'left_stride': 256, 'right_stride': 128, 'attention_pooling_operation': 'mean', 'embedding_pooling_operation': 'max', 'threshold': 0.9784490052199865, 'batch_size': 85, 'attention_heads': 13, 'hidden_dimension': 74, 'number_of_hidden_layers': 3, 'dropout_rate': 0.49542793403430996, 'global_pooling': 'max', 'learning_rate': 0.0004261131217722464, 'weight_decay': 1.2098890994414916e-06, 'beta_0': 0.8321232893836483, 'beta_1': 0.9873591764306561, 'epsilon': 1.8132600403672135e-08, 'balanced_loss': False, 'epochs': 124, 'early_stopping_patience': 10, 'plateau_patience': 10, 'plateau_divider': 9}. Best is trial 94 with value: 0.9681287289875429.
CUDA out of memory. Tried to allocate 1.29 GiB. GPU 0 has a total capacity of 44.56 GiB of which 1.10 GiB is free. Including non-PyTorch memory, this process has 43.45 GiB memory in use. Of the allocated memory 40.09 GiB is allocated by PyTorch, and 2.22 GiB is reserved by PyTorch but unallocated. If reserved but unallocated memory is large try setting PYTORCH_CUDA_ALLOC_CONF=expandable_segments:True to avoid fragmentation.  See documentation for Memory Management  (https://pytorch.org/docs/stable/notes/cuda.html#environment-variables)
[I 2024-12-20 09:25:15,950] Trial 149 finished with value: -1.0 and parameters: {'left_stride': 256, 'right_stride': 64, 'attention_pooling_operation': 'max', 'embedding_pooling_operation': 'max', 'threshold': 0.777516400269604, 'batch_size': 75, 'attention_heads': 14, 'hidden_dimension': 69, 'number_of_hidden_layers': 3, 'dropout_rate': 0.5318154062265433, 'global_pooling': 'max', 'learning_rate': 0.00028697421117129866, 'weight_decay': 0.0005371803437301516, 'beta_0': 0.808218324645884, 'beta_1': 0.9889205703433089, 'epsilon': 5.6259123677085624e-08, 'balanced_loss': False, 'epochs': 118, 'early_stopping_patience': 10, 'plateau_patience': 11, 'plateau_divider': 8}. Best is trial 94 with value: 0.9681287289875429.
[I 2024-12-20 09:38:53,040] Trial 150 finished with value: 0.9653741893569561 and parameters: {'left_stride': 256, 'right_stride': 128, 'attention_pooling_operation': 'max', 'embedding_pooling_operation': 'max', 'threshold': 0.9885822153365121, 'batch_size': 64, 'attention_heads': 10, 'hidden_dimension': 60, 'number_of_hidden_layers': 3, 'dropout_rate': 0.4571646765169709, 'global_pooling': 'max', 'learning_rate': 0.00019827217167199684, 'weight_decay': 1.2727135546699677e-05, 'beta_0': 0.8919886460466973, 'beta_1': 0.9879344367441216, 'epsilon': 3.536354163513528e-08, 'balanced_loss': False, 'epochs': 154, 'early_stopping_patience': 12, 'plateau_patience': 16, 'plateau_divider': 8}. Best is trial 94 with value: 0.9681287289875429.
[I 2024-12-20 09:54:44,146] Trial 151 finished with value: 0.2645795753114291 and parameters: {'left_stride': 256, 'right_stride': 128, 'attention_pooling_operation': 'max', 'embedding_pooling_operation': 'max', 'threshold': 0.998487604252768, 'batch_size': 66, 'attention_heads': 11, 'hidden_dimension': 228, 'number_of_hidden_layers': 4, 'dropout_rate': 0.42587144512759234, 'global_pooling': 'max', 'learning_rate': 0.005094193855197498, 'weight_decay': 1.3652212682651922e-05, 'beta_0': 0.8912265421816153, 'beta_1': 0.9881825743175446, 'epsilon': 3.450836752222902e-08, 'balanced_loss': False, 'epochs': 151, 'early_stopping_patience': 12, 'plateau_patience': 16, 'plateau_divider': 7}. Best is trial 94 with value: 0.9681287289875429.
[I 2024-12-20 10:08:03,793] Trial 152 finished with value: 0.9432062730015558 and parameters: {'left_stride': 256, 'right_stride': 128, 'attention_pooling_operation': 'max', 'embedding_pooling_operation': 'max', 'threshold': 0.989020550120292, 'batch_size': 47, 'attention_heads': 9, 'hidden_dimension': 59, 'number_of_hidden_layers': 3, 'dropout_rate': 0.43871571696025696, 'global_pooling': 'sum', 'learning_rate': 0.0001937070754040257, 'weight_decay': 9.661317195661011e-06, 'beta_0': 0.8022818044430894, 'beta_1': 0.9900627017951639, 'epsilon': 3.0338843521029727e-07, 'balanced_loss': False, 'epochs': 146, 'early_stopping_patience': 13, 'plateau_patience': 15, 'plateau_divider': 7}. Best is trial 94 with value: 0.9681287289875429.
[I 2024-12-20 10:24:29,052] Trial 153 finished with value: 0.950068393624443 and parameters: {'left_stride': 256, 'right_stride': 128, 'attention_pooling_operation': 'max', 'embedding_pooling_operation': 'max', 'threshold': 0.9806981989776847, 'batch_size': 70, 'attention_heads': 14, 'hidden_dimension': 64, 'number_of_hidden_layers': 3, 'dropout_rate': 0.4598835266544007, 'global_pooling': 'max', 'learning_rate': 0.0001518857769129977, 'weight_decay': 8.18191480232613e-06, 'beta_0': 0.8938039670970848, 'beta_1': 0.9876260134127868, 'epsilon': 2.174305361277664e-08, 'balanced_loss': False, 'epochs': 167, 'early_stopping_patience': 15, 'plateau_patience': 17, 'plateau_divider': 8}. Best is trial 94 with value: 0.9681287289875429.
[I 2024-12-20 10:42:46,303] Trial 154 finished with value: 0.9596886595676863 and parameters: {'left_stride': 256, 'right_stride': 128, 'attention_pooling_operation': 'max', 'embedding_pooling_operation': 'max', 'threshold': 0.9733112158454255, 'batch_size': 65, 'attention_heads': 14, 'hidden_dimension': 52, 'number_of_hidden_layers': 3, 'dropout_rate': 0.4752986205544396, 'global_pooling': 'max', 'learning_rate': 0.00011607750187281259, 'weight_decay': 1.639032247808517e-05, 'beta_0': 0.8873262183708815, 'beta_1': 0.9868292296230315, 'epsilon': 1.241109014209853e-07, 'balanced_loss': False, 'epochs': 189, 'early_stopping_patience': 12, 'plateau_patience': 11, 'plateau_divider': 8}. Best is trial 94 with value: 0.9681287289875429.
[I 2024-12-20 11:00:29,311] Trial 155 finished with value: 0.9628424036430551 and parameters: {'left_stride': 256, 'right_stride': 128, 'attention_pooling_operation': 'max', 'embedding_pooling_operation': 'max', 'threshold': 0.9911827518472963, 'batch_size': 80, 'attention_heads': 10, 'hidden_dimension': 248, 'number_of_hidden_layers': 3, 'dropout_rate': 0.45033067927292597, 'global_pooling': 'max', 'learning_rate': 0.0003408470369961355, 'weight_decay': 1.8117173546507454e-06, 'beta_0': 0.8970288545317286, 'beta_1': 0.9879634394294549, 'epsilon': 2.5800920559293918e-08, 'balanced_loss': False, 'epochs': 158, 'early_stopping_patience': 11, 'plateau_patience': 16, 'plateau_divider': 8}. Best is trial 94 with value: 0.9681287289875429.
[I 2024-12-20 11:17:47,262] Trial 156 finished with value: 0.9351319496981114 and parameters: {'left_stride': 256, 'right_stride': 128, 'attention_pooling_operation': 'max', 'embedding_pooling_operation': 'max', 'threshold': 0.9923212393239013, 'batch_size': 79, 'attention_heads': 10, 'hidden_dimension': 220, 'number_of_hidden_layers': 3, 'dropout_rate': 0.4564095843252955, 'global_pooling': 'max', 'learning_rate': 0.00022377976052535538, 'weight_decay': 1.8669050186926896e-06, 'beta_0': 0.8999871182166932, 'beta_1': 0.9885171482029335, 'epsilon': 2.843245668694531e-08, 'balanced_loss': False, 'epochs': 152, 'early_stopping_patience': 11, 'plateau_patience': 15, 'plateau_divider': 8}. Best is trial 94 with value: 0.9681287289875429.
[I 2024-12-20 11:34:00,112] Trial 157 finished with value: 0.9560119140637928 and parameters: {'left_stride': 256, 'right_stride': 128, 'attention_pooling_operation': 'max', 'embedding_pooling_operation': 'max', 'threshold': 0.9864434547551388, 'batch_size': 91, 'attention_heads': 10, 'hidden_dimension': 58, 'number_of_hidden_layers': 3, 'dropout_rate': 0.5409865715766128, 'global_pooling': 'max', 'learning_rate': 0.00020765990306571619, 'weight_decay': 2.1218099451386937e-06, 'beta_0': 0.8961433574612052, 'beta_1': 0.989456839246916, 'epsilon': 2.4248680089003236e-08, 'balanced_loss': False, 'epochs': 160, 'early_stopping_patience': 11, 'plateau_patience': 16, 'plateau_divider': 8}. Best is trial 94 with value: 0.9681287289875429.
[I 2024-12-20 11:49:29,174] Trial 158 finished with value: 0.9421289326852549 and parameters: {'left_stride': 256, 'right_stride': 128, 'attention_pooling_operation': 'max', 'embedding_pooling_operation': 'max', 'threshold': 0.9983008664970957, 'batch_size': 103, 'attention_heads': 10, 'hidden_dimension': 178, 'number_of_hidden_layers': 3, 'dropout_rate': 0.44793154674630287, 'global_pooling': 'max', 'learning_rate': 0.0002813413701471054, 'weight_decay': 1.693487870757681e-06, 'beta_0': 0.8923388991940703, 'beta_1': 0.9958139551127486, 'epsilon': 1.562383222781255e-08, 'balanced_loss': False, 'epochs': 154, 'early_stopping_patience': 10, 'plateau_patience': 17, 'plateau_divider': 9}. Best is trial 94 with value: 0.9681287289875429.
[I 2024-12-20 12:15:51,982] Trial 159 finished with value: 0.9561743253737803 and parameters: {'left_stride': 256, 'right_stride': 128, 'attention_pooling_operation': 'max', 'embedding_pooling_operation': 'max', 'threshold': 0.9726179030998306, 'batch_size': 83, 'attention_heads': 10, 'hidden_dimension': 167, 'number_of_hidden_layers': 3, 'dropout_rate': 0.48442517659561163, 'global_pooling': 'max', 'learning_rate': 0.00013920508011820682, 'weight_decay': 1.1267660762635604e-05, 'beta_0': 0.8000095158519022, 'beta_1': 0.9874153680944463, 'epsilon': 3.94900703676792e-08, 'balanced_loss': False, 'epochs': 142, 'early_stopping_patience': 12, 'plateau_patience': 16, 'plateau_divider': 8}. Best is trial 94 with value: 0.9681287289875429.
[I 2024-12-20 12:43:17,145] Trial 160 finished with value: 0.8391228042429972 and parameters: {'left_stride': 256, 'right_stride': 128, 'attention_pooling_operation': 'min', 'embedding_pooling_operation': 'max', 'threshold': 0.9794388334100763, 'batch_size': 55, 'attention_heads': 11, 'hidden_dimension': 209, 'number_of_hidden_layers': 3, 'dropout_rate': 0.46525455628684664, 'global_pooling': 'max', 'learning_rate': 7.975270775105055e-05, 'weight_decay': 1.32875208018658e-06, 'beta_0': 0.8893034314803077, 'beta_1': 0.9880889599683499, 'epsilon': 3.5020775748087876e-08, 'balanced_loss': False, 'epochs': 178, 'early_stopping_patience': 11, 'plateau_patience': 12, 'plateau_divider': 5}. Best is trial 94 with value: 0.9681287289875429.
[I 2024-12-20 12:56:26,219] Trial 161 finished with value: 0.968159869773082 and parameters: {'left_stride': 256, 'right_stride': 32, 'attention_pooling_operation': 'max', 'embedding_pooling_operation': 'max', 'threshold': 0.9900852088174695, 'batch_size': 246, 'attention_heads': 9, 'hidden_dimension': 68, 'number_of_hidden_layers': 3, 'dropout_rate': 0.45258658711640776, 'global_pooling': 'max', 'learning_rate': 0.0003354086778121656, 'weight_decay': 3.3496676105918104e-05, 'beta_0': 0.8974419343158958, 'beta_1': 0.9887976819936287, 'epsilon': 4.95609926631935e-08, 'balanced_loss': False, 'epochs': 171, 'early_stopping_patience': 10, 'plateau_patience': 16, 'plateau_divider': 4}. Best is trial 161 with value: 0.968159869773082.
