[I 2024-12-04 04:05:12,680] Trial 196 finished with value: 0.9576897828861362 and parameters: {'left_stride': 128, 'right_stride': 0, 'attention_pooling_operation': 'max', 'embedding_pooling_operation': 'max', 'threshold': 0.6619271709626734, 'batch_size': 149, 'attention_heads': 7, 'hidden_dimension': 125, 'number_of_hidden_layers': 2, 'dropout_rate': 0.3315761253829603, 'global_pooling': 'max', 'learning_rate': 0.00011180979195339503, 'weight_decay': 6.927271818899571e-06, 'beta_0': 0.854098053766627, 'beta_1': 0.9957238206223233, 'epsilon': 2.5449213526577616e-08, 'balanced_loss': False, 'epochs': 129, 'early_stopping_patience': 20, 'plateau_patience': 15, 'plateau_divider': 4}. Best is trial 170 with value: 0.9685678381952185.
[I 2024-12-04 04:16:21,156] Trial 197 finished with value: 0.9416771175109593 and parameters: {'left_stride': 128, 'right_stride': 0, 'attention_pooling_operation': 'max', 'embedding_pooling_operation': 'max', 'threshold': 0.6572755004070266, 'batch_size': 127, 'attention_heads': 6, 'hidden_dimension': 125, 'number_of_hidden_layers': 2, 'dropout_rate': 0.3435007488705546, 'global_pooling': 'max', 'learning_rate': 0.0001740009840290667, 'weight_decay': 6.901320083456844e-06, 'beta_0': 0.8445060215170653, 'beta_1': 0.9958914772903532, 'epsilon': 2.6866752791488923e-08, 'balanced_loss': False, 'epochs': 128, 'early_stopping_patience': 20, 'plateau_patience': 15, 'plateau_divider': 5}. Best is trial 170 with value: 0.9685678381952185.
[I 2024-12-04 04:29:37,879] Trial 198 finished with value: 0.9490029766863777 and parameters: {'left_stride': 128, 'right_stride': 32, 'attention_pooling_operation': 'max', 'embedding_pooling_operation': 'min', 'threshold': 0.6608733972124016, 'batch_size': 144, 'attention_heads': 6, 'hidden_dimension': 133, 'number_of_hidden_layers': 2, 'dropout_rate': 0.46808565348611536, 'global_pooling': 'max', 'learning_rate': 0.00011702770602092005, 'weight_decay': 5.078779506298237e-06, 'beta_0': 0.8618640032426994, 'beta_1': 0.9944702594081363, 'epsilon': 3.734988043516677e-08, 'balanced_loss': False, 'epochs': 131, 'early_stopping_patience': 20, 'plateau_patience': 15, 'plateau_divider': 5}. Best is trial 170 with value: 0.9685678381952185.
CUDA out of memory. Tried to allocate 2.82 GiB. GPU 0 has a total capacity of 44.56 GiB of which 2.53 GiB is free. Including non-PyTorch memory, this process has 42.03 GiB memory in use. Of the allocated memory 40.05 GiB is allocated by PyTorch, and 845.96 MiB is reserved by PyTorch but unallocated. If reserved but unallocated memory is large try setting PYTORCH_CUDA_ALLOC_CONF=expandable_segments:True to avoid fragmentation.  See documentation for Memory Management  (https://pytorch.org/docs/stable/notes/cuda.html#environment-variables)
[I 2024-12-04 04:35:01,636] Trial 199 finished with value: -1.0 and parameters: {'left_stride': 128, 'right_stride': 0, 'attention_pooling_operation': 'max', 'embedding_pooling_operation': 'max', 'threshold': 0.6807573793946142, 'batch_size': 161, 'attention_heads': 9, 'hidden_dimension': 128, 'number_of_hidden_layers': 2, 'dropout_rate': 0.33078399323020646, 'global_pooling': 'max', 'learning_rate': 9.477342308065697e-05, 'weight_decay': 5.72189397640365e-06, 'beta_0': 0.8517626872149848, 'beta_1': 0.9942515418273407, 'epsilon': 4.301187789031881e-07, 'balanced_loss': False, 'epochs': 123, 'early_stopping_patience': 21, 'plateau_patience': 15, 'plateau_divider': 4}. Best is trial 170 with value: 0.9685678381952185.
[I 2024-12-04 04:48:38,070] Trial 200 finished with value: 0.9517423302614367 and parameters: {'left_stride': 128, 'right_stride': 256, 'attention_pooling_operation': 'min', 'embedding_pooling_operation': 'max', 'threshold': 0.6722561599025221, 'batch_size': 149, 'attention_heads': 5, 'hidden_dimension': 143, 'number_of_hidden_layers': 2, 'dropout_rate': 0.3362935106711712, 'global_pooling': 'max', 'learning_rate': 0.0001414769151300645, 'weight_decay': 7.5894697432460325e-06, 'beta_0': 0.8464724666426997, 'beta_1': 0.9966515147929704, 'epsilon': 2.3768128087439644e-08, 'balanced_loss': False, 'epochs': 120, 'early_stopping_patience': 20, 'plateau_patience': 14, 'plateau_divider': 4}. Best is trial 170 with value: 0.9685678381952185.
[I 2024-12-04 04:56:15,465] Trial 201 finished with value: 0.9433893862148927 and parameters: {'left_stride': 64, 'right_stride': 0, 'attention_pooling_operation': 'max', 'embedding_pooling_operation': 'max', 'threshold': 0.8899581378795867, 'batch_size': 132, 'attention_heads': 7, 'hidden_dimension': 117, 'number_of_hidden_layers': 2, 'dropout_rate': 0.32793874288602914, 'global_pooling': 'mean', 'learning_rate': 0.0002269351207641831, 'weight_decay': 4.121252749408152e-06, 'beta_0': 0.8499198565006639, 'beta_1': 0.993051651027413, 'epsilon': 1.6308143282525794e-08, 'balanced_loss': False, 'epochs': 130, 'early_stopping_patience': 20, 'plateau_patience': 12, 'plateau_divider': 4}. Best is trial 170 with value: 0.9685678381952185.
slurmstepd: error: *** JOB 14054780 ON gpu001 CANCELLED AT 2024-12-04T05:07:18 DUE TO TIME LIMIT ***
