[I 2024-12-03 16:53:30,468] Trial 180 finished with value: 0.9472329332108478 and parameters: {'left_stride': 256, 'right_stride': 128, 'attention_pooling_operation': 'mean', 'embedding_pooling_operation': 'mean', 'threshold': 0.6760326445067566, 'batch_size': 96, 'attention_heads': 8, 'hidden_dimension': 122, 'number_of_hidden_layers': 0, 'dropout_rate': 0.3660560151577865, 'global_pooling': 'max', 'learning_rate': 0.0005565489122324227, 'weight_decay': 1.8766938415343837e-06, 'beta_0': 0.8536449185637032, 'beta_1': 0.9914320559464145, 'epsilon': 4.636052421009938e-08, 'balanced_loss': False, 'epochs': 128, 'early_stopping_patience': 17, 'plateau_patience': 20, 'plateau_divider': 7}. Best is trial 61 with value: 0.9599624971991361.
CUDA out of memory. Tried to allocate 4.07 GiB. GPU 0 has a total capacity of 44.56 GiB of which 3.60 GiB is free. Including non-PyTorch memory, this process has 40.96 GiB memory in use. Of the allocated memory 39.62 GiB is allocated by PyTorch, and 189.96 MiB is reserved by PyTorch but unallocated. If reserved but unallocated memory is large try setting PYTORCH_CUDA_ALLOC_CONF=expandable_segments:True to avoid fragmentation.  See documentation for Memory Management  (https://pytorch.org/docs/stable/notes/cuda.html#environment-variables)
[I 2024-12-03 16:58:45,023] Trial 181 finished with value: -1.0 and parameters: {'left_stride': 64, 'right_stride': 64, 'attention_pooling_operation': 'mean', 'embedding_pooling_operation': 'max', 'threshold': 0.6557854769453599, 'batch_size': 129, 'attention_heads': 16, 'hidden_dimension': 184, 'number_of_hidden_layers': 3, 'dropout_rate': 0.491710235048349, 'global_pooling': 'mean', 'learning_rate': 0.00015912744455927504, 'weight_decay': 5.081189850992076e-06, 'beta_0': 0.8903546961991661, 'beta_1': 0.9866835015506, 'epsilon': 9.86395429728593e-07, 'balanced_loss': False, 'epochs': 74, 'early_stopping_patience': 24, 'plateau_patience': 23, 'plateau_divider': 6}. Best is trial 61 with value: 0.9599624971991361.
slurmstepd: error: *** JOB 14051918 ON gpu040 CANCELLED AT 2024-12-03T17:06:36 DUE TO TIME LIMIT ***
