[I 2024-12-20 13:08:07,545] Trial 162 finished with value: 0.9192954066190206 and parameters: {'left_stride': 128, 'right_stride': 32, 'attention_pooling_operation': 'max', 'embedding_pooling_operation': 'mean', 'threshold': 0.9900719662018089, 'batch_size': 214, 'attention_heads': 8, 'hidden_dimension': 76, 'number_of_hidden_layers': 3, 'dropout_rate': 0.4438635898783731, 'global_pooling': 'mean', 'learning_rate': 0.0013547319433695883, 'weight_decay': 1.953591307420933e-05, 'beta_0': 0.8967863317184833, 'beta_1': 0.9885556861688647, 'epsilon': 5.1836239936076474e-08, 'balanced_loss': False, 'epochs': 109, 'early_stopping_patience': 12, 'plateau_patience': 17, 'plateau_divider': 6}. Best is trial 161 with value: 0.968159869773082.
CUDA out of memory. Tried to allocate 1.89 GiB. GPU 0 has a total capacity of 44.56 GiB of which 1.88 GiB is free. Including non-PyTorch memory, this process has 42.68 GiB memory in use. Of the allocated memory 38.90 GiB is allocated by PyTorch, and 2.63 GiB is reserved by PyTorch but unallocated. If reserved but unallocated memory is large try setting PYTORCH_CUDA_ALLOC_CONF=expandable_segments:True to avoid fragmentation.  See documentation for Memory Management  (https://pytorch.org/docs/stable/notes/cuda.html#environment-variables)
[I 2024-12-20 13:19:33,960] Trial 163 finished with value: -1.0 and parameters: {'left_stride': 256, 'right_stride': 128, 'attention_pooling_operation': 'max', 'embedding_pooling_operation': 'max', 'threshold': 0.9811078202853405, 'batch_size': 197, 'attention_heads': 13, 'hidden_dimension': 235, 'number_of_hidden_layers': 3, 'dropout_rate': 0.45298742938861514, 'global_pooling': 'max', 'learning_rate': 0.00035972979441591465, 'weight_decay': 3.2633547427982045e-05, 'beta_0': 0.8932835895820955, 'beta_1': 0.988973145788382, 'epsilon': 3.1471693469457996e-08, 'balanced_loss': False, 'epochs': 156, 'early_stopping_patience': 10, 'plateau_patience': 16, 'plateau_divider': 3}. Best is trial 161 with value: 0.968159869773082.
[I 2024-12-20 13:34:33,995] Trial 164 finished with value: 0.9554366952861861 and parameters: {'left_stride': 256, 'right_stride': 128, 'attention_pooling_operation': 'max', 'embedding_pooling_operation': 'max', 'threshold': 0.9928017876513051, 'batch_size': 76, 'attention_heads': 9, 'hidden_dimension': 188, 'number_of_hidden_layers': 3, 'dropout_rate': 0.4354486896488286, 'global_pooling': 'max', 'learning_rate': 0.0002937942762215531, 'weight_decay': 2.197348631687304e-06, 'beta_0': 0.8985872536063549, 'beta_1': 0.9877766735167632, 'epsilon': 4.3184618211678804e-08, 'balanced_loss': False, 'epochs': 173, 'early_stopping_patience': 10, 'plateau_patience': 15, 'plateau_divider': 4}. Best is trial 161 with value: 0.968159869773082.
[I 2024-12-20 13:51:47,344] Trial 165 finished with value: 0.959647704058362 and parameters: {'left_stride': 256, 'right_stride': 32, 'attention_pooling_operation': 'max', 'embedding_pooling_operation': 'max', 'threshold': 0.9694759012499682, 'batch_size': 95, 'attention_heads': 8, 'hidden_dimension': 119, 'number_of_hidden_layers': 3, 'dropout_rate': 0.45976657947750904, 'global_pooling': 'max', 'learning_rate': 0.00018381543916711336, 'weight_decay': 3.70484275080743e-05, 'beta_0': 0.89496407602764, 'beta_1': 0.9871436272087584, 'epsilon': 1.9497105544560975e-08, 'balanced_loss': False, 'epochs': 164, 'early_stopping_patience': 11, 'plateau_patience': 16, 'plateau_divider': 4}. Best is trial 161 with value: 0.968159869773082.
[I 2024-12-20 14:04:44,429] Trial 166 finished with value: 0.947525501337912 and parameters: {'left_stride': 256, 'right_stride': 32, 'attention_pooling_operation': 'max', 'embedding_pooling_operation': 'max', 'threshold': 0.9858532504610626, 'batch_size': 87, 'attention_heads': 10, 'hidden_dimension': 67, 'number_of_hidden_layers': 3, 'dropout_rate': 0.45332978283751757, 'global_pooling': 'max', 'learning_rate': 0.0004389994733984702, 'weight_decay': 5.005044119555694e-05, 'beta_0': 0.802630824794118, 'beta_1': 0.9944832836068832, 'epsilon': 2.5563762347793783e-08, 'balanced_loss': False, 'epochs': 169, 'early_stopping_patience': 10, 'plateau_patience': 16, 'plateau_divider': 5}. Best is trial 161 with value: 0.968159869773082.
[I 2024-12-20 14:22:16,423] Trial 167 finished with value: 0.9514101204544845 and parameters: {'left_stride': 256, 'right_stride': 32, 'attention_pooling_operation': 'max', 'embedding_pooling_operation': 'max', 'threshold': 0.9765177749713818, 'batch_size': 64, 'attention_heads': 7, 'hidden_dimension': 245, 'number_of_hidden_layers': 3, 'dropout_rate': 0.4769571255107055, 'global_pooling': 'max', 'learning_rate': 0.0005731910912919105, 'weight_decay': 2.7797307354622986e-05, 'beta_0': 0.8052993002871799, 'beta_1': 0.989832185814756, 'epsilon': 5.333249758615176e-08, 'balanced_loss': False, 'epochs': 135, 'early_stopping_patience': 11, 'plateau_patience': 14, 'plateau_divider': 10}. Best is trial 161 with value: 0.968159869773082.
[I 2024-12-20 14:34:50,685] Trial 168 finished with value: 0.9504768671252228 and parameters: {'left_stride': 256, 'right_stride': 32, 'attention_pooling_operation': 'max', 'embedding_pooling_operation': 'max', 'threshold': 0.9980705037050276, 'batch_size': 41, 'attention_heads': 13, 'hidden_dimension': 61, 'number_of_hidden_layers': 3, 'dropout_rate': 0.4431854164797361, 'global_pooling': 'max', 'learning_rate': 0.00022110524365787353, 'weight_decay': 4.3569168399706705e-05, 'beta_0': 0.8975199597248471, 'beta_1': 0.988010341112611, 'epsilon': 3.188134548666112e-08, 'balanced_loss': False, 'epochs': 185, 'early_stopping_patience': 10, 'plateau_patience': 21, 'plateau_divider': 8}. Best is trial 161 with value: 0.968159869773082.
[I 2024-12-20 14:53:03,502] Trial 169 finished with value: 0.9550245140791683 and parameters: {'left_stride': 256, 'right_stride': 128, 'attention_pooling_operation': 'max', 'embedding_pooling_operation': 'max', 'threshold': 0.9642418208931564, 'batch_size': 239, 'attention_heads': 9, 'hidden_dimension': 70, 'number_of_hidden_layers': 3, 'dropout_rate': 0.46312696340273113, 'global_pooling': 'max', 'learning_rate': 0.0003192052603939497, 'weight_decay': 1.9211695101443413e-06, 'beta_0': 0.8900831001352876, 'beta_1': 0.9887657531686804, 'epsilon': 4.092165611323514e-08, 'balanced_loss': False, 'epochs': 165, 'early_stopping_patience': 20, 'plateau_patience': 12, 'plateau_divider': 8}. Best is trial 161 with value: 0.968159869773082.
[I 2024-12-20 15:07:31,374] Trial 170 finished with value: 0.9225085500234957 and parameters: {'left_stride': 32, 'right_stride': 128, 'attention_pooling_operation': 'max', 'embedding_pooling_operation': 'max', 'threshold': 0.9838723040230558, 'batch_size': 114, 'attention_heads': 12, 'hidden_dimension': 32, 'number_of_hidden_layers': 3, 'dropout_rate': 0.49032471077427303, 'global_pooling': 'max', 'learning_rate': 0.00010043140320357154, 'weight_decay': 5.93191671524484e-05, 'beta_0': 0.8067444501475007, 'beta_1': 0.9903911928527291, 'epsilon': 2.3073383087623524e-08, 'balanced_loss': True, 'epochs': 172, 'early_stopping_patience': 11, 'plateau_patience': 11, 'plateau_divider': 3}. Best is trial 161 with value: 0.968159869773082.
CUDA out of memory. Tried to allocate 878.00 MiB. GPU 0 has a total capacity of 44.56 GiB of which 450.69 MiB is free. Including non-PyTorch memory, this process has 44.11 GiB memory in use. Of the allocated memory 40.77 GiB is allocated by PyTorch, and 2.20 GiB is reserved by PyTorch but unallocated. If reserved but unallocated memory is large try setting PYTORCH_CUDA_ALLOC_CONF=expandable_segments:True to avoid fragmentation.  See documentation for Memory Management  (https://pytorch.org/docs/stable/notes/cuda.html#environment-variables)
[I 2024-12-20 15:12:58,563] Trial 171 finished with value: -1.0 and parameters: {'left_stride': 256, 'right_stride': 0, 'attention_pooling_operation': 'max', 'embedding_pooling_operation': 'max', 'threshold': 0.7974840104399413, 'batch_size': 69, 'attention_heads': 14, 'hidden_dimension': 55, 'number_of_hidden_layers': 3, 'dropout_rate': 0.4267721718468889, 'global_pooling': 'max', 'learning_rate': 0.00016745646913705393, 'weight_decay': 1.536950506044553e-06, 'beta_0': 0.8039881600578467, 'beta_1': 0.9892781430803342, 'epsilon': 1.7866675064184074e-06, 'balanced_loss': False, 'epochs': 149, 'early_stopping_patience': 10, 'plateau_patience': 11, 'plateau_divider': 4}. Best is trial 161 with value: 0.968159869773082.
[I 2024-12-20 15:35:45,727] Trial 172 finished with value: 0.9601756561430363 and parameters: {'left_stride': 256, 'right_stride': 128, 'attention_pooling_operation': 'mean', 'embedding_pooling_operation': 'min', 'threshold': 0.9753785023797346, 'batch_size': 81, 'attention_heads': 12, 'hidden_dimension': 40, 'number_of_hidden_layers': 3, 'dropout_rate': 0.5228602598635067, 'global_pooling': 'max', 'learning_rate': 0.0002577441308577983, 'weight_decay': 1.1404420704384417e-06, 'beta_0': 0.8026168971612502, 'beta_1': 0.9950315243696213, 'epsilon': 3.6464503104000703e-06, 'balanced_loss': False, 'epochs': 158, 'early_stopping_patience': 13, 'plateau_patience': 17, 'plateau_divider': 8}. Best is trial 161 with value: 0.968159869773082.
[I 2024-12-20 15:50:31,061] Trial 173 finished with value: 0.9491326830767861 and parameters: {'left_stride': 256, 'right_stride': 128, 'attention_pooling_operation': 'max', 'embedding_pooling_operation': 'max', 'threshold': 0.9587464895762272, 'batch_size': 73, 'attention_heads': 9, 'hidden_dimension': 51, 'number_of_hidden_layers': 3, 'dropout_rate': 0.46757835021001337, 'global_pooling': 'max', 'learning_rate': 0.00043139245627878966, 'weight_decay': 1.4416574804150227e-06, 'beta_0': 0.8749702496191684, 'beta_1': 0.9864113749007944, 'epsilon': 6.667813815321984e-08, 'balanced_loss': False, 'epochs': 193, 'early_stopping_patience': 12, 'plateau_patience': 10, 'plateau_divider': 8}. Best is trial 161 with value: 0.968159869773082.
CUDA out of memory. Tried to allocate 1.81 GiB. GPU 0 has a total capacity of 44.56 GiB of which 1.36 GiB is free. Including non-PyTorch memory, this process has 43.20 GiB memory in use. Of the allocated memory 40.26 GiB is allocated by PyTorch, and 1.78 GiB is reserved by PyTorch but unallocated. If reserved but unallocated memory is large try setting PYTORCH_CUDA_ALLOC_CONF=expandable_segments:True to avoid fragmentation.  See documentation for Memory Management  (https://pytorch.org/docs/stable/notes/cuda.html#environment-variables)
[I 2024-12-20 15:54:49,914] Trial 174 finished with value: -1.0 and parameters: {'left_stride': 256, 'right_stride': 128, 'attention_pooling_operation': 'max', 'embedding_pooling_operation': 'max', 'threshold': 0.7545597132562865, 'batch_size': 59, 'attention_heads': 14, 'hidden_dimension': 56, 'number_of_hidden_layers': 3, 'dropout_rate': 0.4701052801472518, 'global_pooling': 'max', 'learning_rate': 0.0003734377733154666, 'weight_decay': 1.730755105195189e-06, 'beta_0': 0.8843951717214958, 'beta_1': 0.9860677897151473, 'epsilon': 7.638992212820838e-08, 'balanced_loss': False, 'epochs': 183, 'early_stopping_patience': 16, 'plateau_patience': 18, 'plateau_divider': 8}. Best is trial 161 with value: 0.968159869773082.
CUDA out of memory. Tried to allocate 1.29 GiB. GPU 0 has a total capacity of 44.56 GiB of which 852.69 MiB is free. Including non-PyTorch memory, this process has 43.72 GiB memory in use. Of the allocated memory 37.25 GiB is allocated by PyTorch, and 5.32 GiB is reserved by PyTorch but unallocated. If reserved but unallocated memory is large try setting PYTORCH_CUDA_ALLOC_CONF=expandable_segments:True to avoid fragmentation.  See documentation for Memory Management  (https://pytorch.org/docs/stable/notes/cuda.html#environment-variables)
[I 2024-12-20 16:06:23,681] Trial 175 finished with value: -1.0 and parameters: {'left_stride': 256, 'right_stride': 128, 'attention_pooling_operation': 'max', 'embedding_pooling_operation': 'max', 'threshold': 0.9663503324711564, 'batch_size': 75, 'attention_heads': 14, 'hidden_dimension': 200, 'number_of_hidden_layers': 3, 'dropout_rate': 0.4777742521961117, 'global_pooling': 'max', 'learning_rate': 0.00031139921702597615, 'weight_decay': 1.5996709091729224e-06, 'beta_0': 0.8940962854162272, 'beta_1': 0.9867276964261438, 'epsilon': 8.18893524167866e-08, 'balanced_loss': False, 'epochs': 116, 'early_stopping_patience': 13, 'plateau_patience': 10, 'plateau_divider': 8}. Best is trial 161 with value: 0.968159869773082.
[I 2024-12-20 16:19:18,295] Trial 176 finished with value: 0.9546324049956285 and parameters: {'left_stride': 256, 'right_stride': 128, 'attention_pooling_operation': 'max', 'embedding_pooling_operation': 'max', 'threshold': 0.989050679517842, 'batch_size': 70, 'attention_heads': 11, 'hidden_dimension': 65, 'number_of_hidden_layers': 3, 'dropout_rate': 0.45804982071296535, 'global_pooling': 'max', 'learning_rate': 0.00036085477217715064, 'weight_decay': 2.350834587332508e-06, 'beta_0': 0.8926619435230307, 'beta_1': 0.9863552434594649, 'epsilon': 4.827032523940437e-08, 'balanced_loss': False, 'epochs': 195, 'early_stopping_patience': 11, 'plateau_patience': 10, 'plateau_divider': 8}. Best is trial 161 with value: 0.968159869773082.
[I 2024-12-20 16:38:32,028] Trial 177 finished with value: 0.9537834434126455 and parameters: {'left_stride': 256, 'right_stride': 128, 'attention_pooling_operation': 'max', 'embedding_pooling_operation': 'max', 'threshold': 0.9722239549918944, 'batch_size': 255, 'attention_heads': 15, 'hidden_dimension': 45, 'number_of_hidden_layers': 3, 'dropout_rate': 0.44921575094215205, 'global_pooling': 'max', 'learning_rate': 0.000201687676246363, 'weight_decay': 2.006077672269275e-06, 'beta_0': 0.8117469249854923, 'beta_1': 0.9858223465161532, 'epsilon': 9.40581116903394e-08, 'balanced_loss': False, 'epochs': 189, 'early_stopping_patience': 12, 'plateau_patience': 11, 'plateau_divider': 8}. Best is trial 161 with value: 0.968159869773082.
[I 2024-12-20 16:56:17,375] Trial 178 finished with value: 0.9300467264032362 and parameters: {'left_stride': 256, 'right_stride': 128, 'attention_pooling_operation': 'max', 'embedding_pooling_operation': 'max', 'threshold': 0.9581735144809429, 'batch_size': 62, 'attention_heads': 14, 'hidden_dimension': 61, 'number_of_hidden_layers': 3, 'dropout_rate': 0.4649474820641852, 'global_pooling': 'max', 'learning_rate': 0.00012934019590503276, 'weight_decay': 2.4446122295640912e-05, 'beta_0': 0.8909886737822856, 'beta_1': 0.9883115060758214, 'epsilon': 2.687753418569785e-08, 'balanced_loss': False, 'epochs': 60, 'early_stopping_patience': 10, 'plateau_patience': 11, 'plateau_divider': 8}. Best is trial 161 with value: 0.968159869773082.
The selected strides are greater or equal to the total chunk size.
[I 2024-12-20 16:56:19,087] Trial 179 finished with value: -1.0 and parameters: {'left_stride': 256, 'right_stride': 256, 'attention_pooling_operation': 'max', 'embedding_pooling_operation': 'max', 'threshold': 0.9822423626899796, 'batch_size': 78, 'attention_heads': 10, 'hidden_dimension': 52, 'number_of_hidden_layers': 3, 'dropout_rate': 0.4736449007911615, 'global_pooling': 'max', 'learning_rate': 0.0002615447333873296, 'weight_decay': 1.3718418802971432e-06, 'beta_0': 0.8462817212647368, 'beta_1': 0.9871262455613313, 'epsilon': 3.596075175332942e-08, 'balanced_loss': False, 'epochs': 177, 'early_stopping_patience': 20, 'plateau_patience': 10, 'plateau_divider': 9}. Best is trial 161 with value: 0.968159869773082.
[I 2024-12-20 17:10:27,105] Trial 180 finished with value: 0.9528588042272423 and parameters: {'left_stride': 256, 'right_stride': 128, 'attention_pooling_operation': 'max', 'embedding_pooling_operation': 'max', 'threshold': 0.9650906264450012, 'batch_size': 38, 'attention_heads': 13, 'hidden_dimension': 42, 'number_of_hidden_layers': 3, 'dropout_rate': 0.4860843106591229, 'global_pooling': 'max', 'learning_rate': 0.000506157871174159, 'weight_decay': 1.7791629991486056e-06, 'beta_0': 0.8000149181308082, 'beta_1': 0.9858258025483283, 'epsilon': 5.873643139281324e-08, 'balanced_loss': False, 'epochs': 98, 'early_stopping_patience': 11, 'plateau_patience': 22, 'plateau_divider': 8}. Best is trial 161 with value: 0.968159869773082.
[I 2024-12-20 17:26:52,583] Trial 181 finished with value: 0.9360377777814852 and parameters: {'left_stride': 256, 'right_stride': 128, 'attention_pooling_operation': 'max', 'embedding_pooling_operation': 'max', 'threshold': 0.9995347093835927, 'batch_size': 66, 'attention_heads': 14, 'hidden_dimension': 58, 'number_of_hidden_layers': 3, 'dropout_rate': 0.5000956821922502, 'global_pooling': 'max', 'learning_rate': 0.00016306045049752177, 'weight_decay': 1.275506089513558e-06, 'beta_0': 0.8095077789184772, 'beta_1': 0.9922431633484886, 'epsilon': 1.7449070844919877e-08, 'balanced_loss': False, 'epochs': 103, 'early_stopping_patience': 14, 'plateau_patience': 12, 'plateau_divider': 7}. Best is trial 161 with value: 0.968159869773082.
[I 2024-12-20 17:46:30,953] Trial 182 finished with value: 0.9368387006627706 and parameters: {'left_stride': 256, 'right_stride': 64, 'attention_pooling_operation': 'max', 'embedding_pooling_operation': 'max', 'threshold': 0.9787250008448259, 'batch_size': 88, 'attention_heads': 13, 'hidden_dimension': 71, 'number_of_hidden_layers': 4, 'dropout_rate': 0.45453812072185346, 'global_pooling': 'max', 'learning_rate': 0.0002390532625454329, 'weight_decay': 3.251382190249635e-05, 'beta_0': 0.8958665182192317, 'beta_1': 0.9875493068356922, 'epsilon': 1.3879594311311123e-08, 'balanced_loss': False, 'epochs': 112, 'early_stopping_patience': 21, 'plateau_patience': 10, 'plateau_divider': 7}. Best is trial 161 with value: 0.968159869773082.
[I 2024-12-20 18:04:00,523] Trial 183 finished with value: 0.9523216153982448 and parameters: {'left_stride': 256, 'right_stride': 128, 'attention_pooling_operation': 'max', 'embedding_pooling_operation': 'max', 'threshold': 0.9653322103621406, 'batch_size': 58, 'attention_heads': 15, 'hidden_dimension': 47, 'number_of_hidden_layers': 3, 'dropout_rate': 0.47031325363705123, 'global_pooling': 'max', 'learning_rate': 0.00021824832988492823, 'weight_decay': 2.7260362395926e-06, 'beta_0': 0.8020812740969993, 'beta_1': 0.9854432311539616, 'epsilon': 4.903137456797771e-08, 'balanced_loss': False, 'epochs': 106, 'early_stopping_patience': 11, 'plateau_patience': 15, 'plateau_divider': 8}. Best is trial 161 with value: 0.968159869773082.
[I 2024-12-20 18:18:01,938] Trial 184 finished with value: 0.9556429388427992 and parameters: {'left_stride': 256, 'right_stride': 128, 'attention_pooling_operation': 'max', 'embedding_pooling_operation': 'max', 'threshold': 0.9726972077975736, 'batch_size': 54, 'attention_heads': 15, 'hidden_dimension': 36, 'number_of_hidden_layers': 3, 'dropout_rate': 0.46880740622727435, 'global_pooling': 'max', 'learning_rate': 0.00030742337380633867, 'weight_decay': 2.559046219003196e-06, 'beta_0': 0.801806582348072, 'beta_1': 0.9850078718769305, 'epsilon': 4.172197568081904e-08, 'balanced_loss': False, 'epochs': 121, 'early_stopping_patience': 12, 'plateau_patience': 13, 'plateau_divider': 8}. Best is trial 161 with value: 0.968159869773082.
[I 2024-12-20 18:33:09,598] Trial 185 finished with value: 0.9602028612550447 and parameters: {'left_stride': 256, 'right_stride': 128, 'attention_pooling_operation': 'max', 'embedding_pooling_operation': 'max', 'threshold': 0.9898346768521027, 'batch_size': 124, 'attention_heads': 15, 'hidden_dimension': 51, 'number_of_hidden_layers': 3, 'dropout_rate': 0.4781354559430812, 'global_pooling': 'max', 'learning_rate': 0.0002380304111758744, 'weight_decay': 4.682520554718569e-06, 'beta_0': 0.805161943946889, 'beta_1': 0.9855949103447442, 'epsilon': 3.30622093451886e-08, 'balanced_loss': False, 'epochs': 104, 'early_stopping_patience': 15, 'plateau_patience': 12, 'plateau_divider': 8}. Best is trial 161 with value: 0.968159869773082.
[I 2024-12-20 18:51:09,782] Trial 186 finished with value: 0.9367863045450993 and parameters: {'left_stride': 32, 'right_stride': 128, 'attention_pooling_operation': 'max', 'embedding_pooling_operation': 'max', 'threshold': 0.9617244527431402, 'batch_size': 48, 'attention_heads': 16, 'hidden_dimension': 48, 'number_of_hidden_layers': 3, 'dropout_rate': 0.5661645832788004, 'global_pooling': 'max', 'learning_rate': 0.00018851190667489395, 'weight_decay': 3.122882335162875e-06, 'beta_0': 0.8032686272861427, 'beta_1': 0.9864747581277294, 'epsilon': 4.629857445980053e-08, 'balanced_loss': False, 'epochs': 186, 'early_stopping_patience': 11, 'plateau_patience': 11, 'plateau_divider': 8}. Best is trial 161 with value: 0.968159869773082.
[I 2024-12-20 19:06:14,791] Trial 187 finished with value: 0.9525352227597385 and parameters: {'left_stride': 256, 'right_stride': 128, 'attention_pooling_operation': 'max', 'embedding_pooling_operation': 'max', 'threshold': 0.9542008647989542, 'batch_size': 60, 'attention_heads': 14, 'hidden_dimension': 43, 'number_of_hidden_layers': 3, 'dropout_rate': 0.4643606808388176, 'global_pooling': 'max', 'learning_rate': 0.00036256188469937513, 'weight_decay': 2.2807260644818852e-06, 'beta_0': 0.8069315209871692, 'beta_1': 0.996509873261995, 'epsilon': 2.814128392494935e-08, 'balanced_loss': False, 'epochs': 197, 'early_stopping_patience': 10, 'plateau_patience': 14, 'plateau_divider': 8}. Best is trial 161 with value: 0.968159869773082.
CUDA out of memory. Tried to allocate 678.00 MiB. GPU 0 has a total capacity of 44.56 GiB of which 326.69 MiB is free. Including non-PyTorch memory, this process has 44.23 GiB memory in use. Of the allocated memory 42.34 GiB is allocated by PyTorch, and 758.83 MiB is reserved by PyTorch but unallocated. If reserved but unallocated memory is large try setting PYTORCH_CUDA_ALLOC_CONF=expandable_segments:True to avoid fragmentation.  See documentation for Memory Management  (https://pytorch.org/docs/stable/notes/cuda.html#environment-variables)
