[I 2024-12-15 02:40:03,971] Trial 234 finished with value: -1.0 and parameters: {'left_stride': 32, 'right_stride': 128, 'attention_pooling_operation': 'mean', 'embedding_pooling_operation': 'max', 'threshold': 0.7060193260328912, 'batch_size': 37, 'attention_heads': 16, 'hidden_dimension': 85, 'number_of_hidden_layers': 3, 'dropout_rate': 0.5619166385200983, 'global_pooling': 'max', 'learning_rate': 1.9378042501736664e-05, 'weight_decay': 5.850015466362903e-06, 'beta_0': 0.8898992028282802, 'beta_1': 0.9914559444989337, 'epsilon': 3.184418246508886e-05, 'balanced_loss': True, 'epochs': 126, 'early_stopping_patience': 16, 'plateau_patience': 19, 'plateau_divider': 7}. Best is trial 213 with value: 0.9803273479163068.
[I 2024-12-15 03:33:53,210] Trial 235 finished with value: 0.9639201895260672 and parameters: {'left_stride': 64, 'right_stride': 128, 'attention_pooling_operation': 'mean', 'embedding_pooling_operation': 'max', 'threshold': 0.7137819572047871, 'batch_size': 44, 'attention_heads': 16, 'hidden_dimension': 90, 'number_of_hidden_layers': 3, 'dropout_rate': 0.5556623688263376, 'global_pooling': 'max', 'learning_rate': 2.309360227900823e-05, 'weight_decay': 0.00037395401537091696, 'beta_0': 0.8829695453025651, 'beta_1': 0.9903869247056161, 'epsilon': 6.131324411043778e-05, 'balanced_loss': True, 'epochs': 137, 'early_stopping_patience': 21, 'plateau_patience': 19, 'plateau_divider': 7}. Best is trial 213 with value: 0.9803273479163068.
slurmstepd: error: *** JOB 14093610 ON gpu012 CANCELLED AT 2024-12-15T03:36:37 DUE TO TIME LIMIT ***
