[I 2024-12-20 19:14:29,889] Trial 188 finished with value: -1.0 and parameters: {'left_stride': 256, 'right_stride': 128, 'attention_pooling_operation': 'max', 'embedding_pooling_operation': 'max', 'threshold': 0.8694449411876579, 'batch_size': 32, 'attention_heads': 15, 'hidden_dimension': 64, 'number_of_hidden_layers': 3, 'dropout_rate': 0.4823942064081262, 'global_pooling': 'sum', 'learning_rate': 0.0001460638937810874, 'weight_decay': 1.5898840677008062e-06, 'beta_0': 0.8016221987846096, 'beta_1': 0.9869690491208368, 'epsilon': 7.009786199474814e-08, 'balanced_loss': False, 'epochs': 192, 'early_stopping_patience': 11, 'plateau_patience': 16, 'plateau_divider': 8}. Best is trial 161 with value: 0.968159869773082.
[I 2024-12-20 19:29:35,202] Trial 189 finished with value: 0.9543047843488272 and parameters: {'left_stride': 256, 'right_stride': 128, 'attention_pooling_operation': 'max', 'embedding_pooling_operation': 'max', 'threshold': 0.9831538605191051, 'batch_size': 69, 'attention_heads': 15, 'hidden_dimension': 55, 'number_of_hidden_layers': 3, 'dropout_rate': 0.4582368977029494, 'global_pooling': 'max', 'learning_rate': 0.0002642102043188152, 'weight_decay': 2.086298935018305e-06, 'beta_0': 0.8978089857287959, 'beta_1': 0.9851958846492712, 'epsilon': 2.2267757216975642e-08, 'balanced_loss': False, 'epochs': 115, 'early_stopping_patience': 12, 'plateau_patience': 11, 'plateau_divider': 9}. Best is trial 161 with value: 0.968159869773082.
[I 2024-12-20 19:48:50,699] Trial 190 finished with value: 0.9330711352118832 and parameters: {'left_stride': 256, 'right_stride': 128, 'attention_pooling_operation': 'max', 'embedding_pooling_operation': 'max', 'threshold': 0.9473054806589272, 'batch_size': 80, 'attention_heads': 14, 'hidden_dimension': 38, 'number_of_hidden_layers': 3, 'dropout_rate': 0.44707346592989405, 'global_pooling': 'max', 'learning_rate': 0.00019955618452485355, 'weight_decay': 3.6933737033251383e-06, 'beta_0': 0.8047713705148166, 'beta_1': 0.9977463819125163, 'epsilon': 5.830672858010875e-08, 'balanced_loss': False, 'epochs': 109, 'early_stopping_patience': 17, 'plateau_patience': 12, 'plateau_divider': 8}. Best is trial 161 with value: 0.968159869773082.
[I 2024-12-20 20:05:26,356] Trial 191 finished with value: 0.8693415238472183 and parameters: {'left_stride': 256, 'right_stride': 128, 'attention_pooling_operation': 'min', 'embedding_pooling_operation': 'max', 'threshold': 0.9705809643123678, 'batch_size': 73, 'attention_heads': 14, 'hidden_dimension': 44, 'number_of_hidden_layers': 3, 'dropout_rate': 0.43969520228256787, 'global_pooling': 'max', 'learning_rate': 0.00011380803563486949, 'weight_decay': 2.6376111978077563e-06, 'beta_0': 0.8893020741873171, 'beta_1': 0.9860395505884902, 'epsilon': 3.7407719900670256e-08, 'balanced_loss': False, 'epochs': 191, 'early_stopping_patience': 10, 'plateau_patience': 21, 'plateau_divider': 8}. Best is trial 161 with value: 0.968159869773082.
[I 2024-12-20 20:17:01,388] Trial 192 finished with value: 0.19808237237437995 and parameters: {'left_stride': 128, 'right_stride': 128, 'attention_pooling_operation': 'max', 'embedding_pooling_operation': 'mean', 'threshold': 0.9902865047490367, 'batch_size': 53, 'attention_heads': 14, 'hidden_dimension': 59, 'number_of_hidden_layers': 3, 'dropout_rate': 0.4731785851592288, 'global_pooling': 'max', 'learning_rate': 0.015293667306793615, 'weight_decay': 2.146493466359921e-05, 'beta_0': 0.8002586676512279, 'beta_1': 0.9848375850557906, 'epsilon': 2.9314690182082916e-08, 'balanced_loss': False, 'epochs': 162, 'early_stopping_patience': 11, 'plateau_patience': 11, 'plateau_divider': 5}. Best is trial 161 with value: 0.968159869773082.
[I 2024-12-20 20:31:55,158] Trial 193 finished with value: 0.9579683072789513 and parameters: {'left_stride': 256, 'right_stride': 128, 'attention_pooling_operation': 'max', 'embedding_pooling_operation': 'max', 'threshold': 0.9881238997490572, 'batch_size': 154, 'attention_heads': 15, 'hidden_dimension': 50, 'number_of_hidden_layers': 3, 'dropout_rate': 0.478915972320676, 'global_pooling': 'max', 'learning_rate': 0.00029357444766297603, 'weight_decay': 1.7931573697667964e-06, 'beta_0': 0.8053879448440545, 'beta_1': 0.9854826127322589, 'epsilon': 3.208503580402575e-08, 'balanced_loss': False, 'epochs': 104, 'early_stopping_patience': 14, 'plateau_patience': 12, 'plateau_divider': 8}. Best is trial 161 with value: 0.968159869773082.
[I 2024-12-20 20:49:15,134] Trial 194 finished with value: 0.9399030943566717 and parameters: {'left_stride': 256, 'right_stride': 128, 'attention_pooling_operation': 'max', 'embedding_pooling_operation': 'max', 'threshold': 0.9792835977258598, 'batch_size': 135, 'attention_heads': 15, 'hidden_dimension': 52, 'number_of_hidden_layers': 3, 'dropout_rate': 0.49167779201864004, 'global_pooling': 'max', 'learning_rate': 0.0002333794210133854, 'weight_decay': 1.2371259790442431e-05, 'beta_0': 0.8035748023044677, 'beta_1': 0.9857032525946214, 'epsilon': 4.4683796028616756e-08, 'balanced_loss': False, 'epochs': 97, 'early_stopping_patience': 16, 'plateau_patience': 13, 'plateau_divider': 8}. Best is trial 161 with value: 0.968159869773082.
[I 2024-12-20 21:03:42,147] Trial 195 finished with value: 0.9497092329281664 and parameters: {'left_stride': 256, 'right_stride': 128, 'attention_pooling_operation': 'max', 'embedding_pooling_operation': 'max', 'threshold': 0.9920682790064501, 'batch_size': 124, 'attention_heads': 15, 'hidden_dimension': 56, 'number_of_hidden_layers': 3, 'dropout_rate': 0.472716473838841, 'global_pooling': 'max', 'learning_rate': 0.000398060784612657, 'weight_decay': 4.803888767387454e-06, 'beta_0': 0.8081511959222951, 'beta_1': 0.9867083603886709, 'epsilon': 3.71531234387214e-08, 'balanced_loss': False, 'epochs': 100, 'early_stopping_patience': 20, 'plateau_patience': 12, 'plateau_divider': 8}. Best is trial 161 with value: 0.968159869773082.
CUDA out of memory. Tried to allocate 706.00 MiB. GPU 0 has a total capacity of 44.56 GiB of which 586.69 MiB is free. Including non-PyTorch memory, this process has 43.98 GiB memory in use. Of the allocated memory 41.49 GiB is allocated by PyTorch, and 1.34 GiB is reserved by PyTorch but unallocated. If reserved but unallocated memory is large try setting PYTORCH_CUDA_ALLOC_CONF=expandable_segments:True to avoid fragmentation.  See documentation for Memory Management  (https://pytorch.org/docs/stable/notes/cuda.html#environment-variables)
[I 2024-12-20 21:06:54,749] Trial 196 finished with value: -1.0 and parameters: {'left_stride': 256, 'right_stride': 128, 'attention_pooling_operation': 'max', 'embedding_pooling_operation': 'max', 'threshold': 0.6536941901394503, 'batch_size': 108, 'attention_heads': 16, 'hidden_dimension': 68, 'number_of_hidden_layers': 3, 'dropout_rate': 0.4799968961775378, 'global_pooling': 'max', 'learning_rate': 0.00022696880907503264, 'weight_decay': 4.063676325398014e-06, 'beta_0': 0.805748930567235, 'beta_1': 0.9856411052659343, 'epsilon': 7.892374211656863e-07, 'balanced_loss': False, 'epochs': 111, 'early_stopping_patience': 15, 'plateau_patience': 13, 'plateau_divider': 8}. Best is trial 161 with value: 0.968159869773082.
[I 2024-12-20 21:21:58,430] Trial 197 finished with value: 0.9443635245471009 and parameters: {'left_stride': 256, 'right_stride': 32, 'attention_pooling_operation': 'max', 'embedding_pooling_operation': 'max', 'threshold': 0.9758205593300896, 'batch_size': 64, 'attention_heads': 13, 'hidden_dimension': 47, 'number_of_hidden_layers': 3, 'dropout_rate': 0.4617868206027898, 'global_pooling': 'max', 'learning_rate': 0.00017038893609700777, 'weight_decay': 7.297067728718967e-06, 'beta_0': 0.8028985102194259, 'beta_1': 0.986235194234169, 'epsilon': 2.631204599818709e-08, 'balanced_loss': False, 'epochs': 195, 'early_stopping_patience': 15, 'plateau_patience': 11, 'plateau_divider': 8}. Best is trial 161 with value: 0.968159869773082.
[I 2024-12-20 21:36:32,162] Trial 198 finished with value: 0.9445587302303642 and parameters: {'left_stride': 256, 'right_stride': 128, 'attention_pooling_operation': 'max', 'embedding_pooling_operation': 'max', 'threshold': 0.9857241349098251, 'batch_size': 99, 'attention_heads': 15, 'hidden_dimension': 62, 'number_of_hidden_layers': 3, 'dropout_rate': 0.4679270938926235, 'global_pooling': 'mean', 'learning_rate': 0.00032645231063389515, 'weight_decay': 1.4618522058905125e-06, 'beta_0': 0.8018457245025699, 'beta_1': 0.9843974225334211, 'epsilon': 2.0575908151225824e-08, 'balanced_loss': False, 'epochs': 103, 'early_stopping_patience': 13, 'plateau_patience': 12, 'plateau_divider': 10}. Best is trial 161 with value: 0.968159869773082.
slurmstepd: error: *** JOB 14126168 ON gpu013 CANCELLED AT 2024-12-20T21:55:55 DUE TO TIME LIMIT ***
