[I 2024-11-29 20:54:41,081] Trial 227 finished with value: 0.9510552909192185 and parameters: {'left_stride': 32, 'right_stride': 0, 'attention_pooling_operation': 'max', 'embedding_pooling_operation': 'max', 'threshold': 0.7358991342509033, 'batch_size': 37, 'attention_heads': 11, 'hidden_dimension': 155, 'number_of_hidden_layers': 1, 'dropout_rate': 0.515566569429165, 'global_pooling': 'max', 'learning_rate': 0.0001482341720303047, 'weight_decay': 3.708414854984612e-06, 'beta_0': 0.8586465712152134, 'beta_1': 0.9971990074522105, 'epsilon': 4.600665339023049e-08, 'balanced_loss': False, 'epochs': 116, 'early_stopping_patience': 18, 'plateau_patience': 23, 'plateau_divider': 7}. Best is trial 211 with value: 0.9654708676873474.
[I 2024-11-29 21:05:08,451] Trial 228 finished with value: 0.956792259571255 and parameters: {'left_stride': 32, 'right_stride': 0, 'attention_pooling_operation': 'max', 'embedding_pooling_operation': 'mean', 'threshold': 0.7511253139542454, 'batch_size': 121, 'attention_heads': 10, 'hidden_dimension': 150, 'number_of_hidden_layers': 1, 'dropout_rate': 0.4775086676969423, 'global_pooling': 'max', 'learning_rate': 0.00023926837439483997, 'weight_decay': 9.033441581285423e-06, 'beta_0': 0.8973849023072532, 'beta_1': 0.9965666636073147, 'epsilon': 6.808907844630413e-08, 'balanced_loss': False, 'epochs': 71, 'early_stopping_patience': 19, 'plateau_patience': 15, 'plateau_divider': 8}. Best is trial 211 with value: 0.9654708676873474.
[I 2024-11-29 21:14:59,432] Trial 229 finished with value: 0.9436193519794702 and parameters: {'left_stride': 32, 'right_stride': 0, 'attention_pooling_operation': 'max', 'embedding_pooling_operation': 'mean', 'threshold': 0.748931467248454, 'batch_size': 123, 'attention_heads': 11, 'hidden_dimension': 144, 'number_of_hidden_layers': 1, 'dropout_rate': 0.4712328484293327, 'global_pooling': 'mean', 'learning_rate': 0.00023415850138218253, 'weight_decay': 9.589689581690748e-06, 'beta_0': 0.8964791128131799, 'beta_1': 0.9957421184050751, 'epsilon': 5.625120281377926e-08, 'balanced_loss': False, 'epochs': 73, 'early_stopping_patience': 20, 'plateau_patience': 14, 'plateau_divider': 8}. Best is trial 211 with value: 0.9654708676873474.
[I 2024-11-29 21:26:09,609] Trial 230 finished with value: 0.9523984041332523 and parameters: {'left_stride': 32, 'right_stride': 0, 'attention_pooling_operation': 'max', 'embedding_pooling_operation': 'mean', 'threshold': 0.730497387973906, 'batch_size': 109, 'attention_heads': 13, 'hidden_dimension': 136, 'number_of_hidden_layers': 1, 'dropout_rate': 0.4780591430114136, 'global_pooling': 'max', 'learning_rate': 0.00026804116461747303, 'weight_decay': 1.3265052354386945e-05, 'beta_0': 0.8903005796908348, 'beta_1': 0.9974319749867125, 'epsilon': 3.784905281511922e-08, 'balanced_loss': False, 'epochs': 78, 'early_stopping_patience': 19, 'plateau_patience': 22, 'plateau_divider': 8}. Best is trial 211 with value: 0.9654708676873474.
[I 2024-11-29 21:35:19,037] Trial 231 finished with value: 0.9431537974591051 and parameters: {'left_stride': 32, 'right_stride': 0, 'attention_pooling_operation': 'max', 'embedding_pooling_operation': 'mean', 'threshold': 0.7428873780468995, 'batch_size': 56, 'attention_heads': 10, 'hidden_dimension': 151, 'number_of_hidden_layers': 1, 'dropout_rate': 0.49301085501557673, 'global_pooling': 'max', 'learning_rate': 0.0005268209198969351, 'weight_decay': 7.8816052391641e-06, 'beta_0': 0.8933573797295584, 'beta_1': 0.9969134316403904, 'epsilon': 6.950515395126613e-07, 'balanced_loss': False, 'epochs': 65, 'early_stopping_patience': 18, 'plateau_patience': 15, 'plateau_divider': 8}. Best is trial 211 with value: 0.9654708676873474.
[I 2024-11-29 21:43:56,804] Trial 232 finished with value: 0.9224523480880478 and parameters: {'left_stride': 32, 'right_stride': 0, 'attention_pooling_operation': 'min', 'embedding_pooling_operation': 'mean', 'threshold': 0.7384840945770403, 'batch_size': 40, 'attention_heads': 12, 'hidden_dimension': 129, 'number_of_hidden_layers': 1, 'dropout_rate': 0.4765766439446926, 'global_pooling': 'max', 'learning_rate': 0.0003818126349061808, 'weight_decay': 6.45307266740877e-06, 'beta_0': 0.896516305384827, 'beta_1': 0.99637863741426, 'epsilon': 6.487510219428117e-08, 'balanced_loss': False, 'epochs': 128, 'early_stopping_patience': 16, 'plateau_patience': 20, 'plateau_divider': 8}. Best is trial 211 with value: 0.9654708676873474.
[I 2024-11-29 21:54:01,970] Trial 233 finished with value: 0.9586391660838239 and parameters: {'left_stride': 32, 'right_stride': 0, 'attention_pooling_operation': 'max', 'embedding_pooling_operation': 'mean', 'threshold': 0.7593793924891673, 'batch_size': 72, 'attention_heads': 10, 'hidden_dimension': 149, 'number_of_hidden_layers': 1, 'dropout_rate': 0.48463517686977686, 'global_pooling': 'max', 'learning_rate': 0.00020321612033082735, 'weight_decay': 9.06055185753368e-06, 'beta_0': 0.8982091427820689, 'beta_1': 0.9989450783327606, 'epsilon': 7.368522840549412e-08, 'balanced_loss': False, 'epochs': 70, 'early_stopping_patience': 19, 'plateau_patience': 23, 'plateau_divider': 7}. Best is trial 211 with value: 0.9654708676873474.
[I 2024-11-29 22:03:16,898] Trial 234 finished with value: 0.9517913601536144 and parameters: {'left_stride': 32, 'right_stride': 0, 'attention_pooling_operation': 'max', 'embedding_pooling_operation': 'mean', 'threshold': 0.7501688892058588, 'batch_size': 70, 'attention_heads': 10, 'hidden_dimension': 148, 'number_of_hidden_layers': 1, 'dropout_rate': 0.48323471243201604, 'global_pooling': 'max', 'learning_rate': 0.00020404927867768465, 'weight_decay': 9.900451856248771e-06, 'beta_0': 0.8998689199059589, 'beta_1': 0.9989828689610365, 'epsilon': 8.272267325637851e-08, 'balanced_loss': False, 'epochs': 70, 'early_stopping_patience': 19, 'plateau_patience': 23, 'plateau_divider': 7}. Best is trial 211 with value: 0.9654708676873474.
[I 2024-11-29 22:12:15,677] Trial 235 finished with value: 0.9473529539190588 and parameters: {'left_stride': 32, 'right_stride': 0, 'attention_pooling_operation': 'max', 'embedding_pooling_operation': 'mean', 'threshold': 0.7537049352663345, 'batch_size': 66, 'attention_heads': 9, 'hidden_dimension': 142, 'number_of_hidden_layers': 1, 'dropout_rate': 0.5007130485215537, 'global_pooling': 'max', 'learning_rate': 0.00027285094686072475, 'weight_decay': 8.865618271492682e-06, 'beta_0': 0.8971101999604195, 'beta_1': 0.9988038393085694, 'epsilon': 4.9592126307284375e-08, 'balanced_loss': False, 'epochs': 70, 'early_stopping_patience': 20, 'plateau_patience': 17, 'plateau_divider': 7}. Best is trial 211 with value: 0.9654708676873474.
[I 2024-11-29 22:21:59,074] Trial 236 finished with value: 0.9551223109555016 and parameters: {'left_stride': 32, 'right_stride': 0, 'attention_pooling_operation': 'max', 'embedding_pooling_operation': 'mean', 'threshold': 0.7456894129852804, 'batch_size': 73, 'attention_heads': 10, 'hidden_dimension': 156, 'number_of_hidden_layers': 1, 'dropout_rate': 0.4874894003136034, 'global_pooling': 'max', 'learning_rate': 0.00018157322679391473, 'weight_decay': 7.756969942172918e-06, 'beta_0': 0.8955232458361034, 'beta_1': 0.9982779529386004, 'epsilon': 1.0866119266684992e-07, 'balanced_loss': False, 'epochs': 73, 'early_stopping_patience': 19, 'plateau_patience': 23, 'plateau_divider': 7}. Best is trial 211 with value: 0.9654708676873474.
[I 2024-11-29 22:31:52,186] Trial 237 finished with value: 0.9509458407577964 and parameters: {'left_stride': 32, 'right_stride': 0, 'attention_pooling_operation': 'max', 'embedding_pooling_operation': 'mean', 'threshold': 0.7742030599503598, 'batch_size': 61, 'attention_heads': 10, 'hidden_dimension': 152, 'number_of_hidden_layers': 1, 'dropout_rate': 0.4797245898231793, 'global_pooling': 'max', 'learning_rate': 0.0002431182469768941, 'weight_decay': 1.1528409652532162e-05, 'beta_0': 0.898048352286124, 'beta_1': 0.9974504929626943, 'epsilon': 2.5195434385821623e-05, 'balanced_loss': False, 'epochs': 76, 'early_stopping_patience': 19, 'plateau_patience': 16, 'plateau_divider': 7}. Best is trial 211 with value: 0.9654708676873474.
[I 2024-11-29 22:41:11,127] Trial 238 finished with value: 0.9583796065385668 and parameters: {'left_stride': 32, 'right_stride': 64, 'attention_pooling_operation': 'max', 'embedding_pooling_operation': 'mean', 'threshold': 0.7607060958612376, 'batch_size': 118, 'attention_heads': 10, 'hidden_dimension': 138, 'number_of_hidden_layers': 1, 'dropout_rate': 0.49351656779448694, 'global_pooling': 'max', 'learning_rate': 0.0002091265483191072, 'weight_decay': 6.562792902558336e-06, 'beta_0': 0.8925819305362712, 'beta_1': 0.9967181254807392, 'epsilon': 6.972051858901177e-08, 'balanced_loss': False, 'epochs': 67, 'early_stopping_patience': 19, 'plateau_patience': 23, 'plateau_divider': 7}. Best is trial 211 with value: 0.9654708676873474.
[I 2024-11-29 22:52:43,614] Trial 239 finished with value: 0.9617082796089047 and parameters: {'left_stride': 32, 'right_stride': 64, 'attention_pooling_operation': 'max', 'embedding_pooling_operation': 'mean', 'threshold': 0.7638101484415286, 'batch_size': 117, 'attention_heads': 10, 'hidden_dimension': 130, 'number_of_hidden_layers': 1, 'dropout_rate': 0.49791238282275235, 'global_pooling': 'max', 'learning_rate': 0.0001936620369933189, 'weight_decay': 6.8164064762461095e-06, 'beta_0': 0.8925103254049406, 'beta_1': 0.9963780267455359, 'epsilon': 4.341901266469234e-08, 'balanced_loss': True, 'epochs': 147, 'early_stopping_patience': 17, 'plateau_patience': 23, 'plateau_divider': 7}. Best is trial 211 with value: 0.9654708676873474.
[I 2024-11-29 23:01:07,149] Trial 240 finished with value: 0.8944842792966399 and parameters: {'left_stride': 32, 'right_stride': 64, 'attention_pooling_operation': 'max', 'embedding_pooling_operation': 'mean', 'threshold': 0.7626779303655937, 'batch_size': 122, 'attention_heads': 10, 'hidden_dimension': 132, 'number_of_hidden_layers': 1, 'dropout_rate': 0.49044717047743897, 'global_pooling': 'max', 'learning_rate': 0.0065199536717633864, 'weight_decay': 8.293737702707935e-06, 'beta_0': 0.8912658429480071, 'beta_1': 0.9966725231873701, 'epsilon': 4.172151784328652e-08, 'balanced_loss': True, 'epochs': 65, 'early_stopping_patience': 17, 'plateau_patience': 23, 'plateau_divider': 7}. Best is trial 211 with value: 0.9654708676873474.
[I 2024-11-29 23:11:41,514] Trial 241 finished with value: 0.9557997073098246 and parameters: {'left_stride': 32, 'right_stride': 64, 'attention_pooling_operation': 'max', 'embedding_pooling_operation': 'max', 'threshold': 0.7672443701441939, 'batch_size': 112, 'attention_heads': 10, 'hidden_dimension': 138, 'number_of_hidden_layers': 1, 'dropout_rate': 0.5007006138670274, 'global_pooling': 'max', 'learning_rate': 0.00012670699980292958, 'weight_decay': 6.996217180450502e-06, 'beta_0': 0.8927051942250629, 'beta_1': 0.9962509886241339, 'epsilon': 3.1063367424422123e-08, 'balanced_loss': True, 'epochs': 144, 'early_stopping_patience': 17, 'plateau_patience': 15, 'plateau_divider': 7}. Best is trial 211 with value: 0.9654708676873474.
[I 2024-11-29 23:21:55,957] Trial 242 finished with value: 0.9442980609138891 and parameters: {'left_stride': 32, 'right_stride': 64, 'attention_pooling_operation': 'max', 'embedding_pooling_operation': 'max', 'threshold': 0.7692256283320664, 'batch_size': 110, 'attention_heads': 10, 'hidden_dimension': 135, 'number_of_hidden_layers': 1, 'dropout_rate': 0.505437745153806, 'global_pooling': 'mean', 'learning_rate': 0.00012395232208462629, 'weight_decay': 7.2505570081986694e-06, 'beta_0': 0.8887720357796575, 'beta_1': 0.9964112368656807, 'epsilon': 3.192556113013038e-08, 'balanced_loss': True, 'epochs': 149, 'early_stopping_patience': 17, 'plateau_patience': 15, 'plateau_divider': 7}. Best is trial 211 with value: 0.9654708676873474.
[I 2024-11-29 23:30:58,137] Trial 243 finished with value: 0.9348903954237635 and parameters: {'left_stride': 32, 'right_stride': 64, 'attention_pooling_operation': 'max', 'embedding_pooling_operation': 'max', 'threshold': 0.760411904690582, 'batch_size': 121, 'attention_heads': 10, 'hidden_dimension': 127, 'number_of_hidden_layers': 1, 'dropout_rate': 0.49825436797089984, 'global_pooling': 'max', 'learning_rate': 0.00019239007394673764, 'weight_decay': 0.00018517868757974396, 'beta_0': 0.8925132453680416, 'beta_1': 0.9961368851780659, 'epsilon': 3.4702303906370917e-08, 'balanced_loss': True, 'epochs': 140, 'early_stopping_patience': 17, 'plateau_patience': 12, 'plateau_divider': 7}. Best is trial 211 with value: 0.9654708676873474.
[I 2024-11-29 23:40:33,161] Trial 244 finished with value: 0.9432886660776043 and parameters: {'left_stride': 32, 'right_stride': 64, 'attention_pooling_operation': 'max', 'embedding_pooling_operation': 'max', 'threshold': 0.7733963420115728, 'batch_size': 114, 'attention_heads': 9, 'hidden_dimension': 140, 'number_of_hidden_layers': 1, 'dropout_rate': 0.49171603236030603, 'global_pooling': 'max', 'learning_rate': 8.096630222048567e-05, 'weight_decay': 9.056038348412883e-06, 'beta_0': 0.8639277395102438, 'beta_1': 0.9966414698255661, 'epsilon': 2.7865068546601482e-08, 'balanced_loss': False, 'epochs': 148, 'early_stopping_patience': 16, 'plateau_patience': 16, 'plateau_divider': 7}. Best is trial 211 with value: 0.9654708676873474.
[I 2024-11-29 23:50:52,308] Trial 245 finished with value: 0.9413894663084992 and parameters: {'left_stride': 32, 'right_stride': 64, 'attention_pooling_operation': 'max', 'embedding_pooling_operation': 'max', 'threshold': 0.7655771615029084, 'batch_size': 114, 'attention_heads': 10, 'hidden_dimension': 138, 'number_of_hidden_layers': 1, 'dropout_rate': 0.5002748070834435, 'global_pooling': 'max', 'learning_rate': 0.00018172468964612685, 'weight_decay': 6.843570892944989e-06, 'beta_0': 0.8608021171615952, 'beta_1': 0.9957880318416272, 'epsilon': 4.462315793174584e-08, 'balanced_loss': True, 'epochs': 146, 'early_stopping_patience': 17, 'plateau_patience': 23, 'plateau_divider': 7}. Best is trial 211 with value: 0.9654708676873474.
[I 2024-11-30 00:02:59,904] Trial 246 finished with value: 0.9441450136840628 and parameters: {'left_stride': 256, 'right_stride': 64, 'attention_pooling_operation': 'max', 'embedding_pooling_operation': 'max', 'threshold': 0.7776244991721644, 'batch_size': 119, 'attention_heads': 10, 'hidden_dimension': 129, 'number_of_hidden_layers': 1, 'dropout_rate': 0.4859026161083904, 'global_pooling': 'max', 'learning_rate': 0.0001456636166884046, 'weight_decay': 5.73731433809666e-06, 'beta_0': 0.8935487952556462, 'beta_1': 0.997743726728678, 'epsilon': 5.518068138430439e-08, 'balanced_loss': True, 'epochs': 149, 'early_stopping_patience': 17, 'plateau_patience': 15, 'plateau_divider': 7}. Best is trial 211 with value: 0.9654708676873474.
[I 2024-11-30 00:14:36,218] Trial 247 finished with value: 0.9489273706789374 and parameters: {'left_stride': 32, 'right_stride': 64, 'attention_pooling_operation': 'max', 'embedding_pooling_operation': 'mean', 'threshold': 0.7560919670844994, 'batch_size': 114, 'attention_heads': 10, 'hidden_dimension': 132, 'number_of_hidden_layers': 1, 'dropout_rate': 0.49474114902835004, 'global_pooling': 'max', 'learning_rate': 0.00011418476562052083, 'weight_decay': 3.0493794775718627e-05, 'beta_0': 0.8912841975611727, 'beta_1': 0.9967915184958576, 'epsilon': 6.389264505059145e-08, 'balanced_loss': True, 'epochs': 144, 'early_stopping_patience': 16, 'plateau_patience': 13, 'plateau_divider': 7}. Best is trial 211 with value: 0.9654708676873474.
[I 2024-11-30 00:26:51,052] Trial 248 finished with value: 0.950135885896146 and parameters: {'left_stride': 128, 'right_stride': 64, 'attention_pooling_operation': 'max', 'embedding_pooling_operation': 'mean', 'threshold': 0.7601014765483951, 'batch_size': 126, 'attention_heads': 11, 'hidden_dimension': 142, 'number_of_hidden_layers': 1, 'dropout_rate': 0.5100029101941363, 'global_pooling': 'max', 'learning_rate': 0.00021041192610652166, 'weight_decay': 1.0114087654404556e-05, 'beta_0': 0.8894588932373542, 'beta_1': 0.9970433125520445, 'epsilon': 4.8580483105961433e-08, 'balanced_loss': True, 'epochs': 137, 'early_stopping_patience': 18, 'plateau_patience': 24, 'plateau_divider': 7}. Best is trial 211 with value: 0.9654708676873474.
[I 2024-11-30 00:34:52,839] Trial 249 finished with value: 0.9423674071744554 and parameters: {'left_stride': 32, 'right_stride': 64, 'attention_pooling_operation': 'max', 'embedding_pooling_operation': 'mean', 'threshold': 0.7675645440390292, 'batch_size': 130, 'attention_heads': 9, 'hidden_dimension': 139, 'number_of_hidden_layers': 1, 'dropout_rate': 0.4874842253062767, 'global_pooling': 'max', 'learning_rate': 0.0007043535738777893, 'weight_decay': 7.807060123159523e-06, 'beta_0': 0.8943747415058706, 'beta_1': 0.998419612610057, 'epsilon': 3.8574604357295695e-08, 'balanced_loss': False, 'epochs': 145, 'early_stopping_patience': 17, 'plateau_patience': 15, 'plateau_divider': 7}. Best is trial 211 with value: 0.9654708676873474.
[I 2024-11-30 00:45:26,606] Trial 250 finished with value: 0.9521137620228357 and parameters: {'left_stride': 64, 'right_stride': 64, 'attention_pooling_operation': 'max', 'embedding_pooling_operation': 'mean', 'threshold': 0.754081560110497, 'batch_size': 117, 'attention_heads': 10, 'hidden_dimension': 144, 'number_of_hidden_layers': 1, 'dropout_rate': 0.5033750737691615, 'global_pooling': 'max', 'learning_rate': 0.00016085206832082178, 'weight_decay': 6.569701997711756e-06, 'beta_0': 0.892303092438392, 'beta_1': 0.996509873261995, 'epsilon': 2.789681374486855e-08, 'balanced_loss': True, 'epochs': 141, 'early_stopping_patience': 16, 'plateau_patience': 19, 'plateau_divider': 8}. Best is trial 211 with value: 0.9654708676873474.
[I 2024-11-30 00:53:43,248] Trial 251 finished with value: 0.9396605985033142 and parameters: {'left_stride': 32, 'right_stride': 64, 'attention_pooling_operation': 'max', 'embedding_pooling_operation': 'max', 'threshold': 0.7715772181163532, 'batch_size': 103, 'attention_heads': 11, 'hidden_dimension': 127, 'number_of_hidden_layers': 1, 'dropout_rate': 0.4953705612826629, 'global_pooling': 'max', 'learning_rate': 0.0005909879160901299, 'weight_decay': 9.113030213293126e-06, 'beta_0': 0.8568793226511358, 'beta_1': 0.9975656796163969, 'epsilon': 6.002055795834299e-08, 'balanced_loss': True, 'epochs': 151, 'early_stopping_patience': 18, 'plateau_patience': 23, 'plateau_divider': 7}. Best is trial 211 with value: 0.9654708676873474.
[I 2024-11-30 01:07:00,020] Trial 252 finished with value: 0.9456497296953985 and parameters: {'left_stride': 32, 'right_stride': 64, 'attention_pooling_operation': 'max', 'embedding_pooling_operation': 'mean', 'threshold': 0.7629460034270741, 'batch_size': 108, 'attention_heads': 10, 'hidden_dimension': 136, 'number_of_hidden_layers': 1, 'dropout_rate': 0.47352864167503095, 'global_pooling': 'max', 'learning_rate': 6.491506272826548e-05, 'weight_decay': 7.318958403684521e-06, 'beta_0': 0.896301559338698, 'beta_1': 0.9919101112357458, 'epsilon': 1.53042004974464e-06, 'balanced_loss': True, 'epochs': 155, 'early_stopping_patience': 20, 'plateau_patience': 23, 'plateau_divider': 7}. Best is trial 211 with value: 0.9654708676873474.
[I 2024-11-30 01:15:05,330] Trial 253 finished with value: 0.9164072436788079 and parameters: {'left_stride': 32, 'right_stride': 64, 'attention_pooling_operation': 'max', 'embedding_pooling_operation': 'mean', 'threshold': 0.7447343685356458, 'batch_size': 75, 'attention_heads': 9, 'hidden_dimension': 144, 'number_of_hidden_layers': 1, 'dropout_rate': 0.5985763184549816, 'global_pooling': 'max', 'learning_rate': 0.003905887130726889, 'weight_decay': 1.2260249349776247e-05, 'beta_0': 0.8973501183813589, 'beta_1': 0.9961042813443884, 'epsilon': 7.460271339696975e-08, 'balanced_loss': False, 'epochs': 66, 'early_stopping_patience': 17, 'plateau_patience': 14, 'plateau_divider': 8}. Best is trial 211 with value: 0.9654708676873474.
[I 2024-11-30 01:25:52,034] Trial 254 finished with value: 0.9546801518790584 and parameters: {'left_stride': 32, 'right_stride': 64, 'attention_pooling_operation': 'max', 'embedding_pooling_operation': 'mean', 'threshold': 0.8592155007868669, 'batch_size': 123, 'attention_heads': 10, 'hidden_dimension': 135, 'number_of_hidden_layers': 3, 'dropout_rate': 0.48371548904952044, 'global_pooling': 'max', 'learning_rate': 0.0002146465565155611, 'weight_decay': 5.657257505230847e-06, 'beta_0': 0.8595077721498636, 'beta_1': 0.9971482134689232, 'epsilon': 4.365432764959705e-08, 'balanced_loss': False, 'epochs': 71, 'early_stopping_patience': 19, 'plateau_patience': 13, 'plateau_divider': 7}. Best is trial 211 with value: 0.9654708676873474.
[I 2024-11-30 01:33:20,614] Trial 255 finished with value: 0.9494981270333331 and parameters: {'left_stride': 32, 'right_stride': 0, 'attention_pooling_operation': 'max', 'embedding_pooling_operation': 'mean', 'threshold': 0.7555545975154193, 'batch_size': 118, 'attention_heads': 11, 'hidden_dimension': 90, 'number_of_hidden_layers': 1, 'dropout_rate': 0.49199816241695027, 'global_pooling': 'mean', 'learning_rate': 0.0008171606341961302, 'weight_decay': 8.105463715860808e-06, 'beta_0': 0.8941666700586248, 'beta_1': 0.99320816195659, 'epsilon': 3.287646497671284e-08, 'balanced_loss': False, 'epochs': 94, 'early_stopping_patience': 15, 'plateau_patience': 24, 'plateau_divider': 7}. Best is trial 211 with value: 0.9654708676873474.
