[I 2024-12-03 13:10:13,302] Trial 151 finished with value: 0.9497879921678913 and parameters: {'left_stride': 256, 'right_stride': 128, 'attention_pooling_operation': 'mean', 'embedding_pooling_operation': 'mean', 'threshold': 0.6972367339840513, 'batch_size': 99, 'attention_heads': 5, 'hidden_dimension': 146, 'number_of_hidden_layers': 3, 'dropout_rate': 0.3806999384479228, 'global_pooling': 'mean', 'learning_rate': 0.00040161858850699505, 'weight_decay': 1.3558704775121574e-06, 'beta_0': 0.8568003718144134, 'beta_1': 0.9829213527769373, 'epsilon': 1.2050805260245172e-07, 'balanced_loss': False, 'epochs': 130, 'early_stopping_patience': 24, 'plateau_patience': 22, 'plateau_divider': 8}. Best is trial 61 with value: 0.9599624971991361.
[I 2024-12-03 13:21:00,632] Trial 152 finished with value: 0.9480173871935456 and parameters: {'left_stride': 256, 'right_stride': 128, 'attention_pooling_operation': 'mean', 'embedding_pooling_operation': 'min', 'threshold': 0.7584011011339251, 'batch_size': 144, 'attention_heads': 6, 'hidden_dimension': 254, 'number_of_hidden_layers': 1, 'dropout_rate': 0.4348298232948939, 'global_pooling': 'max', 'learning_rate': 0.0028000482893979885, 'weight_decay': 2.858712592310409e-06, 'beta_0': 0.8937072972867766, 'beta_1': 0.9954863279228667, 'epsilon': 1.6975926854533008e-07, 'balanced_loss': False, 'epochs': 68, 'early_stopping_patience': 21, 'plateau_patience': 20, 'plateau_divider': 8}. Best is trial 61 with value: 0.9599624971991361.
[I 2024-12-03 13:30:18,784] Trial 153 finished with value: 0.9456104049127234 and parameters: {'left_stride': 256, 'right_stride': 128, 'attention_pooling_operation': 'mean', 'embedding_pooling_operation': 'min', 'threshold': 0.768198697386816, 'batch_size': 148, 'attention_heads': 7, 'hidden_dimension': 121, 'number_of_hidden_layers': 2, 'dropout_rate': 0.4469413912005646, 'global_pooling': 'max', 'learning_rate': 0.001986908971810219, 'weight_decay': 4.127491705830261e-06, 'beta_0': 0.8947744349170804, 'beta_1': 0.9934709341490261, 'epsilon': 1.4527556320894368e-08, 'balanced_loss': False, 'epochs': 63, 'early_stopping_patience': 19, 'plateau_patience': 19, 'plateau_divider': 8}. Best is trial 61 with value: 0.9599624971991361.
[I 2024-12-03 13:36:08,673] Trial 154 finished with value: 0.9186925464323697 and parameters: {'left_stride': 256, 'right_stride': 128, 'attention_pooling_operation': 'mean', 'embedding_pooling_operation': 'min', 'threshold': 0.9794980031214845, 'batch_size': 121, 'attention_heads': 6, 'hidden_dimension': 114, 'number_of_hidden_layers': 1, 'dropout_rate': 0.35120852986259393, 'global_pooling': 'max', 'learning_rate': 0.0022878840592458643, 'weight_decay': 2.4901355756152446e-06, 'beta_0': 0.8477784627981869, 'beta_1': 0.9836937934871633, 'epsilon': 8.054343884252544e-08, 'balanced_loss': False, 'epochs': 165, 'early_stopping_patience': 24, 'plateau_patience': 21, 'plateau_divider': 8}. Best is trial 61 with value: 0.9599624971991361.
[I 2024-12-03 13:42:44,693] Trial 155 finished with value: 0.9479955005120311 and parameters: {'left_stride': 32, 'right_stride': 128, 'attention_pooling_operation': 'mean', 'embedding_pooling_operation': 'min', 'threshold': 0.7747120466101513, 'batch_size': 135, 'attention_heads': 6, 'hidden_dimension': 124, 'number_of_hidden_layers': 0, 'dropout_rate': 0.3110051100515483, 'global_pooling': 'max', 'learning_rate': 0.004348386481537241, 'weight_decay': 2.1084586545693518e-06, 'beta_0': 0.8907313433967008, 'beta_1': 0.994760467390205, 'epsilon': 9.316005986723176e-08, 'balanced_loss': False, 'epochs': 59, 'early_stopping_patience': 23, 'plateau_patience': 19, 'plateau_divider': 6}. Best is trial 61 with value: 0.9599624971991361.
[I 2024-12-03 13:49:21,365] Trial 156 finished with value: 0.9449475837499828 and parameters: {'left_stride': 256, 'right_stride': 0, 'attention_pooling_operation': 'mean', 'embedding_pooling_operation': 'mean', 'threshold': 0.761363068983414, 'batch_size': 158, 'attention_heads': 5, 'hidden_dimension': 155, 'number_of_hidden_layers': 0, 'dropout_rate': 0.427009171722735, 'global_pooling': 'max', 'learning_rate': 0.005266295483673039, 'weight_decay': 3.5774150542571364e-06, 'beta_0': 0.8957872529067888, 'beta_1': 0.9904460003060004, 'epsilon': 2.191679083288687e-07, 'balanced_loss': False, 'epochs': 53, 'early_stopping_patience': 20, 'plateau_patience': 20, 'plateau_divider': 8}. Best is trial 61 with value: 0.9599624971991361.
The selected strides are greater or equal to the total chunk size.
[I 2024-12-03 13:49:23,090] Trial 157 finished with value: -1.0 and parameters: {'left_stride': 256, 'right_stride': 256, 'attention_pooling_operation': 'mean', 'embedding_pooling_operation': 'min', 'threshold': 0.6604414571900923, 'batch_size': 151, 'attention_heads': 5, 'hidden_dimension': 117, 'number_of_hidden_layers': 2, 'dropout_rate': 0.33954806123827275, 'global_pooling': 'max', 'learning_rate': 0.00017463693286225333, 'weight_decay': 2.8749854137245295e-05, 'beta_0': 0.8780852601117363, 'beta_1': 0.994321566940897, 'epsilon': 5.872741344627906e-08, 'balanced_loss': True, 'epochs': 152, 'early_stopping_patience': 25, 'plateau_patience': 20, 'plateau_divider': 10}. Best is trial 61 with value: 0.9599624971991361.
[I 2024-12-03 13:56:25,206] Trial 158 finished with value: 0.9287713099852902 and parameters: {'left_stride': 0, 'right_stride': 0, 'attention_pooling_operation': 'mean', 'embedding_pooling_operation': 'mean', 'threshold': 0.7454239499869889, 'batch_size': 142, 'attention_heads': 7, 'hidden_dimension': 131, 'number_of_hidden_layers': 0, 'dropout_rate': 0.43839308151239215, 'global_pooling': 'sum', 'learning_rate': 0.00028957471865492237, 'weight_decay': 1.7323449005339399e-06, 'beta_0': 0.8879033680268279, 'beta_1': 0.9826028824205304, 'epsilon': 1.2958156079385743e-07, 'balanced_loss': False, 'epochs': 123, 'early_stopping_patience': 17, 'plateau_patience': 21, 'plateau_divider': 7}. Best is trial 61 with value: 0.9599624971991361.
[I 2024-12-03 14:03:02,788] Trial 159 finished with value: 0.9440690817636824 and parameters: {'left_stride': 64, 'right_stride': 64, 'attention_pooling_operation': 'mean', 'embedding_pooling_operation': 'max', 'threshold': 0.6759827751973965, 'batch_size': 137, 'attention_heads': 4, 'hidden_dimension': 98, 'number_of_hidden_layers': 0, 'dropout_rate': 0.3281322269020585, 'global_pooling': 'max', 'learning_rate': 0.0009370091614054548, 'weight_decay': 3.018135212000468e-06, 'beta_0': 0.844717339232188, 'beta_1': 0.9820710178991873, 'epsilon': 3.720476882426208e-08, 'balanced_loss': False, 'epochs': 148, 'early_stopping_patience': 25, 'plateau_patience': 18, 'plateau_divider': 8}. Best is trial 61 with value: 0.9599624971991361.
[I 2024-12-03 14:09:00,726] Trial 160 finished with value: 0.9492100402913182 and parameters: {'left_stride': 256, 'right_stride': 128, 'attention_pooling_operation': 'mean', 'embedding_pooling_operation': 'mean', 'threshold': 0.8917031728004599, 'batch_size': 165, 'attention_heads': 6, 'hidden_dimension': 110, 'number_of_hidden_layers': 0, 'dropout_rate': 0.3624376185267275, 'global_pooling': 'max', 'learning_rate': 0.003226254423414269, 'weight_decay': 1.0118063569394756e-06, 'beta_0': 0.8619981725353018, 'beta_1': 0.9844105055245205, 'epsilon': 1.5509995265965685e-06, 'balanced_loss': False, 'epochs': 89, 'early_stopping_patience': 22, 'plateau_patience': 19, 'plateau_divider': 8}. Best is trial 61 with value: 0.9599624971991361.
[I 2024-12-03 14:15:56,823] Trial 161 finished with value: 0.9401846456964447 and parameters: {'left_stride': 64, 'right_stride': 0, 'attention_pooling_operation': 'max', 'embedding_pooling_operation': 'min', 'threshold': 0.668771019650665, 'batch_size': 153, 'attention_heads': 7, 'hidden_dimension': 104, 'number_of_hidden_layers': 0, 'dropout_rate': 0.39923991555115523, 'global_pooling': 'max', 'learning_rate': 0.0004920124062870506, 'weight_decay': 4.465403258084105e-06, 'beta_0': 0.8851009446794846, 'beta_1': 0.9920562567591239, 'epsilon': 6.090196823654628e-07, 'balanced_loss': False, 'epochs': 94, 'early_stopping_patience': 16, 'plateau_patience': 22, 'plateau_divider': 8}. Best is trial 61 with value: 0.9599624971991361.
[I 2024-12-03 14:23:00,224] Trial 162 finished with value: 0.9365571317162694 and parameters: {'left_stride': 64, 'right_stride': 0, 'attention_pooling_operation': 'mean', 'embedding_pooling_operation': 'mean', 'threshold': 0.8060615315338359, 'batch_size': 97, 'attention_heads': 5, 'hidden_dimension': 111, 'number_of_hidden_layers': 0, 'dropout_rate': 0.3744980456918891, 'global_pooling': 'max', 'learning_rate': 0.00013725321868764622, 'weight_decay': 7.245982412499973e-06, 'beta_0': 0.8544996318030086, 'beta_1': 0.9852295549004235, 'epsilon': 1.2194331326244503e-06, 'balanced_loss': False, 'epochs': 141, 'early_stopping_patience': 15, 'plateau_patience': 17, 'plateau_divider': 8}. Best is trial 61 with value: 0.9599624971991361.
[I 2024-12-03 14:31:22,024] Trial 163 finished with value: 0.9496265023610724 and parameters: {'left_stride': 64, 'right_stride': 0, 'attention_pooling_operation': 'mean', 'embedding_pooling_operation': 'mean', 'threshold': 0.6581239953920855, 'batch_size': 89, 'attention_heads': 9, 'hidden_dimension': 128, 'number_of_hidden_layers': 0, 'dropout_rate': 0.3710563246211414, 'global_pooling': 'max', 'learning_rate': 0.00018517815063470255, 'weight_decay': 6.427801301894657e-06, 'beta_0': 0.8605971096520373, 'beta_1': 0.9858843712837067, 'epsilon': 1.7545185016396193e-06, 'balanced_loss': False, 'epochs': 139, 'early_stopping_patience': 12, 'plateau_patience': 18, 'plateau_divider': 9}. Best is trial 61 with value: 0.9599624971991361.
[I 2024-12-03 14:38:44,037] Trial 164 finished with value: 0.9368021146188208 and parameters: {'left_stride': 64, 'right_stride': 0, 'attention_pooling_operation': 'mean', 'embedding_pooling_operation': 'mean', 'threshold': 0.8543264351897523, 'batch_size': 80, 'attention_heads': 8, 'hidden_dimension': 92, 'number_of_hidden_layers': 0, 'dropout_rate': 0.3694994064688536, 'global_pooling': 'max', 'learning_rate': 9.606102311926033e-05, 'weight_decay': 5.230908820497997e-06, 'beta_0': 0.8652954804638044, 'beta_1': 0.9850573018234564, 'epsilon': 9.385248701980363e-07, 'balanced_loss': False, 'epochs': 146, 'early_stopping_patience': 16, 'plateau_patience': 16, 'plateau_divider': 8}. Best is trial 61 with value: 0.9599624971991361.
[I 2024-12-03 14:45:54,296] Trial 165 finished with value: 0.942478221893807 and parameters: {'left_stride': 64, 'right_stride': 0, 'attention_pooling_operation': 'mean', 'embedding_pooling_operation': 'mean', 'threshold': 0.6643325247194041, 'batch_size': 94, 'attention_heads': 10, 'hidden_dimension': 118, 'number_of_hidden_layers': 0, 'dropout_rate': 0.36091587908267014, 'global_pooling': 'max', 'learning_rate': 0.008025102878918553, 'weight_decay': 9.909684106633983e-06, 'beta_0': 0.8626590315357222, 'beta_1': 0.9855977357750174, 'epsilon': 7.178920980497886e-07, 'balanced_loss': False, 'epochs': 143, 'early_stopping_patience': 17, 'plateau_patience': 18, 'plateau_divider': 5}. Best is trial 61 with value: 0.9599624971991361.
[I 2024-12-03 14:53:16,383] Trial 166 finished with value: 0.9464250232901289 and parameters: {'left_stride': 256, 'right_stride': 128, 'attention_pooling_operation': 'mean', 'embedding_pooling_operation': 'mean', 'threshold': 0.7825178965550414, 'batch_size': 112, 'attention_heads': 6, 'hidden_dimension': 124, 'number_of_hidden_layers': 0, 'dropout_rate': 0.4187727339585667, 'global_pooling': 'max', 'learning_rate': 0.00024687659018820087, 'weight_decay': 8.207604302186202e-06, 'beta_0': 0.8585681524531824, 'beta_1': 0.9846297982060546, 'epsilon': 1.3612615554109664e-06, 'balanced_loss': False, 'epochs': 126, 'early_stopping_patience': 16, 'plateau_patience': 20, 'plateau_divider': 7}. Best is trial 61 with value: 0.9599624971991361.
[I 2024-12-03 15:02:39,968] Trial 167 finished with value: 0.9451989786253486 and parameters: {'left_stride': 64, 'right_stride': 0, 'attention_pooling_operation': 'mean', 'embedding_pooling_operation': 'mean', 'threshold': 0.6570192079707968, 'batch_size': 106, 'attention_heads': 7, 'hidden_dimension': 85, 'number_of_hidden_layers': 0, 'dropout_rate': 0.3560029097941033, 'global_pooling': 'max', 'learning_rate': 0.00011225484884518606, 'weight_decay': 5.978564515116566e-06, 'beta_0': 0.870811306070032, 'beta_1': 0.9898035423784783, 'epsilon': 3.354814408506207e-06, 'balanced_loss': False, 'epochs': 135, 'early_stopping_patience': 21, 'plateau_patience': 19, 'plateau_divider': 8}. Best is trial 61 with value: 0.9599624971991361.
[I 2024-12-03 15:11:39,650] Trial 168 finished with value: 0.9501290491000292 and parameters: {'left_stride': 256, 'right_stride': 0, 'attention_pooling_operation': 'mean', 'embedding_pooling_operation': 'mean', 'threshold': 0.6826325744507599, 'batch_size': 86, 'attention_heads': 13, 'hidden_dimension': 99, 'number_of_hidden_layers': 0, 'dropout_rate': 0.45686056054569074, 'global_pooling': 'max', 'learning_rate': 0.0003451376128743907, 'weight_decay': 1.1527570414513473e-05, 'beta_0': 0.8678390773913659, 'beta_1': 0.9931161736820477, 'epsilon': 2.468685004979464e-06, 'balanced_loss': False, 'epochs': 199, 'early_stopping_patience': 19, 'plateau_patience': 17, 'plateau_divider': 9}. Best is trial 61 with value: 0.9599624971991361.
[I 2024-12-03 15:20:39,028] Trial 169 finished with value: 0.9431510476423495 and parameters: {'left_stride': 32, 'right_stride': 64, 'attention_pooling_operation': 'mean', 'embedding_pooling_operation': 'min', 'threshold': 0.6718038411943144, 'batch_size': 145, 'attention_heads': 5, 'hidden_dimension': 149, 'number_of_hidden_layers': 0, 'dropout_rate': 0.386400850692391, 'global_pooling': 'max', 'learning_rate': 0.00014007008133193623, 'weight_decay': 2.2809317590001924e-06, 'beta_0': 0.8565657888634932, 'beta_1': 0.9833056320316697, 'epsilon': 2.5529759519402728e-08, 'balanced_loss': True, 'epochs': 121, 'early_stopping_patience': 15, 'plateau_patience': 19, 'plateau_divider': 8}. Best is trial 61 with value: 0.9599624971991361.
[I 2024-12-03 15:32:45,827] Trial 170 finished with value: 0.9392439739765424 and parameters: {'left_stride': 64, 'right_stride': 128, 'attention_pooling_operation': 'min', 'embedding_pooling_operation': 'max', 'threshold': 0.6517895174656672, 'batch_size': 73, 'attention_heads': 14, 'hidden_dimension': 107, 'number_of_hidden_layers': 1, 'dropout_rate': 0.3066846229888401, 'global_pooling': 'max', 'learning_rate': 0.0001692199370446781, 'weight_decay': 1.2485381498422699e-06, 'beta_0': 0.8732409066863587, 'beta_1': 0.9840171088408433, 'epsilon': 1.0729648086430945e-06, 'balanced_loss': False, 'epochs': 112, 'early_stopping_patience': 18, 'plateau_patience': 18, 'plateau_divider': 8}. Best is trial 61 with value: 0.9599624971991361.
[I 2024-12-03 15:40:08,468] Trial 171 finished with value: 0.9416528637591932 and parameters: {'left_stride': 256, 'right_stride': 0, 'attention_pooling_operation': 'mean', 'embedding_pooling_operation': 'mean', 'threshold': 0.66425339779388, 'batch_size': 158, 'attention_heads': 4, 'hidden_dimension': 90, 'number_of_hidden_layers': 0, 'dropout_rate': 0.3219538097212044, 'global_pooling': 'max', 'learning_rate': 0.00022490594040932852, 'weight_decay': 1.5682580686545191e-06, 'beta_0': 0.8923482531115656, 'beta_1': 0.9891615531152708, 'epsilon': 3.5258816399508723e-07, 'balanced_loss': False, 'epochs': 131, 'early_stopping_patience': 17, 'plateau_patience': 22, 'plateau_divider': 7}. Best is trial 61 with value: 0.9599624971991361.
[I 2024-12-03 15:48:26,594] Trial 172 finished with value: 0.9519694549911097 and parameters: {'left_stride': 64, 'right_stride': 0, 'attention_pooling_operation': 'mean', 'embedding_pooling_operation': 'mean', 'threshold': 0.6599653485395578, 'batch_size': 77, 'attention_heads': 8, 'hidden_dimension': 96, 'number_of_hidden_layers': 0, 'dropout_rate': 0.3777564487284396, 'global_pooling': 'max', 'learning_rate': 0.00015843906763965496, 'weight_decay': 1.711050535715708e-05, 'beta_0': 0.8467534480423404, 'beta_1': 0.9837432773180784, 'epsilon': 4.8507740148103425e-05, 'balanced_loss': True, 'epochs': 127, 'early_stopping_patience': 15, 'plateau_patience': 18, 'plateau_divider': 8}. Best is trial 61 with value: 0.9599624971991361.
[I 2024-12-03 15:56:18,008] Trial 173 finished with value: 0.9475851309325369 and parameters: {'left_stride': 64, 'right_stride': 0, 'attention_pooling_operation': 'mean', 'embedding_pooling_operation': 'mean', 'threshold': 0.6501081305044767, 'batch_size': 78, 'attention_heads': 8, 'hidden_dimension': 95, 'number_of_hidden_layers': 0, 'dropout_rate': 0.3800638022431144, 'global_pooling': 'max', 'learning_rate': 0.00020456082923099488, 'weight_decay': 2.144783658113861e-05, 'beta_0': 0.8501540207128458, 'beta_1': 0.9836958894735203, 'epsilon': 1.999398378425637e-05, 'balanced_loss': True, 'epochs': 126, 'early_stopping_patience': 15, 'plateau_patience': 18, 'plateau_divider': 8}. Best is trial 61 with value: 0.9599624971991361.
[I 2024-12-03 16:07:06,255] Trial 174 finished with value: 0.9426436420247992 and parameters: {'left_stride': 64, 'right_stride': 0, 'attention_pooling_operation': 'mean', 'embedding_pooling_operation': 'mean', 'threshold': 0.6700244514351359, 'batch_size': 84, 'attention_heads': 9, 'hidden_dimension': 103, 'number_of_hidden_layers': 0, 'dropout_rate': 0.300115252700005, 'global_pooling': 'max', 'learning_rate': 8.38699269765371e-05, 'weight_decay': 1.4527263853322134e-05, 'beta_0': 0.8461123960692295, 'beta_1': 0.9983557154007862, 'epsilon': 5.538343270427989e-05, 'balanced_loss': True, 'epochs': 117, 'early_stopping_patience': 16, 'plateau_patience': 17, 'plateau_divider': 3}. Best is trial 61 with value: 0.9599624971991361.
[I 2024-12-03 16:17:00,198] Trial 175 finished with value: 0.9463500442517054 and parameters: {'left_stride': 64, 'right_stride': 0, 'attention_pooling_operation': 'mean', 'embedding_pooling_operation': 'mean', 'threshold': 0.6598387274376591, 'batch_size': 64, 'attention_heads': 9, 'hidden_dimension': 135, 'number_of_hidden_layers': 0, 'dropout_rate': 0.39222892669189663, 'global_pooling': 'max', 'learning_rate': 0.00012542681187348168, 'weight_decay': 1.8544890384919976e-05, 'beta_0': 0.8514701823349139, 'beta_1': 0.9841525347611091, 'epsilon': 7.271718788587537e-07, 'balanced_loss': True, 'epochs': 85, 'early_stopping_patience': 14, 'plateau_patience': 18, 'plateau_divider': 8}. Best is trial 61 with value: 0.9599624971991361.
[I 2024-12-03 16:23:19,260] Trial 176 finished with value: 0.9478958848837589 and parameters: {'left_stride': 64, 'right_stride': 32, 'attention_pooling_operation': 'mean', 'embedding_pooling_operation': 'mean', 'threshold': 0.6788941872308166, 'batch_size': 69, 'attention_heads': 7, 'hidden_dimension': 79, 'number_of_hidden_layers': 0, 'dropout_rate': 0.37623025115013514, 'global_pooling': 'max', 'learning_rate': 0.0037774529211912836, 'weight_decay': 1.2633848668469387e-05, 'beta_0': 0.8641515837118899, 'beta_1': 0.9826911780905918, 'epsilon': 1.4573204263928447e-05, 'balanced_loss': True, 'epochs': 133, 'early_stopping_patience': 16, 'plateau_patience': 19, 'plateau_divider': 8}. Best is trial 61 with value: 0.9599624971991361.
[I 2024-12-03 16:30:20,481] Trial 177 finished with value: 0.9453593409510539 and parameters: {'left_stride': 256, 'right_stride': 0, 'attention_pooling_operation': 'mean', 'embedding_pooling_operation': 'mean', 'threshold': 0.6907760523591964, 'batch_size': 76, 'attention_heads': 8, 'hidden_dimension': 88, 'number_of_hidden_layers': 0, 'dropout_rate': 0.3474419634003007, 'global_pooling': 'max', 'learning_rate': 0.0002959286427716778, 'weight_decay': 1.6015882880220448e-05, 'beta_0': 0.861253924657312, 'beta_1': 0.990728336763015, 'epsilon': 2.9042786539074215e-05, 'balanced_loss': False, 'epochs': 137, 'early_stopping_patience': 14, 'plateau_patience': 19, 'plateau_divider': 8}. Best is trial 61 with value: 0.9599624971991361.
[I 2024-12-03 16:38:28,771] Trial 178 finished with value: 0.942441603353332 and parameters: {'left_stride': 64, 'right_stride': 128, 'attention_pooling_operation': 'mean', 'embedding_pooling_operation': 'min', 'threshold': 0.6613174514292616, 'batch_size': 150, 'attention_heads': 7, 'hidden_dimension': 114, 'number_of_hidden_layers': 0, 'dropout_rate': 0.4302319798811618, 'global_pooling': 'max', 'learning_rate': 0.0004128066968211722, 'weight_decay': 8.914545467829843e-06, 'beta_0': 0.8445606659326755, 'beta_1': 0.9846530598457092, 'epsilon': 1.5560674202141338e-07, 'balanced_loss': True, 'epochs': 99, 'early_stopping_patience': 25, 'plateau_patience': 21, 'plateau_divider': 8}. Best is trial 61 with value: 0.9599624971991361.
[I 2024-12-03 16:45:44,971] Trial 179 finished with value: 0.9482235129545674 and parameters: {'left_stride': 256, 'right_stride': 0, 'attention_pooling_operation': 'mean', 'embedding_pooling_operation': 'mean', 'threshold': 0.7280104871745764, 'batch_size': 140, 'attention_heads': 6, 'hidden_dimension': 98, 'number_of_hidden_layers': 0, 'dropout_rate': 0.44301304019471915, 'global_pooling': 'max', 'learning_rate': 0.00025002387946249023, 'weight_decay': 4.05140146432501e-05, 'beta_0': 0.8974619986604366, 'beta_1': 0.9832175558657008, 'epsilon': 5.535024759090308e-07, 'balanced_loss': False, 'epochs': 182, 'early_stopping_patience': 15, 'plateau_patience': 18, 'plateau_divider': 8}. Best is trial 61 with value: 0.9599624971991361.
