[I 2024-12-13 21:02:43,506] Trial 182 finished with value: -1.0 and parameters: {'left_stride': 64, 'right_stride': 128, 'attention_pooling_operation': 'mean', 'embedding_pooling_operation': 'max', 'threshold': 0.7099576300968303, 'batch_size': 43, 'attention_heads': 15, 'hidden_dimension': 96, 'number_of_hidden_layers': 3, 'dropout_rate': 0.5723554152015183, 'global_pooling': 'max', 'learning_rate': 2.1617106338125137e-05, 'weight_decay': 0.000288623918454437, 'beta_0': 0.8869478131151565, 'beta_1': 0.9938691354178746, 'epsilon': 8.136195791646011e-05, 'balanced_loss': True, 'epochs': 134, 'early_stopping_patience': 21, 'plateau_patience': 20, 'plateau_divider': 7}. Best is trial 136 with value: 0.9776229738062259.
CUDA out of memory. Tried to allocate 1.68 GiB. GPU 0 has a total capacity of 44.56 GiB of which 1.23 GiB is free. Including non-PyTorch memory, this process has 43.33 GiB memory in use. Of the allocated memory 40.87 GiB is allocated by PyTorch, and 1.30 GiB is reserved by PyTorch but unallocated. If reserved but unallocated memory is large try setting PYTORCH_CUDA_ALLOC_CONF=expandable_segments:True to avoid fragmentation.  See documentation for Memory Management  (https://pytorch.org/docs/stable/notes/cuda.html#environment-variables)
[I 2024-12-13 21:10:38,422] Trial 183 finished with value: -1.0 and parameters: {'left_stride': 64, 'right_stride': 128, 'attention_pooling_operation': 'mean', 'embedding_pooling_operation': 'max', 'threshold': 0.7052313273703964, 'batch_size': 53, 'attention_heads': 15, 'hidden_dimension': 93, 'number_of_hidden_layers': 3, 'dropout_rate': 0.5653444670276446, 'global_pooling': 'max', 'learning_rate': 2.7478137659502406e-05, 'weight_decay': 0.0002109087688712119, 'beta_0': 0.8837022161047055, 'beta_1': 0.9964151233669423, 'epsilon': 6.967851667483525e-05, 'balanced_loss': True, 'epochs': 114, 'early_stopping_patience': 20, 'plateau_patience': 21, 'plateau_divider': 7}. Best is trial 136 with value: 0.9776229738062259.
CUDA out of memory. Tried to allocate 1.60 GiB. GPU 0 has a total capacity of 44.56 GiB of which 1.25 GiB is free. Including non-PyTorch memory, this process has 43.30 GiB memory in use. Of the allocated memory 39.37 GiB is allocated by PyTorch, and 2.78 GiB is reserved by PyTorch but unallocated. If reserved but unallocated memory is large try setting PYTORCH_CUDA_ALLOC_CONF=expandable_segments:True to avoid fragmentation.  See documentation for Memory Management  (https://pytorch.org/docs/stable/notes/cuda.html#environment-variables)
[I 2024-12-13 21:18:33,267] Trial 184 finished with value: -1.0 and parameters: {'left_stride': 64, 'right_stride': 128, 'attention_pooling_operation': 'mean', 'embedding_pooling_operation': 'max', 'threshold': 0.714985176681864, 'batch_size': 47, 'attention_heads': 15, 'hidden_dimension': 100, 'number_of_hidden_layers': 3, 'dropout_rate': 0.5561261815564397, 'global_pooling': 'max', 'learning_rate': 1.3576760781954707e-05, 'weight_decay': 0.00046923419148221866, 'beta_0': 0.891292298470179, 'beta_1': 0.9919461778161456, 'epsilon': 5.4651579102547724e-05, 'balanced_loss': True, 'epochs': 100, 'early_stopping_patience': 21, 'plateau_patience': 20, 'plateau_divider': 7}. Best is trial 136 with value: 0.9776229738062259.
[I 2024-12-13 22:05:34,290] Trial 185 finished with value: 0.9755479559761673 and parameters: {'left_stride': 64, 'right_stride': 128, 'attention_pooling_operation': 'mean', 'embedding_pooling_operation': 'max', 'threshold': 0.730974840714392, 'batch_size': 39, 'attention_heads': 16, 'hidden_dimension': 82, 'number_of_hidden_layers': 3, 'dropout_rate': 0.5477473510094332, 'global_pooling': 'max', 'learning_rate': 2.1383915286852286e-05, 'weight_decay': 0.00036694556871829867, 'beta_0': 0.8816658661005183, 'beta_1': 0.9829225305482986, 'epsilon': 3.755259499020424e-05, 'balanced_loss': True, 'epochs': 138, 'early_stopping_patience': 21, 'plateau_patience': 19, 'plateau_divider': 7}. Best is trial 136 with value: 0.9776229738062259.
[I 2024-12-13 22:48:52,869] Trial 186 finished with value: 0.9669504581239674 and parameters: {'left_stride': 64, 'right_stride': 128, 'attention_pooling_operation': 'mean', 'embedding_pooling_operation': 'max', 'threshold': 0.7306390395342399, 'batch_size': 44, 'attention_heads': 16, 'hidden_dimension': 76, 'number_of_hidden_layers': 3, 'dropout_rate': 0.5464607314104334, 'global_pooling': 'max', 'learning_rate': 2.5415155349973885e-05, 'weight_decay': 0.0003470883578314261, 'beta_0': 0.8779119637690382, 'beta_1': 0.9839933528010181, 'epsilon': 4.754226619207631e-05, 'balanced_loss': True, 'epochs': 139, 'early_stopping_patience': 21, 'plateau_patience': 21, 'plateau_divider': 7}. Best is trial 136 with value: 0.9776229738062259.
CUDA out of memory. Tried to allocate 1.44 GiB. GPU 0 has a total capacity of 44.56 GiB of which 940.69 MiB is free. Including non-PyTorch memory, this process has 43.63 GiB memory in use. Of the allocated memory 38.26 GiB is allocated by PyTorch, and 4.22 GiB is reserved by PyTorch but unallocated. If reserved but unallocated memory is large try setting PYTORCH_CUDA_ALLOC_CONF=expandable_segments:True to avoid fragmentation.  See documentation for Memory Management  (https://pytorch.org/docs/stable/notes/cuda.html#environment-variables)
[I 2024-12-13 23:00:30,646] Trial 187 finished with value: -1.0 and parameters: {'left_stride': 64, 'right_stride': 128, 'attention_pooling_operation': 'mean', 'embedding_pooling_operation': 'max', 'threshold': 0.7220991438882396, 'batch_size': 40, 'attention_heads': 16, 'hidden_dimension': 88, 'number_of_hidden_layers': 3, 'dropout_rate': 0.5525508049455583, 'global_pooling': 'max', 'learning_rate': 2.2244475508534917e-05, 'weight_decay': 0.0002940981474114286, 'beta_0': 0.8841998811912588, 'beta_1': 0.9954318872288241, 'epsilon': 3.575368330353594e-05, 'balanced_loss': True, 'epochs': 137, 'early_stopping_patience': 21, 'plateau_patience': 20, 'plateau_divider': 7}. Best is trial 136 with value: 0.9776229738062259.
[I 2024-12-13 23:46:34,573] Trial 188 finished with value: 0.9742127654270223 and parameters: {'left_stride': 64, 'right_stride': 128, 'attention_pooling_operation': 'mean', 'embedding_pooling_operation': 'max', 'threshold': 0.7238456787164255, 'batch_size': 44, 'attention_heads': 16, 'hidden_dimension': 79, 'number_of_hidden_layers': 3, 'dropout_rate': 0.5597760266300238, 'global_pooling': 'max', 'learning_rate': 3.255068557049466e-05, 'weight_decay': 0.00020000248535011441, 'beta_0': 0.8818521374204087, 'beta_1': 0.9890667657395396, 'epsilon': 7.123671195969581e-05, 'balanced_loss': True, 'epochs': 118, 'early_stopping_patience': 19, 'plateau_patience': 19, 'plateau_divider': 7}. Best is trial 136 with value: 0.9776229738062259.
[I 2024-12-14 00:32:12,732] Trial 189 finished with value: 0.9710039160739197 and parameters: {'left_stride': 64, 'right_stride': 128, 'attention_pooling_operation': 'mean', 'embedding_pooling_operation': 'max', 'threshold': 0.7272070699516647, 'batch_size': 44, 'attention_heads': 16, 'hidden_dimension': 79, 'number_of_hidden_layers': 3, 'dropout_rate': 0.5625472735603942, 'global_pooling': 'max', 'learning_rate': 3.0166683905569162e-05, 'weight_decay': 0.00018918666877501048, 'beta_0': 0.8816072087760112, 'beta_1': 0.9943679086805135, 'epsilon': 7.507829707971066e-05, 'balanced_loss': True, 'epochs': 119, 'early_stopping_patience': 19, 'plateau_patience': 19, 'plateau_divider': 7}. Best is trial 136 with value: 0.9776229738062259.
[I 2024-12-14 01:17:41,135] Trial 190 finished with value: 0.974650628932271 and parameters: {'left_stride': 64, 'right_stride': 128, 'attention_pooling_operation': 'mean', 'embedding_pooling_operation': 'max', 'threshold': 0.7251655068327295, 'batch_size': 49, 'attention_heads': 16, 'hidden_dimension': 79, 'number_of_hidden_layers': 3, 'dropout_rate': 0.5799167559363197, 'global_pooling': 'max', 'learning_rate': 3.425839348409593e-05, 'weight_decay': 0.00017595612643332877, 'beta_0': 0.8826196819869356, 'beta_1': 0.9945620645200743, 'epsilon': 8.02068218293312e-05, 'balanced_loss': True, 'epochs': 111, 'early_stopping_patience': 18, 'plateau_patience': 19, 'plateau_divider': 7}. Best is trial 136 with value: 0.9776229738062259.
CUDA out of memory. Tried to allocate 1.49 GiB. GPU 0 has a total capacity of 44.56 GiB of which 1.08 GiB is free. Including non-PyTorch memory, this process has 43.47 GiB memory in use. Of the allocated memory 39.33 GiB is allocated by PyTorch, and 2.99 GiB is reserved by PyTorch but unallocated. If reserved but unallocated memory is large try setting PYTORCH_CUDA_ALLOC_CONF=expandable_segments:True to avoid fragmentation.  See documentation for Memory Management  (https://pytorch.org/docs/stable/notes/cuda.html#environment-variables)
[I 2024-12-14 01:25:43,735] Trial 191 finished with value: -1.0 and parameters: {'left_stride': 64, 'right_stride': 128, 'attention_pooling_operation': 'mean', 'embedding_pooling_operation': 'max', 'threshold': 0.7149828777726206, 'batch_size': 51, 'attention_heads': 16, 'hidden_dimension': 79, 'number_of_hidden_layers': 3, 'dropout_rate': 0.5786305568084826, 'global_pooling': 'max', 'learning_rate': 3.897221707315747e-05, 'weight_decay': 0.00017408457254452944, 'beta_0': 0.8825348708764433, 'beta_1': 0.9946672554829827, 'epsilon': 9.40753666410515e-05, 'balanced_loss': True, 'epochs': 110, 'early_stopping_patience': 17, 'plateau_patience': 19, 'plateau_divider': 7}. Best is trial 136 with value: 0.9776229738062259.
[I 2024-12-14 01:52:12,714] Trial 192 finished with value: 0.9252480998654129 and parameters: {'left_stride': 64, 'right_stride': 128, 'attention_pooling_operation': 'mean', 'embedding_pooling_operation': 'max', 'threshold': 0.7274438663094904, 'batch_size': 55, 'attention_heads': 16, 'hidden_dimension': 69, 'number_of_hidden_layers': 3, 'dropout_rate': 0.5646408161705065, 'global_pooling': 'sum', 'learning_rate': 4.825798544739619e-05, 'weight_decay': 0.00020688585439769227, 'beta_0': 0.8816821616734274, 'beta_1': 0.9946783324861423, 'epsilon': 7.01683705549155e-05, 'balanced_loss': True, 'epochs': 112, 'early_stopping_patience': 19, 'plateau_patience': 19, 'plateau_divider': 7}. Best is trial 136 with value: 0.9776229738062259.
[I 2024-12-14 02:25:11,398] Trial 193 finished with value: 0.9589479291417341 and parameters: {'left_stride': 64, 'right_stride': 0, 'attention_pooling_operation': 'mean', 'embedding_pooling_operation': 'max', 'threshold': 0.7028119415205375, 'batch_size': 46, 'attention_heads': 16, 'hidden_dimension': 74, 'number_of_hidden_layers': 3, 'dropout_rate': 0.5664427800673928, 'global_pooling': 'max', 'learning_rate': 5.56175564228132e-05, 'weight_decay': 0.0005076250218308926, 'beta_0': 0.8857599833296147, 'beta_1': 0.9955188797664429, 'epsilon': 7.754369432575217e-05, 'balanced_loss': True, 'epochs': 107, 'early_stopping_patience': 19, 'plateau_patience': 20, 'plateau_divider': 7}. Best is trial 136 with value: 0.9776229738062259.
[I 2024-12-14 02:56:12,474] Trial 194 finished with value: 0.9150427205176481 and parameters: {'left_stride': 64, 'right_stride': 128, 'attention_pooling_operation': 'mean', 'embedding_pooling_operation': 'min', 'threshold': 0.733934814322116, 'batch_size': 36, 'attention_heads': 16, 'hidden_dimension': 79, 'number_of_hidden_layers': 3, 'dropout_rate': 0.5739066467467334, 'global_pooling': 'max', 'learning_rate': 3.481057726024592e-05, 'weight_decay': 0.0002643662774813254, 'beta_0': 0.8782876576998673, 'beta_1': 0.9930279843954859, 'epsilon': 6.212352581095196e-05, 'balanced_loss': False, 'epochs': 133, 'early_stopping_patience': 18, 'plateau_patience': 19, 'plateau_divider': 7}. Best is trial 136 with value: 0.9776229738062259.
[I 2024-12-14 03:36:10,977] Trial 195 finished with value: 0.9701033574050868 and parameters: {'left_stride': 64, 'right_stride': 128, 'attention_pooling_operation': 'mean', 'embedding_pooling_operation': 'max', 'threshold': 0.7214881097944491, 'batch_size': 40, 'attention_heads': 16, 'hidden_dimension': 82, 'number_of_hidden_layers': 3, 'dropout_rate': 0.5902369645289595, 'global_pooling': 'max', 'learning_rate': 3.1318774466232004e-05, 'weight_decay': 0.00019853183831633402, 'beta_0': 0.8881065893344157, 'beta_1': 0.9960430422778725, 'epsilon': 9.819061105019123e-05, 'balanced_loss': True, 'epochs': 117, 'early_stopping_patience': 19, 'plateau_patience': 19, 'plateau_divider': 7}. Best is trial 136 with value: 0.9776229738062259.
[I 2024-12-14 04:18:59,370] Trial 196 finished with value: 0.9679175461647725 and parameters: {'left_stride': 64, 'right_stride': 128, 'attention_pooling_operation': 'mean', 'embedding_pooling_operation': 'max', 'threshold': 0.7279393931387964, 'batch_size': 44, 'attention_heads': 16, 'hidden_dimension': 73, 'number_of_hidden_layers': 3, 'dropout_rate': 0.5592519808227366, 'global_pooling': 'max', 'learning_rate': 2.2196275045595317e-05, 'weight_decay': 0.00012966590993180002, 'beta_0': 0.8865010995012398, 'beta_1': 0.9974504929626943, 'epsilon': 7.704709286022402e-05, 'balanced_loss': True, 'epochs': 119, 'early_stopping_patience': 18, 'plateau_patience': 19, 'plateau_divider': 7}. Best is trial 136 with value: 0.9776229738062259.
[I 2024-12-14 05:03:03,290] Trial 197 finished with value: 0.9687939782619341 and parameters: {'left_stride': 64, 'right_stride': 128, 'attention_pooling_operation': 'mean', 'embedding_pooling_operation': 'max', 'threshold': 0.7214491222227489, 'batch_size': 37, 'attention_heads': 16, 'hidden_dimension': 68, 'number_of_hidden_layers': 3, 'dropout_rate': 0.5604554901102304, 'global_pooling': 'max', 'learning_rate': 1.9209505877802578e-05, 'weight_decay': 0.00023897109674664752, 'beta_0': 0.8812521339637458, 'beta_1': 0.9932745805150178, 'epsilon': 5.5534425731471866e-05, 'balanced_loss': True, 'epochs': 125, 'early_stopping_patience': 20, 'plateau_patience': 19, 'plateau_divider': 7}. Best is trial 136 with value: 0.9776229738062259.
[I 2024-12-14 05:49:44,726] Trial 198 finished with value: 0.9541587147884797 and parameters: {'left_stride': 64, 'right_stride': 128, 'attention_pooling_operation': 'mean', 'embedding_pooling_operation': 'max', 'threshold': 0.7449718257058694, 'batch_size': 48, 'attention_heads': 16, 'hidden_dimension': 77, 'number_of_hidden_layers': 3, 'dropout_rate': 0.5696823102886401, 'global_pooling': 'max', 'learning_rate': 1.4922093456287941e-05, 'weight_decay': 0.00027234759062837324, 'beta_0': 0.8838621446472222, 'beta_1': 0.9904218376957353, 'epsilon': 6.76805784700026e-05, 'balanced_loss': True, 'epochs': 119, 'early_stopping_patience': 18, 'plateau_patience': 20, 'plateau_divider': 7}. Best is trial 136 with value: 0.9776229738062259.
CUDA out of memory. Tried to allocate 3.24 GiB. GPU 0 has a total capacity of 44.56 GiB of which 2.55 GiB is free. Including non-PyTorch memory, this process has 42.00 GiB memory in use. Of the allocated memory 38.43 GiB is allocated by PyTorch, and 2.42 GiB is reserved by PyTorch but unallocated. If reserved but unallocated memory is large try setting PYTORCH_CUDA_ALLOC_CONF=expandable_segments:True to avoid fragmentation.  See documentation for Memory Management  (https://pytorch.org/docs/stable/notes/cuda.html#environment-variables)
[I 2024-12-14 05:57:09,997] Trial 199 finished with value: -1.0 and parameters: {'left_stride': 64, 'right_stride': 128, 'attention_pooling_operation': 'mean', 'embedding_pooling_operation': 'max', 'threshold': 0.7109894286970195, 'batch_size': 240, 'attention_heads': 16, 'hidden_dimension': 88, 'number_of_hidden_layers': 3, 'dropout_rate': 0.584824897996306, 'global_pooling': 'max', 'learning_rate': 1.7663207160752985e-05, 'weight_decay': 0.00018079500958811427, 'beta_0': 0.8877760053575519, 'beta_1': 0.9942091840747348, 'epsilon': 4.7047914629426394e-05, 'balanced_loss': True, 'epochs': 114, 'early_stopping_patience': 17, 'plateau_patience': 20, 'plateau_divider': 7}. Best is trial 136 with value: 0.9776229738062259.
[I 2024-12-14 06:35:27,637] Trial 200 finished with value: 0.970166580630673 and parameters: {'left_stride': 64, 'right_stride': 128, 'attention_pooling_operation': 'mean', 'embedding_pooling_operation': 'max', 'threshold': 0.7371732888877287, 'batch_size': 40, 'attention_heads': 16, 'hidden_dimension': 82, 'number_of_hidden_layers': 3, 'dropout_rate': 0.5994772425662815, 'global_pooling': 'max', 'learning_rate': 2.9567741171564853e-05, 'weight_decay': 0.0007261401607380839, 'beta_0': 0.8927484545605479, 'beta_1': 0.9944295765415443, 'epsilon': 6.182588595811496e-05, 'balanced_loss': True, 'epochs': 123, 'early_stopping_patience': 19, 'plateau_patience': 19, 'plateau_divider': 7}. Best is trial 136 with value: 0.9776229738062259.
[I 2024-12-14 07:17:18,092] Trial 201 finished with value: 0.9684187686805105 and parameters: {'left_stride': 64, 'right_stride': 128, 'attention_pooling_operation': 'mean', 'embedding_pooling_operation': 'max', 'threshold': 0.7240648647746595, 'batch_size': 35, 'attention_heads': 16, 'hidden_dimension': 93, 'number_of_hidden_layers': 3, 'dropout_rate': 0.5519322641676544, 'global_pooling': 'max', 'learning_rate': 4.167760381939079e-05, 'weight_decay': 0.00015385781075790114, 'beta_0': 0.8755104216883577, 'beta_1': 0.9891100922620251, 'epsilon': 8.308657333819926e-05, 'balanced_loss': True, 'epochs': 121, 'early_stopping_patience': 20, 'plateau_patience': 20, 'plateau_divider': 7}. Best is trial 136 with value: 0.9776229738062259.
[I 2024-12-14 07:59:37,550] Trial 202 finished with value: 0.97007938286872 and parameters: {'left_stride': 64, 'right_stride': 64, 'attention_pooling_operation': 'mean', 'embedding_pooling_operation': 'max', 'threshold': 0.7161287486143115, 'batch_size': 44, 'attention_heads': 15, 'hidden_dimension': 76, 'number_of_hidden_layers': 3, 'dropout_rate': 0.5557812565882784, 'global_pooling': 'max', 'learning_rate': 2.0836606078036342e-05, 'weight_decay': 4.230089090395511e-06, 'beta_0': 0.8953511195606239, 'beta_1': 0.995020925811664, 'epsilon': 9.99698878129993e-05, 'balanced_loss': True, 'epochs': 104, 'early_stopping_patience': 20, 'plateau_patience': 20, 'plateau_divider': 7}. Best is trial 136 with value: 0.9776229738062259.
[I 2024-12-14 08:44:01,035] Trial 203 finished with value: 0.9161204446311237 and parameters: {'left_stride': 64, 'right_stride': 128, 'attention_pooling_operation': 'mean', 'embedding_pooling_operation': 'max', 'threshold': 0.7314170627747719, 'batch_size': 49, 'attention_heads': 16, 'hidden_dimension': 71, 'number_of_hidden_layers': 3, 'dropout_rate': 0.54752769409328, 'global_pooling': 'max', 'learning_rate': 1.2433612936574156e-05, 'weight_decay': 0.0003733473277712548, 'beta_0': 0.8810033131196238, 'beta_1': 0.9950622318733902, 'epsilon': 3.913016444884644e-05, 'balanced_loss': True, 'epochs': 116, 'early_stopping_patience': 19, 'plateau_patience': 18, 'plateau_divider': 7}. Best is trial 136 with value: 0.9776229738062259.
[I 2024-12-14 09:32:52,422] Trial 204 finished with value: 0.9740453328582659 and parameters: {'left_stride': 64, 'right_stride': 128, 'attention_pooling_operation': 'mean', 'embedding_pooling_operation': 'max', 'threshold': 0.7079757412856322, 'batch_size': 38, 'attention_heads': 16, 'hidden_dimension': 85, 'number_of_hidden_layers': 3, 'dropout_rate': 0.563436917818749, 'global_pooling': 'max', 'learning_rate': 2.73542633237722e-05, 'weight_decay': 0.00033711487172411375, 'beta_0': 0.8902507695190381, 'beta_1': 0.9914223984213939, 'epsilon': 3.7748227138171897e-08, 'balanced_loss': True, 'epochs': 112, 'early_stopping_patience': 20, 'plateau_patience': 19, 'plateau_divider': 7}. Best is trial 136 with value: 0.9776229738062259.
[I 2024-12-14 10:25:09,389] Trial 205 finished with value: 0.970004832367076 and parameters: {'left_stride': 64, 'right_stride': 128, 'attention_pooling_operation': 'mean', 'embedding_pooling_operation': 'max', 'threshold': 0.7104338135148495, 'batch_size': 38, 'attention_heads': 16, 'hidden_dimension': 86, 'number_of_hidden_layers': 3, 'dropout_rate': 0.5654124803654195, 'global_pooling': 'max', 'learning_rate': 2.626632379388264e-05, 'weight_decay': 0.00031237001246663647, 'beta_0': 0.8912466293965311, 'beta_1': 0.9901119674234446, 'epsilon': 5.4062861183258194e-05, 'balanced_loss': True, 'epochs': 110, 'early_stopping_patience': 20, 'plateau_patience': 19, 'plateau_divider': 7}. Best is trial 136 with value: 0.9776229738062259.
[I 2024-12-14 11:02:44,293] Trial 206 finished with value: 0.9722332742320928 and parameters: {'left_stride': 64, 'right_stride': 128, 'attention_pooling_operation': 'mean', 'embedding_pooling_operation': 'max', 'threshold': 0.7038381857659648, 'batch_size': 32, 'attention_heads': 16, 'hidden_dimension': 81, 'number_of_hidden_layers': 3, 'dropout_rate': 0.5598127294385323, 'global_pooling': 'max', 'learning_rate': 3.333463756872118e-05, 'weight_decay': 0.0003247514672439838, 'beta_0': 0.885391849358691, 'beta_1': 0.9883465885043661, 'epsilon': 7.414406714888755e-05, 'balanced_loss': True, 'epochs': 113, 'early_stopping_patience': 20, 'plateau_patience': 19, 'plateau_divider': 7}. Best is trial 136 with value: 0.9776229738062259.
[I 2024-12-14 11:35:38,032] Trial 207 finished with value: 0.9691612035359917 and parameters: {'left_stride': 64, 'right_stride': 128, 'attention_pooling_operation': 'mean', 'embedding_pooling_operation': 'max', 'threshold': 0.7046146685733568, 'batch_size': 34, 'attention_heads': 16, 'hidden_dimension': 79, 'number_of_hidden_layers': 3, 'dropout_rate': 0.5601490907834923, 'global_pooling': 'max', 'learning_rate': 3.36115685595987e-05, 'weight_decay': 0.00033410357120382397, 'beta_0': 0.8851460004488684, 'beta_1': 0.9876630687329855, 'epsilon': 7.18063977816796e-05, 'balanced_loss': True, 'epochs': 112, 'early_stopping_patience': 20, 'plateau_patience': 19, 'plateau_divider': 7}. Best is trial 136 with value: 0.9776229738062259.
