[I 2024-12-18 15:19:05,299] Trial 45 finished with value: -1.0 and parameters: {'left_stride': 256, 'right_stride': 256, 'attention_pooling_operation': 'max', 'embedding_pooling_operation': 'min', 'threshold': 0.9022193309746344, 'batch_size': 62, 'attention_heads': 15, 'hidden_dimension': 99, 'number_of_hidden_layers': 1, 'dropout_rate': 0.33026776304029026, 'global_pooling': 'max', 'learning_rate': 0.00020641727099292764, 'weight_decay': 4.768969728318131e-06, 'beta_0': 0.8754508510530002, 'beta_1': 0.9936311989685075, 'epsilon': 9.871617325475754e-05, 'balanced_loss': False, 'epochs': 61, 'early_stopping_patience': 22, 'plateau_patience': 22, 'plateau_divider': 3}. Best is trial 40 with value: 0.9568162959944471.
CUDA out of memory. Tried to allocate 662.00 MiB. GPU 0 has a total capacity of 44.56 GiB of which 546.69 MiB is free. Including non-PyTorch memory, this process has 44.02 GiB memory in use. Of the allocated memory 42.19 GiB is allocated by PyTorch, and 693.43 MiB is reserved by PyTorch but unallocated. If reserved but unallocated memory is large try setting PYTORCH_CUDA_ALLOC_CONF=expandable_segments:True to avoid fragmentation.  See documentation for Memory Management  (https://pytorch.org/docs/stable/notes/cuda.html#environment-variables)
[I 2024-12-18 15:26:56,969] Trial 46 finished with value: -1.0 and parameters: {'left_stride': 256, 'right_stride': 256, 'attention_pooling_operation': 'max', 'embedding_pooling_operation': 'min', 'threshold': 0.7974840104399413, 'batch_size': 32, 'attention_heads': 13, 'hidden_dimension': 228, 'number_of_hidden_layers': 0, 'dropout_rate': 0.48394728978808305, 'global_pooling': 'max', 'learning_rate': 7.753965975437792e-05, 'weight_decay': 8.060019611100969e-06, 'beta_0': 0.8787793835126431, 'beta_1': 0.9916704040472804, 'epsilon': 3.6441481893298424e-05, 'balanced_loss': False, 'epochs': 77, 'early_stopping_patience': 23, 'plateau_patience': 19, 'plateau_divider': 4}. Best is trial 40 with value: 0.9568162959944471.
CUDA out of memory. Tried to allocate 2.50 GiB. GPU 0 has a total capacity of 44.56 GiB of which 1.06 GiB is free. Including non-PyTorch memory, this process has 43.49 GiB memory in use. Of the allocated memory 40.19 GiB is allocated by PyTorch, and 2.16 GiB is reserved by PyTorch but unallocated. If reserved but unallocated memory is large try setting PYTORCH_CUDA_ALLOC_CONF=expandable_segments:True to avoid fragmentation.  See documentation for Memory Management  (https://pytorch.org/docs/stable/notes/cuda.html#environment-variables)
[I 2024-12-18 15:36:22,068] Trial 47 finished with value: -1.0 and parameters: {'left_stride': 256, 'right_stride': 256, 'attention_pooling_operation': 'max', 'embedding_pooling_operation': 'min', 'threshold': 0.9279621059768717, 'batch_size': 126, 'attention_heads': 15, 'hidden_dimension': 87, 'number_of_hidden_layers': 1, 'dropout_rate': 0.38027468283142096, 'global_pooling': 'max', 'learning_rate': 2.2695526765516405e-05, 'weight_decay': 2.210023198492429e-06, 'beta_0': 0.8661367070370827, 'beta_1': 0.9901003664993316, 'epsilon': 1.1975258981710053e-05, 'balanced_loss': True, 'epochs': 92, 'early_stopping_patience': 21, 'plateau_patience': 21, 'plateau_divider': 5}. Best is trial 40 with value: 0.9568162959944471.
CUDA out of memory. Tried to allocate 1.61 GiB. GPU 0 has a total capacity of 44.56 GiB of which 882.69 MiB is free. Including non-PyTorch memory, this process has 43.69 GiB memory in use. Of the allocated memory 39.49 GiB is allocated by PyTorch, and 3.05 GiB is reserved by PyTorch but unallocated. If reserved but unallocated memory is large try setting PYTORCH_CUDA_ALLOC_CONF=expandable_segments:True to avoid fragmentation.  See documentation for Memory Management  (https://pytorch.org/docs/stable/notes/cuda.html#environment-variables)
[I 2024-12-18 15:45:26,952] Trial 48 finished with value: -1.0 and parameters: {'left_stride': 64, 'right_stride': 256, 'attention_pooling_operation': 'max', 'embedding_pooling_operation': 'min', 'threshold': 0.8391206618341164, 'batch_size': 44, 'attention_heads': 16, 'hidden_dimension': 68, 'number_of_hidden_layers': 0, 'dropout_rate': 0.4038935104813002, 'global_pooling': 'max', 'learning_rate': 0.00035132787048054904, 'weight_decay': 3.315632554497797e-06, 'beta_0': 0.8007159752103736, 'beta_1': 0.9873123585554044, 'epsilon': 4.372482462941653e-05, 'balanced_loss': False, 'epochs': 75, 'early_stopping_patience': 25, 'plateau_patience': 17, 'plateau_divider': 2}. Best is trial 40 with value: 0.9568162959944471.
CUDA out of memory. Tried to allocate 702.00 MiB. GPU 0 has a total capacity of 44.56 GiB of which 402.69 MiB is free. Including non-PyTorch memory, this process has 44.16 GiB memory in use. Of the allocated memory 42.34 GiB is allocated by PyTorch, and 683.65 MiB is reserved by PyTorch but unallocated. If reserved but unallocated memory is large try setting PYTORCH_CUDA_ALLOC_CONF=expandable_segments:True to avoid fragmentation.  See documentation for Memory Management  (https://pytorch.org/docs/stable/notes/cuda.html#environment-variables)
[I 2024-12-18 15:51:35,510] Trial 49 finished with value: -1.0 and parameters: {'left_stride': 32, 'right_stride': 256, 'attention_pooling_operation': 'min', 'embedding_pooling_operation': 'min', 'threshold': 0.7279952303073403, 'batch_size': 101, 'attention_heads': 13, 'hidden_dimension': 46, 'number_of_hidden_layers': 4, 'dropout_rate': 0.4323574732468764, 'global_pooling': 'mean', 'learning_rate': 7.621275142757395e-05, 'weight_decay': 1.4901610319939457e-06, 'beta_0': 0.8082985711350413, 'beta_1': 0.9932740390816465, 'epsilon': 2.20024402409114e-05, 'balanced_loss': False, 'epochs': 84, 'early_stopping_patience': 23, 'plateau_patience': 18, 'plateau_divider': 4}. Best is trial 40 with value: 0.9568162959944471.
CUDA out of memory. Tried to allocate 5.46 GiB. GPU 0 has a total capacity of 44.56 GiB of which 4.44 GiB is free. Including non-PyTorch memory, this process has 40.11 GiB memory in use. Of the allocated memory 37.19 GiB is allocated by PyTorch, and 1.77 GiB is reserved by PyTorch but unallocated. If reserved but unallocated memory is large try setting PYTORCH_CUDA_ALLOC_CONF=expandable_segments:True to avoid fragmentation.  See documentation for Memory Management  (https://pytorch.org/docs/stable/notes/cuda.html#environment-variables)
[I 2024-12-18 16:00:39,373] Trial 50 finished with value: -1.0 and parameters: {'left_stride': 256, 'right_stride': 256, 'attention_pooling_operation': 'max', 'embedding_pooling_operation': 'min', 'threshold': 0.865601759763067, 'batch_size': 74, 'attention_heads': 15, 'hidden_dimension': 205, 'number_of_hidden_layers': 1, 'dropout_rate': 0.47624137299407304, 'global_pooling': 'max', 'learning_rate': 4.77433498081061e-05, 'weight_decay': 7.187311098266255e-06, 'beta_0': 0.8888746887386411, 'beta_1': 0.9893902431702299, 'epsilon': 9.170917097808649e-05, 'balanced_loss': False, 'epochs': 107, 'early_stopping_patience': 21, 'plateau_patience': 23, 'plateau_divider': 4}. Best is trial 40 with value: 0.9568162959944471.
CUDA out of memory. Tried to allocate 2.51 GiB. GPU 0 has a total capacity of 44.56 GiB of which 1.17 GiB is free. Including non-PyTorch memory, this process has 43.38 GiB memory in use. Of the allocated memory 38.92 GiB is allocated by PyTorch, and 3.31 GiB is reserved by PyTorch but unallocated. If reserved but unallocated memory is large try setting PYTORCH_CUDA_ALLOC_CONF=expandable_segments:True to avoid fragmentation.  See documentation for Memory Management  (https://pytorch.org/docs/stable/notes/cuda.html#environment-variables)
[I 2024-12-18 16:11:20,771] Trial 51 finished with value: -1.0 and parameters: {'left_stride': 256, 'right_stride': 256, 'attention_pooling_operation': 'max', 'embedding_pooling_operation': 'min', 'threshold': 0.8924106476808221, 'batch_size': 44, 'attention_heads': 16, 'hidden_dimension': 84, 'number_of_hidden_layers': 0, 'dropout_rate': 0.44390706769280924, 'global_pooling': 'max', 'learning_rate': 0.00019849081792330524, 'weight_decay': 4.163483483648386e-06, 'beta_0': 0.879064255770901, 'beta_1': 0.9903025085204025, 'epsilon': 1.8989271045021023e-06, 'balanced_loss': False, 'epochs': 143, 'early_stopping_patience': 20, 'plateau_patience': 16, 'plateau_divider': 8}. Best is trial 40 with value: 0.9568162959944471.
CUDA out of memory. Tried to allocate 2.91 GiB. GPU 0 has a total capacity of 44.56 GiB of which 1.31 GiB is free. Including non-PyTorch memory, this process has 43.24 GiB memory in use. Of the allocated memory 37.49 GiB is allocated by PyTorch, and 4.60 GiB is reserved by PyTorch but unallocated. If reserved but unallocated memory is large try setting PYTORCH_CUDA_ALLOC_CONF=expandable_segments:True to avoid fragmentation.  See documentation for Memory Management  (https://pytorch.org/docs/stable/notes/cuda.html#environment-variables)
[I 2024-12-18 16:21:59,759] Trial 52 finished with value: -1.0 and parameters: {'left_stride': 128, 'right_stride': 64, 'attention_pooling_operation': 'min', 'embedding_pooling_operation': 'mean', 'threshold': 0.9103957681909902, 'batch_size': 58, 'attention_heads': 14, 'hidden_dimension': 110, 'number_of_hidden_layers': 0, 'dropout_rate': 0.4201066849566908, 'global_pooling': 'mean', 'learning_rate': 0.00037974809501346136, 'weight_decay': 2.5639070678021327e-05, 'beta_0': 0.8559141258610212, 'beta_1': 0.9919419298748423, 'epsilon': 6.98159566760094e-08, 'balanced_loss': False, 'epochs': 122, 'early_stopping_patience': 20, 'plateau_patience': 20, 'plateau_divider': 6}. Best is trial 40 with value: 0.9568162959944471.
[I 2024-12-18 16:37:16,303] Trial 53 finished with value: 0.936995242243005 and parameters: {'left_stride': 0, 'right_stride': 256, 'attention_pooling_operation': 'max', 'embedding_pooling_operation': 'min', 'threshold': 0.8930162700761926, 'batch_size': 45, 'attention_heads': 11, 'hidden_dimension': 77, 'number_of_hidden_layers': 0, 'dropout_rate': 0.5976729747728587, 'global_pooling': 'sum', 'learning_rate': 0.00011138991482925692, 'weight_decay': 1.2032756462061342e-05, 'beta_0': 0.862342213285342, 'beta_1': 0.9880334407938819, 'epsilon': 5.819436698413972e-05, 'balanced_loss': False, 'epochs': 97, 'early_stopping_patience': 22, 'plateau_patience': 16, 'plateau_divider': 7}. Best is trial 40 with value: 0.9568162959944471.
CUDA out of memory. Tried to allocate 2.68 GiB. GPU 0 has a total capacity of 44.56 GiB of which 2.04 GiB is free. Including non-PyTorch memory, this process has 42.52 GiB memory in use. Of the allocated memory 37.99 GiB is allocated by PyTorch, and 3.38 GiB is reserved by PyTorch but unallocated. If reserved but unallocated memory is large try setting PYTORCH_CUDA_ALLOC_CONF=expandable_segments:True to avoid fragmentation.  See documentation for Memory Management  (https://pytorch.org/docs/stable/notes/cuda.html#environment-variables)
[I 2024-12-18 16:48:40,358] Trial 54 finished with value: -1.0 and parameters: {'left_stride': 64, 'right_stride': 32, 'attention_pooling_operation': 'mean', 'embedding_pooling_operation': 'min', 'threshold': 0.8738805109100506, 'batch_size': 87, 'attention_heads': 14, 'hidden_dimension': 95, 'number_of_hidden_layers': 0, 'dropout_rate': 0.4494217811105718, 'global_pooling': 'max', 'learning_rate': 0.0006026270090957047, 'weight_decay': 2.480542264340894e-06, 'beta_0': 0.8678075997641136, 'beta_1': 0.9908630075816452, 'epsilon': 3.3328727646210295e-06, 'balanced_loss': False, 'epochs': 137, 'early_stopping_patience': 11, 'plateau_patience': 11, 'plateau_divider': 4}. Best is trial 40 with value: 0.9568162959944471.
[I 2024-12-18 17:11:35,298] Trial 55 finished with value: 0.9297728809298424 and parameters: {'left_stride': 0, 'right_stride': 0, 'attention_pooling_operation': 'max', 'embedding_pooling_operation': 'mean', 'threshold': 0.9312819196192433, 'batch_size': 67, 'attention_heads': 16, 'hidden_dimension': 80, 'number_of_hidden_layers': 1, 'dropout_rate': 0.4947677287195525, 'global_pooling': 'sum', 'learning_rate': 1.1977488823465632e-05, 'weight_decay': 1.2384821719223173e-06, 'beta_0': 0.8541434270274341, 'beta_1': 0.994091366388261, 'epsilon': 6.918771426508608e-06, 'balanced_loss': False, 'epochs': 108, 'early_stopping_patience': 21, 'plateau_patience': 17, 'plateau_divider': 5}. Best is trial 40 with value: 0.9568162959944471.
[I 2024-12-18 17:28:10,447] Trial 56 finished with value: 0.9682403888722344 and parameters: {'left_stride': 32, 'right_stride': 256, 'attention_pooling_operation': 'mean', 'embedding_pooling_operation': 'min', 'threshold': 0.9513398866560276, 'batch_size': 152, 'attention_heads': 15, 'hidden_dimension': 144, 'number_of_hidden_layers': 0, 'dropout_rate': 0.42836394745605977, 'global_pooling': 'sum', 'learning_rate': 0.0002976881660738593, 'weight_decay': 6.3223820213965085e-06, 'beta_0': 0.8357432460308338, 'beta_1': 0.9811900582045325, 'epsilon': 1.7765707792660108e-07, 'balanced_loss': False, 'epochs': 132, 'early_stopping_patience': 19, 'plateau_patience': 13, 'plateau_divider': 6}. Best is trial 56 with value: 0.9682403888722344.
[I 2024-12-18 17:49:01,294] Trial 57 finished with value: 0.9010297214146964 and parameters: {'left_stride': 32, 'right_stride': 256, 'attention_pooling_operation': 'mean', 'embedding_pooling_operation': 'min', 'threshold': 0.9846343143341288, 'batch_size': 172, 'attention_heads': 15, 'hidden_dimension': 146, 'number_of_hidden_layers': 3, 'dropout_rate': 0.3978193023151379, 'global_pooling': 'max', 'learning_rate': 0.000318701961778627, 'weight_decay': 3.4227151907413136e-06, 'beta_0': 0.8157517509545821, 'beta_1': 0.9863244766764323, 'epsilon': 1.6165299714897625e-07, 'balanced_loss': False, 'epochs': 133, 'early_stopping_patience': 19, 'plateau_patience': 14, 'plateau_divider': 2}. Best is trial 56 with value: 0.9682403888722344.
CUDA out of memory. Tried to allocate 2.24 GiB. GPU 0 has a total capacity of 44.56 GiB of which 908.69 MiB is free. Including non-PyTorch memory, this process has 43.67 GiB memory in use. Of the allocated memory 40.89 GiB is allocated by PyTorch, and 1.63 GiB is reserved by PyTorch but unallocated. If reserved but unallocated memory is large try setting PYTORCH_CUDA_ALLOC_CONF=expandable_segments:True to avoid fragmentation.  See documentation for Memory Management  (https://pytorch.org/docs/stable/notes/cuda.html#environment-variables)
[I 2024-12-18 17:57:54,074] Trial 58 finished with value: -1.0 and parameters: {'left_stride': 32, 'right_stride': 256, 'attention_pooling_operation': 'max', 'embedding_pooling_operation': 'min', 'threshold': 0.9512820736279414, 'batch_size': 152, 'attention_heads': 13, 'hidden_dimension': 171, 'number_of_hidden_layers': 2, 'dropout_rate': 0.4281384554944816, 'global_pooling': 'sum', 'learning_rate': 0.00010048717678802071, 'weight_decay': 5.513047275004474e-06, 'beta_0': 0.8231616467452809, 'beta_1': 0.98245877267087, 'epsilon': 3.814796350429645e-07, 'balanced_loss': True, 'epochs': 146, 'early_stopping_patience': 23, 'plateau_patience': 18, 'plateau_divider': 3}. Best is trial 56 with value: 0.9682403888722344.
CUDA out of memory. Tried to allocate 3.05 GiB. GPU 0 has a total capacity of 44.56 GiB of which 2.53 GiB is free. Including non-PyTorch memory, this process has 42.03 GiB memory in use. Of the allocated memory 38.56 GiB is allocated by PyTorch, and 2.32 GiB is reserved by PyTorch but unallocated. If reserved but unallocated memory is large try setting PYTORCH_CUDA_ALLOC_CONF=expandable_segments:True to avoid fragmentation.  See documentation for Memory Management  (https://pytorch.org/docs/stable/notes/cuda.html#environment-variables)
[I 2024-12-18 18:09:05,036] Trial 59 finished with value: -1.0 and parameters: {'left_stride': 32, 'right_stride': 256, 'attention_pooling_operation': 'min', 'embedding_pooling_operation': 'min', 'threshold': 0.962085448269658, 'batch_size': 190, 'attention_heads': 10, 'hidden_dimension': 185, 'number_of_hidden_layers': 1, 'dropout_rate': 0.41025848269387927, 'global_pooling': 'mean', 'learning_rate': 0.00017737987790162417, 'weight_decay': 1.3073323716757222e-05, 'beta_0': 0.811226458179905, 'beta_1': 0.9809192573242826, 'epsilon': 9.817617595841197e-08, 'balanced_loss': False, 'epochs': 154, 'early_stopping_patience': 22, 'plateau_patience': 15, 'plateau_divider': 3}. Best is trial 56 with value: 0.9682403888722344.
[I 2024-12-18 18:21:28,091] Trial 60 finished with value: 0.914653277906994 and parameters: {'left_stride': 32, 'right_stride': 256, 'attention_pooling_operation': 'mean', 'embedding_pooling_operation': 'min', 'threshold': 0.9955849451206114, 'batch_size': 155, 'attention_heads': 16, 'hidden_dimension': 136, 'number_of_hidden_layers': 0, 'dropout_rate': 0.384844249591743, 'global_pooling': 'sum', 'learning_rate': 0.00046061693080757263, 'weight_decay': 9.862354477479913e-06, 'beta_0': 0.8343610801258494, 'beta_1': 0.9945381761906825, 'epsilon': 5.947606982747762e-08, 'balanced_loss': False, 'epochs': 95, 'early_stopping_patience': 19, 'plateau_patience': 20, 'plateau_divider': 6}. Best is trial 56 with value: 0.9682403888722344.
[I 2024-12-18 18:36:41,335] Trial 61 finished with value: 0.954493805084587 and parameters: {'left_stride': 0, 'right_stride': 64, 'attention_pooling_operation': 'mean', 'embedding_pooling_operation': 'min', 'threshold': 0.9340415567271726, 'batch_size': 38, 'attention_heads': 15, 'hidden_dimension': 66, 'number_of_hidden_layers': 0, 'dropout_rate': 0.4373675089294868, 'global_pooling': 'sum', 'learning_rate': 0.00016159770534001527, 'weight_decay': 6.193928047290109e-06, 'beta_0': 0.8825639930341282, 'beta_1': 0.9949225957776715, 'epsilon': 5.827588851122287e-07, 'balanced_loss': False, 'epochs': 121, 'early_stopping_patience': 20, 'plateau_patience': 13, 'plateau_divider': 7}. Best is trial 56 with value: 0.9682403888722344.
[I 2024-12-18 18:53:17,996] Trial 62 finished with value: 0.923382826101139 and parameters: {'left_stride': 256, 'right_stride': 64, 'attention_pooling_operation': 'mean', 'embedding_pooling_operation': 'min', 'threshold': 0.9378029557803876, 'batch_size': 135, 'attention_heads': 15, 'hidden_dimension': 67, 'number_of_hidden_layers': 0, 'dropout_rate': 0.45912176411631433, 'global_pooling': 'sum', 'learning_rate': 4.997327356575639e-05, 'weight_decay': 5.852441979744064e-06, 'beta_0': 0.8893725814371677, 'beta_1': 0.9950713395834502, 'epsilon': 2.401927169841198e-07, 'balanced_loss': False, 'epochs': 117, 'early_stopping_patience': 21, 'plateau_patience': 11, 'plateau_divider': 8}. Best is trial 56 with value: 0.9682403888722344.
[I 2024-12-18 19:09:11,707] Trial 63 finished with value: 0.9482935485063222 and parameters: {'left_stride': 0, 'right_stride': 64, 'attention_pooling_operation': 'mean', 'embedding_pooling_operation': 'min', 'threshold': 0.914880859252985, 'batch_size': 40, 'attention_heads': 14, 'hidden_dimension': 103, 'number_of_hidden_layers': 0, 'dropout_rate': 0.4369869017247296, 'global_pooling': 'sum', 'learning_rate': 0.00026777893798158995, 'weight_decay': 6.751227781062196e-06, 'beta_0': 0.8833055584369568, 'beta_1': 0.9928694091216517, 'epsilon': 3.2770837707572364e-07, 'balanced_loss': False, 'epochs': 134, 'early_stopping_patience': 20, 'plateau_patience': 13, 'plateau_divider': 6}. Best is trial 56 with value: 0.9682403888722344.
CUDA out of memory. Tried to allocate 2.13 GiB. GPU 0 has a total capacity of 44.56 GiB of which 2.11 GiB is free. Including non-PyTorch memory, this process has 42.44 GiB memory in use. Of the allocated memory 36.39 GiB is allocated by PyTorch, and 4.90 GiB is reserved by PyTorch but unallocated. If reserved but unallocated memory is large try setting PYTORCH_CUDA_ALLOC_CONF=expandable_segments:True to avoid fragmentation.  See documentation for Memory Management  (https://pytorch.org/docs/stable/notes/cuda.html#environment-variables)
[I 2024-12-18 19:20:24,890] Trial 64 finished with value: -1.0 and parameters: {'left_stride': 0, 'right_stride': 64, 'attention_pooling_operation': 'mean', 'embedding_pooling_operation': 'min', 'threshold': 0.8989230843733507, 'batch_size': 244, 'attention_heads': 16, 'hidden_dimension': 32, 'number_of_hidden_layers': 0, 'dropout_rate': 0.4206737410667691, 'global_pooling': 'sum', 'learning_rate': 0.00016116020060977395, 'weight_decay': 3.8689073786105005e-06, 'beta_0': 0.8756550277287977, 'beta_1': 0.9949475077570206, 'epsilon': 5.637924562360637e-07, 'balanced_loss': False, 'epochs': 89, 'early_stopping_patience': 17, 'plateau_patience': 17, 'plateau_divider': 7}. Best is trial 56 with value: 0.9682403888722344.
[I 2024-12-18 19:37:03,561] Trial 65 finished with value: 0.9191568639340186 and parameters: {'left_stride': 0, 'right_stride': 64, 'attention_pooling_operation': 'mean', 'embedding_pooling_operation': 'min', 'threshold': 0.9274588507731321, 'batch_size': 217, 'attention_heads': 15, 'hidden_dimension': 52, 'number_of_hidden_layers': 0, 'dropout_rate': 0.4390458343742752, 'global_pooling': 'sum', 'learning_rate': 0.0002487646990154992, 'weight_decay': 1.8199046739833528e-06, 'beta_0': 0.8990668569329813, 'beta_1': 0.9963838097210417, 'epsilon': 1.2013524615590827e-07, 'balanced_loss': False, 'epochs': 126, 'early_stopping_patience': 21, 'plateau_patience': 10, 'plateau_divider': 8}. Best is trial 56 with value: 0.9682403888722344.
