[I 2024-12-13 03:36:47,917] Using an existing study with name 'R8-GATv2-facebook-bart-large-Grouped-No_Aggregation' instead of creating a new one.
Token indices sequence length is longer than the specified maximum sequence length for this model (1136 > 1024). Running this sequence through the model will result in indexing errors
[I 2024-12-13 04:29:20,006] Trial 157 finished with value: 0.9731955490254465 and parameters: {'left_stride': 64, 'right_stride': 128, 'attention_pooling_operation': 'mean', 'embedding_pooling_operation': 'max', 'threshold': 0.731328311995955, 'batch_size': 45, 'attention_heads': 16, 'hidden_dimension': 87, 'number_of_hidden_layers': 3, 'dropout_rate': 0.5018809362025403, 'global_pooling': 'max', 'learning_rate': 2.4168344948366003e-05, 'weight_decay': 0.0003376765818509857, 'beta_0': 0.8810583119571513, 'beta_1': 0.9830714288439099, 'epsilon': 5.593125643643233e-05, 'balanced_loss': True, 'epochs': 131, 'early_stopping_patience': 21, 'plateau_patience': 19, 'plateau_divider': 7}. Best is trial 136 with value: 0.9776229738062259.
[I 2024-12-13 05:21:55,153] Trial 158 finished with value: 0.9558562974359028 and parameters: {'left_stride': 64, 'right_stride': 128, 'attention_pooling_operation': 'mean', 'embedding_pooling_operation': 'max', 'threshold': 0.7287452004519488, 'batch_size': 32, 'attention_heads': 16, 'hidden_dimension': 86, 'number_of_hidden_layers': 3, 'dropout_rate': 0.5026415458243065, 'global_pooling': 'max', 'learning_rate': 1.5198350937197841e-05, 'weight_decay': 5.01466913683294e-06, 'beta_0': 0.8795504996801968, 'beta_1': 0.9829880087017271, 'epsilon': 7.715772819528068e-05, 'balanced_loss': True, 'epochs': 131, 'early_stopping_patience': 20, 'plateau_patience': 20, 'plateau_divider': 7}. Best is trial 136 with value: 0.9776229738062259.
[I 2024-12-13 06:07:42,104] Trial 159 finished with value: 0.9594538087096989 and parameters: {'left_stride': 64, 'right_stride': 128, 'attention_pooling_operation': 'mean', 'embedding_pooling_operation': 'max', 'threshold': 0.7561204397098111, 'batch_size': 45, 'attention_heads': 16, 'hidden_dimension': 92, 'number_of_hidden_layers': 3, 'dropout_rate': 0.51719710069565, 'global_pooling': 'max', 'learning_rate': 2.5197501794078494e-05, 'weight_decay': 0.0005216669923731372, 'beta_0': 0.8831224251261586, 'beta_1': 0.9831867169565033, 'epsilon': 3.084219777985862e-05, 'balanced_loss': True, 'epochs': 125, 'early_stopping_patience': 21, 'plateau_patience': 19, 'plateau_divider': 7}. Best is trial 136 with value: 0.9776229738062259.
[I 2024-12-13 06:41:51,850] Trial 160 finished with value: 0.9677654556171902 and parameters: {'left_stride': 64, 'right_stride': 128, 'attention_pooling_operation': 'mean', 'embedding_pooling_operation': 'max', 'threshold': 0.7337937911645874, 'batch_size': 50, 'attention_heads': 16, 'hidden_dimension': 78, 'number_of_hidden_layers': 3, 'dropout_rate': 0.4984665509048571, 'global_pooling': 'max', 'learning_rate': 3.517185041783741e-05, 'weight_decay': 0.0003947969186174462, 'beta_0': 0.8805863463806045, 'beta_1': 0.9826550504195215, 'epsilon': 5.978547306171671e-05, 'balanced_loss': True, 'epochs': 134, 'early_stopping_patience': 21, 'plateau_patience': 19, 'plateau_divider': 7}. Best is trial 136 with value: 0.9776229738062259.
[I 2024-12-13 07:35:05,634] Trial 161 finished with value: 0.9703486052335285 and parameters: {'left_stride': 64, 'right_stride': 128, 'attention_pooling_operation': 'mean', 'embedding_pooling_operation': 'max', 'threshold': 0.723218465620431, 'batch_size': 39, 'attention_heads': 16, 'hidden_dimension': 87, 'number_of_hidden_layers': 3, 'dropout_rate': 0.5122512714964786, 'global_pooling': 'max', 'learning_rate': 2.0901721423085176e-05, 'weight_decay': 0.00024174960709848548, 'beta_0': 0.8895105046878622, 'beta_1': 0.982326319781738, 'epsilon': 5.339122880566654e-05, 'balanced_loss': True, 'epochs': 119, 'early_stopping_patience': 21, 'plateau_patience': 18, 'plateau_divider': 7}. Best is trial 136 with value: 0.9776229738062259.
CUDA out of memory. Tried to allocate 1.60 GiB. GPU 0 has a total capacity of 44.56 GiB of which 1.05 GiB is free. Including non-PyTorch memory, this process has 43.50 GiB memory in use. Of the allocated memory 40.55 GiB is allocated by PyTorch, and 1.80 GiB is reserved by PyTorch but unallocated. If reserved but unallocated memory is large try setting PYTORCH_CUDA_ALLOC_CONF=expandable_segments:True to avoid fragmentation.  See documentation for Memory Management  (https://pytorch.org/docs/stable/notes/cuda.html#environment-variables)
[I 2024-12-13 07:58:45,060] Trial 162 finished with value: -1.0 and parameters: {'left_stride': 64, 'right_stride': 0, 'attention_pooling_operation': 'mean', 'embedding_pooling_operation': 'max', 'threshold': 0.7217280878717227, 'batch_size': 38, 'attention_heads': 16, 'hidden_dimension': 105, 'number_of_hidden_layers': 3, 'dropout_rate': 0.4897600308443242, 'global_pooling': 'max', 'learning_rate': 2.1314826572061105e-05, 'weight_decay': 0.00025024598762270244, 'beta_0': 0.8959012300320476, 'beta_1': 0.9822158360729343, 'epsilon': 5.187817093851914e-05, 'balanced_loss': True, 'epochs': 119, 'early_stopping_patience': 21, 'plateau_patience': 20, 'plateau_divider': 7}. Best is trial 136 with value: 0.9776229738062259.
[I 2024-12-13 08:28:15,160] Trial 163 finished with value: 0.9196184900443225 and parameters: {'left_stride': 64, 'right_stride': 128, 'attention_pooling_operation': 'mean', 'embedding_pooling_operation': 'max', 'threshold': 0.7416432516391221, 'batch_size': 36, 'attention_heads': 16, 'hidden_dimension': 90, 'number_of_hidden_layers': 3, 'dropout_rate': 0.5086831320888018, 'global_pooling': 'sum', 'learning_rate': 2.9612905853291615e-05, 'weight_decay': 0.0004720115458831066, 'beta_0': 0.8894479091729104, 'beta_1': 0.9818637752892607, 'epsilon': 3.9543163932738346e-05, 'balanced_loss': True, 'epochs': 116, 'early_stopping_patience': 20, 'plateau_patience': 21, 'plateau_divider': 7}. Best is trial 136 with value: 0.9776229738062259.
CUDA out of memory. Tried to allocate 1.48 GiB. GPU 0 has a total capacity of 44.56 GiB of which 1.36 GiB is free. Including non-PyTorch memory, this process has 43.20 GiB memory in use. Of the allocated memory 38.64 GiB is allocated by PyTorch, and 3.41 GiB is reserved by PyTorch but unallocated. If reserved but unallocated memory is large try setting PYTORCH_CUDA_ALLOC_CONF=expandable_segments:True to avoid fragmentation.  See documentation for Memory Management  (https://pytorch.org/docs/stable/notes/cuda.html#environment-variables)
[I 2024-12-13 08:57:32,036] Trial 164 finished with value: -1.0 and parameters: {'left_stride': 64, 'right_stride': 128, 'attention_pooling_operation': 'mean', 'embedding_pooling_operation': 'min', 'threshold': 0.7270029097809396, 'batch_size': 48, 'attention_heads': 16, 'hidden_dimension': 80, 'number_of_hidden_layers': 3, 'dropout_rate': 0.512259539211085, 'global_pooling': 'max', 'learning_rate': 1.797270667931637e-05, 'weight_decay': 0.0008055077002341198, 'beta_0': 0.8847415687613666, 'beta_1': 0.9807589747611501, 'epsilon': 6.60424023357005e-05, 'balanced_loss': False, 'epochs': 110, 'early_stopping_patience': 20, 'plateau_patience': 18, 'plateau_divider': 7}. Best is trial 136 with value: 0.9776229738062259.
[I 2024-12-13 09:51:41,175] Trial 165 finished with value: 0.9680342321651483 and parameters: {'left_stride': 64, 'right_stride': 128, 'attention_pooling_operation': 'mean', 'embedding_pooling_operation': 'max', 'threshold': 0.7353545099949452, 'batch_size': 41, 'attention_heads': 16, 'hidden_dimension': 87, 'number_of_hidden_layers': 3, 'dropout_rate': 0.520458924744511, 'global_pooling': 'max', 'learning_rate': 1.2792890036794696e-05, 'weight_decay': 0.00035829935764186867, 'beta_0': 0.8898119061794438, 'beta_1': 0.9828060590119151, 'epsilon': 3.319009823849422e-05, 'balanced_loss': True, 'epochs': 123, 'early_stopping_patience': 22, 'plateau_patience': 18, 'plateau_divider': 7}. Best is trial 136 with value: 0.9776229738062259.
[I 2024-12-13 10:42:53,299] Trial 166 finished with value: 0.9641400617739181 and parameters: {'left_stride': 64, 'right_stride': 128, 'attention_pooling_operation': 'mean', 'embedding_pooling_operation': 'max', 'threshold': 0.749979644282567, 'batch_size': 41, 'attention_heads': 16, 'hidden_dimension': 96, 'number_of_hidden_layers': 3, 'dropout_rate': 0.528887749004224, 'global_pooling': 'max', 'learning_rate': 2.237330672137634e-05, 'weight_decay': 0.0004371928228538706, 'beta_0': 0.8861952601804858, 'beta_1': 0.9833245342143049, 'epsilon': 2.5999236618883388e-05, 'balanced_loss': True, 'epochs': 128, 'early_stopping_patience': 21, 'plateau_patience': 18, 'plateau_divider': 7}. Best is trial 136 with value: 0.9776229738062259.
[I 2024-12-13 11:28:49,100] Trial 167 finished with value: 0.9676066275782451 and parameters: {'left_stride': 64, 'right_stride': 128, 'attention_pooling_operation': 'mean', 'embedding_pooling_operation': 'max', 'threshold': 0.7195525403130558, 'batch_size': 32, 'attention_heads': 15, 'hidden_dimension': 84, 'number_of_hidden_layers': 3, 'dropout_rate': 0.5248687373668788, 'global_pooling': 'max', 'learning_rate': 1.589080717468357e-05, 'weight_decay': 0.0003241612287219038, 'beta_0': 0.8929491104239211, 'beta_1': 0.9823231447431888, 'epsilon': 5.2487172316927445e-05, 'balanced_loss': True, 'epochs': 106, 'early_stopping_patience': 22, 'plateau_patience': 19, 'plateau_divider': 7}. Best is trial 136 with value: 0.9776229738062259.
[I 2024-12-13 12:12:55,297] Trial 168 finished with value: 0.9725340542621326 and parameters: {'left_stride': 64, 'right_stride': 128, 'attention_pooling_operation': 'mean', 'embedding_pooling_operation': 'max', 'threshold': 0.7264627241361429, 'batch_size': 46, 'attention_heads': 16, 'hidden_dimension': 72, 'number_of_hidden_layers': 3, 'dropout_rate': 0.5393307310534049, 'global_pooling': 'max', 'learning_rate': 2.649454173130447e-05, 'weight_decay': 0.0002342264312421746, 'beta_0': 0.882288808700663, 'beta_1': 0.9829154756969366, 'epsilon': 8.062140762303657e-05, 'balanced_loss': True, 'epochs': 113, 'early_stopping_patience': 21, 'plateau_patience': 19, 'plateau_divider': 7}. Best is trial 136 with value: 0.9776229738062259.
[I 2024-12-13 12:46:21,063] Trial 169 finished with value: 0.9620183801013551 and parameters: {'left_stride': 64, 'right_stride': 128, 'attention_pooling_operation': 'mean', 'embedding_pooling_operation': 'max', 'threshold': 0.7267509932415033, 'batch_size': 53, 'attention_heads': 16, 'hidden_dimension': 73, 'number_of_hidden_layers': 3, 'dropout_rate': 0.5374253456969618, 'global_pooling': 'max', 'learning_rate': 3.856170271455447e-05, 'weight_decay': 0.00023243291317572108, 'beta_0': 0.8823488307583951, 'beta_1': 0.9813688388199665, 'epsilon': 7.822067457316627e-05, 'balanced_loss': True, 'epochs': 113, 'early_stopping_patience': 21, 'plateau_patience': 19, 'plateau_divider': 7}. Best is trial 136 with value: 0.9776229738062259.
[I 2024-12-13 13:31:10,720] Trial 170 finished with value: 0.9680026508621737 and parameters: {'left_stride': 64, 'right_stride': 64, 'attention_pooling_operation': 'mean', 'embedding_pooling_operation': 'max', 'threshold': 0.7423412016189542, 'batch_size': 47, 'attention_heads': 16, 'hidden_dimension': 76, 'number_of_hidden_layers': 3, 'dropout_rate': 0.5071522531915337, 'global_pooling': 'max', 'learning_rate': 2.7072718931305107e-05, 'weight_decay': 0.00022103119695273752, 'beta_0': 0.8841288467272427, 'beta_1': 0.9825535381957529, 'epsilon': 4.112043455661176e-05, 'balanced_loss': True, 'epochs': 121, 'early_stopping_patience': 22, 'plateau_patience': 19, 'plateau_divider': 7}. Best is trial 136 with value: 0.9776229738062259.
[I 2024-12-13 14:19:21,805] Trial 171 finished with value: 0.9720300407958298 and parameters: {'left_stride': 64, 'right_stride': 128, 'attention_pooling_operation': 'mean', 'embedding_pooling_operation': 'max', 'threshold': 0.7341368888534119, 'batch_size': 38, 'attention_heads': 16, 'hidden_dimension': 83, 'number_of_hidden_layers': 3, 'dropout_rate': 0.5505316846142411, 'global_pooling': 'max', 'learning_rate': 2.2218713365280085e-05, 'weight_decay': 0.0003479498311284227, 'beta_0': 0.8762988624913958, 'beta_1': 0.9818561690447255, 'epsilon': 6.178933333846046e-05, 'balanced_loss': True, 'epochs': 110, 'early_stopping_patience': 21, 'plateau_patience': 20, 'plateau_divider': 7}. Best is trial 136 with value: 0.9776229738062259.
[I 2024-12-13 15:01:00,836] Trial 172 finished with value: 0.9576279277645297 and parameters: {'left_stride': 64, 'right_stride': 128, 'attention_pooling_operation': 'mean', 'embedding_pooling_operation': 'max', 'threshold': 0.7178014207683767, 'batch_size': 59, 'attention_heads': 16, 'hidden_dimension': 68, 'number_of_hidden_layers': 3, 'dropout_rate': 0.5510731502374154, 'global_pooling': 'max', 'learning_rate': 3.0519674324799006e-05, 'weight_decay': 0.0003061642231699742, 'beta_0': 0.8796930694500932, 'beta_1': 0.9818221269047632, 'epsilon': 8.760381275300497e-05, 'balanced_loss': True, 'epochs': 109, 'early_stopping_patience': 21, 'plateau_patience': 20, 'plateau_divider': 7}. Best is trial 136 with value: 0.9776229738062259.
[I 2024-12-13 15:50:38,218] Trial 173 finished with value: 0.9672776506917252 and parameters: {'left_stride': 64, 'right_stride': 128, 'attention_pooling_operation': 'mean', 'embedding_pooling_operation': 'max', 'threshold': 0.7351666604315634, 'batch_size': 45, 'attention_heads': 15, 'hidden_dimension': 90, 'number_of_hidden_layers': 3, 'dropout_rate': 0.5450575240312585, 'global_pooling': 'max', 'learning_rate': 2.42203690012286e-05, 'weight_decay': 0.00027495262203196984, 'beta_0': 0.8758125654465966, 'beta_1': 0.9829880154381924, 'epsilon': 6.020824733236881e-05, 'balanced_loss': True, 'epochs': 130, 'early_stopping_patience': 19, 'plateau_patience': 21, 'plateau_divider': 7}. Best is trial 136 with value: 0.9776229738062259.
[I 2024-12-13 16:20:48,756] Trial 174 finished with value: 0.9617429559774329 and parameters: {'left_stride': 64, 'right_stride': 128, 'attention_pooling_operation': 'mean', 'embedding_pooling_operation': 'max', 'threshold': 0.7219753838265963, 'batch_size': 36, 'attention_heads': 16, 'hidden_dimension': 81, 'number_of_hidden_layers': 3, 'dropout_rate': 0.5005498249700105, 'global_pooling': 'max', 'learning_rate': 4.232915942167887e-05, 'weight_decay': 0.0001570581483768154, 'beta_0': 0.8769650398757325, 'beta_1': 0.9811392639523036, 'epsilon': 6.927991993809496e-05, 'balanced_loss': True, 'epochs': 112, 'early_stopping_patience': 20, 'plateau_patience': 20, 'plateau_divider': 7}. Best is trial 136 with value: 0.9776229738062259.
[I 2024-12-13 17:07:50,569] Trial 175 finished with value: 0.9721544045249723 and parameters: {'left_stride': 64, 'right_stride': 128, 'attention_pooling_operation': 'mean', 'embedding_pooling_operation': 'max', 'threshold': 0.7285060825037419, 'batch_size': 39, 'attention_heads': 16, 'hidden_dimension': 83, 'number_of_hidden_layers': 3, 'dropout_rate': 0.5374138653693026, 'global_pooling': 'max', 'learning_rate': 1.914673973634674e-05, 'weight_decay': 0.0002144301473645164, 'beta_0': 0.8883528263353817, 'beta_1': 0.9822273629067506, 'epsilon': 4.883741484407919e-05, 'balanced_loss': True, 'epochs': 118, 'early_stopping_patience': 21, 'plateau_patience': 19, 'plateau_divider': 7}. Best is trial 136 with value: 0.9776229738062259.
[I 2024-12-13 17:54:31,167] Trial 176 finished with value: 0.9635857949350056 and parameters: {'left_stride': 64, 'right_stride': 128, 'attention_pooling_operation': 'mean', 'embedding_pooling_operation': 'max', 'threshold': 0.7311322638819701, 'batch_size': 40, 'attention_heads': 16, 'hidden_dimension': 74, 'number_of_hidden_layers': 3, 'dropout_rate': 0.5501532378890178, 'global_pooling': 'max', 'learning_rate': 1.7379180951177095e-05, 'weight_decay': 0.0002249878503294487, 'beta_0': 0.8876432791949838, 'beta_1': 0.9815160565425488, 'epsilon': 4.912111130867846e-05, 'balanced_loss': True, 'epochs': 119, 'early_stopping_patience': 21, 'plateau_patience': 19, 'plateau_divider': 7}. Best is trial 136 with value: 0.9776229738062259.
[I 2024-12-13 18:32:49,488] Trial 177 finished with value: 0.9676748751884032 and parameters: {'left_stride': 64, 'right_stride': 128, 'attention_pooling_operation': 'mean', 'embedding_pooling_operation': 'max', 'threshold': 0.7392485948596379, 'batch_size': 32, 'attention_heads': 16, 'hidden_dimension': 87, 'number_of_hidden_layers': 3, 'dropout_rate': 0.5403764648682916, 'global_pooling': 'max', 'learning_rate': 2.486886199840295e-05, 'weight_decay': 0.0003496857412116781, 'beta_0': 0.8852005140715571, 'beta_1': 0.9825948313240422, 'epsilon': 9.51751269952345e-05, 'balanced_loss': True, 'epochs': 125, 'early_stopping_patience': 21, 'plateau_patience': 18, 'plateau_divider': 7}. Best is trial 136 with value: 0.9776229738062259.
[I 2024-12-13 19:20:50,572] Trial 178 finished with value: 0.9730700877712943 and parameters: {'left_stride': 64, 'right_stride': 128, 'attention_pooling_operation': 'mean', 'embedding_pooling_operation': 'max', 'threshold': 0.7085177395699387, 'batch_size': 45, 'attention_heads': 16, 'hidden_dimension': 79, 'number_of_hidden_layers': 3, 'dropout_rate': 0.5578754081100565, 'global_pooling': 'max', 'learning_rate': 2.2175312032854826e-05, 'weight_decay': 0.00020593787357474095, 'beta_0': 0.8835361131646496, 'beta_1': 0.9840085463227763, 'epsilon': 3.9248277295306143e-05, 'balanced_loss': True, 'epochs': 115, 'early_stopping_patience': 20, 'plateau_patience': 21, 'plateau_divider': 7}. Best is trial 136 with value: 0.9776229738062259.
CUDA out of memory. Tried to allocate 1.58 GiB. GPU 0 has a total capacity of 44.56 GiB of which 322.69 MiB is free. Including non-PyTorch memory, this process has 44.24 GiB memory in use. Of the allocated memory 40.85 GiB is allocated by PyTorch, and 2.24 GiB is reserved by PyTorch but unallocated. If reserved but unallocated memory is large try setting PYTORCH_CUDA_ALLOC_CONF=expandable_segments:True to avoid fragmentation.  See documentation for Memory Management  (https://pytorch.org/docs/stable/notes/cuda.html#environment-variables)
[I 2024-12-13 19:31:24,643] Trial 179 finished with value: -1.0 and parameters: {'left_stride': 64, 'right_stride': 128, 'attention_pooling_operation': 'min', 'embedding_pooling_operation': 'max', 'threshold': 0.7086910006734918, 'batch_size': 52, 'attention_heads': 16, 'hidden_dimension': 78, 'number_of_hidden_layers': 3, 'dropout_rate': 0.5585896624498353, 'global_pooling': 'max', 'learning_rate': 1.007271824809071e-05, 'weight_decay': 0.00020092771153395236, 'beta_0': 0.8825306199205031, 'beta_1': 0.9819188084691525, 'epsilon': 5.6555676242935885e-05, 'balanced_loss': True, 'epochs': 122, 'early_stopping_patience': 20, 'plateau_patience': 21, 'plateau_divider': 7}. Best is trial 136 with value: 0.9776229738062259.
[I 2024-12-13 19:59:46,648] Trial 180 finished with value: 0.9630430635503832 and parameters: {'left_stride': 64, 'right_stride': 128, 'attention_pooling_operation': 'mean', 'embedding_pooling_operation': 'max', 'threshold': 0.7170201411878443, 'batch_size': 48, 'attention_heads': 15, 'hidden_dimension': 71, 'number_of_hidden_layers': 3, 'dropout_rate': 0.3567462754747118, 'global_pooling': 'max', 'learning_rate': 3.430377042811315e-05, 'weight_decay': 0.00016792289945301094, 'beta_0': 0.8802226463988689, 'beta_1': 0.9825193116756661, 'epsilon': 4.347615383003542e-05, 'balanced_loss': True, 'epochs': 106, 'early_stopping_patience': 20, 'plateau_patience': 20, 'plateau_divider': 7}. Best is trial 136 with value: 0.9776229738062259.
[I 2024-12-13 20:51:02,542] Trial 181 finished with value: 0.9716165540548679 and parameters: {'left_stride': 64, 'right_stride': 128, 'attention_pooling_operation': 'mean', 'embedding_pooling_operation': 'max', 'threshold': 0.7102745752861851, 'batch_size': 44, 'attention_heads': 15, 'hidden_dimension': 93, 'number_of_hidden_layers': 3, 'dropout_rate': 0.5565560606929593, 'global_pooling': 'max', 'learning_rate': 2.227895362241311e-05, 'weight_decay': 0.0004700622060393157, 'beta_0': 0.8838826008550401, 'beta_1': 0.994985148398215, 'epsilon': 7.257570743855903e-05, 'balanced_loss': True, 'epochs': 136, 'early_stopping_patience': 21, 'plateau_patience': 20, 'plateau_divider': 7}. Best is trial 136 with value: 0.9776229738062259.
CUDA out of memory. Tried to allocate 1.47 GiB. GPU 0 has a total capacity of 44.56 GiB of which 1.32 GiB is free. Including non-PyTorch memory, this process has 43.24 GiB memory in use. Of the allocated memory 39.33 GiB is allocated by PyTorch, and 2.76 GiB is reserved by PyTorch but unallocated. If reserved but unallocated memory is large try setting PYTORCH_CUDA_ALLOC_CONF=expandable_segments:True to avoid fragmentation.  See documentation for Memory Management  (https://pytorch.org/docs/stable/notes/cuda.html#environment-variables)
