[I 2024-12-18 19:55:19,515] Trial 66 finished with value: 0.910539957037051 and parameters: {'left_stride': 32, 'right_stride': 256, 'attention_pooling_operation': 'mean', 'embedding_pooling_operation': 'mean', 'threshold': 0.944194258341522, 'batch_size': 59, 'attention_heads': 12, 'hidden_dimension': 65, 'number_of_hidden_layers': 1, 'dropout_rate': 0.4591699153862068, 'global_pooling': 'sum', 'learning_rate': 3.41951458621076e-05, 'weight_decay': 9.709111410822496e-06, 'beta_0': 0.894088871231821, 'beta_1': 0.9933922430180674, 'epsilon': 3.976441343570728e-08, 'balanced_loss': False, 'epochs': 79, 'early_stopping_patience': 24, 'plateau_patience': 14, 'plateau_divider': 5}. Best is trial 56 with value: 0.9682403888722344.
[I 2024-12-18 20:09:21,365] Trial 67 finished with value: 0.9472902034416866 and parameters: {'left_stride': 128, 'right_stride': 32, 'attention_pooling_operation': 'mean', 'embedding_pooling_operation': 'min', 'threshold': 0.9674560781494719, 'batch_size': 32, 'attention_heads': 16, 'hidden_dimension': 218, 'number_of_hidden_layers': 0, 'dropout_rate': 0.42902099727917575, 'global_pooling': 'sum', 'learning_rate': 0.0009137609227750562, 'weight_decay': 2.760036874650898e-06, 'beta_0': 0.8379056948144722, 'beta_1': 0.9921963682876193, 'epsilon': 1.872603870455712e-07, 'balanced_loss': False, 'epochs': 59, 'early_stopping_patience': 19, 'plateau_patience': 12, 'plateau_divider': 6}. Best is trial 56 with value: 0.9682403888722344.
CUDA out of memory. Tried to allocate 2.24 GiB. GPU 0 has a total capacity of 44.56 GiB of which 1.48 GiB is free. Including non-PyTorch memory, this process has 43.07 GiB memory in use. Of the allocated memory 40.45 GiB is allocated by PyTorch, and 1.47 GiB is reserved by PyTorch but unallocated. If reserved but unallocated memory is large try setting PYTORCH_CUDA_ALLOC_CONF=expandable_segments:True to avoid fragmentation.  See documentation for Memory Management  (https://pytorch.org/docs/stable/notes/cuda.html#environment-variables)
[I 2024-12-18 20:20:24,029] Trial 68 finished with value: -1.0 and parameters: {'left_stride': 0, 'right_stride': 0, 'attention_pooling_operation': 'mean', 'embedding_pooling_operation': 'min', 'threshold': 0.9533382735626349, 'batch_size': 159, 'attention_heads': 14, 'hidden_dimension': 164, 'number_of_hidden_layers': 2, 'dropout_rate': 0.36979031262675305, 'global_pooling': 'sum', 'learning_rate': 8.560795460082442e-05, 'weight_decay': 2.3872470603401108e-05, 'beta_0': 0.8276377271646306, 'beta_1': 0.9912304703635588, 'epsilon': 2.863210796482364e-07, 'balanced_loss': True, 'epochs': 110, 'early_stopping_patience': 20, 'plateau_patience': 19, 'plateau_divider': 7}. Best is trial 56 with value: 0.9682403888722344.
CUDA out of memory. Tried to allocate 4.03 GiB. GPU 0 has a total capacity of 44.56 GiB of which 3.71 GiB is free. Including non-PyTorch memory, this process has 40.85 GiB memory in use. Of the allocated memory 37.85 GiB is allocated by PyTorch, and 1.85 GiB is reserved by PyTorch but unallocated. If reserved but unallocated memory is large try setting PYTORCH_CUDA_ALLOC_CONF=expandable_segments:True to avoid fragmentation.  See documentation for Memory Management  (https://pytorch.org/docs/stable/notes/cuda.html#environment-variables)
[I 2024-12-18 20:31:20,308] Trial 69 finished with value: -1.0 and parameters: {'left_stride': 256, 'right_stride': 256, 'attention_pooling_operation': 'mean', 'embedding_pooling_operation': 'min', 'threshold': 0.9187630059509803, 'batch_size': 189, 'attention_heads': 15, 'hidden_dimension': 127, 'number_of_hidden_layers': 1, 'dropout_rate': 0.4150294687609504, 'global_pooling': 'sum', 'learning_rate': 6.439726192201179e-05, 'weight_decay': 6.719094560231448e-05, 'beta_0': 0.818956956532514, 'beta_1': 0.9892896839690766, 'epsilon': 1.1333527042702922e-06, 'balanced_loss': False, 'epochs': 100, 'early_stopping_patience': 22, 'plateau_patience': 15, 'plateau_divider': 6}. Best is trial 56 with value: 0.9682403888722344.
[I 2024-12-18 20:46:56,589] Trial 70 finished with value: 0.9549965699534855 and parameters: {'left_stride': 0, 'right_stride': 64, 'attention_pooling_operation': 'mean', 'embedding_pooling_operation': 'min', 'threshold': 0.9379873986512397, 'batch_size': 40, 'attention_heads': 16, 'hidden_dimension': 114, 'number_of_hidden_layers': 0, 'dropout_rate': 0.3943842128347946, 'global_pooling': 'max', 'learning_rate': 0.00014703955126558942, 'weight_decay': 9.964793624526043e-05, 'beta_0': 0.8454392198137385, 'beta_1': 0.9859810822311714, 'epsilon': 4.315207610650046e-07, 'balanced_loss': False, 'epochs': 72, 'early_stopping_patience': 23, 'plateau_patience': 13, 'plateau_divider': 4}. Best is trial 56 with value: 0.9682403888722344.
[I 2024-12-18 21:02:55,892] Trial 71 finished with value: 0.9564126558759636 and parameters: {'left_stride': 0, 'right_stride': 64, 'attention_pooling_operation': 'mean', 'embedding_pooling_operation': 'min', 'threshold': 0.9338620233727417, 'batch_size': 39, 'attention_heads': 16, 'hidden_dimension': 117, 'number_of_hidden_layers': 0, 'dropout_rate': 0.39272566186639535, 'global_pooling': 'max', 'learning_rate': 0.00014584444989364806, 'weight_decay': 4.476938428459692e-05, 'beta_0': 0.8465041120185625, 'beta_1': 0.9837299141427769, 'epsilon': 4.809839692825406e-07, 'balanced_loss': False, 'epochs': 63, 'early_stopping_patience': 23, 'plateau_patience': 13, 'plateau_divider': 4}. Best is trial 56 with value: 0.9682403888722344.
[I 2024-12-18 21:19:55,271] Trial 72 finished with value: 0.9492207715152999 and parameters: {'left_stride': 0, 'right_stride': 64, 'attention_pooling_operation': 'mean', 'embedding_pooling_operation': 'min', 'threshold': 0.9349906958164026, 'batch_size': 40, 'attention_heads': 16, 'hidden_dimension': 145, 'number_of_hidden_layers': 0, 'dropout_rate': 0.3946681460462954, 'global_pooling': 'max', 'learning_rate': 0.00014990601537498741, 'weight_decay': 4.242461794008189e-05, 'beta_0': 0.84191992941327, 'beta_1': 0.983848992537824, 'epsilon': 4.4180084447700003e-07, 'balanced_loss': False, 'epochs': 70, 'early_stopping_patience': 23, 'plateau_patience': 13, 'plateau_divider': 4}. Best is trial 56 with value: 0.9682403888722344.
[I 2024-12-18 21:35:47,563] Trial 73 finished with value: 0.9507690777378744 and parameters: {'left_stride': 0, 'right_stride': 64, 'attention_pooling_operation': 'mean', 'embedding_pooling_operation': 'min', 'threshold': 0.9442366293009056, 'batch_size': 53, 'attention_heads': 16, 'hidden_dimension': 117, 'number_of_hidden_layers': 0, 'dropout_rate': 0.3539227260658086, 'global_pooling': 'max', 'learning_rate': 0.00010109290110858811, 'weight_decay': 3.2969899190644106e-05, 'beta_0': 0.8444474120875617, 'beta_1': 0.9819027329130391, 'epsilon': 1.011656789190005e-06, 'balanced_loss': False, 'epochs': 55, 'early_stopping_patience': 24, 'plateau_patience': 12, 'plateau_divider': 4}. Best is trial 56 with value: 0.9682403888722344.
[I 2024-12-18 21:51:12,879] Trial 74 finished with value: 0.9549092399343027 and parameters: {'left_stride': 0, 'right_stride': 64, 'attention_pooling_operation': 'mean', 'embedding_pooling_operation': 'min', 'threshold': 0.9671932778375946, 'batch_size': 74, 'attention_heads': 15, 'hidden_dimension': 105, 'number_of_hidden_layers': 0, 'dropout_rate': 0.37180269030072616, 'global_pooling': 'max', 'learning_rate': 5.760094192190666e-05, 'weight_decay': 0.00010494212692628838, 'beta_0': 0.8472582538989946, 'beta_1': 0.9838650168219127, 'epsilon': 1.4248974357164995e-06, 'balanced_loss': False, 'epochs': 64, 'early_stopping_patience': 25, 'plateau_patience': 13, 'plateau_divider': 3}. Best is trial 56 with value: 0.9682403888722344.
[I 2024-12-18 22:04:58,974] Trial 75 finished with value: 0.933842762038827 and parameters: {'left_stride': 0, 'right_stride': 64, 'attention_pooling_operation': 'mean', 'embedding_pooling_operation': 'min', 'threshold': 0.9834564747149602, 'batch_size': 72, 'attention_heads': 15, 'hidden_dimension': 104, 'number_of_hidden_layers': 0, 'dropout_rate': 0.3662840737151787, 'global_pooling': 'max', 'learning_rate': 5.876373323262232e-05, 'weight_decay': 0.0001031054678981767, 'beta_0': 0.8387155860100061, 'beta_1': 0.9832037828534536, 'epsilon': 3.1061657766672053e-06, 'balanced_loss': False, 'epochs': 64, 'early_stopping_patience': 25, 'plateau_patience': 14, 'plateau_divider': 3}. Best is trial 56 with value: 0.9682403888722344.
slurmstepd: error: *** JOB 14110885 ON gpu014 CANCELLED AT 2024-12-18T22:15:44 DUE TO TIME LIMIT ***
