[I 2024-11-29 15:47:50,294] Using an existing study with name 'R8-GATv2-google-bert-bert-base-uncased-Grouped-Global_Aggregation' instead of creating a new one.
Token indices sequence length is longer than the specified maximum sequence length for this model (639 > 512). Running this sequence through the model will result in indexing errors
[I 2024-11-29 15:55:35,337] Trial 198 finished with value: 0.9429389200779397 and parameters: {'left_stride': 32, 'right_stride': 0, 'attention_pooling_operation': 'max', 'embedding_pooling_operation': 'mean', 'threshold': 0.7415952978754041, 'batch_size': 83, 'attention_heads': 6, 'hidden_dimension': 149, 'number_of_hidden_layers': 1, 'dropout_rate': 0.4866633794218314, 'global_pooling': 'mean', 'learning_rate': 0.00017687875619725908, 'weight_decay': 8.540570332693829e-06, 'beta_0': 0.8993419166868933, 'beta_1': 0.9942460509346965, 'epsilon': 1.4329210303458672e-07, 'balanced_loss': False, 'epochs': 120, 'early_stopping_patience': 19, 'plateau_patience': 22, 'plateau_divider': 7}. Best is trial 188 with value: 0.9610835279228983.
[I 2024-11-29 16:04:24,511] Trial 199 finished with value: 0.9532245695563335 and parameters: {'left_stride': 32, 'right_stride': 0, 'attention_pooling_operation': 'max', 'embedding_pooling_operation': 'mean', 'threshold': 0.7123567660221519, 'batch_size': 52, 'attention_heads': 6, 'hidden_dimension': 151, 'number_of_hidden_layers': 1, 'dropout_rate': 0.5014505143701539, 'global_pooling': 'max', 'learning_rate': 0.00012918033699226036, 'weight_decay': 9.13021825197409e-06, 'beta_0': 0.8915732564095449, 'beta_1': 0.9937183183408543, 'epsilon': 2.0517054797280832e-07, 'balanced_loss': False, 'epochs': 128, 'early_stopping_patience': 20, 'plateau_patience': 23, 'plateau_divider': 7}. Best is trial 188 with value: 0.9610835279228983.
[I 2024-11-29 16:12:48,203] Trial 200 finished with value: 0.9499670607281364 and parameters: {'left_stride': 32, 'right_stride': 0, 'attention_pooling_operation': 'max', 'embedding_pooling_operation': 'mean', 'threshold': 0.7335459590874236, 'batch_size': 78, 'attention_heads': 6, 'hidden_dimension': 141, 'number_of_hidden_layers': 1, 'dropout_rate': 0.48381395662216004, 'global_pooling': 'max', 'learning_rate': 0.00034212827626224493, 'weight_decay': 7.100776328905949e-06, 'beta_0': 0.8975389671512221, 'beta_1': 0.9934149092747826, 'epsilon': 7.597388675449207e-08, 'balanced_loss': False, 'epochs': 104, 'early_stopping_patience': 19, 'plateau_patience': 23, 'plateau_divider': 7}. Best is trial 188 with value: 0.9610835279228983.
[I 2024-11-29 16:21:19,217] Trial 201 finished with value: 0.9201306996687053 and parameters: {'left_stride': 32, 'right_stride': 0, 'attention_pooling_operation': 'min', 'embedding_pooling_operation': 'mean', 'threshold': 0.7413587729679595, 'batch_size': 57, 'attention_heads': 7, 'hidden_dimension': 154, 'number_of_hidden_layers': 1, 'dropout_rate': 0.49602112445677177, 'global_pooling': 'max', 'learning_rate': 0.00046508320061125225, 'weight_decay': 9.555838359945878e-06, 'beta_0': 0.8921367244886613, 'beta_1': 0.9951315785482401, 'epsilon': 4.970721977665139e-08, 'balanced_loss': True, 'epochs': 116, 'early_stopping_patience': 19, 'plateau_patience': 23, 'plateau_divider': 7}. Best is trial 188 with value: 0.9610835279228983.
[I 2024-11-29 16:33:05,896] Trial 202 finished with value: 0.9584090133451397 and parameters: {'left_stride': 32, 'right_stride': 0, 'attention_pooling_operation': 'max', 'embedding_pooling_operation': 'max', 'threshold': 0.7459404222960709, 'batch_size': 74, 'attention_heads': 11, 'hidden_dimension': 148, 'number_of_hidden_layers': 1, 'dropout_rate': 0.4817653980843922, 'global_pooling': 'max', 'learning_rate': 0.00027795534881842594, 'weight_decay': 4.5830523768008504e-06, 'beta_0': 0.8998454509300476, 'beta_1': 0.9930989147816589, 'epsilon': 1.0764261852267342e-07, 'balanced_loss': False, 'epochs': 133, 'early_stopping_patience': 20, 'plateau_patience': 23, 'plateau_divider': 8}. Best is trial 188 with value: 0.9610835279228983.
[I 2024-11-29 16:43:05,825] Trial 203 finished with value: 0.9481873394501299 and parameters: {'left_stride': 32, 'right_stride': 0, 'attention_pooling_operation': 'max', 'embedding_pooling_operation': 'max', 'threshold': 0.7243084765193559, 'batch_size': 75, 'attention_heads': 11, 'hidden_dimension': 147, 'number_of_hidden_layers': 1, 'dropout_rate': 0.4790592226506452, 'global_pooling': 'max', 'learning_rate': 0.00028912644384523044, 'weight_decay': 4.939779813007001e-06, 'beta_0': 0.8998121396228799, 'beta_1': 0.9932342007955863, 'epsilon': 1.0199511341661914e-07, 'balanced_loss': False, 'epochs': 125, 'early_stopping_patience': 20, 'plateau_patience': 23, 'plateau_divider': 8}. Best is trial 188 with value: 0.9610835279228983.
[I 2024-11-29 16:54:03,385] Trial 204 finished with value: 0.9521179233336352 and parameters: {'left_stride': 32, 'right_stride': 0, 'attention_pooling_operation': 'max', 'embedding_pooling_operation': 'max', 'threshold': 0.7475627767107347, 'batch_size': 89, 'attention_heads': 10, 'hidden_dimension': 156, 'number_of_hidden_layers': 1, 'dropout_rate': 0.46543494916975303, 'global_pooling': 'max', 'learning_rate': 0.00016258219072511052, 'weight_decay': 3.9869857232058435e-06, 'beta_0': 0.8949657998104427, 'beta_1': 0.9930164125183061, 'epsilon': 6.295936905512536e-08, 'balanced_loss': False, 'epochs': 132, 'early_stopping_patience': 20, 'plateau_patience': 23, 'plateau_divider': 7}. Best is trial 188 with value: 0.9610835279228983.
[I 2024-11-29 17:05:25,416] Trial 205 finished with value: 0.9549210892820245 and parameters: {'left_stride': 32, 'right_stride': 0, 'attention_pooling_operation': 'max', 'embedding_pooling_operation': 'max', 'threshold': 0.7404862069839642, 'batch_size': 69, 'attention_heads': 11, 'hidden_dimension': 164, 'number_of_hidden_layers': 1, 'dropout_rate': 0.4875141684101745, 'global_pooling': 'max', 'learning_rate': 0.00021718952657418086, 'weight_decay': 4.736328021873079e-06, 'beta_0': 0.8969283150301479, 'beta_1': 0.9925920781288404, 'epsilon': 8.288177545965457e-08, 'balanced_loss': False, 'epochs': 141, 'early_stopping_patience': 19, 'plateau_patience': 23, 'plateau_divider': 8}. Best is trial 188 with value: 0.9610835279228983.
[I 2024-11-29 17:13:49,120] Trial 206 finished with value: 0.9556981134755935 and parameters: {'left_stride': 32, 'right_stride': 0, 'attention_pooling_operation': 'max', 'embedding_pooling_operation': 'max', 'threshold': 0.7506290041509499, 'batch_size': 44, 'attention_heads': 6, 'hidden_dimension': 172, 'number_of_hidden_layers': 1, 'dropout_rate': 0.4930810723556492, 'global_pooling': 'max', 'learning_rate': 0.00025776309304160306, 'weight_decay': 6.9272405822038e-06, 'beta_0': 0.8953722123695629, 'beta_1': 0.9945019000418447, 'epsilon': 1.1936189421698045e-07, 'balanced_loss': False, 'epochs': 137, 'early_stopping_patience': 19, 'plateau_patience': 22, 'plateau_divider': 9}. Best is trial 188 with value: 0.9610835279228983.
[I 2024-11-29 17:24:12,100] Trial 207 finished with value: 0.9471488906674029 and parameters: {'left_stride': 32, 'right_stride': 0, 'attention_pooling_operation': 'max', 'embedding_pooling_operation': 'max', 'threshold': 0.7341185429445369, 'batch_size': 42, 'attention_heads': 11, 'hidden_dimension': 171, 'number_of_hidden_layers': 1, 'dropout_rate': 0.4991629698230931, 'global_pooling': 'max', 'learning_rate': 0.00025803423122903026, 'weight_decay': 7.246158262291478e-06, 'beta_0': 0.8938074101565051, 'beta_1': 0.9938638283711511, 'epsilon': 1.1696217649596117e-07, 'balanced_loss': False, 'epochs': 138, 'early_stopping_patience': 18, 'plateau_patience': 22, 'plateau_divider': 9}. Best is trial 188 with value: 0.9610835279228983.
[I 2024-11-29 17:33:19,857] Trial 208 finished with value: 0.6164889150592557 and parameters: {'left_stride': 32, 'right_stride': 0, 'attention_pooling_operation': 'max', 'embedding_pooling_operation': 'max', 'threshold': 0.7481789928948951, 'batch_size': 49, 'attention_heads': 12, 'hidden_dimension': 140, 'number_of_hidden_layers': 1, 'dropout_rate': 0.4938944139014956, 'global_pooling': 'max', 'learning_rate': 0.09285939748894982, 'weight_decay': 5.697770013680959e-06, 'beta_0': 0.8971937277990648, 'beta_1': 0.9942818467423579, 'epsilon': 1.7578063877900216e-07, 'balanced_loss': False, 'epochs': 55, 'early_stopping_patience': 20, 'plateau_patience': 22, 'plateau_divider': 9}. Best is trial 188 with value: 0.9610835279228983.
[I 2024-11-29 17:41:25,216] Trial 209 finished with value: 0.9492431569362914 and parameters: {'left_stride': 32, 'right_stride': 0, 'attention_pooling_operation': 'max', 'embedding_pooling_operation': 'max', 'threshold': 0.718068294045871, 'batch_size': 59, 'attention_heads': 6, 'hidden_dimension': 144, 'number_of_hidden_layers': 1, 'dropout_rate': 0.4808430681213234, 'global_pooling': 'max', 'learning_rate': 0.00034008729437942956, 'weight_decay': 6.296244008450641e-06, 'beta_0': 0.8959631017165826, 'beta_1': 0.99597625128397, 'epsilon': 1.3707267865176834e-07, 'balanced_loss': False, 'epochs': 135, 'early_stopping_patience': 19, 'plateau_patience': 23, 'plateau_divider': 9}. Best is trial 188 with value: 0.9610835279228983.
[I 2024-11-29 17:49:47,072] Trial 210 finished with value: 0.953564853161238 and parameters: {'left_stride': 32, 'right_stride': 0, 'attention_pooling_operation': 'max', 'embedding_pooling_operation': 'max', 'threshold': 0.7521088471568255, 'batch_size': 84, 'attention_heads': 6, 'hidden_dimension': 183, 'number_of_hidden_layers': 1, 'dropout_rate': 0.4723347757369822, 'global_pooling': 'mean', 'learning_rate': 0.00017861736606724572, 'weight_decay': 8.24044744434651e-06, 'beta_0': 0.89928572572411, 'beta_1': 0.9938313222125881, 'epsilon': 1.0418752370394899e-07, 'balanced_loss': False, 'epochs': 133, 'early_stopping_patience': 19, 'plateau_patience': 23, 'plateau_divider': 9}. Best is trial 188 with value: 0.9610835279228983.
[I 2024-11-29 17:59:22,333] Trial 211 finished with value: 0.9654708676873474 and parameters: {'left_stride': 32, 'right_stride': 0, 'attention_pooling_operation': 'max', 'embedding_pooling_operation': 'mean', 'threshold': 0.7403223287674928, 'batch_size': 76, 'attention_heads': 10, 'hidden_dimension': 149, 'number_of_hidden_layers': 1, 'dropout_rate': 0.505127388606705, 'global_pooling': 'max', 'learning_rate': 0.0005087709679717605, 'weight_decay': 1.0399943379372868e-05, 'beta_0': 0.8998678604282186, 'beta_1': 0.9967225187317124, 'epsilon': 6.762094335130219e-08, 'balanced_loss': False, 'epochs': 64, 'early_stopping_patience': 19, 'plateau_patience': 22, 'plateau_divider': 8}. Best is trial 211 with value: 0.9654708676873474.
[I 2024-11-29 18:08:18,153] Trial 212 finished with value: 0.9506861239314575 and parameters: {'left_stride': 32, 'right_stride': 0, 'attention_pooling_operation': 'max', 'embedding_pooling_operation': 'max', 'threshold': 0.7301781280242948, 'batch_size': 34, 'attention_heads': 8, 'hidden_dimension': 139, 'number_of_hidden_layers': 1, 'dropout_rate': 0.507543114820316, 'global_pooling': 'max', 'learning_rate': 0.00047530452039784565, 'weight_decay': 1.0925527400334923e-05, 'beta_0': 0.8997323189418539, 'beta_1': 0.99662241838524, 'epsilon': 4.8392066000413017e-08, 'balanced_loss': False, 'epochs': 151, 'early_stopping_patience': 18, 'plateau_patience': 22, 'plateau_divider': 8}. Best is trial 211 with value: 0.9654708676873474.
[I 2024-11-29 18:34:44,620] Trial 213 finished with value: 0.944890704087322 and parameters: {'left_stride': 32, 'right_stride': 0, 'attention_pooling_operation': 'max', 'embedding_pooling_operation': 'max', 'threshold': 0.7390830969219817, 'batch_size': 77, 'attention_heads': 10, 'hidden_dimension': 149, 'number_of_hidden_layers': 1, 'dropout_rate': 0.48985778772595934, 'global_pooling': 'max', 'learning_rate': 1.0993032231668202e-05, 'weight_decay': 9.567578917686542e-06, 'beta_0': 0.8947495722857448, 'beta_1': 0.9934372191586545, 'epsilon': 7.073038205568242e-08, 'balanced_loss': False, 'epochs': 130, 'early_stopping_patience': 19, 'plateau_patience': 21, 'plateau_divider': 8}. Best is trial 211 with value: 0.9654708676873474.
[I 2024-11-29 18:43:39,205] Trial 214 finished with value: 0.9521041982132532 and parameters: {'left_stride': 32, 'right_stride': 0, 'attention_pooling_operation': 'max', 'embedding_pooling_operation': 'mean', 'threshold': 0.7448133519485355, 'batch_size': 72, 'attention_heads': 9, 'hidden_dimension': 146, 'number_of_hidden_layers': 1, 'dropout_rate': 0.5044478343028842, 'global_pooling': 'max', 'learning_rate': 0.0005283500597028805, 'weight_decay': 7.483643400434707e-06, 'beta_0': 0.8974543397740672, 'beta_1': 0.9941603075034903, 'epsilon': 6.053177034776109e-08, 'balanced_loss': False, 'epochs': 143, 'early_stopping_patience': 19, 'plateau_patience': 22, 'plateau_divider': 9}. Best is trial 211 with value: 0.9654708676873474.
[I 2024-11-29 18:53:24,736] Trial 215 finished with value: 0.9401416369161169 and parameters: {'left_stride': 32, 'right_stride': 0, 'attention_pooling_operation': 'max', 'embedding_pooling_operation': 'mean', 'threshold': 0.750515298587756, 'batch_size': 63, 'attention_heads': 10, 'hidden_dimension': 159, 'number_of_hidden_layers': 1, 'dropout_rate': 0.48423076323941694, 'global_pooling': 'max', 'learning_rate': 0.0003768427088002898, 'weight_decay': 5.241119570146004e-06, 'beta_0': 0.8918115053074386, 'beta_1': 0.9928330937262903, 'epsilon': 8.625934955699926e-08, 'balanced_loss': False, 'epochs': 64, 'early_stopping_patience': 20, 'plateau_patience': 23, 'plateau_divider': 8}. Best is trial 211 with value: 0.9654708676873474.
[I 2024-11-29 19:02:50,527] Trial 216 finished with value: 0.9497594272206826 and parameters: {'left_stride': 32, 'right_stride': 0, 'attention_pooling_operation': 'max', 'embedding_pooling_operation': 'mean', 'threshold': 0.7350478805769003, 'batch_size': 102, 'attention_heads': 7, 'hidden_dimension': 175, 'number_of_hidden_layers': 1, 'dropout_rate': 0.4931151853350156, 'global_pooling': 'max', 'learning_rate': 0.00028836281900679935, 'weight_decay': 4.22563488033072e-06, 'beta_0': 0.8977971525661217, 'beta_1': 0.9971213777027533, 'epsilon': 5.747379122206887e-08, 'balanced_loss': False, 'epochs': 139, 'early_stopping_patience': 19, 'plateau_patience': 23, 'plateau_divider': 7}. Best is trial 211 with value: 0.9654708676873474.
[I 2024-11-29 19:11:09,220] Trial 217 finished with value: 0.9548239096614863 and parameters: {'left_stride': 32, 'right_stride': 0, 'attention_pooling_operation': 'max', 'embedding_pooling_operation': 'mean', 'threshold': 0.7274412334140068, 'batch_size': 84, 'attention_heads': 5, 'hidden_dimension': 150, 'number_of_hidden_layers': 1, 'dropout_rate': 0.5015846690307084, 'global_pooling': 'max', 'learning_rate': 0.00021686592285282926, 'weight_decay': 8.504310451575904e-06, 'beta_0': 0.8945522649121811, 'beta_1': 0.9946584046353503, 'epsilon': 7.06453470422761e-08, 'balanced_loss': False, 'epochs': 69, 'early_stopping_patience': 18, 'plateau_patience': 21, 'plateau_divider': 8}. Best is trial 211 with value: 0.9654708676873474.
[I 2024-11-29 19:20:40,200] Trial 218 finished with value: 0.9567086672766925 and parameters: {'left_stride': 32, 'right_stride': 0, 'attention_pooling_operation': 'max', 'embedding_pooling_operation': 'mean', 'threshold': 0.7432192667405929, 'batch_size': 69, 'attention_heads': 11, 'hidden_dimension': 143, 'number_of_hidden_layers': 1, 'dropout_rate': 0.5138316864795662, 'global_pooling': 'max', 'learning_rate': 0.0006541648465756053, 'weight_decay': 6.296826368935424e-06, 'beta_0': 0.8962004785775711, 'beta_1': 0.9984840499152203, 'epsilon': 8.808736349793918e-08, 'balanced_loss': False, 'epochs': 126, 'early_stopping_patience': 20, 'plateau_patience': 22, 'plateau_divider': 7}. Best is trial 211 with value: 0.9654708676873474.
[I 2024-11-29 19:31:15,310] Trial 219 finished with value: 0.9410372878058969 and parameters: {'left_stride': 32, 'right_stride': 0, 'attention_pooling_operation': 'max', 'embedding_pooling_operation': 'mean', 'threshold': 0.7414372213959205, 'batch_size': 65, 'attention_heads': 12, 'hidden_dimension': 137, 'number_of_hidden_layers': 1, 'dropout_rate': 0.5122617083721565, 'global_pooling': 'max', 'learning_rate': 0.0005866277245669147, 'weight_decay': 6.222698789331922e-06, 'beta_0': 0.8999923674263702, 'beta_1': 0.9981763912944187, 'epsilon': 1.1195350455857355e-07, 'balanced_loss': False, 'epochs': 134, 'early_stopping_patience': 21, 'plateau_patience': 22, 'plateau_divider': 7}. Best is trial 211 with value: 0.9654708676873474.
[I 2024-11-29 19:42:18,670] Trial 220 finished with value: 0.9455384918429552 and parameters: {'left_stride': 32, 'right_stride': 0, 'attention_pooling_operation': 'max', 'embedding_pooling_operation': 'mean', 'threshold': 0.7226297685519548, 'batch_size': 57, 'attention_heads': 13, 'hidden_dimension': 141, 'number_of_hidden_layers': 1, 'dropout_rate': 0.5217712375699106, 'global_pooling': 'max', 'learning_rate': 0.0007296220884308677, 'weight_decay': 1.1267390525741208e-05, 'beta_0': 0.8907715162732025, 'beta_1': 0.9954288839536477, 'epsilon': 9.097879770386445e-08, 'balanced_loss': False, 'epochs': 124, 'early_stopping_patience': 20, 'plateau_patience': 22, 'plateau_divider': 7}. Best is trial 211 with value: 0.9654708676873474.
[I 2024-11-29 19:52:11,934] Trial 221 finished with value: 0.9608937943620275 and parameters: {'left_stride': 32, 'right_stride': 0, 'attention_pooling_operation': 'max', 'embedding_pooling_operation': 'max', 'threshold': 0.7574039577172302, 'batch_size': 43, 'attention_heads': 11, 'hidden_dimension': 154, 'number_of_hidden_layers': 1, 'dropout_rate': 0.5101438947976595, 'global_pooling': 'max', 'learning_rate': 0.00014415811807045535, 'weight_decay': 7.340555001889838e-06, 'beta_0': 0.893724368594499, 'beta_1': 0.9973975070102171, 'epsilon': 4.502470921776959e-08, 'balanced_loss': False, 'epochs': 118, 'early_stopping_patience': 17, 'plateau_patience': 21, 'plateau_divider': 7}. Best is trial 211 with value: 0.9654708676873474.
[I 2024-11-29 20:00:57,284] Trial 222 finished with value: 0.8628618454984707 and parameters: {'left_stride': 32, 'right_stride': 0, 'attention_pooling_operation': 'max', 'embedding_pooling_operation': 'max', 'threshold': 0.7545286899484837, 'batch_size': 50, 'attention_heads': 11, 'hidden_dimension': 161, 'number_of_hidden_layers': 1, 'dropout_rate': 0.5073941850192607, 'global_pooling': 'sum', 'learning_rate': 0.005002593685198201, 'weight_decay': 6.88567842911258e-06, 'beta_0': 0.8928006970080561, 'beta_1': 0.9925639417856331, 'epsilon': 4.3529404757236485e-08, 'balanced_loss': False, 'epochs': 126, 'early_stopping_patience': 17, 'plateau_patience': 22, 'plateau_divider': 7}. Best is trial 211 with value: 0.9654708676873474.
[I 2024-11-29 20:11:42,334] Trial 223 finished with value: 0.952823717376688 and parameters: {'left_stride': 32, 'right_stride': 0, 'attention_pooling_operation': 'max', 'embedding_pooling_operation': 'max', 'threshold': 0.7559140169618966, 'batch_size': 69, 'attention_heads': 12, 'hidden_dimension': 144, 'number_of_hidden_layers': 1, 'dropout_rate': 0.5136064273836578, 'global_pooling': 'max', 'learning_rate': 0.0001402906792317857, 'weight_decay': 8.159318890578814e-06, 'beta_0': 0.8958830063153773, 'beta_1': 0.9981335599938584, 'epsilon': 5.1179122426113335e-08, 'balanced_loss': False, 'epochs': 120, 'early_stopping_patience': 17, 'plateau_patience': 21, 'plateau_divider': 7}. Best is trial 211 with value: 0.9654708676873474.
[I 2024-11-29 20:23:08,593] Trial 224 finished with value: 0.9548079626715948 and parameters: {'left_stride': 32, 'right_stride': 0, 'attention_pooling_operation': 'max', 'embedding_pooling_operation': 'max', 'threshold': 0.7427500957748745, 'batch_size': 47, 'attention_heads': 11, 'hidden_dimension': 155, 'number_of_hidden_layers': 1, 'dropout_rate': 0.495723641115652, 'global_pooling': 'max', 'learning_rate': 0.00010636457044659824, 'weight_decay': 5.84764108191069e-06, 'beta_0': 0.8949453546853269, 'beta_1': 0.9985825639800816, 'epsilon': 5.908324259150744e-08, 'balanced_loss': False, 'epochs': 123, 'early_stopping_patience': 20, 'plateau_patience': 22, 'plateau_divider': 7}. Best is trial 211 with value: 0.9654708676873474.
[I 2024-11-29 20:34:54,160] Trial 225 finished with value: 0.945947096279864 and parameters: {'left_stride': 32, 'right_stride': 0, 'attention_pooling_operation': 'max', 'embedding_pooling_operation': 'max', 'threshold': 0.7003296197614871, 'batch_size': 43, 'attention_heads': 11, 'hidden_dimension': 167, 'number_of_hidden_layers': 1, 'dropout_rate': 0.510420447924469, 'global_pooling': 'max', 'learning_rate': 0.0006491483809527589, 'weight_decay': 7.1024031579687875e-06, 'beta_0': 0.8888305247211786, 'beta_1': 0.9977792264686246, 'epsilon': 9.002732355114999e-08, 'balanced_loss': False, 'epochs': 119, 'early_stopping_patience': 19, 'plateau_patience': 22, 'plateau_divider': 7}. Best is trial 211 with value: 0.9654708676873474.
[I 2024-11-29 20:44:48,225] Trial 226 finished with value: 0.9452372175870105 and parameters: {'left_stride': 32, 'right_stride': 0, 'attention_pooling_operation': 'max', 'embedding_pooling_operation': 'mean', 'threshold': 0.7592380429945172, 'batch_size': 76, 'attention_heads': 11, 'hidden_dimension': 188, 'number_of_hidden_layers': 1, 'dropout_rate': 0.5027780204404537, 'global_pooling': 'max', 'learning_rate': 0.00043630308480443087, 'weight_decay': 1.0607093952403256e-05, 'beta_0': 0.8933758740825385, 'beta_1': 0.9949384899392045, 'epsilon': 3.712927703456834e-08, 'balanced_loss': False, 'epochs': 131, 'early_stopping_patience': 17, 'plateau_patience': 21, 'plateau_divider': 7}. Best is trial 211 with value: 0.9654708676873474.
