[I 2024-11-30 01:42:43,839] Trial 256 finished with value: 0.9507324666389206 and parameters: {'left_stride': 32, 'right_stride': 64, 'attention_pooling_operation': 'max', 'embedding_pooling_operation': 'mean', 'threshold': 0.8125598892942577, 'batch_size': 70, 'attention_heads': 10, 'hidden_dimension': 161, 'number_of_hidden_layers': 1, 'dropout_rate': 0.5523737659832139, 'global_pooling': 'max', 'learning_rate': 0.00032996530867639585, 'weight_decay': 1.0301606498579533e-05, 'beta_0': 0.8907795046547515, 'beta_1': 0.9979976496655647, 'epsilon': 5.336366257027023e-08, 'balanced_loss': False, 'epochs': 114, 'early_stopping_patience': 18, 'plateau_patience': 23, 'plateau_divider': 8}. Best is trial 211 with value: 0.9654708676873474.
[I 2024-11-30 01:50:48,007] Trial 257 finished with value: 0.9411883304857274 and parameters: {'left_stride': 32, 'right_stride': 256, 'attention_pooling_operation': 'max', 'embedding_pooling_operation': 'max', 'threshold': 0.7482129826970134, 'batch_size': 127, 'attention_heads': 8, 'hidden_dimension': 125, 'number_of_hidden_layers': 1, 'dropout_rate': 0.46597812915323766, 'global_pooling': 'max', 'learning_rate': 0.000434020165119018, 'weight_decay': 6.79851924631394e-06, 'beta_0': 0.8879781594135584, 'beta_1': 0.9953483082851756, 'epsilon': 9.761640688965204e-08, 'balanced_loss': False, 'epochs': 90, 'early_stopping_patience': 16, 'plateau_patience': 23, 'plateau_divider': 7}. Best is trial 211 with value: 0.9654708676873474.
[I 2024-11-30 02:03:31,214] Trial 258 finished with value: 0.9546020403480349 and parameters: {'left_stride': 32, 'right_stride': 0, 'attention_pooling_operation': 'max', 'embedding_pooling_operation': 'mean', 'threshold': 0.737716776263928, 'batch_size': 131, 'attention_heads': 11, 'hidden_dimension': 147, 'number_of_hidden_layers': 1, 'dropout_rate': 0.5049610300934895, 'global_pooling': 'max', 'learning_rate': 0.00024162286648694094, 'weight_decay': 8.837268703204215e-06, 'beta_0': 0.8980226813108249, 'beta_1': 0.9958454792255436, 'epsilon': 8.124453093096392e-05, 'balanced_loss': True, 'epochs': 67, 'early_stopping_patience': 19, 'plateau_patience': 24, 'plateau_divider': 8}. Best is trial 211 with value: 0.9654708676873474.
[I 2024-11-30 02:12:58,027] Trial 259 finished with value: 0.9336959219373588 and parameters: {'left_stride': 128, 'right_stride': 256, 'attention_pooling_operation': 'max', 'embedding_pooling_operation': 'mean', 'threshold': 0.7792554678181954, 'batch_size': 100, 'attention_heads': 10, 'hidden_dimension': 132, 'number_of_hidden_layers': 1, 'dropout_rate': 0.560183346932944, 'global_pooling': 'max', 'learning_rate': 0.0032637369930813044, 'weight_decay': 6.164169803093839e-06, 'beta_0': 0.8946053299834811, 'beta_1': 0.9925141420023694, 'epsilon': 6.719240878414821e-08, 'balanced_loss': False, 'epochs': 153, 'early_stopping_patience': 18, 'plateau_patience': 22, 'plateau_divider': 7}. Best is trial 211 with value: 0.9654708676873474.
[I 2024-11-30 02:21:37,387] Trial 260 finished with value: 0.9400978517457649 and parameters: {'left_stride': 32, 'right_stride': 0, 'attention_pooling_operation': 'max', 'embedding_pooling_operation': 'mean', 'threshold': 0.9178820494686589, 'batch_size': 45, 'attention_heads': 11, 'hidden_dimension': 197, 'number_of_hidden_layers': 1, 'dropout_rate': 0.500500524424909, 'global_pooling': 'sum', 'learning_rate': 0.00017699689225640226, 'weight_decay': 1.4261889160528715e-05, 'beta_0': 0.8957762084470191, 'beta_1': 0.9968562193487559, 'epsilon': 1.2832667373295184e-07, 'balanced_loss': False, 'epochs': 63, 'early_stopping_patience': 15, 'plateau_patience': 23, 'plateau_divider': 8}. Best is trial 211 with value: 0.9654708676873474.
[I 2024-11-30 02:31:25,203] Trial 261 finished with value: 0.9538607100811256 and parameters: {'left_stride': 32, 'right_stride': 0, 'attention_pooling_operation': 'max', 'embedding_pooling_operation': 'mean', 'threshold': 0.7598870454452084, 'batch_size': 93, 'attention_heads': 10, 'hidden_dimension': 154, 'number_of_hidden_layers': 1, 'dropout_rate': 0.5867321549967, 'global_pooling': 'max', 'learning_rate': 0.0004846161195110833, 'weight_decay': 2.408960085746412e-05, 'beta_0': 0.8409043614855143, 'beta_1': 0.9963807788453474, 'epsilon': 2.435660448008375e-08, 'balanced_loss': False, 'epochs': 53, 'early_stopping_patience': 20, 'plateau_patience': 23, 'plateau_divider': 7}. Best is trial 211 with value: 0.9654708676873474.

[TRIAL] 211 [VALIDATION PERFORMANCE] 0.9654708676873474 [TRAINING LOSS] 0.01580613155363545 [VALIDATION LOSS] 0.10742611424842229 

number                                     211
value                                 0.965471
params_threshold                      0.740322
params_attention_heads                      10
params_balanced_loss                     False
params_embedding_pooling_operation        mean
params_attention_pooling_operation         max
params_batch_size                           76
params_dropout_rate                   0.505127
params_early_stopping_patience              19
params_epochs                               64
params_global_pooling                      max
params_hidden_dimension                    149
params_learning_rate                  0.000509
params_number_of_hidden_layers               1
params_plateau_divider                       8
params_plateau_patience                     22
params_weight_decay                    0.00001
params_beta_0                         0.899868
params_beta_1                         0.996723
params_epsilon                             0.0
user_attrs_epoch                          19.0
user_attrs_training_loss              0.015806
user_attrs_validation_loss            0.107426
params_left_stride                          32
params_right_stride                          0
Name: 211, dtype: object
37 Val: 0.9517641314128791 Test: 0.9452797849668513
38 Val: 0.9639046462636265 Test: 0.9353233748411045
39 Val: 0.9584606599639409 Test: 0.9388405577297865
40 Val: 0.9446881675598696 Test: 0.9441605073360646
41 Val: 0.9515247657859425 Test: 0.9517399325464211
42 Val: 0.9543689682568863 Test: 0.9409490286126614
43 Val: 0.9583689847360775 Test: 0.9491979481857916
slurmstepd: error: *** JOB 14027395 ON gpu009 CANCELLED AT 2024-11-30T03:47:45 DUE TO TIME LIMIT ***
