[I 2024-12-18 10:06:39,592] Trial 20 finished with value: 0.9502719091383403 and parameters: {'left_stride': 0, 'right_stride': 128, 'attention_pooling_operation': 'mean', 'embedding_pooling_operation': 'max', 'threshold': 0.8631785466345524, 'batch_size': 61, 'attention_heads': 6, 'hidden_dimension': 36, 'number_of_hidden_layers': 0, 'dropout_rate': 0.5191266879553199, 'global_pooling': 'sum', 'learning_rate': 0.0017504262373620922, 'weight_decay': 0.00022187259110746315, 'beta_0': 0.8438910399996036, 'beta_1': 0.9956608925803254, 'epsilon': 4.879076263033234e-07, 'balanced_loss': False, 'epochs': 112, 'early_stopping_patience': 23, 'plateau_patience': 12, 'plateau_divider': 8}. Best is trial 15 with value: 0.9558519399918003.
[I 2024-12-18 10:19:03,749] Trial 21 finished with value: 0.9504759124958524 and parameters: {'left_stride': 0, 'right_stride': 128, 'attention_pooling_operation': 'mean', 'embedding_pooling_operation': 'max', 'threshold': 0.8671714802450794, 'batch_size': 64, 'attention_heads': 5, 'hidden_dimension': 36, 'number_of_hidden_layers': 0, 'dropout_rate': 0.5160426629834005, 'global_pooling': 'sum', 'learning_rate': 0.0017603506793051522, 'weight_decay': 0.00017218923451216837, 'beta_0': 0.8456995900572255, 'beta_1': 0.9989426509645009, 'epsilon': 4.3900312894840703e-07, 'balanced_loss': False, 'epochs': 113, 'early_stopping_patience': 22, 'plateau_patience': 12, 'plateau_divider': 8}. Best is trial 15 with value: 0.9558519399918003.
[I 2024-12-18 10:31:28,826] Trial 22 finished with value: 0.9505741941103932 and parameters: {'left_stride': 0, 'right_stride': 128, 'attention_pooling_operation': 'mean', 'embedding_pooling_operation': 'max', 'threshold': 0.8841170973359408, 'batch_size': 35, 'attention_heads': 5, 'hidden_dimension': 71, 'number_of_hidden_layers': 0, 'dropout_rate': 0.4448513344069146, 'global_pooling': 'sum', 'learning_rate': 0.005607934282020947, 'weight_decay': 0.0001882128407454295, 'beta_0': 0.8568174169176169, 'beta_1': 0.9987684528976996, 'epsilon': 5.10803805684534e-07, 'balanced_loss': False, 'epochs': 118, 'early_stopping_patience': 20, 'plateau_patience': 12, 'plateau_divider': 7}. Best is trial 15 with value: 0.9558519399918003.
[I 2024-12-18 10:46:13,867] Trial 23 finished with value: 0.9539983138824273 and parameters: {'left_stride': 0, 'right_stride': 128, 'attention_pooling_operation': 'mean', 'embedding_pooling_operation': 'max', 'threshold': 0.9216707136958865, 'batch_size': 33, 'attention_heads': 5, 'hidden_dimension': 69, 'number_of_hidden_layers': 1, 'dropout_rate': 0.43729236582964387, 'global_pooling': 'sum', 'learning_rate': 0.007876313349317245, 'weight_decay': 6.445775781691864e-05, 'beta_0': 0.8551661734594724, 'beta_1': 0.9929616495295206, 'epsilon': 1.2141082011143717e-07, 'balanced_loss': False, 'epochs': 142, 'early_stopping_patience': 19, 'plateau_patience': 11, 'plateau_divider': 6}. Best is trial 15 with value: 0.9558519399918003.
[I 2024-12-18 10:58:42,678] Trial 24 finished with value: 0.9384034286754526 and parameters: {'left_stride': 0, 'right_stride': 128, 'attention_pooling_operation': 'mean', 'embedding_pooling_operation': 'max', 'threshold': 0.9220866341619044, 'batch_size': 50, 'attention_heads': 4, 'hidden_dimension': 80, 'number_of_hidden_layers': 1, 'dropout_rate': 0.4021451833836418, 'global_pooling': 'sum', 'learning_rate': 0.007207120741431889, 'weight_decay': 5.8260310761555996e-05, 'beta_0': 0.8727807276868152, 'beta_1': 0.9925609947971767, 'epsilon': 1.0747472203893285e-07, 'balanced_loss': False, 'epochs': 150, 'early_stopping_patience': 17, 'plateau_patience': 10, 'plateau_divider': 6}. Best is trial 15 with value: 0.9558519399918003.
[I 2024-12-18 11:11:26,361] Trial 25 finished with value: 0.8963875382551485 and parameters: {'left_stride': 0, 'right_stride': 256, 'attention_pooling_operation': 'mean', 'embedding_pooling_operation': 'max', 'threshold': 0.963322413567556, 'batch_size': 77, 'attention_heads': 7, 'hidden_dimension': 124, 'number_of_hidden_layers': 1, 'dropout_rate': 0.45249511639276696, 'global_pooling': 'sum', 'learning_rate': 0.0389976795901964, 'weight_decay': 1.9630815772803804e-05, 'beta_0': 0.8247012855944147, 'beta_1': 0.9927751283313769, 'epsilon': 2.711495434773286e-08, 'balanced_loss': False, 'epochs': 160, 'early_stopping_patience': 17, 'plateau_patience': 15, 'plateau_divider': 10}. Best is trial 15 with value: 0.9558519399918003.
[I 2024-12-18 11:24:55,963] Trial 26 finished with value: 0.8786230027173582 and parameters: {'left_stride': 0, 'right_stride': 0, 'attention_pooling_operation': 'mean', 'embedding_pooling_operation': 'max', 'threshold': 0.9408769923214684, 'batch_size': 111, 'attention_heads': 5, 'hidden_dimension': 153, 'number_of_hidden_layers': 1, 'dropout_rate': 0.3564376905446138, 'global_pooling': 'sum', 'learning_rate': 0.032698315381756014, 'weight_decay': 5.3115522991395093e-05, 'beta_0': 0.8570653954727818, 'beta_1': 0.9943285677652125, 'epsilon': 1.5126214883240803e-07, 'balanced_loss': True, 'epochs': 137, 'early_stopping_patience': 19, 'plateau_patience': 11, 'plateau_divider': 6}. Best is trial 15 with value: 0.9558519399918003.
CUDA out of memory. Tried to allocate 662.00 MiB. GPU 0 has a total capacity of 44.56 GiB of which 262.69 MiB is free. Including non-PyTorch memory, this process has 44.30 GiB memory in use. Of the allocated memory 41.48 GiB is allocated by PyTorch, and 1.66 GiB is reserved by PyTorch but unallocated. If reserved but unallocated memory is large try setting PYTORCH_CUDA_ALLOC_CONF=expandable_segments:True to avoid fragmentation.  See documentation for Memory Management  (https://pytorch.org/docs/stable/notes/cuda.html#environment-variables)
[I 2024-12-18 11:34:43,343] Trial 27 finished with value: -1.0 and parameters: {'left_stride': 128, 'right_stride': 32, 'attention_pooling_operation': 'mean', 'embedding_pooling_operation': 'max', 'threshold': 0.8101054846093967, 'batch_size': 81, 'attention_heads': 8, 'hidden_dimension': 172, 'number_of_hidden_layers': 2, 'dropout_rate': 0.434187321605497, 'global_pooling': 'sum', 'learning_rate': 0.0008587923267411983, 'weight_decay': 7.98774234956142e-05, 'beta_0': 0.8428988896177093, 'beta_1': 0.9961331881350994, 'epsilon': 7.196184631576938e-07, 'balanced_loss': False, 'epochs': 169, 'early_stopping_patience': 20, 'plateau_patience': 14, 'plateau_divider': 9}. Best is trial 15 with value: 0.9558519399918003.
[I 2024-12-18 11:48:54,724] Trial 28 finished with value: 0.9161523507500458 and parameters: {'left_stride': 0, 'right_stride': 128, 'attention_pooling_operation': 'mean', 'embedding_pooling_operation': 'max', 'threshold': 0.9197063674646984, 'batch_size': 50, 'attention_heads': 6, 'hidden_dimension': 63, 'number_of_hidden_layers': 2, 'dropout_rate': 0.3901049063821286, 'global_pooling': 'sum', 'learning_rate': 0.007543947245747004, 'weight_decay': 0.0004799609904139147, 'beta_0': 0.8885964186207054, 'beta_1': 0.9909338006389286, 'epsilon': 2.328037090502271e-06, 'balanced_loss': False, 'epochs': 129, 'early_stopping_patience': 16, 'plateau_patience': 18, 'plateau_divider': 5}. Best is trial 15 with value: 0.9558519399918003.
CUDA out of memory. Tried to allocate 1.42 GiB. GPU 0 has a total capacity of 44.56 GiB of which 670.69 MiB is free. Including non-PyTorch memory, this process has 43.90 GiB memory in use. Of the allocated memory 40.35 GiB is allocated by PyTorch, and 2.40 GiB is reserved by PyTorch but unallocated. If reserved but unallocated memory is large try setting PYTORCH_CUDA_ALLOC_CONF=expandable_segments:True to avoid fragmentation.  See documentation for Memory Management  (https://pytorch.org/docs/stable/notes/cuda.html#environment-variables)
[I 2024-12-18 12:00:56,282] Trial 29 finished with value: -1.0 and parameters: {'left_stride': 0, 'right_stride': 128, 'attention_pooling_operation': 'mean', 'embedding_pooling_operation': 'max', 'threshold': 0.878546744244989, 'batch_size': 32, 'attention_heads': 8, 'hidden_dimension': 114, 'number_of_hidden_layers': 1, 'dropout_rate': 0.3663756640200222, 'global_pooling': 'sum', 'learning_rate': 0.001182300477320937, 'weight_decay': 1.7860801319313403e-05, 'beta_0': 0.851947317570507, 'beta_1': 0.9911943270335606, 'epsilon': 2.266371733042925e-08, 'balanced_loss': True, 'epochs': 141, 'early_stopping_patience': 24, 'plateau_patience': 13, 'plateau_divider': 9}. Best is trial 15 with value: 0.9558519399918003.
CUDA out of memory. Tried to allocate 1.45 GiB. GPU 0 has a total capacity of 44.56 GiB of which 410.69 MiB is free. Including non-PyTorch memory, this process has 44.15 GiB memory in use. Of the allocated memory 40.24 GiB is allocated by PyTorch, and 2.76 GiB is reserved by PyTorch but unallocated. If reserved but unallocated memory is large try setting PYTORCH_CUDA_ALLOC_CONF=expandable_segments:True to avoid fragmentation.  See documentation for Memory Management  (https://pytorch.org/docs/stable/notes/cuda.html#environment-variables)
[I 2024-12-18 12:12:15,508] Trial 30 finished with value: -1.0 and parameters: {'left_stride': 0, 'right_stride': 128, 'attention_pooling_operation': 'mean', 'embedding_pooling_operation': 'max', 'threshold': 0.8427224228953123, 'batch_size': 115, 'attention_heads': 4, 'hidden_dimension': 136, 'number_of_hidden_layers': 1, 'dropout_rate': 0.4110181214357908, 'global_pooling': 'sum', 'learning_rate': 0.02535487234192166, 'weight_decay': 0.0008585001898257058, 'beta_0': 0.829689701935632, 'beta_1': 0.9928245806932903, 'epsilon': 7.738907033234592e-08, 'balanced_loss': False, 'epochs': 102, 'early_stopping_patience': 20, 'plateau_patience': 11, 'plateau_divider': 7}. Best is trial 15 with value: 0.9558519399918003.
[I 2024-12-18 12:24:55,660] Trial 31 finished with value: 0.953927412200013 and parameters: {'left_stride': 0, 'right_stride': 128, 'attention_pooling_operation': 'mean', 'embedding_pooling_operation': 'max', 'threshold': 0.8860350335674559, 'batch_size': 50, 'attention_heads': 5, 'hidden_dimension': 81, 'number_of_hidden_layers': 0, 'dropout_rate': 0.4445507607131097, 'global_pooling': 'sum', 'learning_rate': 0.004773189173051661, 'weight_decay': 0.00021581721538364236, 'beta_0': 0.857704317752747, 'beta_1': 0.9988026277299106, 'epsilon': 6.544607047449322e-07, 'balanced_loss': False, 'epochs': 123, 'early_stopping_patience': 20, 'plateau_patience': 13, 'plateau_divider': 7}. Best is trial 15 with value: 0.9558519399918003.
[I 2024-12-18 12:37:32,935] Trial 32 finished with value: 0.9350828219754987 and parameters: {'left_stride': 0, 'right_stride': 128, 'attention_pooling_operation': 'mean', 'embedding_pooling_operation': 'max', 'threshold': 0.9065538102577688, 'batch_size': 51, 'attention_heads': 5, 'hidden_dimension': 89, 'number_of_hidden_layers': 0, 'dropout_rate': 0.4715911927424736, 'global_pooling': 'sum', 'learning_rate': 0.010548402940511736, 'weight_decay': 0.00032163775444513164, 'beta_0': 0.8643630387442194, 'beta_1': 0.997689391243231, 'epsilon': 2.0855457724619034e-07, 'balanced_loss': False, 'epochs': 127, 'early_stopping_patience': 22, 'plateau_patience': 13, 'plateau_divider': 6}. Best is trial 15 with value: 0.9558519399918003.
[I 2024-12-18 12:49:34,235] Trial 33 finished with value: 0.9515818758102297 and parameters: {'left_stride': 0, 'right_stride': 128, 'attention_pooling_operation': 'mean', 'embedding_pooling_operation': 'max', 'threshold': 0.9549857983424763, 'batch_size': 55, 'attention_heads': 5, 'hidden_dimension': 56, 'number_of_hidden_layers': 0, 'dropout_rate': 0.4591089871578954, 'global_pooling': 'sum', 'learning_rate': 0.0032089340915160067, 'weight_decay': 8.95229579984591e-05, 'beta_0': 0.8498974159914292, 'beta_1': 0.9955468876522827, 'epsilon': 7.934421609407894e-07, 'balanced_loss': False, 'epochs': 68, 'early_stopping_patience': 18, 'plateau_patience': 15, 'plateau_divider': 5}. Best is trial 15 with value: 0.9558519399918003.
[I 2024-12-18 13:01:23,076] Trial 34 finished with value: 0.9485996449462405 and parameters: {'left_stride': 32, 'right_stride': 128, 'attention_pooling_operation': 'mean', 'embedding_pooling_operation': 'max', 'threshold': 0.9684704369841232, 'batch_size': 82, 'attention_heads': 6, 'hidden_dimension': 59, 'number_of_hidden_layers': 0, 'dropout_rate': 0.45259574161332816, 'global_pooling': 'sum', 'learning_rate': 0.0035193176992940594, 'weight_decay': 0.00024504167019183555, 'beta_0': 0.8723325988801616, 'beta_1': 0.9938145498949765, 'epsilon': 1.5248181395328212e-06, 'balanced_loss': False, 'epochs': 67, 'early_stopping_patience': 18, 'plateau_patience': 16, 'plateau_divider': 5}. Best is trial 15 with value: 0.9558519399918003.
[I 2024-12-18 13:13:24,222] Trial 35 finished with value: 0.9381314717891005 and parameters: {'left_stride': 256, 'right_stride': 32, 'attention_pooling_operation': 'mean', 'embedding_pooling_operation': 'max', 'threshold': 0.9400657889248386, 'batch_size': 166, 'attention_heads': 5, 'hidden_dimension': 91, 'number_of_hidden_layers': 0, 'dropout_rate': 0.503654880537339, 'global_pooling': 'sum', 'learning_rate': 0.020449787539403946, 'weight_decay': 4.326136289997957e-05, 'beta_0': 0.840531878809646, 'beta_1': 0.9967270970221576, 'epsilon': 8.422064301472767e-07, 'balanced_loss': False, 'epochs': 70, 'early_stopping_patience': 16, 'plateau_patience': 16, 'plateau_divider': 5}. Best is trial 15 with value: 0.9558519399918003.
[I 2024-12-18 13:25:23,772] Trial 36 finished with value: 0.9469357142552788 and parameters: {'left_stride': 64, 'right_stride': 64, 'attention_pooling_operation': 'mean', 'embedding_pooling_operation': 'max', 'threshold': 0.9492497237788468, 'batch_size': 55, 'attention_heads': 7, 'hidden_dimension': 57, 'number_of_hidden_layers': 0, 'dropout_rate': 0.4675446697293665, 'global_pooling': 'sum', 'learning_rate': 0.0045719532066028894, 'weight_decay': 8.048068326984431e-05, 'beta_0': 0.8606919626898349, 'beta_1': 0.9978114603174845, 'epsilon': 2.372174102306799e-06, 'balanced_loss': False, 'epochs': 161, 'early_stopping_patience': 18, 'plateau_patience': 18, 'plateau_divider': 7}. Best is trial 15 with value: 0.9558519399918003.
[I 2024-12-18 13:37:10,306] Trial 37 finished with value: 0.9493559454720135 and parameters: {'left_stride': 0, 'right_stride': 0, 'attention_pooling_operation': 'mean', 'embedding_pooling_operation': 'min', 'threshold': 0.9790878972913846, 'batch_size': 80, 'attention_heads': 9, 'hidden_dimension': 74, 'number_of_hidden_layers': 0, 'dropout_rate': 0.46447394481516946, 'global_pooling': 'max', 'learning_rate': 0.0020807141930053617, 'weight_decay': 0.0003855504840051275, 'beta_0': 0.8476238706867815, 'beta_1': 0.9956274390779625, 'epsilon': 4.90886031880694e-06, 'balanced_loss': False, 'epochs': 184, 'early_stopping_patience': 15, 'plateau_patience': 15, 'plateau_divider': 8}. Best is trial 15 with value: 0.9558519399918003.
CUDA out of memory. Tried to allocate 564.00 MiB. GPU 0 has a total capacity of 44.56 GiB of which 222.69 MiB is free. Including non-PyTorch memory, this process has 44.34 GiB memory in use. Of the allocated memory 42.77 GiB is allocated by PyTorch, and 424.64 MiB is reserved by PyTorch but unallocated. If reserved but unallocated memory is large try setting PYTORCH_CUDA_ALLOC_CONF=expandable_segments:True to avoid fragmentation.  See documentation for Memory Management  (https://pytorch.org/docs/stable/notes/cuda.html#environment-variables)
[I 2024-12-18 13:42:13,880] Trial 38 finished with value: -1.0 and parameters: {'left_stride': 128, 'right_stride': 128, 'attention_pooling_operation': 'min', 'embedding_pooling_operation': 'max', 'threshold': 0.6614904218473883, 'batch_size': 110, 'attention_heads': 5, 'hidden_dimension': 45, 'number_of_hidden_layers': 0, 'dropout_rate': 0.5477473510094332, 'global_pooling': 'mean', 'learning_rate': 0.0005654083673883879, 'weight_decay': 0.00014107750680977726, 'beta_0': 0.8313258780206864, 'beta_1': 0.988549560289174, 'epsilon': 8.974775070817822e-06, 'balanced_loss': True, 'epochs': 50, 'early_stopping_patience': 19, 'plateau_patience': 14, 'plateau_divider': 3}. Best is trial 15 with value: 0.9558519399918003.
[I 2024-12-18 14:01:19,928] Trial 39 finished with value: 0.9547465307264451 and parameters: {'left_stride': 0, 'right_stride': 256, 'attention_pooling_operation': 'mean', 'embedding_pooling_operation': 'min', 'threshold': 0.9246933000862712, 'batch_size': 46, 'attention_heads': 16, 'hidden_dimension': 87, 'number_of_hidden_layers': 0, 'dropout_rate': 0.43875967659806875, 'global_pooling': 'sum', 'learning_rate': 0.00014196446215295814, 'weight_decay': 4.744861904960802e-06, 'beta_0': 0.8540366251222846, 'beta_1': 0.993558980018149, 'epsilon': 2.1188740349833597e-06, 'balanced_loss': False, 'epochs': 85, 'early_stopping_patience': 22, 'plateau_patience': 17, 'plateau_divider': 4}. Best is trial 15 with value: 0.9558519399918003.
[I 2024-12-18 14:17:07,303] Trial 40 finished with value: 0.9568162959944471 and parameters: {'left_stride': 256, 'right_stride': 256, 'attention_pooling_operation': 'max', 'embedding_pooling_operation': 'min', 'threshold': 0.9153939638077027, 'batch_size': 72, 'attention_heads': 16, 'hidden_dimension': 84, 'number_of_hidden_layers': 0, 'dropout_rate': 0.4408620431887175, 'global_pooling': 'max', 'learning_rate': 0.00011926356981208386, 'weight_decay': 3.308964411903598e-06, 'beta_0': 0.8783887281828445, 'beta_1': 0.9907684832922293, 'epsilon': 1.971344568771825e-05, 'balanced_loss': False, 'epochs': 89, 'early_stopping_patience': 22, 'plateau_patience': 19, 'plateau_divider': 4}. Best is trial 40 with value: 0.9568162959944471.
[I 2024-12-18 14:31:42,432] Trial 41 finished with value: 0.9556058371500377 and parameters: {'left_stride': 256, 'right_stride': 256, 'attention_pooling_operation': 'max', 'embedding_pooling_operation': 'min', 'threshold': 0.9184396643733024, 'batch_size': 46, 'attention_heads': 16, 'hidden_dimension': 84, 'number_of_hidden_layers': 0, 'dropout_rate': 0.439578518084554, 'global_pooling': 'max', 'learning_rate': 0.0001361693490459697, 'weight_decay': 3.4073427425321834e-06, 'beta_0': 0.87900181809089, 'beta_1': 0.9903557518622905, 'epsilon': 7.766966902691868e-05, 'balanced_loss': False, 'epochs': 82, 'early_stopping_patience': 22, 'plateau_patience': 17, 'plateau_divider': 4}. Best is trial 40 with value: 0.9568162959944471.
[I 2024-12-18 14:47:43,251] Trial 42 finished with value: 0.9532215795568608 and parameters: {'left_stride': 256, 'right_stride': 256, 'attention_pooling_operation': 'max', 'embedding_pooling_operation': 'min', 'threshold': 0.9212226669164638, 'batch_size': 70, 'attention_heads': 16, 'hidden_dimension': 98, 'number_of_hidden_layers': 0, 'dropout_rate': 0.4104407478112266, 'global_pooling': 'max', 'learning_rate': 0.00013524336174745125, 'weight_decay': 2.7995857362463673e-06, 'beta_0': 0.8828038633888136, 'beta_1': 0.9902918871493361, 'epsilon': 6.969206515844011e-05, 'balanced_loss': False, 'epochs': 85, 'early_stopping_patience': 22, 'plateau_patience': 19, 'plateau_divider': 4}. Best is trial 40 with value: 0.9568162959944471.
CUDA out of memory. Tried to allocate 1.58 GiB. GPU 0 has a total capacity of 44.56 GiB of which 1.35 GiB is free. Including non-PyTorch memory, this process has 43.20 GiB memory in use. Of the allocated memory 38.76 GiB is allocated by PyTorch, and 3.29 GiB is reserved by PyTorch but unallocated. If reserved but unallocated memory is large try setting PYTORCH_CUDA_ALLOC_CONF=expandable_segments:True to avoid fragmentation.  See documentation for Memory Management  (https://pytorch.org/docs/stable/notes/cuda.html#environment-variables)
[I 2024-12-18 14:56:49,251] Trial 43 finished with value: -1.0 and parameters: {'left_stride': 256, 'right_stride': 256, 'attention_pooling_operation': 'max', 'embedding_pooling_operation': 'min', 'threshold': 0.9106950784677605, 'batch_size': 44, 'attention_heads': 16, 'hidden_dimension': 120, 'number_of_hidden_layers': 3, 'dropout_rate': 0.4386060805337867, 'global_pooling': 'max', 'learning_rate': 2.5313826107055985e-05, 'weight_decay': 5.327799536500063e-06, 'beta_0': 0.8935578624932199, 'beta_1': 0.988958551873151, 'epsilon': 2.9101614021336117e-05, 'balanced_loss': False, 'epochs': 90, 'early_stopping_patience': 24, 'plateau_patience': 17, 'plateau_divider': 3}. Best is trial 40 with value: 0.9568162959944471.
[I 2024-12-18 15:09:58,687] Trial 44 finished with value: 0.9402966280617999 and parameters: {'left_stride': 256, 'right_stride': 256, 'attention_pooling_operation': 'max', 'embedding_pooling_operation': 'min', 'threshold': 0.9774660037414785, 'batch_size': 90, 'attention_heads': 14, 'hidden_dimension': 197, 'number_of_hidden_layers': 0, 'dropout_rate': 0.42169993706230785, 'global_pooling': 'max', 'learning_rate': 0.00013300130318555104, 'weight_decay': 1.6998255522793633e-06, 'beta_0': 0.8698987808856579, 'beta_1': 0.9920166863663997, 'epsilon': 2.0099492467725066e-05, 'balanced_loss': False, 'epochs': 104, 'early_stopping_patience': 24, 'plateau_patience': 19, 'plateau_divider': 4}. Best is trial 40 with value: 0.9568162959944471.
CUDA out of memory. Tried to allocate 1.64 GiB. GPU 0 has a total capacity of 44.56 GiB of which 1.64 GiB is free. Including non-PyTorch memory, this process has 42.91 GiB memory in use. Of the allocated memory 37.59 GiB is allocated by PyTorch, and 4.17 GiB is reserved by PyTorch but unallocated. If reserved but unallocated memory is large try setting PYTORCH_CUDA_ALLOC_CONF=expandable_segments:True to avoid fragmentation.  See documentation for Memory Management  (https://pytorch.org/docs/stable/notes/cuda.html#environment-variables)
