[I 2024-12-18 06:15:47,362] A new study created in RDB with name: R8-GATv2-facebook-bart-large-Surrogate-No_Aggregation
Token indices sequence length is longer than the specified maximum sequence length for this model (1136 > 1024). Running this sequence through the model will result in indexing errors
CUDA out of memory. Tried to allocate 700.00 MiB. GPU 0 has a total capacity of 44.56 GiB of which 112.69 MiB is free. Including non-PyTorch memory, this process has 44.44 GiB memory in use. Of the allocated memory 41.43 GiB is allocated by PyTorch, and 1.87 GiB is reserved by PyTorch but unallocated. If reserved but unallocated memory is large try setting PYTORCH_CUDA_ALLOC_CONF=expandable_segments:True to avoid fragmentation.  See documentation for Memory Management  (https://pytorch.org/docs/stable/notes/cuda.html#environment-variables)
[I 2024-12-18 06:23:31,706] Trial 0 finished with value: -1.0 and parameters: {'left_stride': 32, 'right_stride': 64, 'attention_pooling_operation': 'mean', 'embedding_pooling_operation': 'min', 'threshold': 0.7564817426134086, 'batch_size': 150, 'attention_heads': 9, 'hidden_dimension': 97, 'number_of_hidden_layers': 3, 'dropout_rate': 0.34184815819561254, 'global_pooling': 'max', 'learning_rate': 0.013826232179369865, 'weight_decay': 3.972110727381911e-06, 'beta_0': 0.849951952030185, 'beta_1': 0.9912118037965686, 'epsilon': 1.5339162591163588e-08, 'balanced_loss': True, 'epochs': 59, 'early_stopping_patience': 25, 'plateau_patience': 25, 'plateau_divider': 9}. Best is trial 0 with value: -1.0.
[I 2024-12-18 06:37:21,897] Trial 1 finished with value: 0.9407957181342508 and parameters: {'left_stride': 64, 'right_stride': 64, 'attention_pooling_operation': 'max', 'embedding_pooling_operation': 'mean', 'threshold': 0.9788152345580505, 'batch_size': 233, 'attention_heads': 11, 'hidden_dimension': 239, 'number_of_hidden_layers': 0, 'dropout_rate': 0.35879485872574357, 'global_pooling': 'max', 'learning_rate': 0.00012172958098369953, 'weight_decay': 0.0003063462210622083, 'beta_0': 0.834331843801655, 'beta_1': 0.9853009566677808, 'epsilon': 1.4817820606039087e-06, 'balanced_loss': False, 'epochs': 61, 'early_stopping_patience': 25, 'plateau_patience': 22, 'plateau_divider': 3}. Best is trial 1 with value: 0.9407957181342508.
[I 2024-12-18 06:51:36,702] Trial 2 finished with value: 0.942923479532741 and parameters: {'left_stride': 32, 'right_stride': 128, 'attention_pooling_operation': 'min', 'embedding_pooling_operation': 'mean', 'threshold': 0.9605155877742886, 'batch_size': 138, 'attention_heads': 5, 'hidden_dimension': 192, 'number_of_hidden_layers': 3, 'dropout_rate': 0.46838315927084884, 'global_pooling': 'mean', 'learning_rate': 0.0005130551760589835, 'weight_decay': 1.1919481947918734e-06, 'beta_0': 0.8102310933924105, 'beta_1': 0.98059161803998, 'epsilon': 3.512704726270843e-06, 'balanced_loss': False, 'epochs': 187, 'early_stopping_patience': 13, 'plateau_patience': 16, 'plateau_divider': 8}. Best is trial 2 with value: 0.942923479532741.
CUDA out of memory. Tried to allocate 702.00 MiB. GPU 0 has a total capacity of 44.56 GiB of which 580.69 MiB is free. Including non-PyTorch memory, this process has 43.99 GiB memory in use. Of the allocated memory 42.12 GiB is allocated by PyTorch, and 735.53 MiB is reserved by PyTorch but unallocated. If reserved but unallocated memory is large try setting PYTORCH_CUDA_ALLOC_CONF=expandable_segments:True to avoid fragmentation.  See documentation for Memory Management  (https://pytorch.org/docs/stable/notes/cuda.html#environment-variables)
[I 2024-12-18 06:57:45,900] Trial 3 finished with value: -1.0 and parameters: {'left_stride': 256, 'right_stride': 64, 'attention_pooling_operation': 'min', 'embedding_pooling_operation': 'min', 'threshold': 0.7297750275380542, 'batch_size': 128, 'attention_heads': 14, 'hidden_dimension': 225, 'number_of_hidden_layers': 0, 'dropout_rate': 0.4532241907732697, 'global_pooling': 'mean', 'learning_rate': 0.00022410971619109496, 'weight_decay': 0.0006741074265640696, 'beta_0': 0.8310413476654125, 'beta_1': 0.9898114758541204, 'epsilon': 6.487477066058673e-06, 'balanced_loss': False, 'epochs': 195, 'early_stopping_patience': 14, 'plateau_patience': 17, 'plateau_divider': 4}. Best is trial 2 with value: 0.942923479532741.
CUDA out of memory. Tried to allocate 492.00 MiB. GPU 0 has a total capacity of 44.56 GiB of which 324.69 MiB is free. Including non-PyTorch memory, this process has 44.24 GiB memory in use. Of the allocated memory 41.68 GiB is allocated by PyTorch, and 1.41 GiB is reserved by PyTorch but unallocated. If reserved but unallocated memory is large try setting PYTORCH_CUDA_ALLOC_CONF=expandable_segments:True to avoid fragmentation.  See documentation for Memory Management  (https://pytorch.org/docs/stable/notes/cuda.html#environment-variables)
[I 2024-12-18 07:04:59,958] Trial 4 finished with value: -1.0 and parameters: {'left_stride': 64, 'right_stride': 32, 'attention_pooling_operation': 'min', 'embedding_pooling_operation': 'min', 'threshold': 0.7787204186204115, 'batch_size': 174, 'attention_heads': 12, 'hidden_dimension': 152, 'number_of_hidden_layers': 0, 'dropout_rate': 0.5505907486767714, 'global_pooling': 'mean', 'learning_rate': 0.002309786149269356, 'weight_decay': 0.00010781845035122267, 'beta_0': 0.8015645397505602, 'beta_1': 0.9896841863656863, 'epsilon': 8.053471030316087e-08, 'balanced_loss': True, 'epochs': 154, 'early_stopping_patience': 16, 'plateau_patience': 24, 'plateau_divider': 3}. Best is trial 2 with value: 0.942923479532741.
CUDA out of memory. Tried to allocate 9.48 GiB. GPU 0 has a total capacity of 44.56 GiB of which 4.53 GiB is free. Including non-PyTorch memory, this process has 40.02 GiB memory in use. Of the allocated memory 34.82 GiB is allocated by PyTorch, and 4.05 GiB is reserved by PyTorch but unallocated. If reserved but unallocated memory is large try setting PYTORCH_CUDA_ALLOC_CONF=expandable_segments:True to avoid fragmentation.  See documentation for Memory Management  (https://pytorch.org/docs/stable/notes/cuda.html#environment-variables)
[I 2024-12-18 07:13:58,979] Trial 5 finished with value: -1.0 and parameters: {'left_stride': 64, 'right_stride': 32, 'attention_pooling_operation': 'max', 'embedding_pooling_operation': 'min', 'threshold': 0.9040772280477951, 'batch_size': 233, 'attention_heads': 15, 'hidden_dimension': 207, 'number_of_hidden_layers': 3, 'dropout_rate': 0.3252419894985146, 'global_pooling': 'sum', 'learning_rate': 1.0883991813938131e-05, 'weight_decay': 2.015647705936503e-06, 'beta_0': 0.8650272248026284, 'beta_1': 0.9800952543380481, 'epsilon': 4.397766894483953e-08, 'balanced_loss': False, 'epochs': 148, 'early_stopping_patience': 13, 'plateau_patience': 21, 'plateau_divider': 4}. Best is trial 2 with value: 0.942923479532741.
CUDA out of memory. Tried to allocate 3.33 GiB. GPU 0 has a total capacity of 44.56 GiB of which 2.53 GiB is free. Including non-PyTorch memory, this process has 42.02 GiB memory in use. Of the allocated memory 37.62 GiB is allocated by PyTorch, and 3.25 GiB is reserved by PyTorch but unallocated. If reserved but unallocated memory is large try setting PYTORCH_CUDA_ALLOC_CONF=expandable_segments:True to avoid fragmentation.  See documentation for Memory Management  (https://pytorch.org/docs/stable/notes/cuda.html#environment-variables)
[I 2024-12-18 07:23:00,252] Trial 6 finished with value: -1.0 and parameters: {'left_stride': 128, 'right_stride': 0, 'attention_pooling_operation': 'min', 'embedding_pooling_operation': 'mean', 'threshold': 0.8519105905803794, 'batch_size': 142, 'attention_heads': 6, 'hidden_dimension': 194, 'number_of_hidden_layers': 1, 'dropout_rate': 0.30729478992943615, 'global_pooling': 'max', 'learning_rate': 0.06542056762893128, 'weight_decay': 0.0005553837526912237, 'beta_0': 0.8356502322469728, 'beta_1': 0.9802909082956842, 'epsilon': 5.167425813322413e-05, 'balanced_loss': False, 'epochs': 195, 'early_stopping_patience': 23, 'plateau_patience': 14, 'plateau_divider': 5}. Best is trial 2 with value: 0.942923479532741.
CUDA out of memory. Tried to allocate 562.00 MiB. GPU 0 has a total capacity of 44.56 GiB of which 40.69 MiB is free. Including non-PyTorch memory, this process has 44.51 GiB memory in use. Of the allocated memory 42.52 GiB is allocated by PyTorch, and 859.02 MiB is reserved by PyTorch but unallocated. If reserved but unallocated memory is large try setting PYTORCH_CUDA_ALLOC_CONF=expandable_segments:True to avoid fragmentation.  See documentation for Memory Management  (https://pytorch.org/docs/stable/notes/cuda.html#environment-variables)
[I 2024-12-18 07:30:27,517] Trial 7 finished with value: -1.0 and parameters: {'left_stride': 256, 'right_stride': 256, 'attention_pooling_operation': 'max', 'embedding_pooling_operation': 'min', 'threshold': 0.7758183080154022, 'batch_size': 98, 'attention_heads': 14, 'hidden_dimension': 214, 'number_of_hidden_layers': 4, 'dropout_rate': 0.5739721657669414, 'global_pooling': 'max', 'learning_rate': 0.0039797493741031125, 'weight_decay': 0.0001276146788173022, 'beta_0': 0.8786113098385785, 'beta_1': 0.996892198716152, 'epsilon': 2.248954284391446e-07, 'balanced_loss': True, 'epochs': 137, 'early_stopping_patience': 10, 'plateau_patience': 17, 'plateau_divider': 6}. Best is trial 2 with value: 0.942923479532741.
CUDA out of memory. Tried to allocate 3.26 GiB. GPU 0 has a total capacity of 44.56 GiB of which 1.93 GiB is free. Including non-PyTorch memory, this process has 42.62 GiB memory in use. Of the allocated memory 37.70 GiB is allocated by PyTorch, and 3.77 GiB is reserved by PyTorch but unallocated. If reserved but unallocated memory is large try setting PYTORCH_CUDA_ALLOC_CONF=expandable_segments:True to avoid fragmentation.  See documentation for Memory Management  (https://pytorch.org/docs/stable/notes/cuda.html#environment-variables)
[I 2024-12-18 07:39:28,038] Trial 8 finished with value: -1.0 and parameters: {'left_stride': 256, 'right_stride': 128, 'attention_pooling_operation': 'min', 'embedding_pooling_operation': 'max', 'threshold': 0.9041247058895944, 'batch_size': 251, 'attention_heads': 10, 'hidden_dimension': 104, 'number_of_hidden_layers': 3, 'dropout_rate': 0.38124967537862225, 'global_pooling': 'mean', 'learning_rate': 0.07089141723796885, 'weight_decay': 0.0003220626495993124, 'beta_0': 0.8683420313684149, 'beta_1': 0.9877260389162159, 'epsilon': 4.933751600448336e-08, 'balanced_loss': False, 'epochs': 132, 'early_stopping_patience': 21, 'plateau_patience': 20, 'plateau_divider': 4}. Best is trial 2 with value: 0.942923479532741.
CUDA out of memory. Tried to allocate 602.00 MiB. GPU 0 has a total capacity of 44.56 GiB of which 22.69 MiB is free. Including non-PyTorch memory, this process has 44.53 GiB memory in use. Of the allocated memory 41.92 GiB is allocated by PyTorch, and 1.46 GiB is reserved by PyTorch but unallocated. If reserved but unallocated memory is large try setting PYTORCH_CUDA_ALLOC_CONF=expandable_segments:True to avoid fragmentation.  See documentation for Memory Management  (https://pytorch.org/docs/stable/notes/cuda.html#environment-variables)
[I 2024-12-18 07:48:15,829] Trial 9 finished with value: -1.0 and parameters: {'left_stride': 0, 'right_stride': 64, 'attention_pooling_operation': 'max', 'embedding_pooling_operation': 'min', 'threshold': 0.8220606401321402, 'batch_size': 138, 'attention_heads': 6, 'hidden_dimension': 129, 'number_of_hidden_layers': 1, 'dropout_rate': 0.48475502941566495, 'global_pooling': 'mean', 'learning_rate': 0.003187422711813414, 'weight_decay': 3.2315343430749745e-05, 'beta_0': 0.8849150937783302, 'beta_1': 0.9924741264147013, 'epsilon': 4.484744524732786e-08, 'balanced_loss': False, 'epochs': 54, 'early_stopping_patience': 19, 'plateau_patience': 25, 'plateau_divider': 7}. Best is trial 2 with value: 0.942923479532741.
[I 2024-12-18 08:02:14,145] Trial 10 finished with value: 0.7533914851517357 and parameters: {'left_stride': 32, 'right_stride': 128, 'attention_pooling_operation': 'mean', 'embedding_pooling_operation': 'mean', 'threshold': 0.9942499450596111, 'batch_size': 40, 'attention_heads': 4, 'hidden_dimension': 48, 'number_of_hidden_layers': 4, 'dropout_rate': 0.5215216634175063, 'global_pooling': 'sum', 'learning_rate': 0.0002656836893415814, 'weight_decay': 8.178412772916804e-06, 'beta_0': 0.8049297522472849, 'beta_1': 0.9840036011509948, 'epsilon': 1.3261882354835817e-05, 'balanced_loss': True, 'epochs': 92, 'early_stopping_patience': 10, 'plateau_patience': 10, 'plateau_divider': 10}. Best is trial 2 with value: 0.942923479532741.
[I 2024-12-18 08:20:44,759] Trial 11 finished with value: 0.7654617076671146 and parameters: {'left_stride': 32, 'right_stride': 128, 'attention_pooling_operation': 'max', 'embedding_pooling_operation': 'mean', 'threshold': 0.9965745266953072, 'batch_size': 205, 'attention_heads': 9, 'hidden_dimension': 254, 'number_of_hidden_layers': 2, 'dropout_rate': 0.3965390541849626, 'global_pooling': 'max', 'learning_rate': 4.0083099308315954e-05, 'weight_decay': 1.9948878206620123e-05, 'beta_0': 0.8229997949552795, 'beta_1': 0.9846023396580135, 'epsilon': 1.2304350108398785e-06, 'balanced_loss': False, 'epochs': 101, 'early_stopping_patience': 18, 'plateau_patience': 13, 'plateau_divider': 2}. Best is trial 2 with value: 0.942923479532741.
CUDA out of memory. Tried to allocate 2.06 GiB. GPU 0 has a total capacity of 44.56 GiB of which 1.90 GiB is free. Including non-PyTorch memory, this process has 42.66 GiB memory in use. Of the allocated memory 40.01 GiB is allocated by PyTorch, and 1.50 GiB is reserved by PyTorch but unallocated. If reserved but unallocated memory is large try setting PYTORCH_CUDA_ALLOC_CONF=expandable_segments:True to avoid fragmentation.  See documentation for Memory Management  (https://pytorch.org/docs/stable/notes/cuda.html#environment-variables)
[I 2024-12-18 08:30:02,307] Trial 12 finished with value: -1.0 and parameters: {'left_stride': 64, 'right_stride': 256, 'attention_pooling_operation': 'min', 'embedding_pooling_operation': 'mean', 'threshold': 0.9428667987346189, 'batch_size': 94, 'attention_heads': 11, 'hidden_dimension': 174, 'number_of_hidden_layers': 2, 'dropout_rate': 0.4232817731798428, 'global_pooling': 'mean', 'learning_rate': 0.0003794553385403524, 'weight_decay': 1.0332855569626058e-06, 'beta_0': 0.8160804530670469, 'beta_1': 0.9847976982734662, 'epsilon': 1.051978058963241e-06, 'balanced_loss': False, 'epochs': 170, 'early_stopping_patience': 14, 'plateau_patience': 20, 'plateau_divider': 8}. Best is trial 2 with value: 0.942923479532741.
CUDA out of memory. Tried to allocate 528.00 MiB. GPU 0 has a total capacity of 44.56 GiB of which 302.69 MiB is free. Including non-PyTorch memory, this process has 44.26 GiB memory in use. Of the allocated memory 42.42 GiB is allocated by PyTorch, and 705.27 MiB is reserved by PyTorch but unallocated. If reserved but unallocated memory is large try setting PYTORCH_CUDA_ALLOC_CONF=expandable_segments:True to avoid fragmentation.  See documentation for Memory Management  (https://pytorch.org/docs/stable/notes/cuda.html#environment-variables)
[I 2024-12-18 08:35:19,182] Trial 13 finished with value: -1.0 and parameters: {'left_stride': 128, 'right_stride': 0, 'attention_pooling_operation': 'max', 'embedding_pooling_operation': 'mean', 'threshold': 0.6873409124367824, 'batch_size': 200, 'attention_heads': 7, 'hidden_dimension': 256, 'number_of_hidden_layers': 2, 'dropout_rate': 0.48082126313764223, 'global_pooling': 'max', 'learning_rate': 6.567919987784165e-05, 'weight_decay': 3.7947055714200486e-05, 'beta_0': 0.8379605356560551, 'beta_1': 0.9827099355668892, 'epsilon': 4.088261595658418e-06, 'balanced_loss': False, 'epochs': 97, 'early_stopping_patience': 25, 'plateau_patience': 22, 'plateau_divider': 7}. Best is trial 2 with value: 0.942923479532741.
[I 2024-12-18 08:49:32,350] Trial 14 finished with value: 0.943771694514494 and parameters: {'left_stride': 0, 'right_stride': 64, 'attention_pooling_operation': 'mean', 'embedding_pooling_operation': 'max', 'threshold': 0.9332786847765561, 'batch_size': 95, 'attention_heads': 4, 'hidden_dimension': 181, 'number_of_hidden_layers': 1, 'dropout_rate': 0.3806622045960868, 'global_pooling': 'sum', 'learning_rate': 0.0007163547440785774, 'weight_decay': 0.0001242481468574075, 'beta_0': 0.8159973543818061, 'beta_1': 0.986691679686623, 'epsilon': 3.3584310308021153e-07, 'balanced_loss': False, 'epochs': 78, 'early_stopping_patience': 21, 'plateau_patience': 14, 'plateau_divider': 2}. Best is trial 14 with value: 0.943771694514494.
[I 2024-12-18 09:05:09,351] Trial 15 finished with value: 0.9558519399918003 and parameters: {'left_stride': 0, 'right_stride': 128, 'attention_pooling_operation': 'mean', 'embedding_pooling_operation': 'max', 'threshold': 0.9069340174364714, 'batch_size': 65, 'attention_heads': 4, 'hidden_dimension': 176, 'number_of_hidden_layers': 1, 'dropout_rate': 0.4184972264557809, 'global_pooling': 'sum', 'learning_rate': 0.0012907927554706986, 'weight_decay': 9.49048471129446e-05, 'beta_0': 0.8144156676117761, 'beta_1': 0.9946506297224307, 'epsilon': 2.641771339771067e-07, 'balanced_loss': False, 'epochs': 117, 'early_stopping_patience': 21, 'plateau_patience': 15, 'plateau_divider': 8}. Best is trial 15 with value: 0.9558519399918003.
[I 2024-12-18 09:20:51,544] Trial 16 finished with value: 0.9514336064206868 and parameters: {'left_stride': 0, 'right_stride': 128, 'attention_pooling_operation': 'mean', 'embedding_pooling_operation': 'max', 'threshold': 0.8832370185709574, 'batch_size': 36, 'attention_heads': 4, 'hidden_dimension': 161, 'number_of_hidden_layers': 1, 'dropout_rate': 0.42462872333668983, 'global_pooling': 'sum', 'learning_rate': 0.00122860622618721, 'weight_decay': 0.00010905195766146757, 'beta_0': 0.8515675401044176, 'beta_1': 0.9957286903556802, 'epsilon': 2.663350180692337e-07, 'balanced_loss': False, 'epochs': 115, 'early_stopping_patience': 21, 'plateau_patience': 12, 'plateau_divider': 10}. Best is trial 15 with value: 0.9558519399918003.
CUDA out of memory. Tried to allocate 1.13 GiB. GPU 0 has a total capacity of 44.56 GiB of which 408.69 MiB is free. Including non-PyTorch memory, this process has 44.15 GiB memory in use. Of the allocated memory 40.96 GiB is allocated by PyTorch, and 2.05 GiB is reserved by PyTorch but unallocated. If reserved but unallocated memory is large try setting PYTORCH_CUDA_ALLOC_CONF=expandable_segments:True to avoid fragmentation.  See documentation for Memory Management  (https://pytorch.org/docs/stable/notes/cuda.html#environment-variables)
[I 2024-12-18 09:32:04,081] Trial 17 finished with value: -1.0 and parameters: {'left_stride': 0, 'right_stride': 128, 'attention_pooling_operation': 'mean', 'embedding_pooling_operation': 'max', 'threshold': 0.8504471575251773, 'batch_size': 38, 'attention_heads': 7, 'hidden_dimension': 135, 'number_of_hidden_layers': 1, 'dropout_rate': 0.43156852640865934, 'global_pooling': 'sum', 'learning_rate': 0.012518572091498547, 'weight_decay': 7.953225035554188e-05, 'beta_0': 0.8983389870168317, 'beta_1': 0.9975615419419763, 'epsilon': 2.7494376052367026e-07, 'balanced_loss': False, 'epochs': 112, 'early_stopping_patience': 21, 'plateau_patience': 10, 'plateau_divider': 10}. Best is trial 15 with value: 0.9558519399918003.
CUDA out of memory. Tried to allocate 1.74 GiB. GPU 0 has a total capacity of 44.56 GiB of which 126.69 MiB is free. Including non-PyTorch memory, this process has 44.43 GiB memory in use. Of the allocated memory 38.41 GiB is allocated by PyTorch, and 4.87 GiB is reserved by PyTorch but unallocated. If reserved but unallocated memory is large try setting PYTORCH_CUDA_ALLOC_CONF=expandable_segments:True to avoid fragmentation.  See documentation for Memory Management  (https://pytorch.org/docs/stable/notes/cuda.html#environment-variables)
[I 2024-12-18 09:43:17,885] Trial 18 finished with value: -1.0 and parameters: {'left_stride': 0, 'right_stride': 128, 'attention_pooling_operation': 'mean', 'embedding_pooling_operation': 'max', 'threshold': 0.8932419987571619, 'batch_size': 65, 'attention_heads': 8, 'hidden_dimension': 160, 'number_of_hidden_layers': 1, 'dropout_rate': 0.41483859277909046, 'global_pooling': 'sum', 'learning_rate': 0.0012115838294488926, 'weight_decay': 1.332619900002374e-05, 'beta_0': 0.8508960916792231, 'beta_1': 0.9945019000418447, 'epsilon': 1.4161448845446074e-07, 'balanced_loss': True, 'epochs': 121, 'early_stopping_patience': 19, 'plateau_patience': 12, 'plateau_divider': 9}. Best is trial 15 with value: 0.9558519399918003.
CUDA out of memory. Tried to allocate 536.00 MiB. GPU 0 has a total capacity of 44.56 GiB of which 262.69 MiB is free. Including non-PyTorch memory, this process has 44.30 GiB memory in use. Of the allocated memory 41.61 GiB is allocated by PyTorch, and 1.54 GiB is reserved by PyTorch but unallocated. If reserved but unallocated memory is large try setting PYTORCH_CUDA_ALLOC_CONF=expandable_segments:True to avoid fragmentation.  See documentation for Memory Management  (https://pytorch.org/docs/stable/notes/cuda.html#environment-variables)
[I 2024-12-18 09:53:59,437] Trial 19 finished with value: -1.0 and parameters: {'left_stride': 0, 'right_stride': 128, 'attention_pooling_operation': 'mean', 'embedding_pooling_operation': 'max', 'threshold': 0.8224398675525912, 'batch_size': 70, 'attention_heads': 4, 'hidden_dimension': 108, 'number_of_hidden_layers': 2, 'dropout_rate': 0.49527590330040305, 'global_pooling': 'sum', 'learning_rate': 0.013866125899083374, 'weight_decay': 5.639481675835927e-05, 'beta_0': 0.8595768306567276, 'beta_1': 0.9945781855455501, 'epsilon': 1.1608640886062668e-08, 'balanced_loss': False, 'epochs': 83, 'early_stopping_patience': 23, 'plateau_patience': 15, 'plateau_divider': 9}. Best is trial 15 with value: 0.9558519399918003.
