[I 2025-04-03 08:18:45,161] Trial 138 finished with value: 0.9426605504587156 and parameters: {'co_occurrence_pooling_operation': 'sum', 'embedding_pooling_operation': 'min', 'window_size': 6, 'batch_size': 197, 'attention_heads': 14, 'hidden_dimension': 50, 'number_of_hidden_layers': 3, 'dropout_rate': 0.5995360460829215, 'global_pooling': 'max', 'learning_rate': 8.85844267558973e-05, 'weight_decay': 2.2972998376758066e-05, 'beta_0': 0.8412117113074993, 'beta_1': 0.989655324414058, 'epsilon': 3.0655277503245815e-06, 'balanced_loss': False, 'epochs': 114, 'early_stopping_patience': 21, 'plateau_patience': 12, 'plateau_divider': 2}. Best is trial 121 with value: 0.9541284403669725.
[I 2025-04-03 08:25:12,301] Trial 139 finished with value: 0.948394495412844 and parameters: {'co_occurrence_pooling_operation': 'sum', 'embedding_pooling_operation': 'min', 'window_size': 8, 'batch_size': 203, 'attention_heads': 12, 'hidden_dimension': 41, 'number_of_hidden_layers': 3, 'dropout_rate': 0.5783955264896616, 'global_pooling': 'max', 'learning_rate': 0.0004047469658938042, 'weight_decay': 1.33377191169219e-06, 'beta_0': 0.8286140061374535, 'beta_1': 0.9891302429589737, 'epsilon': 1.5504748375241388e-06, 'balanced_loss': False, 'epochs': 127, 'early_stopping_patience': 21, 'plateau_patience': 13, 'plateau_divider': 2}. Best is trial 121 with value: 0.9541284403669725.
[I 2025-04-03 08:31:46,645] Trial 140 finished with value: 0.944954128440367 and parameters: {'co_occurrence_pooling_operation': 'sum', 'embedding_pooling_operation': 'mean', 'window_size': 9, 'batch_size': 208, 'attention_heads': 13, 'hidden_dimension': 56, 'number_of_hidden_layers': 3, 'dropout_rate': 0.5719518829574533, 'global_pooling': 'max', 'learning_rate': 0.0012885189542640209, 'weight_decay': 1.6290401389917025e-06, 'beta_0': 0.8344054559813399, 'beta_1': 0.9881950078357206, 'epsilon': 2.4398790107222383e-06, 'balanced_loss': False, 'epochs': 122, 'early_stopping_patience': 20, 'plateau_patience': 11, 'plateau_divider': 2}. Best is trial 121 with value: 0.9541284403669725.
