[I 2024-12-26 14:29:29,353] Trial 385 finished with value: 0.9696969696969697 and parameters: {'left_stride': 256, 'right_stride': 32, 'attention_pooling_operation': 'mean', 'embedding_pooling_operation': 'min', 'threshold': 0.9862320904885835, 'batch_size': 29, 'attention_heads': 4, 'hidden_dimension': 36, 'number_of_hidden_layers': 2, 'dropout_rate': 0.4004105749734838, 'global_pooling': 'mean', 'learning_rate': 0.00012286499841832535, 'weight_decay': 0.0004167348402327358, 'beta_0': 0.8282353544521925, 'beta_1': 0.99508550564434, 'epsilon': 1.536831629107968e-08, 'balanced_loss': False, 'epochs': 167, 'early_stopping_patience': 20, 'plateau_patience': 25, 'plateau_divider': 9}. Best is trial 177 with value: 0.9757575757575757.
[I 2024-12-26 15:01:03,533] Trial 386 finished with value: 0.9575757575757575 and parameters: {'left_stride': 128, 'right_stride': 0, 'attention_pooling_operation': 'mean', 'embedding_pooling_operation': 'min', 'threshold': 0.9814126381737347, 'batch_size': 27, 'attention_heads': 4, 'hidden_dimension': 51, 'number_of_hidden_layers': 2, 'dropout_rate': 0.3953664016010724, 'global_pooling': 'mean', 'learning_rate': 4.0413305461023975e-05, 'weight_decay': 0.0005596858425623455, 'beta_0': 0.8455507496145689, 'beta_1': 0.9940460952961858, 'epsilon': 2.0128872892132915e-08, 'balanced_loss': False, 'epochs': 175, 'early_stopping_patience': 17, 'plateau_patience': 25, 'plateau_divider': 8}. Best is trial 177 with value: 0.9757575757575757.
[I 2024-12-26 15:31:11,046] Trial 387 finished with value: 0.9454545454545454 and parameters: {'left_stride': 256, 'right_stride': 32, 'attention_pooling_operation': 'mean', 'embedding_pooling_operation': 'min', 'threshold': 0.9839315078708907, 'batch_size': 35, 'attention_heads': 5, 'hidden_dimension': 40, 'number_of_hidden_layers': 2, 'dropout_rate': 0.3759801692981561, 'global_pooling': 'max', 'learning_rate': 8.283267398252274e-05, 'weight_decay': 0.000467316619912408, 'beta_0': 0.8493139844776374, 'beta_1': 0.9932608074540554, 'epsilon': 1.1762040510397193e-08, 'balanced_loss': False, 'epochs': 160, 'early_stopping_patience': 16, 'plateau_patience': 24, 'plateau_divider': 8}. Best is trial 177 with value: 0.9757575757575757.
CUDA out of memory. Tried to allocate 2.67 GiB. GPU 0 has a total capacity of 44.56 GiB of which 1.69 GiB is free. Including non-PyTorch memory, this process has 42.87 GiB memory in use. Of the allocated memory 36.12 GiB is allocated by PyTorch, and 5.60 GiB is reserved by PyTorch but unallocated. If reserved but unallocated memory is large try setting PYTORCH_CUDA_ALLOC_CONF=expandable_segments:True to avoid fragmentation.  See documentation for Memory Management  (https://pytorch.org/docs/stable/notes/cuda.html#environment-variables)
[I 2024-12-26 15:56:09,794] Trial 388 finished with value: -1.0 and parameters: {'left_stride': 256, 'right_stride': 32, 'attention_pooling_operation': 'mean', 'embedding_pooling_operation': 'min', 'threshold': 0.9771552501366215, 'batch_size': 34, 'attention_heads': 4, 'hidden_dimension': 154, 'number_of_hidden_layers': 2, 'dropout_rate': 0.36291929451354005, 'global_pooling': 'mean', 'learning_rate': 6.385788697960296e-05, 'weight_decay': 0.0003080332981255421, 'beta_0': 0.8540162051014547, 'beta_1': 0.9924669221277864, 'epsilon': 1.5341251955334162e-08, 'balanced_loss': False, 'epochs': 181, 'early_stopping_patience': 17, 'plateau_patience': 25, 'plateau_divider': 8}. Best is trial 177 with value: 0.9757575757575757.
CUDA out of memory. Tried to allocate 1.52 GiB. GPU 0 has a total capacity of 44.56 GiB of which 730.69 MiB is free. Including non-PyTorch memory, this process has 43.84 GiB memory in use. Of the allocated memory 35.01 GiB is allocated by PyTorch, and 7.68 GiB is reserved by PyTorch but unallocated. If reserved but unallocated memory is large try setting PYTORCH_CUDA_ALLOC_CONF=expandable_segments:True to avoid fragmentation.  See documentation for Memory Management  (https://pytorch.org/docs/stable/notes/cuda.html#environment-variables)
[I 2024-12-26 16:05:25,712] Trial 389 finished with value: -1.0 and parameters: {'left_stride': 0, 'right_stride': 32, 'attention_pooling_operation': 'mean', 'embedding_pooling_operation': 'min', 'threshold': 0.9058994788619632, 'batch_size': 36, 'attention_heads': 4, 'hidden_dimension': 36, 'number_of_hidden_layers': 2, 'dropout_rate': 0.38061436680769467, 'global_pooling': 'mean', 'learning_rate': 0.00010370083826085317, 'weight_decay': 0.00040291123630377857, 'beta_0': 0.8506125539791163, 'beta_1': 0.9936915856731666, 'epsilon': 1.3125015143426709e-08, 'balanced_loss': False, 'epochs': 169, 'early_stopping_patience': 18, 'plateau_patience': 25, 'plateau_divider': 10}. Best is trial 177 with value: 0.9757575757575757.
CUDA out of memory. Tried to allocate 1.57 GiB. GPU 0 has a total capacity of 44.56 GiB of which 686.69 MiB is free. Including non-PyTorch memory, this process has 43.88 GiB memory in use. Of the allocated memory 29.65 GiB is allocated by PyTorch, and 13.08 GiB is reserved by PyTorch but unallocated. If reserved but unallocated memory is large try setting PYTORCH_CUDA_ALLOC_CONF=expandable_segments:True to avoid fragmentation.  See documentation for Memory Management  (https://pytorch.org/docs/stable/notes/cuda.html#environment-variables)
[I 2024-12-26 16:32:28,272] Trial 390 finished with value: -1.0 and parameters: {'left_stride': 256, 'right_stride': 32, 'attention_pooling_operation': 'mean', 'embedding_pooling_operation': 'min', 'threshold': 0.9800654636334348, 'batch_size': 31, 'attention_heads': 4, 'hidden_dimension': 32, 'number_of_hidden_layers': 2, 'dropout_rate': 0.38649915956746134, 'global_pooling': 'mean', 'learning_rate': 5.107580361768816e-05, 'weight_decay': 0.00025864123671972915, 'beta_0': 0.8474864378724277, 'beta_1': 0.9944375926260199, 'epsilon': 1.7489078754010472e-08, 'balanced_loss': False, 'epochs': 186, 'early_stopping_patience': 16, 'plateau_patience': 25, 'plateau_divider': 6}. Best is trial 177 with value: 0.9757575757575757.
CUDA out of memory. Tried to allocate 2.49 GiB. GPU 0 has a total capacity of 44.56 GiB of which 24.69 MiB is free. Including non-PyTorch memory, this process has 44.53 GiB memory in use. Of the allocated memory 36.08 GiB is allocated by PyTorch, and 7.29 GiB is reserved by PyTorch but unallocated. If reserved but unallocated memory is large try setting PYTORCH_CUDA_ALLOC_CONF=expandable_segments:True to avoid fragmentation.  See documentation for Memory Management  (https://pytorch.org/docs/stable/notes/cuda.html#environment-variables)
[I 2024-12-26 16:57:29,017] Trial 391 finished with value: -1.0 and parameters: {'left_stride': 256, 'right_stride': 32, 'attention_pooling_operation': 'mean', 'embedding_pooling_operation': 'min', 'threshold': 0.9740005397046028, 'batch_size': 32, 'attention_heads': 5, 'hidden_dimension': 42, 'number_of_hidden_layers': 2, 'dropout_rate': 0.36914517774245753, 'global_pooling': 'mean', 'learning_rate': 7.33356720894352e-05, 'weight_decay': 0.0005559992376480716, 'beta_0': 0.8068612829933263, 'beta_1': 0.9948180223984014, 'epsilon': 1.006492337644179e-08, 'balanced_loss': False, 'epochs': 174, 'early_stopping_patience': 18, 'plateau_patience': 25, 'plateau_divider': 8}. Best is trial 177 with value: 0.9757575757575757.
CUDA out of memory. Tried to allocate 1.80 GiB. GPU 0 has a total capacity of 44.56 GiB of which 76.69 MiB is free. Including non-PyTorch memory, this process has 44.48 GiB memory in use. Of the allocated memory 34.89 GiB is allocated by PyTorch, and 8.44 GiB is reserved by PyTorch but unallocated. If reserved but unallocated memory is large try setting PYTORCH_CUDA_ALLOC_CONF=expandable_segments:True to avoid fragmentation.  See documentation for Memory Management  (https://pytorch.org/docs/stable/notes/cuda.html#environment-variables)
[I 2024-12-26 17:09:17,050] Trial 392 finished with value: -1.0 and parameters: {'left_stride': 256, 'right_stride': 32, 'attention_pooling_operation': 'mean', 'embedding_pooling_operation': 'min', 'threshold': 0.9377905116323546, 'batch_size': 28, 'attention_heads': 4, 'hidden_dimension': 36, 'number_of_hidden_layers': 2, 'dropout_rate': 0.3583009486157108, 'global_pooling': 'mean', 'learning_rate': 4.230777071530969e-05, 'weight_decay': 0.0003347209079154592, 'beta_0': 0.8532923200236884, 'beta_1': 0.991306641942784, 'epsilon': 1.370343917804485e-08, 'balanced_loss': False, 'epochs': 178, 'early_stopping_patience': 17, 'plateau_patience': 24, 'plateau_divider': 9}. Best is trial 177 with value: 0.9757575757575757.
[I 2024-12-26 17:39:33,785] Trial 393 finished with value: 0.9757575757575757 and parameters: {'left_stride': 256, 'right_stride': 32, 'attention_pooling_operation': 'mean', 'embedding_pooling_operation': 'min', 'threshold': 0.9840426197415648, 'batch_size': 33, 'attention_heads': 4, 'hidden_dimension': 32, 'number_of_hidden_layers': 2, 'dropout_rate': 0.37510365911780374, 'global_pooling': 'mean', 'learning_rate': 9.830029097871212e-05, 'weight_decay': 0.00046778938379629366, 'beta_0': 0.8564466736808695, 'beta_1': 0.9928214214501634, 'epsilon': 2.321517675355403e-08, 'balanced_loss': False, 'epochs': 171, 'early_stopping_patience': 15, 'plateau_patience': 25, 'plateau_divider': 8}. Best is trial 177 with value: 0.9757575757575757.
CUDA out of memory. Tried to allocate 3.12 GiB. GPU 0 has a total capacity of 44.56 GiB of which 2.53 GiB is free. Including non-PyTorch memory, this process has 42.02 GiB memory in use. Of the allocated memory 32.84 GiB is allocated by PyTorch, and 8.03 GiB is reserved by PyTorch but unallocated. If reserved but unallocated memory is large try setting PYTORCH_CUDA_ALLOC_CONF=expandable_segments:True to avoid fragmentation.  See documentation for Memory Management  (https://pytorch.org/docs/stable/notes/cuda.html#environment-variables)
[I 2024-12-26 18:05:13,887] Trial 394 finished with value: -1.0 and parameters: {'left_stride': 256, 'right_stride': 128, 'attention_pooling_operation': 'mean', 'embedding_pooling_operation': 'min', 'threshold': 0.9818636903014352, 'batch_size': 30, 'attention_heads': 4, 'hidden_dimension': 46, 'number_of_hidden_layers': 2, 'dropout_rate': 0.39416973913830056, 'global_pooling': 'mean', 'learning_rate': 3.384036073123747e-05, 'weight_decay': 0.0003766042890072052, 'beta_0': 0.8504400274642843, 'beta_1': 0.9919684475701165, 'epsilon': 1.17818185689278e-08, 'balanced_loss': False, 'epochs': 189, 'early_stopping_patience': 19, 'plateau_patience': 25, 'plateau_divider': 8}. Best is trial 177 with value: 0.9757575757575757.
[I 2024-12-26 18:34:12,929] Trial 395 finished with value: 0.9696969696969697 and parameters: {'left_stride': 256, 'right_stride': 32, 'attention_pooling_operation': 'mean', 'embedding_pooling_operation': 'min', 'threshold': 0.9898000885821573, 'batch_size': 37, 'attention_heads': 4, 'hidden_dimension': 39, 'number_of_hidden_layers': 2, 'dropout_rate': 0.38510809785793254, 'global_pooling': 'mean', 'learning_rate': 0.00013999996113406413, 'weight_decay': 0.00022135658361070685, 'beta_0': 0.848179603442847, 'beta_1': 0.9941272338744608, 'epsilon': 1.6211503673070135e-08, 'balanced_loss': False, 'epochs': 183, 'early_stopping_patience': 16, 'plateau_patience': 25, 'plateau_divider': 9}. Best is trial 177 with value: 0.9757575757575757.
[I 2024-12-26 19:02:59,963] Trial 396 finished with value: 0.9696969696969697 and parameters: {'left_stride': 32, 'right_stride': 32, 'attention_pooling_operation': 'mean', 'embedding_pooling_operation': 'min', 'threshold': 0.9873178324788473, 'batch_size': 35, 'attention_heads': 4, 'hidden_dimension': 36, 'number_of_hidden_layers': 2, 'dropout_rate': 0.3673315709369109, 'global_pooling': 'mean', 'learning_rate': 5.835468204708853e-05, 'weight_decay': 0.0006489709960361311, 'beta_0': 0.8545004078868014, 'beta_1': 0.9932484055753592, 'epsilon': 1.1849296133555284e-08, 'balanced_loss': False, 'epochs': 177, 'early_stopping_patience': 18, 'plateau_patience': 24, 'plateau_divider': 8}. Best is trial 177 with value: 0.9757575757575757.
CUDA out of memory. Tried to allocate 2.67 GiB. GPU 0 has a total capacity of 44.56 GiB of which 886.69 MiB is free. Including non-PyTorch memory, this process has 43.69 GiB memory in use. Of the allocated memory 35.07 GiB is allocated by PyTorch, and 7.47 GiB is reserved by PyTorch but unallocated. If reserved but unallocated memory is large try setting PYTORCH_CUDA_ALLOC_CONF=expandable_segments:True to avoid fragmentation.  See documentation for Memory Management  (https://pytorch.org/docs/stable/notes/cuda.html#environment-variables)
[I 2024-12-26 19:28:21,222] Trial 397 finished with value: -1.0 and parameters: {'left_stride': 256, 'right_stride': 32, 'attention_pooling_operation': 'mean', 'embedding_pooling_operation': 'min', 'threshold': 0.9784887268325356, 'batch_size': 34, 'attention_heads': 5, 'hidden_dimension': 32, 'number_of_hidden_layers': 0, 'dropout_rate': 0.4084194306382225, 'global_pooling': 'mean', 'learning_rate': 8.07684309319297e-05, 'weight_decay': 0.00040528422549354593, 'beta_0': 0.8585953274177447, 'beta_1': 0.9937234913647353, 'epsilon': 1.8847482328971425e-08, 'balanced_loss': True, 'epochs': 97, 'early_stopping_patience': 17, 'plateau_patience': 25, 'plateau_divider': 8}. Best is trial 177 with value: 0.9757575757575757.
[I 2024-12-26 20:01:36,683] Trial 398 finished with value: 0.9636363636363636 and parameters: {'left_stride': 256, 'right_stride': 32, 'attention_pooling_operation': 'mean', 'embedding_pooling_operation': 'mean', 'threshold': 0.9849879290767274, 'batch_size': 27, 'attention_heads': 4, 'hidden_dimension': 40, 'number_of_hidden_layers': 2, 'dropout_rate': 0.3799691264934687, 'global_pooling': 'mean', 'learning_rate': 2.5917612911297263e-05, 'weight_decay': 0.0005090159562911577, 'beta_0': 0.8523352307990626, 'beta_1': 0.9927713350727952, 'epsilon': 1.0053504525823518e-08, 'balanced_loss': False, 'epochs': 174, 'early_stopping_patience': 16, 'plateau_patience': 25, 'plateau_divider': 9}. Best is trial 177 with value: 0.9757575757575757.
[I 2024-12-26 20:31:40,623] Trial 399 finished with value: 0.9696969696969697 and parameters: {'left_stride': 256, 'right_stride': 32, 'attention_pooling_operation': 'mean', 'embedding_pooling_operation': 'min', 'threshold': 0.9824245107161026, 'batch_size': 29, 'attention_heads': 4, 'hidden_dimension': 36, 'number_of_hidden_layers': 2, 'dropout_rate': 0.3722087895849033, 'global_pooling': 'mean', 'learning_rate': 6.591386939798812e-05, 'weight_decay': 0.00031460693604405096, 'beta_0': 0.8458733573066832, 'beta_1': 0.9932394252347209, 'epsilon': 1.2401916122408801e-06, 'balanced_loss': False, 'epochs': 166, 'early_stopping_patience': 14, 'plateau_patience': 16, 'plateau_divider': 7}. Best is trial 177 with value: 0.9757575757575757.
[I 2024-12-26 21:00:49,804] Trial 400 finished with value: 0.9515151515151515 and parameters: {'left_stride': 64, 'right_stride': 32, 'attention_pooling_operation': 'mean', 'embedding_pooling_operation': 'min', 'threshold': 0.9815132555255415, 'batch_size': 32, 'attention_heads': 4, 'hidden_dimension': 43, 'number_of_hidden_layers': 2, 'dropout_rate': 0.3910836080816443, 'global_pooling': 'mean', 'learning_rate': 5.075957601910078e-05, 'weight_decay': 0.0004360951107890719, 'beta_0': 0.850060588969739, 'beta_1': 0.9941479245525728, 'epsilon': 1.4533709738031157e-08, 'balanced_loss': False, 'epochs': 180, 'early_stopping_patience': 15, 'plateau_patience': 25, 'plateau_divider': 8}. Best is trial 177 with value: 0.9757575757575757.
CUDA out of memory. Tried to allocate 3.62 GiB. GPU 0 has a total capacity of 44.56 GiB of which 2.49 GiB is free. Including non-PyTorch memory, this process has 42.06 GiB memory in use. Of the allocated memory 33.58 GiB is allocated by PyTorch, and 7.33 GiB is reserved by PyTorch but unallocated. If reserved but unallocated memory is large try setting PYTORCH_CUDA_ALLOC_CONF=expandable_segments:True to avoid fragmentation.  See documentation for Memory Management  (https://pytorch.org/docs/stable/notes/cuda.html#environment-variables)
[I 2024-12-26 21:27:13,661] Trial 401 finished with value: -1.0 and parameters: {'left_stride': 256, 'right_stride': 256, 'attention_pooling_operation': 'mean', 'embedding_pooling_operation': 'min', 'threshold': 0.9856929764767334, 'batch_size': 33, 'attention_heads': 13, 'hidden_dimension': 32, 'number_of_hidden_layers': 2, 'dropout_rate': 0.4015302498690642, 'global_pooling': 'mean', 'learning_rate': 9.134920470112603e-05, 'weight_decay': 0.0002790049144647025, 'beta_0': 0.8616430655600511, 'beta_1': 0.9936547383936297, 'epsilon': 1.3534601513474232e-08, 'balanced_loss': False, 'epochs': 169, 'early_stopping_patience': 18, 'plateau_patience': 19, 'plateau_divider': 8}. Best is trial 177 with value: 0.9757575757575757.
CUDA out of memory. Tried to allocate 1.57 GiB. GPU 0 has a total capacity of 44.56 GiB of which 212.69 MiB is free. Including non-PyTorch memory, this process has 44.35 GiB memory in use. Of the allocated memory 29.86 GiB is allocated by PyTorch, and 13.34 GiB is reserved by PyTorch but unallocated. If reserved but unallocated memory is large try setting PYTORCH_CUDA_ALLOC_CONF=expandable_segments:True to avoid fragmentation.  See documentation for Memory Management  (https://pytorch.org/docs/stable/notes/cuda.html#environment-variables)
[I 2024-12-26 21:54:10,412] Trial 402 finished with value: -1.0 and parameters: {'left_stride': 256, 'right_stride': 32, 'attention_pooling_operation': 'mean', 'embedding_pooling_operation': 'min', 'threshold': 0.9798073652330419, 'batch_size': 31, 'attention_heads': 4, 'hidden_dimension': 39, 'number_of_hidden_layers': 2, 'dropout_rate': 0.3612097821675706, 'global_pooling': 'mean', 'learning_rate': 4.466722530588632e-05, 'weight_decay': 0.00034898854463181843, 'beta_0': 0.855386298276567, 'beta_1': 0.992420316260127, 'epsilon': 1.56856012239485e-08, 'balanced_loss': False, 'epochs': 57, 'early_stopping_patience': 17, 'plateau_patience': 24, 'plateau_divider': 8}. Best is trial 177 with value: 0.9757575757575757.
[I 2024-12-26 22:22:42,072] Trial 403 finished with value: 0.9696969696969697 and parameters: {'left_stride': 256, 'right_stride': 32, 'attention_pooling_operation': 'mean', 'embedding_pooling_operation': 'min', 'threshold': 0.9832398039586897, 'batch_size': 30, 'attention_heads': 4, 'hidden_dimension': 49, 'number_of_hidden_layers': 2, 'dropout_rate': 0.3833618467454214, 'global_pooling': 'mean', 'learning_rate': 0.012683947452078494, 'weight_decay': 0.0006011268973637328, 'beta_0': 0.8514901512515508, 'beta_1': 0.9946495291312027, 'epsilon': 1.1614971561613419e-08, 'balanced_loss': False, 'epochs': 193, 'early_stopping_patience': 19, 'plateau_patience': 25, 'plateau_divider': 9}. Best is trial 177 with value: 0.9757575757575757.
CUDA out of memory. Tried to allocate 2.57 GiB. GPU 0 has a total capacity of 44.56 GiB of which 754.69 MiB is free. Including non-PyTorch memory, this process has 43.82 GiB memory in use. Of the allocated memory 34.51 GiB is allocated by PyTorch, and 8.16 GiB is reserved by PyTorch but unallocated. If reserved but unallocated memory is large try setting PYTORCH_CUDA_ALLOC_CONF=expandable_segments:True to avoid fragmentation.  See documentation for Memory Management  (https://pytorch.org/docs/stable/notes/cuda.html#environment-variables)
[I 2024-12-26 22:41:56,843] Trial 404 finished with value: -1.0 and parameters: {'left_stride': 256, 'right_stride': 32, 'attention_pooling_operation': 'mean', 'embedding_pooling_operation': 'min', 'threshold': 0.9699037995390427, 'batch_size': 34, 'attention_heads': 4, 'hidden_dimension': 36, 'number_of_hidden_layers': 2, 'dropout_rate': 0.37686269465904254, 'global_pooling': 'mean', 'learning_rate': 0.00012017986922723978, 'weight_decay': 0.0003820329274368946, 'beta_0': 0.8484017272549866, 'beta_1': 0.9908452469278568, 'epsilon': 2.093467144641551e-08, 'balanced_loss': False, 'epochs': 176, 'early_stopping_patience': 18, 'plateau_patience': 25, 'plateau_divider': 8}. Best is trial 177 with value: 0.9757575757575757.
CUDA out of memory. Tried to allocate 2.67 GiB. GPU 0 has a total capacity of 44.56 GiB of which 788.69 MiB is free. Including non-PyTorch memory, this process has 43.78 GiB memory in use. Of the allocated memory 36.39 GiB is allocated by PyTorch, and 6.24 GiB is reserved by PyTorch but unallocated. If reserved but unallocated memory is large try setting PYTORCH_CUDA_ALLOC_CONF=expandable_segments:True to avoid fragmentation.  See documentation for Memory Management  (https://pytorch.org/docs/stable/notes/cuda.html#environment-variables)
[I 2024-12-26 23:06:54,155] Trial 405 finished with value: -1.0 and parameters: {'left_stride': 256, 'right_stride': 32, 'attention_pooling_operation': 'mean', 'embedding_pooling_operation': 'min', 'threshold': 0.9768109960478836, 'batch_size': 40, 'attention_heads': 5, 'hidden_dimension': 32, 'number_of_hidden_layers': 2, 'dropout_rate': 0.3536615737085421, 'global_pooling': 'mean', 'learning_rate': 7.29980243643165e-05, 'weight_decay': 0.000491627124654017, 'beta_0': 0.8535204512198152, 'beta_1': 0.9920664298496762, 'epsilon': 1.000903607575194e-08, 'balanced_loss': False, 'epochs': 172, 'early_stopping_patience': 16, 'plateau_patience': 24, 'plateau_divider': 8}. Best is trial 177 with value: 0.9757575757575757.
