[I 2024-11-28 21:42:26,222] Trial 138 finished with value: 0.8666666666666667 and parameters: {'left_stride': 0, 'right_stride': 0, 'attention_pooling_operation': 'min', 'embedding_pooling_operation': 'mean', 'threshold': 0.9345154047190681, 'batch_size': 25, 'attention_heads': 7, 'hidden_dimension': 51, 'number_of_hidden_layers': 1, 'dropout_rate': 0.43668307251692595, 'global_pooling': 'max', 'learning_rate': 0.0005908639575728114, 'weight_decay': 8.68662406853509e-06, 'beta_0': 0.8627214450602833, 'beta_1': 0.9882287537262474, 'epsilon': 1.4656896236656956e-07, 'balanced_loss': True, 'epochs': 166, 'early_stopping_patience': 13, 'plateau_patience': 18, 'plateau_divider': 7}. Best is trial 56 with value: 0.9151515151515152.
[I 2024-11-28 21:48:20,567] Trial 139 finished with value: 0.8909090909090909 and parameters: {'left_stride': 64, 'right_stride': 64, 'attention_pooling_operation': 'min', 'embedding_pooling_operation': 'mean', 'threshold': 0.9168448538912394, 'batch_size': 23, 'attention_heads': 5, 'hidden_dimension': 144, 'number_of_hidden_layers': 1, 'dropout_rate': 0.3957045196845933, 'global_pooling': 'mean', 'learning_rate': 0.0009760331092725017, 'weight_decay': 1.1003671456927965e-06, 'beta_0': 0.86762729015364, 'beta_1': 0.9864855390470186, 'epsilon': 2.0221220193449069e-07, 'balanced_loss': True, 'epochs': 186, 'early_stopping_patience': 14, 'plateau_patience': 11, 'plateau_divider': 5}. Best is trial 56 with value: 0.9151515151515152.
[I 2024-11-28 21:57:21,239] Trial 140 finished with value: 0.8787878787878788 and parameters: {'left_stride': 64, 'right_stride': 128, 'attention_pooling_operation': 'mean', 'embedding_pooling_operation': 'mean', 'threshold': 0.9026124090365738, 'batch_size': 30, 'attention_heads': 6, 'hidden_dimension': 124, 'number_of_hidden_layers': 3, 'dropout_rate': 0.4305583580659569, 'global_pooling': 'mean', 'learning_rate': 0.002039598092201199, 'weight_decay': 3.79639247384326e-06, 'beta_0': 0.8534609659178133, 'beta_1': 0.9869456816344218, 'epsilon': 1.1118093101616433e-06, 'balanced_loss': True, 'epochs': 159, 'early_stopping_patience': 15, 'plateau_patience': 10, 'plateau_divider': 9}. Best is trial 56 with value: 0.9151515151515152.
[I 2024-11-28 22:03:35,832] Trial 141 finished with value: 0.896969696969697 and parameters: {'left_stride': 64, 'right_stride': 64, 'attention_pooling_operation': 'min', 'embedding_pooling_operation': 'mean', 'threshold': 0.9260448234870712, 'batch_size': 26, 'attention_heads': 7, 'hidden_dimension': 135, 'number_of_hidden_layers': 1, 'dropout_rate': 0.462945978664828, 'global_pooling': 'mean', 'learning_rate': 0.0004424389761341468, 'weight_decay': 4.873715840063645e-06, 'beta_0': 0.8613764285305081, 'beta_1': 0.9806530227722822, 'epsilon': 9.031135237983532e-08, 'balanced_loss': True, 'epochs': 158, 'early_stopping_patience': 13, 'plateau_patience': 13, 'plateau_divider': 6}. Best is trial 56 with value: 0.9151515151515152.
[I 2024-11-28 22:09:47,198] Trial 142 finished with value: 0.896969696969697 and parameters: {'left_stride': 64, 'right_stride': 64, 'attention_pooling_operation': 'min', 'embedding_pooling_operation': 'mean', 'threshold': 0.9242088045516582, 'batch_size': 27, 'attention_heads': 8, 'hidden_dimension': 111, 'number_of_hidden_layers': 1, 'dropout_rate': 0.4508568137012549, 'global_pooling': 'mean', 'learning_rate': 0.0006195133259100235, 'weight_decay': 7.058699912581448e-06, 'beta_0': 0.8640225275464346, 'beta_1': 0.9804756275199243, 'epsilon': 1.0765718172440156e-07, 'balanced_loss': True, 'epochs': 155, 'early_stopping_patience': 12, 'plateau_patience': 14, 'plateau_divider': 6}. Best is trial 56 with value: 0.9151515151515152.
slurmstepd: error: *** JOB 14024092 ON gpu046 CANCELLED AT 2024-11-28T22:11:22 DUE TO TIME LIMIT ***
