[I 2024-11-28 12:39:42,502] Trial 54 finished with value: -1.0 and parameters: {'left_stride': 64, 'right_stride': 64, 'attention_pooling_operation': 'min', 'embedding_pooling_operation': 'mean', 'threshold': 0.9313362009363546, 'batch_size': 51, 'attention_heads': 11, 'hidden_dimension': 105, 'number_of_hidden_layers': 3, 'dropout_rate': 0.5302101800558611, 'global_pooling': 'mean', 'learning_rate': 0.0001361672064004133, 'weight_decay': 4.022068282355026e-05, 'beta_0': 0.88654416826994, 'beta_1': 0.9833617541124973, 'epsilon': 2.8960792653123456e-07, 'balanced_loss': True, 'epochs': 105, 'early_stopping_patience': 19, 'plateau_patience': 16, 'plateau_divider': 10}. Best is trial 14 with value: 0.896969696969697.
[I 2024-11-28 12:48:53,939] Trial 55 finished with value: 0.8484848484848485 and parameters: {'left_stride': 256, 'right_stride': 64, 'attention_pooling_operation': 'mean', 'embedding_pooling_operation': 'max', 'threshold': 0.9251709968398893, 'batch_size': 48, 'attention_heads': 10, 'hidden_dimension': 88, 'number_of_hidden_layers': 1, 'dropout_rate': 0.4425521837654015, 'global_pooling': 'sum', 'learning_rate': 0.0006717515628112368, 'weight_decay': 2.789717415753272e-05, 'beta_0': 0.8115180151287442, 'beta_1': 0.9924188191756892, 'epsilon': 5.066647930653514e-08, 'balanced_loss': False, 'epochs': 117, 'early_stopping_patience': 20, 'plateau_patience': 15, 'plateau_divider': 9}. Best is trial 14 with value: 0.896969696969697.
[I 2024-11-28 12:54:39,732] Trial 56 finished with value: 0.9151515151515152 and parameters: {'left_stride': 64, 'right_stride': 128, 'attention_pooling_operation': 'min', 'embedding_pooling_operation': 'mean', 'threshold': 0.9171090144652818, 'batch_size': 50, 'attention_heads': 8, 'hidden_dimension': 75, 'number_of_hidden_layers': 0, 'dropout_rate': 0.5161527646210717, 'global_pooling': 'mean', 'learning_rate': 0.0012662314827139424, 'weight_decay': 1.0833113756432047e-05, 'beta_0': 0.867435395656508, 'beta_1': 0.9859639575737218, 'epsilon': 5.441920538053404e-07, 'balanced_loss': True, 'epochs': 164, 'early_stopping_patience': 15, 'plateau_patience': 18, 'plateau_divider': 6}. Best is trial 56 with value: 0.9151515151515152.
[I 2024-11-28 13:01:17,709] Trial 57 finished with value: 0.9090909090909091 and parameters: {'left_stride': 0, 'right_stride': 128, 'attention_pooling_operation': 'mean', 'embedding_pooling_operation': 'min', 'threshold': 0.9028868410649533, 'batch_size': 25, 'attention_heads': 8, 'hidden_dimension': 75, 'number_of_hidden_layers': 0, 'dropout_rate': 0.5156811249631129, 'global_pooling': 'mean', 'learning_rate': 0.001151694056275281, 'weight_decay': 8.300653972789616e-05, 'beta_0': 0.8600786973192324, 'beta_1': 0.9863666868979869, 'epsilon': 5.570301316740977e-07, 'balanced_loss': False, 'epochs': 84, 'early_stopping_patience': 13, 'plateau_patience': 17, 'plateau_divider': 5}. Best is trial 56 with value: 0.9151515151515152.
[I 2024-11-28 13:09:56,786] Trial 58 finished with value: 0.8909090909090909 and parameters: {'left_stride': 0, 'right_stride': 128, 'attention_pooling_operation': 'mean', 'embedding_pooling_operation': 'min', 'threshold': 0.9036836908619243, 'batch_size': 25, 'attention_heads': 8, 'hidden_dimension': 76, 'number_of_hidden_layers': 4, 'dropout_rate': 0.512424869846108, 'global_pooling': 'mean', 'learning_rate': 0.0012609013783679403, 'weight_decay': 8.617575597188776e-05, 'beta_0': 0.8504283195589919, 'beta_1': 0.9859526150903924, 'epsilon': 1.4279641194366697e-06, 'balanced_loss': False, 'epochs': 186, 'early_stopping_patience': 12, 'plateau_patience': 21, 'plateau_divider': 5}. Best is trial 56 with value: 0.9151515151515152.
[I 2024-11-28 13:16:18,824] Trial 59 finished with value: 0.8666666666666667 and parameters: {'left_stride': 0, 'right_stride': 128, 'attention_pooling_operation': 'mean', 'embedding_pooling_operation': 'max', 'threshold': 0.9145356769073427, 'batch_size': 21, 'attention_heads': 9, 'hidden_dimension': 56, 'number_of_hidden_layers': 0, 'dropout_rate': 0.49714459961422813, 'global_pooling': 'max', 'learning_rate': 0.0036044397580831974, 'weight_decay': 7.84778488708981e-06, 'beta_0': 0.8589150159667587, 'beta_1': 0.9861007709717362, 'epsilon': 7.314279533365158e-07, 'balanced_loss': False, 'epochs': 86, 'early_stopping_patience': 13, 'plateau_patience': 19, 'plateau_divider': 4}. Best is trial 56 with value: 0.9151515151515152.
[I 2024-11-28 13:22:50,653] Trial 60 finished with value: 0.896969696969697 and parameters: {'left_stride': 0, 'right_stride': 128, 'attention_pooling_operation': 'mean', 'embedding_pooling_operation': 'min', 'threshold': 0.9038713776059167, 'batch_size': 27, 'attention_heads': 10, 'hidden_dimension': 44, 'number_of_hidden_layers': 0, 'dropout_rate': 0.3078022340859282, 'global_pooling': 'mean', 'learning_rate': 0.001977997442485333, 'weight_decay': 0.0004657855162020954, 'beta_0': 0.843444406130353, 'beta_1': 0.9854448385792717, 'epsilon': 2.296075329418315e-06, 'balanced_loss': False, 'epochs': 56, 'early_stopping_patience': 15, 'plateau_patience': 20, 'plateau_divider': 6}. Best is trial 56 with value: 0.9151515151515152.
[I 2024-11-28 13:29:22,353] Trial 61 finished with value: 0.8909090909090909 and parameters: {'left_stride': 0, 'right_stride': 128, 'attention_pooling_operation': 'mean', 'embedding_pooling_operation': 'min', 'threshold': 0.9000425240643853, 'batch_size': 21, 'attention_heads': 7, 'hidden_dimension': 73, 'number_of_hidden_layers': 0, 'dropout_rate': 0.5355993129475191, 'global_pooling': 'mean', 'learning_rate': 0.0010594451363644395, 'weight_decay': 5.61394232928072e-05, 'beta_0': 0.8667698383601353, 'beta_1': 0.987291659029397, 'epsilon': 1.476248900556362e-07, 'balanced_loss': False, 'epochs': 77, 'early_stopping_patience': 11, 'plateau_patience': 17, 'plateau_divider': 5}. Best is trial 56 with value: 0.9151515151515152.
[I 2024-11-28 13:36:25,912] Trial 62 finished with value: 0.8909090909090909 and parameters: {'left_stride': 128, 'right_stride': 128, 'attention_pooling_operation': 'mean', 'embedding_pooling_operation': 'min', 'threshold': 0.9113919039752566, 'batch_size': 23, 'attention_heads': 8, 'hidden_dimension': 62, 'number_of_hidden_layers': 0, 'dropout_rate': 0.5244818338379992, 'global_pooling': 'mean', 'learning_rate': 0.0016363308341828886, 'weight_decay': 7.825346294823573e-05, 'beta_0': 0.8519401561509489, 'beta_1': 0.9899886162711454, 'epsilon': 4.737129663801158e-07, 'balanced_loss': False, 'epochs': 91, 'early_stopping_patience': 15, 'plateau_patience': 18, 'plateau_divider': 6}. Best is trial 56 with value: 0.9151515151515152.
[I 2024-11-28 13:42:13,216] Trial 63 finished with value: 0.8727272727272727 and parameters: {'left_stride': 32, 'right_stride': 128, 'attention_pooling_operation': 'max', 'embedding_pooling_operation': 'min', 'threshold': 0.9157100518743647, 'batch_size': 44, 'attention_heads': 6, 'hidden_dimension': 100, 'number_of_hidden_layers': 0, 'dropout_rate': 0.5704113271788637, 'global_pooling': 'mean', 'learning_rate': 0.0004693382075881567, 'weight_decay': 0.00013803830526839254, 'beta_0': 0.8633677863379605, 'beta_1': 0.9884773665593423, 'epsilon': 4.929520066082365e-07, 'balanced_loss': False, 'epochs': 101, 'early_stopping_patience': 13, 'plateau_patience': 12, 'plateau_divider': 4}. Best is trial 56 with value: 0.9151515151515152.
[I 2024-11-28 13:49:10,615] Trial 64 finished with value: 0.8727272727272727 and parameters: {'left_stride': 256, 'right_stride': 128, 'attention_pooling_operation': 'min', 'embedding_pooling_operation': 'min', 'threshold': 0.9090252839739347, 'batch_size': 31, 'attention_heads': 7, 'hidden_dimension': 86, 'number_of_hidden_layers': 0, 'dropout_rate': 0.5070547629648972, 'global_pooling': 'mean', 'learning_rate': 0.0006590379560473277, 'weight_decay': 5.3071054245334184e-05, 'beta_0': 0.8696045516774219, 'beta_1': 0.9952582286868562, 'epsilon': 1.2613002931851673e-06, 'balanced_loss': False, 'epochs': 127, 'early_stopping_patience': 19, 'plateau_patience': 18, 'plateau_divider': 5}. Best is trial 56 with value: 0.9151515151515152.
[I 2024-11-28 13:56:56,567] Trial 65 finished with value: 0.8848484848484849 and parameters: {'left_stride': 0, 'right_stride': 256, 'attention_pooling_operation': 'mean', 'embedding_pooling_operation': 'min', 'threshold': 0.927370638831766, 'batch_size': 47, 'attention_heads': 8, 'hidden_dimension': 117, 'number_of_hidden_layers': 0, 'dropout_rate': 0.5506689576804968, 'global_pooling': 'mean', 'learning_rate': 0.006587950698477075, 'weight_decay': 0.00021582181045393705, 'beta_0': 0.8597048211451649, 'beta_1': 0.9937000929020903, 'epsilon': 4.69314201953557e-06, 'balanced_loss': True, 'epochs': 163, 'early_stopping_patience': 21, 'plateau_patience': 14, 'plateau_divider': 7}. Best is trial 56 with value: 0.9151515151515152.
[I 2024-11-28 14:02:21,155] Trial 66 finished with value: 0.8121212121212121 and parameters: {'left_stride': 32, 'right_stride': 32, 'attention_pooling_operation': 'max', 'embedding_pooling_operation': 'max', 'threshold': 0.9229615472476426, 'batch_size': 53, 'attention_heads': 8, 'hidden_dimension': 71, 'number_of_hidden_layers': 0, 'dropout_rate': 0.5359511488283162, 'global_pooling': 'sum', 'learning_rate': 0.0003314718771151989, 'weight_decay': 0.00010104494168497554, 'beta_0': 0.8750853463515774, 'beta_1': 0.992075002178006, 'epsilon': 8.380351661810937e-07, 'balanced_loss': False, 'epochs': 82, 'early_stopping_patience': 13, 'plateau_patience': 20, 'plateau_divider': 6}. Best is trial 56 with value: 0.9151515151515152.
[I 2024-11-28 14:07:34,248] Trial 67 finished with value: 0.8848484848484849 and parameters: {'left_stride': 128, 'right_stride': 0, 'attention_pooling_operation': 'min', 'embedding_pooling_operation': 'mean', 'threshold': 0.9675797759077818, 'batch_size': 41, 'attention_heads': 7, 'hidden_dimension': 43, 'number_of_hidden_layers': 0, 'dropout_rate': 0.5126737991592248, 'global_pooling': 'mean', 'learning_rate': 0.0010044816609549804, 'weight_decay': 1.4479715585979528e-05, 'beta_0': 0.8535651644486586, 'beta_1': 0.9913969496222533, 'epsilon': 6.593192530460825e-07, 'balanced_loss': False, 'epochs': 186, 'early_stopping_patience': 25, 'plateau_patience': 13, 'plateau_divider': 7}. Best is trial 56 with value: 0.9151515151515152.
[I 2024-11-28 14:13:53,038] Trial 68 finished with value: 0.806060606060606 and parameters: {'left_stride': 32, 'right_stride': 128, 'attention_pooling_operation': 'mean', 'embedding_pooling_operation': 'min', 'threshold': 0.9989161222422878, 'batch_size': 49, 'attention_heads': 6, 'hidden_dimension': 107, 'number_of_hidden_layers': 2, 'dropout_rate': 0.522130433300767, 'global_pooling': 'mean', 'learning_rate': 0.00041924096143938755, 'weight_decay': 3.419230009021419e-05, 'beta_0': 0.8464360009076545, 'beta_1': 0.9946614070592511, 'epsilon': 3.505321419447047e-07, 'balanced_loss': True, 'epochs': 199, 'early_stopping_patience': 11, 'plateau_patience': 15, 'plateau_divider': 3}. Best is trial 56 with value: 0.9151515151515152.
[I 2024-11-28 14:20:24,482] Trial 69 finished with value: 0.8848484848484849 and parameters: {'left_stride': 0, 'right_stride': 256, 'attention_pooling_operation': 'min', 'embedding_pooling_operation': 'min', 'threshold': 0.904728641295124, 'batch_size': 16, 'attention_heads': 9, 'hidden_dimension': 82, 'number_of_hidden_layers': 0, 'dropout_rate': 0.48311910408228104, 'global_pooling': 'mean', 'learning_rate': 0.00026142414406552726, 'weight_decay': 2.3604341754302754e-05, 'beta_0': 0.8359404390222007, 'beta_1': 0.9895012019433994, 'epsilon': 1.6371551815022168e-06, 'balanced_loss': False, 'epochs': 112, 'early_stopping_patience': 14, 'plateau_patience': 17, 'plateau_divider': 6}. Best is trial 56 with value: 0.9151515151515152.
[I 2024-11-28 14:28:01,680] Trial 70 finished with value: 0.8666666666666667 and parameters: {'left_stride': 64, 'right_stride': 128, 'attention_pooling_operation': 'max', 'embedding_pooling_operation': 'min', 'threshold': 0.9403689743169024, 'batch_size': 28, 'attention_heads': 10, 'hidden_dimension': 129, 'number_of_hidden_layers': 1, 'dropout_rate': 0.5595501770026279, 'global_pooling': 'max', 'learning_rate': 0.0023702977311833412, 'weight_decay': 1.9640506033121854e-05, 'beta_0': 0.8958108666080146, 'beta_1': 0.9869170917128501, 'epsilon': 2.9250827419691833e-07, 'balanced_loss': True, 'epochs': 180, 'early_stopping_patience': 18, 'plateau_patience': 19, 'plateau_divider': 8}. Best is trial 56 with value: 0.9151515151515152.
[I 2024-11-28 14:35:24,609] Trial 71 finished with value: 0.9090909090909091 and parameters: {'left_stride': 64, 'right_stride': 64, 'attention_pooling_operation': 'min', 'embedding_pooling_operation': 'mean', 'threshold': 0.9206987018541154, 'batch_size': 61, 'attention_heads': 8, 'hidden_dimension': 147, 'number_of_hidden_layers': 1, 'dropout_rate': 0.4656399376341353, 'global_pooling': 'mean', 'learning_rate': 0.0013595343112443267, 'weight_decay': 1.0173041123263668e-05, 'beta_0': 0.8669173544869553, 'beta_1': 0.9843319566416753, 'epsilon': 2.2640094145388431e-07, 'balanced_loss': True, 'epochs': 158, 'early_stopping_patience': 16, 'plateau_patience': 16, 'plateau_divider': 7}. Best is trial 56 with value: 0.9151515151515152.
CUDA out of memory. Tried to allocate 3.67 GiB. GPU 0 has a total capacity of 44.56 GiB of which 2.76 GiB is free. Including non-PyTorch memory, this process has 41.79 GiB memory in use. Of the allocated memory 40.16 GiB is allocated by PyTorch, and 493.35 MiB is reserved by PyTorch but unallocated. If reserved but unallocated memory is large try setting PYTORCH_CUDA_ALLOC_CONF=expandable_segments:True to avoid fragmentation.  See documentation for Memory Management  (https://pytorch.org/docs/stable/notes/cuda.html#environment-variables)
[I 2024-11-28 14:40:21,442] Trial 72 finished with value: -1.0 and parameters: {'left_stride': 64, 'right_stride': 64, 'attention_pooling_operation': 'min', 'embedding_pooling_operation': 'mean', 'threshold': 0.9171843566560058, 'batch_size': 61, 'attention_heads': 9, 'hidden_dimension': 148, 'number_of_hidden_layers': 2, 'dropout_rate': 0.4166011508635424, 'global_pooling': 'mean', 'learning_rate': 0.0013419702556686484, 'weight_decay': 6.016223083839743e-06, 'beta_0': 0.8657250282965002, 'beta_1': 0.9833284792496257, 'epsilon': 1.0285165466353076e-08, 'balanced_loss': True, 'epochs': 164, 'early_stopping_patience': 16, 'plateau_patience': 16, 'plateau_divider': 7}. Best is trial 56 with value: 0.9151515151515152.
[I 2024-11-28 14:47:10,109] Trial 73 finished with value: 0.9090909090909091 and parameters: {'left_stride': 64, 'right_stride': 64, 'attention_pooling_operation': 'min', 'embedding_pooling_operation': 'mean', 'threshold': 0.9135993262300269, 'batch_size': 37, 'attention_heads': 8, 'hidden_dimension': 116, 'number_of_hidden_layers': 1, 'dropout_rate': 0.4595138803587138, 'global_pooling': 'mean', 'learning_rate': 0.0008055386348700264, 'weight_decay': 4.724167336557986e-06, 'beta_0': 0.8569260001658691, 'beta_1': 0.9850571321597547, 'epsilon': 1.2948888879097807e-07, 'balanced_loss': True, 'epochs': 174, 'early_stopping_patience': 14, 'plateau_patience': 14, 'plateau_divider': 7}. Best is trial 56 with value: 0.9151515151515152.
[I 2024-11-28 14:54:39,838] Trial 74 finished with value: 0.9030303030303031 and parameters: {'left_stride': 64, 'right_stride': 64, 'attention_pooling_operation': 'min', 'embedding_pooling_operation': 'mean', 'threshold': 0.9129999390134482, 'batch_size': 58, 'attention_heads': 8, 'hidden_dimension': 159, 'number_of_hidden_layers': 1, 'dropout_rate': 0.4428188000023584, 'global_pooling': 'mean', 'learning_rate': 0.0005453029847589642, 'weight_decay': 1.6911897064775819e-06, 'beta_0': 0.8570359040254033, 'beta_1': 0.9849934081589388, 'epsilon': 7.276078485262401e-08, 'balanced_loss': True, 'epochs': 178, 'early_stopping_patience': 14, 'plateau_patience': 18, 'plateau_divider': 7}. Best is trial 56 with value: 0.9151515151515152.
[I 2024-11-28 15:02:01,052] Trial 75 finished with value: 0.8787878787878788 and parameters: {'left_stride': 64, 'right_stride': 64, 'attention_pooling_operation': 'min', 'embedding_pooling_operation': 'mean', 'threshold': 0.9134283820565198, 'batch_size': 57, 'attention_heads': 8, 'hidden_dimension': 163, 'number_of_hidden_layers': 1, 'dropout_rate': 0.43855186417711123, 'global_pooling': 'mean', 'learning_rate': 0.0005685547245805705, 'weight_decay': 1.7234363369481996e-06, 'beta_0': 0.8574633557556725, 'beta_1': 0.9851568273477571, 'epsilon': 1.0214649101689346e-07, 'balanced_loss': True, 'epochs': 179, 'early_stopping_patience': 14, 'plateau_patience': 18, 'plateau_divider': 7}. Best is trial 56 with value: 0.9151515151515152.
CUDA out of memory. Tried to allocate 4.76 GiB. GPU 0 has a total capacity of 44.56 GiB of which 378.69 MiB is free. Including non-PyTorch memory, this process has 44.18 GiB memory in use. Of the allocated memory 41.24 GiB is allocated by PyTorch, and 1.79 GiB is reserved by PyTorch but unallocated. If reserved but unallocated memory is large try setting PYTORCH_CUDA_ALLOC_CONF=expandable_segments:True to avoid fragmentation.  See documentation for Memory Management  (https://pytorch.org/docs/stable/notes/cuda.html#environment-variables)
[I 2024-11-28 15:07:37,406] Trial 76 finished with value: -1.0 and parameters: {'left_stride': 64, 'right_stride': 256, 'attention_pooling_operation': 'min', 'embedding_pooling_operation': 'mean', 'threshold': 0.9099324614805973, 'batch_size': 62, 'attention_heads': 9, 'hidden_dimension': 154, 'number_of_hidden_layers': 1, 'dropout_rate': 0.3902872629060862, 'global_pooling': 'mean', 'learning_rate': 0.0020217624269592517, 'weight_decay': 2.2512053495260527e-06, 'beta_0': 0.8620156342047116, 'beta_1': 0.9844842297722085, 'epsilon': 5.3491388621564917e-08, 'balanced_loss': True, 'epochs': 191, 'early_stopping_patience': 15, 'plateau_patience': 17, 'plateau_divider': 6}. Best is trial 56 with value: 0.9151515151515152.
CUDA out of memory. Tried to allocate 4.33 GiB. GPU 0 has a total capacity of 44.56 GiB of which 3.94 GiB is free. Including non-PyTorch memory, this process has 40.61 GiB memory in use. Of the allocated memory 37.79 GiB is allocated by PyTorch, and 1.67 GiB is reserved by PyTorch but unallocated. If reserved but unallocated memory is large try setting PYTORCH_CUDA_ALLOC_CONF=expandable_segments:True to avoid fragmentation.  See documentation for Memory Management  (https://pytorch.org/docs/stable/notes/cuda.html#environment-variables)
[I 2024-11-28 15:12:33,936] Trial 77 finished with value: -1.0 and parameters: {'left_stride': 64, 'right_stride': 32, 'attention_pooling_operation': 'min', 'embedding_pooling_operation': 'mean', 'threshold': 0.9066710944586371, 'batch_size': 58, 'attention_heads': 8, 'hidden_dimension': 175, 'number_of_hidden_layers': 1, 'dropout_rate': 0.46165192757841733, 'global_pooling': 'mean', 'learning_rate': 0.003120977273285788, 'weight_decay': 4.306403756564957e-06, 'beta_0': 0.8541838560999058, 'beta_1': 0.9836772231355798, 'epsilon': 6.938111392842425e-08, 'balanced_loss': False, 'epochs': 168, 'early_stopping_patience': 14, 'plateau_patience': 18, 'plateau_divider': 7}. Best is trial 56 with value: 0.9151515151515152.
CUDA out of memory. Tried to allocate 3.31 GiB. GPU 0 has a total capacity of 44.56 GiB of which 2.03 GiB is free. Including non-PyTorch memory, this process has 42.52 GiB memory in use. Of the allocated memory 39.85 GiB is allocated by PyTorch, and 1.52 GiB is reserved by PyTorch but unallocated. If reserved but unallocated memory is large try setting PYTORCH_CUDA_ALLOC_CONF=expandable_segments:True to avoid fragmentation.  See documentation for Memory Management  (https://pytorch.org/docs/stable/notes/cuda.html#environment-variables)
[I 2024-11-28 15:18:36,530] Trial 78 finished with value: -1.0 and parameters: {'left_stride': 64, 'right_stride': 64, 'attention_pooling_operation': 'mean', 'embedding_pooling_operation': 'mean', 'threshold': 0.919522406440045, 'batch_size': 61, 'attention_heads': 7, 'hidden_dimension': 167, 'number_of_hidden_layers': 2, 'dropout_rate': 0.4506928370915358, 'global_pooling': 'mean', 'learning_rate': 0.00019102601600528774, 'weight_decay': 2.6256616758693054e-06, 'beta_0': 0.8503451569444594, 'beta_1': 0.9852559166694531, 'epsilon': 3.78593782603419e-08, 'balanced_loss': True, 'epochs': 157, 'early_stopping_patience': 16, 'plateau_patience': 19, 'plateau_divider': 7}. Best is trial 56 with value: 0.9151515151515152.
CUDA out of memory. Tried to allocate 4.96 GiB. GPU 0 has a total capacity of 44.56 GiB of which 4.75 GiB is free. Including non-PyTorch memory, this process has 39.80 GiB memory in use. Of the allocated memory 37.86 GiB is allocated by PyTorch, and 806.66 MiB is reserved by PyTorch but unallocated. If reserved but unallocated memory is large try setting PYTORCH_CUDA_ALLOC_CONF=expandable_segments:True to avoid fragmentation.  See documentation for Memory Management  (https://pytorch.org/docs/stable/notes/cuda.html#environment-variables)
[I 2024-11-28 15:23:33,533] Trial 79 finished with value: -1.0 and parameters: {'left_stride': 64, 'right_stride': 64, 'attention_pooling_operation': 'min', 'embedding_pooling_operation': 'mean', 'threshold': 0.9022205371485885, 'batch_size': 55, 'attention_heads': 9, 'hidden_dimension': 186, 'number_of_hidden_layers': 1, 'dropout_rate': 0.4266969243563319, 'global_pooling': 'mean', 'learning_rate': 0.0011222123127563434, 'weight_decay': 1.3476636869007817e-06, 'beta_0': 0.8565982859382812, 'beta_1': 0.9821187331165617, 'epsilon': 1.4354662919275186e-07, 'balanced_loss': False, 'epochs': 177, 'early_stopping_patience': 12, 'plateau_patience': 20, 'plateau_divider': 6}. Best is trial 56 with value: 0.9151515151515152.
