[I 2024-11-22 07:50:17,654] Trial 22 finished with value: -1.0 and parameters: {'left_stride': 32, 'right_stride': 128, 'attention_pooling_operation': 'mean', 'embedding_pooling_operation': 'max', 'threshold': 0.9644823002203178, 'batch_size': 53, 'attention_heads': 9, 'hidden_dimension': 68, 'number_of_hidden_layers': 1, 'dropout_rate': 0.44492801826301637, 'global_pooling': 'mean', 'learning_rate': 0.020556412817056054, 'weight_decay': 7.74211138275677e-05, 'beta_0': 0.8230010286407936, 'beta_1': 0.9987664073902032, 'epsilon': 8.488593831043961e-05, 'balanced_loss': True, 'epochs': 155, 'early_stopping_patience': 21, 'plateau_patience': 22, 'plateau_divider': 7}. Best is trial 17 with value: 0.9030303030303031.
CUDA out of memory. Tried to allocate 3.65 GiB. GPU 0 has a total capacity of 44.56 GiB of which 1.24 GiB is free. Including non-PyTorch memory, this process has 43.32 GiB memory in use. Of the allocated memory 40.55 GiB is allocated by PyTorch, and 1.62 GiB is reserved by PyTorch but unallocated. If reserved but unallocated memory is large try setting PYTORCH_CUDA_ALLOC_CONF=expandable_segments:True to avoid fragmentation.  See documentation for Memory Management  (https://pytorch.org/docs/stable/notes/cuda.html#environment-variables)
[I 2024-11-22 08:04:42,401] Trial 23 finished with value: -1.0 and parameters: {'left_stride': 32, 'right_stride': 128, 'attention_pooling_operation': 'mean', 'embedding_pooling_operation': 'max', 'threshold': 0.9503344898770817, 'batch_size': 44, 'attention_heads': 7, 'hidden_dimension': 89, 'number_of_hidden_layers': 2, 'dropout_rate': 0.4864278147479409, 'global_pooling': 'mean', 'learning_rate': 0.0017368631036271973, 'weight_decay': 1.7292189613103474e-05, 'beta_0': 0.8379805235817134, 'beta_1': 0.9962145483072433, 'epsilon': 2.9922552545582425e-05, 'balanced_loss': True, 'epochs': 168, 'early_stopping_patience': 21, 'plateau_patience': 18, 'plateau_divider': 5}. Best is trial 17 with value: 0.9030303030303031.
[I 2024-11-22 08:21:23,241] Trial 24 finished with value: 0.8363636363636363 and parameters: {'left_stride': 32, 'right_stride': 128, 'attention_pooling_operation': 'mean', 'embedding_pooling_operation': 'max', 'threshold': 0.9764520176269705, 'batch_size': 53, 'attention_heads': 12, 'hidden_dimension': 61, 'number_of_hidden_layers': 1, 'dropout_rate': 0.45743846770982705, 'global_pooling': 'mean', 'learning_rate': 0.032963153428587764, 'weight_decay': 6.436828993883253e-06, 'beta_0': 0.8569044054279659, 'beta_1': 0.9945886319381947, 'epsilon': 6.255603300394717e-07, 'balanced_loss': True, 'epochs': 180, 'early_stopping_patience': 17, 'plateau_patience': 15, 'plateau_divider': 8}. Best is trial 17 with value: 0.9030303030303031.
CUDA out of memory. Tried to allocate 2.98 GiB. GPU 0 has a total capacity of 44.56 GiB of which 2.59 GiB is free. Including non-PyTorch memory, this process has 41.96 GiB memory in use. Of the allocated memory 37.82 GiB is allocated by PyTorch, and 3.00 GiB is reserved by PyTorch but unallocated. If reserved but unallocated memory is large try setting PYTORCH_CUDA_ALLOC_CONF=expandable_segments:True to avoid fragmentation.  See documentation for Memory Management  (https://pytorch.org/docs/stable/notes/cuda.html#environment-variables)
[I 2024-11-22 08:33:06,659] Trial 25 finished with value: -1.0 and parameters: {'left_stride': 128, 'right_stride': 256, 'attention_pooling_operation': 'min', 'embedding_pooling_operation': 'max', 'threshold': 0.9876118756373058, 'batch_size': 57, 'attention_heads': 10, 'hidden_dimension': 115, 'number_of_hidden_layers': 2, 'dropout_rate': 0.42065568530486896, 'global_pooling': 'mean', 'learning_rate': 0.00665465935481395, 'weight_decay': 1.9630815772803804e-05, 'beta_0': 0.8247012855944147, 'beta_1': 0.9967487802703077, 'epsilon': 5.130909047619115e-06, 'balanced_loss': True, 'epochs': 121, 'early_stopping_patience': 19, 'plateau_patience': 18, 'plateau_divider': 2}. Best is trial 17 with value: 0.9030303030303031.
[I 2024-11-22 08:49:00,320] Trial 26 finished with value: 0.8848484848484849 and parameters: {'left_stride': 32, 'right_stride': 128, 'attention_pooling_operation': 'mean', 'embedding_pooling_operation': 'max', 'threshold': 0.964880139986878, 'batch_size': 63, 'attention_heads': 7, 'hidden_dimension': 36, 'number_of_hidden_layers': 2, 'dropout_rate': 0.37325772003717206, 'global_pooling': 'mean', 'learning_rate': 0.0012224923497385423, 'weight_decay': 5.3115522991395093e-05, 'beta_0': 0.811378315404217, 'beta_1': 0.9939740670886705, 'epsilon': 2.058054521307049e-05, 'balanced_loss': True, 'epochs': 142, 'early_stopping_patience': 20, 'plateau_patience': 20, 'plateau_divider': 7}. Best is trial 17 with value: 0.9030303030303031.
CUDA out of memory. Tried to allocate 4.16 GiB. GPU 0 has a total capacity of 44.56 GiB of which 2.23 GiB is free. Including non-PyTorch memory, this process has 42.32 GiB memory in use. Of the allocated memory 39.39 GiB is allocated by PyTorch, and 1.78 GiB is reserved by PyTorch but unallocated. If reserved but unallocated memory is large try setting PYTORCH_CUDA_ALLOC_CONF=expandable_segments:True to avoid fragmentation.  See documentation for Memory Management  (https://pytorch.org/docs/stable/notes/cuda.html#environment-variables)
[I 2024-11-22 09:02:05,084] Trial 27 finished with value: -1.0 and parameters: {'left_stride': 32, 'right_stride': 32, 'attention_pooling_operation': 'mean', 'embedding_pooling_operation': 'max', 'threshold': 0.9533783784552874, 'batch_size': 50, 'attention_heads': 9, 'hidden_dimension': 84, 'number_of_hidden_layers': 1, 'dropout_rate': 0.5010212776847294, 'global_pooling': 'mean', 'learning_rate': 0.006009813639207537, 'weight_decay': 1.2023295261029092e-05, 'beta_0': 0.8279869858548541, 'beta_1': 0.9979511976411359, 'epsilon': 4.866441206106495e-05, 'balanced_loss': True, 'epochs': 160, 'early_stopping_patience': 17, 'plateau_patience': 23, 'plateau_divider': 9}. Best is trial 17 with value: 0.9030303030303031.
[I 2024-11-22 09:12:30,476] Trial 28 finished with value: 0.7575757575757576 and parameters: {'left_stride': 32, 'right_stride': 128, 'attention_pooling_operation': 'min', 'embedding_pooling_operation': 'max', 'threshold': 0.985943912944941, 'batch_size': 45, 'attention_heads': 5, 'hidden_dimension': 57, 'number_of_hidden_layers': 3, 'dropout_rate': 0.47316466120686435, 'global_pooling': 'mean', 'learning_rate': 0.03196164841547606, 'weight_decay': 2.3766354122700476e-06, 'beta_0': 0.8411015115665882, 'beta_1': 0.996074626803753, 'epsilon': 1.0059445889819862e-05, 'balanced_loss': True, 'epochs': 178, 'early_stopping_patience': 23, 'plateau_patience': 16, 'plateau_divider': 5}. Best is trial 17 with value: 0.9030303030303031.
CUDA out of memory. Tried to allocate 3.83 GiB. GPU 0 has a total capacity of 44.56 GiB of which 2.65 GiB is free. Including non-PyTorch memory, this process has 41.91 GiB memory in use. Of the allocated memory 36.25 GiB is allocated by PyTorch, and 4.50 GiB is reserved by PyTorch but unallocated. If reserved but unallocated memory is large try setting PYTORCH_CUDA_ALLOC_CONF=expandable_segments:True to avoid fragmentation.  See documentation for Memory Management  (https://pytorch.org/docs/stable/notes/cuda.html#environment-variables)
[I 2024-11-22 09:21:47,766] Trial 29 finished with value: -1.0 and parameters: {'left_stride': 32, 'right_stride': 128, 'attention_pooling_operation': 'max', 'embedding_pooling_operation': 'max', 'threshold': 0.976151130154829, 'batch_size': 56, 'attention_heads': 11, 'hidden_dimension': 97, 'number_of_hidden_layers': 3, 'dropout_rate': 0.4358588904526797, 'global_pooling': 'max', 'learning_rate': 0.007779417001317683, 'weight_decay': 4.432367246922409e-06, 'beta_0': 0.8005446921906328, 'beta_1': 0.9976726266793812, 'epsilon': 4.840532317846748e-05, 'balanced_loss': True, 'epochs': 122, 'early_stopping_patience': 18, 'plateau_patience': 19, 'plateau_divider': 6}. Best is trial 17 with value: 0.9030303030303031.
[I 2024-11-22 09:35:57,688] Trial 30 finished with value: 0.896969696969697 and parameters: {'left_stride': 64, 'right_stride': 0, 'attention_pooling_operation': 'mean', 'embedding_pooling_operation': 'max', 'threshold': 0.9921133892059124, 'batch_size': 50, 'attention_heads': 5, 'hidden_dimension': 118, 'number_of_hidden_layers': 2, 'dropout_rate': 0.4096228921347802, 'global_pooling': 'mean', 'learning_rate': 0.023861312973170335, 'weight_decay': 5.176911304871817e-06, 'beta_0': 0.8541763877967351, 'beta_1': 0.9923834718044858, 'epsilon': 9.581382467746047e-05, 'balanced_loss': True, 'epochs': 187, 'early_stopping_patience': 23, 'plateau_patience': 12, 'plateau_divider': 9}. Best is trial 17 with value: 0.9030303030303031.
[I 2024-11-22 09:50:20,539] Trial 31 finished with value: 0.8666666666666667 and parameters: {'left_stride': 64, 'right_stride': 0, 'attention_pooling_operation': 'mean', 'embedding_pooling_operation': 'max', 'threshold': 0.9918167931353443, 'batch_size': 50, 'attention_heads': 5, 'hidden_dimension': 123, 'number_of_hidden_layers': 2, 'dropout_rate': 0.3981110808095851, 'global_pooling': 'mean', 'learning_rate': 0.032984283437749236, 'weight_decay': 5.673600306888901e-06, 'beta_0': 0.857704317752747, 'beta_1': 0.9917867123951899, 'epsilon': 7.010959401990346e-05, 'balanced_loss': True, 'epochs': 198, 'early_stopping_patience': 23, 'plateau_patience': 12, 'plateau_divider': 9}. Best is trial 17 with value: 0.9030303030303031.
[I 2024-11-22 10:04:23,837] Trial 32 finished with value: 0.8666666666666667 and parameters: {'left_stride': 64, 'right_stride': 0, 'attention_pooling_operation': 'mean', 'embedding_pooling_operation': 'max', 'threshold': 0.9937622048760582, 'batch_size': 42, 'attention_heads': 6, 'hidden_dimension': 147, 'number_of_hidden_layers': 2, 'dropout_rate': 0.36441660423618766, 'global_pooling': 'mean', 'learning_rate': 0.02012194283318574, 'weight_decay': 1.0495462625853802e-05, 'beta_0': 0.8516882188226724, 'beta_1': 0.9932169213127886, 'epsilon': 2.0087316233033814e-05, 'balanced_loss': True, 'epochs': 185, 'early_stopping_patience': 22, 'plateau_patience': 12, 'plateau_divider': 8}. Best is trial 17 with value: 0.9030303030303031.
[I 2024-11-22 10:19:01,405] Trial 33 finished with value: 0.9030303030303031 and parameters: {'left_stride': 64, 'right_stride': 0, 'attention_pooling_operation': 'mean', 'embedding_pooling_operation': 'max', 'threshold': 0.9789286151053663, 'batch_size': 59, 'attention_heads': 9, 'hidden_dimension': 85, 'number_of_hidden_layers': 0, 'dropout_rate': 0.33970974962768563, 'global_pooling': 'mean', 'learning_rate': 0.05231599470062311, 'weight_decay': 2.622850773144596e-06, 'beta_0': 0.8109516001371364, 'beta_1': 0.9954383283477783, 'epsilon': 9.044816260153586e-05, 'balanced_loss': True, 'epochs': 163, 'early_stopping_patience': 25, 'plateau_patience': 15, 'plateau_divider': 10}. Best is trial 17 with value: 0.9030303030303031.
[I 2024-11-22 10:32:24,274] Trial 34 finished with value: 0.8242424242424242 and parameters: {'left_stride': 64, 'right_stride': 0, 'attention_pooling_operation': 'mean', 'embedding_pooling_operation': 'max', 'threshold': 0.9893919998738766, 'batch_size': 59, 'attention_heads': 5, 'hidden_dimension': 89, 'number_of_hidden_layers': 0, 'dropout_rate': 0.34334801976378215, 'global_pooling': 'max', 'learning_rate': 0.0440567247908833, 'weight_decay': 3.4076834842484316e-06, 'beta_0': 0.8072805495421588, 'beta_1': 0.9950315559476439, 'epsilon': 9.443938507201625e-05, 'balanced_loss': True, 'epochs': 160, 'early_stopping_patience': 25, 'plateau_patience': 15, 'plateau_divider': 10}. Best is trial 17 with value: 0.9030303030303031.
[I 2024-11-22 10:42:05,361] Trial 35 finished with value: 0.8242424242424242 and parameters: {'left_stride': 64, 'right_stride': 0, 'attention_pooling_operation': 'min', 'embedding_pooling_operation': 'max', 'threshold': 0.9775219394020076, 'batch_size': 61, 'attention_heads': 9, 'hidden_dimension': 101, 'number_of_hidden_layers': 0, 'dropout_rate': 0.35227255802889634, 'global_pooling': 'mean', 'learning_rate': 0.07580242947910101, 'weight_decay': 2.0528269844214143e-06, 'beta_0': 0.8103755073621519, 'beta_1': 0.990319447424958, 'epsilon': 4.2485078660376705e-05, 'balanced_loss': True, 'epochs': 184, 'early_stopping_patience': 24, 'plateau_patience': 14, 'plateau_divider': 10}. Best is trial 17 with value: 0.9030303030303031.
[I 2024-11-22 10:55:35,368] Trial 36 finished with value: 0.896969696969697 and parameters: {'left_stride': 64, 'right_stride': 64, 'attention_pooling_operation': 'max', 'embedding_pooling_operation': 'max', 'threshold': 0.9944451890306729, 'batch_size': 56, 'attention_heads': 11, 'hidden_dimension': 138, 'number_of_hidden_layers': 3, 'dropout_rate': 0.30238949804569726, 'global_pooling': 'mean', 'learning_rate': 0.00425783968579193, 'weight_decay': 1.5648681983490151e-06, 'beta_0': 0.8189832450912006, 'beta_1': 0.9956597492141985, 'epsilon': 6.465215130791966e-06, 'balanced_loss': True, 'epochs': 148, 'early_stopping_patience': 24, 'plateau_patience': 11, 'plateau_divider': 9}. Best is trial 17 with value: 0.9030303030303031.
[I 2024-11-22 11:09:41,358] Trial 37 finished with value: 0.9030303030303031 and parameters: {'left_stride': 64, 'right_stride': 64, 'attention_pooling_operation': 'max', 'embedding_pooling_operation': 'max', 'threshold': 0.9943289064898143, 'batch_size': 56, 'attention_heads': 12, 'hidden_dimension': 159, 'number_of_hidden_layers': 3, 'dropout_rate': 0.30282122741003387, 'global_pooling': 'mean', 'learning_rate': 0.0012869815650374402, 'weight_decay': 1.5347245585198373e-06, 'beta_0': 0.8140035074544935, 'beta_1': 0.9927973090457759, 'epsilon': 6.2057643302031515e-06, 'balanced_loss': True, 'epochs': 147, 'early_stopping_patience': 24, 'plateau_patience': 11, 'plateau_divider': 9}. Best is trial 17 with value: 0.9030303030303031.
[I 2024-11-22 11:23:09,426] Trial 38 finished with value: 0.8181818181818182 and parameters: {'left_stride': 64, 'right_stride': 64, 'attention_pooling_operation': 'max', 'embedding_pooling_operation': 'min', 'threshold': 0.9933400397853865, 'batch_size': 60, 'attention_heads': 12, 'hidden_dimension': 156, 'number_of_hidden_layers': 3, 'dropout_rate': 0.3297752113624004, 'global_pooling': 'max', 'learning_rate': 0.001291125850359759, 'weight_decay': 2.6496179955906545e-06, 'beta_0': 0.831646413528015, 'beta_1': 0.9911365298537852, 'epsilon': 2.6736106394990433e-06, 'balanced_loss': True, 'epochs': 190, 'early_stopping_patience': 25, 'plateau_patience': 13, 'plateau_divider': 10}. Best is trial 17 with value: 0.9030303030303031.
CUDA out of memory. Tried to allocate 30.90 GiB. GPU 0 has a total capacity of 44.56 GiB of which 5.13 GiB is free. Including non-PyTorch memory, this process has 39.43 GiB memory in use. Of the allocated memory 35.91 GiB is allocated by PyTorch, and 2.37 GiB is reserved by PyTorch but unallocated. If reserved but unallocated memory is large try setting PYTORCH_CUDA_ALLOC_CONF=expandable_segments:True to avoid fragmentation.  See documentation for Memory Management  (https://pytorch.org/docs/stable/notes/cuda.html#environment-variables)
[I 2024-11-22 11:32:12,778] Trial 39 finished with value: -1.0 and parameters: {'left_stride': 64, 'right_stride': 64, 'attention_pooling_operation': 'max', 'embedding_pooling_operation': 'max', 'threshold': 0.9262213584755216, 'batch_size': 64, 'attention_heads': 16, 'hidden_dimension': 159, 'number_of_hidden_layers': 0, 'dropout_rate': 0.31725875494458816, 'global_pooling': 'mean', 'learning_rate': 0.0024952606654123142, 'weight_decay': 1.4118962577875292e-06, 'beta_0': 0.8668623322392988, 'beta_1': 0.9885791096332979, 'epsilon': 1.213965801256414e-08, 'balanced_loss': True, 'epochs': 131, 'early_stopping_patience': 24, 'plateau_patience': 11, 'plateau_divider': 9}. Best is trial 17 with value: 0.9030303030303031.
CUDA out of memory. Tried to allocate 14.91 GiB. GPU 0 has a total capacity of 44.56 GiB of which 434.69 MiB is free. Including non-PyTorch memory, this process has 44.13 GiB memory in use. Of the allocated memory 41.26 GiB is allocated by PyTorch, and 1.72 GiB is reserved by PyTorch but unallocated. If reserved but unallocated memory is large try setting PYTORCH_CUDA_ALLOC_CONF=expandable_segments:True to avoid fragmentation.  See documentation for Memory Management  (https://pytorch.org/docs/stable/notes/cuda.html#environment-variables)
[I 2024-11-22 11:40:47,722] Trial 40 finished with value: -1.0 and parameters: {'left_stride': 64, 'right_stride': 0, 'attention_pooling_operation': 'max', 'embedding_pooling_operation': 'min', 'threshold': 0.9425040284401959, 'batch_size': 47, 'attention_heads': 13, 'hidden_dimension': 180, 'number_of_hidden_layers': 3, 'dropout_rate': 0.32769133994947064, 'global_pooling': 'mean', 'learning_rate': 0.09219481150376069, 'weight_decay': 1.0005072453856697e-06, 'beta_0': 0.8735438422138055, 'beta_1': 0.993275844932673, 'epsilon': 1.002796620707586e-06, 'balanced_loss': False, 'epochs': 145, 'early_stopping_patience': 22, 'plateau_patience': 13, 'plateau_divider': 10}. Best is trial 17 with value: 0.9030303030303031.
[I 2024-11-22 11:54:15,449] Trial 41 finished with value: 0.8666666666666667 and parameters: {'left_stride': 64, 'right_stride': 64, 'attention_pooling_operation': 'max', 'embedding_pooling_operation': 'max', 'threshold': 0.9951167869834744, 'batch_size': 56, 'attention_heads': 11, 'hidden_dimension': 140, 'number_of_hidden_layers': 3, 'dropout_rate': 0.3019425910339158, 'global_pooling': 'mean', 'learning_rate': 0.003910485643425009, 'weight_decay': 1.7164988025788006e-06, 'beta_0': 0.8187513860467421, 'beta_1': 0.9956358212487029, 'epsilon': 7.682748943540073e-06, 'balanced_loss': True, 'epochs': 150, 'early_stopping_patience': 24, 'plateau_patience': 11, 'plateau_divider': 9}. Best is trial 17 with value: 0.9030303030303031.
CUDA out of memory. Tried to allocate 3.32 GiB. GPU 0 has a total capacity of 44.56 GiB of which 3.25 GiB is free. Including non-PyTorch memory, this process has 41.30 GiB memory in use. Of the allocated memory 38.39 GiB is allocated by PyTorch, and 1.77 GiB is reserved by PyTorch but unallocated. If reserved but unallocated memory is large try setting PYTORCH_CUDA_ALLOC_CONF=expandable_segments:True to avoid fragmentation.  See documentation for Memory Management  (https://pytorch.org/docs/stable/notes/cuda.html#environment-variables)
[I 2024-11-22 12:03:18,340] Trial 42 finished with value: -1.0 and parameters: {'left_stride': 64, 'right_stride': 64, 'attention_pooling_operation': 'max', 'embedding_pooling_operation': 'max', 'threshold': 0.9875738249302448, 'batch_size': 58, 'attention_heads': 13, 'hidden_dimension': 137, 'number_of_hidden_layers': 3, 'dropout_rate': 0.3149876358973178, 'global_pooling': 'mean', 'learning_rate': 0.00039078075892526505, 'weight_decay': 2.648053942820115e-06, 'beta_0': 0.8130477495556874, 'beta_1': 0.9935778863927742, 'epsilon': 5.196182624081582e-06, 'balanced_loss': True, 'epochs': 158, 'early_stopping_patience': 24, 'plateau_patience': 11, 'plateau_divider': 9}. Best is trial 17 with value: 0.9030303030303031.
[I 2024-11-22 12:18:47,626] Trial 43 finished with value: 0.9151515151515152 and parameters: {'left_stride': 64, 'right_stride': 64, 'attention_pooling_operation': 'max', 'embedding_pooling_operation': 'max', 'threshold': 0.9937936087594558, 'batch_size': 55, 'attention_heads': 12, 'hidden_dimension': 116, 'number_of_hidden_layers': 4, 'dropout_rate': 0.3000008150477062, 'global_pooling': 'mean', 'learning_rate': 0.000909842151592636, 'weight_decay': 1.7570916395782223e-06, 'beta_0': 0.8030549353760623, 'beta_1': 0.9924514359732324, 'epsilon': 1.6604354425844852e-06, 'balanced_loss': True, 'epochs': 138, 'early_stopping_patience': 22, 'plateau_patience': 15, 'plateau_divider': 8}. Best is trial 43 with value: 0.9151515151515152.
CUDA out of memory. Tried to allocate 4.84 GiB. GPU 0 has a total capacity of 44.56 GiB of which 1.55 GiB is free. Including non-PyTorch memory, this process has 43.00 GiB memory in use. Of the allocated memory 39.50 GiB is allocated by PyTorch, and 2.35 GiB is reserved by PyTorch but unallocated. If reserved but unallocated memory is large try setting PYTORCH_CUDA_ALLOC_CONF=expandable_segments:True to avoid fragmentation.  See documentation for Memory Management  (https://pytorch.org/docs/stable/notes/cuda.html#environment-variables)
[I 2024-11-22 12:27:51,496] Trial 44 finished with value: -1.0 and parameters: {'left_stride': 64, 'right_stride': 64, 'attention_pooling_operation': 'max', 'embedding_pooling_operation': 'max', 'threshold': 0.9897386477396085, 'batch_size': 55, 'attention_heads': 13, 'hidden_dimension': 255, 'number_of_hidden_layers': 4, 'dropout_rate': 0.3436912053948393, 'global_pooling': 'mean', 'learning_rate': 0.0010097537358924131, 'weight_decay': 4.835095771936229e-06, 'beta_0': 0.8041567185243378, 'beta_1': 0.9921262002348838, 'epsilon': 1.8163357041593053e-05, 'balanced_loss': True, 'epochs': 138, 'early_stopping_patience': 22, 'plateau_patience': 15, 'plateau_divider': 8}. Best is trial 43 with value: 0.9151515151515152.
CUDA out of memory. Tried to allocate 5.92 GiB. GPU 0 has a total capacity of 44.56 GiB of which 704.69 MiB is free. Including non-PyTorch memory, this process has 43.87 GiB memory in use. Of the allocated memory 40.14 GiB is allocated by PyTorch, and 2.58 GiB is reserved by PyTorch but unallocated. If reserved but unallocated memory is large try setting PYTORCH_CUDA_ALLOC_CONF=expandable_segments:True to avoid fragmentation.  See documentation for Memory Management  (https://pytorch.org/docs/stable/notes/cuda.html#environment-variables)
