[I 2024-11-22 03:14:38,876] A new study created in RDB with name: IMDb-top_1000-GAT-google-bert-bert-base-uncased-Surrogate-No_Aggregation
Token indices sequence length is longer than the specified maximum sequence length for this model (1147 > 512). Running this sequence through the model will result in indexing errors
CUDA out of memory. Tried to allocate 6.19 GiB. GPU 0 has a total capacity of 44.56 GiB of which 3.25 GiB is free. Including non-PyTorch memory, this process has 41.30 GiB memory in use. Of the allocated memory 37.50 GiB is allocated by PyTorch, and 2.65 GiB is reserved by PyTorch but unallocated. If reserved but unallocated memory is large try setting PYTORCH_CUDA_ALLOC_CONF=expandable_segments:True to avoid fragmentation.  See documentation for Memory Management  (https://pytorch.org/docs/stable/notes/cuda.html#environment-variables)
[I 2024-11-22 03:28:09,843] Trial 0 finished with value: -1.0 and parameters: {'left_stride': 32, 'right_stride': 64, 'attention_pooling_operation': 'mean', 'embedding_pooling_operation': 'min', 'threshold': 0.9304211818735242, 'batch_size': 41, 'attention_heads': 9, 'hidden_dimension': 97, 'number_of_hidden_layers': 3, 'dropout_rate': 0.34184815819561254, 'global_pooling': 'max', 'learning_rate': 0.013826232179369865, 'weight_decay': 3.972110727381911e-06, 'beta_0': 0.849951952030185, 'beta_1': 0.9912118037965686, 'epsilon': 1.5339162591163588e-08, 'balanced_loss': True, 'epochs': 59, 'early_stopping_patience': 25, 'plateau_patience': 25, 'plateau_divider': 9}. Best is trial 0 with value: -1.0.
[I 2024-11-22 03:39:31,700] Trial 1 finished with value: 0.8424242424242424 and parameters: {'left_stride': 64, 'right_stride': 64, 'attention_pooling_operation': 'max', 'embedding_pooling_operation': 'mean', 'threshold': 0.9939404991670033, 'batch_size': 59, 'attention_heads': 11, 'hidden_dimension': 239, 'number_of_hidden_layers': 0, 'dropout_rate': 0.35879485872574357, 'global_pooling': 'max', 'learning_rate': 0.00012172958098369953, 'weight_decay': 0.0003063462210622083, 'beta_0': 0.834331843801655, 'beta_1': 0.9853009566677808, 'epsilon': 1.4817820606039087e-06, 'balanced_loss': False, 'epochs': 61, 'early_stopping_patience': 25, 'plateau_patience': 22, 'plateau_divider': 3}. Best is trial 1 with value: 0.8424242424242424.
[I 2024-11-22 03:51:03,219] Trial 2 finished with value: 0.8848484848484849 and parameters: {'left_stride': 32, 'right_stride': 128, 'attention_pooling_operation': 'min', 'embedding_pooling_operation': 'mean', 'threshold': 0.988712402130207, 'batch_size': 39, 'attention_heads': 5, 'hidden_dimension': 192, 'number_of_hidden_layers': 3, 'dropout_rate': 0.46838315927084884, 'global_pooling': 'mean', 'learning_rate': 0.0005130551760589835, 'weight_decay': 1.1919481947918734e-06, 'beta_0': 0.8102310933924105, 'beta_1': 0.98059161803998, 'epsilon': 3.512704726270843e-06, 'balanced_loss': False, 'epochs': 187, 'early_stopping_patience': 13, 'plateau_patience': 16, 'plateau_divider': 8}. Best is trial 2 with value: 0.8848484848484849.
CUDA out of memory. Tried to allocate 1.32 GiB. GPU 0 has a total capacity of 44.56 GiB of which 1.00 GiB is free. Including non-PyTorch memory, this process has 43.55 GiB memory in use. Of the allocated memory 41.36 GiB is allocated by PyTorch, and 1.03 GiB is reserved by PyTorch but unallocated. If reserved but unallocated memory is large try setting PYTORCH_CUDA_ALLOC_CONF=expandable_segments:True to avoid fragmentation.  See documentation for Memory Management  (https://pytorch.org/docs/stable/notes/cuda.html#environment-variables)
[I 2024-11-22 04:00:41,412] Trial 3 finished with value: -1.0 and parameters: {'left_stride': 256, 'right_stride': 64, 'attention_pooling_operation': 'min', 'embedding_pooling_operation': 'min', 'threshold': 0.9227912369025688, 'batch_size': 36, 'attention_heads': 14, 'hidden_dimension': 225, 'number_of_hidden_layers': 0, 'dropout_rate': 0.4532241907732697, 'global_pooling': 'mean', 'learning_rate': 0.00022410971619109496, 'weight_decay': 0.0006741074265640696, 'beta_0': 0.8310413476654125, 'beta_1': 0.9898114758541204, 'epsilon': 6.487477066058673e-06, 'balanced_loss': False, 'epochs': 195, 'early_stopping_patience': 14, 'plateau_patience': 17, 'plateau_divider': 4}. Best is trial 2 with value: 0.8848484848484849.
CUDA out of memory. Tried to allocate 13.12 GiB. GPU 0 has a total capacity of 44.56 GiB of which 12.06 GiB is free. Including non-PyTorch memory, this process has 32.49 GiB memory in use. Of the allocated memory 29.34 GiB is allocated by PyTorch, and 2.00 GiB is reserved by PyTorch but unallocated. If reserved but unallocated memory is large try setting PYTORCH_CUDA_ALLOC_CONF=expandable_segments:True to avoid fragmentation.  See documentation for Memory Management  (https://pytorch.org/docs/stable/notes/cuda.html#environment-variables)
[I 2024-11-22 04:09:28,998] Trial 4 finished with value: -1.0 and parameters: {'left_stride': 64, 'right_stride': 32, 'attention_pooling_operation': 'min', 'embedding_pooling_operation': 'min', 'threshold': 0.9367746354405981, 'batch_size': 46, 'attention_heads': 12, 'hidden_dimension': 152, 'number_of_hidden_layers': 0, 'dropout_rate': 0.5505907486767714, 'global_pooling': 'mean', 'learning_rate': 0.002309786149269356, 'weight_decay': 0.00010781845035122267, 'beta_0': 0.8015645397505602, 'beta_1': 0.9896841863656863, 'epsilon': 8.053471030316087e-08, 'balanced_loss': True, 'epochs': 154, 'early_stopping_patience': 16, 'plateau_patience': 24, 'plateau_divider': 3}. Best is trial 2 with value: 0.8848484848484849.
CUDA out of memory. Tried to allocate 12.43 GiB. GPU 0 has a total capacity of 44.56 GiB of which 492.69 MiB is free. Including non-PyTorch memory, this process has 44.07 GiB memory in use. Of the allocated memory 41.26 GiB is allocated by PyTorch, and 1.66 GiB is reserved by PyTorch but unallocated. If reserved but unallocated memory is large try setting PYTORCH_CUDA_ALLOC_CONF=expandable_segments:True to avoid fragmentation.  See documentation for Memory Management  (https://pytorch.org/docs/stable/notes/cuda.html#environment-variables)
[I 2024-11-22 04:18:16,776] Trial 5 finished with value: -1.0 and parameters: {'left_stride': 64, 'right_stride': 32, 'attention_pooling_operation': 'max', 'embedding_pooling_operation': 'min', 'threshold': 0.9725883083302352, 'batch_size': 59, 'attention_heads': 15, 'hidden_dimension': 207, 'number_of_hidden_layers': 3, 'dropout_rate': 0.3252419894985146, 'global_pooling': 'sum', 'learning_rate': 1.0883991813938131e-05, 'weight_decay': 2.015647705936503e-06, 'beta_0': 0.8650272248026284, 'beta_1': 0.9800952543380481, 'epsilon': 4.397766894483953e-08, 'balanced_loss': False, 'epochs': 148, 'early_stopping_patience': 13, 'plateau_patience': 21, 'plateau_divider': 4}. Best is trial 2 with value: 0.8848484848484849.
CUDA out of memory. Tried to allocate 5.07 GiB. GPU 0 has a total capacity of 44.56 GiB of which 3.98 GiB is free. Including non-PyTorch memory, this process has 40.57 GiB memory in use. Of the allocated memory 37.57 GiB is allocated by PyTorch, and 1.86 GiB is reserved by PyTorch but unallocated. If reserved but unallocated memory is large try setting PYTORCH_CUDA_ALLOC_CONF=expandable_segments:True to avoid fragmentation.  See documentation for Memory Management  (https://pytorch.org/docs/stable/notes/cuda.html#environment-variables)
[I 2024-11-22 04:27:20,320] Trial 6 finished with value: -1.0 and parameters: {'left_stride': 128, 'right_stride': 0, 'attention_pooling_operation': 'min', 'embedding_pooling_operation': 'mean', 'threshold': 0.9576846194237897, 'batch_size': 40, 'attention_heads': 6, 'hidden_dimension': 194, 'number_of_hidden_layers': 1, 'dropout_rate': 0.30729478992943615, 'global_pooling': 'max', 'learning_rate': 0.06542056762893128, 'weight_decay': 0.0005553837526912237, 'beta_0': 0.8356502322469728, 'beta_1': 0.9802909082956842, 'epsilon': 5.167425813322413e-05, 'balanced_loss': False, 'epochs': 195, 'early_stopping_patience': 23, 'plateau_patience': 14, 'plateau_divider': 5}. Best is trial 2 with value: 0.8848484848484849.
The selected strides are greater or equal to the total chunk size.
[I 2024-11-22 04:27:21,257] Trial 7 finished with value: -1.0 and parameters: {'left_stride': 256, 'right_stride': 256, 'attention_pooling_operation': 'max', 'embedding_pooling_operation': 'min', 'threshold': 0.9359455202104634, 'batch_size': 30, 'attention_heads': 14, 'hidden_dimension': 214, 'number_of_hidden_layers': 4, 'dropout_rate': 0.5739721657669414, 'global_pooling': 'max', 'learning_rate': 0.0039797493741031125, 'weight_decay': 0.0001276146788173022, 'beta_0': 0.8786113098385785, 'beta_1': 0.996892198716152, 'epsilon': 2.248954284391446e-07, 'balanced_loss': True, 'epochs': 137, 'early_stopping_patience': 10, 'plateau_patience': 17, 'plateau_divider': 6}. Best is trial 2 with value: 0.8848484848484849.
CUDA out of memory. Tried to allocate 6.00 GiB. GPU 0 has a total capacity of 44.56 GiB of which 2.49 GiB is free. Including non-PyTorch memory, this process has 42.06 GiB memory in use. Of the allocated memory 38.75 GiB is allocated by PyTorch, and 2.16 GiB is reserved by PyTorch but unallocated. If reserved but unallocated memory is large try setting PYTORCH_CUDA_ALLOC_CONF=expandable_segments:True to avoid fragmentation.  See documentation for Memory Management  (https://pytorch.org/docs/stable/notes/cuda.html#environment-variables)
[I 2024-11-22 04:38:50,037] Trial 8 finished with value: -1.0 and parameters: {'left_stride': 256, 'right_stride': 128, 'attention_pooling_operation': 'min', 'embedding_pooling_operation': 'max', 'threshold': 0.9726018724589289, 'batch_size': 63, 'attention_heads': 10, 'hidden_dimension': 104, 'number_of_hidden_layers': 3, 'dropout_rate': 0.38124967537862225, 'global_pooling': 'mean', 'learning_rate': 0.07089141723796885, 'weight_decay': 0.0003220626495993124, 'beta_0': 0.8683420313684149, 'beta_1': 0.9877260389162159, 'epsilon': 4.933751600448336e-08, 'balanced_loss': False, 'epochs': 132, 'early_stopping_patience': 21, 'plateau_patience': 20, 'plateau_divider': 4}. Best is trial 2 with value: 0.8848484848484849.
CUDA out of memory. Tried to allocate 3.62 GiB. GPU 0 has a total capacity of 44.56 GiB of which 48.69 MiB is free. Including non-PyTorch memory, this process has 44.51 GiB memory in use. Of the allocated memory 38.32 GiB is allocated by PyTorch, and 5.03 GiB is reserved by PyTorch but unallocated. If reserved but unallocated memory is large try setting PYTORCH_CUDA_ALLOC_CONF=expandable_segments:True to avoid fragmentation.  See documentation for Memory Management  (https://pytorch.org/docs/stable/notes/cuda.html#environment-variables)
[I 2024-11-22 04:47:23,494] Trial 9 finished with value: -1.0 and parameters: {'left_stride': 0, 'right_stride': 64, 'attention_pooling_operation': 'max', 'embedding_pooling_operation': 'min', 'threshold': 0.9491566713529321, 'batch_size': 39, 'attention_heads': 6, 'hidden_dimension': 129, 'number_of_hidden_layers': 1, 'dropout_rate': 0.48475502941566495, 'global_pooling': 'mean', 'learning_rate': 0.003187422711813414, 'weight_decay': 3.2315343430749745e-05, 'beta_0': 0.8849150937783302, 'beta_1': 0.9924741264147013, 'epsilon': 4.484744524732786e-08, 'balanced_loss': False, 'epochs': 54, 'early_stopping_patience': 19, 'plateau_patience': 25, 'plateau_divider': 7}. Best is trial 2 with value: 0.8848484848484849.
[I 2024-11-22 05:02:24,859] Trial 10 finished with value: 0.8545454545454545 and parameters: {'left_stride': 32, 'right_stride': 128, 'attention_pooling_operation': 'mean', 'embedding_pooling_operation': 'mean', 'threshold': 0.9983501014500715, 'batch_size': 17, 'attention_heads': 4, 'hidden_dimension': 48, 'number_of_hidden_layers': 4, 'dropout_rate': 0.5215216634175063, 'global_pooling': 'sum', 'learning_rate': 0.0002656836893415814, 'weight_decay': 8.178412772916804e-06, 'beta_0': 0.8049297522472849, 'beta_1': 0.9840036011509948, 'epsilon': 1.3261882354835817e-05, 'balanced_loss': True, 'epochs': 92, 'early_stopping_patience': 10, 'plateau_patience': 10, 'plateau_divider': 10}. Best is trial 2 with value: 0.8848484848484849.
[I 2024-11-22 05:17:35,052] Trial 11 finished with value: 0.7878787878787878 and parameters: {'left_stride': 32, 'right_stride': 128, 'attention_pooling_operation': 'mean', 'embedding_pooling_operation': 'mean', 'threshold': 0.9994609999076427, 'batch_size': 16, 'attention_heads': 4, 'hidden_dimension': 49, 'number_of_hidden_layers': 4, 'dropout_rate': 0.5192733906910247, 'global_pooling': 'sum', 'learning_rate': 0.00025342324456384277, 'weight_decay': 7.695640974199639e-06, 'beta_0': 0.804592399704736, 'beta_1': 0.983482668486949, 'epsilon': 1.4297517551607266e-05, 'balanced_loss': True, 'epochs': 111, 'early_stopping_patience': 10, 'plateau_patience': 10, 'plateau_divider': 10}. Best is trial 2 with value: 0.8848484848484849.
[I 2024-11-22 05:32:34,912] Trial 12 finished with value: 0.806060606060606 and parameters: {'left_stride': 32, 'right_stride': 128, 'attention_pooling_operation': 'mean', 'embedding_pooling_operation': 'mean', 'threshold': 0.983361125681508, 'batch_size': 16, 'attention_heads': 4, 'hidden_dimension': 35, 'number_of_hidden_layers': 4, 'dropout_rate': 0.40659960874307727, 'global_pooling': 'sum', 'learning_rate': 3.5191107753258047e-05, 'weight_decay': 1.0332855569626058e-06, 'beta_0': 0.816654304338496, 'beta_1': 0.983459090703463, 'epsilon': 2.1813784166932643e-06, 'balanced_loss': True, 'epochs': 93, 'early_stopping_patience': 13, 'plateau_patience': 10, 'plateau_divider': 8}. Best is trial 2 with value: 0.8848484848484849.
[I 2024-11-22 05:50:15,970] Trial 13 finished with value: 0.8545454545454545 and parameters: {'left_stride': 32, 'right_stride': 128, 'attention_pooling_operation': 'mean', 'embedding_pooling_operation': 'mean', 'threshold': 0.9817569136080533, 'batch_size': 26, 'attention_heads': 7, 'hidden_dimension': 171, 'number_of_hidden_layers': 2, 'dropout_rate': 0.49469554812507704, 'global_pooling': 'sum', 'learning_rate': 0.0007266726766963056, 'weight_decay': 1.2469161508682646e-05, 'beta_0': 0.8172660649220073, 'beta_1': 0.9830045251206044, 'epsilon': 7.608327252989486e-05, 'balanced_loss': True, 'epochs': 91, 'early_stopping_patience': 11, 'plateau_patience': 13, 'plateau_divider': 10}. Best is trial 2 with value: 0.8848484848484849.
[I 2024-11-22 05:59:37,260] Trial 14 finished with value: 0.703030303030303 and parameters: {'left_stride': 32, 'right_stride': 128, 'attention_pooling_operation': 'min', 'embedding_pooling_operation': 'max', 'threshold': 0.9999156540599297, 'batch_size': 50, 'attention_heads': 8, 'hidden_dimension': 80, 'number_of_hidden_layers': 3, 'dropout_rate': 0.43144574129242946, 'global_pooling': 'mean', 'learning_rate': 0.0005775730423707891, 'weight_decay': 1.878875597435064e-05, 'beta_0': 0.8156955711496865, 'beta_1': 0.9864145949612743, 'epsilon': 9.948255650918399e-06, 'balanced_loss': False, 'epochs': 169, 'early_stopping_patience': 16, 'plateau_patience': 14, 'plateau_divider': 8}. Best is trial 2 with value: 0.8848484848484849.
CUDA out of memory. Tried to allocate 3.02 GiB. GPU 0 has a total capacity of 44.56 GiB of which 1.05 GiB is free. Including non-PyTorch memory, this process has 43.50 GiB memory in use. Of the allocated memory 38.72 GiB is allocated by PyTorch, and 3.63 GiB is reserved by PyTorch but unallocated. If reserved but unallocated memory is large try setting PYTORCH_CUDA_ALLOC_CONF=expandable_segments:True to avoid fragmentation.  See documentation for Memory Management  (https://pytorch.org/docs/stable/notes/cuda.html#environment-variables)
[I 2024-11-22 06:12:08,618] Trial 15 finished with value: -1.0 and parameters: {'left_stride': 128, 'right_stride': 256, 'attention_pooling_operation': 'mean', 'embedding_pooling_operation': 'mean', 'threshold': 0.9073474392808745, 'batch_size': 24, 'attention_heads': 4, 'hidden_dimension': 176, 'number_of_hidden_layers': 2, 'dropout_rate': 0.5308261875263505, 'global_pooling': 'sum', 'learning_rate': 8.033575562176119e-05, 'weight_decay': 3.2140585393588713e-06, 'beta_0': 0.8981752259338325, 'beta_1': 0.9815902362392467, 'epsilon': 4.6185512256510933e-07, 'balanced_loss': True, 'epochs': 101, 'early_stopping_patience': 12, 'plateau_patience': 12, 'plateau_divider': 9}. Best is trial 2 with value: 0.8848484848484849.
CUDA out of memory. Tried to allocate 2.15 GiB. GPU 0 has a total capacity of 44.56 GiB of which 1.88 GiB is free. Including non-PyTorch memory, this process has 42.68 GiB memory in use. Of the allocated memory 38.79 GiB is allocated by PyTorch, and 2.74 GiB is reserved by PyTorch but unallocated. If reserved but unallocated memory is large try setting PYTORCH_CUDA_ALLOC_CONF=expandable_segments:True to avoid fragmentation.  See documentation for Memory Management  (https://pytorch.org/docs/stable/notes/cuda.html#environment-variables)
[I 2024-11-22 06:20:20,607] Trial 16 finished with value: -1.0 and parameters: {'left_stride': 0, 'right_stride': 0, 'attention_pooling_operation': 'min', 'embedding_pooling_operation': 'mean', 'threshold': 0.960237178472283, 'batch_size': 32, 'attention_heads': 6, 'hidden_dimension': 130, 'number_of_hidden_layers': 4, 'dropout_rate': 0.5988201808801508, 'global_pooling': 'sum', 'learning_rate': 3.5021103255574354e-05, 'weight_decay': 1.4829466330834557e-06, 'beta_0': 0.8477620269796012, 'beta_1': 0.9854286900046532, 'epsilon': 3.3345033718565105e-06, 'balanced_loss': False, 'epochs': 81, 'early_stopping_patience': 15, 'plateau_patience': 16, 'plateau_divider': 7}. Best is trial 2 with value: 0.8848484848484849.
[I 2024-11-22 06:36:00,297] Trial 17 finished with value: 0.9030303030303031 and parameters: {'left_stride': 32, 'right_stride': 128, 'attention_pooling_operation': 'mean', 'embedding_pooling_operation': 'max', 'threshold': 0.9856755545289968, 'batch_size': 51, 'attention_heads': 5, 'hidden_dimension': 69, 'number_of_hidden_layers': 3, 'dropout_rate': 0.46956657073753344, 'global_pooling': 'mean', 'learning_rate': 0.0013153042490514162, 'weight_decay': 6.225515708182688e-06, 'beta_0': 0.8001879137118488, 'beta_1': 0.99660496402926, 'epsilon': 2.304991504499227e-05, 'balanced_loss': True, 'epochs': 169, 'early_stopping_patience': 18, 'plateau_patience': 15, 'plateau_divider': 9}. Best is trial 17 with value: 0.9030303030303031.
[I 2024-11-22 06:47:13,682] Trial 18 finished with value: 0.8909090909090909 and parameters: {'left_stride': 32, 'right_stride': 128, 'attention_pooling_operation': 'min', 'embedding_pooling_operation': 'max', 'threshold': 0.9834374731573783, 'batch_size': 50, 'attention_heads': 8, 'hidden_dimension': 73, 'number_of_hidden_layers': 2, 'dropout_rate': 0.4605962868566267, 'global_pooling': 'mean', 'learning_rate': 0.011370694078598264, 'weight_decay': 4.444703432022873e-06, 'beta_0': 0.8243941983562405, 'beta_1': 0.9983897019837131, 'epsilon': 3.068137980783489e-05, 'balanced_loss': True, 'epochs': 174, 'early_stopping_patience': 18, 'plateau_patience': 19, 'plateau_divider': 8}. Best is trial 17 with value: 0.9030303030303031.
[I 2024-11-22 07:03:42,707] Trial 19 finished with value: 0.8909090909090909 and parameters: {'left_stride': 32, 'right_stride': 128, 'attention_pooling_operation': 'mean', 'embedding_pooling_operation': 'max', 'threshold': 0.9700636113764258, 'batch_size': 52, 'attention_heads': 8, 'hidden_dimension': 71, 'number_of_hidden_layers': 1, 'dropout_rate': 0.4311924713677384, 'global_pooling': 'mean', 'learning_rate': 0.014056789297153517, 'weight_decay': 4.465306633649493e-05, 'beta_0': 0.8244781176560518, 'beta_1': 0.9988991410672623, 'epsilon': 3.152211859002817e-05, 'balanced_loss': True, 'epochs': 173, 'early_stopping_patience': 19, 'plateau_patience': 19, 'plateau_divider': 6}. Best is trial 17 with value: 0.9030303030303031.
[I 2024-11-22 07:19:40,204] Trial 20 finished with value: 0.8666666666666667 and parameters: {'left_stride': 0, 'right_stride': 0, 'attention_pooling_operation': 'mean', 'embedding_pooling_operation': 'max', 'threshold': 0.9812699052075317, 'batch_size': 54, 'attention_heads': 8, 'hidden_dimension': 108, 'number_of_hidden_layers': 2, 'dropout_rate': 0.4209414763277185, 'global_pooling': 'mean', 'learning_rate': 0.010992643338426467, 'weight_decay': 4.002358754255533e-06, 'beta_0': 0.8447532920768743, 'beta_1': 0.9947751213631433, 'epsilon': 2.8226522583781946e-05, 'balanced_loss': True, 'epochs': 168, 'early_stopping_patience': 19, 'plateau_patience': 19, 'plateau_divider': 9}. Best is trial 17 with value: 0.9030303030303031.
[I 2024-11-22 07:35:52,301] Trial 21 finished with value: 0.8727272727272727 and parameters: {'left_stride': 32, 'right_stride': 128, 'attention_pooling_operation': 'mean', 'embedding_pooling_operation': 'max', 'threshold': 0.9701392336849262, 'batch_size': 48, 'attention_heads': 8, 'hidden_dimension': 73, 'number_of_hidden_layers': 1, 'dropout_rate': 0.39329441587716196, 'global_pooling': 'mean', 'learning_rate': 0.013459299721366329, 'weight_decay': 4.327672396053874e-05, 'beta_0': 0.8256833983617946, 'beta_1': 0.9989715643925166, 'epsilon': 3.0101955638627193e-05, 'balanced_loss': True, 'epochs': 178, 'early_stopping_patience': 18, 'plateau_patience': 19, 'plateau_divider': 6}. Best is trial 17 with value: 0.9030303030303031.
CUDA out of memory. Tried to allocate 3.12 GiB. GPU 0 has a total capacity of 44.56 GiB of which 2.57 GiB is free. Including non-PyTorch memory, this process has 41.98 GiB memory in use. Of the allocated memory 39.12 GiB is allocated by PyTorch, and 1.70 GiB is reserved by PyTorch but unallocated. If reserved but unallocated memory is large try setting PYTORCH_CUDA_ALLOC_CONF=expandable_segments:True to avoid fragmentation.  See documentation for Memory Management  (https://pytorch.org/docs/stable/notes/cuda.html#environment-variables)
