[I 2024-11-28 09:38:22,633] Trial 27 finished with value: 0.8727272727272727 and parameters: {'left_stride': 32, 'right_stride': 64, 'attention_pooling_operation': 'mean', 'embedding_pooling_operation': 'min', 'threshold': 0.9276071288707779, 'batch_size': 49, 'attention_heads': 10, 'hidden_dimension': 134, 'number_of_hidden_layers': 1, 'dropout_rate': 0.5079471651138636, 'global_pooling': 'mean', 'learning_rate': 0.0018519191552936374, 'weight_decay': 5.638716576599037e-06, 'beta_0': 0.8922631334480634, 'beta_1': 0.9969335317874451, 'epsilon': 1.4676170021814438e-08, 'balanced_loss': False, 'epochs': 125, 'early_stopping_patience': 17, 'plateau_patience': 15, 'plateau_divider': 7}. Best is trial 14 with value: 0.896969696969697.
[I 2024-11-28 09:45:58,306] Trial 28 finished with value: 0.8727272727272727 and parameters: {'left_stride': 0, 'right_stride': 256, 'attention_pooling_operation': 'min', 'embedding_pooling_operation': 'max', 'threshold': 0.9068858082094, 'batch_size': 43, 'attention_heads': 7, 'hidden_dimension': 78, 'number_of_hidden_layers': 2, 'dropout_rate': 0.5851748115127748, 'global_pooling': 'max', 'learning_rate': 0.00520009440066853, 'weight_decay': 1.6869344956862067e-05, 'beta_0': 0.8622781609322925, 'beta_1': 0.9925519246853719, 'epsilon': 3.6557160420370386e-07, 'balanced_loss': False, 'epochs': 136, 'early_stopping_patience': 20, 'plateau_patience': 12, 'plateau_divider': 8}. Best is trial 14 with value: 0.896969696969697.
[I 2024-11-28 09:52:54,195] Trial 29 finished with value: 0.8424242424242424 and parameters: {'left_stride': 128, 'right_stride': 64, 'attention_pooling_operation': 'max', 'embedding_pooling_operation': 'mean', 'threshold': 0.9299551464310497, 'batch_size': 56, 'attention_heads': 4, 'hidden_dimension': 113, 'number_of_hidden_layers': 3, 'dropout_rate': 0.4828139547470441, 'global_pooling': 'sum', 'learning_rate': 0.00041425428435493497, 'weight_decay': 3.965247737539661e-06, 'beta_0': 0.8557710095590135, 'beta_1': 0.991033781635165, 'epsilon': 2.360607474649904e-08, 'balanced_loss': True, 'epochs': 95, 'early_stopping_patience': 22, 'plateau_patience': 10, 'plateau_divider': 9}. Best is trial 14 with value: 0.896969696969697.
[I 2024-11-28 09:59:21,391] Trial 30 finished with value: 0.8727272727272727 and parameters: {'left_stride': 32, 'right_stride': 128, 'attention_pooling_operation': 'mean', 'embedding_pooling_operation': 'min', 'threshold': 0.9436806049883435, 'batch_size': 33, 'attention_heads': 9, 'hidden_dimension': 37, 'number_of_hidden_layers': 0, 'dropout_rate': 0.5577370095824984, 'global_pooling': 'max', 'learning_rate': 0.0019937422045806226, 'weight_decay': 7.456715732253328e-05, 'beta_0': 0.8781760685827014, 'beta_1': 0.9951964484988151, 'epsilon': 1.2644386288450128e-07, 'balanced_loss': False, 'epochs': 66, 'early_stopping_patience': 19, 'plateau_patience': 14, 'plateau_divider': 6}. Best is trial 14 with value: 0.896969696969697.
[I 2024-11-28 10:04:54,665] Trial 31 finished with value: 0.896969696969697 and parameters: {'left_stride': 32, 'right_stride': 64, 'attention_pooling_operation': 'min', 'embedding_pooling_operation': 'min', 'threshold': 0.9326322147221172, 'batch_size': 44, 'attention_heads': 6, 'hidden_dimension': 96, 'number_of_hidden_layers': 0, 'dropout_rate': 0.5311080800264937, 'global_pooling': 'mean', 'learning_rate': 0.0008595780603636111, 'weight_decay': 4.9630999557711385e-05, 'beta_0': 0.8712999507752677, 'beta_1': 0.9909685444791861, 'epsilon': 1.9177489661618195e-07, 'balanced_loss': True, 'epochs': 109, 'early_stopping_patience': 24, 'plateau_patience': 14, 'plateau_divider': 9}. Best is trial 14 with value: 0.896969696969697.
[I 2024-11-28 10:10:24,757] Trial 32 finished with value: 0.8909090909090909 and parameters: {'left_stride': 32, 'right_stride': 64, 'attention_pooling_operation': 'min', 'embedding_pooling_operation': 'min', 'threshold': 0.9218841872430781, 'batch_size': 42, 'attention_heads': 5, 'hidden_dimension': 91, 'number_of_hidden_layers': 0, 'dropout_rate': 0.5348553662914303, 'global_pooling': 'mean', 'learning_rate': 0.0006438292360812228, 'weight_decay': 3.648036631093696e-05, 'beta_0': 0.883749465702198, 'beta_1': 0.991752884644437, 'epsilon': 9.769650327697597e-07, 'balanced_loss': True, 'epochs': 92, 'early_stopping_patience': 22, 'plateau_patience': 16, 'plateau_divider': 8}. Best is trial 14 with value: 0.896969696969697.
[I 2024-11-28 10:16:18,825] Trial 33 finished with value: 0.8303030303030303 and parameters: {'left_stride': 32, 'right_stride': 64, 'attention_pooling_operation': 'min', 'embedding_pooling_operation': 'min', 'threshold': 0.9325713387169451, 'batch_size': 48, 'attention_heads': 9, 'hidden_dimension': 110, 'number_of_hidden_layers': 0, 'dropout_rate': 0.5424307568334619, 'global_pooling': 'mean', 'learning_rate': 0.03371047539909981, 'weight_decay': 2.06063321185626e-05, 'beta_0': 0.89986087646536, 'beta_1': 0.9928144520250517, 'epsilon': 2.0131016906124025e-06, 'balanced_loss': True, 'epochs': 104, 'early_stopping_patience': 25, 'plateau_patience': 12, 'plateau_divider': 9}. Best is trial 14 with value: 0.896969696969697.
[I 2024-11-28 10:21:52,404] Trial 34 finished with value: 0.8787878787878788 and parameters: {'left_stride': 32, 'right_stride': 64, 'attention_pooling_operation': 'min', 'embedding_pooling_operation': 'min', 'threshold': 0.9133589750954443, 'batch_size': 37, 'attention_heads': 5, 'hidden_dimension': 58, 'number_of_hidden_layers': 0, 'dropout_rate': 0.5008723505072926, 'global_pooling': 'mean', 'learning_rate': 0.0003500457710958475, 'weight_decay': 0.00018347203153760787, 'beta_0': 0.8925452671571517, 'beta_1': 0.9881468339863374, 'epsilon': 1.0120618676393113e-07, 'balanced_loss': True, 'epochs': 118, 'early_stopping_patience': 20, 'plateau_patience': 14, 'plateau_divider': 7}. Best is trial 14 with value: 0.896969696969697.
[I 2024-11-28 10:31:37,744] Trial 35 finished with value: 0.896969696969697 and parameters: {'left_stride': 64, 'right_stride': 64, 'attention_pooling_operation': 'min', 'embedding_pooling_operation': 'mean', 'threshold': 0.9194483849239382, 'batch_size': 51, 'attention_heads': 11, 'hidden_dimension': 135, 'number_of_hidden_layers': 1, 'dropout_rate': 0.46903732592202374, 'global_pooling': 'mean', 'learning_rate': 9.615959711127552e-05, 'weight_decay': 1.028217683001476e-05, 'beta_0': 0.878735080503682, 'beta_1': 0.9839411352910221, 'epsilon': 2.4022673607118665e-07, 'balanced_loss': True, 'epochs': 146, 'early_stopping_patience': 17, 'plateau_patience': 16, 'plateau_divider': 10}. Best is trial 14 with value: 0.896969696969697.
[I 2024-11-28 10:37:53,090] Trial 36 finished with value: 0.8909090909090909 and parameters: {'left_stride': 32, 'right_stride': 64, 'attention_pooling_operation': 'min', 'embedding_pooling_operation': 'min', 'threshold': 0.940699243469269, 'batch_size': 46, 'attention_heads': 8, 'hidden_dimension': 180, 'number_of_hidden_layers': 0, 'dropout_rate': 0.5195376738351614, 'global_pooling': 'mean', 'learning_rate': 0.0013504870496879697, 'weight_decay': 6.583773532034831e-05, 'beta_0': 0.8550980006529129, 'beta_1': 0.9899738828967063, 'epsilon': 5.992193634673793e-07, 'balanced_loss': True, 'epochs': 83, 'early_stopping_patience': 24, 'plateau_patience': 17, 'plateau_divider': 8}. Best is trial 14 with value: 0.896969696969697.
[I 2024-11-28 10:45:53,038] Trial 37 finished with value: 0.8787878787878788 and parameters: {'left_stride': 64, 'right_stride': 32, 'attention_pooling_operation': 'max', 'embedding_pooling_operation': 'min', 'threshold': 0.9063342396110708, 'batch_size': 41, 'attention_heads': 7, 'hidden_dimension': 155, 'number_of_hidden_layers': 1, 'dropout_rate': 0.5488810117459794, 'global_pooling': 'max', 'learning_rate': 0.0005617197644275689, 'weight_decay': 2.5095871577727646e-06, 'beta_0': 0.8426779829686798, 'beta_1': 0.9886417227746906, 'epsilon': 2.7849268158938605e-06, 'balanced_loss': False, 'epochs': 69, 'early_stopping_patience': 22, 'plateau_patience': 15, 'plateau_divider': 9}. Best is trial 14 with value: 0.896969696969697.
[I 2024-11-28 10:51:28,991] Trial 38 finished with value: 0.8545454545454545 and parameters: {'left_stride': 128, 'right_stride': 0, 'attention_pooling_operation': 'min', 'embedding_pooling_operation': 'mean', 'threshold': 0.9945194639105507, 'batch_size': 59, 'attention_heads': 5, 'hidden_dimension': 102, 'number_of_hidden_layers': 3, 'dropout_rate': 0.5703039057547253, 'global_pooling': 'mean', 'learning_rate': 0.00017828577275267235, 'weight_decay': 3.616587171879425e-05, 'beta_0': 0.8646985767179264, 'beta_1': 0.9907958176695315, 'epsilon': 6.148997477362303e-08, 'balanced_loss': False, 'epochs': 122, 'early_stopping_patience': 18, 'plateau_patience': 13, 'plateau_divider': 7}. Best is trial 14 with value: 0.896969696969697.
[I 2024-11-28 10:57:30,910] Trial 39 finished with value: 0.8666666666666667 and parameters: {'left_stride': 0, 'right_stride': 32, 'attention_pooling_operation': 'min', 'embedding_pooling_operation': 'min', 'threshold': 0.9597716695761932, 'batch_size': 57, 'attention_heads': 11, 'hidden_dimension': 146, 'number_of_hidden_layers': 0, 'dropout_rate': 0.5830575764020685, 'global_pooling': 'mean', 'learning_rate': 0.02390078730774726, 'weight_decay': 0.00010889762114649299, 'beta_0': 0.8870365556386096, 'beta_1': 0.9864137864314614, 'epsilon': 2.7408250087330384e-08, 'balanced_loss': True, 'epochs': 99, 'early_stopping_patience': 23, 'plateau_patience': 11, 'plateau_divider': 8}. Best is trial 14 with value: 0.896969696969697.
[I 2024-11-28 11:03:28,508] Trial 40 finished with value: 0.8787878787878788 and parameters: {'left_stride': 32, 'right_stride': 128, 'attention_pooling_operation': 'max', 'embedding_pooling_operation': 'min', 'threshold': 0.937302034176092, 'batch_size': 37, 'attention_heads': 6, 'hidden_dimension': 81, 'number_of_hidden_layers': 1, 'dropout_rate': 0.49440248005924686, 'global_pooling': 'max', 'learning_rate': 0.0027327081490780172, 'weight_decay': 1.0005072453856697e-06, 'beta_0': 0.8945855093385272, 'beta_1': 0.9818736195042396, 'epsilon': 1.741767623308528e-07, 'balanced_loss': False, 'epochs': 131, 'early_stopping_patience': 20, 'plateau_patience': 23, 'plateau_divider': 9}. Best is trial 14 with value: 0.896969696969697.
[I 2024-11-28 11:09:08,600] Trial 41 finished with value: 0.8848484848484849 and parameters: {'left_stride': 32, 'right_stride': 64, 'attention_pooling_operation': 'min', 'embedding_pooling_operation': 'min', 'threshold': 0.9332658006744349, 'batch_size': 45, 'attention_heads': 6, 'hidden_dimension': 97, 'number_of_hidden_layers': 0, 'dropout_rate': 0.5222657869525288, 'global_pooling': 'mean', 'learning_rate': 0.0007985527010112326, 'weight_decay': 4.3774162188542285e-05, 'beta_0': 0.8717315694108507, 'beta_1': 0.9907319148744367, 'epsilon': 2.483290675330672e-07, 'balanced_loss': True, 'epochs': 107, 'early_stopping_patience': 24, 'plateau_patience': 14, 'plateau_divider': 9}. Best is trial 14 with value: 0.896969696969697.
[I 2024-11-28 11:15:13,667] Trial 42 finished with value: 0.8909090909090909 and parameters: {'left_stride': 32, 'right_stride': 64, 'attention_pooling_operation': 'min', 'embedding_pooling_operation': 'min', 'threshold': 0.9284693841915468, 'batch_size': 43, 'attention_heads': 7, 'hidden_dimension': 123, 'number_of_hidden_layers': 0, 'dropout_rate': 0.5448136079414113, 'global_pooling': 'mean', 'learning_rate': 0.0003128160754285922, 'weight_decay': 6.519885976823555e-05, 'beta_0': 0.8704966135156921, 'beta_1': 0.9917842632788663, 'epsilon': 7.58620095290169e-08, 'balanced_loss': True, 'epochs': 109, 'early_stopping_patience': 24, 'plateau_patience': 14, 'plateau_divider': 10}. Best is trial 14 with value: 0.896969696969697.
[I 2024-11-28 11:21:06,136] Trial 43 finished with value: 0.8909090909090909 and parameters: {'left_stride': 32, 'right_stride': 64, 'attention_pooling_operation': 'min', 'embedding_pooling_operation': 'min', 'threshold': 0.925117457168357, 'batch_size': 39, 'attention_heads': 8, 'hidden_dimension': 137, 'number_of_hidden_layers': 0, 'dropout_rate': 0.47560255288450304, 'global_pooling': 'mean', 'learning_rate': 0.001556458394121832, 'weight_decay': 8.695879269415614e-05, 'beta_0': 0.8778507910763059, 'beta_1': 0.9890860718705876, 'epsilon': 4.184978573906688e-07, 'balanced_loss': True, 'epochs': 92, 'early_stopping_patience': 21, 'plateau_patience': 16, 'plateau_divider': 8}. Best is trial 14 with value: 0.896969696969697.
[I 2024-11-28 11:26:14,684] Trial 44 finished with value: 0.8787878787878788 and parameters: {'left_stride': 32, 'right_stride': 64, 'attention_pooling_operation': 'min', 'embedding_pooling_operation': 'min', 'threshold': 0.9849422642354759, 'batch_size': 50, 'attention_heads': 6, 'hidden_dimension': 94, 'number_of_hidden_layers': 0, 'dropout_rate': 0.5172195417237014, 'global_pooling': 'mean', 'learning_rate': 0.004341731309416379, 'weight_decay': 2.193664685023822e-05, 'beta_0': 0.8611859769772309, 'beta_1': 0.9938789599255664, 'epsilon': 1.6322134755382886e-07, 'balanced_loss': True, 'epochs': 144, 'early_stopping_patience': 25, 'plateau_patience': 13, 'plateau_divider': 7}. Best is trial 14 with value: 0.896969696969697.
[I 2024-11-28 11:33:28,685] Trial 45 finished with value: 0.8909090909090909 and parameters: {'left_stride': 64, 'right_stride': 64, 'attention_pooling_operation': 'min', 'embedding_pooling_operation': 'min', 'threshold': 0.9160184507070075, 'batch_size': 32, 'attention_heads': 9, 'hidden_dimension': 111, 'number_of_hidden_layers': 1, 'dropout_rate': 0.5590771123489261, 'global_pooling': 'mean', 'learning_rate': 0.0007976466461803258, 'weight_decay': 4.8919719021999564e-05, 'beta_0': 0.8819666359059413, 'beta_1': 0.9903827814865431, 'epsilon': 1.195776396422247e-06, 'balanced_loss': True, 'epochs': 109, 'early_stopping_patience': 19, 'plateau_patience': 15, 'plateau_divider': 9}. Best is trial 14 with value: 0.896969696969697.
[I 2024-11-28 11:38:55,310] Trial 46 finished with value: 0.8666666666666667 and parameters: {'left_stride': 0, 'right_stride': 64, 'attention_pooling_operation': 'max', 'embedding_pooling_operation': 'max', 'threshold': 0.9360691138624703, 'batch_size': 47, 'attention_heads': 5, 'hidden_dimension': 51, 'number_of_hidden_layers': 0, 'dropout_rate': 0.3556325156614351, 'global_pooling': 'mean', 'learning_rate': 0.0004618959693714205, 'weight_decay': 0.0001564652847912012, 'beta_0': 0.8743068226321976, 'beta_1': 0.9945319291222725, 'epsilon': 7.74889728652402e-07, 'balanced_loss': False, 'epochs': 120, 'early_stopping_patience': 23, 'plateau_patience': 12, 'plateau_divider': 8}. Best is trial 14 with value: 0.896969696969697.
[I 2024-11-28 11:45:36,757] Trial 47 finished with value: 0.8363636363636363 and parameters: {'left_stride': 128, 'right_stride': 256, 'attention_pooling_operation': 'min', 'embedding_pooling_operation': 'min', 'threshold': 0.9214256166453192, 'batch_size': 43, 'attention_heads': 8, 'hidden_dimension': 34, 'number_of_hidden_layers': 0, 'dropout_rate': 0.4417293807459166, 'global_pooling': 'sum', 'learning_rate': 0.002650064655827312, 'weight_decay': 2.8854382817400574e-05, 'beta_0': 0.8673675569256535, 'beta_1': 0.9930512653678377, 'epsilon': 3.286454544599637e-08, 'balanced_loss': True, 'epochs': 156, 'early_stopping_patience': 22, 'plateau_patience': 14, 'plateau_divider': 7}. Best is trial 14 with value: 0.896969696969697.
[I 2024-11-28 11:52:00,561] Trial 48 finished with value: 0.8909090909090909 and parameters: {'left_stride': 32, 'right_stride': 0, 'attention_pooling_operation': 'mean', 'embedding_pooling_operation': 'min', 'threshold': 0.9551321251353879, 'batch_size': 40, 'attention_heads': 6, 'hidden_dimension': 67, 'number_of_hidden_layers': 1, 'dropout_rate': 0.5421881285039843, 'global_pooling': 'mean', 'learning_rate': 0.00024256778364713247, 'weight_decay': 0.00011981252221100194, 'beta_0': 0.8007159752103736, 'beta_1': 0.9917331409784549, 'epsilon': 3.0128018205961527e-07, 'balanced_loss': False, 'epochs': 130, 'early_stopping_patience': 15, 'plateau_patience': 19, 'plateau_divider': 10}. Best is trial 14 with value: 0.896969696969697.
[I 2024-11-28 11:58:49,666] Trial 49 finished with value: 0.8787878787878788 and parameters: {'left_stride': 0, 'right_stride': 64, 'attention_pooling_operation': 'max', 'embedding_pooling_operation': 'max', 'threshold': 0.9507677983062505, 'batch_size': 17, 'attention_heads': 7, 'hidden_dimension': 161, 'number_of_hidden_layers': 2, 'dropout_rate': 0.4577481171196485, 'global_pooling': 'mean', 'learning_rate': 0.0009631409155377802, 'weight_decay': 0.0002889788649640855, 'beta_0': 0.8959952089622685, 'beta_1': 0.9963152860635802, 'epsilon': 8.609011000878386e-08, 'balanced_loss': False, 'epochs': 97, 'early_stopping_patience': 17, 'plateau_patience': 13, 'plateau_divider': 6}. Best is trial 14 with value: 0.896969696969697.
[I 2024-11-28 12:07:26,556] Trial 50 finished with value: 0.8848484848484849 and parameters: {'left_stride': 128, 'right_stride': 256, 'attention_pooling_operation': 'min', 'embedding_pooling_operation': 'mean', 'threshold': 0.9081160364396754, 'batch_size': 45, 'attention_heads': 4, 'hidden_dimension': 141, 'number_of_hidden_layers': 0, 'dropout_rate': 0.5019909648217963, 'global_pooling': 'mean', 'learning_rate': 9.69097229615399e-05, 'weight_decay': 7.847944359298867e-06, 'beta_0': 0.8890286478750579, 'beta_1': 0.9871236674051552, 'epsilon': 2.1897344894761766e-07, 'balanced_loss': True, 'epochs': 112, 'early_stopping_patience': 24, 'plateau_patience': 17, 'plateau_divider': 8}. Best is trial 14 with value: 0.896969696969697.
[I 2024-11-28 12:21:32,487] Trial 51 finished with value: 0.8727272727272727 and parameters: {'left_stride': 64, 'right_stride': 64, 'attention_pooling_operation': 'min', 'embedding_pooling_operation': 'mean', 'threshold': 0.9183463851040586, 'batch_size': 52, 'attention_heads': 11, 'hidden_dimension': 134, 'number_of_hidden_layers': 1, 'dropout_rate': 0.4656676117975405, 'global_pooling': 'mean', 'learning_rate': 2.601388301349929e-05, 'weight_decay': 1.1478093440400465e-05, 'beta_0': 0.8782429672312835, 'beta_1': 0.9848141922314682, 'epsilon': 1.9559723133156823e-07, 'balanced_loss': True, 'epochs': 144, 'early_stopping_patience': 17, 'plateau_patience': 16, 'plateau_divider': 10}. Best is trial 14 with value: 0.896969696969697.
CUDA out of memory. Tried to allocate 4.05 GiB. GPU 0 has a total capacity of 44.56 GiB of which 3.61 GiB is free. Including non-PyTorch memory, this process has 40.94 GiB memory in use. Of the allocated memory 36.06 GiB is allocated by PyTorch, and 3.73 GiB is reserved by PyTorch but unallocated. If reserved but unallocated memory is large try setting PYTORCH_CUDA_ALLOC_CONF=expandable_segments:True to avoid fragmentation.  See documentation for Memory Management  (https://pytorch.org/docs/stable/notes/cuda.html#environment-variables)
[I 2024-11-28 12:26:30,172] Trial 52 finished with value: -1.0 and parameters: {'left_stride': 64, 'right_stride': 64, 'attention_pooling_operation': 'min', 'embedding_pooling_operation': 'mean', 'threshold': 0.92091607089978, 'batch_size': 64, 'attention_heads': 12, 'hidden_dimension': 123, 'number_of_hidden_layers': 2, 'dropout_rate': 0.4757800068091161, 'global_pooling': 'mean', 'learning_rate': 3.191540545608928e-05, 'weight_decay': 4.0730811583465776e-06, 'beta_0': 0.8812959500807853, 'beta_1': 0.9822270341858749, 'epsilon': 3.987057320467449e-07, 'balanced_loss': True, 'epochs': 152, 'early_stopping_patience': 18, 'plateau_patience': 15, 'plateau_divider': 10}. Best is trial 14 with value: 0.896969696969697.
CUDA out of memory. Tried to allocate 4.73 GiB. GPU 0 has a total capacity of 44.56 GiB of which 1.60 GiB is free. Including non-PyTorch memory, this process has 42.95 GiB memory in use. Of the allocated memory 41.03 GiB is allocated by PyTorch, and 785.39 MiB is reserved by PyTorch but unallocated. If reserved but unallocated memory is large try setting PYTORCH_CUDA_ALLOC_CONF=expandable_segments:True to avoid fragmentation.  See documentation for Memory Management  (https://pytorch.org/docs/stable/notes/cuda.html#environment-variables)
[I 2024-11-28 12:31:27,944] Trial 53 finished with value: -1.0 and parameters: {'left_stride': 64, 'right_stride': 64, 'attention_pooling_operation': 'min', 'embedding_pooling_operation': 'mean', 'threshold': 0.9113656851213209, 'batch_size': 55, 'attention_heads': 9, 'hidden_dimension': 196, 'number_of_hidden_layers': 1, 'dropout_rate': 0.48806428692137555, 'global_pooling': 'mean', 'learning_rate': 9.067684774228017e-05, 'weight_decay': 1.6457104653592672e-05, 'beta_0': 0.8736466723540846, 'beta_1': 0.9891748014654466, 'epsilon': 1.0927609521677625e-07, 'balanced_loss': True, 'epochs': 137, 'early_stopping_patience': 16, 'plateau_patience': 14, 'plateau_divider': 9}. Best is trial 14 with value: 0.896969696969697.
CUDA out of memory. Tried to allocate 2.48 GiB. GPU 0 has a total capacity of 44.56 GiB of which 2.25 GiB is free. Including non-PyTorch memory, this process has 42.30 GiB memory in use. Of the allocated memory 38.24 GiB is allocated by PyTorch, and 2.92 GiB is reserved by PyTorch but unallocated. If reserved but unallocated memory is large try setting PYTORCH_CUDA_ALLOC_CONF=expandable_segments:True to avoid fragmentation.  See documentation for Memory Management  (https://pytorch.org/docs/stable/notes/cuda.html#environment-variables)
