[I 2024-11-28 18:38:15,947] Trial 109 finished with value: -1.0 and parameters: {'left_stride': 64, 'right_stride': 32, 'attention_pooling_operation': 'min', 'embedding_pooling_operation': 'mean', 'threshold': 0.9091420313356908, 'batch_size': 64, 'attention_heads': 15, 'hidden_dimension': 157, 'number_of_hidden_layers': 1, 'dropout_rate': 0.4042314889137679, 'global_pooling': 'mean', 'learning_rate': 0.0035651451886135875, 'weight_decay': 1.1740544649052227e-05, 'beta_0': 0.8807442208506648, 'beta_1': 0.9875506981083975, 'epsilon': 1.5658699908284741e-07, 'balanced_loss': True, 'epochs': 166, 'early_stopping_patience': 15, 'plateau_patience': 11, 'plateau_divider': 4}. Best is trial 56 with value: 0.9151515151515152.
[I 2024-11-28 18:44:58,487] Trial 110 finished with value: 0.9030303030303031 and parameters: {'left_stride': 64, 'right_stride': 64, 'attention_pooling_operation': 'min', 'embedding_pooling_operation': 'mean', 'threshold': 0.9212465218915087, 'batch_size': 31, 'attention_heads': 5, 'hidden_dimension': 167, 'number_of_hidden_layers': 1, 'dropout_rate': 0.4861880281989067, 'global_pooling': 'mean', 'learning_rate': 0.0012477242544253718, 'weight_decay': 5.563908330129257e-06, 'beta_0': 0.8648654693552141, 'beta_1': 0.9889823664196133, 'epsilon': 3.4423603212995065e-07, 'balanced_loss': True, 'epochs': 181, 'early_stopping_patience': 16, 'plateau_patience': 11, 'plateau_divider': 2}. Best is trial 56 with value: 0.9151515151515152.
[I 2024-11-28 18:51:06,333] Trial 111 finished with value: 0.8848484848484849 and parameters: {'left_stride': 64, 'right_stride': 64, 'attention_pooling_operation': 'min', 'embedding_pooling_operation': 'mean', 'threshold': 0.9172763410517865, 'batch_size': 26, 'attention_heads': 6, 'hidden_dimension': 132, 'number_of_hidden_layers': 1, 'dropout_rate': 0.4711391925919886, 'global_pooling': 'mean', 'learning_rate': 0.0006824358951347709, 'weight_decay': 8.122705200414451e-06, 'beta_0': 0.8605651761600881, 'beta_1': 0.9870678552417952, 'epsilon': 2.170204191478381e-08, 'balanced_loss': True, 'epochs': 170, 'early_stopping_patience': 13, 'plateau_patience': 10, 'plateau_divider': 6}. Best is trial 56 with value: 0.9151515151515152.
[I 2024-11-28 18:57:19,431] Trial 112 finished with value: 0.9030303030303031 and parameters: {'left_stride': 64, 'right_stride': 64, 'attention_pooling_operation': 'min', 'embedding_pooling_operation': 'mean', 'threshold': 0.920476381767169, 'batch_size': 24, 'attention_heads': 6, 'hidden_dimension': 140, 'number_of_hidden_layers': 1, 'dropout_rate': 0.44363463575079937, 'global_pooling': 'mean', 'learning_rate': 0.0004568580227026182, 'weight_decay': 6.2069114478526415e-06, 'beta_0': 0.8702014557928441, 'beta_1': 0.9828813346061598, 'epsilon': 7.731185960076118e-08, 'balanced_loss': True, 'epochs': 165, 'early_stopping_patience': 15, 'plateau_patience': 18, 'plateau_divider': 6}. Best is trial 56 with value: 0.9151515151515152.
[I 2024-11-28 19:03:10,025] Trial 113 finished with value: 0.9090909090909091 and parameters: {'left_stride': 64, 'right_stride': 64, 'attention_pooling_operation': 'min', 'embedding_pooling_operation': 'mean', 'threshold': 0.92729109209165, 'batch_size': 33, 'attention_heads': 6, 'hidden_dimension': 111, 'number_of_hidden_layers': 1, 'dropout_rate': 0.45394835293912383, 'global_pooling': 'mean', 'learning_rate': 0.0006539551766033304, 'weight_decay': 1.028015870276994e-05, 'beta_0': 0.85408057210062, 'beta_1': 0.9812321334796643, 'epsilon': 5.823696699084892e-08, 'balanced_loss': True, 'epochs': 177, 'early_stopping_patience': 13, 'plateau_patience': 10, 'plateau_divider': 7}. Best is trial 56 with value: 0.9151515151515152.
[I 2024-11-28 19:10:58,671] Trial 114 finished with value: 0.8909090909090909 and parameters: {'left_stride': 64, 'right_stride': 64, 'attention_pooling_operation': 'min', 'embedding_pooling_operation': 'mean', 'threshold': 0.9024533426384977, 'batch_size': 33, 'attention_heads': 4, 'hidden_dimension': 252, 'number_of_hidden_layers': 2, 'dropout_rate': 0.43508047062700966, 'global_pooling': 'mean', 'learning_rate': 0.0010810067650625004, 'weight_decay': 1.803595720220085e-05, 'beta_0': 0.8551929644016564, 'beta_1': 0.9853130204703106, 'epsilon': 4.180629143449141e-08, 'balanced_loss': True, 'epochs': 178, 'early_stopping_patience': 14, 'plateau_patience': 10, 'plateau_divider': 7}. Best is trial 56 with value: 0.9151515151515152.
[I 2024-11-28 19:17:13,229] Trial 115 finished with value: 0.8 and parameters: {'left_stride': 64, 'right_stride': 128, 'attention_pooling_operation': 'min', 'embedding_pooling_operation': 'mean', 'threshold': 0.9149081237927233, 'batch_size': 38, 'attention_heads': 5, 'hidden_dimension': 99, 'number_of_hidden_layers': 1, 'dropout_rate': 0.45462869381999554, 'global_pooling': 'mean', 'learning_rate': 0.08862686174615657, 'weight_decay': 1.0556461256076798e-05, 'beta_0': 0.8754428346500756, 'beta_1': 0.9839752767922996, 'epsilon': 6.551298158344814e-08, 'balanced_loss': True, 'epochs': 174, 'early_stopping_patience': 13, 'plateau_patience': 11, 'plateau_divider': 8}. Best is trial 56 with value: 0.9151515151515152.
[I 2024-11-28 19:23:45,598] Trial 116 finished with value: 0.8848484848484849 and parameters: {'left_stride': 64, 'right_stride': 64, 'attention_pooling_operation': 'min', 'embedding_pooling_operation': 'mean', 'threshold': 0.9104436725427683, 'batch_size': 30, 'attention_heads': 6, 'hidden_dimension': 105, 'number_of_hidden_layers': 1, 'dropout_rate': 0.5166358126255446, 'global_pooling': 'max', 'learning_rate': 0.0025838804587306912, 'weight_decay': 3.661677778964635e-06, 'beta_0': 0.8582735785473223, 'beta_1': 0.9865224410969422, 'epsilon': 1.872911004653915e-08, 'balanced_loss': True, 'epochs': 169, 'early_stopping_patience': 16, 'plateau_patience': 10, 'plateau_divider': 8}. Best is trial 56 with value: 0.9151515151515152.
[I 2024-11-28 19:29:31,151] Trial 117 finished with value: 0.8848484848484849 and parameters: {'left_stride': 64, 'right_stride': 0, 'attention_pooling_operation': 'min', 'embedding_pooling_operation': 'mean', 'threshold': 0.9273657263248957, 'batch_size': 35, 'attention_heads': 5, 'hidden_dimension': 111, 'number_of_hidden_layers': 1, 'dropout_rate': 0.4237511780991247, 'global_pooling': 'mean', 'learning_rate': 0.0014554162269026793, 'weight_decay': 9.2889813690605e-06, 'beta_0': 0.8525321555412788, 'beta_1': 0.9813426678787428, 'epsilon': 1.7168309166995012e-07, 'balanced_loss': True, 'epochs': 191, 'early_stopping_patience': 15, 'plateau_patience': 17, 'plateau_divider': 7}. Best is trial 56 with value: 0.9151515151515152.
[I 2024-11-28 19:35:20,660] Trial 118 finished with value: 0.8909090909090909 and parameters: {'left_stride': 64, 'right_stride': 64, 'attention_pooling_operation': 'min', 'embedding_pooling_operation': 'mean', 'threshold': 0.9180214161351594, 'batch_size': 33, 'attention_heads': 6, 'hidden_dimension': 78, 'number_of_hidden_layers': 1, 'dropout_rate': 0.4455160315765427, 'global_pooling': 'mean', 'learning_rate': 0.00038405781489002594, 'weight_decay': 4.3231062541847686e-06, 'beta_0': 0.850142829252053, 'beta_1': 0.9859766507437622, 'epsilon': 5.618793806257934e-08, 'balanced_loss': True, 'epochs': 184, 'early_stopping_patience': 13, 'plateau_patience': 10, 'plateau_divider': 8}. Best is trial 56 with value: 0.9151515151515152.
[I 2024-11-28 19:40:54,405] Trial 119 finished with value: 0.9151515151515152 and parameters: {'left_stride': 64, 'right_stride': 128, 'attention_pooling_operation': 'min', 'embedding_pooling_operation': 'mean', 'threshold': 0.9828564438154516, 'batch_size': 28, 'attention_heads': 8, 'hidden_dimension': 128, 'number_of_hidden_layers': 1, 'dropout_rate': 0.34583035163189646, 'global_pooling': 'mean', 'learning_rate': 0.0010772972851483189, 'weight_decay': 1.2210140157088e-05, 'beta_0': 0.8721570121107592, 'beta_1': 0.9849670087923598, 'epsilon': 9.79167737195531e-05, 'balanced_loss': True, 'epochs': 173, 'early_stopping_patience': 14, 'plateau_patience': 16, 'plateau_divider': 7}. Best is trial 56 with value: 0.9151515151515152.
[I 2024-11-28 19:48:10,593] Trial 120 finished with value: 0.9030303030303031 and parameters: {'left_stride': 256, 'right_stride': 128, 'attention_pooling_operation': 'min', 'embedding_pooling_operation': 'mean', 'threshold': 0.9633772050077536, 'batch_size': 28, 'attention_heads': 8, 'hidden_dimension': 119, 'number_of_hidden_layers': 1, 'dropout_rate': 0.5101045033629894, 'global_pooling': 'mean', 'learning_rate': 0.0005857625700813923, 'weight_decay': 1.5091767086635316e-05, 'beta_0': 0.863200781703746, 'beta_1': 0.9878600846590487, 'epsilon': 2.001791678348295e-05, 'balanced_loss': True, 'epochs': 172, 'early_stopping_patience': 15, 'plateau_patience': 16, 'plateau_divider': 7}. Best is trial 56 with value: 0.9151515151515152.
[I 2024-11-28 19:53:50,878] Trial 121 finished with value: 0.8848484848484849 and parameters: {'left_stride': 64, 'right_stride': 128, 'attention_pooling_operation': 'min', 'embedding_pooling_operation': 'mean', 'threshold': 0.9865138792711486, 'batch_size': 29, 'attention_heads': 9, 'hidden_dimension': 128, 'number_of_hidden_layers': 1, 'dropout_rate': 0.33985225489094295, 'global_pooling': 'mean', 'learning_rate': 0.0010386155734366962, 'weight_decay': 1.1823651519842559e-05, 'beta_0': 0.867167392844351, 'beta_1': 0.984954315676532, 'epsilon': 7.118290062023432e-05, 'balanced_loss': True, 'epochs': 177, 'early_stopping_patience': 14, 'plateau_patience': 16, 'plateau_divider': 7}. Best is trial 56 with value: 0.9151515151515152.
[I 2024-11-28 19:59:30,838] Trial 122 finished with value: 0.9030303030303031 and parameters: {'left_stride': 64, 'right_stride': 128, 'attention_pooling_operation': 'min', 'embedding_pooling_operation': 'mean', 'threshold': 0.9729222287209157, 'batch_size': 32, 'attention_heads': 8, 'hidden_dimension': 105, 'number_of_hidden_layers': 1, 'dropout_rate': 0.34026466477473627, 'global_pooling': 'mean', 'learning_rate': 0.001945988851629219, 'weight_decay': 8.540380601533218e-06, 'beta_0': 0.8730390462313562, 'beta_1': 0.9854501045551665, 'epsilon': 6.120399146290799e-07, 'balanced_loss': True, 'epochs': 163, 'early_stopping_patience': 14, 'plateau_patience': 17, 'plateau_divider': 7}. Best is trial 56 with value: 0.9151515151515152.
[I 2024-11-28 20:06:43,739] Trial 123 finished with value: 0.896969696969697 and parameters: {'left_stride': 64, 'right_stride': 128, 'attention_pooling_operation': 'min', 'embedding_pooling_operation': 'mean', 'threshold': 0.9075828852597266, 'batch_size': 27, 'attention_heads': 8, 'hidden_dimension': 152, 'number_of_hidden_layers': 1, 'dropout_rate': 0.3202438711237205, 'global_pooling': 'mean', 'learning_rate': 0.0007713744436341258, 'weight_decay': 2.9755093134843812e-06, 'beta_0': 0.8703187034134727, 'beta_1': 0.9843498171047134, 'epsilon': 8.563910418594174e-06, 'balanced_loss': True, 'epochs': 180, 'early_stopping_patience': 13, 'plateau_patience': 18, 'plateau_divider': 7}. Best is trial 56 with value: 0.9151515151515152.
[I 2024-11-28 20:13:24,116] Trial 124 finished with value: 0.9030303030303031 and parameters: {'left_stride': 64, 'right_stride': 64, 'attention_pooling_operation': 'min', 'embedding_pooling_operation': 'mean', 'threshold': 0.9133132500095963, 'batch_size': 30, 'attention_heads': 9, 'hidden_dimension': 114, 'number_of_hidden_layers': 1, 'dropout_rate': 0.3670532254336567, 'global_pooling': 'mean', 'learning_rate': 0.0015276987108556533, 'weight_decay': 1.0459024554344238e-05, 'beta_0': 0.8558145641745794, 'beta_1': 0.9835336999396043, 'epsilon': 1.2750555433106256e-07, 'balanced_loss': True, 'epochs': 167, 'early_stopping_patience': 14, 'plateau_patience': 15, 'plateau_divider': 7}. Best is trial 56 with value: 0.9151515151515152.
[I 2024-11-28 20:19:28,182] Trial 125 finished with value: 0.9030303030303031 and parameters: {'left_stride': 64, 'right_stride': 128, 'attention_pooling_operation': 'min', 'embedding_pooling_operation': 'mean', 'threshold': 0.9506372823618139, 'batch_size': 25, 'attention_heads': 8, 'hidden_dimension': 108, 'number_of_hidden_layers': 1, 'dropout_rate': 0.4824268865327524, 'global_pooling': 'mean', 'learning_rate': 0.001125403464909653, 'weight_decay': 6.1693591212096025e-06, 'beta_0': 0.8621003985744923, 'beta_1': 0.9861543592099699, 'epsilon': 2.451307843569752e-07, 'balanced_loss': True, 'epochs': 194, 'early_stopping_patience': 15, 'plateau_patience': 24, 'plateau_divider': 8}. Best is trial 56 with value: 0.9151515151515152.
[I 2024-11-28 20:25:53,586] Trial 126 finished with value: 0.896969696969697 and parameters: {'left_stride': 64, 'right_stride': 64, 'attention_pooling_operation': 'min', 'embedding_pooling_operation': 'mean', 'threshold': 0.9230984130993934, 'batch_size': 63, 'attention_heads': 6, 'hidden_dimension': 93, 'number_of_hidden_layers': 1, 'dropout_rate': 0.40959056782897774, 'global_pooling': 'mean', 'learning_rate': 0.000502357570790834, 'weight_decay': 1.2976576504376937e-05, 'beta_0': 0.8660556066442187, 'beta_1': 0.9866926735034199, 'epsilon': 4.30476657400062e-05, 'balanced_loss': True, 'epochs': 172, 'early_stopping_patience': 16, 'plateau_patience': 16, 'plateau_divider': 7}. Best is trial 56 with value: 0.9151515151515152.
[I 2024-11-28 20:31:30,312] Trial 127 finished with value: 0.8545454545454545 and parameters: {'left_stride': 64, 'right_stride': 64, 'attention_pooling_operation': 'min', 'embedding_pooling_operation': 'mean', 'threshold': 0.9755046696061778, 'batch_size': 28, 'attention_heads': 8, 'hidden_dimension': 64, 'number_of_hidden_layers': 1, 'dropout_rate': 0.49838944568443777, 'global_pooling': 'sum', 'learning_rate': 0.0009003012416635315, 'weight_decay': 5.296716782234158e-06, 'beta_0': 0.8486253939669585, 'beta_1': 0.9852053283238834, 'epsilon': 7.526118205337902e-07, 'balanced_loss': True, 'epochs': 153, 'early_stopping_patience': 14, 'plateau_patience': 17, 'plateau_divider': 8}. Best is trial 56 with value: 0.9151515151515152.
[I 2024-11-28 20:38:28,082] Trial 128 finished with value: 0.9030303030303031 and parameters: {'left_stride': 0, 'right_stride': 64, 'attention_pooling_operation': 'min', 'embedding_pooling_operation': 'mean', 'threshold': 0.9452192566238672, 'batch_size': 32, 'attention_heads': 8, 'hidden_dimension': 147, 'number_of_hidden_layers': 1, 'dropout_rate': 0.4534675063955018, 'global_pooling': 'mean', 'learning_rate': 0.0012520602208754064, 'weight_decay': 2.2830587313512427e-06, 'beta_0': 0.8765423543454611, 'beta_1': 0.9830229199949073, 'epsilon': 4.208136232627768e-07, 'balanced_loss': True, 'epochs': 161, 'early_stopping_patience': 15, 'plateau_patience': 10, 'plateau_divider': 7}. Best is trial 56 with value: 0.9151515151515152.
CUDA out of memory. Tried to allocate 4.20 GiB. GPU 0 has a total capacity of 44.56 GiB of which 4.13 GiB is free. Including non-PyTorch memory, this process has 40.42 GiB memory in use. Of the allocated memory 36.74 GiB is allocated by PyTorch, and 2.53 GiB is reserved by PyTorch but unallocated. If reserved but unallocated memory is large try setting PYTORCH_CUDA_ALLOC_CONF=expandable_segments:True to avoid fragmentation.  See documentation for Memory Management  (https://pytorch.org/docs/stable/notes/cuda.html#environment-variables)
[I 2024-11-28 20:45:25,611] Trial 129 finished with value: -1.0 and parameters: {'left_stride': 64, 'right_stride': 128, 'attention_pooling_operation': 'mean', 'embedding_pooling_operation': 'mean', 'threshold': 0.9053554113019302, 'batch_size': 60, 'attention_heads': 9, 'hidden_dimension': 132, 'number_of_hidden_layers': 1, 'dropout_rate': 0.46528217453444976, 'global_pooling': 'mean', 'learning_rate': 0.002321619708596338, 'weight_decay': 7.876137360241139e-06, 'beta_0': 0.8716843984523996, 'beta_1': 0.9871426562451996, 'epsilon': 1.055633346670444e-07, 'balanced_loss': True, 'epochs': 174, 'early_stopping_patience': 16, 'plateau_patience': 11, 'plateau_divider': 7}. Best is trial 56 with value: 0.9151515151515152.
[I 2024-11-28 20:55:23,436] Trial 130 finished with value: 0.8909090909090909 and parameters: {'left_stride': 64, 'right_stride': 32, 'attention_pooling_operation': 'min', 'embedding_pooling_operation': 'mean', 'threshold': 0.9097702226298465, 'batch_size': 24, 'attention_heads': 7, 'hidden_dimension': 211, 'number_of_hidden_layers': 2, 'dropout_rate': 0.49039714531798134, 'global_pooling': 'mean', 'learning_rate': 0.0002894515320691076, 'weight_decay': 1.6007184471115454e-05, 'beta_0': 0.8686333452532352, 'beta_1': 0.9847597954496696, 'epsilon': 2.922298780829322e-07, 'balanced_loss': True, 'epochs': 71, 'early_stopping_patience': 17, 'plateau_patience': 19, 'plateau_divider': 6}. Best is trial 56 with value: 0.9151515151515152.
[I 2024-11-28 21:02:07,459] Trial 131 finished with value: 0.896969696969697 and parameters: {'left_stride': 64, 'right_stride': 64, 'attention_pooling_operation': 'min', 'embedding_pooling_operation': 'mean', 'threshold': 0.9195237054951555, 'batch_size': 26, 'attention_heads': 7, 'hidden_dimension': 137, 'number_of_hidden_layers': 1, 'dropout_rate': 0.46712400794093023, 'global_pooling': 'mean', 'learning_rate': 0.000664294376309773, 'weight_decay': 6.505458711785015e-06, 'beta_0': 0.8608130936177388, 'beta_1': 0.9801214280148657, 'epsilon': 8.482564920234446e-08, 'balanced_loss': True, 'epochs': 169, 'early_stopping_patience': 12, 'plateau_patience': 13, 'plateau_divider': 6}. Best is trial 56 with value: 0.9151515151515152.
[I 2024-11-28 21:08:17,636] Trial 132 finished with value: 0.9151515151515152 and parameters: {'left_stride': 64, 'right_stride': 64, 'attention_pooling_operation': 'min', 'embedding_pooling_operation': 'mean', 'threshold': 0.9262963425867237, 'batch_size': 27, 'attention_heads': 6, 'hidden_dimension': 126, 'number_of_hidden_layers': 1, 'dropout_rate': 0.47185767858905875, 'global_pooling': 'mean', 'learning_rate': 0.0007538673715898232, 'weight_decay': 7.58549718640881e-06, 'beta_0': 0.8580920262488707, 'beta_1': 0.9811068943284065, 'epsilon': 4.505448982998561e-08, 'balanced_loss': True, 'epochs': 164, 'early_stopping_patience': 13, 'plateau_patience': 16, 'plateau_divider': 6}. Best is trial 56 with value: 0.9151515151515152.
[I 2024-11-28 21:13:58,619] Trial 133 finished with value: 0.896969696969697 and parameters: {'left_stride': 64, 'right_stride': 64, 'attention_pooling_operation': 'min', 'embedding_pooling_operation': 'mean', 'threshold': 0.9304425282322177, 'batch_size': 27, 'attention_heads': 5, 'hidden_dimension': 120, 'number_of_hidden_layers': 1, 'dropout_rate': 0.47947333648562623, 'global_pooling': 'mean', 'learning_rate': 0.0008285152742680078, 'weight_decay': 1.1058233048430398e-05, 'beta_0': 0.8644237797050947, 'beta_1': 0.9811522518162179, 'epsilon': 3.291074243884443e-08, 'balanced_loss': True, 'epochs': 164, 'early_stopping_patience': 14, 'plateau_patience': 15, 'plateau_divider': 5}. Best is trial 56 with value: 0.9151515151515152.
[I 2024-11-28 21:19:16,883] Trial 134 finished with value: 0.8848484848484849 and parameters: {'left_stride': 64, 'right_stride': 64, 'attention_pooling_operation': 'min', 'embedding_pooling_operation': 'mean', 'threshold': 0.9787297772528479, 'batch_size': 22, 'attention_heads': 6, 'hidden_dimension': 126, 'number_of_hidden_layers': 1, 'dropout_rate': 0.34902926093556524, 'global_pooling': 'mean', 'learning_rate': 0.0017504408164696946, 'weight_decay': 9.646390633526096e-06, 'beta_0': 0.8543306396626746, 'beta_1': 0.9816390050735752, 'epsilon': 4.4365090368303726e-08, 'balanced_loss': True, 'epochs': 61, 'early_stopping_patience': 13, 'plateau_patience': 17, 'plateau_divider': 6}. Best is trial 56 with value: 0.9151515151515152.
[I 2024-11-28 21:25:12,829] Trial 135 finished with value: 0.9030303030303031 and parameters: {'left_stride': 64, 'right_stride': 64, 'attention_pooling_operation': 'min', 'embedding_pooling_operation': 'mean', 'threshold': 0.9220132256662641, 'batch_size': 28, 'attention_heads': 6, 'hidden_dimension': 116, 'number_of_hidden_layers': 1, 'dropout_rate': 0.47379210531318994, 'global_pooling': 'mean', 'learning_rate': 0.0010964701615136876, 'weight_decay': 7.374488709007152e-06, 'beta_0': 0.8567571554743655, 'beta_1': 0.9858279843205882, 'epsilon': 5.5394601209610356e-08, 'balanced_loss': True, 'epochs': 181, 'early_stopping_patience': 13, 'plateau_patience': 16, 'plateau_divider': 8}. Best is trial 56 with value: 0.9151515151515152.
[I 2024-11-28 21:31:25,223] Trial 136 finished with value: 0.9030303030303031 and parameters: {'left_stride': 64, 'right_stride': 64, 'attention_pooling_operation': 'min', 'embedding_pooling_operation': 'mean', 'threshold': 0.9270449620603921, 'batch_size': 29, 'attention_heads': 5, 'hidden_dimension': 164, 'number_of_hidden_layers': 1, 'dropout_rate': 0.4574297559835411, 'global_pooling': 'mean', 'learning_rate': 0.0007372623419602663, 'weight_decay': 4.261834238518079e-06, 'beta_0': 0.8581216884550643, 'beta_1': 0.9842049803311876, 'epsilon': 2.6171098741217543e-08, 'balanced_loss': True, 'epochs': 156, 'early_stopping_patience': 14, 'plateau_patience': 16, 'plateau_divider': 7}. Best is trial 56 with value: 0.9151515151515152.
[I 2024-11-28 21:37:09,303] Trial 137 finished with value: 0.8909090909090909 and parameters: {'left_stride': 64, 'right_stride': 64, 'attention_pooling_operation': 'min', 'embedding_pooling_operation': 'mean', 'threshold': 0.9386361984699643, 'batch_size': 58, 'attention_heads': 8, 'hidden_dimension': 128, 'number_of_hidden_layers': 0, 'dropout_rate': 0.4701135728535498, 'global_pooling': 'mean', 'learning_rate': 0.0014013619137835818, 'weight_decay': 5.9974846374222195e-06, 'beta_0': 0.8594019470800756, 'beta_1': 0.9874113301799851, 'epsilon': 9.076729775228765e-07, 'balanced_loss': True, 'epochs': 175, 'early_stopping_patience': 15, 'plateau_patience': 15, 'plateau_divider': 7}. Best is trial 56 with value: 0.9151515151515152.
