[I 2024-11-28 19:02:52,795] Trial 103 finished with value: 0.8909090909090909 and parameters: {'left_stride': 0, 'right_stride': 32, 'attention_pooling_operation': 'min', 'embedding_pooling_operation': 'min', 'threshold': 0.9503740816418415, 'batch_size': 62, 'attention_heads': 10, 'hidden_dimension': 199, 'number_of_hidden_layers': 0, 'dropout_rate': 0.49957885344409453, 'global_pooling': 'mean', 'learning_rate': 0.0012241983163660158, 'weight_decay': 0.00015973355547920027, 'beta_0': 0.8525946935705985, 'beta_1': 0.9883293947244757, 'epsilon': 6.610527688444417e-08, 'balanced_loss': True, 'epochs': 105, 'early_stopping_patience': 16, 'plateau_patience': 22, 'plateau_divider': 7}. Best is trial 84 with value: 0.9090909090909091.
[I 2024-11-28 19:09:32,406] Trial 104 finished with value: 0.9030303030303031 and parameters: {'left_stride': 0, 'right_stride': 32, 'attention_pooling_operation': 'min', 'embedding_pooling_operation': 'min', 'threshold': 0.94063344544122, 'batch_size': 61, 'attention_heads': 11, 'hidden_dimension': 191, 'number_of_hidden_layers': 0, 'dropout_rate': 0.5092157946935352, 'global_pooling': 'mean', 'learning_rate': 0.000579613486798204, 'weight_decay': 0.00018011857813586126, 'beta_0': 0.846169696619292, 'beta_1': 0.9885757002179714, 'epsilon': 4.1459754963769757e-07, 'balanced_loss': True, 'epochs': 107, 'early_stopping_patience': 18, 'plateau_patience': 22, 'plateau_divider': 7}. Best is trial 84 with value: 0.9090909090909091.
[I 2024-11-28 19:16:50,930] Trial 105 finished with value: 0.8909090909090909 and parameters: {'left_stride': 0, 'right_stride': 32, 'attention_pooling_operation': 'min', 'embedding_pooling_operation': 'min', 'threshold': 0.933026546738945, 'batch_size': 56, 'attention_heads': 12, 'hidden_dimension': 206, 'number_of_hidden_layers': 0, 'dropout_rate': 0.4803993784351092, 'global_pooling': 'mean', 'learning_rate': 0.00043870263015561716, 'weight_decay': 8.024169448277259e-05, 'beta_0': 0.8559220842111466, 'beta_1': 0.9896773085045804, 'epsilon': 1.048593574013536e-07, 'balanced_loss': True, 'epochs': 124, 'early_stopping_patience': 17, 'plateau_patience': 23, 'plateau_divider': 6}. Best is trial 84 with value: 0.9090909090909091.
[I 2024-11-28 19:23:46,616] Trial 106 finished with value: 0.896969696969697 and parameters: {'left_stride': 128, 'right_stride': 32, 'attention_pooling_operation': 'min', 'embedding_pooling_operation': 'min', 'threshold': 0.9441531301798864, 'batch_size': 53, 'attention_heads': 12, 'hidden_dimension': 223, 'number_of_hidden_layers': 0, 'dropout_rate': 0.5290728160319201, 'global_pooling': 'mean', 'learning_rate': 0.000959758391368845, 'weight_decay': 0.00031833423461835776, 'beta_0': 0.8593567815548779, 'beta_1': 0.9887989245015583, 'epsilon': 1.614412859505045e-07, 'balanced_loss': True, 'epochs': 129, 'early_stopping_patience': 17, 'plateau_patience': 24, 'plateau_divider': 7}. Best is trial 84 with value: 0.9090909090909091.
[I 2024-11-28 19:30:30,748] Trial 107 finished with value: 0.806060606060606 and parameters: {'left_stride': 64, 'right_stride': 32, 'attention_pooling_operation': 'min', 'embedding_pooling_operation': 'min', 'threshold': 0.9390044478065733, 'batch_size': 60, 'attention_heads': 11, 'hidden_dimension': 177, 'number_of_hidden_layers': 0, 'dropout_rate': 0.46389717897258737, 'global_pooling': 'max', 'learning_rate': 0.002265767426743807, 'weight_decay': 5.2305563499538705e-05, 'beta_0': 0.84973802476169, 'beta_1': 0.9840297579040763, 'epsilon': 5.976221948245429e-08, 'balanced_loss': True, 'epochs': 148, 'early_stopping_patience': 18, 'plateau_patience': 23, 'plateau_divider': 6}. Best is trial 84 with value: 0.9090909090909091.
[I 2024-11-28 19:38:06,937] Trial 108 finished with value: 0.896969696969697 and parameters: {'left_stride': 128, 'right_stride': 32, 'attention_pooling_operation': 'min', 'embedding_pooling_operation': 'min', 'threshold': 0.9296283149554778, 'batch_size': 50, 'attention_heads': 10, 'hidden_dimension': 213, 'number_of_hidden_layers': 0, 'dropout_rate': 0.5721659569966765, 'global_pooling': 'mean', 'learning_rate': 0.0003052948424225983, 'weight_decay': 9.501042111830125e-05, 'beta_0': 0.8664925143995723, 'beta_1': 0.9908438461991352, 'epsilon': 9.339119309915095e-08, 'balanced_loss': True, 'epochs': 135, 'early_stopping_patience': 16, 'plateau_patience': 21, 'plateau_divider': 8}. Best is trial 84 with value: 0.9090909090909091.
[I 2024-11-28 19:45:04,329] Trial 109 finished with value: 0.9030303030303031 and parameters: {'left_stride': 0, 'right_stride': 0, 'attention_pooling_operation': 'min', 'embedding_pooling_operation': 'min', 'threshold': 0.9078059272156085, 'batch_size': 64, 'attention_heads': 9, 'hidden_dimension': 167, 'number_of_hidden_layers': 0, 'dropout_rate': 0.5390059528642607, 'global_pooling': 'mean', 'learning_rate': 0.0006396167773931677, 'weight_decay': 0.00022397484112635918, 'beta_0': 0.8625267268190383, 'beta_1': 0.9850344369557581, 'epsilon': 2.8960370414638994e-07, 'balanced_loss': True, 'epochs': 142, 'early_stopping_patience': 19, 'plateau_patience': 15, 'plateau_divider': 10}. Best is trial 84 with value: 0.9090909090909091.
CUDA out of memory. Tried to allocate 6.45 GiB. GPU 0 has a total capacity of 44.56 GiB of which 5.49 GiB is free. Including non-PyTorch memory, this process has 39.07 GiB memory in use. Of the allocated memory 35.79 GiB is allocated by PyTorch, and 2.12 GiB is reserved by PyTorch but unallocated. If reserved but unallocated memory is large try setting PYTORCH_CUDA_ALLOC_CONF=expandable_segments:True to avoid fragmentation.  See documentation for Memory Management  (https://pytorch.org/docs/stable/notes/cuda.html#environment-variables)
[I 2024-11-28 19:50:40,795] Trial 110 finished with value: -1.0 and parameters: {'left_stride': 64, 'right_stride': 256, 'attention_pooling_operation': 'min', 'embedding_pooling_operation': 'min', 'threshold': 0.9100884860853178, 'batch_size': 57, 'attention_heads': 8, 'hidden_dimension': 234, 'number_of_hidden_layers': 0, 'dropout_rate': 0.48602670100692363, 'global_pooling': 'mean', 'learning_rate': 0.0013440824018447633, 'weight_decay': 0.000138122781954319, 'beta_0': 0.8537951313290597, 'beta_1': 0.9894072007313843, 'epsilon': 4.2739253787602496e-06, 'balanced_loss': True, 'epochs': 98, 'early_stopping_patience': 14, 'plateau_patience': 16, 'plateau_divider': 5}. Best is trial 84 with value: 0.9090909090909091.
[I 2024-11-28 19:57:36,954] Trial 111 finished with value: 0.8787878787878788 and parameters: {'left_stride': 0, 'right_stride': 64, 'attention_pooling_operation': 'min', 'embedding_pooling_operation': 'min', 'threshold': 0.9424761600562976, 'batch_size': 34, 'attention_heads': 13, 'hidden_dimension': 228, 'number_of_hidden_layers': 0, 'dropout_rate': 0.42938919038589124, 'global_pooling': 'mean', 'learning_rate': 0.001526653212820441, 'weight_decay': 0.00015050095814478213, 'beta_0': 0.8382989318515536, 'beta_1': 0.9902141194249592, 'epsilon': 1.1210697809848702e-07, 'balanced_loss': False, 'epochs': 119, 'early_stopping_patience': 17, 'plateau_patience': 17, 'plateau_divider': 6}. Best is trial 84 with value: 0.9090909090909091.
[I 2024-11-28 20:04:48,033] Trial 112 finished with value: 0.9090909090909091 and parameters: {'left_stride': 0, 'right_stride': 32, 'attention_pooling_operation': 'min', 'embedding_pooling_operation': 'min', 'threshold': 0.935612926857582, 'batch_size': 33, 'attention_heads': 13, 'hidden_dimension': 218, 'number_of_hidden_layers': 0, 'dropout_rate': 0.5454218769472179, 'global_pooling': 'mean', 'learning_rate': 0.0007826935037624043, 'weight_decay': 0.00025631542768451965, 'beta_0': 0.8484191719441921, 'beta_1': 0.9890080164951752, 'epsilon': 7.891996317621375e-08, 'balanced_loss': False, 'epochs': 120, 'early_stopping_patience': 17, 'plateau_patience': 20, 'plateau_divider': 6}. Best is trial 84 with value: 0.9090909090909091.
[I 2024-11-28 20:11:54,276] Trial 113 finished with value: 0.896969696969697 and parameters: {'left_stride': 0, 'right_stride': 32, 'attention_pooling_operation': 'min', 'embedding_pooling_operation': 'min', 'threshold': 0.9359324868764646, 'batch_size': 30, 'attention_heads': 14, 'hidden_dimension': 199, 'number_of_hidden_layers': 0, 'dropout_rate': 0.5453374729733621, 'global_pooling': 'mean', 'learning_rate': 0.0007379608706385723, 'weight_decay': 0.00025199630724526535, 'beta_0': 0.8295905514876232, 'beta_1': 0.9825647574863429, 'epsilon': 4.464331460463769e-08, 'balanced_loss': True, 'epochs': 119, 'early_stopping_patience': 18, 'plateau_patience': 20, 'plateau_divider': 6}. Best is trial 84 with value: 0.9090909090909091.
CUDA out of memory. Tried to allocate 3.55 GiB. GPU 0 has a total capacity of 44.56 GiB of which 3.41 GiB is free. Including non-PyTorch memory, this process has 41.14 GiB memory in use. Of the allocated memory 39.43 GiB is allocated by PyTorch, and 573.83 MiB is reserved by PyTorch but unallocated. If reserved but unallocated memory is large try setting PYTORCH_CUDA_ALLOC_CONF=expandable_segments:True to avoid fragmentation.  See documentation for Memory Management  (https://pytorch.org/docs/stable/notes/cuda.html#environment-variables)
[I 2024-11-28 20:16:41,775] Trial 114 finished with value: -1.0 and parameters: {'left_stride': 0, 'right_stride': 32, 'attention_pooling_operation': 'min', 'embedding_pooling_operation': 'min', 'threshold': 0.9329071836981894, 'batch_size': 36, 'attention_heads': 13, 'hidden_dimension': 209, 'number_of_hidden_layers': 2, 'dropout_rate': 0.5606682322722191, 'global_pooling': 'mean', 'learning_rate': 0.0010126312846674159, 'weight_decay': 0.0001113486511149567, 'beta_0': 0.8477342963593755, 'beta_1': 0.9874228308875078, 'epsilon': 6.688999745363935e-08, 'balanced_loss': False, 'epochs': 112, 'early_stopping_patience': 17, 'plateau_patience': 24, 'plateau_divider': 7}. Best is trial 84 with value: 0.9090909090909091.
[I 2024-11-28 20:24:46,517] Trial 115 finished with value: 0.8121212121212121 and parameters: {'left_stride': 128, 'right_stride': 32, 'attention_pooling_operation': 'min', 'embedding_pooling_operation': 'min', 'threshold': 0.9040301166617633, 'batch_size': 38, 'attention_heads': 11, 'hidden_dimension': 204, 'number_of_hidden_layers': 0, 'dropout_rate': 0.5490159122660654, 'global_pooling': 'mean', 'learning_rate': 0.08862686174615657, 'weight_decay': 0.0001742767578600167, 'beta_0': 0.8515497223006077, 'beta_1': 0.9889610103666655, 'epsilon': 1.9962206333795268e-07, 'balanced_loss': False, 'epochs': 110, 'early_stopping_patience': 25, 'plateau_patience': 20, 'plateau_divider': 5}. Best is trial 84 with value: 0.9090909090909091.
CUDA out of memory. Tried to allocate 6.53 GiB. GPU 0 has a total capacity of 44.56 GiB of which 5.50 GiB is free. Including non-PyTorch memory, this process has 39.05 GiB memory in use. Of the allocated memory 36.31 GiB is allocated by PyTorch, and 1.59 GiB is reserved by PyTorch but unallocated. If reserved but unallocated memory is large try setting PYTORCH_CUDA_ALLOC_CONF=expandable_segments:True to avoid fragmentation.  See documentation for Memory Management  (https://pytorch.org/docs/stable/notes/cuda.html#environment-variables)
[I 2024-11-28 20:30:36,207] Trial 116 finished with value: -1.0 and parameters: {'left_stride': 32, 'right_stride': 32, 'attention_pooling_operation': 'mean', 'embedding_pooling_operation': 'min', 'threshold': 0.9127794423181101, 'batch_size': 53, 'attention_heads': 12, 'hidden_dimension': 222, 'number_of_hidden_layers': 3, 'dropout_rate': 0.49335503702301253, 'global_pooling': 'mean', 'learning_rate': 0.0017956888310845468, 'weight_decay': 0.000285616532600653, 'beta_0': 0.8405664369081661, 'beta_1': 0.9879399461363753, 'epsilon': 2.7632144536955198e-05, 'balanced_loss': True, 'epochs': 125, 'early_stopping_patience': 16, 'plateau_patience': 16, 'plateau_divider': 7}. Best is trial 84 with value: 0.9090909090909091.
[I 2024-11-28 20:38:56,046] Trial 117 finished with value: 0.8909090909090909 and parameters: {'left_stride': 0, 'right_stride': 32, 'attention_pooling_operation': 'min', 'embedding_pooling_operation': 'max', 'threshold': 0.9271769028064539, 'batch_size': 32, 'attention_heads': 14, 'hidden_dimension': 192, 'number_of_hidden_layers': 0, 'dropout_rate': 0.5328688668523215, 'global_pooling': 'sum', 'learning_rate': 0.0008089832992001279, 'weight_decay': 0.00020285005637141535, 'beta_0': 0.8444398370871735, 'beta_1': 0.9864816303193509, 'epsilon': 8.144336999076924e-08, 'balanced_loss': False, 'epochs': 159, 'early_stopping_patience': 15, 'plateau_patience': 19, 'plateau_divider': 7}. Best is trial 84 with value: 0.9090909090909091.
[I 2024-11-28 20:46:54,785] Trial 118 finished with value: 0.806060606060606 and parameters: {'left_stride': 64, 'right_stride': 0, 'attention_pooling_operation': 'min', 'embedding_pooling_operation': 'min', 'threshold': 0.9308914998066393, 'batch_size': 35, 'attention_heads': 12, 'hidden_dimension': 217, 'number_of_hidden_layers': 0, 'dropout_rate': 0.5168579221758629, 'global_pooling': 'max', 'learning_rate': 0.00036772496041814, 'weight_decay': 2.9580185381886143e-06, 'beta_0': 0.8073802935259965, 'beta_1': 0.9892374689279636, 'epsilon': 3.6392235291390006e-08, 'balanced_loss': False, 'epochs': 139, 'early_stopping_patience': 18, 'plateau_patience': 18, 'plateau_divider': 3}. Best is trial 84 with value: 0.9090909090909091.
[I 2024-11-28 20:55:06,937] Trial 119 finished with value: 0.896969696969697 and parameters: {'left_stride': 128, 'right_stride': 32, 'attention_pooling_operation': 'min', 'embedding_pooling_operation': 'mean', 'threshold': 0.9187351633980283, 'batch_size': 34, 'attention_heads': 13, 'hidden_dimension': 226, 'number_of_hidden_layers': 0, 'dropout_rate': 0.5028974940430401, 'global_pooling': 'mean', 'learning_rate': 0.0005014697047946194, 'weight_decay': 6.06522597956344e-05, 'beta_0': 0.8355113109143594, 'beta_1': 0.9910417949284718, 'epsilon': 5.179279776819906e-06, 'balanced_loss': True, 'epochs': 129, 'early_stopping_patience': 16, 'plateau_patience': 16, 'plateau_divider': 6}. Best is trial 84 with value: 0.9090909090909091.
[I 2024-11-28 21:01:25,712] Trial 120 finished with value: 0.8909090909090909 and parameters: {'left_stride': 0, 'right_stride': 128, 'attention_pooling_operation': 'min', 'embedding_pooling_operation': 'min', 'threshold': 0.9467249666004703, 'batch_size': 37, 'attention_heads': 11, 'hidden_dimension': 196, 'number_of_hidden_layers': 0, 'dropout_rate': 0.5562215981853722, 'global_pooling': 'mean', 'learning_rate': 0.0012585396440777871, 'weight_decay': 8.477657922933306e-06, 'beta_0': 0.8038630235971855, 'beta_1': 0.9833567005587557, 'epsilon': 1.0978045464337991e-06, 'balanced_loss': False, 'epochs': 154, 'early_stopping_patience': 15, 'plateau_patience': 21, 'plateau_divider': 7}. Best is trial 84 with value: 0.9090909090909091.
[I 2024-11-28 21:08:31,133] Trial 121 finished with value: 0.896969696969697 and parameters: {'left_stride': 0, 'right_stride': 64, 'attention_pooling_operation': 'min', 'embedding_pooling_operation': 'min', 'threshold': 0.9406905575877155, 'batch_size': 33, 'attention_heads': 13, 'hidden_dimension': 216, 'number_of_hidden_layers': 0, 'dropout_rate': 0.4566210033751939, 'global_pooling': 'mean', 'learning_rate': 0.0014745601807124712, 'weight_decay': 0.00013746084061241773, 'beta_0': 0.842641860572667, 'beta_1': 0.9899258261019083, 'epsilon': 9.623202461982798e-08, 'balanced_loss': False, 'epochs': 115, 'early_stopping_patience': 17, 'plateau_patience': 17, 'plateau_divider': 6}. Best is trial 84 with value: 0.9090909090909091.
[I 2024-11-28 21:15:27,583] Trial 122 finished with value: 0.8848484848484849 and parameters: {'left_stride': 0, 'right_stride': 64, 'attention_pooling_operation': 'min', 'embedding_pooling_operation': 'min', 'threshold': 0.9379743058159989, 'batch_size': 31, 'attention_heads': 13, 'hidden_dimension': 212, 'number_of_hidden_layers': 0, 'dropout_rate': 0.47057211678343325, 'global_pooling': 'mean', 'learning_rate': 0.0020328281272259567, 'weight_decay': 0.0003842271210495462, 'beta_0': 0.8463552338308077, 'beta_1': 0.9903308876872438, 'epsilon': 2.8237693554441797e-06, 'balanced_loss': False, 'epochs': 120, 'early_stopping_patience': 18, 'plateau_patience': 17, 'plateau_divider': 6}. Best is trial 84 with value: 0.9090909090909091.
[I 2024-11-28 21:21:59,686] Trial 123 finished with value: 0.8787878787878788 and parameters: {'left_stride': 0, 'right_stride': 0, 'attention_pooling_operation': 'min', 'embedding_pooling_operation': 'min', 'threshold': 0.9432106824708859, 'batch_size': 33, 'attention_heads': 13, 'hidden_dimension': 221, 'number_of_hidden_layers': 0, 'dropout_rate': 0.44450442835993526, 'global_pooling': 'mean', 'learning_rate': 0.0024417322573211317, 'weight_decay': 8.925324192051842e-05, 'beta_0': 0.8577401472141849, 'beta_1': 0.9905903584821029, 'epsilon': 1.6819257818031765e-07, 'balanced_loss': False, 'epochs': 116, 'early_stopping_patience': 17, 'plateau_patience': 17, 'plateau_divider': 5}. Best is trial 84 with value: 0.9090909090909091.
[I 2024-11-28 21:28:31,859] Trial 124 finished with value: 0.8909090909090909 and parameters: {'left_stride': 0, 'right_stride': 64, 'attention_pooling_operation': 'min', 'embedding_pooling_operation': 'min', 'threshold': 0.935250447727144, 'batch_size': 28, 'attention_heads': 12, 'hidden_dimension': 204, 'number_of_hidden_layers': 0, 'dropout_rate': 0.5398718363172498, 'global_pooling': 'mean', 'learning_rate': 0.003091347667213943, 'weight_decay': 0.00011621922201856947, 'beta_0': 0.8493606637748723, 'beta_1': 0.9918326020779018, 'epsilon': 1.2174168329752881e-07, 'balanced_loss': False, 'epochs': 123, 'early_stopping_patience': 17, 'plateau_patience': 16, 'plateau_divider': 6}. Best is trial 84 with value: 0.9090909090909091.
[I 2024-11-28 21:35:27,618] Trial 125 finished with value: 0.8848484848484849 and parameters: {'left_stride': 64, 'right_stride': 32, 'attention_pooling_operation': 'min', 'embedding_pooling_operation': 'min', 'threshold': 0.9525922693036235, 'batch_size': 36, 'attention_heads': 14, 'hidden_dimension': 233, 'number_of_hidden_layers': 0, 'dropout_rate': 0.526033339419863, 'global_pooling': 'mean', 'learning_rate': 0.0010933021500006044, 'weight_decay': 0.00017176591393212425, 'beta_0': 0.8322747859939672, 'beta_1': 0.9896773595386729, 'epsilon': 4.78192208605601e-07, 'balanced_loss': False, 'epochs': 108, 'early_stopping_patience': 16, 'plateau_patience': 18, 'plateau_divider': 6}. Best is trial 84 with value: 0.9090909090909091.
[I 2024-11-28 21:44:00,032] Trial 126 finished with value: 0.896969696969697 and parameters: {'left_stride': 128, 'right_stride': 0, 'attention_pooling_operation': 'min', 'embedding_pooling_operation': 'min', 'threshold': 0.9070572601693241, 'batch_size': 31, 'attention_heads': 12, 'hidden_dimension': 241, 'number_of_hidden_layers': 0, 'dropout_rate': 0.5674676803093057, 'global_pooling': 'mean', 'learning_rate': 0.0008834772511894526, 'weight_decay': 7.858452677145365e-05, 'beta_0': 0.8089317923702672, 'beta_1': 0.9886953659636354, 'epsilon': 2.2349903609793954e-07, 'balanced_loss': False, 'epochs': 103, 'early_stopping_patience': 16, 'plateau_patience': 16, 'plateau_divider': 5}. Best is trial 84 with value: 0.9090909090909091.
[I 2024-11-28 22:00:50,379] Trial 127 finished with value: 0.8666666666666667 and parameters: {'left_stride': 0, 'right_stride': 64, 'attention_pooling_operation': 'min', 'embedding_pooling_operation': 'min', 'threshold': 0.9412137361251796, 'batch_size': 35, 'attention_heads': 13, 'hidden_dimension': 227, 'number_of_hidden_layers': 0, 'dropout_rate': 0.41092598930808766, 'global_pooling': 'mean', 'learning_rate': 1.0933398869230075e-05, 'weight_decay': 0.0004692560566823094, 'beta_0': 0.8248869042587943, 'beta_1': 0.9881413672241679, 'epsilon': 7.886167961881488e-08, 'balanced_loss': False, 'epochs': 145, 'early_stopping_patience': 17, 'plateau_patience': 15, 'plateau_divider': 6}. Best is trial 84 with value: 0.9090909090909091.
slurmstepd: error: *** JOB 14024093 ON gpu051 CANCELLED AT 2024-11-28T22:11:53 DUE TO TIME LIMIT ***
