[I 2024-11-22 12:38:10,412] Trial 45 finished with value: -1.0 and parameters: {'left_stride': 256, 'right_stride': 32, 'attention_pooling_operation': 'max', 'embedding_pooling_operation': 'max', 'threshold': 0.9803450142914278, 'batch_size': 61, 'attention_heads': 14, 'hidden_dimension': 115, 'number_of_hidden_layers': 4, 'dropout_rate': 0.332206513103892, 'global_pooling': 'mean', 'learning_rate': 0.00013073246703825252, 'weight_decay': 2.9467639352533743e-06, 'beta_0': 0.8007057101857772, 'beta_1': 0.9903827814865431, 'epsilon': 1.7798512361383914e-06, 'balanced_loss': True, 'epochs': 164, 'early_stopping_patience': 25, 'plateau_patience': 17, 'plateau_divider': 9}. Best is trial 43 with value: 0.9151515151515152.
[I 2024-11-22 12:50:23,664] Trial 46 finished with value: 0.8181818181818182 and parameters: {'left_stride': 64, 'right_stride': 64, 'attention_pooling_operation': 'max', 'embedding_pooling_operation': 'min', 'threshold': 0.9969669071144167, 'batch_size': 38, 'attention_heads': 12, 'hidden_dimension': 116, 'number_of_hidden_layers': 4, 'dropout_rate': 0.3556325156614351, 'global_pooling': 'max', 'learning_rate': 0.0003822451252826386, 'weight_decay': 2.041455559555978e-06, 'beta_0': 0.8064538849021086, 'beta_1': 0.9926086170498607, 'epsilon': 1.2080624596875405e-06, 'balanced_loss': False, 'epochs': 131, 'early_stopping_patience': 23, 'plateau_patience': 14, 'plateau_divider': 10}. Best is trial 43 with value: 0.9151515151515152.
CUDA out of memory. Tried to allocate 26.46 GiB. GPU 0 has a total capacity of 44.56 GiB of which 3.95 GiB is free. Including non-PyTorch memory, this process has 40.61 GiB memory in use. Of the allocated memory 37.48 GiB is allocated by PyTorch, and 1.98 GiB is reserved by PyTorch but unallocated. If reserved but unallocated memory is large try setting PYTORCH_CUDA_ALLOC_CONF=expandable_segments:True to avoid fragmentation.  See documentation for Memory Management  (https://pytorch.org/docs/stable/notes/cuda.html#environment-variables)
[I 2024-11-22 13:03:29,919] Trial 47 finished with value: -1.0 and parameters: {'left_stride': 64, 'right_stride': 0, 'attention_pooling_operation': 'mean', 'embedding_pooling_operation': 'max', 'threshold': 0.913664803275008, 'batch_size': 52, 'attention_heads': 15, 'hidden_dimension': 164, 'number_of_hidden_layers': 4, 'dropout_rate': 0.31443036648148903, 'global_pooling': 'mean', 'learning_rate': 0.0020121774107295194, 'weight_decay': 8.273640577464006e-06, 'beta_0': 0.8100417578598003, 'beta_1': 0.9889884858993756, 'epsilon': 1.7004730366198068e-07, 'balanced_loss': True, 'epochs': 112, 'early_stopping_patience': 22, 'plateau_patience': 16, 'plateau_divider': 8}. Best is trial 43 with value: 0.9151515151515152.
The selected strides are greater or equal to the total chunk size.
[I 2024-11-22 13:03:31,169] Trial 48 finished with value: -1.0 and parameters: {'left_stride': 256, 'right_stride': 256, 'attention_pooling_operation': 'max', 'embedding_pooling_operation': 'max', 'threshold': 0.9906717459750499, 'batch_size': 48, 'attention_heads': 10, 'hidden_dimension': 195, 'number_of_hidden_layers': 4, 'dropout_rate': 0.37761156019611863, 'global_pooling': 'mean', 'learning_rate': 0.00014344256537547436, 'weight_decay': 5.993065500061001e-06, 'beta_0': 0.8601815820757451, 'beta_1': 0.9940441385657759, 'epsilon': 6.27091300140103e-05, 'balanced_loss': True, 'epochs': 152, 'early_stopping_patience': 20, 'plateau_patience': 13, 'plateau_divider': 10}. Best is trial 43 with value: 0.9151515151515152.
[I 2024-11-22 13:21:06,820] Trial 49 finished with value: 0.9030303030303031 and parameters: {'left_stride': 128, 'right_stride': 64, 'attention_pooling_operation': 'mean', 'embedding_pooling_operation': 'max', 'threshold': 0.9857341747062007, 'batch_size': 42, 'attention_heads': 6, 'hidden_dimension': 125, 'number_of_hidden_layers': 3, 'dropout_rate': 0.33475819090383807, 'global_pooling': 'mean', 'learning_rate': 0.0007444928499401827, 'weight_decay': 1.246945876446805e-06, 'beta_0': 0.8073902846100173, 'beta_1': 0.9910740710769782, 'epsilon': 1.2119470578150601e-05, 'balanced_loss': False, 'epochs': 200, 'early_stopping_patience': 25, 'plateau_patience': 17, 'plateau_divider': 8}. Best is trial 43 with value: 0.9151515151515152.
[I 2024-11-22 13:40:37,861] Trial 50 finished with value: 0.8666666666666667 and parameters: {'left_stride': 128, 'right_stride': 64, 'attention_pooling_operation': 'mean', 'embedding_pooling_operation': 'min', 'threshold': 0.9717183320905106, 'batch_size': 34, 'attention_heads': 6, 'hidden_dimension': 95, 'number_of_hidden_layers': 3, 'dropout_rate': 0.3356473819764588, 'global_pooling': 'sum', 'learning_rate': 0.0005673788426457105, 'weight_decay': 1.0519186788799618e-06, 'beta_0': 0.8149100240315688, 'beta_1': 0.9910550528097063, 'epsilon': 1.2219298966917145e-05, 'balanced_loss': False, 'epochs': 200, 'early_stopping_patience': 25, 'plateau_patience': 17, 'plateau_divider': 7}. Best is trial 43 with value: 0.9151515151515152.
[I 2024-11-22 13:58:11,848] Trial 51 finished with value: 0.8909090909090909 and parameters: {'left_stride': 128, 'right_stride': 64, 'attention_pooling_operation': 'mean', 'embedding_pooling_operation': 'max', 'threshold': 0.9837510252717931, 'batch_size': 43, 'attention_heads': 5, 'hidden_dimension': 124, 'number_of_hidden_layers': 3, 'dropout_rate': 0.31237934474104495, 'global_pooling': 'mean', 'learning_rate': 0.0007399031575027887, 'weight_decay': 1.3178131183886416e-06, 'beta_0': 0.8052003171811095, 'beta_1': 0.9926846483958172, 'epsilon': 4.5048430806589375e-06, 'balanced_loss': False, 'epochs': 192, 'early_stopping_patience': 23, 'plateau_patience': 15, 'plateau_divider': 8}. Best is trial 43 with value: 0.9151515151515152.
[I 2024-11-22 14:13:28,027] Trial 52 finished with value: 0.8 and parameters: {'left_stride': 128, 'right_stride': 64, 'attention_pooling_operation': 'mean', 'embedding_pooling_operation': 'max', 'threshold': 0.9992999676215407, 'batch_size': 37, 'attention_heads': 6, 'hidden_dimension': 108, 'number_of_hidden_layers': 3, 'dropout_rate': 0.3214532048514795, 'global_pooling': 'mean', 'learning_rate': 0.0008593194615005559, 'weight_decay': 1.8367320148498898e-06, 'beta_0': 0.8090550920835882, 'beta_1': 0.9914221634708263, 'epsilon': 8.587448197608441e-06, 'balanced_loss': False, 'epochs': 189, 'early_stopping_patience': 25, 'plateau_patience': 14, 'plateau_divider': 9}. Best is trial 43 with value: 0.9151515151515152.
[I 2024-11-22 14:28:53,990] Trial 53 finished with value: 0.896969696969697 and parameters: {'left_stride': 0, 'right_stride': 64, 'attention_pooling_operation': 'mean', 'embedding_pooling_operation': 'max', 'threshold': 0.9864409172571299, 'batch_size': 58, 'attention_heads': 4, 'hidden_dimension': 130, 'number_of_hidden_layers': 4, 'dropout_rate': 0.34935346543584117, 'global_pooling': 'mean', 'learning_rate': 0.001470006078760481, 'weight_decay': 3.121459506201236e-06, 'beta_0': 0.8028218011631587, 'beta_1': 0.9970860936587607, 'epsilon': 6.579223487215825e-07, 'balanced_loss': False, 'epochs': 174, 'early_stopping_patience': 24, 'plateau_patience': 16, 'plateau_divider': 8}. Best is trial 43 with value: 0.9151515151515152.
CUDA out of memory. Tried to allocate 2.36 GiB. GPU 0 has a total capacity of 44.56 GiB of which 2.16 GiB is free. Including non-PyTorch memory, this process has 42.39 GiB memory in use. Of the allocated memory 38.83 GiB is allocated by PyTorch, and 2.41 GiB is reserved by PyTorch but unallocated. If reserved but unallocated memory is large try setting PYTORCH_CUDA_ALLOC_CONF=expandable_segments:True to avoid fragmentation.  See documentation for Memory Management  (https://pytorch.org/docs/stable/notes/cuda.html#environment-variables)
[I 2024-11-22 14:42:56,662] Trial 54 finished with value: -1.0 and parameters: {'left_stride': 128, 'right_stride': 0, 'attention_pooling_operation': 'mean', 'embedding_pooling_operation': 'mean', 'threshold': 0.9791869979911426, 'batch_size': 40, 'attention_heads': 7, 'hidden_dimension': 150, 'number_of_hidden_layers': 3, 'dropout_rate': 0.38875329206832787, 'global_pooling': 'mean', 'learning_rate': 0.052522279474373844, 'weight_decay': 1.3482990891807958e-06, 'beta_0': 0.812687909545382, 'beta_1': 0.9873567032628291, 'epsilon': 9.909500936240899e-05, 'balanced_loss': False, 'epochs': 138, 'early_stopping_patience': 14, 'plateau_patience': 10, 'plateau_divider': 9}. Best is trial 43 with value: 0.9151515151515152.
[I 2024-11-22 14:57:31,825] Trial 55 finished with value: 0.896969696969697 and parameters: {'left_stride': 64, 'right_stride': 32, 'attention_pooling_operation': 'mean', 'embedding_pooling_operation': 'max', 'threshold': 0.9840962525470424, 'batch_size': 54, 'attention_heads': 11, 'hidden_dimension': 81, 'number_of_hidden_layers': 0, 'dropout_rate': 0.300329403832615, 'global_pooling': 'mean', 'learning_rate': 0.0029509757551919756, 'weight_decay': 0.00018517868757974396, 'beta_0': 0.8000933684032256, 'beta_1': 0.9901639952470719, 'epsilon': 1.565607843579804e-05, 'balanced_loss': True, 'epochs': 183, 'early_stopping_patience': 23, 'plateau_patience': 17, 'plateau_divider': 7}. Best is trial 43 with value: 0.9151515151515152.
[I 2024-11-22 15:13:38,495] Trial 56 finished with value: 0.8909090909090909 and parameters: {'left_stride': 64, 'right_stride': 64, 'attention_pooling_operation': 'mean', 'embedding_pooling_operation': 'max', 'threshold': 0.9746510365512393, 'batch_size': 51, 'attention_heads': 4, 'hidden_dimension': 49, 'number_of_hidden_layers': 2, 'dropout_rate': 0.36696809558100535, 'global_pooling': 'mean', 'learning_rate': 0.0001957844373195015, 'weight_decay': 2.213250496286033e-06, 'beta_0': 0.8202579886409186, 'beta_1': 0.9896032475582879, 'epsilon': 3.4328245570470226e-06, 'balanced_loss': False, 'epochs': 163, 'early_stopping_patience': 25, 'plateau_patience': 15, 'plateau_divider': 9}. Best is trial 43 with value: 0.9151515151515152.
[I 2024-11-22 15:26:44,357] Trial 57 finished with value: 0.8545454545454545 and parameters: {'left_stride': 128, 'right_stride': 0, 'attention_pooling_operation': 'max', 'embedding_pooling_operation': 'max', 'threshold': 0.9956740808654432, 'batch_size': 48, 'attention_heads': 10, 'hidden_dimension': 105, 'number_of_hidden_layers': 4, 'dropout_rate': 0.4744107350193423, 'global_pooling': 'sum', 'learning_rate': 0.00041095250886100565, 'weight_decay': 3.7233390624796e-06, 'beta_0': 0.8069497353414556, 'beta_1': 0.9944118557312508, 'epsilon': 4.360754422443844e-05, 'balanced_loss': True, 'epochs': 194, 'early_stopping_patience': 20, 'plateau_patience': 12, 'plateau_divider': 10}. Best is trial 43 with value: 0.9151515151515152.
CUDA out of memory. Tried to allocate 2.75 GiB. GPU 0 has a total capacity of 44.56 GiB of which 2.71 GiB is free. Including non-PyTorch memory, this process has 41.84 GiB memory in use. Of the allocated memory 36.55 GiB is allocated by PyTorch, and 4.14 GiB is reserved by PyTorch but unallocated. If reserved but unallocated memory is large try setting PYTORCH_CUDA_ALLOC_CONF=expandable_segments:True to avoid fragmentation.  See documentation for Memory Management  (https://pytorch.org/docs/stable/notes/cuda.html#environment-variables)
[I 2024-11-22 15:42:32,335] Trial 58 finished with value: -1.0 and parameters: {'left_stride': 0, 'right_stride': 256, 'attention_pooling_operation': 'mean', 'embedding_pooling_operation': 'mean', 'threshold': 0.990939073108321, 'batch_size': 47, 'attention_heads': 13, 'hidden_dimension': 168, 'number_of_hidden_layers': 3, 'dropout_rate': 0.3408745278335935, 'global_pooling': 'mean', 'learning_rate': 1.1141369537465082e-05, 'weight_decay': 7.932801313679381e-06, 'beta_0': 0.8504283195589919, 'beta_1': 0.9926750500741692, 'epsilon': 2.614999824646894e-07, 'balanced_loss': True, 'epochs': 171, 'early_stopping_patience': 21, 'plateau_patience': 18, 'plateau_divider': 8}. Best is trial 43 with value: 0.9151515151515152.
CUDA out of memory. Tried to allocate 5.86 GiB. GPU 0 has a total capacity of 44.56 GiB of which 1.47 GiB is free. Including non-PyTorch memory, this process has 43.08 GiB memory in use. Of the allocated memory 40.07 GiB is allocated by PyTorch, and 1.86 GiB is reserved by PyTorch but unallocated. If reserved but unallocated memory is large try setting PYTORCH_CUDA_ALLOC_CONF=expandable_segments:True to avoid fragmentation.  See documentation for Memory Management  (https://pytorch.org/docs/stable/notes/cuda.html#environment-variables)
[I 2024-11-22 15:59:10,456] Trial 59 finished with value: -1.0 and parameters: {'left_stride': 256, 'right_stride': 64, 'attention_pooling_operation': 'mean', 'embedding_pooling_operation': 'max', 'threshold': 0.9665662813402331, 'batch_size': 61, 'attention_heads': 5, 'hidden_dimension': 182, 'number_of_hidden_layers': 1, 'dropout_rate': 0.5093701039951517, 'global_pooling': 'mean', 'learning_rate': 6.648874906125784e-05, 'weight_decay': 1.6757150579441002e-06, 'beta_0': 0.8136801449911711, 'beta_1': 0.9949843279823369, 'epsilon': 2.324465545388473e-06, 'balanced_loss': True, 'epochs': 154, 'early_stopping_patience': 24, 'plateau_patience': 16, 'plateau_divider': 10}. Best is trial 43 with value: 0.9151515151515152.
CUDA out of memory. Tried to allocate 2.94 GiB. GPU 0 has a total capacity of 44.56 GiB of which 2.49 GiB is free. Including non-PyTorch memory, this process has 42.06 GiB memory in use. Of the allocated memory 37.72 GiB is allocated by PyTorch, and 3.19 GiB is reserved by PyTorch but unallocated. If reserved but unallocated memory is large try setting PYTORCH_CUDA_ALLOC_CONF=expandable_segments:True to avoid fragmentation.  See documentation for Memory Management  (https://pytorch.org/docs/stable/notes/cuda.html#environment-variables)
[I 2024-11-22 16:10:10,699] Trial 60 finished with value: -1.0 and parameters: {'left_stride': 64, 'right_stride': 0, 'attention_pooling_operation': 'max', 'embedding_pooling_operation': 'max', 'threshold': 0.9806873354027985, 'batch_size': 45, 'attention_heads': 14, 'hidden_dimension': 92, 'number_of_hidden_layers': 2, 'dropout_rate': 0.450440892370023, 'global_pooling': 'max', 'learning_rate': 0.0006087191659379361, 'weight_decay': 1.1784147809631494e-06, 'beta_0': 0.882788669446163, 'beta_1': 0.9908135640424138, 'epsilon': 6.230629376495638e-05, 'balanced_loss': False, 'epochs': 166, 'early_stopping_patience': 22, 'plateau_patience': 13, 'plateau_divider': 9}. Best is trial 43 with value: 0.9151515151515152.
[I 2024-11-22 16:23:36,987] Trial 61 finished with value: 0.7515151515151515 and parameters: {'left_stride': 64, 'right_stride': 64, 'attention_pooling_operation': 'max', 'embedding_pooling_operation': 'max', 'threshold': 0.9961338408014859, 'batch_size': 56, 'attention_heads': 11, 'hidden_dimension': 143, 'number_of_hidden_layers': 3, 'dropout_rate': 0.311040744422163, 'global_pooling': 'mean', 'learning_rate': 0.003660814475095354, 'weight_decay': 1.5491837230841329e-06, 'beta_0': 0.8160739102880001, 'beta_1': 0.9954493183948054, 'epsilon': 5.991962317907108e-06, 'balanced_loss': True, 'epochs': 145, 'early_stopping_patience': 24, 'plateau_patience': 10, 'plateau_divider': 9}. Best is trial 43 with value: 0.9151515151515152.
[I 2024-11-22 16:37:19,159] Trial 62 finished with value: 0.8909090909090909 and parameters: {'left_stride': 64, 'right_stride': 64, 'attention_pooling_operation': 'max', 'embedding_pooling_operation': 'max', 'threshold': 0.9933147725109007, 'batch_size': 54, 'attention_heads': 12, 'hidden_dimension': 132, 'number_of_hidden_layers': 3, 'dropout_rate': 0.30157251412236624, 'global_pooling': 'mean', 'learning_rate': 0.0017889727610758534, 'weight_decay': 2.3314311111198743e-06, 'beta_0': 0.8035064664574314, 'beta_1': 0.996509873261995, 'epsilon': 2.3684558994263576e-05, 'balanced_loss': True, 'epochs': 72, 'early_stopping_patience': 23, 'plateau_patience': 11, 'plateau_divider': 9}. Best is trial 43 with value: 0.9151515151515152.
CUDA out of memory. Tried to allocate 2.46 GiB. GPU 0 has a total capacity of 44.56 GiB of which 2.39 GiB is free. Including non-PyTorch memory, this process has 42.16 GiB memory in use. Of the allocated memory 38.41 GiB is allocated by PyTorch, and 2.60 GiB is reserved by PyTorch but unallocated. If reserved but unallocated memory is large try setting PYTORCH_CUDA_ALLOC_CONF=expandable_segments:True to avoid fragmentation.  See documentation for Memory Management  (https://pytorch.org/docs/stable/notes/cuda.html#environment-variables)
[I 2024-11-22 16:46:22,643] Trial 63 finished with value: -1.0 and parameters: {'left_stride': 64, 'right_stride': 64, 'attention_pooling_operation': 'max', 'embedding_pooling_operation': 'max', 'threshold': 0.9870008037980392, 'batch_size': 57, 'attention_heads': 11, 'hidden_dimension': 117, 'number_of_hidden_layers': 3, 'dropout_rate': 0.41251406540897984, 'global_pooling': 'mean', 'learning_rate': 0.00485181806134779, 'weight_decay': 0.0008433870920184607, 'beta_0': 0.8191842740510131, 'beta_1': 0.9957069159437565, 'epsilon': 4.007198707500218e-06, 'balanced_loss': True, 'epochs': 145, 'early_stopping_patience': 25, 'plateau_patience': 12, 'plateau_divider': 8}. Best is trial 43 with value: 0.9151515151515152.
[I 2024-11-22 16:56:21,299] Trial 64 finished with value: 0.7090909090909091 and parameters: {'left_stride': 64, 'right_stride': 64, 'attention_pooling_operation': 'max', 'embedding_pooling_operation': 'max', 'threshold': 0.9997560220039651, 'batch_size': 51, 'attention_heads': 12, 'hidden_dimension': 136, 'number_of_hidden_layers': 3, 'dropout_rate': 0.3210146172608882, 'global_pooling': 'mean', 'learning_rate': 0.009063029279154202, 'weight_decay': 3.7754550535860003e-06, 'beta_0': 0.8209386539894314, 'beta_1': 0.9918425756676568, 'epsilon': 2.2267757216975642e-08, 'balanced_loss': True, 'epochs': 127, 'early_stopping_patience': 24, 'plateau_patience': 11, 'plateau_divider': 9}. Best is trial 43 with value: 0.9151515151515152.
[I 2024-11-22 17:12:37,759] Trial 65 finished with value: 0.8606060606060606 and parameters: {'left_stride': 64, 'right_stride': 64, 'attention_pooling_operation': 'mean', 'embedding_pooling_operation': 'max', 'threshold': 0.9839921720065934, 'batch_size': 53, 'attention_heads': 6, 'hidden_dimension': 123, 'number_of_hidden_layers': 2, 'dropout_rate': 0.3262901053064698, 'global_pooling': 'mean', 'learning_rate': 0.02029214487318128, 'weight_decay': 1.7276999665756983e-06, 'beta_0': 0.8087910205275037, 'beta_1': 0.9971988315863882, 'epsilon': 7.0503690585821645e-06, 'balanced_loss': True, 'epochs': 178, 'early_stopping_patience': 16, 'plateau_patience': 14, 'plateau_divider': 10}. Best is trial 43 with value: 0.9151515151515152.
[I 2024-11-22 17:24:17,353] Trial 66 finished with value: 0.8666666666666667 and parameters: {'left_stride': 128, 'right_stride': 32, 'attention_pooling_operation': 'max', 'embedding_pooling_operation': 'max', 'threshold': 0.9914315331807093, 'batch_size': 29, 'attention_heads': 9, 'hidden_dimension': 65, 'number_of_hidden_layers': 4, 'dropout_rate': 0.5406101705250905, 'global_pooling': 'mean', 'learning_rate': 0.0025230112199603654, 'weight_decay': 5.109989321167113e-06, 'beta_0': 0.8292519169162322, 'beta_1': 0.9938720610267859, 'epsilon': 1.0301920730629102e-05, 'balanced_loss': True, 'epochs': 156, 'early_stopping_patience': 23, 'plateau_patience': 12, 'plateau_divider': 8}. Best is trial 43 with value: 0.9151515151515152.
[I 2024-11-22 17:41:19,248] Trial 67 finished with value: 0.8909090909090909 and parameters: {'left_stride': 64, 'right_stride': 0, 'attention_pooling_operation': 'mean', 'embedding_pooling_operation': 'max', 'threshold': 0.995856553690415, 'batch_size': 59, 'attention_heads': 10, 'hidden_dimension': 152, 'number_of_hidden_layers': 3, 'dropout_rate': 0.30775295290129984, 'global_pooling': 'mean', 'learning_rate': 0.0010551677101766947, 'weight_decay': 1.2992593953138473e-06, 'beta_0': 0.8353849956669802, 'beta_1': 0.9978177775859356, 'epsilon': 3.8422111744795104e-05, 'balanced_loss': True, 'epochs': 136, 'early_stopping_patience': 21, 'plateau_patience': 10, 'plateau_divider': 9}. Best is trial 43 with value: 0.9151515151515152.
CUDA out of memory. Tried to allocate 2.89 GiB. GPU 0 has a total capacity of 44.56 GiB of which 2.32 GiB is free. Including non-PyTorch memory, this process has 42.24 GiB memory in use. Of the allocated memory 40.08 GiB is allocated by PyTorch, and 1.01 GiB is reserved by PyTorch but unallocated. If reserved but unallocated memory is large try setting PYTORCH_CUDA_ALLOC_CONF=expandable_segments:True to avoid fragmentation.  See documentation for Memory Management  (https://pytorch.org/docs/stable/notes/cuda.html#environment-variables)
[I 2024-11-22 17:50:19,454] Trial 68 finished with value: -1.0 and parameters: {'left_stride': 64, 'right_stride': 64, 'attention_pooling_operation': 'min', 'embedding_pooling_operation': 'max', 'threshold': 0.9737964624418051, 'batch_size': 55, 'attention_heads': 7, 'hidden_dimension': 111, 'number_of_hidden_layers': 2, 'dropout_rate': 0.3604529838546017, 'global_pooling': 'sum', 'learning_rate': 0.0051221788909852455, 'weight_decay': 2.968056346127527e-06, 'beta_0': 0.8435040243596835, 'beta_1': 0.9930246161448623, 'epsilon': 1.3806412312513267e-05, 'balanced_loss': True, 'epochs': 117, 'early_stopping_patience': 25, 'plateau_patience': 13, 'plateau_divider': 2}. Best is trial 43 with value: 0.9151515151515152.
