[I 2024-11-23 12:11:43,130] Trial 142 finished with value: 0.8909090909090909 and parameters: {'left_stride': 128, 'right_stride': 64, 'attention_pooling_operation': 'mean', 'embedding_pooling_operation': 'max', 'threshold': 0.9910298517928274, 'batch_size': 63, 'attention_heads': 5, 'hidden_dimension': 111, 'number_of_hidden_layers': 4, 'dropout_rate': 0.35810395228120706, 'global_pooling': 'mean', 'learning_rate': 0.0007285468667330458, 'weight_decay': 1.4734144625264251e-06, 'beta_0': 0.8016594555080117, 'beta_1': 0.9924766479358168, 'epsilon': 1.871552977236386e-05, 'balanced_loss': False, 'epochs': 190, 'early_stopping_patience': 25, 'plateau_patience': 17, 'plateau_divider': 8}. Best is trial 84 with value: 0.9212121212121213.
CUDA out of memory. Tried to allocate 2.01 GiB. GPU 0 has a total capacity of 44.56 GiB of which 1.99 GiB is free. Including non-PyTorch memory, this process has 42.57 GiB memory in use. Of the allocated memory 39.96 GiB is allocated by PyTorch, and 1.46 GiB is reserved by PyTorch but unallocated. If reserved but unallocated memory is large try setting PYTORCH_CUDA_ALLOC_CONF=expandable_segments:True to avoid fragmentation.  See documentation for Memory Management  (https://pytorch.org/docs/stable/notes/cuda.html#environment-variables)
[I 2024-11-23 12:27:08,688] Trial 143 finished with value: -1.0 and parameters: {'left_stride': 128, 'right_stride': 64, 'attention_pooling_operation': 'mean', 'embedding_pooling_operation': 'max', 'threshold': 0.9799177252672351, 'batch_size': 43, 'attention_heads': 7, 'hidden_dimension': 120, 'number_of_hidden_layers': 4, 'dropout_rate': 0.34815363432479546, 'global_pooling': 'mean', 'learning_rate': 0.0012602461157395573, 'weight_decay': 1.747926405736064e-06, 'beta_0': 0.8000468632924032, 'beta_1': 0.9929410443993092, 'epsilon': 2.200424078734571e-07, 'balanced_loss': False, 'epochs': 112, 'early_stopping_patience': 24, 'plateau_patience': 18, 'plateau_divider': 9}. Best is trial 84 with value: 0.9212121212121213.
CUDA out of memory. Tried to allocate 3.74 GiB. GPU 0 has a total capacity of 44.56 GiB of which 904.69 MiB is free. Including non-PyTorch memory, this process has 43.67 GiB memory in use. Of the allocated memory 38.52 GiB is allocated by PyTorch, and 4.00 GiB is reserved by PyTorch but unallocated. If reserved but unallocated memory is large try setting PYTORCH_CUDA_ALLOC_CONF=expandable_segments:True to avoid fragmentation.  See documentation for Memory Management  (https://pytorch.org/docs/stable/notes/cuda.html#environment-variables)
[I 2024-11-23 12:43:16,558] Trial 144 finished with value: -1.0 and parameters: {'left_stride': 128, 'right_stride': 64, 'attention_pooling_operation': 'mean', 'embedding_pooling_operation': 'max', 'threshold': 0.9847992072153993, 'batch_size': 51, 'attention_heads': 16, 'hidden_dimension': 107, 'number_of_hidden_layers': 4, 'dropout_rate': 0.3660518944958896, 'global_pooling': 'mean', 'learning_rate': 0.0015752380082805926, 'weight_decay': 1.622977442699997e-05, 'beta_0': 0.8044836375781907, 'beta_1': 0.9935510792536603, 'epsilon': 5.801025092997646e-05, 'balanced_loss': False, 'epochs': 180, 'early_stopping_patience': 25, 'plateau_patience': 23, 'plateau_divider': 5}. Best is trial 84 with value: 0.9212121212121213.
[I 2024-11-23 12:59:49,369] Trial 145 finished with value: 0.9030303030303031 and parameters: {'left_stride': 0, 'right_stride': 64, 'attention_pooling_operation': 'mean', 'embedding_pooling_operation': 'max', 'threshold': 0.9888993714836715, 'batch_size': 24, 'attention_heads': 6, 'hidden_dimension': 87, 'number_of_hidden_layers': 4, 'dropout_rate': 0.34261745514004105, 'global_pooling': 'mean', 'learning_rate': 0.0007315865669047158, 'weight_decay': 2.1274395065979245e-06, 'beta_0': 0.8070470099022897, 'beta_1': 0.9943778278113174, 'epsilon': 1.2867401087517778e-08, 'balanced_loss': True, 'epochs': 173, 'early_stopping_patience': 24, 'plateau_patience': 15, 'plateau_divider': 8}. Best is trial 84 with value: 0.9212121212121213.
[I 2024-11-23 13:17:21,253] Trial 146 finished with value: 0.8606060606060606 and parameters: {'left_stride': 64, 'right_stride': 64, 'attention_pooling_operation': 'mean', 'embedding_pooling_operation': 'max', 'threshold': 0.9972209093373726, 'batch_size': 61, 'attention_heads': 10, 'hidden_dimension': 141, 'number_of_hidden_layers': 4, 'dropout_rate': 0.4969488608866135, 'global_pooling': 'mean', 'learning_rate': 0.000981694316076563, 'weight_decay': 1.2476097399411796e-05, 'beta_0': 0.8143192037147909, 'beta_1': 0.9912492505510195, 'epsilon': 1.1246913516467944e-06, 'balanced_loss': False, 'epochs': 103, 'early_stopping_patience': 25, 'plateau_patience': 16, 'plateau_divider': 8}. Best is trial 84 with value: 0.9212121212121213.
CUDA out of memory. Tried to allocate 6.28 GiB. GPU 0 has a total capacity of 44.56 GiB of which 4.47 GiB is free. Including non-PyTorch memory, this process has 40.08 GiB memory in use. Of the allocated memory 37.06 GiB is allocated by PyTorch, and 1.87 GiB is reserved by PyTorch but unallocated. If reserved but unallocated memory is large try setting PYTORCH_CUDA_ALLOC_CONF=expandable_segments:True to avoid fragmentation.  See documentation for Memory Management  (https://pytorch.org/docs/stable/notes/cuda.html#environment-variables)
[I 2024-11-23 13:27:25,634] Trial 147 finished with value: -1.0 and parameters: {'left_stride': 0, 'right_stride': 256, 'attention_pooling_operation': 'min', 'embedding_pooling_operation': 'max', 'threshold': 0.9746128658346638, 'batch_size': 59, 'attention_heads': 6, 'hidden_dimension': 235, 'number_of_hidden_layers': 2, 'dropout_rate': 0.32268698645512683, 'global_pooling': 'mean', 'learning_rate': 0.0005884421980613703, 'weight_decay': 8.041063485794661e-06, 'beta_0': 0.8102369176714855, 'beta_1': 0.9987526589862364, 'epsilon': 1.188967582105124e-07, 'balanced_loss': False, 'epochs': 164, 'early_stopping_patience': 25, 'plateau_patience': 17, 'plateau_divider': 7}. Best is trial 84 with value: 0.9212121212121213.
CUDA out of memory. Tried to allocate 2.36 GiB. GPU 0 has a total capacity of 44.56 GiB of which 138.69 MiB is free. Including non-PyTorch memory, this process has 44.42 GiB memory in use. Of the allocated memory 39.43 GiB is allocated by PyTorch, and 3.83 GiB is reserved by PyTorch but unallocated. If reserved but unallocated memory is large try setting PYTORCH_CUDA_ALLOC_CONF=expandable_segments:True to avoid fragmentation.  See documentation for Memory Management  (https://pytorch.org/docs/stable/notes/cuda.html#environment-variables)
[I 2024-11-23 13:42:16,053] Trial 148 finished with value: -1.0 and parameters: {'left_stride': 128, 'right_stride': 64, 'attention_pooling_operation': 'mean', 'embedding_pooling_operation': 'max', 'threshold': 0.9830462390990327, 'batch_size': 57, 'attention_heads': 7, 'hidden_dimension': 126, 'number_of_hidden_layers': 4, 'dropout_rate': 0.3128902983927828, 'global_pooling': 'mean', 'learning_rate': 0.0003999967097045286, 'weight_decay': 1.6424826021464202e-06, 'beta_0': 0.8224029153328732, 'beta_1': 0.9971016268416593, 'epsilon': 7.600231352452008e-06, 'balanced_loss': True, 'epochs': 194, 'early_stopping_patience': 24, 'plateau_patience': 16, 'plateau_divider': 9}. Best is trial 84 with value: 0.9212121212121213.
CUDA out of memory. Tried to allocate 3.58 GiB. GPU 0 has a total capacity of 44.56 GiB of which 276.69 MiB is free. Including non-PyTorch memory, this process has 44.28 GiB memory in use. Of the allocated memory 38.85 GiB is allocated by PyTorch, and 4.28 GiB is reserved by PyTorch but unallocated. If reserved but unallocated memory is large try setting PYTORCH_CUDA_ALLOC_CONF=expandable_segments:True to avoid fragmentation.  See documentation for Memory Management  (https://pytorch.org/docs/stable/notes/cuda.html#environment-variables)
[I 2024-11-23 13:56:13,700] Trial 149 finished with value: -1.0 and parameters: {'left_stride': 0, 'right_stride': 128, 'attention_pooling_operation': 'mean', 'embedding_pooling_operation': 'max', 'threshold': 0.9767735148631829, 'batch_size': 52, 'attention_heads': 11, 'hidden_dimension': 103, 'number_of_hidden_layers': 3, 'dropout_rate': 0.37374576108456364, 'global_pooling': 'mean', 'learning_rate': 0.001159179464342875, 'weight_decay': 1.9402124944148765e-05, 'beta_0': 0.8054852494054743, 'beta_1': 0.9963046652014623, 'epsilon': 1.816717557711584e-08, 'balanced_loss': False, 'epochs': 200, 'early_stopping_patience': 23, 'plateau_patience': 15, 'plateau_divider': 8}. Best is trial 84 with value: 0.9212121212121213.
[I 2024-11-23 14:06:04,784] Trial 150 finished with value: 0.8909090909090909 and parameters: {'left_stride': 32, 'right_stride': 64, 'attention_pooling_operation': 'max', 'embedding_pooling_operation': 'max', 'threshold': 0.9867482586838927, 'batch_size': 60, 'attention_heads': 4, 'hidden_dimension': 92, 'number_of_hidden_layers': 4, 'dropout_rate': 0.35279410108670123, 'global_pooling': 'mean', 'learning_rate': 0.0019944802957067628, 'weight_decay': 1.2921757698708758e-06, 'beta_0': 0.8030229649073954, 'beta_1': 0.9880576975413523, 'epsilon': 2.652683951293616e-08, 'balanced_loss': False, 'epochs': 154, 'early_stopping_patience': 12, 'plateau_patience': 17, 'plateau_divider': 8}. Best is trial 84 with value: 0.9212121212121213.
[I 2024-11-23 14:21:37,178] Trial 151 finished with value: 0.896969696969697 and parameters: {'left_stride': 0, 'right_stride': 64, 'attention_pooling_operation': 'mean', 'embedding_pooling_operation': 'max', 'threshold': 0.9849201603388733, 'batch_size': 58, 'attention_heads': 4, 'hidden_dimension': 132, 'number_of_hidden_layers': 4, 'dropout_rate': 0.36055606698370335, 'global_pooling': 'mean', 'learning_rate': 0.0014820357962089436, 'weight_decay': 2.5364952743680136e-06, 'beta_0': 0.8586554248225446, 'beta_1': 0.9967181795716836, 'epsilon': 2.0948999678221785e-06, 'balanced_loss': False, 'epochs': 176, 'early_stopping_patience': 24, 'plateau_patience': 16, 'plateau_divider': 8}. Best is trial 84 with value: 0.9212121212121213.
[I 2024-11-23 14:38:47,095] Trial 152 finished with value: 0.9212121212121213 and parameters: {'left_stride': 0, 'right_stride': 64, 'attention_pooling_operation': 'mean', 'embedding_pooling_operation': 'max', 'threshold': 0.9817471971594015, 'batch_size': 62, 'attention_heads': 4, 'hidden_dimension': 120, 'number_of_hidden_layers': 4, 'dropout_rate': 0.4672730292092692, 'global_pooling': 'mean', 'learning_rate': 0.0008390338817043788, 'weight_decay': 2.036433103023493e-06, 'beta_0': 0.8085120201098895, 'beta_1': 0.9977463398003048, 'epsilon': 1.7347129548512331e-07, 'balanced_loss': False, 'epochs': 173, 'early_stopping_patience': 23, 'plateau_patience': 16, 'plateau_divider': 8}. Best is trial 84 with value: 0.9212121212121213.
[I 2024-11-23 14:55:12,017] Trial 153 finished with value: 0.9212121212121213 and parameters: {'left_stride': 0, 'right_stride': 64, 'attention_pooling_operation': 'mean', 'embedding_pooling_operation': 'max', 'threshold': 0.9814831880611988, 'batch_size': 62, 'attention_heads': 4, 'hidden_dimension': 118, 'number_of_hidden_layers': 4, 'dropout_rate': 0.45104611984595644, 'global_pooling': 'mean', 'learning_rate': 0.0008265774633643906, 'weight_decay': 2.0912538556954604e-06, 'beta_0': 0.8083867550072393, 'beta_1': 0.9978143830043987, 'epsilon': 9.394368143874894e-08, 'balanced_loss': False, 'epochs': 168, 'early_stopping_patience': 22, 'plateau_patience': 15, 'plateau_divider': 8}. Best is trial 84 with value: 0.9212121212121213.
[I 2024-11-23 15:10:49,466] Trial 154 finished with value: 0.9212121212121213 and parameters: {'left_stride': 0, 'right_stride': 64, 'attention_pooling_operation': 'mean', 'embedding_pooling_operation': 'max', 'threshold': 0.9795345372943498, 'batch_size': 63, 'attention_heads': 4, 'hidden_dimension': 116, 'number_of_hidden_layers': 4, 'dropout_rate': 0.4644956566760742, 'global_pooling': 'mean', 'learning_rate': 0.0007556393927343199, 'weight_decay': 2.115569587990818e-06, 'beta_0': 0.8123659348391087, 'beta_1': 0.9980993107086041, 'epsilon': 9.668464157286566e-08, 'balanced_loss': False, 'epochs': 169, 'early_stopping_patience': 22, 'plateau_patience': 14, 'plateau_divider': 8}. Best is trial 84 with value: 0.9212121212121213.
[I 2024-11-23 15:26:49,470] Trial 155 finished with value: 0.896969696969697 and parameters: {'left_stride': 0, 'right_stride': 64, 'attention_pooling_operation': 'mean', 'embedding_pooling_operation': 'max', 'threshold': 0.9796431626670039, 'batch_size': 62, 'attention_heads': 4, 'hidden_dimension': 117, 'number_of_hidden_layers': 4, 'dropout_rate': 0.46453830907419563, 'global_pooling': 'mean', 'learning_rate': 0.00047532418026065705, 'weight_decay': 2.0917508077252012e-06, 'beta_0': 0.8112753380995311, 'beta_1': 0.9978137471116707, 'epsilon': 8.783730596503589e-08, 'balanced_loss': False, 'epochs': 168, 'early_stopping_patience': 22, 'plateau_patience': 14, 'plateau_divider': 8}. Best is trial 84 with value: 0.9212121212121213.
[I 2024-11-23 15:42:08,818] Trial 156 finished with value: 0.8909090909090909 and parameters: {'left_stride': 0, 'right_stride': 64, 'attention_pooling_operation': 'mean', 'embedding_pooling_operation': 'max', 'threshold': 0.9821539914908497, 'batch_size': 63, 'attention_heads': 4, 'hidden_dimension': 113, 'number_of_hidden_layers': 4, 'dropout_rate': 0.4755247519568502, 'global_pooling': 'mean', 'learning_rate': 0.0008596960532572594, 'weight_decay': 2.904141617897758e-06, 'beta_0': 0.8087866211632798, 'beta_1': 0.9981809616211259, 'epsilon': 1.0146891733953432e-07, 'balanced_loss': False, 'epochs': 172, 'early_stopping_patience': 22, 'plateau_patience': 15, 'plateau_divider': 8}. Best is trial 84 with value: 0.9212121212121213.
[I 2024-11-23 15:58:23,569] Trial 157 finished with value: 0.8727272727272727 and parameters: {'left_stride': 0, 'right_stride': 64, 'attention_pooling_operation': 'mean', 'embedding_pooling_operation': 'max', 'threshold': 0.9779257083792772, 'batch_size': 64, 'attention_heads': 4, 'hidden_dimension': 120, 'number_of_hidden_layers': 4, 'dropout_rate': 0.46846966646244775, 'global_pooling': 'sum', 'learning_rate': 0.0006463859111392714, 'weight_decay': 1.4246151095681011e-05, 'beta_0': 0.8046143843116882, 'beta_1': 0.9974102692615632, 'epsilon': 1.494638435471172e-07, 'balanced_loss': False, 'epochs': 169, 'early_stopping_patience': 21, 'plateau_patience': 14, 'plateau_divider': 8}. Best is trial 84 with value: 0.9212121212121213.
[I 2024-11-23 16:13:02,118] Trial 158 finished with value: 0.896969696969697 and parameters: {'left_stride': 0, 'right_stride': 0, 'attention_pooling_operation': 'mean', 'embedding_pooling_operation': 'max', 'threshold': 0.9809932513982558, 'batch_size': 61, 'attention_heads': 4, 'hidden_dimension': 99, 'number_of_hidden_layers': 4, 'dropout_rate': 0.45465007058332607, 'global_pooling': 'mean', 'learning_rate': 0.0010301764060607255, 'weight_decay': 1.8629063030822762e-06, 'beta_0': 0.8167559730207382, 'beta_1': 0.9989567251095618, 'epsilon': 1.0167096636569166e-08, 'balanced_loss': False, 'epochs': 159, 'early_stopping_patience': 22, 'plateau_patience': 15, 'plateau_divider': 7}. Best is trial 84 with value: 0.9212121212121213.
[I 2024-11-23 16:29:51,481] Trial 159 finished with value: 0.9030303030303031 and parameters: {'left_stride': 0, 'right_stride': 64, 'attention_pooling_operation': 'mean', 'embedding_pooling_operation': 'mean', 'threshold': 0.9757508765064375, 'batch_size': 62, 'attention_heads': 4, 'hidden_dimension': 109, 'number_of_hidden_layers': 4, 'dropout_rate': 0.4449012054176391, 'global_pooling': 'mean', 'learning_rate': 0.0007623886199353307, 'weight_decay': 4.395201876688221e-06, 'beta_0': 0.8021170441943889, 'beta_1': 0.9984958667318686, 'epsilon': 7.224998681535903e-08, 'balanced_loss': False, 'epochs': 164, 'early_stopping_patience': 21, 'plateau_patience': 15, 'plateau_divider': 8}. Best is trial 84 with value: 0.9212121212121213.
[I 2024-11-23 16:45:45,482] Trial 160 finished with value: 0.8909090909090909 and parameters: {'left_stride': 0, 'right_stride': 128, 'attention_pooling_operation': 'mean', 'embedding_pooling_operation': 'max', 'threshold': 0.9824758550132905, 'batch_size': 63, 'attention_heads': 5, 'hidden_dimension': 54, 'number_of_hidden_layers': 4, 'dropout_rate': 0.4495574953713201, 'global_pooling': 'mean', 'learning_rate': 0.0005757783490886013, 'weight_decay': 2.5521566849010795e-06, 'beta_0': 0.8069217782934899, 'beta_1': 0.9977399898396548, 'epsilon': 1.852388539191712e-07, 'balanced_loss': False, 'epochs': 179, 'early_stopping_patience': 22, 'plateau_patience': 14, 'plateau_divider': 8}. Best is trial 84 with value: 0.9212121212121213.
[I 2024-11-23 17:01:35,469] Trial 161 finished with value: 0.9030303030303031 and parameters: {'left_stride': 0, 'right_stride': 64, 'attention_pooling_operation': 'mean', 'embedding_pooling_operation': 'max', 'threshold': 0.9786892948351338, 'batch_size': 64, 'attention_heads': 4, 'hidden_dimension': 123, 'number_of_hidden_layers': 4, 'dropout_rate': 0.48320828411673555, 'global_pooling': 'mean', 'learning_rate': 0.0013302670888164752, 'weight_decay': 2.2373182179421967e-06, 'beta_0': 0.8125748049882932, 'beta_1': 0.9980827845520842, 'epsilon': 5.782980004638113e-08, 'balanced_loss': False, 'epochs': 183, 'early_stopping_patience': 23, 'plateau_patience': 16, 'plateau_divider': 9}. Best is trial 84 with value: 0.9212121212121213.
[I 2024-11-23 17:17:37,015] Trial 162 finished with value: 0.9212121212121213 and parameters: {'left_stride': 0, 'right_stride': 64, 'attention_pooling_operation': 'mean', 'embedding_pooling_operation': 'max', 'threshold': 0.9836057145587244, 'batch_size': 61, 'attention_heads': 5, 'hidden_dimension': 116, 'number_of_hidden_layers': 4, 'dropout_rate': 0.47000046736058065, 'global_pooling': 'mean', 'learning_rate': 0.0009117092239736233, 'weight_decay': 1.592221102906354e-06, 'beta_0': 0.8094518678214156, 'beta_1': 0.9981609559790381, 'epsilon': 7.86996483465834e-08, 'balanced_loss': False, 'epochs': 174, 'early_stopping_patience': 23, 'plateau_patience': 16, 'plateau_divider': 8}. Best is trial 84 with value: 0.9212121212121213.
[I 2024-11-23 17:33:24,151] Trial 163 finished with value: 0.9151515151515152 and parameters: {'left_stride': 0, 'right_stride': 64, 'attention_pooling_operation': 'mean', 'embedding_pooling_operation': 'max', 'threshold': 0.9834503401461672, 'batch_size': 61, 'attention_heads': 5, 'hidden_dimension': 113, 'number_of_hidden_layers': 4, 'dropout_rate': 0.4739868197248337, 'global_pooling': 'mean', 'learning_rate': 0.0008592992973653753, 'weight_decay': 1.876512603663497e-06, 'beta_0': 0.8037516182584075, 'beta_1': 0.9985734508183749, 'epsilon': 1.3000743201063123e-07, 'balanced_loss': False, 'epochs': 174, 'early_stopping_patience': 23, 'plateau_patience': 16, 'plateau_divider': 8}. Best is trial 84 with value: 0.9212121212121213.
[I 2024-11-23 17:50:32,159] Trial 164 finished with value: 0.9151515151515152 and parameters: {'left_stride': 0, 'right_stride': 64, 'attention_pooling_operation': 'mean', 'embedding_pooling_operation': 'max', 'threshold': 0.9835446050135168, 'batch_size': 62, 'attention_heads': 5, 'hidden_dimension': 114, 'number_of_hidden_layers': 4, 'dropout_rate': 0.46791793785997055, 'global_pooling': 'mean', 'learning_rate': 0.0008418336920876203, 'weight_decay': 1.5052693131422613e-06, 'beta_0': 0.803243773842376, 'beta_1': 0.9985539751487363, 'epsilon': 1.3136496550432905e-07, 'balanced_loss': False, 'epochs': 176, 'early_stopping_patience': 23, 'plateau_patience': 16, 'plateau_divider': 8}. Best is trial 84 with value: 0.9212121212121213.
[I 2024-11-23 18:07:04,998] Trial 165 finished with value: 0.9151515151515152 and parameters: {'left_stride': 0, 'right_stride': 64, 'attention_pooling_operation': 'mean', 'embedding_pooling_operation': 'max', 'threshold': 0.9841776016537338, 'batch_size': 61, 'attention_heads': 5, 'hidden_dimension': 119, 'number_of_hidden_layers': 4, 'dropout_rate': 0.4592766813628226, 'global_pooling': 'mean', 'learning_rate': 0.0008885358635377852, 'weight_decay': 1.5580443613710907e-06, 'beta_0': 0.8058902516464559, 'beta_1': 0.9985311427963389, 'epsilon': 1.4662714201801294e-07, 'balanced_loss': False, 'epochs': 175, 'early_stopping_patience': 23, 'plateau_patience': 16, 'plateau_divider': 8}. Best is trial 84 with value: 0.9212121212121213.
[I 2024-11-23 18:23:15,558] Trial 166 finished with value: 0.9090909090909091 and parameters: {'left_stride': 0, 'right_stride': 64, 'attention_pooling_operation': 'mean', 'embedding_pooling_operation': 'max', 'threshold': 0.9807704360296902, 'batch_size': 60, 'attention_heads': 5, 'hidden_dimension': 116, 'number_of_hidden_layers': 4, 'dropout_rate': 0.4727450414707128, 'global_pooling': 'mean', 'learning_rate': 0.0009558776397724084, 'weight_decay': 9.37825879804683e-05, 'beta_0': 0.803702287384963, 'beta_1': 0.9985514250942257, 'epsilon': 1.332813648666789e-07, 'balanced_loss': False, 'epochs': 175, 'early_stopping_patience': 23, 'plateau_patience': 16, 'plateau_divider': 8}. Best is trial 84 with value: 0.9212121212121213.
[I 2024-11-23 18:39:47,594] Trial 167 finished with value: 0.896969696969697 and parameters: {'left_stride': 0, 'right_stride': 64, 'attention_pooling_operation': 'mean', 'embedding_pooling_operation': 'max', 'threshold': 0.9830290171066552, 'batch_size': 62, 'attention_heads': 5, 'hidden_dimension': 126, 'number_of_hidden_layers': 4, 'dropout_rate': 0.45927968378147066, 'global_pooling': 'mean', 'learning_rate': 0.0010812940532723004, 'weight_decay': 1.4749462147517847e-06, 'beta_0': 0.8061747879355788, 'beta_1': 0.9989900451298787, 'epsilon': 9.820475821658281e-08, 'balanced_loss': False, 'epochs': 173, 'early_stopping_patience': 23, 'plateau_patience': 16, 'plateau_divider': 8}. Best is trial 84 with value: 0.9212121212121213.
