[I 2024-11-28 06:11:39,085] A new study created in RDB with name: IMDb-top_1000-GATv2-google-bert-bert-base-uncased-Grouped-Layer-wise_Aggregation
Token indices sequence length is longer than the specified maximum sequence length for this model (1147 > 512). Running this sequence through the model will result in indexing errors
[I 2024-11-28 06:21:31,648] Trial 0 finished with value: 0.6666666666666666 and parameters: {'left_stride': 32, 'right_stride': 64, 'attention_pooling_operation': 'mean', 'embedding_pooling_operation': 'min', 'threshold': 0.9304211818735242, 'batch_size': 41, 'attention_heads': 9, 'hidden_dimension': 97, 'number_of_hidden_layers': 3, 'dropout_rate': 0.34184815819561254, 'global_pooling': 'max', 'learning_rate': 0.013826232179369865, 'weight_decay': 3.972110727381911e-06, 'beta_0': 0.849951952030185, 'beta_1': 0.9912118037965686, 'epsilon': 1.5339162591163588e-08, 'balanced_loss': True, 'epochs': 59, 'early_stopping_patience': 25, 'plateau_patience': 25, 'plateau_divider': 9}. Best is trial 0 with value: 0.6666666666666666.
[I 2024-11-28 06:27:21,883] Trial 1 finished with value: 0.8363636363636363 and parameters: {'left_stride': 64, 'right_stride': 64, 'attention_pooling_operation': 'max', 'embedding_pooling_operation': 'mean', 'threshold': 0.9939404991670033, 'batch_size': 59, 'attention_heads': 11, 'hidden_dimension': 239, 'number_of_hidden_layers': 0, 'dropout_rate': 0.35879485872574357, 'global_pooling': 'max', 'learning_rate': 0.00012172958098369953, 'weight_decay': 0.0003063462210622083, 'beta_0': 0.834331843801655, 'beta_1': 0.9853009566677808, 'epsilon': 1.4817820606039087e-06, 'balanced_loss': False, 'epochs': 61, 'early_stopping_patience': 25, 'plateau_patience': 22, 'plateau_divider': 3}. Best is trial 1 with value: 0.8363636363636363.
[I 2024-11-28 06:32:57,122] Trial 2 finished with value: 0.8727272727272727 and parameters: {'left_stride': 32, 'right_stride': 128, 'attention_pooling_operation': 'min', 'embedding_pooling_operation': 'mean', 'threshold': 0.988712402130207, 'batch_size': 39, 'attention_heads': 5, 'hidden_dimension': 192, 'number_of_hidden_layers': 3, 'dropout_rate': 0.46838315927084884, 'global_pooling': 'mean', 'learning_rate': 0.0005130551760589835, 'weight_decay': 1.1919481947918734e-06, 'beta_0': 0.8102310933924105, 'beta_1': 0.98059161803998, 'epsilon': 3.512704726270843e-06, 'balanced_loss': False, 'epochs': 187, 'early_stopping_patience': 13, 'plateau_patience': 16, 'plateau_divider': 8}. Best is trial 2 with value: 0.8727272727272727.
[I 2024-11-28 06:42:38,923] Trial 3 finished with value: 0.896969696969697 and parameters: {'left_stride': 256, 'right_stride': 64, 'attention_pooling_operation': 'min', 'embedding_pooling_operation': 'min', 'threshold': 0.9227912369025688, 'batch_size': 36, 'attention_heads': 14, 'hidden_dimension': 225, 'number_of_hidden_layers': 0, 'dropout_rate': 0.4532241907732697, 'global_pooling': 'mean', 'learning_rate': 0.00022410971619109496, 'weight_decay': 0.0006741074265640696, 'beta_0': 0.8310413476654125, 'beta_1': 0.9898114758541204, 'epsilon': 6.487477066058673e-06, 'balanced_loss': False, 'epochs': 195, 'early_stopping_patience': 14, 'plateau_patience': 17, 'plateau_divider': 4}. Best is trial 3 with value: 0.896969696969697.
[I 2024-11-28 06:49:05,735] Trial 4 finished with value: 0.9030303030303031 and parameters: {'left_stride': 64, 'right_stride': 32, 'attention_pooling_operation': 'min', 'embedding_pooling_operation': 'min', 'threshold': 0.9367746354405981, 'batch_size': 46, 'attention_heads': 12, 'hidden_dimension': 152, 'number_of_hidden_layers': 0, 'dropout_rate': 0.5505907486767714, 'global_pooling': 'mean', 'learning_rate': 0.002309786149269356, 'weight_decay': 0.00010781845035122267, 'beta_0': 0.8015645397505602, 'beta_1': 0.9896841863656863, 'epsilon': 8.053471030316087e-08, 'balanced_loss': True, 'epochs': 154, 'early_stopping_patience': 16, 'plateau_patience': 24, 'plateau_divider': 3}. Best is trial 4 with value: 0.9030303030303031.
CUDA out of memory. Tried to allocate 2.68 GiB. GPU 0 has a total capacity of 44.56 GiB of which 2.08 GiB is free. Including non-PyTorch memory, this process has 42.47 GiB memory in use. Of the allocated memory 40.44 GiB is allocated by PyTorch, and 903.97 MiB is reserved by PyTorch but unallocated. If reserved but unallocated memory is large try setting PYTORCH_CUDA_ALLOC_CONF=expandable_segments:True to avoid fragmentation.  See documentation for Memory Management  (https://pytorch.org/docs/stable/notes/cuda.html#environment-variables)
[I 2024-11-28 06:53:54,579] Trial 5 finished with value: -1.0 and parameters: {'left_stride': 64, 'right_stride': 32, 'attention_pooling_operation': 'max', 'embedding_pooling_operation': 'min', 'threshold': 0.9725883083302352, 'batch_size': 59, 'attention_heads': 15, 'hidden_dimension': 207, 'number_of_hidden_layers': 3, 'dropout_rate': 0.3252419894985146, 'global_pooling': 'sum', 'learning_rate': 1.0883991813938131e-05, 'weight_decay': 2.015647705936503e-06, 'beta_0': 0.8650272248026284, 'beta_1': 0.9800952543380481, 'epsilon': 4.397766894483953e-08, 'balanced_loss': False, 'epochs': 148, 'early_stopping_patience': 13, 'plateau_patience': 21, 'plateau_divider': 4}. Best is trial 4 with value: 0.9030303030303031.
[I 2024-11-28 07:00:48,025] Trial 6 finished with value: 0.5818181818181818 and parameters: {'left_stride': 128, 'right_stride': 0, 'attention_pooling_operation': 'min', 'embedding_pooling_operation': 'mean', 'threshold': 0.9576846194237897, 'batch_size': 40, 'attention_heads': 6, 'hidden_dimension': 194, 'number_of_hidden_layers': 1, 'dropout_rate': 0.30729478992943615, 'global_pooling': 'max', 'learning_rate': 0.06542056762893128, 'weight_decay': 0.0005553837526912237, 'beta_0': 0.8356502322469728, 'beta_1': 0.9802909082956842, 'epsilon': 5.167425813322413e-05, 'balanced_loss': False, 'epochs': 195, 'early_stopping_patience': 23, 'plateau_patience': 14, 'plateau_divider': 5}. Best is trial 4 with value: 0.9030303030303031.
The selected strides are greater or equal to the total chunk size.
[I 2024-11-28 07:00:48,891] Trial 7 finished with value: -1.0 and parameters: {'left_stride': 256, 'right_stride': 256, 'attention_pooling_operation': 'max', 'embedding_pooling_operation': 'min', 'threshold': 0.9359455202104634, 'batch_size': 30, 'attention_heads': 14, 'hidden_dimension': 214, 'number_of_hidden_layers': 4, 'dropout_rate': 0.5739721657669414, 'global_pooling': 'max', 'learning_rate': 0.0039797493741031125, 'weight_decay': 0.0001276146788173022, 'beta_0': 0.8786113098385785, 'beta_1': 0.996892198716152, 'epsilon': 2.248954284391446e-07, 'balanced_loss': True, 'epochs': 137, 'early_stopping_patience': 10, 'plateau_patience': 17, 'plateau_divider': 6}. Best is trial 4 with value: 0.9030303030303031.
[I 2024-11-28 07:09:08,736] Trial 8 finished with value: 0.6484848484848484 and parameters: {'left_stride': 256, 'right_stride': 128, 'attention_pooling_operation': 'min', 'embedding_pooling_operation': 'max', 'threshold': 0.9726018724589289, 'batch_size': 63, 'attention_heads': 10, 'hidden_dimension': 104, 'number_of_hidden_layers': 3, 'dropout_rate': 0.38124967537862225, 'global_pooling': 'mean', 'learning_rate': 0.07089141723796885, 'weight_decay': 0.0003220626495993124, 'beta_0': 0.8683420313684149, 'beta_1': 0.9877260389162159, 'epsilon': 4.933751600448336e-08, 'balanced_loss': False, 'epochs': 132, 'early_stopping_patience': 21, 'plateau_patience': 20, 'plateau_divider': 4}. Best is trial 4 with value: 0.9030303030303031.
[I 2024-11-28 07:15:00,443] Trial 9 finished with value: 0.896969696969697 and parameters: {'left_stride': 0, 'right_stride': 64, 'attention_pooling_operation': 'max', 'embedding_pooling_operation': 'min', 'threshold': 0.9491566713529321, 'batch_size': 39, 'attention_heads': 6, 'hidden_dimension': 129, 'number_of_hidden_layers': 1, 'dropout_rate': 0.48475502941566495, 'global_pooling': 'mean', 'learning_rate': 0.003187422711813414, 'weight_decay': 3.2315343430749745e-05, 'beta_0': 0.8849150937783302, 'beta_1': 0.9924741264147013, 'epsilon': 4.484744524732786e-08, 'balanced_loss': False, 'epochs': 54, 'early_stopping_patience': 19, 'plateau_patience': 25, 'plateau_divider': 7}. Best is trial 4 with value: 0.9030303030303031.
[I 2024-11-28 07:21:53,774] Trial 10 finished with value: 0.8242424242424242 and parameters: {'left_stride': 64, 'right_stride': 32, 'attention_pooling_operation': 'mean', 'embedding_pooling_operation': 'max', 'threshold': 0.9029748787782621, 'batch_size': 17, 'attention_heads': 12, 'hidden_dimension': 41, 'number_of_hidden_layers': 1, 'dropout_rate': 0.5977087996381012, 'global_pooling': 'sum', 'learning_rate': 3.669591461834728e-05, 'weight_decay': 2.2149751254685757e-05, 'beta_0': 0.8049082510455238, 'beta_1': 0.9986108440342225, 'epsilon': 3.1334546767721343e-07, 'balanced_loss': True, 'epochs': 104, 'early_stopping_patience': 17, 'plateau_patience': 10, 'plateau_divider': 2}. Best is trial 4 with value: 0.9030303030303031.
CUDA out of memory. Tried to allocate 7.33 GiB. GPU 0 has a total capacity of 44.56 GiB of which 662.69 MiB is free. Including non-PyTorch memory, this process has 43.91 GiB memory in use. Of the allocated memory 40.14 GiB is allocated by PyTorch, and 2.61 GiB is reserved by PyTorch but unallocated. If reserved but unallocated memory is large try setting PYTORCH_CUDA_ALLOC_CONF=expandable_segments:True to avoid fragmentation.  See documentation for Memory Management  (https://pytorch.org/docs/stable/notes/cuda.html#environment-variables)
[I 2024-11-28 07:27:11,461] Trial 11 finished with value: -1.0 and parameters: {'left_stride': 256, 'right_stride': 32, 'attention_pooling_operation': 'min', 'embedding_pooling_operation': 'min', 'threshold': 0.9119819529014985, 'batch_size': 51, 'attention_heads': 16, 'hidden_dimension': 164, 'number_of_hidden_layers': 0, 'dropout_rate': 0.5210463301030738, 'global_pooling': 'mean', 'learning_rate': 0.0004122230732977218, 'weight_decay': 0.0009840234240147763, 'beta_0': 0.8229385099706575, 'beta_1': 0.9865689260288907, 'epsilon': 8.30499390626528e-06, 'balanced_loss': True, 'epochs': 168, 'early_stopping_patience': 16, 'plateau_patience': 13, 'plateau_divider': 2}. Best is trial 4 with value: 0.9030303030303031.
[I 2024-11-28 07:35:08,306] Trial 12 finished with value: 0.8606060606060606 and parameters: {'left_stride': 128, 'right_stride': 256, 'attention_pooling_operation': 'min', 'embedding_pooling_operation': 'min', 'threshold': 0.9193199803632638, 'batch_size': 27, 'attention_heads': 13, 'hidden_dimension': 163, 'number_of_hidden_layers': 0, 'dropout_rate': 0.4206664023532743, 'global_pooling': 'mean', 'learning_rate': 0.0018063675104261487, 'weight_decay': 6.291626708150022e-05, 'beta_0': 0.8015181094989687, 'beta_1': 0.9932670271498628, 'epsilon': 2.177455140795459e-05, 'balanced_loss': True, 'epochs': 169, 'early_stopping_patience': 14, 'plateau_patience': 19, 'plateau_divider': 4}. Best is trial 4 with value: 0.9030303030303031.
[I 2024-11-28 07:42:03,790] Trial 13 finished with value: 0.8848484848484849 and parameters: {'left_stride': 0, 'right_stride': 0, 'attention_pooling_operation': 'min', 'embedding_pooling_operation': 'min', 'threshold': 0.9342307189887571, 'batch_size': 47, 'attention_heads': 8, 'hidden_dimension': 256, 'number_of_hidden_layers': 1, 'dropout_rate': 0.5467233430896324, 'global_pooling': 'mean', 'learning_rate': 0.00016799219502342284, 'weight_decay': 0.00016893806027344123, 'beta_0': 0.823397595015505, 'beta_1': 0.9894820783637132, 'epsilon': 5.799160154310164e-07, 'balanced_loss': True, 'epochs': 101, 'early_stopping_patience': 10, 'plateau_patience': 23, 'plateau_divider': 6}. Best is trial 4 with value: 0.9030303030303031.
[I 2024-11-28 07:48:37,921] Trial 14 finished with value: 0.8545454545454545 and parameters: {'left_stride': 256, 'right_stride': 32, 'attention_pooling_operation': 'min', 'embedding_pooling_operation': 'max', 'threshold': 0.9483600897435989, 'batch_size': 29, 'attention_heads': 13, 'hidden_dimension': 50, 'number_of_hidden_layers': 2, 'dropout_rate': 0.42401420158907666, 'global_pooling': 'mean', 'learning_rate': 0.00942561948154041, 'weight_decay': 9.08581703614988e-06, 'beta_0': 0.8980212771528688, 'beta_1': 0.9844344686710937, 'epsilon': 3.306868489920373e-06, 'balanced_loss': False, 'epochs': 165, 'early_stopping_patience': 15, 'plateau_patience': 18, 'plateau_divider': 3}. Best is trial 4 with value: 0.9030303030303031.
[I 2024-11-28 07:59:59,242] Trial 15 finished with value: 0.8606060606060606 and parameters: {'left_stride': 64, 'right_stride': 64, 'attention_pooling_operation': 'mean', 'embedding_pooling_operation': 'min', 'threshold': 0.9211923380903495, 'batch_size': 46, 'attention_heads': 16, 'hidden_dimension': 142, 'number_of_hidden_layers': 0, 'dropout_rate': 0.5101867334009248, 'global_pooling': 'sum', 'learning_rate': 0.0009693256467549694, 'weight_decay': 5.404734934449139e-05, 'beta_0': 0.8178984939364393, 'beta_1': 0.9946506297224307, 'epsilon': 9.935138101942618e-05, 'balanced_loss': True, 'epochs': 200, 'early_stopping_patience': 20, 'plateau_patience': 16, 'plateau_divider': 5}. Best is trial 4 with value: 0.9030303030303031.
[I 2024-11-28 08:08:00,045] Trial 16 finished with value: 0.8909090909090909 and parameters: {'left_stride': 64, 'right_stride': 64, 'attention_pooling_operation': 'min', 'embedding_pooling_operation': 'min', 'threshold': 0.9408280284740435, 'batch_size': 52, 'attention_heads': 11, 'hidden_dimension': 92, 'number_of_hidden_layers': 2, 'dropout_rate': 0.40195808035300096, 'global_pooling': 'mean', 'learning_rate': 0.0001284908851699592, 'weight_decay': 0.0001469958547733551, 'beta_0': 0.8471209575208628, 'beta_1': 0.9891886169055271, 'epsilon': 1.4820209278517213e-07, 'balanced_loss': False, 'epochs': 109, 'early_stopping_patience': 18, 'plateau_patience': 14, 'plateau_divider': 3}. Best is trial 4 with value: 0.9030303030303031.
[I 2024-11-28 08:24:11,317] Trial 17 finished with value: 0.8848484848484849 and parameters: {'left_stride': 256, 'right_stride': 32, 'attention_pooling_operation': 'min', 'embedding_pooling_operation': 'min', 'threshold': 0.9025326062419374, 'batch_size': 33, 'attention_heads': 14, 'hidden_dimension': 176, 'number_of_hidden_layers': 0, 'dropout_rate': 0.45005699654981046, 'global_pooling': 'mean', 'learning_rate': 4.5635710191635446e-05, 'weight_decay': 0.0007688671193150354, 'beta_0': 0.8356205958561155, 'beta_1': 0.9838115578678897, 'epsilon': 1.5067910365759739e-05, 'balanced_loss': True, 'epochs': 151, 'early_stopping_patience': 12, 'plateau_patience': 23, 'plateau_divider': 5}. Best is trial 4 with value: 0.9030303030303031.
[I 2024-11-28 08:37:12,013] Trial 18 finished with value: 0.8424242424242424 and parameters: {'left_stride': 0, 'right_stride': 256, 'attention_pooling_operation': 'min', 'embedding_pooling_operation': 'mean', 'threshold': 0.9243715138797781, 'batch_size': 18, 'attention_heads': 12, 'hidden_dimension': 238, 'number_of_hidden_layers': 1, 'dropout_rate': 0.5451082720321563, 'global_pooling': 'mean', 'learning_rate': 0.01600428763625089, 'weight_decay': 0.000315195987295406, 'beta_0': 0.8152854517277068, 'beta_1': 0.9904036337368142, 'epsilon': 1.5614591834319235e-06, 'balanced_loss': True, 'epochs': 180, 'early_stopping_patience': 16, 'plateau_patience': 11, 'plateau_divider': 10}. Best is trial 4 with value: 0.9030303030303031.
[I 2024-11-28 08:44:40,767] Trial 19 finished with value: 0.8606060606060606 and parameters: {'left_stride': 32, 'right_stride': 128, 'attention_pooling_operation': 'mean', 'embedding_pooling_operation': 'max', 'threshold': 0.9587988949354894, 'batch_size': 24, 'attention_heads': 8, 'hidden_dimension': 119, 'number_of_hidden_layers': 2, 'dropout_rate': 0.4976510781618152, 'global_pooling': 'sum', 'learning_rate': 0.00047750808874943366, 'weight_decay': 1.2144581852724987e-05, 'beta_0': 0.8489715911849802, 'beta_1': 0.9943720154535816, 'epsilon': 1.1608640886062668e-08, 'balanced_loss': False, 'epochs': 83, 'early_stopping_patience': 12, 'plateau_patience': 19, 'plateau_divider': 2}. Best is trial 4 with value: 0.9030303030303031.
[I 2024-11-28 08:52:57,541] Trial 20 finished with value: 0.9030303030303031 and parameters: {'left_stride': 128, 'right_stride': 0, 'attention_pooling_operation': 'min', 'embedding_pooling_operation': 'min', 'threshold': 0.9147194712503521, 'batch_size': 35, 'attention_heads': 14, 'hidden_dimension': 223, 'number_of_hidden_layers': 0, 'dropout_rate': 0.5386888279278214, 'global_pooling': 'mean', 'learning_rate': 0.0010659737146300051, 'weight_decay': 7.635669924783436e-05, 'beta_0': 0.8272398101833868, 'beta_1': 0.9878416432046382, 'epsilon': 5.264691427806198e-06, 'balanced_loss': False, 'epochs': 155, 'early_stopping_patience': 15, 'plateau_patience': 16, 'plateau_divider': 7}. Best is trial 4 with value: 0.9030303030303031.
[I 2024-11-28 09:00:40,746] Trial 21 finished with value: 0.896969696969697 and parameters: {'left_stride': 128, 'right_stride': 0, 'attention_pooling_operation': 'min', 'embedding_pooling_operation': 'min', 'threshold': 0.9114546134112465, 'batch_size': 35, 'attention_heads': 14, 'hidden_dimension': 223, 'number_of_hidden_layers': 0, 'dropout_rate': 0.5428265523566719, 'global_pooling': 'mean', 'learning_rate': 0.0012893708533181206, 'weight_decay': 7.13502124247914e-05, 'beta_0': 0.8283755020817825, 'beta_1': 0.987143776668423, 'epsilon': 8.112280691265317e-06, 'balanced_loss': False, 'epochs': 153, 'early_stopping_patience': 15, 'plateau_patience': 16, 'plateau_divider': 7}. Best is trial 4 with value: 0.9030303030303031.
CUDA out of memory. Tried to allocate 8.28 GiB. GPU 0 has a total capacity of 44.56 GiB of which 6.49 GiB is free. Including non-PyTorch memory, this process has 38.06 GiB memory in use. Of the allocated memory 36.63 GiB is allocated by PyTorch, and 286.68 MiB is reserved by PyTorch but unallocated. If reserved but unallocated memory is large try setting PYTORCH_CUDA_ALLOC_CONF=expandable_segments:True to avoid fragmentation.  See documentation for Memory Management  (https://pytorch.org/docs/stable/notes/cuda.html#environment-variables)
[I 2024-11-28 09:05:32,056] Trial 22 finished with value: -1.0 and parameters: {'left_stride': 128, 'right_stride': 0, 'attention_pooling_operation': 'min', 'embedding_pooling_operation': 'min', 'threshold': 0.9144365950363761, 'batch_size': 45, 'attention_heads': 15, 'hidden_dimension': 255, 'number_of_hidden_layers': 0, 'dropout_rate': 0.5932953199236469, 'global_pooling': 'mean', 'learning_rate': 0.004834299687274919, 'weight_decay': 0.00010349573145268162, 'beta_0': 0.8110856517395288, 'beta_1': 0.989059824200013, 'epsilon': 3.743315179335648e-06, 'balanced_loss': False, 'epochs': 121, 'early_stopping_patience': 17, 'plateau_patience': 13, 'plateau_divider': 7}. Best is trial 4 with value: 0.9030303030303031.
[I 2024-11-28 09:11:48,607] Trial 23 finished with value: 0.8909090909090909 and parameters: {'left_stride': 128, 'right_stride': 0, 'attention_pooling_operation': 'min', 'embedding_pooling_operation': 'min', 'threshold': 0.9274505789987455, 'batch_size': 23, 'attention_heads': 12, 'hidden_dimension': 71, 'number_of_hidden_layers': 1, 'dropout_rate': 0.5699602386085928, 'global_pooling': 'mean', 'learning_rate': 0.0002335493448899663, 'weight_decay': 3.2900788109500105e-05, 'beta_0': 0.845716713214561, 'beta_1': 0.9911506816813667, 'epsilon': 8.612201142578027e-07, 'balanced_loss': False, 'epochs': 175, 'early_stopping_patience': 14, 'plateau_patience': 18, 'plateau_divider': 8}. Best is trial 4 with value: 0.9030303030303031.
[I 2024-11-28 09:19:15,318] Trial 24 finished with value: 0.9030303030303031 and parameters: {'left_stride': 64, 'right_stride': 64, 'attention_pooling_operation': 'min', 'embedding_pooling_operation': 'min', 'threshold': 0.9377242279424269, 'batch_size': 36, 'attention_heads': 13, 'hidden_dimension': 191, 'number_of_hidden_layers': 0, 'dropout_rate': 0.5237167918363986, 'global_pooling': 'mean', 'learning_rate': 0.000987218309656611, 'weight_decay': 0.00046044401569441713, 'beta_0': 0.8590315865929972, 'beta_1': 0.9826180690151296, 'epsilon': 1.5487968495927837e-05, 'balanced_loss': False, 'epochs': 143, 'early_stopping_patience': 18, 'plateau_patience': 17, 'plateau_divider': 4}. Best is trial 4 with value: 0.9030303030303031.
[I 2024-11-28 09:27:04,736] Trial 25 finished with value: 0.8909090909090909 and parameters: {'left_stride': 64, 'right_stride': 0, 'attention_pooling_operation': 'min', 'embedding_pooling_operation': 'min', 'threshold': 0.9432606261108647, 'batch_size': 51, 'attention_heads': 10, 'hidden_dimension': 178, 'number_of_hidden_layers': 1, 'dropout_rate': 0.5230816583939956, 'global_pooling': 'mean', 'learning_rate': 0.0010839796315624322, 'weight_decay': 0.0002109113799096371, 'beta_0': 0.8628605170015381, 'beta_1': 0.9822711164523699, 'epsilon': 2.2527837221821628e-05, 'balanced_loss': False, 'epochs': 142, 'early_stopping_patience': 19, 'plateau_patience': 15, 'plateau_divider': 5}. Best is trial 4 with value: 0.9030303030303031.
