[I 2024-11-24 02:43:47,317] Trial 197 finished with value: 0.896969696969697 and parameters: {'left_stride': 0, 'right_stride': 32, 'attention_pooling_operation': 'mean', 'embedding_pooling_operation': 'max', 'threshold': 0.977794416425073, 'batch_size': 61, 'attention_heads': 4, 'hidden_dimension': 117, 'number_of_hidden_layers': 4, 'dropout_rate': 0.4631483575113541, 'global_pooling': 'mean', 'learning_rate': 0.0011533676787661982, 'weight_decay': 1.8912015113481755e-06, 'beta_0': 0.813700428559007, 'beta_1': 0.9982287365835918, 'epsilon': 9.891057257777318e-08, 'balanced_loss': False, 'epochs': 172, 'early_stopping_patience': 23, 'plateau_patience': 17, 'plateau_divider': 7}. Best is trial 175 with value: 0.9333333333333333.
CUDA out of memory. Tried to allocate 1.93 GiB. GPU 0 has a total capacity of 44.56 GiB of which 1.59 GiB is free. Including non-PyTorch memory, this process has 42.96 GiB memory in use. Of the allocated memory 40.45 GiB is allocated by PyTorch, and 1.36 GiB is reserved by PyTorch but unallocated. If reserved but unallocated memory is large try setting PYTORCH_CUDA_ALLOC_CONF=expandable_segments:True to avoid fragmentation.  See documentation for Memory Management  (https://pytorch.org/docs/stable/notes/cuda.html#environment-variables)
[I 2024-11-24 02:57:06,392] Trial 198 finished with value: -1.0 and parameters: {'left_stride': 0, 'right_stride': 64, 'attention_pooling_operation': 'mean', 'embedding_pooling_operation': 'mean', 'threshold': 0.9718167587963571, 'batch_size': 60, 'attention_heads': 4, 'hidden_dimension': 112, 'number_of_hidden_layers': 4, 'dropout_rate': 0.45600029866956315, 'global_pooling': 'mean', 'learning_rate': 0.0009157232449690554, 'weight_decay': 1.3447250055163015e-06, 'beta_0': 0.8122972666056829, 'beta_1': 0.9844418852554783, 'epsilon': 7.788484367799672e-08, 'balanced_loss': False, 'epochs': 196, 'early_stopping_patience': 20, 'plateau_patience': 17, 'plateau_divider': 7}. Best is trial 175 with value: 0.9333333333333333.
[I 2024-11-24 03:12:35,052] Trial 199 finished with value: 0.9030303030303031 and parameters: {'left_stride': 0, 'right_stride': 64, 'attention_pooling_operation': 'mean', 'embedding_pooling_operation': 'max', 'threshold': 0.9759585615988593, 'batch_size': 61, 'attention_heads': 4, 'hidden_dimension': 96, 'number_of_hidden_layers': 4, 'dropout_rate': 0.4783154877659057, 'global_pooling': 'mean', 'learning_rate': 0.0011038499164256188, 'weight_decay': 2.0935956501224922e-06, 'beta_0': 0.8185148981724106, 'beta_1': 0.9985138686876635, 'epsilon': 6.364090213668225e-08, 'balanced_loss': False, 'epochs': 193, 'early_stopping_patience': 23, 'plateau_patience': 17, 'plateau_divider': 7}. Best is trial 175 with value: 0.9333333333333333.
slurmstepd: error: *** JOB 14001171 ON gpu052 CANCELLED AT 2024-11-24T03:14:34 DUE TO TIME LIMIT ***
