[I 2024-12-25 16:13:50,693] Trial 338 finished with value: 0.9696969696969697 and parameters: {'left_stride': 256, 'right_stride': 32, 'attention_pooling_operation': 'mean', 'embedding_pooling_operation': 'min', 'threshold': 0.9888742361913863, 'batch_size': 28, 'attention_heads': 4, 'hidden_dimension': 32, 'number_of_hidden_layers': 2, 'dropout_rate': 0.36312502389287604, 'global_pooling': 'mean', 'learning_rate': 0.00015869155611578897, 'weight_decay': 0.0003439382933467549, 'beta_0': 0.8608672837082817, 'beta_1': 0.9910994440439111, 'epsilon': 1.5509206207479628e-08, 'balanced_loss': False, 'epochs': 176, 'early_stopping_patience': 16, 'plateau_patience': 25, 'plateau_divider': 10}. Best is trial 177 with value: 0.9757575757575757.
[I 2024-12-25 16:46:04,340] Trial 339 finished with value: 0.9575757575757575 and parameters: {'left_stride': 256, 'right_stride': 32, 'attention_pooling_operation': 'mean', 'embedding_pooling_operation': 'min', 'threshold': 0.982340386969769, 'batch_size': 52, 'attention_heads': 4, 'hidden_dimension': 40, 'number_of_hidden_layers': 2, 'dropout_rate': 0.39698328701262053, 'global_pooling': 'mean', 'learning_rate': 6.177658211121123e-05, 'weight_decay': 2.7599256736628646e-06, 'beta_0': 0.8428275437565961, 'beta_1': 0.9931741234756852, 'epsilon': 1.151874453102767e-08, 'balanced_loss': True, 'epochs': 168, 'early_stopping_patience': 17, 'plateau_patience': 25, 'plateau_divider': 9}. Best is trial 177 with value: 0.9757575757575757.
CUDA out of memory. Tried to allocate 2.67 GiB. GPU 0 has a total capacity of 44.56 GiB of which 1.77 GiB is free. Including non-PyTorch memory, this process has 42.78 GiB memory in use. Of the allocated memory 35.93 GiB is allocated by PyTorch, and 5.70 GiB is reserved by PyTorch but unallocated. If reserved but unallocated memory is large try setting PYTORCH_CUDA_ALLOC_CONF=expandable_segments:True to avoid fragmentation.  See documentation for Memory Management  (https://pytorch.org/docs/stable/notes/cuda.html#environment-variables)
[I 2024-12-25 17:11:28,738] Trial 340 finished with value: -1.0 and parameters: {'left_stride': 256, 'right_stride': 32, 'attention_pooling_operation': 'mean', 'embedding_pooling_operation': 'min', 'threshold': 0.9773605024554997, 'batch_size': 31, 'attention_heads': 5, 'hidden_dimension': 37, 'number_of_hidden_layers': 2, 'dropout_rate': 0.38320856801884884, 'global_pooling': 'mean', 'learning_rate': 0.00011428705054760149, 'weight_decay': 0.00042996324455760805, 'beta_0': 0.849033718340829, 'beta_1': 0.9922276562642219, 'epsilon': 1.377648811007419e-08, 'balanced_loss': False, 'epochs': 173, 'early_stopping_patience': 18, 'plateau_patience': 24, 'plateau_divider': 8}. Best is trial 177 with value: 0.9757575757575757.
CUDA out of memory. Tried to allocate 1.36 GiB. GPU 0 has a total capacity of 44.56 GiB of which 542.69 MiB is free. Including non-PyTorch memory, this process has 44.02 GiB memory in use. Of the allocated memory 33.58 GiB is allocated by PyTorch, and 9.29 GiB is reserved by PyTorch but unallocated. If reserved but unallocated memory is large try setting PYTORCH_CUDA_ALLOC_CONF=expandable_segments:True to avoid fragmentation.  See documentation for Memory Management  (https://pytorch.org/docs/stable/notes/cuda.html#environment-variables)
[I 2024-12-25 17:39:23,039] Trial 341 finished with value: -1.0 and parameters: {'left_stride': 256, 'right_stride': 32, 'attention_pooling_operation': 'mean', 'embedding_pooling_operation': 'min', 'threshold': 0.9858092742930826, 'batch_size': 33, 'attention_heads': 4, 'hidden_dimension': 166, 'number_of_hidden_layers': 2, 'dropout_rate': 0.37290720796290744, 'global_pooling': 'mean', 'learning_rate': 9.31024404176374e-05, 'weight_decay': 0.0006565486292905475, 'beta_0': 0.8581353069562659, 'beta_1': 0.9951148059659126, 'epsilon': 1.7541230908929293e-08, 'balanced_loss': False, 'epochs': 183, 'early_stopping_patience': 19, 'plateau_patience': 25, 'plateau_divider': 8}. Best is trial 177 with value: 0.9757575757575757.
[I 2024-12-25 18:11:17,721] Trial 342 finished with value: 0.9696969696969697 and parameters: {'left_stride': 256, 'right_stride': 32, 'attention_pooling_operation': 'mean', 'embedding_pooling_operation': 'min', 'threshold': 0.9833655938594367, 'batch_size': 27, 'attention_heads': 4, 'hidden_dimension': 44, 'number_of_hidden_layers': 2, 'dropout_rate': 0.4020974388502613, 'global_pooling': 'mean', 'learning_rate': 5.5643824730238945e-05, 'weight_decay': 0.00038104567908895336, 'beta_0': 0.8532121397770676, 'beta_1': 0.9941366073770274, 'epsilon': 1.0037898401591791e-08, 'balanced_loss': False, 'epochs': 187, 'early_stopping_patience': 17, 'plateau_patience': 25, 'plateau_divider': 8}. Best is trial 177 with value: 0.9757575757575757.
[I 2024-12-25 18:42:20,105] Trial 343 finished with value: 0.9636363636363636 and parameters: {'left_stride': 32, 'right_stride': 32, 'attention_pooling_operation': 'mean', 'embedding_pooling_operation': 'min', 'threshold': 0.9796438545360533, 'batch_size': 37, 'attention_heads': 4, 'hidden_dimension': 32, 'number_of_hidden_layers': 2, 'dropout_rate': 0.3932261611387244, 'global_pooling': 'mean', 'learning_rate': 4.405932746760385e-05, 'weight_decay': 0.00027650463032605324, 'beta_0': 0.8519095385210507, 'beta_1': 0.9928986603361593, 'epsilon': 1.3622128654875295e-08, 'balanced_loss': False, 'epochs': 178, 'early_stopping_patience': 16, 'plateau_patience': 24, 'plateau_divider': 7}. Best is trial 177 with value: 0.9757575757575757.
[I 2024-12-25 19:12:34,681] Trial 344 finished with value: 0.9393939393939394 and parameters: {'left_stride': 256, 'right_stride': 32, 'attention_pooling_operation': 'mean', 'embedding_pooling_operation': 'min', 'threshold': 0.9818901587934101, 'batch_size': 34, 'attention_heads': 4, 'hidden_dimension': 39, 'number_of_hidden_layers': 2, 'dropout_rate': 0.36656406980161377, 'global_pooling': 'max', 'learning_rate': 6.930284589108109e-05, 'weight_decay': 0.0004880420124999566, 'beta_0': 0.8466712906832199, 'beta_1': 0.9934754075531567, 'epsilon': 2.2978400168131703e-08, 'balanced_loss': False, 'epochs': 166, 'early_stopping_patience': 16, 'plateau_patience': 25, 'plateau_divider': 8}. Best is trial 177 with value: 0.9757575757575757.
[I 2024-12-25 19:46:10,862] Trial 345 finished with value: 0.9696969696969697 and parameters: {'left_stride': 256, 'right_stride': 32, 'attention_pooling_operation': 'mean', 'embedding_pooling_operation': 'min', 'threshold': 0.9870264529533399, 'batch_size': 31, 'attention_heads': 5, 'hidden_dimension': 36, 'number_of_hidden_layers': 2, 'dropout_rate': 0.37790481177142843, 'global_pooling': 'mean', 'learning_rate': 3.587461756075853e-05, 'weight_decay': 0.00032830734801728487, 'beta_0': 0.8559508400640525, 'beta_1': 0.9944364654940313, 'epsilon': 1.0037369473354252e-08, 'balanced_loss': False, 'epochs': 176, 'early_stopping_patience': 17, 'plateau_patience': 25, 'plateau_divider': 8}. Best is trial 177 with value: 0.9757575757575757.
[I 2024-12-25 20:17:30,765] Trial 346 finished with value: 0.9757575757575757 and parameters: {'left_stride': 256, 'right_stride': 128, 'attention_pooling_operation': 'mean', 'embedding_pooling_operation': 'min', 'threshold': 0.9847516655069742, 'batch_size': 35, 'attention_heads': 4, 'hidden_dimension': 32, 'number_of_hidden_layers': 2, 'dropout_rate': 0.35027472582476943, 'global_pooling': 'mean', 'learning_rate': 8.2173701882772e-05, 'weight_decay': 0.00041746543049091435, 'beta_0': 0.8506692661306732, 'beta_1': 0.9955316620063247, 'epsilon': 1.5604034810571163e-08, 'balanced_loss': False, 'epochs': 171, 'early_stopping_patience': 15, 'plateau_patience': 24, 'plateau_divider': 9}. Best is trial 177 with value: 0.9757575757575757.
[I 2024-12-25 20:50:32,982] Trial 347 finished with value: 0.9757575757575757 and parameters: {'left_stride': 256, 'right_stride': 32, 'attention_pooling_operation': 'mean', 'embedding_pooling_operation': 'min', 'threshold': 0.9807501354593815, 'batch_size': 29, 'attention_heads': 4, 'hidden_dimension': 42, 'number_of_hidden_layers': 2, 'dropout_rate': 0.3841314318293737, 'global_pooling': 'mean', 'learning_rate': 5.3929164295955236e-05, 'weight_decay': 0.0005702934112845676, 'beta_0': 0.8544834044786719, 'beta_1': 0.9925668571697402, 'epsilon': 1.1855428530594703e-08, 'balanced_loss': False, 'epochs': 180, 'early_stopping_patience': 18, 'plateau_patience': 25, 'plateau_divider': 8}. Best is trial 177 with value: 0.9757575757575757.
[I 2024-12-25 21:19:33,621] Trial 348 finished with value: 0.9575757575757575 and parameters: {'left_stride': 64, 'right_stride': 32, 'attention_pooling_operation': 'mean', 'embedding_pooling_operation': 'min', 'threshold': 0.9784057691827495, 'batch_size': 32, 'attention_heads': 4, 'hidden_dimension': 48, 'number_of_hidden_layers': 2, 'dropout_rate': 0.39002835185494583, 'global_pooling': 'mean', 'learning_rate': 0.0001060242164337156, 'weight_decay': 0.0007893284971042259, 'beta_0': 0.848305189332289, 'beta_1': 0.993814653349803, 'epsilon': 1.9048837632371e-08, 'balanced_loss': False, 'epochs': 174, 'early_stopping_patience': 18, 'plateau_patience': 25, 'plateau_divider': 9}. Best is trial 177 with value: 0.9757575757575757.
CUDA out of memory. Tried to allocate 2.67 GiB. GPU 0 has a total capacity of 44.56 GiB of which 176.69 MiB is free. Including non-PyTorch memory, this process has 44.38 GiB memory in use. Of the allocated memory 37.27 GiB is allocated by PyTorch, and 5.96 GiB is reserved by PyTorch but unallocated. If reserved but unallocated memory is large try setting PYTORCH_CUDA_ALLOC_CONF=expandable_segments:True to avoid fragmentation.  See documentation for Memory Management  (https://pytorch.org/docs/stable/notes/cuda.html#environment-variables)
[I 2024-12-25 21:45:00,504] Trial 349 finished with value: -1.0 and parameters: {'left_stride': 256, 'right_stride': 32, 'attention_pooling_operation': 'mean', 'embedding_pooling_operation': 'min', 'threshold': 0.9756489579317092, 'batch_size': 36, 'attention_heads': 4, 'hidden_dimension': 36, 'number_of_hidden_layers': 2, 'dropout_rate': 0.3714844747659549, 'global_pooling': 'mean', 'learning_rate': 6.681676926107475e-05, 'weight_decay': 4.768969728318131e-06, 'beta_0': 0.8447917633554667, 'beta_1': 0.9916616380111918, 'epsilon': 1.3617895917024722e-08, 'balanced_loss': False, 'epochs': 182, 'early_stopping_patience': 19, 'plateau_patience': 24, 'plateau_divider': 8}. Best is trial 177 with value: 0.9757575757575757.
[I 2024-12-25 22:17:57,243] Trial 350 finished with value: 0.9636363636363636 and parameters: {'left_stride': 256, 'right_stride': 32, 'attention_pooling_operation': 'mean', 'embedding_pooling_operation': 'min', 'threshold': 0.9842785909866031, 'batch_size': 33, 'attention_heads': 4, 'hidden_dimension': 40, 'number_of_hidden_layers': 2, 'dropout_rate': 0.36052760709156867, 'global_pooling': 'mean', 'learning_rate': 4.747281799948032e-05, 'weight_decay': 0.000360042504572425, 'beta_0': 0.8510658993299891, 'beta_1': 0.9801763627706476, 'epsilon': 1.5828557162031695e-08, 'balanced_loss': False, 'epochs': 169, 'early_stopping_patience': 16, 'plateau_patience': 25, 'plateau_divider': 9}. Best is trial 177 with value: 0.9757575757575757.
CUDA out of memory. Tried to allocate 2.86 GiB. GPU 0 has a total capacity of 44.56 GiB of which 2.72 GiB is free. Including non-PyTorch memory, this process has 41.84 GiB memory in use. Of the allocated memory 33.44 GiB is allocated by PyTorch, and 7.24 GiB is reserved by PyTorch but unallocated. If reserved but unallocated memory is large try setting PYTORCH_CUDA_ALLOC_CONF=expandable_segments:True to avoid fragmentation.  See documentation for Memory Management  (https://pytorch.org/docs/stable/notes/cuda.html#environment-variables)
[I 2024-12-25 22:44:53,556] Trial 351 finished with value: -1.0 and parameters: {'left_stride': 256, 'right_stride': 256, 'attention_pooling_operation': 'mean', 'embedding_pooling_operation': 'min', 'threshold': 0.9823761051351005, 'batch_size': 57, 'attention_heads': 4, 'hidden_dimension': 32, 'number_of_hidden_layers': 2, 'dropout_rate': 0.4644095270889577, 'global_pooling': 'mean', 'learning_rate': 8.085672357327261e-05, 'weight_decay': 0.00045217546998103545, 'beta_0': 0.8536495680269749, 'beta_1': 0.9931031357340194, 'epsilon': 1.2067585731595753e-08, 'balanced_loss': False, 'epochs': 177, 'early_stopping_patience': 17, 'plateau_patience': 25, 'plateau_divider': 8}. Best is trial 177 with value: 0.9757575757575757.
[I 2024-12-25 23:15:44,288] Trial 352 finished with value: 0.9696969696969697 and parameters: {'left_stride': 256, 'right_stride': 32, 'attention_pooling_operation': 'mean', 'embedding_pooling_operation': 'min', 'threshold': 0.9801872439493109, 'batch_size': 30, 'attention_heads': 5, 'hidden_dimension': 36, 'number_of_hidden_layers': 2, 'dropout_rate': 0.4477160565783752, 'global_pooling': 'mean', 'learning_rate': 0.00013188904879762146, 'weight_decay': 0.0002969336389275548, 'beta_0': 0.8489142957493767, 'beta_1': 0.9921147208031665, 'epsilon': 1.0004719152689063e-08, 'balanced_loss': False, 'epochs': 172, 'early_stopping_patience': 16, 'plateau_patience': 25, 'plateau_divider': 7}. Best is trial 177 with value: 0.9757575757575757.
[I 2024-12-25 23:46:16,493] Trial 353 finished with value: 0.9030303030303031 and parameters: {'left_stride': 256, 'right_stride': 32, 'attention_pooling_operation': 'mean', 'embedding_pooling_operation': 'min', 'threshold': 0.9869768888893378, 'batch_size': 35, 'attention_heads': 4, 'hidden_dimension': 40, 'number_of_hidden_layers': 2, 'dropout_rate': 0.38075489656581485, 'global_pooling': 'mean', 'learning_rate': 2.0168371982903485e-05, 'weight_decay': 0.00021414165899253363, 'beta_0': 0.8584089475194597, 'beta_1': 0.9940381082213888, 'epsilon': 1.4059575418171453e-08, 'balanced_loss': False, 'epochs': 84, 'early_stopping_patience': 15, 'plateau_patience': 25, 'plateau_divider': 8}. Best is trial 177 with value: 0.9757575757575757.
CUDA out of memory. Tried to allocate 1.85 GiB. GPU 0 has a total capacity of 44.56 GiB of which 1.25 GiB is free. Including non-PyTorch memory, this process has 43.30 GiB memory in use. Of the allocated memory 34.88 GiB is allocated by PyTorch, and 7.27 GiB is reserved by PyTorch but unallocated. If reserved but unallocated memory is large try setting PYTORCH_CUDA_ALLOC_CONF=expandable_segments:True to avoid fragmentation.  See documentation for Memory Management  (https://pytorch.org/docs/stable/notes/cuda.html#environment-variables)
[I 2024-12-25 23:56:20,860] Trial 354 finished with value: -1.0 and parameters: {'left_stride': 256, 'right_stride': 32, 'attention_pooling_operation': 'mean', 'embedding_pooling_operation': 'min', 'threshold': 0.9262275737698105, 'batch_size': 28, 'attention_heads': 4, 'hidden_dimension': 32, 'number_of_hidden_layers': 2, 'dropout_rate': 0.36781806887366125, 'global_pooling': 'mean', 'learning_rate': 3.983128681687445e-05, 'weight_decay': 0.0005156416370205668, 'beta_0': 0.8555075939222209, 'beta_1': 0.9934530946268267, 'epsilon': 1.692452599448732e-08, 'balanced_loss': False, 'epochs': 163, 'early_stopping_patience': 18, 'plateau_patience': 25, 'plateau_divider': 5}. Best is trial 177 with value: 0.9757575757575757.
[I 2024-12-26 00:27:17,664] Trial 355 finished with value: 0.9696969696969697 and parameters: {'left_stride': 256, 'right_stride': 32, 'attention_pooling_operation': 'mean', 'embedding_pooling_operation': 'min', 'threshold': 0.9833584566629301, 'batch_size': 34, 'attention_heads': 4, 'hidden_dimension': 45, 'number_of_hidden_layers': 2, 'dropout_rate': 0.37452275944822455, 'global_pooling': 'mean', 'learning_rate': 9.906556658719718e-05, 'weight_decay': 0.00039432751559845416, 'beta_0': 0.8520036492458177, 'beta_1': 0.9927601943908374, 'epsilon': 6.223986976313601e-07, 'balanced_loss': False, 'epochs': 186, 'early_stopping_patience': 17, 'plateau_patience': 25, 'plateau_divider': 8}. Best is trial 177 with value: 0.9757575757575757.
CUDA out of memory. Tried to allocate 2.67 GiB. GPU 0 has a total capacity of 44.56 GiB of which 820.69 MiB is free. Including non-PyTorch memory, this process has 43.75 GiB memory in use. Of the allocated memory 35.57 GiB is allocated by PyTorch, and 7.03 GiB is reserved by PyTorch but unallocated. If reserved but unallocated memory is large try setting PYTORCH_CUDA_ALLOC_CONF=expandable_segments:True to avoid fragmentation.  See documentation for Memory Management  (https://pytorch.org/docs/stable/notes/cuda.html#environment-variables)
[I 2024-12-26 00:52:44,949] Trial 356 finished with value: -1.0 and parameters: {'left_stride': 256, 'right_stride': 32, 'attention_pooling_operation': 'mean', 'embedding_pooling_operation': 'mean', 'threshold': 0.9778705088160913, 'batch_size': 30, 'attention_heads': 4, 'hidden_dimension': 36, 'number_of_hidden_layers': 2, 'dropout_rate': 0.39609484028304687, 'global_pooling': 'mean', 'learning_rate': 5.920529524712094e-05, 'weight_decay': 0.0006950231139323323, 'beta_0': 0.8460283678748818, 'beta_1': 0.9937834058772285, 'epsilon': 1.2155433040997059e-08, 'balanced_loss': False, 'epochs': 180, 'early_stopping_patience': 18, 'plateau_patience': 24, 'plateau_divider': 8}. Best is trial 177 with value: 0.9757575757575757.
CUDA out of memory. Tried to allocate 2.49 GiB. GPU 0 has a total capacity of 44.56 GiB of which 158.69 MiB is free. Including non-PyTorch memory, this process has 44.40 GiB memory in use. Of the allocated memory 37.35 GiB is allocated by PyTorch, and 5.89 GiB is reserved by PyTorch but unallocated. If reserved but unallocated memory is large try setting PYTORCH_CUDA_ALLOC_CONF=expandable_segments:True to avoid fragmentation.  See documentation for Memory Management  (https://pytorch.org/docs/stable/notes/cuda.html#environment-variables)
[I 2024-12-26 01:18:10,259] Trial 357 finished with value: -1.0 and parameters: {'left_stride': 256, 'right_stride': 32, 'attention_pooling_operation': 'mean', 'embedding_pooling_operation': 'min', 'threshold': 0.9723345126573324, 'batch_size': 31, 'attention_heads': 5, 'hidden_dimension': 36, 'number_of_hidden_layers': 2, 'dropout_rate': 0.38695243976635507, 'global_pooling': 'mean', 'learning_rate': 5.247410865676578e-05, 'weight_decay': 0.0005756643087119795, 'beta_0': 0.8494148933434155, 'beta_1': 0.994491960781745, 'epsilon': 2.033875493760024e-08, 'balanced_loss': False, 'epochs': 190, 'early_stopping_patience': 16, 'plateau_patience': 25, 'plateau_divider': 8}. Best is trial 177 with value: 0.9757575757575757.
[I 2024-12-26 01:48:59,384] Trial 358 finished with value: 0.9636363636363636 and parameters: {'left_stride': 256, 'right_stride': 32, 'attention_pooling_operation': 'mean', 'embedding_pooling_operation': 'min', 'threshold': 0.9816701597174984, 'batch_size': 32, 'attention_heads': 4, 'hidden_dimension': 40, 'number_of_hidden_layers': 2, 'dropout_rate': 0.40573149072281117, 'global_pooling': 'mean', 'learning_rate': 8.744038179288292e-05, 'weight_decay': 0.0002561745768290393, 'beta_0': 0.8535291677785468, 'beta_1': 0.9949350129426261, 'epsilon': 1.1794226543602949e-08, 'balanced_loss': True, 'epochs': 175, 'early_stopping_patience': 17, 'plateau_patience': 25, 'plateau_divider': 9}. Best is trial 177 with value: 0.9757575757575757.
[I 2024-12-26 02:19:48,503] Trial 359 finished with value: 0.9757575757575757 and parameters: {'left_stride': 256, 'right_stride': 32, 'attention_pooling_operation': 'mean', 'embedding_pooling_operation': 'min', 'threshold': 0.9854711902361535, 'batch_size': 29, 'attention_heads': 4, 'hidden_dimension': 32, 'number_of_hidden_layers': 2, 'dropout_rate': 0.3575431090524165, 'global_pooling': 'mean', 'learning_rate': 7.184588487008933e-05, 'weight_decay': 0.0003395823696797523, 'beta_0': 0.8569865575115073, 'beta_1': 0.9932357645427441, 'epsilon': 4.5571518518581273e-07, 'balanced_loss': False, 'epochs': 198, 'early_stopping_patience': 18, 'plateau_patience': 24, 'plateau_divider': 8}. Best is trial 177 with value: 0.9757575757575757.
[I 2024-12-26 02:52:05,511] Trial 360 finished with value: 0.9696969696969697 and parameters: {'left_stride': 128, 'right_stride': 32, 'attention_pooling_operation': 'mean', 'embedding_pooling_operation': 'min', 'threshold': 0.9887318367907099, 'batch_size': 33, 'attention_heads': 4, 'hidden_dimension': 50, 'number_of_hidden_layers': 2, 'dropout_rate': 0.3793980556751552, 'global_pooling': 'mean', 'learning_rate': 3.301230914786017e-05, 'weight_decay': 0.0004483022627975304, 'beta_0': 0.8473935138039044, 'beta_1': 0.992603818307427, 'epsilon': 1.5476425875075686e-08, 'balanced_loss': False, 'epochs': 168, 'early_stopping_patience': 19, 'plateau_patience': 25, 'plateau_divider': 10}. Best is trial 177 with value: 0.9757575757575757.
[I 2024-12-26 03:21:22,646] Trial 361 finished with value: 0.9515151515151515 and parameters: {'left_stride': 0, 'right_stride': 32, 'attention_pooling_operation': 'mean', 'embedding_pooling_operation': 'min', 'threshold': 0.9801859227933393, 'batch_size': 36, 'attention_heads': 4, 'hidden_dimension': 43, 'number_of_hidden_layers': 2, 'dropout_rate': 0.3650837255871168, 'global_pooling': 'mean', 'learning_rate': 4.2043800986159795e-05, 'weight_decay': 0.00038021738284235804, 'beta_0': 0.8509853014870575, 'beta_1': 0.9930318848756571, 'epsilon': 1.3774170602372763e-07, 'balanced_loss': False, 'epochs': 183, 'early_stopping_patience': 14, 'plateau_patience': 25, 'plateau_divider': 8}. Best is trial 177 with value: 0.9757575757575757.
