[I 2024-11-23 00:09:01,141] Trial 94 finished with value: 0.9212121212121213 and parameters: {'left_stride': 0, 'right_stride': 64, 'attention_pooling_operation': 'mean', 'embedding_pooling_operation': 'max', 'threshold': 0.982166214960883, 'batch_size': 64, 'attention_heads': 6, 'hidden_dimension': 104, 'number_of_hidden_layers': 4, 'dropout_rate': 0.34762309523128704, 'global_pooling': 'mean', 'learning_rate': 0.0008641807345479721, 'weight_decay': 1.3428875414488737e-05, 'beta_0': 0.8017989592257156, 'beta_1': 0.9985729859278715, 'epsilon': 9.025433875808062e-08, 'balanced_loss': False, 'epochs': 180, 'early_stopping_patience': 25, 'plateau_patience': 17, 'plateau_divider': 8}. Best is trial 84 with value: 0.9212121212121213.
[I 2024-11-23 00:24:58,225] Trial 95 finished with value: 0.9090909090909091 and parameters: {'left_stride': 0, 'right_stride': 64, 'attention_pooling_operation': 'mean', 'embedding_pooling_operation': 'max', 'threshold': 0.982050814082636, 'batch_size': 64, 'attention_heads': 6, 'hidden_dimension': 92, 'number_of_hidden_layers': 4, 'dropout_rate': 0.36641268453123826, 'global_pooling': 'mean', 'learning_rate': 0.0009202937871991264, 'weight_decay': 1.1354509705698355e-05, 'beta_0': 0.8016846457085897, 'beta_1': 0.998955448520582, 'epsilon': 3.545543542776845e-08, 'balanced_loss': False, 'epochs': 192, 'early_stopping_patience': 25, 'plateau_patience': 17, 'plateau_divider': 6}. Best is trial 84 with value: 0.9212121212121213.
[I 2024-11-23 00:42:48,874] Trial 96 finished with value: 0.8545454545454545 and parameters: {'left_stride': 32, 'right_stride': 128, 'attention_pooling_operation': 'mean', 'embedding_pooling_operation': 'max', 'threshold': 0.9822146667247958, 'batch_size': 63, 'attention_heads': 6, 'hidden_dimension': 94, 'number_of_hidden_layers': 4, 'dropout_rate': 0.4008304444365175, 'global_pooling': 'max', 'learning_rate': 0.0001849679375034137, 'weight_decay': 1.1364880863583982e-05, 'beta_0': 0.8000620379170624, 'beta_1': 0.9985087525953016, 'epsilon': 3.3377821583666894e-08, 'balanced_loss': False, 'epochs': 185, 'early_stopping_patience': 25, 'plateau_patience': 18, 'plateau_divider': 6}. Best is trial 84 with value: 0.9212121212121213.
[I 2024-11-23 00:58:39,905] Trial 97 finished with value: 0.8909090909090909 and parameters: {'left_stride': 0, 'right_stride': 64, 'attention_pooling_operation': 'mean', 'embedding_pooling_operation': 'max', 'threshold': 0.990033077438328, 'batch_size': 64, 'attention_heads': 7, 'hidden_dimension': 105, 'number_of_hidden_layers': 4, 'dropout_rate': 0.36580856529838807, 'global_pooling': 'mean', 'learning_rate': 0.0009832698668738257, 'weight_decay': 1.3673665087449677e-05, 'beta_0': 0.8020501523343904, 'beta_1': 0.9980631349073877, 'epsilon': 5.098782467002563e-08, 'balanced_loss': False, 'epochs': 200, 'early_stopping_patience': 25, 'plateau_patience': 17, 'plateau_divider': 6}. Best is trial 84 with value: 0.9212121212121213.
[I 2024-11-23 01:14:38,952] Trial 98 finished with value: 0.896969696969697 and parameters: {'left_stride': 0, 'right_stride': 64, 'attention_pooling_operation': 'mean', 'embedding_pooling_operation': 'max', 'threshold': 0.981837748251621, 'batch_size': 61, 'attention_heads': 6, 'hidden_dimension': 89, 'number_of_hidden_layers': 4, 'dropout_rate': 0.411858678666976, 'global_pooling': 'mean', 'learning_rate': 0.00045019728440349386, 'weight_decay': 1.4862450145429521e-05, 'beta_0': 0.8043825491918392, 'beta_1': 0.9989954101670446, 'epsilon': 9.622564235274093e-08, 'balanced_loss': False, 'epochs': 193, 'early_stopping_patience': 25, 'plateau_patience': 17, 'plateau_divider': 7}. Best is trial 84 with value: 0.9212121212121213.
CUDA out of memory. Tried to allocate 2.31 GiB. GPU 0 has a total capacity of 44.56 GiB of which 1.00 GiB is free. Including non-PyTorch memory, this process has 43.55 GiB memory in use. Of the allocated memory 38.89 GiB is allocated by PyTorch, and 3.51 GiB is reserved by PyTorch but unallocated. If reserved but unallocated memory is large try setting PYTORCH_CUDA_ALLOC_CONF=expandable_segments:True to avoid fragmentation.  See documentation for Memory Management  (https://pytorch.org/docs/stable/notes/cuda.html#environment-variables)
[I 2024-11-23 01:32:23,439] Trial 99 finished with value: -1.0 and parameters: {'left_stride': 128, 'right_stride': 256, 'attention_pooling_operation': 'mean', 'embedding_pooling_operation': 'max', 'threshold': 0.9686077634253698, 'batch_size': 64, 'attention_heads': 5, 'hidden_dimension': 69, 'number_of_hidden_layers': 4, 'dropout_rate': 0.4265926619199176, 'global_pooling': 'mean', 'learning_rate': 0.0007373325321260112, 'weight_decay': 9.260444528553578e-06, 'beta_0': 0.8015331233646765, 'beta_1': 0.9985076916051507, 'epsilon': 2.0702640658289714e-07, 'balanced_loss': False, 'epochs': 189, 'early_stopping_patience': 25, 'plateau_patience': 19, 'plateau_divider': 2}. Best is trial 84 with value: 0.9212121212121213.
CUDA out of memory. Tried to allocate 2.15 GiB. GPU 0 has a total capacity of 44.56 GiB of which 98.69 MiB is free. Including non-PyTorch memory, this process has 44.46 GiB memory in use. Of the allocated memory 41.56 GiB is allocated by PyTorch, and 1.75 GiB is reserved by PyTorch but unallocated. If reserved but unallocated memory is large try setting PYTORCH_CUDA_ALLOC_CONF=expandable_segments:True to avoid fragmentation.  See documentation for Memory Management  (https://pytorch.org/docs/stable/notes/cuda.html#environment-variables)
[I 2024-11-23 01:45:49,632] Trial 100 finished with value: -1.0 and parameters: {'left_stride': 32, 'right_stride': 64, 'attention_pooling_operation': 'mean', 'embedding_pooling_operation': 'max', 'threshold': 0.9797596900586703, 'batch_size': 63, 'attention_heads': 8, 'hidden_dimension': 85, 'number_of_hidden_layers': 4, 'dropout_rate': 0.5653336287907684, 'global_pooling': 'mean', 'learning_rate': 0.000345631729545555, 'weight_decay': 2.100340977078812e-05, 'beta_0': 0.8043779859470646, 'beta_1': 0.9981746215280789, 'epsilon': 6.702758828945735e-08, 'balanced_loss': False, 'epochs': 191, 'early_stopping_patience': 25, 'plateau_patience': 18, 'plateau_divider': 7}. Best is trial 84 with value: 0.9212121212121213.
CUDA out of memory. Tried to allocate 2.97 GiB. GPU 0 has a total capacity of 44.56 GiB of which 1.07 GiB is free. Including non-PyTorch memory, this process has 43.49 GiB memory in use. Of the allocated memory 41.10 GiB is allocated by PyTorch, and 1.24 GiB is reserved by PyTorch but unallocated. If reserved but unallocated memory is large try setting PYTORCH_CUDA_ALLOC_CONF=expandable_segments:True to avoid fragmentation.  See documentation for Memory Management  (https://pytorch.org/docs/stable/notes/cuda.html#environment-variables)
[I 2024-11-23 01:58:49,637] Trial 101 finished with value: -1.0 and parameters: {'left_stride': 0, 'right_stride': 64, 'attention_pooling_operation': 'mean', 'embedding_pooling_operation': 'max', 'threshold': 0.9631143854281345, 'batch_size': 60, 'attention_heads': 5, 'hidden_dimension': 113, 'number_of_hidden_layers': 4, 'dropout_rate': 0.3493065568758581, 'global_pooling': 'mean', 'learning_rate': 0.0020811602650498595, 'weight_decay': 1.220139067526246e-05, 'beta_0': 0.8105495099480456, 'beta_1': 0.997547383028748, 'epsilon': 1.1105238381003474e-07, 'balanced_loss': False, 'epochs': 180, 'early_stopping_patience': 24, 'plateau_patience': 17, 'plateau_divider': 5}. Best is trial 84 with value: 0.9212121212121213.
[I 2024-11-23 02:14:16,019] Trial 102 finished with value: 0.9030303030303031 and parameters: {'left_stride': 0, 'right_stride': 64, 'attention_pooling_operation': 'mean', 'embedding_pooling_operation': 'max', 'threshold': 0.9769571316539676, 'batch_size': 35, 'attention_heads': 6, 'hidden_dimension': 99, 'number_of_hidden_layers': 4, 'dropout_rate': 0.36000633544193594, 'global_pooling': 'mean', 'learning_rate': 0.0009309926699845499, 'weight_decay': 2.630620795192151e-05, 'beta_0': 0.8057267298220715, 'beta_1': 0.9987135139888023, 'epsilon': 3.867924971951029e-08, 'balanced_loss': False, 'epochs': 170, 'early_stopping_patience': 17, 'plateau_patience': 15, 'plateau_divider': 6}. Best is trial 84 with value: 0.9212121212121213.
CUDA out of memory. Tried to allocate 2.04 GiB. GPU 0 has a total capacity of 44.56 GiB of which 1.98 GiB is free. Including non-PyTorch memory, this process has 42.57 GiB memory in use. Of the allocated memory 39.48 GiB is allocated by PyTorch, and 1.94 GiB is reserved by PyTorch but unallocated. If reserved but unallocated memory is large try setting PYTORCH_CUDA_ALLOC_CONF=expandable_segments:True to avoid fragmentation.  See documentation for Memory Management  (https://pytorch.org/docs/stable/notes/cuda.html#environment-variables)
[I 2024-11-23 02:27:14,614] Trial 103 finished with value: -1.0 and parameters: {'left_stride': 0, 'right_stride': 64, 'attention_pooling_operation': 'mean', 'embedding_pooling_operation': 'max', 'threshold': 0.973078613292018, 'batch_size': 61, 'attention_heads': 5, 'hidden_dimension': 105, 'number_of_hidden_layers': 4, 'dropout_rate': 0.34562938986198893, 'global_pooling': 'mean', 'learning_rate': 0.0006251919262235448, 'weight_decay': 8.991763717728367e-06, 'beta_0': 0.8037383442481145, 'beta_1': 0.9979674123268628, 'epsilon': 2.752902478654659e-07, 'balanced_loss': False, 'epochs': 134, 'early_stopping_patience': 25, 'plateau_patience': 17, 'plateau_divider': 8}. Best is trial 84 with value: 0.9212121212121213.
[I 2024-11-23 02:42:30,836] Trial 104 finished with value: 0.9090909090909091 and parameters: {'left_stride': 0, 'right_stride': 64, 'attention_pooling_operation': 'mean', 'embedding_pooling_operation': 'max', 'threshold': 0.9898856491391937, 'batch_size': 59, 'attention_heads': 6, 'hidden_dimension': 120, 'number_of_hidden_layers': 4, 'dropout_rate': 0.37594784586481744, 'global_pooling': 'mean', 'learning_rate': 0.0008037051328993801, 'weight_decay': 0.0004013962234652322, 'beta_0': 0.8015749299849163, 'beta_1': 0.9952309409770371, 'epsilon': 1.7863771132553414e-08, 'balanced_loss': False, 'epochs': 186, 'early_stopping_patience': 23, 'plateau_patience': 15, 'plateau_divider': 8}. Best is trial 84 with value: 0.9212121212121213.
CUDA out of memory. Tried to allocate 2.12 GiB. GPU 0 has a total capacity of 44.56 GiB of which 636.69 MiB is free. Including non-PyTorch memory, this process has 43.93 GiB memory in use. Of the allocated memory 39.10 GiB is allocated by PyTorch, and 3.69 GiB is reserved by PyTorch but unallocated. If reserved but unallocated memory is large try setting PYTORCH_CUDA_ALLOC_CONF=expandable_segments:True to avoid fragmentation.  See documentation for Memory Management  (https://pytorch.org/docs/stable/notes/cuda.html#environment-variables)
[I 2024-11-23 02:51:01,129] Trial 105 finished with value: -1.0 and parameters: {'left_stride': 0, 'right_stride': 64, 'attention_pooling_operation': 'min', 'embedding_pooling_operation': 'max', 'threshold': 0.9011305826704028, 'batch_size': 63, 'attention_heads': 6, 'hidden_dimension': 91, 'number_of_hidden_layers': 4, 'dropout_rate': 0.3851824147087519, 'global_pooling': 'mean', 'learning_rate': 0.0005029340527732383, 'weight_decay': 0.0005688797852996322, 'beta_0': 0.8001913198951592, 'beta_1': 0.9951317574580898, 'epsilon': 5.185988418813676e-08, 'balanced_loss': False, 'epochs': 196, 'early_stopping_patience': 23, 'plateau_patience': 21, 'plateau_divider': 8}. Best is trial 84 with value: 0.9212121212121213.
[I 2024-11-23 03:08:13,110] Trial 106 finished with value: 0.8787878787878788 and parameters: {'left_stride': 0, 'right_stride': 128, 'attention_pooling_operation': 'mean', 'embedding_pooling_operation': 'max', 'threshold': 0.9902399170000498, 'batch_size': 59, 'attention_heads': 6, 'hidden_dimension': 119, 'number_of_hidden_layers': 4, 'dropout_rate': 0.3753456963958663, 'global_pooling': 'sum', 'learning_rate': 0.0010647400769329765, 'weight_decay': 1.7619855266801508e-05, 'beta_0': 0.8024014848134857, 'beta_1': 0.9962621025192451, 'epsilon': 1.1544803652297098e-08, 'balanced_loss': False, 'epochs': 187, 'early_stopping_patience': 23, 'plateau_patience': 14, 'plateau_divider': 3}. Best is trial 84 with value: 0.9212121212121213.
[I 2024-11-23 03:23:44,627] Trial 107 finished with value: 0.8666666666666667 and parameters: {'left_stride': 128, 'right_stride': 64, 'attention_pooling_operation': 'mean', 'embedding_pooling_operation': 'mean', 'threshold': 0.9977896236835458, 'batch_size': 56, 'attention_heads': 7, 'hidden_dimension': 64, 'number_of_hidden_layers': 4, 'dropout_rate': 0.4793943856113734, 'global_pooling': 'mean', 'learning_rate': 0.0008404376447414222, 'weight_decay': 0.00012634743623720954, 'beta_0': 0.8096767326929937, 'beta_1': 0.9929063767612567, 'epsilon': 1.7086452466071098e-08, 'balanced_loss': False, 'epochs': 182, 'early_stopping_patience': 25, 'plateau_patience': 15, 'plateau_divider': 8}. Best is trial 84 with value: 0.9212121212121213.
[I 2024-11-23 03:42:24,874] Trial 108 finished with value: 0.896969696969697 and parameters: {'left_stride': 256, 'right_stride': 64, 'attention_pooling_operation': 'mean', 'embedding_pooling_operation': 'max', 'threshold': 0.983373480104857, 'batch_size': 41, 'attention_heads': 6, 'hidden_dimension': 78, 'number_of_hidden_layers': 3, 'dropout_rate': 0.39612782785343664, 'global_pooling': 'mean', 'learning_rate': 0.0006927651345242934, 'weight_decay': 5.718251929404715e-05, 'beta_0': 0.806458224502133, 'beta_1': 0.9817159098758174, 'epsilon': 2.0746672355881093e-08, 'balanced_loss': False, 'epochs': 128, 'early_stopping_patience': 24, 'plateau_patience': 18, 'plateau_divider': 4}. Best is trial 84 with value: 0.9212121212121213.
[I 2024-11-23 03:59:40,502] Trial 109 finished with value: 0.896969696969697 and parameters: {'left_stride': 0, 'right_stride': 32, 'attention_pooling_operation': 'mean', 'embedding_pooling_operation': 'max', 'threshold': 0.9944233782242108, 'batch_size': 62, 'attention_heads': 15, 'hidden_dimension': 97, 'number_of_hidden_layers': 4, 'dropout_rate': 0.3902847191006977, 'global_pooling': 'mean', 'learning_rate': 0.0011924163564551846, 'weight_decay': 0.00021672859823865733, 'beta_0': 0.8175734594298675, 'beta_1': 0.9891979265449634, 'epsilon': 3.175935280755959e-08, 'balanced_loss': False, 'epochs': 166, 'early_stopping_patience': 18, 'plateau_patience': 15, 'plateau_divider': 9}. Best is trial 84 with value: 0.9212121212121213.
[I 2024-11-23 04:16:10,182] Trial 110 finished with value: 0.896969696969697 and parameters: {'left_stride': 32, 'right_stride': 64, 'attention_pooling_operation': 'mean', 'embedding_pooling_operation': 'min', 'threshold': 0.9789754763218188, 'batch_size': 61, 'attention_heads': 5, 'hidden_dimension': 104, 'number_of_hidden_layers': 3, 'dropout_rate': 0.3370228891456061, 'global_pooling': 'mean', 'learning_rate': 0.0032425577630068895, 'weight_decay': 0.0002992229769474289, 'beta_0': 0.8114857222598677, 'beta_1': 0.9972682614088542, 'epsilon': 1.4280641509990208e-08, 'balanced_loss': False, 'epochs': 180, 'early_stopping_patience': 24, 'plateau_patience': 16, 'plateau_divider': 7}. Best is trial 84 with value: 0.9212121212121213.
[I 2024-11-23 04:32:17,300] Trial 111 finished with value: 0.896969696969697 and parameters: {'left_stride': 0, 'right_stride': 64, 'attention_pooling_operation': 'mean', 'embedding_pooling_operation': 'max', 'threshold': 0.9849982359122659, 'batch_size': 58, 'attention_heads': 5, 'hidden_dimension': 128, 'number_of_hidden_layers': 4, 'dropout_rate': 0.3679939314156953, 'global_pooling': 'mean', 'learning_rate': 0.002451779686629077, 'weight_decay': 7.269878566298573e-06, 'beta_0': 0.8017013994122489, 'beta_1': 0.9989651576988483, 'epsilon': 8.261920403438704e-08, 'balanced_loss': False, 'epochs': 174, 'early_stopping_patience': 24, 'plateau_patience': 17, 'plateau_divider': 8}. Best is trial 84 with value: 0.9212121212121213.
[I 2024-11-23 04:48:12,100] Trial 112 finished with value: 0.8909090909090909 and parameters: {'left_stride': 0, 'right_stride': 64, 'attention_pooling_operation': 'mean', 'embedding_pooling_operation': 'max', 'threshold': 0.9914277622765753, 'batch_size': 54, 'attention_heads': 7, 'hidden_dimension': 114, 'number_of_hidden_layers': 4, 'dropout_rate': 0.45855373036544217, 'global_pooling': 'mean', 'learning_rate': 0.001842621236890539, 'weight_decay': 1.9448328846407164e-05, 'beta_0': 0.8044329033938602, 'beta_1': 0.9984124909247984, 'epsilon': 1.7389959775207876e-05, 'balanced_loss': False, 'epochs': 192, 'early_stopping_patience': 23, 'plateau_patience': 16, 'plateau_divider': 8}. Best is trial 84 with value: 0.9212121212121213.
[I 2024-11-23 05:03:58,893] Trial 113 finished with value: 0.9030303030303031 and parameters: {'left_stride': 0, 'right_stride': 64, 'attention_pooling_operation': 'mean', 'embedding_pooling_operation': 'max', 'threshold': 0.9888902321014887, 'batch_size': 59, 'attention_heads': 5, 'hidden_dimension': 107, 'number_of_hidden_layers': 4, 'dropout_rate': 0.3622029068784878, 'global_pooling': 'mean', 'learning_rate': 0.0017006811311286523, 'weight_decay': 5.773953845172837e-06, 'beta_0': 0.8133160567814042, 'beta_1': 0.9978149218954597, 'epsilon': 1.3501514779609494e-06, 'balanced_loss': False, 'epochs': 186, 'early_stopping_patience': 25, 'plateau_patience': 15, 'plateau_divider': 8}. Best is trial 84 with value: 0.9212121212121213.
CUDA out of memory. Tried to allocate 2.61 GiB. GPU 0 has a total capacity of 44.56 GiB of which 2.39 GiB is free. Including non-PyTorch memory, this process has 42.17 GiB memory in use. Of the allocated memory 39.12 GiB is allocated by PyTorch, and 1.90 GiB is reserved by PyTorch but unallocated. If reserved but unallocated memory is large try setting PYTORCH_CUDA_ALLOC_CONF=expandable_segments:True to avoid fragmentation.  See documentation for Memory Management  (https://pytorch.org/docs/stable/notes/cuda.html#environment-variables)
[I 2024-11-23 05:17:05,164] Trial 114 finished with value: -1.0 and parameters: {'left_stride': 0, 'right_stride': 64, 'attention_pooling_operation': 'mean', 'embedding_pooling_operation': 'max', 'threshold': 0.9824559348100362, 'batch_size': 64, 'attention_heads': 8, 'hidden_dimension': 123, 'number_of_hidden_layers': 4, 'dropout_rate': 0.4053489767737247, 'global_pooling': 'mean', 'learning_rate': 0.0008013374677895731, 'weight_decay': 9.785423999797068e-06, 'beta_0': 0.846276843177124, 'beta_1': 0.9962433797909492, 'epsilon': 1.0775291836258553e-05, 'balanced_loss': False, 'epochs': 162, 'early_stopping_patience': 19, 'plateau_patience': 14, 'plateau_divider': 8}. Best is trial 84 with value: 0.9212121212121213.
[I 2024-11-23 05:33:59,412] Trial 115 finished with value: 0.9090909090909091 and parameters: {'left_stride': 0, 'right_stride': 64, 'attention_pooling_operation': 'mean', 'embedding_pooling_operation': 'max', 'threshold': 0.9862682350920727, 'batch_size': 56, 'attention_heads': 6, 'hidden_dimension': 120, 'number_of_hidden_layers': 4, 'dropout_rate': 0.4154776446075988, 'global_pooling': 'mean', 'learning_rate': 0.0005460962278274912, 'weight_decay': 1.564396954614277e-05, 'beta_0': 0.8073499334003825, 'beta_1': 0.9970648179442785, 'epsilon': 8.75390662615487e-06, 'balanced_loss': False, 'epochs': 171, 'early_stopping_patience': 24, 'plateau_patience': 16, 'plateau_divider': 8}. Best is trial 84 with value: 0.9212121212121213.
CUDA out of memory. Tried to allocate 9.08 GiB. GPU 0 has a total capacity of 44.56 GiB of which 5.98 GiB is free. Including non-PyTorch memory, this process has 38.58 GiB memory in use. Of the allocated memory 34.65 GiB is allocated by PyTorch, and 2.78 GiB is reserved by PyTorch but unallocated. If reserved but unallocated memory is large try setting PYTORCH_CUDA_ALLOC_CONF=expandable_segments:True to avoid fragmentation.  See documentation for Memory Management  (https://pytorch.org/docs/stable/notes/cuda.html#environment-variables)
[I 2024-11-23 05:47:05,669] Trial 116 finished with value: -1.0 and parameters: {'left_stride': 0, 'right_stride': 64, 'attention_pooling_operation': 'mean', 'embedding_pooling_operation': 'max', 'threshold': 0.9198015443262135, 'batch_size': 57, 'attention_heads': 7, 'hidden_dimension': 120, 'number_of_hidden_layers': 4, 'dropout_rate': 0.44126289779263167, 'global_pooling': 'max', 'learning_rate': 0.0004022214236393229, 'weight_decay': 1.521243689036577e-05, 'beta_0': 0.8078457101161584, 'beta_1': 0.9971129627215969, 'epsilon': 1.1643831175860239e-07, 'balanced_loss': False, 'epochs': 159, 'early_stopping_patience': 25, 'plateau_patience': 17, 'plateau_divider': 7}. Best is trial 84 with value: 0.9212121212121213.
[I 2024-11-23 06:06:21,869] Trial 117 finished with value: 0.9090909090909091 and parameters: {'left_stride': 128, 'right_stride': 128, 'attention_pooling_operation': 'mean', 'embedding_pooling_operation': 'max', 'threshold': 0.9811482861733793, 'batch_size': 52, 'attention_heads': 6, 'hidden_dimension': 84, 'number_of_hidden_layers': 4, 'dropout_rate': 0.3803472289758212, 'global_pooling': 'mean', 'learning_rate': 0.0005053077409253656, 'weight_decay': 2.4367358194045238e-05, 'beta_0': 0.8031877225043815, 'beta_1': 0.9948317430907678, 'epsilon': 9.026921710929395e-06, 'balanced_loss': False, 'epochs': 152, 'early_stopping_patience': 24, 'plateau_patience': 16, 'plateau_divider': 9}. Best is trial 84 with value: 0.9212121212121213.
