[I 2024-11-28 06:11:15,839] A new study created in RDB with name: IMDb-top_1000-GATv2-google-bert-bert-base-uncased-Grouped-Global_Aggregation
Token indices sequence length is longer than the specified maximum sequence length for this model (1147 > 512). Running this sequence through the model will result in indexing errors
[I 2024-11-28 06:21:35,476] Trial 0 finished with value: 0.7333333333333333 and parameters: {'left_stride': 32, 'right_stride': 64, 'attention_pooling_operation': 'mean', 'embedding_pooling_operation': 'min', 'threshold': 0.9304211818735242, 'batch_size': 41, 'attention_heads': 9, 'hidden_dimension': 97, 'number_of_hidden_layers': 3, 'dropout_rate': 0.34184815819561254, 'global_pooling': 'max', 'learning_rate': 0.013826232179369865, 'weight_decay': 3.972110727381911e-06, 'beta_0': 0.849951952030185, 'beta_1': 0.9912118037965686, 'epsilon': 1.5339162591163588e-08, 'balanced_loss': True, 'epochs': 59, 'early_stopping_patience': 25, 'plateau_patience': 25, 'plateau_divider': 9}. Best is trial 0 with value: 0.7333333333333333.
[I 2024-11-28 06:27:29,657] Trial 1 finished with value: 0.8303030303030303 and parameters: {'left_stride': 64, 'right_stride': 64, 'attention_pooling_operation': 'max', 'embedding_pooling_operation': 'mean', 'threshold': 0.9939404991670033, 'batch_size': 59, 'attention_heads': 11, 'hidden_dimension': 239, 'number_of_hidden_layers': 0, 'dropout_rate': 0.35879485872574357, 'global_pooling': 'max', 'learning_rate': 0.00012172958098369953, 'weight_decay': 0.0003063462210622083, 'beta_0': 0.834331843801655, 'beta_1': 0.9853009566677808, 'epsilon': 1.4817820606039087e-06, 'balanced_loss': False, 'epochs': 61, 'early_stopping_patience': 25, 'plateau_patience': 22, 'plateau_divider': 3}. Best is trial 1 with value: 0.8303030303030303.
[I 2024-11-28 06:33:09,972] Trial 2 finished with value: 0.8666666666666667 and parameters: {'left_stride': 32, 'right_stride': 128, 'attention_pooling_operation': 'min', 'embedding_pooling_operation': 'mean', 'threshold': 0.988712402130207, 'batch_size': 39, 'attention_heads': 5, 'hidden_dimension': 192, 'number_of_hidden_layers': 3, 'dropout_rate': 0.46838315927084884, 'global_pooling': 'mean', 'learning_rate': 0.0005130551760589835, 'weight_decay': 1.1919481947918734e-06, 'beta_0': 0.8102310933924105, 'beta_1': 0.98059161803998, 'epsilon': 3.512704726270843e-06, 'balanced_loss': False, 'epochs': 187, 'early_stopping_patience': 13, 'plateau_patience': 16, 'plateau_divider': 8}. Best is trial 2 with value: 0.8666666666666667.
[I 2024-11-28 06:42:56,305] Trial 3 finished with value: 0.8909090909090909 and parameters: {'left_stride': 256, 'right_stride': 64, 'attention_pooling_operation': 'min', 'embedding_pooling_operation': 'min', 'threshold': 0.9227912369025688, 'batch_size': 36, 'attention_heads': 14, 'hidden_dimension': 225, 'number_of_hidden_layers': 0, 'dropout_rate': 0.4532241907732697, 'global_pooling': 'mean', 'learning_rate': 0.00022410971619109496, 'weight_decay': 0.0006741074265640696, 'beta_0': 0.8310413476654125, 'beta_1': 0.9898114758541204, 'epsilon': 6.487477066058673e-06, 'balanced_loss': False, 'epochs': 195, 'early_stopping_patience': 14, 'plateau_patience': 17, 'plateau_divider': 4}. Best is trial 3 with value: 0.8909090909090909.
[I 2024-11-28 06:49:12,802] Trial 4 finished with value: 0.8727272727272727 and parameters: {'left_stride': 64, 'right_stride': 32, 'attention_pooling_operation': 'min', 'embedding_pooling_operation': 'min', 'threshold': 0.9367746354405981, 'batch_size': 46, 'attention_heads': 12, 'hidden_dimension': 152, 'number_of_hidden_layers': 0, 'dropout_rate': 0.5505907486767714, 'global_pooling': 'mean', 'learning_rate': 0.002309786149269356, 'weight_decay': 0.00010781845035122267, 'beta_0': 0.8015645397505602, 'beta_1': 0.9896841863656863, 'epsilon': 8.053471030316087e-08, 'balanced_loss': True, 'epochs': 154, 'early_stopping_patience': 16, 'plateau_patience': 24, 'plateau_divider': 3}. Best is trial 3 with value: 0.8909090909090909.
CUDA out of memory. Tried to allocate 2.68 GiB. GPU 0 has a total capacity of 44.56 GiB of which 2.19 GiB is free. Including non-PyTorch memory, this process has 42.37 GiB memory in use. Of the allocated memory 40.24 GiB is allocated by PyTorch, and 1000.10 MiB is reserved by PyTorch but unallocated. If reserved but unallocated memory is large try setting PYTORCH_CUDA_ALLOC_CONF=expandable_segments:True to avoid fragmentation.  See documentation for Memory Management  (https://pytorch.org/docs/stable/notes/cuda.html#environment-variables)
[I 2024-11-28 06:54:05,758] Trial 5 finished with value: -1.0 and parameters: {'left_stride': 64, 'right_stride': 32, 'attention_pooling_operation': 'max', 'embedding_pooling_operation': 'min', 'threshold': 0.9725883083302352, 'batch_size': 59, 'attention_heads': 15, 'hidden_dimension': 207, 'number_of_hidden_layers': 3, 'dropout_rate': 0.3252419894985146, 'global_pooling': 'sum', 'learning_rate': 1.0883991813938131e-05, 'weight_decay': 2.015647705936503e-06, 'beta_0': 0.8650272248026284, 'beta_1': 0.9800952543380481, 'epsilon': 4.397766894483953e-08, 'balanced_loss': False, 'epochs': 148, 'early_stopping_patience': 13, 'plateau_patience': 21, 'plateau_divider': 4}. Best is trial 3 with value: 0.8909090909090909.
[I 2024-11-28 07:01:18,147] Trial 6 finished with value: 0.703030303030303 and parameters: {'left_stride': 128, 'right_stride': 0, 'attention_pooling_operation': 'min', 'embedding_pooling_operation': 'mean', 'threshold': 0.9576846194237897, 'batch_size': 40, 'attention_heads': 6, 'hidden_dimension': 194, 'number_of_hidden_layers': 1, 'dropout_rate': 0.30729478992943615, 'global_pooling': 'max', 'learning_rate': 0.06542056762893128, 'weight_decay': 0.0005553837526912237, 'beta_0': 0.8356502322469728, 'beta_1': 0.9802909082956842, 'epsilon': 5.167425813322413e-05, 'balanced_loss': False, 'epochs': 195, 'early_stopping_patience': 23, 'plateau_patience': 14, 'plateau_divider': 5}. Best is trial 3 with value: 0.8909090909090909.
The selected strides are greater or equal to the total chunk size.
[I 2024-11-28 07:01:18,834] Trial 7 finished with value: -1.0 and parameters: {'left_stride': 256, 'right_stride': 256, 'attention_pooling_operation': 'max', 'embedding_pooling_operation': 'min', 'threshold': 0.9359455202104634, 'batch_size': 30, 'attention_heads': 14, 'hidden_dimension': 214, 'number_of_hidden_layers': 4, 'dropout_rate': 0.5739721657669414, 'global_pooling': 'max', 'learning_rate': 0.0039797493741031125, 'weight_decay': 0.0001276146788173022, 'beta_0': 0.8786113098385785, 'beta_1': 0.996892198716152, 'epsilon': 2.248954284391446e-07, 'balanced_loss': True, 'epochs': 137, 'early_stopping_patience': 10, 'plateau_patience': 17, 'plateau_divider': 6}. Best is trial 3 with value: 0.8909090909090909.
[I 2024-11-28 07:09:18,654] Trial 8 finished with value: 0.5333333333333333 and parameters: {'left_stride': 256, 'right_stride': 128, 'attention_pooling_operation': 'min', 'embedding_pooling_operation': 'max', 'threshold': 0.9726018724589289, 'batch_size': 63, 'attention_heads': 10, 'hidden_dimension': 104, 'number_of_hidden_layers': 3, 'dropout_rate': 0.38124967537862225, 'global_pooling': 'mean', 'learning_rate': 0.07089141723796885, 'weight_decay': 0.0003220626495993124, 'beta_0': 0.8683420313684149, 'beta_1': 0.9877260389162159, 'epsilon': 4.933751600448336e-08, 'balanced_loss': False, 'epochs': 132, 'early_stopping_patience': 21, 'plateau_patience': 20, 'plateau_divider': 4}. Best is trial 3 with value: 0.8909090909090909.
[I 2024-11-28 07:15:12,724] Trial 9 finished with value: 0.8787878787878788 and parameters: {'left_stride': 0, 'right_stride': 64, 'attention_pooling_operation': 'max', 'embedding_pooling_operation': 'min', 'threshold': 0.9491566713529321, 'batch_size': 39, 'attention_heads': 6, 'hidden_dimension': 129, 'number_of_hidden_layers': 1, 'dropout_rate': 0.48475502941566495, 'global_pooling': 'mean', 'learning_rate': 0.003187422711813414, 'weight_decay': 3.2315343430749745e-05, 'beta_0': 0.8849150937783302, 'beta_1': 0.9924741264147013, 'epsilon': 4.484744524732786e-08, 'balanced_loss': False, 'epochs': 54, 'early_stopping_patience': 19, 'plateau_patience': 25, 'plateau_divider': 7}. Best is trial 3 with value: 0.8909090909090909.
[I 2024-11-28 07:24:35,538] Trial 10 finished with value: 0.8727272727272727 and parameters: {'left_stride': 256, 'right_stride': 0, 'attention_pooling_operation': 'mean', 'embedding_pooling_operation': 'max', 'threshold': 0.9018707763297794, 'batch_size': 17, 'attention_heads': 16, 'hidden_dimension': 48, 'number_of_hidden_layers': 1, 'dropout_rate': 0.41388127302606703, 'global_pooling': 'sum', 'learning_rate': 5.8264711350987226e-05, 'weight_decay': 9.371501314649858e-06, 'beta_0': 0.8199436502427444, 'beta_1': 0.9986215180289472, 'epsilon': 1.5255235349194254e-05, 'balanced_loss': True, 'epochs': 88, 'early_stopping_patience': 16, 'plateau_patience': 10, 'plateau_divider': 2}. Best is trial 3 with value: 0.8909090909090909.
[I 2024-11-28 07:32:12,005] Trial 11 finished with value: 0.8909090909090909 and parameters: {'left_stride': 0, 'right_stride': 64, 'attention_pooling_operation': 'max', 'embedding_pooling_operation': 'min', 'threshold': 0.9121285127504196, 'batch_size': 29, 'attention_heads': 8, 'hidden_dimension': 147, 'number_of_hidden_layers': 1, 'dropout_rate': 0.469311003804919, 'global_pooling': 'mean', 'learning_rate': 0.0005096820308190229, 'weight_decay': 2.4104707065043276e-05, 'beta_0': 0.8994794194881102, 'beta_1': 0.9935241326149981, 'epsilon': 3.349956971576618e-07, 'balanced_loss': False, 'epochs': 114, 'early_stopping_patience': 19, 'plateau_patience': 13, 'plateau_divider': 7}. Best is trial 3 with value: 0.8909090909090909.
[I 2024-11-28 07:38:57,063] Trial 12 finished with value: 0.8727272727272727 and parameters: {'left_stride': 0, 'right_stride': 64, 'attention_pooling_operation': 'max', 'embedding_pooling_operation': 'min', 'threshold': 0.906598695299297, 'batch_size': 25, 'attention_heads': 8, 'hidden_dimension': 160, 'number_of_hidden_layers': 0, 'dropout_rate': 0.5107448673793068, 'global_pooling': 'mean', 'learning_rate': 0.000290737662667635, 'weight_decay': 1.5678299738104753e-05, 'beta_0': 0.8486444431924708, 'beta_1': 0.9946444806839707, 'epsilon': 5.081105718586446e-07, 'balanced_loss': False, 'epochs': 102, 'early_stopping_patience': 18, 'plateau_patience': 13, 'plateau_divider': 10}. Best is trial 3 with value: 0.8909090909090909.
CUDA out of memory. Tried to allocate 4.42 GiB. GPU 0 has a total capacity of 44.56 GiB of which 4.37 GiB is free. Including non-PyTorch memory, this process has 40.18 GiB memory in use. Of the allocated memory 38.69 GiB is allocated by PyTorch, and 351.72 MiB is reserved by PyTorch but unallocated. If reserved but unallocated memory is large try setting PYTORCH_CUDA_ALLOC_CONF=expandable_segments:True to avoid fragmentation.  See documentation for Memory Management  (https://pytorch.org/docs/stable/notes/cuda.html#environment-variables)
[I 2024-11-28 07:43:51,522] Trial 13 finished with value: -1.0 and parameters: {'left_stride': 0, 'right_stride': 64, 'attention_pooling_operation': 'min', 'embedding_pooling_operation': 'min', 'threshold': 0.9173410944096023, 'batch_size': 28, 'attention_heads': 13, 'hidden_dimension': 256, 'number_of_hidden_layers': 1, 'dropout_rate': 0.4279039998282282, 'global_pooling': 'mean', 'learning_rate': 5.3089503271011466e-05, 'weight_decay': 2.83305504884095e-05, 'beta_0': 0.8279942679303411, 'beta_1': 0.9865915641172548, 'epsilon': 6.631389926381584e-06, 'balanced_loss': False, 'epochs': 169, 'early_stopping_patience': 14, 'plateau_patience': 11, 'plateau_divider': 6}. Best is trial 3 with value: 0.8909090909090909.
[I 2024-11-28 07:52:37,193] Trial 14 finished with value: 0.896969696969697 and parameters: {'left_stride': 128, 'right_stride': 256, 'attention_pooling_operation': 'mean', 'embedding_pooling_operation': 'max', 'threshold': 0.9195686988768934, 'batch_size': 49, 'attention_heads': 8, 'hidden_dimension': 41, 'number_of_hidden_layers': 2, 'dropout_rate': 0.5182611788035248, 'global_pooling': 'mean', 'learning_rate': 0.0007399715115198294, 'weight_decay': 6.455401918095674e-05, 'beta_0': 0.8980212771528688, 'beta_1': 0.9935805738590399, 'epsilon': 1.5255719781330334e-06, 'balanced_loss': False, 'epochs': 105, 'early_stopping_patience': 20, 'plateau_patience': 14, 'plateau_divider': 7}. Best is trial 14 with value: 0.896969696969697.
[I 2024-11-28 08:01:33,979] Trial 15 finished with value: 0.8787878787878788 and parameters: {'left_stride': 128, 'right_stride': 256, 'attention_pooling_operation': 'mean', 'embedding_pooling_operation': 'max', 'threshold': 0.9235342986428065, 'batch_size': 48, 'attention_heads': 12, 'hidden_dimension': 44, 'number_of_hidden_layers': 2, 'dropout_rate': 0.5267920110111541, 'global_pooling': 'mean', 'learning_rate': 0.0013274690861300312, 'weight_decay': 0.0008826247294928965, 'beta_0': 0.8981752259338325, 'beta_1': 0.9842694988011573, 'epsilon': 9.935138101942618e-05, 'balanced_loss': False, 'epochs': 79, 'early_stopping_patience': 10, 'plateau_patience': 19, 'plateau_divider': 5}. Best is trial 14 with value: 0.896969696969697.
[I 2024-11-28 08:10:08,537] Trial 16 finished with value: 0.5333333333333333 and parameters: {'left_stride': 128, 'right_stride': 256, 'attention_pooling_operation': 'mean', 'embedding_pooling_operation': 'max', 'threshold': 0.9470137890231193, 'batch_size': 51, 'attention_heads': 4, 'hidden_dimension': 69, 'number_of_hidden_layers': 2, 'dropout_rate': 0.5982864433547647, 'global_pooling': 'sum', 'learning_rate': 1.4341754109660819e-05, 'weight_decay': 9.227225374356018e-05, 'beta_0': 0.8575906084551044, 'beta_1': 0.9954821289374454, 'epsilon': 1.7112945204463068e-06, 'balanced_loss': False, 'epochs': 113, 'early_stopping_patience': 21, 'plateau_patience': 15, 'plateau_divider': 8}. Best is trial 14 with value: 0.896969696969697.
The selected strides are greater or equal to the total chunk size.
[I 2024-11-28 08:10:09,329] Trial 17 finished with value: -1.0 and parameters: {'left_stride': 256, 'right_stride': 256, 'attention_pooling_operation': 'mean', 'embedding_pooling_operation': 'max', 'threshold': 0.9260610502237047, 'batch_size': 53, 'attention_heads': 8, 'hidden_dimension': 84, 'number_of_hidden_layers': 4, 'dropout_rate': 0.4289360089964802, 'global_pooling': 'mean', 'learning_rate': 0.010864983873957587, 'weight_decay': 5.793376493294994e-05, 'beta_0': 0.8414428402818317, 'beta_1': 0.9898555806901383, 'epsilon': 1.5067910365759739e-05, 'balanced_loss': False, 'epochs': 169, 'early_stopping_patience': 16, 'plateau_patience': 18, 'plateau_divider': 5}. Best is trial 14 with value: 0.896969696969697.
[I 2024-11-28 08:22:06,858] Trial 18 finished with value: 0.8848484848484849 and parameters: {'left_stride': 128, 'right_stride': 256, 'attention_pooling_operation': 'min', 'embedding_pooling_operation': 'max', 'threshold': 0.9144935018609204, 'batch_size': 35, 'attention_heads': 10, 'hidden_dimension': 118, 'number_of_hidden_layers': 2, 'dropout_rate': 0.509106569042536, 'global_pooling': 'mean', 'learning_rate': 0.00013717299524522908, 'weight_decay': 0.0002524400258962249, 'beta_0': 0.8199804990248458, 'beta_1': 0.9917654562052852, 'epsilon': 7.213150335081184e-06, 'balanced_loss': True, 'epochs': 87, 'early_stopping_patience': 21, 'plateau_patience': 12, 'plateau_divider': 2}. Best is trial 14 with value: 0.896969696969697.
[I 2024-11-28 08:40:17,721] Trial 19 finished with value: 0.8666666666666667 and parameters: {'left_stride': 128, 'right_stride': 128, 'attention_pooling_operation': 'mean', 'embedding_pooling_operation': 'max', 'threshold': 0.9408035754628781, 'batch_size': 20, 'attention_heads': 16, 'hidden_dimension': 171, 'number_of_hidden_layers': 2, 'dropout_rate': 0.4054774765320206, 'global_pooling': 'sum', 'learning_rate': 0.0008649769134734023, 'weight_decay': 0.0008959315848652595, 'beta_0': 0.8840292457327051, 'beta_1': 0.9880202326306927, 'epsilon': 9.482311995181508e-07, 'balanced_loss': False, 'epochs': 174, 'early_stopping_patience': 14, 'plateau_patience': 16, 'plateau_divider': 7}. Best is trial 14 with value: 0.896969696969697.
[I 2024-11-28 08:49:37,073] Trial 20 finished with value: 0.8909090909090909 and parameters: {'left_stride': 256, 'right_stride': 0, 'attention_pooling_operation': 'mean', 'embedding_pooling_operation': 'mean', 'threshold': 0.9618832907021146, 'batch_size': 34, 'attention_heads': 14, 'hidden_dimension': 231, 'number_of_hidden_layers': 0, 'dropout_rate': 0.4528479041085119, 'global_pooling': 'mean', 'learning_rate': 0.00019839393298343153, 'weight_decay': 0.00016270500137778498, 'beta_0': 0.822224914622008, 'beta_1': 0.9962846779745452, 'epsilon': 2.4484524848809268e-05, 'balanced_loss': False, 'epochs': 115, 'early_stopping_patience': 12, 'plateau_patience': 18, 'plateau_divider': 10}. Best is trial 14 with value: 0.896969696969697.
[I 2024-11-28 08:56:20,265] Trial 21 finished with value: 0.896969696969697 and parameters: {'left_stride': 0, 'right_stride': 64, 'attention_pooling_operation': 'max', 'embedding_pooling_operation': 'min', 'threshold': 0.9122819811379029, 'batch_size': 24, 'attention_heads': 7, 'hidden_dimension': 133, 'number_of_hidden_layers': 1, 'dropout_rate': 0.4808430681213234, 'global_pooling': 'mean', 'learning_rate': 0.0005626011089242127, 'weight_decay': 1.011377133458066e-05, 'beta_0': 0.8995919758250085, 'beta_1': 0.9940029552975193, 'epsilon': 2.6941180902664763e-07, 'balanced_loss': False, 'epochs': 104, 'early_stopping_patience': 19, 'plateau_patience': 14, 'plateau_divider': 7}. Best is trial 14 with value: 0.896969696969697.
[I 2024-11-28 09:03:46,820] Trial 22 finished with value: 0.8848484848484849 and parameters: {'left_stride': 0, 'right_stride': 64, 'attention_pooling_operation': 'max', 'embedding_pooling_operation': 'min', 'threshold': 0.900554275554638, 'batch_size': 24, 'attention_heads': 7, 'hidden_dimension': 65, 'number_of_hidden_layers': 1, 'dropout_rate': 0.49184848214774646, 'global_pooling': 'mean', 'learning_rate': 5.6335342704309824e-05, 'weight_decay': 6.300733064147458e-06, 'beta_0': 0.8897081317255072, 'beta_1': 0.9933808011825643, 'epsilon': 3.743315179335648e-06, 'balanced_loss': False, 'epochs': 100, 'early_stopping_patience': 18, 'plateau_patience': 15, 'plateau_divider': 6}. Best is trial 14 with value: 0.896969696969697.
[I 2024-11-28 09:10:13,800] Trial 23 finished with value: 0.896969696969697 and parameters: {'left_stride': 32, 'right_stride': 64, 'attention_pooling_operation': 'min', 'embedding_pooling_operation': 'min', 'threshold': 0.9201838097922155, 'batch_size': 44, 'attention_heads': 9, 'hidden_dimension': 132, 'number_of_hidden_layers': 0, 'dropout_rate': 0.5382457319700833, 'global_pooling': 'mean', 'learning_rate': 0.0009548897497377072, 'weight_decay': 4.703383215309873e-05, 'beta_0': 0.8724390393808225, 'beta_1': 0.990820921184014, 'epsilon': 1.6446047305521236e-07, 'balanced_loss': False, 'epochs': 124, 'early_stopping_patience': 19, 'plateau_patience': 14, 'plateau_divider': 8}. Best is trial 14 with value: 0.896969696969697.
[I 2024-11-28 09:18:51,464] Trial 24 finished with value: 0.8787878787878788 and parameters: {'left_stride': 32, 'right_stride': 32, 'attention_pooling_operation': 'mean', 'embedding_pooling_operation': 'min', 'threshold': 0.9100369798135755, 'batch_size': 45, 'attention_heads': 9, 'hidden_dimension': 125, 'number_of_hidden_layers': 1, 'dropout_rate': 0.5309513741411446, 'global_pooling': 'mean', 'learning_rate': 0.007699202953418796, 'weight_decay': 4.947640184237049e-05, 'beta_0': 0.8916905450697954, 'beta_1': 0.9983941526766823, 'epsilon': 1.3181265418063148e-07, 'balanced_loss': False, 'epochs': 125, 'early_stopping_patience': 20, 'plateau_patience': 13, 'plateau_divider': 8}. Best is trial 14 with value: 0.896969696969697.
CUDA out of memory. Tried to allocate 3.51 GiB. GPU 0 has a total capacity of 44.56 GiB of which 1014.69 MiB is free. Including non-PyTorch memory, this process has 43.56 GiB memory in use. Of the allocated memory 42.12 GiB is allocated by PyTorch, and 297.18 MiB is reserved by PyTorch but unallocated. If reserved but unallocated memory is large try setting PYTORCH_CUDA_ALLOC_CONF=expandable_segments:True to avoid fragmentation.  See documentation for Memory Management  (https://pytorch.org/docs/stable/notes/cuda.html#environment-variables)
[I 2024-11-28 09:24:19,623] Trial 25 finished with value: -1.0 and parameters: {'left_stride': 32, 'right_stride': 256, 'attention_pooling_operation': 'max', 'embedding_pooling_operation': 'max', 'threshold': 0.9187025857089203, 'batch_size': 54, 'attention_heads': 7, 'hidden_dimension': 172, 'number_of_hidden_layers': 2, 'dropout_rate': 0.5625989452813175, 'global_pooling': 'mean', 'learning_rate': 0.001116746315104781, 'weight_decay': 1.2727135546699677e-05, 'beta_0': 0.874323678180689, 'beta_1': 0.9940705214921806, 'epsilon': 6.204457098539711e-07, 'balanced_loss': False, 'epochs': 75, 'early_stopping_patience': 23, 'plateau_patience': 11, 'plateau_divider': 9}. Best is trial 14 with value: 0.896969696969697.
[I 2024-11-28 09:29:55,890] Trial 26 finished with value: 0.896969696969697 and parameters: {'left_stride': 32, 'right_stride': 64, 'attention_pooling_operation': 'min', 'embedding_pooling_operation': 'min', 'threshold': 0.9350655028152458, 'batch_size': 44, 'attention_heads': 6, 'hidden_dimension': 102, 'number_of_hidden_layers': 0, 'dropout_rate': 0.5398251934918832, 'global_pooling': 'mean', 'learning_rate': 0.0007212927973228343, 'weight_decay': 5.3115522991395093e-05, 'beta_0': 0.8741628908998542, 'beta_1': 0.991144506426741, 'epsilon': 1.9409100390943826e-07, 'balanced_loss': True, 'epochs': 103, 'early_stopping_patience': 23, 'plateau_patience': 14, 'plateau_divider': 9}. Best is trial 14 with value: 0.896969696969697.
