[I 2024-11-28 09:32:59,992] Trial 26 finished with value: 0.8848484848484849 and parameters: {'left_stride': 64, 'right_stride': 32, 'attention_pooling_operation': 'min', 'embedding_pooling_operation': 'min', 'threshold': 0.9594167165738048, 'batch_size': 43, 'attention_heads': 11, 'hidden_dimension': 158, 'number_of_hidden_layers': 0, 'dropout_rate': 0.559105795407131, 'global_pooling': 'mean', 'learning_rate': 0.002292176281853278, 'weight_decay': 0.00041069007740323824, 'beta_0': 0.8570653954727818, 'beta_1': 0.982129946011773, 'epsilon': 4.088134610523175e-05, 'balanced_loss': True, 'epochs': 121, 'early_stopping_patience': 21, 'plateau_patience': 20, 'plateau_divider': 3}. Best is trial 4 with value: 0.9030303030303031.
CUDA out of memory. Tried to allocate 2.63 GiB. GPU 0 has a total capacity of 44.56 GiB of which 1.99 GiB is free. Including non-PyTorch memory, this process has 42.57 GiB memory in use. Of the allocated memory 40.87 GiB is allocated by PyTorch, and 565.58 MiB is reserved by PyTorch but unallocated. If reserved but unallocated memory is large try setting PYTORCH_CUDA_ALLOC_CONF=expandable_segments:True to avoid fragmentation.  See documentation for Memory Management  (https://pytorch.org/docs/stable/notes/cuda.html#environment-variables)
[I 2024-11-28 09:37:44,831] Trial 27 finished with value: -1.0 and parameters: {'left_stride': 64, 'right_stride': 0, 'attention_pooling_operation': 'min', 'embedding_pooling_operation': 'min', 'threshold': 0.9415117549512763, 'batch_size': 32, 'attention_heads': 13, 'hidden_dimension': 196, 'number_of_hidden_layers': 4, 'dropout_rate': 0.4867469590104657, 'global_pooling': 'mean', 'learning_rate': 0.00787519182118015, 'weight_decay': 1.92090089929956e-05, 'beta_0': 0.8730606644555795, 'beta_1': 0.9863904816332667, 'epsilon': 1.2049201205224378e-07, 'balanced_loss': False, 'epochs': 159, 'early_stopping_patience': 18, 'plateau_patience': 15, 'plateau_divider': 6}. Best is trial 4 with value: 0.9030303030303031.
[I 2024-11-28 09:45:43,148] Trial 28 finished with value: 0.5333333333333333 and parameters: {'left_stride': 128, 'right_stride': 32, 'attention_pooling_operation': 'mean', 'embedding_pooling_operation': 'mean', 'threshold': 0.9703051137197034, 'batch_size': 36, 'attention_heads': 15, 'hidden_dimension': 147, 'number_of_hidden_layers': 1, 'dropout_rate': 0.5263697482356712, 'global_pooling': 'max', 'learning_rate': 0.02736425228687605, 'weight_decay': 9.153368826908066e-05, 'beta_0': 0.8411015115665882, 'beta_1': 0.9880058836814896, 'epsilon': 1.3860962990633534e-05, 'balanced_loss': True, 'epochs': 133, 'early_stopping_patience': 16, 'plateau_patience': 12, 'plateau_divider': 8}. Best is trial 4 with value: 0.9030303030303031.
[I 2024-11-28 09:58:23,801] Trial 29 finished with value: 0.8787878787878788 and parameters: {'left_stride': 32, 'right_stride': 64, 'attention_pooling_operation': 'max', 'embedding_pooling_operation': 'max', 'threshold': 0.9300415213390955, 'batch_size': 42, 'attention_heads': 9, 'hidden_dimension': 180, 'number_of_hidden_layers': 2, 'dropout_rate': 0.5039164679577534, 'global_pooling': 'sum', 'learning_rate': 0.000729087030526837, 'weight_decay': 4.661045683079309e-05, 'beta_0': 0.8580340894552427, 'beta_1': 0.9828671266316888, 'epsilon': 2.360607474649904e-08, 'balanced_loss': True, 'epochs': 146, 'early_stopping_patience': 19, 'plateau_patience': 24, 'plateau_divider': 10}. Best is trial 4 with value: 0.9030303030303031.
[I 2024-11-28 10:07:12,596] Trial 30 finished with value: 0.8727272727272727 and parameters: {'left_stride': 64, 'right_stride': 64, 'attention_pooling_operation': 'mean', 'embedding_pooling_operation': 'min', 'threshold': 0.9348316365885069, 'batch_size': 48, 'attention_heads': 13, 'hidden_dimension': 204, 'number_of_hidden_layers': 0, 'dropout_rate': 0.5788686963214708, 'global_pooling': 'max', 'learning_rate': 0.006515800741522607, 'weight_decay': 0.00023267583148257887, 'beta_0': 0.8000914132876867, 'beta_1': 0.9854140260244719, 'epsilon': 2.299698854482472e-06, 'balanced_loss': False, 'epochs': 117, 'early_stopping_patience': 22, 'plateau_patience': 21, 'plateau_divider': 9}. Best is trial 4 with value: 0.9030303030303031.
CUDA out of memory. Tried to allocate 6.38 GiB. GPU 0 has a total capacity of 44.56 GiB of which 5.90 GiB is free. Including non-PyTorch memory, this process has 38.65 GiB memory in use. Of the allocated memory 35.32 GiB is allocated by PyTorch, and 2.18 GiB is reserved by PyTorch but unallocated. If reserved but unallocated memory is large try setting PYTORCH_CUDA_ALLOC_CONF=expandable_segments:True to avoid fragmentation.  See documentation for Memory Management  (https://pytorch.org/docs/stable/notes/cuda.html#environment-variables)
[I 2024-11-28 10:12:47,566] Trial 31 finished with value: -1.0 and parameters: {'left_stride': 256, 'right_stride': 64, 'attention_pooling_operation': 'min', 'embedding_pooling_operation': 'min', 'threshold': 0.9168335102666896, 'batch_size': 36, 'attention_heads': 14, 'hidden_dimension': 225, 'number_of_hidden_layers': 0, 'dropout_rate': 0.4568740282318273, 'global_pooling': 'mean', 'learning_rate': 0.0003185202355343786, 'weight_decay': 0.0005811745550380192, 'beta_0': 0.8278318839457257, 'beta_1': 0.9922333421347671, 'epsilon': 5.881179142023633e-06, 'balanced_loss': False, 'epochs': 159, 'early_stopping_patience': 15, 'plateau_patience': 18, 'plateau_divider': 4}. Best is trial 4 with value: 0.9030303030303031.
[I 2024-11-28 10:26:43,890] Trial 32 finished with value: 0.9030303030303031 and parameters: {'left_stride': 64, 'right_stride': 64, 'attention_pooling_operation': 'min', 'embedding_pooling_operation': 'min', 'threshold': 0.9069769941290908, 'batch_size': 37, 'attention_heads': 12, 'hidden_dimension': 233, 'number_of_hidden_layers': 0, 'dropout_rate': 0.5373935375332328, 'global_pooling': 'mean', 'learning_rate': 5.7624029167147704e-05, 'weight_decay': 0.00045709979009604657, 'beta_0': 0.8568833781810121, 'beta_1': 0.9903823403654898, 'epsilon': 5.995155240052002e-06, 'balanced_loss': False, 'epochs': 187, 'early_stopping_patience': 14, 'plateau_patience': 17, 'plateau_divider': 3}. Best is trial 4 with value: 0.9030303030303031.
[I 2024-11-28 10:38:33,227] Trial 33 finished with value: 0.8909090909090909 and parameters: {'left_stride': 64, 'right_stride': 64, 'attention_pooling_operation': 'min', 'embedding_pooling_operation': 'min', 'threshold': 0.9286531223864395, 'batch_size': 39, 'attention_heads': 12, 'hidden_dimension': 232, 'number_of_hidden_layers': 0, 'dropout_rate': 0.5352403586665998, 'global_pooling': 'mean', 'learning_rate': 5.506152492891392e-05, 'weight_decay': 0.00039371901008080647, 'beta_0': 0.8554492053255957, 'beta_1': 0.9911708142524004, 'epsilon': 6.030483244543861e-07, 'balanced_loss': False, 'epochs': 185, 'early_stopping_patience': 12, 'plateau_patience': 15, 'plateau_divider': 3}. Best is trial 4 with value: 0.9030303030303031.
CUDA out of memory. Tried to allocate 7.51 GiB. GPU 0 has a total capacity of 44.56 GiB of which 1.35 GiB is free. Including non-PyTorch memory, this process has 43.21 GiB memory in use. Of the allocated memory 41.11 GiB is allocated by PyTorch, and 971.19 MiB is reserved by PyTorch but unallocated. If reserved but unallocated memory is large try setting PYTORCH_CUDA_ALLOC_CONF=expandable_segments:True to avoid fragmentation.  See documentation for Memory Management  (https://pytorch.org/docs/stable/notes/cuda.html#environment-variables)
[I 2024-11-28 10:43:25,260] Trial 34 finished with value: -1.0 and parameters: {'left_stride': 64, 'right_stride': 64, 'attention_pooling_operation': 'min', 'embedding_pooling_operation': 'min', 'threshold': 0.9071238838483263, 'batch_size': 55, 'attention_heads': 11, 'hidden_dimension': 243, 'number_of_hidden_layers': 0, 'dropout_rate': 0.5570093858590918, 'global_pooling': 'mean', 'learning_rate': 2.1308799501452082e-05, 'weight_decay': 0.00024333499622710176, 'beta_0': 0.8437724684007956, 'beta_1': 0.985086673304014, 'epsilon': 1.5216149622845156e-06, 'balanced_loss': False, 'epochs': 162, 'early_stopping_patience': 17, 'plateau_patience': 17, 'plateau_divider': 2}. Best is trial 4 with value: 0.9030303030303031.
[I 2024-11-28 10:56:00,560] Trial 35 finished with value: 0.8909090909090909 and parameters: {'left_stride': 64, 'right_stride': 64, 'attention_pooling_operation': 'min', 'embedding_pooling_operation': 'mean', 'threshold': 0.9003565200759075, 'batch_size': 43, 'attention_heads': 11, 'hidden_dimension': 207, 'number_of_hidden_layers': 0, 'dropout_rate': 0.512716421474163, 'global_pooling': 'mean', 'learning_rate': 8.255131863983619e-05, 'weight_decay': 8.622291460892637e-05, 'beta_0': 0.8542356086874147, 'beta_1': 0.9878553703468179, 'epsilon': 1.3037385695375537e-05, 'balanced_loss': False, 'epochs': 91, 'early_stopping_patience': 13, 'plateau_patience': 19, 'plateau_divider': 3}. Best is trial 4 with value: 0.9030303030303031.
CUDA out of memory. Tried to allocate 4.34 GiB. GPU 0 has a total capacity of 44.56 GiB of which 3.67 GiB is free. Including non-PyTorch memory, this process has 40.88 GiB memory in use. Of the allocated memory 38.51 GiB is allocated by PyTorch, and 1.22 GiB is reserved by PyTorch but unallocated. If reserved but unallocated memory is large try setting PYTORCH_CUDA_ALLOC_CONF=expandable_segments:True to avoid fragmentation.  See documentation for Memory Management  (https://pytorch.org/docs/stable/notes/cuda.html#environment-variables)
[I 2024-11-28 11:01:02,624] Trial 36 finished with value: -1.0 and parameters: {'left_stride': 64, 'right_stride': 128, 'attention_pooling_operation': 'max', 'embedding_pooling_operation': 'min', 'threshold': 0.9115563266632448, 'batch_size': 33, 'attention_heads': 13, 'hidden_dimension': 188, 'number_of_hidden_layers': 1, 'dropout_rate': 0.47847064966603026, 'global_pooling': 'mean', 'learning_rate': 0.0018233640834062913, 'weight_decay': 3.6653823767542575e-06, 'beta_0': 0.8396870793060578, 'beta_1': 0.9904347821622346, 'epsilon': 4.494299899535551e-06, 'balanced_loss': False, 'epochs': 177, 'early_stopping_patience': 24, 'plateau_patience': 16, 'plateau_divider': 4}. Best is trial 4 with value: 0.9030303030303031.
CUDA out of memory. Tried to allocate 7.19 GiB. GPU 0 has a total capacity of 44.56 GiB of which 1.28 GiB is free. Including non-PyTorch memory, this process has 43.27 GiB memory in use. Of the allocated memory 39.45 GiB is allocated by PyTorch, and 2.67 GiB is reserved by PyTorch but unallocated. If reserved but unallocated memory is large try setting PYTORCH_CUDA_ALLOC_CONF=expandable_segments:True to avoid fragmentation.  See documentation for Memory Management  (https://pytorch.org/docs/stable/notes/cuda.html#environment-variables)
[I 2024-11-28 11:06:23,973] Trial 37 finished with value: -1.0 and parameters: {'left_stride': 32, 'right_stride': 256, 'attention_pooling_operation': 'min', 'embedding_pooling_operation': 'min', 'threshold': 0.9079011669557313, 'batch_size': 37, 'attention_heads': 15, 'hidden_dimension': 218, 'number_of_hidden_layers': 0, 'dropout_rate': 0.5828012500229799, 'global_pooling': 'max', 'learning_rate': 0.0007583158322071059, 'weight_decay': 0.0004760913006093329, 'beta_0': 0.8749860082203337, 'beta_1': 0.9887520370336486, 'epsilon': 4.052110060170688e-05, 'balanced_loss': False, 'epochs': 190, 'early_stopping_patience': 14, 'plateau_patience': 21, 'plateau_divider': 3}. Best is trial 4 with value: 0.9030303030303031.
[I 2024-11-28 11:12:27,108] Trial 38 finished with value: 0.5636363636363636 and parameters: {'left_stride': 64, 'right_stride': 64, 'attention_pooling_operation': 'min', 'embedding_pooling_operation': 'mean', 'threshold': 0.9945194639105507, 'batch_size': 26, 'attention_heads': 9, 'hidden_dimension': 202, 'number_of_hidden_layers': 3, 'dropout_rate': 0.5633717975247972, 'global_pooling': 'mean', 'learning_rate': 0.01864072093247873, 'weight_decay': 0.00012590139715436008, 'beta_0': 0.862133888738515, 'beta_1': 0.9815576906662004, 'epsilon': 2.789279232542852e-06, 'balanced_loss': False, 'epochs': 139, 'early_stopping_patience': 16, 'plateau_patience': 17, 'plateau_divider': 4}. Best is trial 4 with value: 0.9030303030303031.
[I 2024-11-28 11:20:38,228] Trial 39 finished with value: 0.7696969696969697 and parameters: {'left_stride': 128, 'right_stride': 128, 'attention_pooling_operation': 'max', 'embedding_pooling_operation': 'min', 'threshold': 0.9877778407641848, 'batch_size': 41, 'attention_heads': 12, 'hidden_dimension': 243, 'number_of_hidden_layers': 1, 'dropout_rate': 0.5329527676530005, 'global_pooling': 'max', 'learning_rate': 1.2801324027326961e-05, 'weight_decay': 0.00018044953718460315, 'beta_0': 0.8850416630533607, 'beta_1': 0.9951221021276572, 'epsilon': 2.4703351063176363e-05, 'balanced_loss': False, 'epochs': 132, 'early_stopping_patience': 11, 'plateau_patience': 14, 'plateau_divider': 6}. Best is trial 4 with value: 0.9030303030303031.
[I 2024-11-28 11:26:02,011] Trial 40 finished with value: 0.8424242424242424 and parameters: {'left_stride': 64, 'right_stride': 32, 'attention_pooling_operation': 'min', 'embedding_pooling_operation': 'min', 'threshold': 0.9232175357182805, 'batch_size': 31, 'attention_heads': 4, 'hidden_dimension': 131, 'number_of_hidden_layers': 0, 'dropout_rate': 0.3512528207372072, 'global_pooling': 'sum', 'learning_rate': 0.039348461092948, 'weight_decay': 1.0005072453856697e-06, 'beta_0': 0.8667017121580267, 'beta_1': 0.9928265226040547, 'epsilon': 6.48337216324479e-05, 'balanced_loss': True, 'epochs': 150, 'early_stopping_patience': 18, 'plateau_patience': 22, 'plateau_divider': 5}. Best is trial 4 with value: 0.9030303030303031.
[I 2024-11-28 11:35:24,388] Trial 41 finished with value: 0.8848484848484849 and parameters: {'left_stride': 256, 'right_stride': 64, 'attention_pooling_operation': 'min', 'embedding_pooling_operation': 'min', 'threshold': 0.9361770394825117, 'batch_size': 38, 'attention_heads': 14, 'hidden_dimension': 219, 'number_of_hidden_layers': 0, 'dropout_rate': 0.43316500365400185, 'global_pooling': 'mean', 'learning_rate': 0.00025959186211551926, 'weight_decay': 0.0007184700890579399, 'beta_0': 0.8099694580564478, 'beta_1': 0.9901486393098646, 'epsilon': 7.592999551266081e-06, 'balanced_loss': False, 'epochs': 195, 'early_stopping_patience': 14, 'plateau_patience': 16, 'plateau_divider': 4}. Best is trial 4 with value: 0.9030303030303031.
[I 2024-11-28 11:46:27,843] Trial 42 finished with value: 0.8787878787878788 and parameters: {'left_stride': 0, 'right_stride': 64, 'attention_pooling_operation': 'min', 'embedding_pooling_operation': 'min', 'threshold': 0.9176237356096999, 'batch_size': 35, 'attention_heads': 13, 'hidden_dimension': 231, 'number_of_hidden_layers': 0, 'dropout_rate': 0.3733016643584086, 'global_pooling': 'mean', 'learning_rate': 7.800035794581543e-05, 'weight_decay': 0.0009963397741321466, 'beta_0': 0.8261645980815135, 'beta_1': 0.9919856362974357, 'epsilon': 5.371073432150715e-06, 'balanced_loss': False, 'epochs': 183, 'early_stopping_patience': 15, 'plateau_patience': 17, 'plateau_divider': 2}. Best is trial 4 with value: 0.9030303030303031.
CUDA out of memory. Tried to allocate 4.29 GiB. GPU 0 has a total capacity of 44.56 GiB of which 3.57 GiB is free. Including non-PyTorch memory, this process has 40.99 GiB memory in use. Of the allocated memory 37.94 GiB is allocated by PyTorch, and 1.90 GiB is reserved by PyTorch but unallocated. If reserved but unallocated memory is large try setting PYTORCH_CUDA_ALLOC_CONF=expandable_segments:True to avoid fragmentation.  See documentation for Memory Management  (https://pytorch.org/docs/stable/notes/cuda.html#environment-variables)
[I 2024-11-28 11:52:00,539] Trial 43 finished with value: -1.0 and parameters: {'left_stride': 256, 'right_stride': 64, 'attention_pooling_operation': 'min', 'embedding_pooling_operation': 'min', 'threshold': 0.92413774820176, 'batch_size': 29, 'attention_heads': 16, 'hidden_dimension': 188, 'number_of_hidden_layers': 1, 'dropout_rate': 0.46597090287209053, 'global_pooling': 'mean', 'learning_rate': 0.0035647879115827397, 'weight_decay': 0.0005337599126170807, 'beta_0': 0.8314130887959205, 'beta_1': 0.9937751992791226, 'epsilon': 1.1394250463207657e-05, 'balanced_loss': False, 'epochs': 173, 'early_stopping_patience': 13, 'plateau_patience': 20, 'plateau_divider': 7}. Best is trial 4 with value: 0.9030303030303031.
CUDA out of memory. Tried to allocate 6.59 GiB. GPU 0 has a total capacity of 44.56 GiB of which 6.13 GiB is free. Including non-PyTorch memory, this process has 38.42 GiB memory in use. Of the allocated memory 36.42 GiB is allocated by PyTorch, and 876.58 MiB is reserved by PyTorch but unallocated. If reserved but unallocated memory is large try setting PYTORCH_CUDA_ALLOC_CONF=expandable_segments:True to avoid fragmentation.  See documentation for Memory Management  (https://pytorch.org/docs/stable/notes/cuda.html#environment-variables)
[I 2024-11-28 11:57:05,660] Trial 44 finished with value: -1.0 and parameters: {'left_stride': 128, 'right_stride': 64, 'attention_pooling_operation': 'min', 'embedding_pooling_operation': 'max', 'threshold': 0.9085873895326235, 'batch_size': 40, 'attention_heads': 14, 'hidden_dimension': 213, 'number_of_hidden_layers': 0, 'dropout_rate': 0.4890194272225958, 'global_pooling': 'mean', 'learning_rate': 0.0005800848459823959, 'weight_decay': 0.0002794070115222104, 'beta_0': 0.8510303880476802, 'beta_1': 0.9959631551380531, 'epsilon': 6.611095653781392e-08, 'balanced_loss': False, 'epochs': 190, 'early_stopping_patience': 17, 'plateau_patience': 18, 'plateau_divider': 3}. Best is trial 4 with value: 0.9030303030303031.
[I 2024-11-28 12:10:15,450] Trial 45 finished with value: 0.8787878787878788 and parameters: {'left_stride': 64, 'right_stride': 0, 'attention_pooling_operation': 'min', 'embedding_pooling_operation': 'min', 'threshold': 0.9509315271204837, 'batch_size': 34, 'attention_heads': 12, 'hidden_dimension': 244, 'number_of_hidden_layers': 0, 'dropout_rate': 0.5535445954892518, 'global_pooling': 'mean', 'learning_rate': 2.844294954271908e-05, 'weight_decay': 0.0003614885674797084, 'beta_0': 0.818299316114304, 'beta_1': 0.9916273470079394, 'epsilon': 1.7798512361383914e-06, 'balanced_loss': False, 'epochs': 198, 'early_stopping_patience': 15, 'plateau_patience': 15, 'plateau_divider': 5}. Best is trial 4 with value: 0.9030303030303031.
[I 2024-11-28 12:18:53,070] Trial 46 finished with value: 0.8787878787878788 and parameters: {'left_stride': 256, 'right_stride': 32, 'attention_pooling_operation': 'max', 'embedding_pooling_operation': 'min', 'threshold': 0.9317657557160621, 'batch_size': 45, 'attention_heads': 13, 'hidden_dimension': 231, 'number_of_hidden_layers': 0, 'dropout_rate': 0.32175765512986654, 'global_pooling': 'mean', 'learning_rate': 0.002439093665735161, 'weight_decay': 4.3025015027725126e-05, 'beta_0': 0.8381414445908447, 'beta_1': 0.9860349658527, 'epsilon': 3.4583839605450433e-07, 'balanced_loss': True, 'epochs': 157, 'early_stopping_patience': 14, 'plateau_patience': 17, 'plateau_divider': 4}. Best is trial 4 with value: 0.9030303030303031.
CUDA out of memory. Tried to allocate 4.67 GiB. GPU 0 has a total capacity of 44.56 GiB of which 644.69 MiB is free. Including non-PyTorch memory, this process has 43.92 GiB memory in use. Of the allocated memory 41.16 GiB is allocated by PyTorch, and 1.62 GiB is reserved by PyTorch but unallocated. If reserved but unallocated memory is large try setting PYTORCH_CUDA_ALLOC_CONF=expandable_segments:True to avoid fragmentation.  See documentation for Memory Management  (https://pytorch.org/docs/stable/notes/cuda.html#environment-variables)
[I 2024-11-28 12:24:29,797] Trial 47 finished with value: -1.0 and parameters: {'left_stride': 64, 'right_stride': 256, 'attention_pooling_operation': 'min', 'embedding_pooling_operation': 'min', 'threshold': 0.9395692429903795, 'batch_size': 49, 'attention_heads': 15, 'hidden_dimension': 169, 'number_of_hidden_layers': 1, 'dropout_rate': 0.5138724247586847, 'global_pooling': 'mean', 'learning_rate': 0.0001948544282757922, 'weight_decay': 0.00012882655641962336, 'beta_0': 0.8063505874962864, 'beta_1': 0.9883874616148073, 'epsilon': 9.215633837602271e-07, 'balanced_loss': False, 'epochs': 169, 'early_stopping_patience': 16, 'plateau_patience': 19, 'plateau_divider': 2}. Best is trial 4 with value: 0.9030303030303031.
[I 2024-11-28 12:38:08,753] Trial 48 finished with value: 0.8909090909090909 and parameters: {'left_stride': 0, 'right_stride': 64, 'attention_pooling_operation': 'mean', 'embedding_pooling_operation': 'mean', 'threshold': 0.918135685120933, 'batch_size': 38, 'attention_heads': 14, 'hidden_dimension': 195, 'number_of_hidden_layers': 0, 'dropout_rate': 0.4697500477999306, 'global_pooling': 'mean', 'learning_rate': 9.0039449440349e-05, 'weight_decay': 0.000629462042246219, 'beta_0': 0.8339300609807622, 'beta_1': 0.9899496747262578, 'epsilon': 3.0166650087000577e-05, 'balanced_loss': False, 'epochs': 128, 'early_stopping_patience': 11, 'plateau_patience': 16, 'plateau_divider': 8}. Best is trial 4 with value: 0.9030303030303031.
