[I 2024-11-28 12:45:46,894] Trial 49 finished with value: 0.8606060606060606 and parameters: {'left_stride': 32, 'right_stride': 32, 'attention_pooling_operation': 'min', 'embedding_pooling_operation': 'min', 'threshold': 0.9533402538167803, 'batch_size': 55, 'attention_heads': 10, 'hidden_dimension': 153, 'number_of_hidden_layers': 1, 'dropout_rate': 0.4034965488136031, 'global_pooling': 'sum', 'learning_rate': 0.001367913479149202, 'weight_decay': 0.0008263540643539605, 'beta_0': 0.8227827563061645, 'beta_1': 0.9871502686901675, 'epsilon': 8.859966168775054e-06, 'balanced_loss': True, 'epochs': 65, 'early_stopping_patience': 20, 'plateau_patience': 14, 'plateau_divider': 3}. Best is trial 4 with value: 0.9030303030303031.
CUDA out of memory. Tried to allocate 3.15 GiB. GPU 0 has a total capacity of 44.56 GiB of which 902.69 MiB is free. Including non-PyTorch memory, this process has 43.67 GiB memory in use. Of the allocated memory 41.96 GiB is allocated by PyTorch, and 575.43 MiB is reserved by PyTorch but unallocated. If reserved but unallocated memory is large try setting PYTORCH_CUDA_ALLOC_CONF=expandable_segments:True to avoid fragmentation.  See documentation for Memory Management  (https://pytorch.org/docs/stable/notes/cuda.html#environment-variables)
[I 2024-11-28 12:51:02,759] Trial 50 finished with value: -1.0 and parameters: {'left_stride': 256, 'right_stride': 0, 'attention_pooling_operation': 'min', 'embedding_pooling_operation': 'max', 'threshold': 0.9049404098870832, 'batch_size': 30, 'attention_heads': 16, 'hidden_dimension': 110, 'number_of_hidden_layers': 4, 'dropout_rate': 0.5002002764189504, 'global_pooling': 'mean', 'learning_rate': 0.0003870405523829285, 'weight_decay': 0.000191439488359687, 'beta_0': 0.8697839003753237, 'beta_1': 0.9988068541382085, 'epsilon': 2.096250610248489e-08, 'balanced_loss': False, 'epochs': 144, 'early_stopping_patience': 13, 'plateau_patience': 25, 'plateau_divider': 6}. Best is trial 4 with value: 0.9030303030303031.
[I 2024-11-28 12:56:25,466] Trial 51 finished with value: 0.8787878787878788 and parameters: {'left_stride': 0, 'right_stride': 64, 'attention_pooling_operation': 'max', 'embedding_pooling_operation': 'min', 'threshold': 0.9443041864766983, 'batch_size': 40, 'attention_heads': 4, 'hidden_dimension': 119, 'number_of_hidden_layers': 0, 'dropout_rate': 0.5326620445510669, 'global_pooling': 'mean', 'learning_rate': 0.0034124755117354516, 'weight_decay': 2.746809163562514e-05, 'beta_0': 0.8876383152181252, 'beta_1': 0.992970976828752, 'epsilon': 4.1800673887739104e-08, 'balanced_loss': False, 'epochs': 74, 'early_stopping_patience': 19, 'plateau_patience': 24, 'plateau_divider': 7}. Best is trial 4 with value: 0.9030303030303031.
[I 2024-11-28 13:02:26,071] Trial 52 finished with value: 0.8909090909090909 and parameters: {'left_stride': 0, 'right_stride': 64, 'attention_pooling_operation': 'max', 'embedding_pooling_operation': 'min', 'threshold': 0.9453334785291555, 'batch_size': 43, 'attention_heads': 6, 'hidden_dimension': 138, 'number_of_hidden_layers': 1, 'dropout_rate': 0.4365071179735842, 'global_pooling': 'mean', 'learning_rate': 0.005749530432123954, 'weight_decay': 2.0010850499086305e-05, 'beta_0': 0.8600244924193405, 'beta_1': 0.9907312069417317, 'epsilon': 7.650744700022799e-08, 'balanced_loss': False, 'epochs': 111, 'early_stopping_patience': 20, 'plateau_patience': 24, 'plateau_divider': 7}. Best is trial 4 with value: 0.9030303030303031.
[I 2024-11-28 13:07:40,616] Trial 53 finished with value: 0.8787878787878788 and parameters: {'left_stride': 0, 'right_stride': 64, 'attention_pooling_operation': 'max', 'embedding_pooling_operation': 'min', 'threshold': 0.936781460800353, 'batch_size': 37, 'attention_heads': 6, 'hidden_dimension': 89, 'number_of_hidden_layers': 0, 'dropout_rate': 0.4891607634501252, 'global_pooling': 'mean', 'learning_rate': 0.00309175385537644, 'weight_decay': 7.184855219347522e-05, 'beta_0': 0.882490313900545, 'beta_1': 0.9836257101242306, 'epsilon': 3.711514466532814e-08, 'balanced_loss': False, 'epochs': 169, 'early_stopping_patience': 17, 'plateau_patience': 25, 'plateau_divider': 8}. Best is trial 4 with value: 0.9030303030303031.
[I 2024-11-28 13:14:26,465] Trial 54 finished with value: 0.8787878787878788 and parameters: {'left_stride': 128, 'right_stride': 64, 'attention_pooling_operation': 'max', 'embedding_pooling_operation': 'min', 'threshold': 0.964351316145543, 'batch_size': 34, 'attention_heads': 11, 'hidden_dimension': 129, 'number_of_hidden_layers': 1, 'dropout_rate': 0.5425482016836981, 'global_pooling': 'mean', 'learning_rate': 0.00014246432113589966, 'weight_decay': 1.0784925445400047e-05, 'beta_0': 0.8950749457568212, 'beta_1': 0.9810272657748453, 'epsilon': 1.9631869280816263e-07, 'balanced_loss': False, 'epochs': 58, 'early_stopping_patience': 18, 'plateau_patience': 23, 'plateau_divider': 5}. Best is trial 4 with value: 0.9030303030303031.
[I 2024-11-28 13:21:07,690] Trial 55 finished with value: 0.896969696969697 and parameters: {'left_stride': 0, 'right_stride': 128, 'attention_pooling_operation': 'min', 'embedding_pooling_operation': 'min', 'threshold': 0.947168984497626, 'batch_size': 41, 'attention_heads': 10, 'hidden_dimension': 249, 'number_of_hidden_layers': 0, 'dropout_rate': 0.5156394797479107, 'global_pooling': 'mean', 'learning_rate': 0.0017849047546762951, 'weight_decay': 3.1954259995150056e-05, 'beta_0': 0.8516600968837142, 'beta_1': 0.9895049496785857, 'epsilon': 1.8866097516186985e-05, 'balanced_loss': True, 'epochs': 97, 'early_stopping_patience': 16, 'plateau_patience': 18, 'plateau_divider': 9}. Best is trial 4 with value: 0.9030303030303031.
[I 2024-11-28 13:26:40,028] Trial 56 finished with value: 0.8727272727272727 and parameters: {'left_stride': 64, 'right_stride': 0, 'attention_pooling_operation': 'max', 'embedding_pooling_operation': 'min', 'threshold': 0.952652318355778, 'batch_size': 27, 'attention_heads': 5, 'hidden_dimension': 170, 'number_of_hidden_layers': 0, 'dropout_rate': 0.5875293600245324, 'global_pooling': 'mean', 'learning_rate': 0.0006723296735840521, 'weight_decay': 4.5646003637445064e-05, 'beta_0': 0.8125760874122042, 'beta_1': 0.9872525775344858, 'epsilon': 1.0741163361207708e-08, 'balanced_loss': False, 'epochs': 50, 'early_stopping_patience': 15, 'plateau_patience': 22, 'plateau_divider': 6}. Best is trial 4 with value: 0.9030303030303031.
[I 2024-11-28 13:39:38,951] Trial 57 finished with value: 0.9030303030303031 and parameters: {'left_stride': 128, 'right_stride': 32, 'attention_pooling_operation': 'min', 'embedding_pooling_operation': 'min', 'threshold': 0.9137229638300653, 'batch_size': 39, 'attention_heads': 12, 'hidden_dimension': 84, 'number_of_hidden_layers': 3, 'dropout_rate': 0.5714787606209136, 'global_pooling': 'max', 'learning_rate': 0.0009407980799343298, 'weight_decay': 7.685834565111622e-06, 'beta_0': 0.8047079505556252, 'beta_1': 0.9922325953391845, 'epsilon': 2.3522511250137096e-06, 'balanced_loss': True, 'epochs': 154, 'early_stopping_patience': 19, 'plateau_patience': 17, 'plateau_divider': 7}. Best is trial 4 with value: 0.9030303030303031.
[I 2024-11-28 13:48:07,294] Trial 58 finished with value: 0.896969696969697 and parameters: {'left_stride': 128, 'right_stride': 32, 'attention_pooling_operation': 'min', 'embedding_pooling_operation': 'min', 'threshold': 0.9151863576143358, 'batch_size': 45, 'attention_heads': 12, 'hidden_dimension': 63, 'number_of_hidden_layers': 3, 'dropout_rate': 0.5679286150252685, 'global_pooling': 'max', 'learning_rate': 0.0009831050840247418, 'weight_decay': 2.5444953157865336e-06, 'beta_0': 0.8033394875920822, 'beta_1': 0.9938249965448109, 'epsilon': 2.8549477239823308e-06, 'balanced_loss': True, 'epochs': 153, 'early_stopping_patience': 14, 'plateau_patience': 17, 'plateau_divider': 4}. Best is trial 4 with value: 0.9030303030303031.
CUDA out of memory. Tried to allocate 3.98 GiB. GPU 0 has a total capacity of 44.56 GiB of which 3.04 GiB is free. Including non-PyTorch memory, this process has 41.51 GiB memory in use. Of the allocated memory 39.84 GiB is allocated by PyTorch, and 529.15 MiB is reserved by PyTorch but unallocated. If reserved but unallocated memory is large try setting PYTORCH_CUDA_ALLOC_CONF=expandable_segments:True to avoid fragmentation.  See documentation for Memory Management  (https://pytorch.org/docs/stable/notes/cuda.html#environment-variables)
[I 2024-11-28 13:53:06,210] Trial 59 finished with value: -1.0 and parameters: {'left_stride': 128, 'right_stride': 32, 'attention_pooling_operation': 'min', 'embedding_pooling_operation': 'min', 'threshold': 0.9214210952693432, 'batch_size': 31, 'attention_heads': 13, 'hidden_dimension': 212, 'number_of_hidden_layers': 2, 'dropout_rate': 0.5526122587361075, 'global_pooling': 'max', 'learning_rate': 0.0004155111278595486, 'weight_decay': 1.3529854727410543e-05, 'beta_0': 0.8192047523219285, 'beta_1': 0.9976806741779154, 'epsilon': 4.242208641566196e-06, 'balanced_loss': True, 'epochs': 137, 'early_stopping_patience': 21, 'plateau_patience': 15, 'plateau_divider': 2}. Best is trial 4 with value: 0.9030303030303031.
[I 2024-11-28 14:02:57,343] Trial 60 finished with value: 0.8666666666666667 and parameters: {'left_stride': 128, 'right_stride': 32, 'attention_pooling_operation': 'min', 'embedding_pooling_operation': 'max', 'threshold': 0.9258712814035087, 'batch_size': 38, 'attention_heads': 14, 'hidden_dimension': 76, 'number_of_hidden_layers': 4, 'dropout_rate': 0.5763599809930967, 'global_pooling': 'max', 'learning_rate': 0.0016730288846743943, 'weight_decay': 1.4842976056897445e-06, 'beta_0': 0.8151041358659631, 'beta_1': 0.9894552188447286, 'epsilon': 6.4628989533301865e-06, 'balanced_loss': True, 'epochs': 165, 'early_stopping_patience': 19, 'plateau_patience': 16, 'plateau_divider': 7}. Best is trial 4 with value: 0.9030303030303031.
[I 2024-11-28 14:09:34,368] Trial 61 finished with value: 0.8545454545454545 and parameters: {'left_stride': 128, 'right_stride': 32, 'attention_pooling_operation': 'min', 'embedding_pooling_operation': 'min', 'threshold': 0.9136830119168654, 'batch_size': 36, 'attention_heads': 8, 'hidden_dimension': 54, 'number_of_hidden_layers': 2, 'dropout_rate': 0.5427020635674139, 'global_pooling': 'max', 'learning_rate': 0.009005662425592264, 'weight_decay': 6.800167184890781e-06, 'beta_0': 0.8065895104299278, 'beta_1': 0.9922311600027607, 'epsilon': 2.0442356254841554e-06, 'balanced_loss': True, 'epochs': 155, 'early_stopping_patience': 18, 'plateau_patience': 19, 'plateau_divider': 7}. Best is trial 4 with value: 0.9030303030303031.
The selected strides are greater or equal to the total chunk size.
[I 2024-11-28 14:09:35,605] Trial 62 finished with value: -1.0 and parameters: {'left_stride': 256, 'right_stride': 256, 'attention_pooling_operation': 'mean', 'embedding_pooling_operation': 'min', 'threshold': 0.9310967440902266, 'batch_size': 33, 'attention_heads': 13, 'hidden_dimension': 98, 'number_of_hidden_layers': 2, 'dropout_rate': 0.5966195516113245, 'global_pooling': 'max', 'learning_rate': 0.0024182293261042903, 'weight_decay': 5.174152704084738e-06, 'beta_0': 0.8078817513600948, 'beta_1': 0.9912643182366849, 'epsilon': 3.3558757963463905e-06, 'balanced_loss': True, 'epochs': 147, 'early_stopping_patience': 19, 'plateau_patience': 18, 'plateau_divider': 8}. Best is trial 4 with value: 0.9030303030303031.
[I 2024-11-28 14:15:52,173] Trial 63 finished with value: 0.8545454545454545 and parameters: {'left_stride': 64, 'right_stride': 64, 'attention_pooling_operation': 'min', 'embedding_pooling_operation': 'min', 'threshold': 0.9204746165998531, 'batch_size': 42, 'attention_heads': 15, 'hidden_dimension': 84, 'number_of_hidden_layers': 0, 'dropout_rate': 0.529828616851199, 'global_pooling': 'sum', 'learning_rate': 0.004728418564318843, 'weight_decay': 5.9511806462333166e-05, 'beta_0': 0.8430572876941099, 'beta_1': 0.9925764187007375, 'epsilon': 1.166736745287566e-06, 'balanced_loss': False, 'epochs': 126, 'early_stopping_patience': 17, 'plateau_patience': 17, 'plateau_divider': 6}. Best is trial 4 with value: 0.9030303030303031.
[I 2024-11-28 14:22:31,478] Trial 64 finished with value: 0.8909090909090909 and parameters: {'left_stride': 128, 'right_stride': 32, 'attention_pooling_operation': 'min', 'embedding_pooling_operation': 'min', 'threshold': 0.9110776644452525, 'batch_size': 39, 'attention_heads': 11, 'hidden_dimension': 32, 'number_of_hidden_layers': 3, 'dropout_rate': 0.4484985601189417, 'global_pooling': 'mean', 'learning_rate': 0.0012295984171962673, 'weight_decay': 0.00045494863001514123, 'beta_0': 0.8909410584769112, 'beta_1': 0.9935258495430523, 'epsilon': 8.463929192759208e-06, 'balanced_loss': True, 'epochs': 178, 'early_stopping_patience': 20, 'plateau_patience': 24, 'plateau_divider': 7}. Best is trial 4 with value: 0.9030303030303031.
CUDA out of memory. Tried to allocate 3.81 GiB. GPU 0 has a total capacity of 44.56 GiB of which 116.69 MiB is free. Including non-PyTorch memory, this process has 44.44 GiB memory in use. Of the allocated memory 42.08 GiB is allocated by PyTorch, and 1.21 GiB is reserved by PyTorch but unallocated. If reserved but unallocated memory is large try setting PYTORCH_CUDA_ALLOC_CONF=expandable_segments:True to avoid fragmentation.  See documentation for Memory Management  (https://pytorch.org/docs/stable/notes/cuda.html#environment-variables)
[I 2024-11-28 14:27:19,454] Trial 65 finished with value: -1.0 and parameters: {'left_stride': 64, 'right_stride': 0, 'attention_pooling_operation': 'min', 'embedding_pooling_operation': 'min', 'threshold': 0.9032893904071705, 'batch_size': 47, 'attention_heads': 7, 'hidden_dimension': 226, 'number_of_hidden_layers': 3, 'dropout_rate': 0.5052585881380495, 'global_pooling': 'mean', 'learning_rate': 0.012146029316533899, 'weight_decay': 2.529389212368769e-05, 'beta_0': 0.8025694503603339, 'beta_1': 0.9885415213510577, 'epsilon': 3.027383581275338e-08, 'balanced_loss': False, 'epochs': 190, 'early_stopping_patience': 15, 'plateau_patience': 16, 'plateau_divider': 3}. Best is trial 4 with value: 0.9030303030303031.
[I 2024-11-28 14:34:15,459] Trial 66 finished with value: 0.8909090909090909 and parameters: {'left_stride': 0, 'right_stride': 64, 'attention_pooling_operation': 'min', 'embedding_pooling_operation': 'mean', 'threshold': 0.9279777511594088, 'batch_size': 44, 'attention_heads': 12, 'hidden_dimension': 153, 'number_of_hidden_layers': 0, 'dropout_rate': 0.5212777408393279, 'global_pooling': 'mean', 'learning_rate': 0.0009392801085605007, 'weight_decay': 0.000285509363847716, 'beta_0': 0.8757080884723046, 'beta_1': 0.9916450928660144, 'epsilon': 9.649557187647601e-08, 'balanced_loss': False, 'epochs': 163, 'early_stopping_patience': 21, 'plateau_patience': 13, 'plateau_divider': 5}. Best is trial 4 with value: 0.9030303030303031.
[I 2024-11-28 14:40:24,970] Trial 67 finished with value: 0.8909090909090909 and parameters: {'left_stride': 32, 'right_stride': 64, 'attention_pooling_operation': 'min', 'embedding_pooling_operation': 'min', 'threshold': 0.9397355409640819, 'batch_size': 35, 'attention_heads': 12, 'hidden_dimension': 117, 'number_of_hidden_layers': 0, 'dropout_rate': 0.4803504047675266, 'global_pooling': 'mean', 'learning_rate': 0.0005013087607365433, 'weight_decay': 1.6327862427024294e-05, 'beta_0': 0.8475842542825349, 'beta_1': 0.9897935022553581, 'epsilon': 1.6871943017703603e-05, 'balanced_loss': True, 'epochs': 139, 'early_stopping_patience': 16, 'plateau_patience': 20, 'plateau_divider': 3}. Best is trial 4 with value: 0.9030303030303031.
[I 2024-11-28 14:47:05,805] Trial 68 finished with value: 0.8363636363636363 and parameters: {'left_stride': 64, 'right_stride': 32, 'attention_pooling_operation': 'mean', 'embedding_pooling_operation': 'min', 'threshold': 0.9989161222422878, 'batch_size': 41, 'attention_heads': 14, 'hidden_dimension': 182, 'number_of_hidden_layers': 1, 'dropout_rate': 0.56205270346011, 'global_pooling': 'max', 'learning_rate': 0.00032491163567657376, 'weight_decay': 9.08079400692669e-05, 'beta_0': 0.8709757246133514, 'beta_1': 0.9908005849756418, 'epsilon': 1.0724816310147282e-05, 'balanced_loss': False, 'epochs': 182, 'early_stopping_patience': 18, 'plateau_patience': 17, 'plateau_divider': 8}. Best is trial 4 with value: 0.9030303030303031.
CUDA out of memory. Tried to allocate 2.64 GiB. GPU 0 has a total capacity of 44.56 GiB of which 1.26 GiB is free. Including non-PyTorch memory, this process has 43.30 GiB memory in use. Of the allocated memory 41.44 GiB is allocated by PyTorch, and 720.06 MiB is reserved by PyTorch but unallocated. If reserved but unallocated memory is large try setting PYTORCH_CUDA_ALLOC_CONF=expandable_segments:True to avoid fragmentation.  See documentation for Memory Management  (https://pytorch.org/docs/stable/notes/cuda.html#environment-variables)
[I 2024-11-28 14:52:21,799] Trial 69 finished with value: -1.0 and parameters: {'left_stride': 128, 'right_stride': 128, 'attention_pooling_operation': 'max', 'embedding_pooling_operation': 'min', 'threshold': 0.9570442257480982, 'batch_size': 37, 'attention_heads': 13, 'hidden_dimension': 202, 'number_of_hidden_layers': 3, 'dropout_rate': 0.5493262389612826, 'global_pooling': 'mean', 'learning_rate': 5.109052667046585e-05, 'weight_decay': 3.580552460525198e-05, 'beta_0': 0.8215196160974445, 'beta_1': 0.9889905859742429, 'epsilon': 1.643322775086476e-08, 'balanced_loss': False, 'epochs': 150, 'early_stopping_patience': 17, 'plateau_patience': 10, 'plateau_divider': 6}. Best is trial 4 with value: 0.9030303030303031.
CUDA out of memory. Tried to allocate 10.91 GiB. GPU 0 has a total capacity of 44.56 GiB of which 4.96 GiB is free. Including non-PyTorch memory, this process has 39.60 GiB memory in use. Of the allocated memory 36.63 GiB is allocated by PyTorch, and 1.82 GiB is reserved by PyTorch but unallocated. If reserved but unallocated memory is large try setting PYTORCH_CUDA_ALLOC_CONF=expandable_segments:True to avoid fragmentation.  See documentation for Memory Management  (https://pytorch.org/docs/stable/notes/cuda.html#environment-variables)
[I 2024-11-28 14:57:54,121] Trial 70 finished with value: -1.0 and parameters: {'left_stride': 256, 'right_stride': 64, 'attention_pooling_operation': 'min', 'embedding_pooling_operation': 'min', 'threshold': 0.9004749302894307, 'batch_size': 63, 'attention_heads': 12, 'hidden_dimension': 236, 'number_of_hidden_layers': 0, 'dropout_rate': 0.5704235903466323, 'global_pooling': 'sum', 'learning_rate': 0.0007949796518955701, 'weight_decay': 0.00015320480729288382, 'beta_0': 0.8997458148254749, 'beta_1': 0.9946185583108434, 'epsilon': 4.731711851196896e-06, 'balanced_loss': True, 'epochs': 172, 'early_stopping_patience': 22, 'plateau_patience': 18, 'plateau_divider': 4}. Best is trial 4 with value: 0.9030303030303031.
[I 2024-11-28 15:04:37,154] Trial 71 finished with value: 0.9030303030303031 and parameters: {'left_stride': 128, 'right_stride': 0, 'attention_pooling_operation': 'min', 'embedding_pooling_operation': 'min', 'threshold': 0.9101851826117197, 'batch_size': 35, 'attention_heads': 9, 'hidden_dimension': 222, 'number_of_hidden_layers': 0, 'dropout_rate': 0.5405190125689763, 'global_pooling': 'mean', 'learning_rate': 0.0014971316191497667, 'weight_decay': 5.411201229021989e-05, 'beta_0': 0.829869377164686, 'beta_1': 0.9847190961914297, 'epsilon': 2.494592962004006e-06, 'balanced_loss': False, 'epochs': 142, 'early_stopping_patience': 15, 'plateau_patience': 16, 'plateau_divider': 7}. Best is trial 4 with value: 0.9030303030303031.
[I 2024-11-28 15:11:07,946] Trial 72 finished with value: 0.8848484848484849 and parameters: {'left_stride': 128, 'right_stride': 0, 'attention_pooling_operation': 'min', 'embedding_pooling_operation': 'min', 'threshold': 0.9096781647420175, 'batch_size': 39, 'attention_heads': 7, 'hidden_dimension': 251, 'number_of_hidden_layers': 0, 'dropout_rate': 0.5348967084973749, 'global_pooling': 'mean', 'learning_rate': 0.0027567677170478476, 'weight_decay': 0.00010744013582420802, 'beta_0': 0.8314302680255047, 'beta_1': 0.983848992537824, 'epsilon': 6.514421781299809e-07, 'balanced_loss': False, 'epochs': 132, 'early_stopping_patience': 15, 'plateau_patience': 15, 'plateau_divider': 7}. Best is trial 4 with value: 0.9030303030303031.
[I 2024-11-28 15:18:45,292] Trial 73 finished with value: 0.9030303030303031 and parameters: {'left_stride': 128, 'right_stride': 0, 'attention_pooling_operation': 'min', 'embedding_pooling_operation': 'min', 'threshold': 0.9047296036718753, 'batch_size': 32, 'attention_heads': 11, 'hidden_dimension': 225, 'number_of_hidden_layers': 0, 'dropout_rate': 0.497592491977284, 'global_pooling': 'mean', 'learning_rate': 0.0017746662566449, 'weight_decay': 5.238270204053019e-05, 'beta_0': 0.8247487459352154, 'beta_1': 0.9828710773377257, 'epsilon': 3.650216353379741e-07, 'balanced_loss': False, 'epochs': 145, 'early_stopping_patience': 13, 'plateau_patience': 16, 'plateau_divider': 7}. Best is trial 4 with value: 0.9030303030303031.
[I 2024-11-28 15:26:22,011] Trial 74 finished with value: 0.8848484848484849 and parameters: {'left_stride': 128, 'right_stride': 0, 'attention_pooling_operation': 'min', 'embedding_pooling_operation': 'min', 'threshold': 0.9056429976281405, 'batch_size': 31, 'attention_heads': 11, 'hidden_dimension': 225, 'number_of_hidden_layers': 0, 'dropout_rate': 0.5393190204108165, 'global_pooling': 'mean', 'learning_rate': 0.0018027311281320528, 'weight_decay': 5.700839359910581e-05, 'beta_0': 0.8276784982560063, 'beta_1': 0.982954166174382, 'epsilon': 2.328121399980311e-06, 'balanced_loss': False, 'epochs': 141, 'early_stopping_patience': 12, 'plateau_patience': 16, 'plateau_divider': 7}. Best is trial 4 with value: 0.9030303030303031.
