[I 2024-11-28 15:31:31,610] Trial 80 finished with value: 0.8727272727272727 and parameters: {'left_stride': 64, 'right_stride': 128, 'attention_pooling_operation': 'min', 'embedding_pooling_operation': 'mean', 'threshold': 0.9128458016418304, 'batch_size': 60, 'attention_heads': 8, 'hidden_dimension': 143, 'number_of_hidden_layers': 1, 'dropout_rate': 0.474067330961216, 'global_pooling': 'sum', 'learning_rate': 0.00037409361093389666, 'weight_decay': 3.2255872970792497e-06, 'beta_0': 0.8452118830138995, 'beta_1': 0.9826845003257374, 'epsilon': 1.033929799630723e-06, 'balanced_loss': True, 'epochs': 173, 'early_stopping_patience': 15, 'plateau_patience': 16, 'plateau_divider': 5}. Best is trial 56 with value: 0.9151515151515152.
[I 2024-11-28 15:38:01,294] Trial 81 finished with value: 0.9030303030303031 and parameters: {'left_stride': 64, 'right_stride': 64, 'attention_pooling_operation': 'min', 'embedding_pooling_operation': 'mean', 'threshold': 0.9237364696689916, 'batch_size': 26, 'attention_heads': 7, 'hidden_dimension': 117, 'number_of_hidden_layers': 1, 'dropout_rate': 0.489182089311183, 'global_pooling': 'mean', 'learning_rate': 0.0007549449648878148, 'weight_decay': 4.8804069794357585e-06, 'beta_0': 0.8680110272906812, 'beta_1': 0.9855940368217485, 'epsilon': 5.527470535068137e-07, 'balanced_loss': True, 'epochs': 171, 'early_stopping_patience': 14, 'plateau_patience': 15, 'plateau_divider': 8}. Best is trial 56 with value: 0.9151515151515152.
[I 2024-11-28 15:44:07,317] Trial 82 finished with value: 0.896969696969697 and parameters: {'left_stride': 64, 'right_stride': 64, 'attention_pooling_operation': 'min', 'embedding_pooling_operation': 'mean', 'threshold': 0.9227192780702497, 'batch_size': 23, 'attention_heads': 7, 'hidden_dimension': 118, 'number_of_hidden_layers': 1, 'dropout_rate': 0.4869228853817747, 'global_pooling': 'mean', 'learning_rate': 0.0005493709415225242, 'weight_decay': 4.783732116494305e-06, 'beta_0': 0.8638819355282514, 'beta_1': 0.9844466068514166, 'epsilon': 5.581245808977627e-07, 'balanced_loss': True, 'epochs': 172, 'early_stopping_patience': 13, 'plateau_patience': 15, 'plateau_divider': 8}. Best is trial 56 with value: 0.9151515151515152.
[I 2024-11-28 15:51:41,761] Trial 83 finished with value: 0.9030303030303031 and parameters: {'left_stride': 64, 'right_stride': 64, 'attention_pooling_operation': 'min', 'embedding_pooling_operation': 'mean', 'threshold': 0.9171343489301649, 'batch_size': 25, 'attention_heads': 8, 'hidden_dimension': 126, 'number_of_hidden_layers': 1, 'dropout_rate': 0.45723111164203945, 'global_pooling': 'mean', 'learning_rate': 0.0015560086362450074, 'weight_decay': 7.895869578224765e-06, 'beta_0': 0.8695380638598144, 'beta_1': 0.9855079176905299, 'epsilon': 2.41793313577075e-07, 'balanced_loss': True, 'epochs': 160, 'early_stopping_patience': 14, 'plateau_patience': 13, 'plateau_divider': 7}. Best is trial 56 with value: 0.9151515151515152.
[I 2024-11-28 15:58:21,553] Trial 84 finished with value: 0.896969696969697 and parameters: {'left_stride': 64, 'right_stride': 64, 'attention_pooling_operation': 'min', 'embedding_pooling_operation': 'mean', 'threshold': 0.9169689317592552, 'batch_size': 29, 'attention_heads': 8, 'hidden_dimension': 126, 'number_of_hidden_layers': 1, 'dropout_rate': 0.43362356559518594, 'global_pooling': 'mean', 'learning_rate': 0.0016747854183388798, 'weight_decay': 8.367279414203485e-06, 'beta_0': 0.8685644993048107, 'beta_1': 0.9857653445702981, 'epsilon': 2.4227157897627865e-07, 'balanced_loss': True, 'epochs': 162, 'early_stopping_patience': 14, 'plateau_patience': 13, 'plateau_divider': 7}. Best is trial 56 with value: 0.9151515151515152.
[I 2024-11-28 16:05:01,624] Trial 85 finished with value: 0.8909090909090909 and parameters: {'left_stride': 64, 'right_stride': 64, 'attention_pooling_operation': 'min', 'embedding_pooling_operation': 'mean', 'threshold': 0.9146553635199012, 'batch_size': 27, 'attention_heads': 7, 'hidden_dimension': 151, 'number_of_hidden_layers': 1, 'dropout_rate': 0.4568511824437585, 'global_pooling': 'mean', 'learning_rate': 0.0008152704391797732, 'weight_decay': 1.0340700609099977e-05, 'beta_0': 0.8393633158495446, 'beta_1': 0.9864454105022709, 'epsilon': 1.2010531600595084e-07, 'balanced_loss': True, 'epochs': 152, 'early_stopping_patience': 13, 'plateau_patience': 17, 'plateau_divider': 7}. Best is trial 56 with value: 0.9151515151515152.
[I 2024-11-28 16:11:25,816] Trial 86 finished with value: 0.8848484848484849 and parameters: {'left_stride': 64, 'right_stride': 0, 'attention_pooling_operation': 'max', 'embedding_pooling_operation': 'mean', 'threshold': 0.9091381063571625, 'batch_size': 19, 'attention_heads': 8, 'hidden_dimension': 115, 'number_of_hidden_layers': 1, 'dropout_rate': 0.47869843854513855, 'global_pooling': 'mean', 'learning_rate': 0.0013035805212985162, 'weight_decay': 3.36280342956449e-06, 'beta_0': 0.8592611819253768, 'beta_1': 0.9849248387991445, 'epsilon': 4.0712005635501787e-07, 'balanced_loss': True, 'epochs': 183, 'early_stopping_patience': 15, 'plateau_patience': 15, 'plateau_divider': 7}. Best is trial 56 with value: 0.9151515151515152.
[I 2024-11-28 16:17:37,782] Trial 87 finished with value: 0.9030303030303031 and parameters: {'left_stride': 64, 'right_stride': 64, 'attention_pooling_operation': 'min', 'embedding_pooling_operation': 'mean', 'threshold': 0.924811409042113, 'batch_size': 26, 'attention_heads': 7, 'hidden_dimension': 138, 'number_of_hidden_layers': 1, 'dropout_rate': 0.46770878510623654, 'global_pooling': 'mean', 'learning_rate': 0.0006685927013415013, 'weight_decay': 7.0799653532035284e-06, 'beta_0': 0.8609951559646625, 'beta_1': 0.9808233429836821, 'epsilon': 8.905099759081567e-08, 'balanced_loss': True, 'epochs': 158, 'early_stopping_patience': 12, 'plateau_patience': 13, 'plateau_divider': 6}. Best is trial 56 with value: 0.9151515151515152.
[I 2024-11-28 16:24:03,303] Trial 88 finished with value: 0.896969696969697 and parameters: {'left_stride': 64, 'right_stride': 64, 'attention_pooling_operation': 'min', 'embedding_pooling_operation': 'mean', 'threshold': 0.9187446452359549, 'batch_size': 26, 'attention_heads': 7, 'hidden_dimension': 137, 'number_of_hidden_layers': 1, 'dropout_rate': 0.4481154594359458, 'global_pooling': 'mean', 'learning_rate': 0.000730563207918347, 'weight_decay': 6.782730988743248e-06, 'beta_0': 0.8615080766014498, 'beta_1': 0.9809228484005703, 'epsilon': 8.599790912941144e-08, 'balanced_loss': True, 'epochs': 160, 'early_stopping_patience': 12, 'plateau_patience': 11, 'plateau_divider': 6}. Best is trial 56 with value: 0.9151515151515152.
[I 2024-11-28 16:31:15,619] Trial 89 finished with value: 0.8787878787878788 and parameters: {'left_stride': 64, 'right_stride': 256, 'attention_pooling_operation': 'min', 'embedding_pooling_operation': 'mean', 'threshold': 0.9253223098318958, 'batch_size': 34, 'attention_heads': 8, 'hidden_dimension': 143, 'number_of_hidden_layers': 1, 'dropout_rate': 0.4193428207684392, 'global_pooling': 'mean', 'learning_rate': 0.0015046641888454217, 'weight_decay': 5.247731584226249e-06, 'beta_0': 0.8656042117423114, 'beta_1': 0.9877739594506668, 'epsilon': 6.017709626944682e-08, 'balanced_loss': True, 'epochs': 168, 'early_stopping_patience': 14, 'plateau_patience': 13, 'plateau_divider': 5}. Best is trial 56 with value: 0.9151515151515152.
[I 2024-11-28 16:38:49,104] Trial 90 finished with value: 0.8666666666666667 and parameters: {'left_stride': 64, 'right_stride': 64, 'attention_pooling_operation': 'min', 'embedding_pooling_operation': 'mean', 'threshold': 0.9294239152373951, 'batch_size': 30, 'attention_heads': 8, 'hidden_dimension': 159, 'number_of_hidden_layers': 2, 'dropout_rate': 0.5026111663398759, 'global_pooling': 'max', 'learning_rate': 0.0023052378043483517, 'weight_decay': 3.293345903419686e-06, 'beta_0': 0.8473723648235206, 'beta_1': 0.9806306837082255, 'epsilon': 1.993751648555591e-06, 'balanced_loss': True, 'epochs': 166, 'early_stopping_patience': 12, 'plateau_patience': 25, 'plateau_divider': 6}. Best is trial 56 with value: 0.9151515151515152.
[I 2024-11-28 16:44:52,467] Trial 91 finished with value: 0.8787878787878788 and parameters: {'left_stride': 64, 'right_stride': 64, 'attention_pooling_operation': 'min', 'embedding_pooling_operation': 'mean', 'threshold': 0.9242912819687157, 'batch_size': 24, 'attention_heads': 7, 'hidden_dimension': 129, 'number_of_hidden_layers': 1, 'dropout_rate': 0.4675544810236043, 'global_pooling': 'mean', 'learning_rate': 0.0005521467988414604, 'weight_decay': 1.288600929677814e-05, 'beta_0': 0.8601267131678311, 'beta_1': 0.9840036732707447, 'epsilon': 2.681028116665259e-07, 'balanced_loss': True, 'epochs': 50, 'early_stopping_patience': 11, 'plateau_patience': 14, 'plateau_divider': 7}. Best is trial 56 with value: 0.9151515151515152.
[I 2024-11-28 16:51:07,103] Trial 92 finished with value: 0.9030303030303031 and parameters: {'left_stride': 64, 'right_stride': 64, 'attention_pooling_operation': 'min', 'embedding_pooling_operation': 'mean', 'threshold': 0.9115785983763165, 'batch_size': 22, 'attention_heads': 7, 'hidden_dimension': 125, 'number_of_hidden_layers': 1, 'dropout_rate': 0.46075585493921967, 'global_pooling': 'mean', 'learning_rate': 0.0009300886687213116, 'weight_decay': 6.7526594596098546e-06, 'beta_0': 0.8985382618666039, 'beta_1': 0.9856183321287078, 'epsilon': 2.050804325502904e-07, 'balanced_loss': True, 'epochs': 148, 'early_stopping_patience': 14, 'plateau_patience': 12, 'plateau_divider': 8}. Best is trial 56 with value: 0.9151515151515152.
[I 2024-11-28 16:58:00,754] Trial 93 finished with value: 0.9030303030303031 and parameters: {'left_stride': 64, 'right_stride': 64, 'attention_pooling_operation': 'min', 'embedding_pooling_operation': 'mean', 'threshold': 0.9121306029160525, 'batch_size': 19, 'attention_heads': 7, 'hidden_dimension': 122, 'number_of_hidden_layers': 1, 'dropout_rate': 0.46162281763686697, 'global_pooling': 'mean', 'learning_rate': 0.000850392544617697, 'weight_decay': 7.219535904028805e-06, 'beta_0': 0.869160637166777, 'beta_1': 0.9856532894120454, 'epsilon': 1.7903889421829914e-07, 'balanced_loss': True, 'epochs': 149, 'early_stopping_patience': 14, 'plateau_patience': 12, 'plateau_divider': 8}. Best is trial 56 with value: 0.9151515151515152.
[I 2024-11-28 17:04:28,497] Trial 94 finished with value: 0.9030303030303031 and parameters: {'left_stride': 64, 'right_stride': 64, 'attention_pooling_operation': 'min', 'embedding_pooling_operation': 'mean', 'threshold': 0.9110291638601572, 'batch_size': 18, 'attention_heads': 7, 'hidden_dimension': 123, 'number_of_hidden_layers': 1, 'dropout_rate': 0.4614984897981835, 'global_pooling': 'mean', 'learning_rate': 0.0010036041475219675, 'weight_decay': 7.056345672298733e-06, 'beta_0': 0.8684712719364337, 'beta_1': 0.9857571389942791, 'epsilon': 2.1034189012350263e-07, 'balanced_loss': True, 'epochs': 149, 'early_stopping_patience': 14, 'plateau_patience': 12, 'plateau_divider': 8}. Best is trial 56 with value: 0.9151515151515152.
[I 2024-11-28 17:10:56,404] Trial 95 finished with value: 0.8848484848484849 and parameters: {'left_stride': 64, 'right_stride': 64, 'attention_pooling_operation': 'min', 'embedding_pooling_operation': 'mean', 'threshold': 0.9072573859204974, 'batch_size': 22, 'attention_heads': 7, 'hidden_dimension': 139, 'number_of_hidden_layers': 1, 'dropout_rate': 0.4492305016300082, 'global_pooling': 'mean', 'learning_rate': 0.0008800435278481908, 'weight_decay': 9.17650922563574e-06, 'beta_0': 0.852409445981323, 'beta_1': 0.986696373263324, 'epsilon': 9.238412415100029e-08, 'balanced_loss': True, 'epochs': 140, 'early_stopping_patience': 13, 'plateau_patience': 12, 'plateau_divider': 8}. Best is trial 56 with value: 0.9151515151515152.
[I 2024-11-28 17:17:24,849] Trial 96 finished with value: 0.9090909090909091 and parameters: {'left_stride': 64, 'right_stride': 64, 'attention_pooling_operation': 'min', 'embedding_pooling_operation': 'mean', 'threshold': 0.9049656426149636, 'batch_size': 26, 'attention_heads': 6, 'hidden_dimension': 110, 'number_of_hidden_layers': 1, 'dropout_rate': 0.4042502286889096, 'global_pooling': 'mean', 'learning_rate': 0.0011512349368807302, 'weight_decay': 5.409895098670635e-06, 'beta_0': 0.8720240075227661, 'beta_1': 0.9873085086288603, 'epsilon': 1.3653983002549307e-07, 'balanced_loss': True, 'epochs': 159, 'early_stopping_patience': 15, 'plateau_patience': 11, 'plateau_divider': 8}. Best is trial 56 with value: 0.9151515151515152.
[I 2024-11-28 17:24:05,484] Trial 97 finished with value: 0.9090909090909091 and parameters: {'left_stride': 64, 'right_stride': 64, 'attention_pooling_operation': 'min', 'embedding_pooling_operation': 'mean', 'threshold': 0.9040172655349936, 'batch_size': 26, 'attention_heads': 6, 'hidden_dimension': 110, 'number_of_hidden_layers': 1, 'dropout_rate': 0.49179962970338115, 'global_pooling': 'mean', 'learning_rate': 0.0012300144087965268, 'weight_decay': 4.9908046028880235e-06, 'beta_0': 0.8575350477503062, 'beta_1': 0.9862339424130293, 'epsilon': 1.3083461202100686e-07, 'balanced_loss': True, 'epochs': 160, 'early_stopping_patience': 15, 'plateau_patience': 10, 'plateau_divider': 8}. Best is trial 56 with value: 0.9151515151515152.
[I 2024-11-28 17:30:01,728] Trial 98 finished with value: 0.8848484848484849 and parameters: {'left_stride': 64, 'right_stride': 64, 'attention_pooling_operation': 'min', 'embedding_pooling_operation': 'mean', 'threshold': 0.9052826756689153, 'batch_size': 26, 'attention_heads': 5, 'hidden_dimension': 108, 'number_of_hidden_layers': 1, 'dropout_rate': 0.38789058796884257, 'global_pooling': 'mean', 'learning_rate': 0.001185156014933554, 'weight_decay': 5.547784054308414e-06, 'beta_0': 0.8563856748823235, 'beta_1': 0.987289912448666, 'epsilon': 1.392491711929827e-07, 'balanced_loss': True, 'epochs': 157, 'early_stopping_patience': 15, 'plateau_patience': 10, 'plateau_divider': 6}. Best is trial 56 with value: 0.9151515151515152.
[I 2024-11-28 17:36:18,894] Trial 99 finished with value: 0.8909090909090909 and parameters: {'left_stride': 64, 'right_stride': 64, 'attention_pooling_operation': 'min', 'embedding_pooling_operation': 'mean', 'threshold': 0.9017246923279387, 'batch_size': 29, 'attention_heads': 6, 'hidden_dimension': 112, 'number_of_hidden_layers': 1, 'dropout_rate': 0.4030547989891917, 'global_pooling': 'mean', 'learning_rate': 0.0031203038121052572, 'weight_decay': 4.8958187608018015e-06, 'beta_0': 0.8714607687155799, 'beta_1': 0.9848967214896892, 'epsilon': 1.1018349971361246e-07, 'balanced_loss': True, 'epochs': 160, 'early_stopping_patience': 16, 'plateau_patience': 11, 'plateau_divider': 5}. Best is trial 56 with value: 0.9151515151515152.
[I 2024-11-28 17:42:20,637] Trial 100 finished with value: 0.896969696969697 and parameters: {'left_stride': 64, 'right_stride': 64, 'attention_pooling_operation': 'min', 'embedding_pooling_operation': 'mean', 'threshold': 0.9031010558434486, 'batch_size': 25, 'attention_heads': 6, 'hidden_dimension': 90, 'number_of_hidden_layers': 1, 'dropout_rate': 0.4954928376733125, 'global_pooling': 'mean', 'learning_rate': 0.0049733210661833714, 'weight_decay': 3.7377955453265277e-06, 'beta_0': 0.8766380722726235, 'beta_1': 0.9862076068450313, 'epsilon': 3.30893173287979e-07, 'balanced_loss': True, 'epochs': 154, 'early_stopping_patience': 15, 'plateau_patience': 10, 'plateau_divider': 8}. Best is trial 56 with value: 0.9151515151515152.
[I 2024-11-28 17:48:33,460] Trial 101 finished with value: 0.8848484848484849 and parameters: {'left_stride': 64, 'right_stride': 64, 'attention_pooling_operation': 'min', 'embedding_pooling_operation': 'mean', 'threshold': 0.9080476127062788, 'batch_size': 23, 'attention_heads': 6, 'hidden_dimension': 132, 'number_of_hidden_layers': 1, 'dropout_rate': 0.36974418936987696, 'global_pooling': 'mean', 'learning_rate': 0.0017357714456615006, 'weight_decay': 2.7252686040517287e-06, 'beta_0': 0.8630565695747274, 'beta_1': 0.9845840949981038, 'epsilon': 7.0450572040557e-08, 'balanced_loss': True, 'epochs': 160, 'early_stopping_patience': 14, 'plateau_patience': 11, 'plateau_divider': 8}. Best is trial 56 with value: 0.9151515151515152.
[I 2024-11-28 17:54:50,832] Trial 102 finished with value: 0.9090909090909091 and parameters: {'left_stride': 64, 'right_stride': 64, 'attention_pooling_operation': 'min', 'embedding_pooling_operation': 'mean', 'threshold': 0.9157233400678292, 'batch_size': 27, 'attention_heads': 5, 'hidden_dimension': 148, 'number_of_hidden_layers': 1, 'dropout_rate': 0.4715080571375258, 'global_pooling': 'mean', 'learning_rate': 0.002124393017783456, 'weight_decay': 6.242797037153239e-06, 'beta_0': 0.8653231732332112, 'beta_1': 0.9874534327355655, 'epsilon': 1.6615217544578973e-07, 'balanced_loss': True, 'epochs': 176, 'early_stopping_patience': 16, 'plateau_patience': 10, 'plateau_divider': 7}. Best is trial 56 with value: 0.9151515151515152.
[I 2024-11-28 18:01:39,161] Trial 103 finished with value: 0.8848484848484849 and parameters: {'left_stride': 64, 'right_stride': 64, 'attention_pooling_operation': 'min', 'embedding_pooling_operation': 'mean', 'threshold': 0.9160922966770573, 'batch_size': 27, 'attention_heads': 5, 'hidden_dimension': 148, 'number_of_hidden_layers': 1, 'dropout_rate': 0.47459411294707027, 'global_pooling': 'mean', 'learning_rate': 0.0022041191935368745, 'weight_decay': 1.8694629255954956e-06, 'beta_0': 0.8664927850094959, 'beta_1': 0.9867604655828495, 'epsilon': 1.2426853672223066e-07, 'balanced_loss': True, 'epochs': 171, 'early_stopping_patience': 16, 'plateau_patience': 10, 'plateau_divider': 7}. Best is trial 56 with value: 0.9151515151515152.
[I 2024-11-28 18:08:06,059] Trial 104 finished with value: 0.9090909090909091 and parameters: {'left_stride': 64, 'right_stride': 64, 'attention_pooling_operation': 'min', 'embedding_pooling_operation': 'mean', 'threshold': 0.9056525513441126, 'batch_size': 31, 'attention_heads': 5, 'hidden_dimension': 119, 'number_of_hidden_layers': 1, 'dropout_rate': 0.48996782600075534, 'global_pooling': 'mean', 'learning_rate': 0.0014531959646706795, 'weight_decay': 9.143752365745705e-06, 'beta_0': 0.8645310483871536, 'beta_1': 0.9883574008765714, 'epsilon': 3.989080736228266e-08, 'balanced_loss': True, 'epochs': 177, 'early_stopping_patience': 16, 'plateau_patience': 10, 'plateau_divider': 7}. Best is trial 56 with value: 0.9151515151515152.
[I 2024-11-28 18:14:15,500] Trial 105 finished with value: 0.9030303030303031 and parameters: {'left_stride': 64, 'right_stride': 64, 'attention_pooling_operation': 'min', 'embedding_pooling_operation': 'mean', 'threshold': 0.9005181520442136, 'batch_size': 31, 'attention_heads': 5, 'hidden_dimension': 101, 'number_of_hidden_layers': 1, 'dropout_rate': 0.49024421068757484, 'global_pooling': 'mean', 'learning_rate': 0.0018756834654416236, 'weight_decay': 9.131057521085645e-06, 'beta_0': 0.8725005578601119, 'beta_1': 0.9875737915248899, 'epsilon': 3.5419817538049986e-08, 'balanced_loss': True, 'epochs': 176, 'early_stopping_patience': 17, 'plateau_patience': 10, 'plateau_divider': 7}. Best is trial 56 with value: 0.9151515151515152.
[I 2024-11-28 18:20:21,382] Trial 106 finished with value: 0.8666666666666667 and parameters: {'left_stride': 64, 'right_stride': 128, 'attention_pooling_operation': 'min', 'embedding_pooling_operation': 'mean', 'threshold': 0.9059748993052913, 'batch_size': 28, 'attention_heads': 4, 'hidden_dimension': 95, 'number_of_hidden_layers': 1, 'dropout_rate': 0.5041801613882131, 'global_pooling': 'sum', 'learning_rate': 0.0027934133730004003, 'weight_decay': 4.6475739172798244e-06, 'beta_0': 0.8643801500436898, 'beta_1': 0.9862392931749843, 'epsilon': 4.728330785516505e-08, 'balanced_loss': True, 'epochs': 183, 'early_stopping_patience': 16, 'plateau_patience': 10, 'plateau_divider': 7}. Best is trial 56 with value: 0.9151515151515152.
[I 2024-11-28 18:26:41,796] Trial 107 finished with value: 0.9030303030303031 and parameters: {'left_stride': 64, 'right_stride': 64, 'attention_pooling_operation': 'min', 'embedding_pooling_operation': 'mean', 'threshold': 0.9047246338775903, 'batch_size': 36, 'attention_heads': 5, 'hidden_dimension': 120, 'number_of_hidden_layers': 1, 'dropout_rate': 0.479956239784455, 'global_pooling': 'mean', 'learning_rate': 0.0013732314146903983, 'weight_decay': 1.4813058087930674e-06, 'beta_0': 0.8580760352834031, 'beta_1': 0.9885384869892894, 'epsilon': 2.773567004053187e-08, 'balanced_loss': True, 'epochs': 175, 'early_stopping_patience': 15, 'plateau_patience': 11, 'plateau_divider': 7}. Best is trial 56 with value: 0.9151515151515152.
[I 2024-11-28 18:33:20,957] Trial 108 finished with value: 0.8787878787878788 and parameters: {'left_stride': 256, 'right_stride': 64, 'attention_pooling_operation': 'min', 'embedding_pooling_operation': 'mean', 'threshold': 0.9143049524922797, 'batch_size': 25, 'attention_heads': 4, 'hidden_dimension': 115, 'number_of_hidden_layers': 1, 'dropout_rate': 0.4937573981247213, 'global_pooling': 'mean', 'learning_rate': 0.0015891612310487795, 'weight_decay': 1.388535183418255e-05, 'beta_0': 0.8674749815279029, 'beta_1': 0.9881007002288635, 'epsilon': 4.761709592491532e-07, 'balanced_loss': True, 'epochs': 189, 'early_stopping_patience': 17, 'plateau_patience': 10, 'plateau_divider': 7}. Best is trial 56 with value: 0.9151515151515152.
CUDA out of memory. Tried to allocate 7.28 GiB. GPU 0 has a total capacity of 44.56 GiB of which 3.22 GiB is free. Including non-PyTorch memory, this process has 41.33 GiB memory in use. Of the allocated memory 39.34 GiB is allocated by PyTorch, and 860.38 MiB is reserved by PyTorch but unallocated. If reserved but unallocated memory is large try setting PYTORCH_CUDA_ALLOC_CONF=expandable_segments:True to avoid fragmentation.  See documentation for Memory Management  (https://pytorch.org/docs/stable/notes/cuda.html#environment-variables)
