[I 2024-12-26 03:52:06,361] Trial 362 finished with value: 0.9696969696969697 and parameters: {'left_stride': 256, 'right_stride': 32, 'attention_pooling_operation': 'mean', 'embedding_pooling_operation': 'min', 'threshold': 0.9833316025952703, 'batch_size': 27, 'attention_heads': 4, 'hidden_dimension': 36, 'number_of_hidden_layers': 2, 'dropout_rate': 0.3900521324999321, 'global_pooling': 'mean', 'learning_rate': 6.377587598178137e-05, 'weight_decay': 0.0005032341007390568, 'beta_0': 0.8550623672765557, 'beta_1': 0.9942254350301634, 'epsilon': 1.0047447860331518e-08, 'balanced_loss': False, 'epochs': 177, 'early_stopping_patience': 16, 'plateau_patience': 24, 'plateau_divider': 8}. Best is trial 177 with value: 0.9757575757575757.
[I 2024-12-26 04:24:30,829] Trial 363 finished with value: 0.9515151515151515 and parameters: {'left_stride': 256, 'right_stride': 32, 'attention_pooling_operation': 'mean', 'embedding_pooling_operation': 'min', 'threshold': 0.9814537744185095, 'batch_size': 39, 'attention_heads': 5, 'hidden_dimension': 32, 'number_of_hidden_layers': 2, 'dropout_rate': 0.37042496739741765, 'global_pooling': 'mean', 'learning_rate': 4.949870346526198e-05, 'weight_decay': 0.0002919461399088505, 'beta_0': 0.8525916049912031, 'beta_1': 0.9967269152594854, 'epsilon': 1.3037770773751864e-08, 'balanced_loss': False, 'epochs': 172, 'early_stopping_patience': 15, 'plateau_patience': 25, 'plateau_divider': 9}. Best is trial 177 with value: 0.9757575757575757.
CUDA out of memory. Tried to allocate 1.19 GiB. GPU 0 has a total capacity of 44.56 GiB of which 466.69 MiB is free. Including non-PyTorch memory, this process has 44.10 GiB memory in use. Of the allocated memory 37.41 GiB is allocated by PyTorch, and 5.54 GiB is reserved by PyTorch but unallocated. If reserved but unallocated memory is large try setting PYTORCH_CUDA_ALLOC_CONF=expandable_segments:True to avoid fragmentation.  See documentation for Memory Management  (https://pytorch.org/docs/stable/notes/cuda.html#environment-variables)
[I 2024-12-26 04:42:50,363] Trial 364 finished with value: -1.0 and parameters: {'left_stride': 256, 'right_stride': 32, 'attention_pooling_operation': 'mean', 'embedding_pooling_operation': 'min', 'threshold': 0.9537007750601187, 'batch_size': 34, 'attention_heads': 4, 'hidden_dimension': 40, 'number_of_hidden_layers': 2, 'dropout_rate': 0.4007302827765526, 'global_pooling': 'mean', 'learning_rate': 0.00011414587198333077, 'weight_decay': 0.0004233666647614394, 'beta_0': 0.8598416544546456, 'beta_1': 0.9920523062374165, 'epsilon': 1.7278174810914513e-08, 'balanced_loss': False, 'epochs': 180, 'early_stopping_patience': 18, 'plateau_patience': 25, 'plateau_divider': 8}. Best is trial 177 with value: 0.9757575757575757.
CUDA out of memory. Tried to allocate 2.67 GiB. GPU 0 has a total capacity of 44.56 GiB of which 776.69 MiB is free. Including non-PyTorch memory, this process has 43.79 GiB memory in use. Of the allocated memory 36.55 GiB is allocated by PyTorch, and 6.09 GiB is reserved by PyTorch but unallocated. If reserved but unallocated memory is large try setting PYTORCH_CUDA_ALLOC_CONF=expandable_segments:True to avoid fragmentation.  See documentation for Memory Management  (https://pytorch.org/docs/stable/notes/cuda.html#environment-variables)
[I 2024-12-26 05:08:14,905] Trial 365 finished with value: -1.0 and parameters: {'left_stride': 256, 'right_stride': 32, 'attention_pooling_operation': 'mean', 'embedding_pooling_operation': 'min', 'threshold': 0.9765891154628905, 'batch_size': 32, 'attention_heads': 4, 'hidden_dimension': 37, 'number_of_hidden_layers': 2, 'dropout_rate': 0.3767627752583195, 'global_pooling': 'mean', 'learning_rate': 7.639267462920991e-05, 'weight_decay': 0.00033910421831887915, 'beta_0': 0.8496069428019907, 'beta_1': 0.9936955728294579, 'epsilon': 2.948810224120871e-05, 'balanced_loss': False, 'epochs': 174, 'early_stopping_patience': 17, 'plateau_patience': 25, 'plateau_divider': 9}. Best is trial 177 with value: 0.9757575757575757.
CUDA out of memory. Tried to allocate 2.67 GiB. GPU 0 has a total capacity of 44.56 GiB of which 1.81 GiB is free. Including non-PyTorch memory, this process has 42.75 GiB memory in use. Of the allocated memory 34.65 GiB is allocated by PyTorch, and 6.94 GiB is reserved by PyTorch but unallocated. If reserved but unallocated memory is large try setting PYTORCH_CUDA_ALLOC_CONF=expandable_segments:True to avoid fragmentation.  See documentation for Memory Management  (https://pytorch.org/docs/stable/notes/cuda.html#environment-variables)
[I 2024-12-26 05:33:37,816] Trial 366 finished with value: -1.0 and parameters: {'left_stride': 256, 'right_stride': 32, 'attention_pooling_operation': 'mean', 'embedding_pooling_operation': 'min', 'threshold': 0.9790807471112432, 'batch_size': 35, 'attention_heads': 4, 'hidden_dimension': 47, 'number_of_hidden_layers': 2, 'dropout_rate': 0.38449757150562747, 'global_pooling': 'max', 'learning_rate': 8.99253530238867e-05, 'weight_decay': 0.0005964106298642936, 'beta_0': 0.8447705387882609, 'beta_1': 0.9947423277817825, 'epsilon': 1.38983935486227e-08, 'balanced_loss': False, 'epochs': 166, 'early_stopping_patience': 16, 'plateau_patience': 25, 'plateau_divider': 8}. Best is trial 177 with value: 0.9757575757575757.
CUDA out of memory. Tried to allocate 1.36 GiB. GPU 0 has a total capacity of 44.56 GiB of which 886.69 MiB is free. Including non-PyTorch memory, this process has 43.69 GiB memory in use. Of the allocated memory 36.89 GiB is allocated by PyTorch, and 5.64 GiB is reserved by PyTorch but unallocated. If reserved but unallocated memory is large try setting PYTORCH_CUDA_ALLOC_CONF=expandable_segments:True to avoid fragmentation.  See documentation for Memory Management  (https://pytorch.org/docs/stable/notes/cuda.html#environment-variables)
[I 2024-12-26 05:43:04,022] Trial 367 finished with value: -1.0 and parameters: {'left_stride': 256, 'right_stride': 32, 'attention_pooling_operation': 'mean', 'embedding_pooling_operation': 'min', 'threshold': 0.9112110341732346, 'batch_size': 33, 'attention_heads': 5, 'hidden_dimension': 229, 'number_of_hidden_layers': 2, 'dropout_rate': 0.3633088252930147, 'global_pooling': 'mean', 'learning_rate': 0.00013674638990498981, 'weight_decay': 0.0004775716748566243, 'beta_0': 0.8509667589935668, 'beta_1': 0.9923261684082124, 'epsilon': 1.1783747899059154e-08, 'balanced_loss': False, 'epochs': 170, 'early_stopping_patience': 18, 'plateau_patience': 25, 'plateau_divider': 7}. Best is trial 177 with value: 0.9757575757575757.
[I 2024-12-26 06:13:53,778] Trial 368 finished with value: 0.9757575757575757 and parameters: {'left_stride': 256, 'right_stride': 32, 'attention_pooling_operation': 'mean', 'embedding_pooling_operation': 'min', 'threshold': 0.9860918723915445, 'batch_size': 30, 'attention_heads': 4, 'hidden_dimension': 32, 'number_of_hidden_layers': 2, 'dropout_rate': 0.3918639769356017, 'global_pooling': 'mean', 'learning_rate': 6.314366583466479e-05, 'weight_decay': 0.0003861174883644797, 'beta_0': 0.846984573823395, 'beta_1': 0.9915049279441801, 'epsilon': 2.191929327552372e-08, 'balanced_loss': False, 'epochs': 178, 'early_stopping_patience': 17, 'plateau_patience': 25, 'plateau_divider': 8}. Best is trial 177 with value: 0.9757575757575757.
[I 2024-12-26 06:44:49,514] Trial 369 finished with value: 0.9696969696969697 and parameters: {'left_stride': 32, 'right_stride': 128, 'attention_pooling_operation': 'mean', 'embedding_pooling_operation': 'min', 'threshold': 0.984336682941437, 'batch_size': 29, 'attention_heads': 4, 'hidden_dimension': 39, 'number_of_hidden_layers': 2, 'dropout_rate': 0.3727771471752273, 'global_pooling': 'mean', 'learning_rate': 4.842594560160232e-05, 'weight_decay': 0.000314778085876874, 'beta_0': 0.8540110476030263, 'beta_1': 0.993327200940497, 'epsilon': 1.4944150445765345e-08, 'balanced_loss': False, 'epochs': 184, 'early_stopping_patience': 16, 'plateau_patience': 24, 'plateau_divider': 9}. Best is trial 177 with value: 0.9757575757575757.
[I 2024-12-26 07:18:59,107] Trial 370 finished with value: 0.9636363636363636 and parameters: {'left_stride': 256, 'right_stride': 32, 'attention_pooling_operation': 'mean', 'embedding_pooling_operation': 'min', 'threshold': 0.9820615790959265, 'batch_size': 31, 'attention_heads': 4, 'hidden_dimension': 36, 'number_of_hidden_layers': 2, 'dropout_rate': 0.41611796842468846, 'global_pooling': 'mean', 'learning_rate': 2.8490105443729465e-05, 'weight_decay': 0.00023964863792587794, 'beta_0': 0.8421166642177362, 'beta_1': 0.9940244393022669, 'epsilon': 1.87031035312488e-08, 'balanced_loss': False, 'epochs': 176, 'early_stopping_patience': 19, 'plateau_patience': 24, 'plateau_divider': 8}. Best is trial 177 with value: 0.9757575757575757.
CUDA out of memory. Tried to allocate 2.67 GiB. GPU 0 has a total capacity of 44.56 GiB of which 1.81 GiB is free. Including non-PyTorch memory, this process has 42.75 GiB memory in use. Of the allocated memory 34.62 GiB is allocated by PyTorch, and 6.98 GiB is reserved by PyTorch but unallocated. If reserved but unallocated memory is large try setting PYTORCH_CUDA_ALLOC_CONF=expandable_segments:True to avoid fragmentation.  See documentation for Memory Management  (https://pytorch.org/docs/stable/notes/cuda.html#environment-variables)
[I 2024-12-26 07:44:24,288] Trial 371 finished with value: -1.0 and parameters: {'left_stride': 256, 'right_stride': 32, 'attention_pooling_operation': 'mean', 'embedding_pooling_operation': 'min', 'threshold': 0.9790811683655514, 'batch_size': 34, 'attention_heads': 4, 'hidden_dimension': 43, 'number_of_hidden_layers': 2, 'dropout_rate': 0.38184824493102953, 'global_pooling': 'mean', 'learning_rate': 1.4201887701045446e-05, 'weight_decay': 1.4911601232263379e-06, 'beta_0': 0.8245974596685991, 'beta_1': 0.9929008998242298, 'epsilon': 1.1887581437425311e-08, 'balanced_loss': False, 'epochs': 181, 'early_stopping_patience': 17, 'plateau_patience': 25, 'plateau_divider': 8}. Best is trial 177 with value: 0.9757575757575757.
[I 2024-12-26 08:18:04,072] Trial 372 finished with value: 0.9757575757575757 and parameters: {'left_stride': 256, 'right_stride': 32, 'attention_pooling_operation': 'mean', 'embedding_pooling_operation': 'min', 'threshold': 0.9833130133168853, 'batch_size': 37, 'attention_heads': 5, 'hidden_dimension': 37, 'number_of_hidden_layers': 2, 'dropout_rate': 0.3503426304662276, 'global_pooling': 'mean', 'learning_rate': 3.963080557128461e-05, 'weight_decay': 0.0005225015525075279, 'beta_0': 0.8569234687916917, 'beta_1': 0.9936454687443739, 'epsilon': 1.3799285204213843e-08, 'balanced_loss': False, 'epochs': 173, 'early_stopping_patience': 16, 'plateau_patience': 25, 'plateau_divider': 8}. Best is trial 177 with value: 0.9757575757575757.
[I 2024-12-26 08:48:38,400] Trial 373 finished with value: 0.9696969696969697 and parameters: {'left_stride': 256, 'right_stride': 32, 'attention_pooling_operation': 'mean', 'embedding_pooling_operation': 'min', 'threshold': 0.9871112295103673, 'batch_size': 33, 'attention_heads': 4, 'hidden_dimension': 56, 'number_of_hidden_layers': 2, 'dropout_rate': 0.39587946603082214, 'global_pooling': 'mean', 'learning_rate': 9.976980896407014e-05, 'weight_decay': 0.0004411840197898986, 'beta_0': 0.8486483383683051, 'beta_1': 0.9957455680686355, 'epsilon': 1.727795715466537e-08, 'balanced_loss': False, 'epochs': 169, 'early_stopping_patience': 18, 'plateau_patience': 25, 'plateau_divider': 9}. Best is trial 177 with value: 0.9757575757575757.
[I 2024-12-26 09:20:30,226] Trial 374 finished with value: 0.9757575757575757 and parameters: {'left_stride': 256, 'right_stride': 32, 'attention_pooling_operation': 'mean', 'embedding_pooling_operation': 'min', 'threshold': 0.9808568905739506, 'batch_size': 28, 'attention_heads': 4, 'hidden_dimension': 32, 'number_of_hidden_layers': 2, 'dropout_rate': 0.42299680348193425, 'global_pooling': 'mean', 'learning_rate': 5.559188812591042e-05, 'weight_decay': 0.00037684118844643846, 'beta_0': 0.8519263607240334, 'beta_1': 0.9943446699992549, 'epsilon': 1.1648451427263909e-08, 'balanced_loss': False, 'epochs': 163, 'early_stopping_patience': 15, 'plateau_patience': 25, 'plateau_divider': 8}. Best is trial 177 with value: 0.9757575757575757.
CUDA out of memory. Tried to allocate 1.92 GiB. GPU 0 has a total capacity of 44.56 GiB of which 650.69 MiB is free. Including non-PyTorch memory, this process has 43.92 GiB memory in use. Of the allocated memory 34.27 GiB is allocated by PyTorch, and 8.50 GiB is reserved by PyTorch but unallocated. If reserved but unallocated memory is large try setting PYTORCH_CUDA_ALLOC_CONF=expandable_segments:True to avoid fragmentation.  See documentation for Memory Management  (https://pytorch.org/docs/stable/notes/cuda.html#environment-variables)
[I 2024-12-26 09:27:59,393] Trial 375 finished with value: -1.0 and parameters: {'left_stride': 256, 'right_stride': 256, 'attention_pooling_operation': 'mean', 'embedding_pooling_operation': 'min', 'threshold': 0.9010554075031962, 'batch_size': 32, 'attention_heads': 4, 'hidden_dimension': 32, 'number_of_hidden_layers': 2, 'dropout_rate': 0.36530969121846113, 'global_pooling': 'mean', 'learning_rate': 7.857272248480835e-05, 'weight_decay': 0.0006293123316129994, 'beta_0': 0.8551044821132812, 'beta_1': 0.9925962535771268, 'epsilon': 1.0065853791929611e-08, 'balanced_loss': False, 'epochs': 187, 'early_stopping_patience': 17, 'plateau_patience': 25, 'plateau_divider': 8}. Best is trial 177 with value: 0.9757575757575757.
[I 2024-12-26 09:57:46,737] Trial 376 finished with value: 0.9757575757575757 and parameters: {'left_stride': 256, 'right_stride': 32, 'attention_pooling_operation': 'mean', 'embedding_pooling_operation': 'min', 'threshold': 0.9847874808979454, 'batch_size': 35, 'attention_heads': 4, 'hidden_dimension': 42, 'number_of_hidden_layers': 2, 'dropout_rate': 0.3592796679323732, 'global_pooling': 'mean', 'learning_rate': 0.0001630309579872099, 'weight_decay': 0.0004247940290532149, 'beta_0': 0.8500126372878131, 'beta_1': 0.995326637180474, 'epsilon': 1.5474722291692083e-08, 'balanced_loss': False, 'epochs': 179, 'early_stopping_patience': 16, 'plateau_patience': 24, 'plateau_divider': 7}. Best is trial 177 with value: 0.9757575757575757.
[I 2024-12-26 10:30:50,094] Trial 377 finished with value: 0.9636363636363636 and parameters: {'left_stride': 256, 'right_stride': 32, 'attention_pooling_operation': 'mean', 'embedding_pooling_operation': 'mean', 'threshold': 0.982744995996586, 'batch_size': 36, 'attention_heads': 9, 'hidden_dimension': 36, 'number_of_hidden_layers': 2, 'dropout_rate': 0.3759215307323879, 'global_pooling': 'mean', 'learning_rate': 6.828137655559781e-05, 'weight_decay': 0.00031633193342516967, 'beta_0': 0.8530897206258381, 'beta_1': 0.9933815720495334, 'epsilon': 1.3441859124548037e-08, 'balanced_loss': True, 'epochs': 175, 'early_stopping_patience': 18, 'plateau_patience': 25, 'plateau_divider': 8}. Best is trial 177 with value: 0.9757575757575757.
[I 2024-12-26 10:59:56,353] Trial 378 finished with value: 0.9575757575757575 and parameters: {'left_stride': 64, 'right_stride': 32, 'attention_pooling_operation': 'mean', 'embedding_pooling_operation': 'min', 'threshold': 0.9781372055665495, 'batch_size': 31, 'attention_heads': 4, 'hidden_dimension': 40, 'number_of_hidden_layers': 2, 'dropout_rate': 0.38608944058329303, 'global_pooling': 'mean', 'learning_rate': 0.00010926399010845008, 'weight_decay': 0.0005218746530483955, 'beta_0': 0.8476638188918281, 'beta_1': 0.9930220930508402, 'epsilon': 2.387888332577198e-08, 'balanced_loss': False, 'epochs': 182, 'early_stopping_patience': 15, 'plateau_patience': 24, 'plateau_divider': 6}. Best is trial 177 with value: 0.9757575757575757.
[I 2024-12-26 11:32:45,960] Trial 379 finished with value: 0.9696969696969697 and parameters: {'left_stride': 256, 'right_stride': 32, 'attention_pooling_operation': 'mean', 'embedding_pooling_operation': 'min', 'threshold': 0.9807149296131951, 'batch_size': 28, 'attention_heads': 4, 'hidden_dimension': 46, 'number_of_hidden_layers': 2, 'dropout_rate': 0.40606557387051645, 'global_pooling': 'mean', 'learning_rate': 4.5808543631686656e-05, 'weight_decay': 0.00016890560318962564, 'beta_0': 0.8579597204066778, 'beta_1': 0.9939371596882416, 'epsilon': 1.8512211255658666e-08, 'balanced_loss': False, 'epochs': 172, 'early_stopping_patience': 17, 'plateau_patience': 25, 'plateau_divider': 9}. Best is trial 177 with value: 0.9757575757575757.
[I 2024-12-26 12:03:49,524] Trial 380 finished with value: 0.9696969696969697 and parameters: {'left_stride': 256, 'right_stride': 32, 'attention_pooling_operation': 'mean', 'embedding_pooling_operation': 'min', 'threshold': 0.98520254152727, 'batch_size': 34, 'attention_heads': 4, 'hidden_dimension': 36, 'number_of_hidden_layers': 2, 'dropout_rate': 0.37214400801221503, 'global_pooling': 'mean', 'learning_rate': 5.749168452869e-05, 'weight_decay': 0.00036602171853037513, 'beta_0': 0.843632747767741, 'beta_1': 0.9945826319643418, 'epsilon': 2.6411942014427054e-06, 'balanced_loss': False, 'epochs': 177, 'early_stopping_patience': 16, 'plateau_patience': 25, 'plateau_divider': 8}. Best is trial 177 with value: 0.9757575757575757.
[I 2024-12-26 12:36:00,789] Trial 381 finished with value: 0.9515151515151515 and parameters: {'left_stride': 256, 'right_stride': 32, 'attention_pooling_operation': 'mean', 'embedding_pooling_operation': 'min', 'threshold': 0.9886818186223455, 'batch_size': 48, 'attention_heads': 5, 'hidden_dimension': 32, 'number_of_hidden_layers': 2, 'dropout_rate': 0.38054871674573404, 'global_pooling': 'mean', 'learning_rate': 3.444888053273698e-05, 'weight_decay': 0.0002749628750330647, 'beta_0': 0.8559165538926998, 'beta_1': 0.9923468338021477, 'epsilon': 1.0055180158641743e-08, 'balanced_loss': False, 'epochs': 165, 'early_stopping_patience': 18, 'plateau_patience': 25, 'plateau_divider': 8}. Best is trial 177 with value: 0.9757575757575757.
CUDA out of memory. Tried to allocate 2.67 GiB. GPU 0 has a total capacity of 44.56 GiB of which 176.69 MiB is free. Including non-PyTorch memory, this process has 44.38 GiB memory in use. Of the allocated memory 37.31 GiB is allocated by PyTorch, and 5.92 GiB is reserved by PyTorch but unallocated. If reserved but unallocated memory is large try setting PYTORCH_CUDA_ALLOC_CONF=expandable_segments:True to avoid fragmentation.  See documentation for Memory Management  (https://pytorch.org/docs/stable/notes/cuda.html#environment-variables)
[I 2024-12-26 13:01:23,084] Trial 382 finished with value: -1.0 and parameters: {'left_stride': 256, 'right_stride': 32, 'attention_pooling_operation': 'mean', 'embedding_pooling_operation': 'min', 'threshold': 0.9756169123108602, 'batch_size': 30, 'attention_heads': 4, 'hidden_dimension': 39, 'number_of_hidden_layers': 4, 'dropout_rate': 0.38984095804126995, 'global_pooling': 'mean', 'learning_rate': 8.824744844213909e-05, 'weight_decay': 0.0004728933688682003, 'beta_0': 0.8120476476253868, 'beta_1': 0.9918247617103895, 'epsilon': 1.34234591468762e-08, 'balanced_loss': False, 'epochs': 184, 'early_stopping_patience': 19, 'plateau_patience': 24, 'plateau_divider': 8}. Best is trial 177 with value: 0.9757575757575757.
[I 2024-12-26 13:32:34,753] Trial 383 finished with value: 0.9757575757575757 and parameters: {'left_stride': 256, 'right_stride': 32, 'attention_pooling_operation': 'mean', 'embedding_pooling_operation': 'min', 'threshold': 0.9827084219916884, 'batch_size': 33, 'attention_heads': 4, 'hidden_dimension': 32, 'number_of_hidden_layers': 2, 'dropout_rate': 0.35462181906716683, 'global_pooling': 'mean', 'learning_rate': 7.035697509966712e-05, 'weight_decay': 0.0007220811148908738, 'beta_0': 0.8520023123908993, 'beta_1': 0.9935453681273019, 'epsilon': 2.036676961878384e-07, 'balanced_loss': False, 'epochs': 171, 'early_stopping_patience': 18, 'plateau_patience': 25, 'plateau_divider': 9}. Best is trial 177 with value: 0.9757575757575757.
CUDA out of memory. Tried to allocate 1.57 GiB. GPU 0 has a total capacity of 44.56 GiB of which 210.69 MiB is free. Including non-PyTorch memory, this process has 44.35 GiB memory in use. Of the allocated memory 30.10 GiB is allocated by PyTorch, and 13.09 GiB is reserved by PyTorch but unallocated. If reserved but unallocated memory is large try setting PYTORCH_CUDA_ALLOC_CONF=expandable_segments:True to avoid fragmentation.  See documentation for Memory Management  (https://pytorch.org/docs/stable/notes/cuda.html#environment-variables)
[I 2024-12-26 14:00:00,881] Trial 384 finished with value: -1.0 and parameters: {'left_stride': 256, 'right_stride': 32, 'attention_pooling_operation': 'mean', 'embedding_pooling_operation': 'min', 'threshold': 0.9794957576886659, 'batch_size': 32, 'attention_heads': 4, 'hidden_dimension': 44, 'number_of_hidden_layers': 2, 'dropout_rate': 0.36808726524218305, 'global_pooling': 'mean', 'learning_rate': 5.409798392762875e-05, 'weight_decay': 0.00034902240841473166, 'beta_0': 0.8600042810855372, 'beta_1': 0.9928935164564988, 'epsilon': 1.1937565833305946e-08, 'balanced_loss': False, 'epochs': 179, 'early_stopping_patience': 16, 'plateau_patience': 25, 'plateau_divider': 8}. Best is trial 177 with value: 0.9757575757575757.
