[I 2024-11-23 06:19:21,300] Trial 118 finished with value: 0.9151515151515152 and parameters: {'left_stride': 0, 'right_stride': 128, 'attention_pooling_operation': 'max', 'embedding_pooling_operation': 'max', 'threshold': 0.980605456556943, 'batch_size': 51, 'attention_heads': 6, 'hidden_dimension': 82, 'number_of_hidden_layers': 4, 'dropout_rate': 0.38356804403955236, 'global_pooling': 'mean', 'learning_rate': 0.0002394098093948743, 'weight_decay': 3.072923107266183e-05, 'beta_0': 0.8028408401504774, 'beta_1': 0.994833810262007, 'epsilon': 2.6122091927664903e-06, 'balanced_loss': False, 'epochs': 151, 'early_stopping_patience': 23, 'plateau_patience': 15, 'plateau_divider': 9}. Best is trial 84 with value: 0.9212121212121213.
[I 2024-11-23 06:31:49,420] Trial 119 finished with value: 0.9030303030303031 and parameters: {'left_stride': 0, 'right_stride': 128, 'attention_pooling_operation': 'min', 'embedding_pooling_operation': 'max', 'threshold': 0.9763129168620897, 'batch_size': 51, 'attention_heads': 6, 'hidden_dimension': 87, 'number_of_hidden_layers': 4, 'dropout_rate': 0.4162899270585125, 'global_pooling': 'mean', 'learning_rate': 0.0002684673389389457, 'weight_decay': 3.253898434157332e-05, 'beta_0': 0.8019501686636946, 'beta_1': 0.9946889309412743, 'epsilon': 2.552375496287788e-06, 'balanced_loss': False, 'epochs': 166, 'early_stopping_patience': 22, 'plateau_patience': 15, 'plateau_divider': 9}. Best is trial 84 with value: 0.9212121212121213.
[I 2024-11-23 06:49:19,638] Trial 120 finished with value: 0.8848484848484849 and parameters: {'left_stride': 0, 'right_stride': 128, 'attention_pooling_operation': 'mean', 'embedding_pooling_operation': 'max', 'threshold': 0.9802920239423747, 'batch_size': 52, 'attention_heads': 6, 'hidden_dimension': 73, 'number_of_hidden_layers': 4, 'dropout_rate': 0.3821443821697795, 'global_pooling': 'mean', 'learning_rate': 0.00023772941401178048, 'weight_decay': 4.9790931996540344e-05, 'beta_0': 0.8044397808642357, 'beta_1': 0.9950914333254338, 'epsilon': 1.9859307957965954e-06, 'balanced_loss': False, 'epochs': 142, 'early_stopping_patience': 23, 'plateau_patience': 14, 'plateau_divider': 9}. Best is trial 84 with value: 0.9212121212121213.
[I 2024-11-23 07:03:51,485] Trial 121 finished with value: 0.8787878787878788 and parameters: {'left_stride': 0, 'right_stride': 128, 'attention_pooling_operation': 'max', 'embedding_pooling_operation': 'max', 'threshold': 0.9813138557490678, 'batch_size': 53, 'attention_heads': 6, 'hidden_dimension': 83, 'number_of_hidden_layers': 4, 'dropout_rate': 0.3931034490761532, 'global_pooling': 'mean', 'learning_rate': 5.5034120946202017e-05, 'weight_decay': 2.5861137424394464e-05, 'beta_0': 0.8057887142786814, 'beta_1': 0.9955242658896046, 'epsilon': 8.100223222004368e-06, 'balanced_loss': False, 'epochs': 152, 'early_stopping_patience': 24, 'plateau_patience': 16, 'plateau_divider': 9}. Best is trial 84 with value: 0.9212121212121213.
[I 2024-11-23 07:15:15,754] Trial 122 finished with value: 0.8545454545454545 and parameters: {'left_stride': 0, 'right_stride': 128, 'attention_pooling_operation': 'max', 'embedding_pooling_operation': 'max', 'threshold': 0.9884385446857349, 'batch_size': 49, 'attention_heads': 7, 'hidden_dimension': 60, 'number_of_hidden_layers': 4, 'dropout_rate': 0.40366396150133615, 'global_pooling': 'mean', 'learning_rate': 9.482547638818853e-05, 'weight_decay': 3.21360057989456e-05, 'beta_0': 0.8004426595593372, 'beta_1': 0.9958729212259452, 'epsilon': 5.581101149033679e-06, 'balanced_loss': False, 'epochs': 157, 'early_stopping_patience': 23, 'plateau_patience': 16, 'plateau_divider': 10}. Best is trial 84 with value: 0.9212121212121213.
[I 2024-11-23 07:27:13,624] Trial 123 finished with value: 0.9030303030303031 and parameters: {'left_stride': 0, 'right_stride': 128, 'attention_pooling_operation': 'max', 'embedding_pooling_operation': 'max', 'threshold': 0.9753349375609405, 'batch_size': 56, 'attention_heads': 5, 'hidden_dimension': 93, 'number_of_hidden_layers': 4, 'dropout_rate': 0.3767931142094174, 'global_pooling': 'mean', 'learning_rate': 0.0005607277676868711, 'weight_decay': 1.9167429895231265e-05, 'beta_0': 0.8094936593240635, 'beta_1': 0.9942097233281408, 'epsilon': 4.030747459764082e-06, 'balanced_loss': True, 'epochs': 150, 'early_stopping_patience': 20, 'plateau_patience': 15, 'plateau_divider': 9}. Best is trial 84 with value: 0.9212121212121213.
CUDA out of memory. Tried to allocate 1.89 GiB. GPU 0 has a total capacity of 44.56 GiB of which 1.45 GiB is free. Including non-PyTorch memory, this process has 43.10 GiB memory in use. Of the allocated memory 39.02 GiB is allocated by PyTorch, and 2.93 GiB is reserved by PyTorch but unallocated. If reserved but unallocated memory is large try setting PYTORCH_CUDA_ALLOC_CONF=expandable_segments:True to avoid fragmentation.  See documentation for Memory Management  (https://pytorch.org/docs/stable/notes/cuda.html#environment-variables)
[I 2024-11-23 07:36:42,916] Trial 124 finished with value: -1.0 and parameters: {'left_stride': 32, 'right_stride': 128, 'attention_pooling_operation': 'max', 'embedding_pooling_operation': 'max', 'threshold': 0.9781371137389765, 'batch_size': 55, 'attention_heads': 7, 'hidden_dimension': 75, 'number_of_hidden_layers': 4, 'dropout_rate': 0.38562251526279906, 'global_pooling': 'mean', 'learning_rate': 0.00015854821641345497, 'weight_decay': 3.9736512682271894e-05, 'beta_0': 0.8025402657340714, 'beta_1': 0.9965564650027905, 'epsilon': 4.810285333311802e-06, 'balanced_loss': False, 'epochs': 145, 'early_stopping_patience': 24, 'plateau_patience': 16, 'plateau_divider': 9}. Best is trial 84 with value: 0.9212121212121213.
CUDA out of memory. Tried to allocate 5.82 GiB. GPU 0 has a total capacity of 44.56 GiB of which 2.86 GiB is free. Including non-PyTorch memory, this process has 41.70 GiB memory in use. Of the allocated memory 38.02 GiB is allocated by PyTorch, and 2.53 GiB is reserved by PyTorch but unallocated. If reserved but unallocated memory is large try setting PYTORCH_CUDA_ALLOC_CONF=expandable_segments:True to avoid fragmentation.  See documentation for Memory Management  (https://pytorch.org/docs/stable/notes/cuda.html#environment-variables)
[I 2024-11-23 07:48:14,637] Trial 125 finished with value: -1.0 and parameters: {'left_stride': 256, 'right_stride': 128, 'attention_pooling_operation': 'max', 'embedding_pooling_operation': 'max', 'threshold': 0.9476157180929333, 'batch_size': 54, 'attention_heads': 6, 'hidden_dimension': 102, 'number_of_hidden_layers': 4, 'dropout_rate': 0.40046229817412027, 'global_pooling': 'mean', 'learning_rate': 0.0005092175134100041, 'weight_decay': 1.314839283205904e-05, 'beta_0': 0.8031022913357697, 'beta_1': 0.9953205837423659, 'epsilon': 8.569537559679364e-06, 'balanced_loss': True, 'epochs': 152, 'early_stopping_patience': 24, 'plateau_patience': 15, 'plateau_divider': 10}. Best is trial 84 with value: 0.9212121212121213.
[I 2024-11-23 08:04:31,588] Trial 126 finished with value: 0.8666666666666667 and parameters: {'left_stride': 128, 'right_stride': 128, 'attention_pooling_operation': 'max', 'embedding_pooling_operation': 'max', 'threshold': 0.9923992985876373, 'batch_size': 57, 'attention_heads': 8, 'hidden_dimension': 83, 'number_of_hidden_layers': 4, 'dropout_rate': 0.3709745201340009, 'global_pooling': 'mean', 'learning_rate': 1.887349584142041e-05, 'weight_decay': 1.1611803766860992e-05, 'beta_0': 0.8067938246779134, 'beta_1': 0.9935320609029186, 'epsilon': 1.634070755780153e-06, 'balanced_loss': False, 'epochs': 170, 'early_stopping_patience': 21, 'plateau_patience': 14, 'plateau_divider': 9}. Best is trial 84 with value: 0.9212121212121213.
CUDA out of memory. Tried to allocate 2.22 GiB. GPU 0 has a total capacity of 44.56 GiB of which 582.69 MiB is free. Including non-PyTorch memory, this process has 43.98 GiB memory in use. Of the allocated memory 41.53 GiB is allocated by PyTorch, and 1.30 GiB is reserved by PyTorch but unallocated. If reserved but unallocated memory is large try setting PYTORCH_CUDA_ALLOC_CONF=expandable_segments:True to avoid fragmentation.  See documentation for Memory Management  (https://pytorch.org/docs/stable/notes/cuda.html#environment-variables)
[I 2024-11-23 08:20:18,699] Trial 127 finished with value: -1.0 and parameters: {'left_stride': 0, 'right_stride': 256, 'attention_pooling_operation': 'mean', 'embedding_pooling_operation': 'max', 'threshold': 0.9869201412288118, 'batch_size': 60, 'attention_heads': 12, 'hidden_dimension': 79, 'number_of_hidden_layers': 4, 'dropout_rate': 0.40905004955516494, 'global_pooling': 'mean', 'learning_rate': 0.0010712211870911295, 'weight_decay': 2.3034421137752574e-05, 'beta_0': 0.8000635771020115, 'beta_1': 0.9947029955091629, 'epsilon': 3.138518075690543e-06, 'balanced_loss': False, 'epochs': 143, 'early_stopping_patience': 14, 'plateau_patience': 16, 'plateau_divider': 9}. Best is trial 84 with value: 0.9212121212121213.
[I 2024-11-23 08:36:42,657] Trial 128 finished with value: 0.8727272727272727 and parameters: {'left_stride': 64, 'right_stride': 0, 'attention_pooling_operation': 'mean', 'embedding_pooling_operation': 'max', 'threshold': 0.9835513628333735, 'batch_size': 52, 'attention_heads': 6, 'hidden_dimension': 97, 'number_of_hidden_layers': 4, 'dropout_rate': 0.41760954661558425, 'global_pooling': 'sum', 'learning_rate': 0.0003426921591999468, 'weight_decay': 1.556245842117559e-05, 'beta_0': 0.811637994387972, 'beta_1': 0.9976090910315208, 'epsilon': 6.4750491570520385e-06, 'balanced_loss': True, 'epochs': 161, 'early_stopping_patience': 22, 'plateau_patience': 15, 'plateau_divider': 8}. Best is trial 84 with value: 0.9212121212121213.
[I 2024-11-23 08:51:34,956] Trial 129 finished with value: 0.8787878787878788 and parameters: {'left_stride': 0, 'right_stride': 128, 'attention_pooling_operation': 'mean', 'embedding_pooling_operation': 'max', 'threshold': 0.9953521019057084, 'batch_size': 55, 'attention_heads': 5, 'hidden_dimension': 115, 'number_of_hidden_layers': 1, 'dropout_rate': 0.396539181433614, 'global_pooling': 'mean', 'learning_rate': 0.0006475414264637142, 'weight_decay': 2.501388161212111e-05, 'beta_0': 0.8148819777836631, 'beta_1': 0.9958909811145608, 'epsilon': 2.40632043273626e-08, 'balanced_loss': False, 'epochs': 155, 'early_stopping_patience': 23, 'plateau_patience': 17, 'plateau_divider': 9}. Best is trial 84 with value: 0.9212121212121213.
CUDA out of memory. Tried to allocate 6.68 GiB. GPU 0 has a total capacity of 44.56 GiB of which 4.04 GiB is free. Including non-PyTorch memory, this process has 40.51 GiB memory in use. Of the allocated memory 32.09 GiB is allocated by PyTorch, and 7.27 GiB is reserved by PyTorch but unallocated. If reserved but unallocated memory is large try setting PYTORCH_CUDA_ALLOC_CONF=expandable_segments:True to avoid fragmentation.  See documentation for Memory Management  (https://pytorch.org/docs/stable/notes/cuda.html#environment-variables)
[I 2024-11-23 09:01:09,430] Trial 130 finished with value: -1.0 and parameters: {'left_stride': 64, 'right_stride': 128, 'attention_pooling_operation': 'max', 'embedding_pooling_operation': 'mean', 'threshold': 0.9728909184447382, 'batch_size': 62, 'attention_heads': 13, 'hidden_dimension': 110, 'number_of_hidden_layers': 4, 'dropout_rate': 0.38055263334960726, 'global_pooling': 'mean', 'learning_rate': 0.015146633843883114, 'weight_decay': 6.951222723854435e-05, 'beta_0': 0.8085959989231591, 'beta_1': 0.9984312480410091, 'epsilon': 2.5823318426783032e-05, 'balanced_loss': True, 'epochs': 148, 'early_stopping_patience': 24, 'plateau_patience': 16, 'plateau_divider': 4}. Best is trial 84 with value: 0.9212121212121213.
[I 2024-11-23 09:18:26,862] Trial 131 finished with value: 0.8848484848484849 and parameters: {'left_stride': 128, 'right_stride': 64, 'attention_pooling_operation': 'mean', 'embedding_pooling_operation': 'max', 'threshold': 0.9863168344693588, 'batch_size': 32, 'attention_heads': 6, 'hidden_dimension': 127, 'number_of_hidden_layers': 3, 'dropout_rate': 0.31630027786037795, 'global_pooling': 'mean', 'learning_rate': 0.0009105091441297277, 'weight_decay': 1.1041844638928051e-06, 'beta_0': 0.8053451013833746, 'beta_1': 0.9918746118090189, 'epsilon': 1.2243107867378769e-05, 'balanced_loss': False, 'epochs': 198, 'early_stopping_patience': 25, 'plateau_patience': 17, 'plateau_divider': 8}. Best is trial 84 with value: 0.9212121212121213.
[I 2024-11-23 09:36:12,259] Trial 132 finished with value: 0.9030303030303031 and parameters: {'left_stride': 128, 'right_stride': 64, 'attention_pooling_operation': 'mean', 'embedding_pooling_operation': 'max', 'threshold': 0.9900971117892301, 'batch_size': 49, 'attention_heads': 6, 'hidden_dimension': 116, 'number_of_hidden_layers': 4, 'dropout_rate': 0.3060038647662915, 'global_pooling': 'mean', 'learning_rate': 0.0012424701843731327, 'weight_decay': 2.933929103411307e-05, 'beta_0': 0.8034918605242134, 'beta_1': 0.9980379271840119, 'epsilon': 1.4468965299984632e-05, 'balanced_loss': False, 'epochs': 171, 'early_stopping_patience': 25, 'plateau_patience': 18, 'plateau_divider': 8}. Best is trial 84 with value: 0.9212121212121213.
CUDA out of memory. Tried to allocate 2.94 GiB. GPU 0 has a total capacity of 44.56 GiB of which 2.76 GiB is free. Including non-PyTorch memory, this process has 41.79 GiB memory in use. Of the allocated memory 39.41 GiB is allocated by PyTorch, and 1.23 GiB is reserved by PyTorch but unallocated. If reserved but unallocated memory is large try setting PYTORCH_CUDA_ALLOC_CONF=expandable_segments:True to avoid fragmentation.  See documentation for Memory Management  (https://pytorch.org/docs/stable/notes/cuda.html#environment-variables)
[I 2024-11-23 09:51:04,281] Trial 133 finished with value: -1.0 and parameters: {'left_stride': 128, 'right_stride': 64, 'attention_pooling_operation': 'mean', 'embedding_pooling_operation': 'max', 'threshold': 0.9806165471726513, 'batch_size': 45, 'attention_heads': 9, 'hidden_dimension': 135, 'number_of_hidden_layers': 3, 'dropout_rate': 0.32797905214940154, 'global_pooling': 'mean', 'learning_rate': 0.0006553070046249416, 'weight_decay': 1.8148826856206012e-05, 'beta_0': 0.8069675424068993, 'beta_1': 0.9899140861840776, 'epsilon': 1.100059231540213e-05, 'balanced_loss': False, 'epochs': 178, 'early_stopping_patience': 15, 'plateau_patience': 17, 'plateau_divider': 7}. Best is trial 84 with value: 0.9212121212121213.
[I 2024-11-23 10:10:00,882] Trial 134 finished with value: 0.9090909090909091 and parameters: {'left_stride': 128, 'right_stride': 64, 'attention_pooling_operation': 'mean', 'embedding_pooling_operation': 'max', 'threshold': 0.985672330413757, 'batch_size': 51, 'attention_heads': 10, 'hidden_dimension': 88, 'number_of_hidden_layers': 4, 'dropout_rate': 0.3560260328285129, 'global_pooling': 'mean', 'learning_rate': 0.0007549914441654904, 'weight_decay': 1.8965424560527977e-06, 'beta_0': 0.8092159730672941, 'beta_1': 0.9936762516020338, 'epsilon': 1.7415096132230957e-08, 'balanced_loss': False, 'epochs': 61, 'early_stopping_patience': 24, 'plateau_patience': 16, 'plateau_divider': 8}. Best is trial 84 with value: 0.9212121212121213.
[I 2024-11-23 10:29:42,590] Trial 135 finished with value: 0.8787878787878788 and parameters: {'left_stride': 128, 'right_stride': 64, 'attention_pooling_operation': 'mean', 'embedding_pooling_operation': 'max', 'threshold': 0.9852023510126893, 'batch_size': 51, 'attention_heads': 10, 'hidden_dimension': 67, 'number_of_hidden_layers': 4, 'dropout_rate': 0.3555003459910269, 'global_pooling': 'mean', 'learning_rate': 0.00011089200841006885, 'weight_decay': 1.9178102419584714e-06, 'beta_0': 0.810389331260011, 'beta_1': 0.9940077035833714, 'epsilon': 1.834558792489648e-08, 'balanced_loss': False, 'epochs': 83, 'early_stopping_patience': 24, 'plateau_patience': 15, 'plateau_divider': 8}. Best is trial 84 with value: 0.9212121212121213.
CUDA out of memory. Tried to allocate 3.94 GiB. GPU 0 has a total capacity of 44.56 GiB of which 3.24 GiB is free. Including non-PyTorch memory, this process has 41.32 GiB memory in use. Of the allocated memory 38.34 GiB is allocated by PyTorch, and 1.83 GiB is reserved by PyTorch but unallocated. If reserved but unallocated memory is large try setting PYTORCH_CUDA_ALLOC_CONF=expandable_segments:True to avoid fragmentation.  See documentation for Memory Management  (https://pytorch.org/docs/stable/notes/cuda.html#environment-variables)
[I 2024-11-23 10:42:49,997] Trial 136 finished with value: -1.0 and parameters: {'left_stride': 0, 'right_stride': 64, 'attention_pooling_operation': 'mean', 'embedding_pooling_operation': 'min', 'threshold': 0.981907825686668, 'batch_size': 53, 'attention_heads': 10, 'hidden_dimension': 172, 'number_of_hidden_layers': 4, 'dropout_rate': 0.5999261977557371, 'global_pooling': 'mean', 'learning_rate': 0.00021182164353466713, 'weight_decay': 1.0578630509524463e-05, 'beta_0': 0.8016727982472486, 'beta_1': 0.9937387196011672, 'epsilon': 1.4364357709530453e-08, 'balanced_loss': False, 'epochs': 67, 'early_stopping_patience': 24, 'plateau_patience': 16, 'plateau_divider': 9}. Best is trial 84 with value: 0.9212121212121213.
CUDA out of memory. Tried to allocate 2.28 GiB. GPU 0 has a total capacity of 44.56 GiB of which 1.47 GiB is free. Including non-PyTorch memory, this process has 43.09 GiB memory in use. Of the allocated memory 40.59 GiB is allocated by PyTorch, and 1.34 GiB is reserved by PyTorch but unallocated. If reserved but unallocated memory is large try setting PYTORCH_CUDA_ALLOC_CONF=expandable_segments:True to avoid fragmentation.  See documentation for Memory Management  (https://pytorch.org/docs/stable/notes/cuda.html#environment-variables)
[I 2024-11-23 10:55:31,693] Trial 137 finished with value: -1.0 and parameters: {'left_stride': 32, 'right_stride': 0, 'attention_pooling_operation': 'mean', 'embedding_pooling_operation': 'max', 'threshold': 0.9782910404272165, 'batch_size': 47, 'attention_heads': 11, 'hidden_dimension': 90, 'number_of_hidden_layers': 4, 'dropout_rate': 0.3644687904818336, 'global_pooling': 'mean', 'learning_rate': 0.0008390825223622947, 'weight_decay': 1.3303826960934293e-05, 'beta_0': 0.8036495109192823, 'beta_1': 0.9931771111480858, 'epsilon': 3.972335976918716e-08, 'balanced_loss': False, 'epochs': 52, 'early_stopping_patience': 23, 'plateau_patience': 16, 'plateau_divider': 10}. Best is trial 84 with value: 0.9212121212121213.
[I 2024-11-23 11:11:16,698] Trial 138 finished with value: 0.9030303030303031 and parameters: {'left_stride': 0, 'right_stride': 64, 'attention_pooling_operation': 'mean', 'embedding_pooling_operation': 'max', 'threshold': 0.993534898771458, 'batch_size': 56, 'attention_heads': 12, 'hidden_dimension': 80, 'number_of_hidden_layers': 4, 'dropout_rate': 0.39145384287834734, 'global_pooling': 'mean', 'learning_rate': 0.0004466401082252636, 'weight_decay': 2.364926626495259e-06, 'beta_0': 0.8076349991082473, 'beta_1': 0.9945217574785399, 'epsilon': 3.021371116256814e-08, 'balanced_loss': True, 'epochs': 166, 'early_stopping_patience': 13, 'plateau_patience': 15, 'plateau_divider': 2}. Best is trial 84 with value: 0.9212121212121213.
[I 2024-11-23 11:22:31,728] Trial 139 finished with value: 0.8484848484848485 and parameters: {'left_stride': 64, 'right_stride': 32, 'attention_pooling_operation': 'max', 'embedding_pooling_operation': 'max', 'threshold': 0.9838294777204182, 'batch_size': 50, 'attention_heads': 6, 'hidden_dimension': 96, 'number_of_hidden_layers': 4, 'dropout_rate': 0.37611295530248817, 'global_pooling': 'max', 'learning_rate': 0.0010581927834870273, 'weight_decay': 3.708829800394483e-05, 'beta_0': 0.805436971432585, 'beta_1': 0.9950246714567021, 'epsilon': 6.084523266656423e-08, 'balanced_loss': False, 'epochs': 139, 'early_stopping_patience': 25, 'plateau_patience': 16, 'plateau_divider': 7}. Best is trial 84 with value: 0.9212121212121213.
[I 2024-11-23 11:39:16,346] Trial 140 finished with value: 0.8909090909090909 and parameters: {'left_stride': 128, 'right_stride': 64, 'attention_pooling_operation': 'mean', 'embedding_pooling_operation': 'max', 'threshold': 0.9884127217501919, 'batch_size': 54, 'attention_heads': 9, 'hidden_dimension': 70, 'number_of_hidden_layers': 2, 'dropout_rate': 0.3851179675403699, 'global_pooling': 'mean', 'learning_rate': 0.0005481078904816362, 'weight_decay': 2.1402394497262713e-05, 'beta_0': 0.8122971247175964, 'beta_1': 0.9860038983019893, 'epsilon': 2.8131849941782932e-06, 'balanced_loss': False, 'epochs': 57, 'early_stopping_patience': 24, 'plateau_patience': 17, 'plateau_divider': 8}. Best is trial 84 with value: 0.9212121212121213.
[I 2024-11-23 11:55:01,235] Trial 141 finished with value: 0.8727272727272727 and parameters: {'left_stride': 128, 'right_stride': 64, 'attention_pooling_operation': 'mean', 'embedding_pooling_operation': 'max', 'threshold': 0.9863970533704676, 'batch_size': 64, 'attention_heads': 5, 'hidden_dimension': 162, 'number_of_hidden_layers': 0, 'dropout_rate': 0.33389338630023907, 'global_pooling': 'mean', 'learning_rate': 0.0009030135982568104, 'weight_decay': 1.3007480534602663e-06, 'beta_0': 0.8089868760347929, 'beta_1': 0.9921408020457232, 'epsilon': 8.930529300089748e-06, 'balanced_loss': False, 'epochs': 184, 'early_stopping_patience': 25, 'plateau_patience': 14, 'plateau_divider': 8}. Best is trial 84 with value: 0.9212121212121213.
