[I 2024-12-25 04:05:15,122] Using an existing study with name 'IMDb-top_1000-GATv2-facebook-bart-large-Surrogate-No_Aggregation' instead of creating a new one.
Token indices sequence length is longer than the specified maximum sequence length for this model (1113 > 1024). Running this sequence through the model will result in indexing errors
[I 2024-12-25 04:35:38,607] Trial 314 finished with value: 0.9575757575757575 and parameters: {'left_stride': 256, 'right_stride': 32, 'attention_pooling_operation': 'mean', 'embedding_pooling_operation': 'min', 'threshold': 0.9821053580137404, 'batch_size': 34, 'attention_heads': 4, 'hidden_dimension': 43, 'number_of_hidden_layers': 2, 'dropout_rate': 0.3584851035938134, 'global_pooling': 'mean', 'learning_rate': 7.088995070809059e-05, 'weight_decay': 0.00048193615647789567, 'beta_0': 0.8539114282953632, 'beta_1': 0.9939835204485898, 'epsilon': 1.4759722003775365e-08, 'balanced_loss': False, 'epochs': 173, 'early_stopping_patience': 16, 'plateau_patience': 25, 'plateau_divider': 8}. Best is trial 177 with value: 0.9757575757575757.
[I 2024-12-25 05:07:33,625] Trial 315 finished with value: 0.9696969696969697 and parameters: {'left_stride': 256, 'right_stride': 32, 'attention_pooling_operation': 'mean', 'embedding_pooling_operation': 'min', 'threshold': 0.9890155307833897, 'batch_size': 31, 'attention_heads': 4, 'hidden_dimension': 39, 'number_of_hidden_layers': 2, 'dropout_rate': 0.4143209764164224, 'global_pooling': 'mean', 'learning_rate': 2.966664494843379e-05, 'weight_decay': 0.0002951960297727206, 'beta_0': 0.8510960999933209, 'beta_1': 0.99313768537269, 'epsilon': 1.2165675294122202e-08, 'balanced_loss': False, 'epochs': 176, 'early_stopping_patience': 21, 'plateau_patience': 25, 'plateau_divider': 10}. Best is trial 177 with value: 0.9757575757575757.
[I 2024-12-25 05:38:14,809] Trial 316 finished with value: 0.9575757575757575 and parameters: {'left_stride': 32, 'right_stride': 32, 'attention_pooling_operation': 'mean', 'embedding_pooling_operation': 'min', 'threshold': 0.9762918328147397, 'batch_size': 35, 'attention_heads': 4, 'hidden_dimension': 36, 'number_of_hidden_layers': 2, 'dropout_rate': 0.4392499488134854, 'global_pooling': 'mean', 'learning_rate': 4.7386488604788604e-05, 'weight_decay': 0.0003749652462065677, 'beta_0': 0.8562725299445365, 'beta_1': 0.9914191908121628, 'epsilon': 1.9944946095879428e-08, 'balanced_loss': False, 'epochs': 166, 'early_stopping_patience': 18, 'plateau_patience': 25, 'plateau_divider': 8}. Best is trial 177 with value: 0.9757575757575757.
[I 2024-12-25 06:09:40,259] Trial 317 finished with value: 0.9757575757575757 and parameters: {'left_stride': 256, 'right_stride': 32, 'attention_pooling_operation': 'mean', 'embedding_pooling_operation': 'min', 'threshold': 0.9803573742640972, 'batch_size': 29, 'attention_heads': 4, 'hidden_dimension': 32, 'number_of_hidden_layers': 2, 'dropout_rate': 0.3730592095014941, 'global_pooling': 'mean', 'learning_rate': 5.9911246602711636e-05, 'weight_decay': 0.000751550951614101, 'beta_0': 0.849300587122629, 'beta_1': 0.9947156461729073, 'epsilon': 1.4115564016977992e-08, 'balanced_loss': False, 'epochs': 183, 'early_stopping_patience': 17, 'plateau_patience': 25, 'plateau_divider': 8}. Best is trial 177 with value: 0.9757575757575757.
[I 2024-12-25 06:40:35,679] Trial 318 finished with value: 0.9636363636363636 and parameters: {'left_stride': 256, 'right_stride': 32, 'attention_pooling_operation': 'mean', 'embedding_pooling_operation': 'min', 'threshold': 0.9850828957893867, 'batch_size': 33, 'attention_heads': 4, 'hidden_dimension': 40, 'number_of_hidden_layers': 2, 'dropout_rate': 0.3882179972402695, 'global_pooling': 'mean', 'learning_rate': 7.971256985075913e-05, 'weight_decay': 0.0004300036289681605, 'beta_0': 0.851933069462864, 'beta_1': 0.9922635847679478, 'epsilon': 3.3584310308021153e-07, 'balanced_loss': False, 'epochs': 180, 'early_stopping_patience': 16, 'plateau_patience': 25, 'plateau_divider': 8}. Best is trial 177 with value: 0.9757575757575757.
[I 2024-12-25 07:14:26,965] Trial 319 finished with value: 0.9636363636363636 and parameters: {'left_stride': 256, 'right_stride': 32, 'attention_pooling_operation': 'mean', 'embedding_pooling_operation': 'min', 'threshold': 0.982718814427003, 'batch_size': 28, 'attention_heads': 5, 'hidden_dimension': 36, 'number_of_hidden_layers': 2, 'dropout_rate': 0.4282452402593278, 'global_pooling': 'mean', 'learning_rate': 3.5791646543540545e-05, 'weight_decay': 0.0002579072955401955, 'beta_0': 0.8543193499166761, 'beta_1': 0.993691780152599, 'epsilon': 1.1291686888699461e-08, 'balanced_loss': False, 'epochs': 190, 'early_stopping_patience': 15, 'plateau_patience': 24, 'plateau_divider': 9}. Best is trial 177 with value: 0.9757575757575757.
CUDA out of memory. Tried to allocate 2.67 GiB. GPU 0 has a total capacity of 44.56 GiB of which 1.81 GiB is free. Including non-PyTorch memory, this process has 42.75 GiB memory in use. Of the allocated memory 34.88 GiB is allocated by PyTorch, and 6.72 GiB is reserved by PyTorch but unallocated. If reserved but unallocated memory is large try setting PYTORCH_CUDA_ALLOC_CONF=expandable_segments:True to avoid fragmentation.  See documentation for Memory Management  (https://pytorch.org/docs/stable/notes/cuda.html#environment-variables)
[I 2024-12-25 07:39:37,004] Trial 320 finished with value: -1.0 and parameters: {'left_stride': 256, 'right_stride': 32, 'attention_pooling_operation': 'mean', 'embedding_pooling_operation': 'min', 'threshold': 0.9787309420643746, 'batch_size': 31, 'attention_heads': 4, 'hidden_dimension': 46, 'number_of_hidden_layers': 2, 'dropout_rate': 0.40456733551232, 'global_pooling': 'mean', 'learning_rate': 9.944664445348936e-05, 'weight_decay': 0.0005533279529091011, 'beta_0': 0.8462044498812535, 'beta_1': 0.9961810217338385, 'epsilon': 1.7416799769531883e-08, 'balanced_loss': True, 'epochs': 172, 'early_stopping_patience': 19, 'plateau_patience': 25, 'plateau_divider': 6}. Best is trial 177 with value: 0.9757575757575757.
[I 2024-12-25 08:10:19,672] Trial 321 finished with value: 0.9696969696969697 and parameters: {'left_stride': 64, 'right_stride': 128, 'attention_pooling_operation': 'mean', 'embedding_pooling_operation': 'min', 'threshold': 0.9815423523006618, 'batch_size': 42, 'attention_heads': 4, 'hidden_dimension': 32, 'number_of_hidden_layers': 2, 'dropout_rate': 0.3792019660528421, 'global_pooling': 'mean', 'learning_rate': 6.627666962562975e-05, 'weight_decay': 0.00031914208448403664, 'beta_0': 0.8593233148743781, 'beta_1': 0.994170462635712, 'epsilon': 1.3768797517039504e-08, 'balanced_loss': False, 'epochs': 177, 'early_stopping_patience': 17, 'plateau_patience': 25, 'plateau_divider': 8}. Best is trial 177 with value: 0.9757575757575757.
[I 2024-12-25 08:40:20,552] Trial 322 finished with value: 0.9696969696969697 and parameters: {'left_stride': 256, 'right_stride': 32, 'attention_pooling_operation': 'mean', 'embedding_pooling_operation': 'min', 'threshold': 0.9862571222541322, 'batch_size': 34, 'attention_heads': 5, 'hidden_dimension': 41, 'number_of_hidden_layers': 2, 'dropout_rate': 0.36498722098454545, 'global_pooling': 'mean', 'learning_rate': 0.00013605961880792822, 'weight_decay': 0.00040007080496200665, 'beta_0': 0.8503441230470644, 'beta_1': 0.992890185159878, 'epsilon': 1.1623547835702758e-08, 'balanced_loss': False, 'epochs': 168, 'early_stopping_patience': 18, 'plateau_patience': 25, 'plateau_divider': 8}. Best is trial 177 with value: 0.9757575757575757.
[I 2024-12-25 09:12:14,558] Trial 323 finished with value: 0.9636363636363636 and parameters: {'left_stride': 256, 'right_stride': 32, 'attention_pooling_operation': 'mean', 'embedding_pooling_operation': 'min', 'threshold': 0.983699574151119, 'batch_size': 32, 'attention_heads': 4, 'hidden_dimension': 37, 'number_of_hidden_layers': 2, 'dropout_rate': 0.3939989979301161, 'global_pooling': 'mean', 'learning_rate': 4.9111623990591366e-05, 'weight_decay': 0.00048824217085536144, 'beta_0': 0.8568730938409171, 'beta_1': 0.9817872127587747, 'epsilon': 1.0066088644858318e-08, 'balanced_loss': False, 'epochs': 174, 'early_stopping_patience': 16, 'plateau_patience': 24, 'plateau_divider': 9}. Best is trial 177 with value: 0.9757575757575757.
CUDA out of memory. Tried to allocate 1.57 GiB. GPU 0 has a total capacity of 44.56 GiB of which 690.69 MiB is free. Including non-PyTorch memory, this process has 43.88 GiB memory in use. Of the allocated memory 29.50 GiB is allocated by PyTorch, and 13.23 GiB is reserved by PyTorch but unallocated. If reserved but unallocated memory is large try setting PYTORCH_CUDA_ALLOC_CONF=expandable_segments:True to avoid fragmentation.  See documentation for Memory Management  (https://pytorch.org/docs/stable/notes/cuda.html#environment-variables)
[I 2024-12-25 09:39:27,550] Trial 324 finished with value: -1.0 and parameters: {'left_stride': 256, 'right_stride': 32, 'attention_pooling_operation': 'mean', 'embedding_pooling_operation': 'min', 'threshold': 0.9802029820430561, 'batch_size': 27, 'attention_heads': 4, 'hidden_dimension': 32, 'number_of_hidden_layers': 2, 'dropout_rate': 0.37286566787800923, 'global_pooling': 'mean', 'learning_rate': 8.33738239270253e-05, 'weight_decay': 0.0006437246406547471, 'beta_0': 0.8527760626428132, 'beta_1': 0.9932921582804961, 'epsilon': 1.6084148675734782e-08, 'balanced_loss': False, 'epochs': 182, 'early_stopping_patience': 18, 'plateau_patience': 25, 'plateau_divider': 8}. Best is trial 177 with value: 0.9757575757575757.
CUDA out of memory. Tried to allocate 2.67 GiB. GPU 0 has a total capacity of 44.56 GiB of which 1.78 GiB is free. Including non-PyTorch memory, this process has 42.78 GiB memory in use. Of the allocated memory 35.76 GiB is allocated by PyTorch, and 5.87 GiB is reserved by PyTorch but unallocated. If reserved but unallocated memory is large try setting PYTORCH_CUDA_ALLOC_CONF=expandable_segments:True to avoid fragmentation.  See documentation for Memory Management  (https://pytorch.org/docs/stable/notes/cuda.html#environment-variables)
[I 2024-12-25 10:04:39,387] Trial 325 finished with value: -1.0 and parameters: {'left_stride': 256, 'right_stride': 32, 'attention_pooling_operation': 'mean', 'embedding_pooling_operation': 'min', 'threshold': 0.9776171175650539, 'batch_size': 35, 'attention_heads': 4, 'hidden_dimension': 36, 'number_of_hidden_layers': 2, 'dropout_rate': 0.3531164812684018, 'global_pooling': 'max', 'learning_rate': 0.00010393400914086273, 'weight_decay': 0.0004363320483003847, 'beta_0': 0.8481143812701334, 'beta_1': 0.9925046421491832, 'epsilon': 2.256037692812252e-08, 'balanced_loss': False, 'epochs': 186, 'early_stopping_patience': 16, 'plateau_patience': 25, 'plateau_divider': 9}. Best is trial 177 with value: 0.9757575757575757.
CUDA out of memory. Tried to allocate 2.67 GiB. GPU 0 has a total capacity of 44.56 GiB of which 104.69 MiB is free. Including non-PyTorch memory, this process has 44.45 GiB memory in use. Of the allocated memory 37.94 GiB is allocated by PyTorch, and 5.36 GiB is reserved by PyTorch but unallocated. If reserved but unallocated memory is large try setting PYTORCH_CUDA_ALLOC_CONF=expandable_segments:True to avoid fragmentation.  See documentation for Memory Management  (https://pytorch.org/docs/stable/notes/cuda.html#environment-variables)
[I 2024-12-25 10:29:50,903] Trial 326 finished with value: -1.0 and parameters: {'left_stride': 256, 'right_stride': 32, 'attention_pooling_operation': 'mean', 'embedding_pooling_operation': 'min', 'threshold': 0.9747979321428966, 'batch_size': 30, 'attention_heads': 4, 'hidden_dimension': 53, 'number_of_hidden_layers': 2, 'dropout_rate': 0.384371967830525, 'global_pooling': 'mean', 'learning_rate': 4.2249860148836795e-05, 'weight_decay': 0.0003633510809381208, 'beta_0': 0.8407253956188083, 'beta_1': 0.992012586482278, 'epsilon': 1.3458516438250431e-08, 'balanced_loss': False, 'epochs': 178, 'early_stopping_patience': 17, 'plateau_patience': 25, 'plateau_divider': 8}. Best is trial 177 with value: 0.9757575757575757.
CUDA out of memory. Tried to allocate 3.49 GiB. GPU 0 has a total capacity of 44.56 GiB of which 2.78 GiB is free. Including non-PyTorch memory, this process has 41.77 GiB memory in use. Of the allocated memory 31.34 GiB is allocated by PyTorch, and 9.28 GiB is reserved by PyTorch but unallocated. If reserved but unallocated memory is large try setting PYTORCH_CUDA_ALLOC_CONF=expandable_segments:True to avoid fragmentation.  See documentation for Memory Management  (https://pytorch.org/docs/stable/notes/cuda.html#environment-variables)
[I 2024-12-25 10:50:22,054] Trial 327 finished with value: -1.0 and parameters: {'left_stride': 256, 'right_stride': 256, 'attention_pooling_operation': 'mean', 'embedding_pooling_operation': 'min', 'threshold': 0.9675070170352587, 'batch_size': 33, 'attention_heads': 4, 'hidden_dimension': 44, 'number_of_hidden_layers': 2, 'dropout_rate': 0.399277591555026, 'global_pooling': 'mean', 'learning_rate': 5.898713903016731e-05, 'weight_decay': 0.00030921397925962296, 'beta_0': 0.8551013458018368, 'beta_1': 0.993757837923687, 'epsilon': 1.808599895247588e-08, 'balanced_loss': False, 'epochs': 169, 'early_stopping_patience': 19, 'plateau_patience': 24, 'plateau_divider': 8}. Best is trial 177 with value: 0.9757575757575757.
[I 2024-12-25 11:20:30,817] Trial 328 finished with value: 0.9696969696969697 and parameters: {'left_stride': 256, 'right_stride': 32, 'attention_pooling_operation': 'mean', 'embedding_pooling_operation': 'min', 'threshold': 0.9828721258638831, 'batch_size': 36, 'attention_heads': 4, 'hidden_dimension': 36, 'number_of_hidden_layers': 2, 'dropout_rate': 0.3612827916929014, 'global_pooling': 'mean', 'learning_rate': 7.347934196292932e-05, 'weight_decay': 0.0005371803437301516, 'beta_0': 0.8523784172305987, 'beta_1': 0.9943510690868217, 'epsilon': 1.2289978043209193e-08, 'balanced_loss': False, 'epochs': 175, 'early_stopping_patience': 15, 'plateau_patience': 25, 'plateau_divider': 8}. Best is trial 177 with value: 0.9757575757575757.
[I 2024-12-25 11:51:39,543] Trial 329 finished with value: 0.9696969696969697 and parameters: {'left_stride': 256, 'right_stride': 32, 'attention_pooling_operation': 'mean', 'embedding_pooling_operation': 'min', 'threshold': 0.9875046207322896, 'batch_size': 32, 'attention_heads': 4, 'hidden_dimension': 41, 'number_of_hidden_layers': 2, 'dropout_rate': 0.37685561882363017, 'global_pooling': 'mean', 'learning_rate': 5.359720530995243e-05, 'weight_decay': 0.00046033185948127073, 'beta_0': 0.8501936614133975, 'beta_1': 0.9948816052023023, 'epsilon': 1.5111596918386123e-08, 'balanced_loss': False, 'epochs': 171, 'early_stopping_patience': 16, 'plateau_patience': 25, 'plateau_divider': 8}. Best is trial 177 with value: 0.9757575757575757.
[I 2024-12-25 12:21:21,297] Trial 330 finished with value: 0.9757575757575757 and parameters: {'left_stride': 256, 'right_stride': 32, 'attention_pooling_operation': 'mean', 'embedding_pooling_operation': 'min', 'threshold': 0.9809012783514133, 'batch_size': 34, 'attention_heads': 4, 'hidden_dimension': 32, 'number_of_hidden_layers': 2, 'dropout_rate': 0.3695902303208697, 'global_pooling': 'mean', 'learning_rate': 0.00012253809696856704, 'weight_decay': 0.00023871685984515827, 'beta_0': 0.8443627805979383, 'beta_1': 0.9934229334451784, 'epsilon': 1.0052548111487102e-08, 'balanced_loss': False, 'epochs': 181, 'early_stopping_patience': 17, 'plateau_patience': 25, 'plateau_divider': 9}. Best is trial 177 with value: 0.9757575757575757.
CUDA out of memory. Tried to allocate 2.39 GiB. GPU 0 has a total capacity of 44.56 GiB of which 824.69 MiB is free. Including non-PyTorch memory, this process has 43.75 GiB memory in use. Of the allocated memory 36.13 GiB is allocated by PyTorch, and 6.47 GiB is reserved by PyTorch but unallocated. If reserved but unallocated memory is large try setting PYTORCH_CUDA_ALLOC_CONF=expandable_segments:True to avoid fragmentation.  See documentation for Memory Management  (https://pytorch.org/docs/stable/notes/cuda.html#environment-variables)
[I 2024-12-25 12:40:33,966] Trial 331 finished with value: -1.0 and parameters: {'left_stride': 256, 'right_stride': 32, 'attention_pooling_operation': 'mean', 'embedding_pooling_operation': 'min', 'threshold': 0.9633010694749309, 'batch_size': 30, 'attention_heads': 5, 'hidden_dimension': 48, 'number_of_hidden_layers': 2, 'dropout_rate': 0.38974168414359184, 'global_pooling': 'mean', 'learning_rate': 6.607727878760219e-05, 'weight_decay': 0.00039027841065566294, 'beta_0': 0.8479315427202929, 'beta_1': 0.9916946893516642, 'epsilon': 1.2110172641531552e-08, 'balanced_loss': False, 'epochs': 165, 'early_stopping_patience': 18, 'plateau_patience': 24, 'plateau_divider': 8}. Best is trial 177 with value: 0.9757575757575757.
[I 2024-12-25 13:11:58,934] Trial 332 finished with value: 0.9696969696969697 and parameters: {'left_stride': 256, 'right_stride': 32, 'attention_pooling_operation': 'mean', 'embedding_pooling_operation': 'min', 'threshold': 0.9855695901524065, 'batch_size': 29, 'attention_heads': 4, 'hidden_dimension': 39, 'number_of_hidden_layers': 2, 'dropout_rate': 0.3811029907330293, 'global_pooling': 'mean', 'learning_rate': 3.849793638174707e-05, 'weight_decay': 0.00033409618536938475, 'beta_0': 0.8574235004364464, 'beta_1': 0.9929623508093319, 'epsilon': 1.5690965786767357e-08, 'balanced_loss': False, 'epochs': 178, 'early_stopping_patience': 16, 'plateau_patience': 25, 'plateau_divider': 8}. Best is trial 177 with value: 0.9757575757575757.
[I 2024-12-25 13:44:19,037] Trial 333 finished with value: 0.9696969696969697 and parameters: {'left_stride': 256, 'right_stride': 32, 'attention_pooling_operation': 'mean', 'embedding_pooling_operation': 'min', 'threshold': 0.9840762509103805, 'batch_size': 33, 'attention_heads': 4, 'hidden_dimension': 32, 'number_of_hidden_layers': 2, 'dropout_rate': 0.3683142937910028, 'global_pooling': 'mean', 'learning_rate': 2.6169360230812732e-05, 'weight_decay': 0.0005848639627200379, 'beta_0': 0.853914282975144, 'beta_1': 0.9940378187122965, 'epsilon': 1.8225180539349686e-08, 'balanced_loss': False, 'epochs': 174, 'early_stopping_patience': 18, 'plateau_patience': 25, 'plateau_divider': 9}. Best is trial 177 with value: 0.9757575757575757.
[I 2024-12-25 14:13:46,537] Trial 334 finished with value: 0.9575757575757575 and parameters: {'left_stride': 128, 'right_stride': 32, 'attention_pooling_operation': 'mean', 'embedding_pooling_operation': 'mean', 'threshold': 0.9787837825766338, 'batch_size': 34, 'attention_heads': 4, 'hidden_dimension': 36, 'number_of_hidden_layers': 2, 'dropout_rate': 0.37664601016085447, 'global_pooling': 'mean', 'learning_rate': 9.184231135895055e-05, 'weight_decay': 0.00046452786301649204, 'beta_0': 0.8501161614776297, 'beta_1': 0.9934440606451043, 'epsilon': 1.3493216253479816e-08, 'balanced_loss': False, 'epochs': 162, 'early_stopping_patience': 20, 'plateau_patience': 25, 'plateau_divider': 8}. Best is trial 177 with value: 0.9757575757575757.
[I 2024-12-25 14:43:39,452] Trial 335 finished with value: 0.9515151515151515 and parameters: {'left_stride': 0, 'right_stride': 32, 'attention_pooling_operation': 'mean', 'embedding_pooling_operation': 'min', 'threshold': 0.9819841326239879, 'batch_size': 35, 'attention_heads': 4, 'hidden_dimension': 43, 'number_of_hidden_layers': 2, 'dropout_rate': 0.3878054169648094, 'global_pooling': 'mean', 'learning_rate': 4.627651746534709e-05, 'weight_decay': 0.00028036154610182557, 'beta_0': 0.8466402684602486, 'beta_1': 0.9926023919616567, 'epsilon': 7.86031101449287e-06, 'balanced_loss': False, 'epochs': 184, 'early_stopping_patience': 17, 'plateau_patience': 24, 'plateau_divider': 8}. Best is trial 177 with value: 0.9757575757575757.
[I 2024-12-25 15:17:30,464] Trial 336 finished with value: 0.9696969696969697 and parameters: {'left_stride': 256, 'right_stride': 32, 'attention_pooling_operation': 'mean', 'embedding_pooling_operation': 'min', 'threshold': 0.9843939712719445, 'batch_size': 38, 'attention_heads': 5, 'hidden_dimension': 36, 'number_of_hidden_layers': 2, 'dropout_rate': 0.35643490003854916, 'global_pooling': 'mean', 'learning_rate': 3.2059390162936795e-05, 'weight_decay': 0.000399978481163559, 'beta_0': 0.8556235084237066, 'beta_1': 0.9945972350402955, 'epsilon': 1.1633384754162937e-08, 'balanced_loss': False, 'epochs': 171, 'early_stopping_patience': 15, 'plateau_patience': 25, 'plateau_divider': 8}. Best is trial 177 with value: 0.9757575757575757.
CUDA out of memory. Tried to allocate 1.57 GiB. GPU 0 has a total capacity of 44.56 GiB of which 690.69 MiB is free. Including non-PyTorch memory, this process has 43.88 GiB memory in use. Of the allocated memory 29.49 GiB is allocated by PyTorch, and 13.24 GiB is reserved by PyTorch but unallocated. If reserved but unallocated memory is large try setting PYTORCH_CUDA_ALLOC_CONF=expandable_segments:True to avoid fragmentation.  See documentation for Memory Management  (https://pytorch.org/docs/stable/notes/cuda.html#environment-variables)
[I 2024-12-25 15:44:41,498] Trial 337 finished with value: -1.0 and parameters: {'left_stride': 256, 'right_stride': 32, 'attention_pooling_operation': 'mean', 'embedding_pooling_operation': 'min', 'threshold': 0.9802560620883618, 'batch_size': 32, 'attention_heads': 4, 'hidden_dimension': 198, 'number_of_hidden_layers': 2, 'dropout_rate': 0.4095880444110234, 'global_pooling': 'mean', 'learning_rate': 7.720049285517236e-05, 'weight_decay': 0.0005095272831588994, 'beta_0': 0.852206221121201, 'beta_1': 0.9937382581076607, 'epsilon': 2.097512729973151e-08, 'balanced_loss': False, 'epochs': 180, 'early_stopping_patience': 18, 'plateau_patience': 25, 'plateau_divider': 7}. Best is trial 177 with value: 0.9757575757575757.
