[I 2024-11-23 18:55:14,166] Trial 168 finished with value: 0.8909090909090909 and parameters: {'left_stride': 0, 'right_stride': 64, 'attention_pooling_operation': 'mean', 'embedding_pooling_operation': 'max', 'threshold': 0.9883259570597016, 'batch_size': 61, 'attention_heads': 5, 'hidden_dimension': 113, 'number_of_hidden_layers': 4, 'dropout_rate': 0.46477432997153517, 'global_pooling': 'mean', 'learning_rate': 0.0008359866581676491, 'weight_decay': 1.13698263453685e-06, 'beta_0': 0.8020744579632002, 'beta_1': 0.9983458794720406, 'epsilon': 1.7202593861481897e-07, 'balanced_loss': False, 'epochs': 176, 'early_stopping_patience': 22, 'plateau_patience': 16, 'plateau_divider': 8}. Best is trial 84 with value: 0.9212121212121213.
[I 2024-11-23 19:12:18,095] Trial 169 finished with value: 0.9090909090909091 and parameters: {'left_stride': 0, 'right_stride': 64, 'attention_pooling_operation': 'mean', 'embedding_pooling_operation': 'min', 'threshold': 0.98010747326513, 'batch_size': 62, 'attention_heads': 5, 'hidden_dimension': 119, 'number_of_hidden_layers': 4, 'dropout_rate': 0.43866875472440925, 'global_pooling': 'mean', 'learning_rate': 0.0004938002029472893, 'weight_decay': 0.0008874127496709143, 'beta_0': 0.804883651067716, 'beta_1': 0.9979506112274357, 'epsilon': 8.397530943015403e-08, 'balanced_loss': False, 'epochs': 181, 'early_stopping_patience': 23, 'plateau_patience': 17, 'plateau_divider': 8}. Best is trial 84 with value: 0.9212121212121213.
[I 2024-11-23 19:29:02,077] Trial 170 finished with value: 0.9272727272727272 and parameters: {'left_stride': 0, 'right_stride': 64, 'attention_pooling_operation': 'mean', 'embedding_pooling_operation': 'max', 'threshold': 0.9829419159623779, 'batch_size': 63, 'attention_heads': 5, 'hidden_dimension': 108, 'number_of_hidden_layers': 4, 'dropout_rate': 0.4905561704044787, 'global_pooling': 'mean', 'learning_rate': 0.0006941436250083732, 'weight_decay': 1.4868176608516935e-06, 'beta_0': 0.8078057881688484, 'beta_1': 0.9975019459103478, 'epsilon': 1.2696285979240212e-07, 'balanced_loss': False, 'epochs': 187, 'early_stopping_patience': 23, 'plateau_patience': 16, 'plateau_divider': 7}. Best is trial 170 with value: 0.9272727272727272.
[I 2024-11-23 19:45:46,743] Trial 171 finished with value: 0.9151515151515152 and parameters: {'left_stride': 0, 'right_stride': 64, 'attention_pooling_operation': 'mean', 'embedding_pooling_operation': 'max', 'threshold': 0.9833498241429053, 'batch_size': 63, 'attention_heads': 5, 'hidden_dimension': 107, 'number_of_hidden_layers': 4, 'dropout_rate': 0.48752336752224235, 'global_pooling': 'mean', 'learning_rate': 0.000632496451406299, 'weight_decay': 1.6777024020347521e-06, 'beta_0': 0.8074621745722111, 'beta_1': 0.9975749893646814, 'epsilon': 1.1845671764617817e-07, 'balanced_loss': False, 'epochs': 186, 'early_stopping_patience': 23, 'plateau_patience': 16, 'plateau_divider': 7}. Best is trial 170 with value: 0.9272727272727272.
[I 2024-11-23 20:01:40,461] Trial 172 finished with value: 0.9151515151515152 and parameters: {'left_stride': 0, 'right_stride': 64, 'attention_pooling_operation': 'mean', 'embedding_pooling_operation': 'max', 'threshold': 0.9839134494077216, 'batch_size': 63, 'attention_heads': 5, 'hidden_dimension': 107, 'number_of_hidden_layers': 4, 'dropout_rate': 0.48883854407895216, 'global_pooling': 'mean', 'learning_rate': 0.0006363230519607724, 'weight_decay': 1.5073248630892553e-06, 'beta_0': 0.8078553085451404, 'beta_1': 0.9974566327391888, 'epsilon': 1.300100572004834e-07, 'balanced_loss': False, 'epochs': 188, 'early_stopping_patience': 22, 'plateau_patience': 16, 'plateau_divider': 7}. Best is trial 170 with value: 0.9272727272727272.
[I 2024-11-23 20:18:21,538] Trial 173 finished with value: 0.9151515151515152 and parameters: {'left_stride': 0, 'right_stride': 64, 'attention_pooling_operation': 'mean', 'embedding_pooling_operation': 'max', 'threshold': 0.9834325227874253, 'batch_size': 63, 'attention_heads': 5, 'hidden_dimension': 107, 'number_of_hidden_layers': 4, 'dropout_rate': 0.4924936619712508, 'global_pooling': 'mean', 'learning_rate': 0.0007148962402345919, 'weight_decay': 1.6250672831761942e-06, 'beta_0': 0.8087701463223175, 'beta_1': 0.9975572810409099, 'epsilon': 1.304929060685283e-07, 'balanced_loss': False, 'epochs': 187, 'early_stopping_patience': 22, 'plateau_patience': 16, 'plateau_divider': 7}. Best is trial 170 with value: 0.9272727272727272.
[I 2024-11-23 20:34:08,258] Trial 174 finished with value: 0.9272727272727272 and parameters: {'left_stride': 0, 'right_stride': 64, 'attention_pooling_operation': 'mean', 'embedding_pooling_operation': 'max', 'threshold': 0.9832969954041052, 'batch_size': 63, 'attention_heads': 5, 'hidden_dimension': 109, 'number_of_hidden_layers': 4, 'dropout_rate': 0.5043079213709663, 'global_pooling': 'mean', 'learning_rate': 0.0006887528081104892, 'weight_decay': 1.5829453723388386e-06, 'beta_0': 0.8090930173209532, 'beta_1': 0.99752397840159, 'epsilon': 1.286710775245169e-07, 'balanced_loss': False, 'epochs': 188, 'early_stopping_patience': 22, 'plateau_patience': 16, 'plateau_divider': 7}. Best is trial 170 with value: 0.9272727272727272.
[I 2024-11-23 20:51:18,321] Trial 175 finished with value: 0.9333333333333333 and parameters: {'left_stride': 0, 'right_stride': 64, 'attention_pooling_operation': 'mean', 'embedding_pooling_operation': 'max', 'threshold': 0.9837938412911195, 'batch_size': 63, 'attention_heads': 5, 'hidden_dimension': 105, 'number_of_hidden_layers': 4, 'dropout_rate': 0.5058736689615027, 'global_pooling': 'mean', 'learning_rate': 0.0007134399359291173, 'weight_decay': 1.6319171499161143e-06, 'beta_0': 0.8103694098663191, 'beta_1': 0.9974732653280144, 'epsilon': 1.2834714644076053e-07, 'balanced_loss': False, 'epochs': 189, 'early_stopping_patience': 22, 'plateau_patience': 16, 'plateau_divider': 7}. Best is trial 175 with value: 0.9333333333333333.
[I 2024-11-23 21:07:04,062] Trial 176 finished with value: 0.9151515151515152 and parameters: {'left_stride': 0, 'right_stride': 64, 'attention_pooling_operation': 'mean', 'embedding_pooling_operation': 'max', 'threshold': 0.9836038255838129, 'batch_size': 63, 'attention_heads': 5, 'hidden_dimension': 106, 'number_of_hidden_layers': 4, 'dropout_rate': 0.508187092380538, 'global_pooling': 'mean', 'learning_rate': 0.0006583697047106392, 'weight_decay': 1.6204986196871016e-06, 'beta_0': 0.8103186670243524, 'beta_1': 0.997491865854188, 'epsilon': 1.369052009709982e-07, 'balanced_loss': False, 'epochs': 188, 'early_stopping_patience': 22, 'plateau_patience': 16, 'plateau_divider': 7}. Best is trial 175 with value: 0.9333333333333333.
[I 2024-11-23 21:22:59,888] Trial 177 finished with value: 0.8787878787878788 and parameters: {'left_stride': 0, 'right_stride': 64, 'attention_pooling_operation': 'mean', 'embedding_pooling_operation': 'max', 'threshold': 0.984115903210069, 'batch_size': 61, 'attention_heads': 5, 'hidden_dimension': 108, 'number_of_hidden_layers': 4, 'dropout_rate': 0.4900653689343442, 'global_pooling': 'max', 'learning_rate': 0.0006529664022353551, 'weight_decay': 1.0297341429850149e-06, 'beta_0': 0.8127985387638351, 'beta_1': 0.9975131610082636, 'epsilon': 2.3188485172840297e-07, 'balanced_loss': False, 'epochs': 184, 'early_stopping_patience': 22, 'plateau_patience': 16, 'plateau_divider': 7}. Best is trial 175 with value: 0.9333333333333333.
[I 2024-11-23 21:38:58,629] Trial 178 finished with value: 0.896969696969697 and parameters: {'left_stride': 0, 'right_stride': 64, 'attention_pooling_operation': 'mean', 'embedding_pooling_operation': 'max', 'threshold': 0.9770060100311746, 'batch_size': 64, 'attention_heads': 4, 'hidden_dimension': 102, 'number_of_hidden_layers': 4, 'dropout_rate': 0.503450693671534, 'global_pooling': 'mean', 'learning_rate': 0.0003858098892642852, 'weight_decay': 1.4225779174045137e-06, 'beta_0': 0.8089319946650241, 'beta_1': 0.9979238590910521, 'epsilon': 1.7499920499658447e-07, 'balanced_loss': False, 'epochs': 188, 'early_stopping_patience': 22, 'plateau_patience': 16, 'plateau_divider': 7}. Best is trial 175 with value: 0.9333333333333333.
[I 2024-11-23 21:55:36,135] Trial 179 finished with value: 0.9030303030303031 and parameters: {'left_stride': 0, 'right_stride': 64, 'attention_pooling_operation': 'mean', 'embedding_pooling_operation': 'max', 'threshold': 0.9838483288349839, 'batch_size': 62, 'attention_heads': 5, 'hidden_dimension': 112, 'number_of_hidden_layers': 4, 'dropout_rate': 0.5128824617386866, 'global_pooling': 'mean', 'learning_rate': 0.0007407167492926156, 'weight_decay': 1.7048658838512194e-06, 'beta_0': 0.8113642525483161, 'beta_1': 0.9970187697626414, 'epsilon': 1.046941412778931e-07, 'balanced_loss': False, 'epochs': 178, 'early_stopping_patience': 21, 'plateau_patience': 15, 'plateau_divider': 7}. Best is trial 175 with value: 0.9333333333333333.
[I 2024-11-23 22:11:52,855] Trial 180 finished with value: 0.9151515151515152 and parameters: {'left_stride': 0, 'right_stride': 64, 'attention_pooling_operation': 'mean', 'embedding_pooling_operation': 'max', 'threshold': 0.9792397716862665, 'batch_size': 63, 'attention_heads': 4, 'hidden_dimension': 104, 'number_of_hidden_layers': 4, 'dropout_rate': 0.4932307239821392, 'global_pooling': 'mean', 'learning_rate': 0.001167469152462474, 'weight_decay': 1.4159580945279602e-06, 'beta_0': 0.8087588526927071, 'beta_1': 0.9982558545622138, 'epsilon': 7.715493659923569e-08, 'balanced_loss': False, 'epochs': 183, 'early_stopping_patience': 22, 'plateau_patience': 16, 'plateau_divider': 6}. Best is trial 175 with value: 0.9333333333333333.
[I 2024-11-23 22:28:10,189] Trial 181 finished with value: 0.9212121212121213 and parameters: {'left_stride': 0, 'right_stride': 64, 'attention_pooling_operation': 'mean', 'embedding_pooling_operation': 'max', 'threshold': 0.9832383238053507, 'batch_size': 63, 'attention_heads': 5, 'hidden_dimension': 108, 'number_of_hidden_layers': 4, 'dropout_rate': 0.5178820319847517, 'global_pooling': 'mean', 'learning_rate': 0.0006856673957322289, 'weight_decay': 1.6086031225627056e-06, 'beta_0': 0.8107404951499276, 'beta_1': 0.9974276535109942, 'epsilon': 1.276150106389218e-07, 'balanced_loss': False, 'epochs': 186, 'early_stopping_patience': 22, 'plateau_patience': 16, 'plateau_divider': 7}. Best is trial 175 with value: 0.9333333333333333.
[I 2024-11-23 22:44:04,952] Trial 182 finished with value: 0.9090909090909091 and parameters: {'left_stride': 0, 'right_stride': 64, 'attention_pooling_operation': 'mean', 'embedding_pooling_operation': 'max', 'threshold': 0.9853346134360994, 'batch_size': 61, 'attention_heads': 5, 'hidden_dimension': 109, 'number_of_hidden_layers': 4, 'dropout_rate': 0.5193963026030312, 'global_pooling': 'mean', 'learning_rate': 0.0006333665482424913, 'weight_decay': 1.9795308898070077e-06, 'beta_0': 0.8151736499701063, 'beta_1': 0.9976371520983799, 'epsilon': 1.288911534046167e-07, 'balanced_loss': False, 'epochs': 190, 'early_stopping_patience': 22, 'plateau_patience': 16, 'plateau_divider': 7}. Best is trial 175 with value: 0.9333333333333333.
[I 2024-11-23 23:00:29,723] Trial 183 finished with value: 0.9090909090909091 and parameters: {'left_stride': 0, 'right_stride': 64, 'attention_pooling_operation': 'mean', 'embedding_pooling_operation': 'max', 'threshold': 0.9820514215256425, 'batch_size': 64, 'attention_heads': 5, 'hidden_dimension': 115, 'number_of_hidden_layers': 4, 'dropout_rate': 0.4849428719151546, 'global_pooling': 'mean', 'learning_rate': 0.0008519929155398818, 'weight_decay': 1.2285506398520672e-06, 'beta_0': 0.8071933915374843, 'beta_1': 0.997295363562736, 'epsilon': 1.5402905351007007e-07, 'balanced_loss': False, 'epochs': 186, 'early_stopping_patience': 22, 'plateau_patience': 16, 'plateau_divider': 7}. Best is trial 175 with value: 0.9333333333333333.
[I 2024-11-23 23:16:02,874] Trial 184 finished with value: 0.9090909090909091 and parameters: {'left_stride': 0, 'right_stride': 64, 'attention_pooling_operation': 'mean', 'embedding_pooling_operation': 'max', 'threshold': 0.9877893687522123, 'batch_size': 63, 'attention_heads': 5, 'hidden_dimension': 109, 'number_of_hidden_layers': 4, 'dropout_rate': 0.5015761623343019, 'global_pooling': 'mean', 'learning_rate': 0.0005831709302504002, 'weight_decay': 1.6601708217958592e-06, 'beta_0': 0.8108684758811824, 'beta_1': 0.9981145538829845, 'epsilon': 1.0500941900394405e-07, 'balanced_loss': False, 'epochs': 182, 'early_stopping_patience': 21, 'plateau_patience': 15, 'plateau_divider': 7}. Best is trial 175 with value: 0.9333333333333333.
[I 2024-11-23 23:32:14,508] Trial 185 finished with value: 0.8909090909090909 and parameters: {'left_stride': 0, 'right_stride': 64, 'attention_pooling_operation': 'mean', 'embedding_pooling_operation': 'max', 'threshold': 0.9843387751161929, 'batch_size': 62, 'attention_heads': 4, 'hidden_dimension': 101, 'number_of_hidden_layers': 4, 'dropout_rate': 0.48155731645746797, 'global_pooling': 'mean', 'learning_rate': 0.0010305142448207253, 'weight_decay': 1.8654296694519212e-06, 'beta_0': 0.813576015206634, 'beta_1': 0.9968554946901139, 'epsilon': 1.2615246049321871e-07, 'balanced_loss': False, 'epochs': 187, 'early_stopping_patience': 22, 'plateau_patience': 16, 'plateau_divider': 7}. Best is trial 175 with value: 0.9333333333333333.
[I 2024-11-23 23:48:49,528] Trial 186 finished with value: 0.9090909090909091 and parameters: {'left_stride': 0, 'right_stride': 64, 'attention_pooling_operation': 'mean', 'embedding_pooling_operation': 'max', 'threshold': 0.9801116410818269, 'batch_size': 60, 'attention_heads': 5, 'hidden_dimension': 106, 'number_of_hidden_layers': 4, 'dropout_rate': 0.4758810159003517, 'global_pooling': 'mean', 'learning_rate': 0.00044577053526865043, 'weight_decay': 1.5011869673846097e-06, 'beta_0': 0.8078492833597859, 'beta_1': 0.9977282182290687, 'epsilon': 1.976148992281631e-07, 'balanced_loss': False, 'epochs': 193, 'early_stopping_patience': 23, 'plateau_patience': 15, 'plateau_divider': 7}. Best is trial 175 with value: 0.9333333333333333.
[I 2024-11-24 00:04:40,350] Trial 187 finished with value: 0.896969696969697 and parameters: {'left_stride': 0, 'right_stride': 64, 'attention_pooling_operation': 'mean', 'embedding_pooling_operation': 'max', 'threshold': 0.9869165774632762, 'batch_size': 62, 'attention_heads': 4, 'hidden_dimension': 113, 'number_of_hidden_layers': 4, 'dropout_rate': 0.4961381010934286, 'global_pooling': 'mean', 'learning_rate': 0.0007721865198924047, 'weight_decay': 2.2021997544989045e-06, 'beta_0': 0.8322262948830719, 'beta_1': 0.9985081451407726, 'epsilon': 9.088671110146898e-08, 'balanced_loss': False, 'epochs': 176, 'early_stopping_patience': 22, 'plateau_patience': 16, 'plateau_divider': 7}. Best is trial 175 with value: 0.9333333333333333.
[I 2024-11-24 00:15:32,323] Trial 188 finished with value: 0.9030303030303031 and parameters: {'left_stride': 0, 'right_stride': 64, 'attention_pooling_operation': 'min', 'embedding_pooling_operation': 'max', 'threshold': 0.9821722742006821, 'batch_size': 63, 'attention_heads': 4, 'hidden_dimension': 112, 'number_of_hidden_layers': 4, 'dropout_rate': 0.5074627177069108, 'global_pooling': 'mean', 'learning_rate': 0.0013014871623453863, 'weight_decay': 1.22021163853296e-06, 'beta_0': 0.8096842256551127, 'beta_1': 0.9972490856257712, 'epsilon': 1.586840787967899e-07, 'balanced_loss': False, 'epochs': 180, 'early_stopping_patience': 23, 'plateau_patience': 16, 'plateau_divider': 7}. Best is trial 175 with value: 0.9333333333333333.
[I 2024-11-24 00:32:35,212] Trial 189 finished with value: 0.9151515151515152 and parameters: {'left_stride': 0, 'right_stride': 64, 'attention_pooling_operation': 'mean', 'embedding_pooling_operation': 'max', 'threshold': 0.9792224094789611, 'batch_size': 61, 'attention_heads': 5, 'hidden_dimension': 123, 'number_of_hidden_layers': 4, 'dropout_rate': 0.5129118154800432, 'global_pooling': 'mean', 'learning_rate': 0.0016359399171801642, 'weight_decay': 1.7570186530005678e-06, 'beta_0': 0.806395341369176, 'beta_1': 0.9981812458461484, 'epsilon': 7.154642009784501e-08, 'balanced_loss': False, 'epochs': 191, 'early_stopping_patience': 21, 'plateau_patience': 17, 'plateau_divider': 7}. Best is trial 175 with value: 0.9333333333333333.
[I 2024-11-24 00:48:39,167] Trial 190 finished with value: 0.8909090909090909 and parameters: {'left_stride': 0, 'right_stride': 64, 'attention_pooling_operation': 'mean', 'embedding_pooling_operation': 'max', 'threshold': 0.9854231430695967, 'batch_size': 64, 'attention_heads': 5, 'hidden_dimension': 98, 'number_of_hidden_layers': 4, 'dropout_rate': 0.5314397058704511, 'global_pooling': 'mean', 'learning_rate': 0.0002997125017821824, 'weight_decay': 1.5422515200156014e-06, 'beta_0': 0.8056376194615691, 'beta_1': 0.9976611762724344, 'epsilon': 2.4745835204318595e-07, 'balanced_loss': False, 'epochs': 186, 'early_stopping_patience': 23, 'plateau_patience': 16, 'plateau_divider': 7}. Best is trial 175 with value: 0.9333333333333333.
[I 2024-11-24 01:05:13,599] Trial 191 finished with value: 0.9151515151515152 and parameters: {'left_stride': 0, 'right_stride': 64, 'attention_pooling_operation': 'mean', 'embedding_pooling_operation': 'max', 'threshold': 0.9833925215738705, 'batch_size': 63, 'attention_heads': 5, 'hidden_dimension': 106, 'number_of_hidden_layers': 4, 'dropout_rate': 0.5289024621496159, 'global_pooling': 'mean', 'learning_rate': 0.0007121346850472212, 'weight_decay': 1.6285632474667767e-06, 'beta_0': 0.8115312931295936, 'beta_1': 0.9973565981531158, 'epsilon': 1.3530106623319116e-07, 'balanced_loss': False, 'epochs': 190, 'early_stopping_patience': 22, 'plateau_patience': 16, 'plateau_divider': 7}. Best is trial 175 with value: 0.9333333333333333.
[I 2024-11-24 01:21:58,714] Trial 192 finished with value: 0.8848484848484849 and parameters: {'left_stride': 0, 'right_stride': 64, 'attention_pooling_operation': 'mean', 'embedding_pooling_operation': 'max', 'threshold': 0.9844228400771255, 'batch_size': 62, 'attention_heads': 5, 'hidden_dimension': 116, 'number_of_hidden_layers': 4, 'dropout_rate': 0.4874904854016868, 'global_pooling': 'mean', 'learning_rate': 0.0006594043407516534, 'weight_decay': 1.3363843587652579e-06, 'beta_0': 0.8097334032388, 'beta_1': 0.9978391860554657, 'epsilon': 1.1437726262437344e-07, 'balanced_loss': False, 'epochs': 187, 'early_stopping_patience': 22, 'plateau_patience': 16, 'plateau_divider': 7}. Best is trial 175 with value: 0.9333333333333333.
[I 2024-11-24 01:38:01,793] Trial 193 finished with value: 0.896969696969697 and parameters: {'left_stride': 0, 'right_stride': 64, 'attention_pooling_operation': 'mean', 'embedding_pooling_operation': 'max', 'threshold': 0.9827881685041537, 'batch_size': 63, 'attention_heads': 5, 'hidden_dimension': 107, 'number_of_hidden_layers': 4, 'dropout_rate': 0.5070406701331863, 'global_pooling': 'mean', 'learning_rate': 0.0005478940174035842, 'weight_decay': 2.0859431132036663e-06, 'beta_0': 0.8083741054202276, 'beta_1': 0.9966465861086083, 'epsilon': 1.5011978935021946e-07, 'balanced_loss': False, 'epochs': 182, 'early_stopping_patience': 23, 'plateau_patience': 16, 'plateau_divider': 6}. Best is trial 175 with value: 0.9333333333333333.
[I 2024-11-24 01:55:42,065] Trial 194 finished with value: 0.9272727272727272 and parameters: {'left_stride': 0, 'right_stride': 64, 'attention_pooling_operation': 'mean', 'embedding_pooling_operation': 'max', 'threshold': 0.9777459516222143, 'batch_size': 61, 'attention_heads': 5, 'hidden_dimension': 103, 'number_of_hidden_layers': 4, 'dropout_rate': 0.4704907976000458, 'global_pooling': 'mean', 'learning_rate': 0.0008977891122387554, 'weight_decay': 1.8304137855375263e-06, 'beta_0': 0.812536766008706, 'beta_1': 0.9974440599256773, 'epsilon': 9.230826252704296e-08, 'balanced_loss': False, 'epochs': 196, 'early_stopping_patience': 21, 'plateau_patience': 17, 'plateau_divider': 7}. Best is trial 175 with value: 0.9333333333333333.
[I 2024-11-24 02:11:41,691] Trial 195 finished with value: 0.9212121212121213 and parameters: {'left_stride': 0, 'right_stride': 64, 'attention_pooling_operation': 'mean', 'embedding_pooling_operation': 'max', 'threshold': 0.9780383291513811, 'batch_size': 61, 'attention_heads': 4, 'hidden_dimension': 101, 'number_of_hidden_layers': 4, 'dropout_rate': 0.47162917599298515, 'global_pooling': 'mean', 'learning_rate': 0.0009197811806044519, 'weight_decay': 1.9277149447624247e-06, 'beta_0': 0.8132847642965707, 'beta_1': 0.9985861573147939, 'epsilon': 8.789880630713842e-08, 'balanced_loss': False, 'epochs': 195, 'early_stopping_patience': 21, 'plateau_patience': 17, 'plateau_divider': 7}. Best is trial 175 with value: 0.9333333333333333.
[I 2024-11-24 02:28:33,116] Trial 196 finished with value: 0.8666666666666667 and parameters: {'left_stride': 0, 'right_stride': 64, 'attention_pooling_operation': 'mean', 'embedding_pooling_operation': 'max', 'threshold': 0.9740128512538409, 'batch_size': 60, 'attention_heads': 4, 'hidden_dimension': 102, 'number_of_hidden_layers': 4, 'dropout_rate': 0.469573424812086, 'global_pooling': 'sum', 'learning_rate': 0.0009150554473317827, 'weight_decay': 2.3575570827673365e-06, 'beta_0': 0.8161876771019162, 'beta_1': 0.9986312604585043, 'epsilon': 8.45848007502242e-08, 'balanced_loss': False, 'epochs': 196, 'early_stopping_patience': 21, 'plateau_patience': 17, 'plateau_divider': 7}. Best is trial 175 with value: 0.9333333333333333.
