[I 2024-12-26 23:39:41,459] Trial 406 finished with value: 0.9696969696969697 and parameters: {'left_stride': 256, 'right_stride': 32, 'attention_pooling_operation': 'mean', 'embedding_pooling_operation': 'min', 'threshold': 0.9802594999240924, 'batch_size': 35, 'attention_heads': 5, 'hidden_dimension': 43, 'number_of_hidden_layers': 2, 'dropout_rate': 0.37038003464019253, 'global_pooling': 'mean', 'learning_rate': 6.049753169752857e-05, 'weight_decay': 0.00044299825374894894, 'beta_0': 0.8566097006093658, 'beta_1': 0.9929980931867938, 'epsilon': 1.3629249356632958e-08, 'balanced_loss': False, 'epochs': 185, 'early_stopping_patience': 17, 'plateau_patience': 25, 'plateau_divider': 9}. Best is trial 177 with value: 0.9757575757575757.
[I 2024-12-27 00:12:30,122] Trial 407 finished with value: 0.9575757575757575 and parameters: {'left_stride': 256, 'right_stride': 32, 'attention_pooling_operation': 'mean', 'embedding_pooling_operation': 'min', 'threshold': 0.9837567491023793, 'batch_size': 36, 'attention_heads': 4, 'hidden_dimension': 36, 'number_of_hidden_layers': 2, 'dropout_rate': 0.3899230708231572, 'global_pooling': 'mean', 'learning_rate': 3.580825790112843e-05, 'weight_decay': 8.782602816634485e-05, 'beta_0': 0.8518532828451629, 'beta_1': 0.9939521321493774, 'epsilon': 1.7965630557348766e-08, 'balanced_loss': False, 'epochs': 179, 'early_stopping_patience': 15, 'plateau_patience': 25, 'plateau_divider': 8}. Best is trial 177 with value: 0.9757575757575757.

[TRIAL] 198 [VALIDATION PERFORMANCE] 0.9757575757575757 [TRAINING LOSS] 0.03725554604898207 [VALIDATION LOSS] 0.11455988326391282 

number                                     198
value                                 0.975758
params_threshold                      0.982602
params_attention_heads                       4
params_balanced_loss                     False
params_embedding_pooling_operation         min
params_attention_pooling_operation        mean
params_batch_size                           32
params_dropout_rate                   0.366046
params_early_stopping_patience              15
params_epochs                              176
params_global_pooling                     mean
params_hidden_dimension                     32
params_learning_rate                  0.000125
params_number_of_hidden_layers               2
params_plateau_divider                       8
params_plateau_patience                     25
params_weight_decay                   0.000569
params_beta_0                         0.853714
params_beta_1                         0.991779
params_epsilon                             0.0
user_attrs_epoch                          57.0
user_attrs_training_loss              0.037256
user_attrs_validation_loss             0.11456
params_left_stride                         256
params_right_stride                         32
Name: 198, dtype: object
37 Val: 0.9696969696969697 Test: 0.9522388059701492
38 Val: 0.9757575757575757 Test: 0.9492537313432836
39 Val: 0.9636363636363636 Test: 0.9522388059701492
40 Val: 0.9696969696969697 Test: 0.9522388059701492
41 Val: 0.9636363636363636 Test: 0.9522388059701492
42 Val: 0.9757575757575757 Test: 0.9492537313432836
43 Val: 0.9696969696969697 Test: 0.9522388059701492
slurmstepd: error: *** JOB 14149145 ON gpu050 CANCELLED AT 2024-12-27T04:05:03 DUE TO TIME LIMIT ***
