[I 2024-12-23 13:51:18,545] Trial 252 finished with value: 0.9272727272727272 and parameters: {'left_stride': 128, 'right_stride': 64, 'attention_pooling_operation': 'min', 'embedding_pooling_operation': 'max', 'threshold': 0.9949758523107411, 'batch_size': 46, 'attention_heads': 8, 'hidden_dimension': 126, 'number_of_hidden_layers': 2, 'dropout_rate': 0.3984946607149528, 'global_pooling': 'mean', 'learning_rate': 7.975270775105055e-05, 'weight_decay': 3.660894748070067e-05, 'beta_0': 0.8367578779437966, 'beta_1': 0.9962795671966513, 'epsilon': 2.17235254260516e-08, 'balanced_loss': True, 'epochs': 160, 'early_stopping_patience': 13, 'plateau_patience': 23, 'plateau_divider': 3}. Best is trial 110 with value: 0.9515151515151515.
[I 2024-12-23 14:10:53,967] Trial 253 finished with value: 0.8242424242424242 and parameters: {'left_stride': 128, 'right_stride': 64, 'attention_pooling_operation': 'min', 'embedding_pooling_operation': 'mean', 'threshold': 0.9997623799588826, 'batch_size': 58, 'attention_heads': 9, 'hidden_dimension': 137, 'number_of_hidden_layers': 2, 'dropout_rate': 0.38431995558507104, 'global_pooling': 'mean', 'learning_rate': 0.001246482871008998, 'weight_decay': 2.7057501236373596e-05, 'beta_0': 0.8614894792603739, 'beta_1': 0.9969356517481286, 'epsilon': 1.6233888818039856e-08, 'balanced_loss': True, 'epochs': 110, 'early_stopping_patience': 12, 'plateau_patience': 24, 'plateau_divider': 3}. Best is trial 110 with value: 0.9515151515151515.
[I 2024-12-23 14:32:57,540] Trial 254 finished with value: 0.9333333333333333 and parameters: {'left_stride': 128, 'right_stride': 64, 'attention_pooling_operation': 'min', 'embedding_pooling_operation': 'max', 'threshold': 0.9932924803634057, 'batch_size': 53, 'attention_heads': 8, 'hidden_dimension': 131, 'number_of_hidden_layers': 2, 'dropout_rate': 0.4082701294523887, 'global_pooling': 'mean', 'learning_rate': 0.0005961328269796647, 'weight_decay': 4.711261738245862e-05, 'beta_0': 0.8394574440812812, 'beta_1': 0.9957478291531594, 'epsilon': 1.185195669034358e-06, 'balanced_loss': True, 'epochs': 149, 'early_stopping_patience': 13, 'plateau_patience': 25, 'plateau_divider': 4}. Best is trial 110 with value: 0.9515151515151515.
[I 2024-12-23 14:58:58,965] Trial 255 finished with value: 0.9393939393939394 and parameters: {'left_stride': 128, 'right_stride': 256, 'attention_pooling_operation': 'min', 'embedding_pooling_operation': 'max', 'threshold': 0.9964890709955442, 'batch_size': 36, 'attention_heads': 8, 'hidden_dimension': 121, 'number_of_hidden_layers': 2, 'dropout_rate': 0.39339571014459945, 'global_pooling': 'mean', 'learning_rate': 0.00040007593866137054, 'weight_decay': 3.309852528286747e-05, 'beta_0': 0.8419827495115174, 'beta_1': 0.9885043866682057, 'epsilon': 2.5382344022048277e-08, 'balanced_loss': True, 'epochs': 86, 'early_stopping_patience': 13, 'plateau_patience': 19, 'plateau_divider': 3}. Best is trial 110 with value: 0.9515151515151515.
[I 2024-12-23 15:32:22,440] Trial 256 finished with value: 0.8787878787878788 and parameters: {'left_stride': 128, 'right_stride': 64, 'attention_pooling_operation': 'mean', 'embedding_pooling_operation': 'mean', 'threshold': 0.9975241266943167, 'batch_size': 49, 'attention_heads': 6, 'hidden_dimension': 133, 'number_of_hidden_layers': 2, 'dropout_rate': 0.4034612463709633, 'global_pooling': 'mean', 'learning_rate': 0.0008024700670027413, 'weight_decay': 3.896001207900549e-05, 'beta_0': 0.8448732129332592, 'beta_1': 0.9955079710601253, 'epsilon': 1.1901228890254077e-08, 'balanced_loss': True, 'epochs': 155, 'early_stopping_patience': 11, 'plateau_patience': 18, 'plateau_divider': 2}. Best is trial 110 with value: 0.9515151515151515.
[I 2024-12-23 15:54:46,281] Trial 257 finished with value: 0.9272727272727272 and parameters: {'left_stride': 128, 'right_stride': 32, 'attention_pooling_operation': 'min', 'embedding_pooling_operation': 'max', 'threshold': 0.9944421558443788, 'batch_size': 56, 'attention_heads': 9, 'hidden_dimension': 178, 'number_of_hidden_layers': 2, 'dropout_rate': 0.41028360444472245, 'global_pooling': 'mean', 'learning_rate': 0.0005144092363651809, 'weight_decay': 2.988057809994394e-05, 'beta_0': 0.8485513925547102, 'beta_1': 0.9984002037335474, 'epsilon': 1.9873683327725625e-08, 'balanced_loss': True, 'epochs': 154, 'early_stopping_patience': 17, 'plateau_patience': 25, 'plateau_divider': 3}. Best is trial 110 with value: 0.9515151515151515.
CUDA out of memory. Tried to allocate 1.77 GiB. GPU 0 has a total capacity of 44.56 GiB of which 1.68 GiB is free. Including non-PyTorch memory, this process has 42.88 GiB memory in use. Of the allocated memory 37.57 GiB is allocated by PyTorch, and 4.16 GiB is reserved by PyTorch but unallocated. If reserved but unallocated memory is large try setting PYTORCH_CUDA_ALLOC_CONF=expandable_segments:True to avoid fragmentation.  See documentation for Memory Management  (https://pytorch.org/docs/stable/notes/cuda.html#environment-variables)
[I 2024-12-23 16:16:29,949] Trial 258 finished with value: -1.0 and parameters: {'left_stride': 256, 'right_stride': 64, 'attention_pooling_operation': 'min', 'embedding_pooling_operation': 'max', 'threshold': 0.9920850733098682, 'batch_size': 59, 'attention_heads': 8, 'hidden_dimension': 143, 'number_of_hidden_layers': 2, 'dropout_rate': 0.3869494965880789, 'global_pooling': 'mean', 'learning_rate': 0.0003174142565396768, 'weight_decay': 5.17294301353061e-05, 'beta_0': 0.8465385427085809, 'beta_1': 0.9952943141382643, 'epsilon': 1.5146401107936572e-08, 'balanced_loss': True, 'epochs': 145, 'early_stopping_patience': 13, 'plateau_patience': 25, 'plateau_divider': 3}. Best is trial 110 with value: 0.9515151515151515.
CUDA out of memory. Tried to allocate 1.09 GiB. GPU 0 has a total capacity of 44.56 GiB of which 714.69 MiB is free. Including non-PyTorch memory, this process has 43.86 GiB memory in use. Of the allocated memory 36.38 GiB is allocated by PyTorch, and 6.33 GiB is reserved by PyTorch but unallocated. If reserved but unallocated memory is large try setting PYTORCH_CUDA_ALLOC_CONF=expandable_segments:True to avoid fragmentation.  See documentation for Memory Management  (https://pytorch.org/docs/stable/notes/cuda.html#environment-variables)
[I 2024-12-23 16:22:22,505] Trial 259 finished with value: -1.0 and parameters: {'left_stride': 128, 'right_stride': 64, 'attention_pooling_operation': 'min', 'embedding_pooling_operation': 'max', 'threshold': 0.9049813526707423, 'batch_size': 51, 'attention_heads': 6, 'hidden_dimension': 72, 'number_of_hidden_layers': 2, 'dropout_rate': 0.3980139996234991, 'global_pooling': 'mean', 'learning_rate': 0.0010159985264898911, 'weight_decay': 5.779554195051548e-06, 'beta_0': 0.8664243797500168, 'beta_1': 0.9844765055138394, 'epsilon': 3.143589868291785e-08, 'balanced_loss': True, 'epochs': 167, 'early_stopping_patience': 14, 'plateau_patience': 25, 'plateau_divider': 3}. Best is trial 110 with value: 0.9515151515151515.
[I 2024-12-23 16:43:06,393] Trial 260 finished with value: 0.9212121212121213 and parameters: {'left_stride': 128, 'right_stride': 64, 'attention_pooling_operation': 'min', 'embedding_pooling_operation': 'mean', 'threshold': 0.9952609859296738, 'batch_size': 64, 'attention_heads': 8, 'hidden_dimension': 126, 'number_of_hidden_layers': 2, 'dropout_rate': 0.40448128092506386, 'global_pooling': 'mean', 'learning_rate': 0.0006944799617393723, 'weight_decay': 2.0537679897261206e-05, 'beta_0': 0.843469784187664, 'beta_1': 0.996987903163949, 'epsilon': 2.457533008472125e-08, 'balanced_loss': True, 'epochs': 189, 'early_stopping_patience': 10, 'plateau_patience': 24, 'plateau_divider': 3}. Best is trial 110 with value: 0.9515151515151515.
CUDA out of memory. Tried to allocate 1.38 GiB. GPU 0 has a total capacity of 44.56 GiB of which 1.22 GiB is free. Including non-PyTorch memory, this process has 43.33 GiB memory in use. Of the allocated memory 37.12 GiB is allocated by PyTorch, and 5.06 GiB is reserved by PyTorch but unallocated. If reserved but unallocated memory is large try setting PYTORCH_CUDA_ALLOC_CONF=expandable_segments:True to avoid fragmentation.  See documentation for Memory Management  (https://pytorch.org/docs/stable/notes/cuda.html#environment-variables)
[I 2024-12-23 17:07:43,885] Trial 261 finished with value: -1.0 and parameters: {'left_stride': 128, 'right_stride': 256, 'attention_pooling_operation': 'min', 'embedding_pooling_operation': 'max', 'threshold': 0.988898663324054, 'batch_size': 46, 'attention_heads': 6, 'hidden_dimension': 135, 'number_of_hidden_layers': 2, 'dropout_rate': 0.3810657572246839, 'global_pooling': 'mean', 'learning_rate': 0.0014355386518187024, 'weight_decay': 4.4478872918115493e-05, 'beta_0': 0.8408955958811859, 'beta_1': 0.9881370104539872, 'epsilon': 1.4486214815887347e-07, 'balanced_loss': True, 'epochs': 195, 'early_stopping_patience': 12, 'plateau_patience': 17, 'plateau_divider': 2}. Best is trial 110 with value: 0.9515151515151515.
[I 2024-12-23 17:29:37,922] Trial 262 finished with value: 0.9212121212121213 and parameters: {'left_stride': 128, 'right_stride': 64, 'attention_pooling_operation': 'min', 'embedding_pooling_operation': 'max', 'threshold': 0.9979959776704835, 'batch_size': 41, 'attention_heads': 8, 'hidden_dimension': 217, 'number_of_hidden_layers': 2, 'dropout_rate': 0.3906287534317476, 'global_pooling': 'mean', 'learning_rate': 0.0004823433743942978, 'weight_decay': 3.426372631999249e-05, 'beta_0': 0.8469462702029992, 'beta_1': 0.9965115897913747, 'epsilon': 1.7713768432279084e-08, 'balanced_loss': True, 'epochs': 185, 'early_stopping_patience': 13, 'plateau_patience': 18, 'plateau_divider': 4}. Best is trial 110 with value: 0.9515151515151515.
CUDA out of memory. Tried to allocate 1.25 GiB. GPU 0 has a total capacity of 44.56 GiB of which 590.69 MiB is free. Including non-PyTorch memory, this process has 43.98 GiB memory in use. Of the allocated memory 38.40 GiB is allocated by PyTorch, and 4.43 GiB is reserved by PyTorch but unallocated. If reserved but unallocated memory is large try setting PYTORCH_CUDA_ALLOC_CONF=expandable_segments:True to avoid fragmentation.  See documentation for Memory Management  (https://pytorch.org/docs/stable/notes/cuda.html#environment-variables)
[I 2024-12-23 17:39:41,219] Trial 263 finished with value: -1.0 and parameters: {'left_stride': 128, 'right_stride': 64, 'attention_pooling_operation': 'min', 'embedding_pooling_operation': 'max', 'threshold': 0.942135278733363, 'batch_size': 45, 'attention_heads': 9, 'hidden_dimension': 227, 'number_of_hidden_layers': 2, 'dropout_rate': 0.37506469409018706, 'global_pooling': 'mean', 'learning_rate': 0.0008826146211299555, 'weight_decay': 2.5732514657264167e-05, 'beta_0': 0.8443998635825787, 'beta_1': 0.9891067969251732, 'epsilon': 2.8644019636249868e-08, 'balanced_loss': True, 'epochs': 197, 'early_stopping_patience': 14, 'plateau_patience': 24, 'plateau_divider': 3}. Best is trial 110 with value: 0.9515151515151515.
[I 2024-12-23 18:03:05,160] Trial 264 finished with value: 0.9333333333333333 and parameters: {'left_stride': 128, 'right_stride': 64, 'attention_pooling_operation': 'min', 'embedding_pooling_operation': 'mean', 'threshold': 0.9929213686856087, 'batch_size': 54, 'attention_heads': 7, 'hidden_dimension': 174, 'number_of_hidden_layers': 2, 'dropout_rate': 0.3976104506091707, 'global_pooling': 'mean', 'learning_rate': 0.0012232220010914283, 'weight_decay': 2.951636985564314e-05, 'beta_0': 0.8421027112660611, 'beta_1': 0.9961232660486153, 'epsilon': 1.3834321809971767e-08, 'balanced_loss': True, 'epochs': 182, 'early_stopping_patience': 13, 'plateau_patience': 25, 'plateau_divider': 3}. Best is trial 110 with value: 0.9515151515151515.
CUDA out of memory. Tried to allocate 1.28 GiB. GPU 0 has a total capacity of 44.56 GiB of which 398.69 MiB is free. Including non-PyTorch memory, this process has 44.16 GiB memory in use. Of the allocated memory 37.29 GiB is allocated by PyTorch, and 5.72 GiB is reserved by PyTorch but unallocated. If reserved but unallocated memory is large try setting PYTORCH_CUDA_ALLOC_CONF=expandable_segments:True to avoid fragmentation.  See documentation for Memory Management  (https://pytorch.org/docs/stable/notes/cuda.html#environment-variables)
[I 2024-12-23 18:10:36,259] Trial 265 finished with value: -1.0 and parameters: {'left_stride': 128, 'right_stride': 64, 'attention_pooling_operation': 'min', 'embedding_pooling_operation': 'max', 'threshold': 0.9236265571089214, 'batch_size': 47, 'attention_heads': 8, 'hidden_dimension': 117, 'number_of_hidden_layers': 2, 'dropout_rate': 0.40994394441801446, 'global_pooling': 'mean', 'learning_rate': 0.0006236227128543162, 'weight_decay': 4.034583926823004e-05, 'beta_0': 0.8387479153123715, 'beta_1': 0.9974881121742308, 'epsilon': 2.2150424817563406e-08, 'balanced_loss': True, 'epochs': 192, 'early_stopping_patience': 13, 'plateau_patience': 25, 'plateau_divider': 3}. Best is trial 110 with value: 0.9515151515151515.
CUDA out of memory. Tried to allocate 2.38 GiB. GPU 0 has a total capacity of 44.56 GiB of which 554.69 MiB is free. Including non-PyTorch memory, this process has 44.01 GiB memory in use. Of the allocated memory 40.23 GiB is allocated by PyTorch, and 2.64 GiB is reserved by PyTorch but unallocated. If reserved but unallocated memory is large try setting PYTORCH_CUDA_ALLOC_CONF=expandable_segments:True to avoid fragmentation.  See documentation for Memory Management  (https://pytorch.org/docs/stable/notes/cuda.html#environment-variables)
[I 2024-12-23 18:29:54,109] Trial 266 finished with value: -1.0 and parameters: {'left_stride': 128, 'right_stride': 64, 'attention_pooling_operation': 'min', 'embedding_pooling_operation': 'max', 'threshold': 0.9908212406422794, 'batch_size': 57, 'attention_heads': 7, 'hidden_dimension': 244, 'number_of_hidden_layers': 2, 'dropout_rate': 0.3931920496428324, 'global_pooling': 'mean', 'learning_rate': 0.0003699373004864493, 'weight_decay': 6.478531963768773e-05, 'beta_0': 0.8489203649853672, 'beta_1': 0.9886291395783938, 'epsilon': 3.591671500764156e-08, 'balanced_loss': True, 'epochs': 151, 'early_stopping_patience': 15, 'plateau_patience': 18, 'plateau_divider': 6}. Best is trial 110 with value: 0.9515151515151515.
[I 2024-12-23 18:58:04,502] Trial 267 finished with value: 0.9454545454545454 and parameters: {'left_stride': 128, 'right_stride': 256, 'attention_pooling_operation': 'min', 'embedding_pooling_operation': 'mean', 'threshold': 0.9959993577338024, 'batch_size': 43, 'attention_heads': 8, 'hidden_dimension': 199, 'number_of_hidden_layers': 2, 'dropout_rate': 0.3664976063664422, 'global_pooling': 'mean', 'learning_rate': 0.0007634644151072595, 'weight_decay': 8.178621256095379e-05, 'beta_0': 0.8457307290485351, 'beta_1': 0.9895004475472782, 'epsilon': 1.9438025675626867e-08, 'balanced_loss': True, 'epochs': 189, 'early_stopping_patience': 12, 'plateau_patience': 25, 'plateau_divider': 3}. Best is trial 110 with value: 0.9515151515151515.
[I 2024-12-23 19:24:08,916] Trial 268 finished with value: 0.8909090909090909 and parameters: {'left_stride': 128, 'right_stride': 256, 'attention_pooling_operation': 'min', 'embedding_pooling_operation': 'mean', 'threshold': 0.9987228726479785, 'batch_size': 43, 'attention_heads': 6, 'hidden_dimension': 208, 'number_of_hidden_layers': 2, 'dropout_rate': 0.3511325562566752, 'global_pooling': 'sum', 'learning_rate': 0.0008110868790651174, 'weight_decay': 8.283529452483975e-05, 'beta_0': 0.8520468828444804, 'beta_1': 0.9896945532262345, 'epsilon': 2.6591398091084832e-08, 'balanced_loss': True, 'epochs': 189, 'early_stopping_patience': 13, 'plateau_patience': 25, 'plateau_divider': 3}. Best is trial 110 with value: 0.9515151515151515.
CUDA out of memory. Tried to allocate 5.09 GiB. GPU 0 has a total capacity of 44.56 GiB of which 4.30 GiB is free. Including non-PyTorch memory, this process has 40.25 GiB memory in use. Of the allocated memory 35.30 GiB is allocated by PyTorch, and 3.80 GiB is reserved by PyTorch but unallocated. If reserved but unallocated memory is large try setting PYTORCH_CUDA_ALLOC_CONF=expandable_segments:True to avoid fragmentation.  See documentation for Memory Management  (https://pytorch.org/docs/stable/notes/cuda.html#environment-variables)
[I 2024-12-23 19:39:45,336] Trial 269 finished with value: -1.0 and parameters: {'left_stride': 64, 'right_stride': 256, 'attention_pooling_operation': 'min', 'embedding_pooling_operation': 'mean', 'threshold': 0.9695946183542631, 'batch_size': 44, 'attention_heads': 5, 'hidden_dimension': 200, 'number_of_hidden_layers': 2, 'dropout_rate': 0.363299621072331, 'global_pooling': 'mean', 'learning_rate': 0.001058504990258045, 'weight_decay': 0.00014919278161900116, 'beta_0': 0.8471506139886217, 'beta_1': 0.988996935782589, 'epsilon': 2.064390825045872e-08, 'balanced_loss': True, 'epochs': 186, 'early_stopping_patience': 12, 'plateau_patience': 25, 'plateau_divider': 3}. Best is trial 110 with value: 0.9515151515151515.
[I 2024-12-23 20:06:59,857] Trial 270 finished with value: 0.9272727272727272 and parameters: {'left_stride': 128, 'right_stride': 256, 'attention_pooling_operation': 'min', 'embedding_pooling_operation': 'mean', 'threshold': 0.9965381294696755, 'batch_size': 39, 'attention_heads': 8, 'hidden_dimension': 189, 'number_of_hidden_layers': 2, 'dropout_rate': 0.3701830389412739, 'global_pooling': 'mean', 'learning_rate': 0.0007632562453440794, 'weight_decay': 7.715227414110081e-05, 'beta_0': 0.8538947685846614, 'beta_1': 0.9967916376546498, 'epsilon': 3.3695371265749315e-08, 'balanced_loss': True, 'epochs': 183, 'early_stopping_patience': 11, 'plateau_patience': 22, 'plateau_divider': 3}. Best is trial 110 with value: 0.9515151515151515.
slurmstepd: error: *** JOB 14141827 ON gpu052 CANCELLED AT 2024-12-23T20:19:23 DUE TO TIME LIMIT ***
