[I 2024-11-28 15:33:09,876] Trial 75 finished with value: 0.8909090909090909 and parameters: {'left_stride': 128, 'right_stride': 0, 'attention_pooling_operation': 'min', 'embedding_pooling_operation': 'min', 'threshold': 0.9146838259840459, 'batch_size': 33, 'attention_heads': 10, 'hidden_dimension': 217, 'number_of_hidden_layers': 0, 'dropout_rate': 0.5245803797523583, 'global_pooling': 'mean', 'learning_rate': 0.0013792858350518162, 'weight_decay': 0.0007294407336471606, 'beta_0': 0.8147380005566097, 'beta_1': 0.9851684638969285, 'epsilon': 3.487275481210484e-07, 'balanced_loss': False, 'epochs': 147, 'early_stopping_patience': 13, 'plateau_patience': 16, 'plateau_divider': 9}. Best is trial 4 with value: 0.9030303030303031.
[I 2024-11-28 15:40:29,474] Trial 76 finished with value: 0.896969696969697 and parameters: {'left_stride': 128, 'right_stride': 0, 'attention_pooling_operation': 'min', 'embedding_pooling_operation': 'min', 'threshold': 0.9064336567767047, 'batch_size': 35, 'attention_heads': 9, 'hidden_dimension': 237, 'number_of_hidden_layers': 0, 'dropout_rate': 0.49434134204168456, 'global_pooling': 'mean', 'learning_rate': 0.0005887107640872681, 'weight_decay': 8.289697252067657e-05, 'beta_0': 0.8245589177111611, 'beta_1': 0.9844929101674526, 'epsilon': 4.5348864093808736e-07, 'balanced_loss': False, 'epochs': 135, 'early_stopping_patience': 14, 'plateau_patience': 14, 'plateau_divider': 7}. Best is trial 4 with value: 0.9030303030303031.
[I 2024-11-28 15:47:11,851] Trial 77 finished with value: 0.8727272727272727 and parameters: {'left_stride': 128, 'right_stride': 0, 'attention_pooling_operation': 'min', 'embedding_pooling_operation': 'max', 'threshold': 0.9134395997499726, 'batch_size': 27, 'attention_heads': 10, 'hidden_dimension': 206, 'number_of_hidden_layers': 0, 'dropout_rate': 0.5581241583358859, 'global_pooling': 'mean', 'learning_rate': 0.004065738468020226, 'weight_decay': 4.0522194693377105e-05, 'beta_0': 0.8305184334967213, 'beta_1': 0.9823036912186531, 'epsilon': 1.2742590252531207e-06, 'balanced_loss': False, 'epochs': 156, 'early_stopping_patience': 14, 'plateau_patience': 15, 'plateau_divider': 6}. Best is trial 4 with value: 0.9030303030303031.
[I 2024-11-28 15:54:45,670] Trial 78 finished with value: 0.8909090909090909 and parameters: {'left_stride': 128, 'right_stride': 0, 'attention_pooling_operation': 'min', 'embedding_pooling_operation': 'min', 'threshold': 0.9032392951916126, 'batch_size': 29, 'attention_heads': 11, 'hidden_dimension': 220, 'number_of_hidden_layers': 0, 'dropout_rate': 0.5883346616972274, 'global_pooling': 'mean', 'learning_rate': 0.002137188875126842, 'weight_decay': 7.582473307238239e-05, 'beta_0': 0.8382483966563167, 'beta_1': 0.9800608193619595, 'epsilon': 5.957193609263079e-06, 'balanced_loss': False, 'epochs': 160, 'early_stopping_patience': 13, 'plateau_patience': 17, 'plateau_divider': 8}. Best is trial 4 with value: 0.9030303030303031.
[I 2024-11-28 16:01:55,221] Trial 79 finished with value: 0.8909090909090909 and parameters: {'left_stride': 64, 'right_stride': 0, 'attention_pooling_operation': 'min', 'embedding_pooling_operation': 'mean', 'threshold': 0.9166649577435536, 'batch_size': 34, 'attention_heads': 13, 'hidden_dimension': 213, 'number_of_hidden_layers': 0, 'dropout_rate': 0.5071650337367928, 'global_pooling': 'mean', 'learning_rate': 0.0008749346355720673, 'weight_decay': 0.0003490619648645305, 'beta_0': 0.8000245540331307, 'beta_1': 0.9806574580908101, 'epsilon': 2.1895183532516096e-07, 'balanced_loss': False, 'epochs': 145, 'early_stopping_patience': 12, 'plateau_patience': 17, 'plateau_divider': 2}. Best is trial 4 with value: 0.9030303030303031.
CUDA out of memory. Tried to allocate 2.26 GiB. GPU 0 has a total capacity of 44.56 GiB of which 718.69 MiB is free. Including non-PyTorch memory, this process has 43.85 GiB memory in use. Of the allocated memory 40.29 GiB is allocated by PyTorch, and 2.41 GiB is reserved by PyTorch but unallocated. If reserved but unallocated memory is large try setting PYTORCH_CUDA_ALLOC_CONF=expandable_segments:True to avoid fragmentation.  See documentation for Memory Management  (https://pytorch.org/docs/stable/notes/cuda.html#environment-variables)
[I 2024-11-28 16:06:55,911] Trial 80 finished with value: -1.0 and parameters: {'left_stride': 128, 'right_stride': 0, 'attention_pooling_operation': 'min', 'embedding_pooling_operation': 'min', 'threshold': 0.9102578831674037, 'batch_size': 20, 'attention_heads': 9, 'hidden_dimension': 229, 'number_of_hidden_layers': 4, 'dropout_rate': 0.517191222219991, 'global_pooling': 'max', 'learning_rate': 0.00020097016382679417, 'weight_decay': 0.00010782421921909401, 'beta_0': 0.8335260095274231, 'beta_1': 0.9831170633153573, 'epsilon': 3.5027198600682094e-06, 'balanced_loss': False, 'epochs': 122, 'early_stopping_patience': 11, 'plateau_patience': 19, 'plateau_divider': 3}. Best is trial 4 with value: 0.9030303030303031.
[I 2024-11-28 16:14:19,271] Trial 81 finished with value: 0.8909090909090909 and parameters: {'left_stride': 64, 'right_stride': 64, 'attention_pooling_operation': 'min', 'embedding_pooling_operation': 'min', 'threshold': 0.9210510660282515, 'batch_size': 37, 'attention_heads': 12, 'hidden_dimension': 196, 'number_of_hidden_layers': 0, 'dropout_rate': 0.47264227341146425, 'global_pooling': 'mean', 'learning_rate': 0.0011996958750222473, 'weight_decay': 4.999385787737627e-05, 'beta_0': 0.8642891990213036, 'beta_1': 0.9820195476782839, 'epsilon': 5.473051223643077e-08, 'balanced_loss': False, 'epochs': 198, 'early_stopping_patience': 16, 'plateau_patience': 18, 'plateau_divider': 7}. Best is trial 4 with value: 0.9030303030303031.
The selected strides are greater or equal to the total chunk size.
[I 2024-11-28 16:14:20,711] Trial 82 finished with value: -1.0 and parameters: {'left_stride': 256, 'right_stride': 256, 'attention_pooling_operation': 'min', 'embedding_pooling_operation': 'min', 'threshold': 0.9330369953068863, 'batch_size': 39, 'attention_heads': 5, 'hidden_dimension': 236, 'number_of_hidden_layers': 0, 'dropout_rate': 0.45326969342978946, 'global_pooling': 'mean', 'learning_rate': 0.006139800408873824, 'weight_decay': 2.750185201143732e-05, 'beta_0': 0.8538851811832621, 'beta_1': 0.9904929449283034, 'epsilon': 2.5019335947539057e-06, 'balanced_loss': False, 'epochs': 115, 'early_stopping_patience': 14, 'plateau_patience': 25, 'plateau_divider': 6}. Best is trial 4 with value: 0.9030303030303031.
CUDA out of memory. Tried to allocate 4.15 GiB. GPU 0 has a total capacity of 44.56 GiB of which 2.05 GiB is free. Including non-PyTorch memory, this process has 42.51 GiB memory in use. Of the allocated memory 36.76 GiB is allocated by PyTorch, and 4.59 GiB is reserved by PyTorch but unallocated. If reserved but unallocated memory is large try setting PYTORCH_CUDA_ALLOC_CONF=expandable_segments:True to avoid fragmentation.  See documentation for Memory Management  (https://pytorch.org/docs/stable/notes/cuda.html#environment-variables)
[I 2024-11-28 16:19:29,368] Trial 83 finished with value: -1.0 and parameters: {'left_stride': 128, 'right_stride': 32, 'attention_pooling_operation': 'min', 'embedding_pooling_operation': 'min', 'threshold': 0.9084005344926522, 'batch_size': 32, 'attention_heads': 11, 'hidden_dimension': 210, 'number_of_hidden_layers': 1, 'dropout_rate': 0.46231839564552224, 'global_pooling': 'mean', 'learning_rate': 0.0015360730496727724, 'weight_decay': 3.878155171669953e-05, 'beta_0': 0.8360267860680354, 'beta_1': 0.9843911524736959, 'epsilon': 1.1477501904750006e-07, 'balanced_loss': False, 'epochs': 151, 'early_stopping_patience': 19, 'plateau_patience': 16, 'plateau_divider': 7}. Best is trial 4 with value: 0.9030303030303031.
[I 2024-11-28 16:27:37,498] Trial 84 finished with value: 0.9090909090909091 and parameters: {'left_stride': 64, 'right_stride': 64, 'attention_pooling_operation': 'min', 'embedding_pooling_operation': 'min', 'threshold': 0.918230560123676, 'batch_size': 35, 'attention_heads': 14, 'hidden_dimension': 188, 'number_of_hidden_layers': 0, 'dropout_rate': 0.5471885202538613, 'global_pooling': 'mean', 'learning_rate': 0.0021398831074690393, 'weight_decay': 0.0008525922755798037, 'beta_0': 0.8090514333716435, 'beta_1': 0.9857653445702981, 'epsilon': 1.651445845593722e-07, 'balanced_loss': False, 'epochs': 129, 'early_stopping_patience': 16, 'plateau_patience': 16, 'plateau_divider': 8}. Best is trial 84 with value: 0.9090909090909091.
[I 2024-11-28 16:44:12,464] Trial 85 finished with value: 0.8787878787878788 and parameters: {'left_stride': 64, 'right_stride': 64, 'attention_pooling_operation': 'min', 'embedding_pooling_operation': 'min', 'threshold': 0.9233507434309132, 'batch_size': 36, 'attention_heads': 15, 'hidden_dimension': 161, 'number_of_hidden_layers': 0, 'dropout_rate': 0.545690980308192, 'global_pooling': 'mean', 'learning_rate': 1.9926917231001847e-05, 'weight_decay': 0.0008397444720458763, 'beta_0': 0.8107568533530838, 'beta_1': 0.9861524749778532, 'epsilon': 1.8365277518795543e-07, 'balanced_loss': False, 'epochs': 130, 'early_stopping_patience': 15, 'plateau_patience': 16, 'plateau_divider': 8}. Best is trial 84 with value: 0.9090909090909091.
[I 2024-11-28 16:56:16,971] Trial 86 finished with value: 0.8787878787878788 and parameters: {'left_stride': 64, 'right_stride': 0, 'attention_pooling_operation': 'min', 'embedding_pooling_operation': 'min', 'threshold': 0.9193164385224932, 'batch_size': 32, 'attention_heads': 15, 'hidden_dimension': 248, 'number_of_hidden_layers': 0, 'dropout_rate': 0.5653307745842181, 'global_pooling': 'mean', 'learning_rate': 6.79629929515364e-05, 'weight_decay': 0.0005583318423923042, 'beta_0': 0.8040781946445565, 'beta_1': 0.9855332610694769, 'epsilon': 2.5270086218005293e-07, 'balanced_loss': False, 'epochs': 140, 'early_stopping_patience': 15, 'plateau_patience': 15, 'plateau_divider': 8}. Best is trial 84 with value: 0.9090909090909091.
[I 2024-11-28 17:04:05,739] Trial 87 finished with value: 0.8909090909090909 and parameters: {'left_stride': 64, 'right_stride': 64, 'attention_pooling_operation': 'min', 'embedding_pooling_operation': 'min', 'threshold': 0.9161765215647529, 'batch_size': 34, 'attention_heads': 14, 'hidden_dimension': 222, 'number_of_hidden_layers': 0, 'dropout_rate': 0.4050073745584715, 'global_pooling': 'mean', 'learning_rate': 0.0019563615458363195, 'weight_decay': 0.0006297495243919809, 'beta_0': 0.8208155460233022, 'beta_1': 0.9881249121014021, 'epsilon': 1.6470705916394402e-07, 'balanced_loss': True, 'epochs': 193, 'early_stopping_patience': 16, 'plateau_patience': 18, 'plateau_divider': 4}. Best is trial 84 with value: 0.9090909090909091.
[I 2024-11-28 17:14:55,125] Trial 88 finished with value: 0.8909090909090909 and parameters: {'left_stride': 64, 'right_stride': 32, 'attention_pooling_operation': 'min', 'embedding_pooling_operation': 'min', 'threshold': 0.9124759829527607, 'batch_size': 30, 'attention_heads': 13, 'hidden_dimension': 200, 'number_of_hidden_layers': 0, 'dropout_rate': 0.550986425247016, 'global_pooling': 'mean', 'learning_rate': 0.00010568899283363464, 'weight_decay': 0.00041490594935158104, 'beta_0': 0.8086269567730415, 'beta_1': 0.9845532391698925, 'epsilon': 1.0254011381015109e-05, 'balanced_loss': False, 'epochs': 136, 'early_stopping_patience': 13, 'plateau_patience': 17, 'plateau_divider': 9}. Best is trial 84 with value: 0.9090909090909091.
[I 2024-11-28 17:20:21,561] Trial 89 finished with value: 0.8848484848484849 and parameters: {'left_stride': 32, 'right_stride': 0, 'attention_pooling_operation': 'min', 'embedding_pooling_operation': 'min', 'threshold': 0.9834978929913885, 'batch_size': 38, 'attention_heads': 14, 'hidden_dimension': 186, 'number_of_hidden_layers': 0, 'dropout_rate': 0.5282506809820386, 'global_pooling': 'mean', 'learning_rate': 0.002795605279780804, 'weight_decay': 6.448656365656778e-05, 'beta_0': 0.817528474463014, 'beta_1': 0.9876066789436856, 'epsilon': 6.95625120681958e-06, 'balanced_loss': False, 'epochs': 143, 'early_stopping_patience': 15, 'plateau_patience': 16, 'plateau_divider': 3}. Best is trial 84 with value: 0.9090909090909091.
[I 2024-11-28 17:28:16,663] Trial 90 finished with value: 0.8727272727272727 and parameters: {'left_stride': 64, 'right_stride': 64, 'attention_pooling_operation': 'min', 'embedding_pooling_operation': 'min', 'threshold': 0.9051745737254943, 'batch_size': 36, 'attention_heads': 13, 'hidden_dimension': 174, 'number_of_hidden_layers': 0, 'dropout_rate': 0.5786846551234458, 'global_pooling': 'sum', 'learning_rate': 0.0011027261453254386, 'weight_decay': 0.0002477059214724082, 'beta_0': 0.8602238935682316, 'beta_1': 0.9834749835359162, 'epsilon': 1.763353844287244e-06, 'balanced_loss': True, 'epochs': 166, 'early_stopping_patience': 16, 'plateau_patience': 17, 'plateau_divider': 4}. Best is trial 84 with value: 0.9090909090909091.
[I 2024-11-28 17:36:42,094] Trial 91 finished with value: 0.8909090909090909 and parameters: {'left_stride': 0, 'right_stride': 64, 'attention_pooling_operation': 'max', 'embedding_pooling_operation': 'min', 'threshold': 0.9258976359964014, 'batch_size': 35, 'attention_heads': 14, 'hidden_dimension': 241, 'number_of_hidden_layers': 0, 'dropout_rate': 0.5371412927822614, 'global_pooling': 'mean', 'learning_rate': 0.004451853315515028, 'weight_decay': 0.0004932336317792541, 'beta_0': 0.8260682300322292, 'beta_1': 0.9869757158422353, 'epsilon': 7.408519694079947e-08, 'balanced_loss': False, 'epochs': 186, 'early_stopping_patience': 17, 'plateau_patience': 15, 'plateau_divider': 8}. Best is trial 84 with value: 0.9090909090909091.
[I 2024-11-28 17:44:34,566] Trial 92 finished with value: 0.8909090909090909 and parameters: {'left_stride': 128, 'right_stride': 64, 'attention_pooling_operation': 'mean', 'embedding_pooling_operation': 'min', 'threshold': 0.9373039402973337, 'batch_size': 40, 'attention_heads': 12, 'hidden_dimension': 142, 'number_of_hidden_layers': 0, 'dropout_rate': 0.4980180531740471, 'global_pooling': 'mean', 'learning_rate': 0.003336114404512393, 'weight_decay': 0.000913859926427165, 'beta_0': 0.813047743556886, 'beta_1': 0.9857738718510615, 'epsilon': 1.4010812998687527e-07, 'balanced_loss': False, 'epochs': 84, 'early_stopping_patience': 20, 'plateau_patience': 17, 'plateau_divider': 7}. Best is trial 84 with value: 0.9090909090909091.
[I 2024-11-28 17:53:20,735] Trial 93 finished with value: 0.896969696969697 and parameters: {'left_stride': 64, 'right_stride': 64, 'attention_pooling_operation': 'min', 'embedding_pooling_operation': 'min', 'threshold': 0.9480587641500249, 'batch_size': 42, 'attention_heads': 12, 'hidden_dimension': 230, 'number_of_hidden_layers': 1, 'dropout_rate': 0.5124008963838969, 'global_pooling': 'mean', 'learning_rate': 0.0006857169107277926, 'weight_decay': 0.0006645866768310888, 'beta_0': 0.8057331611430136, 'beta_1': 0.9915062338416127, 'epsilon': 5.2073936783112876e-08, 'balanced_loss': False, 'epochs': 153, 'early_stopping_patience': 14, 'plateau_patience': 14, 'plateau_divider': 7}. Best is trial 84 with value: 0.9090909090909091.
[I 2024-11-28 18:02:18,152] Trial 94 finished with value: 0.8909090909090909 and parameters: {'left_stride': 256, 'right_stride': 128, 'attention_pooling_operation': 'max', 'embedding_pooling_operation': 'max', 'threshold': 0.9013668729242135, 'batch_size': 37, 'attention_heads': 12, 'hidden_dimension': 131, 'number_of_hidden_layers': 0, 'dropout_rate': 0.5217767360771423, 'global_pooling': 'mean', 'learning_rate': 0.002679133492748884, 'weight_decay': 6.754817639695013e-05, 'beta_0': 0.8015797199467313, 'beta_1': 0.9867921829807992, 'epsilon': 7.637658429929498e-07, 'balanced_loss': False, 'epochs': 123, 'early_stopping_patience': 18, 'plateau_patience': 16, 'plateau_divider': 5}. Best is trial 84 with value: 0.9090909090909091.
[I 2024-11-28 18:09:30,405] Trial 95 finished with value: 0.9030303030303031 and parameters: {'left_stride': 0, 'right_stride': 64, 'attention_pooling_operation': 'min', 'embedding_pooling_operation': 'min', 'threshold': 0.9422112098935382, 'batch_size': 33, 'attention_heads': 13, 'hidden_dimension': 216, 'number_of_hidden_layers': 0, 'dropout_rate': 0.4775696462876075, 'global_pooling': 'mean', 'learning_rate': 0.001422304422085992, 'weight_decay': 0.000130559039706427, 'beta_0': 0.8424528522845752, 'beta_1': 0.9901365241324777, 'epsilon': 8.858688690089771e-08, 'balanced_loss': False, 'epochs': 117, 'early_stopping_patience': 17, 'plateau_patience': 18, 'plateau_divider': 7}. Best is trial 84 with value: 0.9090909090909091.
[I 2024-11-28 18:16:31,712] Trial 96 finished with value: 0.9030303030303031 and parameters: {'left_stride': 0, 'right_stride': 64, 'attention_pooling_operation': 'min', 'embedding_pooling_operation': 'min', 'threshold': 0.9424881202407802, 'batch_size': 33, 'attention_heads': 13, 'hidden_dimension': 217, 'number_of_hidden_layers': 0, 'dropout_rate': 0.4443564887815194, 'global_pooling': 'mean', 'learning_rate': 0.0014921643401204694, 'weight_decay': 0.000143978830694326, 'beta_0': 0.8421079956210721, 'beta_1': 0.9901371793461675, 'epsilon': 1.0655690742318829e-07, 'balanced_loss': False, 'epochs': 117, 'early_stopping_patience': 17, 'plateau_patience': 17, 'plateau_divider': 6}. Best is trial 84 with value: 0.9090909090909091.
[I 2024-11-28 18:23:24,962] Trial 97 finished with value: 0.8242424242424242 and parameters: {'left_stride': 0, 'right_stride': 64, 'attention_pooling_operation': 'min', 'embedding_pooling_operation': 'min', 'threshold': 0.9459217621172086, 'batch_size': 32, 'attention_heads': 13, 'hidden_dimension': 208, 'number_of_hidden_layers': 0, 'dropout_rate': 0.5542013789565295, 'global_pooling': 'max', 'learning_rate': 0.0015942737181307291, 'weight_decay': 0.00012456893073551815, 'beta_0': 0.8448514496127967, 'beta_1': 0.9900510388739282, 'epsilon': 8.542314000106763e-08, 'balanced_loss': False, 'epochs': 113, 'early_stopping_patience': 17, 'plateau_patience': 19, 'plateau_divider': 6}. Best is trial 84 with value: 0.9090909090909091.
[I 2024-11-28 18:30:03,198] Trial 98 finished with value: 0.896969696969697 and parameters: {'left_stride': 0, 'right_stride': 64, 'attention_pooling_operation': 'min', 'embedding_pooling_operation': 'mean', 'threshold': 0.9379062215500482, 'batch_size': 29, 'attention_heads': 13, 'hidden_dimension': 217, 'number_of_hidden_layers': 0, 'dropout_rate': 0.44240575750862193, 'global_pooling': 'mean', 'learning_rate': 0.0020981860156808513, 'weight_decay': 0.00020653423434994407, 'beta_0': 0.8418712480923455, 'beta_1': 0.9816525283841199, 'epsilon': 2.6456786119644564e-07, 'balanced_loss': False, 'epochs': 117, 'early_stopping_patience': 16, 'plateau_patience': 18, 'plateau_divider': 8}. Best is trial 84 with value: 0.9090909090909091.
[I 2024-11-28 18:36:45,820] Trial 99 finished with value: 0.9090909090909091 and parameters: {'left_stride': 0, 'right_stride': 32, 'attention_pooling_operation': 'min', 'embedding_pooling_operation': 'min', 'threshold': 0.9335391326023479, 'batch_size': 61, 'attention_heads': 11, 'hidden_dimension': 200, 'number_of_hidden_layers': 0, 'dropout_rate': 0.4790972223848647, 'global_pooling': 'mean', 'learning_rate': 0.0010753991720752194, 'weight_decay': 0.00016745571637855202, 'beta_0': 0.8474237440711816, 'beta_1': 0.9889031611348468, 'epsilon': 1.2044031277524556e-07, 'balanced_loss': True, 'epochs': 126, 'early_stopping_patience': 18, 'plateau_patience': 21, 'plateau_divider': 6}. Best is trial 84 with value: 0.9090909090909091.
[I 2024-11-28 18:43:18,368] Trial 100 finished with value: 0.896969696969697 and parameters: {'left_stride': 0, 'right_stride': 32, 'attention_pooling_operation': 'min', 'embedding_pooling_operation': 'min', 'threshold': 0.934820559312021, 'batch_size': 59, 'attention_heads': 11, 'hidden_dimension': 191, 'number_of_hidden_layers': 0, 'dropout_rate': 0.47645265519619623, 'global_pooling': 'mean', 'learning_rate': 0.0010818648896386855, 'weight_decay': 9.932295482659664e-05, 'beta_0': 0.8493171466682787, 'beta_1': 0.9891844950396191, 'epsilon': 1.3788792864294393e-07, 'balanced_loss': True, 'epochs': 132, 'early_stopping_patience': 18, 'plateau_patience': 21, 'plateau_divider': 7}. Best is trial 84 with value: 0.9090909090909091.
[I 2024-11-28 18:49:51,099] Trial 101 finished with value: 0.9090909090909091 and parameters: {'left_stride': 0, 'right_stride': 32, 'attention_pooling_operation': 'min', 'embedding_pooling_operation': 'min', 'threshold': 0.9427485331110697, 'batch_size': 57, 'attention_heads': 12, 'hidden_dimension': 201, 'number_of_hidden_layers': 0, 'dropout_rate': 0.4918235022174416, 'global_pooling': 'mean', 'learning_rate': 0.0008752743660198649, 'weight_decay': 0.00015096221072750699, 'beta_0': 0.8520894239390385, 'beta_1': 0.9887819667286809, 'epsilon': 1.1736638959665826e-07, 'balanced_loss': True, 'epochs': 118, 'early_stopping_patience': 17, 'plateau_patience': 23, 'plateau_divider': 6}. Best is trial 84 with value: 0.9090909090909091.
[I 2024-11-28 18:56:29,644] Trial 102 finished with value: 0.896969696969697 and parameters: {'left_stride': 0, 'right_stride': 32, 'attention_pooling_operation': 'min', 'embedding_pooling_operation': 'min', 'threshold': 0.9426245732707875, 'batch_size': 57, 'attention_heads': 12, 'hidden_dimension': 184, 'number_of_hidden_layers': 0, 'dropout_rate': 0.49015278300606563, 'global_pooling': 'mean', 'learning_rate': 0.0008525398881204412, 'weight_decay': 0.00012068179277378448, 'beta_0': 0.8569914375028337, 'beta_1': 0.9876209429633006, 'epsilon': 1.2949279810960232e-07, 'balanced_loss': True, 'epochs': 127, 'early_stopping_patience': 19, 'plateau_patience': 23, 'plateau_divider': 6}. Best is trial 84 with value: 0.9090909090909091.
