[I 2024-12-21 17:10:28,009] Trial 185 finished with value: 0.9696969696969697 and parameters: {'left_stride': 256, 'right_stride': 32, 'attention_pooling_operation': 'mean', 'embedding_pooling_operation': 'min', 'threshold': 0.9837815282326454, 'batch_size': 29, 'attention_heads': 4, 'hidden_dimension': 44, 'number_of_hidden_layers': 2, 'dropout_rate': 0.39429660253313775, 'global_pooling': 'mean', 'learning_rate': 8.904160487514792e-05, 'weight_decay': 0.0003844059738339093, 'beta_0': 0.8517267327844067, 'beta_1': 0.9918623314382403, 'epsilon': 1.0137562643238202e-08, 'balanced_loss': False, 'epochs': 174, 'early_stopping_patience': 16, 'plateau_patience': 25, 'plateau_divider': 9}. Best is trial 177 with value: 0.9757575757575757.
[I 2024-12-21 17:43:21,632] Trial 186 finished with value: 0.9757575757575757 and parameters: {'left_stride': 256, 'right_stride': 32, 'attention_pooling_operation': 'mean', 'embedding_pooling_operation': 'min', 'threshold': 0.9836682956168356, 'batch_size': 29, 'attention_heads': 4, 'hidden_dimension': 33, 'number_of_hidden_layers': 2, 'dropout_rate': 0.36957170148308904, 'global_pooling': 'mean', 'learning_rate': 4.974044389268164e-05, 'weight_decay': 0.0004381314512672049, 'beta_0': 0.8477150796483035, 'beta_1': 0.9942528957205032, 'epsilon': 1.3310520001808265e-08, 'balanced_loss': False, 'epochs': 177, 'early_stopping_patience': 16, 'plateau_patience': 25, 'plateau_divider': 8}. Best is trial 177 with value: 0.9757575757575757.
[I 2024-12-21 18:16:34,802] Trial 187 finished with value: 0.9757575757575757 and parameters: {'left_stride': 256, 'right_stride': 32, 'attention_pooling_operation': 'mean', 'embedding_pooling_operation': 'min', 'threshold': 0.9830178104791485, 'batch_size': 32, 'attention_heads': 4, 'hidden_dimension': 32, 'number_of_hidden_layers': 2, 'dropout_rate': 0.38014381156170507, 'global_pooling': 'mean', 'learning_rate': 4.2841094093198726e-05, 'weight_decay': 0.0005580628068154406, 'beta_0': 0.8466269570899103, 'beta_1': 0.9942289067845905, 'epsilon': 1.3247745802852889e-08, 'balanced_loss': False, 'epochs': 176, 'early_stopping_patience': 16, 'plateau_patience': 25, 'plateau_divider': 9}. Best is trial 177 with value: 0.9757575757575757.
CUDA out of memory. Tried to allocate 2.52 GiB. GPU 0 has a total capacity of 44.56 GiB of which 1.82 GiB is free. Including non-PyTorch memory, this process has 42.73 GiB memory in use. Of the allocated memory 32.16 GiB is allocated by PyTorch, and 9.42 GiB is reserved by PyTorch but unallocated. If reserved but unallocated memory is large try setting PYTORCH_CUDA_ALLOC_CONF=expandable_segments:True to avoid fragmentation.  See documentation for Memory Management  (https://pytorch.org/docs/stable/notes/cuda.html#environment-variables)
[I 2024-12-21 18:42:51,603] Trial 188 finished with value: -1.0 and parameters: {'left_stride': 256, 'right_stride': 32, 'attention_pooling_operation': 'mean', 'embedding_pooling_operation': 'min', 'threshold': 0.9809802502189575, 'batch_size': 32, 'attention_heads': 4, 'hidden_dimension': 32, 'number_of_hidden_layers': 2, 'dropout_rate': 0.36956586592567253, 'global_pooling': 'mean', 'learning_rate': 5.238148612765116e-05, 'weight_decay': 0.0005908742989643063, 'beta_0': 0.8468676496512874, 'beta_1': 0.9944149462891787, 'epsilon': 1.3382338061212516e-08, 'balanced_loss': False, 'epochs': 176, 'early_stopping_patience': 16, 'plateau_patience': 25, 'plateau_divider': 9}. Best is trial 177 with value: 0.9757575757575757.
CUDA out of memory. Tried to allocate 2.67 GiB. GPU 0 has a total capacity of 44.56 GiB of which 832.69 MiB is free. Including non-PyTorch memory, this process has 43.74 GiB memory in use. Of the allocated memory 36.35 GiB is allocated by PyTorch, and 6.24 GiB is reserved by PyTorch but unallocated. If reserved but unallocated memory is large try setting PYTORCH_CUDA_ALLOC_CONF=expandable_segments:True to avoid fragmentation.  See documentation for Memory Management  (https://pytorch.org/docs/stable/notes/cuda.html#environment-variables)
[I 2024-12-21 19:08:44,960] Trial 189 finished with value: -1.0 and parameters: {'left_stride': 256, 'right_stride': 32, 'attention_pooling_operation': 'mean', 'embedding_pooling_operation': 'min', 'threshold': 0.9768466489203798, 'batch_size': 30, 'attention_heads': 4, 'hidden_dimension': 42, 'number_of_hidden_layers': 2, 'dropout_rate': 0.3820122565456748, 'global_pooling': 'mean', 'learning_rate': 3.778774716416692e-05, 'weight_decay': 0.0003430301071089793, 'beta_0': 0.84941525143797, 'beta_1': 0.9935487607171917, 'epsilon': 1.3736539134665445e-08, 'balanced_loss': False, 'epochs': 170, 'early_stopping_patience': 15, 'plateau_patience': 25, 'plateau_divider': 9}. Best is trial 177 with value: 0.9757575757575757.
[I 2024-12-21 19:39:17,589] Trial 190 finished with value: 0.9696969696969697 and parameters: {'left_stride': 256, 'right_stride': 32, 'attention_pooling_operation': 'mean', 'embedding_pooling_operation': 'min', 'threshold': 0.9826863462875216, 'batch_size': 31, 'attention_heads': 4, 'hidden_dimension': 32, 'number_of_hidden_layers': 2, 'dropout_rate': 0.39225011666519766, 'global_pooling': 'mean', 'learning_rate': 0.00015248796127677913, 'weight_decay': 0.00026461181942653454, 'beta_0': 0.845127798629694, 'beta_1': 0.9929576943770796, 'epsilon': 1.2627871562956152e-08, 'balanced_loss': True, 'epochs': 178, 'early_stopping_patience': 16, 'plateau_patience': 25, 'plateau_divider': 10}. Best is trial 177 with value: 0.9757575757575757.
CUDA out of memory. Tried to allocate 2.67 GiB. GPU 0 has a total capacity of 44.56 GiB of which 1.80 GiB is free. Including non-PyTorch memory, this process has 42.76 GiB memory in use. Of the allocated memory 34.69 GiB is allocated by PyTorch, and 6.91 GiB is reserved by PyTorch but unallocated. If reserved but unallocated memory is large try setting PYTORCH_CUDA_ALLOC_CONF=expandable_segments:True to avoid fragmentation.  See documentation for Memory Management  (https://pytorch.org/docs/stable/notes/cuda.html#environment-variables)
[I 2024-12-21 20:05:11,760] Trial 191 finished with value: -1.0 and parameters: {'left_stride': 256, 'right_stride': 32, 'attention_pooling_operation': 'mean', 'embedding_pooling_operation': 'min', 'threshold': 0.9789931086976433, 'batch_size': 29, 'attention_heads': 4, 'hidden_dimension': 47, 'number_of_hidden_layers': 2, 'dropout_rate': 0.36946654380328864, 'global_pooling': 'mean', 'learning_rate': 6.780980615293846e-05, 'weight_decay': 0.0005721506585572122, 'beta_0': 0.8485951043737611, 'beta_1': 0.991707301301164, 'epsilon': 1.4682129056881527e-08, 'balanced_loss': False, 'epochs': 174, 'early_stopping_patience': 17, 'plateau_patience': 25, 'plateau_divider': 9}. Best is trial 177 with value: 0.9757575757575757.
slurmstepd: error: *** JOB 14130649 ON gpu007 CANCELLED AT 2024-12-21T20:10:26 DUE TO TIME LIMIT ***
