[I 2024-11-22 18:07:14,949] Trial 69 finished with value: 0.8727272727272727 and parameters: {'left_stride': 0, 'right_stride': 256, 'attention_pooling_operation': 'mean', 'embedding_pooling_operation': 'mean', 'threshold': 0.9884185500179631, 'batch_size': 52, 'attention_heads': 4, 'hidden_dimension': 74, 'number_of_hidden_layers': 4, 'dropout_rate': 0.34090272054652687, 'global_pooling': 'mean', 'learning_rate': 0.026731813531837928, 'weight_decay': 2.4229171059084643e-06, 'beta_0': 0.8026964993212092, 'beta_1': 0.9945242128553882, 'epsilon': 2.2522482216269166e-05, 'balanced_loss': True, 'epochs': 174, 'early_stopping_patience': 15, 'plateau_patience': 20, 'plateau_divider': 7}. Best is trial 43 with value: 0.9151515151515152.
CUDA out of memory. Tried to allocate 5.00 GiB. GPU 0 has a total capacity of 44.56 GiB of which 2.93 GiB is free. Including non-PyTorch memory, this process has 41.62 GiB memory in use. Of the allocated memory 34.74 GiB is allocated by PyTorch, and 5.74 GiB is reserved by PyTorch but unallocated. If reserved but unallocated memory is large try setting PYTORCH_CUDA_ALLOC_CONF=expandable_segments:True to avoid fragmentation.  See documentation for Memory Management  (https://pytorch.org/docs/stable/notes/cuda.html#environment-variables)
[I 2024-11-22 18:15:48,200] Trial 70 finished with value: -1.0 and parameters: {'left_stride': 64, 'right_stride': 0, 'attention_pooling_operation': 'max', 'embedding_pooling_operation': 'max', 'threshold': 0.9787989996624231, 'batch_size': 62, 'attention_heads': 11, 'hidden_dimension': 146, 'number_of_hidden_layers': 3, 'dropout_rate': 0.4655947509989077, 'global_pooling': 'mean', 'learning_rate': 0.001381779547899463, 'weight_decay': 6.827826538151831e-06, 'beta_0': 0.8609672279001314, 'beta_1': 0.9922228036005541, 'epsilon': 3.199186646828928e-06, 'balanced_loss': True, 'epochs': 140, 'early_stopping_patience': 24, 'plateau_patience': 16, 'plateau_divider': 4}. Best is trial 43 with value: 0.9151515151515152.
[I 2024-11-22 18:31:05,136] Trial 71 finished with value: 0.9030303030303031 and parameters: {'left_stride': 0, 'right_stride': 64, 'attention_pooling_operation': 'mean', 'embedding_pooling_operation': 'max', 'threshold': 0.9856472773918928, 'batch_size': 58, 'attention_heads': 4, 'hidden_dimension': 131, 'number_of_hidden_layers': 4, 'dropout_rate': 0.351415223132822, 'global_pooling': 'mean', 'learning_rate': 0.0014527131883270204, 'weight_decay': 3.434781736810832e-06, 'beta_0': 0.8542698633170682, 'beta_1': 0.9968460277220385, 'epsilon': 7.185563383241562e-07, 'balanced_loss': False, 'epochs': 175, 'early_stopping_patience': 24, 'plateau_patience': 16, 'plateau_divider': 8}. Best is trial 43 with value: 0.9151515151515152.
[I 2024-11-22 18:46:12,615] Trial 72 finished with value: 0.896969696969697 and parameters: {'left_stride': 0, 'right_stride': 64, 'attention_pooling_operation': 'mean', 'embedding_pooling_operation': 'max', 'threshold': 0.9845253091269061, 'batch_size': 19, 'attention_heads': 5, 'hidden_dimension': 124, 'number_of_hidden_layers': 4, 'dropout_rate': 0.33321896192065514, 'global_pooling': 'mean', 'learning_rate': 0.0009528034206176386, 'weight_decay': 4.048378631305465e-06, 'beta_0': 0.8523727771902841, 'beta_1': 0.9960813786403098, 'epsilon': 6.600101848223045e-07, 'balanced_loss': False, 'epochs': 150, 'early_stopping_patience': 23, 'plateau_patience': 15, 'plateau_divider': 8}. Best is trial 43 with value: 0.9151515151515152.
[I 2024-11-22 19:00:48,352] Trial 73 finished with value: 0.8787878787878788 and parameters: {'left_stride': 0, 'right_stride': 64, 'attention_pooling_operation': 'mean', 'embedding_pooling_operation': 'max', 'threshold': 0.9931761531080043, 'batch_size': 58, 'attention_heads': 4, 'hidden_dimension': 101, 'number_of_hidden_layers': 4, 'dropout_rate': 0.4414588004041429, 'global_pooling': 'mean', 'learning_rate': 0.000292657947709063, 'weight_decay': 2.615626951374651e-05, 'beta_0': 0.8482998806057772, 'beta_1': 0.9970855168018217, 'epsilon': 1.702654214720626e-06, 'balanced_loss': False, 'epochs': 195, 'early_stopping_patience': 24, 'plateau_patience': 17, 'plateau_divider': 7}. Best is trial 43 with value: 0.9151515151515152.
[I 2024-11-22 19:15:18,258] Trial 74 finished with value: 0.8909090909090909 and parameters: {'left_stride': 0, 'right_stride': 64, 'attention_pooling_operation': 'mean', 'embedding_pooling_operation': 'max', 'threshold': 0.988973528471398, 'batch_size': 49, 'attention_heads': 5, 'hidden_dimension': 158, 'number_of_hidden_layers': 1, 'dropout_rate': 0.37180269030072616, 'global_pooling': 'mean', 'learning_rate': 0.0007549019840668469, 'weight_decay': 1.0706438196875645e-05, 'beta_0': 0.8719668658128839, 'beta_1': 0.9953837938824098, 'epsilon': 7.126510268851374e-05, 'balanced_loss': False, 'epochs': 182, 'early_stopping_patience': 25, 'plateau_patience': 18, 'plateau_divider': 8}. Best is trial 43 with value: 0.9151515151515152.
CUDA out of memory. Tried to allocate 2.23 GiB. GPU 0 has a total capacity of 44.56 GiB of which 2.22 GiB is free. Including non-PyTorch memory, this process has 42.34 GiB memory in use. Of the allocated memory 37.29 GiB is allocated by PyTorch, and 3.90 GiB is reserved by PyTorch but unallocated. If reserved but unallocated memory is large try setting PYTORCH_CUDA_ALLOC_CONF=expandable_segments:True to avoid fragmentation.  See documentation for Memory Management  (https://pytorch.org/docs/stable/notes/cuda.html#environment-variables)
[I 2024-11-22 19:33:03,497] Trial 75 finished with value: -1.0 and parameters: {'left_stride': 256, 'right_stride': 128, 'attention_pooling_operation': 'mean', 'embedding_pooling_operation': 'max', 'threshold': 0.9811776970892168, 'batch_size': 64, 'attention_heads': 4, 'hidden_dimension': 139, 'number_of_hidden_layers': 4, 'dropout_rate': 0.34868508317811575, 'global_pooling': 'mean', 'learning_rate': 0.05514078649821512, 'weight_decay': 1.9506952095256603e-06, 'beta_0': 0.8558652074738549, 'beta_1': 0.9982328267676637, 'epsilon': 9.948296529708566e-07, 'balanced_loss': False, 'epochs': 188, 'early_stopping_patience': 22, 'plateau_patience': 16, 'plateau_divider': 9}. Best is trial 43 with value: 0.9151515151515152.
[I 2024-11-22 19:48:48,522] Trial 76 finished with value: 0.8545454545454545 and parameters: {'left_stride': 64, 'right_stride': 64, 'attention_pooling_operation': 'mean', 'embedding_pooling_operation': 'min', 'threshold': 0.997955972964168, 'batch_size': 60, 'attention_heads': 12, 'hidden_dimension': 85, 'number_of_hidden_layers': 4, 'dropout_rate': 0.31988772002667415, 'global_pooling': 'mean', 'learning_rate': 0.00046218522621846984, 'weight_decay': 1.1836920436627946e-06, 'beta_0': 0.8397606301026603, 'beta_1': 0.9934067384351649, 'epsilon': 5.154754364030112e-07, 'balanced_loss': False, 'epochs': 170, 'early_stopping_patience': 24, 'plateau_patience': 14, 'plateau_divider': 10}. Best is trial 43 with value: 0.9151515151515152.
CUDA out of memory. Tried to allocate 3.59 GiB. GPU 0 has a total capacity of 44.56 GiB of which 3.47 GiB is free. Including non-PyTorch memory, this process has 41.08 GiB memory in use. Of the allocated memory 35.60 GiB is allocated by PyTorch, and 4.33 GiB is reserved by PyTorch but unallocated. If reserved but unallocated memory is large try setting PYTORCH_CUDA_ALLOC_CONF=expandable_segments:True to avoid fragmentation.  See documentation for Memory Management  (https://pytorch.org/docs/stable/notes/cuda.html#environment-variables)
[I 2024-11-22 19:57:06,326] Trial 77 finished with value: -1.0 and parameters: {'left_stride': 32, 'right_stride': 0, 'attention_pooling_operation': 'max', 'embedding_pooling_operation': 'max', 'threshold': 0.957051960814503, 'batch_size': 55, 'attention_heads': 5, 'hidden_dimension': 134, 'number_of_hidden_layers': 3, 'dropout_rate': 0.3845669018278095, 'global_pooling': 'max', 'learning_rate': 0.0028313414077734637, 'weight_decay': 2.7873796254035154e-06, 'beta_0': 0.8638362302910534, 'beta_1': 0.9915566935741298, 'epsilon': 3.2973967572993295e-05, 'balanced_loss': True, 'epochs': 161, 'early_stopping_patience': 11, 'plateau_patience': 15, 'plateau_divider': 8}. Best is trial 43 with value: 0.9151515151515152.
CUDA out of memory. Tried to allocate 2.32 GiB. GPU 0 has a total capacity of 44.56 GiB of which 1.78 GiB is free. Including non-PyTorch memory, this process has 42.77 GiB memory in use. Of the allocated memory 39.73 GiB is allocated by PyTorch, and 1.90 GiB is reserved by PyTorch but unallocated. If reserved but unallocated memory is large try setting PYTORCH_CUDA_ALLOC_CONF=expandable_segments:True to avoid fragmentation.  See documentation for Memory Management  (https://pytorch.org/docs/stable/notes/cuda.html#environment-variables)
[I 2024-11-22 20:10:04,302] Trial 78 finished with value: -1.0 and parameters: {'left_stride': 0, 'right_stride': 64, 'attention_pooling_operation': 'mean', 'embedding_pooling_operation': 'max', 'threshold': 0.9677375817273486, 'batch_size': 57, 'attention_heads': 13, 'hidden_dimension': 41, 'number_of_hidden_layers': 3, 'dropout_rate': 0.3070677635242867, 'global_pooling': 'mean', 'learning_rate': 0.001828452332014687, 'weight_decay': 5.0345779599141495e-06, 'beta_0': 0.8534430517019397, 'beta_1': 0.9964380063187066, 'epsilon': 4.142940192051705e-07, 'balanced_loss': True, 'epochs': 197, 'early_stopping_patience': 23, 'plateau_patience': 11, 'plateau_divider': 9}. Best is trial 43 with value: 0.9151515151515152.
[I 2024-11-22 20:20:33,440] Trial 79 finished with value: 0.896969696969697 and parameters: {'left_stride': 128, 'right_stride': 128, 'attention_pooling_operation': 'min', 'embedding_pooling_operation': 'max', 'threshold': 0.9925161427409933, 'batch_size': 60, 'attention_heads': 7, 'hidden_dimension': 55, 'number_of_hidden_layers': 0, 'dropout_rate': 0.32722574531590254, 'global_pooling': 'mean', 'learning_rate': 0.0022295163425966073, 'weight_decay': 3.45155471809471e-06, 'beta_0': 0.8118244401164767, 'beta_1': 0.9940669615379604, 'epsilon': 8.801455087190066e-07, 'balanced_loss': True, 'epochs': 148, 'early_stopping_patience': 25, 'plateau_patience': 17, 'plateau_divider': 10}. Best is trial 43 with value: 0.9151515151515152.
CUDA out of memory. Tried to allocate 6.51 GiB. GPU 0 has a total capacity of 44.56 GiB of which 5.32 GiB is free. Including non-PyTorch memory, this process has 39.23 GiB memory in use. Of the allocated memory 36.52 GiB is allocated by PyTorch, and 1.55 GiB is reserved by PyTorch but unallocated. If reserved but unallocated memory is large try setting PYTORCH_CUDA_ALLOC_CONF=expandable_segments:True to avoid fragmentation.  See documentation for Memory Management  (https://pytorch.org/docs/stable/notes/cuda.html#environment-variables)
[I 2024-11-22 20:29:33,410] Trial 80 finished with value: -1.0 and parameters: {'left_stride': 64, 'right_stride': 64, 'attention_pooling_operation': 'max', 'embedding_pooling_operation': 'max', 'threshold': 0.9375496638800869, 'batch_size': 53, 'attention_heads': 6, 'hidden_dimension': 126, 'number_of_hidden_layers': 4, 'dropout_rate': 0.4887433233977283, 'global_pooling': 'mean', 'learning_rate': 0.09691977102211156, 'weight_decay': 1.5256768999591905e-06, 'beta_0': 0.8961532321257895, 'beta_1': 0.990696159546712, 'epsilon': 3.0536324056640276e-07, 'balanced_loss': False, 'epochs': 157, 'early_stopping_patience': 22, 'plateau_patience': 13, 'plateau_divider': 7}. Best is trial 43 with value: 0.9151515151515152.
[I 2024-11-22 20:44:24,411] Trial 81 finished with value: 0.9030303030303031 and parameters: {'left_stride': 0, 'right_stride': 64, 'attention_pooling_operation': 'mean', 'embedding_pooling_operation': 'max', 'threshold': 0.9872946871678702, 'batch_size': 58, 'attention_heads': 4, 'hidden_dimension': 130, 'number_of_hidden_layers': 4, 'dropout_rate': 0.35357463256068655, 'global_pooling': 'mean', 'learning_rate': 0.001399419530760859, 'weight_decay': 3.0209958075932073e-06, 'beta_0': 0.8070434689989041, 'beta_1': 0.9967051688558128, 'epsilon': 1.544478921618327e-07, 'balanced_loss': False, 'epochs': 177, 'early_stopping_patience': 24, 'plateau_patience': 16, 'plateau_divider': 8}. Best is trial 43 with value: 0.9151515151515152.
[I 2024-11-22 20:59:10,949] Trial 82 finished with value: 0.9151515151515152 and parameters: {'left_stride': 0, 'right_stride': 64, 'attention_pooling_operation': 'mean', 'embedding_pooling_operation': 'max', 'threshold': 0.9878245131690705, 'batch_size': 56, 'attention_heads': 4, 'hidden_dimension': 117, 'number_of_hidden_layers': 4, 'dropout_rate': 0.40379386782275173, 'global_pooling': 'mean', 'learning_rate': 0.0012592470694196619, 'weight_decay': 1.4846399691268279e-05, 'beta_0': 0.8075512380426413, 'beta_1': 0.9974415952143171, 'epsilon': 1.1757071811925207e-07, 'balanced_loss': False, 'epochs': 179, 'early_stopping_patience': 24, 'plateau_patience': 16, 'plateau_divider': 3}. Best is trial 43 with value: 0.9151515151515152.
[I 2024-11-22 21:15:10,970] Trial 83 finished with value: 0.9030303030303031 and parameters: {'left_stride': 0, 'right_stride': 64, 'attention_pooling_operation': 'mean', 'embedding_pooling_operation': 'max', 'threshold': 0.9856514208442853, 'batch_size': 62, 'attention_heads': 4, 'hidden_dimension': 119, 'number_of_hidden_layers': 4, 'dropout_rate': 0.40495278491875075, 'global_pooling': 'mean', 'learning_rate': 0.0014156788094921674, 'weight_decay': 1.6696710614385353e-05, 'beta_0': 0.8078914395667331, 'beta_1': 0.9974478026973941, 'epsilon': 1.4560241584541202e-07, 'balanced_loss': False, 'epochs': 177, 'early_stopping_patience': 24, 'plateau_patience': 16, 'plateau_divider': 8}. Best is trial 43 with value: 0.9151515151515152.
[I 2024-11-22 21:31:24,136] Trial 84 finished with value: 0.9212121212121213 and parameters: {'left_stride': 0, 'right_stride': 64, 'attention_pooling_operation': 'mean', 'embedding_pooling_operation': 'max', 'threshold': 0.9769493729482218, 'batch_size': 62, 'attention_heads': 4, 'hidden_dimension': 120, 'number_of_hidden_layers': 4, 'dropout_rate': 0.39795412115610185, 'global_pooling': 'mean', 'learning_rate': 0.0015537790651099673, 'weight_decay': 1.7346090586180948e-05, 'beta_0': 0.8076091417155595, 'beta_1': 0.9983122906444909, 'epsilon': 1.3227729095627506e-07, 'balanced_loss': False, 'epochs': 166, 'early_stopping_patience': 25, 'plateau_patience': 16, 'plateau_divider': 7}. Best is trial 84 with value: 0.9212121212121213.
[I 2024-11-22 21:47:11,492] Trial 85 finished with value: 0.9030303030303031 and parameters: {'left_stride': 0, 'right_stride': 64, 'attention_pooling_operation': 'mean', 'embedding_pooling_operation': 'max', 'threshold': 0.9770261328575831, 'batch_size': 59, 'attention_heads': 4, 'hidden_dimension': 110, 'number_of_hidden_layers': 4, 'dropout_rate': 0.39773376553608997, 'global_pooling': 'mean', 'learning_rate': 0.0006584471008968515, 'weight_decay': 1.6484641239247848e-05, 'beta_0': 0.8057614029558112, 'beta_1': 0.9987338837447504, 'epsilon': 9.114392247409402e-08, 'balanced_loss': False, 'epochs': 166, 'early_stopping_patience': 25, 'plateau_patience': 15, 'plateau_divider': 3}. Best is trial 84 with value: 0.9212121212121213.
[I 2024-11-22 22:03:19,318] Trial 86 finished with value: 0.9030303030303031 and parameters: {'left_stride': 0, 'right_stride': 64, 'attention_pooling_operation': 'mean', 'embedding_pooling_operation': 'max', 'threshold': 0.9827231706314722, 'batch_size': 63, 'attention_heads': 5, 'hidden_dimension': 131, 'number_of_hidden_layers': 4, 'dropout_rate': 0.3573476931119593, 'global_pooling': 'mean', 'learning_rate': 0.0011543693863456102, 'weight_decay': 2.206237473569442e-05, 'beta_0': 0.8104361444669969, 'beta_1': 0.9983264803590337, 'epsilon': 7.414686639076891e-08, 'balanced_loss': False, 'epochs': 177, 'early_stopping_patience': 25, 'plateau_patience': 17, 'plateau_divider': 6}. Best is trial 84 with value: 0.9212121212121213.
[I 2024-11-22 22:20:01,290] Trial 87 finished with value: 0.8666666666666667 and parameters: {'left_stride': 0, 'right_stride': 64, 'attention_pooling_operation': 'mean', 'embedding_pooling_operation': 'max', 'threshold': 0.9752764284148994, 'batch_size': 57, 'attention_heads': 4, 'hidden_dimension': 100, 'number_of_hidden_layers': 4, 'dropout_rate': 0.3721430133730365, 'global_pooling': 'sum', 'learning_rate': 0.0008443018716422902, 'weight_decay': 1.3901499332608777e-05, 'beta_0': 0.8027833043966618, 'beta_1': 0.9967161572329478, 'epsilon': 6.089353867589686e-08, 'balanced_loss': False, 'epochs': 168, 'early_stopping_patience': 25, 'plateau_patience': 16, 'plateau_divider': 3}. Best is trial 84 with value: 0.9212121212121213.
[I 2024-11-22 22:35:16,700] Trial 88 finished with value: 0.896969696969697 and parameters: {'left_stride': 0, 'right_stride': 64, 'attention_pooling_operation': 'mean', 'embedding_pooling_operation': 'min', 'threshold': 0.9878502126831994, 'batch_size': 62, 'attention_heads': 4, 'hidden_dimension': 77, 'number_of_hidden_layers': 4, 'dropout_rate': 0.43034916461998085, 'global_pooling': 'mean', 'learning_rate': 0.0016312695423053624, 'weight_decay': 3.75408454455892e-05, 'beta_0': 0.8054913993424265, 'beta_1': 0.9974575865496735, 'epsilon': 1.4441703135668163e-07, 'balanced_loss': False, 'epochs': 181, 'early_stopping_patience': 24, 'plateau_patience': 18, 'plateau_divider': 7}. Best is trial 84 with value: 0.9212121212121213.
CUDA out of memory. Tried to allocate 4.39 GiB. GPU 0 has a total capacity of 44.56 GiB of which 2.02 GiB is free. Including non-PyTorch memory, this process has 42.53 GiB memory in use. Of the allocated memory 39.67 GiB is allocated by PyTorch, and 1.71 GiB is reserved by PyTorch but unallocated. If reserved but unallocated memory is large try setting PYTORCH_CUDA_ALLOC_CONF=expandable_segments:True to avoid fragmentation.  See documentation for Memory Management  (https://pytorch.org/docs/stable/notes/cuda.html#environment-variables)
[I 2024-11-22 22:48:24,826] Trial 89 finished with value: -1.0 and parameters: {'left_stride': 0, 'right_stride': 64, 'attention_pooling_operation': 'mean', 'embedding_pooling_operation': 'mean', 'threshold': 0.9710086172473266, 'batch_size': 58, 'attention_heads': 5, 'hidden_dimension': 220, 'number_of_hidden_layers': 4, 'dropout_rate': 0.33956961662132307, 'global_pooling': 'mean', 'learning_rate': 0.00031906050430577636, 'weight_decay': 2.32979150838014e-05, 'beta_0': 0.8158336962825191, 'beta_1': 0.9958951107336689, 'epsilon': 2.7317893045016273e-08, 'balanced_loss': False, 'epochs': 163, 'early_stopping_patience': 24, 'plateau_patience': 15, 'plateau_divider': 5}. Best is trial 84 with value: 0.9212121212121213.
[I 2024-11-22 23:05:05,027] Trial 90 finished with value: 0.9030303030303031 and parameters: {'left_stride': 0, 'right_stride': 32, 'attention_pooling_operation': 'mean', 'embedding_pooling_operation': 'max', 'threshold': 0.9784428380777261, 'batch_size': 55, 'attention_heads': 4, 'hidden_dimension': 144, 'number_of_hidden_layers': 4, 'dropout_rate': 0.42150646087347876, 'global_pooling': 'mean', 'learning_rate': 0.0005406842558413593, 'weight_decay': 9.213828125313869e-06, 'beta_0': 0.8083146423693306, 'beta_1': 0.9978328731206604, 'epsilon': 1.205683106897627e-07, 'balanced_loss': False, 'epochs': 172, 'early_stopping_patience': 25, 'plateau_patience': 25, 'plateau_divider': 7}. Best is trial 84 with value: 0.9212121212121213.
[I 2024-11-22 23:20:43,774] Trial 91 finished with value: 0.896969696969697 and parameters: {'left_stride': 0, 'right_stride': 64, 'attention_pooling_operation': 'mean', 'embedding_pooling_operation': 'max', 'threshold': 0.9866762910625377, 'batch_size': 62, 'attention_heads': 4, 'hidden_dimension': 111, 'number_of_hidden_layers': 4, 'dropout_rate': 0.37965898542233206, 'global_pooling': 'mean', 'learning_rate': 0.0014580765161399478, 'weight_decay': 6.771638928067397e-06, 'beta_0': 0.8082271803856523, 'beta_1': 0.9968966662238723, 'epsilon': 1.868384395025244e-07, 'balanced_loss': False, 'epochs': 175, 'early_stopping_patience': 24, 'plateau_patience': 16, 'plateau_divider': 8}. Best is trial 84 with value: 0.9212121212121213.
[I 2024-11-22 23:36:25,071] Trial 92 finished with value: 0.9030303030303031 and parameters: {'left_stride': 0, 'right_stride': 64, 'attention_pooling_operation': 'mean', 'embedding_pooling_operation': 'max', 'threshold': 0.9847469639857759, 'batch_size': 60, 'attention_heads': 4, 'hidden_dimension': 122, 'number_of_hidden_layers': 4, 'dropout_rate': 0.3894172825108349, 'global_pooling': 'mean', 'learning_rate': 0.0012271279629975007, 'weight_decay': 3.0549125370747145e-05, 'beta_0': 0.8137193570048717, 'beta_1': 0.99743564331645, 'epsilon': 3.531251967783018e-07, 'balanced_loss': False, 'epochs': 185, 'early_stopping_patience': 23, 'plateau_patience': 16, 'plateau_divider': 8}. Best is trial 84 with value: 0.9212121212121213.
[I 2024-11-22 23:52:43,908] Trial 93 finished with value: 0.9090909090909091 and parameters: {'left_stride': 0, 'right_stride': 64, 'attention_pooling_operation': 'mean', 'embedding_pooling_operation': 'max', 'threshold': 0.9819566897006285, 'batch_size': 63, 'attention_heads': 5, 'hidden_dimension': 119, 'number_of_hidden_layers': 4, 'dropout_rate': 0.4022400882362728, 'global_pooling': 'mean', 'learning_rate': 0.0009502866829193152, 'weight_decay': 1.5012508176136282e-05, 'beta_0': 0.8016860865698089, 'beta_1': 0.9986285196676536, 'epsilon': 1.1552446652401773e-07, 'balanced_loss': False, 'epochs': 180, 'early_stopping_patience': 25, 'plateau_patience': 17, 'plateau_divider': 8}. Best is trial 84 with value: 0.9212121212121213.
