[I 2024-12-21 04:10:20,231] Using an existing study with name 'IMDb-top_1000-GATv2-facebook-bart-large-Surrogate-No_Aggregation' instead of creating a new one.
Token indices sequence length is longer than the specified maximum sequence length for this model (1113 > 1024). Running this sequence through the model will result in indexing errors
[I 2024-12-21 04:28:01,128] Trial 157 finished with value: 0.9575757575757575 and parameters: {'left_stride': 256, 'right_stride': 64, 'attention_pooling_operation': 'max', 'embedding_pooling_operation': 'max', 'threshold': 0.9874077211682221, 'batch_size': 55, 'attention_heads': 4, 'hidden_dimension': 54, 'number_of_hidden_layers': 2, 'dropout_rate': 0.5031124368207978, 'global_pooling': 'sum', 'learning_rate': 0.0013054661263947323, 'weight_decay': 1.4643477144467243e-05, 'beta_0': 0.8681431293371645, 'beta_1': 0.9855697716884277, 'epsilon': 5.489964248028733e-08, 'balanced_loss': False, 'epochs': 146, 'early_stopping_patience': 13, 'plateau_patience': 24, 'plateau_divider': 2}. Best is trial 91 with value: 0.9696969696969697.
[I 2024-12-21 04:44:03,640] Trial 158 finished with value: 0.9454545454545454 and parameters: {'left_stride': 0, 'right_stride': 64, 'attention_pooling_operation': 'max', 'embedding_pooling_operation': 'max', 'threshold': 0.9919107747480995, 'batch_size': 18, 'attention_heads': 5, 'hidden_dimension': 43, 'number_of_hidden_layers': 2, 'dropout_rate': 0.3372649848857318, 'global_pooling': 'sum', 'learning_rate': 0.0010254047511992698, 'weight_decay': 2.59783112989505e-05, 'beta_0': 0.8593135080818731, 'beta_1': 0.9906137129213649, 'epsilon': 3.524071162993868e-08, 'balanced_loss': False, 'epochs': 140, 'early_stopping_patience': 14, 'plateau_patience': 12, 'plateau_divider': 2}. Best is trial 91 with value: 0.9696969696969697.
[I 2024-12-21 05:00:48,806] Trial 159 finished with value: 0.7212121212121212 and parameters: {'left_stride': 256, 'right_stride': 64, 'attention_pooling_operation': 'max', 'embedding_pooling_operation': 'max', 'threshold': 0.9998868602048958, 'batch_size': 23, 'attention_heads': 6, 'hidden_dimension': 140, 'number_of_hidden_layers': 2, 'dropout_rate': 0.3452215347012957, 'global_pooling': 'mean', 'learning_rate': 0.0005821382467120201, 'weight_decay': 4.734440756019443e-05, 'beta_0': 0.8439980184492005, 'beta_1': 0.9959266183235351, 'epsilon': 4.158120608425374e-08, 'balanced_loss': False, 'epochs': 137, 'early_stopping_patience': 12, 'plateau_patience': 11, 'plateau_divider': 4}. Best is trial 91 with value: 0.9696969696969697.
[I 2024-12-21 05:18:19,846] Trial 160 finished with value: 0.896969696969697 and parameters: {'left_stride': 256, 'right_stride': 64, 'attention_pooling_operation': 'min', 'embedding_pooling_operation': 'max', 'threshold': 0.9886243224319652, 'batch_size': 21, 'attention_heads': 7, 'hidden_dimension': 49, 'number_of_hidden_layers': 2, 'dropout_rate': 0.5333033043656366, 'global_pooling': 'sum', 'learning_rate': 0.0007301679259831871, 'weight_decay': 8.064560383306259e-06, 'beta_0': 0.8711838780726789, 'beta_1': 0.998426739601483, 'epsilon': 1.7069626251967096e-08, 'balanced_loss': False, 'epochs': 143, 'early_stopping_patience': 13, 'plateau_patience': 23, 'plateau_divider': 3}. Best is trial 91 with value: 0.9696969696969697.
CUDA out of memory. Tried to allocate 2.45 GiB. GPU 0 has a total capacity of 44.56 GiB of which 1.72 GiB is free. Including non-PyTorch memory, this process has 42.84 GiB memory in use. Of the allocated memory 36.16 GiB is allocated by PyTorch, and 5.52 GiB is reserved by PyTorch but unallocated. If reserved but unallocated memory is large try setting PYTORCH_CUDA_ALLOC_CONF=expandable_segments:True to avoid fragmentation.  See documentation for Memory Management  (https://pytorch.org/docs/stable/notes/cuda.html#environment-variables)
[I 2024-12-21 05:29:56,325] Trial 161 finished with value: -1.0 and parameters: {'left_stride': 256, 'right_stride': 64, 'attention_pooling_operation': 'max', 'embedding_pooling_operation': 'max', 'threshold': 0.9606102537974289, 'batch_size': 25, 'attention_heads': 5, 'hidden_dimension': 124, 'number_of_hidden_layers': 2, 'dropout_rate': 0.4817653980843922, 'global_pooling': 'sum', 'learning_rate': 0.0016521264668998318, 'weight_decay': 1.8189487601552222e-05, 'beta_0': 0.8552079076789858, 'beta_1': 0.9897679634178496, 'epsilon': 2.3062212562555125e-08, 'balanced_loss': True, 'epochs': 149, 'early_stopping_patience': 11, 'plateau_patience': 10, 'plateau_divider': 2}. Best is trial 91 with value: 0.9696969696969697.
[I 2024-12-21 05:47:21,569] Trial 162 finished with value: 0.9515151515151515 and parameters: {'left_stride': 256, 'right_stride': 0, 'attention_pooling_operation': 'max', 'embedding_pooling_operation': 'max', 'threshold': 0.9945094107194286, 'batch_size': 19, 'attention_heads': 6, 'hidden_dimension': 95, 'number_of_hidden_layers': 2, 'dropout_rate': 0.49308825191370204, 'global_pooling': 'sum', 'learning_rate': 0.0026129195653585365, 'weight_decay': 0.0008719252087658132, 'beta_0': 0.8650130779444125, 'beta_1': 0.993058542037426, 'epsilon': 2.655923968645004e-08, 'balanced_loss': False, 'epochs': 134, 'early_stopping_patience': 15, 'plateau_patience': 23, 'plateau_divider': 2}. Best is trial 91 with value: 0.9696969696969697.
[I 2024-12-21 06:15:45,020] Trial 163 finished with value: 0.9696969696969697 and parameters: {'left_stride': 256, 'right_stride': 32, 'attention_pooling_operation': 'mean', 'embedding_pooling_operation': 'max', 'threshold': 0.9857675483296944, 'batch_size': 24, 'attention_heads': 4, 'hidden_dimension': 37, 'number_of_hidden_layers': 2, 'dropout_rate': 0.3604441106822985, 'global_pooling': 'mean', 'learning_rate': 0.0003659455595873202, 'weight_decay': 0.00046597879814817123, 'beta_0': 0.8514593315705578, 'beta_1': 0.9917494617437989, 'epsilon': 1.9972082329679058e-08, 'balanced_loss': False, 'epochs': 152, 'early_stopping_patience': 16, 'plateau_patience': 24, 'plateau_divider': 2}. Best is trial 91 with value: 0.9696969696969697.
[I 2024-12-21 06:44:31,799] Trial 164 finished with value: 0.9636363636363636 and parameters: {'left_stride': 256, 'right_stride': 32, 'attention_pooling_operation': 'mean', 'embedding_pooling_operation': 'max', 'threshold': 0.9855386462741018, 'batch_size': 24, 'attention_heads': 4, 'hidden_dimension': 37, 'number_of_hidden_layers': 2, 'dropout_rate': 0.3606646977129601, 'global_pooling': 'mean', 'learning_rate': 0.0003413744038049639, 'weight_decay': 0.0005126444379343927, 'beta_0': 0.8504737087393378, 'beta_1': 0.9920941671030359, 'epsilon': 1.9905021638284806e-08, 'balanced_loss': False, 'epochs': 152, 'early_stopping_patience': 17, 'plateau_patience': 24, 'plateau_divider': 2}. Best is trial 91 with value: 0.9696969696969697.
[I 2024-12-21 07:13:09,222] Trial 165 finished with value: 0.9636363636363636 and parameters: {'left_stride': 256, 'right_stride': 32, 'attention_pooling_operation': 'mean', 'embedding_pooling_operation': 'max', 'threshold': 0.9858357452211557, 'batch_size': 26, 'attention_heads': 4, 'hidden_dimension': 38, 'number_of_hidden_layers': 2, 'dropout_rate': 0.36176558885641297, 'global_pooling': 'mean', 'learning_rate': 0.0003274204434987017, 'weight_decay': 0.0005087326244843072, 'beta_0': 0.8533728709487957, 'beta_1': 0.9923398669943503, 'epsilon': 2.0334611706603237e-08, 'balanced_loss': False, 'epochs': 160, 'early_stopping_patience': 17, 'plateau_patience': 24, 'plateau_divider': 2}. Best is trial 91 with value: 0.9696969696969697.
[I 2024-12-21 07:42:03,610] Trial 166 finished with value: 0.9696969696969697 and parameters: {'left_stride': 256, 'right_stride': 32, 'attention_pooling_operation': 'mean', 'embedding_pooling_operation': 'max', 'threshold': 0.9844712866762144, 'batch_size': 26, 'attention_heads': 4, 'hidden_dimension': 35, 'number_of_hidden_layers': 2, 'dropout_rate': 0.37490869025592927, 'global_pooling': 'mean', 'learning_rate': 0.0002251796868339213, 'weight_decay': 0.000440514612041631, 'beta_0': 0.8518735942657092, 'beta_1': 0.991938452868287, 'epsilon': 1.4792774468473839e-08, 'balanced_loss': False, 'epochs': 159, 'early_stopping_patience': 16, 'plateau_patience': 25, 'plateau_divider': 2}. Best is trial 91 with value: 0.9696969696969697.
[I 2024-12-21 08:10:40,934] Trial 167 finished with value: 0.9696969696969697 and parameters: {'left_stride': 256, 'right_stride': 32, 'attention_pooling_operation': 'mean', 'embedding_pooling_operation': 'max', 'threshold': 0.9863108267454377, 'batch_size': 26, 'attention_heads': 4, 'hidden_dimension': 32, 'number_of_hidden_layers': 2, 'dropout_rate': 0.37792377621405293, 'global_pooling': 'mean', 'learning_rate': 0.00021635262996791746, 'weight_decay': 0.0004822483102645834, 'beta_0': 0.8512794985659731, 'beta_1': 0.991755498586304, 'epsilon': 1.2752787846409604e-08, 'balanced_loss': False, 'epochs': 160, 'early_stopping_patience': 16, 'plateau_patience': 25, 'plateau_divider': 2}. Best is trial 91 with value: 0.9696969696969697.
[I 2024-12-21 08:39:50,998] Trial 168 finished with value: 0.9696969696969697 and parameters: {'left_stride': 256, 'right_stride': 32, 'attention_pooling_operation': 'mean', 'embedding_pooling_operation': 'min', 'threshold': 0.9849250183506773, 'batch_size': 28, 'attention_heads': 4, 'hidden_dimension': 35, 'number_of_hidden_layers': 2, 'dropout_rate': 0.3755327165600183, 'global_pooling': 'mean', 'learning_rate': 0.00019984678682187325, 'weight_decay': 0.0005338629349130138, 'beta_0': 0.8515816724918063, 'beta_1': 0.992019207934815, 'epsilon': 1.1960884175714561e-08, 'balanced_loss': False, 'epochs': 164, 'early_stopping_patience': 17, 'plateau_patience': 25, 'plateau_divider': 2}. Best is trial 91 with value: 0.9696969696969697.
[I 2024-12-21 09:09:00,999] Trial 169 finished with value: 0.9696969696969697 and parameters: {'left_stride': 256, 'right_stride': 32, 'attention_pooling_operation': 'mean', 'embedding_pooling_operation': 'min', 'threshold': 0.9850795132736391, 'batch_size': 28, 'attention_heads': 4, 'hidden_dimension': 36, 'number_of_hidden_layers': 2, 'dropout_rate': 0.3746089739250244, 'global_pooling': 'mean', 'learning_rate': 0.00018180915965756344, 'weight_decay': 0.00044783380626921287, 'beta_0': 0.8505147751662349, 'beta_1': 0.9918754333230395, 'epsilon': 1.1410775779218758e-08, 'balanced_loss': False, 'epochs': 163, 'early_stopping_patience': 16, 'plateau_patience': 25, 'plateau_divider': 2}. Best is trial 91 with value: 0.9696969696969697.
[I 2024-12-21 09:38:36,956] Trial 170 finished with value: 0.9696969696969697 and parameters: {'left_stride': 256, 'right_stride': 32, 'attention_pooling_operation': 'mean', 'embedding_pooling_operation': 'min', 'threshold': 0.9851945248743272, 'batch_size': 28, 'attention_heads': 4, 'hidden_dimension': 35, 'number_of_hidden_layers': 2, 'dropout_rate': 0.3781614938281441, 'global_pooling': 'mean', 'learning_rate': 9.791283517466968e-05, 'weight_decay': 0.0004972709483066664, 'beta_0': 0.8517074492764483, 'beta_1': 0.9919091442509925, 'epsilon': 1.2010109698477743e-08, 'balanced_loss': False, 'epochs': 167, 'early_stopping_patience': 16, 'plateau_patience': 25, 'plateau_divider': 2}. Best is trial 91 with value: 0.9696969696969697.
[I 2024-12-21 10:08:15,953] Trial 171 finished with value: 0.9696969696969697 and parameters: {'left_stride': 256, 'right_stride': 32, 'attention_pooling_operation': 'mean', 'embedding_pooling_operation': 'min', 'threshold': 0.9852475738131855, 'batch_size': 29, 'attention_heads': 4, 'hidden_dimension': 36, 'number_of_hidden_layers': 2, 'dropout_rate': 0.37547354335181193, 'global_pooling': 'mean', 'learning_rate': 0.00010986627642845353, 'weight_decay': 0.0004765561237049007, 'beta_0': 0.8510347451984579, 'beta_1': 0.9924239804433203, 'epsilon': 1.1060233865364242e-08, 'balanced_loss': False, 'epochs': 169, 'early_stopping_patience': 16, 'plateau_patience': 25, 'plateau_divider': 2}. Best is trial 91 with value: 0.9696969696969697.
[I 2024-12-21 10:37:36,552] Trial 172 finished with value: 0.9696969696969697 and parameters: {'left_stride': 256, 'right_stride': 32, 'attention_pooling_operation': 'mean', 'embedding_pooling_operation': 'min', 'threshold': 0.9841668722509354, 'batch_size': 29, 'attention_heads': 4, 'hidden_dimension': 35, 'number_of_hidden_layers': 2, 'dropout_rate': 0.3774940979877445, 'global_pooling': 'mean', 'learning_rate': 0.00017104204643939686, 'weight_decay': 0.00048093878422159704, 'beta_0': 0.8513240847545627, 'beta_1': 0.9919026795245076, 'epsilon': 1.007003445212985e-08, 'balanced_loss': False, 'epochs': 167, 'early_stopping_patience': 16, 'plateau_patience': 25, 'plateau_divider': 2}. Best is trial 91 with value: 0.9696969696969697.
[I 2024-12-21 11:08:05,052] Trial 173 finished with value: 0.9696969696969697 and parameters: {'left_stride': 256, 'right_stride': 32, 'attention_pooling_operation': 'mean', 'embedding_pooling_operation': 'min', 'threshold': 0.9842527994149638, 'batch_size': 28, 'attention_heads': 4, 'hidden_dimension': 35, 'number_of_hidden_layers': 2, 'dropout_rate': 0.37972131404861514, 'global_pooling': 'mean', 'learning_rate': 8.485924428480631e-05, 'weight_decay': 0.0004923789860597703, 'beta_0': 0.8504717208288095, 'beta_1': 0.9923675157115233, 'epsilon': 1.0205470619722033e-08, 'balanced_loss': False, 'epochs': 167, 'early_stopping_patience': 16, 'plateau_patience': 25, 'plateau_divider': 2}. Best is trial 91 with value: 0.9696969696969697.
[I 2024-12-21 11:38:19,857] Trial 174 finished with value: 0.9696969696969697 and parameters: {'left_stride': 256, 'right_stride': 32, 'attention_pooling_operation': 'mean', 'embedding_pooling_operation': 'min', 'threshold': 0.9840498473337238, 'batch_size': 28, 'attention_heads': 4, 'hidden_dimension': 35, 'number_of_hidden_layers': 2, 'dropout_rate': 0.37548345137304207, 'global_pooling': 'mean', 'learning_rate': 0.00010699627218855103, 'weight_decay': 0.00046158863342942363, 'beta_0': 0.8513525590783017, 'beta_1': 0.992370581338203, 'epsilon': 1.1204548536207596e-08, 'balanced_loss': False, 'epochs': 168, 'early_stopping_patience': 16, 'plateau_patience': 25, 'plateau_divider': 2}. Best is trial 91 with value: 0.9696969696969697.
[I 2024-12-21 12:08:30,889] Trial 175 finished with value: 0.9696969696969697 and parameters: {'left_stride': 256, 'right_stride': 32, 'attention_pooling_operation': 'mean', 'embedding_pooling_operation': 'min', 'threshold': 0.9847579959291034, 'batch_size': 28, 'attention_heads': 4, 'hidden_dimension': 35, 'number_of_hidden_layers': 2, 'dropout_rate': 0.3758625197438999, 'global_pooling': 'mean', 'learning_rate': 0.00010201409503221867, 'weight_decay': 0.0004689591682009785, 'beta_0': 0.8514866639532351, 'beta_1': 0.9924799496305481, 'epsilon': 1.0984189224003539e-08, 'balanced_loss': False, 'epochs': 167, 'early_stopping_patience': 16, 'plateau_patience': 25, 'plateau_divider': 2}. Best is trial 91 with value: 0.9696969696969697.
[I 2024-12-21 12:38:45,023] Trial 176 finished with value: 0.9696969696969697 and parameters: {'left_stride': 256, 'right_stride': 32, 'attention_pooling_operation': 'mean', 'embedding_pooling_operation': 'min', 'threshold': 0.9844646684722768, 'batch_size': 28, 'attention_heads': 4, 'hidden_dimension': 36, 'number_of_hidden_layers': 2, 'dropout_rate': 0.3758430251983979, 'global_pooling': 'mean', 'learning_rate': 0.00010246437815333476, 'weight_decay': 0.00048079821825107704, 'beta_0': 0.8514745441743069, 'beta_1': 0.9923497238398579, 'epsilon': 1.1216581840950198e-08, 'balanced_loss': False, 'epochs': 168, 'early_stopping_patience': 16, 'plateau_patience': 25, 'plateau_divider': 2}. Best is trial 91 with value: 0.9696969696969697.
[I 2024-12-21 13:09:04,473] Trial 177 finished with value: 0.9757575757575757 and parameters: {'left_stride': 256, 'right_stride': 32, 'attention_pooling_operation': 'mean', 'embedding_pooling_operation': 'min', 'threshold': 0.9836623567175469, 'batch_size': 28, 'attention_heads': 4, 'hidden_dimension': 32, 'number_of_hidden_layers': 2, 'dropout_rate': 0.3748559825502746, 'global_pooling': 'mean', 'learning_rate': 9.930059813876726e-05, 'weight_decay': 0.0004692243153406935, 'beta_0': 0.8512110796272658, 'beta_1': 0.9919443900211069, 'epsilon': 1.0220219229235084e-08, 'balanced_loss': False, 'epochs': 168, 'early_stopping_patience': 16, 'plateau_patience': 25, 'plateau_divider': 2}. Best is trial 177 with value: 0.9757575757575757.
[I 2024-12-21 13:39:18,289] Trial 178 finished with value: 0.9757575757575757 and parameters: {'left_stride': 256, 'right_stride': 32, 'attention_pooling_operation': 'mean', 'embedding_pooling_operation': 'min', 'threshold': 0.9840181534074857, 'batch_size': 29, 'attention_heads': 4, 'hidden_dimension': 32, 'number_of_hidden_layers': 2, 'dropout_rate': 0.374501099060963, 'global_pooling': 'mean', 'learning_rate': 0.00011301906841842572, 'weight_decay': 0.0004405164621137389, 'beta_0': 0.8515638744194487, 'beta_1': 0.9928753960062705, 'epsilon': 1.000408206665588e-08, 'balanced_loss': False, 'epochs': 168, 'early_stopping_patience': 16, 'plateau_patience': 25, 'plateau_divider': 2}. Best is trial 177 with value: 0.9757575757575757.
[I 2024-12-21 14:09:36,393] Trial 179 finished with value: 0.9757575757575757 and parameters: {'left_stride': 256, 'right_stride': 32, 'attention_pooling_operation': 'mean', 'embedding_pooling_operation': 'min', 'threshold': 0.9836516441695675, 'batch_size': 29, 'attention_heads': 4, 'hidden_dimension': 32, 'number_of_hidden_layers': 2, 'dropout_rate': 0.3761138314811442, 'global_pooling': 'mean', 'learning_rate': 0.00010002442732973978, 'weight_decay': 0.0004395437975174041, 'beta_0': 0.8501011426845656, 'beta_1': 0.9928491725366481, 'epsilon': 1.0391660461080714e-08, 'balanced_loss': False, 'epochs': 169, 'early_stopping_patience': 16, 'plateau_patience': 25, 'plateau_divider': 2}. Best is trial 177 with value: 0.9757575757575757.
[I 2024-12-21 14:39:58,032] Trial 180 finished with value: 0.9696969696969697 and parameters: {'left_stride': 256, 'right_stride': 32, 'attention_pooling_operation': 'mean', 'embedding_pooling_operation': 'min', 'threshold': 0.9813021758686773, 'batch_size': 28, 'attention_heads': 4, 'hidden_dimension': 34, 'number_of_hidden_layers': 2, 'dropout_rate': 0.3763876732220647, 'global_pooling': 'mean', 'learning_rate': 0.00010349565577386007, 'weight_decay': 0.0004212311855455389, 'beta_0': 0.8521356925302523, 'beta_1': 0.9928144520250517, 'epsilon': 1.0252153812366649e-08, 'balanced_loss': False, 'epochs': 168, 'early_stopping_patience': 16, 'plateau_patience': 25, 'plateau_divider': 2}. Best is trial 177 with value: 0.9757575757575757.
[I 2024-12-21 15:10:14,250] Trial 181 finished with value: 0.9757575757575757 and parameters: {'left_stride': 256, 'right_stride': 32, 'attention_pooling_operation': 'mean', 'embedding_pooling_operation': 'min', 'threshold': 0.9802932628793424, 'batch_size': 29, 'attention_heads': 4, 'hidden_dimension': 32, 'number_of_hidden_layers': 2, 'dropout_rate': 0.37722126032602626, 'global_pooling': 'mean', 'learning_rate': 9.22601313990604e-05, 'weight_decay': 0.0004640605675531527, 'beta_0': 0.8514575876413957, 'beta_1': 0.9929227079973186, 'epsilon': 1.1283710908363143e-08, 'balanced_loss': False, 'epochs': 174, 'early_stopping_patience': 16, 'plateau_patience': 25, 'plateau_divider': 9}. Best is trial 177 with value: 0.9757575757575757.
[I 2024-12-21 15:40:03,853] Trial 182 finished with value: 0.9757575757575757 and parameters: {'left_stride': 256, 'right_stride': 32, 'attention_pooling_operation': 'mean', 'embedding_pooling_operation': 'min', 'threshold': 0.984019730130514, 'batch_size': 29, 'attention_heads': 4, 'hidden_dimension': 32, 'number_of_hidden_layers': 2, 'dropout_rate': 0.3883227418218659, 'global_pooling': 'mean', 'learning_rate': 9.378187375527265e-05, 'weight_decay': 0.00046505027507627366, 'beta_0': 0.8510308689797238, 'beta_1': 0.9939457531132753, 'epsilon': 1.224093980581708e-08, 'balanced_loss': False, 'epochs': 171, 'early_stopping_patience': 16, 'plateau_patience': 25, 'plateau_divider': 9}. Best is trial 177 with value: 0.9757575757575757.
[I 2024-12-21 16:08:34,997] Trial 183 finished with value: 0.9636363636363636 and parameters: {'left_stride': 32, 'right_stride': 32, 'attention_pooling_operation': 'mean', 'embedding_pooling_operation': 'min', 'threshold': 0.9807050983793435, 'batch_size': 30, 'attention_heads': 4, 'hidden_dimension': 32, 'number_of_hidden_layers': 2, 'dropout_rate': 0.38754988154055675, 'global_pooling': 'mean', 'learning_rate': 6.93090666084104e-05, 'weight_decay': 0.0003161654275965873, 'beta_0': 0.8493090109266784, 'beta_1': 0.9936221196840256, 'epsilon': 1.2019947465083938e-08, 'balanced_loss': False, 'epochs': 172, 'early_stopping_patience': 16, 'plateau_patience': 25, 'plateau_divider': 9}. Best is trial 177 with value: 0.9757575757575757.
[I 2024-12-21 16:39:07,148] Trial 184 finished with value: 0.9757575757575757 and parameters: {'left_stride': 256, 'right_stride': 32, 'attention_pooling_operation': 'mean', 'embedding_pooling_operation': 'min', 'threshold': 0.9844811891872055, 'batch_size': 28, 'attention_heads': 4, 'hidden_dimension': 32, 'number_of_hidden_layers': 2, 'dropout_rate': 0.3955088321403131, 'global_pooling': 'mean', 'learning_rate': 0.00010164404842707384, 'weight_decay': 0.0003658114604028344, 'beta_0': 0.8512895246179675, 'beta_1': 0.9926064299142394, 'epsilon': 1.1940023119294324e-08, 'balanced_loss': False, 'epochs': 170, 'early_stopping_patience': 16, 'plateau_patience': 25, 'plateau_divider': 9}. Best is trial 177 with value: 0.9757575757575757.
