[I 2025-04-07 01:51:04,410] Trial 231 finished with value: 0.6594161859840041 and parameters: {'left_stride': 64, 'right_stride': 0, 'co_occurrence_pooling_operation': 'sum', 'embedding_pooling_operation': 'mean', 'window_size': 10, 'batch_size': 122, 'attention_heads': 12, 'hidden_dimension': 232, 'number_of_hidden_layers': 1, 'dropout_rate': 0.47222231892990574, 'global_pooling': 'mean', 'learning_rate': 0.0013916429296771046, 'weight_decay': 0.00024324800507601648, 'beta_0': 0.8505273546787958, 'beta_1': 0.9936078202039387, 'epsilon': 2.7638063787722524e-06, 'balanced_loss': True, 'epochs': 196, 'early_stopping_patience': 20, 'plateau_patience': 16, 'plateau_divider': 3}. Best is trial 97 with value: 0.6752887550206477.
[I 2025-04-07 02:14:35,984] Trial 232 finished with value: 0.6346200563690073 and parameters: {'left_stride': 64, 'right_stride': 0, 'co_occurrence_pooling_operation': 'sum', 'embedding_pooling_operation': 'mean', 'window_size': 10, 'batch_size': 123, 'attention_heads': 12, 'hidden_dimension': 230, 'number_of_hidden_layers': 1, 'dropout_rate': 0.47427299855547334, 'global_pooling': 'sum', 'learning_rate': 0.001500912401705603, 'weight_decay': 0.00023974718868751319, 'beta_0': 0.8504103048685661, 'beta_1': 0.9943727152513866, 'epsilon': 2.8235535398498494e-06, 'balanced_loss': True, 'epochs': 197, 'early_stopping_patience': 20, 'plateau_patience': 16, 'plateau_divider': 3}. Best is trial 97 with value: 0.6752887550206477.
[I 2025-04-07 02:38:08,515] Trial 233 finished with value: 0.6726708831234892 and parameters: {'left_stride': 64, 'right_stride': 0, 'co_occurrence_pooling_operation': 'sum', 'embedding_pooling_operation': 'mean', 'window_size': 10, 'batch_size': 119, 'attention_heads': 12, 'hidden_dimension': 232, 'number_of_hidden_layers': 1, 'dropout_rate': 0.4569279147716967, 'global_pooling': 'mean', 'learning_rate': 0.0013324953102610622, 'weight_decay': 0.00027621728960878556, 'beta_0': 0.8526066010301159, 'beta_1': 0.9939695482852862, 'epsilon': 2.5375306517964856e-06, 'balanced_loss': True, 'epochs': 195, 'early_stopping_patience': 20, 'plateau_patience': 17, 'plateau_divider': 3}. Best is trial 97 with value: 0.6752887550206477.
[I 2025-04-07 03:01:17,877] Trial 234 finished with value: 0.6604543209721102 and parameters: {'left_stride': 64, 'right_stride': 0, 'co_occurrence_pooling_operation': 'sum', 'embedding_pooling_operation': 'mean', 'window_size': 10, 'batch_size': 120, 'attention_heads': 12, 'hidden_dimension': 231, 'number_of_hidden_layers': 1, 'dropout_rate': 0.4524571185787532, 'global_pooling': 'mean', 'learning_rate': 0.0012928213066073658, 'weight_decay': 0.000260099946002355, 'beta_0': 0.8534410377886291, 'beta_1': 0.993680670280727, 'epsilon': 2.5929764718572565e-06, 'balanced_loss': True, 'epochs': 193, 'early_stopping_patience': 21, 'plateau_patience': 17, 'plateau_divider': 3}. Best is trial 97 with value: 0.6752887550206477.
[I 2025-04-07 03:24:23,169] Trial 235 finished with value: 0.6324792247837536 and parameters: {'left_stride': 64, 'right_stride': 0, 'co_occurrence_pooling_operation': 'sum', 'embedding_pooling_operation': 'mean', 'window_size': 10, 'batch_size': 119, 'attention_heads': 12, 'hidden_dimension': 234, 'number_of_hidden_layers': 1, 'dropout_rate': 0.4548190278104528, 'global_pooling': 'mean', 'learning_rate': 0.001268214916310638, 'weight_decay': 0.0002606443189640342, 'beta_0': 0.852624016877499, 'beta_1': 0.9938483630422027, 'epsilon': 2.481126566125756e-06, 'balanced_loss': True, 'epochs': 193, 'early_stopping_patience': 20, 'plateau_patience': 17, 'plateau_divider': 3}. Best is trial 97 with value: 0.6752887550206477.
[I 2025-04-07 03:47:30,866] Trial 236 finished with value: 0.6388974316201417 and parameters: {'left_stride': 64, 'right_stride': 0, 'co_occurrence_pooling_operation': 'sum', 'embedding_pooling_operation': 'mean', 'window_size': 10, 'batch_size': 117, 'attention_heads': 12, 'hidden_dimension': 227, 'number_of_hidden_layers': 1, 'dropout_rate': 0.45818374692068675, 'global_pooling': 'mean', 'learning_rate': 0.0010246723053190234, 'weight_decay': 0.00029511755262781467, 'beta_0': 0.8552350805310786, 'beta_1': 0.9936104896682952, 'epsilon': 2.8611984925628558e-06, 'balanced_loss': True, 'epochs': 200, 'early_stopping_patience': 20, 'plateau_patience': 17, 'plateau_divider': 3}. Best is trial 97 with value: 0.6752887550206477.
[I 2025-04-07 04:10:47,671] Trial 237 finished with value: 0.6592989237151009 and parameters: {'left_stride': 64, 'right_stride': 0, 'co_occurrence_pooling_operation': 'sum', 'embedding_pooling_operation': 'mean', 'window_size': 10, 'batch_size': 124, 'attention_heads': 12, 'hidden_dimension': 232, 'number_of_hidden_layers': 1, 'dropout_rate': 0.44217952997804216, 'global_pooling': 'mean', 'learning_rate': 0.0017897406176348488, 'weight_decay': 0.00026112408309435345, 'beta_0': 0.8511347599457598, 'beta_1': 0.9947004260523841, 'epsilon': 3.7479449810177828e-06, 'balanced_loss': True, 'epochs': 195, 'early_stopping_patience': 21, 'plateau_patience': 17, 'plateau_divider': 3}. Best is trial 97 with value: 0.6752887550206477.
[I 2025-04-07 04:33:51,715] Trial 238 finished with value: 0.6616502787136119 and parameters: {'left_stride': 64, 'right_stride': 0, 'co_occurrence_pooling_operation': 'sum', 'embedding_pooling_operation': 'mean', 'window_size': 10, 'batch_size': 120, 'attention_heads': 12, 'hidden_dimension': 238, 'number_of_hidden_layers': 1, 'dropout_rate': 0.4484340377366329, 'global_pooling': 'mean', 'learning_rate': 0.0013125366431071032, 'weight_decay': 0.0003280092003100229, 'beta_0': 0.8534445174879184, 'beta_1': 0.9940828012264379, 'epsilon': 2.212516850435596e-06, 'balanced_loss': True, 'epochs': 189, 'early_stopping_patience': 21, 'plateau_patience': 17, 'plateau_divider': 3}. Best is trial 97 with value: 0.6752887550206477.
[I 2025-04-07 04:57:15,561] Trial 239 finished with value: 0.6549036939311655 and parameters: {'left_stride': 64, 'right_stride': 0, 'co_occurrence_pooling_operation': 'sum', 'embedding_pooling_operation': 'mean', 'window_size': 10, 'batch_size': 120, 'attention_heads': 12, 'hidden_dimension': 237, 'number_of_hidden_layers': 1, 'dropout_rate': 0.46208737117739307, 'global_pooling': 'mean', 'learning_rate': 0.0013255112991164052, 'weight_decay': 0.0002204088493584593, 'beta_0': 0.8539102103152961, 'beta_1': 0.9941472550703939, 'epsilon': 2.5087590658710396e-06, 'balanced_loss': True, 'epochs': 189, 'early_stopping_patience': 21, 'plateau_patience': 18, 'plateau_divider': 3}. Best is trial 97 with value: 0.6752887550206477.
[I 2025-04-07 05:21:35,853] Trial 240 finished with value: 0.654682177922038 and parameters: {'left_stride': 64, 'right_stride': 0, 'co_occurrence_pooling_operation': 'sum', 'embedding_pooling_operation': 'mean', 'window_size': 10, 'batch_size': 122, 'attention_heads': 12, 'hidden_dimension': 242, 'number_of_hidden_layers': 1, 'dropout_rate': 0.4560296880833644, 'global_pooling': 'mean', 'learning_rate': 0.0011185543886969207, 'weight_decay': 0.00034346010974638567, 'beta_0': 0.8566333207379528, 'beta_1': 0.9935569900091021, 'epsilon': 9.085499418584531e-05, 'balanced_loss': True, 'epochs': 186, 'early_stopping_patience': 21, 'plateau_patience': 17, 'plateau_divider': 3}. Best is trial 97 with value: 0.6752887550206477.
[I 2025-04-07 05:45:14,778] Trial 241 finished with value: 0.66084573882192 and parameters: {'left_stride': 64, 'right_stride': 0, 'co_occurrence_pooling_operation': 'sum', 'embedding_pooling_operation': 'mean', 'window_size': 10, 'batch_size': 118, 'attention_heads': 12, 'hidden_dimension': 246, 'number_of_hidden_layers': 1, 'dropout_rate': 0.44955491417641547, 'global_pooling': 'mean', 'learning_rate': 0.002017245311854126, 'weight_decay': 0.0002920946931367672, 'beta_0': 0.8530456666343865, 'beta_1': 0.9944938465961808, 'epsilon': 2.9807851499037805e-06, 'balanced_loss': True, 'epochs': 191, 'early_stopping_patience': 20, 'plateau_patience': 17, 'plateau_divider': 3}. Best is trial 97 with value: 0.6752887550206477.
[I 2025-04-07 06:08:36,882] Trial 242 finished with value: 0.6566916328192598 and parameters: {'left_stride': 64, 'right_stride': 0, 'co_occurrence_pooling_operation': 'sum', 'embedding_pooling_operation': 'mean', 'window_size': 10, 'batch_size': 115, 'attention_heads': 12, 'hidden_dimension': 246, 'number_of_hidden_layers': 1, 'dropout_rate': 0.4477184901184247, 'global_pooling': 'mean', 'learning_rate': 0.0028143622682545574, 'weight_decay': 0.00038937343515261244, 'beta_0': 0.8558854974021436, 'beta_1': 0.9948467055611947, 'epsilon': 2.2409955738716373e-06, 'balanced_loss': True, 'epochs': 191, 'early_stopping_patience': 21, 'plateau_patience': 17, 'plateau_divider': 3}. Best is trial 97 with value: 0.6752887550206477.
[I 2025-04-07 06:33:07,264] Trial 243 finished with value: 0.6350428335092689 and parameters: {'left_stride': 64, 'right_stride': 0, 'co_occurrence_pooling_operation': 'sum', 'embedding_pooling_operation': 'mean', 'window_size': 10, 'batch_size': 119, 'attention_heads': 13, 'hidden_dimension': 251, 'number_of_hidden_layers': 1, 'dropout_rate': 0.45346580017897886, 'global_pooling': 'mean', 'learning_rate': 0.0022928963107135135, 'weight_decay': 0.000298278281085999, 'beta_0': 0.8534909115451714, 'beta_1': 0.9944663502058103, 'epsilon': 3.159777251395209e-06, 'balanced_loss': True, 'epochs': 187, 'early_stopping_patience': 22, 'plateau_patience': 17, 'plateau_divider': 3}. Best is trial 97 with value: 0.6752887550206477.
[I 2025-04-07 06:56:19,248] Trial 244 finished with value: 0.6407043137538776 and parameters: {'left_stride': 64, 'right_stride': 0, 'co_occurrence_pooling_operation': 'sum', 'embedding_pooling_operation': 'mean', 'window_size': 9, 'batch_size': 116, 'attention_heads': 13, 'hidden_dimension': 245, 'number_of_hidden_layers': 1, 'dropout_rate': 0.44825358595743037, 'global_pooling': 'mean', 'learning_rate': 0.0019563741789201095, 'weight_decay': 0.00030966117325828026, 'beta_0': 0.8592446480869815, 'beta_1': 0.9941121982060132, 'epsilon': 3.6976091537470746e-06, 'balanced_loss': True, 'epochs': 189, 'early_stopping_patience': 21, 'plateau_patience': 18, 'plateau_divider': 3}. Best is trial 97 with value: 0.6752887550206477.
[I 2025-04-07 07:19:14,969] Trial 245 finished with value: 0.6428144778725945 and parameters: {'left_stride': 64, 'right_stride': 0, 'co_occurrence_pooling_operation': 'sum', 'embedding_pooling_operation': 'min', 'window_size': 10, 'batch_size': 121, 'attention_heads': 12, 'hidden_dimension': 237, 'number_of_hidden_layers': 1, 'dropout_rate': 0.45042262478944706, 'global_pooling': 'mean', 'learning_rate': 0.0015769295636877214, 'weight_decay': 0.0009991515344212616, 'beta_0': 0.8531218400385094, 'beta_1': 0.9949275468346156, 'epsilon': 2.1596600424695755e-06, 'balanced_loss': True, 'epochs': 125, 'early_stopping_patience': 20, 'plateau_patience': 17, 'plateau_divider': 3}. Best is trial 97 with value: 0.6752887550206477.
[I 2025-04-07 07:42:17,693] Trial 246 finished with value: 0.6586994150007502 and parameters: {'left_stride': 64, 'right_stride': 0, 'co_occurrence_pooling_operation': 'sum', 'embedding_pooling_operation': 'mean', 'window_size': 10, 'batch_size': 126, 'attention_heads': 12, 'hidden_dimension': 232, 'number_of_hidden_layers': 1, 'dropout_rate': 0.4380101199120765, 'global_pooling': 'mean', 'learning_rate': 0.000989901689297304, 'weight_decay': 0.00027050680210163874, 'beta_0': 0.8495130949307722, 'beta_1': 0.9939320337699241, 'epsilon': 2.8698975911585664e-06, 'balanced_loss': True, 'epochs': 193, 'early_stopping_patience': 20, 'plateau_patience': 17, 'plateau_divider': 3}. Best is trial 97 with value: 0.6752887550206477.
[I 2025-04-07 08:05:01,354] Trial 247 finished with value: 0.6556877236846159 and parameters: {'left_stride': 64, 'right_stride': 0, 'co_occurrence_pooling_operation': 'sum', 'embedding_pooling_operation': 'mean', 'window_size': 10, 'batch_size': 123, 'attention_heads': 12, 'hidden_dimension': 239, 'number_of_hidden_layers': 1, 'dropout_rate': 0.44161323763064164, 'global_pooling': 'mean', 'learning_rate': 0.0014215169935343503, 'weight_decay': 0.00033953113602721, 'beta_0': 0.8468884010996197, 'beta_1': 0.9936346218936095, 'epsilon': 4.643255382491991e-06, 'balanced_loss': True, 'epochs': 185, 'early_stopping_patience': 20, 'plateau_patience': 16, 'plateau_divider': 3}. Best is trial 97 with value: 0.6752887550206477.
[I 2025-04-07 08:28:17,774] Trial 248 finished with value: 0.6462777977124016 and parameters: {'left_stride': 64, 'right_stride': 0, 'co_occurrence_pooling_operation': 'sum', 'embedding_pooling_operation': 'mean', 'window_size': 10, 'batch_size': 118, 'attention_heads': 12, 'hidden_dimension': 250, 'number_of_hidden_layers': 1, 'dropout_rate': 0.4649080033378039, 'global_pooling': 'mean', 'learning_rate': 0.001897536337616475, 'weight_decay': 0.00023326011421356626, 'beta_0': 0.8518119971667969, 'beta_1': 0.9945074384661461, 'epsilon': 2.9210992611542443e-06, 'balanced_loss': True, 'epochs': 192, 'early_stopping_patience': 20, 'plateau_patience': 17, 'plateau_divider': 3}. Best is trial 97 with value: 0.6752887550206477.
[I 2025-04-07 08:52:06,348] Trial 249 finished with value: 0.6460946577006759 and parameters: {'left_stride': 64, 'right_stride': 0, 'co_occurrence_pooling_operation': 'sum', 'embedding_pooling_operation': 'mean', 'window_size': 10, 'batch_size': 120, 'attention_heads': 12, 'hidden_dimension': 229, 'number_of_hidden_layers': 1, 'dropout_rate': 0.4691084125643439, 'global_pooling': 'mean', 'learning_rate': 0.0012913563858611774, 'weight_decay': 0.0001930066895838, 'beta_0': 0.8567086654707617, 'beta_1': 0.9938899295149626, 'epsilon': 3.5315857691836784e-06, 'balanced_loss': True, 'epochs': 196, 'early_stopping_patience': 21, 'plateau_patience': 16, 'plateau_divider': 3}. Best is trial 97 with value: 0.6752887550206477.
[I 2025-04-07 09:15:35,859] Trial 250 finished with value: 0.6462154284668753 and parameters: {'left_stride': 64, 'right_stride': 0, 'co_occurrence_pooling_operation': 'sum', 'embedding_pooling_operation': 'mean', 'window_size': 10, 'batch_size': 118, 'attention_heads': 12, 'hidden_dimension': 241, 'number_of_hidden_layers': 1, 'dropout_rate': 0.4604645110573133, 'global_pooling': 'mean', 'learning_rate': 0.0008967178604242778, 'weight_decay': 0.0002532868188631928, 'beta_0': 0.8486403931237948, 'beta_1': 0.9932350059954375, 'epsilon': 2.6244879309292765e-06, 'balanced_loss': True, 'epochs': 188, 'early_stopping_patience': 20, 'plateau_patience': 16, 'plateau_divider': 3}. Best is trial 97 with value: 0.6752887550206477.
[I 2025-04-07 09:39:21,838] Trial 251 finished with value: 0.6543768788758166 and parameters: {'left_stride': 64, 'right_stride': 0, 'co_occurrence_pooling_operation': 'sum', 'embedding_pooling_operation': 'mean', 'window_size': 10, 'batch_size': 124, 'attention_heads': 13, 'hidden_dimension': 235, 'number_of_hidden_layers': 1, 'dropout_rate': 0.43057195590967656, 'global_pooling': 'mean', 'learning_rate': 0.0011100836157515142, 'weight_decay': 0.0008743066891490619, 'beta_0': 0.8555474080891089, 'beta_1': 0.9942615785216034, 'epsilon': 5.161469897984751e-06, 'balanced_loss': True, 'epochs': 191, 'early_stopping_patience': 21, 'plateau_patience': 16, 'plateau_divider': 3}. Best is trial 97 with value: 0.6752887550206477.
[I 2025-04-07 10:02:17,714] Trial 252 finished with value: 0.6573421071335787 and parameters: {'left_stride': 64, 'right_stride': 0, 'co_occurrence_pooling_operation': 'sum', 'embedding_pooling_operation': 'mean', 'window_size': 10, 'batch_size': 128, 'attention_heads': 12, 'hidden_dimension': 224, 'number_of_hidden_layers': 1, 'dropout_rate': 0.44986289999365725, 'global_pooling': 'mean', 'learning_rate': 0.0016954303403164432, 'weight_decay': 0.000383329605009939, 'beta_0': 0.8520856456101817, 'beta_1': 0.993450561966736, 'epsilon': 3.961741244188447e-06, 'balanced_loss': True, 'epochs': 195, 'early_stopping_patience': 20, 'plateau_patience': 18, 'plateau_divider': 3}. Best is trial 97 with value: 0.6752887550206477.
[I 2025-04-07 10:24:05,587] Trial 253 finished with value: 0.6465977347406429 and parameters: {'left_stride': 128, 'right_stride': 0, 'co_occurrence_pooling_operation': 'sum', 'embedding_pooling_operation': 'mean', 'window_size': 10, 'batch_size': 121, 'attention_heads': 12, 'hidden_dimension': 247, 'number_of_hidden_layers': 1, 'dropout_rate': 0.47157399845354736, 'global_pooling': 'mean', 'learning_rate': 0.001372431784948029, 'weight_decay': 0.00030236093095682665, 'beta_0': 0.8503074107949459, 'beta_1': 0.9938345846389777, 'epsilon': 3.36139250117249e-06, 'balanced_loss': True, 'epochs': 185, 'early_stopping_patience': 14, 'plateau_patience': 18, 'plateau_divider': 3}. Best is trial 97 with value: 0.6752887550206477.
[I 2025-04-07 10:48:08,932] Trial 254 finished with value: 0.6575751843391174 and parameters: {'left_stride': 0, 'right_stride': 128, 'co_occurrence_pooling_operation': 'sum', 'embedding_pooling_operation': 'mean', 'window_size': 10, 'batch_size': 126, 'attention_heads': 13, 'hidden_dimension': 238, 'number_of_hidden_layers': 1, 'dropout_rate': 0.4430708878102082, 'global_pooling': 'mean', 'learning_rate': 0.0008451028761067288, 'weight_decay': 0.00022896757345281573, 'beta_0': 0.8583150619437695, 'beta_1': 0.9944825664238994, 'epsilon': 2.1144330810531044e-06, 'balanced_loss': True, 'epochs': 183, 'early_stopping_patience': 20, 'plateau_patience': 16, 'plateau_divider': 3}. Best is trial 97 with value: 0.6752887550206477.
