[I 2025-04-06 14:10:26,977] Trial 201 finished with value: 0.6169301246929756 and parameters: {'left_stride': 32, 'right_stride': 256, 'co_occurrence_pooling_operation': 'sum', 'embedding_pooling_operation': 'min', 'window_size': 10, 'batch_size': 91, 'attention_heads': 12, 'hidden_dimension': 253, 'number_of_hidden_layers': 1, 'dropout_rate': 0.5229194985061034, 'global_pooling': 'mean', 'learning_rate': 0.0008685462336991377, 'weight_decay': 0.00030866648223084426, 'beta_0': 0.8553037594966293, 'beta_1': 0.9929952888316275, 'epsilon': 5.418015215024391e-06, 'balanced_loss': True, 'epochs': 185, 'early_stopping_patience': 18, 'plateau_patience': 15, 'plateau_divider': 3}. Best is trial 97 with value: 0.6752887550206477.
[I 2025-04-06 14:30:50,348] Trial 202 finished with value: 0.6284530849723061 and parameters: {'left_stride': 32, 'right_stride': 256, 'co_occurrence_pooling_operation': 'sum', 'embedding_pooling_operation': 'mean', 'window_size': 8, 'batch_size': 87, 'attention_heads': 12, 'hidden_dimension': 244, 'number_of_hidden_layers': 1, 'dropout_rate': 0.5068576335964747, 'global_pooling': 'mean', 'learning_rate': 0.0020632440029891685, 'weight_decay': 0.00044038982206429285, 'beta_0': 0.850404703248439, 'beta_1': 0.994474415307105, 'epsilon': 3.3370451301958298e-06, 'balanced_loss': True, 'epochs': 191, 'early_stopping_patience': 18, 'plateau_patience': 14, 'plateau_divider': 4}. Best is trial 97 with value: 0.6752887550206477.
[I 2025-04-06 14:54:25,357] Trial 203 finished with value: 0.6603472911251831 and parameters: {'left_stride': 64, 'right_stride': 256, 'co_occurrence_pooling_operation': 'sum', 'embedding_pooling_operation': 'mean', 'window_size': 10, 'batch_size': 77, 'attention_heads': 12, 'hidden_dimension': 236, 'number_of_hidden_layers': 1, 'dropout_rate': 0.48325457679476086, 'global_pooling': 'mean', 'learning_rate': 0.0007450416379934712, 'weight_decay': 0.0007333604629598182, 'beta_0': 0.8528529299857251, 'beta_1': 0.9939006476497838, 'epsilon': 5.008806222533673e-06, 'balanced_loss': True, 'epochs': 184, 'early_stopping_patience': 19, 'plateau_patience': 15, 'plateau_divider': 3}. Best is trial 97 with value: 0.6752887550206477.
[I 2025-04-06 15:17:34,650] Trial 204 finished with value: 0.658887483402088 and parameters: {'left_stride': 64, 'right_stride': 256, 'co_occurrence_pooling_operation': 'sum', 'embedding_pooling_operation': 'mean', 'window_size': 10, 'batch_size': 76, 'attention_heads': 11, 'hidden_dimension': 235, 'number_of_hidden_layers': 1, 'dropout_rate': 0.4859654165477394, 'global_pooling': 'mean', 'learning_rate': 0.0006868770782127747, 'weight_decay': 0.0007619104668351484, 'beta_0': 0.8401583717866706, 'beta_1': 0.9925329320739692, 'epsilon': 7.273570176455937e-06, 'balanced_loss': True, 'epochs': 182, 'early_stopping_patience': 19, 'plateau_patience': 15, 'plateau_divider': 3}. Best is trial 97 with value: 0.6752887550206477.
[I 2025-04-06 15:38:47,049] Trial 205 finished with value: 0.633169320106067 and parameters: {'left_stride': 64, 'right_stride': 256, 'co_occurrence_pooling_operation': 'sum', 'embedding_pooling_operation': 'mean', 'window_size': 9, 'batch_size': 77, 'attention_heads': 11, 'hidden_dimension': 234, 'number_of_hidden_layers': 1, 'dropout_rate': 0.48037622531132385, 'global_pooling': 'mean', 'learning_rate': 0.0013436869581416248, 'weight_decay': 0.0009823879332383257, 'beta_0': 0.8389212933261875, 'beta_1': 0.9920800909778322, 'epsilon': 7.016397646492222e-06, 'balanced_loss': True, 'epochs': 182, 'early_stopping_patience': 20, 'plateau_patience': 15, 'plateau_divider': 3}. Best is trial 97 with value: 0.6752887550206477.
[I 2025-04-06 16:02:48,227] Trial 206 finished with value: 0.6587694686840678 and parameters: {'left_stride': 64, 'right_stride': 256, 'co_occurrence_pooling_operation': 'sum', 'embedding_pooling_operation': 'mean', 'window_size': 10, 'batch_size': 74, 'attention_heads': 12, 'hidden_dimension': 244, 'number_of_hidden_layers': 1, 'dropout_rate': 0.4760555173719796, 'global_pooling': 'mean', 'learning_rate': 0.0006860647899770002, 'weight_decay': 0.0007684556127605369, 'beta_0': 0.840846437233681, 'beta_1': 0.9925605866686978, 'epsilon': 5.810836649316275e-06, 'balanced_loss': True, 'epochs': 183, 'early_stopping_patience': 19, 'plateau_patience': 15, 'plateau_divider': 3}. Best is trial 97 with value: 0.6752887550206477.
[I 2025-04-06 16:26:06,187] Trial 207 finished with value: 0.6471281260819479 and parameters: {'left_stride': 64, 'right_stride': 256, 'co_occurrence_pooling_operation': 'sum', 'embedding_pooling_operation': 'mean', 'window_size': 10, 'batch_size': 73, 'attention_heads': 12, 'hidden_dimension': 244, 'number_of_hidden_layers': 1, 'dropout_rate': 0.48485010094692255, 'global_pooling': 'mean', 'learning_rate': 0.0007546488268343013, 'weight_decay': 0.0007417666730571847, 'beta_0': 0.8414876034785955, 'beta_1': 0.9915462335375701, 'epsilon': 5.994918605989049e-06, 'balanced_loss': True, 'epochs': 181, 'early_stopping_patience': 19, 'plateau_patience': 15, 'plateau_divider': 3}. Best is trial 97 with value: 0.6752887550206477.
[I 2025-04-06 16:49:50,618] Trial 208 finished with value: 0.6573204946398344 and parameters: {'left_stride': 64, 'right_stride': 256, 'co_occurrence_pooling_operation': 'sum', 'embedding_pooling_operation': 'mean', 'window_size': 10, 'batch_size': 79, 'attention_heads': 12, 'hidden_dimension': 249, 'number_of_hidden_layers': 1, 'dropout_rate': 0.47358524931737483, 'global_pooling': 'mean', 'learning_rate': 0.0007608369057287913, 'weight_decay': 0.000698551720517197, 'beta_0': 0.8362422357674791, 'beta_1': 0.9927550720729539, 'epsilon': 7.535947113419852e-06, 'balanced_loss': True, 'epochs': 185, 'early_stopping_patience': 20, 'plateau_patience': 15, 'plateau_divider': 3}. Best is trial 97 with value: 0.6752887550206477.
[I 2025-04-06 17:13:32,984] Trial 209 finished with value: 0.6509216829869835 and parameters: {'left_stride': 64, 'right_stride': 256, 'co_occurrence_pooling_operation': 'sum', 'embedding_pooling_operation': 'mean', 'window_size': 10, 'batch_size': 77, 'attention_heads': 12, 'hidden_dimension': 252, 'number_of_hidden_layers': 1, 'dropout_rate': 0.46980925363042836, 'global_pooling': 'mean', 'learning_rate': 0.0011373545853910073, 'weight_decay': 0.0006782496365670071, 'beta_0': 0.8368287523719063, 'beta_1': 0.9923037167836691, 'epsilon': 8.199074155226858e-06, 'balanced_loss': True, 'epochs': 175, 'early_stopping_patience': 20, 'plateau_patience': 15, 'plateau_divider': 3}. Best is trial 97 with value: 0.6752887550206477.
[I 2025-04-06 17:36:03,342] Trial 210 finished with value: 0.6549262000769283 and parameters: {'left_stride': 64, 'right_stride': 256, 'co_occurrence_pooling_operation': 'sum', 'embedding_pooling_operation': 'mean', 'window_size': 10, 'batch_size': 76, 'attention_heads': 11, 'hidden_dimension': 240, 'number_of_hidden_layers': 1, 'dropout_rate': 0.480554848559124, 'global_pooling': 'mean', 'learning_rate': 0.000830223593153352, 'weight_decay': 0.0008250833871724492, 'beta_0': 0.8329229448559508, 'beta_1': 0.9929468933433707, 'epsilon': 6.059706611907865e-06, 'balanced_loss': True, 'epochs': 184, 'early_stopping_patience': 19, 'plateau_patience': 16, 'plateau_divider': 3}. Best is trial 97 with value: 0.6752887550206477.
[I 2025-04-06 17:58:59,716] Trial 211 finished with value: 0.6508640851845119 and parameters: {'left_stride': 64, 'right_stride': 256, 'co_occurrence_pooling_operation': 'sum', 'embedding_pooling_operation': 'mean', 'window_size': 10, 'batch_size': 71, 'attention_heads': 12, 'hidden_dimension': 247, 'number_of_hidden_layers': 1, 'dropout_rate': 0.45803485161417196, 'global_pooling': 'mean', 'learning_rate': 0.0006808008016012161, 'weight_decay': 0.0006061702934679315, 'beta_0': 0.8351248897574772, 'beta_1': 0.9927349625079157, 'epsilon': 5.404242380617056e-06, 'balanced_loss': True, 'epochs': 187, 'early_stopping_patience': 19, 'plateau_patience': 15, 'plateau_divider': 3}. Best is trial 97 with value: 0.6752887550206477.
[I 2025-04-06 18:22:52,238] Trial 212 finished with value: 0.666979267274665 and parameters: {'left_stride': 64, 'right_stride': 256, 'co_occurrence_pooling_operation': 'sum', 'embedding_pooling_operation': 'mean', 'window_size': 10, 'batch_size': 79, 'attention_heads': 12, 'hidden_dimension': 256, 'number_of_hidden_layers': 1, 'dropout_rate': 0.47448411425222875, 'global_pooling': 'mean', 'learning_rate': 0.001792279834820889, 'weight_decay': 0.0008877406245555589, 'beta_0': 0.8400060630439692, 'beta_1': 0.993542760523593, 'epsilon': 4.41269147875367e-06, 'balanced_loss': True, 'epochs': 182, 'early_stopping_patience': 20, 'plateau_patience': 15, 'plateau_divider': 3}. Best is trial 97 with value: 0.6752887550206477.
[I 2025-04-06 18:46:10,305] Trial 213 finished with value: 0.6740863756298038 and parameters: {'left_stride': 64, 'right_stride': 256, 'co_occurrence_pooling_operation': 'sum', 'embedding_pooling_operation': 'mean', 'window_size': 10, 'batch_size': 80, 'attention_heads': 12, 'hidden_dimension': 239, 'number_of_hidden_layers': 1, 'dropout_rate': 0.4926344878827239, 'global_pooling': 'mean', 'learning_rate': 0.001721192869397909, 'weight_decay': 0.0008603241024833935, 'beta_0': 0.8402088022536262, 'beta_1': 0.9934866458139923, 'epsilon': 1.3699579502588286e-05, 'balanced_loss': True, 'epochs': 180, 'early_stopping_patience': 19, 'plateau_patience': 15, 'plateau_divider': 3}. Best is trial 97 with value: 0.6752887550206477.
[I 2025-04-06 19:08:48,820] Trial 214 finished with value: 0.6449646205739612 and parameters: {'left_stride': 64, 'right_stride': 256, 'co_occurrence_pooling_operation': 'sum', 'embedding_pooling_operation': 'mean', 'window_size': 10, 'batch_size': 80, 'attention_heads': 12, 'hidden_dimension': 236, 'number_of_hidden_layers': 1, 'dropout_rate': 0.48702706354282205, 'global_pooling': 'mean', 'learning_rate': 0.0017486389116727562, 'weight_decay': 0.0008642233040429696, 'beta_0': 0.8445400458367078, 'beta_1': 0.9933446182049918, 'epsilon': 1.0685996825771553e-05, 'balanced_loss': True, 'epochs': 177, 'early_stopping_patience': 19, 'plateau_patience': 15, 'plateau_divider': 3}. Best is trial 97 with value: 0.6752887550206477.
[I 2025-04-06 19:31:56,949] Trial 215 finished with value: 0.6337396951611362 and parameters: {'left_stride': 64, 'right_stride': 256, 'co_occurrence_pooling_operation': 'sum', 'embedding_pooling_operation': 'mean', 'window_size': 10, 'batch_size': 81, 'attention_heads': 11, 'hidden_dimension': 230, 'number_of_hidden_layers': 1, 'dropout_rate': 0.5013405634348597, 'global_pooling': 'mean', 'learning_rate': 0.0020326203512147124, 'weight_decay': 0.0009153759873932338, 'beta_0': 0.8387281266546547, 'beta_1': 0.9937706560452141, 'epsilon': 1.3913775653133015e-05, 'balanced_loss': True, 'epochs': 180, 'early_stopping_patience': 20, 'plateau_patience': 16, 'plateau_divider': 3}. Best is trial 97 with value: 0.6752887550206477.
[I 2025-04-06 19:55:36,151] Trial 216 finished with value: 0.6641196533522784 and parameters: {'left_stride': 64, 'right_stride': 256, 'co_occurrence_pooling_operation': 'sum', 'embedding_pooling_operation': 'mean', 'window_size': 10, 'batch_size': 75, 'attention_heads': 12, 'hidden_dimension': 256, 'number_of_hidden_layers': 1, 'dropout_rate': 0.47428830242434544, 'global_pooling': 'mean', 'learning_rate': 0.001661743523916325, 'weight_decay': 0.0007629238929907018, 'beta_0': 0.842811860578469, 'beta_1': 0.9932756069614832, 'epsilon': 4.181165841937902e-06, 'balanced_loss': True, 'epochs': 182, 'early_stopping_patience': 19, 'plateau_patience': 15, 'plateau_divider': 3}. Best is trial 97 with value: 0.6752887550206477.
[I 2025-04-06 20:21:53,695] Trial 217 finished with value: 0.6530186569558707 and parameters: {'left_stride': 64, 'right_stride': 256, 'co_occurrence_pooling_operation': 'sum', 'embedding_pooling_operation': 'mean', 'window_size': 10, 'batch_size': 75, 'attention_heads': 12, 'hidden_dimension': 256, 'number_of_hidden_layers': 1, 'dropout_rate': 0.49437085082012405, 'global_pooling': 'mean', 'learning_rate': 0.0015427553934793947, 'weight_decay': 0.0009993863412603398, 'beta_0': 0.8297139419260369, 'beta_1': 0.9932962937825116, 'epsilon': 4.224118427944408e-06, 'balanced_loss': True, 'epochs': 181, 'early_stopping_patience': 20, 'plateau_patience': 15, 'plateau_divider': 3}. Best is trial 97 with value: 0.6752887550206477.
[I 2025-04-06 20:45:41,294] Trial 218 finished with value: 0.6380110474427969 and parameters: {'left_stride': 64, 'right_stride': 256, 'co_occurrence_pooling_operation': 'sum', 'embedding_pooling_operation': 'mean', 'window_size': 10, 'batch_size': 69, 'attention_heads': 11, 'hidden_dimension': 251, 'number_of_hidden_layers': 1, 'dropout_rate': 0.4912666759011189, 'global_pooling': 'mean', 'learning_rate': 0.002349531625380353, 'weight_decay': 0.0007616577600931597, 'beta_0': 0.8403403595761485, 'beta_1': 0.9935557327403574, 'epsilon': 1.9442905549468443e-05, 'balanced_loss': True, 'epochs': 173, 'early_stopping_patience': 19, 'plateau_patience': 15, 'plateau_divider': 3}. Best is trial 97 with value: 0.6752887550206477.
[I 2025-04-06 21:08:33,880] Trial 219 finished with value: 0.6464669578881678 and parameters: {'left_stride': 64, 'right_stride': 256, 'co_occurrence_pooling_operation': 'sum', 'embedding_pooling_operation': 'mean', 'window_size': 10, 'batch_size': 78, 'attention_heads': 12, 'hidden_dimension': 237, 'number_of_hidden_layers': 1, 'dropout_rate': 0.48190606936582625, 'global_pooling': 'mean', 'learning_rate': 0.0027288615144667946, 'weight_decay': 0.0006448181513647666, 'beta_0': 0.8426159357484112, 'beta_1': 0.9940700917249832, 'epsilon': 3.3356340604145627e-06, 'balanced_loss': True, 'epochs': 187, 'early_stopping_patience': 19, 'plateau_patience': 15, 'plateau_divider': 3}. Best is trial 97 with value: 0.6752887550206477.
[I 2025-04-06 21:31:52,675] Trial 220 finished with value: 0.635603717622876 and parameters: {'left_stride': 64, 'right_stride': 256, 'co_occurrence_pooling_operation': 'sum', 'embedding_pooling_operation': 'mean', 'window_size': 10, 'batch_size': 72, 'attention_heads': 12, 'hidden_dimension': 242, 'number_of_hidden_layers': 1, 'dropout_rate': 0.4895126185653149, 'global_pooling': 'mean', 'learning_rate': 0.0018148650180458967, 'weight_decay': 0.0008638352754146149, 'beta_0': 0.8436757352536743, 'beta_1': 0.9930575599091996, 'epsilon': 1.3111681732009681e-05, 'balanced_loss': True, 'epochs': 178, 'early_stopping_patience': 19, 'plateau_patience': 14, 'plateau_divider': 3}. Best is trial 97 with value: 0.6752887550206477.
[I 2025-04-06 21:54:51,962] Trial 221 finished with value: 0.6450948858078756 and parameters: {'left_stride': 64, 'right_stride': 256, 'co_occurrence_pooling_operation': 'sum', 'embedding_pooling_operation': 'mean', 'window_size': 10, 'batch_size': 84, 'attention_heads': 12, 'hidden_dimension': 254, 'number_of_hidden_layers': 1, 'dropout_rate': 0.475490444831301, 'global_pooling': 'mean', 'learning_rate': 0.0014026761873830633, 'weight_decay': 0.0005480570438250084, 'beta_0': 0.8268590241651405, 'beta_1': 0.9943914424673232, 'epsilon': 4.608360748867632e-06, 'balanced_loss': True, 'epochs': 194, 'early_stopping_patience': 18, 'plateau_patience': 15, 'plateau_divider': 3}. Best is trial 97 with value: 0.6752887550206477.
[I 2025-04-06 22:17:17,209] Trial 222 finished with value: 0.657795547146046 and parameters: {'left_stride': 64, 'right_stride': 256, 'co_occurrence_pooling_operation': 'sum', 'embedding_pooling_operation': 'mean', 'window_size': 10, 'batch_size': 82, 'attention_heads': 11, 'hidden_dimension': 230, 'number_of_hidden_layers': 1, 'dropout_rate': 0.49792326540850457, 'global_pooling': 'mean', 'learning_rate': 0.0015460275181796545, 'weight_decay': 0.0007689351415865271, 'beta_0': 0.8457690571347927, 'beta_1': 0.9935995168658548, 'epsilon': 3.566827730595107e-05, 'balanced_loss': True, 'epochs': 189, 'early_stopping_patience': 19, 'plateau_patience': 16, 'plateau_divider': 3}. Best is trial 97 with value: 0.6752887550206477.
[I 2025-04-06 22:41:18,626] Trial 223 finished with value: 0.666133272586109 and parameters: {'left_stride': 64, 'right_stride': 256, 'co_occurrence_pooling_operation': 'sum', 'embedding_pooling_operation': 'mean', 'window_size': 10, 'batch_size': 78, 'attention_heads': 13, 'hidden_dimension': 233, 'number_of_hidden_layers': 1, 'dropout_rate': 0.46360963590165893, 'global_pooling': 'mean', 'learning_rate': 0.0010170038727115324, 'weight_decay': 0.0009183782878880814, 'beta_0': 0.8472483244614508, 'beta_1': 0.9931146580151594, 'epsilon': 3.844193061316375e-06, 'balanced_loss': True, 'epochs': 183, 'early_stopping_patience': 20, 'plateau_patience': 16, 'plateau_divider': 3}. Best is trial 97 with value: 0.6752887550206477.
[I 2025-04-06 23:05:38,054] Trial 224 finished with value: 0.647062948832675 and parameters: {'left_stride': 64, 'right_stride': 256, 'co_occurrence_pooling_operation': 'sum', 'embedding_pooling_operation': 'mean', 'window_size': 10, 'batch_size': 78, 'attention_heads': 13, 'hidden_dimension': 234, 'number_of_hidden_layers': 1, 'dropout_rate': 0.4656179593102272, 'global_pooling': 'mean', 'learning_rate': 0.0010267079137124013, 'weight_decay': 0.0007021058463992691, 'beta_0': 0.8472325217995842, 'beta_1': 0.9925166798749406, 'epsilon': 4.097280130657335e-06, 'balanced_loss': True, 'epochs': 170, 'early_stopping_patience': 20, 'plateau_patience': 16, 'plateau_divider': 4}. Best is trial 97 with value: 0.6752887550206477.
[I 2025-04-06 23:30:17,754] Trial 225 finished with value: 0.6454692909360612 and parameters: {'left_stride': 64, 'right_stride': 256, 'co_occurrence_pooling_operation': 'sum', 'embedding_pooling_operation': 'mean', 'window_size': 10, 'batch_size': 76, 'attention_heads': 13, 'hidden_dimension': 247, 'number_of_hidden_layers': 1, 'dropout_rate': 0.47093049482201105, 'global_pooling': 'mean', 'learning_rate': 0.0012003022490047826, 'weight_decay': 0.0008576433594206982, 'beta_0': 0.8438049099463284, 'beta_1': 0.9932379315258366, 'epsilon': 3.1843250107704557e-06, 'balanced_loss': True, 'epochs': 122, 'early_stopping_patience': 20, 'plateau_patience': 16, 'plateau_divider': 3}. Best is trial 97 with value: 0.6752887550206477.
[I 2025-04-06 23:54:26,052] Trial 226 finished with value: 0.6297009632739358 and parameters: {'left_stride': 64, 'right_stride': 256, 'co_occurrence_pooling_operation': 'sum', 'embedding_pooling_operation': 'mean', 'window_size': 10, 'batch_size': 80, 'attention_heads': 13, 'hidden_dimension': 226, 'number_of_hidden_layers': 1, 'dropout_rate': 0.483684458385282, 'global_pooling': 'mean', 'learning_rate': 0.00173273498149813, 'weight_decay': 0.000980397923625514, 'beta_0': 0.8377948800162552, 'beta_1': 0.9938574210468432, 'epsilon': 4.798977245290437e-06, 'balanced_loss': True, 'epochs': 184, 'early_stopping_patience': 21, 'plateau_patience': 15, 'plateau_divider': 3}. Best is trial 97 with value: 0.6752887550206477.
[I 2025-04-07 00:18:59,404] Trial 227 finished with value: 0.6528094351009919 and parameters: {'left_stride': 64, 'right_stride': 256, 'co_occurrence_pooling_operation': 'sum', 'embedding_pooling_operation': 'mean', 'window_size': 10, 'batch_size': 74, 'attention_heads': 12, 'hidden_dimension': 256, 'number_of_hidden_layers': 1, 'dropout_rate': 0.49354442477543525, 'global_pooling': 'mean', 'learning_rate': 0.0012321446526410485, 'weight_decay': 0.0008424423893115988, 'beta_0': 0.8485218272377599, 'beta_1': 0.9947162202692532, 'epsilon': 4.169882814869749e-06, 'balanced_loss': True, 'epochs': 182, 'early_stopping_patience': 21, 'plateau_patience': 14, 'plateau_divider': 3}. Best is trial 97 with value: 0.6752887550206477.
[I 2025-04-07 00:42:06,283] Trial 228 finished with value: 0.6512729748612172 and parameters: {'left_stride': 64, 'right_stride': 256, 'co_occurrence_pooling_operation': 'sum', 'embedding_pooling_operation': 'mean', 'window_size': 10, 'batch_size': 77, 'attention_heads': 12, 'hidden_dimension': 241, 'number_of_hidden_layers': 1, 'dropout_rate': 0.4660618755104164, 'global_pooling': 'mean', 'learning_rate': 0.002223036749961361, 'weight_decay': 0.0007564689440000991, 'beta_0': 0.8400535976813608, 'beta_1': 0.9932432618711368, 'epsilon': 3.669096326460667e-06, 'balanced_loss': True, 'epochs': 191, 'early_stopping_patience': 19, 'plateau_patience': 16, 'plateau_divider': 3}. Best is trial 97 with value: 0.6752887550206477.
[I 2025-04-07 01:03:40,245] Trial 229 finished with value: 0.6599898717351248 and parameters: {'left_stride': 64, 'right_stride': 256, 'co_occurrence_pooling_operation': 'sum', 'embedding_pooling_operation': 'mean', 'window_size': 10, 'batch_size': 124, 'attention_heads': 9, 'hidden_dimension': 235, 'number_of_hidden_layers': 1, 'dropout_rate': 0.47981548425294596, 'global_pooling': 'mean', 'learning_rate': 0.0009636910043898919, 'weight_decay': 0.0009162721619311084, 'beta_0': 0.8542343533658106, 'beta_1': 0.9941134982105087, 'epsilon': 3.568804055889426e-06, 'balanced_loss': True, 'epochs': 188, 'early_stopping_patience': 18, 'plateau_patience': 15, 'plateau_divider': 3}. Best is trial 97 with value: 0.6752887550206477.
[I 2025-04-07 01:27:19,551] Trial 230 finished with value: 0.6321790008048869 and parameters: {'left_stride': 64, 'right_stride': 256, 'co_occurrence_pooling_operation': 'sum', 'embedding_pooling_operation': 'mean', 'window_size': 10, 'batch_size': 125, 'attention_heads': 13, 'hidden_dimension': 239, 'number_of_hidden_layers': 1, 'dropout_rate': 0.4784656685472271, 'global_pooling': 'mean', 'learning_rate': 0.001013887845064161, 'weight_decay': 0.0006189023060848398, 'beta_0': 0.8545920548561124, 'beta_1': 0.9941318935568529, 'epsilon': 3.5292978354600174e-06, 'balanced_loss': True, 'epochs': 179, 'early_stopping_patience': 18, 'plateau_patience': 15, 'plateau_divider': 3}. Best is trial 97 with value: 0.6752887550206477.
