[I 2025-04-06 03:27:02,504] Using an existing study with name 'Ohsumed-GATv2-facebook-bart-large-Grouped-Sliding_Windows' instead of creating a new one.
[I 2025-04-06 03:45:42,159] Trial 172 finished with value: 0.6316243995471627 and parameters: {'left_stride': 64, 'right_stride': 128, 'co_occurrence_pooling_operation': 'sum', 'embedding_pooling_operation': 'mean', 'window_size': 10, 'batch_size': 93, 'attention_heads': 4, 'hidden_dimension': 203, 'number_of_hidden_layers': 1, 'dropout_rate': 0.5438471329985248, 'global_pooling': 'mean', 'learning_rate': 0.0004992562408382688, 'weight_decay': 5.2271452454822294e-05, 'beta_0': 0.8519851014465654, 'beta_1': 0.9986655485127044, 'epsilon': 8.464188343830304e-07, 'balanced_loss': True, 'epochs': 126, 'early_stopping_patience': 15, 'plateau_patience': 21, 'plateau_divider': 3}. Best is trial 97 with value: 0.6752887550206477.
[I 2025-04-06 04:08:06,779] Trial 173 finished with value: 0.6483514733620558 and parameters: {'left_stride': 32, 'right_stride': 64, 'co_occurrence_pooling_operation': 'sum', 'embedding_pooling_operation': 'mean', 'window_size': 9, 'batch_size': 83, 'attention_heads': 14, 'hidden_dimension': 233, 'number_of_hidden_layers': 1, 'dropout_rate': 0.5205438636380442, 'global_pooling': 'mean', 'learning_rate': 0.0014841645450455632, 'weight_decay': 0.0005246324395711742, 'beta_0': 0.8797472812511835, 'beta_1': 0.9951580519194182, 'epsilon': 2.840213800744645e-06, 'balanced_loss': True, 'epochs': 197, 'early_stopping_patience': 17, 'plateau_patience': 19, 'plateau_divider': 2}. Best is trial 97 with value: 0.6752887550206477.
[I 2025-04-06 04:28:27,989] Trial 174 finished with value: 0.636198770921591 and parameters: {'left_stride': 32, 'right_stride': 256, 'co_occurrence_pooling_operation': 'sum', 'embedding_pooling_operation': 'mean', 'window_size': 10, 'batch_size': 99, 'attention_heads': 10, 'hidden_dimension': 224, 'number_of_hidden_layers': 1, 'dropout_rate': 0.5650114087257804, 'global_pooling': 'mean', 'learning_rate': 0.0007747619133938151, 'weight_decay': 0.0008544874493876721, 'beta_0': 0.8488104679806235, 'beta_1': 0.9975654961239997, 'epsilon': 1.1091567491955045e-06, 'balanced_loss': True, 'epochs': 145, 'early_stopping_patience': 10, 'plateau_patience': 20, 'plateau_divider': 3}. Best is trial 97 with value: 0.6752887550206477.
[I 2025-04-06 04:48:44,066] Trial 175 finished with value: 0.6409976263466428 and parameters: {'left_stride': 64, 'right_stride': 256, 'co_occurrence_pooling_operation': 'sum', 'embedding_pooling_operation': 'mean', 'window_size': 10, 'batch_size': 94, 'attention_heads': 6, 'hidden_dimension': 211, 'number_of_hidden_layers': 1, 'dropout_rate': 0.49599271256154953, 'global_pooling': 'mean', 'learning_rate': 0.00031364184570884375, 'weight_decay': 0.000742285080017621, 'beta_0': 0.8779418532204789, 'beta_1': 0.985389920497518, 'epsilon': 1.4978661074146384e-06, 'balanced_loss': True, 'epochs': 193, 'early_stopping_patience': 16, 'plateau_patience': 21, 'plateau_divider': 3}. Best is trial 97 with value: 0.6752887550206477.
[I 2025-04-06 05:14:00,459] Trial 176 finished with value: 0.6644680675307887 and parameters: {'left_stride': 32, 'right_stride': 0, 'co_occurrence_pooling_operation': 'sum', 'embedding_pooling_operation': 'mean', 'window_size': 10, 'batch_size': 97, 'attention_heads': 12, 'hidden_dimension': 221, 'number_of_hidden_layers': 1, 'dropout_rate': 0.5261632483024227, 'global_pooling': 'mean', 'learning_rate': 0.0002503183871000548, 'weight_decay': 0.000389337070325819, 'beta_0': 0.8415291476064732, 'beta_1': 0.9932248281625761, 'epsilon': 3.815130313162321e-06, 'balanced_loss': True, 'epochs': 191, 'early_stopping_patience': 18, 'plateau_patience': 15, 'plateau_divider': 3}. Best is trial 97 with value: 0.6752887550206477.
[I 2025-04-06 05:37:35,303] Trial 177 finished with value: 0.6513205060318137 and parameters: {'left_stride': 32, 'right_stride': 0, 'co_occurrence_pooling_operation': 'sum', 'embedding_pooling_operation': 'mean', 'window_size': 10, 'batch_size': 97, 'attention_heads': 11, 'hidden_dimension': 218, 'number_of_hidden_layers': 1, 'dropout_rate': 0.5291787402303405, 'global_pooling': 'mean', 'learning_rate': 0.00027398968678422723, 'weight_decay': 0.000433829052096259, 'beta_0': 0.8460604463487487, 'beta_1': 0.9925260062016967, 'epsilon': 4.798094821936048e-06, 'balanced_loss': True, 'epochs': 191, 'early_stopping_patience': 18, 'plateau_patience': 15, 'plateau_divider': 3}. Best is trial 97 with value: 0.6752887550206477.
[I 2025-04-06 06:01:28,231] Trial 178 finished with value: 0.6615773772865161 and parameters: {'left_stride': 32, 'right_stride': 0, 'co_occurrence_pooling_operation': 'sum', 'embedding_pooling_operation': 'mean', 'window_size': 10, 'batch_size': 104, 'attention_heads': 13, 'hidden_dimension': 215, 'number_of_hidden_layers': 1, 'dropout_rate': 0.5175901454174983, 'global_pooling': 'mean', 'learning_rate': 0.0003783459470245015, 'weight_decay': 0.000264341735569147, 'beta_0': 0.8548923652424898, 'beta_1': 0.9932457329452568, 'epsilon': 3.761613116952254e-06, 'balanced_loss': True, 'epochs': 194, 'early_stopping_patience': 18, 'plateau_patience': 16, 'plateau_divider': 3}. Best is trial 97 with value: 0.6752887550206477.
[I 2025-04-06 06:24:31,871] Trial 179 finished with value: 0.6497843222253625 and parameters: {'left_stride': 32, 'right_stride': 0, 'co_occurrence_pooling_operation': 'sum', 'embedding_pooling_operation': 'mean', 'window_size': 10, 'batch_size': 105, 'attention_heads': 12, 'hidden_dimension': 222, 'number_of_hidden_layers': 1, 'dropout_rate': 0.5172725128500781, 'global_pooling': 'mean', 'learning_rate': 0.00039256813093884835, 'weight_decay': 0.0003234439443331063, 'beta_0': 0.8550091275937546, 'beta_1': 0.9933130912074704, 'epsilon': 1.4438024921821962e-07, 'balanced_loss': True, 'epochs': 194, 'early_stopping_patience': 18, 'plateau_patience': 17, 'plateau_divider': 3}. Best is trial 97 with value: 0.6752887550206477.
[I 2025-04-06 06:48:43,948] Trial 180 finished with value: 0.6484090121861995 and parameters: {'left_stride': 32, 'right_stride': 0, 'co_occurrence_pooling_operation': 'sum', 'embedding_pooling_operation': 'mean', 'window_size': 10, 'batch_size': 107, 'attention_heads': 13, 'hidden_dimension': 230, 'number_of_hidden_layers': 1, 'dropout_rate': 0.5097144400043995, 'global_pooling': 'mean', 'learning_rate': 0.00033126344532478995, 'weight_decay': 0.0002861677284309727, 'beta_0': 0.85866423100235, 'beta_1': 0.9928905198626461, 'epsilon': 3.1918588729759956e-06, 'balanced_loss': True, 'epochs': 187, 'early_stopping_patience': 18, 'plateau_patience': 16, 'plateau_divider': 3}. Best is trial 97 with value: 0.6752887550206477.
[I 2025-04-06 07:09:17,695] Trial 181 finished with value: 0.6222288236507245 and parameters: {'left_stride': 32, 'right_stride': 256, 'co_occurrence_pooling_operation': 'sum', 'embedding_pooling_operation': 'mean', 'window_size': 10, 'batch_size': 101, 'attention_heads': 4, 'hidden_dimension': 214, 'number_of_hidden_layers': 1, 'dropout_rate': 0.5052207868126242, 'global_pooling': 'max', 'learning_rate': 0.00022192616557372105, 'weight_decay': 0.00024657195788157566, 'beta_0': 0.8506545400440795, 'beta_1': 0.9922115840393115, 'epsilon': 3.92974007113848e-06, 'balanced_loss': True, 'epochs': 197, 'early_stopping_patience': 18, 'plateau_patience': 16, 'plateau_divider': 3}. Best is trial 97 with value: 0.6752887550206477.
[I 2025-04-06 07:36:14,718] Trial 182 finished with value: 0.6533152984037799 and parameters: {'left_stride': 64, 'right_stride': 0, 'co_occurrence_pooling_operation': 'sum', 'embedding_pooling_operation': 'mean', 'window_size': 10, 'batch_size': 103, 'attention_heads': 14, 'hidden_dimension': 226, 'number_of_hidden_layers': 1, 'dropout_rate': 0.5258557465061632, 'global_pooling': 'mean', 'learning_rate': 0.00025904075765116906, 'weight_decay': 0.0003932408776649385, 'beta_0': 0.8251757304394868, 'beta_1': 0.9934366556058888, 'epsilon': 5.992983586234765e-06, 'balanced_loss': True, 'epochs': 190, 'early_stopping_patience': 17, 'plateau_patience': 15, 'plateau_divider': 4}. Best is trial 97 with value: 0.6752887550206477.
[I 2025-04-06 07:54:17,327] Trial 183 finished with value: 0.6506438470771524 and parameters: {'left_stride': 32, 'right_stride': 0, 'co_occurrence_pooling_operation': 'sum', 'embedding_pooling_operation': 'mean', 'window_size': 9, 'batch_size': 99, 'attention_heads': 11, 'hidden_dimension': 51, 'number_of_hidden_layers': 1, 'dropout_rate': 0.5206614254908108, 'global_pooling': 'mean', 'learning_rate': 0.0003830478335065713, 'weight_decay': 0.00033445948743531965, 'beta_0': 0.8542019775038653, 'beta_1': 0.9945562467947718, 'epsilon': 2.484216677610123e-06, 'balanced_loss': True, 'epochs': 200, 'early_stopping_patience': 18, 'plateau_patience': 15, 'plateau_divider': 3}. Best is trial 97 with value: 0.6752887550206477.
[I 2025-04-06 08:12:52,424] Trial 184 finished with value: 0.62089551754452 and parameters: {'left_stride': 0, 'right_stride': 0, 'co_occurrence_pooling_operation': 'sum', 'embedding_pooling_operation': 'mean', 'window_size': 10, 'batch_size': 97, 'attention_heads': 4, 'hidden_dimension': 217, 'number_of_hidden_layers': 1, 'dropout_rate': 0.487014317166729, 'global_pooling': 'sum', 'learning_rate': 0.00048284839925727033, 'weight_decay': 0.000556819195804539, 'beta_0': 0.842441106868295, 'beta_1': 0.983893233912602, 'epsilon': 3.72333833388569e-06, 'balanced_loss': True, 'epochs': 194, 'early_stopping_patience': 17, 'plateau_patience': 15, 'plateau_divider': 3}. Best is trial 97 with value: 0.6752887550206477.
[I 2025-04-06 08:31:43,905] Trial 185 finished with value: 0.6624345469821503 and parameters: {'left_stride': 64, 'right_stride': 0, 'co_occurrence_pooling_operation': 'sum', 'embedding_pooling_operation': 'mean', 'window_size': 10, 'batch_size': 104, 'attention_heads': 5, 'hidden_dimension': 200, 'number_of_hidden_layers': 1, 'dropout_rate': 0.5130043889512607, 'global_pooling': 'mean', 'learning_rate': 0.001877983447391355, 'weight_decay': 0.00020659393126075154, 'beta_0': 0.8524229109274927, 'beta_1': 0.994820850491099, 'epsilon': 4.824250167926016e-06, 'balanced_loss': True, 'epochs': 132, 'early_stopping_patience': 19, 'plateau_patience': 16, 'plateau_divider': 3}. Best is trial 97 with value: 0.6752887550206477.
[I 2025-04-06 08:50:44,652] Trial 186 finished with value: 0.6483064670116722 and parameters: {'left_stride': 64, 'right_stride': 0, 'co_occurrence_pooling_operation': 'sum', 'embedding_pooling_operation': 'mean', 'window_size': 10, 'batch_size': 103, 'attention_heads': 5, 'hidden_dimension': 203, 'number_of_hidden_layers': 1, 'dropout_rate': 0.5111153170998521, 'global_pooling': 'mean', 'learning_rate': 0.0019004269696022375, 'weight_decay': 0.0002033313504587711, 'beta_0': 0.8284364865409174, 'beta_1': 0.9947916937827967, 'epsilon': 4.105619594158277e-06, 'balanced_loss': True, 'epochs': 133, 'early_stopping_patience': 19, 'plateau_patience': 16, 'plateau_divider': 3}. Best is trial 97 with value: 0.6752887550206477.
[I 2025-04-06 09:09:51,438] Trial 187 finished with value: 0.6350720064631609 and parameters: {'left_stride': 64, 'right_stride': 0, 'co_occurrence_pooling_operation': 'sum', 'embedding_pooling_operation': 'mean', 'window_size': 10, 'batch_size': 106, 'attention_heads': 6, 'hidden_dimension': 200, 'number_of_hidden_layers': 1, 'dropout_rate': 0.5028764877027567, 'global_pooling': 'mean', 'learning_rate': 0.0024886870124951038, 'weight_decay': 0.00018532462320307346, 'beta_0': 0.8480288560706596, 'beta_1': 0.9936714575603884, 'epsilon': 5.0783936305334295e-06, 'balanced_loss': True, 'epochs': 128, 'early_stopping_patience': 18, 'plateau_patience': 17, 'plateau_divider': 3}. Best is trial 97 with value: 0.6752887550206477.
[I 2025-04-06 09:28:40,338] Trial 188 finished with value: 0.6439473991582065 and parameters: {'left_stride': 64, 'right_stride': 0, 'co_occurrence_pooling_operation': 'sum', 'embedding_pooling_operation': 'mean', 'window_size': 10, 'batch_size': 100, 'attention_heads': 5, 'hidden_dimension': 213, 'number_of_hidden_layers': 1, 'dropout_rate': 0.5167889563992564, 'global_pooling': 'mean', 'learning_rate': 0.0016251201610243278, 'weight_decay': 0.00027876854651160007, 'beta_0': 0.8518909363425914, 'beta_1': 0.9942270699928589, 'epsilon': 6.3431285261810565e-06, 'balanced_loss': True, 'epochs': 184, 'early_stopping_patience': 17, 'plateau_patience': 16, 'plateau_divider': 3}. Best is trial 97 with value: 0.6752887550206477.
[I 2025-04-06 09:47:56,670] Trial 189 finished with value: 0.6441771839532378 and parameters: {'left_stride': 64, 'right_stride': 0, 'co_occurrence_pooling_operation': 'sum', 'embedding_pooling_operation': 'mean', 'window_size': 10, 'batch_size': 126, 'attention_heads': 5, 'hidden_dimension': 206, 'number_of_hidden_layers': 1, 'dropout_rate': 0.40868694532848004, 'global_pooling': 'mean', 'learning_rate': 0.0006602813901108798, 'weight_decay': 0.0001585280698946054, 'beta_0': 0.8566567794261596, 'beta_1': 0.980012423080157, 'epsilon': 2.306399223485137e-07, 'balanced_loss': True, 'epochs': 190, 'early_stopping_patience': 19, 'plateau_patience': 14, 'plateau_divider': 3}. Best is trial 97 with value: 0.6752887550206477.
[I 2025-04-06 10:07:18,855] Trial 190 finished with value: 0.6528801576672882 and parameters: {'left_stride': 64, 'right_stride': 0, 'co_occurrence_pooling_operation': 'sum', 'embedding_pooling_operation': 'mean', 'window_size': 10, 'batch_size': 111, 'attention_heads': 5, 'hidden_dimension': 222, 'number_of_hidden_layers': 1, 'dropout_rate': 0.5278116237792188, 'global_pooling': 'mean', 'learning_rate': 0.0010995093606787135, 'weight_decay': 0.00022015283759974685, 'beta_0': 0.8452039361948755, 'beta_1': 0.9982653748776907, 'epsilon': 2.3258969793422697e-06, 'balanced_loss': True, 'epochs': 116, 'early_stopping_patience': 18, 'plateau_patience': 20, 'plateau_divider': 3}. Best is trial 97 with value: 0.6752887550206477.
[I 2025-04-06 10:26:28,258] Trial 191 finished with value: 0.6341727995671456 and parameters: {'left_stride': 32, 'right_stride': 0, 'co_occurrence_pooling_operation': 'sum', 'embedding_pooling_operation': 'mean', 'window_size': 10, 'batch_size': 105, 'attention_heads': 4, 'hidden_dimension': 198, 'number_of_hidden_layers': 1, 'dropout_rate': 0.4923787964441911, 'global_pooling': 'mean', 'learning_rate': 0.00031540232173938264, 'weight_decay': 0.0008862145286446467, 'beta_0': 0.8534901111326268, 'beta_1': 0.9932553169775745, 'epsilon': 8.498800565462767e-06, 'balanced_loss': True, 'epochs': 137, 'early_stopping_patience': 17, 'plateau_patience': 15, 'plateau_divider': 3}. Best is trial 97 with value: 0.6752887550206477.
[I 2025-04-06 10:47:31,917] Trial 192 finished with value: 0.6449422017647111 and parameters: {'left_stride': 128, 'right_stride': 256, 'co_occurrence_pooling_operation': 'sum', 'embedding_pooling_operation': 'mean', 'window_size': 8, 'batch_size': 108, 'attention_heads': 12, 'hidden_dimension': 191, 'number_of_hidden_layers': 1, 'dropout_rate': 0.5532463332363751, 'global_pooling': 'mean', 'learning_rate': 0.00017121178984957292, 'weight_decay': 0.00036298762699885057, 'beta_0': 0.8609820543508399, 'beta_1': 0.9951377684981889, 'epsilon': 1.1498477746611646e-08, 'balanced_loss': True, 'epochs': 131, 'early_stopping_patience': 18, 'plateau_patience': 16, 'plateau_divider': 4}. Best is trial 97 with value: 0.6752887550206477.
[I 2025-04-06 11:07:10,836] Trial 193 finished with value: 0.6302360491584815 and parameters: {'left_stride': 32, 'right_stride': 256, 'co_occurrence_pooling_operation': 'sum', 'embedding_pooling_operation': 'mean', 'window_size': 10, 'batch_size': 102, 'attention_heads': 6, 'hidden_dimension': 210, 'number_of_hidden_layers': 1, 'dropout_rate': 0.5356768381740304, 'global_pooling': 'max', 'learning_rate': 0.00044116000619209367, 'weight_decay': 0.0002596826752878478, 'beta_0': 0.8582539654788826, 'beta_1': 0.9956996441962521, 'epsilon': 2.8078596193747435e-06, 'balanced_loss': True, 'epochs': 197, 'early_stopping_patience': 17, 'plateau_patience': 21, 'plateau_divider': 3}. Best is trial 97 with value: 0.6752887550206477.
[I 2025-04-06 11:26:13,984] Trial 194 finished with value: 0.6402941359728337 and parameters: {'left_stride': 64, 'right_stride': 256, 'co_occurrence_pooling_operation': 'sum', 'embedding_pooling_operation': 'mean', 'window_size': 10, 'batch_size': 51, 'attention_heads': 5, 'hidden_dimension': 218, 'number_of_hidden_layers': 1, 'dropout_rate': 0.5000114573517193, 'global_pooling': 'mean', 'learning_rate': 0.003269517353104549, 'weight_decay': 0.0006548476201703434, 'beta_0': 0.8490886369009827, 'beta_1': 0.9979298372372795, 'epsilon': 1.798964691362623e-05, 'balanced_loss': True, 'epochs': 193, 'early_stopping_patience': 19, 'plateau_patience': 22, 'plateau_divider': 10}. Best is trial 97 with value: 0.6752887550206477.
[I 2025-04-06 11:49:37,749] Trial 195 finished with value: 0.6554821604655665 and parameters: {'left_stride': 32, 'right_stride': 256, 'co_occurrence_pooling_operation': 'sum', 'embedding_pooling_operation': 'mean', 'window_size': 10, 'batch_size': 96, 'attention_heads': 12, 'hidden_dimension': 236, 'number_of_hidden_layers': 1, 'dropout_rate': 0.512693971194826, 'global_pooling': 'mean', 'learning_rate': 0.0009109981790784919, 'weight_decay': 0.0004608962129488414, 'beta_0': 0.8523250130864752, 'beta_1': 0.9939514267238149, 'epsilon': 4.575093620837591e-06, 'balanced_loss': True, 'epochs': 189, 'early_stopping_patience': 18, 'plateau_patience': 14, 'plateau_divider': 3}. Best is trial 97 with value: 0.6752887550206477.
[I 2025-04-06 12:13:17,559] Trial 196 finished with value: 0.6625221831795384 and parameters: {'left_stride': 32, 'right_stride': 256, 'co_occurrence_pooling_operation': 'sum', 'embedding_pooling_operation': 'mean', 'window_size': 10, 'batch_size': 96, 'attention_heads': 12, 'hidden_dimension': 243, 'number_of_hidden_layers': 1, 'dropout_rate': 0.5134236002332616, 'global_pooling': 'mean', 'learning_rate': 0.000979909429814788, 'weight_decay': 0.00047669254124529996, 'beta_0': 0.8552766099399748, 'beta_1': 0.9938330856173953, 'epsilon': 3.850021520020904e-06, 'balanced_loss': True, 'epochs': 187, 'early_stopping_patience': 18, 'plateau_patience': 14, 'plateau_divider': 3}. Best is trial 97 with value: 0.6752887550206477.
[I 2025-04-06 12:37:11,014] Trial 197 finished with value: 0.6634310753457281 and parameters: {'left_stride': 32, 'right_stride': 256, 'co_occurrence_pooling_operation': 'sum', 'embedding_pooling_operation': 'mean', 'window_size': 10, 'batch_size': 92, 'attention_heads': 12, 'hidden_dimension': 241, 'number_of_hidden_layers': 1, 'dropout_rate': 0.5084066471124015, 'global_pooling': 'mean', 'learning_rate': 0.0008891686233595436, 'weight_decay': 0.0003118503272496534, 'beta_0': 0.8506594095067593, 'beta_1': 0.9940633306928182, 'epsilon': 5.072040048594333e-06, 'balanced_loss': True, 'epochs': 188, 'early_stopping_patience': 18, 'plateau_patience': 14, 'plateau_divider': 3}. Best is trial 97 with value: 0.6752887550206477.
[I 2025-04-06 13:00:38,186] Trial 198 finished with value: 0.6531931699904041 and parameters: {'left_stride': 32, 'right_stride': 256, 'co_occurrence_pooling_operation': 'sum', 'embedding_pooling_operation': 'mean', 'window_size': 10, 'batch_size': 89, 'attention_heads': 12, 'hidden_dimension': 240, 'number_of_hidden_layers': 1, 'dropout_rate': 0.511764510640918, 'global_pooling': 'mean', 'learning_rate': 0.0009143061785139083, 'weight_decay': 0.00045942401347212066, 'beta_0': 0.851218636636258, 'beta_1': 0.9939460560888395, 'epsilon': 4.77034907641274e-06, 'balanced_loss': True, 'epochs': 186, 'early_stopping_patience': 18, 'plateau_patience': 14, 'plateau_divider': 3}. Best is trial 97 with value: 0.6752887550206477.
[I 2025-04-06 13:24:23,568] Trial 199 finished with value: 0.6429587277952422 and parameters: {'left_stride': 32, 'right_stride': 256, 'co_occurrence_pooling_operation': 'sum', 'embedding_pooling_operation': 'mean', 'window_size': 10, 'batch_size': 92, 'attention_heads': 12, 'hidden_dimension': 241, 'number_of_hidden_layers': 1, 'dropout_rate': 0.510894325428104, 'global_pooling': 'mean', 'learning_rate': 0.0013464542088193602, 'weight_decay': 0.0003285745351774399, 'beta_0': 0.8535160428553273, 'beta_1': 0.9936081274051072, 'epsilon': 7.6038598256491224e-06, 'balanced_loss': True, 'epochs': 190, 'early_stopping_patience': 18, 'plateau_patience': 14, 'plateau_divider': 3}. Best is trial 97 with value: 0.6752887550206477.
[I 2025-04-06 13:47:03,878] Trial 200 finished with value: 0.634285807000716 and parameters: {'left_stride': 32, 'right_stride': 256, 'co_occurrence_pooling_operation': 'sum', 'embedding_pooling_operation': 'mean', 'window_size': 10, 'batch_size': 95, 'attention_heads': 11, 'hidden_dimension': 249, 'number_of_hidden_layers': 1, 'dropout_rate': 0.5019299753395642, 'global_pooling': 'mean', 'learning_rate': 0.0011369079067159525, 'weight_decay': 0.00037448394382323213, 'beta_0': 0.8471566350889982, 'beta_1': 0.9941504295999203, 'epsilon': 3.8921842544731285e-06, 'balanced_loss': True, 'epochs': 187, 'early_stopping_patience': 19, 'plateau_patience': 14, 'plateau_divider': 3}. Best is trial 97 with value: 0.6752887550206477.
