[I 2025-01-08 18:41:57,203] Trial 62 finished with value: 0.9008438818565401 and parameters: {'attention_pooling_operation': 'max', 'embedding_pooling_operation': 'max', 'threshold': 0.5510905274251041, 'batch_size': 66, 'attention_heads': 13, 'hidden_dimension': 78, 'number_of_hidden_layers': 2, 'dropout_rate': 0.4888969625231329, 'global_pooling': 'max', 'learning_rate': 0.002519470842019648, 'weight_decay': 3.2287765375073816e-05, 'beta_0': 0.8067070183494588, 'beta_1': 0.9806888480235406, 'epsilon': 6.560962517233137e-05, 'balanced_loss': False, 'epochs': 56, 'early_stopping_patience': 25, 'plateau_patience': 11, 'plateau_divider': 5}. Best is trial 30 with value: 0.9085794655414908.
[I 2025-01-08 18:48:48,458] Trial 63 finished with value: 0.90014064697609 and parameters: {'attention_pooling_operation': 'max', 'embedding_pooling_operation': 'max', 'threshold': 0.6596940073066276, 'batch_size': 132, 'attention_heads': 10, 'hidden_dimension': 213, 'number_of_hidden_layers': 0, 'dropout_rate': 0.47036695628284475, 'global_pooling': 'max', 'learning_rate': 0.0016617757326709557, 'weight_decay': 1.4037260361215834e-05, 'beta_0': 0.8099768733862008, 'beta_1': 0.9823906748642031, 'epsilon': 4.653796529588353e-05, 'balanced_loss': False, 'epochs': 142, 'early_stopping_patience': 24, 'plateau_patience': 15, 'plateau_divider': 5}. Best is trial 30 with value: 0.9085794655414908.
[I 2025-01-08 18:57:27,910] Trial 64 finished with value: 0.90014064697609 and parameters: {'attention_pooling_operation': 'max', 'embedding_pooling_operation': 'max', 'threshold': 0.5892386909206482, 'batch_size': 81, 'attention_heads': 13, 'hidden_dimension': 112, 'number_of_hidden_layers': 3, 'dropout_rate': 0.5186436816313645, 'global_pooling': 'max', 'learning_rate': 0.0029854064450996506, 'weight_decay': 2.617266023747355e-05, 'beta_0': 0.8034736691146285, 'beta_1': 0.9845453735094856, 'epsilon': 1.0964479419177917e-05, 'balanced_loss': False, 'epochs': 158, 'early_stopping_patience': 23, 'plateau_patience': 12, 'plateau_divider': 6}. Best is trial 30 with value: 0.9085794655414908.
[I 2025-01-08 19:12:04,970] Trial 65 finished with value: 0.9050632911392406 and parameters: {'attention_pooling_operation': 'max', 'embedding_pooling_operation': 'max', 'threshold': 0.5595254060344671, 'batch_size': 44, 'attention_heads': 12, 'hidden_dimension': 197, 'number_of_hidden_layers': 4, 'dropout_rate': 0.54025104318588, 'global_pooling': 'max', 'learning_rate': 0.004479368567999152, 'weight_decay': 4.417536764514259e-05, 'beta_0': 0.8191863386952561, 'beta_1': 0.9834327412111374, 'epsilon': 8.270789450924958e-05, 'balanced_loss': False, 'epochs': 63, 'early_stopping_patience': 25, 'plateau_patience': 13, 'plateau_divider': 4}. Best is trial 30 with value: 0.9085794655414908.
[I 2025-01-08 19:24:16,386] Trial 66 finished with value: 0.9008438818565401 and parameters: {'attention_pooling_operation': 'max', 'embedding_pooling_operation': 'min', 'threshold': 0.641721297606692, 'batch_size': 115, 'attention_heads': 14, 'hidden_dimension': 202, 'number_of_hidden_layers': 4, 'dropout_rate': 0.5668259289818972, 'global_pooling': 'max', 'learning_rate': 0.004770679832997495, 'weight_decay': 4.3203731968955235e-05, 'beta_0': 0.8261248739731327, 'beta_1': 0.9832619355526084, 'epsilon': 8.393649584930269e-05, 'balanced_loss': False, 'epochs': 85, 'early_stopping_patience': 22, 'plateau_patience': 14, 'plateau_divider': 3}. Best is trial 30 with value: 0.9085794655414908.
[I 2025-01-08 19:33:39,482] Trial 67 finished with value: 0.5232067510548524 and parameters: {'attention_pooling_operation': 'mean', 'embedding_pooling_operation': 'min', 'threshold': 0.6096212776980239, 'batch_size': 55, 'attention_heads': 10, 'hidden_dimension': 197, 'number_of_hidden_layers': 4, 'dropout_rate': 0.4241966976319693, 'global_pooling': 'max', 'learning_rate': 0.010284643203107803, 'weight_decay': 0.00011657846404056846, 'beta_0': 0.8392132984555072, 'beta_1': 0.981387761633427, 'epsilon': 1.822183487245561e-06, 'balanced_loss': True, 'epochs': 77, 'early_stopping_patience': 20, 'plateau_patience': 15, 'plateau_divider': 4}. Best is trial 30 with value: 0.9085794655414908.
[I 2025-01-08 19:45:39,975] Trial 68 finished with value: 0.9043600562587905 and parameters: {'attention_pooling_operation': 'max', 'embedding_pooling_operation': 'max', 'threshold': 0.4906434768999437, 'batch_size': 102, 'attention_heads': 15, 'hidden_dimension': 154, 'number_of_hidden_layers': 4, 'dropout_rate': 0.3345272403759433, 'global_pooling': 'mean', 'learning_rate': 0.004302442413170324, 'weight_decay': 0.00017667499413687185, 'beta_0': 0.8193473012138421, 'beta_1': 0.9837346081686731, 'epsilon': 1.1193391476885907e-07, 'balanced_loss': False, 'epochs': 66, 'early_stopping_patience': 21, 'plateau_patience': 14, 'plateau_divider': 4}. Best is trial 30 with value: 0.9085794655414908.
[I 2025-01-08 19:56:21,593] Trial 69 finished with value: 0.890295358649789 and parameters: {'attention_pooling_operation': 'max', 'embedding_pooling_operation': 'mean', 'threshold': 0.44902001619739196, 'batch_size': 142, 'attention_heads': 15, 'hidden_dimension': 135, 'number_of_hidden_layers': 3, 'dropout_rate': 0.3053764163049408, 'global_pooling': 'mean', 'learning_rate': 0.021840190446354914, 'weight_decay': 0.00017790987038550146, 'beta_0': 0.830057827398808, 'beta_1': 0.983950407535945, 'epsilon': 1.0404171735822726e-07, 'balanced_loss': True, 'epochs': 66, 'early_stopping_patience': 21, 'plateau_patience': 13, 'plateau_divider': 3}. Best is trial 30 with value: 0.9085794655414908.
[I 2025-01-08 20:07:02,659] Trial 70 finished with value: 0.9064697609001406 and parameters: {'attention_pooling_operation': 'mean', 'embedding_pooling_operation': 'min', 'threshold': 0.49437616674213364, 'batch_size': 101, 'attention_heads': 15, 'hidden_dimension': 152, 'number_of_hidden_layers': 4, 'dropout_rate': 0.331381784306979, 'global_pooling': 'mean', 'learning_rate': 0.006788177434074593, 'weight_decay': 0.0003290247277319442, 'beta_0': 0.8190085124447526, 'beta_1': 0.9866347221013119, 'epsilon': 5.4718003527855976e-08, 'balanced_loss': False, 'epochs': 61, 'early_stopping_patience': 19, 'plateau_patience': 18, 'plateau_divider': 4}. Best is trial 30 with value: 0.9085794655414908.
[I 2025-01-08 20:17:35,954] Trial 71 finished with value: 0.8909985935302391 and parameters: {'attention_pooling_operation': 'mean', 'embedding_pooling_operation': 'min', 'threshold': 0.477166938518428, 'batch_size': 100, 'attention_heads': 15, 'hidden_dimension': 143, 'number_of_hidden_layers': 4, 'dropout_rate': 0.3360158897800201, 'global_pooling': 'mean', 'learning_rate': 0.00713914761251526, 'weight_decay': 0.00039877575259855274, 'beta_0': 0.8242900083283607, 'beta_1': 0.9854172320082999, 'epsilon': 3.683479455198948e-08, 'balanced_loss': False, 'epochs': 58, 'early_stopping_patience': 19, 'plateau_patience': 18, 'plateau_divider': 4}. Best is trial 30 with value: 0.9085794655414908.
[I 2025-01-08 20:29:30,079] Trial 72 finished with value: 0.8073136427566807 and parameters: {'attention_pooling_operation': 'mean', 'embedding_pooling_operation': 'min', 'threshold': 0.5173693534306102, 'batch_size': 121, 'attention_heads': 16, 'hidden_dimension': 157, 'number_of_hidden_layers': 4, 'dropout_rate': 0.3197529306958349, 'global_pooling': 'mean', 'learning_rate': 0.01697144811255569, 'weight_decay': 0.0002584912732072674, 'beta_0': 0.8199241398285543, 'beta_1': 0.9864473993871902, 'epsilon': 5.512243790339336e-08, 'balanced_loss': False, 'epochs': 64, 'early_stopping_patience': 20, 'plateau_patience': 16, 'plateau_divider': 4}. Best is trial 30 with value: 0.9085794655414908.
[I 2025-01-08 20:39:50,241] Trial 73 finished with value: 0.8340365682137834 and parameters: {'attention_pooling_operation': 'mean', 'embedding_pooling_operation': 'min', 'threshold': 0.5328221572411304, 'batch_size': 109, 'attention_heads': 14, 'hidden_dimension': 153, 'number_of_hidden_layers': 4, 'dropout_rate': 0.35148282883549625, 'global_pooling': 'mean', 'learning_rate': 0.004785721663746653, 'weight_decay': 0.000288905385135732, 'beta_0': 0.817255925398105, 'beta_1': 0.984575995332575, 'epsilon': 2.4544685998707227e-08, 'balanced_loss': False, 'epochs': 70, 'early_stopping_patience': 19, 'plateau_patience': 19, 'plateau_divider': 4}. Best is trial 30 with value: 0.9085794655414908.
[I 2025-01-08 20:49:56,128] Trial 74 finished with value: 0.7953586497890295 and parameters: {'attention_pooling_operation': 'mean', 'embedding_pooling_operation': 'min', 'threshold': 0.48165738814900677, 'batch_size': 91, 'attention_heads': 16, 'hidden_dimension': 166, 'number_of_hidden_layers': 4, 'dropout_rate': 0.36008090289796224, 'global_pooling': 'mean', 'learning_rate': 0.012526565068702322, 'weight_decay': 0.00043679052052227063, 'beta_0': 0.8154844842261613, 'beta_1': 0.9874857105428816, 'epsilon': 7.561344128835088e-08, 'balanced_loss': False, 'epochs': 75, 'early_stopping_patience': 12, 'plateau_patience': 17, 'plateau_divider': 3}. Best is trial 30 with value: 0.9085794655414908.
[I 2025-01-08 21:00:59,015] Trial 75 finished with value: 0.9008438818565401 and parameters: {'attention_pooling_operation': 'mean', 'embedding_pooling_operation': 'min', 'threshold': 0.4934236757753656, 'batch_size': 127, 'attention_heads': 15, 'hidden_dimension': 150, 'number_of_hidden_layers': 4, 'dropout_rate': 0.32754781540114436, 'global_pooling': 'mean', 'learning_rate': 0.006249843350273112, 'weight_decay': 0.00021744870921203488, 'beta_0': 0.8194083476284229, 'beta_1': 0.9887018913905529, 'epsilon': 1.5108792112661897e-08, 'balanced_loss': False, 'epochs': 69, 'early_stopping_patience': 21, 'plateau_patience': 13, 'plateau_divider': 4}. Best is trial 30 with value: 0.9085794655414908.
[I 2025-01-08 21:10:31,774] Trial 76 finished with value: 0.9022503516174403 and parameters: {'attention_pooling_operation': 'max', 'embedding_pooling_operation': 'min', 'threshold': 0.4983876463358615, 'batch_size': 220, 'attention_heads': 8, 'hidden_dimension': 183, 'number_of_hidden_layers': 4, 'dropout_rate': 0.3438274681434624, 'global_pooling': 'mean', 'learning_rate': 0.00949162333071408, 'weight_decay': 0.00013886418594151123, 'beta_0': 0.8269575849607735, 'beta_1': 0.982944082328542, 'epsilon': 3.944162488463102e-08, 'balanced_loss': False, 'epochs': 93, 'early_stopping_patience': 18, 'plateau_patience': 21, 'plateau_divider': 3}. Best is trial 30 with value: 0.9085794655414908.
[I 2025-01-08 21:17:34,072] Trial 77 finished with value: 0.9050632911392406 and parameters: {'attention_pooling_operation': 'mean', 'embedding_pooling_operation': 'max', 'threshold': 0.5885605951686294, 'batch_size': 101, 'attention_heads': 14, 'hidden_dimension': 127, 'number_of_hidden_layers': 1, 'dropout_rate': 0.39559372999299725, 'global_pooling': 'mean', 'learning_rate': 0.004340028222938447, 'weight_decay': 9.749384160218343e-05, 'beta_0': 0.8235538102585032, 'beta_1': 0.9896248932629733, 'epsilon': 1.3296255959879688e-07, 'balanced_loss': True, 'epochs': 61, 'early_stopping_patience': 17, 'plateau_patience': 15, 'plateau_divider': 4}. Best is trial 30 with value: 0.9085794655414908.
[I 2025-01-08 21:25:08,004] Trial 78 finished with value: 0.9008438818565401 and parameters: {'attention_pooling_operation': 'mean', 'embedding_pooling_operation': 'min', 'threshold': 0.5815013563941206, 'batch_size': 157, 'attention_heads': 14, 'hidden_dimension': 124, 'number_of_hidden_layers': 2, 'dropout_rate': 0.5420968807945933, 'global_pooling': 'mean', 'learning_rate': 0.0010962016963188333, 'weight_decay': 0.00032189575567174956, 'beta_0': 0.8337665478297374, 'beta_1': 0.9894457176797237, 'epsilon': 8.835180692054827e-08, 'balanced_loss': False, 'epochs': 61, 'early_stopping_patience': 16, 'plateau_patience': 15, 'plateau_divider': 4}. Best is trial 30 with value: 0.9085794655414908.
[I 2025-01-08 21:32:05,363] Trial 79 finished with value: 0.9008438818565401 and parameters: {'attention_pooling_operation': 'mean', 'embedding_pooling_operation': 'max', 'threshold': 0.630145461771377, 'batch_size': 233, 'attention_heads': 15, 'hidden_dimension': 126, 'number_of_hidden_layers': 1, 'dropout_rate': 0.37368346359713484, 'global_pooling': 'mean', 'learning_rate': 0.004204354394683091, 'weight_decay': 9.73451303108808e-05, 'beta_0': 0.8236672444308282, 'beta_1': 0.9899026380126708, 'epsilon': 1.4778681642762116e-07, 'balanced_loss': False, 'epochs': 56, 'early_stopping_patience': 17, 'plateau_patience': 14, 'plateau_divider': 3}. Best is trial 30 with value: 0.9085794655414908.
[I 2025-01-08 21:39:29,896] Trial 80 finished with value: 0.89943741209564 and parameters: {'attention_pooling_operation': 'mean', 'embedding_pooling_operation': 'min', 'threshold': 0.4591836167149319, 'batch_size': 189, 'attention_heads': 14, 'hidden_dimension': 138, 'number_of_hidden_layers': 1, 'dropout_rate': 0.3287777242412769, 'global_pooling': 'mean', 'learning_rate': 0.0030077548063104824, 'weight_decay': 0.0005371088987663949, 'beta_0': 0.8138938654786491, 'beta_1': 0.9903667639204364, 'epsilon': 6.28961493429457e-07, 'balanced_loss': True, 'epochs': 72, 'early_stopping_patience': 16, 'plateau_patience': 18, 'plateau_divider': 4}. Best is trial 30 with value: 0.9085794655414908.
[I 2025-01-08 21:46:09,539] Trial 81 finished with value: 0.8987341772151899 and parameters: {'attention_pooling_operation': 'mean', 'embedding_pooling_operation': 'max', 'threshold': 0.5580551336143749, 'batch_size': 104, 'attention_heads': 13, 'hidden_dimension': 146, 'number_of_hidden_layers': 0, 'dropout_rate': 0.39632467666664717, 'global_pooling': 'mean', 'learning_rate': 0.00804693109020022, 'weight_decay': 0.00011640655915109443, 'beta_0': 0.8298600873733107, 'beta_1': 0.9911141828228534, 'epsilon': 2.0611717965159664e-07, 'balanced_loss': True, 'epochs': 63, 'early_stopping_patience': 19, 'plateau_patience': 16, 'plateau_divider': 5}. Best is trial 30 with value: 0.9085794655414908.
[I 2025-01-08 21:52:54,910] Trial 82 finished with value: 0.90014064697609 and parameters: {'attention_pooling_operation': 'min', 'embedding_pooling_operation': 'max', 'threshold': 0.612199306934451, 'batch_size': 96, 'attention_heads': 14, 'hidden_dimension': 190, 'number_of_hidden_layers': 0, 'dropout_rate': 0.3097267477135831, 'global_pooling': 'mean', 'learning_rate': 0.004382474477121954, 'weight_decay': 0.00019776504826844954, 'beta_0': 0.8186466121687821, 'beta_1': 0.9885618133634875, 'epsilon': 3.07270809782481e-08, 'balanced_loss': True, 'epochs': 50, 'early_stopping_patience': 20, 'plateau_patience': 15, 'plateau_divider': 4}. Best is trial 30 with value: 0.9085794655414908.
[I 2025-01-08 21:59:38,789] Trial 83 finished with value: 0.8959212376933896 and parameters: {'attention_pooling_operation': 'mean', 'embedding_pooling_operation': 'max', 'threshold': 0.5242274701401651, 'batch_size': 114, 'attention_heads': 15, 'hidden_dimension': 163, 'number_of_hidden_layers': 0, 'dropout_rate': 0.3858844900924957, 'global_pooling': 'mean', 'learning_rate': 0.005670198260640634, 'weight_decay': 0.00016334972867304746, 'beta_0': 0.8222379042406643, 'beta_1': 0.9874030577905061, 'epsilon': 4.1428511901300065e-07, 'balanced_loss': True, 'epochs': 60, 'early_stopping_patience': 17, 'plateau_patience': 15, 'plateau_divider': 5}. Best is trial 30 with value: 0.9085794655414908.
[I 2025-01-08 22:06:49,428] Trial 84 finished with value: 0.89943741209564 and parameters: {'attention_pooling_operation': 'max', 'embedding_pooling_operation': 'max', 'threshold': 0.536837214513225, 'batch_size': 88, 'attention_heads': 15, 'hidden_dimension': 111, 'number_of_hidden_layers': 1, 'dropout_rate': 0.3980857660606451, 'global_pooling': 'sum', 'learning_rate': 0.0014914844889965132, 'weight_decay': 0.00012404613700594652, 'beta_0': 0.8386439385893251, 'beta_1': 0.9835756601382035, 'epsilon': 3.254836040960908e-07, 'balanced_loss': True, 'epochs': 83, 'early_stopping_patience': 18, 'plateau_patience': 13, 'plateau_divider': 5}. Best is trial 30 with value: 0.9085794655414908.
[I 2025-01-08 22:17:14,164] Trial 85 finished with value: 0.9029535864978903 and parameters: {'attention_pooling_operation': 'max', 'embedding_pooling_operation': 'max', 'threshold': 0.5958182478380784, 'batch_size': 119, 'attention_heads': 16, 'hidden_dimension': 175, 'number_of_hidden_layers': 3, 'dropout_rate': 0.5991365320298793, 'global_pooling': 'mean', 'learning_rate': 0.0023734748912042905, 'weight_decay': 9.032577783134579e-05, 'beta_0': 0.8096461583563186, 'beta_1': 0.9858480111127913, 'epsilon': 1.1755950413897247e-07, 'balanced_loss': True, 'epochs': 53, 'early_stopping_patience': 21, 'plateau_patience': 14, 'plateau_divider': 4}. Best is trial 30 with value: 0.9085794655414908.
