[I 2025-02-26 14:55:50,253] Trial 62 finished with value: 0.8543577981651376 and parameters: {'attention_pooling_operation': 'min', 'embedding_pooling_operation': 'max', 'threshold': 0.7237676615281946, 'batch_size': 32, 'attention_heads': 15, 'hidden_dimension': 221, 'number_of_hidden_layers': 2, 'dropout_rate': 0.46330616291762655, 'global_pooling': 'max', 'learning_rate': 0.0008439418850942752, 'weight_decay': 0.00021222348266588316, 'beta_0': 0.8122248243070328, 'beta_1': 0.9854955105483927, 'epsilon': 6.926314245414099e-08, 'balanced_loss': False, 'epochs': 197, 'early_stopping_patience': 23, 'plateau_patience': 21, 'plateau_divider': 7}. Best is trial 57 with value: 0.8715596330275229.
[I 2025-02-26 15:03:20,751] Trial 63 finished with value: 0.8451834862385321 and parameters: {'attention_pooling_operation': 'min', 'embedding_pooling_operation': 'max', 'threshold': 0.6491135658260946, 'batch_size': 58, 'attention_heads': 16, 'hidden_dimension': 183, 'number_of_hidden_layers': 2, 'dropout_rate': 0.4770385592427119, 'global_pooling': 'max', 'learning_rate': 0.002897934664259941, 'weight_decay': 0.00039866450638113046, 'beta_0': 0.8000595412319104, 'beta_1': 0.9843786994834721, 'epsilon': 1.4840705899546306e-08, 'balanced_loss': False, 'epochs': 173, 'early_stopping_patience': 22, 'plateau_patience': 21, 'plateau_divider': 8}. Best is trial 57 with value: 0.8715596330275229.
[I 2025-02-26 15:12:32,404] Trial 64 finished with value: 0.8704128440366973 and parameters: {'attention_pooling_operation': 'min', 'embedding_pooling_operation': 'max', 'threshold': 0.6050061089628648, 'batch_size': 63, 'attention_heads': 15, 'hidden_dimension': 194, 'number_of_hidden_layers': 2, 'dropout_rate': 0.506988475842647, 'global_pooling': 'max', 'learning_rate': 0.0006465138829639015, 'weight_decay': 0.0007497321769180591, 'beta_0': 0.8188571068424046, 'beta_1': 0.9871297475331785, 'epsilon': 4.983068708017224e-08, 'balanced_loss': False, 'epochs': 190, 'early_stopping_patience': 22, 'plateau_patience': 20, 'plateau_divider': 8}. Best is trial 57 with value: 0.8715596330275229.
[I 2025-02-26 15:20:27,672] Trial 65 finished with value: 0.856651376146789 and parameters: {'attention_pooling_operation': 'mean', 'embedding_pooling_operation': 'max', 'threshold': 0.6345164814278526, 'batch_size': 51, 'attention_heads': 15, 'hidden_dimension': 206, 'number_of_hidden_layers': 2, 'dropout_rate': 0.51203027809072, 'global_pooling': 'max', 'learning_rate': 0.0002850312896558543, 'weight_decay': 0.0006850095004926659, 'beta_0': 0.8191004941817751, 'beta_1': 0.987445282017013, 'epsilon': 4.318307093601998e-08, 'balanced_loss': False, 'epochs': 191, 'early_stopping_patience': 24, 'plateau_patience': 19, 'plateau_divider': 8}. Best is trial 57 with value: 0.8715596330275229.
[I 2025-02-26 15:28:37,793] Trial 66 finished with value: 0.8600917431192661 and parameters: {'attention_pooling_operation': 'min', 'embedding_pooling_operation': 'max', 'threshold': 0.6023141095035845, 'batch_size': 61, 'attention_heads': 15, 'hidden_dimension': 197, 'number_of_hidden_layers': 2, 'dropout_rate': 0.5258534244077425, 'global_pooling': 'sum', 'learning_rate': 0.0006177264549290406, 'weight_decay': 0.0005336042542861738, 'beta_0': 0.8055969743292308, 'beta_1': 0.9855357539703984, 'epsilon': 1.411685955365155e-07, 'balanced_loss': False, 'epochs': 199, 'early_stopping_patience': 23, 'plateau_patience': 22, 'plateau_divider': 9}. Best is trial 57 with value: 0.8715596330275229.
[I 2025-02-26 15:34:08,024] Trial 67 finished with value: 0.8337155963302753 and parameters: {'attention_pooling_operation': 'min', 'embedding_pooling_operation': 'max', 'threshold': 0.9397575370373784, 'batch_size': 80, 'attention_heads': 16, 'hidden_dimension': 234, 'number_of_hidden_layers': 1, 'dropout_rate': 0.5014958464889446, 'global_pooling': 'max', 'learning_rate': 0.0006199097227128371, 'weight_decay': 0.0007499711627883946, 'beta_0': 0.8099104588175569, 'beta_1': 0.9877693378234905, 'epsilon': 1.9146609743196608e-08, 'balanced_loss': False, 'epochs': 194, 'early_stopping_patience': 21, 'plateau_patience': 18, 'plateau_divider': 9}. Best is trial 57 with value: 0.8715596330275229.
[I 2025-02-26 15:42:26,063] Trial 68 finished with value: 0.856651376146789 and parameters: {'attention_pooling_operation': 'min', 'embedding_pooling_operation': 'max', 'threshold': 0.595567328410777, 'batch_size': 41, 'attention_heads': 14, 'hidden_dimension': 218, 'number_of_hidden_layers': 2, 'dropout_rate': 0.43444449313331346, 'global_pooling': 'max', 'learning_rate': 0.002116848162079129, 'weight_decay': 0.00045688455818803855, 'beta_0': 0.820560708146555, 'beta_1': 0.9892093187247758, 'epsilon': 3.1100957731182626e-07, 'balanced_loss': True, 'epochs': 178, 'early_stopping_patience': 22, 'plateau_patience': 21, 'plateau_divider': 8}. Best is trial 57 with value: 0.8715596330275229.
[I 2025-02-26 15:47:56,864] Trial 69 finished with value: 0.661697247706422 and parameters: {'attention_pooling_operation': 'min', 'embedding_pooling_operation': 'max', 'threshold': 0.6786925104639883, 'batch_size': 65, 'attention_heads': 10, 'hidden_dimension': 246, 'number_of_hidden_layers': 2, 'dropout_rate': 0.4195070415023979, 'global_pooling': 'max', 'learning_rate': 0.021840190446354914, 'weight_decay': 4.613781980548487e-06, 'beta_0': 0.8164865322974791, 'beta_1': 0.9864914405434202, 'epsilon': 1.0708068893133919e-07, 'balanced_loss': False, 'epochs': 188, 'early_stopping_patience': 13, 'plateau_patience': 23, 'plateau_divider': 8}. Best is trial 57 with value: 0.8715596330275229.
[I 2025-02-26 15:54:22,032] Trial 70 finished with value: 0.8612385321100917 and parameters: {'attention_pooling_operation': 'min', 'embedding_pooling_operation': 'max', 'threshold': 0.4906246330840809, 'batch_size': 77, 'attention_heads': 15, 'hidden_dimension': 152, 'number_of_hidden_layers': 1, 'dropout_rate': 0.5402880131674628, 'global_pooling': 'max', 'learning_rate': 0.0016772099961071684, 'weight_decay': 0.00013505500014648235, 'beta_0': 0.8263017410664125, 'beta_1': 0.9847867460831355, 'epsilon': 2.099197785620072e-07, 'balanced_loss': False, 'epochs': 158, 'early_stopping_patience': 20, 'plateau_patience': 20, 'plateau_divider': 9}. Best is trial 57 with value: 0.8715596330275229.
[I 2025-02-26 16:03:05,898] Trial 71 finished with value: 0.8635321100917431 and parameters: {'attention_pooling_operation': 'min', 'embedding_pooling_operation': 'max', 'threshold': 0.621022486599577, 'batch_size': 71, 'attention_heads': 16, 'hidden_dimension': 193, 'number_of_hidden_layers': 2, 'dropout_rate': 0.45880994337569764, 'global_pooling': 'max', 'learning_rate': 0.0012400474010651153, 'weight_decay': 0.000288825473567065, 'beta_0': 0.8931837918866986, 'beta_1': 0.9871186129007694, 'epsilon': 5.125903415431173e-08, 'balanced_loss': False, 'epochs': 175, 'early_stopping_patience': 22, 'plateau_patience': 20, 'plateau_divider': 7}. Best is trial 57 with value: 0.8715596330275229.
[I 2025-02-26 16:11:42,104] Trial 72 finished with value: 0.8623853211009175 and parameters: {'attention_pooling_operation': 'min', 'embedding_pooling_operation': 'max', 'threshold': 0.6080424527973767, 'batch_size': 86, 'attention_heads': 16, 'hidden_dimension': 183, 'number_of_hidden_layers': 2, 'dropout_rate': 0.445166402436143, 'global_pooling': 'max', 'learning_rate': 0.001040699143875345, 'weight_decay': 0.00021428895400374756, 'beta_0': 0.8109966055907203, 'beta_1': 0.9884829737360995, 'epsilon': 7.364151216936624e-08, 'balanced_loss': False, 'epochs': 182, 'early_stopping_patience': 24, 'plateau_patience': 19, 'plateau_divider': 7}. Best is trial 57 with value: 0.8715596330275229.
[I 2025-02-26 16:22:15,631] Trial 73 finished with value: 0.8658256880733946 and parameters: {'attention_pooling_operation': 'min', 'embedding_pooling_operation': 'mean', 'threshold': 0.5744924006148598, 'batch_size': 54, 'attention_heads': 16, 'hidden_dimension': 206, 'number_of_hidden_layers': 2, 'dropout_rate': 0.47317677799401137, 'global_pooling': 'max', 'learning_rate': 0.0007349977093849679, 'weight_decay': 0.00035470487997350266, 'beta_0': 0.8821136660726467, 'beta_1': 0.990195277951422, 'epsilon': 2.758372538229068e-08, 'balanced_loss': False, 'epochs': 195, 'early_stopping_patience': 23, 'plateau_patience': 20, 'plateau_divider': 7}. Best is trial 57 with value: 0.8715596330275229.
[I 2025-02-26 16:30:53,319] Trial 74 finished with value: 0.8612385321100917 and parameters: {'attention_pooling_operation': 'min', 'embedding_pooling_operation': 'max', 'threshold': 0.6286235108218938, 'batch_size': 66, 'attention_heads': 16, 'hidden_dimension': 168, 'number_of_hidden_layers': 2, 'dropout_rate': 0.45470521847924844, 'global_pooling': 'max', 'learning_rate': 0.0014228615089765435, 'weight_decay': 0.00051685353751, 'beta_0': 0.8161451121993429, 'beta_1': 0.9867425793562957, 'epsilon': 3.8217751720082946e-08, 'balanced_loss': False, 'epochs': 184, 'early_stopping_patience': 21, 'plateau_patience': 16, 'plateau_divider': 8}. Best is trial 57 with value: 0.8715596330275229.
[I 2025-02-26 16:41:50,068] Trial 75 finished with value: 0.8589449541284404 and parameters: {'attention_pooling_operation': 'mean', 'embedding_pooling_operation': 'min', 'threshold': 0.6621888903908104, 'batch_size': 47, 'attention_heads': 15, 'hidden_dimension': 227, 'number_of_hidden_layers': 3, 'dropout_rate': 0.482982549870378, 'global_pooling': 'max', 'learning_rate': 0.0005435206178285227, 'weight_decay': 0.00027989358468681093, 'beta_0': 0.8325177197977071, 'beta_1': 0.9859083150124548, 'epsilon': 9.204021959211727e-08, 'balanced_loss': False, 'epochs': 167, 'early_stopping_patience': 22, 'plateau_patience': 21, 'plateau_divider': 7}. Best is trial 57 with value: 0.8715596330275229.
[I 2025-02-26 16:51:41,920] Trial 76 finished with value: 0.8440366972477065 and parameters: {'attention_pooling_operation': 'min', 'embedding_pooling_operation': 'min', 'threshold': 0.6435037388723001, 'batch_size': 64, 'attention_heads': 15, 'hidden_dimension': 194, 'number_of_hidden_layers': 3, 'dropout_rate': 0.4658080531956295, 'global_pooling': 'mean', 'learning_rate': 0.003590872347187588, 'weight_decay': 0.00035818508220092533, 'beta_0': 0.8125416285022844, 'beta_1': 0.9880165826123719, 'epsilon': 1.4771814395967768e-07, 'balanced_loss': False, 'epochs': 200, 'early_stopping_patience': 23, 'plateau_patience': 19, 'plateau_divider': 8}. Best is trial 57 with value: 0.8715596330275229.
[I 2025-02-26 17:00:48,794] Trial 77 finished with value: 0.8692660550458715 and parameters: {'attention_pooling_operation': 'min', 'embedding_pooling_operation': 'max', 'threshold': 0.6089751812128814, 'batch_size': 109, 'attention_heads': 14, 'hidden_dimension': 212, 'number_of_hidden_layers': 2, 'dropout_rate': 0.5041500769273761, 'global_pooling': 'max', 'learning_rate': 0.0010152460678533415, 'weight_decay': 0.00014914877706552194, 'beta_0': 0.8285724802808156, 'beta_1': 0.9888415551995074, 'epsilon': 1.1017027490799598e-08, 'balanced_loss': False, 'epochs': 187, 'early_stopping_patience': 25, 'plateau_patience': 17, 'plateau_divider': 10}. Best is trial 57 with value: 0.8715596330275229.
[I 2025-02-26 17:09:34,044] Trial 78 finished with value: 0.8451834862385321 and parameters: {'attention_pooling_operation': 'min', 'embedding_pooling_operation': 'max', 'threshold': 0.5875980742030547, 'batch_size': 108, 'attention_heads': 14, 'hidden_dimension': 213, 'number_of_hidden_layers': 2, 'dropout_rate': 0.5212271195655853, 'global_pooling': 'sum', 'learning_rate': 0.00021637057274247255, 'weight_decay': 0.00010846325058589723, 'beta_0': 0.8273845343922419, 'beta_1': 0.9888935876589897, 'epsilon': 1.199008238250748e-08, 'balanced_loss': False, 'epochs': 188, 'early_stopping_patience': 25, 'plateau_patience': 18, 'plateau_divider': 10}. Best is trial 57 with value: 0.8715596330275229.
[I 2025-02-26 17:17:23,573] Trial 79 finished with value: 0.8646788990825688 and parameters: {'attention_pooling_operation': 'min', 'embedding_pooling_operation': 'max', 'threshold': 0.5659483355737316, 'batch_size': 152, 'attention_heads': 14, 'hidden_dimension': 232, 'number_of_hidden_layers': 1, 'dropout_rate': 0.5038351678718316, 'global_pooling': 'max', 'learning_rate': 0.0009838723335780343, 'weight_decay': 0.00013226615239124564, 'beta_0': 0.8229347832994817, 'beta_1': 0.9914991885543003, 'epsilon': 4.305601053313785e-05, 'balanced_loss': True, 'epochs': 124, 'early_stopping_patience': 25, 'plateau_patience': 17, 'plateau_divider': 10}. Best is trial 57 with value: 0.8715596330275229.
[I 2025-02-26 17:24:35,276] Trial 80 finished with value: 0.8589449541284404 and parameters: {'attention_pooling_operation': 'min', 'embedding_pooling_operation': 'max', 'threshold': 0.5415921244399416, 'batch_size': 133, 'attention_heads': 15, 'hidden_dimension': 202, 'number_of_hidden_layers': 2, 'dropout_rate': 0.5379464257863396, 'global_pooling': 'max', 'learning_rate': 0.0023873490255334313, 'weight_decay': 0.00019824750034994168, 'beta_0': 0.8029284565337873, 'beta_1': 0.9874013407405724, 'epsilon': 2.530820951952158e-08, 'balanced_loss': False, 'epochs': 171, 'early_stopping_patience': 11, 'plateau_patience': 17, 'plateau_divider': 10}. Best is trial 57 with value: 0.8715596330275229.
[I 2025-02-26 17:33:08,768] Trial 81 finished with value: 0.875 and parameters: {'attention_pooling_operation': 'min', 'embedding_pooling_operation': 'max', 'threshold': 0.6043707821818122, 'batch_size': 83, 'attention_heads': 16, 'hidden_dimension': 184, 'number_of_hidden_layers': 2, 'dropout_rate': 0.49127159947562404, 'global_pooling': 'max', 'learning_rate': 0.0003398370712661133, 'weight_decay': 0.0001543646255788603, 'beta_0': 0.8202910790975771, 'beta_1': 0.9864581040976793, 'epsilon': 1.7196561103884085e-08, 'balanced_loss': False, 'epochs': 193, 'early_stopping_patience': 24, 'plateau_patience': 16, 'plateau_divider': 9}. Best is trial 81 with value: 0.875.
[I 2025-02-26 17:41:44,915] Trial 82 finished with value: 0.8658256880733946 and parameters: {'attention_pooling_operation': 'min', 'embedding_pooling_operation': 'max', 'threshold': 0.6425726411831627, 'batch_size': 102, 'attention_heads': 16, 'hidden_dimension': 181, 'number_of_hidden_layers': 2, 'dropout_rate': 0.48709313871090404, 'global_pooling': 'max', 'learning_rate': 0.0005256766010927817, 'weight_decay': 0.0001487280748071376, 'beta_0': 0.8206715160514905, 'beta_1': 0.9864018075315876, 'epsilon': 1.886571954034543e-08, 'balanced_loss': False, 'epochs': 193, 'early_stopping_patience': 24, 'plateau_patience': 16, 'plateau_divider': 9}. Best is trial 81 with value: 0.875.
[I 2025-02-26 17:49:35,009] Trial 83 finished with value: 0.8600917431192661 and parameters: {'attention_pooling_operation': 'min', 'embedding_pooling_operation': 'max', 'threshold': 0.8406173134890713, 'batch_size': 83, 'attention_heads': 15, 'hidden_dimension': 217, 'number_of_hidden_layers': 2, 'dropout_rate': 0.4960237561145346, 'global_pooling': 'max', 'learning_rate': 0.00034090458614408943, 'weight_decay': 0.0005957582989780165, 'beta_0': 0.8137825192034884, 'beta_1': 0.9882950877535537, 'epsilon': 1.1754484171849546e-08, 'balanced_loss': False, 'epochs': 196, 'early_stopping_patience': 24, 'plateau_patience': 14, 'plateau_divider': 10}. Best is trial 81 with value: 0.875.
[I 2025-02-26 17:59:50,379] Trial 84 finished with value: 0.856651376146789 and parameters: {'attention_pooling_operation': 'min', 'embedding_pooling_operation': 'max', 'threshold': 0.5258556068254326, 'batch_size': 91, 'attention_heads': 16, 'hidden_dimension': 222, 'number_of_hidden_layers': 2, 'dropout_rate': 0.5089971921366128, 'global_pooling': 'max', 'learning_rate': 0.00011571638417248412, 'weight_decay': 0.00021756176492322574, 'beta_0': 0.8295949353400178, 'beta_1': 0.989641755225094, 'epsilon': 3.640886996433395e-08, 'balanced_loss': False, 'epochs': 179, 'early_stopping_patience': 25, 'plateau_patience': 15, 'plateau_divider': 9}. Best is trial 81 with value: 0.875.
[I 2025-02-26 18:06:20,900] Trial 85 finished with value: 0.8681192660550459 and parameters: {'attention_pooling_operation': 'min', 'embedding_pooling_operation': 'max', 'threshold': 0.610221704603985, 'batch_size': 139, 'attention_heads': 15, 'hidden_dimension': 173, 'number_of_hidden_layers': 2, 'dropout_rate': 0.48272567992345244, 'global_pooling': 'max', 'learning_rate': 0.0007561926585345923, 'weight_decay': 5.126571203243937e-05, 'beta_0': 0.8093944143479077, 'beta_1': 0.9857434349023232, 'epsilon': 1.5964487111388055e-08, 'balanced_loss': False, 'epochs': 189, 'early_stopping_patience': 24, 'plateau_patience': 16, 'plateau_divider': 9}. Best is trial 81 with value: 0.875.
[I 2025-02-26 18:13:28,800] Trial 86 finished with value: 0.8692660550458715 and parameters: {'attention_pooling_operation': 'min', 'embedding_pooling_operation': 'max', 'threshold': 0.5922235961026451, 'batch_size': 138, 'attention_heads': 14, 'hidden_dimension': 174, 'number_of_hidden_layers': 2, 'dropout_rate': 0.49257483387102413, 'global_pooling': 'max', 'learning_rate': 0.0007031523223516134, 'weight_decay': 4.540631243649215e-05, 'beta_0': 0.8078887822634633, 'beta_1': 0.9857019220187393, 'epsilon': 1.4762305746745776e-08, 'balanced_loss': False, 'epochs': 190, 'early_stopping_patience': 25, 'plateau_patience': 16, 'plateau_divider': 9}. Best is trial 81 with value: 0.875.
[I 2025-02-26 18:20:29,127] Trial 87 finished with value: 0.8589449541284404 and parameters: {'attention_pooling_operation': 'mean', 'embedding_pooling_operation': 'max', 'threshold': 0.5935887538465132, 'batch_size': 147, 'attention_heads': 14, 'hidden_dimension': 158, 'number_of_hidden_layers': 2, 'dropout_rate': 0.5168350653800392, 'global_pooling': 'max', 'learning_rate': 0.00023358114575319994, 'weight_decay': 3.044763063518473e-05, 'beta_0': 0.8033533176289505, 'beta_1': 0.984784779943906, 'epsilon': 1.1008515661762674e-08, 'balanced_loss': False, 'epochs': 191, 'early_stopping_patience': 25, 'plateau_patience': 15, 'plateau_divider': 9}. Best is trial 81 with value: 0.875.
[I 2025-02-26 18:26:40,645] Trial 88 finished with value: 0.8635321100917431 and parameters: {'attention_pooling_operation': 'min', 'embedding_pooling_operation': 'max', 'threshold': 0.5027310634019886, 'batch_size': 124, 'attention_heads': 14, 'hidden_dimension': 147, 'number_of_hidden_layers': 1, 'dropout_rate': 0.5291618066656658, 'global_pooling': 'max', 'learning_rate': 0.0003704870036655025, 'weight_decay': 8.349333421738515e-05, 'beta_0': 0.8078534003844493, 'beta_1': 0.9831231078067849, 'epsilon': 2.3560821304800343e-08, 'balanced_loss': False, 'epochs': 137, 'early_stopping_patience': 25, 'plateau_patience': 16, 'plateau_divider': 10}. Best is trial 81 with value: 0.875.
[I 2025-02-26 18:34:15,266] Trial 89 finished with value: 0.8612385321100917 and parameters: {'attention_pooling_operation': 'min', 'embedding_pooling_operation': 'max', 'threshold': 0.5702281561967235, 'batch_size': 98, 'attention_heads': 13, 'hidden_dimension': 209, 'number_of_hidden_layers': 2, 'dropout_rate': 0.5523699595546073, 'global_pooling': 'mean', 'learning_rate': 0.0004776104336564482, 'weight_decay': 3.7696535552612335e-05, 'beta_0': 0.8150510912984599, 'beta_1': 0.989047310947417, 'epsilon': 1.656431259640174e-08, 'balanced_loss': False, 'epochs': 197, 'early_stopping_patience': 24, 'plateau_patience': 15, 'plateau_divider': 9}. Best is trial 81 with value: 0.875.
[I 2025-02-26 18:41:51,840] Trial 90 finished with value: 0.8658256880733946 and parameters: {'attention_pooling_operation': 'max', 'embedding_pooling_operation': 'max', 'threshold': 0.5597105047402453, 'batch_size': 118, 'attention_heads': 14, 'hidden_dimension': 173, 'number_of_hidden_layers': 2, 'dropout_rate': 0.4924415848939637, 'global_pooling': 'max', 'learning_rate': 0.0006502075790930058, 'weight_decay': 1.2729361168429522e-05, 'beta_0': 0.8182747393875182, 'beta_1': 0.9923755389639684, 'epsilon': 3.101986380585392e-08, 'balanced_loss': False, 'epochs': 146, 'early_stopping_patience': 25, 'plateau_patience': 17, 'plateau_divider': 8}. Best is trial 81 with value: 0.875.
[I 2025-02-26 18:48:57,250] Trial 91 finished with value: 0.8681192660550459 and parameters: {'attention_pooling_operation': 'min', 'embedding_pooling_operation': 'max', 'threshold': 0.601702478070582, 'batch_size': 138, 'attention_heads': 15, 'hidden_dimension': 174, 'number_of_hidden_layers': 2, 'dropout_rate': 0.4863692774711231, 'global_pooling': 'max', 'learning_rate': 0.0008250649411932294, 'weight_decay': 5.010572076052403e-05, 'beta_0': 0.8093260888301719, 'beta_1': 0.9838653110826846, 'epsilon': 1.498584395578026e-08, 'balanced_loss': False, 'epochs': 189, 'early_stopping_patience': 24, 'plateau_patience': 16, 'plateau_divider': 9}. Best is trial 81 with value: 0.875.
[I 2025-02-26 18:53:23,513] Trial 92 finished with value: 0.8635321100917431 and parameters: {'attention_pooling_operation': 'min', 'embedding_pooling_operation': 'max', 'threshold': 0.6343522900366243, 'batch_size': 131, 'attention_heads': 9, 'hidden_dimension': 40, 'number_of_hidden_layers': 2, 'dropout_rate': 0.4810104388399807, 'global_pooling': 'max', 'learning_rate': 0.0011495493581578147, 'weight_decay': 1.9953212591660242e-05, 'beta_0': 0.8046140897114274, 'beta_1': 0.9857210439198656, 'epsilon': 1.0214237147315471e-08, 'balanced_loss': False, 'epochs': 193, 'early_stopping_patience': 24, 'plateau_patience': 17, 'plateau_divider': 10}. Best is trial 81 with value: 0.875.
