[I 2025-02-26 10:53:43,662] Trial 62 finished with value: 0.875 and parameters: {'attention_pooling_operation': 'mean', 'embedding_pooling_operation': 'max', 'threshold': 0.5510905274251041, 'batch_size': 242, 'attention_heads': 13, 'hidden_dimension': 170, 'number_of_hidden_layers': 1, 'dropout_rate': 0.31664768725873593, 'global_pooling': 'mean', 'learning_rate': 0.0008052218882109486, 'weight_decay': 0.0007531419062124915, 'beta_0': 0.8735349624066504, 'beta_1': 0.992618638858606, 'epsilon': 2.145183015711154e-07, 'balanced_loss': True, 'epochs': 84, 'early_stopping_patience': 25, 'plateau_patience': 16, 'plateau_divider': 4}. Best is trial 36 with value: 0.8795871559633027.
[I 2025-02-26 10:59:05,240] Trial 63 finished with value: 0.8704128440366973 and parameters: {'attention_pooling_operation': 'mean', 'embedding_pooling_operation': 'max', 'threshold': 0.5893857996397992, 'batch_size': 237, 'attention_heads': 15, 'hidden_dimension': 173, 'number_of_hidden_layers': 1, 'dropout_rate': 0.30166010830045314, 'global_pooling': 'mean', 'learning_rate': 0.0022177755435737303, 'weight_decay': 0.000525031104605986, 'beta_0': 0.8709916014747847, 'beta_1': 0.9928917130203276, 'epsilon': 4.46092660141979e-07, 'balanced_loss': True, 'epochs': 82, 'early_stopping_patience': 23, 'plateau_patience': 16, 'plateau_divider': 5}. Best is trial 36 with value: 0.8795871559633027.
[I 2025-02-26 11:03:56,652] Trial 64 finished with value: 0.8704128440366973 and parameters: {'attention_pooling_operation': 'mean', 'embedding_pooling_operation': 'max', 'threshold': 0.6182505295074773, 'batch_size': 213, 'attention_heads': 13, 'hidden_dimension': 149, 'number_of_hidden_layers': 1, 'dropout_rate': 0.3384581636884172, 'global_pooling': 'mean', 'learning_rate': 0.0013868952579628145, 'weight_decay': 0.0003935500063725819, 'beta_0': 0.8839374859801707, 'beta_1': 0.9937200833788074, 'epsilon': 3.187122674319524e-05, 'balanced_loss': True, 'epochs': 56, 'early_stopping_patience': 24, 'plateau_patience': 15, 'plateau_divider': 3}. Best is trial 36 with value: 0.8795871559633027.
[I 2025-02-26 11:08:23,786] Trial 65 finished with value: 0.8646788990825688 and parameters: {'attention_pooling_operation': 'mean', 'embedding_pooling_operation': 'max', 'threshold': 0.502987801844328, 'batch_size': 187, 'attention_heads': 14, 'hidden_dimension': 187, 'number_of_hidden_layers': 0, 'dropout_rate': 0.35003403705584546, 'global_pooling': 'mean', 'learning_rate': 0.003055738154654448, 'weight_decay': 0.000686070389919931, 'beta_0': 0.8963524340308024, 'beta_1': 0.9949383137979405, 'epsilon': 2.0796807327806784e-07, 'balanced_loss': True, 'epochs': 120, 'early_stopping_patience': 23, 'plateau_patience': 14, 'plateau_divider': 5}. Best is trial 36 with value: 0.8795871559633027.
[I 2025-02-26 11:12:08,151] Trial 66 finished with value: 0.8738532110091743 and parameters: {'attention_pooling_operation': 'mean', 'embedding_pooling_operation': 'max', 'threshold': 0.6434482453472974, 'batch_size': 157, 'attention_heads': 8, 'hidden_dimension': 41, 'number_of_hidden_layers': 1, 'dropout_rate': 0.32971707088150404, 'global_pooling': 'mean', 'learning_rate': 0.008019775385082112, 'weight_decay': 0.00044881189279054887, 'beta_0': 0.8886215737806387, 'beta_1': 0.99431250335242, 'epsilon': 3.547316906423007e-07, 'balanced_loss': True, 'epochs': 72, 'early_stopping_patience': 25, 'plateau_patience': 16, 'plateau_divider': 2}. Best is trial 36 with value: 0.8795871559633027.
[I 2025-02-26 11:16:10,211] Trial 67 finished with value: 0.8600917431192661 and parameters: {'attention_pooling_operation': 'mean', 'embedding_pooling_operation': 'max', 'threshold': 0.5315632407742701, 'batch_size': 86, 'attention_heads': 13, 'hidden_dimension': 50, 'number_of_hidden_layers': 2, 'dropout_rate': 0.46053636512883567, 'global_pooling': 'sum', 'learning_rate': 0.00037476284388507033, 'weight_decay': 0.0002396365436625027, 'beta_0': 0.8685639484652404, 'beta_1': 0.9969271459060772, 'epsilon': 4.9693602205989766e-05, 'balanced_loss': True, 'epochs': 85, 'early_stopping_patience': 16, 'plateau_patience': 12, 'plateau_divider': 4}. Best is trial 36 with value: 0.8795871559633027.
[I 2025-02-26 11:21:14,344] Trial 68 finished with value: 0.8715596330275229 and parameters: {'attention_pooling_operation': 'min', 'embedding_pooling_operation': 'max', 'threshold': 0.6088930499243584, 'batch_size': 174, 'attention_heads': 11, 'hidden_dimension': 197, 'number_of_hidden_layers': 1, 'dropout_rate': 0.47738175180203585, 'global_pooling': 'mean', 'learning_rate': 0.0008659615609070707, 'weight_decay': 4.948175836685151e-05, 'beta_0': 0.8621824262880752, 'beta_1': 0.9911557718171581, 'epsilon': 8.711353645896095e-07, 'balanced_loss': True, 'epochs': 60, 'early_stopping_patience': 22, 'plateau_patience': 19, 'plateau_divider': 3}. Best is trial 36 with value: 0.8795871559633027.
[I 2025-02-26 11:26:35,752] Trial 69 finished with value: 0.8681192660550459 and parameters: {'attention_pooling_operation': 'mean', 'embedding_pooling_operation': 'max', 'threshold': 0.5477821894488485, 'batch_size': 124, 'attention_heads': 16, 'hidden_dimension': 137, 'number_of_hidden_layers': 1, 'dropout_rate': 0.3762686464619441, 'global_pooling': 'mean', 'learning_rate': 0.0002704209416290173, 'weight_decay': 0.00016998532978834268, 'beta_0': 0.8817154612400655, 'beta_1': 0.9875288693654142, 'epsilon': 1.4469354792883587e-06, 'balanced_loss': True, 'epochs': 90, 'early_stopping_patience': 24, 'plateau_patience': 15, 'plateau_divider': 4}. Best is trial 36 with value: 0.8795871559633027.
[I 2025-02-26 11:30:50,852] Trial 70 finished with value: 0.8532110091743119 and parameters: {'attention_pooling_operation': 'mean', 'embedding_pooling_operation': 'max', 'threshold': 0.5169246098109618, 'batch_size': 52, 'attention_heads': 15, 'hidden_dimension': 172, 'number_of_hidden_layers': 0, 'dropout_rate': 0.49834120971250356, 'global_pooling': 'mean', 'learning_rate': 0.012358495524491775, 'weight_decay': 0.00012290983431496744, 'beta_0': 0.8485539057274859, 'beta_1': 0.9926823030603459, 'epsilon': 7.692932329601096e-05, 'balanced_loss': True, 'epochs': 66, 'early_stopping_patience': 19, 'plateau_patience': 17, 'plateau_divider': 2}. Best is trial 36 with value: 0.8795871559633027.
[I 2025-02-26 11:35:49,552] Trial 71 finished with value: 0.8646788990825688 and parameters: {'attention_pooling_operation': 'mean', 'embedding_pooling_operation': 'max', 'threshold': 0.5641694665463763, 'batch_size': 243, 'attention_heads': 12, 'hidden_dimension': 163, 'number_of_hidden_layers': 1, 'dropout_rate': 0.31872441110503574, 'global_pooling': 'mean', 'learning_rate': 0.0009132068384805016, 'weight_decay': 0.0007539186808516319, 'beta_0': 0.8795055014835399, 'beta_1': 0.9915557809063823, 'epsilon': 1.1421702878364945e-07, 'balanced_loss': True, 'epochs': 68, 'early_stopping_patience': 25, 'plateau_patience': 17, 'plateau_divider': 4}. Best is trial 36 with value: 0.8795871559633027.
[I 2025-02-26 11:40:53,655] Trial 72 finished with value: 0.8692660550458715 and parameters: {'attention_pooling_operation': 'mean', 'embedding_pooling_operation': 'max', 'threshold': 0.5794948544184864, 'batch_size': 254, 'attention_heads': 12, 'hidden_dimension': 165, 'number_of_hidden_layers': 1, 'dropout_rate': 0.31101439776889245, 'global_pooling': 'mean', 'learning_rate': 0.0012479191530638952, 'weight_decay': 0.0008798753889267093, 'beta_0': 0.874107387226224, 'beta_1': 0.9936336188764548, 'epsilon': 2.00458511164561e-07, 'balanced_loss': True, 'epochs': 76, 'early_stopping_patience': 25, 'plateau_patience': 17, 'plateau_divider': 4}. Best is trial 36 with value: 0.8795871559633027.
[I 2025-02-26 11:46:07,993] Trial 73 finished with value: 0.8669724770642202 and parameters: {'attention_pooling_operation': 'mean', 'embedding_pooling_operation': 'max', 'threshold': 0.5987470672436115, 'batch_size': 256, 'attention_heads': 13, 'hidden_dimension': 179, 'number_of_hidden_layers': 1, 'dropout_rate': 0.32618829345259553, 'global_pooling': 'mean', 'learning_rate': 0.0005558873879229771, 'weight_decay': 0.0006212444488189053, 'beta_0': 0.8742614590119094, 'beta_1': 0.9901320051629049, 'epsilon': 5.37604766990079e-07, 'balanced_loss': True, 'epochs': 58, 'early_stopping_patience': 24, 'plateau_patience': 18, 'plateau_divider': 5}. Best is trial 36 with value: 0.8795871559633027.
[I 2025-02-26 11:51:14,533] Trial 74 finished with value: 0.875 and parameters: {'attention_pooling_operation': 'mean', 'embedding_pooling_operation': 'max', 'threshold': 0.5475514099215368, 'batch_size': 230, 'attention_heads': 12, 'hidden_dimension': 159, 'number_of_hidden_layers': 1, 'dropout_rate': 0.4524797612004801, 'global_pooling': 'mean', 'learning_rate': 0.002149003488827596, 'weight_decay': 0.0005205141811810737, 'beta_0': 0.8866293008502136, 'beta_1': 0.9919352483462432, 'epsilon': 6.980487210889144e-08, 'balanced_loss': True, 'epochs': 72, 'early_stopping_patience': 25, 'plateau_patience': 16, 'plateau_divider': 3}. Best is trial 36 with value: 0.8795871559633027.
[I 2025-02-26 11:57:18,826] Trial 75 finished with value: 0.8761467889908257 and parameters: {'attention_pooling_operation': 'mean', 'embedding_pooling_operation': 'mean', 'threshold': 0.48125302767287237, 'batch_size': 247, 'attention_heads': 11, 'hidden_dimension': 147, 'number_of_hidden_layers': 2, 'dropout_rate': 0.4365450286895466, 'global_pooling': 'mean', 'learning_rate': 0.002126009398232669, 'weight_decay': 0.0004553738555252301, 'beta_0': 0.8911982470210746, 'beta_1': 0.9921520284263269, 'epsilon': 2.830926213055176e-08, 'balanced_loss': True, 'epochs': 129, 'early_stopping_patience': 20, 'plateau_patience': 15, 'plateau_divider': 3}. Best is trial 36 with value: 0.8795871559633027.
[I 2025-02-26 12:02:35,210] Trial 76 finished with value: 0.875 and parameters: {'attention_pooling_operation': 'mean', 'embedding_pooling_operation': 'mean', 'threshold': 0.48959051328250003, 'batch_size': 228, 'attention_heads': 11, 'hidden_dimension': 137, 'number_of_hidden_layers': 2, 'dropout_rate': 0.45848656178557073, 'global_pooling': 'mean', 'learning_rate': 0.0020513177296999957, 'weight_decay': 0.0002907772519931182, 'beta_0': 0.8907696820427433, 'beta_1': 0.98902038417245, 'epsilon': 2.3785886129206984e-08, 'balanced_loss': True, 'epochs': 138, 'early_stopping_patience': 20, 'plateau_patience': 16, 'plateau_divider': 3}. Best is trial 36 with value: 0.8795871559633027.
[I 2025-02-26 12:08:29,390] Trial 77 finished with value: 0.8807339449541285 and parameters: {'attention_pooling_operation': 'mean', 'embedding_pooling_operation': 'mean', 'threshold': 0.4819682855059743, 'batch_size': 240, 'attention_heads': 11, 'hidden_dimension': 147, 'number_of_hidden_layers': 2, 'dropout_rate': 0.4404242693589575, 'global_pooling': 'mean', 'learning_rate': 0.0033384610947604547, 'weight_decay': 0.00046285783024436344, 'beta_0': 0.8871607681886624, 'beta_1': 0.9922155874396422, 'epsilon': 1.539064882113847e-08, 'balanced_loss': True, 'epochs': 113, 'early_stopping_patience': 21, 'plateau_patience': 15, 'plateau_divider': 2}. Best is trial 77 with value: 0.8807339449541285.
[I 2025-02-26 12:13:00,666] Trial 78 finished with value: 0.8451834862385321 and parameters: {'attention_pooling_operation': 'mean', 'embedding_pooling_operation': 'mean', 'threshold': 0.45484879650709364, 'batch_size': 221, 'attention_heads': 9, 'hidden_dimension': 147, 'number_of_hidden_layers': 2, 'dropout_rate': 0.44123519995420274, 'global_pooling': 'sum', 'learning_rate': 0.003440655052263744, 'weight_decay': 0.0003351370343700374, 'beta_0': 0.8960741861278682, 'beta_1': 0.9857232720371842, 'epsilon': 1.4000164631303888e-08, 'balanced_loss': True, 'epochs': 129, 'early_stopping_patience': 11, 'plateau_patience': 15, 'plateau_divider': 2}. Best is trial 77 with value: 0.8807339449541285.
[I 2025-02-26 12:18:06,851] Trial 79 finished with value: 0.8623853211009175 and parameters: {'attention_pooling_operation': 'min', 'embedding_pooling_operation': 'mean', 'threshold': 0.456299475963616, 'batch_size': 239, 'attention_heads': 10, 'hidden_dimension': 137, 'number_of_hidden_layers': 2, 'dropout_rate': 0.4040973142240892, 'global_pooling': 'mean', 'learning_rate': 0.005617814165869114, 'weight_decay': 0.00047553543831437435, 'beta_0': 0.8929416316813853, 'beta_1': 0.9869813176336931, 'epsilon': 3.320148415789431e-08, 'balanced_loss': False, 'epochs': 111, 'early_stopping_patience': 21, 'plateau_patience': 22, 'plateau_divider': 2}. Best is trial 77 with value: 0.8807339449541285.
[I 2025-02-26 12:23:12,997] Trial 80 finished with value: 0.8795871559633027 and parameters: {'attention_pooling_operation': 'max', 'embedding_pooling_operation': 'mean', 'threshold': 0.47981144883375226, 'batch_size': 248, 'attention_heads': 11, 'hidden_dimension': 122, 'number_of_hidden_layers': 2, 'dropout_rate': 0.466902024694372, 'global_pooling': 'max', 'learning_rate': 0.0015314139780647814, 'weight_decay': 1.0320654511533209e-05, 'beta_0': 0.8423094785198894, 'beta_1': 0.9905309699915059, 'epsilon': 4.773902442902211e-08, 'balanced_loss': True, 'epochs': 120, 'early_stopping_patience': 20, 'plateau_patience': 11, 'plateau_divider': 2}. Best is trial 77 with value: 0.8807339449541285.
[I 2025-02-26 12:27:56,369] Trial 81 finished with value: 0.8772935779816514 and parameters: {'attention_pooling_operation': 'max', 'embedding_pooling_operation': 'mean', 'threshold': 0.48064531272988, 'batch_size': 246, 'attention_heads': 11, 'hidden_dimension': 93, 'number_of_hidden_layers': 2, 'dropout_rate': 0.435236258355984, 'global_pooling': 'max', 'learning_rate': 0.001549275557987122, 'weight_decay': 4.476764415788337e-06, 'beta_0': 0.8267373882598417, 'beta_1': 0.9904771126753658, 'epsilon': 1.7202624905894674e-08, 'balanced_loss': True, 'epochs': 122, 'early_stopping_patience': 20, 'plateau_patience': 12, 'plateau_divider': 2}. Best is trial 77 with value: 0.8807339449541285.
[I 2025-02-26 12:32:44,861] Trial 82 finished with value: 0.8658256880733946 and parameters: {'attention_pooling_operation': 'max', 'embedding_pooling_operation': 'mean', 'threshold': 0.4806144540660585, 'batch_size': 248, 'attention_heads': 11, 'hidden_dimension': 100, 'number_of_hidden_layers': 2, 'dropout_rate': 0.42285853945494123, 'global_pooling': 'max', 'learning_rate': 0.00147628629148043, 'weight_decay': 5.285806250079704e-06, 'beta_0': 0.8374890108616072, 'beta_1': 0.9905707977623968, 'epsilon': 1.80233072418063e-08, 'balanced_loss': True, 'epochs': 121, 'early_stopping_patience': 20, 'plateau_patience': 11, 'plateau_divider': 2}. Best is trial 77 with value: 0.8807339449541285.
[I 2025-02-26 12:37:51,519] Trial 83 finished with value: 0.8727064220183486 and parameters: {'attention_pooling_operation': 'max', 'embedding_pooling_operation': 'mean', 'threshold': 0.41105747191375136, 'batch_size': 248, 'attention_heads': 10, 'hidden_dimension': 122, 'number_of_hidden_layers': 2, 'dropout_rate': 0.4334656388853794, 'global_pooling': 'max', 'learning_rate': 0.004677011371206397, 'weight_decay': 2.4762408416302915e-06, 'beta_0': 0.8399516170048981, 'beta_1': 0.9895856620558161, 'epsilon': 1.2769638963135905e-08, 'balanced_loss': True, 'epochs': 117, 'early_stopping_patience': 19, 'plateau_patience': 12, 'plateau_divider': 2}. Best is trial 77 with value: 0.8807339449541285.
[I 2025-02-26 12:42:30,225] Trial 84 finished with value: 0.8658256880733946 and parameters: {'attention_pooling_operation': 'max', 'embedding_pooling_operation': 'mean', 'threshold': 0.43879382483330065, 'batch_size': 249, 'attention_heads': 10, 'hidden_dimension': 91, 'number_of_hidden_layers': 2, 'dropout_rate': 0.44745468702535746, 'global_pooling': 'max', 'learning_rate': 0.0017890270263334128, 'weight_decay': 8.153985174100701e-06, 'beta_0': 0.830694351746449, 'beta_1': 0.9910782361160009, 'epsilon': 3.550138590290549e-08, 'balanced_loss': True, 'epochs': 128, 'early_stopping_patience': 20, 'plateau_patience': 11, 'plateau_divider': 2}. Best is trial 77 with value: 0.8807339449541285.
[I 2025-02-26 12:47:08,230] Trial 85 finished with value: 0.8715596330275229 and parameters: {'attention_pooling_operation': 'max', 'embedding_pooling_operation': 'mean', 'threshold': 0.41873912939230723, 'batch_size': 234, 'attention_heads': 11, 'hidden_dimension': 68, 'number_of_hidden_layers': 2, 'dropout_rate': 0.5991365320298793, 'global_pooling': 'max', 'learning_rate': 0.007547654817816888, 'weight_decay': 1.665430963593154e-05, 'beta_0': 0.8045463210339576, 'beta_1': 0.9891309840317456, 'epsilon': 5.448013948112382e-08, 'balanced_loss': False, 'epochs': 123, 'early_stopping_patience': 21, 'plateau_patience': 10, 'plateau_divider': 2}. Best is trial 77 with value: 0.8807339449541285.
[I 2025-02-26 12:51:33,457] Trial 86 finished with value: 0.8784403669724771 and parameters: {'attention_pooling_operation': 'max', 'embedding_pooling_operation': 'mean', 'threshold': 0.4690115130927636, 'batch_size': 212, 'attention_heads': 10, 'hidden_dimension': 77, 'number_of_hidden_layers': 2, 'dropout_rate': 0.4228416099782643, 'global_pooling': 'max', 'learning_rate': 0.003173286266886367, 'weight_decay': 1.131269507802894e-05, 'beta_0': 0.815260921834993, 'beta_1': 0.98445883952868, 'epsilon': 2.4681049412173277e-08, 'balanced_loss': True, 'epochs': 134, 'early_stopping_patience': 20, 'plateau_patience': 12, 'plateau_divider': 2}. Best is trial 77 with value: 0.8807339449541285.
[I 2025-02-26 12:55:47,424] Trial 87 finished with value: 0.8704128440366973 and parameters: {'attention_pooling_operation': 'max', 'embedding_pooling_operation': 'mean', 'threshold': 0.46887348723425815, 'batch_size': 212, 'attention_heads': 10, 'hidden_dimension': 52, 'number_of_hidden_layers': 3, 'dropout_rate': 0.4672671292984792, 'global_pooling': 'max', 'learning_rate': 0.0010719862683279248, 'weight_decay': 1.2279640645362857e-05, 'beta_0': 0.8154372138728502, 'beta_1': 0.9843340092967585, 'epsilon': 1.825052287199767e-08, 'balanced_loss': True, 'epochs': 135, 'early_stopping_patience': 17, 'plateau_patience': 12, 'plateau_divider': 2}. Best is trial 77 with value: 0.8807339449541285.
[I 2025-02-26 12:59:57,568] Trial 88 finished with value: 0.8692660550458715 and parameters: {'attention_pooling_operation': 'max', 'embedding_pooling_operation': 'mean', 'threshold': 0.5093195475753729, 'batch_size': 226, 'attention_heads': 9, 'hidden_dimension': 61, 'number_of_hidden_layers': 2, 'dropout_rate': 0.484244272024965, 'global_pooling': 'max', 'learning_rate': 0.003587465021587262, 'weight_decay': 9.950240367819662e-06, 'beta_0': 0.8272943130091223, 'beta_1': 0.9884677884757169, 'epsilon': 1.615499520167263e-08, 'balanced_loss': False, 'epochs': 102, 'early_stopping_patience': 21, 'plateau_patience': 11, 'plateau_divider': 2}. Best is trial 77 with value: 0.8807339449541285.
[I 2025-02-26 13:04:46,817] Trial 89 finished with value: 0.8727064220183486 and parameters: {'attention_pooling_operation': 'max', 'embedding_pooling_operation': 'mean', 'threshold': 0.49674682885363924, 'batch_size': 196, 'attention_heads': 16, 'hidden_dimension': 77, 'number_of_hidden_layers': 2, 'dropout_rate': 0.4229709079065901, 'global_pooling': 'max', 'learning_rate': 0.001542633447332118, 'weight_decay': 6.5694244348219765e-06, 'beta_0': 0.8100523309667402, 'beta_1': 0.9848710503655995, 'epsilon': 4.699829766429437e-08, 'balanced_loss': True, 'epochs': 144, 'early_stopping_patience': 19, 'plateau_patience': 13, 'plateau_divider': 2}. Best is trial 77 with value: 0.8807339449541285.
[I 2025-02-26 13:09:44,336] Trial 90 finished with value: 0.8727064220183486 and parameters: {'attention_pooling_operation': 'max', 'embedding_pooling_operation': 'mean', 'threshold': 0.46950759807170034, 'batch_size': 152, 'attention_heads': 11, 'hidden_dimension': 89, 'number_of_hidden_layers': 3, 'dropout_rate': 0.48827153858757194, 'global_pooling': 'max', 'learning_rate': 0.0027508232643912367, 'weight_decay': 3.904908863615402e-06, 'beta_0': 0.8051784998523954, 'beta_1': 0.983101589317561, 'epsilon': 2.3190002551792257e-08, 'balanced_loss': False, 'epochs': 114, 'early_stopping_patience': 19, 'plateau_patience': 12, 'plateau_divider': 2}. Best is trial 77 with value: 0.8807339449541285.
[I 2025-02-26 13:14:13,762] Trial 91 finished with value: 0.8761467889908257 and parameters: {'attention_pooling_operation': 'max', 'embedding_pooling_operation': 'mean', 'threshold': 0.479864784253268, 'batch_size': 223, 'attention_heads': 10, 'hidden_dimension': 83, 'number_of_hidden_layers': 2, 'dropout_rate': 0.45000357010182923, 'global_pooling': 'max', 'learning_rate': 0.002360001976933076, 'weight_decay': 4.582710883410624e-06, 'beta_0': 0.8210380896267416, 'beta_1': 0.9903932235641757, 'epsilon': 2.8803482878290195e-08, 'balanced_loss': True, 'epochs': 126, 'early_stopping_patience': 20, 'plateau_patience': 13, 'plateau_divider': 2}. Best is trial 77 with value: 0.8807339449541285.
[I 2025-02-26 13:18:24,612] Trial 92 finished with value: 0.8658256880733946 and parameters: {'attention_pooling_operation': 'max', 'embedding_pooling_operation': 'mean', 'threshold': 0.458412893876195, 'batch_size': 213, 'attention_heads': 11, 'hidden_dimension': 36, 'number_of_hidden_layers': 2, 'dropout_rate': 0.4415116467379776, 'global_pooling': 'max', 'learning_rate': 0.001179114447790223, 'weight_decay': 2.214795790054802e-06, 'beta_0': 0.8442781148436608, 'beta_1': 0.9824907205193637, 'epsilon': 1.0237910770095174e-08, 'balanced_loss': True, 'epochs': 134, 'early_stopping_patience': 21, 'plateau_patience': 10, 'plateau_divider': 3}. Best is trial 77 with value: 0.8807339449541285.
