[I 2025-02-26 19:00:09,829] Trial 93 finished with value: 0.8600917431192661 and parameters: {'attention_pooling_operation': 'min', 'embedding_pooling_operation': 'max', 'threshold': 0.5836179996724669, 'batch_size': 148, 'attention_heads': 15, 'hidden_dimension': 170, 'number_of_hidden_layers': 2, 'dropout_rate': 0.5045447862385182, 'global_pooling': 'max', 'learning_rate': 0.0007190653089125864, 'weight_decay': 5.9413869530398464e-05, 'beta_0': 0.8083995898713012, 'beta_1': 0.9850806612844442, 'epsilon': 1.586091275631996e-08, 'balanced_loss': False, 'epochs': 176, 'early_stopping_patience': 23, 'plateau_patience': 16, 'plateau_divider': 9}. Best is trial 81 with value: 0.875.
[I 2025-02-26 19:07:57,280] Trial 94 finished with value: 0.8589449541284404 and parameters: {'attention_pooling_operation': 'min', 'embedding_pooling_operation': 'max', 'threshold': 0.6116473403085004, 'batch_size': 136, 'attention_heads': 15, 'hidden_dimension': 185, 'number_of_hidden_layers': 2, 'dropout_rate': 0.4734243522770876, 'global_pooling': 'max', 'learning_rate': 0.00015337563694507313, 'weight_decay': 3.708749688044688e-05, 'beta_0': 0.8430027430381402, 'beta_1': 0.9863479208944471, 'epsilon': 2.300947874093544e-08, 'balanced_loss': False, 'epochs': 187, 'early_stopping_patience': 24, 'plateau_patience': 14, 'plateau_divider': 8}. Best is trial 81 with value: 0.875.
[I 2025-02-26 19:12:51,383] Trial 95 finished with value: 0.8635321100917431 and parameters: {'attention_pooling_operation': 'min', 'embedding_pooling_operation': 'mean', 'threshold': 0.549800417407395, 'batch_size': 111, 'attention_heads': 16, 'hidden_dimension': 163, 'number_of_hidden_layers': 0, 'dropout_rate': 0.49929148656452443, 'global_pooling': 'max', 'learning_rate': 0.0004657978266611455, 'weight_decay': 7.149518191943301e-05, 'beta_0': 0.8121774157085819, 'beta_1': 0.987760031786004, 'epsilon': 5.160019626711709e-08, 'balanced_loss': False, 'epochs': 181, 'early_stopping_patience': 23, 'plateau_patience': 16, 'plateau_divider': 8}. Best is trial 81 with value: 0.875.
[I 2025-02-26 19:20:29,625] Trial 96 finished with value: 0.8681192660550459 and parameters: {'attention_pooling_operation': 'min', 'embedding_pooling_operation': 'max', 'threshold': 0.6664266673808507, 'batch_size': 141, 'attention_heads': 15, 'hidden_dimension': 190, 'number_of_hidden_layers': 2, 'dropout_rate': 0.4501787227922378, 'global_pooling': 'max', 'learning_rate': 0.00030362500594434416, 'weight_decay': 0.00011308128665943169, 'beta_0': 0.838925285499175, 'beta_1': 0.9861119516608485, 'epsilon': 1.3155698499338792e-08, 'balanced_loss': False, 'epochs': 198, 'early_stopping_patience': 25, 'plateau_patience': 18, 'plateau_divider': 9}. Best is trial 81 with value: 0.875.
[I 2025-02-26 19:26:45,880] Trial 97 finished with value: 0.8577981651376146 and parameters: {'attention_pooling_operation': 'min', 'embedding_pooling_operation': 'max', 'threshold': 0.6897859873048652, 'batch_size': 127, 'attention_heads': 16, 'hidden_dimension': 179, 'number_of_hidden_layers': 2, 'dropout_rate': 0.5145138715915606, 'global_pooling': 'sum', 'learning_rate': 0.0018339686236738095, 'weight_decay': 5.2872264426729636e-05, 'beta_0': 0.8224052462585821, 'beta_1': 0.997918147733076, 'epsilon': 4.441131543325614e-08, 'balanced_loss': False, 'epochs': 191, 'early_stopping_patience': 16, 'plateau_patience': 15, 'plateau_divider': 9}. Best is trial 81 with value: 0.875.
[I 2025-02-26 19:32:05,010] Trial 98 finished with value: 0.8623853211009175 and parameters: {'attention_pooling_operation': 'min', 'embedding_pooling_operation': 'max', 'threshold': 0.6516648987247313, 'batch_size': 161, 'attention_heads': 12, 'hidden_dimension': 213, 'number_of_hidden_layers': 1, 'dropout_rate': 0.4816322387504816, 'global_pooling': 'max', 'learning_rate': 0.000997786084456934, 'weight_decay': 0.00042791775494412185, 'beta_0': 0.819545775270999, 'beta_1': 0.9826847869952787, 'epsilon': 3.149030361245386e-08, 'balanced_loss': True, 'epochs': 182, 'early_stopping_patience': 23, 'plateau_patience': 16, 'plateau_divider': 10}. Best is trial 81 with value: 0.875.
[I 2025-02-26 19:40:04,490] Trial 99 finished with value: 0.6479357798165137 and parameters: {'attention_pooling_operation': 'min', 'embedding_pooling_operation': 'max', 'threshold': 0.5323154091460252, 'batch_size': 230, 'attention_heads': 15, 'hidden_dimension': 205, 'number_of_hidden_layers': 2, 'dropout_rate': 0.5076466828796999, 'global_pooling': 'max', 'learning_rate': 0.07206623111215438, 'weight_decay': 0.00017523889259429026, 'beta_0': 0.8143898281938635, 'beta_1': 0.9853448069197078, 'epsilon': 2.0026897899158162e-08, 'balanced_loss': False, 'epochs': 195, 'early_stopping_patience': 24, 'plateau_patience': 17, 'plateau_divider': 8}. Best is trial 81 with value: 0.875.
[I 2025-02-26 19:48:14,061] Trial 100 finished with value: 0.8623853211009175 and parameters: {'attention_pooling_operation': 'min', 'embedding_pooling_operation': 'max', 'threshold': 0.606581190691888, 'batch_size': 107, 'attention_heads': 16, 'hidden_dimension': 196, 'number_of_hidden_layers': 2, 'dropout_rate': 0.4704884923550074, 'global_pooling': 'max', 'learning_rate': 0.00024827581158384603, 'weight_decay': 2.490235059078211e-05, 'beta_0': 0.8166679753796632, 'beta_1': 0.9901588895468353, 'epsilon': 6.446982565834637e-08, 'balanced_loss': False, 'epochs': 187, 'early_stopping_patience': 24, 'plateau_patience': 17, 'plateau_divider': 9}. Best is trial 81 with value: 0.875.
[I 2025-02-26 19:55:09,331] Trial 101 finished with value: 0.8612385321100917 and parameters: {'attention_pooling_operation': 'min', 'embedding_pooling_operation': 'max', 'threshold': 0.6025984293556054, 'batch_size': 171, 'attention_heads': 15, 'hidden_dimension': 179, 'number_of_hidden_layers': 2, 'dropout_rate': 0.48837836958469877, 'global_pooling': 'max', 'learning_rate': 0.0008789622169716609, 'weight_decay': 4.59547210767697e-05, 'beta_0': 0.8091233504371387, 'beta_1': 0.9839134210121045, 'epsilon': 1.5573493530383763e-08, 'balanced_loss': False, 'epochs': 189, 'early_stopping_patience': 24, 'plateau_patience': 16, 'plateau_divider': 9}. Best is trial 81 with value: 0.875.
[I 2025-02-26 20:02:03,366] Trial 102 finished with value: 0.8612385321100917 and parameters: {'attention_pooling_operation': 'min', 'embedding_pooling_operation': 'max', 'threshold': 0.6289073905956103, 'batch_size': 135, 'attention_heads': 15, 'hidden_dimension': 173, 'number_of_hidden_layers': 2, 'dropout_rate': 0.4839100502880324, 'global_pooling': 'max', 'learning_rate': 0.000760138025085474, 'weight_decay': 4.229302618777414e-05, 'beta_0': 0.8105001027015821, 'beta_1': 0.9837389986803309, 'epsilon': 1.6858439646207718e-08, 'balanced_loss': False, 'epochs': 107, 'early_stopping_patience': 25, 'plateau_patience': 15, 'plateau_divider': 9}. Best is trial 81 with value: 0.875.
[I 2025-02-26 20:09:08,563] Trial 103 finished with value: 0.8600917431192661 and parameters: {'attention_pooling_operation': 'min', 'embedding_pooling_operation': 'max', 'threshold': 0.5935660448288215, 'batch_size': 139, 'attention_heads': 15, 'hidden_dimension': 187, 'number_of_hidden_layers': 2, 'dropout_rate': 0.44010372076351534, 'global_pooling': 'max', 'learning_rate': 0.0005854056676445467, 'weight_decay': 6.095014223851151e-05, 'beta_0': 0.8346207346480897, 'beta_1': 0.981893494891075, 'epsilon': 1.337802113733234e-08, 'balanced_loss': False, 'epochs': 191, 'early_stopping_patience': 23, 'plateau_patience': 16, 'plateau_divider': 9}. Best is trial 81 with value: 0.875.
[I 2025-02-26 20:15:52,713] Trial 104 finished with value: 0.8612385321100917 and parameters: {'attention_pooling_operation': 'min', 'embedding_pooling_operation': 'max', 'threshold': 0.5767218327005679, 'batch_size': 154, 'attention_heads': 16, 'hidden_dimension': 153, 'number_of_hidden_layers': 2, 'dropout_rate': 0.49197926704110306, 'global_pooling': 'max', 'learning_rate': 0.00041736424273921597, 'weight_decay': 0.0007911580480765909, 'beta_0': 0.8130770759843506, 'beta_1': 0.9845306467532153, 'epsilon': 2.5340074327535674e-08, 'balanced_loss': False, 'epochs': 199, 'early_stopping_patience': 24, 'plateau_patience': 17, 'plateau_divider': 8}. Best is trial 81 with value: 0.875.
[I 2025-02-26 20:21:24,762] Trial 105 finished with value: 0.8612385321100917 and parameters: {'attention_pooling_operation': 'min', 'embedding_pooling_operation': 'max', 'threshold': 0.6156072803039798, 'batch_size': 123, 'attention_heads': 14, 'hidden_dimension': 126, 'number_of_hidden_layers': 2, 'dropout_rate': 0.30820763832777576, 'global_pooling': 'max', 'learning_rate': 0.0012719997989170386, 'weight_decay': 8.894616738158213e-05, 'beta_0': 0.8072443129077637, 'beta_1': 0.9867211666646696, 'epsilon': 1.3754897947365826e-08, 'balanced_loss': False, 'epochs': 174, 'early_stopping_patience': 23, 'plateau_patience': 16, 'plateau_divider': 10}. Best is trial 81 with value: 0.875.
slurmstepd: error: *** JOB 15030000 ON gpu028 CANCELLED AT 2025-02-26T20:24:56 DUE TO TIME LIMIT ***
