[I 2025-03-21 07:08:35,144] Trial 238 finished with value: 0.8956422018348624 and parameters: {'attention_pooling_operation': 'max', 'embedding_pooling_operation': 'max', 'threshold': 0.48627218859930654, 'batch_size': 162, 'attention_heads': 13, 'hidden_dimension': 230, 'number_of_hidden_layers': 2, 'dropout_rate': 0.45424171615369574, 'global_pooling': 'max', 'learning_rate': 0.0009539726893784063, 'weight_decay': 0.00039022041928223663, 'beta_0': 0.8610231123466976, 'beta_1': 0.9962153923450796, 'epsilon': 1.8259263998073516e-05, 'balanced_loss': True, 'epochs': 128, 'early_stopping_patience': 22, 'plateau_patience': 22, 'plateau_divider': 4}. Best is trial 87 with value: 0.9151376146788991.
[I 2025-03-21 07:14:58,033] Trial 239 finished with value: 0.9002293577981652 and parameters: {'attention_pooling_operation': 'max', 'embedding_pooling_operation': 'max', 'threshold': 0.49759903402791444, 'batch_size': 165, 'attention_heads': 13, 'hidden_dimension': 216, 'number_of_hidden_layers': 2, 'dropout_rate': 0.44236526807211246, 'global_pooling': 'max', 'learning_rate': 0.0007175666947066766, 'weight_decay': 0.0003614043782969251, 'beta_0': 0.8639806067494561, 'beta_1': 0.9964611407483859, 'epsilon': 1.5403115368996913e-05, 'balanced_loss': True, 'epochs': 131, 'early_stopping_patience': 22, 'plateau_patience': 21, 'plateau_divider': 4}. Best is trial 87 with value: 0.9151376146788991.
[I 2025-03-21 07:20:02,680] Trial 240 finished with value: 0.9013761467889908 and parameters: {'attention_pooling_operation': 'max', 'embedding_pooling_operation': 'max', 'threshold': 0.47590385831034876, 'batch_size': 174, 'attention_heads': 8, 'hidden_dimension': 221, 'number_of_hidden_layers': 2, 'dropout_rate': 0.4491995411027815, 'global_pooling': 'max', 'learning_rate': 0.0010065789292733988, 'weight_decay': 0.0003251688122978059, 'beta_0': 0.8578134149935887, 'beta_1': 0.9970905765869984, 'epsilon': 1.998990611210573e-05, 'balanced_loss': True, 'epochs': 135, 'early_stopping_patience': 21, 'plateau_patience': 21, 'plateau_divider': 4}. Best is trial 87 with value: 0.9151376146788991.
[I 2025-03-21 07:27:14,609] Trial 241 finished with value: 0.8990825688073395 and parameters: {'attention_pooling_operation': 'max', 'embedding_pooling_operation': 'max', 'threshold': 0.48572422878753774, 'batch_size': 217, 'attention_heads': 13, 'hidden_dimension': 220, 'number_of_hidden_layers': 2, 'dropout_rate': 0.46127252889145787, 'global_pooling': 'max', 'learning_rate': 0.0008170074848723198, 'weight_decay': 0.000280575471498651, 'beta_0': 0.8621847168165935, 'beta_1': 0.9975386638800802, 'epsilon': 2.492184249976477e-05, 'balanced_loss': False, 'epochs': 141, 'early_stopping_patience': 22, 'plateau_patience': 24, 'plateau_divider': 4}. Best is trial 87 with value: 0.9151376146788991.
[I 2025-03-21 07:33:25,014] Trial 242 finished with value: 0.9013761467889908 and parameters: {'attention_pooling_operation': 'max', 'embedding_pooling_operation': 'max', 'threshold': 0.5196217728807139, 'batch_size': 160, 'attention_heads': 14, 'hidden_dimension': 212, 'number_of_hidden_layers': 2, 'dropout_rate': 0.45579776514677306, 'global_pooling': 'max', 'learning_rate': 0.000633250808948229, 'weight_decay': 0.00018585817216789624, 'beta_0': 0.8694068023265942, 'beta_1': 0.9985045403301903, 'epsilon': 1.6029489056995837e-05, 'balanced_loss': True, 'epochs': 129, 'early_stopping_patience': 20, 'plateau_patience': 21, 'plateau_divider': 4}. Best is trial 87 with value: 0.9151376146788991.
[I 2025-03-21 07:39:53,020] Trial 243 finished with value: 0.9013761467889908 and parameters: {'attention_pooling_operation': 'max', 'embedding_pooling_operation': 'max', 'threshold': 0.46730580288493884, 'batch_size': 142, 'attention_heads': 13, 'hidden_dimension': 216, 'number_of_hidden_layers': 2, 'dropout_rate': 0.4638497762157489, 'global_pooling': 'max', 'learning_rate': 0.001440737532433661, 'weight_decay': 0.00023567519894297757, 'beta_0': 0.8045445265611865, 'beta_1': 0.996939032320247, 'epsilon': 1.286506868614989e-05, 'balanced_loss': True, 'epochs': 126, 'early_stopping_patience': 22, 'plateau_patience': 21, 'plateau_divider': 6}. Best is trial 87 with value: 0.9151376146788991.
[I 2025-03-21 07:45:50,298] Trial 244 finished with value: 0.9013761467889908 and parameters: {'attention_pooling_operation': 'max', 'embedding_pooling_operation': 'max', 'threshold': 0.49526353982219573, 'batch_size': 169, 'attention_heads': 12, 'hidden_dimension': 203, 'number_of_hidden_layers': 2, 'dropout_rate': 0.459278309426975, 'global_pooling': 'max', 'learning_rate': 0.0010848189906669163, 'weight_decay': 0.0004095241935911351, 'beta_0': 0.8061380320648548, 'beta_1': 0.996696387303826, 'epsilon': 1.3850148864328648e-05, 'balanced_loss': True, 'epochs': 121, 'early_stopping_patience': 23, 'plateau_patience': 22, 'plateau_divider': 3}. Best is trial 87 with value: 0.9151376146788991.
[I 2025-03-21 07:52:41,063] Trial 245 finished with value: 0.9013761467889908 and parameters: {'attention_pooling_operation': 'max', 'embedding_pooling_operation': 'max', 'threshold': 0.4770761764582525, 'batch_size': 133, 'attention_heads': 13, 'hidden_dimension': 197, 'number_of_hidden_layers': 2, 'dropout_rate': 0.49303056569620224, 'global_pooling': 'max', 'learning_rate': 0.0017207458988869146, 'weight_decay': 4.5959700581753036e-05, 'beta_0': 0.8656408520890109, 'beta_1': 0.997484458313482, 'epsilon': 2.8488383915683135e-05, 'balanced_loss': True, 'epochs': 132, 'early_stopping_patience': 25, 'plateau_patience': 21, 'plateau_divider': 6}. Best is trial 87 with value: 0.9151376146788991.
[I 2025-03-21 07:59:40,351] Trial 246 finished with value: 0.908256880733945 and parameters: {'attention_pooling_operation': 'max', 'embedding_pooling_operation': 'max', 'threshold': 0.4511287230840731, 'batch_size': 137, 'attention_heads': 13, 'hidden_dimension': 225, 'number_of_hidden_layers': 2, 'dropout_rate': 0.5334369544630257, 'global_pooling': 'max', 'learning_rate': 0.001285658884998778, 'weight_decay': 4.460416239608317e-06, 'beta_0': 0.8596300072791879, 'beta_1': 0.997167360092248, 'epsilon': 6.3436130502040446e-06, 'balanced_loss': True, 'epochs': 137, 'early_stopping_patience': 17, 'plateau_patience': 20, 'plateau_divider': 7}. Best is trial 87 with value: 0.9151376146788991.
[I 2025-03-21 08:07:00,328] Trial 247 finished with value: 0.9048165137614679 and parameters: {'attention_pooling_operation': 'max', 'embedding_pooling_operation': 'max', 'threshold': 0.40213045970736727, 'batch_size': 136, 'attention_heads': 13, 'hidden_dimension': 228, 'number_of_hidden_layers': 3, 'dropout_rate': 0.5302537493236377, 'global_pooling': 'mean', 'learning_rate': 0.0012541452338755152, 'weight_decay': 0.0003170642068817931, 'beta_0': 0.8585860762918508, 'beta_1': 0.9972283276506027, 'epsilon': 6.403881700166644e-06, 'balanced_loss': True, 'epochs': 138, 'early_stopping_patience': 17, 'plateau_patience': 22, 'plateau_divider': 4}. Best is trial 87 with value: 0.9151376146788991.
[I 2025-03-21 08:13:34,550] Trial 248 finished with value: 0.9059633027522935 and parameters: {'attention_pooling_operation': 'max', 'embedding_pooling_operation': 'max', 'threshold': 0.5058298337273904, 'batch_size': 179, 'attention_heads': 13, 'hidden_dimension': 235, 'number_of_hidden_layers': 2, 'dropout_rate': 0.5391383871037613, 'global_pooling': 'max', 'learning_rate': 0.0008836851817887146, 'weight_decay': 4.573268536943372e-06, 'beta_0': 0.8604883481662103, 'beta_1': 0.9954543055276205, 'epsilon': 5.5057878294488755e-06, 'balanced_loss': True, 'epochs': 136, 'early_stopping_patience': 17, 'plateau_patience': 23, 'plateau_divider': 5}. Best is trial 87 with value: 0.9151376146788991.
[I 2025-03-21 08:20:00,006] Trial 249 finished with value: 0.9025229357798165 and parameters: {'attention_pooling_operation': 'max', 'embedding_pooling_operation': 'max', 'threshold': 0.43579399011895487, 'batch_size': 165, 'attention_heads': 14, 'hidden_dimension': 222, 'number_of_hidden_layers': 2, 'dropout_rate': 0.5190383878737559, 'global_pooling': 'max', 'learning_rate': 0.0011284812346325785, 'weight_decay': 0.0002614465400646491, 'beta_0': 0.8538820844959779, 'beta_1': 0.9977750849796605, 'epsilon': 8.040785494036644e-06, 'balanced_loss': True, 'epochs': 72, 'early_stopping_patience': 18, 'plateau_patience': 20, 'plateau_divider': 2}. Best is trial 87 with value: 0.9151376146788991.
[I 2025-03-21 08:27:08,093] Trial 250 finished with value: 0.9036697247706422 and parameters: {'attention_pooling_operation': 'max', 'embedding_pooling_operation': 'max', 'threshold': 0.4612371733872165, 'batch_size': 158, 'attention_heads': 13, 'hidden_dimension': 227, 'number_of_hidden_layers': 2, 'dropout_rate': 0.534087092442928, 'global_pooling': 'max', 'learning_rate': 0.001375009981319377, 'weight_decay': 5.759374900505942e-05, 'beta_0': 0.8562443013553632, 'beta_1': 0.9986919169854294, 'epsilon': 6.644862258191591e-06, 'balanced_loss': True, 'epochs': 129, 'early_stopping_patience': 17, 'plateau_patience': 20, 'plateau_divider': 3}. Best is trial 87 with value: 0.9151376146788991.
[I 2025-03-21 08:33:53,681] Trial 251 finished with value: 0.9002293577981652 and parameters: {'attention_pooling_operation': 'min', 'embedding_pooling_operation': 'max', 'threshold': 0.4865944188445161, 'batch_size': 225, 'attention_heads': 13, 'hidden_dimension': 214, 'number_of_hidden_layers': 2, 'dropout_rate': 0.5100858195141472, 'global_pooling': 'max', 'learning_rate': 0.0010345078988324755, 'weight_decay': 5.806088163530819e-06, 'beta_0': 0.863643711147892, 'beta_1': 0.997192354389543, 'epsilon': 2.125970346352952e-05, 'balanced_loss': True, 'epochs': 133, 'early_stopping_patience': 19, 'plateau_patience': 22, 'plateau_divider': 7}. Best is trial 87 with value: 0.9151376146788991.

[TRIAL] 87 [VALIDATION PERFORMANCE] 0.9151376146788991 [TRAINING LOSS] 0.10381594000429642 [VALIDATION LOSS] 0.3263206258416176 

number                                      87
value                                 0.915138
params_threshold                      0.436154
params_attention_heads                      12
params_balanced_loss                      True
params_embedding_pooling_operation         max
params_attention_pooling_operation         max
params_batch_size                          169
params_dropout_rate                   0.474901
params_early_stopping_patience              20
params_epochs                              137
params_global_pooling                      max
params_hidden_dimension                    159
params_learning_rate                  0.001148
params_number_of_hidden_layers               2
params_plateau_divider                       4
params_plateau_patience                     21
params_weight_decay                   0.000417
params_beta_0                         0.859238
params_beta_1                         0.998361
params_epsilon                        0.000013
user_attrs_epoch                          14.0
user_attrs_training_loss              0.103816
user_attrs_validation_loss            0.326321
Name: 87, dtype: object
37 Val: 0.8979357798165137 Test: 0.8945634266886326
38 Val: 0.8990825688073395 Test: 0.8984074684239429
39 Val: 0.9048165137614679 Test: 0.8956617243272927
40 Val: 0.9013761467889908 Test: 0.8890719384953323
41 Val: 0.9025229357798165 Test: 0.8907193849533224
42 Val: 0.9059633027522935 Test: 0.8956617243272927
43 Val: 0.9002293577981652 Test: 0.8951125755079626
44 Val: 0.9036697247706422 Test: 0.8934651290499726
45 Val: 0.9036697247706422 Test: 0.8934651290499726
46 Val: 0.8956422018348624 Test: 0.8945634266886326
Validation performance: 89.56 & 90.15 ± 0.33 & 90.6
Testing performance: 88.91 & 89.41 ± 0.26 & 89.84

[TRIAL] 74 [VALIDATION PERFORMANCE] 0.9139908256880734 [TRAINING LOSS] 0.23965048917702267 [VALIDATION LOSS] 0.2765874475240707 

number                                      74
value                                 0.913991
params_threshold                      0.483291
params_attention_heads                      13
params_balanced_loss                      True
params_embedding_pooling_operation         max
params_attention_pooling_operation         max
params_batch_size                          203
params_dropout_rate                   0.464175
params_early_stopping_patience              24
params_epochs                              122
params_global_pooling                      max
params_hidden_dimension                    212
params_learning_rate                  0.000997
params_number_of_hidden_layers               2
params_plateau_divider                       2
params_plateau_patience                     24
params_weight_decay                   0.000044
params_beta_0                         0.893844
params_beta_1                         0.989903
params_epsilon                        0.000006
user_attrs_epoch                           6.0
user_attrs_training_loss               0.23965
user_attrs_validation_loss            0.276587
Name: 74, dtype: object
37 Val: 0.9025229357798165 Test: 0.9028006589785832
38 Val: 0.9025229357798165 Test: 0.8934651290499726
39 Val: 0.8967889908256881 Test: 0.8841295991213619
40 Val: 0.8979357798165137 Test: 0.8967600219659527
41 Val: 0.9025229357798165 Test: 0.8901702361339923
42 Val: 0.9036697247706422 Test: 0.8885227896760022
43 Val: 0.9002293577981652 Test: 0.8956617243272927
44 Val: 0.8990825688073395 Test: 0.8918176825919825
45 Val: 0.9025229357798165 Test: 0.8956617243272927
46 Val: 0.9013761467889908 Test: 0.8830313014827018
Validation performance: 89.68 & 90.09 ± 0.23 & 90.37
Testing performance: 88.3 & 89.22 ± 0.6 & 90.28

[TRIAL] 194 [VALIDATION PERFORMANCE] 0.9128440366972477 [TRAINING LOSS] 0.13772283502075136 [VALIDATION LOSS] 0.3109882303646633 

number                                     194
value                                 0.912844
params_threshold                      0.438639
params_attention_heads                      11
params_balanced_loss                      True
params_embedding_pooling_operation         max
params_attention_pooling_operation         max
params_batch_size                          143
params_dropout_rate                   0.550125
params_early_stopping_patience              22
params_epochs                              121
params_global_pooling                      max
params_hidden_dimension                    196
params_learning_rate                  0.002401
params_number_of_hidden_layers               2
params_plateau_divider                       7
params_plateau_patience                     19
params_weight_decay                   0.000966
params_beta_0                         0.806214
params_beta_1                         0.997553
params_epsilon                        0.000003
user_attrs_epoch                          23.0
user_attrs_training_loss              0.137723
user_attrs_validation_loss            0.310988
Name: 194, dtype: object
37 Val: 0.9059633027522935 Test: 0.8962108731466227
38 Val: 0.9013761467889908 Test: 0.8989566172432729
39 Val: 0.8979357798165137 Test: 0.8929159802306426
40 Val: 0.9036697247706422 Test: 0.9033498077979132
41 Val: 0.908256880733945 Test: 0.9011532125205931
42 Val: 0.8990825688073395 Test: 0.8978583196046128
43 Val: 0.9002293577981652 Test: 0.9011532125205931
44 Val: 0.908256880733945 Test: 0.8912685337726524
45 Val: 0.9025229357798165 Test: 0.8907193849533224
46 Val: 0.9048165137614679 Test: 0.8841295991213619
Validation performance: 89.79 & 90.32 ± 0.36 & 90.83
Testing performance: 88.41 & 89.58 ± 0.6 & 90.33

[TRIAL] 65 [VALIDATION PERFORMANCE] 0.911697247706422 [TRAINING LOSS] 0.18848703778348863 [VALIDATION LOSS] 0.2640939764678478 

number                                      65
value                                 0.911697
params_threshold                      0.530409
params_attention_heads                      13
params_balanced_loss                      True
params_embedding_pooling_operation         max
params_attention_pooling_operation         max
params_batch_size                          222
params_dropout_rate                   0.494642
params_early_stopping_patience              25
params_epochs                              128
params_global_pooling                      max
params_hidden_dimension                    198
params_learning_rate                  0.002333
params_number_of_hidden_layers               2
params_plateau_divider                       3
params_plateau_patience                     24
params_weight_decay                    0.00003
params_beta_0                          0.86328
params_beta_1                         0.994269
params_epsilon                         0.00001
user_attrs_epoch                          11.0
user_attrs_training_loss              0.188487
user_attrs_validation_loss            0.264094
Name: 65, dtype: object
37 Val: 0.9013761467889908 Test: 0.8841295991213619
38 Val: 0.9025229357798165 Test: 0.899505766062603
39 Val: 0.9059633027522935 Test: 0.8989566172432729
40 Val: 0.9048165137614679 Test: 0.8918176825919825
41 Val: 0.8967889908256881 Test: 0.885227896760022
42 Val: 0.8990825688073395 Test: 0.885777045579352
43 Val: 0.8979357798165137 Test: 0.8962108731466227
44 Val: 0.9139908256880734 Test: 0.8956617243272927
45 Val: 0.9128440366972477 Test: 0.8967600219659527
46 Val: 0.9025229357798165 Test: 0.8951125755079626
Validation performance: 89.68 & 90.38 ± 0.58 & 91.4
Testing performance: 88.41 & 89.29 ± 0.58 & 89.95

[TRIAL] 124 [VALIDATION PERFORMANCE] 0.9105504587155964 [TRAINING LOSS] 0.07084622874674273 [VALIDATION LOSS] 0.3593502640724182 

number                                     124
value                                  0.91055
params_threshold                       0.55896
params_attention_heads                      13
params_balanced_loss                      True
params_embedding_pooling_operation         max
params_attention_pooling_operation         max
params_batch_size                          170
params_dropout_rate                   0.494906
params_early_stopping_patience              22
params_epochs                              118
params_global_pooling                      max
params_hidden_dimension                    207
params_learning_rate                  0.001776
params_number_of_hidden_layers               2
params_plateau_divider                       3
params_plateau_patience                     22
params_weight_decay                   0.000077
params_beta_0                         0.851084
params_beta_1                         0.998628
params_epsilon                        0.000006
user_attrs_epoch                          28.0
user_attrs_training_loss              0.070846
user_attrs_validation_loss             0.35935
Name: 124, dtype: object
37 Val: 0.9036697247706422 Test: 0.8901702361339923
38 Val: 0.9013761467889908 Test: 0.8934651290499726
39 Val: 0.9025229357798165 Test: 0.8868753432180121
40 Val: 0.9025229357798165 Test: 0.8901702361339923
41 Val: 0.9013761467889908 Test: 0.8912685337726524
42 Val: 0.9059633027522935 Test: 0.900054914881933
43 Val: 0.9059633027522935 Test: 0.8923668314113125
44 Val: 0.9036697247706422 Test: 0.8912685337726524
45 Val: 0.9036697247706422 Test: 0.8951125755079626
46 Val: 0.9071100917431193 Test: 0.8890719384953323
Validation performance: 90.14 & 90.38 ± 0.2 & 90.71
Testing performance: 88.69 & 89.2 ± 0.36 & 90.01

[SST-2] Elapsed time: 598.7989253838857 minutes.
