[I 2025-02-26 13:22:46,685] Trial 93 finished with value: 0.875 and parameters: {'attention_pooling_operation': 'max', 'embedding_pooling_operation': 'mean', 'threshold': 0.5236363224059934, 'batch_size': 238, 'attention_heads': 8, 'hidden_dimension': 99, 'number_of_hidden_layers': 2, 'dropout_rate': 0.43467682553567194, 'global_pooling': 'max', 'learning_rate': 0.0031230377681400485, 'weight_decay': 2.5016183352729828e-05, 'beta_0': 0.8128778259154804, 'beta_1': 0.9912275493041064, 'epsilon': 2.0642094027275613e-08, 'balanced_loss': True, 'epochs': 141, 'early_stopping_patience': 20, 'plateau_patience': 14, 'plateau_divider': 2}. Best is trial 77 with value: 0.8807339449541285.
[I 2025-02-26 13:27:48,384] Trial 94 finished with value: 0.8681192660550459 and parameters: {'attention_pooling_operation': 'max', 'embedding_pooling_operation': 'mean', 'threshold': 0.4314851112950884, 'batch_size': 179, 'attention_heads': 11, 'hidden_dimension': 106, 'number_of_hidden_layers': 2, 'dropout_rate': 0.4659922648553961, 'global_pooling': 'max', 'learning_rate': 0.004443212586498146, 'weight_decay': 7.002390781838194e-05, 'beta_0': 0.8035032180504751, 'beta_1': 0.9879946362930214, 'epsilon': 5.685900363960466e-05, 'balanced_loss': True, 'epochs': 109, 'early_stopping_patience': 18, 'plateau_patience': 12, 'plateau_divider': 2}. Best is trial 77 with value: 0.8807339449541285.
[I 2025-02-26 13:32:14,690] Trial 95 finished with value: 0.8715596330275229 and parameters: {'attention_pooling_operation': 'max', 'embedding_pooling_operation': 'mean', 'threshold': 0.49594398378297067, 'batch_size': 244, 'attention_heads': 11, 'hidden_dimension': 62, 'number_of_hidden_layers': 2, 'dropout_rate': 0.4757406351447332, 'global_pooling': 'max', 'learning_rate': 0.0016681676902506515, 'weight_decay': 1.4778429278362008e-05, 'beta_0': 0.8315831488848018, 'beta_1': 0.9810743001304986, 'epsilon': 8.507485123247176e-05, 'balanced_loss': True, 'epochs': 130, 'early_stopping_patience': 21, 'plateau_patience': 11, 'plateau_divider': 3}. Best is trial 77 with value: 0.8807339449541285.
[I 2025-02-26 13:38:05,397] Trial 96 finished with value: 0.8772935779816514 and parameters: {'attention_pooling_operation': 'max', 'embedding_pooling_operation': 'mean', 'threshold': 0.4421268831141062, 'batch_size': 187, 'attention_heads': 16, 'hidden_dimension': 117, 'number_of_hidden_layers': 2, 'dropout_rate': 0.39714033957478145, 'global_pooling': 'max', 'learning_rate': 0.0006634938962119498, 'weight_decay': 2.056664300475691e-05, 'beta_0': 0.8246914025795288, 'beta_1': 0.9922039161041816, 'epsilon': 1.1718644202433636e-08, 'balanced_loss': True, 'epochs': 118, 'early_stopping_patience': 19, 'plateau_patience': 14, 'plateau_divider': 6}. Best is trial 77 with value: 0.8807339449541285.
[I 2025-02-26 13:43:48,173] Trial 97 finished with value: 0.8669724770642202 and parameters: {'attention_pooling_operation': 'max', 'embedding_pooling_operation': 'mean', 'threshold': 0.4392898940401294, 'batch_size': 161, 'attention_heads': 16, 'hidden_dimension': 113, 'number_of_hidden_layers': 2, 'dropout_rate': 0.3876436840490771, 'global_pooling': 'max', 'learning_rate': 0.0005336431347909073, 'weight_decay': 2.0949633440177033e-05, 'beta_0': 0.822842705594643, 'beta_1': 0.9839363977420522, 'epsilon': 1.2805716310973697e-08, 'balanced_loss': True, 'epochs': 125, 'early_stopping_patience': 19, 'plateau_patience': 14, 'plateau_divider': 6}. Best is trial 77 with value: 0.8807339449541285.
[I 2025-02-26 13:49:34,223] Trial 98 finished with value: 0.8795871559633027 and parameters: {'attention_pooling_operation': 'max', 'embedding_pooling_operation': 'mean', 'threshold': 0.4469827363069808, 'batch_size': 188, 'attention_heads': 16, 'hidden_dimension': 119, 'number_of_hidden_layers': 2, 'dropout_rate': 0.4193139956117229, 'global_pooling': 'max', 'learning_rate': 0.0006610632595737859, 'weight_decay': 3.044768560070643e-05, 'beta_0': 0.8338884360444196, 'beta_1': 0.9864696775470976, 'epsilon': 3.8581775596449473e-05, 'balanced_loss': False, 'epochs': 118, 'early_stopping_patience': 18, 'plateau_patience': 13, 'plateau_divider': 7}. Best is trial 77 with value: 0.8807339449541285.
[I 2025-02-26 13:55:53,088] Trial 99 finished with value: 0.6204128440366973 and parameters: {'attention_pooling_operation': 'max', 'embedding_pooling_operation': 'min', 'threshold': 0.5381099303061178, 'batch_size': 167, 'attention_heads': 7, 'hidden_dimension': 73, 'number_of_hidden_layers': 2, 'dropout_rate': 0.4120991433162732, 'global_pooling': 'max', 'learning_rate': 0.07206623111215438, 'weight_decay': 3.325842876215002e-05, 'beta_0': 0.8383701179516238, 'beta_1': 0.9863580368721295, 'epsilon': 3.376894561452183e-05, 'balanced_loss': False, 'epochs': 121, 'early_stopping_patience': 18, 'plateau_patience': 13, 'plateau_divider': 8}. Best is trial 77 with value: 0.8807339449541285.
[I 2025-02-26 14:01:29,968] Trial 100 finished with value: 0.8681192660550459 and parameters: {'attention_pooling_operation': 'max', 'embedding_pooling_operation': 'mean', 'threshold': 0.4212620365125828, 'batch_size': 177, 'attention_heads': 15, 'hidden_dimension': 97, 'number_of_hidden_layers': 2, 'dropout_rate': 0.4235815278300864, 'global_pooling': 'max', 'learning_rate': 0.0009506137612266405, 'weight_decay': 1.5379895620642044e-06, 'beta_0': 0.851060367222432, 'beta_1': 0.984641309587999, 'epsilon': 5.8761795912645756e-05, 'balanced_loss': False, 'epochs': 114, 'early_stopping_patience': 22, 'plateau_patience': 21, 'plateau_divider': 7}. Best is trial 77 with value: 0.8807339449541285.
[I 2025-02-26 14:07:05,850] Trial 101 finished with value: 0.8669724770642202 and parameters: {'attention_pooling_operation': 'max', 'embedding_pooling_operation': 'mean', 'threshold': 0.4457486724706182, 'batch_size': 202, 'attention_heads': 16, 'hidden_dimension': 105, 'number_of_hidden_layers': 2, 'dropout_rate': 0.3921116192996153, 'global_pooling': 'max', 'learning_rate': 0.00039373846796707127, 'weight_decay': 4.2245091715780505e-05, 'beta_0': 0.826230922498143, 'beta_1': 0.9854432276876011, 'epsilon': 1.0930568735601063e-08, 'balanced_loss': False, 'epochs': 118, 'early_stopping_patience': 20, 'plateau_patience': 13, 'plateau_divider': 7}. Best is trial 77 with value: 0.8807339449541285.
[I 2025-02-26 14:13:19,380] Trial 102 finished with value: 0.8727064220183486 and parameters: {'attention_pooling_operation': 'max', 'embedding_pooling_operation': 'mean', 'threshold': 0.46357123534033906, 'batch_size': 187, 'attention_heads': 16, 'hidden_dimension': 127, 'number_of_hidden_layers': 2, 'dropout_rate': 0.40932437453122517, 'global_pooling': 'max', 'learning_rate': 0.00024950572129656546, 'weight_decay': 2.966108338865714e-05, 'beta_0': 0.8342035820207385, 'beta_1': 0.9899464585092396, 'epsilon': 1.6129171369701774e-08, 'balanced_loss': False, 'epochs': 107, 'early_stopping_patience': 18, 'plateau_patience': 13, 'plateau_divider': 9}. Best is trial 77 with value: 0.8807339449541285.
[I 2025-02-26 14:18:51,567] Trial 103 finished with value: 0.8658256880733946 and parameters: {'attention_pooling_operation': 'max', 'embedding_pooling_operation': 'mean', 'threshold': 0.510131436311208, 'batch_size': 184, 'attention_heads': 15, 'hidden_dimension': 119, 'number_of_hidden_layers': 2, 'dropout_rate': 0.4541602393043803, 'global_pooling': 'max', 'learning_rate': 0.0006425453089340719, 'weight_decay': 1.000646136336293e-05, 'beta_0': 0.8344992146411275, 'beta_1': 0.9907291572913195, 'epsilon': 3.899885180969543e-05, 'balanced_loss': False, 'epochs': 133, 'early_stopping_patience': 19, 'plateau_patience': 12, 'plateau_divider': 6}. Best is trial 77 with value: 0.8807339449541285.
[I 2025-02-26 14:25:39,651] Trial 104 finished with value: 0.8738532110091743 and parameters: {'attention_pooling_operation': 'max', 'embedding_pooling_operation': 'mean', 'threshold': 0.40569309315521324, 'batch_size': 189, 'attention_heads': 16, 'hidden_dimension': 112, 'number_of_hidden_layers': 3, 'dropout_rate': 0.4281499133358614, 'global_pooling': 'max', 'learning_rate': 0.0007569476194700704, 'weight_decay': 1.0199767857893966e-05, 'beta_0': 0.8276391529960335, 'beta_1': 0.9867826113775142, 'epsilon': 4.7971636122654564e-05, 'balanced_loss': True, 'epochs': 117, 'early_stopping_patience': 20, 'plateau_patience': 23, 'plateau_divider': 7}. Best is trial 77 with value: 0.8807339449541285.
[I 2025-02-26 14:31:32,406] Trial 105 finished with value: 0.8692660550458715 and parameters: {'attention_pooling_operation': 'max', 'embedding_pooling_operation': 'mean', 'threshold': 0.44612272470175635, 'batch_size': 171, 'attention_heads': 16, 'hidden_dimension': 124, 'number_of_hidden_layers': 2, 'dropout_rate': 0.3986094157170014, 'global_pooling': 'max', 'learning_rate': 0.0012028930645317836, 'weight_decay': 2.3252436002753423e-05, 'beta_0': 0.8172745971659767, 'beta_1': 0.9932874126055318, 'epsilon': 5.403549622034802e-06, 'balanced_loss': False, 'epochs': 123, 'early_stopping_patience': 19, 'plateau_patience': 14, 'plateau_divider': 8}. Best is trial 77 with value: 0.8807339449541285.
[I 2025-02-26 14:36:29,229] Trial 106 finished with value: 0.8715596330275229 and parameters: {'attention_pooling_operation': 'max', 'embedding_pooling_operation': 'mean', 'threshold': 0.4927597040141854, 'batch_size': 193, 'attention_heads': 15, 'hidden_dimension': 93, 'number_of_hidden_layers': 2, 'dropout_rate': 0.5061210046613228, 'global_pooling': 'max', 'learning_rate': 0.00046890302108337296, 'weight_decay': 1.5349642858273018e-05, 'beta_0': 0.8463954634789304, 'beta_1': 0.9890986934409346, 'epsilon': 2.391146702272725e-05, 'balanced_loss': True, 'epochs': 111, 'early_stopping_patience': 17, 'plateau_patience': 14, 'plateau_divider': 6}. Best is trial 77 with value: 0.8807339449541285.
[I 2025-02-26 14:41:27,553] Trial 107 finished with value: 0.8623853211009175 and parameters: {'attention_pooling_operation': 'min', 'embedding_pooling_operation': 'mean', 'threshold': 0.42907323195275926, 'batch_size': 163, 'attention_heads': 12, 'hidden_dimension': 81, 'number_of_hidden_layers': 2, 'dropout_rate': 0.5209923901588055, 'global_pooling': 'sum', 'learning_rate': 0.0006353688651467582, 'weight_decay': 1.8108571155885205e-05, 'beta_0': 0.841407860017541, 'beta_1': 0.992314882590172, 'epsilon': 7.954444221516008e-05, 'balanced_loss': True, 'epochs': 141, 'early_stopping_patience': 20, 'plateau_patience': 11, 'plateau_divider': 2}. Best is trial 77 with value: 0.8807339449541285.
[I 2025-02-26 14:47:17,628] Trial 108 finished with value: 0.8704128440366973 and parameters: {'attention_pooling_operation': 'max', 'embedding_pooling_operation': 'min', 'threshold': 0.5724557468038998, 'batch_size': 140, 'attention_heads': 16, 'hidden_dimension': 133, 'number_of_hidden_layers': 2, 'dropout_rate': 0.4599834710652425, 'global_pooling': 'max', 'learning_rate': 0.0014170274551675577, 'weight_decay': 5.387007600573411e-05, 'beta_0': 0.800723388376725, 'beta_1': 0.9836034364446893, 'epsilon': 1.1916496094799442e-05, 'balanced_loss': False, 'epochs': 150, 'early_stopping_patience': 21, 'plateau_patience': 12, 'plateau_divider': 2}. Best is trial 77 with value: 0.8807339449541285.
[I 2025-02-26 14:52:01,749] Trial 109 finished with value: 0.8658256880733946 and parameters: {'attention_pooling_operation': 'max', 'embedding_pooling_operation': 'mean', 'threshold': 0.756426566381074, 'batch_size': 204, 'attention_heads': 15, 'hidden_dimension': 89, 'number_of_hidden_layers': 2, 'dropout_rate': 0.49537863563804535, 'global_pooling': 'max', 'learning_rate': 0.0064102892991097825, 'weight_decay': 0.00010007177811812488, 'beta_0': 0.8193331116098209, 'beta_1': 0.9827495184782028, 'epsilon': 2.5227974620049573e-05, 'balanced_loss': True, 'epochs': 98, 'early_stopping_patience': 22, 'plateau_patience': 24, 'plateau_divider': 6}. Best is trial 77 with value: 0.8807339449541285.
[I 2025-02-26 14:56:51,036] Trial 110 finished with value: 0.8692660550458715 and parameters: {'attention_pooling_operation': 'max', 'embedding_pooling_operation': 'mean', 'threshold': 0.400063879892391, 'batch_size': 209, 'attention_heads': 16, 'hidden_dimension': 70, 'number_of_hidden_layers': 2, 'dropout_rate': 0.44632974058600955, 'global_pooling': 'max', 'learning_rate': 0.00249143681190233, 'weight_decay': 0.00015067207427606758, 'beta_0': 0.8250958251366484, 'beta_1': 0.9914339751254558, 'epsilon': 6.650238767540153e-05, 'balanced_loss': True, 'epochs': 127, 'early_stopping_patience': 19, 'plateau_patience': 13, 'plateau_divider': 2}. Best is trial 77 with value: 0.8807339449541285.
[I 2025-02-26 15:01:58,515] Trial 111 finished with value: 0.875 and parameters: {'attention_pooling_operation': 'mean', 'embedding_pooling_operation': 'mean', 'threshold': 0.4865468149014623, 'batch_size': 234, 'attention_heads': 9, 'hidden_dimension': 147, 'number_of_hidden_layers': 2, 'dropout_rate': 0.4366340381696932, 'global_pooling': 'mean', 'learning_rate': 0.0018752630395501822, 'weight_decay': 1.205178116736031e-05, 'beta_0': 0.8325407264394521, 'beta_1': 0.992050038106903, 'epsilon': 2.920315353756698e-08, 'balanced_loss': True, 'epochs': 138, 'early_stopping_patience': 20, 'plateau_patience': 15, 'plateau_divider': 3}. Best is trial 77 with value: 0.8807339449541285.
[I 2025-02-26 15:06:02,828] Trial 112 finished with value: 0.8704128440366973 and parameters: {'attention_pooling_operation': 'mean', 'embedding_pooling_operation': 'mean', 'threshold': 0.4772849205654036, 'batch_size': 251, 'attention_heads': 10, 'hidden_dimension': 41, 'number_of_hidden_layers': 2, 'dropout_rate': 0.4186998155075897, 'global_pooling': 'mean', 'learning_rate': 0.0009362919651645592, 'weight_decay': 3.592457387352914e-05, 'beta_0': 0.8294609112844678, 'beta_1': 0.992424480421419, 'epsilon': 4.0414250082847585e-08, 'balanced_loss': True, 'epochs': 131, 'early_stopping_patience': 21, 'plateau_patience': 15, 'plateau_divider': 2}. Best is trial 77 with value: 0.8807339449541285.
[I 2025-02-26 15:11:44,817] Trial 113 finished with value: 0.8727064220183486 and parameters: {'attention_pooling_operation': 'mean', 'embedding_pooling_operation': 'mean', 'threshold': 0.4580479244205558, 'batch_size': 170, 'attention_heads': 12, 'hidden_dimension': 143, 'number_of_hidden_layers': 2, 'dropout_rate': 0.48035479055955127, 'global_pooling': 'mean', 'learning_rate': 0.002237262761890572, 'weight_decay': 7.004428124174268e-06, 'beta_0': 0.8972985102707811, 'beta_1': 0.9874533971538693, 'epsilon': 2.5746568778997226e-08, 'balanced_loss': True, 'epochs': 120, 'early_stopping_patience': 20, 'plateau_patience': 15, 'plateau_divider': 3}. Best is trial 77 with value: 0.8807339449541285.
[I 2025-02-26 15:17:11,517] Trial 114 finished with value: 0.8704128440366973 and parameters: {'attention_pooling_operation': 'mean', 'embedding_pooling_operation': 'mean', 'threshold': 0.5067459620820792, 'batch_size': 217, 'attention_heads': 12, 'hidden_dimension': 153, 'number_of_hidden_layers': 2, 'dropout_rate': 0.43936892745740735, 'global_pooling': 'mean', 'learning_rate': 0.0012795146493236602, 'weight_decay': 4.291357201557713e-05, 'beta_0': 0.8896482702280633, 'beta_1': 0.9931929538238955, 'epsilon': 8.248292094849001e-08, 'balanced_loss': True, 'epochs': 124, 'early_stopping_patience': 18, 'plateau_patience': 14, 'plateau_divider': 2}. Best is trial 77 with value: 0.8807339449541285.
[I 2025-02-26 15:20:57,015] Trial 115 finished with value: 0.8658256880733946 and parameters: {'attention_pooling_operation': 'mean', 'embedding_pooling_operation': 'mean', 'threshold': 0.5211435758746665, 'batch_size': 196, 'attention_heads': 11, 'hidden_dimension': 33, 'number_of_hidden_layers': 1, 'dropout_rate': 0.4713407402994373, 'global_pooling': 'mean', 'learning_rate': 0.0031412243931635627, 'weight_decay': 2.134161223005209e-05, 'beta_0': 0.8555530564455388, 'beta_1': 0.9893614599243411, 'epsilon': 2.1469827883200835e-08, 'balanced_loss': True, 'epochs': 115, 'early_stopping_patience': 20, 'plateau_patience': 16, 'plateau_divider': 5}. Best is trial 77 with value: 0.8807339449541285.
[I 2025-02-26 15:26:10,521] Trial 116 finished with value: 0.8727064220183486 and parameters: {'attention_pooling_operation': 'mean', 'embedding_pooling_operation': 'mean', 'threshold': 0.4774191013328108, 'batch_size': 183, 'attention_heads': 11, 'hidden_dimension': 157, 'number_of_hidden_layers': 1, 'dropout_rate': 0.4305224743275084, 'global_pooling': 'max', 'learning_rate': 0.00392554108240297, 'weight_decay': 1.4217067442244338e-05, 'beta_0': 0.8868447680003004, 'beta_1': 0.9902247586534151, 'epsilon': 1.6089499050400647e-08, 'balanced_loss': True, 'epochs': 128, 'early_stopping_patience': 21, 'plateau_patience': 13, 'plateau_divider': 3}. Best is trial 77 with value: 0.8807339449541285.
[I 2025-02-26 15:32:06,609] Trial 117 finished with value: 0.8715596330275229 and parameters: {'attention_pooling_operation': 'max', 'embedding_pooling_operation': 'max', 'threshold': 0.4524866395997085, 'batch_size': 159, 'attention_heads': 15, 'hidden_dimension': 132, 'number_of_hidden_layers': 2, 'dropout_rate': 0.45529720652906297, 'global_pooling': 'mean', 'learning_rate': 0.0010022182901930222, 'weight_decay': 0.00042646747714622675, 'beta_0': 0.8921110029894909, 'beta_1': 0.9908571856500062, 'epsilon': 4.323562915780859e-05, 'balanced_loss': True, 'epochs': 104, 'early_stopping_patience': 19, 'plateau_patience': 15, 'plateau_divider': 2}. Best is trial 77 with value: 0.8807339449541285.
[I 2025-02-26 15:36:20,553] Trial 118 finished with value: 0.8646788990825688 and parameters: {'attention_pooling_operation': 'min', 'embedding_pooling_operation': 'mean', 'threshold': 0.41756353282281805, 'batch_size': 241, 'attention_heads': 10, 'hidden_dimension': 78, 'number_of_hidden_layers': 1, 'dropout_rate': 0.4187368701785319, 'global_pooling': 'sum', 'learning_rate': 0.0015855726031910363, 'weight_decay': 0.00021396698526350363, 'beta_0': 0.8141922295006234, 'beta_1': 0.9941314348244117, 'epsilon': 3.4119499055179445e-08, 'balanced_loss': False, 'epochs': 136, 'early_stopping_patience': 21, 'plateau_patience': 14, 'plateau_divider': 2}. Best is trial 77 with value: 0.8807339449541285.
[I 2025-02-26 15:41:36,710] Trial 119 finished with value: 0.8738532110091743 and parameters: {'attention_pooling_operation': 'mean', 'embedding_pooling_operation': 'max', 'threshold': 0.5403051623269102, 'batch_size': 231, 'attention_heads': 16, 'hidden_dimension': 104, 'number_of_hidden_layers': 2, 'dropout_rate': 0.3797523240527765, 'global_pooling': 'mean', 'learning_rate': 0.002521501446565534, 'weight_decay': 3.5131331502304934e-06, 'beta_0': 0.8216035746833021, 'beta_1': 0.9939585774360237, 'epsilon': 2.6681044135068714e-06, 'balanced_loss': True, 'epochs': 120, 'early_stopping_patience': 20, 'plateau_patience': 12, 'plateau_divider': 2}. Best is trial 77 with value: 0.8807339449541285.
[I 2025-02-26 15:46:06,426] Trial 120 finished with value: 0.8692660550458715 and parameters: {'attention_pooling_operation': 'max', 'embedding_pooling_operation': 'min', 'threshold': 0.5901526733866208, 'batch_size': 246, 'attention_heads': 11, 'hidden_dimension': 117, 'number_of_hidden_layers': 2, 'dropout_rate': 0.44771089747669157, 'global_pooling': 'max', 'learning_rate': 0.001964063532964352, 'weight_decay': 0.0003524974388192569, 'beta_0': 0.8840436388878932, 'beta_1': 0.991978426931837, 'epsilon': 1.4061916828400221e-08, 'balanced_loss': True, 'epochs': 132, 'early_stopping_patience': 16, 'plateau_patience': 15, 'plateau_divider': 3}. Best is trial 77 with value: 0.8807339449541285.
[I 2025-02-26 15:50:39,185] Trial 121 finished with value: 0.875 and parameters: {'attention_pooling_operation': 'max', 'embedding_pooling_operation': 'mean', 'threshold': 0.4832766550819566, 'batch_size': 228, 'attention_heads': 10, 'hidden_dimension': 87, 'number_of_hidden_layers': 2, 'dropout_rate': 0.45266385076923826, 'global_pooling': 'max', 'learning_rate': 0.002285947635952211, 'weight_decay': 5.285535592421235e-06, 'beta_0': 0.8195831029243406, 'beta_1': 0.9904433036888587, 'epsilon': 2.6440807505846977e-08, 'balanced_loss': True, 'epochs': 126, 'early_stopping_patience': 20, 'plateau_patience': 13, 'plateau_divider': 2}. Best is trial 77 with value: 0.8807339449541285.
[I 2025-02-26 15:55:21,103] Trial 122 finished with value: 0.8727064220183486 and parameters: {'attention_pooling_operation': 'max', 'embedding_pooling_operation': 'mean', 'threshold': 0.46397847108935547, 'batch_size': 220, 'attention_heads': 10, 'hidden_dimension': 84, 'number_of_hidden_layers': 2, 'dropout_rate': 0.4637960881565852, 'global_pooling': 'max', 'learning_rate': 0.004610120139550495, 'weight_decay': 4.840202364425099e-06, 'beta_0': 0.8217770153108499, 'beta_1': 0.9927565621203576, 'epsilon': 5.995747888493031e-08, 'balanced_loss': True, 'epochs': 128, 'early_stopping_patience': 19, 'plateau_patience': 13, 'plateau_divider': 2}. Best is trial 77 with value: 0.8807339449541285.
[I 2025-02-26 15:59:40,412] Trial 123 finished with value: 0.8738532110091743 and parameters: {'attention_pooling_operation': 'max', 'embedding_pooling_operation': 'mean', 'threshold': 0.4382317992875059, 'batch_size': 152, 'attention_heads': 9, 'hidden_dimension': 55, 'number_of_hidden_layers': 2, 'dropout_rate': 0.44412041483006237, 'global_pooling': 'max', 'learning_rate': 0.003114730703875439, 'weight_decay': 3.363502999011685e-06, 'beta_0': 0.8997067583403592, 'beta_1': 0.9899529374034922, 'epsilon': 2.0105538051211268e-08, 'balanced_loss': True, 'epochs': 123, 'early_stopping_patience': 20, 'plateau_patience': 12, 'plateau_divider': 8}. Best is trial 77 with value: 0.8807339449541285.
