[I 2025-02-27 22:09:28,163] Trial 251 finished with value: 0.8635321100917431 and parameters: {'attention_pooling_operation': 'min', 'embedding_pooling_operation': 'mean', 'threshold': 0.6297066832280229, 'batch_size': 55, 'attention_heads': 16, 'hidden_dimension': 148, 'number_of_hidden_layers': 2, 'dropout_rate': 0.5173223265454218, 'global_pooling': 'max', 'learning_rate': 0.000991204338114151, 'weight_decay': 3.3460225384395174e-06, 'beta_0': 0.818871221244851, 'beta_1': 0.9866563883029799, 'epsilon': 1.6723951641105564e-07, 'balanced_loss': False, 'epochs': 195, 'early_stopping_patience': 20, 'plateau_patience': 22, 'plateau_divider': 8}. Best is trial 147 with value: 0.8784403669724771.

[TRIAL] 225 [VALIDATION PERFORMANCE] 0.8784403669724771 [TRAINING LOSS] 0.2064489156771929 [VALIDATION LOSS] 0.40970551818609235 

number                                     225
value                                  0.87844
params_threshold                      0.607153
params_attention_heads                      16
params_balanced_loss                     False
params_embedding_pooling_operation        mean
params_attention_pooling_operation         min
params_batch_size                           89
params_dropout_rate                    0.52712
params_early_stopping_patience              20
params_epochs                              193
params_global_pooling                      max
params_hidden_dimension                    144
params_learning_rate                  0.001675
params_number_of_hidden_layers               2
params_plateau_divider                       8
params_plateau_patience                     22
params_weight_decay                   0.000831
params_beta_0                         0.819325
params_beta_1                         0.986847
params_epsilon                             0.0
user_attrs_epoch                          19.0
user_attrs_training_loss              0.206449
user_attrs_validation_loss            0.409706
Name: 225, dtype: object
37 Val: 0.8658256880733946 Test: 0.8550247116968699
38 Val: 0.8589449541284404 Test: 0.8638110928061504
39 Val: 0.8658256880733946 Test: 0.85722130697419
40 Val: 0.8681192660550459 Test: 0.8616144975288303
41 Val: 0.8692660550458715 Test: 0.8660076880834706
42 Val: 0.8646788990825688 Test: 0.8528281164195497
43 Val: 0.8600917431192661 Test: 0.8484349258649094
44 Val: 0.8669724770642202 Test: 0.8555738605161999
45 Val: 0.8623853211009175 Test: 0.8550247116968699
46 Val: 0.8635321100917431 Test: 0.8643602416254805
Validation performance: 85.89 & 86.46 ± 0.34 & 86.93
Testing performance: 84.84 & 85.8 ± 0.57 & 86.6

[TRIAL] 147 [VALIDATION PERFORMANCE] 0.8784403669724771 [TRAINING LOSS] 0.07268971303500325 [VALIDATION LOSS] 0.42462681098417804 

number                                     147
value                                  0.87844
params_threshold                      0.615991
params_attention_heads                      15
params_balanced_loss                     False
params_embedding_pooling_operation        mean
params_attention_pooling_operation         min
params_batch_size                           84
params_dropout_rate                   0.499311
params_early_stopping_patience              25
params_epochs                              182
params_global_pooling                      max
params_hidden_dimension                    149
params_learning_rate                   0.00105
params_number_of_hidden_layers               2
params_plateau_divider                       9
params_plateau_patience                     19
params_weight_decay                   0.000033
params_beta_0                         0.814586
params_beta_1                         0.986957
params_epsilon                             0.0
user_attrs_epoch                          29.0
user_attrs_training_loss               0.07269
user_attrs_validation_loss            0.424627
Name: 147, dtype: object
37 Val: 0.8784403669724771 Test: 0.8594179022515102
38 Val: 0.8635321100917431 Test: 0.8599670510708401
39 Val: 0.8704128440366973 Test: 0.8511806699615596
40 Val: 0.8669724770642202 Test: 0.8676551345414607
41 Val: 0.8600917431192661 Test: 0.8665568369028006
42 Val: 0.8772935779816514 Test: 0.85722130697419
43 Val: 0.8681192660550459 Test: 0.8473366282262493
44 Val: 0.8646788990825688 Test: 0.8544755628775398
45 Val: 0.8704128440366973 Test: 0.8616144975288303
46 Val: 0.8681192660550459 Test: 0.8627127951674904
Validation performance: 86.01 & 86.88 ± 0.57 & 87.84
Testing performance: 84.73 & 85.88 ± 0.64 & 86.77

[TRIAL] 154 [VALIDATION PERFORMANCE] 0.8761467889908257 [TRAINING LOSS] 0.16258758356173833 [VALIDATION LOSS] 0.3353649154305458 

number                                     154
value                                 0.876147
params_threshold                      0.670798
params_attention_heads                      10
params_balanced_loss                     False
params_embedding_pooling_operation        mean
params_attention_pooling_operation         min
params_batch_size                           93
params_dropout_rate                   0.542655
params_early_stopping_patience              25
params_epochs                              113
params_global_pooling                      max
params_hidden_dimension                    147
params_learning_rate                   0.00194
params_number_of_hidden_layers               2
params_plateau_divider                       8
params_plateau_patience                     21
params_weight_decay                   0.000015
params_beta_0                         0.815335
params_beta_1                         0.988785
params_epsilon                             0.0
user_attrs_epoch                          89.0
user_attrs_training_loss              0.162588
user_attrs_validation_loss            0.335365
Name: 154, dtype: object
37 Val: 0.8704128440366973 Test: 0.8506315211422295
38 Val: 0.8646788990825688 Test: 0.8577704557935201
39 Val: 0.8589449541284404 Test: 0.8533772652388797
40 Val: 0.8612385321100917 Test: 0.8484349258649094
41 Val: 0.8727064220183486 Test: 0.85722130697419
42 Val: 0.8600917431192661 Test: 0.8588687534321802
43 Val: 0.8635321100917431 Test: 0.8500823723228995
44 Val: 0.8623853211009175 Test: 0.8588687534321802
45 Val: 0.8669724770642202 Test: 0.8588687534321802
46 Val: 0.856651376146789 Test: 0.842943437671609
Validation performance: 85.67 & 86.38 ± 0.51 & 87.27
Testing performance: 84.29 & 85.37 ± 0.55 & 85.89

[TRIAL] 183 [VALIDATION PERFORMANCE] 0.875 [TRAINING LOSS] 0.2669314243704886 [VALIDATION LOSS] 0.34838095903396604 

number                                     183
value                                    0.875
params_threshold                       0.59741
params_attention_heads                       5
params_balanced_loss                     False
params_embedding_pooling_operation        mean
params_attention_pooling_operation         min
params_batch_size                           94
params_dropout_rate                   0.494563
params_early_stopping_patience              25
params_epochs                              133
params_global_pooling                      max
params_hidden_dimension                    158
params_learning_rate                  0.001128
params_number_of_hidden_layers               2
params_plateau_divider                       8
params_plateau_patience                     19
params_weight_decay                   0.000014
params_beta_0                         0.828624
params_beta_1                         0.987502
params_epsilon                        0.000056
user_attrs_epoch                          11.0
user_attrs_training_loss              0.266931
user_attrs_validation_loss            0.348381
Name: 183, dtype: object
37 Val: 0.8727064220183486 Test: 0.8500823723228995
38 Val: 0.8532110091743119 Test: 0.8528281164195497
39 Val: 0.8623853211009175 Test: 0.8550247116968699
40 Val: 0.8623853211009175 Test: 0.8550247116968699
41 Val: 0.8600917431192661 Test: 0.8555738605161999
42 Val: 0.8669724770642202 Test: 0.8577704557935201
43 Val: 0.8635321100917431 Test: 0.8627127951674904
44 Val: 0.8600917431192661 Test: 0.8511806699615596
45 Val: 0.8681192660550459 Test: 0.8594179022515102
46 Val: 0.8646788990825688 Test: 0.8649093904448105
Validation performance: 85.32 & 86.34 ± 0.53 & 87.27
Testing performance: 85.01 & 85.65 ± 0.48 & 86.49

[TRIAL] 165 [VALIDATION PERFORMANCE] 0.875 [TRAINING LOSS] 0.1245824948829763 [VALIDATION LOSS] 0.3709300593896346 

number                                     165
value                                    0.875
params_threshold                      0.615669
params_attention_heads                       5
params_balanced_loss                     False
params_embedding_pooling_operation        mean
params_attention_pooling_operation         min
params_batch_size                           82
params_dropout_rate                   0.526865
params_early_stopping_patience              25
params_epochs                              119
params_global_pooling                      max
params_hidden_dimension                    156
params_learning_rate                  0.001241
params_number_of_hidden_layers               2
params_plateau_divider                       8
params_plateau_patience                     23
params_weight_decay                   0.000018
params_beta_0                         0.818681
params_beta_1                         0.986703
params_epsilon                             0.0
user_attrs_epoch                          37.0
user_attrs_training_loss              0.124582
user_attrs_validation_loss             0.37093
Name: 165, dtype: object
37 Val: 0.8646788990825688 Test: 0.8528281164195497
38 Val: 0.8543577981651376 Test: 0.8693025809994509
39 Val: 0.8612385321100917 Test: 0.8544755628775398
40 Val: 0.8658256880733946 Test: 0.8627127951674904
41 Val: 0.8692660550458715 Test: 0.8539264140582098
42 Val: 0.8669724770642202 Test: 0.8588687534321802
43 Val: 0.8658256880733946 Test: 0.8621636463481603
44 Val: 0.8646788990825688 Test: 0.85612300933553
45 Val: 0.8669724770642202 Test: 0.8627127951674904
46 Val: 0.8658256880733946 Test: 0.8511806699615596
Validation performance: 85.44 & 86.46 ± 0.41 & 86.93
Testing performance: 85.12 & 85.84 ± 0.57 & 86.93

[SST-2] Elapsed time: 526.5709193785985 minutes.
