[I 2025-02-26 08:18:03,314] Trial 31 finished with value: 0.8704128440366973 and parameters: {'attention_pooling_operation': 'mean', 'embedding_pooling_operation': 'max', 'threshold': 0.6056064071513704, 'batch_size': 146, 'attention_heads': 13, 'hidden_dimension': 142, 'number_of_hidden_layers': 1, 'dropout_rate': 0.38791030170326013, 'global_pooling': 'mean', 'learning_rate': 0.0026298956118464343, 'weight_decay': 0.0008688253254989641, 'beta_0': 0.8881772038013053, 'beta_1': 0.9933183970078799, 'epsilon': 4.230059944838868e-05, 'balanced_loss': True, 'epochs': 64, 'early_stopping_patience': 19, 'plateau_patience': 13, 'plateau_divider': 4}. Best is trial 10 with value: 0.8772935779816514.
[I 2025-02-26 08:23:45,806] Trial 32 finished with value: 0.8704128440366973 and parameters: {'attention_pooling_operation': 'mean', 'embedding_pooling_operation': 'mean', 'threshold': 0.4691710405035144, 'batch_size': 95, 'attention_heads': 14, 'hidden_dimension': 186, 'number_of_hidden_layers': 1, 'dropout_rate': 0.4169070075563147, 'global_pooling': 'mean', 'learning_rate': 0.0004804794289250587, 'weight_decay': 0.0002728085107968291, 'beta_0': 0.8988051148005927, 'beta_1': 0.9961645665697206, 'epsilon': 6.224572036972407e-06, 'balanced_loss': True, 'epochs': 75, 'early_stopping_patience': 22, 'plateau_patience': 11, 'plateau_divider': 6}. Best is trial 10 with value: 0.8772935779816514.
[I 2025-02-26 08:29:16,296] Trial 33 finished with value: 0.8772935779816514 and parameters: {'attention_pooling_operation': 'mean', 'embedding_pooling_operation': 'max', 'threshold': 0.5824782822510989, 'batch_size': 167, 'attention_heads': 16, 'hidden_dimension': 162, 'number_of_hidden_layers': 1, 'dropout_rate': 0.44012405728456516, 'global_pooling': 'mean', 'learning_rate': 0.0009600561308006346, 'weight_decay': 0.00010558597591045263, 'beta_0': 0.8830846057835314, 'beta_1': 0.9933284079611832, 'epsilon': 5.440114058437669e-05, 'balanced_loss': True, 'epochs': 126, 'early_stopping_patience': 22, 'plateau_patience': 16, 'plateau_divider': 2}. Best is trial 10 with value: 0.8772935779816514.
[I 2025-02-26 08:33:39,145] Trial 34 finished with value: 0.8784403669724771 and parameters: {'attention_pooling_operation': 'mean', 'embedding_pooling_operation': 'max', 'threshold': 0.5566386656994149, 'batch_size': 175, 'attention_heads': 16, 'hidden_dimension': 85, 'number_of_hidden_layers': 1, 'dropout_rate': 0.4810902834245469, 'global_pooling': 'mean', 'learning_rate': 0.0010934648935877372, 'weight_decay': 0.00012581585386855742, 'beta_0': 0.8829638961210171, 'beta_1': 0.9890899444914188, 'epsilon': 5.496401968145616e-05, 'balanced_loss': True, 'epochs': 127, 'early_stopping_patience': 22, 'plateau_patience': 18, 'plateau_divider': 2}. Best is trial 34 with value: 0.8784403669724771.
[I 2025-02-26 08:38:58,950] Trial 35 finished with value: 0.8600917431192661 and parameters: {'attention_pooling_operation': 'min', 'embedding_pooling_operation': 'max', 'threshold': 0.5472434201232245, 'batch_size': 193, 'attention_heads': 15, 'hidden_dimension': 85, 'number_of_hidden_layers': 2, 'dropout_rate': 0.45255221975043, 'global_pooling': 'mean', 'learning_rate': 0.00017037249445403074, 'weight_decay': 0.00010605079238464282, 'beta_0': 0.8708580749952353, 'beta_1': 0.9891050291549006, 'epsilon': 5.547045703880397e-05, 'balanced_loss': True, 'epochs': 136, 'early_stopping_patience': 24, 'plateau_patience': 18, 'plateau_divider': 2}. Best is trial 34 with value: 0.8784403669724771.
[I 2025-02-26 08:42:55,525] Trial 36 finished with value: 0.8795871559633027 and parameters: {'attention_pooling_operation': 'mean', 'embedding_pooling_operation': 'max', 'threshold': 0.47153519200230964, 'batch_size': 171, 'attention_heads': 16, 'hidden_dimension': 47, 'number_of_hidden_layers': 1, 'dropout_rate': 0.4772972913320371, 'global_pooling': 'mean', 'learning_rate': 0.0011227062449786199, 'weight_decay': 4.862237608420454e-05, 'beta_0': 0.8952548122001249, 'beta_1': 0.9846001748654197, 'epsilon': 6.462977139496563e-05, 'balanced_loss': False, 'epochs': 125, 'early_stopping_patience': 20, 'plateau_patience': 21, 'plateau_divider': 2}. Best is trial 36 with value: 0.8795871559633027.
[I 2025-02-26 08:46:55,283] Trial 37 finished with value: 0.8727064220183486 and parameters: {'attention_pooling_operation': 'mean', 'embedding_pooling_operation': 'max', 'threshold': 0.44517686016958813, 'batch_size': 174, 'attention_heads': 16, 'hidden_dimension': 45, 'number_of_hidden_layers': 1, 'dropout_rate': 0.48089238003776524, 'global_pooling': 'mean', 'learning_rate': 0.0009859583947606607, 'weight_decay': 4.736814512295173e-05, 'beta_0': 0.8947706138943243, 'beta_1': 0.9821694673409502, 'epsilon': 6.958911977111005e-05, 'balanced_loss': False, 'epochs': 123, 'early_stopping_patience': 23, 'plateau_patience': 22, 'plateau_divider': 2}. Best is trial 36 with value: 0.8795871559633027.
[I 2025-02-26 08:50:46,790] Trial 38 finished with value: 0.8681192660550459 and parameters: {'attention_pooling_operation': 'mean', 'embedding_pooling_operation': 'max', 'threshold': 0.48258541094006335, 'batch_size': 219, 'attention_heads': 16, 'hidden_dimension': 74, 'number_of_hidden_layers': 0, 'dropout_rate': 0.5016422304007286, 'global_pooling': 'mean', 'learning_rate': 0.0010842835645784275, 'weight_decay': 9.572572640618901e-05, 'beta_0': 0.8856630139613728, 'beta_1': 0.9842104504302283, 'epsilon': 1.336372746340535e-05, 'balanced_loss': True, 'epochs': 147, 'early_stopping_patience': 19, 'plateau_patience': 23, 'plateau_divider': 2}. Best is trial 36 with value: 0.8795871559633027.
[I 2025-02-26 08:54:28,291] Trial 39 finished with value: 0.8669724770642202 and parameters: {'attention_pooling_operation': 'mean', 'embedding_pooling_operation': 'max', 'threshold': 0.5330127534633659, 'batch_size': 191, 'attention_heads': 16, 'hidden_dimension': 55, 'number_of_hidden_layers': 0, 'dropout_rate': 0.4695813247837714, 'global_pooling': 'mean', 'learning_rate': 0.0017057341616482757, 'weight_decay': 0.00015031022281543414, 'beta_0': 0.8932488505751794, 'beta_1': 0.9853611398613866, 'epsilon': 2.2674691609223064e-05, 'balanced_loss': False, 'epochs': 125, 'early_stopping_patience': 21, 'plateau_patience': 20, 'plateau_divider': 3}. Best is trial 36 with value: 0.8795871559633027.
[I 2025-02-26 08:59:03,194] Trial 40 finished with value: 0.8646788990825688 and parameters: {'attention_pooling_operation': 'mean', 'embedding_pooling_operation': 'max', 'threshold': 0.448751520940001, 'batch_size': 233, 'attention_heads': 16, 'hidden_dimension': 47, 'number_of_hidden_layers': 1, 'dropout_rate': 0.5150289983965204, 'global_pooling': 'mean', 'learning_rate': 0.00019882068428801183, 'weight_decay': 5.033957414163647e-05, 'beta_0': 0.8842467875296411, 'beta_1': 0.9836694107734295, 'epsilon': 4.409842018498267e-05, 'balanced_loss': True, 'epochs': 151, 'early_stopping_patience': 25, 'plateau_patience': 24, 'plateau_divider': 2}. Best is trial 36 with value: 0.8795871559633027.
[I 2025-02-26 09:08:19,566] Trial 41 finished with value: 0.8635321100917431 and parameters: {'attention_pooling_operation': 'min', 'embedding_pooling_operation': 'mean', 'threshold': 0.5701156573617353, 'batch_size': 183, 'attention_heads': 15, 'hidden_dimension': 199, 'number_of_hidden_layers': 4, 'dropout_rate': 0.44345376516435486, 'global_pooling': 'max', 'learning_rate': 0.0018112546836353833, 'weight_decay': 0.00017784332543491557, 'beta_0': 0.8917897444106175, 'beta_1': 0.9815198592500584, 'epsilon': 6.532384931135592e-05, 'balanced_loss': False, 'epochs': 118, 'early_stopping_patience': 20, 'plateau_patience': 16, 'plateau_divider': 3}. Best is trial 36 with value: 0.8795871559633027.
[I 2025-02-26 09:12:16,892] Trial 42 finished with value: 0.8692660550458715 and parameters: {'attention_pooling_operation': 'mean', 'embedding_pooling_operation': 'max', 'threshold': 0.5810379788950787, 'batch_size': 162, 'attention_heads': 9, 'hidden_dimension': 95, 'number_of_hidden_layers': 1, 'dropout_rate': 0.4857423105359722, 'global_pooling': 'mean', 'learning_rate': 0.0007550623032849434, 'weight_decay': 0.0003141266216227528, 'beta_0': 0.8994929612344079, 'beta_1': 0.9807941608502533, 'epsilon': 2.0408067280355246e-05, 'balanced_loss': False, 'epochs': 162, 'early_stopping_patience': 17, 'plateau_patience': 18, 'plateau_divider': 2}. Best is trial 36 with value: 0.8795871559633027.
[I 2025-02-26 09:16:57,132] Trial 43 finished with value: 0.8681192660550459 and parameters: {'attention_pooling_operation': 'max', 'embedding_pooling_operation': 'max', 'threshold': 0.6671940715993117, 'batch_size': 206, 'attention_heads': 15, 'hidden_dimension': 66, 'number_of_hidden_layers': 2, 'dropout_rate': 0.4626212354672664, 'global_pooling': 'sum', 'learning_rate': 0.0038713778941519973, 'weight_decay': 7.859747676382489e-05, 'beta_0': 0.8811874096224629, 'beta_1': 0.9909848135525722, 'epsilon': 3.736025043263932e-05, 'balanced_loss': False, 'epochs': 138, 'early_stopping_patience': 22, 'plateau_patience': 20, 'plateau_divider': 4}. Best is trial 36 with value: 0.8795871559633027.
[I 2025-02-26 09:20:47,727] Trial 44 finished with value: 0.8692660550458715 and parameters: {'attention_pooling_operation': 'max', 'embedding_pooling_operation': 'mean', 'threshold': 0.5156373607176964, 'batch_size': 141, 'attention_heads': 16, 'hidden_dimension': 33, 'number_of_hidden_layers': 1, 'dropout_rate': 0.4154018373614057, 'global_pooling': 'max', 'learning_rate': 0.0064924042831130836, 'weight_decay': 0.00020084401413802895, 'beta_0': 0.8243519631782009, 'beta_1': 0.9864277319635838, 'epsilon': 9.898621498811869e-05, 'balanced_loss': False, 'epochs': 132, 'early_stopping_patience': 20, 'plateau_patience': 16, 'plateau_divider': 6}. Best is trial 36 with value: 0.8795871559633027.
[I 2025-02-26 09:31:15,770] Trial 45 finished with value: 0.5172018348623854 and parameters: {'attention_pooling_operation': 'mean', 'embedding_pooling_operation': 'max', 'threshold': 0.5533812612352362, 'batch_size': 168, 'attention_heads': 15, 'hidden_dimension': 237, 'number_of_hidden_layers': 4, 'dropout_rate': 0.43839785902946876, 'global_pooling': 'mean', 'learning_rate': 0.01811890237987291, 'weight_decay': 0.00013389636177378033, 'beta_0': 0.8722555518896419, 'beta_1': 0.989694279766952, 'epsilon': 8.709615976263464e-06, 'balanced_loss': False, 'epochs': 126, 'early_stopping_patience': 21, 'plateau_patience': 17, 'plateau_divider': 2}. Best is trial 36 with value: 0.8795871559633027.
[I 2025-02-26 09:38:10,309] Trial 46 finished with value: 0.8646788990825688 and parameters: {'attention_pooling_operation': 'min', 'embedding_pooling_operation': 'max', 'threshold': 0.497939851862957, 'batch_size': 202, 'attention_heads': 10, 'hidden_dimension': 206, 'number_of_hidden_layers': 2, 'dropout_rate': 0.4933149198191827, 'global_pooling': 'max', 'learning_rate': 0.0014692237410089811, 'weight_decay': 2.8027346598141624e-05, 'beta_0': 0.8902579278760672, 'beta_1': 0.9977559107540425, 'epsilon': 2.6524572757806116e-07, 'balanced_loss': False, 'epochs': 115, 'early_stopping_patience': 24, 'plateau_patience': 21, 'plateau_divider': 3}. Best is trial 36 with value: 0.8795871559633027.
[I 2025-02-26 09:42:20,250] Trial 47 finished with value: 0.8704128440366973 and parameters: {'attention_pooling_operation': 'max', 'embedding_pooling_operation': 'max', 'threshold': 0.5792978293718105, 'batch_size': 123, 'attention_heads': 6, 'hidden_dimension': 44, 'number_of_hidden_layers': 3, 'dropout_rate': 0.4720231555687663, 'global_pooling': 'max', 'learning_rate': 0.0004355461815299055, 'weight_decay': 0.00038220160719304604, 'beta_0': 0.8079522363789734, 'beta_1': 0.9850636985551365, 'epsilon': 6.521105136780985e-07, 'balanced_loss': False, 'epochs': 144, 'early_stopping_patience': 23, 'plateau_patience': 18, 'plateau_divider': 5}. Best is trial 36 with value: 0.8795871559633027.
[I 2025-02-26 09:47:43,972] Trial 48 finished with value: 0.8658256880733946 and parameters: {'attention_pooling_operation': 'max', 'embedding_pooling_operation': 'max', 'threshold': 0.6335029754226661, 'batch_size': 49, 'attention_heads': 14, 'hidden_dimension': 130, 'number_of_hidden_layers': 1, 'dropout_rate': 0.5451274580326322, 'global_pooling': 'mean', 'learning_rate': 0.004258122869730672, 'weight_decay': 1.1257800316314651e-06, 'beta_0': 0.8709738805376926, 'beta_1': 0.991603531717605, 'epsilon': 8.112069998974796e-08, 'balanced_loss': False, 'epochs': 104, 'early_stopping_patience': 18, 'plateau_patience': 15, 'plateau_divider': 2}. Best is trial 36 with value: 0.8795871559633027.
[I 2025-02-26 09:53:57,496] Trial 49 finished with value: 0.8428899082568807 and parameters: {'attention_pooling_operation': 'mean', 'embedding_pooling_operation': 'mean', 'threshold': 0.5300916131220519, 'batch_size': 32, 'attention_heads': 16, 'hidden_dimension': 72, 'number_of_hidden_layers': 3, 'dropout_rate': 0.41383414149363507, 'global_pooling': 'sum', 'learning_rate': 2.2335092207361408e-05, 'weight_decay': 6.271083062733009e-05, 'beta_0': 0.8174868273703865, 'beta_1': 0.9833862722093656, 'epsilon': 6.936608289165773e-05, 'balanced_loss': True, 'epochs': 156, 'early_stopping_patience': 19, 'plateau_patience': 19, 'plateau_divider': 4}. Best is trial 36 with value: 0.8795871559633027.
[I 2025-02-26 09:58:22,151] Trial 50 finished with value: 0.8704128440366973 and parameters: {'attention_pooling_operation': 'max', 'embedding_pooling_operation': 'max', 'threshold': 0.4722262843472579, 'batch_size': 151, 'attention_heads': 9, 'hidden_dimension': 84, 'number_of_hidden_layers': 0, 'dropout_rate': 0.5687320168609645, 'global_pooling': 'max', 'learning_rate': 0.00019958670350971787, 'weight_decay': 8.653723814343016e-05, 'beta_0': 0.8944645372552081, 'beta_1': 0.988241631755082, 'epsilon': 4.0884141100878473e-08, 'balanced_loss': False, 'epochs': 182, 'early_stopping_patience': 21, 'plateau_patience': 14, 'plateau_divider': 7}. Best is trial 36 with value: 0.8795871559633027.
[I 2025-02-26 10:03:12,783] Trial 51 finished with value: 0.8738532110091743 and parameters: {'attention_pooling_operation': 'mean', 'embedding_pooling_operation': 'max', 'threshold': 0.6144370838196793, 'batch_size': 101, 'attention_heads': 13, 'hidden_dimension': 152, 'number_of_hidden_layers': 1, 'dropout_rate': 0.3072990031037489, 'global_pooling': 'mean', 'learning_rate': 0.002788444712766284, 'weight_decay': 0.000676452967351565, 'beta_0': 0.8821382376170775, 'beta_1': 0.9929047748455658, 'epsilon': 4.6732130637088646e-07, 'balanced_loss': True, 'epochs': 69, 'early_stopping_patience': 22, 'plateau_patience': 14, 'plateau_divider': 3}. Best is trial 36 with value: 0.8795871559633027.
[I 2025-02-26 10:07:53,903] Trial 52 finished with value: 0.8704128440366973 and parameters: {'attention_pooling_operation': 'mean', 'embedding_pooling_operation': 'max', 'threshold': 0.6783176294132296, 'batch_size': 180, 'attention_heads': 13, 'hidden_dimension': 152, 'number_of_hidden_layers': 1, 'dropout_rate': 0.3060680296502451, 'global_pooling': 'mean', 'learning_rate': 0.0010843246218991873, 'weight_decay': 0.0007167555297795756, 'beta_0': 0.8864865739306863, 'beta_1': 0.9923808078476581, 'epsilon': 1.107796830085454e-06, 'balanced_loss': True, 'epochs': 200, 'early_stopping_patience': 22, 'plateau_patience': 13, 'plateau_divider': 3}. Best is trial 36 with value: 0.8795871559633027.
[I 2025-02-26 10:11:58,259] Trial 53 finished with value: 0.8727064220183486 and parameters: {'attention_pooling_operation': 'mean', 'embedding_pooling_operation': 'max', 'threshold': 0.5922371982270342, 'batch_size': 77, 'attention_heads': 4, 'hidden_dimension': 168, 'number_of_hidden_layers': 1, 'dropout_rate': 0.5118187792653119, 'global_pooling': 'mean', 'learning_rate': 0.003637023261982086, 'weight_decay': 0.00022223292821613568, 'beta_0': 0.8806594693014405, 'beta_1': 0.9801687936629504, 'epsilon': 1.8377365939202905e-07, 'balanced_loss': True, 'epochs': 56, 'early_stopping_patience': 23, 'plateau_patience': 15, 'plateau_divider': 2}. Best is trial 36 with value: 0.8795871559633027.
[I 2025-02-26 10:16:43,859] Trial 54 finished with value: 0.8784403669724771 and parameters: {'attention_pooling_operation': 'mean', 'embedding_pooling_operation': 'max', 'threshold': 0.6162827028183364, 'batch_size': 139, 'attention_heads': 12, 'hidden_dimension': 172, 'number_of_hidden_layers': 1, 'dropout_rate': 0.3165413926403853, 'global_pooling': 'mean', 'learning_rate': 0.002045652968660464, 'weight_decay': 0.0003862651714290962, 'beta_0': 0.8616193473300319, 'beta_1': 0.9898222855048329, 'epsilon': 4.5883597681694656e-07, 'balanced_loss': True, 'epochs': 69, 'early_stopping_patience': 20, 'plateau_patience': 16, 'plateau_divider': 3}. Best is trial 36 with value: 0.8795871559633027.
[I 2025-02-26 10:21:26,293] Trial 55 finished with value: 0.8658256880733946 and parameters: {'attention_pooling_operation': 'mean', 'embedding_pooling_operation': 'max', 'threshold': 0.6273387111203559, 'batch_size': 165, 'attention_heads': 11, 'hidden_dimension': 181, 'number_of_hidden_layers': 1, 'dropout_rate': 0.33467181242765226, 'global_pooling': 'mean', 'learning_rate': 0.002006886083049656, 'weight_decay': 0.0003987396572846667, 'beta_0': 0.8630887191418241, 'beta_1': 0.9953128638119761, 'epsilon': 4.4009260898587335e-07, 'balanced_loss': True, 'epochs': 92, 'early_stopping_patience': 21, 'plateau_patience': 16, 'plateau_divider': 3}. Best is trial 36 with value: 0.8795871559633027.
[I 2025-02-26 10:26:29,113] Trial 56 finished with value: 0.8738532110091743 and parameters: {'attention_pooling_operation': 'mean', 'embedding_pooling_operation': 'max', 'threshold': 0.5551639007057902, 'batch_size': 254, 'attention_heads': 12, 'hidden_dimension': 164, 'number_of_hidden_layers': 1, 'dropout_rate': 0.3174091925519197, 'global_pooling': 'mean', 'learning_rate': 0.0008241052625838186, 'weight_decay': 0.0007805655042625225, 'beta_0': 0.8747709441239887, 'beta_1': 0.9916066859811457, 'epsilon': 2.4365831189300356e-07, 'balanced_loss': True, 'epochs': 67, 'early_stopping_patience': 25, 'plateau_patience': 17, 'plateau_divider': 4}. Best is trial 36 with value: 0.8795871559633027.
[I 2025-02-26 10:30:18,933] Trial 57 finished with value: 0.8658256880733946 and parameters: {'attention_pooling_operation': 'mean', 'embedding_pooling_operation': 'max', 'threshold': 0.7008123647032847, 'batch_size': 144, 'attention_heads': 12, 'hidden_dimension': 128, 'number_of_hidden_layers': 0, 'dropout_rate': 0.31218325809474606, 'global_pooling': 'mean', 'learning_rate': 0.0013126422886505678, 'weight_decay': 3.832848285026543e-05, 'beta_0': 0.8531068673834165, 'beta_1': 0.9953449338198597, 'epsilon': 1.766706490461535e-06, 'balanced_loss': True, 'epochs': 131, 'early_stopping_patience': 20, 'plateau_patience': 20, 'plateau_divider': 2}. Best is trial 36 with value: 0.8795871559633027.
[I 2025-02-26 10:34:48,721] Trial 58 finished with value: 0.8635321100917431 and parameters: {'attention_pooling_operation': 'mean', 'embedding_pooling_operation': 'max', 'threshold': 0.658867175407466, 'batch_size': 198, 'attention_heads': 10, 'hidden_dimension': 154, 'number_of_hidden_layers': 1, 'dropout_rate': 0.345775608219584, 'global_pooling': 'mean', 'learning_rate': 0.005514953283809889, 'weight_decay': 0.000538247738311581, 'beta_0': 0.8794157382937775, 'beta_1': 0.9819296245593288, 'epsilon': 1.3347514570868133e-07, 'balanced_loss': True, 'epochs': 77, 'early_stopping_patience': 24, 'plateau_patience': 13, 'plateau_divider': 2}. Best is trial 36 with value: 0.8795871559633027.
[I 2025-02-26 10:38:55,643] Trial 59 finished with value: 0.8543577981651376 and parameters: {'attention_pooling_operation': 'mean', 'embedding_pooling_operation': 'max', 'threshold': 0.9029975246580153, 'batch_size': 134, 'attention_heads': 14, 'hidden_dimension': 117, 'number_of_hidden_layers': 2, 'dropout_rate': 0.3227924909103564, 'global_pooling': 'mean', 'learning_rate': 0.00034904081158776786, 'weight_decay': 0.00030790122137801826, 'beta_0': 0.8580886642719155, 'beta_1': 0.9901062044692246, 'epsilon': 8.204878587161535e-07, 'balanced_loss': True, 'epochs': 108, 'early_stopping_patience': 18, 'plateau_patience': 25, 'plateau_divider': 3}. Best is trial 36 with value: 0.8795871559633027.
[I 2025-02-26 10:43:25,076] Trial 60 finished with value: 0.8715596330275229 and parameters: {'attention_pooling_operation': 'mean', 'embedding_pooling_operation': 'max', 'threshold': 0.4289621701106131, 'batch_size': 174, 'attention_heads': 11, 'hidden_dimension': 107, 'number_of_hidden_layers': 1, 'dropout_rate': 0.35847745909296613, 'global_pooling': 'mean', 'learning_rate': 0.0006249968480965996, 'weight_decay': 0.0009973641786640427, 'beta_0': 0.8663021296194306, 'beta_1': 0.9886608977286883, 'epsilon': 1.834264289008942e-05, 'balanced_loss': True, 'epochs': 96, 'early_stopping_patience': 22, 'plateau_patience': 18, 'plateau_divider': 3}. Best is trial 36 with value: 0.8795871559633027.
[I 2025-02-26 10:48:30,374] Trial 61 finished with value: 0.8715596330275229 and parameters: {'attention_pooling_operation': 'mean', 'embedding_pooling_operation': 'max', 'threshold': 0.5636269387524897, 'batch_size': 107, 'attention_heads': 12, 'hidden_dimension': 163, 'number_of_hidden_layers': 1, 'dropout_rate': 0.32117449949386534, 'global_pooling': 'mean', 'learning_rate': 0.0007339064656523577, 'weight_decay': 0.0007678808177072241, 'beta_0': 0.8754078885708949, 'beta_1': 0.9917481418316291, 'epsilon': 2.7557153003899964e-07, 'balanced_loss': True, 'epochs': 69, 'early_stopping_patience': 25, 'plateau_patience': 17, 'plateau_divider': 4}. Best is trial 36 with value: 0.8795871559633027.
