[I 2025-03-07 09:29:38,279] Trial 109 finished with value: -1.0 and parameters: {'left_stride': 32, 'right_stride': 128, 'attention_pooling_operation': 'mean', 'embedding_pooling_operation': 'mean', 'threshold': 0.971620231910179, 'batch_size': 20, 'attention_heads': 14, 'hidden_dimension': 230, 'number_of_hidden_layers': 1, 'dropout_rate': 0.4298239483914014, 'global_pooling': 'max', 'learning_rate': 0.005944624526937617, 'weight_decay': 1.7557924643582153e-06, 'beta_0': 0.80529656444096, 'beta_1': 0.9827159951273753, 'epsilon': 6.353261124264056e-06, 'balanced_loss': True, 'epochs': 172, 'early_stopping_patience': 17, 'plateau_patience': 23, 'plateau_divider': 7}. Best is trial 2 with value: 0.9151515151515152.
CUDA out of memory. Tried to allocate 3.36 GiB. GPU 0 has a total capacity of 44.56 GiB of which 162.69 MiB is free. Including non-PyTorch memory, this process has 44.39 GiB memory in use. Of the allocated memory 41.32 GiB is allocated by PyTorch, and 1.92 GiB is reserved by PyTorch but unallocated. If reserved but unallocated memory is large try setting PYTORCH_CUDA_ALLOC_CONF=expandable_segments:True to avoid fragmentation.  See documentation for Memory Management  (https://pytorch.org/docs/stable/notes/cuda.html#environment-variables)
[I 2025-03-07 09:40:17,480] Trial 110 finished with value: -1.0 and parameters: {'left_stride': 256, 'right_stride': 32, 'attention_pooling_operation': 'max', 'embedding_pooling_operation': 'min', 'threshold': 0.9657725552542107, 'batch_size': 31, 'attention_heads': 11, 'hidden_dimension': 93, 'number_of_hidden_layers': 1, 'dropout_rate': 0.588251359072431, 'global_pooling': 'mean', 'learning_rate': 5.585719603520809e-05, 'weight_decay': 2.5431002852753977e-05, 'beta_0': 0.8510709315000519, 'beta_1': 0.989059699138599, 'epsilon': 4.0669843529397265e-06, 'balanced_loss': False, 'epochs': 129, 'early_stopping_patience': 19, 'plateau_patience': 15, 'plateau_divider': 7}. Best is trial 2 with value: 0.9151515151515152.
[I 2025-03-07 09:58:59,451] Trial 111 finished with value: 0.8909090909090909 and parameters: {'left_stride': 32, 'right_stride': 256, 'attention_pooling_operation': 'mean', 'embedding_pooling_operation': 'min', 'threshold': 0.9691650542453472, 'batch_size': 28, 'attention_heads': 5, 'hidden_dimension': 85, 'number_of_hidden_layers': 1, 'dropout_rate': 0.4080420109198713, 'global_pooling': 'mean', 'learning_rate': 0.00043752103725962286, 'weight_decay': 2.5967510452251393e-06, 'beta_0': 0.8541185924657181, 'beta_1': 0.9927558371971185, 'epsilon': 2.7387155882199104e-06, 'balanced_loss': False, 'epochs': 136, 'early_stopping_patience': 19, 'plateau_patience': 22, 'plateau_divider': 8}. Best is trial 2 with value: 0.9151515151515152.
[I 2025-03-07 10:17:45,626] Trial 112 finished with value: 0.896969696969697 and parameters: {'left_stride': 32, 'right_stride': 256, 'attention_pooling_operation': 'mean', 'embedding_pooling_operation': 'min', 'threshold': 0.9707432591026691, 'batch_size': 27, 'attention_heads': 5, 'hidden_dimension': 95, 'number_of_hidden_layers': 1, 'dropout_rate': 0.4208621653983253, 'global_pooling': 'mean', 'learning_rate': 0.0003840159689714812, 'weight_decay': 3.864083970992522e-06, 'beta_0': 0.8557985519482848, 'beta_1': 0.986868156820152, 'epsilon': 2.3863154968839625e-06, 'balanced_loss': False, 'epochs': 136, 'early_stopping_patience': 20, 'plateau_patience': 22, 'plateau_divider': 8}. Best is trial 2 with value: 0.9151515151515152.
[I 2025-03-07 10:37:57,561] Trial 113 finished with value: 0.9090909090909091 and parameters: {'left_stride': 32, 'right_stride': 256, 'attention_pooling_operation': 'mean', 'embedding_pooling_operation': 'min', 'threshold': 0.9641266911461664, 'batch_size': 24, 'attention_heads': 5, 'hidden_dimension': 101, 'number_of_hidden_layers': 1, 'dropout_rate': 0.44374385572140695, 'global_pooling': 'mean', 'learning_rate': 9.041779797979604e-05, 'weight_decay': 1.4681449496719918e-06, 'beta_0': 0.8633157951434177, 'beta_1': 0.9854779894744837, 'epsilon': 5.3989688501546316e-06, 'balanced_loss': False, 'epochs': 140, 'early_stopping_patience': 21, 'plateau_patience': 23, 'plateau_divider': 8}. Best is trial 2 with value: 0.9151515151515152.
CUDA out of memory. Tried to allocate 3.17 GiB. GPU 0 has a total capacity of 44.56 GiB of which 2.93 GiB is free. Including non-PyTorch memory, this process has 41.62 GiB memory in use. Of the allocated memory 37.73 GiB is allocated by PyTorch, and 2.74 GiB is reserved by PyTorch but unallocated. If reserved but unallocated memory is large try setting PYTORCH_CUDA_ALLOC_CONF=expandable_segments:True to avoid fragmentation.  See documentation for Memory Management  (https://pytorch.org/docs/stable/notes/cuda.html#environment-variables)
[I 2025-03-07 10:54:05,534] Trial 114 finished with value: -1.0 and parameters: {'left_stride': 32, 'right_stride': 256, 'attention_pooling_operation': 'mean', 'embedding_pooling_operation': 'min', 'threshold': 0.9639803845684195, 'batch_size': 47, 'attention_heads': 6, 'hidden_dimension': 102, 'number_of_hidden_layers': 1, 'dropout_rate': 0.4438472658677171, 'global_pooling': 'mean', 'learning_rate': 9.93709181331996e-05, 'weight_decay': 1.4940010713853347e-06, 'beta_0': 0.8623950440551365, 'beta_1': 0.981153360159163, 'epsilon': 5.1568090383081085e-06, 'balanced_loss': False, 'epochs': 141, 'early_stopping_patience': 21, 'plateau_patience': 23, 'plateau_divider': 9}. Best is trial 2 with value: 0.9151515151515152.
[I 2025-03-07 11:10:59,999] Trial 115 finished with value: 0.9030303030303031 and parameters: {'left_stride': 32, 'right_stride': 64, 'attention_pooling_operation': 'mean', 'embedding_pooling_operation': 'min', 'threshold': 0.9599565912979481, 'batch_size': 24, 'attention_heads': 4, 'hidden_dimension': 118, 'number_of_hidden_layers': 1, 'dropout_rate': 0.571076416392919, 'global_pooling': 'mean', 'learning_rate': 0.0001596923833622211, 'weight_decay': 1.3742773199898642e-06, 'beta_0': 0.8680219143240887, 'beta_1': 0.9803473535232508, 'epsilon': 7.373344810848777e-06, 'balanced_loss': False, 'epochs': 181, 'early_stopping_patience': 22, 'plateau_patience': 24, 'plateau_divider': 8}. Best is trial 2 with value: 0.9151515151515152.
[I 2025-03-07 11:21:52,018] Trial 116 finished with value: 0.8848484848484849 and parameters: {'left_stride': 64, 'right_stride': 128, 'attention_pooling_operation': 'min', 'embedding_pooling_operation': 'max', 'threshold': 0.9957792470600555, 'batch_size': 25, 'attention_heads': 10, 'hidden_dimension': 44, 'number_of_hidden_layers': 1, 'dropout_rate': 0.45594117414146645, 'global_pooling': 'mean', 'learning_rate': 8.746276514799829e-05, 'weight_decay': 1.9844916169302233e-06, 'beta_0': 0.8648330932131203, 'beta_1': 0.9848879747221213, 'epsilon': 9.906532960972413e-06, 'balanced_loss': True, 'epochs': 197, 'early_stopping_patience': 21, 'plateau_patience': 17, 'plateau_divider': 8}. Best is trial 2 with value: 0.9151515151515152.
CUDA out of memory. Tried to allocate 3.29 GiB. GPU 0 has a total capacity of 44.56 GiB of which 212.69 MiB is free. Including non-PyTorch memory, this process has 44.35 GiB memory in use. Of the allocated memory 38.96 GiB is allocated by PyTorch, and 4.24 GiB is reserved by PyTorch but unallocated. If reserved but unallocated memory is large try setting PYTORCH_CUDA_ALLOC_CONF=expandable_segments:True to avoid fragmentation.  See documentation for Memory Management  (https://pytorch.org/docs/stable/notes/cuda.html#environment-variables)
[I 2025-03-07 11:39:55,426] Trial 117 finished with value: -1.0 and parameters: {'left_stride': 128, 'right_stride': 256, 'attention_pooling_operation': 'mean', 'embedding_pooling_operation': 'mean', 'threshold': 0.9515602464965445, 'batch_size': 23, 'attention_heads': 8, 'hidden_dimension': 109, 'number_of_hidden_layers': 2, 'dropout_rate': 0.4382698731625241, 'global_pooling': 'sum', 'learning_rate': 0.0002540587312995013, 'weight_decay': 1.1701445094151855e-06, 'beta_0': 0.8578394931926251, 'beta_1': 0.9812898381971604, 'epsilon': 3.5097567434162965e-06, 'balanced_loss': False, 'epochs': 153, 'early_stopping_patience': 12, 'plateau_patience': 25, 'plateau_divider': 6}. Best is trial 2 with value: 0.9151515151515152.
[I 2025-03-07 11:53:18,538] Trial 118 finished with value: 0.896969696969697 and parameters: {'left_stride': 32, 'right_stride': 32, 'attention_pooling_operation': 'min', 'embedding_pooling_operation': 'min', 'threshold': 0.9742734383042922, 'batch_size': 19, 'attention_heads': 5, 'hidden_dimension': 128, 'number_of_hidden_layers': 3, 'dropout_rate': 0.4642676890939103, 'global_pooling': 'mean', 'learning_rate': 0.00019390385627547264, 'weight_decay': 1.0131216268953898e-06, 'beta_0': 0.8762434522693965, 'beta_1': 0.9859907010227258, 'epsilon': 6.3581660811158475e-06, 'balanced_loss': True, 'epochs': 193, 'early_stopping_patience': 13, 'plateau_patience': 16, 'plateau_divider': 7}. Best is trial 2 with value: 0.9151515151515152.
CUDA out of memory. Tried to allocate 2.51 GiB. GPU 0 has a total capacity of 44.56 GiB of which 284.69 MiB is free. Including non-PyTorch memory, this process has 44.28 GiB memory in use. Of the allocated memory 39.54 GiB is allocated by PyTorch, and 3.59 GiB is reserved by PyTorch but unallocated. If reserved but unallocated memory is large try setting PYTORCH_CUDA_ALLOC_CONF=expandable_segments:True to avoid fragmentation.  See documentation for Memory Management  (https://pytorch.org/docs/stable/notes/cuda.html#environment-variables)
[I 2025-03-07 12:03:01,469] Trial 119 finished with value: -1.0 and parameters: {'left_stride': 128, 'right_stride': 64, 'attention_pooling_operation': 'min', 'embedding_pooling_operation': 'max', 'threshold': 0.9673601260493497, 'batch_size': 54, 'attention_heads': 6, 'hidden_dimension': 79, 'number_of_hidden_layers': 1, 'dropout_rate': 0.5580347506192385, 'global_pooling': 'mean', 'learning_rate': 4.7261394802818354e-05, 'weight_decay': 4.8036297422720786e-06, 'beta_0': 0.8697541056856868, 'beta_1': 0.9854390788431328, 'epsilon': 4.6501808367887295e-06, 'balanced_loss': False, 'epochs': 147, 'early_stopping_patience': 14, 'plateau_patience': 21, 'plateau_divider': 8}. Best is trial 2 with value: 0.9151515151515152.
CUDA out of memory. Tried to allocate 3.59 GiB. GPU 0 has a total capacity of 44.56 GiB of which 1.76 GiB is free. Including non-PyTorch memory, this process has 42.80 GiB memory in use. Of the allocated memory 39.42 GiB is allocated by PyTorch, and 2.23 GiB is reserved by PyTorch but unallocated. If reserved but unallocated memory is large try setting PYTORCH_CUDA_ALLOC_CONF=expandable_segments:True to avoid fragmentation.  See documentation for Memory Management  (https://pytorch.org/docs/stable/notes/cuda.html#environment-variables)
[I 2025-03-07 12:17:35,126] Trial 120 finished with value: -1.0 and parameters: {'left_stride': 32, 'right_stride': 128, 'attention_pooling_operation': 'mean', 'embedding_pooling_operation': 'mean', 'threshold': 0.9587378314953808, 'batch_size': 26, 'attention_heads': 9, 'hidden_dimension': 137, 'number_of_hidden_layers': 1, 'dropout_rate': 0.4481570216418187, 'global_pooling': 'mean', 'learning_rate': 0.00013104088434765367, 'weight_decay': 3.3389524004065926e-06, 'beta_0': 0.8438455573961939, 'beta_1': 0.9808263364866455, 'epsilon': 3.9690092479482725e-05, 'balanced_loss': True, 'epochs': 123, 'early_stopping_patience': 20, 'plateau_patience': 20, 'plateau_divider': 10}. Best is trial 2 with value: 0.9151515151515152.
[I 2025-03-07 12:35:50,792] Trial 121 finished with value: 0.896969696969697 and parameters: {'left_stride': 32, 'right_stride': 256, 'attention_pooling_operation': 'mean', 'embedding_pooling_operation': 'min', 'threshold': 0.9707957075518444, 'batch_size': 29, 'attention_heads': 5, 'hidden_dimension': 86, 'number_of_hidden_layers': 1, 'dropout_rate': 0.4171362729071045, 'global_pooling': 'mean', 'learning_rate': 0.001388338726820296, 'weight_decay': 1.7079459597713782e-06, 'beta_0': 0.8597592263677274, 'beta_1': 0.9869584817509107, 'epsilon': 2.302180221496534e-06, 'balanced_loss': False, 'epochs': 132, 'early_stopping_patience': 18, 'plateau_patience': 22, 'plateau_divider': 8}. Best is trial 2 with value: 0.9151515151515152.
[I 2025-03-07 12:54:28,990] Trial 122 finished with value: 0.9030303030303031 and parameters: {'left_stride': 32, 'right_stride': 256, 'attention_pooling_operation': 'mean', 'embedding_pooling_operation': 'min', 'threshold': 0.9625327647407911, 'batch_size': 27, 'attention_heads': 5, 'hidden_dimension': 97, 'number_of_hidden_layers': 1, 'dropout_rate': 0.3908062606010484, 'global_pooling': 'mean', 'learning_rate': 0.0007140682015952046, 'weight_decay': 2.3104375587643435e-06, 'beta_0': 0.8489968182678943, 'beta_1': 0.9873568949297503, 'epsilon': 2.822080604535806e-06, 'balanced_loss': False, 'epochs': 128, 'early_stopping_patience': 19, 'plateau_patience': 23, 'plateau_divider': 8}. Best is trial 2 with value: 0.9151515151515152.
[I 2025-03-07 13:13:04,045] Trial 123 finished with value: 0.8848484848484849 and parameters: {'left_stride': 32, 'right_stride': 256, 'attention_pooling_operation': 'mean', 'embedding_pooling_operation': 'min', 'threshold': 0.9769164967148308, 'batch_size': 22, 'attention_heads': 4, 'hidden_dimension': 93, 'number_of_hidden_layers': 1, 'dropout_rate': 0.43197196864556753, 'global_pooling': 'mean', 'learning_rate': 6.896817041476048e-05, 'weight_decay': 2.721676056586367e-06, 'beta_0': 0.8532192783932296, 'beta_1': 0.9897083479971126, 'epsilon': 3.8080996756562995e-06, 'balanced_loss': False, 'epochs': 140, 'early_stopping_patience': 18, 'plateau_patience': 22, 'plateau_divider': 8}. Best is trial 2 with value: 0.9151515151515152.
[I 2025-03-07 13:32:47,048] Trial 124 finished with value: 0.896969696969697 and parameters: {'left_stride': 32, 'right_stride': 256, 'attention_pooling_operation': 'mean', 'embedding_pooling_operation': 'min', 'threshold': 0.9650650184256472, 'batch_size': 18, 'attention_heads': 5, 'hidden_dimension': 89, 'number_of_hidden_layers': 1, 'dropout_rate': 0.5806162061407846, 'global_pooling': 'mean', 'learning_rate': 0.0001157949267800332, 'weight_decay': 6.078053271376071e-06, 'beta_0': 0.8546019276153564, 'beta_1': 0.9863976974755362, 'epsilon': 1.6876304632623719e-06, 'balanced_loss': False, 'epochs': 144, 'early_stopping_patience': 19, 'plateau_patience': 23, 'plateau_divider': 7}. Best is trial 2 with value: 0.9151515151515152.
CUDA out of memory. Tried to allocate 2.36 GiB. GPU 0 has a total capacity of 44.56 GiB of which 1.60 GiB is free. Including non-PyTorch memory, this process has 42.95 GiB memory in use. Of the allocated memory 38.65 GiB is allocated by PyTorch, and 3.15 GiB is reserved by PyTorch but unallocated. If reserved but unallocated memory is large try setting PYTORCH_CUDA_ALLOC_CONF=expandable_segments:True to avoid fragmentation.  See documentation for Memory Management  (https://pytorch.org/docs/stable/notes/cuda.html#environment-variables)
[I 2025-03-07 13:49:38,202] Trial 125 finished with value: -1.0 and parameters: {'left_stride': 64, 'right_stride': 256, 'attention_pooling_operation': 'mean', 'embedding_pooling_operation': 'min', 'threshold': 0.9697371563599518, 'batch_size': 39, 'attention_heads': 4, 'hidden_dimension': 150, 'number_of_hidden_layers': 1, 'dropout_rate': 0.36682934295695047, 'global_pooling': 'mean', 'learning_rate': 0.00029819815655252757, 'weight_decay': 4.238525251882071e-06, 'beta_0': 0.8465426133107967, 'beta_1': 0.9875162600819177, 'epsilon': 5.712667240759263e-06, 'balanced_loss': False, 'epochs': 190, 'early_stopping_patience': 20, 'plateau_patience': 24, 'plateau_divider': 9}. Best is trial 2 with value: 0.9151515151515152.
[I 2025-03-07 14:01:51,890] Trial 126 finished with value: 0.8848484848484849 and parameters: {'left_stride': 32, 'right_stride': 64, 'attention_pooling_operation': 'min', 'embedding_pooling_operation': 'min', 'threshold': 0.973226135088813, 'batch_size': 32, 'attention_heads': 6, 'hidden_dimension': 104, 'number_of_hidden_layers': 1, 'dropout_rate': 0.3898738398503277, 'global_pooling': 'mean', 'learning_rate': 8.271337042671233e-05, 'weight_decay': 1.9775345195907293e-06, 'beta_0': 0.8715897512030933, 'beta_1': 0.9800673126183501, 'epsilon': 3.149174446245876e-06, 'balanced_loss': False, 'epochs': 134, 'early_stopping_patience': 19, 'plateau_patience': 12, 'plateau_divider': 8}. Best is trial 2 with value: 0.9151515151515152.
[I 2025-03-07 14:16:14,270] Trial 127 finished with value: 0.8909090909090909 and parameters: {'left_stride': 0, 'right_stride': 32, 'attention_pooling_operation': 'mean', 'embedding_pooling_operation': 'max', 'threshold': 0.9755046696061778, 'batch_size': 16, 'attention_heads': 5, 'hidden_dimension': 76, 'number_of_hidden_layers': 1, 'dropout_rate': 0.31455112367472565, 'global_pooling': 'mean', 'learning_rate': 0.00016230850109870342, 'weight_decay': 1.5893914598250709e-06, 'beta_0': 0.8583538705886482, 'beta_1': 0.9886906873524877, 'epsilon': 2.6380263251798004e-05, 'balanced_loss': False, 'epochs': 185, 'early_stopping_patience': 21, 'plateau_patience': 14, 'plateau_divider': 6}. Best is trial 2 with value: 0.9151515151515152.
[I 2025-03-07 14:30:09,053] Trial 128 finished with value: 0.8909090909090909 and parameters: {'left_stride': 128, 'right_stride': 128, 'attention_pooling_operation': 'min', 'embedding_pooling_operation': 'mean', 'threshold': 0.9889025525893292, 'batch_size': 24, 'attention_heads': 5, 'hidden_dimension': 143, 'number_of_hidden_layers': 2, 'dropout_rate': 0.43960936101612375, 'global_pooling': 'mean', 'learning_rate': 5.97070311150836e-05, 'weight_decay': 7.054168367367268e-06, 'beta_0': 0.8628325724828318, 'beta_1': 0.9817147613446451, 'epsilon': 6.510696046410789e-05, 'balanced_loss': True, 'epochs': 122, 'early_stopping_patience': 18, 'plateau_patience': 21, 'plateau_divider': 8}. Best is trial 2 with value: 0.9151515151515152.
[I 2025-03-07 14:46:18,493] Trial 129 finished with value: 0.9030303030303031 and parameters: {'left_stride': 32, 'right_stride': 64, 'attention_pooling_operation': 'mean', 'embedding_pooling_operation': 'min', 'threshold': 0.9669554494553233, 'batch_size': 21, 'attention_heads': 4, 'hidden_dimension': 114, 'number_of_hidden_layers': 1, 'dropout_rate': 0.40321366377383006, 'global_pooling': 'mean', 'learning_rate': 9.782006331328046e-05, 'weight_decay': 1.3493860173938336e-06, 'beta_0': 0.8797189106661121, 'beta_1': 0.9883331153698475, 'epsilon': 8.415928710258777e-06, 'balanced_loss': False, 'epochs': 115, 'early_stopping_patience': 15, 'plateau_patience': 15, 'plateau_divider': 7}. Best is trial 2 with value: 0.9151515151515152.
[I 2025-03-07 15:01:48,897] Trial 130 finished with value: 0.8303030303030303 and parameters: {'left_stride': 32, 'right_stride': 0, 'attention_pooling_operation': 'max', 'embedding_pooling_operation': 'max', 'threshold': 0.9840325799574061, 'batch_size': 20, 'attention_heads': 7, 'hidden_dimension': 171, 'number_of_hidden_layers': 1, 'dropout_rate': 0.4261807835486419, 'global_pooling': 'max', 'learning_rate': 3.84950314380689e-05, 'weight_decay': 6.798186264414413e-05, 'beta_0': 0.8128220890521112, 'beta_1': 0.9807237403186128, 'epsilon': 4.244370971240437e-06, 'balanced_loss': True, 'epochs': 150, 'early_stopping_patience': 22, 'plateau_patience': 13, 'plateau_divider': 6}. Best is trial 2 with value: 0.9151515151515152.
[I 2025-03-07 15:23:21,417] Trial 131 finished with value: 0.9030303030303031 and parameters: {'left_stride': 32, 'right_stride': 64, 'attention_pooling_operation': 'mean', 'embedding_pooling_operation': 'max', 'threshold': 0.9852507709253541, 'batch_size': 21, 'attention_heads': 12, 'hidden_dimension': 250, 'number_of_hidden_layers': 1, 'dropout_rate': 0.42538175278291723, 'global_pooling': 'mean', 'learning_rate': 0.00011203220000137946, 'weight_decay': 1.3354990954515852e-06, 'beta_0': 0.8441637087574425, 'beta_1': 0.9805686823793667, 'epsilon': 2.116361413459895e-06, 'balanced_loss': False, 'epochs': 184, 'early_stopping_patience': 19, 'plateau_patience': 20, 'plateau_divider': 10}. Best is trial 2 with value: 0.9151515151515152.
CUDA out of memory. Tried to allocate 2.81 GiB. GPU 0 has a total capacity of 44.56 GiB of which 2.24 GiB is free. Including non-PyTorch memory, this process has 42.32 GiB memory in use. Of the allocated memory 35.50 GiB is allocated by PyTorch, and 5.66 GiB is reserved by PyTorch but unallocated. If reserved but unallocated memory is large try setting PYTORCH_CUDA_ALLOC_CONF=expandable_segments:True to avoid fragmentation.  See documentation for Memory Management  (https://pytorch.org/docs/stable/notes/cuda.html#environment-variables)
[I 2025-03-07 15:40:05,077] Trial 132 finished with value: -1.0 and parameters: {'left_stride': 32, 'right_stride': 64, 'attention_pooling_operation': 'mean', 'embedding_pooling_operation': 'max', 'threshold': 0.9805294579372926, 'batch_size': 23, 'attention_heads': 12, 'hidden_dimension': 189, 'number_of_hidden_layers': 1, 'dropout_rate': 0.45227507755530366, 'global_pooling': 'mean', 'learning_rate': 0.000954641323848283, 'weight_decay': 1.1741944541648651e-06, 'beta_0': 0.8428358359770597, 'beta_1': 0.9800039035076911, 'epsilon': 1.9553482247304873e-06, 'balanced_loss': False, 'epochs': 179, 'early_stopping_patience': 19, 'plateau_patience': 20, 'plateau_divider': 10}. Best is trial 2 with value: 0.9151515151515152.
