[I 2025-03-06 13:12:04,220] Trial 19 finished with value: -1.0 and parameters: {'left_stride': 0, 'right_stride': 128, 'attention_pooling_operation': 'min', 'embedding_pooling_operation': 'mean', 'threshold': 0.9661389941672918, 'batch_size': 34, 'attention_heads': 7, 'hidden_dimension': 118, 'number_of_hidden_layers': 1, 'dropout_rate': 0.4161032044480161, 'global_pooling': 'mean', 'learning_rate': 0.0008620189481276323, 'weight_decay': 2.6056845845932253e-06, 'beta_0': 0.8501775573721153, 'beta_1': 0.9943720154535816, 'epsilon': 3.3503783026673938e-06, 'balanced_loss': True, 'epochs': 174, 'early_stopping_patience': 12, 'plateau_patience': 10, 'plateau_divider': 10}. Best is trial 2 with value: 0.9151515151515152.
CUDA out of memory. Tried to allocate 1.01 GiB. GPU 0 has a total capacity of 44.56 GiB of which 88.69 MiB is free. Including non-PyTorch memory, this process has 44.47 GiB memory in use. Of the allocated memory 40.85 GiB is allocated by PyTorch, and 2.46 GiB is reserved by PyTorch but unallocated. If reserved but unallocated memory is large try setting PYTORCH_CUDA_ALLOC_CONF=expandable_segments:True to avoid fragmentation.  See documentation for Memory Management  (https://pytorch.org/docs/stable/notes/cuda.html#environment-variables)
[I 2025-03-06 13:22:21,532] Trial 20 finished with value: -1.0 and parameters: {'left_stride': 128, 'right_stride': 128, 'attention_pooling_operation': 'min', 'embedding_pooling_operation': 'mean', 'threshold': 0.9515385093477269, 'batch_size': 24, 'attention_heads': 8, 'hidden_dimension': 36, 'number_of_hidden_layers': 4, 'dropout_rate': 0.4718229936345373, 'global_pooling': 'mean', 'learning_rate': 0.01741984434716415, 'weight_decay': 1.3388870263190836e-05, 'beta_0': 0.8571318019371432, 'beta_1': 0.9865453889524554, 'epsilon': 2.978494405725174e-07, 'balanced_loss': True, 'epochs': 147, 'early_stopping_patience': 15, 'plateau_patience': 12, 'plateau_divider': 9}. Best is trial 2 with value: 0.9151515151515152.
[I 2025-03-06 13:33:44,497] Trial 21 finished with value: 0.8848484848484849 and parameters: {'left_stride': 64, 'right_stride': 128, 'attention_pooling_operation': 'min', 'embedding_pooling_operation': 'mean', 'threshold': 0.9843278999628386, 'batch_size': 21, 'attention_heads': 5, 'hidden_dimension': 72, 'number_of_hidden_layers': 0, 'dropout_rate': 0.4394214813785529, 'global_pooling': 'mean', 'learning_rate': 8.696451609571903e-05, 'weight_decay': 4.8301282695181e-06, 'beta_0': 0.8773605250989186, 'beta_1': 0.9825164467330031, 'epsilon': 1.2287332993099977e-05, 'balanced_loss': True, 'epochs': 117, 'early_stopping_patience': 17, 'plateau_patience': 15, 'plateau_divider': 8}. Best is trial 2 with value: 0.9151515151515152.
[I 2025-03-06 13:46:08,265] Trial 22 finished with value: 0.9030303030303031 and parameters: {'left_stride': 64, 'right_stride': 128, 'attention_pooling_operation': 'min', 'embedding_pooling_operation': 'mean', 'threshold': 0.9735380370228474, 'batch_size': 20, 'attention_heads': 5, 'hidden_dimension': 65, 'number_of_hidden_layers': 1, 'dropout_rate': 0.5152398202256283, 'global_pooling': 'mean', 'learning_rate': 5.690631664811265e-05, 'weight_decay': 2.7071833654608395e-06, 'beta_0': 0.8730958896317493, 'beta_1': 0.9815381892863796, 'epsilon': 1.526188474071594e-05, 'balanced_loss': True, 'epochs': 121, 'early_stopping_patience': 18, 'plateau_patience': 15, 'plateau_divider': 7}. Best is trial 2 with value: 0.9151515151515152.
[I 2025-03-06 14:01:48,137] Trial 23 finished with value: 0.896969696969697 and parameters: {'left_stride': 64, 'right_stride': 128, 'attention_pooling_operation': 'min', 'embedding_pooling_operation': 'mean', 'threshold': 0.9716215057109643, 'batch_size': 31, 'attention_heads': 5, 'hidden_dimension': 75, 'number_of_hidden_layers': 1, 'dropout_rate': 0.5477919479071571, 'global_pooling': 'mean', 'learning_rate': 2.656031456135463e-05, 'weight_decay': 2.0793044345416203e-06, 'beta_0': 0.8636306629753923, 'beta_1': 0.9811249843947168, 'epsilon': 2.717265136136558e-06, 'balanced_loss': True, 'epochs': 124, 'early_stopping_patience': 20, 'plateau_patience': 12, 'plateau_divider': 6}. Best is trial 2 with value: 0.9151515151515152.
[I 2025-03-06 14:23:18,510] Trial 24 finished with value: 0.8545454545454545 and parameters: {'left_stride': 64, 'right_stride': 128, 'attention_pooling_operation': 'min', 'embedding_pooling_operation': 'mean', 'threshold': 0.9747793203617963, 'batch_size': 20, 'attention_heads': 7, 'hidden_dimension': 80, 'number_of_hidden_layers': 2, 'dropout_rate': 0.5982905780104251, 'global_pooling': 'mean', 'learning_rate': 1.1371218168230958e-05, 'weight_decay': 1.7269970466831973e-06, 'beta_0': 0.843473324081945, 'beta_1': 0.9834399179232998, 'epsilon': 9.57384631506369e-06, 'balanced_loss': True, 'epochs': 106, 'early_stopping_patience': 18, 'plateau_patience': 12, 'plateau_divider': 7}. Best is trial 2 with value: 0.9151515151515152.
CUDA out of memory. Tried to allocate 3.16 GiB. GPU 0 has a total capacity of 44.56 GiB of which 444.69 MiB is free. Including non-PyTorch memory, this process has 44.12 GiB memory in use. Of the allocated memory 40.96 GiB is allocated by PyTorch, and 2.01 GiB is reserved by PyTorch but unallocated. If reserved but unallocated memory is large try setting PYTORCH_CUDA_ALLOC_CONF=expandable_segments:True to avoid fragmentation.  See documentation for Memory Management  (https://pytorch.org/docs/stable/notes/cuda.html#environment-variables)
[I 2025-03-06 14:39:54,607] Trial 25 finished with value: -1.0 and parameters: {'left_stride': 32, 'right_stride': 256, 'attention_pooling_operation': 'mean', 'embedding_pooling_operation': 'max', 'threshold': 0.9490437543889996, 'batch_size': 28, 'attention_heads': 5, 'hidden_dimension': 144, 'number_of_hidden_layers': 1, 'dropout_rate': 0.506427415774549, 'global_pooling': 'sum', 'learning_rate': 0.0004677245205870634, 'weight_decay': 2.932499941567802e-06, 'beta_0': 0.8573589592217871, 'beta_1': 0.9810242125372717, 'epsilon': 2.267745533670667e-05, 'balanced_loss': True, 'epochs': 75, 'early_stopping_patience': 14, 'plateau_patience': 15, 'plateau_divider': 10}. Best is trial 2 with value: 0.9151515151515152.
[I 2025-03-06 14:53:00,297] Trial 26 finished with value: 0.8727272727272727 and parameters: {'left_stride': 64, 'right_stride': 0, 'attention_pooling_operation': 'min', 'embedding_pooling_operation': 'mean', 'threshold': 0.9906768576972595, 'batch_size': 34, 'attention_heads': 8, 'hidden_dimension': 142, 'number_of_hidden_layers': 3, 'dropout_rate': 0.5298721420781565, 'global_pooling': 'mean', 'learning_rate': 0.00017063711318375172, 'weight_decay': 1.4167380766548147e-05, 'beta_0': 0.8732694669548539, 'beta_1': 0.9880895711895139, 'epsilon': 5.509358096013087e-07, 'balanced_loss': True, 'epochs': 138, 'early_stopping_patience': 17, 'plateau_patience': 11, 'plateau_divider': 6}. Best is trial 2 with value: 0.9151515151515152.
[I 2025-03-06 15:05:46,498] Trial 27 finished with value: 0.8848484848484849 and parameters: {'left_stride': 64, 'right_stride': 32, 'attention_pooling_operation': 'min', 'embedding_pooling_operation': 'mean', 'threshold': 0.9650074864107694, 'batch_size': 46, 'attention_heads': 6, 'hidden_dimension': 50, 'number_of_hidden_layers': 1, 'dropout_rate': 0.4621604403362684, 'global_pooling': 'mean', 'learning_rate': 4.9610870017679544e-05, 'weight_decay': 1.457811421668042e-06, 'beta_0': 0.8220784566455493, 'beta_1': 0.998800192918023, 'epsilon': 3.072639126218525e-05, 'balanced_loss': True, 'epochs': 159, 'early_stopping_patience': 12, 'plateau_patience': 16, 'plateau_divider': 9}. Best is trial 2 with value: 0.9151515151515152.
[I 2025-03-06 15:17:22,977] Trial 28 finished with value: 0.8909090909090909 and parameters: {'left_stride': 32, 'right_stride': 128, 'attention_pooling_operation': 'min', 'embedding_pooling_operation': 'mean', 'threshold': 0.9780139618392125, 'batch_size': 18, 'attention_heads': 4, 'hidden_dimension': 116, 'number_of_hidden_layers': 2, 'dropout_rate': 0.49171110729339645, 'global_pooling': 'mean', 'learning_rate': 0.0016621208952231833, 'weight_decay': 3.925611765436764e-06, 'beta_0': 0.8563153207343507, 'beta_1': 0.9855671107821562, 'epsilon': 2.7414545537004273e-06, 'balanced_loss': True, 'epochs': 84, 'early_stopping_patience': 19, 'plateau_patience': 19, 'plateau_divider': 7}. Best is trial 2 with value: 0.9151515151515152.
CUDA out of memory. Tried to allocate 500.00 MiB. GPU 0 has a total capacity of 44.56 GiB of which 280.69 MiB is free. Including non-PyTorch memory, this process has 44.28 GiB memory in use. Of the allocated memory 40.60 GiB is allocated by PyTorch, and 2.53 GiB is reserved by PyTorch but unallocated. If reserved but unallocated memory is large try setting PYTORCH_CUDA_ALLOC_CONF=expandable_segments:True to avoid fragmentation.  See documentation for Memory Management  (https://pytorch.org/docs/stable/notes/cuda.html#environment-variables)
[I 2025-03-06 15:30:26,501] Trial 29 finished with value: -1.0 and parameters: {'left_stride': 32, 'right_stride': 128, 'attention_pooling_operation': 'mean', 'embedding_pooling_operation': 'max', 'threshold': 0.9013794237547178, 'batch_size': 44, 'attention_heads': 9, 'hidden_dimension': 87, 'number_of_hidden_layers': 3, 'dropout_rate': 0.41271021082279297, 'global_pooling': 'sum', 'learning_rate': 2.5130505908654767e-05, 'weight_decay': 4.584393675798188e-06, 'beta_0': 0.848159937347863, 'beta_1': 0.9834135186352271, 'epsilon': 6.407829801027749e-06, 'balanced_loss': True, 'epochs': 184, 'early_stopping_patience': 15, 'plateau_patience': 14, 'plateau_divider': 9}. Best is trial 2 with value: 0.9151515151515152.
CUDA out of memory. Tried to allocate 2.19 GiB. GPU 0 has a total capacity of 44.56 GiB of which 560.69 MiB is free. Including non-PyTorch memory, this process has 44.01 GiB memory in use. Of the allocated memory 41.50 GiB is allocated by PyTorch, and 1.36 GiB is reserved by PyTorch but unallocated. If reserved but unallocated memory is large try setting PYTORCH_CUDA_ALLOC_CONF=expandable_segments:True to avoid fragmentation.  See documentation for Memory Management  (https://pytorch.org/docs/stable/notes/cuda.html#environment-variables)
[I 2025-03-06 15:39:48,896] Trial 30 finished with value: -1.0 and parameters: {'left_stride': 0, 'right_stride': 128, 'attention_pooling_operation': 'min', 'embedding_pooling_operation': 'mean', 'threshold': 0.9571909754177468, 'batch_size': 25, 'attention_heads': 8, 'hidden_dimension': 98, 'number_of_hidden_layers': 2, 'dropout_rate': 0.5060954702146057, 'global_pooling': 'mean', 'learning_rate': 0.00880257442976611, 'weight_decay': 3.39202518186886e-06, 'beta_0': 0.8078364270902004, 'beta_1': 0.9817944758086452, 'epsilon': 5.558634994589789e-07, 'balanced_loss': True, 'epochs': 109, 'early_stopping_patience': 13, 'plateau_patience': 13, 'plateau_divider': 10}. Best is trial 2 with value: 0.9151515151515152.
[I 2025-03-06 15:55:38,056] Trial 31 finished with value: 0.8787878787878788 and parameters: {'left_stride': 64, 'right_stride': 128, 'attention_pooling_operation': 'min', 'embedding_pooling_operation': 'mean', 'threshold': 0.9697505231210753, 'batch_size': 32, 'attention_heads': 5, 'hidden_dimension': 60, 'number_of_hidden_layers': 1, 'dropout_rate': 0.5519240593921764, 'global_pooling': 'mean', 'learning_rate': 2.369404334197908e-05, 'weight_decay': 2.178383673424262e-06, 'beta_0': 0.8642563255945398, 'beta_1': 0.9813040941175936, 'epsilon': 2.1374437409039653e-06, 'balanced_loss': True, 'epochs': 126, 'early_stopping_patience': 21, 'plateau_patience': 12, 'plateau_divider': 5}. Best is trial 2 with value: 0.9151515151515152.
[I 2025-03-06 16:07:48,729] Trial 32 finished with value: 0.8727272727272727 and parameters: {'left_stride': 64, 'right_stride': 128, 'attention_pooling_operation': 'min', 'embedding_pooling_operation': 'mean', 'threshold': 0.990129269427485, 'batch_size': 38, 'attention_heads': 5, 'hidden_dimension': 70, 'number_of_hidden_layers': 1, 'dropout_rate': 0.5402655527566671, 'global_pooling': 'mean', 'learning_rate': 4.261965723692681e-05, 'weight_decay': 1.5391857321261276e-06, 'beta_0': 0.8838388796775725, 'beta_1': 0.980724271962689, 'epsilon': 5.908925994308989e-06, 'balanced_loss': True, 'epochs': 129, 'early_stopping_patience': 20, 'plateau_patience': 11, 'plateau_divider': 6}. Best is trial 2 with value: 0.9151515151515152.
[I 2025-03-06 16:21:08,149] Trial 33 finished with value: 0.8909090909090909 and parameters: {'left_stride': 64, 'right_stride': 128, 'attention_pooling_operation': 'min', 'embedding_pooling_operation': 'mean', 'threshold': 0.9779532610530047, 'batch_size': 22, 'attention_heads': 6, 'hidden_dimension': 110, 'number_of_hidden_layers': 0, 'dropout_rate': 0.5833628590463211, 'global_pooling': 'mean', 'learning_rate': 9.863259232959256e-05, 'weight_decay': 5.768351917784468e-06, 'beta_0': 0.845245155463558, 'beta_1': 0.9831862350681093, 'epsilon': 1.712696334763341e-06, 'balanced_loss': True, 'epochs': 123, 'early_stopping_patience': 22, 'plateau_patience': 16, 'plateau_divider': 5}. Best is trial 2 with value: 0.9151515151515152.
[I 2025-03-06 16:30:51,484] Trial 34 finished with value: 0.8727272727272727 and parameters: {'left_stride': 64, 'right_stride': 32, 'attention_pooling_operation': 'min', 'embedding_pooling_operation': 'mean', 'threshold': 0.9934661368257622, 'batch_size': 27, 'attention_heads': 4, 'hidden_dimension': 81, 'number_of_hidden_layers': 1, 'dropout_rate': 0.5570093858590918, 'global_pooling': 'mean', 'learning_rate': 0.0001749018486396942, 'weight_decay': 1.1944317901219978e-06, 'beta_0': 0.8604604517070155, 'beta_1': 0.9911897265213029, 'epsilon': 3.714460069375318e-06, 'balanced_loss': True, 'epochs': 139, 'early_stopping_patience': 19, 'plateau_patience': 13, 'plateau_divider': 7}. Best is trial 2 with value: 0.9151515151515152.
[I 2025-03-06 16:53:57,365] Trial 35 finished with value: 0.8363636363636363 and parameters: {'left_stride': 256, 'right_stride': 64, 'attention_pooling_operation': 'min', 'embedding_pooling_operation': 'min', 'threshold': 0.9683645901110106, 'batch_size': 32, 'attention_heads': 7, 'hidden_dimension': 130, 'number_of_hidden_layers': 0, 'dropout_rate': 0.35227255802889634, 'global_pooling': 'mean', 'learning_rate': 1.745021786012829e-05, 'weight_decay': 6.62100941986372e-05, 'beta_0': 0.8719984560374681, 'beta_1': 0.9800598993437178, 'epsilon': 1.641488720669157e-05, 'balanced_loss': True, 'epochs': 159, 'early_stopping_patience': 20, 'plateau_patience': 11, 'plateau_divider': 8}. Best is trial 2 with value: 0.9151515151515152.
CUDA out of memory. Tried to allocate 2.97 GiB. GPU 0 has a total capacity of 44.56 GiB of which 616.69 MiB is free. Including non-PyTorch memory, this process has 43.95 GiB memory in use. Of the allocated memory 41.48 GiB is allocated by PyTorch, and 1.33 GiB is reserved by PyTorch but unallocated. If reserved but unallocated memory is large try setting PYTORCH_CUDA_ALLOC_CONF=expandable_segments:True to avoid fragmentation.  See documentation for Memory Management  (https://pytorch.org/docs/stable/notes/cuda.html#environment-variables)
[I 2025-03-06 17:02:52,099] Trial 36 finished with value: -1.0 and parameters: {'left_stride': 64, 'right_stride': 0, 'attention_pooling_operation': 'min', 'embedding_pooling_operation': 'mean', 'threshold': 0.9566829670833303, 'batch_size': 36, 'attention_heads': 5, 'hidden_dimension': 159, 'number_of_hidden_layers': 1, 'dropout_rate': 0.525711655405209, 'global_pooling': 'mean', 'learning_rate': 3.826444196614517e-05, 'weight_decay': 2.3799965367536935e-06, 'beta_0': 0.8526869512357981, 'beta_1': 0.9818107341040954, 'epsilon': 7.846819114376024e-06, 'balanced_loss': True, 'epochs': 123, 'early_stopping_patience': 23, 'plateau_patience': 15, 'plateau_divider': 6}. Best is trial 2 with value: 0.9151515151515152.
CUDA out of memory. Tried to allocate 5.43 GiB. GPU 0 has a total capacity of 44.56 GiB of which 4.87 GiB is free. Including non-PyTorch memory, this process has 39.69 GiB memory in use. Of the allocated memory 37.09 GiB is allocated by PyTorch, and 1.45 GiB is reserved by PyTorch but unallocated. If reserved but unallocated memory is large try setting PYTORCH_CUDA_ALLOC_CONF=expandable_segments:True to avoid fragmentation.  See documentation for Memory Management  (https://pytorch.org/docs/stable/notes/cuda.html#environment-variables)
[I 2025-03-06 17:18:07,940] Trial 37 finished with value: -1.0 and parameters: {'left_stride': 64, 'right_stride': 128, 'attention_pooling_operation': 'mean', 'embedding_pooling_operation': 'mean', 'threshold': 0.9765448646681572, 'batch_size': 43, 'attention_heads': 10, 'hidden_dimension': 194, 'number_of_hidden_layers': 0, 'dropout_rate': 0.4584169604138366, 'global_pooling': 'max', 'learning_rate': 0.00033089866500366914, 'weight_decay': 1.1002548261405314e-05, 'beta_0': 0.8291406365207994, 'beta_1': 0.9860987567153712, 'epsilon': 6.729149202229014e-07, 'balanced_loss': True, 'epochs': 90, 'early_stopping_patience': 15, 'plateau_patience': 10, 'plateau_divider': 5}. Best is trial 2 with value: 0.9151515151515152.
[I 2025-03-06 17:31:48,387] Trial 38 finished with value: 0.9030303030303031 and parameters: {'left_stride': 128, 'right_stride': 32, 'attention_pooling_operation': 'min', 'embedding_pooling_operation': 'min', 'threshold': 0.9623777657149539, 'batch_size': 30, 'attention_heads': 6, 'hidden_dimension': 91, 'number_of_hidden_layers': 1, 'dropout_rate': 0.5702475334100342, 'global_pooling': 'mean', 'learning_rate': 0.0001329740751456538, 'weight_decay': 3.3149584524899616e-06, 'beta_0': 0.8404920839550495, 'beta_1': 0.9800498188836724, 'epsilon': 4.398154012005355e-06, 'balanced_loss': True, 'epochs': 145, 'early_stopping_patience': 16, 'plateau_patience': 17, 'plateau_divider': 6}. Best is trial 2 with value: 0.9151515151515152.
CUDA out of memory. Tried to allocate 4.28 GiB. GPU 0 has a total capacity of 44.56 GiB of which 3.40 GiB is free. Including non-PyTorch memory, this process has 41.15 GiB memory in use. Of the allocated memory 37.64 GiB is allocated by PyTorch, and 2.37 GiB is reserved by PyTorch but unallocated. If reserved but unallocated memory is large try setting PYTORCH_CUDA_ALLOC_CONF=expandable_segments:True to avoid fragmentation.  See documentation for Memory Management  (https://pytorch.org/docs/stable/notes/cuda.html#environment-variables)
[I 2025-03-06 17:41:24,034] Trial 39 finished with value: -1.0 and parameters: {'left_stride': 128, 'right_stride': 32, 'attention_pooling_operation': 'max', 'embedding_pooling_operation': 'min', 'threshold': 0.9407565425805422, 'batch_size': 36, 'attention_heads': 8, 'hidden_dimension': 92, 'number_of_hidden_layers': 3, 'dropout_rate': 0.5729943517879397, 'global_pooling': 'max', 'learning_rate': 0.0004965192622491495, 'weight_decay': 3.436884184272464e-06, 'beta_0': 0.8422311403582269, 'beta_1': 0.9801010274362343, 'epsilon': 1.213965801256414e-08, 'balanced_loss': False, 'epochs': 185, 'early_stopping_patience': 16, 'plateau_patience': 17, 'plateau_divider': 7}. Best is trial 2 with value: 0.9151515151515152.
CUDA out of memory. Tried to allocate 1.79 GiB. GPU 0 has a total capacity of 44.56 GiB of which 1.40 GiB is free. Including non-PyTorch memory, this process has 43.15 GiB memory in use. Of the allocated memory 40.44 GiB is allocated by PyTorch, and 1.56 GiB is reserved by PyTorch but unallocated. If reserved but unallocated memory is large try setting PYTORCH_CUDA_ALLOC_CONF=expandable_segments:True to avoid fragmentation.  See documentation for Memory Management  (https://pytorch.org/docs/stable/notes/cuda.html#environment-variables)
[I 2025-03-06 17:51:02,292] Trial 40 finished with value: -1.0 and parameters: {'left_stride': 128, 'right_stride': 32, 'attention_pooling_operation': 'min', 'embedding_pooling_operation': 'min', 'threshold': 0.9610224294802997, 'batch_size': 20, 'attention_heads': 6, 'hidden_dimension': 129, 'number_of_hidden_layers': 2, 'dropout_rate': 0.49685815707028713, 'global_pooling': 'sum', 'learning_rate': 0.00018188248830613372, 'weight_decay': 8.99192253643451e-06, 'beta_0': 0.8302740009653008, 'beta_1': 0.984245314181402, 'epsilon': 3.8997420398683326e-05, 'balanced_loss': True, 'epochs': 199, 'early_stopping_patience': 11, 'plateau_patience': 19, 'plateau_divider': 4}. Best is trial 2 with value: 0.9151515151515152.
[I 2025-03-06 18:03:37,345] Trial 41 finished with value: 0.8848484848484849 and parameters: {'left_stride': 128, 'right_stride': 32, 'attention_pooling_operation': 'min', 'embedding_pooling_operation': 'min', 'threshold': 0.9721385687902707, 'batch_size': 31, 'attention_heads': 6, 'hidden_dimension': 32, 'number_of_hidden_layers': 1, 'dropout_rate': 0.5441914887240072, 'global_pooling': 'mean', 'learning_rate': 6.042119703355801e-05, 'weight_decay': 1.7418953837387422e-06, 'beta_0': 0.8643935236738703, 'beta_1': 0.981124680770017, 'epsilon': 5.4979270124553425e-06, 'balanced_loss': True, 'epochs': 146, 'early_stopping_patience': 17, 'plateau_patience': 17, 'plateau_divider': 6}. Best is trial 2 with value: 0.9151515151515152.
The selected strides are greater or equal to the total chunk size.
[I 2025-03-06 18:03:38,252] Trial 42 finished with value: -1.0 and parameters: {'left_stride': 256, 'right_stride': 256, 'attention_pooling_operation': 'min', 'embedding_pooling_operation': 'min', 'threshold': 0.963181443346315, 'batch_size': 26, 'attention_heads': 5, 'hidden_dimension': 59, 'number_of_hidden_layers': 1, 'dropout_rate': 0.5649761494076985, 'global_pooling': 'mean', 'learning_rate': 0.00011820503463759567, 'weight_decay': 2.219876163031805e-06, 'beta_0': 0.8391019054609643, 'beta_1': 0.9821809203418677, 'epsilon': 2.0890333094885252e-06, 'balanced_loss': True, 'epochs': 109, 'early_stopping_patience': 18, 'plateau_patience': 15, 'plateau_divider': 6}. Best is trial 2 with value: 0.9151515151515152.
