[I 2025-03-06 23:12:22,539] Trial 65 finished with value: -1.0 and parameters: {'left_stride': 0, 'right_stride': 256, 'attention_pooling_operation': 'mean', 'embedding_pooling_operation': 'max', 'threshold': 0.9660920706306286, 'batch_size': 22, 'attention_heads': 4, 'hidden_dimension': 123, 'number_of_hidden_layers': 4, 'dropout_rate': 0.593439964796698, 'global_pooling': 'mean', 'learning_rate': 0.000393386255546215, 'weight_decay': 3.631116783358248e-06, 'beta_0': 0.8862486742841266, 'beta_1': 0.9806207379446619, 'epsilon': 1.3696432503131391e-05, 'balanced_loss': False, 'epochs': 178, 'early_stopping_patience': 17, 'plateau_patience': 24, 'plateau_divider': 6}. Best is trial 2 with value: 0.9151515151515152.
CUDA out of memory. Tried to allocate 2.58 GiB. GPU 0 has a total capacity of 44.56 GiB of which 132.69 MiB is free. Including non-PyTorch memory, this process has 44.42 GiB memory in use. Of the allocated memory 41.85 GiB is allocated by PyTorch, and 1.42 GiB is reserved by PyTorch but unallocated. If reserved but unallocated memory is large try setting PYTORCH_CUDA_ALLOC_CONF=expandable_segments:True to avoid fragmentation.  See documentation for Memory Management  (https://pytorch.org/docs/stable/notes/cuda.html#environment-variables)
[I 2025-03-06 23:21:44,730] Trial 66 finished with value: -1.0 and parameters: {'left_stride': 128, 'right_stride': 0, 'attention_pooling_operation': 'max', 'embedding_pooling_operation': 'min', 'threshold': 0.9449950814188776, 'batch_size': 28, 'attention_heads': 6, 'hidden_dimension': 108, 'number_of_hidden_layers': 1, 'dropout_rate': 0.36562128044735315, 'global_pooling': 'sum', 'learning_rate': 0.003113604357239929, 'weight_decay': 1.9093433059255295e-06, 'beta_0': 0.8529941778777292, 'beta_1': 0.9822248873405576, 'epsilon': 3.1144396893046566e-06, 'balanced_loss': True, 'epochs': 144, 'early_stopping_patience': 19, 'plateau_patience': 17, 'plateau_divider': 8}. Best is trial 2 with value: 0.9151515151515152.
CUDA out of memory. Tried to allocate 1.83 GiB. GPU 0 has a total capacity of 44.56 GiB of which 610.69 MiB is free. Including non-PyTorch memory, this process has 43.96 GiB memory in use. Of the allocated memory 40.03 GiB is allocated by PyTorch, and 2.78 GiB is reserved by PyTorch but unallocated. If reserved but unallocated memory is large try setting PYTORCH_CUDA_ALLOC_CONF=expandable_segments:True to avoid fragmentation.  See documentation for Memory Management  (https://pytorch.org/docs/stable/notes/cuda.html#environment-variables)
[I 2025-03-06 23:30:54,621] Trial 67 finished with value: -1.0 and parameters: {'left_stride': 32, 'right_stride': 64, 'attention_pooling_operation': 'min', 'embedding_pooling_operation': 'min', 'threshold': 0.9601525836998084, 'batch_size': 25, 'attention_heads': 5, 'hidden_dimension': 138, 'number_of_hidden_layers': 2, 'dropout_rate': 0.5188749451867788, 'global_pooling': 'mean', 'learning_rate': 0.0008119756444299805, 'weight_decay': 4.7363486219362577e-05, 'beta_0': 0.867366462818362, 'beta_1': 0.9830730018299791, 'epsilon': 2.3914410724629226e-05, 'balanced_loss': True, 'epochs': 198, 'early_stopping_patience': 18, 'plateau_patience': 21, 'plateau_divider': 7}. Best is trial 2 with value: 0.9151515151515152.
CUDA out of memory. Tried to allocate 6.40 GiB. GPU 0 has a total capacity of 44.56 GiB of which 2.22 GiB is free. Including non-PyTorch memory, this process has 42.34 GiB memory in use. Of the allocated memory 38.20 GiB is allocated by PyTorch, and 2.98 GiB is reserved by PyTorch but unallocated. If reserved but unallocated memory is large try setting PYTORCH_CUDA_ALLOC_CONF=expandable_segments:True to avoid fragmentation.  See documentation for Memory Management  (https://pytorch.org/docs/stable/notes/cuda.html#environment-variables)
[I 2025-03-06 23:41:17,270] Trial 68 finished with value: -1.0 and parameters: {'left_stride': 128, 'right_stride': 128, 'attention_pooling_operation': 'min', 'embedding_pooling_operation': 'max', 'threshold': 0.9707754356928363, 'batch_size': 61, 'attention_heads': 8, 'hidden_dimension': 151, 'number_of_hidden_layers': 2, 'dropout_rate': 0.3998465931441026, 'global_pooling': 'mean', 'learning_rate': 9.941694864346964e-05, 'weight_decay': 7.901331502750646e-06, 'beta_0': 0.813738254682447, 'beta_1': 0.9805420699196404, 'epsilon': 4.541175195610638e-06, 'balanced_loss': False, 'epochs': 141, 'early_stopping_patience': 13, 'plateau_patience': 14, 'plateau_divider': 9}. Best is trial 2 with value: 0.9151515151515152.
CUDA out of memory. Tried to allocate 5.63 GiB. GPU 0 has a total capacity of 44.56 GiB of which 1.74 GiB is free. Including non-PyTorch memory, this process has 42.81 GiB memory in use. Of the allocated memory 39.31 GiB is allocated by PyTorch, and 2.36 GiB is reserved by PyTorch but unallocated. If reserved but unallocated memory is large try setting PYTORCH_CUDA_ALLOC_CONF=expandable_segments:True to avoid fragmentation.  See documentation for Memory Management  (https://pytorch.org/docs/stable/notes/cuda.html#environment-variables)
[I 2025-03-06 23:51:58,948] Trial 69 finished with value: -1.0 and parameters: {'left_stride': 256, 'right_stride': 32, 'attention_pooling_operation': 'min', 'embedding_pooling_operation': 'mean', 'threshold': 0.97466441182427, 'batch_size': 20, 'attention_heads': 15, 'hidden_dimension': 239, 'number_of_hidden_layers': 0, 'dropout_rate': 0.5761553107687118, 'global_pooling': 'mean', 'learning_rate': 4.508247488899369e-05, 'weight_decay': 3.0341943279835064e-06, 'beta_0': 0.8262425036247255, 'beta_1': 0.9816429766267435, 'epsilon': 8.074812142186497e-06, 'balanced_loss': True, 'epochs': 134, 'early_stopping_patience': 20, 'plateau_patience': 13, 'plateau_divider': 5}. Best is trial 2 with value: 0.9151515151515152.
[I 2025-03-07 00:07:47,295] Trial 70 finished with value: 0.8666666666666667 and parameters: {'left_stride': 32, 'right_stride': 128, 'attention_pooling_operation': 'mean', 'embedding_pooling_operation': 'mean', 'threshold': 0.9869359105016148, 'batch_size': 23, 'attention_heads': 4, 'hidden_dimension': 99, 'number_of_hidden_layers': 1, 'dropout_rate': 0.535503009446611, 'global_pooling': 'mean', 'learning_rate': 0.040770296098192195, 'weight_decay': 1.506584093496053e-05, 'beta_0': 0.8895829222838162, 'beta_1': 0.9844138064005531, 'epsilon': 1.14432134313806e-06, 'balanced_loss': True, 'epochs': 149, 'early_stopping_patience': 15, 'plateau_patience': 16, 'plateau_divider': 6}. Best is trial 2 with value: 0.9151515151515152.
[I 2025-03-07 00:28:43,973] Trial 71 finished with value: 0.9030303030303031 and parameters: {'left_stride': 32, 'right_stride': 64, 'attention_pooling_operation': 'mean', 'embedding_pooling_operation': 'max', 'threshold': 0.974781922600953, 'batch_size': 18, 'attention_heads': 12, 'hidden_dimension': 163, 'number_of_hidden_layers': 1, 'dropout_rate': 0.37350895780347193, 'global_pooling': 'mean', 'learning_rate': 0.00012747910112019997, 'weight_decay': 4.562907574503319e-06, 'beta_0': 0.8581288791046235, 'beta_1': 0.9806076304977711, 'epsilon': 8.90985201415942e-06, 'balanced_loss': False, 'epochs': 191, 'early_stopping_patience': 18, 'plateau_patience': 23, 'plateau_divider': 8}. Best is trial 2 with value: 0.9151515151515152.
CUDA out of memory. Tried to allocate 2.64 GiB. GPU 0 has a total capacity of 44.56 GiB of which 2.07 GiB is free. Including non-PyTorch memory, this process has 42.49 GiB memory in use. Of the allocated memory 38.44 GiB is allocated by PyTorch, and 2.90 GiB is reserved by PyTorch but unallocated. If reserved but unallocated memory is large try setting PYTORCH_CUDA_ALLOC_CONF=expandable_segments:True to avoid fragmentation.  See documentation for Memory Management  (https://pytorch.org/docs/stable/notes/cuda.html#environment-variables)
[I 2025-03-07 00:42:46,238] Trial 72 finished with value: -1.0 and parameters: {'left_stride': 32, 'right_stride': 64, 'attention_pooling_operation': 'mean', 'embedding_pooling_operation': 'max', 'threshold': 0.9671999067855064, 'batch_size': 18, 'attention_heads': 11, 'hidden_dimension': 148, 'number_of_hidden_layers': 1, 'dropout_rate': 0.35383203261754376, 'global_pooling': 'mean', 'learning_rate': 0.0002725151108013682, 'weight_decay': 5.4483439516818716e-06, 'beta_0': 0.8627359372183209, 'beta_1': 0.9813173518315295, 'epsilon': 4.310483221430816e-06, 'balanced_loss': False, 'epochs': 191, 'early_stopping_patience': 18, 'plateau_patience': 22, 'plateau_divider': 8}. Best is trial 2 with value: 0.9151515151515152.
[I 2025-03-07 01:03:18,951] Trial 73 finished with value: 0.9030303030303031 and parameters: {'left_stride': 32, 'right_stride': 64, 'attention_pooling_operation': 'mean', 'embedding_pooling_operation': 'max', 'threshold': 0.9808635138206602, 'batch_size': 21, 'attention_heads': 12, 'hidden_dimension': 155, 'number_of_hidden_layers': 1, 'dropout_rate': 0.4318240290666146, 'global_pooling': 'mean', 'learning_rate': 7.898523277448615e-05, 'weight_decay': 1.2376403441985473e-06, 'beta_0': 0.8490778433438232, 'beta_1': 0.9805502346115593, 'epsilon': 1.894133504852892e-06, 'balanced_loss': False, 'epochs': 188, 'early_stopping_patience': 19, 'plateau_patience': 20, 'plateau_divider': 10}. Best is trial 2 with value: 0.9151515151515152.
CUDA out of memory. Tried to allocate 3.46 GiB. GPU 0 has a total capacity of 44.56 GiB of which 2.35 GiB is free. Including non-PyTorch memory, this process has 42.20 GiB memory in use. Of the allocated memory 39.61 GiB is allocated by PyTorch, and 1.44 GiB is reserved by PyTorch but unallocated. If reserved but unallocated memory is large try setting PYTORCH_CUDA_ALLOC_CONF=expandable_segments:True to avoid fragmentation.  See documentation for Memory Management  (https://pytorch.org/docs/stable/notes/cuda.html#environment-variables)
[I 2025-03-07 01:17:15,208] Trial 74 finished with value: -1.0 and parameters: {'left_stride': 32, 'right_stride': 64, 'attention_pooling_operation': 'mean', 'embedding_pooling_operation': 'max', 'threshold': 0.9629839334471899, 'batch_size': 16, 'attention_heads': 13, 'hidden_dimension': 180, 'number_of_hidden_layers': 1, 'dropout_rate': 0.3156663455431916, 'global_pooling': 'mean', 'learning_rate': 0.0001458361613645652, 'weight_decay': 2.5369101750030412e-06, 'beta_0': 0.8597688578833004, 'beta_1': 0.9811664340762035, 'epsilon': 4.613592982063265e-06, 'balanced_loss': False, 'epochs': 179, 'early_stopping_patience': 17, 'plateau_patience': 21, 'plateau_divider': 9}. Best is trial 2 with value: 0.9151515151515152.
CUDA out of memory. Tried to allocate 6.93 GiB. GPU 0 has a total capacity of 44.56 GiB of which 5.09 GiB is free. Including non-PyTorch memory, this process has 39.46 GiB memory in use. Of the allocated memory 36.81 GiB is allocated by PyTorch, and 1.50 GiB is reserved by PyTorch but unallocated. If reserved but unallocated memory is large try setting PYTORCH_CUDA_ALLOC_CONF=expandable_segments:True to avoid fragmentation.  See documentation for Memory Management  (https://pytorch.org/docs/stable/notes/cuda.html#environment-variables)
[I 2025-03-07 01:26:36,637] Trial 75 finished with value: -1.0 and parameters: {'left_stride': 64, 'right_stride': 64, 'attention_pooling_operation': 'min', 'embedding_pooling_operation': 'max', 'threshold': 0.9540577836304198, 'batch_size': 27, 'attention_heads': 11, 'hidden_dimension': 195, 'number_of_hidden_layers': 1, 'dropout_rate': 0.3312055943992766, 'global_pooling': 'mean', 'learning_rate': 0.00019155198773326352, 'weight_decay': 6.932023372848798e-06, 'beta_0': 0.8707065066862179, 'beta_1': 0.9820406495302729, 'epsilon': 6.18600397604426e-05, 'balanced_loss': False, 'epochs': 119, 'early_stopping_patience': 19, 'plateau_patience': 15, 'plateau_divider': 8}. Best is trial 2 with value: 0.9151515151515152.
CUDA out of memory. Tried to allocate 3.37 GiB. GPU 0 has a total capacity of 44.56 GiB of which 2.66 GiB is free. Including non-PyTorch memory, this process has 41.89 GiB memory in use. Of the allocated memory 38.40 GiB is allocated by PyTorch, and 2.34 GiB is reserved by PyTorch but unallocated. If reserved but unallocated memory is large try setting PYTORCH_CUDA_ALLOC_CONF=expandable_segments:True to avoid fragmentation.  See documentation for Memory Management  (https://pytorch.org/docs/stable/notes/cuda.html#environment-variables)
[I 2025-03-07 01:41:26,057] Trial 76 finished with value: -1.0 and parameters: {'left_stride': 32, 'right_stride': 128, 'attention_pooling_operation': 'mean', 'embedding_pooling_operation': 'min', 'threshold': 0.9776071103973539, 'batch_size': 33, 'attention_heads': 10, 'hidden_dimension': 168, 'number_of_hidden_layers': 1, 'dropout_rate': 0.40966987227631096, 'global_pooling': 'mean', 'learning_rate': 0.00010497113630076285, 'weight_decay': 4.891834375649248e-06, 'beta_0': 0.8744708935547835, 'beta_1': 0.9801203711746163, 'epsilon': 3.471242146394793e-05, 'balanced_loss': False, 'epochs': 196, 'early_stopping_patience': 20, 'plateau_patience': 22, 'plateau_divider': 6}. Best is trial 2 with value: 0.9151515151515152.
[I 2025-03-07 01:53:07,225] Trial 77 finished with value: 0.8424242424242424 and parameters: {'left_stride': 64, 'right_stride': 32, 'attention_pooling_operation': 'min', 'embedding_pooling_operation': 'mean', 'threshold': 0.9841959503666626, 'batch_size': 19, 'attention_heads': 5, 'hidden_dimension': 124, 'number_of_hidden_layers': 1, 'dropout_rate': 0.390681694541952, 'global_pooling': 'max', 'learning_rate': 7.411907234563976e-05, 'weight_decay': 1.6650182588721819e-06, 'beta_0': 0.8534044181247196, 'beta_1': 0.982708792548475, 'epsilon': 1.2318500619956756e-05, 'balanced_loss': True, 'epochs': 171, 'early_stopping_patience': 22, 'plateau_patience': 19, 'plateau_divider': 7}. Best is trial 2 with value: 0.9151515151515152.
[I 2025-03-07 02:04:14,348] Trial 78 finished with value: 0.8121212121212121 and parameters: {'left_stride': 128, 'right_stride': 128, 'attention_pooling_operation': 'min', 'embedding_pooling_operation': 'max', 'threshold': 0.9997022061255588, 'batch_size': 17, 'attention_heads': 5, 'hidden_dimension': 78, 'number_of_hidden_layers': 0, 'dropout_rate': 0.30072860087506054, 'global_pooling': 'mean', 'learning_rate': 1.801126658454768e-05, 'weight_decay': 3.4682385203639523e-06, 'beta_0': 0.8453705959046574, 'beta_1': 0.9960538980801095, 'epsilon': 5.097121499799419e-06, 'balanced_loss': True, 'epochs': 180, 'early_stopping_patience': 17, 'plateau_patience': 16, 'plateau_divider': 9}. Best is trial 2 with value: 0.9151515151515152.
[I 2025-03-07 02:18:14,025] Trial 79 finished with value: 0.8484848484848485 and parameters: {'left_stride': 0, 'right_stride': 32, 'attention_pooling_operation': 'max', 'embedding_pooling_operation': 'mean', 'threshold': 0.9747816344926667, 'batch_size': 25, 'attention_heads': 4, 'hidden_dimension': 88, 'number_of_hidden_layers': 3, 'dropout_rate': 0.5563898352921617, 'global_pooling': 'sum', 'learning_rate': 5.1027205255099285e-05, 'weight_decay': 2.1835733793194104e-06, 'beta_0': 0.8824476745647305, 'beta_1': 0.9906145045776915, 'epsilon': 3.1289553317131965e-06, 'balanced_loss': False, 'epochs': 129, 'early_stopping_patience': 21, 'plateau_patience': 25, 'plateau_divider': 7}. Best is trial 2 with value: 0.9151515151515152.
CUDA out of memory. Tried to allocate 3.99 GiB. GPU 0 has a total capacity of 44.56 GiB of which 1.75 GiB is free. Including non-PyTorch memory, this process has 42.80 GiB memory in use. Of the allocated memory 39.20 GiB is allocated by PyTorch, and 2.45 GiB is reserved by PyTorch but unallocated. If reserved but unallocated memory is large try setting PYTORCH_CUDA_ALLOC_CONF=expandable_segments:True to avoid fragmentation.  See documentation for Memory Management  (https://pytorch.org/docs/stable/notes/cuda.html#environment-variables)
[I 2025-03-07 02:27:51,595] Trial 80 finished with value: -1.0 and parameters: {'left_stride': 32, 'right_stride': 128, 'attention_pooling_operation': 'min', 'embedding_pooling_operation': 'min', 'threshold': 0.9153429523699437, 'batch_size': 30, 'attention_heads': 9, 'hidden_dimension': 65, 'number_of_hidden_layers': 1, 'dropout_rate': 0.49291046847852493, 'global_pooling': 'mean', 'learning_rate': 0.0017594249366003863, 'weight_decay': 6.293091234629948e-06, 'beta_0': 0.8401128297469704, 'beta_1': 0.9834889843145141, 'epsilon': 8.606628609359604e-07, 'balanced_loss': True, 'epochs': 126, 'early_stopping_patience': 16, 'plateau_patience': 14, 'plateau_divider': 6}. Best is trial 2 with value: 0.9151515151515152.
CUDA out of memory. Tried to allocate 2.81 GiB. GPU 0 has a total capacity of 44.56 GiB of which 2.45 GiB is free. Including non-PyTorch memory, this process has 42.10 GiB memory in use. Of the allocated memory 37.64 GiB is allocated by PyTorch, and 3.31 GiB is reserved by PyTorch but unallocated. If reserved but unallocated memory is large try setting PYTORCH_CUDA_ALLOC_CONF=expandable_segments:True to avoid fragmentation.  See documentation for Memory Management  (https://pytorch.org/docs/stable/notes/cuda.html#environment-variables)
[I 2025-03-07 02:42:15,160] Trial 81 finished with value: -1.0 and parameters: {'left_stride': 32, 'right_stride': 64, 'attention_pooling_operation': 'mean', 'embedding_pooling_operation': 'max', 'threshold': 0.9737546727913252, 'batch_size': 19, 'attention_heads': 12, 'hidden_dimension': 161, 'number_of_hidden_layers': 1, 'dropout_rate': 0.37503681491216395, 'global_pooling': 'mean', 'learning_rate': 0.00012992005819945687, 'weight_decay': 4.591403110474348e-06, 'beta_0': 0.8603001113391311, 'beta_1': 0.9807156848497414, 'epsilon': 8.32617702264378e-06, 'balanced_loss': False, 'epochs': 192, 'early_stopping_patience': 18, 'plateau_patience': 23, 'plateau_divider': 8}. Best is trial 2 with value: 0.9151515151515152.
CUDA out of memory. Tried to allocate 2.85 GiB. GPU 0 has a total capacity of 44.56 GiB of which 480.69 MiB is free. Including non-PyTorch memory, this process has 44.08 GiB memory in use. Of the allocated memory 38.58 GiB is allocated by PyTorch, and 4.36 GiB is reserved by PyTorch but unallocated. If reserved but unallocated memory is large try setting PYTORCH_CUDA_ALLOC_CONF=expandable_segments:True to avoid fragmentation.  See documentation for Memory Management  (https://pytorch.org/docs/stable/notes/cuda.html#environment-variables)
[I 2025-03-07 02:56:15,651] Trial 82 finished with value: -1.0 and parameters: {'left_stride': 32, 'right_stride': 64, 'attention_pooling_operation': 'mean', 'embedding_pooling_operation': 'max', 'threshold': 0.9717523502232858, 'batch_size': 18, 'attention_heads': 12, 'hidden_dimension': 176, 'number_of_hidden_layers': 1, 'dropout_rate': 0.38455245098392865, 'global_pooling': 'mean', 'learning_rate': 0.00014523002688837918, 'weight_decay': 4.2157230582701685e-06, 'beta_0': 0.8568125492754136, 'beta_1': 0.9800014409419516, 'epsilon': 1.4712268383307061e-05, 'balanced_loss': False, 'epochs': 200, 'early_stopping_patience': 18, 'plateau_patience': 24, 'plateau_divider': 8}. Best is trial 2 with value: 0.9151515151515152.
[I 2025-03-07 03:15:49,587] Trial 83 finished with value: 0.8909090909090909 and parameters: {'left_stride': 32, 'right_stride': 64, 'attention_pooling_operation': 'mean', 'embedding_pooling_operation': 'max', 'threshold': 0.9793652028359352, 'batch_size': 21, 'attention_heads': 13, 'hidden_dimension': 159, 'number_of_hidden_layers': 1, 'dropout_rate': 0.34271261109579, 'global_pooling': 'mean', 'learning_rate': 0.00030122880427184927, 'weight_decay': 9.37376699531725e-06, 'beta_0': 0.8465083294593803, 'beta_1': 0.9809016445054018, 'epsilon': 6.578753256436039e-06, 'balanced_loss': False, 'epochs': 189, 'early_stopping_patience': 19, 'plateau_patience': 23, 'plateau_divider': 8}. Best is trial 2 with value: 0.9151515151515152.
[I 2025-03-07 03:39:54,218] Trial 84 finished with value: 0.896969696969697 and parameters: {'left_stride': 32, 'right_stride': 64, 'attention_pooling_operation': 'mean', 'embedding_pooling_operation': 'max', 'threshold': 0.976239141502962, 'batch_size': 23, 'attention_heads': 11, 'hidden_dimension': 137, 'number_of_hidden_layers': 1, 'dropout_rate': 0.44530193594860723, 'global_pooling': 'mean', 'learning_rate': 3.35832243675381e-05, 'weight_decay': 5.0709368063245e-06, 'beta_0': 0.8666377737679943, 'beta_1': 0.9805127501048305, 'epsilon': 9.594038749629045e-06, 'balanced_loss': False, 'epochs': 183, 'early_stopping_patience': 18, 'plateau_patience': 24, 'plateau_divider': 5}. Best is trial 2 with value: 0.9151515151515152.
CUDA out of memory. Tried to allocate 2.77 GiB. GPU 0 has a total capacity of 44.56 GiB of which 2.60 GiB is free. Including non-PyTorch memory, this process has 41.95 GiB memory in use. Of the allocated memory 39.23 GiB is allocated by PyTorch, and 1.57 GiB is reserved by PyTorch but unallocated. If reserved but unallocated memory is large try setting PYTORCH_CUDA_ALLOC_CONF=expandable_segments:True to avoid fragmentation.  See documentation for Memory Management  (https://pytorch.org/docs/stable/notes/cuda.html#environment-variables)
