[I 2025-03-08 05:50:50,286] Trial 188 finished with value: 0.9030303030303031 and parameters: {'left_stride': 32, 'right_stride': 64, 'attention_pooling_operation': 'mean', 'embedding_pooling_operation': 'max', 'threshold': 0.9604503962100095, 'batch_size': 21, 'attention_heads': 4, 'hidden_dimension': 125, 'number_of_hidden_layers': 0, 'dropout_rate': 0.5921795316914386, 'global_pooling': 'mean', 'learning_rate': 0.0004332464771278596, 'weight_decay': 1.6776472778889686e-06, 'beta_0': 0.8588365019604559, 'beta_1': 0.9820706016814031, 'epsilon': 6.432120049618668e-07, 'balanced_loss': True, 'epochs': 176, 'early_stopping_patience': 15, 'plateau_patience': 17, 'plateau_divider': 8}. Best is trial 151 with value: 0.9212121212121213.
[I 2025-03-08 06:05:47,471] Trial 189 finished with value: 0.9030303030303031 and parameters: {'left_stride': 32, 'right_stride': 64, 'attention_pooling_operation': 'mean', 'embedding_pooling_operation': 'max', 'threshold': 0.9629446960167402, 'batch_size': 19, 'attention_heads': 4, 'hidden_dimension': 99, 'number_of_hidden_layers': 0, 'dropout_rate': 0.5840225752305929, 'global_pooling': 'mean', 'learning_rate': 0.0006644451860463996, 'weight_decay': 1.2772145591511524e-06, 'beta_0': 0.855471870766926, 'beta_1': 0.985171316536836, 'epsilon': 1.4828157246381117e-07, 'balanced_loss': True, 'epochs': 168, 'early_stopping_patience': 17, 'plateau_patience': 18, 'plateau_divider': 8}. Best is trial 151 with value: 0.9212121212121213.
[I 2025-03-08 06:20:48,696] Trial 190 finished with value: 0.896969696969697 and parameters: {'left_stride': 32, 'right_stride': 64, 'attention_pooling_operation': 'mean', 'embedding_pooling_operation': 'max', 'threshold': 0.9670927860132966, 'batch_size': 16, 'attention_heads': 4, 'hidden_dimension': 117, 'number_of_hidden_layers': 0, 'dropout_rate': 0.5940662015466865, 'global_pooling': 'mean', 'learning_rate': 0.0008268322991711588, 'weight_decay': 2.2006707397182867e-06, 'beta_0': 0.8688682181540223, 'beta_1': 0.984677901941655, 'epsilon': 8.415474900288686e-08, 'balanced_loss': True, 'epochs': 180, 'early_stopping_patience': 16, 'plateau_patience': 17, 'plateau_divider': 8}. Best is trial 151 with value: 0.9212121212121213.
[I 2025-03-08 06:36:20,476] Trial 191 finished with value: 0.9030303030303031 and parameters: {'left_stride': 32, 'right_stride': 64, 'attention_pooling_operation': 'mean', 'embedding_pooling_operation': 'max', 'threshold': 0.9643112459593111, 'batch_size': 19, 'attention_heads': 4, 'hidden_dimension': 113, 'number_of_hidden_layers': 0, 'dropout_rate': 0.5793465314145189, 'global_pooling': 'mean', 'learning_rate': 0.00047648744499490886, 'weight_decay': 1.1729850297838884e-06, 'beta_0': 0.8579088892856824, 'beta_1': 0.9838910315993337, 'epsilon': 2.755045686152053e-07, 'balanced_loss': True, 'epochs': 174, 'early_stopping_patience': 17, 'plateau_patience': 17, 'plateau_divider': 8}. Best is trial 151 with value: 0.9212121212121213.
[I 2025-03-08 06:51:20,903] Trial 192 finished with value: 0.9030303030303031 and parameters: {'left_stride': 32, 'right_stride': 64, 'attention_pooling_operation': 'mean', 'embedding_pooling_operation': 'max', 'threshold': 0.96501365447195, 'batch_size': 20, 'attention_heads': 4, 'hidden_dimension': 105, 'number_of_hidden_layers': 0, 'dropout_rate': 0.5810443025925776, 'global_pooling': 'mean', 'learning_rate': 0.0005381203147894326, 'weight_decay': 1.0031117950837899e-06, 'beta_0': 0.8602452767288928, 'beta_1': 0.9839430432468397, 'epsilon': 2.980936981523612e-07, 'balanced_loss': True, 'epochs': 186, 'early_stopping_patience': 17, 'plateau_patience': 17, 'plateau_divider': 8}. Best is trial 151 with value: 0.9212121212121213.
[I 2025-03-08 07:06:33,453] Trial 193 finished with value: 0.9151515151515152 and parameters: {'left_stride': 32, 'right_stride': 64, 'attention_pooling_operation': 'mean', 'embedding_pooling_operation': 'max', 'threshold': 0.9685065166225166, 'batch_size': 17, 'attention_heads': 4, 'hidden_dimension': 114, 'number_of_hidden_layers': 0, 'dropout_rate': 0.588431249186673, 'global_pooling': 'mean', 'learning_rate': 0.00039386541989205507, 'weight_decay': 1.566612383378671e-06, 'beta_0': 0.8634598327185254, 'beta_1': 0.9832132015312901, 'epsilon': 5.246378259174232e-07, 'balanced_loss': True, 'epochs': 173, 'early_stopping_patience': 24, 'plateau_patience': 16, 'plateau_divider': 8}. Best is trial 151 with value: 0.9212121212121213.
[I 2025-03-08 07:22:03,634] Trial 194 finished with value: 0.9030303030303031 and parameters: {'left_stride': 32, 'right_stride': 64, 'attention_pooling_operation': 'mean', 'embedding_pooling_operation': 'max', 'threshold': 0.9714383766175013, 'batch_size': 18, 'attention_heads': 4, 'hidden_dimension': 120, 'number_of_hidden_layers': 0, 'dropout_rate': 0.5999311685530233, 'global_pooling': 'mean', 'learning_rate': 0.0003840478054103795, 'weight_decay': 1.512476338262507e-06, 'beta_0': 0.8661165176220444, 'beta_1': 0.9830404810588669, 'epsilon': 5.771520167728052e-07, 'balanced_loss': True, 'epochs': 170, 'early_stopping_patience': 24, 'plateau_patience': 16, 'plateau_divider': 8}. Best is trial 151 with value: 0.9212121212121213.
[I 2025-03-08 07:37:33,539] Trial 195 finished with value: 0.8909090909090909 and parameters: {'left_stride': 32, 'right_stride': 64, 'attention_pooling_operation': 'mean', 'embedding_pooling_operation': 'max', 'threshold': 0.9687736164622295, 'batch_size': 16, 'attention_heads': 4, 'hidden_dimension': 109, 'number_of_hidden_layers': 0, 'dropout_rate': 0.5898947329638171, 'global_pooling': 'mean', 'learning_rate': 0.0003038542625387195, 'weight_decay': 1.8778497072323787e-06, 'beta_0': 0.8631993608308295, 'beta_1': 0.9834208642801026, 'epsilon': 4.953927027046244e-07, 'balanced_loss': True, 'epochs': 177, 'early_stopping_patience': 23, 'plateau_patience': 16, 'plateau_divider': 8}. Best is trial 151 with value: 0.9212121212121213.
[I 2025-03-08 07:52:04,801] Trial 196 finished with value: 0.8909090909090909 and parameters: {'left_stride': 32, 'right_stride': 64, 'attention_pooling_operation': 'mean', 'embedding_pooling_operation': 'max', 'threshold': 0.9736282458344849, 'batch_size': 17, 'attention_heads': 4, 'hidden_dimension': 104, 'number_of_hidden_layers': 0, 'dropout_rate': 0.5856947366148721, 'global_pooling': 'mean', 'learning_rate': 0.0012023581383902714, 'weight_decay': 1.4021329397872062e-06, 'beta_0': 0.8644440969734273, 'beta_1': 0.9822450124171728, 'epsilon': 7.599930017732404e-07, 'balanced_loss': True, 'epochs': 182, 'early_stopping_patience': 15, 'plateau_patience': 16, 'plateau_divider': 9}. Best is trial 151 with value: 0.9212121212121213.
[I 2025-03-08 08:07:07,858] Trial 197 finished with value: 0.9212121212121213 and parameters: {'left_stride': 0, 'right_stride': 64, 'attention_pooling_operation': 'mean', 'embedding_pooling_operation': 'max', 'threshold': 0.9583190608514589, 'batch_size': 20, 'attention_heads': 4, 'hidden_dimension': 132, 'number_of_hidden_layers': 0, 'dropout_rate': 0.5692234851964799, 'global_pooling': 'mean', 'learning_rate': 0.0006590238000106959, 'weight_decay': 1.6868943249820473e-06, 'beta_0': 0.8614224832903384, 'beta_1': 0.9826085389856404, 'epsilon': 4.2052583162363096e-07, 'balanced_loss': True, 'epochs': 179, 'early_stopping_patience': 18, 'plateau_patience': 17, 'plateau_divider': 8}. Best is trial 151 with value: 0.9212121212121213.
[I 2025-03-08 08:23:02,868] Trial 198 finished with value: 0.896969696969697 and parameters: {'left_stride': 32, 'right_stride': 64, 'attention_pooling_operation': 'mean', 'embedding_pooling_operation': 'max', 'threshold': 0.9571697034352128, 'batch_size': 22, 'attention_heads': 5, 'hidden_dimension': 127, 'number_of_hidden_layers': 0, 'dropout_rate': 0.5708907711360564, 'global_pooling': 'mean', 'learning_rate': 0.0007236431729375916, 'weight_decay': 1.7571644298158563e-06, 'beta_0': 0.86122080221732, 'beta_1': 0.9827826477141095, 'epsilon': 3.8660500663154775e-07, 'balanced_loss': True, 'epochs': 172, 'early_stopping_patience': 24, 'plateau_patience': 18, 'plateau_divider': 8}. Best is trial 151 with value: 0.9212121212121213.
[I 2025-03-08 08:37:54,621] Trial 199 finished with value: 0.896969696969697 and parameters: {'left_stride': 0, 'right_stride': 64, 'attention_pooling_operation': 'mean', 'embedding_pooling_operation': 'max', 'threshold': 0.9707334533451077, 'batch_size': 18, 'attention_heads': 5, 'hidden_dimension': 133, 'number_of_hidden_layers': 0, 'dropout_rate': 0.5935689053067447, 'global_pooling': 'mean', 'learning_rate': 0.0009660880620204433, 'weight_decay': 1.5582622791911076e-06, 'beta_0': 0.8602172147091578, 'beta_1': 0.9987008281551032, 'epsilon': 4.933028730616561e-07, 'balanced_loss': True, 'epochs': 185, 'early_stopping_patience': 25, 'plateau_patience': 18, 'plateau_divider': 3}. Best is trial 151 with value: 0.9212121212121213.
[I 2025-03-08 08:52:25,016] Trial 200 finished with value: 0.8909090909090909 and parameters: {'left_stride': 0, 'right_stride': 64, 'attention_pooling_operation': 'mean', 'embedding_pooling_operation': 'max', 'threshold': 0.9667825870205055, 'batch_size': 21, 'attention_heads': 4, 'hidden_dimension': 115, 'number_of_hidden_layers': 0, 'dropout_rate': 0.5864876098978373, 'global_pooling': 'mean', 'learning_rate': 0.0004061583924445325, 'weight_decay': 2.2321949452877106e-06, 'beta_0': 0.8561005500853065, 'beta_1': 0.9818439876305345, 'epsilon': 3.915774966719609e-07, 'balanced_loss': True, 'epochs': 177, 'early_stopping_patience': 18, 'plateau_patience': 16, 'plateau_divider': 8}. Best is trial 151 with value: 0.9212121212121213.
[I 2025-03-08 09:06:56,172] Trial 201 finished with value: 0.9030303030303031 and parameters: {'left_stride': 0, 'right_stride': 64, 'attention_pooling_operation': 'mean', 'embedding_pooling_operation': 'max', 'threshold': 0.9620421954074379, 'batch_size': 20, 'attention_heads': 4, 'hidden_dimension': 121, 'number_of_hidden_layers': 0, 'dropout_rate': 0.5649691014893929, 'global_pooling': 'mean', 'learning_rate': 0.0006045760795318915, 'weight_decay': 1.302598425780385e-06, 'beta_0': 0.8627487070780163, 'beta_1': 0.9831942651758616, 'epsilon': 3.488859400358955e-07, 'balanced_loss': True, 'epochs': 180, 'early_stopping_patience': 18, 'plateau_patience': 17, 'plateau_divider': 8}. Best is trial 151 with value: 0.9212121212121213.
[I 2025-03-08 09:21:36,885] Trial 202 finished with value: 0.9030303030303031 and parameters: {'left_stride': 0, 'right_stride': 64, 'attention_pooling_operation': 'mean', 'embedding_pooling_operation': 'max', 'threshold': 0.9596823321543941, 'batch_size': 19, 'attention_heads': 4, 'hidden_dimension': 111, 'number_of_hidden_layers': 0, 'dropout_rate': 0.5824208458032852, 'global_pooling': 'mean', 'learning_rate': 0.0005435253716831686, 'weight_decay': 1.7249951707922492e-06, 'beta_0': 0.8654569288003748, 'beta_1': 0.9824308337544655, 'epsilon': 2.4308165023922405e-07, 'balanced_loss': True, 'epochs': 173, 'early_stopping_patience': 18, 'plateau_patience': 17, 'plateau_divider': 8}. Best is trial 151 with value: 0.9212121212121213.
slurmstepd: error: *** JOB 15106635 ON gpu043 CANCELLED AT 2025-03-08T09:30:52 DUE TO TIME LIMIT ***
