[I 2025-03-03 16:18:12,831] Trial 294 finished with value: 0.8787878787878788 and parameters: {'left_stride': 128, 'right_stride': 0, 'attention_pooling_operation': 'mean', 'embedding_pooling_operation': 'mean', 'threshold': 0.985997331727431, 'batch_size': 28, 'attention_heads': 4, 'hidden_dimension': 78, 'number_of_hidden_layers': 2, 'dropout_rate': 0.42111686504578316, 'global_pooling': 'sum', 'learning_rate': 0.0015492622153180685, 'weight_decay': 2.438543223226317e-06, 'beta_0': 0.8766213062500625, 'beta_1': 0.9851767838001582, 'epsilon': 1.6612112732407615e-07, 'balanced_loss': False, 'epochs': 147, 'early_stopping_patience': 24, 'plateau_patience': 11, 'plateau_divider': 3}. Best is trial 195 with value: 0.9030303030303031.
[I 2025-03-03 16:37:12,114] Trial 295 finished with value: 0.8787878787878788 and parameters: {'left_stride': 128, 'right_stride': 32, 'attention_pooling_operation': 'mean', 'embedding_pooling_operation': 'mean', 'threshold': 0.99099767464091, 'batch_size': 22, 'attention_heads': 5, 'hidden_dimension': 187, 'number_of_hidden_layers': 3, 'dropout_rate': 0.4481128603609785, 'global_pooling': 'sum', 'learning_rate': 0.0005052209142921175, 'weight_decay': 0.0009070392568424235, 'beta_0': 0.8749570763017658, 'beta_1': 0.9883940118019834, 'epsilon': 3.5987084648717127e-07, 'balanced_loss': True, 'epochs': 194, 'early_stopping_patience': 24, 'plateau_patience': 23, 'plateau_divider': 3}. Best is trial 195 with value: 0.9030303030303031.
[I 2025-03-03 16:54:26,130] Trial 296 finished with value: 0.8666666666666667 and parameters: {'left_stride': 128, 'right_stride': 32, 'attention_pooling_operation': 'mean', 'embedding_pooling_operation': 'min', 'threshold': 0.9943847665320532, 'batch_size': 25, 'attention_heads': 10, 'hidden_dimension': 98, 'number_of_hidden_layers': 2, 'dropout_rate': 0.43629107318500765, 'global_pooling': 'sum', 'learning_rate': 0.0009204430887871547, 'weight_decay': 0.0005882744271365338, 'beta_0': 0.8659329179284203, 'beta_1': 0.981731067088074, 'epsilon': 1.282985518128102e-07, 'balanced_loss': True, 'epochs': 155, 'early_stopping_patience': 24, 'plateau_patience': 21, 'plateau_divider': 3}. Best is trial 195 with value: 0.9030303030303031.
[I 2025-03-03 17:06:38,160] Trial 297 finished with value: 0.8727272727272727 and parameters: {'left_stride': 128, 'right_stride': 32, 'attention_pooling_operation': 'max', 'embedding_pooling_operation': 'mean', 'threshold': 0.9970901155808531, 'batch_size': 27, 'attention_heads': 5, 'hidden_dimension': 169, 'number_of_hidden_layers': 2, 'dropout_rate': 0.45453868677093856, 'global_pooling': 'sum', 'learning_rate': 0.0006484829279080774, 'weight_decay': 2.7257433710357002e-06, 'beta_0': 0.8711881151408793, 'beta_1': 0.9810572712276356, 'epsilon': 2.5571938115567683e-06, 'balanced_loss': False, 'epochs': 158, 'early_stopping_patience': 25, 'plateau_patience': 20, 'plateau_divider': 3}. Best is trial 195 with value: 0.9030303030303031.
slurmstepd: error: *** JOB 15071871 ON gpu033 CANCELLED AT 2025-03-03T17:11:59 DUE TO TIME LIMIT ***
