[I 2025-03-07 22:33:56,178] Trial 159 finished with value: 0.9151515151515152 and parameters: {'left_stride': 32, 'right_stride': 64, 'attention_pooling_operation': 'mean', 'embedding_pooling_operation': 'max', 'threshold': 0.964440717091293, 'batch_size': 20, 'attention_heads': 4, 'hidden_dimension': 112, 'number_of_hidden_layers': 0, 'dropout_rate': 0.5891697393435973, 'global_pooling': 'mean', 'learning_rate': 0.0005547085041351726, 'weight_decay': 1.6597756434346035e-06, 'beta_0': 0.861033948369015, 'beta_1': 0.983388860562873, 'epsilon': 2.792632441305409e-07, 'balanced_loss': True, 'epochs': 172, 'early_stopping_patience': 16, 'plateau_patience': 17, 'plateau_divider': 8}. Best is trial 151 with value: 0.9212121212121213.
[I 2025-03-07 22:48:57,125] Trial 160 finished with value: 0.896969696969697 and parameters: {'left_stride': 32, 'right_stride': 64, 'attention_pooling_operation': 'mean', 'embedding_pooling_operation': 'max', 'threshold': 0.9652219661035294, 'batch_size': 20, 'attention_heads': 4, 'hidden_dimension': 111, 'number_of_hidden_layers': 0, 'dropout_rate': 0.5902987391927483, 'global_pooling': 'mean', 'learning_rate': 0.0007749082723688591, 'weight_decay': 1.6268352374551477e-06, 'beta_0': 0.863631532763194, 'beta_1': 0.9833111175391563, 'epsilon': 2.2633088784042752e-07, 'balanced_loss': True, 'epochs': 169, 'early_stopping_patience': 16, 'plateau_patience': 17, 'plateau_divider': 8}. Best is trial 151 with value: 0.9212121212121213.
[I 2025-03-07 23:04:09,310] Trial 161 finished with value: 0.896969696969697 and parameters: {'left_stride': 32, 'right_stride': 64, 'attention_pooling_operation': 'mean', 'embedding_pooling_operation': 'max', 'threshold': 0.9631268808248011, 'batch_size': 19, 'attention_heads': 4, 'hidden_dimension': 117, 'number_of_hidden_layers': 0, 'dropout_rate': 0.594484762037117, 'global_pooling': 'mean', 'learning_rate': 0.000504603402929672, 'weight_decay': 1.5548832850602981e-06, 'beta_0': 0.8612494317898494, 'beta_1': 0.9828500944185539, 'epsilon': 4.3048565567468917e-07, 'balanced_loss': True, 'epochs': 172, 'early_stopping_patience': 16, 'plateau_patience': 17, 'plateau_divider': 8}. Best is trial 151 with value: 0.9212121212121213.
[I 2025-03-07 23:19:16,484] Trial 162 finished with value: 0.9030303030303031 and parameters: {'left_stride': 32, 'right_stride': 64, 'attention_pooling_operation': 'mean', 'embedding_pooling_operation': 'max', 'threshold': 0.9614733742158562, 'batch_size': 20, 'attention_heads': 4, 'hidden_dimension': 114, 'number_of_hidden_layers': 0, 'dropout_rate': 0.583645859365662, 'global_pooling': 'mean', 'learning_rate': 0.0006274917591865749, 'weight_decay': 1.992264973694356e-06, 'beta_0': 0.8607880578955387, 'beta_1': 0.9825859230308879, 'epsilon': 3.3942124256844456e-07, 'balanced_loss': True, 'epochs': 166, 'early_stopping_patience': 16, 'plateau_patience': 17, 'plateau_divider': 8}. Best is trial 151 with value: 0.9212121212121213.
[I 2025-03-07 23:34:41,289] Trial 163 finished with value: 0.9151515151515152 and parameters: {'left_stride': 32, 'right_stride': 64, 'attention_pooling_operation': 'mean', 'embedding_pooling_operation': 'max', 'threshold': 0.9642004617198964, 'batch_size': 22, 'attention_heads': 4, 'hidden_dimension': 118, 'number_of_hidden_layers': 0, 'dropout_rate': 0.5863359047418929, 'global_pooling': 'mean', 'learning_rate': 0.0004683989682456082, 'weight_decay': 1.425092644397202e-06, 'beta_0': 0.8639641777905285, 'beta_1': 0.9837232266501246, 'epsilon': 1.433063412614959e-07, 'balanced_loss': True, 'epochs': 174, 'early_stopping_patience': 16, 'plateau_patience': 17, 'plateau_divider': 8}. Best is trial 151 with value: 0.9212121212121213.
[I 2025-03-07 23:50:07,619] Trial 164 finished with value: 0.9030303030303031 and parameters: {'left_stride': 32, 'right_stride': 64, 'attention_pooling_operation': 'mean', 'embedding_pooling_operation': 'max', 'threshold': 0.9649527817951828, 'batch_size': 22, 'attention_heads': 4, 'hidden_dimension': 119, 'number_of_hidden_layers': 0, 'dropout_rate': 0.5879059661396773, 'global_pooling': 'mean', 'learning_rate': 0.00045561624104242446, 'weight_decay': 1.4422931736067238e-06, 'beta_0': 0.8637003890885327, 'beta_1': 0.9837868898416766, 'epsilon': 1.453738126981997e-07, 'balanced_loss': True, 'epochs': 176, 'early_stopping_patience': 17, 'plateau_patience': 18, 'plateau_divider': 8}. Best is trial 151 with value: 0.9212121212121213.
[I 2025-03-08 00:05:07,671] Trial 165 finished with value: 0.8909090909090909 and parameters: {'left_stride': 32, 'right_stride': 64, 'attention_pooling_operation': 'mean', 'embedding_pooling_operation': 'max', 'threshold': 0.9590220175265108, 'batch_size': 20, 'attention_heads': 4, 'hidden_dimension': 109, 'number_of_hidden_layers': 0, 'dropout_rate': 0.5746650446021527, 'global_pooling': 'mean', 'learning_rate': 0.0008465341798501976, 'weight_decay': 1.7419721645520948e-06, 'beta_0': 0.8596729709043487, 'beta_1': 0.9843431635132058, 'epsilon': 5.763149221601679e-07, 'balanced_loss': True, 'epochs': 172, 'early_stopping_patience': 15, 'plateau_patience': 17, 'plateau_divider': 8}. Best is trial 151 with value: 0.9212121212121213.
[I 2025-03-08 00:19:55,361] Trial 166 finished with value: 0.8909090909090909 and parameters: {'left_stride': 32, 'right_stride': 64, 'attention_pooling_operation': 'mean', 'embedding_pooling_operation': 'max', 'threshold': 0.9682771052667538, 'batch_size': 19, 'attention_heads': 4, 'hidden_dimension': 116, 'number_of_hidden_layers': 0, 'dropout_rate': 0.5958405737242408, 'global_pooling': 'mean', 'learning_rate': 0.0010714611907612923, 'weight_decay': 1.4335362316021614e-06, 'beta_0': 0.8669590918284142, 'beta_1': 0.9835471210580854, 'epsilon': 2.4000027983955056e-07, 'balanced_loss': True, 'epochs': 165, 'early_stopping_patience': 16, 'plateau_patience': 17, 'plateau_divider': 8}. Best is trial 151 with value: 0.9212121212121213.
[I 2025-03-08 00:35:00,108] Trial 167 finished with value: 0.8909090909090909 and parameters: {'left_stride': 32, 'right_stride': 64, 'attention_pooling_operation': 'mean', 'embedding_pooling_operation': 'max', 'threshold': 0.9637718786784313, 'batch_size': 21, 'attention_heads': 4, 'hidden_dimension': 128, 'number_of_hidden_layers': 0, 'dropout_rate': 0.5870022368515122, 'global_pooling': 'mean', 'learning_rate': 0.0004910511894114117, 'weight_decay': 2.157580437792883e-06, 'beta_0': 0.8618420889247084, 'beta_1': 0.9830603083741554, 'epsilon': 4.1062514789068346e-07, 'balanced_loss': True, 'epochs': 180, 'early_stopping_patience': 17, 'plateau_patience': 18, 'plateau_divider': 8}. Best is trial 151 with value: 0.9212121212121213.
[I 2025-03-08 00:50:01,982] Trial 168 finished with value: 0.8909090909090909 and parameters: {'left_stride': 32, 'right_stride': 64, 'attention_pooling_operation': 'mean', 'embedding_pooling_operation': 'max', 'threshold': 0.9664295603270935, 'batch_size': 22, 'attention_heads': 4, 'hidden_dimension': 122, 'number_of_hidden_layers': 0, 'dropout_rate': 0.5814558091475361, 'global_pooling': 'max', 'learning_rate': 0.0005674417734512861, 'weight_decay': 1.7400099786413334e-06, 'beta_0': 0.8587230279099785, 'beta_1': 0.9824490096338969, 'epsilon': 1.872576098397345e-07, 'balanced_loss': True, 'epochs': 174, 'early_stopping_patience': 15, 'plateau_patience': 17, 'plateau_divider': 8}. Best is trial 151 with value: 0.9212121212121213.
[I 2025-03-08 01:05:02,876] Trial 169 finished with value: 0.9090909090909091 and parameters: {'left_stride': 32, 'right_stride': 64, 'attention_pooling_operation': 'mean', 'embedding_pooling_operation': 'max', 'threshold': 0.9709103453080035, 'batch_size': 17, 'attention_heads': 4, 'hidden_dimension': 112, 'number_of_hidden_layers': 0, 'dropout_rate': 0.5897853077898515, 'global_pooling': 'mean', 'learning_rate': 0.0006909529251526087, 'weight_decay': 1.5177692263398432e-06, 'beta_0': 0.8649888516484597, 'beta_1': 0.9830237250846354, 'epsilon': 2.8990933090756837e-07, 'balanced_loss': True, 'epochs': 178, 'early_stopping_patience': 16, 'plateau_patience': 17, 'plateau_divider': 8}. Best is trial 151 with value: 0.9212121212121213.
[I 2025-03-08 01:20:02,891] Trial 170 finished with value: 0.896969696969697 and parameters: {'left_stride': 32, 'right_stride': 64, 'attention_pooling_operation': 'mean', 'embedding_pooling_operation': 'max', 'threshold': 0.9702941485438462, 'batch_size': 17, 'attention_heads': 4, 'hidden_dimension': 103, 'number_of_hidden_layers': 0, 'dropout_rate': 0.591352297705141, 'global_pooling': 'mean', 'learning_rate': 0.0006826781482606682, 'weight_decay': 1.178454849022365e-06, 'beta_0': 0.8653608820659506, 'beta_1': 0.9827923942922813, 'epsilon': 3.308021467192529e-07, 'balanced_loss': True, 'epochs': 170, 'early_stopping_patience': 16, 'plateau_patience': 17, 'plateau_divider': 8}. Best is trial 151 with value: 0.9212121212121213.
[I 2025-03-08 01:34:45,000] Trial 171 finished with value: 0.8909090909090909 and parameters: {'left_stride': 32, 'right_stride': 64, 'attention_pooling_operation': 'mean', 'embedding_pooling_operation': 'max', 'threshold': 0.9719352059198243, 'batch_size': 19, 'attention_heads': 4, 'hidden_dimension': 111, 'number_of_hidden_layers': 0, 'dropout_rate': 0.5952691684169796, 'global_pooling': 'mean', 'learning_rate': 0.0009088271176924216, 'weight_decay': 1.5527565359079805e-06, 'beta_0': 0.8628150422151531, 'beta_1': 0.9830370938592246, 'epsilon': 4.937780785111205e-07, 'balanced_loss': True, 'epochs': 178, 'early_stopping_patience': 17, 'plateau_patience': 16, 'plateau_divider': 8}. Best is trial 151 with value: 0.9212121212121213.
[I 2025-03-08 01:49:41,095] Trial 172 finished with value: 0.9030303030303031 and parameters: {'left_stride': 32, 'right_stride': 64, 'attention_pooling_operation': 'mean', 'embedding_pooling_operation': 'max', 'threshold': 0.9686957264609681, 'batch_size': 20, 'attention_heads': 4, 'hidden_dimension': 113, 'number_of_hidden_layers': 0, 'dropout_rate': 0.5849150513911601, 'global_pooling': 'mean', 'learning_rate': 0.0007557322162185602, 'weight_decay': 1.913516053252406e-06, 'beta_0': 0.8566562908683932, 'beta_1': 0.9819369336849341, 'epsilon': 1.9030872129992908e-07, 'balanced_loss': True, 'epochs': 175, 'early_stopping_patience': 16, 'plateau_patience': 18, 'plateau_divider': 8}. Best is trial 151 with value: 0.9212121212121213.
[I 2025-03-08 02:05:02,534] Trial 173 finished with value: 0.9151515151515152 and parameters: {'left_stride': 32, 'right_stride': 64, 'attention_pooling_operation': 'mean', 'embedding_pooling_operation': 'max', 'threshold': 0.9643745407139681, 'batch_size': 18, 'attention_heads': 4, 'hidden_dimension': 106, 'number_of_hidden_layers': 0, 'dropout_rate': 0.5763023489711554, 'global_pooling': 'mean', 'learning_rate': 0.0003528598613181058, 'weight_decay': 1.3807535950869523e-06, 'beta_0': 0.8601571245600247, 'beta_1': 0.9825575430972725, 'epsilon': 2.830095589185656e-07, 'balanced_loss': True, 'epochs': 180, 'early_stopping_patience': 15, 'plateau_patience': 16, 'plateau_divider': 8}. Best is trial 151 with value: 0.9212121212121213.
[I 2025-03-08 02:20:16,915] Trial 174 finished with value: 0.9151515151515152 and parameters: {'left_stride': 32, 'right_stride': 64, 'attention_pooling_operation': 'mean', 'embedding_pooling_operation': 'max', 'threshold': 0.9637287928507643, 'batch_size': 18, 'attention_heads': 4, 'hidden_dimension': 106, 'number_of_hidden_layers': 0, 'dropout_rate': 0.576925033736183, 'global_pooling': 'mean', 'learning_rate': 0.00036443048038906675, 'weight_decay': 1.451332664398632e-06, 'beta_0': 0.8647560928946225, 'beta_1': 0.9835175667438755, 'epsilon': 2.930435082344282e-07, 'balanced_loss': True, 'epochs': 180, 'early_stopping_patience': 16, 'plateau_patience': 17, 'plateau_divider': 8}. Best is trial 151 with value: 0.9212121212121213.
[I 2025-03-08 02:35:50,199] Trial 175 finished with value: 0.8848484848484849 and parameters: {'left_stride': 32, 'right_stride': 64, 'attention_pooling_operation': 'mean', 'embedding_pooling_operation': 'max', 'threshold': 0.9605631890506892, 'batch_size': 64, 'attention_heads': 4, 'hidden_dimension': 105, 'number_of_hidden_layers': 0, 'dropout_rate': 0.599512867732998, 'global_pooling': 'mean', 'learning_rate': 0.0003521410558378903, 'weight_decay': 1.3610034050309408e-06, 'beta_0': 0.868120938288304, 'beta_1': 0.983487250171447, 'epsilon': 2.6927565348360366e-07, 'balanced_loss': True, 'epochs': 181, 'early_stopping_patience': 15, 'plateau_patience': 16, 'plateau_divider': 8}. Best is trial 151 with value: 0.9212121212121213.
[I 2025-03-08 02:51:04,100] Trial 176 finished with value: 0.9030303030303031 and parameters: {'left_stride': 32, 'right_stride': 64, 'attention_pooling_operation': 'mean', 'embedding_pooling_operation': 'max', 'threshold': 0.963459031703013, 'batch_size': 18, 'attention_heads': 4, 'hidden_dimension': 102, 'number_of_hidden_layers': 0, 'dropout_rate': 0.5781410891300969, 'global_pooling': 'mean', 'learning_rate': 0.00043671723409629263, 'weight_decay': 1.1836012832467044e-06, 'beta_0': 0.8645532729494245, 'beta_1': 0.9840693020874492, 'epsilon': 1.260481908937703e-07, 'balanced_loss': True, 'epochs': 169, 'early_stopping_patience': 16, 'plateau_patience': 17, 'plateau_divider': 8}. Best is trial 151 with value: 0.9212121212121213.
[I 2025-03-08 03:06:16,484] Trial 177 finished with value: 0.8909090909090909 and parameters: {'left_stride': 32, 'right_stride': 64, 'attention_pooling_operation': 'mean', 'embedding_pooling_operation': 'max', 'threshold': 0.9574518644238293, 'batch_size': 16, 'attention_heads': 4, 'hidden_dimension': 107, 'number_of_hidden_layers': 0, 'dropout_rate': 0.5700335030277129, 'global_pooling': 'mean', 'learning_rate': 0.0005334072763945337, 'weight_decay': 1.5710313443083702e-06, 'beta_0': 0.8612838426332418, 'beta_1': 0.982393836763968, 'epsilon': 3.6774856918493857e-07, 'balanced_loss': True, 'epochs': 178, 'early_stopping_patience': 16, 'plateau_patience': 17, 'plateau_divider': 8}. Best is trial 151 with value: 0.9212121212121213.
[I 2025-03-08 03:21:11,420] Trial 178 finished with value: 0.896969696969697 and parameters: {'left_stride': 32, 'right_stride': 64, 'attention_pooling_operation': 'mean', 'embedding_pooling_operation': 'max', 'threshold': 0.9651533551526583, 'batch_size': 17, 'attention_heads': 4, 'hidden_dimension': 111, 'number_of_hidden_layers': 0, 'dropout_rate': 0.5912516191043642, 'global_pooling': 'mean', 'learning_rate': 0.0003868223762911098, 'weight_decay': 1.4124886815664841e-06, 'beta_0': 0.859143746971088, 'beta_1': 0.9845304629029954, 'epsilon': 2.975155438163492e-07, 'balanced_loss': True, 'epochs': 173, 'early_stopping_patience': 15, 'plateau_patience': 16, 'plateau_divider': 8}. Best is trial 151 with value: 0.9212121212121213.
[I 2025-03-08 03:36:21,291] Trial 179 finished with value: 0.9090909090909091 and parameters: {'left_stride': 32, 'right_stride': 64, 'attention_pooling_operation': 'mean', 'embedding_pooling_operation': 'max', 'threshold': 0.9622465712094761, 'batch_size': 19, 'attention_heads': 4, 'hidden_dimension': 118, 'number_of_hidden_layers': 0, 'dropout_rate': 0.5762670882605032, 'global_pooling': 'mean', 'learning_rate': 0.0006081308362026962, 'weight_decay': 1.0904747409786136e-06, 'beta_0': 0.8633769746388501, 'beta_1': 0.9836173998788941, 'epsilon': 1.7902569068325557e-07, 'balanced_loss': True, 'epochs': 181, 'early_stopping_patience': 17, 'plateau_patience': 17, 'plateau_divider': 8}. Best is trial 151 with value: 0.9212121212121213.
[I 2025-03-08 03:50:58,081] Trial 180 finished with value: 0.8666666666666667 and parameters: {'left_stride': 32, 'right_stride': 64, 'attention_pooling_operation': 'mean', 'embedding_pooling_operation': 'max', 'threshold': 0.9667192527177151, 'batch_size': 18, 'attention_heads': 4, 'hidden_dimension': 101, 'number_of_hidden_layers': 0, 'dropout_rate': 0.5856254432158873, 'global_pooling': 'sum', 'learning_rate': 0.0002943518745652168, 'weight_decay': 1.746419225328434e-06, 'beta_0': 0.8661830094188918, 'beta_1': 0.9831243294369401, 'epsilon': 4.501202881555698e-07, 'balanced_loss': True, 'epochs': 177, 'early_stopping_patience': 17, 'plateau_patience': 18, 'plateau_divider': 8}. Best is trial 151 with value: 0.9212121212121213.
[I 2025-03-08 04:05:59,865] Trial 181 finished with value: 0.9030303030303031 and parameters: {'left_stride': 32, 'right_stride': 64, 'attention_pooling_operation': 'mean', 'embedding_pooling_operation': 'max', 'threshold': 0.9595758907037418, 'batch_size': 19, 'attention_heads': 4, 'hidden_dimension': 117, 'number_of_hidden_layers': 0, 'dropout_rate': 0.5742291339364043, 'global_pooling': 'mean', 'learning_rate': 0.0006133390936193917, 'weight_decay': 1.0215274654602562e-06, 'beta_0': 0.863762743253098, 'beta_1': 0.9836621996657324, 'epsilon': 1.9260764062462408e-07, 'balanced_loss': True, 'epochs': 181, 'early_stopping_patience': 17, 'plateau_patience': 17, 'plateau_divider': 8}. Best is trial 151 with value: 0.9212121212121213.
[I 2025-03-08 04:20:51,889] Trial 182 finished with value: 0.896969696969697 and parameters: {'left_stride': 32, 'right_stride': 64, 'attention_pooling_operation': 'mean', 'embedding_pooling_operation': 'max', 'threshold': 0.9621780822500028, 'batch_size': 20, 'attention_heads': 4, 'hidden_dimension': 122, 'number_of_hidden_layers': 0, 'dropout_rate': 0.5615301018441063, 'global_pooling': 'mean', 'learning_rate': 0.0011901770488679751, 'weight_decay': 1.3216114478040163e-06, 'beta_0': 0.8617916404629214, 'beta_1': 0.9826870158399427, 'epsilon': 1.6624761373299052e-07, 'balanced_loss': True, 'epochs': 184, 'early_stopping_patience': 16, 'plateau_patience': 17, 'plateau_divider': 8}. Best is trial 151 with value: 0.9212121212121213.
[I 2025-03-08 04:35:55,446] Trial 183 finished with value: 0.9090909090909091 and parameters: {'left_stride': 32, 'right_stride': 64, 'attention_pooling_operation': 'mean', 'embedding_pooling_operation': 'max', 'threshold': 0.9646746611810963, 'batch_size': 19, 'attention_heads': 4, 'hidden_dimension': 114, 'number_of_hidden_layers': 0, 'dropout_rate': 0.5801761309535384, 'global_pooling': 'mean', 'learning_rate': 0.0004720184989560983, 'weight_decay': 1.1844625240071761e-06, 'beta_0': 0.8573915683921609, 'beta_1': 0.9841767411280364, 'epsilon': 2.8935046127255806e-07, 'balanced_loss': True, 'epochs': 174, 'early_stopping_patience': 17, 'plateau_patience': 17, 'plateau_divider': 8}. Best is trial 151 with value: 0.9212121212121213.
[I 2025-03-08 04:51:03,083] Trial 184 finished with value: 0.8848484848484849 and parameters: {'left_stride': 32, 'right_stride': 64, 'attention_pooling_operation': 'mean', 'embedding_pooling_operation': 'max', 'threshold': 0.9617799521565525, 'batch_size': 58, 'attention_heads': 4, 'hidden_dimension': 109, 'number_of_hidden_layers': 0, 'dropout_rate': 0.5886399625054081, 'global_pooling': 'mean', 'learning_rate': 0.0007467568634127071, 'weight_decay': 1.54580842284016e-06, 'beta_0': 0.8599627422197532, 'beta_1': 0.9833844069679082, 'epsilon': 2.492293831186883e-07, 'balanced_loss': True, 'epochs': 179, 'early_stopping_patience': 16, 'plateau_patience': 16, 'plateau_divider': 8}. Best is trial 151 with value: 0.9212121212121213.
[I 2025-03-08 05:06:15,540] Trial 185 finished with value: 0.896969696969697 and parameters: {'left_stride': 32, 'right_stride': 64, 'attention_pooling_operation': 'mean', 'embedding_pooling_operation': 'max', 'threshold': 0.9666246870226947, 'batch_size': 21, 'attention_heads': 4, 'hidden_dimension': 119, 'number_of_hidden_layers': 0, 'dropout_rate': 0.5993510127628524, 'global_pooling': 'mean', 'learning_rate': 0.0003499679144408187, 'weight_decay': 1.1103553310474248e-06, 'beta_0': 0.8679852165049773, 'beta_1': 0.9829686296735078, 'epsilon': 1.0654056040092709e-07, 'balanced_loss': True, 'epochs': 171, 'early_stopping_patience': 17, 'plateau_patience': 18, 'plateau_divider': 8}. Best is trial 151 with value: 0.9212121212121213.
[I 2025-03-08 05:21:04,126] Trial 186 finished with value: 0.896969696969697 and parameters: {'left_stride': 32, 'right_stride': 64, 'attention_pooling_operation': 'mean', 'embedding_pooling_operation': 'max', 'threshold': 0.9693759986892349, 'batch_size': 17, 'attention_heads': 4, 'hidden_dimension': 107, 'number_of_hidden_layers': 0, 'dropout_rate': 0.5688441240057489, 'global_pooling': 'mean', 'learning_rate': 0.0005706510366856513, 'weight_decay': 1.371882968407212e-06, 'beta_0': 0.8646990586323507, 'beta_1': 0.982522978159276, 'epsilon': 3.733255152173749e-07, 'balanced_loss': True, 'epochs': 164, 'early_stopping_patience': 14, 'plateau_patience': 16, 'plateau_divider': 8}. Best is trial 151 with value: 0.9212121212121213.
[I 2025-03-08 05:35:49,342] Trial 187 finished with value: 0.9090909090909091 and parameters: {'left_stride': 32, 'right_stride': 64, 'attention_pooling_operation': 'mean', 'embedding_pooling_operation': 'max', 'threshold': 0.9642004805697159, 'batch_size': 18, 'attention_heads': 4, 'hidden_dimension': 112, 'number_of_hidden_layers': 0, 'dropout_rate': 0.577142659198321, 'global_pooling': 'mean', 'learning_rate': 0.0009884296960161105, 'weight_decay': 1.960181866372809e-06, 'beta_0': 0.8623096506753721, 'beta_1': 0.9817099158233543, 'epsilon': 2.1231065320155423e-07, 'balanced_loss': True, 'epochs': 182, 'early_stopping_patience': 16, 'plateau_patience': 17, 'plateau_divider': 8}. Best is trial 151 with value: 0.9212121212121213.
