[I 2025-03-06 09:30:59,006] A new study created in RDB with name: IMDb-top_1000-GATv2-google-bert-bert-base-uncased-Surrogate-No_Aggregation-Random_Attentions-0.0-0.0
Token indices sequence length is longer than the specified maximum sequence length for this model (1147 > 512). Running this sequence through the model will result in indexing errors
CUDA out of memory. Tried to allocate 6.19 GiB. GPU 0 has a total capacity of 44.56 GiB of which 3.88 GiB is free. Including non-PyTorch memory, this process has 40.68 GiB memory in use. Of the allocated memory 37.48 GiB is allocated by PyTorch, and 2.05 GiB is reserved by PyTorch but unallocated. If reserved but unallocated memory is large try setting PYTORCH_CUDA_ALLOC_CONF=expandable_segments:True to avoid fragmentation.  See documentation for Memory Management  (https://pytorch.org/docs/stable/notes/cuda.html#environment-variables)
[I 2025-03-06 09:44:45,403] Trial 0 finished with value: -1.0 and parameters: {'left_stride': 32, 'right_stride': 64, 'attention_pooling_operation': 'mean', 'embedding_pooling_operation': 'min', 'threshold': 0.9304211818735242, 'batch_size': 41, 'attention_heads': 9, 'hidden_dimension': 97, 'number_of_hidden_layers': 3, 'dropout_rate': 0.34184815819561254, 'global_pooling': 'max', 'learning_rate': 0.013826232179369865, 'weight_decay': 3.972110727381911e-06, 'beta_0': 0.849951952030185, 'beta_1': 0.9912118037965686, 'epsilon': 1.5339162591163588e-08, 'balanced_loss': True, 'epochs': 59, 'early_stopping_patience': 25, 'plateau_patience': 25, 'plateau_divider': 9}. Best is trial 0 with value: -1.0.
[I 2025-03-06 09:57:23,890] Trial 1 finished with value: 0.8484848484848485 and parameters: {'left_stride': 64, 'right_stride': 64, 'attention_pooling_operation': 'max', 'embedding_pooling_operation': 'mean', 'threshold': 0.9939404991670033, 'batch_size': 59, 'attention_heads': 11, 'hidden_dimension': 239, 'number_of_hidden_layers': 0, 'dropout_rate': 0.35879485872574357, 'global_pooling': 'max', 'learning_rate': 0.00012172958098369953, 'weight_decay': 0.0003063462210622083, 'beta_0': 0.834331843801655, 'beta_1': 0.9853009566677808, 'epsilon': 1.4817820606039087e-06, 'balanced_loss': False, 'epochs': 61, 'early_stopping_patience': 25, 'plateau_patience': 22, 'plateau_divider': 3}. Best is trial 1 with value: 0.8484848484848485.
[I 2025-03-06 10:10:07,831] Trial 2 finished with value: 0.9151515151515152 and parameters: {'left_stride': 32, 'right_stride': 128, 'attention_pooling_operation': 'min', 'embedding_pooling_operation': 'mean', 'threshold': 0.988712402130207, 'batch_size': 39, 'attention_heads': 5, 'hidden_dimension': 192, 'number_of_hidden_layers': 3, 'dropout_rate': 0.46838315927084884, 'global_pooling': 'mean', 'learning_rate': 0.0005130551760589835, 'weight_decay': 1.1919481947918734e-06, 'beta_0': 0.8102310933924105, 'beta_1': 0.98059161803998, 'epsilon': 3.512704726270843e-06, 'balanced_loss': False, 'epochs': 187, 'early_stopping_patience': 13, 'plateau_patience': 16, 'plateau_divider': 8}. Best is trial 2 with value: 0.9151515151515152.
CUDA out of memory. Tried to allocate 1.32 GiB. GPU 0 has a total capacity of 44.56 GiB of which 542.69 MiB is free. Including non-PyTorch memory, this process has 44.02 GiB memory in use. Of the allocated memory 41.51 GiB is allocated by PyTorch, and 1.36 GiB is reserved by PyTorch but unallocated. If reserved but unallocated memory is large try setting PYTORCH_CUDA_ALLOC_CONF=expandable_segments:True to avoid fragmentation.  See documentation for Memory Management  (https://pytorch.org/docs/stable/notes/cuda.html#environment-variables)
[I 2025-03-06 10:20:00,528] Trial 3 finished with value: -1.0 and parameters: {'left_stride': 256, 'right_stride': 64, 'attention_pooling_operation': 'min', 'embedding_pooling_operation': 'min', 'threshold': 0.9227912369025688, 'batch_size': 36, 'attention_heads': 14, 'hidden_dimension': 225, 'number_of_hidden_layers': 0, 'dropout_rate': 0.4532241907732697, 'global_pooling': 'mean', 'learning_rate': 0.00022410971619109496, 'weight_decay': 0.0006741074265640696, 'beta_0': 0.8310413476654125, 'beta_1': 0.9898114758541204, 'epsilon': 6.487477066058673e-06, 'balanced_loss': False, 'epochs': 195, 'early_stopping_patience': 14, 'plateau_patience': 17, 'plateau_divider': 4}. Best is trial 2 with value: 0.9151515151515152.
CUDA out of memory. Tried to allocate 13.12 GiB. GPU 0 has a total capacity of 44.56 GiB of which 11.67 GiB is free. Including non-PyTorch memory, this process has 32.88 GiB memory in use. Of the allocated memory 29.50 GiB is allocated by PyTorch, and 2.24 GiB is reserved by PyTorch but unallocated. If reserved but unallocated memory is large try setting PYTORCH_CUDA_ALLOC_CONF=expandable_segments:True to avoid fragmentation.  See documentation for Memory Management  (https://pytorch.org/docs/stable/notes/cuda.html#environment-variables)
[I 2025-03-06 10:29:03,046] Trial 4 finished with value: -1.0 and parameters: {'left_stride': 64, 'right_stride': 32, 'attention_pooling_operation': 'min', 'embedding_pooling_operation': 'min', 'threshold': 0.9367746354405981, 'batch_size': 46, 'attention_heads': 12, 'hidden_dimension': 152, 'number_of_hidden_layers': 0, 'dropout_rate': 0.5505907486767714, 'global_pooling': 'mean', 'learning_rate': 0.002309786149269356, 'weight_decay': 0.00010781845035122267, 'beta_0': 0.8015645397505602, 'beta_1': 0.9896841863656863, 'epsilon': 8.053471030316087e-08, 'balanced_loss': True, 'epochs': 154, 'early_stopping_patience': 16, 'plateau_patience': 24, 'plateau_divider': 3}. Best is trial 2 with value: 0.9151515151515152.
CUDA out of memory. Tried to allocate 12.43 GiB. GPU 0 has a total capacity of 44.56 GiB of which 12.08 GiB is free. Including non-PyTorch memory, this process has 32.47 GiB memory in use. Of the allocated memory 29.51 GiB is allocated by PyTorch, and 1.82 GiB is reserved by PyTorch but unallocated. If reserved but unallocated memory is large try setting PYTORCH_CUDA_ALLOC_CONF=expandable_segments:True to avoid fragmentation.  See documentation for Memory Management  (https://pytorch.org/docs/stable/notes/cuda.html#environment-variables)
[I 2025-03-06 10:38:06,883] Trial 5 finished with value: -1.0 and parameters: {'left_stride': 64, 'right_stride': 32, 'attention_pooling_operation': 'max', 'embedding_pooling_operation': 'min', 'threshold': 0.9725883083302352, 'batch_size': 59, 'attention_heads': 15, 'hidden_dimension': 207, 'number_of_hidden_layers': 3, 'dropout_rate': 0.3252419894985146, 'global_pooling': 'sum', 'learning_rate': 1.0883991813938131e-05, 'weight_decay': 2.015647705936503e-06, 'beta_0': 0.8650272248026284, 'beta_1': 0.9800952543380481, 'epsilon': 4.397766894483953e-08, 'balanced_loss': False, 'epochs': 148, 'early_stopping_patience': 13, 'plateau_patience': 21, 'plateau_divider': 4}. Best is trial 2 with value: 0.9151515151515152.
CUDA out of memory. Tried to allocate 5.07 GiB. GPU 0 has a total capacity of 44.56 GiB of which 4.87 GiB is free. Including non-PyTorch memory, this process has 39.68 GiB memory in use. Of the allocated memory 36.92 GiB is allocated by PyTorch, and 1.62 GiB is reserved by PyTorch but unallocated. If reserved but unallocated memory is large try setting PYTORCH_CUDA_ALLOC_CONF=expandable_segments:True to avoid fragmentation.  See documentation for Memory Management  (https://pytorch.org/docs/stable/notes/cuda.html#environment-variables)
[I 2025-03-06 10:47:24,911] Trial 6 finished with value: -1.0 and parameters: {'left_stride': 128, 'right_stride': 0, 'attention_pooling_operation': 'min', 'embedding_pooling_operation': 'mean', 'threshold': 0.9576846194237897, 'batch_size': 40, 'attention_heads': 6, 'hidden_dimension': 194, 'number_of_hidden_layers': 1, 'dropout_rate': 0.30729478992943615, 'global_pooling': 'max', 'learning_rate': 0.06542056762893128, 'weight_decay': 0.0005553837526912237, 'beta_0': 0.8356502322469728, 'beta_1': 0.9802909082956842, 'epsilon': 5.167425813322413e-05, 'balanced_loss': False, 'epochs': 195, 'early_stopping_patience': 23, 'plateau_patience': 14, 'plateau_divider': 5}. Best is trial 2 with value: 0.9151515151515152.
The selected strides are greater or equal to the total chunk size.
[I 2025-03-06 10:47:25,825] Trial 7 finished with value: -1.0 and parameters: {'left_stride': 256, 'right_stride': 256, 'attention_pooling_operation': 'max', 'embedding_pooling_operation': 'min', 'threshold': 0.9359455202104634, 'batch_size': 30, 'attention_heads': 14, 'hidden_dimension': 214, 'number_of_hidden_layers': 4, 'dropout_rate': 0.5739721657669414, 'global_pooling': 'max', 'learning_rate': 0.0039797493741031125, 'weight_decay': 0.0001276146788173022, 'beta_0': 0.8786113098385785, 'beta_1': 0.996892198716152, 'epsilon': 2.248954284391446e-07, 'balanced_loss': True, 'epochs': 137, 'early_stopping_patience': 10, 'plateau_patience': 17, 'plateau_divider': 6}. Best is trial 2 with value: 0.9151515151515152.
CUDA out of memory. Tried to allocate 6.00 GiB. GPU 0 has a total capacity of 44.56 GiB of which 1.81 GiB is free. Including non-PyTorch memory, this process has 42.74 GiB memory in use. Of the allocated memory 37.68 GiB is allocated by PyTorch, and 3.92 GiB is reserved by PyTorch but unallocated. If reserved but unallocated memory is large try setting PYTORCH_CUDA_ALLOC_CONF=expandable_segments:True to avoid fragmentation.  See documentation for Memory Management  (https://pytorch.org/docs/stable/notes/cuda.html#environment-variables)
[I 2025-03-06 10:59:10,261] Trial 8 finished with value: -1.0 and parameters: {'left_stride': 256, 'right_stride': 128, 'attention_pooling_operation': 'min', 'embedding_pooling_operation': 'max', 'threshold': 0.9726018724589289, 'batch_size': 63, 'attention_heads': 10, 'hidden_dimension': 104, 'number_of_hidden_layers': 3, 'dropout_rate': 0.38124967537862225, 'global_pooling': 'mean', 'learning_rate': 0.07089141723796885, 'weight_decay': 0.0003220626495993124, 'beta_0': 0.8683420313684149, 'beta_1': 0.9877260389162159, 'epsilon': 4.933751600448336e-08, 'balanced_loss': False, 'epochs': 132, 'early_stopping_patience': 21, 'plateau_patience': 20, 'plateau_divider': 4}. Best is trial 2 with value: 0.9151515151515152.
CUDA out of memory. Tried to allocate 3.62 GiB. GPU 0 has a total capacity of 44.56 GiB of which 22.69 MiB is free. Including non-PyTorch memory, this process has 44.53 GiB memory in use. Of the allocated memory 41.29 GiB is allocated by PyTorch, and 2.10 GiB is reserved by PyTorch but unallocated. If reserved but unallocated memory is large try setting PYTORCH_CUDA_ALLOC_CONF=expandable_segments:True to avoid fragmentation.  See documentation for Memory Management  (https://pytorch.org/docs/stable/notes/cuda.html#environment-variables)
[I 2025-03-06 11:07:58,708] Trial 9 finished with value: -1.0 and parameters: {'left_stride': 0, 'right_stride': 64, 'attention_pooling_operation': 'max', 'embedding_pooling_operation': 'min', 'threshold': 0.9491566713529321, 'batch_size': 39, 'attention_heads': 6, 'hidden_dimension': 129, 'number_of_hidden_layers': 1, 'dropout_rate': 0.48475502941566495, 'global_pooling': 'mean', 'learning_rate': 0.003187422711813414, 'weight_decay': 3.2315343430749745e-05, 'beta_0': 0.8849150937783302, 'beta_1': 0.9924741264147013, 'epsilon': 4.484744524732786e-08, 'balanced_loss': False, 'epochs': 54, 'early_stopping_patience': 19, 'plateau_patience': 25, 'plateau_divider': 7}. Best is trial 2 with value: 0.9151515151515152.
[I 2025-03-06 11:23:19,109] Trial 10 finished with value: 0.8424242424242424 and parameters: {'left_stride': 32, 'right_stride': 128, 'attention_pooling_operation': 'mean', 'embedding_pooling_operation': 'mean', 'threshold': 0.9983501014500715, 'batch_size': 17, 'attention_heads': 4, 'hidden_dimension': 48, 'number_of_hidden_layers': 4, 'dropout_rate': 0.5215216634175063, 'global_pooling': 'sum', 'learning_rate': 0.0002656836893415814, 'weight_decay': 8.178412772916804e-06, 'beta_0': 0.8049297522472849, 'beta_1': 0.9840036011509948, 'epsilon': 1.3261882354835817e-05, 'balanced_loss': True, 'epochs': 92, 'early_stopping_patience': 10, 'plateau_patience': 10, 'plateau_divider': 10}. Best is trial 2 with value: 0.9151515151515152.
[I 2025-03-06 11:38:17,222] Trial 11 finished with value: 0.8303030303030303 and parameters: {'left_stride': 32, 'right_stride': 128, 'attention_pooling_operation': 'max', 'embedding_pooling_operation': 'mean', 'threshold': 0.9990142201899019, 'batch_size': 52, 'attention_heads': 9, 'hidden_dimension': 254, 'number_of_hidden_layers': 2, 'dropout_rate': 0.3965390541849626, 'global_pooling': 'max', 'learning_rate': 4.0083099308315954e-05, 'weight_decay': 1.9948878206620123e-05, 'beta_0': 0.8229997949552795, 'beta_1': 0.9846023396580135, 'epsilon': 1.2304350108398785e-06, 'balanced_loss': False, 'epochs': 101, 'early_stopping_patience': 18, 'plateau_patience': 13, 'plateau_divider': 2}. Best is trial 2 with value: 0.9151515151515152.
CUDA out of memory. Tried to allocate 2.87 GiB. GPU 0 has a total capacity of 44.56 GiB of which 2.56 GiB is free. Including non-PyTorch memory, this process has 41.99 GiB memory in use. Of the allocated memory 37.01 GiB is allocated by PyTorch, and 3.83 GiB is reserved by PyTorch but unallocated. If reserved but unallocated memory is large try setting PYTORCH_CUDA_ALLOC_CONF=expandable_segments:True to avoid fragmentation.  See documentation for Memory Management  (https://pytorch.org/docs/stable/notes/cuda.html#environment-variables)
[I 2025-03-06 11:49:12,193] Trial 12 finished with value: -1.0 and parameters: {'left_stride': 64, 'right_stride': 256, 'attention_pooling_operation': 'min', 'embedding_pooling_operation': 'mean', 'threshold': 0.9836702511656749, 'batch_size': 29, 'attention_heads': 11, 'hidden_dimension': 174, 'number_of_hidden_layers': 2, 'dropout_rate': 0.4232817731798428, 'global_pooling': 'mean', 'learning_rate': 0.0003794553385403524, 'weight_decay': 1.0332855569626058e-06, 'beta_0': 0.8160804530670469, 'beta_1': 0.9847976982734662, 'epsilon': 1.051978058963241e-06, 'balanced_loss': False, 'epochs': 170, 'early_stopping_patience': 14, 'plateau_patience': 20, 'plateau_divider': 8}. Best is trial 2 with value: 0.9151515151515152.
CUDA out of memory. Tried to allocate 442.00 MiB. GPU 0 has a total capacity of 44.56 GiB of which 312.69 MiB is free. Including non-PyTorch memory, this process has 44.25 GiB memory in use. Of the allocated memory 40.56 GiB is allocated by PyTorch, and 2.54 GiB is reserved by PyTorch but unallocated. If reserved but unallocated memory is large try setting PYTORCH_CUDA_ALLOC_CONF=expandable_segments:True to avoid fragmentation.  See documentation for Memory Management  (https://pytorch.org/docs/stable/notes/cuda.html#environment-variables)
[I 2025-03-06 11:58:30,934] Trial 13 finished with value: -1.0 and parameters: {'left_stride': 128, 'right_stride': 0, 'attention_pooling_operation': 'max', 'embedding_pooling_operation': 'mean', 'threshold': 0.9106680700435837, 'batch_size': 52, 'attention_heads': 7, 'hidden_dimension': 256, 'number_of_hidden_layers': 2, 'dropout_rate': 0.48082126313764223, 'global_pooling': 'max', 'learning_rate': 6.567919987784165e-05, 'weight_decay': 3.7947055714200486e-05, 'beta_0': 0.8379605356560551, 'beta_1': 0.9827099355668892, 'epsilon': 4.088261595658418e-06, 'balanced_loss': False, 'epochs': 97, 'early_stopping_patience': 25, 'plateau_patience': 22, 'plateau_divider': 7}. Best is trial 2 with value: 0.9151515151515152.
[I 2025-03-06 12:14:17,883] Trial 14 finished with value: 0.8303030303030303 and parameters: {'left_stride': 0, 'right_stride': 64, 'attention_pooling_operation': 'mean', 'embedding_pooling_operation': 'max', 'threshold': 0.9809309857161858, 'batch_size': 50, 'attention_heads': 4, 'hidden_dimension': 181, 'number_of_hidden_layers': 1, 'dropout_rate': 0.3806622045960868, 'global_pooling': 'sum', 'learning_rate': 0.0007163547440785774, 'weight_decay': 0.0001242481468574075, 'beta_0': 0.8159973543818061, 'beta_1': 0.986691679686623, 'epsilon': 3.3584310308021153e-07, 'balanced_loss': False, 'epochs': 78, 'early_stopping_patience': 21, 'plateau_patience': 14, 'plateau_divider': 2}. Best is trial 2 with value: 0.9151515151515152.
[I 2025-03-06 12:29:10,217] Trial 15 finished with value: 0.8787878787878788 and parameters: {'left_stride': 64, 'right_stride': 128, 'attention_pooling_operation': 'min', 'embedding_pooling_operation': 'mean', 'threshold': 0.9869470956984794, 'batch_size': 23, 'attention_heads': 12, 'hidden_dimension': 236, 'number_of_hidden_layers': 0, 'dropout_rate': 0.43962734982768675, 'global_pooling': 'mean', 'learning_rate': 0.00012237515790935425, 'weight_decay': 6.992934972302667e-06, 'beta_0': 0.8981752259338325, 'beta_1': 0.9824420102739834, 'epsilon': 9.935138101942618e-05, 'balanced_loss': False, 'epochs': 115, 'early_stopping_patience': 16, 'plateau_patience': 18, 'plateau_divider': 8}. Best is trial 2 with value: 0.9151515151515152.
CUDA out of memory. Tried to allocate 4.60 GiB. GPU 0 has a total capacity of 44.56 GiB of which 2.69 GiB is free. Including non-PyTorch memory, this process has 41.86 GiB memory in use. Of the allocated memory 38.75 GiB is allocated by PyTorch, and 1.96 GiB is reserved by PyTorch but unallocated. If reserved but unallocated memory is large try setting PYTORCH_CUDA_ALLOC_CONF=expandable_segments:True to avoid fragmentation.  See documentation for Memory Management  (https://pytorch.org/docs/stable/notes/cuda.html#environment-variables)
[I 2025-03-06 12:38:46,879] Trial 16 finished with value: -1.0 and parameters: {'left_stride': 32, 'right_stride': 128, 'attention_pooling_operation': 'min', 'embedding_pooling_operation': 'mean', 'threshold': 0.9617102963741547, 'batch_size': 17, 'attention_heads': 16, 'hidden_dimension': 164, 'number_of_hidden_layers': 3, 'dropout_rate': 0.4425634968754803, 'global_pooling': 'mean', 'learning_rate': 2.16471725366042e-05, 'weight_decay': 7.525868374086113e-06, 'beta_0': 0.8920979459285414, 'beta_1': 0.9817331829640847, 'epsilon': 8.520047096206607e-05, 'balanced_loss': False, 'epochs': 116, 'early_stopping_patience': 16, 'plateau_patience': 18, 'plateau_divider': 9}. Best is trial 2 with value: 0.9151515151515152.
CUDA out of memory. Tried to allocate 3.22 GiB. GPU 0 has a total capacity of 44.56 GiB of which 656.69 MiB is free. Including non-PyTorch memory, this process has 43.91 GiB memory in use. Of the allocated memory 39.05 GiB is allocated by PyTorch, and 3.72 GiB is reserved by PyTorch but unallocated. If reserved but unallocated memory is large try setting PYTORCH_CUDA_ALLOC_CONF=expandable_segments:True to avoid fragmentation.  See documentation for Memory Management  (https://pytorch.org/docs/stable/notes/cuda.html#environment-variables)
[I 2025-03-06 12:48:22,714] Trial 17 finished with value: -1.0 and parameters: {'left_stride': 32, 'right_stride': 128, 'attention_pooling_operation': 'min', 'embedding_pooling_operation': 'max', 'threshold': 0.9844645297913952, 'batch_size': 26, 'attention_heads': 13, 'hidden_dimension': 226, 'number_of_hidden_layers': 2, 'dropout_rate': 0.5062651953627526, 'global_pooling': 'mean', 'learning_rate': 0.0011261127130204611, 'weight_decay': 1.09640470597855e-06, 'beta_0': 0.8983389870168317, 'beta_1': 0.99660496402926, 'epsilon': 2.5944191269874045e-05, 'balanced_loss': False, 'epochs': 169, 'early_stopping_patience': 12, 'plateau_patience': 16, 'plateau_divider': 8}. Best is trial 2 with value: 0.9151515151515152.
[I 2025-03-06 13:02:45,911] Trial 18 finished with value: 0.9030303030303031 and parameters: {'left_stride': 64, 'right_stride': 128, 'attention_pooling_operation': 'min', 'embedding_pooling_operation': 'mean', 'threshold': 0.9699382446775976, 'batch_size': 25, 'attention_heads': 8, 'hidden_dimension': 125, 'number_of_hidden_layers': 1, 'dropout_rate': 0.42745281232403104, 'global_pooling': 'mean', 'learning_rate': 0.00011094754848128584, 'weight_decay': 3.5902393518252257e-06, 'beta_0': 0.8490038793987367, 'beta_1': 0.9820287290713341, 'epsilon': 3.943203508652823e-06, 'balanced_loss': True, 'epochs': 119, 'early_stopping_patience': 16, 'plateau_patience': 11, 'plateau_divider': 10}. Best is trial 2 with value: 0.9151515151515152.
CUDA out of memory. Tried to allocate 2.66 GiB. GPU 0 has a total capacity of 44.56 GiB of which 2.39 GiB is free. Including non-PyTorch memory, this process has 42.16 GiB memory in use. Of the allocated memory 39.79 GiB is allocated by PyTorch, and 1.23 GiB is reserved by PyTorch but unallocated. If reserved but unallocated memory is large try setting PYTORCH_CUDA_ALLOC_CONF=expandable_segments:True to avoid fragmentation.  See documentation for Memory Management  (https://pytorch.org/docs/stable/notes/cuda.html#environment-variables)
