[I 2025-03-07 15:59:15,183] Trial 133 finished with value: 0.9090909090909091 and parameters: {'left_stride': 32, 'right_stride': 64, 'attention_pooling_operation': 'mean', 'embedding_pooling_operation': 'max', 'threshold': 0.987422418819978, 'batch_size': 18, 'attention_heads': 12, 'hidden_dimension': 202, 'number_of_hidden_layers': 1, 'dropout_rate': 0.47282928614710135, 'global_pooling': 'mean', 'learning_rate': 0.00011789302819305613, 'weight_decay': 1.2270503247956336e-06, 'beta_0': 0.8371053798998568, 'beta_1': 0.9811801094329343, 'epsilon': 5.117912937278947e-06, 'balanced_loss': False, 'epochs': 189, 'early_stopping_patience': 20, 'plateau_patience': 19, 'plateau_divider': 10}. Best is trial 2 with value: 0.9151515151515152.
CUDA out of memory. Tried to allocate 440.00 MiB. GPU 0 has a total capacity of 44.56 GiB of which 136.69 MiB is free. Including non-PyTorch memory, this process has 44.42 GiB memory in use. Of the allocated memory 38.49 GiB is allocated by PyTorch, and 4.79 GiB is reserved by PyTorch but unallocated. If reserved but unallocated memory is large try setting PYTORCH_CUDA_ALLOC_CONF=expandable_segments:True to avoid fragmentation.  See documentation for Memory Management  (https://pytorch.org/docs/stable/notes/cuda.html#environment-variables)
[I 2025-03-07 16:11:43,250] Trial 134 finished with value: -1.0 and parameters: {'left_stride': 32, 'right_stride': 64, 'attention_pooling_operation': 'mean', 'embedding_pooling_operation': 'max', 'threshold': 0.900294316066058, 'batch_size': 19, 'attention_heads': 13, 'hidden_dimension': 156, 'number_of_hidden_layers': 1, 'dropout_rate': 0.4733892847776377, 'global_pooling': 'mean', 'learning_rate': 0.00020173481028738625, 'weight_decay': 3.77957708589279e-06, 'beta_0': 0.8332161320035105, 'beta_1': 0.9903993844034699, 'epsilon': 5.287604477004078e-06, 'balanced_loss': False, 'epochs': 199, 'early_stopping_patience': 20, 'plateau_patience': 19, 'plateau_divider': 9}. Best is trial 2 with value: 0.9151515151515152.
[I 2025-03-07 16:29:37,794] Trial 135 finished with value: 0.896969696969697 and parameters: {'left_stride': 64, 'right_stride': 64, 'attention_pooling_operation': 'mean', 'embedding_pooling_operation': 'max', 'threshold': 0.9926074400191338, 'batch_size': 17, 'attention_heads': 11, 'hidden_dimension': 163, 'number_of_hidden_layers': 1, 'dropout_rate': 0.3362574966626721, 'global_pooling': 'mean', 'learning_rate': 0.00013662163714971205, 'weight_decay': 5.4476474070141555e-06, 'beta_0': 0.8479122682210312, 'beta_1': 0.9812657017989489, 'epsilon': 1.2630024150331604e-05, 'balanced_loss': False, 'epochs': 190, 'early_stopping_patience': 21, 'plateau_patience': 18, 'plateau_divider': 10}. Best is trial 2 with value: 0.9151515151515152.
[I 2025-03-07 16:41:55,721] Trial 136 finished with value: 0.9030303030303031 and parameters: {'left_stride': 32, 'right_stride': 32, 'attention_pooling_operation': 'min', 'embedding_pooling_operation': 'mean', 'threshold': 0.9785356799921334, 'batch_size': 18, 'attention_heads': 6, 'hidden_dimension': 200, 'number_of_hidden_layers': 1, 'dropout_rate': 0.5999261977557371, 'global_pooling': 'mean', 'learning_rate': 0.0003426784458956379, 'weight_decay': 2.1552807586592883e-06, 'beta_0': 0.8282881642443112, 'beta_1': 0.9819477582060953, 'epsilon': 3.3908006771021166e-06, 'balanced_loss': False, 'epochs': 193, 'early_stopping_patience': 20, 'plateau_patience': 19, 'plateau_divider': 2}. Best is trial 2 with value: 0.9151515151515152.
CUDA out of memory. Tried to allocate 2.23 GiB. GPU 0 has a total capacity of 44.56 GiB of which 2.00 GiB is free. Including non-PyTorch memory, this process has 42.56 GiB memory in use. Of the allocated memory 34.90 GiB is allocated by PyTorch, and 6.51 GiB is reserved by PyTorch but unallocated. If reserved but unallocated memory is large try setting PYTORCH_CUDA_ALLOC_CONF=expandable_segments:True to avoid fragmentation.  See documentation for Memory Management  (https://pytorch.org/docs/stable/notes/cuda.html#environment-variables)
[I 2025-03-07 17:00:15,913] Trial 137 finished with value: -1.0 and parameters: {'left_stride': 256, 'right_stride': 128, 'attention_pooling_operation': 'mean', 'embedding_pooling_operation': 'max', 'threshold': 0.9615552729473937, 'batch_size': 16, 'attention_heads': 5, 'hidden_dimension': 215, 'number_of_hidden_layers': 1, 'dropout_rate': 0.4890476974935647, 'global_pooling': 'mean', 'learning_rate': 0.0019170603823388858, 'weight_decay': 2.892469643994646e-06, 'beta_0': 0.8368266572475349, 'beta_1': 0.980966187315508, 'epsilon': 6.878083128878095e-06, 'balanced_loss': True, 'epochs': 52, 'early_stopping_patience': 18, 'plateau_patience': 17, 'plateau_divider': 10}. Best is trial 2 with value: 0.9151515151515152.
CUDA out of memory. Tried to allocate 2.06 GiB. GPU 0 has a total capacity of 44.56 GiB of which 1.43 GiB is free. Including non-PyTorch memory, this process has 43.12 GiB memory in use. Of the allocated memory 39.84 GiB is allocated by PyTorch, and 2.13 GiB is reserved by PyTorch but unallocated. If reserved but unallocated memory is large try setting PYTORCH_CUDA_ALLOC_CONF=expandable_segments:True to avoid fragmentation.  See documentation for Memory Management  (https://pytorch.org/docs/stable/notes/cuda.html#environment-variables)
[I 2025-03-07 17:10:04,888] Trial 138 finished with value: -1.0 and parameters: {'left_stride': 128, 'right_stride': 64, 'attention_pooling_operation': 'min', 'embedding_pooling_operation': 'min', 'threshold': 0.955486215398901, 'batch_size': 17, 'attention_heads': 16, 'hidden_dimension': 61, 'number_of_hidden_layers': 4, 'dropout_rate': 0.46745921261790213, 'global_pooling': 'mean', 'learning_rate': 8.12764018907733e-05, 'weight_decay': 1.0686449876407235e-06, 'beta_0': 0.8407685107367091, 'beta_1': 0.9814898312715987, 'epsilon': 4.983683535898212e-06, 'balanced_loss': False, 'epochs': 188, 'early_stopping_patience': 17, 'plateau_patience': 18, 'plateau_divider': 6}. Best is trial 2 with value: 0.9151515151515152.
CUDA out of memory. Tried to allocate 4.98 GiB. GPU 0 has a total capacity of 44.56 GiB of which 1.96 GiB is free. Including non-PyTorch memory, this process has 42.59 GiB memory in use. Of the allocated memory 40.07 GiB is allocated by PyTorch, and 1.38 GiB is reserved by PyTorch but unallocated. If reserved but unallocated memory is large try setting PYTORCH_CUDA_ALLOC_CONF=expandable_segments:True to avoid fragmentation.  See documentation for Memory Management  (https://pytorch.org/docs/stable/notes/cuda.html#environment-variables)
[I 2025-03-07 17:23:31,287] Trial 139 finished with value: -1.0 and parameters: {'left_stride': 32, 'right_stride': 32, 'attention_pooling_operation': 'mean', 'embedding_pooling_operation': 'mean', 'threshold': 0.9720987178195083, 'batch_size': 30, 'attention_heads': 12, 'hidden_dimension': 210, 'number_of_hidden_layers': 1, 'dropout_rate': 0.38127801394045197, 'global_pooling': 'sum', 'learning_rate': 0.00017252883274878993, 'weight_decay': 3.373803763184794e-06, 'beta_0': 0.8514220522171585, 'beta_1': 0.9803771623201927, 'epsilon': 1.303835553544187e-06, 'balanced_loss': True, 'epochs': 126, 'early_stopping_patience': 20, 'plateau_patience': 19, 'plateau_divider': 9}. Best is trial 2 with value: 0.9151515151515152.
[I 2025-03-07 17:37:53,994] Trial 140 finished with value: 0.8181818181818182 and parameters: {'left_stride': 32, 'right_stride': 256, 'attention_pooling_operation': 'min', 'embedding_pooling_operation': 'max', 'threshold': 0.9825998783937899, 'batch_size': 20, 'attention_heads': 11, 'hidden_dimension': 120, 'number_of_hidden_layers': 1, 'dropout_rate': 0.45716051178333045, 'global_pooling': 'mean', 'learning_rate': 0.09755286280014455, 'weight_decay': 2.4133989411854544e-06, 'beta_0': 0.8776998423928257, 'beta_1': 0.9822899859924379, 'epsilon': 9.301049585186352e-06, 'balanced_loss': False, 'epochs': 175, 'early_stopping_patience': 21, 'plateau_patience': 18, 'plateau_divider': 10}. Best is trial 2 with value: 0.9151515151515152.
[I 2025-03-07 17:57:45,968] Trial 141 finished with value: 0.8909090909090909 and parameters: {'left_stride': 32, 'right_stride': 64, 'attention_pooling_operation': 'mean', 'embedding_pooling_operation': 'max', 'threshold': 0.9880744720848866, 'batch_size': 22, 'attention_heads': 12, 'hidden_dimension': 192, 'number_of_hidden_layers': 1, 'dropout_rate': 0.4453119020949215, 'global_pooling': 'mean', 'learning_rate': 0.00011675760517167855, 'weight_decay': 1.341150479398672e-06, 'beta_0': 0.8421589281846134, 'beta_1': 0.980627517472711, 'epsilon': 1.0612363707143684e-06, 'balanced_loss': False, 'epochs': 182, 'early_stopping_patience': 19, 'plateau_patience': 20, 'plateau_divider': 10}. Best is trial 2 with value: 0.9151515151515152.
[I 2025-03-07 18:16:45,344] Trial 142 finished with value: 0.8787878787878788 and parameters: {'left_stride': 32, 'right_stride': 64, 'attention_pooling_operation': 'mean', 'embedding_pooling_operation': 'max', 'threshold': 0.9916876368255669, 'batch_size': 19, 'attention_heads': 12, 'hidden_dimension': 186, 'number_of_hidden_layers': 1, 'dropout_rate': 0.535498190154162, 'global_pooling': 'mean', 'learning_rate': 6.975297111153493e-05, 'weight_decay': 1.1993516564277693e-06, 'beta_0': 0.8452034791019553, 'beta_1': 0.9810734451756897, 'epsilon': 2.3638984436441176e-06, 'balanced_loss': False, 'epochs': 184, 'early_stopping_patience': 19, 'plateau_patience': 20, 'plateau_divider': 10}. Best is trial 2 with value: 0.9151515151515152.
[I 2025-03-07 18:39:13,560] Trial 143 finished with value: 0.9030303030303031 and parameters: {'left_stride': 32, 'right_stride': 64, 'attention_pooling_operation': 'mean', 'embedding_pooling_operation': 'max', 'threshold': 0.986694262832858, 'batch_size': 27, 'attention_heads': 13, 'hidden_dimension': 202, 'number_of_hidden_layers': 1, 'dropout_rate': 0.4998998653222984, 'global_pooling': 'mean', 'learning_rate': 9.633835756169187e-05, 'weight_decay': 1.5514556641145032e-06, 'beta_0': 0.8493582405715527, 'beta_1': 0.9804340926348336, 'epsilon': 3.7805793169239493e-06, 'balanced_loss': False, 'epochs': 195, 'early_stopping_patience': 18, 'plateau_patience': 19, 'plateau_divider': 10}. Best is trial 2 with value: 0.9151515151515152.
[I 2025-03-07 18:57:12,465] Trial 144 finished with value: 0.8666666666666667 and parameters: {'left_stride': 32, 'right_stride': 64, 'attention_pooling_operation': 'mean', 'embedding_pooling_operation': 'max', 'threshold': 0.9949310046250868, 'batch_size': 24, 'attention_heads': 11, 'hidden_dimension': 178, 'number_of_hidden_layers': 1, 'dropout_rate': 0.4293663476850118, 'global_pooling': 'mean', 'learning_rate': 5.3281855883503e-05, 'weight_decay': 4.616774978689677e-06, 'beta_0': 0.8412337801662215, 'beta_1': 0.9800052630881876, 'epsilon': 7.783113282027321e-07, 'balanced_loss': False, 'epochs': 177, 'early_stopping_patience': 16, 'plateau_patience': 16, 'plateau_divider': 10}. Best is trial 2 with value: 0.9151515151515152.
[I 2025-03-07 19:13:22,025] Trial 145 finished with value: 0.8666666666666667 and parameters: {'left_stride': 64, 'right_stride': 64, 'attention_pooling_operation': 'mean', 'embedding_pooling_operation': 'max', 'threshold': 0.9977753338643813, 'batch_size': 21, 'attention_heads': 13, 'hidden_dimension': 98, 'number_of_hidden_layers': 1, 'dropout_rate': 0.41420012364922676, 'global_pooling': 'mean', 'learning_rate': 0.00012622731235600906, 'weight_decay': 1.9163469312732468e-06, 'beta_0': 0.8378225148050664, 'beta_1': 0.9815444103653862, 'epsilon': 5.918119775966815e-06, 'balanced_loss': False, 'epochs': 188, 'early_stopping_patience': 20, 'plateau_patience': 11, 'plateau_divider': 8}. Best is trial 2 with value: 0.9151515151515152.
CUDA out of memory. Tried to allocate 2.74 GiB. GPU 0 has a total capacity of 44.56 GiB of which 1.52 GiB is free. Including non-PyTorch memory, this process has 43.03 GiB memory in use. Of the allocated memory 39.81 GiB is allocated by PyTorch, and 2.08 GiB is reserved by PyTorch but unallocated. If reserved but unallocated memory is large try setting PYTORCH_CUDA_ALLOC_CONF=expandable_segments:True to avoid fragmentation.  See documentation for Memory Management  (https://pytorch.org/docs/stable/notes/cuda.html#environment-variables)
[I 2025-03-07 19:23:01,863] Trial 146 finished with value: -1.0 and parameters: {'left_stride': 32, 'right_stride': 128, 'attention_pooling_operation': 'max', 'embedding_pooling_operation': 'min', 'threshold': 0.9685724033364853, 'batch_size': 25, 'attention_heads': 12, 'hidden_dimension': 107, 'number_of_hidden_layers': 1, 'dropout_rate': 0.4746492416490146, 'global_pooling': 'mean', 'learning_rate': 0.0006129985360614959, 'weight_decay': 1.0128459325384421e-06, 'beta_0': 0.8729887590013802, 'beta_1': 0.980742430989033, 'epsilon': 2.9790774427723912e-06, 'balanced_loss': True, 'epochs': 137, 'early_stopping_patience': 17, 'plateau_patience': 21, 'plateau_divider': 9}. Best is trial 2 with value: 0.9151515151515152.
[I 2025-03-07 19:35:22,845] Trial 147 finished with value: 0.8909090909090909 and parameters: {'left_stride': 128, 'right_stride': 32, 'attention_pooling_operation': 'min', 'embedding_pooling_operation': 'mean', 'threshold': 0.9884932771070725, 'batch_size': 18, 'attention_heads': 5, 'hidden_dimension': 197, 'number_of_hidden_layers': 1, 'dropout_rate': 0.48278950203287957, 'global_pooling': 'mean', 'learning_rate': 8.012814357163699e-05, 'weight_decay': 1.2484104406188429e-06, 'beta_0': 0.8658557319645331, 'beta_1': 0.9812210162715639, 'epsilon': 7.073726735588287e-08, 'balanced_loss': False, 'epochs': 160, 'early_stopping_patience': 19, 'plateau_patience': 22, 'plateau_divider': 10}. Best is trial 2 with value: 0.9151515151515152.
[I 2025-03-07 19:50:47,055] Trial 148 finished with value: 0.9151515151515152 and parameters: {'left_stride': 32, 'right_stride': 64, 'attention_pooling_operation': 'mean', 'embedding_pooling_operation': 'max', 'threshold': 0.9751267174876239, 'batch_size': 22, 'attention_heads': 4, 'hidden_dimension': 110, 'number_of_hidden_layers': 0, 'dropout_rate': 0.4413073168854496, 'global_pooling': 'mean', 'learning_rate': 0.00025177286066300055, 'weight_decay': 1.5514988054180536e-06, 'beta_0': 0.8556897380805523, 'beta_1': 0.9819355239936022, 'epsilon': 1.60500194817527e-06, 'balanced_loss': True, 'epochs': 181, 'early_stopping_patience': 18, 'plateau_patience': 19, 'plateau_divider': 8}. Best is trial 2 with value: 0.9151515151515152.
[I 2025-03-07 20:05:27,429] Trial 149 finished with value: 0.8848484848484849 and parameters: {'left_stride': 32, 'right_stride': 64, 'attention_pooling_operation': 'mean', 'embedding_pooling_operation': 'max', 'threshold': 0.9751555627089785, 'batch_size': 23, 'attention_heads': 4, 'hidden_dimension': 52, 'number_of_hidden_layers': 0, 'dropout_rate': 0.43915573586697165, 'global_pooling': 'mean', 'learning_rate': 0.00024278786525770533, 'weight_decay': 1.7844934772187987e-06, 'beta_0': 0.8566246184548366, 'beta_1': 0.9820626666713806, 'epsilon': 1.523262862954057e-06, 'balanced_loss': True, 'epochs': 156, 'early_stopping_patience': 11, 'plateau_patience': 19, 'plateau_divider': 8}. Best is trial 2 with value: 0.9151515151515152.
[I 2025-03-07 20:16:40,341] Trial 150 finished with value: 0.8848484848484849 and parameters: {'left_stride': 128, 'right_stride': 32, 'attention_pooling_operation': 'min', 'embedding_pooling_operation': 'min', 'threshold': 0.9781617691259231, 'batch_size': 28, 'attention_heads': 4, 'hidden_dimension': 126, 'number_of_hidden_layers': 0, 'dropout_rate': 0.4483470579275694, 'global_pooling': 'mean', 'learning_rate': 0.00015768088380907944, 'weight_decay': 3.1027209381367754e-06, 'beta_0': 0.8524767999336955, 'beta_1': 0.9839347403473252, 'epsilon': 7.432478709932841e-06, 'balanced_loss': True, 'epochs': 147, 'early_stopping_patience': 13, 'plateau_patience': 23, 'plateau_divider': 8}. Best is trial 2 with value: 0.9151515151515152.
[I 2025-03-07 20:31:47,703] Trial 151 finished with value: 0.9212121212121213 and parameters: {'left_stride': 32, 'right_stride': 64, 'attention_pooling_operation': 'mean', 'embedding_pooling_operation': 'max', 'threshold': 0.970596909931319, 'batch_size': 20, 'attention_heads': 4, 'hidden_dimension': 112, 'number_of_hidden_layers': 0, 'dropout_rate': 0.4330865315081141, 'global_pooling': 'mean', 'learning_rate': 0.0004891426352173774, 'weight_decay': 1.6796305311646137e-06, 'beta_0': 0.8389882785170456, 'beta_1': 0.9803870041834656, 'epsilon': 4.453157613825011e-06, 'balanced_loss': True, 'epochs': 181, 'early_stopping_patience': 18, 'plateau_patience': 19, 'plateau_divider': 8}. Best is trial 151 with value: 0.9212121212121213.
[I 2025-03-07 20:46:53,230] Trial 152 finished with value: 0.9151515151515152 and parameters: {'left_stride': 32, 'right_stride': 64, 'attention_pooling_operation': 'mean', 'embedding_pooling_operation': 'max', 'threshold': 0.9708823057323959, 'batch_size': 20, 'attention_heads': 4, 'hidden_dimension': 110, 'number_of_hidden_layers': 0, 'dropout_rate': 0.593382964771605, 'global_pooling': 'mean', 'learning_rate': 0.0008362003400032291, 'weight_decay': 2.483523769993282e-06, 'beta_0': 0.8596869643127413, 'beta_1': 0.980854646780998, 'epsilon': 4.928825048118554e-06, 'balanced_loss': True, 'epochs': 180, 'early_stopping_patience': 18, 'plateau_patience': 17, 'plateau_divider': 8}. Best is trial 151 with value: 0.9212121212121213.
[I 2025-03-07 21:01:54,258] Trial 153 finished with value: 0.9151515151515152 and parameters: {'left_stride': 32, 'right_stride': 64, 'attention_pooling_operation': 'mean', 'embedding_pooling_operation': 'max', 'threshold': 0.9731124543047094, 'batch_size': 19, 'attention_heads': 4, 'hidden_dimension': 114, 'number_of_hidden_layers': 0, 'dropout_rate': 0.593945633964512, 'global_pooling': 'mean', 'learning_rate': 0.000757622429207439, 'weight_decay': 1.6140682742249212e-06, 'beta_0': 0.8614860846290446, 'beta_1': 0.9810016267697945, 'epsilon': 4.582103193780619e-06, 'balanced_loss': True, 'epochs': 180, 'early_stopping_patience': 18, 'plateau_patience': 17, 'plateau_divider': 8}. Best is trial 151 with value: 0.9212121212121213.
[I 2025-03-07 21:17:05,954] Trial 154 finished with value: 0.9151515151515152 and parameters: {'left_stride': 32, 'right_stride': 64, 'attention_pooling_operation': 'mean', 'embedding_pooling_operation': 'max', 'threshold': 0.9643804923142932, 'batch_size': 20, 'attention_heads': 4, 'hidden_dimension': 110, 'number_of_hidden_layers': 0, 'dropout_rate': 0.5919474067908369, 'global_pooling': 'mean', 'learning_rate': 0.0004867944161072562, 'weight_decay': 1.6511147031490209e-06, 'beta_0': 0.8610906015974101, 'beta_1': 0.981733094880743, 'epsilon': 4.59381142604653e-06, 'balanced_loss': True, 'epochs': 172, 'early_stopping_patience': 18, 'plateau_patience': 17, 'plateau_divider': 8}. Best is trial 151 with value: 0.9212121212121213.
[I 2025-03-07 21:32:22,634] Trial 155 finished with value: 0.9090909090909091 and parameters: {'left_stride': 32, 'right_stride': 64, 'attention_pooling_operation': 'mean', 'embedding_pooling_operation': 'max', 'threshold': 0.9645574980866427, 'batch_size': 20, 'attention_heads': 4, 'hidden_dimension': 112, 'number_of_hidden_layers': 0, 'dropout_rate': 0.5910518680365663, 'global_pooling': 'mean', 'learning_rate': 0.0007490093709359962, 'weight_decay': 1.6274464214405548e-06, 'beta_0': 0.861098694538278, 'beta_1': 0.9824512593077753, 'epsilon': 4.605830569121725e-06, 'balanced_loss': True, 'epochs': 180, 'early_stopping_patience': 17, 'plateau_patience': 17, 'plateau_divider': 8}. Best is trial 151 with value: 0.9212121212121213.
[I 2025-03-07 21:48:04,903] Trial 156 finished with value: 0.9090909090909091 and parameters: {'left_stride': 32, 'right_stride': 64, 'attention_pooling_operation': 'mean', 'embedding_pooling_operation': 'max', 'threshold': 0.9641344270549762, 'batch_size': 19, 'attention_heads': 4, 'hidden_dimension': 113, 'number_of_hidden_layers': 0, 'dropout_rate': 0.5915422326555264, 'global_pooling': 'mean', 'learning_rate': 0.00048674880028148513, 'weight_decay': 1.5372872878564772e-06, 'beta_0': 0.861711437845217, 'beta_1': 0.9818115398097769, 'epsilon': 4.6059245300902453e-07, 'balanced_loss': True, 'epochs': 170, 'early_stopping_patience': 16, 'plateau_patience': 17, 'plateau_divider': 8}. Best is trial 151 with value: 0.9212121212121213.
[I 2025-03-07 22:03:26,194] Trial 157 finished with value: 0.9151515151515152 and parameters: {'left_stride': 32, 'right_stride': 64, 'attention_pooling_operation': 'mean', 'embedding_pooling_operation': 'max', 'threshold': 0.9631900192390369, 'batch_size': 20, 'attention_heads': 4, 'hidden_dimension': 114, 'number_of_hidden_layers': 0, 'dropout_rate': 0.5922247433524047, 'global_pooling': 'mean', 'learning_rate': 0.0007859678596108963, 'weight_decay': 1.6252319174684414e-06, 'beta_0': 0.8612387395302366, 'beta_1': 0.9827905699279128, 'epsilon': 3.480048982217534e-07, 'balanced_loss': True, 'epochs': 170, 'early_stopping_patience': 16, 'plateau_patience': 17, 'plateau_divider': 8}. Best is trial 151 with value: 0.9212121212121213.
[I 2025-03-07 22:18:41,565] Trial 158 finished with value: 0.9151515151515152 and parameters: {'left_stride': 32, 'right_stride': 64, 'attention_pooling_operation': 'mean', 'embedding_pooling_operation': 'max', 'threshold': 0.9634663151192104, 'batch_size': 20, 'attention_heads': 4, 'hidden_dimension': 112, 'number_of_hidden_layers': 0, 'dropout_rate': 0.592474360350481, 'global_pooling': 'mean', 'learning_rate': 0.0005252517631272242, 'weight_decay': 1.5731206043376475e-06, 'beta_0': 0.8614838221141833, 'beta_1': 0.9829691018786867, 'epsilon': 4.3306764588098344e-07, 'balanced_loss': True, 'epochs': 171, 'early_stopping_patience': 16, 'plateau_patience': 17, 'plateau_divider': 8}. Best is trial 151 with value: 0.9212121212121213.
