[I 2025-03-06 18:17:20,567] Trial 43 finished with value: 0.896969696969697 and parameters: {'left_stride': 128, 'right_stride': 32, 'attention_pooling_operation': 'min', 'embedding_pooling_operation': 'min', 'threshold': 0.9536454033472388, 'batch_size': 29, 'attention_heads': 4, 'hidden_dimension': 97, 'number_of_hidden_layers': 1, 'dropout_rate': 0.5822333791562451, 'global_pooling': 'mean', 'learning_rate': 7.931170633239932e-05, 'weight_decay': 5.491984774962493e-06, 'beta_0': 0.8710538764570234, 'beta_1': 0.9809543911368027, 'epsilon': 1.752802927236431e-05, 'balanced_loss': True, 'epochs': 138, 'early_stopping_patience': 20, 'plateau_patience': 16, 'plateau_divider': 6}. Best is trial 2 with value: 0.9151515151515152.
[I 2025-03-06 18:32:36,535] Trial 44 finished with value: 0.896969696969697 and parameters: {'left_stride': 64, 'right_stride': 128, 'attention_pooling_operation': 'min', 'embedding_pooling_operation': 'min', 'threshold': 0.9797064060464754, 'batch_size': 41, 'attention_heads': 7, 'hidden_dimension': 72, 'number_of_hidden_layers': 4, 'dropout_rate': 0.5312057335444904, 'global_pooling': 'mean', 'learning_rate': 0.00023959845545826083, 'weight_decay': 2.0267530845806234e-05, 'beta_0': 0.8670792417999458, 'beta_1': 0.9838114495067591, 'epsilon': 9.844932093921968e-06, 'balanced_loss': True, 'epochs': 152, 'early_stopping_patience': 19, 'plateau_patience': 14, 'plateau_divider': 7}. Best is trial 2 with value: 0.9151515151515152.
CUDA out of memory. Tried to allocate 2.82 GiB. GPU 0 has a total capacity of 44.56 GiB of which 2.70 GiB is free. Including non-PyTorch memory, this process has 41.85 GiB memory in use. Of the allocated memory 39.40 GiB is allocated by PyTorch, and 1.31 GiB is reserved by PyTorch but unallocated. If reserved but unallocated memory is large try setting PYTORCH_CUDA_ALLOC_CONF=expandable_segments:True to avoid fragmentation.  See documentation for Memory Management  (https://pytorch.org/docs/stable/notes/cuda.html#environment-variables)
[I 2025-03-06 18:42:31,125] Trial 45 finished with value: -1.0 and parameters: {'left_stride': 128, 'right_stride': 64, 'attention_pooling_operation': 'max', 'embedding_pooling_operation': 'mean', 'threshold': 0.9450096532020695, 'batch_size': 38, 'attention_heads': 9, 'hidden_dimension': 54, 'number_of_hidden_layers': 0, 'dropout_rate': 0.47123468740579416, 'global_pooling': 'mean', 'learning_rate': 1.3008463357282214e-05, 'weight_decay': 1.0066450208514128e-06, 'beta_0': 0.8808378817283982, 'beta_1': 0.9801370519934355, 'epsilon': 1.159583294789355e-07, 'balanced_loss': False, 'epochs': 132, 'early_stopping_patience': 13, 'plateau_patience': 18, 'plateau_divider': 5}. Best is trial 2 with value: 0.9151515151515152.
CUDA out of memory. Tried to allocate 4.35 GiB. GPU 0 has a total capacity of 44.56 GiB of which 1.78 GiB is free. Including non-PyTorch memory, this process has 42.77 GiB memory in use. Of the allocated memory 39.54 GiB is allocated by PyTorch, and 2.08 GiB is reserved by PyTorch but unallocated. If reserved but unallocated memory is large try setting PYTORCH_CUDA_ALLOC_CONF=expandable_segments:True to avoid fragmentation.  See documentation for Memory Management  (https://pytorch.org/docs/stable/notes/cuda.html#environment-variables)
[I 2025-03-06 18:52:11,556] Trial 46 finished with value: -1.0 and parameters: {'left_stride': 32, 'right_stride': 128, 'attention_pooling_operation': 'min', 'embedding_pooling_operation': 'mean', 'threshold': 0.9254611393718987, 'batch_size': 34, 'attention_heads': 6, 'hidden_dimension': 105, 'number_of_hidden_layers': 1, 'dropout_rate': 0.39802476689663807, 'global_pooling': 'mean', 'learning_rate': 3.4925153102358965e-05, 'weight_decay': 3.033887978417856e-06, 'beta_0': 0.810580546308805, 'beta_1': 0.982816165915311, 'epsilon': 9.249253293569777e-07, 'balanced_loss': True, 'epochs': 184, 'early_stopping_patience': 15, 'plateau_patience': 23, 'plateau_divider': 8}. Best is trial 2 with value: 0.9151515151515152.
[I 2025-03-06 19:07:27,880] Trial 47 finished with value: 0.8848484848484849 and parameters: {'left_stride': 256, 'right_stride': 32, 'attention_pooling_operation': 'min', 'embedding_pooling_operation': 'max', 'threshold': 0.9729339863417203, 'batch_size': 24, 'attention_heads': 4, 'hidden_dimension': 206, 'number_of_hidden_layers': 2, 'dropout_rate': 0.4265157702836292, 'global_pooling': 'max', 'learning_rate': 0.00013517798938780486, 'weight_decay': 1.4752715165305703e-06, 'beta_0': 0.8020268254524269, 'beta_1': 0.9889884858993756, 'epsilon': 1.498862996493186e-06, 'balanced_loss': False, 'epochs': 101, 'early_stopping_patience': 14, 'plateau_patience': 13, 'plateau_divider': 4}. Best is trial 2 with value: 0.9151515151515152.
[I 2025-03-06 19:21:48,845] Trial 48 finished with value: 0.896969696969697 and parameters: {'left_stride': 64, 'right_stride': 0, 'attention_pooling_operation': 'mean', 'embedding_pooling_operation': 'mean', 'threshold': 0.9875601575672407, 'batch_size': 30, 'attention_heads': 5, 'hidden_dimension': 67, 'number_of_hidden_layers': 1, 'dropout_rate': 0.5159317026331071, 'global_pooling': 'mean', 'learning_rate': 0.0005655450835570314, 'weight_decay': 3.913160861297711e-06, 'beta_0': 0.835088514135606, 'beta_1': 0.9849553875099225, 'epsilon': 2.4512788337542828e-06, 'balanced_loss': False, 'epochs': 119, 'early_stopping_patience': 24, 'plateau_patience': 19, 'plateau_divider': 5}. Best is trial 2 with value: 0.9151515151515152.
[I 2025-03-06 19:33:19,127] Trial 49 finished with value: 0.8424242424242424 and parameters: {'left_stride': 0, 'right_stride': 256, 'attention_pooling_operation': 'max', 'embedding_pooling_operation': 'min', 'threshold': 0.9961002326772056, 'batch_size': 19, 'attention_heads': 7, 'hidden_dimension': 40, 'number_of_hidden_layers': 2, 'dropout_rate': 0.5421525803843548, 'global_pooling': 'mean', 'learning_rate': 2.943558511708327e-05, 'weight_decay': 1.9316746468033326e-06, 'beta_0': 0.8250422018170036, 'beta_1': 0.9817337546003165, 'epsilon': 6.4818265653822465e-06, 'balanced_loss': True, 'epochs': 65, 'early_stopping_patience': 18, 'plateau_patience': 12, 'plateau_divider': 7}. Best is trial 2 with value: 0.9151515151515152.
[I 2025-03-06 19:48:33,824] Trial 50 finished with value: 0.8666666666666667 and parameters: {'left_stride': 32, 'right_stride': 128, 'attention_pooling_operation': 'min', 'embedding_pooling_operation': 'mean', 'threshold': 0.9689687834405847, 'batch_size': 16, 'attention_heads': 6, 'hidden_dimension': 134, 'number_of_hidden_layers': 0, 'dropout_rate': 0.5668005290736137, 'global_pooling': 'sum', 'learning_rate': 0.00031947105068421745, 'weight_decay': 0.0008376028642850983, 'beta_0': 0.8181648012090333, 'beta_1': 0.9808542241538578, 'epsilon': 2.096250610248489e-08, 'balanced_loss': False, 'epochs': 112, 'early_stopping_patience': 17, 'plateau_patience': 17, 'plateau_divider': 8}. Best is trial 2 with value: 0.9151515151515152.
[I 2025-03-06 20:02:09,036] Trial 51 finished with value: 0.9030303030303031 and parameters: {'left_stride': 128, 'right_stride': 32, 'attention_pooling_operation': 'min', 'embedding_pooling_operation': 'min', 'threshold': 0.9565539552268985, 'batch_size': 28, 'attention_heads': 4, 'hidden_dimension': 98, 'number_of_hidden_layers': 1, 'dropout_rate': 0.5939093742427942, 'global_pooling': 'mean', 'learning_rate': 7.534108031176003e-05, 'weight_decay': 5.852116691033795e-06, 'beta_0': 0.8729562144740682, 'beta_1': 0.9809331758911679, 'epsilon': 2.035034270882147e-05, 'balanced_loss': True, 'epochs': 142, 'early_stopping_patience': 20, 'plateau_patience': 16, 'plateau_divider': 6}. Best is trial 2 with value: 0.9151515151515152.
[I 2025-03-06 20:15:41,267] Trial 52 finished with value: 0.8909090909090909 and parameters: {'left_stride': 128, 'right_stride': 32, 'attention_pooling_operation': 'min', 'embedding_pooling_operation': 'min', 'threshold': 0.9587528555098701, 'batch_size': 28, 'attention_heads': 4, 'hidden_dimension': 83, 'number_of_hidden_layers': 1, 'dropout_rate': 0.5994151685161212, 'global_pooling': 'mean', 'learning_rate': 6.731013032281872e-05, 'weight_decay': 6.061843430916418e-06, 'beta_0': 0.8883515273829461, 'beta_1': 0.9822909919660097, 'epsilon': 3.823247518960506e-06, 'balanced_loss': True, 'epochs': 144, 'early_stopping_patience': 20, 'plateau_patience': 16, 'plateau_divider': 7}. Best is trial 2 with value: 0.9151515151515152.
[I 2025-03-06 20:28:38,822] Trial 53 finished with value: 0.9030303030303031 and parameters: {'left_stride': 128, 'right_stride': 32, 'attention_pooling_operation': 'min', 'embedding_pooling_operation': 'min', 'threshold': 0.9668680186842522, 'batch_size': 23, 'attention_heads': 5, 'hidden_dimension': 107, 'number_of_hidden_layers': 1, 'dropout_rate': 0.5790269250709532, 'global_pooling': 'mean', 'learning_rate': 0.001470006078760481, 'weight_decay': 2.5203501801287674e-06, 'beta_0': 0.8758047798490383, 'beta_1': 0.9805860990645004, 'epsilon': 5.819436698413972e-05, 'balanced_loss': True, 'epochs': 158, 'early_stopping_patience': 21, 'plateau_patience': 14, 'plateau_divider': 6}. Best is trial 2 with value: 0.9151515151515152.
[I 2025-03-06 20:41:12,500] Trial 54 finished with value: 0.896969696969697 and parameters: {'left_stride': 128, 'right_stride': 32, 'attention_pooling_operation': 'min', 'embedding_pooling_operation': 'min', 'threshold': 0.9650497648509263, 'batch_size': 22, 'attention_heads': 4, 'hidden_dimension': 118, 'number_of_hidden_layers': 1, 'dropout_rate': 0.586818234296676, 'global_pooling': 'mean', 'learning_rate': 0.004935027492789222, 'weight_decay': 2.810387815551971e-06, 'beta_0': 0.8760995799070563, 'beta_1': 0.9805704886281235, 'epsilon': 6.127038417828185e-05, 'balanced_loss': True, 'epochs': 163, 'early_stopping_patience': 22, 'plateau_patience': 15, 'plateau_divider': 6}. Best is trial 2 with value: 0.9151515151515152.
[I 2025-03-06 20:53:36,190] Trial 55 finished with value: 0.8909090909090909 and parameters: {'left_stride': 128, 'right_stride': 32, 'attention_pooling_operation': 'min', 'embedding_pooling_operation': 'min', 'threshold': 0.9820831911643533, 'batch_size': 23, 'attention_heads': 10, 'hidden_dimension': 104, 'number_of_hidden_layers': 1, 'dropout_rate': 0.5896326908185548, 'global_pooling': 'mean', 'learning_rate': 0.0011091644871106506, 'weight_decay': 0.00018517868757974396, 'beta_0': 0.8932435593066012, 'beta_1': 0.9829008877433721, 'epsilon': 3.2673115902914745e-05, 'balanced_loss': True, 'epochs': 173, 'early_stopping_patience': 21, 'plateau_patience': 17, 'plateau_divider': 7}. Best is trial 2 with value: 0.9151515151515152.
CUDA out of memory. Tried to allocate 1.88 GiB. GPU 0 has a total capacity of 44.56 GiB of which 844.69 MiB is free. Including non-PyTorch memory, this process has 43.73 GiB memory in use. Of the allocated memory 41.13 GiB is allocated by PyTorch, and 1.45 GiB is reserved by PyTorch but unallocated. If reserved but unallocated memory is large try setting PYTORCH_CUDA_ALLOC_CONF=expandable_segments:True to avoid fragmentation.  See documentation for Memory Management  (https://pytorch.org/docs/stable/notes/cuda.html#environment-variables)
[I 2025-03-06 21:03:15,913] Trial 56 finished with value: -1.0 and parameters: {'left_stride': 128, 'right_stride': 32, 'attention_pooling_operation': 'min', 'embedding_pooling_operation': 'min', 'threshold': 0.9527300162433548, 'batch_size': 26, 'attention_heads': 5, 'hidden_dimension': 113, 'number_of_hidden_layers': 2, 'dropout_rate': 0.5625400739078009, 'global_pooling': 'mean', 'learning_rate': 0.0014032728412177627, 'weight_decay': 4.239566480019415e-06, 'beta_0': 0.8827654676992645, 'beta_1': 0.9815240488282321, 'epsilon': 4.874459448399081e-05, 'balanced_loss': True, 'epochs': 152, 'early_stopping_patience': 22, 'plateau_patience': 18, 'plateau_divider': 3}. Best is trial 2 with value: 0.9151515151515152.
CUDA out of memory. Tried to allocate 2.76 GiB. GPU 0 has a total capacity of 44.56 GiB of which 1.82 GiB is free. Including non-PyTorch memory, this process has 42.73 GiB memory in use. Of the allocated memory 39.37 GiB is allocated by PyTorch, and 2.22 GiB is reserved by PyTorch but unallocated. If reserved but unallocated memory is large try setting PYTORCH_CUDA_ALLOC_CONF=expandable_segments:True to avoid fragmentation.  See documentation for Memory Management  (https://pytorch.org/docs/stable/notes/cuda.html#environment-variables)
[I 2025-03-06 21:12:56,695] Trial 57 finished with value: -1.0 and parameters: {'left_stride': 128, 'right_stride': 32, 'attention_pooling_operation': 'min', 'embedding_pooling_operation': 'min', 'threshold': 0.9343670398096049, 'batch_size': 21, 'attention_heads': 6, 'hidden_dimension': 124, 'number_of_hidden_layers': 1, 'dropout_rate': 0.5748657076852621, 'global_pooling': 'mean', 'learning_rate': 0.0022012508201083615, 'weight_decay': 1.3488699312755875e-06, 'beta_0': 0.8875375543866588, 'beta_1': 0.9838338717198657, 'epsilon': 1.7345110325307915e-05, 'balanced_loss': False, 'epochs': 132, 'early_stopping_patience': 14, 'plateau_patience': 14, 'plateau_divider': 6}. Best is trial 2 with value: 0.9151515151515152.
CUDA out of memory. Tried to allocate 2.48 GiB. GPU 0 has a total capacity of 44.56 GiB of which 1.30 GiB is free. Including non-PyTorch memory, this process has 43.26 GiB memory in use. Of the allocated memory 38.62 GiB is allocated by PyTorch, and 3.49 GiB is reserved by PyTorch but unallocated. If reserved but unallocated memory is large try setting PYTORCH_CUDA_ALLOC_CONF=expandable_segments:True to avoid fragmentation.  See documentation for Memory Management  (https://pytorch.org/docs/stable/notes/cuda.html#environment-variables)
[I 2025-03-06 21:22:37,941] Trial 58 finished with value: -1.0 and parameters: {'left_stride': 128, 'right_stride': 32, 'attention_pooling_operation': 'min', 'embedding_pooling_operation': 'min', 'threshold': 0.9483761624399705, 'batch_size': 49, 'attention_heads': 4, 'hidden_dimension': 91, 'number_of_hidden_layers': 0, 'dropout_rate': 0.4495344573550543, 'global_pooling': 'max', 'learning_rate': 0.0007053398181264099, 'weight_decay': 9.732770460087315e-06, 'beta_0': 0.869036425542072, 'beta_1': 0.9825003941198965, 'epsilon': 7.548288574631336e-05, 'balanced_loss': True, 'epochs': 178, 'early_stopping_patience': 16, 'plateau_patience': 16, 'plateau_divider': 10}. Best is trial 2 with value: 0.9151515151515152.
CUDA out of memory. Tried to allocate 5.90 GiB. GPU 0 has a total capacity of 44.56 GiB of which 1.44 GiB is free. Including non-PyTorch memory, this process has 43.11 GiB memory in use. Of the allocated memory 39.51 GiB is allocated by PyTorch, and 2.45 GiB is reserved by PyTorch but unallocated. If reserved but unallocated memory is large try setting PYTORCH_CUDA_ALLOC_CONF=expandable_segments:True to avoid fragmentation.  See documentation for Memory Management  (https://pytorch.org/docs/stable/notes/cuda.html#environment-variables)
[I 2025-03-06 21:32:18,519] Trial 59 finished with value: -1.0 and parameters: {'left_stride': 128, 'right_stride': 32, 'attention_pooling_operation': 'min', 'embedding_pooling_operation': 'min', 'threshold': 0.9600923910585697, 'batch_size': 55, 'attention_heads': 7, 'hidden_dimension': 143, 'number_of_hidden_layers': 3, 'dropout_rate': 0.4795361274164854, 'global_pooling': 'mean', 'learning_rate': 0.00023334227017381945, 'weight_decay': 2.088823973308884e-05, 'beta_0': 0.8746005724003213, 'beta_1': 0.993138984599889, 'epsilon': 2.1998269843009186e-05, 'balanced_loss': True, 'epochs': 163, 'early_stopping_patience': 11, 'plateau_patience': 15, 'plateau_divider': 9}. Best is trial 2 with value: 0.9151515151515152.
[I 2025-03-06 21:49:26,153] Trial 60 finished with value: 0.9030303030303031 and parameters: {'left_stride': 32, 'right_stride': 64, 'attention_pooling_operation': 'mean', 'embedding_pooling_operation': 'max', 'threshold': 0.9675981722632452, 'batch_size': 18, 'attention_heads': 5, 'hidden_dimension': 154, 'number_of_hidden_layers': 1, 'dropout_rate': 0.3078022340859282, 'global_pooling': 'mean', 'learning_rate': 0.00012540873426783206, 'weight_decay': 7.0903724075898435e-06, 'beta_0': 0.879457327897308, 'beta_1': 0.9800366741078185, 'epsilon': 4.714667790657717e-06, 'balanced_loss': False, 'epochs': 190, 'early_stopping_patience': 19, 'plateau_patience': 20, 'plateau_divider': 8}. Best is trial 2 with value: 0.9151515151515152.
[I 2025-03-06 22:08:19,628] Trial 61 finished with value: 0.8909090909090909 and parameters: {'left_stride': 32, 'right_stride': 64, 'attention_pooling_operation': 'mean', 'embedding_pooling_operation': 'max', 'threshold': 0.9683680458421756, 'batch_size': 16, 'attention_heads': 5, 'hidden_dimension': 183, 'number_of_hidden_layers': 1, 'dropout_rate': 0.32152882526587767, 'global_pooling': 'mean', 'learning_rate': 5.57033453802642e-05, 'weight_decay': 6.837630841261589e-06, 'beta_0': 0.8796863517078894, 'beta_1': 0.980033957003972, 'epsilon': 1.101843350121322e-05, 'balanced_loss': False, 'epochs': 192, 'early_stopping_patience': 19, 'plateau_patience': 20, 'plateau_divider': 8}. Best is trial 2 with value: 0.9151515151515152.
[I 2025-03-06 22:28:05,968] Trial 62 finished with value: 0.9030303030303031 and parameters: {'left_stride': 32, 'right_stride': 64, 'attention_pooling_operation': 'mean', 'embedding_pooling_operation': 'max', 'threshold': 0.9749312095816282, 'batch_size': 18, 'attention_heads': 11, 'hidden_dimension': 152, 'number_of_hidden_layers': 1, 'dropout_rate': 0.37364552714791927, 'global_pooling': 'mean', 'learning_rate': 0.00012836891409538967, 'weight_decay': 5.084897590510362e-06, 'beta_0': 0.8608390891992657, 'beta_1': 0.9807642956280486, 'epsilon': 4.8215364654547686e-06, 'balanced_loss': False, 'epochs': 190, 'early_stopping_patience': 18, 'plateau_patience': 22, 'plateau_divider': 8}. Best is trial 2 with value: 0.9151515151515152.
CUDA out of memory. Tried to allocate 2.35 GiB. GPU 0 has a total capacity of 44.56 GiB of which 1.61 GiB is free. Including non-PyTorch memory, this process has 42.94 GiB memory in use. Of the allocated memory 40.16 GiB is allocated by PyTorch, and 1.63 GiB is reserved by PyTorch but unallocated. If reserved but unallocated memory is large try setting PYTORCH_CUDA_ALLOC_CONF=expandable_segments:True to avoid fragmentation.  See documentation for Memory Management  (https://pytorch.org/docs/stable/notes/cuda.html#environment-variables)
[I 2025-03-06 22:42:03,436] Trial 63 finished with value: -1.0 and parameters: {'left_stride': 32, 'right_stride': 64, 'attention_pooling_operation': 'mean', 'embedding_pooling_operation': 'max', 'threshold': 0.955881352557747, 'batch_size': 24, 'attention_heads': 5, 'hidden_dimension': 170, 'number_of_hidden_layers': 1, 'dropout_rate': 0.305733301515884, 'global_pooling': 'mean', 'learning_rate': 9.015011637156921e-05, 'weight_decay': 2.524396427470098e-06, 'beta_0': 0.8931308319520744, 'beta_1': 0.9818544993118618, 'epsilon': 7.82500760722759e-06, 'balanced_loss': False, 'epochs': 166, 'early_stopping_patience': 16, 'plateau_patience': 18, 'plateau_divider': 7}. Best is trial 2 with value: 0.9151515151515152.
CUDA out of memory. Tried to allocate 2.62 GiB. GPU 0 has a total capacity of 44.56 GiB of which 1.78 GiB is free. Including non-PyTorch memory, this process has 42.78 GiB memory in use. Of the allocated memory 39.58 GiB is allocated by PyTorch, and 2.05 GiB is reserved by PyTorch but unallocated. If reserved but unallocated memory is large try setting PYTORCH_CUDA_ALLOC_CONF=expandable_segments:True to avoid fragmentation.  See documentation for Memory Management  (https://pytorch.org/docs/stable/notes/cuda.html#environment-variables)
[I 2025-03-06 22:56:12,270] Trial 64 finished with value: -1.0 and parameters: {'left_stride': 32, 'right_stride': 64, 'attention_pooling_operation': 'mean', 'embedding_pooling_operation': 'max', 'threshold': 0.9634027410681998, 'batch_size': 19, 'attention_heads': 6, 'hidden_dimension': 219, 'number_of_hidden_layers': 1, 'dropout_rate': 0.3352362976716358, 'global_pooling': 'mean', 'learning_rate': 0.00016744939470526306, 'weight_decay': 1.2431077496804555e-05, 'beta_0': 0.8775904114500029, 'beta_1': 0.9813053721222201, 'epsilon': 4.3987571583048054e-05, 'balanced_loss': False, 'epochs': 157, 'early_stopping_patience': 21, 'plateau_patience': 21, 'plateau_divider': 9}. Best is trial 2 with value: 0.9151515151515152.
CUDA out of memory. Tried to allocate 1.09 GiB. GPU 0 has a total capacity of 44.56 GiB of which 934.69 MiB is free. Including non-PyTorch memory, this process has 43.64 GiB memory in use. Of the allocated memory 38.74 GiB is allocated by PyTorch, and 3.75 GiB is reserved by PyTorch but unallocated. If reserved but unallocated memory is large try setting PYTORCH_CUDA_ALLOC_CONF=expandable_segments:True to avoid fragmentation.  See documentation for Memory Management  (https://pytorch.org/docs/stable/notes/cuda.html#environment-variables)
