[I 2025-03-07 03:53:27,066] Trial 85 finished with value: -1.0 and parameters: {'left_stride': 64, 'right_stride': 0, 'attention_pooling_operation': 'mean', 'embedding_pooling_operation': 'max', 'threshold': 0.9664227432305882, 'batch_size': 17, 'attention_heads': 11, 'hidden_dimension': 167, 'number_of_hidden_layers': 1, 'dropout_rate': 0.36112055930901377, 'global_pooling': 'mean', 'learning_rate': 0.00020573258614436314, 'weight_decay': 3.055521115193917e-06, 'beta_0': 0.8328183262643669, 'beta_1': 0.9814930718836631, 'epsilon': 2.0345584492009157e-05, 'balanced_loss': False, 'epochs': 175, 'early_stopping_patience': 17, 'plateau_patience': 23, 'plateau_divider': 9}. Best is trial 2 with value: 0.9151515151515152.
CUDA out of memory. Tried to allocate 5.08 GiB. GPU 0 has a total capacity of 44.56 GiB of which 460.69 MiB is free. Including non-PyTorch memory, this process has 44.10 GiB memory in use. Of the allocated memory 40.98 GiB is allocated by PyTorch, and 1.98 GiB is reserved by PyTorch but unallocated. If reserved but unallocated memory is large try setting PYTORCH_CUDA_ALLOC_CONF=expandable_segments:True to avoid fragmentation.  See documentation for Memory Management  (https://pytorch.org/docs/stable/notes/cuda.html#environment-variables)
[I 2025-03-07 04:03:19,413] Trial 86 finished with value: -1.0 and parameters: {'left_stride': 128, 'right_stride': 64, 'attention_pooling_operation': 'min', 'embedding_pooling_operation': 'mean', 'threshold': 0.9623618432626404, 'batch_size': 20, 'attention_heads': 13, 'hidden_dimension': 185, 'number_of_hidden_layers': 2, 'dropout_rate': 0.4677769580386865, 'global_pooling': 'mean', 'learning_rate': 6.0466769887682855e-05, 'weight_decay': 3.576372648322882e-06, 'beta_0': 0.8504703069747022, 'beta_1': 0.981030402348091, 'epsilon': 1.5040744458568239e-06, 'balanced_loss': True, 'epochs': 194, 'early_stopping_patience': 20, 'plateau_patience': 17, 'plateau_divider': 7}. Best is trial 2 with value: 0.9151515151515152.
[I 2025-03-07 04:21:55,168] Trial 87 finished with value: 0.9030303030303031 and parameters: {'left_stride': 32, 'right_stride': 256, 'attention_pooling_operation': 'mean', 'embedding_pooling_operation': 'min', 'threshold': 0.9701706473038186, 'batch_size': 27, 'attention_heads': 5, 'hidden_dimension': 96, 'number_of_hidden_layers': 1, 'dropout_rate': 0.40712144901319075, 'global_pooling': 'mean', 'learning_rate': 0.00041172778760725803, 'weight_decay': 2.613439174195478e-06, 'beta_0': 0.8545055013843329, 'beta_1': 0.987347452429866, 'epsilon': 2.487901615875559e-06, 'balanced_loss': False, 'epochs': 135, 'early_stopping_patience': 19, 'plateau_patience': 22, 'plateau_divider': 8}. Best is trial 2 with value: 0.9151515151515152.
CUDA out of memory. Tried to allocate 4.54 GiB. GPU 0 has a total capacity of 44.56 GiB of which 2.17 GiB is free. Including non-PyTorch memory, this process has 42.38 GiB memory in use. Of the allocated memory 37.72 GiB is allocated by PyTorch, and 3.51 GiB is reserved by PyTorch but unallocated. If reserved but unallocated memory is large try setting PYTORCH_CUDA_ALLOC_CONF=expandable_segments:True to avoid fragmentation.  See documentation for Memory Management  (https://pytorch.org/docs/stable/notes/cuda.html#environment-variables)
[I 2025-03-07 04:32:35,869] Trial 88 finished with value: -1.0 and parameters: {'left_stride': 256, 'right_stride': 32, 'attention_pooling_operation': 'min', 'embedding_pooling_operation': 'mean', 'threshold': 0.9581049388403394, 'batch_size': 18, 'attention_heads': 10, 'hidden_dimension': 198, 'number_of_hidden_layers': 2, 'dropout_rate': 0.3731261774230147, 'global_pooling': 'mean', 'learning_rate': 0.0006370429636701739, 'weight_decay': 7.5756952896258145e-06, 'beta_0': 0.8704387846298376, 'beta_1': 0.981925043559396, 'epsilon': 2.8116091538412243e-05, 'balanced_loss': True, 'epochs': 115, 'early_stopping_patience': 23, 'plateau_patience': 10, 'plateau_divider': 7}. Best is trial 2 with value: 0.9151515151515152.
[I 2025-03-07 04:45:45,804] Trial 89 finished with value: 0.896969696969697 and parameters: {'left_stride': 64, 'right_stride': 128, 'attention_pooling_operation': 'min', 'embedding_pooling_operation': 'max', 'threshold': 0.9927071455946689, 'batch_size': 22, 'attention_heads': 12, 'hidden_dimension': 147, 'number_of_hidden_layers': 1, 'dropout_rate': 0.4199120844762035, 'global_pooling': 'mean', 'learning_rate': 8.575299206970224e-05, 'weight_decay': 0.000535141631020011, 'beta_0': 0.8614700203273966, 'beta_1': 0.981389856510323, 'epsilon': 5.792216589390179e-06, 'balanced_loss': True, 'epochs': 187, 'early_stopping_patience': 16, 'plateau_patience': 18, 'plateau_divider': 5}. Best is trial 2 with value: 0.9151515151515152.
[I 2025-03-07 04:58:42,754] Trial 90 finished with value: 0.8787878787878788 and parameters: {'left_stride': 128, 'right_stride': 64, 'attention_pooling_operation': 'min', 'embedding_pooling_operation': 'min', 'threshold': 0.9826745654719402, 'batch_size': 25, 'attention_heads': 6, 'hidden_dimension': 133, 'number_of_hidden_layers': 1, 'dropout_rate': 0.43579371439874587, 'global_pooling': 'max', 'learning_rate': 0.00012421189676986385, 'weight_decay': 1.6082519190699245e-05, 'beta_0': 0.8786754147793328, 'beta_1': 0.9824773316607013, 'epsilon': 9.784607092478511e-05, 'balanced_loss': False, 'epochs': 168, 'early_stopping_patience': 10, 'plateau_patience': 16, 'plateau_divider': 6}. Best is trial 2 with value: 0.9151515151515152.
[I 2025-03-07 05:17:31,025] Trial 91 finished with value: 0.9030303030303031 and parameters: {'left_stride': 32, 'right_stride': 64, 'attention_pooling_operation': 'mean', 'embedding_pooling_operation': 'max', 'threshold': 0.9872766112765601, 'batch_size': 21, 'attention_heads': 12, 'hidden_dimension': 189, 'number_of_hidden_layers': 1, 'dropout_rate': 0.42690799183979583, 'global_pooling': 'mean', 'learning_rate': 0.00011375478496329103, 'weight_decay': 1.267848206384299e-06, 'beta_0': 0.8429311533299946, 'beta_1': 0.9805378394734051, 'epsilon': 2.0809371776188596e-06, 'balanced_loss': False, 'epochs': 183, 'early_stopping_patience': 19, 'plateau_patience': 20, 'plateau_divider': 10}. Best is trial 2 with value: 0.9151515151515152.
[I 2025-03-07 05:39:05,241] Trial 92 finished with value: 0.9030303030303031 and parameters: {'left_stride': 32, 'right_stride': 64, 'attention_pooling_operation': 'mean', 'embedding_pooling_operation': 'max', 'threshold': 0.9795311550727841, 'batch_size': 21, 'attention_heads': 12, 'hidden_dimension': 153, 'number_of_hidden_layers': 1, 'dropout_rate': 0.4527133750467524, 'global_pooling': 'mean', 'learning_rate': 6.611290685542765e-05, 'weight_decay': 1.0722287839823812e-06, 'beta_0': 0.8493417467718373, 'beta_1': 0.9804078641282581, 'epsilon': 1.8957534995699885e-06, 'balanced_loss': False, 'epochs': 188, 'early_stopping_patience': 18, 'plateau_patience': 19, 'plateau_divider': 10}. Best is trial 2 with value: 0.9151515151515152.
[I 2025-03-07 06:00:24,820] Trial 93 finished with value: 0.9030303030303031 and parameters: {'left_stride': 32, 'right_stride': 64, 'attention_pooling_operation': 'mean', 'embedding_pooling_operation': 'max', 'threshold': 0.980637165000816, 'batch_size': 23, 'attention_heads': 11, 'hidden_dimension': 154, 'number_of_hidden_layers': 1, 'dropout_rate': 0.4601532384826902, 'global_pooling': 'mean', 'learning_rate': 8.08552733352838e-05, 'weight_decay': 1.8140498152849909e-06, 'beta_0': 0.8585718927179496, 'beta_1': 0.9809346239566541, 'epsilon': 3.579944979994836e-06, 'balanced_loss': False, 'epochs': 196, 'early_stopping_patience': 19, 'plateau_patience': 21, 'plateau_divider': 10}. Best is trial 2 with value: 0.9151515151515152.
[I 2025-03-07 06:20:46,930] Trial 94 finished with value: 0.8848484848484849 and parameters: {'left_stride': 32, 'right_stride': 64, 'attention_pooling_operation': 'mean', 'embedding_pooling_operation': 'max', 'threshold': 0.9904700820043133, 'batch_size': 20, 'attention_heads': 13, 'hidden_dimension': 157, 'number_of_hidden_layers': 1, 'dropout_rate': 0.43315886724817165, 'global_pooling': 'mean', 'learning_rate': 4.3065960546001335e-05, 'weight_decay': 1.5034273789511516e-06, 'beta_0': 0.8654545950701483, 'beta_1': 0.9804481063132542, 'epsilon': 7.14219970920136e-06, 'balanced_loss': False, 'epochs': 103, 'early_stopping_patience': 20, 'plateau_patience': 17, 'plateau_divider': 10}. Best is trial 2 with value: 0.9151515151515152.
[I 2025-03-07 06:37:10,869] Trial 95 finished with value: 0.896969696969697 and parameters: {'left_stride': 32, 'right_stride': 32, 'attention_pooling_operation': 'mean', 'embedding_pooling_operation': 'max', 'threshold': 0.975701168098987, 'batch_size': 44, 'attention_heads': 4, 'hidden_dimension': 174, 'number_of_hidden_layers': 1, 'dropout_rate': 0.4778408258817784, 'global_pooling': 'mean', 'learning_rate': 0.00015232126753600848, 'weight_decay': 2.1249144415758888e-06, 'beta_0': 0.8553349213024083, 'beta_1': 0.9821322904593911, 'epsilon': 2.647165180758897e-06, 'balanced_loss': False, 'epochs': 120, 'early_stopping_patience': 21, 'plateau_patience': 15, 'plateau_divider': 10}. Best is trial 2 with value: 0.9151515151515152.
[I 2025-03-07 06:57:08,497] Trial 96 finished with value: 0.896969696969697 and parameters: {'left_stride': 128, 'right_stride': 128, 'attention_pooling_operation': 'mean', 'embedding_pooling_operation': 'mean', 'threshold': 0.9645546799417605, 'batch_size': 24, 'attention_heads': 5, 'hidden_dimension': 140, 'number_of_hidden_layers': 1, 'dropout_rate': 0.34685992336215205, 'global_pooling': 'mean', 'learning_rate': 0.0002210933622416843, 'weight_decay': 1.226540137162789e-06, 'beta_0': 0.8517745274275085, 'beta_1': 0.9816112494765865, 'epsilon': 1.042372230497759e-05, 'balanced_loss': True, 'epochs': 187, 'early_stopping_patience': 17, 'plateau_patience': 20, 'plateau_divider': 9}. Best is trial 2 with value: 0.9151515151515152.
CUDA out of memory. Tried to allocate 1.54 GiB. GPU 0 has a total capacity of 44.56 GiB of which 1.32 GiB is free. Including non-PyTorch memory, this process has 43.23 GiB memory in use. Of the allocated memory 40.48 GiB is allocated by PyTorch, and 1.60 GiB is reserved by PyTorch but unallocated. If reserved but unallocated memory is large try setting PYTORCH_CUDA_ALLOC_CONF=expandable_segments:True to avoid fragmentation.  See documentation for Memory Management  (https://pytorch.org/docs/stable/notes/cuda.html#environment-variables)
[I 2025-03-07 07:06:29,875] Trial 97 finished with value: -1.0 and parameters: {'left_stride': 64, 'right_stride': 64, 'attention_pooling_operation': 'min', 'embedding_pooling_operation': 'min', 'threshold': 0.9697375749504503, 'batch_size': 29, 'attention_heads': 6, 'hidden_dimension': 113, 'number_of_hidden_layers': 4, 'dropout_rate': 0.5805424352561022, 'global_pooling': 'sum', 'learning_rate': 0.0001045659265039468, 'weight_decay': 2.9920999608878413e-06, 'beta_0': 0.8002237725870914, 'beta_1': 0.9803402470898699, 'epsilon': 1.3206902372741854e-06, 'balanced_loss': False, 'epochs': 156, 'early_stopping_patience': 18, 'plateau_patience': 11, 'plateau_divider': 6}. Best is trial 2 with value: 0.9151515151515152.
[I 2025-03-07 07:17:34,485] Trial 98 finished with value: 0.9151515151515152 and parameters: {'left_stride': 32, 'right_stride': 32, 'attention_pooling_operation': 'max', 'embedding_pooling_operation': 'mean', 'threshold': 0.9719056199769562, 'batch_size': 17, 'attention_heads': 14, 'hidden_dimension': 120, 'number_of_hidden_layers': 0, 'dropout_rate': 0.5112515126337142, 'global_pooling': 'mean', 'learning_rate': 0.0012641134953935557, 'weight_decay': 5.998536960896218e-06, 'beta_0': 0.8472798445478995, 'beta_1': 0.9809682389469813, 'epsilon': 5.308886288281619e-06, 'balanced_loss': True, 'epochs': 176, 'early_stopping_patience': 12, 'plateau_patience': 18, 'plateau_divider': 9}. Best is trial 2 with value: 0.9151515151515152.
[I 2025-03-07 07:27:48,935] Trial 99 finished with value: 0.8848484848484849 and parameters: {'left_stride': 0, 'right_stride': 32, 'attention_pooling_operation': 'max', 'embedding_pooling_operation': 'mean', 'threshold': 0.9672109681775798, 'batch_size': 16, 'attention_heads': 14, 'hidden_dimension': 101, 'number_of_hidden_layers': 0, 'dropout_rate': 0.509525892357154, 'global_pooling': 'mean', 'learning_rate': 0.0029836950205420092, 'weight_decay': 1.0956936745891567e-05, 'beta_0': 0.8743017782991642, 'beta_1': 0.981019608519529, 'epsilon': 3.946435867086979e-06, 'balanced_loss': True, 'epochs': 176, 'early_stopping_patience': 11, 'plateau_patience': 18, 'plateau_divider': 8}. Best is trial 2 with value: 0.9151515151515152.
[I 2025-03-07 07:38:39,312] Trial 100 finished with value: 0.896969696969697 and parameters: {'left_stride': 128, 'right_stride': 32, 'attention_pooling_operation': 'max', 'embedding_pooling_operation': 'mean', 'threshold': 0.9726810172246861, 'batch_size': 17, 'attention_heads': 7, 'hidden_dimension': 124, 'number_of_hidden_layers': 0, 'dropout_rate': 0.5945973382266834, 'global_pooling': 'mean', 'learning_rate': 0.004140288884502489, 'weight_decay': 6.35328767513973e-06, 'beta_0': 0.8811534464091096, 'beta_1': 0.9832098699377759, 'epsilon': 1.1911607995208804e-05, 'balanced_loss': True, 'epochs': 162, 'early_stopping_patience': 12, 'plateau_patience': 15, 'plateau_divider': 9}. Best is trial 2 with value: 0.9151515151515152.
[I 2025-03-07 07:49:22,273] Trial 101 finished with value: 0.8909090909090909 and parameters: {'left_stride': 32, 'right_stride': 32, 'attention_pooling_operation': 'max', 'embedding_pooling_operation': 'mean', 'threshold': 0.9766727845759394, 'batch_size': 18, 'attention_heads': 15, 'hidden_dimension': 115, 'number_of_hidden_layers': 0, 'dropout_rate': 0.5492637157778409, 'global_pooling': 'mean', 'learning_rate': 0.0017250161963761953, 'weight_decay': 4.278533337748024e-06, 'beta_0': 0.8373103401345136, 'beta_1': 0.9800272384931663, 'epsilon': 5.393934436213416e-06, 'balanced_loss': True, 'epochs': 182, 'early_stopping_patience': 13, 'plateau_patience': 16, 'plateau_divider': 10}. Best is trial 2 with value: 0.9151515151515152.
[I 2025-03-07 07:59:53,335] Trial 102 finished with value: 0.9030303030303031 and parameters: {'left_stride': 32, 'right_stride': 32, 'attention_pooling_operation': 'max', 'embedding_pooling_operation': 'mean', 'threshold': 0.981725573023217, 'batch_size': 19, 'attention_heads': 16, 'hidden_dimension': 131, 'number_of_hidden_layers': 0, 'dropout_rate': 0.4996846957931789, 'global_pooling': 'mean', 'learning_rate': 0.0013777103170924618, 'weight_decay': 5.057888007897796e-06, 'beta_0': 0.8482417605360637, 'beta_1': 0.9813202881033893, 'epsilon': 2.744673343569559e-06, 'balanced_loss': True, 'epochs': 190, 'early_stopping_patience': 12, 'plateau_patience': 20, 'plateau_divider': 9}. Best is trial 2 with value: 0.9151515151515152.
CUDA out of memory. Tried to allocate 2.53 GiB. GPU 0 has a total capacity of 44.56 GiB of which 974.69 MiB is free. Including non-PyTorch memory, this process has 43.60 GiB memory in use. Of the allocated memory 41.11 GiB is allocated by PyTorch, and 1.34 GiB is reserved by PyTorch but unallocated. If reserved but unallocated memory is large try setting PYTORCH_CUDA_ALLOC_CONF=expandable_segments:True to avoid fragmentation.  See documentation for Memory Management  (https://pytorch.org/docs/stable/notes/cuda.html#environment-variables)
[I 2025-03-07 08:09:30,449] Trial 103 finished with value: -1.0 and parameters: {'left_stride': 32, 'right_stride': 128, 'attention_pooling_operation': 'max', 'embedding_pooling_operation': 'mean', 'threshold': 0.9685498642361593, 'batch_size': 36, 'attention_heads': 5, 'hidden_dimension': 164, 'number_of_hidden_layers': 3, 'dropout_rate': 0.48548820578245466, 'global_pooling': 'mean', 'learning_rate': 0.0022526426767929797, 'weight_decay': 3.904091048996248e-06, 'beta_0': 0.8465508356395312, 'beta_1': 0.9807367584847809, 'epsilon': 1.747407236031461e-06, 'balanced_loss': True, 'epochs': 194, 'early_stopping_patience': 11, 'plateau_patience': 19, 'plateau_divider': 9}. Best is trial 2 with value: 0.9151515151515152.
[I 2025-03-07 08:20:25,098] Trial 104 finished with value: 0.896969696969697 and parameters: {'left_stride': 32, 'right_stride': 32, 'attention_pooling_operation': 'min', 'embedding_pooling_operation': 'max', 'threshold': 0.9856523756476409, 'batch_size': 21, 'attention_heads': 13, 'hidden_dimension': 105, 'number_of_hidden_layers': 1, 'dropout_rate': 0.5656116300387334, 'global_pooling': 'mean', 'learning_rate': 0.000897726781615966, 'weight_decay': 2.362754958272117e-06, 'beta_0': 0.8405885407183262, 'beta_1': 0.9819093608493996, 'epsilon': 3.318289470285642e-06, 'balanced_loss': True, 'epochs': 150, 'early_stopping_patience': 15, 'plateau_patience': 22, 'plateau_divider': 8}. Best is trial 2 with value: 0.9151515151515152.
CUDA out of memory. Tried to allocate 5.20 GiB. GPU 0 has a total capacity of 44.56 GiB of which 1.56 GiB is free. Including non-PyTorch memory, this process has 42.99 GiB memory in use. Of the allocated memory 40.39 GiB is allocated by PyTorch, and 1.46 GiB is reserved by PyTorch but unallocated. If reserved but unallocated memory is large try setting PYTORCH_CUDA_ALLOC_CONF=expandable_segments:True to avoid fragmentation.  See documentation for Memory Management  (https://pytorch.org/docs/stable/notes/cuda.html#environment-variables)
[I 2025-03-07 08:29:31,243] Trial 105 finished with value: -1.0 and parameters: {'left_stride': 32, 'right_stride': 64, 'attention_pooling_operation': 'min', 'embedding_pooling_operation': 'min', 'threshold': 0.9608565606408066, 'batch_size': 26, 'attention_heads': 14, 'hidden_dimension': 146, 'number_of_hidden_layers': 2, 'dropout_rate': 0.40427845022489584, 'global_pooling': 'mean', 'learning_rate': 7.144725571725567e-05, 'weight_decay': 8.350628672960329e-06, 'beta_0': 0.8761287224724197, 'beta_1': 0.9808503709879102, 'epsilon': 4.692680873566757e-06, 'balanced_loss': False, 'epochs': 186, 'early_stopping_patience': 20, 'plateau_patience': 17, 'plateau_divider': 10}. Best is trial 2 with value: 0.9151515151515152.
[I 2025-03-07 08:53:37,824] Trial 106 finished with value: 0.8727272727272727 and parameters: {'left_stride': 64, 'right_stride': 0, 'attention_pooling_operation': 'mean', 'embedding_pooling_operation': 'mean', 'threshold': 0.9733087531114545, 'batch_size': 22, 'attention_heads': 12, 'hidden_dimension': 121, 'number_of_hidden_layers': 1, 'dropout_rate': 0.41486780181922317, 'global_pooling': 'mean', 'learning_rate': 3.0024915102378293e-05, 'weight_decay': 5.62497876820694e-06, 'beta_0': 0.8206997013333184, 'beta_1': 0.9803622484247999, 'epsilon': 1.8861926653930748e-05, 'balanced_loss': True, 'epochs': 111, 'early_stopping_patience': 19, 'plateau_patience': 16, 'plateau_divider': 9}. Best is trial 2 with value: 0.9151515151515152.
CUDA out of memory. Tried to allocate 7.10 GiB. GPU 0 has a total capacity of 44.56 GiB of which 2.02 GiB is free. Including non-PyTorch memory, this process has 42.54 GiB memory in use. Of the allocated memory 39.44 GiB is allocated by PyTorch, and 1.95 GiB is reserved by PyTorch but unallocated. If reserved but unallocated memory is large try setting PYTORCH_CUDA_ALLOC_CONF=expandable_segments:True to avoid fragmentation.  See documentation for Memory Management  (https://pytorch.org/docs/stable/notes/cuda.html#environment-variables)
[I 2025-03-07 09:04:17,799] Trial 107 finished with value: -1.0 and parameters: {'left_stride': 32, 'right_stride': 256, 'attention_pooling_operation': 'min', 'embedding_pooling_operation': 'max', 'threshold': 0.9558611562384153, 'batch_size': 17, 'attention_heads': 15, 'hidden_dimension': 205, 'number_of_hidden_layers': 1, 'dropout_rate': 0.5130332316969488, 'global_pooling': 'mean', 'learning_rate': 0.001116868957627789, 'weight_decay': 3.2077038401538413e-06, 'beta_0': 0.8730507998855965, 'beta_1': 0.9822907895432527, 'epsilon': 8.591044235897615e-06, 'balanced_loss': True, 'epochs': 143, 'early_stopping_patience': 14, 'plateau_patience': 21, 'plateau_divider': 8}. Best is trial 2 with value: 0.9151515151515152.
[I 2025-03-07 09:14:49,115] Trial 108 finished with value: 0.8787878787878788 and parameters: {'left_stride': 128, 'right_stride': 32, 'attention_pooling_operation': 'min', 'embedding_pooling_operation': 'min', 'threshold': 0.978740187136926, 'batch_size': 41, 'attention_heads': 4, 'hidden_dimension': 109, 'number_of_hidden_layers': 0, 'dropout_rate': 0.5250489136318383, 'global_pooling': 'mean', 'learning_rate': 0.0005310067030251245, 'weight_decay': 2.692928736037193e-06, 'beta_0': 0.8844552996645109, 'beta_1': 0.9816083921612617, 'epsilon': 1.5026846085632628e-05, 'balanced_loss': False, 'epochs': 167, 'early_stopping_patience': 18, 'plateau_patience': 18, 'plateau_divider': 6}. Best is trial 2 with value: 0.9151515151515152.
CUDA out of memory. Tried to allocate 4.95 GiB. GPU 0 has a total capacity of 44.56 GiB of which 524.69 MiB is free. Including non-PyTorch memory, this process has 44.04 GiB memory in use. Of the allocated memory 41.26 GiB is allocated by PyTorch, and 1.64 GiB is reserved by PyTorch but unallocated. If reserved but unallocated memory is large try setting PYTORCH_CUDA_ALLOC_CONF=expandable_segments:True to avoid fragmentation.  See documentation for Memory Management  (https://pytorch.org/docs/stable/notes/cuda.html#environment-variables)
