[I 2025-03-03 16:02:40,459] Trial 307 finished with value: 0.5699278875596712 and parameters: {'left_stride': 64, 'right_stride': 256, 'attention_pooling_operation': 'max', 'embedding_pooling_operation': 'mean', 'threshold': 0.9856355144781397, 'batch_size': 50, 'attention_heads': 10, 'hidden_dimension': 152, 'number_of_hidden_layers': 1, 'dropout_rate': 0.4291467574604735, 'global_pooling': 'max', 'learning_rate': 0.000750469908834167, 'weight_decay': 0.0005902540608042287, 'beta_0': 0.8246830607874381, 'beta_1': 0.9891629350742555, 'epsilon': 1.0373800068295728e-06, 'balanced_loss': False, 'epochs': 166, 'early_stopping_patience': 19, 'plateau_patience': 15, 'plateau_divider': 2}. Best is trial 287 with value: 0.6249865640230626.
[I 2025-03-03 16:23:32,147] Trial 308 finished with value: 0.6019523597925646 and parameters: {'left_stride': 64, 'right_stride': 0, 'attention_pooling_operation': 'max', 'embedding_pooling_operation': 'mean', 'threshold': 0.9792885374898121, 'batch_size': 52, 'attention_heads': 11, 'hidden_dimension': 142, 'number_of_hidden_layers': 1, 'dropout_rate': 0.4137216570558319, 'global_pooling': 'max', 'learning_rate': 0.0007070404812909537, 'weight_decay': 4.825373761358146e-06, 'beta_0': 0.8262419688140371, 'beta_1': 0.988635180927533, 'epsilon': 2.8775828075876793e-06, 'balanced_loss': False, 'epochs': 171, 'early_stopping_patience': 16, 'plateau_patience': 14, 'plateau_divider': 3}. Best is trial 287 with value: 0.6249865640230626.
[I 2025-03-03 16:45:31,491] Trial 309 finished with value: 0.5919092377508085 and parameters: {'left_stride': 64, 'right_stride': 0, 'attention_pooling_operation': 'max', 'embedding_pooling_operation': 'mean', 'threshold': 0.9794229963236356, 'batch_size': 52, 'attention_heads': 11, 'hidden_dimension': 137, 'number_of_hidden_layers': 1, 'dropout_rate': 0.4171189570550518, 'global_pooling': 'max', 'learning_rate': 0.0006658486048019975, 'weight_decay': 1.5401366337196427e-06, 'beta_0': 0.8254279530795913, 'beta_1': 0.9884208123018055, 'epsilon': 3.026618089801437e-06, 'balanced_loss': False, 'epochs': 171, 'early_stopping_patience': 17, 'plateau_patience': 14, 'plateau_divider': 3}. Best is trial 287 with value: 0.6249865640230626.
[I 2025-03-03 17:05:14,473] Trial 310 finished with value: 0.5794922670048331 and parameters: {'left_stride': 64, 'right_stride': 0, 'attention_pooling_operation': 'max', 'embedding_pooling_operation': 'mean', 'threshold': 0.9827000010544454, 'batch_size': 50, 'attention_heads': 11, 'hidden_dimension': 143, 'number_of_hidden_layers': 1, 'dropout_rate': 0.41442226601257603, 'global_pooling': 'max', 'learning_rate': 0.0009070360795342281, 'weight_decay': 1.000359702201953e-06, 'beta_0': 0.823811652403606, 'beta_1': 0.9885974596510958, 'epsilon': 2.8150268401604586e-06, 'balanced_loss': False, 'epochs': 164, 'early_stopping_patience': 16, 'plateau_patience': 14, 'plateau_divider': 3}. Best is trial 287 with value: 0.6249865640230626.
[I 2025-03-03 17:26:01,494] Trial 311 finished with value: 0.5831097279290866 and parameters: {'left_stride': 64, 'right_stride': 0, 'attention_pooling_operation': 'max', 'embedding_pooling_operation': 'mean', 'threshold': 0.9784216403988718, 'batch_size': 47, 'attention_heads': 12, 'hidden_dimension': 135, 'number_of_hidden_layers': 1, 'dropout_rate': 0.4215523008639305, 'global_pooling': 'max', 'learning_rate': 0.0007348295947694273, 'weight_decay': 0.0009079099309842545, 'beta_0': 0.8234796849528665, 'beta_1': 0.9878208635632763, 'epsilon': 4.589948408255589e-06, 'balanced_loss': False, 'epochs': 161, 'early_stopping_patience': 16, 'plateau_patience': 14, 'plateau_divider': 3}. Best is trial 287 with value: 0.6249865640230626.
[I 2025-03-03 17:50:11,412] Trial 312 finished with value: 0.5904637460570737 and parameters: {'left_stride': 64, 'right_stride': 0, 'attention_pooling_operation': 'max', 'embedding_pooling_operation': 'min', 'threshold': 0.9669169428890106, 'batch_size': 53, 'attention_heads': 11, 'hidden_dimension': 130, 'number_of_hidden_layers': 2, 'dropout_rate': 0.40969954189286706, 'global_pooling': 'max', 'learning_rate': 0.0004480672974026651, 'weight_decay': 3.691607728533166e-06, 'beta_0': 0.8263666139210001, 'beta_1': 0.9844765055138394, 'epsilon': 3.660766501959448e-06, 'balanced_loss': False, 'epochs': 168, 'early_stopping_patience': 16, 'plateau_patience': 14, 'plateau_divider': 3}. Best is trial 287 with value: 0.6249865640230626.
[I 2025-03-03 18:11:31,662] Trial 313 finished with value: 0.5884548889909798 and parameters: {'left_stride': 64, 'right_stride': 0, 'attention_pooling_operation': 'max', 'embedding_pooling_operation': 'mean', 'threshold': 0.974140882658204, 'batch_size': 44, 'attention_heads': 11, 'hidden_dimension': 120, 'number_of_hidden_layers': 1, 'dropout_rate': 0.41070699411614225, 'global_pooling': 'max', 'learning_rate': 0.000356998841952954, 'weight_decay': 7.094884476404585e-06, 'beta_0': 0.8272398014324133, 'beta_1': 0.9862350936160291, 'epsilon': 2.321787780772666e-06, 'balanced_loss': False, 'epochs': 171, 'early_stopping_patience': 18, 'plateau_patience': 14, 'plateau_divider': 3}. Best is trial 287 with value: 0.6249865640230626.
[I 2025-03-03 18:33:50,518] Trial 314 finished with value: 0.5661523928590172 and parameters: {'left_stride': 64, 'right_stride': 256, 'attention_pooling_operation': 'min', 'embedding_pooling_operation': 'mean', 'threshold': 0.9705686044048638, 'batch_size': 51, 'attention_heads': 12, 'hidden_dimension': 149, 'number_of_hidden_layers': 1, 'dropout_rate': 0.42513039672155567, 'global_pooling': 'max', 'learning_rate': 0.0009937589475010919, 'weight_decay': 1.1037468498710864e-05, 'beta_0': 0.8670792417999458, 'beta_1': 0.9888535676350158, 'epsilon': 3.368919340106602e-06, 'balanced_loss': False, 'epochs': 173, 'early_stopping_patience': 18, 'plateau_patience': 14, 'plateau_divider': 4}. Best is trial 287 with value: 0.6249865640230626.
[I 2025-03-03 18:53:47,411] Trial 315 finished with value: 0.5261758398147875 and parameters: {'left_stride': 64, 'right_stride': 256, 'attention_pooling_operation': 'max', 'embedding_pooling_operation': 'mean', 'threshold': 0.9852259689290331, 'batch_size': 48, 'attention_heads': 10, 'hidden_dimension': 133, 'number_of_hidden_layers': 1, 'dropout_rate': 0.40526820756825704, 'global_pooling': 'mean', 'learning_rate': 0.0006041490097006485, 'weight_decay': 4.768969728318131e-06, 'beta_0': 0.8439653798120478, 'beta_1': 0.9881620554874879, 'epsilon': 7.406173935441029e-07, 'balanced_loss': False, 'epochs': 167, 'early_stopping_patience': 20, 'plateau_patience': 14, 'plateau_divider': 3}. Best is trial 287 with value: 0.6249865640230626.
[I 2025-03-03 19:17:25,998] Trial 316 finished with value: 0.589424534044341 and parameters: {'left_stride': 64, 'right_stride': 256, 'attention_pooling_operation': 'max', 'embedding_pooling_operation': 'mean', 'threshold': 0.9567620569105955, 'batch_size': 46, 'attention_heads': 10, 'hidden_dimension': 139, 'number_of_hidden_layers': 1, 'dropout_rate': 0.41684629066284223, 'global_pooling': 'max', 'learning_rate': 0.0005237577596403927, 'weight_decay': 0.0006711227392495835, 'beta_0': 0.842254177050771, 'beta_1': 0.9818877383985862, 'epsilon': 2.899735325058452e-06, 'balanced_loss': False, 'epochs': 159, 'early_stopping_patience': 20, 'plateau_patience': 14, 'plateau_divider': 4}. Best is trial 287 with value: 0.6249865640230626.
[I 2025-03-03 19:37:47,928] Trial 317 finished with value: 0.6150030274704557 and parameters: {'left_stride': 64, 'right_stride': 64, 'attention_pooling_operation': 'max', 'embedding_pooling_operation': 'mean', 'threshold': 0.9774338901366472, 'batch_size': 49, 'attention_heads': 11, 'hidden_dimension': 132, 'number_of_hidden_layers': 1, 'dropout_rate': 0.41234697362362815, 'global_pooling': 'max', 'learning_rate': 0.0007649751883098838, 'weight_decay': 0.0001801347336502886, 'beta_0': 0.8250181108303476, 'beta_1': 0.9891391665158157, 'epsilon': 1.9946129805609543e-06, 'balanced_loss': False, 'epochs': 171, 'early_stopping_patience': 18, 'plateau_patience': 15, 'plateau_divider': 2}. Best is trial 287 with value: 0.6249865640230626.
[I 2025-03-03 19:58:11,055] Trial 318 finished with value: 0.57494121549759 and parameters: {'left_stride': 64, 'right_stride': 64, 'attention_pooling_operation': 'max', 'embedding_pooling_operation': 'mean', 'threshold': 0.9802579693397812, 'batch_size': 49, 'attention_heads': 11, 'hidden_dimension': 141, 'number_of_hidden_layers': 1, 'dropout_rate': 0.4136275265657932, 'global_pooling': 'max', 'learning_rate': 0.0008159887463566473, 'weight_decay': 0.00021186638377615783, 'beta_0': 0.8212558777864012, 'beta_1': 0.9897862670398749, 'epsilon': 2.07303443593643e-06, 'balanced_loss': False, 'epochs': 170, 'early_stopping_patience': 18, 'plateau_patience': 15, 'plateau_divider': 2}. Best is trial 287 with value: 0.6249865640230626.
[I 2025-03-03 20:18:25,541] Trial 319 finished with value: 0.5773234046785626 and parameters: {'left_stride': 64, 'right_stride': 64, 'attention_pooling_operation': 'max', 'embedding_pooling_operation': 'mean', 'threshold': 0.9756677100925328, 'batch_size': 43, 'attention_heads': 11, 'hidden_dimension': 131, 'number_of_hidden_layers': 1, 'dropout_rate': 0.432378467071541, 'global_pooling': 'max', 'learning_rate': 0.0009632798041595194, 'weight_decay': 0.00016857297645275876, 'beta_0': 0.8235347095480707, 'beta_1': 0.9892820609282703, 'epsilon': 1.5842273576339602e-06, 'balanced_loss': False, 'epochs': 165, 'early_stopping_patience': 17, 'plateau_patience': 15, 'plateau_divider': 2}. Best is trial 287 with value: 0.6249865640230626.
CUDA out of memory. Tried to allocate 120.00 MiB. GPU 0 has a total capacity of 44.56 GiB of which 28.69 MiB is free. Including non-PyTorch memory, this process has 44.53 GiB memory in use. Of the allocated memory 42.75 GiB is allocated by PyTorch, and 641.13 MiB is reserved by PyTorch but unallocated. If reserved but unallocated memory is large try setting PYTORCH_CUDA_ALLOC_CONF=expandable_segments:True to avoid fragmentation.  See documentation for Memory Management  (https://pytorch.org/docs/stable/notes/cuda.html#environment-variables)
[I 2025-03-03 20:29:20,333] Trial 320 finished with value: -1.0 and parameters: {'left_stride': 64, 'right_stride': 0, 'attention_pooling_operation': 'max', 'embedding_pooling_operation': 'mean', 'threshold': 0.8524577705593, 'batch_size': 46, 'attention_heads': 11, 'hidden_dimension': 124, 'number_of_hidden_layers': 1, 'dropout_rate': 0.4220128111928286, 'global_pooling': 'max', 'learning_rate': 0.0006538604351186076, 'weight_decay': 1.5884086241931572e-06, 'beta_0': 0.8373354066761275, 'beta_1': 0.9891284035069209, 'epsilon': 3.1071594771438576e-05, 'balanced_loss': False, 'epochs': 173, 'early_stopping_patience': 18, 'plateau_patience': 14, 'plateau_divider': 2}. Best is trial 287 with value: 0.6249865640230626.
[I 2025-03-03 20:49:23,659] Trial 321 finished with value: 0.5763432843543737 and parameters: {'left_stride': 64, 'right_stride': 64, 'attention_pooling_operation': 'max', 'embedding_pooling_operation': 'mean', 'threshold': 0.9871340267488905, 'batch_size': 53, 'attention_heads': 11, 'hidden_dimension': 156, 'number_of_hidden_layers': 1, 'dropout_rate': 0.4081626178396254, 'global_pooling': 'max', 'learning_rate': 0.0004831907549119069, 'weight_decay': 0.0007943514345891264, 'beta_0': 0.8251102011790434, 'beta_1': 0.9899470008218716, 'epsilon': 6.601056298835212e-06, 'balanced_loss': False, 'epochs': 169, 'early_stopping_patience': 17, 'plateau_patience': 14, 'plateau_divider': 2}. Best is trial 287 with value: 0.6249865640230626.
CUDA out of memory. Tried to allocate 124.00 MiB. GPU 0 has a total capacity of 44.56 GiB of which 82.69 MiB is free. Including non-PyTorch memory, this process has 44.47 GiB memory in use. Of the allocated memory 42.56 GiB is allocated by PyTorch, and 780.56 MiB is reserved by PyTorch but unallocated. If reserved but unallocated memory is large try setting PYTORCH_CUDA_ALLOC_CONF=expandable_segments:True to avoid fragmentation.  See documentation for Memory Management  (https://pytorch.org/docs/stable/notes/cuda.html#environment-variables)
[I 2025-03-03 21:02:16,607] Trial 322 finished with value: -1.0 and parameters: {'left_stride': 64, 'right_stride': 64, 'attention_pooling_operation': 'max', 'embedding_pooling_operation': 'mean', 'threshold': 0.8789491553413296, 'batch_size': 48, 'attention_heads': 10, 'hidden_dimension': 145, 'number_of_hidden_layers': 1, 'dropout_rate': 0.4193278973708871, 'global_pooling': 'max', 'learning_rate': 0.0010740417790527472, 'weight_decay': 0.0002337810733494445, 'beta_0': 0.8282756069611392, 'beta_1': 0.989483989637742, 'epsilon': 6.437210861875157e-07, 'balanced_loss': False, 'epochs': 173, 'early_stopping_patience': 15, 'plateau_patience': 15, 'plateau_divider': 3}. Best is trial 287 with value: 0.6249865640230626.
[I 2025-03-03 21:22:25,069] Trial 323 finished with value: 0.5757738214943818 and parameters: {'left_stride': 64, 'right_stride': 64, 'attention_pooling_operation': 'max', 'embedding_pooling_operation': 'mean', 'threshold': 0.9831100258548708, 'batch_size': 45, 'attention_heads': 11, 'hidden_dimension': 133, 'number_of_hidden_layers': 1, 'dropout_rate': 0.4123591001654664, 'global_pooling': 'max', 'learning_rate': 0.0007632562453440794, 'weight_decay': 0.0003236575102974189, 'beta_0': 0.8405106308100033, 'beta_1': 0.9886220149585554, 'epsilon': 1.8780383454887517e-06, 'balanced_loss': False, 'epochs': 166, 'early_stopping_patience': 18, 'plateau_patience': 15, 'plateau_divider': 3}. Best is trial 287 with value: 0.6249865640230626.
slurmstepd: error: *** JOB 15079946 ON gpu041 CANCELLED AT 2025-03-03T21:34:59 DUE TO TIME LIMIT ***
