[I 2025-02-23 16:09:42,522] Trial 287 finished with value: 0.6248293852930329 and parameters: {'left_stride': 128, 'right_stride': 64, 'attention_pooling_operation': 'mean', 'embedding_pooling_operation': 'max', 'threshold': 0.9219160099338084, 'batch_size': 63, 'attention_heads': 15, 'hidden_dimension': 69, 'number_of_hidden_layers': 1, 'dropout_rate': 0.44831386101585036, 'global_pooling': 'max', 'learning_rate': 0.0005456477321268498, 'weight_decay': 0.0008815270713988383, 'beta_0': 0.8124455514417073, 'beta_1': 0.9872748592468246, 'epsilon': 4.809506825499022e-08, 'balanced_loss': False, 'epochs': 53, 'early_stopping_patience': 21, 'plateau_patience': 11, 'plateau_divider': 10}. Best is trial 222 with value: 0.6575405977059186.
[I 2025-02-23 16:29:27,641] Trial 288 finished with value: 0.5990172862769416 and parameters: {'left_stride': 128, 'right_stride': 64, 'attention_pooling_operation': 'max', 'embedding_pooling_operation': 'max', 'threshold': 0.9156180891190349, 'batch_size': 69, 'attention_heads': 16, 'hidden_dimension': 77, 'number_of_hidden_layers': 1, 'dropout_rate': 0.44088048010748376, 'global_pooling': 'max', 'learning_rate': 0.001148140700404823, 'weight_decay': 0.0005925849154036812, 'beta_0': 0.881186755868909, 'beta_1': 0.9875724066429759, 'epsilon': 1.4352236784244122e-07, 'balanced_loss': False, 'epochs': 124, 'early_stopping_patience': 16, 'plateau_patience': 11, 'plateau_divider': 10}. Best is trial 222 with value: 0.6575405977059186.
[I 2025-02-23 16:48:58,962] Trial 289 finished with value: 0.6234545512360548 and parameters: {'left_stride': 128, 'right_stride': 64, 'attention_pooling_operation': 'max', 'embedding_pooling_operation': 'max', 'threshold': 0.9210668583284042, 'batch_size': 65, 'attention_heads': 16, 'hidden_dimension': 61, 'number_of_hidden_layers': 1, 'dropout_rate': 0.43365060560265134, 'global_pooling': 'max', 'learning_rate': 0.0007314123398821852, 'weight_decay': 0.0005229711442743092, 'beta_0': 0.8725849878476334, 'beta_1': 0.989069475219747, 'epsilon': 9.509236625904842e-08, 'balanced_loss': False, 'epochs': 128, 'early_stopping_patience': 21, 'plateau_patience': 11, 'plateau_divider': 10}. Best is trial 222 with value: 0.6575405977059186.
[I 2025-02-23 17:07:33,590] Trial 290 finished with value: 0.6146750292121478 and parameters: {'left_stride': 0, 'right_stride': 32, 'attention_pooling_operation': 'max', 'embedding_pooling_operation': 'max', 'threshold': 0.9302218539637878, 'batch_size': 62, 'attention_heads': 16, 'hidden_dimension': 82, 'number_of_hidden_layers': 1, 'dropout_rate': 0.4544021250126886, 'global_pooling': 'max', 'learning_rate': 0.0009427030869099649, 'weight_decay': 0.00011320699561190676, 'beta_0': 0.8139634823770829, 'beta_1': 0.988409098978272, 'epsilon': 6.978098289845171e-08, 'balanced_loss': False, 'epochs': 53, 'early_stopping_patience': 17, 'plateau_patience': 12, 'plateau_divider': 10}. Best is trial 222 with value: 0.6575405977059186.
[I 2025-02-23 17:31:53,263] Trial 291 finished with value: 0.6210339463980382 and parameters: {'left_stride': 128, 'right_stride': 0, 'attention_pooling_operation': 'mean', 'embedding_pooling_operation': 'max', 'threshold': 0.9261238392708742, 'batch_size': 68, 'attention_heads': 15, 'hidden_dimension': 73, 'number_of_hidden_layers': 1, 'dropout_rate': 0.4284705591668276, 'global_pooling': 'max', 'learning_rate': 0.0006049232101543893, 'weight_decay': 4.3569168399706705e-05, 'beta_0': 0.8168233554870351, 'beta_1': 0.9866065934083899, 'epsilon': 5.83316222390311e-08, 'balanced_loss': False, 'epochs': 126, 'early_stopping_patience': 22, 'plateau_patience': 12, 'plateau_divider': 10}. Best is trial 222 with value: 0.6575405977059186.
[I 2025-02-23 17:51:28,382] Trial 292 finished with value: 0.6234993357715851 and parameters: {'left_stride': 0, 'right_stride': 256, 'attention_pooling_operation': 'max', 'embedding_pooling_operation': 'max', 'threshold': 0.9185737076940337, 'batch_size': 59, 'attention_heads': 16, 'hidden_dimension': 67, 'number_of_hidden_layers': 1, 'dropout_rate': 0.4465606154275676, 'global_pooling': 'max', 'learning_rate': 0.0007451902751963892, 'weight_decay': 0.0007764925555645579, 'beta_0': 0.8060309859019671, 'beta_1': 0.9872128900783883, 'epsilon': 5.015496154562334e-07, 'balanced_loss': False, 'epochs': 133, 'early_stopping_patience': 20, 'plateau_patience': 11, 'plateau_divider': 10}. Best is trial 222 with value: 0.6575405977059186.
[I 2025-02-23 18:14:04,572] Trial 293 finished with value: 0.5982570478023014 and parameters: {'left_stride': 256, 'right_stride': 128, 'attention_pooling_operation': 'min', 'embedding_pooling_operation': 'max', 'threshold': 0.9120605766175552, 'batch_size': 66, 'attention_heads': 16, 'hidden_dimension': 78, 'number_of_hidden_layers': 1, 'dropout_rate': 0.436678430805843, 'global_pooling': 'max', 'learning_rate': 0.00039956600914847214, 'weight_decay': 1.047539202028171e-06, 'beta_0': 0.8624905183323504, 'beta_1': 0.9879955354998999, 'epsilon': 2.707585242031643e-07, 'balanced_loss': False, 'epochs': 56, 'early_stopping_patience': 21, 'plateau_patience': 11, 'plateau_divider': 10}. Best is trial 222 with value: 0.6575405977059186.
[I 2025-02-23 18:34:30,110] Trial 294 finished with value: 0.6080774489524855 and parameters: {'left_stride': 0, 'right_stride': 128, 'attention_pooling_operation': 'max', 'embedding_pooling_operation': 'max', 'threshold': 0.923442463484363, 'batch_size': 63, 'attention_heads': 15, 'hidden_dimension': 83, 'number_of_hidden_layers': 1, 'dropout_rate': 0.4526739236445744, 'global_pooling': 'max', 'learning_rate': 0.0010088927889328162, 'weight_decay': 2.5766061702848875e-05, 'beta_0': 0.8029984689928097, 'beta_1': 0.9887198213430903, 'epsilon': 8.526607341036883e-08, 'balanced_loss': False, 'epochs': 53, 'early_stopping_patience': 20, 'plateau_patience': 12, 'plateau_divider': 10}. Best is trial 222 with value: 0.6575405977059186.
[I 2025-02-23 18:53:34,364] Trial 295 finished with value: 0.6231757423810437 and parameters: {'left_stride': 128, 'right_stride': 64, 'attention_pooling_operation': 'max', 'embedding_pooling_operation': 'max', 'threshold': 0.9298360796242973, 'batch_size': 72, 'attention_heads': 16, 'hidden_dimension': 74, 'number_of_hidden_layers': 1, 'dropout_rate': 0.43944897009537387, 'global_pooling': 'max', 'learning_rate': 0.0013163994745599632, 'weight_decay': 0.0006195621621877919, 'beta_0': 0.8100345113708997, 'beta_1': 0.9895266411133058, 'epsilon': 3.424587046094419e-08, 'balanced_loss': False, 'epochs': 50, 'early_stopping_patience': 21, 'plateau_patience': 11, 'plateau_divider': 10}. Best is trial 222 with value: 0.6575405977059186.
CUDA out of memory. Tried to allocate 3.67 GiB. GPU 0 has a total capacity of 44.56 GiB of which 732.69 MiB is free. Including non-PyTorch memory, this process has 43.84 GiB memory in use. Of the allocated memory 38.72 GiB is allocated by PyTorch, and 3.96 GiB is reserved by PyTorch but unallocated. If reserved but unallocated memory is large try setting PYTORCH_CUDA_ALLOC_CONF=expandable_segments:True to avoid fragmentation.  See documentation for Memory Management  (https://pytorch.org/docs/stable/notes/cuda.html#environment-variables)
[I 2025-02-23 19:10:12,933] Trial 296 finished with value: -1.0 and parameters: {'left_stride': 64, 'right_stride': 128, 'attention_pooling_operation': 'mean', 'embedding_pooling_operation': 'max', 'threshold': 0.8711076943690917, 'batch_size': 67, 'attention_heads': 16, 'hidden_dimension': 70, 'number_of_hidden_layers': 1, 'dropout_rate': 0.42664522694875956, 'global_pooling': 'mean', 'learning_rate': 0.0004995377260378133, 'weight_decay': 0.0004509681517761002, 'beta_0': 0.8780839752663232, 'beta_1': 0.9862815406706171, 'epsilon': 1.1563176889301907e-07, 'balanced_loss': False, 'epochs': 58, 'early_stopping_patience': 16, 'plateau_patience': 12, 'plateau_divider': 10}. Best is trial 222 with value: 0.6575405977059186.
[I 2025-02-23 19:31:57,220] Trial 297 finished with value: 0.612468054474671 and parameters: {'left_stride': 0, 'right_stride': 128, 'attention_pooling_operation': 'max', 'embedding_pooling_operation': 'mean', 'threshold': 0.916135854582871, 'batch_size': 64, 'attention_heads': 16, 'hidden_dimension': 87, 'number_of_hidden_layers': 1, 'dropout_rate': 0.4204128172344355, 'global_pooling': 'max', 'learning_rate': 0.0008230089466289234, 'weight_decay': 0.0008758930493060992, 'beta_0': 0.8764122043760433, 'beta_1': 0.9873941506365342, 'epsilon': 2.5195434385821623e-05, 'balanced_loss': False, 'epochs': 50, 'early_stopping_patience': 19, 'plateau_patience': 11, 'plateau_divider': 10}. Best is trial 222 with value: 0.6575405977059186.
[I 2025-02-23 19:52:18,689] Trial 298 finished with value: 0.6245549838879924 and parameters: {'left_stride': 0, 'right_stride': 128, 'attention_pooling_operation': 'max', 'embedding_pooling_operation': 'max', 'threshold': 0.9050288544873293, 'batch_size': 68, 'attention_heads': 15, 'hidden_dimension': 61, 'number_of_hidden_layers': 1, 'dropout_rate': 0.44507056264862493, 'global_pooling': 'max', 'learning_rate': 0.0006401907196762128, 'weight_decay': 0.0007741574181413694, 'beta_0': 0.8121523712909123, 'beta_1': 0.9883244355322033, 'epsilon': 1.6121733971480318e-07, 'balanced_loss': False, 'epochs': 56, 'early_stopping_patience': 20, 'plateau_patience': 12, 'plateau_divider': 10}. Best is trial 222 with value: 0.6575405977059186.
[I 2025-02-23 20:11:05,989] Trial 299 finished with value: 0.6321248605690901 and parameters: {'left_stride': 0, 'right_stride': 256, 'attention_pooling_operation': 'max', 'embedding_pooling_operation': 'max', 'threshold': 0.9216164998114391, 'batch_size': 61, 'attention_heads': 16, 'hidden_dimension': 52, 'number_of_hidden_layers': 1, 'dropout_rate': 0.43155462620005336, 'global_pooling': 'max', 'learning_rate': 0.0011743337515482612, 'weight_decay': 0.0006325300843823719, 'beta_0': 0.8090859972084199, 'beta_1': 0.9878397016325626, 'epsilon': 1.9414375676232717e-07, 'balanced_loss': False, 'epochs': 122, 'early_stopping_patience': 22, 'plateau_patience': 14, 'plateau_divider': 9}. Best is trial 222 with value: 0.6575405977059186.

[TRIAL] 222 [VALIDATION PERFORMANCE] 0.6575405977059186 [TRAINING LOSS] 0.027906809297458427 [VALIDATION LOSS] 1.3473853956569324 

number                                     222
value                                 0.657541
params_threshold                      0.921081
params_attention_heads                      16
params_balanced_loss                     False
params_embedding_pooling_operation         max
params_attention_pooling_operation         max
params_batch_size                           66
params_dropout_rate                    0.42369
params_early_stopping_patience              20
params_epochs                               52
params_global_pooling                      max
params_hidden_dimension                     75
params_learning_rate                  0.000613
params_number_of_hidden_layers               1
params_plateau_divider                      10
params_plateau_patience                     13
params_weight_decay                   0.000822
params_beta_0                         0.814335
params_beta_1                         0.988242
params_epsilon                             0.0
user_attrs_epoch                          24.0
user_attrs_training_loss              0.027907
user_attrs_validation_loss            1.347385
params_left_stride                           0
params_right_stride                        128
Name: 222, dtype: object
slurmstepd: error: *** JOB 15004853 ON gpu008 CANCELLED AT 2025-02-23T20:29:56 DUE TO TIME LIMIT ***
