[I 2025-03-03 05:35:07,065] Using an existing study with name 'Ohsumed-GATv2-google-bert-bert-base-uncased-Surrogate-No_Aggregation-No_Ablation-1.0-0.25' instead of creating a new one.
Token indices sequence length is longer than the specified maximum sequence length for this model (611 > 512). Running this sequence through the model will result in indexing errors
[I 2025-03-03 06:06:01,119] Trial 280 finished with value: 0.5564801251066419 and parameters: {'left_stride': 64, 'right_stride': 0, 'attention_pooling_operation': 'mean', 'embedding_pooling_operation': 'min', 'threshold': 0.9776904111019882, 'batch_size': 62, 'attention_heads': 10, 'hidden_dimension': 250, 'number_of_hidden_layers': 1, 'dropout_rate': 0.4083562311899723, 'global_pooling': 'max', 'learning_rate': 0.0007341961874986174, 'weight_decay': 0.00022183895556673755, 'beta_0': 0.8360334803244992, 'beta_1': 0.9901761140113334, 'epsilon': 4.250392376342804e-06, 'balanced_loss': False, 'epochs': 173, 'early_stopping_patience': 19, 'plateau_patience': 12, 'plateau_divider': 9}. Best is trial 270 with value: 0.6215289180750414.
CUDA out of memory. Tried to allocate 142.00 MiB. GPU 0 has a total capacity of 44.56 GiB of which 78.69 MiB is free. Including non-PyTorch memory, this process has 44.48 GiB memory in use. Of the allocated memory 42.69 GiB is allocated by PyTorch, and 649.50 MiB is reserved by PyTorch but unallocated. If reserved but unallocated memory is large try setting PYTORCH_CUDA_ALLOC_CONF=expandable_segments:True to avoid fragmentation.  See documentation for Memory Management  (https://pytorch.org/docs/stable/notes/cuda.html#environment-variables)
[I 2025-03-03 06:14:35,801] Trial 281 finished with value: -1.0 and parameters: {'left_stride': 64, 'right_stride': 0, 'attention_pooling_operation': 'max', 'embedding_pooling_operation': 'min', 'threshold': 0.8067168411280451, 'batch_size': 57, 'attention_heads': 11, 'hidden_dimension': 247, 'number_of_hidden_layers': 1, 'dropout_rate': 0.39618742909475596, 'global_pooling': 'sum', 'learning_rate': 0.00043510878643169615, 'weight_decay': 0.00034342567641794093, 'beta_0': 0.8300346915483902, 'beta_1': 0.9887789510173368, 'epsilon': 2.2745087824467157e-06, 'balanced_loss': False, 'epochs': 169, 'early_stopping_patience': 19, 'plateau_patience': 13, 'plateau_divider': 9}. Best is trial 270 with value: 0.6215289180750414.
[I 2025-03-03 06:39:00,411] Trial 282 finished with value: 0.5794585917135172 and parameters: {'left_stride': 64, 'right_stride': 0, 'attention_pooling_operation': 'max', 'embedding_pooling_operation': 'min', 'threshold': 0.9720353657660711, 'batch_size': 50, 'attention_heads': 10, 'hidden_dimension': 251, 'number_of_hidden_layers': 1, 'dropout_rate': 0.41342261120477186, 'global_pooling': 'max', 'learning_rate': 0.0005824188399847502, 'weight_decay': 0.00026119173456201557, 'beta_0': 0.8345929851050533, 'beta_1': 0.9898845208757461, 'epsilon': 7.681665788875752e-07, 'balanced_loss': False, 'epochs': 175, 'early_stopping_patience': 18, 'plateau_patience': 13, 'plateau_divider': 8}. Best is trial 270 with value: 0.6215289180750414.
[I 2025-03-03 07:04:35,966] Trial 283 finished with value: 0.5841728315775605 and parameters: {'left_stride': 64, 'right_stride': 0, 'attention_pooling_operation': 'min', 'embedding_pooling_operation': 'min', 'threshold': 0.9678353253164935, 'batch_size': 54, 'attention_heads': 10, 'hidden_dimension': 256, 'number_of_hidden_layers': 1, 'dropout_rate': 0.4035456635861239, 'global_pooling': 'max', 'learning_rate': 0.0007476142214527896, 'weight_decay': 0.00030406265231076526, 'beta_0': 0.8311820852354008, 'beta_1': 0.9894820783637132, 'epsilon': 9.93302452214978e-07, 'balanced_loss': True, 'epochs': 172, 'early_stopping_patience': 17, 'plateau_patience': 12, 'plateau_divider': 8}. Best is trial 270 with value: 0.6215289180750414.
[I 2025-03-03 07:38:43,040] Trial 284 finished with value: 0.49004501872279366 and parameters: {'left_stride': 64, 'right_stride': 0, 'attention_pooling_operation': 'max', 'embedding_pooling_operation': 'min', 'threshold': 0.9809260337659562, 'batch_size': 51, 'attention_heads': 10, 'hidden_dimension': 248, 'number_of_hidden_layers': 4, 'dropout_rate': 0.3837796413062012, 'global_pooling': 'max', 'learning_rate': 0.0005540437401641236, 'weight_decay': 0.0004051074701436295, 'beta_0': 0.8285459911651739, 'beta_1': 0.9891505657600315, 'epsilon': 4.939598500952253e-06, 'balanced_loss': False, 'epochs': 163, 'early_stopping_patience': 18, 'plateau_patience': 19, 'plateau_divider': 9}. Best is trial 270 with value: 0.6215289180750414.
[I 2025-03-03 07:59:21,629] Trial 285 finished with value: 0.5718235140600494 and parameters: {'left_stride': 64, 'right_stride': 0, 'attention_pooling_operation': 'max', 'embedding_pooling_operation': 'min', 'threshold': 0.9750621829987397, 'batch_size': 45, 'attention_heads': 11, 'hidden_dimension': 95, 'number_of_hidden_layers': 1, 'dropout_rate': 0.3932899651188626, 'global_pooling': 'max', 'learning_rate': 0.000647737666565177, 'weight_decay': 0.00024816805508924035, 'beta_0': 0.8331607674045319, 'beta_1': 0.9899662653197923, 'epsilon': 2.0143609338866853e-06, 'balanced_loss': False, 'epochs': 177, 'early_stopping_patience': 19, 'plateau_patience': 13, 'plateau_divider': 8}. Best is trial 270 with value: 0.6215289180750414.
[I 2025-03-03 08:24:31,590] Trial 286 finished with value: 0.6013362601088503 and parameters: {'left_stride': 64, 'right_stride': 256, 'attention_pooling_operation': 'max', 'embedding_pooling_operation': 'min', 'threshold': 0.9712276082382784, 'batch_size': 47, 'attention_heads': 10, 'hidden_dimension': 243, 'number_of_hidden_layers': 1, 'dropout_rate': 0.41014407940404696, 'global_pooling': 'max', 'learning_rate': 0.0007941638580395745, 'weight_decay': 0.00022143120906090608, 'beta_0': 0.8362430702243696, 'beta_1': 0.9894560920756874, 'epsilon': 1.1645341950024315e-06, 'balanced_loss': False, 'epochs': 167, 'early_stopping_patience': 19, 'plateau_patience': 14, 'plateau_divider': 8}. Best is trial 270 with value: 0.6215289180750414.
[I 2025-03-03 08:47:08,928] Trial 287 finished with value: 0.6249865640230626 and parameters: {'left_stride': 64, 'right_stride': 256, 'attention_pooling_operation': 'max', 'embedding_pooling_operation': 'min', 'threshold': 0.9719970039297329, 'batch_size': 47, 'attention_heads': 10, 'hidden_dimension': 135, 'number_of_hidden_layers': 1, 'dropout_rate': 0.41014959219069497, 'global_pooling': 'max', 'learning_rate': 0.0007889806897517153, 'weight_decay': 0.00021017373152825976, 'beta_0': 0.8347367933772694, 'beta_1': 0.9887430273373713, 'epsilon': 1.1744420046784635e-06, 'balanced_loss': False, 'epochs': 167, 'early_stopping_patience': 19, 'plateau_patience': 14, 'plateau_divider': 9}. Best is trial 287 with value: 0.6249865640230626.
[I 2025-03-03 09:16:12,274] Trial 288 finished with value: 0.14039054027552753 and parameters: {'left_stride': 64, 'right_stride': 256, 'attention_pooling_operation': 'max', 'embedding_pooling_operation': 'min', 'threshold': 0.976566302864544, 'batch_size': 47, 'attention_heads': 10, 'hidden_dimension': 131, 'number_of_hidden_layers': 1, 'dropout_rate': 0.3980492065240382, 'global_pooling': 'max', 'learning_rate': 0.014780080015112867, 'weight_decay': 0.00021248381191583336, 'beta_0': 0.8351916307457669, 'beta_1': 0.9893654919118112, 'epsilon': 1.3337965785752414e-06, 'balanced_loss': False, 'epochs': 166, 'early_stopping_patience': 19, 'plateau_patience': 15, 'plateau_divider': 8}. Best is trial 287 with value: 0.6249865640230626.
CUDA out of memory. Tried to allocate 252.00 MiB. GPU 0 has a total capacity of 44.56 GiB of which 84.69 MiB is free. Including non-PyTorch memory, this process has 44.47 GiB memory in use. Of the allocated memory 42.50 GiB is allocated by PyTorch, and 837.69 MiB is reserved by PyTorch but unallocated. If reserved but unallocated memory is large try setting PYTORCH_CUDA_ALLOC_CONF=expandable_segments:True to avoid fragmentation.  See documentation for Memory Management  (https://pytorch.org/docs/stable/notes/cuda.html#environment-variables)
[I 2025-03-03 09:32:31,628] Trial 289 finished with value: -1.0 and parameters: {'left_stride': 64, 'right_stride': 256, 'attention_pooling_operation': 'max', 'embedding_pooling_operation': 'min', 'threshold': 0.9064195765513215, 'batch_size': 44, 'attention_heads': 10, 'hidden_dimension': 134, 'number_of_hidden_layers': 1, 'dropout_rate': 0.4055866401337566, 'global_pooling': 'max', 'learning_rate': 0.0008069422623212663, 'weight_decay': 0.00019702050056096145, 'beta_0': 0.8415450652502454, 'beta_1': 0.9888797567991444, 'epsilon': 1.2122275370120379e-06, 'balanced_loss': False, 'epochs': 162, 'early_stopping_patience': 19, 'plateau_patience': 14, 'plateau_divider': 9}. Best is trial 287 with value: 0.6249865640230626.
[I 2025-03-03 09:58:15,428] Trial 290 finished with value: 0.6160975117570022 and parameters: {'left_stride': 64, 'right_stride': 256, 'attention_pooling_operation': 'max', 'embedding_pooling_operation': 'min', 'threshold': 0.9702980308934847, 'batch_size': 47, 'attention_heads': 10, 'hidden_dimension': 242, 'number_of_hidden_layers': 1, 'dropout_rate': 0.41048116803694934, 'global_pooling': 'max', 'learning_rate': 0.0005013428900508049, 'weight_decay': 0.00018204504078690547, 'beta_0': 0.8449771215969831, 'beta_1': 0.9895865609350194, 'epsilon': 1.0680622180611324e-06, 'balanced_loss': False, 'epochs': 158, 'early_stopping_patience': 19, 'plateau_patience': 14, 'plateau_divider': 3}. Best is trial 287 with value: 0.6249865640230626.
[I 2025-03-03 10:19:31,245] Trial 291 finished with value: 0.5728336082612756 and parameters: {'left_stride': 64, 'right_stride': 256, 'attention_pooling_operation': 'max', 'embedding_pooling_operation': 'min', 'threshold': 0.970014426947709, 'batch_size': 46, 'attention_heads': 10, 'hidden_dimension': 121, 'number_of_hidden_layers': 1, 'dropout_rate': 0.4111767886004873, 'global_pooling': 'max', 'learning_rate': 0.00040832002910542276, 'weight_decay': 0.0001806485099329379, 'beta_0': 0.8453488442167606, 'beta_1': 0.9884251887680945, 'epsilon': 1.3619661854027647e-06, 'balanced_loss': False, 'epochs': 160, 'early_stopping_patience': 19, 'plateau_patience': 14, 'plateau_divider': 2}. Best is trial 287 with value: 0.6249865640230626.
[I 2025-03-03 10:41:05,547] Trial 292 finished with value: 0.6092589678738232 and parameters: {'left_stride': 64, 'right_stride': 256, 'attention_pooling_operation': 'max', 'embedding_pooling_operation': 'min', 'threshold': 0.9721789920978317, 'batch_size': 48, 'attention_heads': 11, 'hidden_dimension': 128, 'number_of_hidden_layers': 1, 'dropout_rate': 0.4230686146640309, 'global_pooling': 'max', 'learning_rate': 0.0004438153882701089, 'weight_decay': 0.00022734579876733372, 'beta_0': 0.8437732390208982, 'beta_1': 0.9891317238117152, 'epsilon': 1.1359121583765998e-06, 'balanced_loss': False, 'epochs': 158, 'early_stopping_patience': 19, 'plateau_patience': 14, 'plateau_divider': 3}. Best is trial 287 with value: 0.6249865640230626.
CUDA out of memory. Tried to allocate 2.54 GiB. GPU 0 has a total capacity of 44.56 GiB of which 1.74 GiB is free. Including non-PyTorch memory, this process has 42.81 GiB memory in use. Of the allocated memory 41.36 GiB is allocated by PyTorch, and 302.56 MiB is reserved by PyTorch but unallocated. If reserved but unallocated memory is large try setting PYTORCH_CUDA_ALLOC_CONF=expandable_segments:True to avoid fragmentation.  See documentation for Memory Management  (https://pytorch.org/docs/stable/notes/cuda.html#environment-variables)
[I 2025-03-03 10:57:45,765] Trial 293 finished with value: -1.0 and parameters: {'left_stride': 64, 'right_stride': 256, 'attention_pooling_operation': 'max', 'embedding_pooling_operation': 'min', 'threshold': 0.9350207854473584, 'batch_size': 48, 'attention_heads': 11, 'hidden_dimension': 242, 'number_of_hidden_layers': 1, 'dropout_rate': 0.42684475368942676, 'global_pooling': 'mean', 'learning_rate': 0.0004775495855883065, 'weight_decay': 0.00023012745010514817, 'beta_0': 0.845834953276565, 'beta_1': 0.9890191304400587, 'epsilon': 1.1008544612736986e-06, 'balanced_loss': False, 'epochs': 157, 'early_stopping_patience': 19, 'plateau_patience': 14, 'plateau_divider': 4}. Best is trial 287 with value: 0.6249865640230626.
[I 2025-03-03 11:17:55,201] Trial 294 finished with value: 0.5483664550035422 and parameters: {'left_stride': 64, 'right_stride': 256, 'attention_pooling_operation': 'max', 'embedding_pooling_operation': 'min', 'threshold': 0.9643380560860395, 'batch_size': 45, 'attention_heads': 11, 'hidden_dimension': 137, 'number_of_hidden_layers': 0, 'dropout_rate': 0.4215560807396124, 'global_pooling': 'max', 'learning_rate': 0.00040503178874950704, 'weight_decay': 0.0002659246912944455, 'beta_0': 0.8434281104117706, 'beta_1': 0.9894897814076195, 'epsilon': 9.852168120563035e-07, 'balanced_loss': False, 'epochs': 155, 'early_stopping_patience': 19, 'plateau_patience': 15, 'plateau_divider': 3}. Best is trial 287 with value: 0.6249865640230626.
[I 2025-03-03 11:40:42,331] Trial 295 finished with value: 0.5157719830417266 and parameters: {'left_stride': 64, 'right_stride': 256, 'attention_pooling_operation': 'max', 'embedding_pooling_operation': 'min', 'threshold': 0.9689514156929334, 'batch_size': 42, 'attention_heads': 10, 'hidden_dimension': 125, 'number_of_hidden_layers': 3, 'dropout_rate': 0.4346349984721466, 'global_pooling': 'max', 'learning_rate': 0.0004725431968751734, 'weight_decay': 0.00017774423385968213, 'beta_0': 0.8473090478955788, 'beta_1': 0.988188520880847, 'epsilon': 1.1237732885034919e-06, 'balanced_loss': False, 'epochs': 164, 'early_stopping_patience': 10, 'plateau_patience': 14, 'plateau_divider': 9}. Best is trial 287 with value: 0.6249865640230626.
[I 2025-03-03 12:08:24,290] Trial 296 finished with value: 0.5853258998282239 and parameters: {'left_stride': 64, 'right_stride': 256, 'attention_pooling_operation': 'mean', 'embedding_pooling_operation': 'min', 'threshold': 0.9737404064644478, 'batch_size': 48, 'attention_heads': 11, 'hidden_dimension': 161, 'number_of_hidden_layers': 1, 'dropout_rate': 0.4434718585655224, 'global_pooling': 'max', 'learning_rate': 0.0005582851601929226, 'weight_decay': 0.0002329064430888197, 'beta_0': 0.8443778002909684, 'beta_1': 0.9889433519342616, 'epsilon': 1.456116412316064e-06, 'balanced_loss': False, 'epochs': 167, 'early_stopping_patience': 19, 'plateau_patience': 14, 'plateau_divider': 3}. Best is trial 287 with value: 0.6249865640230626.
[I 2025-03-03 12:32:02,846] Trial 297 finished with value: 0.5730865958140688 and parameters: {'left_stride': 64, 'right_stride': 256, 'attention_pooling_operation': 'max', 'embedding_pooling_operation': 'min', 'threshold': 0.9601603676506488, 'batch_size': 49, 'attention_heads': 12, 'hidden_dimension': 127, 'number_of_hidden_layers': 1, 'dropout_rate': 0.41671915803750365, 'global_pooling': 'max', 'learning_rate': 0.0003817085549101998, 'weight_decay': 0.00020520369686845055, 'beta_0': 0.8432139062396763, 'beta_1': 0.9886233981802021, 'epsilon': 1.1569198839572577e-06, 'balanced_loss': False, 'epochs': 159, 'early_stopping_patience': 19, 'plateau_patience': 14, 'plateau_divider': 3}. Best is trial 287 with value: 0.6249865640230626.
[I 2025-03-03 12:54:08,829] Trial 298 finished with value: 0.6103137471817286 and parameters: {'left_stride': 64, 'right_stride': 256, 'attention_pooling_operation': 'max', 'embedding_pooling_operation': 'mean', 'threshold': 0.9689570133077751, 'batch_size': 46, 'attention_heads': 10, 'hidden_dimension': 143, 'number_of_hidden_layers': 1, 'dropout_rate': 0.4091579923430631, 'global_pooling': 'max', 'learning_rate': 0.000679582724898408, 'weight_decay': 1.029904476432445e-06, 'beta_0': 0.840374172372411, 'beta_1': 0.9893805908117057, 'epsilon': 9.238312760857475e-07, 'balanced_loss': False, 'epochs': 168, 'early_stopping_patience': 19, 'plateau_patience': 15, 'plateau_divider': 3}. Best is trial 287 with value: 0.6249865640230626.
[I 2025-03-03 13:15:29,319] Trial 299 finished with value: 0.5900608801668109 and parameters: {'left_stride': 64, 'right_stride': 256, 'attention_pooling_operation': 'max', 'embedding_pooling_operation': 'mean', 'threshold': 0.9759527016012141, 'batch_size': 44, 'attention_heads': 10, 'hidden_dimension': 147, 'number_of_hidden_layers': 1, 'dropout_rate': 0.4101177148144837, 'global_pooling': 'max', 'learning_rate': 0.0004889922026004502, 'weight_decay': 1.2000589846647985e-06, 'beta_0': 0.8393831079117371, 'beta_1': 0.9892059286167252, 'epsilon': 9.475675898213853e-07, 'balanced_loss': False, 'epochs': 165, 'early_stopping_patience': 19, 'plateau_patience': 15, 'plateau_divider': 3}. Best is trial 287 with value: 0.6249865640230626.
[I 2025-03-03 13:36:49,445] Trial 300 finished with value: 0.5944128865168679 and parameters: {'left_stride': 64, 'right_stride': 256, 'attention_pooling_operation': 'max', 'embedding_pooling_operation': 'mean', 'threshold': 0.9695192911683593, 'batch_size': 47, 'attention_heads': 11, 'hidden_dimension': 115, 'number_of_hidden_layers': 1, 'dropout_rate': 0.4214070088057551, 'global_pooling': 'max', 'learning_rate': 0.000680862479012447, 'weight_decay': 2.7037093377624727e-06, 'beta_0': 0.841372769567733, 'beta_1': 0.9896759190488834, 'epsilon': 9.444607467104166e-07, 'balanced_loss': False, 'epochs': 143, 'early_stopping_patience': 19, 'plateau_patience': 14, 'plateau_divider': 3}. Best is trial 287 with value: 0.6249865640230626.
[I 2025-03-03 13:58:49,623] Trial 301 finished with value: 0.5790731310962022 and parameters: {'left_stride': 64, 'right_stride': 256, 'attention_pooling_operation': 'max', 'embedding_pooling_operation': 'mean', 'threshold': 0.9646476643525819, 'batch_size': 39, 'attention_heads': 10, 'hidden_dimension': 144, 'number_of_hidden_layers': 1, 'dropout_rate': 0.40640538033053425, 'global_pooling': 'max', 'learning_rate': 0.0006171115733255106, 'weight_decay': 7.92789243554694e-06, 'beta_0': 0.8410946368190099, 'beta_1': 0.9894039600519092, 'epsilon': 8.157500233735124e-07, 'balanced_loss': False, 'epochs': 168, 'early_stopping_patience': 19, 'plateau_patience': 15, 'plateau_divider': 3}. Best is trial 287 with value: 0.6249865640230626.
[I 2025-03-03 14:20:14,108] Trial 302 finished with value: 0.5788297912322891 and parameters: {'left_stride': 64, 'right_stride': 256, 'attention_pooling_operation': 'max', 'embedding_pooling_operation': 'mean', 'threshold': 0.9733681025641978, 'batch_size': 45, 'attention_heads': 10, 'hidden_dimension': 139, 'number_of_hidden_layers': 1, 'dropout_rate': 0.4152707068851994, 'global_pooling': 'max', 'learning_rate': 0.0005321910028374376, 'weight_decay': 2.119562897377061e-06, 'beta_0': 0.8359283247502471, 'beta_1': 0.988617630961261, 'epsilon': 1.190254185445431e-06, 'balanced_loss': False, 'epochs': 149, 'early_stopping_patience': 19, 'plateau_patience': 14, 'plateau_divider': 3}. Best is trial 287 with value: 0.6249865640230626.
[I 2025-03-03 14:40:27,041] Trial 303 finished with value: 0.572473282159374 and parameters: {'left_stride': 64, 'right_stride': 256, 'attention_pooling_operation': 'max', 'embedding_pooling_operation': 'min', 'threshold': 0.9835595190730851, 'batch_size': 42, 'attention_heads': 10, 'hidden_dimension': 145, 'number_of_hidden_layers': 1, 'dropout_rate': 0.401234325512128, 'global_pooling': 'max', 'learning_rate': 0.0007546087914679382, 'weight_decay': 0.00026706236231531456, 'beta_0': 0.8398626366076549, 'beta_1': 0.9897153318917848, 'epsilon': 1.4843961530412347e-06, 'balanced_loss': False, 'epochs': 162, 'early_stopping_patience': 19, 'plateau_patience': 14, 'plateau_divider': 3}. Best is trial 287 with value: 0.6249865640230626.
[I 2025-03-03 15:01:16,759] Trial 304 finished with value: 0.6046407842784856 and parameters: {'left_stride': 64, 'right_stride': 0, 'attention_pooling_operation': 'max', 'embedding_pooling_operation': 'mean', 'threshold': 0.9780703560456245, 'batch_size': 50, 'attention_heads': 10, 'hidden_dimension': 141, 'number_of_hidden_layers': 1, 'dropout_rate': 0.42865483475604316, 'global_pooling': 'max', 'learning_rate': 0.0008967994204782926, 'weight_decay': 0.0007351208246585358, 'beta_0': 0.8242306520540831, 'beta_1': 0.9890708283322669, 'epsilon': 7.618828860536053e-07, 'balanced_loss': False, 'epochs': 170, 'early_stopping_patience': 19, 'plateau_patience': 14, 'plateau_divider': 3}. Best is trial 287 with value: 0.6249865640230626.
[I 2025-03-03 15:21:50,970] Trial 305 finished with value: 0.5467951632703739 and parameters: {'left_stride': 64, 'right_stride': 256, 'attention_pooling_operation': 'max', 'embedding_pooling_operation': 'min', 'threshold': 0.9800445685901771, 'batch_size': 49, 'attention_heads': 10, 'hidden_dimension': 138, 'number_of_hidden_layers': 1, 'dropout_rate': 0.428461867843948, 'global_pooling': 'sum', 'learning_rate': 0.0008873116868552609, 'weight_decay': 0.0007345518795309825, 'beta_0': 0.8209434374254976, 'beta_1': 0.9889434548791606, 'epsilon': 1.2511219268792879e-05, 'balanced_loss': True, 'epochs': 155, 'early_stopping_patience': 19, 'plateau_patience': 14, 'plateau_divider': 3}. Best is trial 287 with value: 0.6249865640230626.
[I 2025-03-03 15:42:16,647] Trial 306 finished with value: 0.5931218118616093 and parameters: {'left_stride': 64, 'right_stride': 256, 'attention_pooling_operation': 'max', 'embedding_pooling_operation': 'mean', 'threshold': 0.9760736847735934, 'batch_size': 47, 'attention_heads': 10, 'hidden_dimension': 152, 'number_of_hidden_layers': 1, 'dropout_rate': 0.42195845014988853, 'global_pooling': 'max', 'learning_rate': 0.0009103103660406658, 'weight_decay': 0.0008028257495188992, 'beta_0': 0.8221394479193973, 'beta_1': 0.9881270061738772, 'epsilon': 7.008660207027548e-07, 'balanced_loss': False, 'epochs': 170, 'early_stopping_patience': 18, 'plateau_patience': 15, 'plateau_divider': 3}. Best is trial 287 with value: 0.6249865640230626.
