[I 2025-03-05 18:26:40,671] Trial 333 finished with value: 0.5240779319401788 and parameters: {'left_stride': 128, 'right_stride': 256, 'attention_pooling_operation': 'max', 'embedding_pooling_operation': 'min', 'threshold': 0.9752798770043478, 'batch_size': 52, 'attention_heads': 12, 'hidden_dimension': 162, 'number_of_hidden_layers': 1, 'dropout_rate': 0.5713520763195079, 'global_pooling': 'max', 'learning_rate': 0.0003151394172373282, 'weight_decay': 3.865143929216769e-05, 'beta_0': 0.8441923712618802, 'beta_1': 0.9929323884573548, 'epsilon': 1.947819992519262e-07, 'balanced_loss': True, 'epochs': 62, 'early_stopping_patience': 19, 'plateau_patience': 20, 'plateau_divider': 2}. Best is trial 214 with value: 0.5493008496774074.

[TRIAL] 214 [VALIDATION PERFORMANCE] 0.5493008496774074 [TRAINING LOSS] 0.2769967430100149 [VALIDATION LOSS] 1.7497692933449378 

number                                     214
value                                 0.549301
params_threshold                      0.969138
params_attention_heads                      13
params_balanced_loss                      True
params_embedding_pooling_operation         min
params_attention_pooling_operation         max
params_batch_size                           55
params_dropout_rate                   0.555339
params_early_stopping_patience              19
params_epochs                              107
params_global_pooling                      max
params_hidden_dimension                    161
params_learning_rate                  0.000396
params_number_of_hidden_layers               1
params_plateau_divider                       2
params_plateau_patience                     24
params_weight_decay                   0.000066
params_beta_0                         0.844197
params_beta_1                         0.991985
params_epsilon                        0.000001
user_attrs_epoch                          32.0
user_attrs_training_loss              0.276997
user_attrs_validation_loss            1.749769
params_left_stride                         128
params_right_stride                        256
Name: 214, dtype: object
37 Val: 0.5126033380026671 Test: 0.49990828776900265
38 Val: 0.5297506653512226 Test: 0.5278371052553047
39 Val: 0.5038182979081097 Test: 0.5227603576497833
40 Val: 0.5072766228741431 Test: 0.4999140179350784
41 Val: 0.5302278199763821 Test: 0.5268287353026562
42 Val: 0.5316147556510006 Test: 0.5189728869635021
43 Val: 0.5139021243152002 Test: 0.48584515306162646
44 Val: 0.5288055228136705 Test: 0.5361722413603441
45 Val: 0.5153648382874829 Test: 0.48699262160283
46 Val: 0.5028892164955512 Test: 0.5139084243031283
Validation performance: 50.29 & 51.76 ± 1.15 & 53.16
Testing performance: 48.58 & 51.19 ± 1.77 & 53.62

[TRIAL] 183 [VALIDATION PERFORMANCE] 0.5476273104865623 [TRAINING LOSS] 0.2905619305372238 [VALIDATION LOSS] 1.8090417843598585 

number                                     183
value                                 0.547627
params_threshold                      0.975888
params_attention_heads                      14
params_balanced_loss                      True
params_embedding_pooling_operation         min
params_attention_pooling_operation         max
params_batch_size                           54
params_dropout_rate                   0.541343
params_early_stopping_patience              18
params_epochs                              120
params_global_pooling                      max
params_hidden_dimension                    138
params_learning_rate                  0.000847
params_number_of_hidden_layers               1
params_plateau_divider                       2
params_plateau_patience                     24
params_weight_decay                   0.000046
params_beta_0                         0.845954
params_beta_1                          0.99355
params_epsilon                        0.000001
user_attrs_epoch                          31.0
user_attrs_training_loss              0.290562
user_attrs_validation_loss            1.809042
params_left_stride                         128
params_right_stride                        256
Name: 183, dtype: object
37 Val: 0.514271227952829 Test: 0.518611779846627
38 Val: 0.5200900897218572 Test: 0.5332161353202793
39 Val: 0.5140395485969929 Test: 0.5147104116379135
40 Val: 0.4929509656561912 Test: 0.508729221945186
41 Val: 0.5051886034688069 Test: 0.52628378711547
42 Val: 0.5281022724533742 Test: 0.5272522410916011
43 Val: 0.517099933502735 Test: 0.5242549506742987
44 Val: 0.5271944392256147 Test: 0.5295882556091452
45 Val: 0.5241601249229355 Test: 0.5162836572645452
46 Val: 0.48323413907188634 Test: 0.49820276403680075
Validation performance: 48.32 & 51.26 ± 1.48 & 52.81
Testing performance: 49.82 & 51.97 ± 1.07 & 53.32

[TRIAL] 220 [VALIDATION PERFORMANCE] 0.5472475551763017 [TRAINING LOSS] 0.31905298431714374 [VALIDATION LOSS] 1.948453853527705 

number                                     220
value                                 0.547248
params_threshold                      0.967434
params_attention_heads                      13
params_balanced_loss                      True
params_embedding_pooling_operation         min
params_attention_pooling_operation         max
params_batch_size                           60
params_dropout_rate                   0.591487
params_early_stopping_patience              19
params_epochs                               98
params_global_pooling                      max
params_hidden_dimension                    163
params_learning_rate                  0.000272
params_number_of_hidden_layers               1
params_plateau_divider                       2
params_plateau_patience                     22
params_weight_decay                   0.000063
params_beta_0                         0.851643
params_beta_1                         0.991916
params_epsilon                             0.0
user_attrs_epoch                          50.0
user_attrs_training_loss              0.319053
user_attrs_validation_loss            1.948454
params_left_stride                         128
params_right_stride                        256
Name: 220, dtype: object
37 Val: 0.49006697475736977 Test: 0.5017843030642808
38 Val: 0.5211820620325195 Test: 0.5207276553633704
39 Val: 0.49634962165703833 Test: 0.5172064287267021
40 Val: 0.4968688048383013 Test: 0.5069778576227472
41 Val: 0.5130579753184892 Test: 0.5010381713202811
42 Val: 0.5231141105527397 Test: 0.5066788562263558
43 Val: 0.5231725332815844 Test: 0.5103344196724513
44 Val: 0.51526307571245 Test: 0.5029383985005859
45 Val: 0.5184088606185838 Test: 0.49631535306861957
46 Val: 0.5073659178735876 Test: 0.5208334249050087
Validation performance: 49.01 & 51.05 ± 1.22 & 52.32
Testing performance: 49.63 & 50.85 ± 0.86 & 52.08

[TRIAL] 215 [VALIDATION PERFORMANCE] 0.5421621196900989 [TRAINING LOSS] 0.24496554761477138 [VALIDATION LOSS] 1.7412431786457698 

number                                     215
value                                 0.542162
params_threshold                      0.968676
params_attention_heads                      13
params_balanced_loss                      True
params_embedding_pooling_operation         min
params_attention_pooling_operation         max
params_batch_size                           59
params_dropout_rate                   0.566349
params_early_stopping_patience              19
params_epochs                              105
params_global_pooling                      max
params_hidden_dimension                    166
params_learning_rate                  0.000373
params_number_of_hidden_layers               1
params_plateau_divider                       2
params_plateau_patience                     23
params_weight_decay                   0.000066
params_beta_0                         0.847166
params_beta_1                         0.991952
params_epsilon                             0.0
user_attrs_epoch                          44.0
user_attrs_training_loss              0.244966
user_attrs_validation_loss            1.741243
params_left_stride                         128
params_right_stride                        256
Name: 215, dtype: object
37 Val: 0.5167941117309934 Test: 0.5182487931151656
38 Val: 0.5350935817528615 Test: 0.5289607715226237
39 Val: 0.51994317926826 Test: 0.5198491666444979
40 Val: 0.5143394730666551 Test: 0.5390838404833006
41 Val: 0.5266432354831265 Test: 0.5096866292618863
42 Val: 0.5237762453274724 Test: 0.5227806584521338
43 Val: 0.5046571130775598 Test: 0.5090620217170031
44 Val: 0.5320364998456355 Test: 0.5192279048694473
45 Val: 0.5299445090986019 Test: 0.5241605785491812
46 Val: 0.4860043641233432 Test: 0.5151055748592013
Validation performance: 48.6 & 51.89 ± 1.47 & 53.51
Testing performance: 50.91 & 52.06 ± 0.89 & 53.91

[TRIAL] 144 [VALIDATION PERFORMANCE] 0.5379792613443007 [TRAINING LOSS] 0.31144209789193195 [VALIDATION LOSS] 1.6785333752632141 

number                                     144
value                                 0.537979
params_threshold                      0.967918
params_attention_heads                      14
params_balanced_loss                      True
params_embedding_pooling_operation         min
params_attention_pooling_operation         max
params_batch_size                           39
params_dropout_rate                   0.541692
params_early_stopping_patience              19
params_epochs                              127
params_global_pooling                      max
params_hidden_dimension                    122
params_learning_rate                   0.00037
params_number_of_hidden_layers               1
params_plateau_divider                       3
params_plateau_patience                     24
params_weight_decay                   0.000049
params_beta_0                         0.848168
params_beta_1                            0.992
params_epsilon                             0.0
user_attrs_epoch                          30.0
user_attrs_training_loss              0.311442
user_attrs_validation_loss            1.678533
params_left_stride                         128
params_right_stride                        256
Name: 144, dtype: object
37 Val: 0.5218863147736732 Test: 0.5140292295077964
38 Val: 0.5431291695657112 Test: 0.5292563156406677
39 Val: 0.4977042773411725 Test: 0.5321161853360529
40 Val: 0.5089605838493404 Test: 0.5225682270264298
41 Val: 0.5142719657937892 Test: 0.5263114997081647
42 Val: 0.5145711479064531 Test: 0.5132641814305107
43 Val: 0.5190906199771397 Test: 0.5284195032247868
44 Val: 0.5208863665619365 Test: 0.5274033605889086
45 Val: 0.5618989415640043 Test: 0.5207675672919008
46 Val: 0.4961680671121192 Test: 0.49329618873324443
Validation performance: 49.62 & 51.99 ± 1.98 & 56.19
Testing performance: 49.33 & 52.07 ± 1.15 & 53.21

[Ohsumed] Elapsed time: 1966.7050557255745 minutes.
