[I 2025-02-27 11:16:43,564] Trial 90 finished with value: 0.5267816078127201 and parameters: {'left_stride': 64, 'right_stride': 256, 'attention_pooling_operation': 'max', 'embedding_pooling_operation': 'min', 'threshold': 0.9649388087625036, 'batch_size': 42, 'attention_heads': 11, 'hidden_dimension': 172, 'number_of_hidden_layers': 2, 'dropout_rate': 0.31886750299907907, 'global_pooling': 'mean', 'learning_rate': 0.00011611698060097108, 'weight_decay': 0.00020531265512375296, 'beta_0': 0.8798507491642348, 'beta_1': 0.9924720961875655, 'epsilon': 6.13285502483576e-08, 'balanced_loss': True, 'epochs': 134, 'early_stopping_patience': 18, 'plateau_patience': 11, 'plateau_divider': 10}. Best is trial 88 with value: 0.5445577248127786.
CUDA out of memory. Tried to allocate 264.00 MiB. GPU 0 has a total capacity of 44.56 GiB of which 32.69 MiB is free. Including non-PyTorch memory, this process has 44.52 GiB memory in use. Of the allocated memory 42.63 GiB is allocated by PyTorch, and 753.93 MiB is reserved by PyTorch but unallocated. If reserved but unallocated memory is large try setting PYTORCH_CUDA_ALLOC_CONF=expandable_segments:True to avoid fragmentation.  See documentation for Memory Management  (https://pytorch.org/docs/stable/notes/cuda.html#environment-variables)
[I 2025-02-27 11:24:30,288] Trial 91 finished with value: -1.0 and parameters: {'left_stride': 64, 'right_stride': 256, 'attention_pooling_operation': 'max', 'embedding_pooling_operation': 'min', 'threshold': 0.8256374938534885, 'batch_size': 43, 'attention_heads': 12, 'hidden_dimension': 173, 'number_of_hidden_layers': 2, 'dropout_rate': 0.3170044448874844, 'global_pooling': 'mean', 'learning_rate': 6.261698488432452e-05, 'weight_decay': 0.00023946296068707334, 'beta_0': 0.8733962697145241, 'beta_1': 0.993138984599889, 'epsilon': 5.9463982012376485e-08, 'balanced_loss': True, 'epochs': 135, 'early_stopping_patience': 18, 'plateau_patience': 11, 'plateau_divider': 10}. Best is trial 88 with value: 0.5445577248127786.
[I 2025-02-27 11:45:39,839] Trial 92 finished with value: 0.5256629891394483 and parameters: {'left_stride': 64, 'right_stride': 256, 'attention_pooling_operation': 'max', 'embedding_pooling_operation': 'min', 'threshold': 0.97509125501228, 'batch_size': 35, 'attention_heads': 11, 'hidden_dimension': 149, 'number_of_hidden_layers': 2, 'dropout_rate': 0.32851979726657354, 'global_pooling': 'mean', 'learning_rate': 0.0002855598226735926, 'weight_decay': 0.00019302353523124123, 'beta_0': 0.8789397409701385, 'beta_1': 0.990989634585533, 'epsilon': 6.909448033008456e-08, 'balanced_loss': True, 'epochs': 122, 'early_stopping_patience': 17, 'plateau_patience': 11, 'plateau_divider': 10}. Best is trial 88 with value: 0.5445577248127786.
slurmstepd: error: *** JOB 15030013 ON gpu015 CANCELLED AT 2025-02-27T12:02:49 DUE TO TIME LIMIT ***
