[I 2025-02-28 06:42:31,869] Using an existing study with name 'Ohsumed-GATv2-google-bert-bert-base-uncased-Surrogate-No_Aggregation-No_Ablation-1.0-0.5' instead of creating a new one.
Token indices sequence length is longer than the specified maximum sequence length for this model (611 > 512). Running this sequence through the model will result in indexing errors
[I 2025-02-28 06:59:24,922] Trial 151 finished with value: 0.5336947232868307 and parameters: {'left_stride': 64, 'right_stride': 32, 'attention_pooling_operation': 'max', 'embedding_pooling_operation': 'min', 'threshold': 0.9502947404087985, 'batch_size': 34, 'attention_heads': 13, 'hidden_dimension': 54, 'number_of_hidden_layers': 2, 'dropout_rate': 0.3002658241609647, 'global_pooling': 'mean', 'learning_rate': 0.0005679611711176294, 'weight_decay': 0.00027088783785295757, 'beta_0': 0.8429094307855259, 'beta_1': 0.9938094969092427, 'epsilon': 1.1641575892808426e-07, 'balanced_loss': True, 'epochs': 145, 'early_stopping_patience': 17, 'plateau_patience': 11, 'plateau_divider': 9}. Best is trial 147 with value: 0.5890664194848952.
[I 2025-02-28 07:15:44,399] Trial 152 finished with value: 0.5004511306716926 and parameters: {'left_stride': 64, 'right_stride': 64, 'attention_pooling_operation': 'max', 'embedding_pooling_operation': 'min', 'threshold': 0.9786406431678639, 'batch_size': 44, 'attention_heads': 12, 'hidden_dimension': 97, 'number_of_hidden_layers': 2, 'dropout_rate': 0.3461630599592448, 'global_pooling': 'mean', 'learning_rate': 0.0004810867195989355, 'weight_decay': 0.0007517942115232368, 'beta_0': 0.8539534698255453, 'beta_1': 0.9945498722165197, 'epsilon': 6.80540937950783e-08, 'balanced_loss': True, 'epochs': 133, 'early_stopping_patience': 19, 'plateau_patience': 10, 'plateau_divider': 6}. Best is trial 147 with value: 0.5890664194848952.
[I 2025-02-28 07:32:08,420] Trial 153 finished with value: 0.5294137223821089 and parameters: {'left_stride': 64, 'right_stride': 32, 'attention_pooling_operation': 'max', 'embedding_pooling_operation': 'min', 'threshold': 0.9692948654002603, 'batch_size': 35, 'attention_heads': 15, 'hidden_dimension': 67, 'number_of_hidden_layers': 2, 'dropout_rate': 0.31191084607167224, 'global_pooling': 'mean', 'learning_rate': 0.0006139638432195702, 'weight_decay': 0.00048351510085214305, 'beta_0': 0.858607365617778, 'beta_1': 0.9958562099775963, 'epsilon': 1.504573612948119e-07, 'balanced_loss': True, 'epochs': 139, 'early_stopping_patience': 18, 'plateau_patience': 11, 'plateau_divider': 9}. Best is trial 147 with value: 0.5890664194848952.
[I 2025-02-28 07:49:22,739] Trial 154 finished with value: 0.5233167570803555 and parameters: {'left_stride': 64, 'right_stride': 32, 'attention_pooling_operation': 'min', 'embedding_pooling_operation': 'min', 'threshold': 0.9409915417023904, 'batch_size': 39, 'attention_heads': 14, 'hidden_dimension': 41, 'number_of_hidden_layers': 2, 'dropout_rate': 0.32611821394908974, 'global_pooling': 'mean', 'learning_rate': 0.00023888180390933456, 'weight_decay': 0.00023429451853186796, 'beta_0': 0.8604095203832397, 'beta_1': 0.9982997659038161, 'epsilon': 8.214876139755909e-08, 'balanced_loss': True, 'epochs': 128, 'early_stopping_patience': 17, 'plateau_patience': 12, 'plateau_divider': 7}. Best is trial 147 with value: 0.5890664194848952.
[I 2025-02-28 08:05:05,043] Trial 155 finished with value: 0.015025642070110527 and parameters: {'left_stride': 64, 'right_stride': 32, 'attention_pooling_operation': 'max', 'embedding_pooling_operation': 'min', 'threshold': 0.9517321286773783, 'batch_size': 34, 'attention_heads': 13, 'hidden_dimension': 55, 'number_of_hidden_layers': 2, 'dropout_rate': 0.30014346103395056, 'global_pooling': 'mean', 'learning_rate': 0.04111834324236489, 'weight_decay': 0.00027929887392136386, 'beta_0': 0.8501993017011908, 'beta_1': 0.9936207617034821, 'epsilon': 1.2363080807593473e-07, 'balanced_loss': True, 'epochs': 144, 'early_stopping_patience': 17, 'plateau_patience': 11, 'plateau_divider': 9}. Best is trial 147 with value: 0.5890664194848952.
[I 2025-02-28 08:22:34,663] Trial 156 finished with value: 0.5371179669914233 and parameters: {'left_stride': 64, 'right_stride': 32, 'attention_pooling_operation': 'max', 'embedding_pooling_operation': 'min', 'threshold': 0.9586049181757648, 'batch_size': 34, 'attention_heads': 13, 'hidden_dimension': 76, 'number_of_hidden_layers': 2, 'dropout_rate': 0.30546465173128173, 'global_pooling': 'mean', 'learning_rate': 0.0005645349555515409, 'weight_decay': 0.0002786289953171813, 'beta_0': 0.8439965776204705, 'beta_1': 0.9942712488794353, 'epsilon': 1.0173479315945012e-07, 'balanced_loss': True, 'epochs': 150, 'early_stopping_patience': 18, 'plateau_patience': 11, 'plateau_divider': 9}. Best is trial 147 with value: 0.5890664194848952.
[I 2025-02-28 08:40:11,294] Trial 157 finished with value: 0.5491029677331326 and parameters: {'left_stride': 64, 'right_stride': 32, 'attention_pooling_operation': 'max', 'embedding_pooling_operation': 'min', 'threshold': 0.9570543078671813, 'batch_size': 32, 'attention_heads': 13, 'hidden_dimension': 74, 'number_of_hidden_layers': 2, 'dropout_rate': 0.3065074587372868, 'global_pooling': 'mean', 'learning_rate': 0.0004308896899954802, 'weight_decay': 0.0003780577254240348, 'beta_0': 0.8639783679063425, 'beta_1': 0.99480412418791, 'epsilon': 9.955553793073518e-08, 'balanced_loss': True, 'epochs': 150, 'early_stopping_patience': 18, 'plateau_patience': 10, 'plateau_divider': 9}. Best is trial 147 with value: 0.5890664194848952.
[I 2025-02-28 08:57:35,068] Trial 158 finished with value: 0.5293852170210102 and parameters: {'left_stride': 64, 'right_stride': 32, 'attention_pooling_operation': 'max', 'embedding_pooling_operation': 'min', 'threshold': 0.959194669303553, 'batch_size': 32, 'attention_heads': 13, 'hidden_dimension': 66, 'number_of_hidden_layers': 2, 'dropout_rate': 0.3170533235844993, 'global_pooling': 'mean', 'learning_rate': 0.0007371172453477294, 'weight_decay': 0.00044173570006659666, 'beta_0': 0.8401901883222268, 'beta_1': 0.9942546746377635, 'epsilon': 7.367973096286823e-08, 'balanced_loss': True, 'epochs': 150, 'early_stopping_patience': 18, 'plateau_patience': 10, 'plateau_divider': 9}. Best is trial 147 with value: 0.5890664194848952.
[I 2025-02-28 09:18:37,289] Trial 159 finished with value: 0.5411282229106521 and parameters: {'left_stride': 64, 'right_stride': 32, 'attention_pooling_operation': 'max', 'embedding_pooling_operation': 'min', 'threshold': 0.9631715916595601, 'batch_size': 36, 'attention_heads': 13, 'hidden_dimension': 130, 'number_of_hidden_layers': 2, 'dropout_rate': 0.30696330147827083, 'global_pooling': 'mean', 'learning_rate': 0.0006113820707512177, 'weight_decay': 1.0081458090310478e-05, 'beta_0': 0.8472946947367669, 'beta_1': 0.9955262637063268, 'epsilon': 1.0117540693233682e-07, 'balanced_loss': True, 'epochs': 153, 'early_stopping_patience': 18, 'plateau_patience': 10, 'plateau_divider': 9}. Best is trial 147 with value: 0.5890664194848952.
[I 2025-02-28 09:37:57,901] Trial 160 finished with value: 0.5397680947547936 and parameters: {'left_stride': 128, 'right_stride': 32, 'attention_pooling_operation': 'max', 'embedding_pooling_operation': 'min', 'threshold': 0.9735265293379213, 'batch_size': 35, 'attention_heads': 13, 'hidden_dimension': 129, 'number_of_hidden_layers': 2, 'dropout_rate': 0.31300705420512565, 'global_pooling': 'mean', 'learning_rate': 0.0004509338496676297, 'weight_decay': 4.995941750772026e-06, 'beta_0': 0.8474878491223707, 'beta_1': 0.9950413983313644, 'epsilon': 2.8655596439424337e-08, 'balanced_loss': True, 'epochs': 148, 'early_stopping_patience': 18, 'plateau_patience': 10, 'plateau_divider': 9}. Best is trial 147 with value: 0.5890664194848952.
[I 2025-02-28 09:54:12,114] Trial 161 finished with value: 0.5335405611526602 and parameters: {'left_stride': 64, 'right_stride': 32, 'attention_pooling_operation': 'max', 'embedding_pooling_operation': 'min', 'threshold': 0.9741219668932547, 'batch_size': 32, 'attention_heads': 13, 'hidden_dimension': 73, 'number_of_hidden_layers': 2, 'dropout_rate': 0.33333136201693425, 'global_pooling': 'mean', 'learning_rate': 0.00043920975839657116, 'weight_decay': 9.188470121427899e-06, 'beta_0': 0.8483957517015406, 'beta_1': 0.9948780977417188, 'epsilon': 2.59560349622838e-07, 'balanced_loss': True, 'epochs': 160, 'early_stopping_patience': 19, 'plateau_patience': 10, 'plateau_divider': 9}. Best is trial 147 with value: 0.5890664194848952.
[I 2025-02-28 10:16:01,425] Trial 162 finished with value: 0.5390985618748744 and parameters: {'left_stride': 128, 'right_stride': 0, 'attention_pooling_operation': 'max', 'embedding_pooling_operation': 'min', 'threshold': 0.965649031652051, 'batch_size': 35, 'attention_heads': 14, 'hidden_dimension': 131, 'number_of_hidden_layers': 2, 'dropout_rate': 0.32205442470542794, 'global_pooling': 'mean', 'learning_rate': 0.00033023874624944755, 'weight_decay': 1.2699050184940598e-05, 'beta_0': 0.8425885757283715, 'beta_1': 0.9951830455861079, 'epsilon': 2.9782977798411862e-08, 'balanced_loss': True, 'epochs': 154, 'early_stopping_patience': 19, 'plateau_patience': 10, 'plateau_divider': 9}. Best is trial 147 with value: 0.5890664194848952.
[I 2025-02-28 10:36:31,255] Trial 163 finished with value: 0.5107842960281395 and parameters: {'left_stride': 128, 'right_stride': 0, 'attention_pooling_operation': 'max', 'embedding_pooling_operation': 'min', 'threshold': 0.9806249171662547, 'batch_size': 37, 'attention_heads': 14, 'hidden_dimension': 129, 'number_of_hidden_layers': 2, 'dropout_rate': 0.34235417846813454, 'global_pooling': 'mean', 'learning_rate': 0.00018889580116503038, 'weight_decay': 1.597198798550308e-05, 'beta_0': 0.8367895391769838, 'beta_1': 0.9955873419807711, 'epsilon': 2.5174721417134917e-08, 'balanced_loss': True, 'epochs': 152, 'early_stopping_patience': 19, 'plateau_patience': 10, 'plateau_divider': 9}. Best is trial 147 with value: 0.5890664194848952.
[I 2025-02-28 10:59:35,441] Trial 164 finished with value: 0.5475866854529999 and parameters: {'left_stride': 128, 'right_stride': 0, 'attention_pooling_operation': 'max', 'embedding_pooling_operation': 'min', 'threshold': 0.9642108887128196, 'batch_size': 35, 'attention_heads': 15, 'hidden_dimension': 134, 'number_of_hidden_layers': 2, 'dropout_rate': 0.3223225078676883, 'global_pooling': 'mean', 'learning_rate': 0.00026927385525548047, 'weight_decay': 4.456902956916124e-06, 'beta_0': 0.8472331710905705, 'beta_1': 0.9966648272336417, 'epsilon': 3.4799611811115355e-08, 'balanced_loss': True, 'epochs': 144, 'early_stopping_patience': 19, 'plateau_patience': 10, 'plateau_divider': 9}. Best is trial 147 with value: 0.5890664194848952.
[I 2025-02-28 11:22:30,758] Trial 165 finished with value: 0.5333025327463181 and parameters: {'left_stride': 32, 'right_stride': 0, 'attention_pooling_operation': 'max', 'embedding_pooling_operation': 'min', 'threshold': 0.9644359722212315, 'batch_size': 35, 'attention_heads': 14, 'hidden_dimension': 142, 'number_of_hidden_layers': 2, 'dropout_rate': 0.3231723152121918, 'global_pooling': 'mean', 'learning_rate': 0.00032965535968269497, 'weight_decay': 5.348817144501655e-06, 'beta_0': 0.846943551082102, 'beta_1': 0.9966710378484194, 'epsilon': 1.6868971137941732e-08, 'balanced_loss': True, 'epochs': 153, 'early_stopping_patience': 19, 'plateau_patience': 10, 'plateau_divider': 9}. Best is trial 147 with value: 0.5890664194848952.
[I 2025-02-28 11:43:58,583] Trial 166 finished with value: 0.5256313991440132 and parameters: {'left_stride': 128, 'right_stride': 64, 'attention_pooling_operation': 'max', 'embedding_pooling_operation': 'min', 'threshold': 0.9718132090913364, 'batch_size': 34, 'attention_heads': 15, 'hidden_dimension': 134, 'number_of_hidden_layers': 2, 'dropout_rate': 0.3168083067454866, 'global_pooling': 'mean', 'learning_rate': 0.00027420380780834413, 'weight_decay': 3.924262917231602e-06, 'beta_0': 0.842827034995592, 'beta_1': 0.9950626093795784, 'epsilon': 3.452764871360482e-08, 'balanced_loss': True, 'epochs': 144, 'early_stopping_patience': 19, 'plateau_patience': 10, 'plateau_divider': 9}. Best is trial 147 with value: 0.5890664194848952.
[I 2025-02-28 12:07:58,324] Trial 167 finished with value: 0.5222593740280596 and parameters: {'left_stride': 128, 'right_stride': 0, 'attention_pooling_operation': 'max', 'embedding_pooling_operation': 'min', 'threshold': 0.9673518302434188, 'batch_size': 37, 'attention_heads': 15, 'hidden_dimension': 127, 'number_of_hidden_layers': 2, 'dropout_rate': 0.32947060076744705, 'global_pooling': 'mean', 'learning_rate': 0.0001377645224452399, 'weight_decay': 2.7109043589210226e-06, 'beta_0': 0.8478858678055012, 'beta_1': 0.9957039578594642, 'epsilon': 2.7281093521613157e-08, 'balanced_loss': True, 'epochs': 146, 'early_stopping_patience': 20, 'plateau_patience': 10, 'plateau_divider': 9}. Best is trial 147 with value: 0.5890664194848952.
[I 2025-02-28 12:26:34,497] Trial 168 finished with value: 0.5036532885314619 and parameters: {'left_stride': 128, 'right_stride': 0, 'attention_pooling_operation': 'max', 'embedding_pooling_operation': 'min', 'threshold': 0.9835422667610522, 'batch_size': 33, 'attention_heads': 14, 'hidden_dimension': 133, 'number_of_hidden_layers': 2, 'dropout_rate': 0.3213757834440081, 'global_pooling': 'mean', 'learning_rate': 0.0002153978268523198, 'weight_decay': 4.526931596352856e-06, 'beta_0': 0.8506162847743435, 'beta_1': 0.9966573966614388, 'epsilon': 1.8366328477854563e-08, 'balanced_loss': True, 'epochs': 141, 'early_stopping_patience': 18, 'plateau_patience': 10, 'plateau_divider': 9}. Best is trial 147 with value: 0.5890664194848952.
[I 2025-02-28 12:45:41,210] Trial 169 finished with value: 0.5305958563209116 and parameters: {'left_stride': 128, 'right_stride': 0, 'attention_pooling_operation': 'max', 'embedding_pooling_operation': 'min', 'threshold': 0.9765469960500035, 'batch_size': 38, 'attention_heads': 13, 'hidden_dimension': 131, 'number_of_hidden_layers': 2, 'dropout_rate': 0.31318442434243726, 'global_pooling': 'mean', 'learning_rate': 0.0003115067977663524, 'weight_decay': 1.2331653378591214e-05, 'beta_0': 0.8401333680141814, 'beta_1': 0.9951448649892924, 'epsilon': 3.0490625836995356e-08, 'balanced_loss': True, 'epochs': 149, 'early_stopping_patience': 19, 'plateau_patience': 10, 'plateau_divider': 9}. Best is trial 147 with value: 0.5890664194848952.
[I 2025-02-28 13:10:28,377] Trial 170 finished with value: 0.5405401402295426 and parameters: {'left_stride': 128, 'right_stride': 0, 'attention_pooling_operation': 'max', 'embedding_pooling_operation': 'min', 'threshold': 0.9655396596916125, 'batch_size': 41, 'attention_heads': 13, 'hidden_dimension': 156, 'number_of_hidden_layers': 2, 'dropout_rate': 0.33612482079571404, 'global_pooling': 'mean', 'learning_rate': 0.00025428247904361954, 'weight_decay': 3.239825834981653e-06, 'beta_0': 0.852027250406296, 'beta_1': 0.9960923001038219, 'epsilon': 3.985068204280074e-08, 'balanced_loss': True, 'epochs': 157, 'early_stopping_patience': 18, 'plateau_patience': 10, 'plateau_divider': 9}. Best is trial 147 with value: 0.5890664194848952.
[I 2025-02-28 13:34:54,898] Trial 171 finished with value: 0.5402239238754611 and parameters: {'left_stride': 128, 'right_stride': 0, 'attention_pooling_operation': 'max', 'embedding_pooling_operation': 'min', 'threshold': 0.9697273411502353, 'batch_size': 32, 'attention_heads': 13, 'hidden_dimension': 162, 'number_of_hidden_layers': 2, 'dropout_rate': 0.3410730265612252, 'global_pooling': 'mean', 'learning_rate': 0.00017829611203306077, 'weight_decay': 3.146339637634337e-06, 'beta_0': 0.85315156323119, 'beta_1': 0.996117472065732, 'epsilon': 4.2198200060779156e-08, 'balanced_loss': True, 'epochs': 157, 'early_stopping_patience': 18, 'plateau_patience': 10, 'plateau_divider': 4}. Best is trial 147 with value: 0.5890664194848952.
[I 2025-02-28 13:58:26,031] Trial 172 finished with value: 0.546565712133631 and parameters: {'left_stride': 128, 'right_stride': 0, 'attention_pooling_operation': 'max', 'embedding_pooling_operation': 'min', 'threshold': 0.9704558160233211, 'batch_size': 32, 'attention_heads': 13, 'hidden_dimension': 153, 'number_of_hidden_layers': 2, 'dropout_rate': 0.34056468248137006, 'global_pooling': 'mean', 'learning_rate': 0.00018286770456077015, 'weight_decay': 2.83040999739686e-06, 'beta_0': 0.8532982148416777, 'beta_1': 0.9960336673525849, 'epsilon': 4.064504107604873e-08, 'balanced_loss': True, 'epochs': 158, 'early_stopping_patience': 18, 'plateau_patience': 10, 'plateau_divider': 4}. Best is trial 147 with value: 0.5890664194848952.
[I 2025-02-28 14:22:35,800] Trial 173 finished with value: 0.5331031663113616 and parameters: {'left_stride': 128, 'right_stride': 0, 'attention_pooling_operation': 'max', 'embedding_pooling_operation': 'min', 'threshold': 0.9707054637858148, 'batch_size': 33, 'attention_heads': 13, 'hidden_dimension': 168, 'number_of_hidden_layers': 2, 'dropout_rate': 0.35388701723814786, 'global_pooling': 'mean', 'learning_rate': 0.0001550248806403767, 'weight_decay': 3.1460715457588156e-06, 'beta_0': 0.8525633128035794, 'beta_1': 0.997291783212959, 'epsilon': 4.135788397186537e-08, 'balanced_loss': True, 'epochs': 162, 'early_stopping_patience': 18, 'plateau_patience': 10, 'plateau_divider': 4}. Best is trial 147 with value: 0.5890664194848952.
[I 2025-02-28 14:44:50,776] Trial 174 finished with value: 0.5280250002083094 and parameters: {'left_stride': 128, 'right_stride': 0, 'attention_pooling_operation': 'max', 'embedding_pooling_operation': 'min', 'threshold': 0.9752898293478135, 'batch_size': 32, 'attention_heads': 13, 'hidden_dimension': 155, 'number_of_hidden_layers': 2, 'dropout_rate': 0.34099316646087696, 'global_pooling': 'mean', 'learning_rate': 0.00017835533701751188, 'weight_decay': 2.2094539169248616e-06, 'beta_0': 0.8497728876587968, 'beta_1': 0.9960709910996558, 'epsilon': 3.9301507095630074e-08, 'balanced_loss': True, 'epochs': 158, 'early_stopping_patience': 18, 'plateau_patience': 10, 'plateau_divider': 4}. Best is trial 147 with value: 0.5890664194848952.
CUDA out of memory. Tried to allocate 1.66 GiB. GPU 0 has a total capacity of 44.56 GiB of which 1.16 GiB is free. Including non-PyTorch memory, this process has 43.39 GiB memory in use. Of the allocated memory 41.25 GiB is allocated by PyTorch, and 1016.42 MiB is reserved by PyTorch but unallocated. If reserved but unallocated memory is large try setting PYTORCH_CUDA_ALLOC_CONF=expandable_segments:True to avoid fragmentation.  See documentation for Memory Management  (https://pytorch.org/docs/stable/notes/cuda.html#environment-variables)
[I 2025-02-28 14:58:19,329] Trial 175 finished with value: -1.0 and parameters: {'left_stride': 128, 'right_stride': 0, 'attention_pooling_operation': 'max', 'embedding_pooling_operation': 'min', 'threshold': 0.9633713366232264, 'batch_size': 36, 'attention_heads': 16, 'hidden_dimension': 158, 'number_of_hidden_layers': 2, 'dropout_rate': 0.34761198316578534, 'global_pooling': 'mean', 'learning_rate': 0.0002161915782923623, 'weight_decay': 4.827667912758066e-06, 'beta_0': 0.8536227003529309, 'beta_1': 0.9966269094972589, 'epsilon': 6.092015909828809e-08, 'balanced_loss': True, 'epochs': 174, 'early_stopping_patience': 18, 'plateau_patience': 10, 'plateau_divider': 4}. Best is trial 147 with value: 0.5890664194848952.
[I 2025-02-28 15:21:45,530] Trial 176 finished with value: 0.5631036313364884 and parameters: {'left_stride': 128, 'right_stride': 0, 'attention_pooling_operation': 'max', 'embedding_pooling_operation': 'min', 'threshold': 0.9696058630511514, 'batch_size': 32, 'attention_heads': 13, 'hidden_dimension': 163, 'number_of_hidden_layers': 2, 'dropout_rate': 0.33651517557493704, 'global_pooling': 'mean', 'learning_rate': 0.0002629688334022521, 'weight_decay': 1.489283805975062e-06, 'beta_0': 0.8465412153820178, 'beta_1': 0.9959735974420334, 'epsilon': 4.678862003525484e-08, 'balanced_loss': True, 'epochs': 166, 'early_stopping_patience': 18, 'plateau_patience': 10, 'plateau_divider': 4}. Best is trial 147 with value: 0.5890664194848952.
[I 2025-02-28 15:45:52,602] Trial 177 finished with value: 0.5381394780680223 and parameters: {'left_stride': 128, 'right_stride': 0, 'attention_pooling_operation': 'max', 'embedding_pooling_operation': 'min', 'threshold': 0.969765395683876, 'batch_size': 32, 'attention_heads': 13, 'hidden_dimension': 163, 'number_of_hidden_layers': 2, 'dropout_rate': 0.3368955365770882, 'global_pooling': 'mean', 'learning_rate': 0.0001498411994275203, 'weight_decay': 1.4292149232215618e-06, 'beta_0': 0.851498746236557, 'beta_1': 0.9960864407071709, 'epsilon': 4.701587767134113e-08, 'balanced_loss': True, 'epochs': 163, 'early_stopping_patience': 18, 'plateau_patience': 10, 'plateau_divider': 4}. Best is trial 147 with value: 0.5890664194848952.
[I 2025-02-28 16:06:59,618] Trial 178 finished with value: 0.5413825504087095 and parameters: {'left_stride': 128, 'right_stride': 0, 'attention_pooling_operation': 'max', 'embedding_pooling_operation': 'min', 'threshold': 0.9779010768136489, 'batch_size': 35, 'attention_heads': 13, 'hidden_dimension': 151, 'number_of_hidden_layers': 2, 'dropout_rate': 0.3418466230966063, 'global_pooling': 'mean', 'learning_rate': 0.0002677596307044243, 'weight_decay': 3.0157048547019945e-06, 'beta_0': 0.8457423088420232, 'beta_1': 0.9956260559636093, 'epsilon': 3.352170672337037e-08, 'balanced_loss': True, 'epochs': 160, 'early_stopping_patience': 18, 'plateau_patience': 10, 'plateau_divider': 3}. Best is trial 147 with value: 0.5890664194848952.
