[I 2025-02-26 20:02:53,120] Using an existing study with name 'Ohsumed-GATv2-google-bert-bert-base-uncased-Surrogate-No_Aggregation-No_Ablation-1.0-0.5' instead of creating a new one.
Token indices sequence length is longer than the specified maximum sequence length for this model (611 > 512). Running this sequence through the model will result in indexing errors
[I 2025-02-26 20:26:42,265] Trial 42 finished with value: 0.49351122656199403 and parameters: {'left_stride': 0, 'right_stride': 128, 'attention_pooling_operation': 'mean', 'embedding_pooling_operation': 'max', 'threshold': 0.9461067998953967, 'batch_size': 49, 'attention_heads': 4, 'hidden_dimension': 193, 'number_of_hidden_layers': 1, 'dropout_rate': 0.41388127302606703, 'global_pooling': 'sum', 'learning_rate': 0.002843462730679623, 'weight_decay': 8.816904586159344e-05, 'beta_0': 0.8258499154883183, 'beta_1': 0.9951204856983663, 'epsilon': 4.434879775206662e-07, 'balanced_loss': False, 'epochs': 114, 'early_stopping_patience': 22, 'plateau_patience': 15, 'plateau_divider': 8}. Best is trial 2 with value: 0.5059441274536349.
CUDA out of memory. Tried to allocate 1004.00 MiB. GPU 0 has a total capacity of 44.56 GiB of which 568.69 MiB is free. Including non-PyTorch memory, this process has 44.00 GiB memory in use. Of the allocated memory 42.36 GiB is allocated by PyTorch, and 503.34 MiB is reserved by PyTorch but unallocated. If reserved but unallocated memory is large try setting PYTORCH_CUDA_ALLOC_CONF=expandable_segments:True to avoid fragmentation.  See documentation for Memory Management  (https://pytorch.org/docs/stable/notes/cuda.html#environment-variables)
[I 2025-02-26 20:44:54,561] Trial 43 finished with value: -1.0 and parameters: {'left_stride': 0, 'right_stride': 128, 'attention_pooling_operation': 'mean', 'embedding_pooling_operation': 'max', 'threshold': 0.9250184998322462, 'batch_size': 45, 'attention_heads': 5, 'hidden_dimension': 187, 'number_of_hidden_layers': 1, 'dropout_rate': 0.3869273861240436, 'global_pooling': 'sum', 'learning_rate': 0.0029968948789610267, 'weight_decay': 0.00010079014427079243, 'beta_0': 0.8237488185850358, 'beta_1': 0.9921675420520165, 'epsilon': 1.8823477194464376e-07, 'balanced_loss': False, 'epochs': 112, 'early_stopping_patience': 22, 'plateau_patience': 15, 'plateau_divider': 8}. Best is trial 2 with value: 0.5059441274536349.
[I 2025-02-26 21:05:31,091] Trial 44 finished with value: 0.40767199694363376 and parameters: {'left_stride': 0, 'right_stride': 128, 'attention_pooling_operation': 'mean', 'embedding_pooling_operation': 'max', 'threshold': 0.9924602433494817, 'batch_size': 62, 'attention_heads': 4, 'hidden_dimension': 217, 'number_of_hidden_layers': 1, 'dropout_rate': 0.4438496180294093, 'global_pooling': 'sum', 'learning_rate': 0.0009600189141793192, 'weight_decay': 0.00020363510456836763, 'beta_0': 0.8058774410698107, 'beta_1': 0.9959266183235351, 'epsilon': 1.3897654696399844e-06, 'balanced_loss': False, 'epochs': 135, 'early_stopping_patience': 23, 'plateau_patience': 16, 'plateau_divider': 9}. Best is trial 2 with value: 0.5059441274536349.
CUDA out of memory. Tried to allocate 170.00 MiB. GPU 0 has a total capacity of 44.56 GiB of which 104.69 MiB is free. Including non-PyTorch memory, this process has 44.45 GiB memory in use. Of the allocated memory 42.26 GiB is allocated by PyTorch, and 1.04 GiB is reserved by PyTorch but unallocated. If reserved but unallocated memory is large try setting PYTORCH_CUDA_ALLOC_CONF=expandable_segments:True to avoid fragmentation.  See documentation for Memory Management  (https://pytorch.org/docs/stable/notes/cuda.html#environment-variables)
[I 2025-02-26 21:17:07,496] Trial 45 finished with value: -1.0 and parameters: {'left_stride': 0, 'right_stride': 128, 'attention_pooling_operation': 'mean', 'embedding_pooling_operation': 'min', 'threshold': 0.8536277128075006, 'batch_size': 54, 'attention_heads': 5, 'hidden_dimension': 178, 'number_of_hidden_layers': 4, 'dropout_rate': 0.4219083654776428, 'global_pooling': 'sum', 'learning_rate': 0.005329078957678115, 'weight_decay': 8.081317490572928e-05, 'beta_0': 0.814829523204393, 'beta_1': 0.9977154409606331, 'epsilon': 4.481273150641924e-07, 'balanced_loss': False, 'epochs': 91, 'early_stopping_patience': 21, 'plateau_patience': 14, 'plateau_divider': 7}. Best is trial 2 with value: 0.5059441274536349.
[I 2025-02-26 21:37:06,403] Trial 46 finished with value: 0.4395180205066405 and parameters: {'left_stride': 0, 'right_stride': 128, 'attention_pooling_operation': 'max', 'embedding_pooling_operation': 'max', 'threshold': 0.9555133725354927, 'batch_size': 56, 'attention_heads': 10, 'hidden_dimension': 203, 'number_of_hidden_layers': 0, 'dropout_rate': 0.4679245956870072, 'global_pooling': 'sum', 'learning_rate': 0.0003192988394946105, 'weight_decay': 3.212020244352793e-05, 'beta_0': 0.8341325254098868, 'beta_1': 0.9834164142130433, 'epsilon': 2.8353459605003708e-08, 'balanced_loss': False, 'epochs': 52, 'early_stopping_patience': 24, 'plateau_patience': 13, 'plateau_divider': 8}. Best is trial 2 with value: 0.5059441274536349.
CUDA out of memory. Tried to allocate 1.51 GiB. GPU 0 has a total capacity of 44.56 GiB of which 998.69 MiB is free. Including non-PyTorch memory, this process has 43.58 GiB memory in use. Of the allocated memory 40.68 GiB is allocated by PyTorch, and 1.75 GiB is reserved by PyTorch but unallocated. If reserved but unallocated memory is large try setting PYTORCH_CUDA_ALLOC_CONF=expandable_segments:True to avoid fragmentation.  See documentation for Memory Management  (https://pytorch.org/docs/stable/notes/cuda.html#environment-variables)
[I 2025-02-26 21:50:22,870] Trial 47 finished with value: -1.0 and parameters: {'left_stride': 32, 'right_stride': 128, 'attention_pooling_operation': 'min', 'embedding_pooling_operation': 'max', 'threshold': 0.9437190945501548, 'batch_size': 82, 'attention_heads': 4, 'hidden_dimension': 242, 'number_of_hidden_layers': 2, 'dropout_rate': 0.3673800724671034, 'global_pooling': 'mean', 'learning_rate': 0.003274926316440593, 'weight_decay': 6.220545480315375e-05, 'beta_0': 0.8266536789900617, 'beta_1': 0.9940804083136254, 'epsilon': 1.1013889628209193e-06, 'balanced_loss': True, 'epochs': 99, 'early_stopping_patience': 23, 'plateau_patience': 17, 'plateau_divider': 3}. Best is trial 2 with value: 0.5059441274536349.
[I 2025-02-26 22:13:55,392] Trial 48 finished with value: 0.5081531127424952 and parameters: {'left_stride': 256, 'right_stride': 0, 'attention_pooling_operation': 'mean', 'embedding_pooling_operation': 'mean', 'threshold': 0.9709130437679077, 'batch_size': 96, 'attention_heads': 11, 'hidden_dimension': 164, 'number_of_hidden_layers': 1, 'dropout_rate': 0.4076190572335312, 'global_pooling': 'max', 'learning_rate': 0.0021624114674499723, 'weight_decay': 0.00033715257698818776, 'beta_0': 0.8194660349354783, 'beta_1': 0.9806704160059783, 'epsilon': 2.1434521705982345e-07, 'balanced_loss': False, 'epochs': 123, 'early_stopping_patience': 13, 'plateau_patience': 15, 'plateau_divider': 10}. Best is trial 48 with value: 0.5081531127424952.
CUDA out of memory. Tried to allocate 2.44 GiB. GPU 0 has a total capacity of 44.56 GiB of which 2.28 GiB is free. Including non-PyTorch memory, this process has 42.28 GiB memory in use. Of the allocated memory 38.98 GiB is allocated by PyTorch, and 2.15 GiB is reserved by PyTorch but unallocated. If reserved but unallocated memory is large try setting PYTORCH_CUDA_ALLOC_CONF=expandable_segments:True to avoid fragmentation.  See documentation for Memory Management  (https://pytorch.org/docs/stable/notes/cuda.html#environment-variables)
[I 2025-02-26 22:32:24,055] Trial 49 finished with value: -1.0 and parameters: {'left_stride': 256, 'right_stride': 0, 'attention_pooling_operation': 'mean', 'embedding_pooling_operation': 'mean', 'threshold': 0.9733891580405561, 'batch_size': 119, 'attention_heads': 12, 'hidden_dimension': 166, 'number_of_hidden_layers': 1, 'dropout_rate': 0.40040882971233144, 'global_pooling': 'max', 'learning_rate': 0.00225365219601838, 'weight_decay': 0.0003765235038335932, 'beta_0': 0.8407378754887367, 'beta_1': 0.981044023527584, 'epsilon': 8.030497036869146e-08, 'balanced_loss': False, 'epochs': 124, 'early_stopping_patience': 11, 'plateau_patience': 18, 'plateau_divider': 10}. Best is trial 48 with value: 0.5081531127424952.
[I 2025-02-26 22:49:29,737] Trial 50 finished with value: 0.4856644723569044 and parameters: {'left_stride': 256, 'right_stride': 0, 'attention_pooling_operation': 'max', 'embedding_pooling_operation': 'mean', 'threshold': 0.985944935914422, 'batch_size': 98, 'attention_heads': 11, 'hidden_dimension': 117, 'number_of_hidden_layers': 2, 'dropout_rate': 0.3108821916599564, 'global_pooling': 'max', 'learning_rate': 0.00044784822715334104, 'weight_decay': 0.00028114734673106913, 'beta_0': 0.8199590592308037, 'beta_1': 0.9805079834282716, 'epsilon': 3.943203508652823e-06, 'balanced_loss': False, 'epochs': 139, 'early_stopping_patience': 13, 'plateau_patience': 23, 'plateau_divider': 10}. Best is trial 48 with value: 0.5081531127424952.
CUDA out of memory. Tried to allocate 2.22 GiB. GPU 0 has a total capacity of 44.56 GiB of which 1.99 GiB is free. Including non-PyTorch memory, this process has 42.56 GiB memory in use. Of the allocated memory 39.22 GiB is allocated by PyTorch, and 2.19 GiB is reserved by PyTorch but unallocated. If reserved but unallocated memory is large try setting PYTORCH_CUDA_ALLOC_CONF=expandable_segments:True to avoid fragmentation.  See documentation for Memory Management  (https://pytorch.org/docs/stable/notes/cuda.html#environment-variables)
[I 2025-02-26 23:02:52,014] Trial 51 finished with value: -1.0 and parameters: {'left_stride': 256, 'right_stride': 0, 'attention_pooling_operation': 'min', 'embedding_pooling_operation': 'mean', 'threshold': 0.9678552692070815, 'batch_size': 108, 'attention_heads': 12, 'hidden_dimension': 149, 'number_of_hidden_layers': 1, 'dropout_rate': 0.48660054351427257, 'global_pooling': 'max', 'learning_rate': 0.00023599861845207754, 'weight_decay': 0.0005447932032471737, 'beta_0': 0.8043412749687684, 'beta_1': 0.9817872127587747, 'epsilon': 1.3796120732645842e-05, 'balanced_loss': False, 'epochs': 82, 'early_stopping_patience': 14, 'plateau_patience': 13, 'plateau_divider': 5}. Best is trial 48 with value: 0.5081531127424952.
[I 2025-02-26 23:21:12,634] Trial 52 finished with value: 0.06709389203211495 and parameters: {'left_stride': 256, 'right_stride': 0, 'attention_pooling_operation': 'mean', 'embedding_pooling_operation': 'mean', 'threshold': 0.9994526314905706, 'batch_size': 110, 'attention_heads': 11, 'hidden_dimension': 184, 'number_of_hidden_layers': 1, 'dropout_rate': 0.4248754711272515, 'global_pooling': 'max', 'learning_rate': 0.0012686539951909947, 'weight_decay': 0.0001150009077446738, 'beta_0': 0.8219507269062813, 'beta_1': 0.9855953594358717, 'epsilon': 3.02800128181091e-07, 'balanced_loss': False, 'epochs': 131, 'early_stopping_patience': 13, 'plateau_patience': 15, 'plateau_divider': 9}. Best is trial 48 with value: 0.5081531127424952.
CUDA out of memory. Tried to allocate 3.02 GiB. GPU 0 has a total capacity of 44.56 GiB of which 1.01 GiB is free. Including non-PyTorch memory, this process has 43.54 GiB memory in use. Of the allocated memory 40.89 GiB is allocated by PyTorch, and 1.50 GiB is reserved by PyTorch but unallocated. If reserved but unallocated memory is large try setting PYTORCH_CUDA_ALLOC_CONF=expandable_segments:True to avoid fragmentation.  See documentation for Memory Management  (https://pytorch.org/docs/stable/notes/cuda.html#environment-variables)
[I 2025-02-26 23:39:41,446] Trial 53 finished with value: -1.0 and parameters: {'left_stride': 128, 'right_stride': 256, 'attention_pooling_operation': 'mean', 'embedding_pooling_operation': 'mean', 'threshold': 0.9402854819946833, 'batch_size': 86, 'attention_heads': 9, 'hidden_dimension': 194, 'number_of_hidden_layers': 1, 'dropout_rate': 0.38935647749277064, 'global_pooling': 'max', 'learning_rate': 0.0007029293962356584, 'weight_decay': 0.0001328018479127532, 'beta_0': 0.8163817156164943, 'beta_1': 0.980020590312411, 'epsilon': 1.3947894076138034e-07, 'balanced_loss': False, 'epochs': 117, 'early_stopping_patience': 11, 'plateau_patience': 16, 'plateau_divider': 8}. Best is trial 48 with value: 0.5081531127424952.
[I 2025-02-27 00:01:03,335] Trial 54 finished with value: 0.47233093600122567 and parameters: {'left_stride': 64, 'right_stride': 64, 'attention_pooling_operation': 'mean', 'embedding_pooling_operation': 'max', 'threshold': 0.9633646076819915, 'batch_size': 98, 'attention_heads': 4, 'hidden_dimension': 180, 'number_of_hidden_layers': 1, 'dropout_rate': 0.4168513060298568, 'global_pooling': 'sum', 'learning_rate': 0.002921040327699566, 'weight_decay': 4.3111276186186044e-05, 'beta_0': 0.8091995965935181, 'beta_1': 0.9834858201809098, 'epsilon': 2.2956010297358584e-07, 'balanced_loss': False, 'epochs': 105, 'early_stopping_patience': 15, 'plateau_patience': 14, 'plateau_divider': 2}. Best is trial 48 with value: 0.5081531127424952.
[I 2025-02-27 00:21:35,788] Trial 55 finished with value: 0.4521474687658853 and parameters: {'left_stride': 0, 'right_stride': 128, 'attention_pooling_operation': 'mean', 'embedding_pooling_operation': 'min', 'threshold': 0.952695786587072, 'batch_size': 46, 'attention_heads': 10, 'hidden_dimension': 169, 'number_of_hidden_layers': 0, 'dropout_rate': 0.40513116797749643, 'global_pooling': 'mean', 'learning_rate': 0.007700757357968214, 'weight_decay': 0.00018640196024307905, 'beta_0': 0.8129206654356351, 'beta_1': 0.9927989011984076, 'epsilon': 6.345462384454807e-07, 'balanced_loss': False, 'epochs': 95, 'early_stopping_patience': 12, 'plateau_patience': 15, 'plateau_divider': 6}. Best is trial 48 with value: 0.5081531127424952.
CUDA out of memory. Tried to allocate 1.70 GiB. GPU 0 has a total capacity of 44.56 GiB of which 240.69 MiB is free. Including non-PyTorch memory, this process has 44.32 GiB memory in use. Of the allocated memory 42.46 GiB is allocated by PyTorch, and 722.09 MiB is reserved by PyTorch but unallocated. If reserved but unallocated memory is large try setting PYTORCH_CUDA_ALLOC_CONF=expandable_segments:True to avoid fragmentation.  See documentation for Memory Management  (https://pytorch.org/docs/stable/notes/cuda.html#environment-variables)
[I 2025-02-27 00:39:56,669] Trial 56 finished with value: -1.0 and parameters: {'left_stride': 32, 'right_stride': 32, 'attention_pooling_operation': 'mean', 'embedding_pooling_operation': 'max', 'threshold': 0.9202010001626516, 'batch_size': 71, 'attention_heads': 6, 'hidden_dimension': 154, 'number_of_hidden_layers': 2, 'dropout_rate': 0.43654962014718285, 'global_pooling': 'sum', 'learning_rate': 0.000936314722544962, 'weight_decay': 6.68365721477805e-05, 'beta_0': 0.8329477228224018, 'beta_1': 0.9844938173983308, 'epsilon': 3.4634111629749797e-07, 'balanced_loss': False, 'epochs': 123, 'early_stopping_patience': 14, 'plateau_patience': 16, 'plateau_divider': 10}. Best is trial 48 with value: 0.5081531127424952.
CUDA out of memory. Tried to allocate 1.37 GiB. GPU 0 has a total capacity of 44.56 GiB of which 164.69 MiB is free. Including non-PyTorch memory, this process has 44.39 GiB memory in use. Of the allocated memory 42.43 GiB is allocated by PyTorch, and 834.43 MiB is reserved by PyTorch but unallocated. If reserved but unallocated memory is large try setting PYTORCH_CUDA_ALLOC_CONF=expandable_segments:True to avoid fragmentation.  See documentation for Memory Management  (https://pytorch.org/docs/stable/notes/cuda.html#environment-variables)
[I 2025-02-27 00:58:16,355] Trial 57 finished with value: -1.0 and parameters: {'left_stride': 0, 'right_stride': 0, 'attention_pooling_operation': 'mean', 'embedding_pooling_operation': 'mean', 'threshold': 0.9334960039120562, 'batch_size': 94, 'attention_heads': 5, 'hidden_dimension': 136, 'number_of_hidden_layers': 1, 'dropout_rate': 0.37174883672751147, 'global_pooling': 'sum', 'learning_rate': 0.0020492163922829682, 'weight_decay': 0.00045057087535833184, 'beta_0': 0.8269685740179337, 'beta_1': 0.995897598222743, 'epsilon': 2.1551685588290258e-07, 'balanced_loss': True, 'epochs': 153, 'early_stopping_patience': 20, 'plateau_patience': 15, 'plateau_divider': 7}. Best is trial 48 with value: 0.5081531127424952.
CUDA out of memory. Tried to allocate 1.30 GiB. GPU 0 has a total capacity of 44.56 GiB of which 772.69 MiB is free. Including non-PyTorch memory, this process has 43.80 GiB memory in use. Of the allocated memory 41.99 GiB is allocated by PyTorch, and 675.14 MiB is reserved by PyTorch but unallocated. If reserved but unallocated memory is large try setting PYTORCH_CUDA_ALLOC_CONF=expandable_segments:True to avoid fragmentation.  See documentation for Memory Management  (https://pytorch.org/docs/stable/notes/cuda.html#environment-variables)
[I 2025-02-27 01:12:07,654] Trial 58 finished with value: -1.0 and parameters: {'left_stride': 256, 'right_stride': 128, 'attention_pooling_operation': 'min', 'embedding_pooling_operation': 'max', 'threshold': 0.9748295425181396, 'batch_size': 51, 'attention_heads': 13, 'hidden_dimension': 192, 'number_of_hidden_layers': 4, 'dropout_rate': 0.49425474368000333, 'global_pooling': 'max', 'learning_rate': 0.004664027864431761, 'weight_decay': 1.5927431759512717e-05, 'beta_0': 0.8039370928170889, 'beta_1': 0.9871827178600339, 'epsilon': 5.509358096013087e-07, 'balanced_loss': False, 'epochs': 113, 'early_stopping_patience': 25, 'plateau_patience': 14, 'plateau_divider': 9}. Best is trial 48 with value: 0.5081531127424952.
CUDA out of memory. Tried to allocate 1.80 GiB. GPU 0 has a total capacity of 44.56 GiB of which 1.07 GiB is free. Including non-PyTorch memory, this process has 43.48 GiB memory in use. Of the allocated memory 42.13 GiB is allocated by PyTorch, and 208.97 MiB is reserved by PyTorch but unallocated. If reserved but unallocated memory is large try setting PYTORCH_CUDA_ALLOC_CONF=expandable_segments:True to avoid fragmentation.  See documentation for Memory Management  (https://pytorch.org/docs/stable/notes/cuda.html#environment-variables)
[I 2025-02-27 01:30:32,130] Trial 59 finished with value: -1.0 and parameters: {'left_stride': 0, 'right_stride': 128, 'attention_pooling_operation': 'mean', 'embedding_pooling_operation': 'mean', 'threshold': 0.9459497754279447, 'batch_size': 126, 'attention_heads': 4, 'hidden_dimension': 205, 'number_of_hidden_layers': 1, 'dropout_rate': 0.45159456752429816, 'global_pooling': 'mean', 'learning_rate': 0.019499196338177795, 'weight_decay': 0.0007968175012549253, 'beta_0': 0.8204950618678126, 'beta_1': 0.9945228971144418, 'epsilon': 9.44154447026078e-07, 'balanced_loss': False, 'epochs': 73, 'early_stopping_patience': 19, 'plateau_patience': 17, 'plateau_divider': 8}. Best is trial 48 with value: 0.5081531127424952.
CUDA out of memory. Tried to allocate 190.00 MiB. GPU 0 has a total capacity of 44.56 GiB of which 64.69 MiB is free. Including non-PyTorch memory, this process has 44.49 GiB memory in use. Of the allocated memory 42.41 GiB is allocated by PyTorch, and 953.00 MiB is reserved by PyTorch but unallocated. If reserved but unallocated memory is large try setting PYTORCH_CUDA_ALLOC_CONF=expandable_segments:True to avoid fragmentation.  See documentation for Memory Management  (https://pytorch.org/docs/stable/notes/cuda.html#environment-variables)
[I 2025-02-27 01:48:06,352] Trial 60 finished with value: -1.0 and parameters: {'left_stride': 32, 'right_stride': 64, 'attention_pooling_operation': 'mean', 'embedding_pooling_operation': 'max', 'threshold': 0.9067214286743984, 'batch_size': 64, 'attention_heads': 9, 'hidden_dimension': 167, 'number_of_hidden_layers': 3, 'dropout_rate': 0.38424659034921, 'global_pooling': 'sum', 'learning_rate': 0.0013060521038602722, 'weight_decay': 7.034074343640121e-06, 'beta_0': 0.8378374272978969, 'beta_1': 0.9829777360379134, 'epsilon': 2.2005627425226696e-06, 'balanced_loss': False, 'epochs': 58, 'early_stopping_patience': 21, 'plateau_patience': 12, 'plateau_divider': 7}. Best is trial 48 with value: 0.5081531127424952.
[I 2025-02-27 02:04:35,261] Trial 61 finished with value: 0.5159970815551687 and parameters: {'left_stride': 0, 'right_stride': 256, 'attention_pooling_operation': 'max', 'embedding_pooling_operation': 'max', 'threshold': 0.9912149211954169, 'batch_size': 32, 'attention_heads': 5, 'hidden_dimension': 182, 'number_of_hidden_layers': 2, 'dropout_rate': 0.3471531764633749, 'global_pooling': 'sum', 'learning_rate': 0.0005794129198740482, 'weight_decay': 0.00025995931432627604, 'beta_0': 0.8885142189176355, 'beta_1': 0.9902898548655753, 'epsilon': 1.05200655829188e-07, 'balanced_loss': False, 'epochs': 86, 'early_stopping_patience': 22, 'plateau_patience': 13, 'plateau_divider': 9}. Best is trial 61 with value: 0.5159970815551687.
[I 2025-02-27 02:20:28,950] Trial 62 finished with value: 0.5086036725870391 and parameters: {'left_stride': 0, 'right_stride': 256, 'attention_pooling_operation': 'max', 'embedding_pooling_operation': 'max', 'threshold': 0.9932785565954806, 'batch_size': 33, 'attention_heads': 5, 'hidden_dimension': 176, 'number_of_hidden_layers': 2, 'dropout_rate': 0.3419302740091185, 'global_pooling': 'sum', 'learning_rate': 0.0006377416440877196, 'weight_decay': 0.0002761522062718165, 'beta_0': 0.8807197191502368, 'beta_1': 0.9914808331547593, 'epsilon': 1.0565193743936833e-07, 'balanced_loss': False, 'epochs': 119, 'early_stopping_patience': 22, 'plateau_patience': 11, 'plateau_divider': 9}. Best is trial 61 with value: 0.5159970815551687.
