[I 2025-03-03 10:52:13,141] Trial 244 finished with value: 0.5528394312295294 and parameters: {'left_stride': 128, 'right_stride': 0, 'attention_pooling_operation': 'max', 'embedding_pooling_operation': 'min', 'threshold': 0.9579495645200845, 'batch_size': 35, 'attention_heads': 11, 'hidden_dimension': 82, 'number_of_hidden_layers': 2, 'dropout_rate': 0.32714393592325736, 'global_pooling': 'mean', 'learning_rate': 0.0004721439900097041, 'weight_decay': 6.356701847823576e-06, 'beta_0': 0.8904938449761581, 'beta_1': 0.9887152198466539, 'epsilon': 1.9588014139147698e-08, 'balanced_loss': True, 'epochs': 160, 'early_stopping_patience': 23, 'plateau_patience': 10, 'plateau_divider': 4}. Best is trial 147 with value: 0.5890664194848952.
[I 2025-03-03 11:11:18,745] Trial 245 finished with value: 0.5279681762489747 and parameters: {'left_stride': 128, 'right_stride': 0, 'attention_pooling_operation': 'max', 'embedding_pooling_operation': 'min', 'threshold': 0.9584881935543876, 'batch_size': 36, 'attention_heads': 11, 'hidden_dimension': 79, 'number_of_hidden_layers': 2, 'dropout_rate': 0.33029127945328063, 'global_pooling': 'mean', 'learning_rate': 0.0004730045780104356, 'weight_decay': 6.99558883566677e-06, 'beta_0': 0.8907960861067898, 'beta_1': 0.9891976818225895, 'epsilon': 1.8568092410908614e-08, 'balanced_loss': True, 'epochs': 149, 'early_stopping_patience': 23, 'plateau_patience': 10, 'plateau_divider': 4}. Best is trial 147 with value: 0.5890664194848952.
[I 2025-03-03 11:31:34,725] Trial 246 finished with value: 0.5493450795482492 and parameters: {'left_stride': 128, 'right_stride': 0, 'attention_pooling_operation': 'max', 'embedding_pooling_operation': 'min', 'threshold': 0.9546551650529584, 'batch_size': 35, 'attention_heads': 11, 'hidden_dimension': 87, 'number_of_hidden_layers': 2, 'dropout_rate': 0.34343455763583636, 'global_pooling': 'mean', 'learning_rate': 0.0009292161222111591, 'weight_decay': 1.1866001984969647e-06, 'beta_0': 0.893544719353732, 'beta_1': 0.988687267464433, 'epsilon': 1.648196787327561e-08, 'balanced_loss': True, 'epochs': 154, 'early_stopping_patience': 23, 'plateau_patience': 10, 'plateau_divider': 4}. Best is trial 147 with value: 0.5890664194848952.
[I 2025-03-03 11:52:12,395] Trial 247 finished with value: 0.5399853812667462 and parameters: {'left_stride': 128, 'right_stride': 0, 'attention_pooling_operation': 'max', 'embedding_pooling_operation': 'min', 'threshold': 0.9484919049020694, 'batch_size': 32, 'attention_heads': 11, 'hidden_dimension': 87, 'number_of_hidden_layers': 2, 'dropout_rate': 0.351076519664171, 'global_pooling': 'mean', 'learning_rate': 0.0012863110536983297, 'weight_decay': 1.2590091621847933e-06, 'beta_0': 0.8999955060953992, 'beta_1': 0.9885771991101157, 'epsilon': 1.390974774283657e-08, 'balanced_loss': True, 'epochs': 153, 'early_stopping_patience': 23, 'plateau_patience': 10, 'plateau_divider': 5}. Best is trial 147 with value: 0.5890664194848952.
[I 2025-03-03 12:12:04,806] Trial 248 finished with value: 0.5200049546296817 and parameters: {'left_stride': 128, 'right_stride': 0, 'attention_pooling_operation': 'max', 'embedding_pooling_operation': 'min', 'threshold': 0.9533802722783945, 'batch_size': 35, 'attention_heads': 11, 'hidden_dimension': 82, 'number_of_hidden_layers': 2, 'dropout_rate': 0.34471517349484615, 'global_pooling': 'mean', 'learning_rate': 0.000907664251981404, 'weight_decay': 1.2944155244918261e-06, 'beta_0': 0.8891643938187382, 'beta_1': 0.9889015207449645, 'epsilon': 1.7076325659499133e-08, 'balanced_loss': True, 'epochs': 157, 'early_stopping_patience': 24, 'plateau_patience': 10, 'plateau_divider': 4}. Best is trial 147 with value: 0.5890664194848952.
[I 2025-03-03 12:30:26,803] Trial 249 finished with value: 0.5242609441482841 and parameters: {'left_stride': 128, 'right_stride': 0, 'attention_pooling_operation': 'max', 'embedding_pooling_operation': 'min', 'threshold': 0.9568164312874909, 'batch_size': 34, 'attention_heads': 10, 'hidden_dimension': 77, 'number_of_hidden_layers': 2, 'dropout_rate': 0.34085946656590616, 'global_pooling': 'mean', 'learning_rate': 0.001155384188546478, 'weight_decay': 6.207395819258062e-06, 'beta_0': 0.8876331156344092, 'beta_1': 0.989482197198284, 'epsilon': 2.11035264870691e-08, 'balanced_loss': True, 'epochs': 154, 'early_stopping_patience': 23, 'plateau_patience': 19, 'plateau_divider': 4}. Best is trial 147 with value: 0.5890664194848952.
[I 2025-03-03 12:50:13,523] Trial 250 finished with value: 0.541993121492372 and parameters: {'left_stride': 128, 'right_stride': 0, 'attention_pooling_operation': 'max', 'embedding_pooling_operation': 'min', 'threshold': 0.9617120257900366, 'batch_size': 36, 'attention_heads': 11, 'hidden_dimension': 100, 'number_of_hidden_layers': 2, 'dropout_rate': 0.3342610415898247, 'global_pooling': 'mean', 'learning_rate': 0.0007010342382741427, 'weight_decay': 1.5157261620781e-06, 'beta_0': 0.8938728765936336, 'beta_1': 0.9880071641506372, 'epsilon': 1.5818435989505887e-08, 'balanced_loss': True, 'epochs': 159, 'early_stopping_patience': 23, 'plateau_patience': 10, 'plateau_divider': 4}. Best is trial 147 with value: 0.5890664194848952.
[I 2025-03-03 13:08:52,888] Trial 251 finished with value: 0.5478316555829734 and parameters: {'left_stride': 128, 'right_stride': 0, 'attention_pooling_operation': 'max', 'embedding_pooling_operation': 'min', 'threshold': 0.9558635627615935, 'batch_size': 32, 'attention_heads': 11, 'hidden_dimension': 73, 'number_of_hidden_layers': 2, 'dropout_rate': 0.3470757760310975, 'global_pooling': 'mean', 'learning_rate': 0.0004883918812320775, 'weight_decay': 2.6367615035091436e-05, 'beta_0': 0.8922896948927822, 'beta_1': 0.9886920317243916, 'epsilon': 1.2846949815048218e-08, 'balanced_loss': True, 'epochs': 147, 'early_stopping_patience': 22, 'plateau_patience': 10, 'plateau_divider': 4}. Best is trial 147 with value: 0.5890664194848952.
[I 2025-03-03 13:28:06,122] Trial 252 finished with value: 0.566447933549244 and parameters: {'left_stride': 128, 'right_stride': 0, 'attention_pooling_operation': 'max', 'embedding_pooling_operation': 'min', 'threshold': 0.9419664737848323, 'batch_size': 32, 'attention_heads': 10, 'hidden_dimension': 72, 'number_of_hidden_layers': 2, 'dropout_rate': 0.3469713831487905, 'global_pooling': 'mean', 'learning_rate': 0.0004680881440777249, 'weight_decay': 2.3124458076583356e-05, 'beta_0': 0.8951795733885182, 'beta_1': 0.9888389567689664, 'epsilon': 1.1273762349038422e-08, 'balanced_loss': True, 'epochs': 147, 'early_stopping_patience': 22, 'plateau_patience': 10, 'plateau_divider': 4}. Best is trial 147 with value: 0.5890664194848952.
[I 2025-03-03 13:48:21,337] Trial 253 finished with value: 0.5190772412374983 and parameters: {'left_stride': 128, 'right_stride': 0, 'attention_pooling_operation': 'max', 'embedding_pooling_operation': 'min', 'threshold': 0.941739835746261, 'batch_size': 32, 'attention_heads': 10, 'hidden_dimension': 84, 'number_of_hidden_layers': 2, 'dropout_rate': 0.34964980214504704, 'global_pooling': 'mean', 'learning_rate': 0.0004362469612005954, 'weight_decay': 2.617359254877221e-05, 'beta_0': 0.8912252120101529, 'beta_1': 0.9887603855580349, 'epsilon': 1.022148590598363e-08, 'balanced_loss': True, 'epochs': 148, 'early_stopping_patience': 22, 'plateau_patience': 10, 'plateau_divider': 4}. Best is trial 147 with value: 0.5890664194848952.
[I 2025-03-03 14:07:18,762] Trial 254 finished with value: 0.535739587982927 and parameters: {'left_stride': 128, 'right_stride': 0, 'attention_pooling_operation': 'max', 'embedding_pooling_operation': 'min', 'threshold': 0.9367255310723985, 'batch_size': 32, 'attention_heads': 10, 'hidden_dimension': 66, 'number_of_hidden_layers': 2, 'dropout_rate': 0.3471841200274332, 'global_pooling': 'mean', 'learning_rate': 0.0005229526352725222, 'weight_decay': 2.767292419516971e-05, 'beta_0': 0.8932580369353158, 'beta_1': 0.9884762913794681, 'epsilon': 1.2758700014338032e-08, 'balanced_loss': True, 'epochs': 146, 'early_stopping_patience': 23, 'plateau_patience': 10, 'plateau_divider': 4}. Best is trial 147 with value: 0.5890664194848952.
[I 2025-03-03 14:25:03,018] Trial 255 finished with value: 0.5373594585204148 and parameters: {'left_stride': 128, 'right_stride': 0, 'attention_pooling_operation': 'max', 'embedding_pooling_operation': 'min', 'threshold': 0.9455192653299631, 'batch_size': 34, 'attention_heads': 9, 'hidden_dimension': 71, 'number_of_hidden_layers': 2, 'dropout_rate': 0.3559827298168704, 'global_pooling': 'mean', 'learning_rate': 0.00047522177924819116, 'weight_decay': 2.3335436533952337e-05, 'beta_0': 0.8950729810999598, 'beta_1': 0.9891113202072046, 'epsilon': 1.2094500413042547e-08, 'balanced_loss': True, 'epochs': 151, 'early_stopping_patience': 22, 'plateau_patience': 10, 'plateau_divider': 4}. Best is trial 147 with value: 0.5890664194848952.
[I 2025-03-03 14:43:58,921] Trial 256 finished with value: 0.5574137891853019 and parameters: {'left_stride': 128, 'right_stride': 0, 'attention_pooling_operation': 'max', 'embedding_pooling_operation': 'min', 'threshold': 0.951129866391336, 'batch_size': 34, 'attention_heads': 11, 'hidden_dimension': 76, 'number_of_hidden_layers': 2, 'dropout_rate': 0.34025535082467984, 'global_pooling': 'mean', 'learning_rate': 0.00039185798588773735, 'weight_decay': 2.96333830752796e-05, 'beta_0': 0.8957546420355449, 'beta_1': 0.987943219345615, 'epsilon': 1.8652552510377047e-08, 'balanced_loss': True, 'epochs': 145, 'early_stopping_patience': 21, 'plateau_patience': 10, 'plateau_divider': 4}. Best is trial 147 with value: 0.5890664194848952.
[I 2025-03-03 15:04:40,017] Trial 257 finished with value: 0.5527043468790326 and parameters: {'left_stride': 128, 'right_stride': 0, 'attention_pooling_operation': 'max', 'embedding_pooling_operation': 'min', 'threshold': 0.9494037359169915, 'batch_size': 34, 'attention_heads': 11, 'hidden_dimension': 89, 'number_of_hidden_layers': 2, 'dropout_rate': 0.3422770332450137, 'global_pooling': 'mean', 'learning_rate': 0.0003672976354729676, 'weight_decay': 1.14089399554779e-06, 'beta_0': 0.8954010294035545, 'beta_1': 0.9877754383086325, 'epsilon': 1.777031292416156e-08, 'balanced_loss': True, 'epochs': 143, 'early_stopping_patience': 21, 'plateau_patience': 10, 'plateau_divider': 4}. Best is trial 147 with value: 0.5890664194848952.
[I 2025-03-03 15:23:43,174] Trial 258 finished with value: 0.531332321306753 and parameters: {'left_stride': 128, 'right_stride': 0, 'attention_pooling_operation': 'min', 'embedding_pooling_operation': 'min', 'threshold': 0.9501999464584822, 'batch_size': 34, 'attention_heads': 11, 'hidden_dimension': 73, 'number_of_hidden_layers': 2, 'dropout_rate': 0.3634994982441316, 'global_pooling': 'mean', 'learning_rate': 0.0003675807923346758, 'weight_decay': 1.2211640397171654e-06, 'beta_0': 0.8893567616172304, 'beta_1': 0.9872476951966024, 'epsilon': 1.87479491752931e-08, 'balanced_loss': True, 'epochs': 143, 'early_stopping_patience': 24, 'plateau_patience': 10, 'plateau_divider': 4}. Best is trial 147 with value: 0.5890664194848952.
[I 2025-03-03 15:43:25,648] Trial 259 finished with value: 0.5379414770674058 and parameters: {'left_stride': 128, 'right_stride': 0, 'attention_pooling_operation': 'max', 'embedding_pooling_operation': 'mean', 'threshold': 0.941897800132723, 'batch_size': 34, 'attention_heads': 11, 'hidden_dimension': 79, 'number_of_hidden_layers': 2, 'dropout_rate': 0.3432974327804786, 'global_pooling': 'mean', 'learning_rate': 0.00038456309996153003, 'weight_decay': 1.0040367799864467e-06, 'beta_0': 0.8932935806031885, 'beta_1': 0.9861122629421953, 'epsilon': 2.3368318509643462e-08, 'balanced_loss': True, 'epochs': 146, 'early_stopping_patience': 21, 'plateau_patience': 10, 'plateau_divider': 4}. Best is trial 147 with value: 0.5890664194848952.
[I 2025-03-03 16:03:00,812] Trial 260 finished with value: 0.5524712913811776 and parameters: {'left_stride': 128, 'right_stride': 0, 'attention_pooling_operation': 'max', 'embedding_pooling_operation': 'min', 'threshold': 0.9481605083851051, 'batch_size': 35, 'attention_heads': 11, 'hidden_dimension': 82, 'number_of_hidden_layers': 2, 'dropout_rate': 0.339806540305625, 'global_pooling': 'mean', 'learning_rate': 0.000526992706172736, 'weight_decay': 3.0017088346071684e-05, 'beta_0': 0.8962485655964189, 'beta_1': 0.9877197366056792, 'epsilon': 1.8007277723395822e-08, 'balanced_loss': True, 'epochs': 149, 'early_stopping_patience': 21, 'plateau_patience': 10, 'plateau_divider': 5}. Best is trial 147 with value: 0.5890664194848952.
[I 2025-03-03 16:24:01,697] Trial 261 finished with value: 0.5673512444163891 and parameters: {'left_stride': 128, 'right_stride': 0, 'attention_pooling_operation': 'max', 'embedding_pooling_operation': 'min', 'threshold': 0.9445747610803945, 'batch_size': 36, 'attention_heads': 11, 'hidden_dimension': 82, 'number_of_hidden_layers': 2, 'dropout_rate': 0.3516318723594828, 'global_pooling': 'mean', 'learning_rate': 0.00035372580852238, 'weight_decay': 2.944886737090996e-05, 'beta_0': 0.8918298996293035, 'beta_1': 0.9876212410754496, 'epsilon': 1.8314421614948057e-08, 'balanced_loss': True, 'epochs': 141, 'early_stopping_patience': 21, 'plateau_patience': 10, 'plateau_divider': 4}. Best is trial 147 with value: 0.5890664194848952.
CUDA out of memory. Tried to allocate 710.00 MiB. GPU 0 has a total capacity of 44.56 GiB of which 228.69 MiB is free. Including non-PyTorch memory, this process has 44.33 GiB memory in use. Of the allocated memory 42.39 GiB is allocated by PyTorch, and 813.71 MiB is reserved by PyTorch but unallocated. If reserved but unallocated memory is large try setting PYTORCH_CUDA_ALLOC_CONF=expandable_segments:True to avoid fragmentation.  See documentation for Memory Management  (https://pytorch.org/docs/stable/notes/cuda.html#environment-variables)
[I 2025-03-03 16:36:54,834] Trial 262 finished with value: -1.0 and parameters: {'left_stride': 128, 'right_stride': 64, 'attention_pooling_operation': 'max', 'embedding_pooling_operation': 'min', 'threshold': 0.9321526681877634, 'batch_size': 36, 'attention_heads': 11, 'hidden_dimension': 76, 'number_of_hidden_layers': 2, 'dropout_rate': 0.369750744525414, 'global_pooling': 'mean', 'learning_rate': 0.00034581886182010244, 'weight_decay': 3.155281657595227e-05, 'beta_0': 0.8845560106895045, 'beta_1': 0.9876139461437105, 'epsilon': 1.6258945025715377e-08, 'balanced_loss': True, 'epochs': 143, 'early_stopping_patience': 21, 'plateau_patience': 10, 'plateau_divider': 4}. Best is trial 147 with value: 0.5890664194848952.
[I 2025-03-03 16:55:58,375] Trial 263 finished with value: 0.5390242097343476 and parameters: {'left_stride': 128, 'right_stride': 0, 'attention_pooling_operation': 'max', 'embedding_pooling_operation': 'min', 'threshold': 0.9464784790765508, 'batch_size': 36, 'attention_heads': 11, 'hidden_dimension': 68, 'number_of_hidden_layers': 2, 'dropout_rate': 0.35237798343851795, 'global_pooling': 'mean', 'learning_rate': 0.0004284505681148492, 'weight_decay': 3.8116533192147585e-05, 'beta_0': 0.8912624621701297, 'beta_1': 0.9878779130136451, 'epsilon': 1.8513026111993052e-08, 'balanced_loss': True, 'epochs': 140, 'early_stopping_patience': 21, 'plateau_patience': 10, 'plateau_divider': 4}. Best is trial 147 with value: 0.5890664194848952.
CUDA out of memory. Tried to allocate 1.79 GiB. GPU 0 has a total capacity of 44.56 GiB of which 512.69 MiB is free. Including non-PyTorch memory, this process has 44.05 GiB memory in use. Of the allocated memory 42.50 GiB is allocated by PyTorch, and 412.81 MiB is reserved by PyTorch but unallocated. If reserved but unallocated memory is large try setting PYTORCH_CUDA_ALLOC_CONF=expandable_segments:True to avoid fragmentation.  See documentation for Memory Management  (https://pytorch.org/docs/stable/notes/cuda.html#environment-variables)
[I 2025-03-03 17:08:47,320] Trial 264 finished with value: -1.0 and parameters: {'left_stride': 128, 'right_stride': 0, 'attention_pooling_operation': 'max', 'embedding_pooling_operation': 'min', 'threshold': 0.9402048702839478, 'batch_size': 102, 'attention_heads': 11, 'hidden_dimension': 82, 'number_of_hidden_layers': 2, 'dropout_rate': 0.3585201592967986, 'global_pooling': 'mean', 'learning_rate': 0.00032668531386173305, 'weight_decay': 2.9359884160295906e-05, 'beta_0': 0.8880505552240427, 'beta_1': 0.9870849856628805, 'epsilon': 1.2865160267189303e-08, 'balanced_loss': True, 'epochs': 146, 'early_stopping_patience': 21, 'plateau_patience': 10, 'plateau_divider': 5}. Best is trial 147 with value: 0.5890664194848952.
[I 2025-03-03 17:29:25,406] Trial 265 finished with value: 0.5536397800733294 and parameters: {'left_stride': 128, 'right_stride': 0, 'attention_pooling_operation': 'max', 'embedding_pooling_operation': 'min', 'threshold': 0.9484410539454138, 'batch_size': 35, 'attention_heads': 11, 'hidden_dimension': 88, 'number_of_hidden_layers': 2, 'dropout_rate': 0.3479227347778957, 'global_pooling': 'mean', 'learning_rate': 0.0003910092150686597, 'weight_decay': 5.158000413394961e-06, 'beta_0': 0.8924001845700439, 'beta_1': 0.9881346281831368, 'epsilon': 1.0329855817742914e-08, 'balanced_loss': True, 'epochs': 148, 'early_stopping_patience': 21, 'plateau_patience': 10, 'plateau_divider': 5}. Best is trial 147 with value: 0.5890664194848952.
CUDA out of memory. Tried to allocate 1.03 GiB. GPU 0 has a total capacity of 44.56 GiB of which 1.00 GiB is free. Including non-PyTorch memory, this process has 43.55 GiB memory in use. Of the allocated memory 41.35 GiB is allocated by PyTorch, and 1.05 GiB is reserved by PyTorch but unallocated. If reserved but unallocated memory is large try setting PYTORCH_CUDA_ALLOC_CONF=expandable_segments:True to avoid fragmentation.  See documentation for Memory Management  (https://pytorch.org/docs/stable/notes/cuda.html#environment-variables)
[I 2025-03-03 17:44:06,848] Trial 266 finished with value: -1.0 and parameters: {'left_stride': 128, 'right_stride': 0, 'attention_pooling_operation': 'max', 'embedding_pooling_operation': 'min', 'threshold': 0.9435883226759051, 'batch_size': 37, 'attention_heads': 11, 'hidden_dimension': 83, 'number_of_hidden_layers': 2, 'dropout_rate': 0.34700173612459695, 'global_pooling': 'mean', 'learning_rate': 0.00044777686605247105, 'weight_decay': 4.366123259012622e-06, 'beta_0': 0.8927791341671031, 'beta_1': 0.9863572301899619, 'epsilon': 1.2352317536971275e-08, 'balanced_loss': True, 'epochs': 148, 'early_stopping_patience': 21, 'plateau_patience': 10, 'plateau_divider': 6}. Best is trial 147 with value: 0.5890664194848952.
[I 2025-03-03 18:03:58,007] Trial 267 finished with value: 0.533761677914489 and parameters: {'left_stride': 128, 'right_stride': 0, 'attention_pooling_operation': 'min', 'embedding_pooling_operation': 'min', 'threshold': 0.9506495690487315, 'batch_size': 56, 'attention_heads': 11, 'hidden_dimension': 88, 'number_of_hidden_layers': 2, 'dropout_rate': 0.35142055035992853, 'global_pooling': 'mean', 'learning_rate': 0.0003879892774887812, 'weight_decay': 5.058185764263217e-06, 'beta_0': 0.8948883772163874, 'beta_1': 0.9875235004307791, 'epsilon': 1.043069322256577e-08, 'balanced_loss': True, 'epochs': 149, 'early_stopping_patience': 21, 'plateau_patience': 10, 'plateau_divider': 5}. Best is trial 147 with value: 0.5890664194848952.
[I 2025-03-03 18:24:19,860] Trial 268 finished with value: 0.5735689862142955 and parameters: {'left_stride': 128, 'right_stride': 0, 'attention_pooling_operation': 'max', 'embedding_pooling_operation': 'min', 'threshold': 0.9479003716580366, 'batch_size': 35, 'attention_heads': 11, 'hidden_dimension': 73, 'number_of_hidden_layers': 2, 'dropout_rate': 0.4597161452301908, 'global_pooling': 'mean', 'learning_rate': 0.0005785630872968795, 'weight_decay': 3.587623825064129e-05, 'beta_0': 0.8922417747076103, 'beta_1': 0.9881474819855005, 'epsilon': 1.0004975325995126e-08, 'balanced_loss': True, 'epochs': 145, 'early_stopping_patience': 21, 'plateau_patience': 10, 'plateau_divider': 5}. Best is trial 147 with value: 0.5890664194848952.
[I 2025-03-03 18:44:20,420] Trial 269 finished with value: 0.5647480728690178 and parameters: {'left_stride': 128, 'right_stride': 0, 'attention_pooling_operation': 'max', 'embedding_pooling_operation': 'min', 'threshold': 0.9479905535180814, 'batch_size': 35, 'attention_heads': 11, 'hidden_dimension': 74, 'number_of_hidden_layers': 2, 'dropout_rate': 0.45985136024322937, 'global_pooling': 'mean', 'learning_rate': 0.0005889078762801545, 'weight_decay': 4.129664726057974e-05, 'beta_0': 0.8902555870537563, 'beta_1': 0.9879849703686303, 'epsilon': 1.0560920261152586e-08, 'balanced_loss': True, 'epochs': 145, 'early_stopping_patience': 21, 'plateau_patience': 10, 'plateau_divider': 5}. Best is trial 147 with value: 0.5890664194848952.
slurmstepd: error: *** JOB 15068788 ON gpu007 CANCELLED AT 2025-03-03T18:55:45 DUE TO TIME LIMIT ***
