[I 2025-03-04 13:24:15,109] Trial 295 finished with value: 0.5357987526798066 and parameters: {'left_stride': 128, 'right_stride': 0, 'attention_pooling_operation': 'mean', 'embedding_pooling_operation': 'min', 'threshold': 0.9462175666105838, 'batch_size': 36, 'attention_heads': 10, 'hidden_dimension': 87, 'number_of_hidden_layers': 2, 'dropout_rate': 0.4880483671874333, 'global_pooling': 'mean', 'learning_rate': 0.00032834941224860626, 'weight_decay': 2.954892128266126e-05, 'beta_0': 0.898253205405517, 'beta_1': 0.9869649987365076, 'epsilon': 2.110668806844084e-08, 'balanced_loss': True, 'epochs': 152, 'early_stopping_patience': 22, 'plateau_patience': 11, 'plateau_divider': 5}. Best is trial 147 with value: 0.5890664194848952.
[I 2025-03-04 13:51:26,835] Trial 296 finished with value: 0.4860704714802827 and parameters: {'left_stride': 128, 'right_stride': 0, 'attention_pooling_operation': 'mean', 'embedding_pooling_operation': 'min', 'threshold': 0.9400734692781255, 'batch_size': 34, 'attention_heads': 10, 'hidden_dimension': 92, 'number_of_hidden_layers': 2, 'dropout_rate': 0.48784399636548803, 'global_pooling': 'max', 'learning_rate': 0.001891572579728019, 'weight_decay': 3.434053001585361e-05, 'beta_0': 0.8954618797889983, 'beta_1': 0.986896427255116, 'epsilon': 1.8344654855426222e-08, 'balanced_loss': True, 'epochs': 147, 'early_stopping_patience': 22, 'plateau_patience': 11, 'plateau_divider': 5}. Best is trial 147 with value: 0.5890664194848952.
CUDA out of memory. Tried to allocate 1.27 GiB. GPU 0 has a total capacity of 44.56 GiB of which 1.18 GiB is free. Including non-PyTorch memory, this process has 43.38 GiB memory in use. Of the allocated memory 41.65 GiB is allocated by PyTorch, and 583.58 MiB is reserved by PyTorch but unallocated. If reserved but unallocated memory is large try setting PYTORCH_CUDA_ALLOC_CONF=expandable_segments:True to avoid fragmentation.  See documentation for Memory Management  (https://pytorch.org/docs/stable/notes/cuda.html#environment-variables)
[I 2025-03-04 14:09:15,370] Trial 297 finished with value: -1.0 and parameters: {'left_stride': 128, 'right_stride': 0, 'attention_pooling_operation': 'mean', 'embedding_pooling_operation': 'min', 'threshold': 0.9340559307927067, 'batch_size': 69, 'attention_heads': 10, 'hidden_dimension': 86, 'number_of_hidden_layers': 2, 'dropout_rate': 0.5157430977566538, 'global_pooling': 'mean', 'learning_rate': 0.0009043257820236887, 'weight_decay': 7.339387845446975e-05, 'beta_0': 0.8320919154715898, 'beta_1': 0.9875057453972663, 'epsilon': 2.3231093600218182e-08, 'balanced_loss': True, 'epochs': 138, 'early_stopping_patience': 23, 'plateau_patience': 11, 'plateau_divider': 5}. Best is trial 147 with value: 0.5890664194848952.
[I 2025-03-04 14:34:42,062] Trial 298 finished with value: 0.5047932636506146 and parameters: {'left_stride': 128, 'right_stride': 0, 'attention_pooling_operation': 'mean', 'embedding_pooling_operation': 'mean', 'threshold': 0.9503283862397799, 'batch_size': 38, 'attention_heads': 11, 'hidden_dimension': 79, 'number_of_hidden_layers': 2, 'dropout_rate': 0.43303023192915446, 'global_pooling': 'mean', 'learning_rate': 0.0006459962297751966, 'weight_decay': 1.1190525777931877e-06, 'beta_0': 0.8999740337808252, 'beta_1': 0.9884493414750765, 'epsilon': 1.3939825843461815e-08, 'balanced_loss': True, 'epochs': 154, 'early_stopping_patience': 22, 'plateau_patience': 22, 'plateau_divider': 5}. Best is trial 147 with value: 0.5890664194848952.
[I 2025-03-04 15:01:02,978] Trial 299 finished with value: 0.5184760061915644 and parameters: {'left_stride': 128, 'right_stride': 0, 'attention_pooling_operation': 'mean', 'embedding_pooling_operation': 'min', 'threshold': 0.9531308827605981, 'batch_size': 35, 'attention_heads': 11, 'hidden_dimension': 97, 'number_of_hidden_layers': 2, 'dropout_rate': 0.45475629393377165, 'global_pooling': 'mean', 'learning_rate': 0.0005277463868123125, 'weight_decay': 2.935002699167037e-05, 'beta_0': 0.8978195662543949, 'beta_1': 0.9879085804473624, 'epsilon': 1.1904235511087186e-08, 'balanced_loss': True, 'epochs': 143, 'early_stopping_patience': 22, 'plateau_patience': 11, 'plateau_divider': 6}. Best is trial 147 with value: 0.5890664194848952.
[I 2025-03-04 15:26:21,373] Trial 300 finished with value: 0.5302105330607371 and parameters: {'left_stride': 128, 'right_stride': 0, 'attention_pooling_operation': 'mean', 'embedding_pooling_operation': 'min', 'threshold': 0.94562013796566, 'batch_size': 34, 'attention_heads': 11, 'hidden_dimension': 81, 'number_of_hidden_layers': 2, 'dropout_rate': 0.3405305359771899, 'global_pooling': 'mean', 'learning_rate': 0.0003927875499015895, 'weight_decay': 2.0336615364777075e-05, 'beta_0': 0.8943739603300475, 'beta_1': 0.9888936011914793, 'epsilon': 2.5180910506919113e-08, 'balanced_loss': True, 'epochs': 149, 'early_stopping_patience': 23, 'plateau_patience': 10, 'plateau_divider': 4}. Best is trial 147 with value: 0.5890664194848952.
[I 2025-03-04 15:48:11,554] Trial 301 finished with value: 0.5273822457762171 and parameters: {'left_stride': 256, 'right_stride': 0, 'attention_pooling_operation': 'max', 'embedding_pooling_operation': 'min', 'threshold': 0.9500971777135131, 'batch_size': 40, 'attention_heads': 11, 'hidden_dimension': 89, 'number_of_hidden_layers': 2, 'dropout_rate': 0.48215888203344004, 'global_pooling': 'mean', 'learning_rate': 0.0007422012753667805, 'weight_decay': 1.6789139708864265e-06, 'beta_0': 0.890611214131362, 'beta_1': 0.985687721057646, 'epsilon': 1.600703398150086e-08, 'balanced_loss': True, 'epochs': 151, 'early_stopping_patience': 21, 'plateau_patience': 11, 'plateau_divider': 5}. Best is trial 147 with value: 0.5890664194848952.
[I 2025-03-04 16:07:17,222] Trial 302 finished with value: 0.5153197853233406 and parameters: {'left_stride': 128, 'right_stride': 0, 'attention_pooling_operation': 'max', 'embedding_pooling_operation': 'min', 'threshold': 0.955154077546059, 'batch_size': 72, 'attention_heads': 11, 'hidden_dimension': 69, 'number_of_hidden_layers': 2, 'dropout_rate': 0.43962152327441784, 'global_pooling': 'mean', 'learning_rate': 0.0005218053478910468, 'weight_decay': 2.5370389845842687e-05, 'beta_0': 0.8967215316269558, 'beta_1': 0.9873450379246681, 'epsilon': 2.0570974188736293e-08, 'balanced_loss': True, 'epochs': 155, 'early_stopping_patience': 21, 'plateau_patience': 10, 'plateau_divider': 4}. Best is trial 147 with value: 0.5890664194848952.
[I 2025-03-04 16:28:35,308] Trial 303 finished with value: 0.5181925424830368 and parameters: {'left_stride': 128, 'right_stride': 0, 'attention_pooling_operation': 'max', 'embedding_pooling_operation': 'min', 'threshold': 0.9438749218165803, 'batch_size': 36, 'attention_heads': 11, 'hidden_dimension': 77, 'number_of_hidden_layers': 2, 'dropout_rate': 0.5014206307085116, 'global_pooling': 'mean', 'learning_rate': 0.0009896019549125142, 'weight_decay': 4.011977642154136e-05, 'beta_0': 0.8883073644528989, 'beta_1': 0.9893181519664132, 'epsilon': 5.682598537104057e-06, 'balanced_loss': True, 'epochs': 163, 'early_stopping_patience': 20, 'plateau_patience': 10, 'plateau_divider': 4}. Best is trial 147 with value: 0.5890664194848952.
[I 2025-03-04 16:49:46,741] Trial 304 finished with value: 0.5474593439022989 and parameters: {'left_stride': 128, 'right_stride': 0, 'attention_pooling_operation': 'max', 'embedding_pooling_operation': 'min', 'threshold': 0.9487997009070936, 'batch_size': 34, 'attention_heads': 10, 'hidden_dimension': 86, 'number_of_hidden_layers': 2, 'dropout_rate': 0.46624821421333756, 'global_pooling': 'mean', 'learning_rate': 0.0003539521272715131, 'weight_decay': 3.2599802110260384e-05, 'beta_0': 0.8930968542737906, 'beta_1': 0.9884170650568079, 'epsilon': 1.7461592536727082e-08, 'balanced_loss': True, 'epochs': 144, 'early_stopping_patience': 21, 'plateau_patience': 10, 'plateau_divider': 4}. Best is trial 147 with value: 0.5890664194848952.
CUDA out of memory. Tried to allocate 960.00 MiB. GPU 0 has a total capacity of 44.56 GiB of which 742.69 MiB is free. Including non-PyTorch memory, this process has 43.83 GiB memory in use. Of the allocated memory 41.61 GiB is allocated by PyTorch, and 1.07 GiB is reserved by PyTorch but unallocated. If reserved but unallocated memory is large try setting PYTORCH_CUDA_ALLOC_CONF=expandable_segments:True to avoid fragmentation.  See documentation for Memory Management  (https://pytorch.org/docs/stable/notes/cuda.html#environment-variables)
[I 2025-03-04 17:03:26,619] Trial 305 finished with value: -1.0 and parameters: {'left_stride': 128, 'right_stride': 0, 'attention_pooling_operation': 'max', 'embedding_pooling_operation': 'min', 'threshold': 0.9403902947973516, 'batch_size': 38, 'attention_heads': 10, 'hidden_dimension': 93, 'number_of_hidden_layers': 2, 'dropout_rate': 0.3780671839617957, 'global_pooling': 'mean', 'learning_rate': 0.0004317722469903838, 'weight_decay': 2.284537535217334e-05, 'beta_0': 0.8958611273578362, 'beta_1': 0.9879019259712193, 'epsilon': 1.3721754832657056e-08, 'balanced_loss': True, 'epochs': 148, 'early_stopping_patience': 22, 'plateau_patience': 11, 'plateau_divider': 5}. Best is trial 147 with value: 0.5890664194848952.
[I 2025-03-04 17:22:40,641] Trial 306 finished with value: 0.5419957592085463 and parameters: {'left_stride': 128, 'right_stride': 0, 'attention_pooling_operation': 'max', 'embedding_pooling_operation': 'min', 'threshold': 0.9543547335483397, 'batch_size': 33, 'attention_heads': 11, 'hidden_dimension': 80, 'number_of_hidden_layers': 2, 'dropout_rate': 0.3419106950174021, 'global_pooling': 'mean', 'learning_rate': 0.0006761503155617864, 'weight_decay': 2.9396169745635558e-05, 'beta_0': 0.898648098557942, 'beta_1': 0.9867562384624027, 'epsilon': 1.0106063189558433e-08, 'balanced_loss': True, 'epochs': 140, 'early_stopping_patience': 22, 'plateau_patience': 10, 'plateau_divider': 4}. Best is trial 147 with value: 0.5890664194848952.
[I 2025-03-04 17:49:18,203] Trial 307 finished with value: 0.5093658518829374 and parameters: {'left_stride': 128, 'right_stride': 0, 'attention_pooling_operation': 'mean', 'embedding_pooling_operation': 'min', 'threshold': 0.9463358093260353, 'batch_size': 36, 'attention_heads': 11, 'hidden_dimension': 101, 'number_of_hidden_layers': 2, 'dropout_rate': 0.3556325156614351, 'global_pooling': 'mean', 'learning_rate': 0.000575172762707365, 'weight_decay': 3.7908368790193855e-05, 'beta_0': 0.8935860094336877, 'beta_1': 0.9989828689610365, 'epsilon': 2.6276455977217345e-08, 'balanced_loss': True, 'epochs': 155, 'early_stopping_patience': 21, 'plateau_patience': 11, 'plateau_divider': 4}. Best is trial 147 with value: 0.5890664194848952.
[I 2025-03-04 18:09:56,582] Trial 308 finished with value: 0.5275345063765314 and parameters: {'left_stride': 128, 'right_stride': 0, 'attention_pooling_operation': 'max', 'embedding_pooling_operation': 'mean', 'threshold': 0.9509750871691914, 'batch_size': 33, 'attention_heads': 11, 'hidden_dimension': 84, 'number_of_hidden_layers': 2, 'dropout_rate': 0.4472092308392785, 'global_pooling': 'mean', 'learning_rate': 0.00031307293321471065, 'weight_decay': 3.4335329513051884e-05, 'beta_0': 0.8913093442135458, 'beta_1': 0.9889165995876763, 'epsilon': 1.2053171218389296e-08, 'balanced_loss': True, 'epochs': 131, 'early_stopping_patience': 20, 'plateau_patience': 10, 'plateau_divider': 4}. Best is trial 147 with value: 0.5890664194848952.
[I 2025-03-04 18:30:53,932] Trial 309 finished with value: 0.5433817297519725 and parameters: {'left_stride': 128, 'right_stride': 0, 'attention_pooling_operation': 'max', 'embedding_pooling_operation': 'min', 'threshold': 0.9566729008344215, 'batch_size': 36, 'attention_heads': 11, 'hidden_dimension': 90, 'number_of_hidden_layers': 2, 'dropout_rate': 0.5285404409521045, 'global_pooling': 'mean', 'learning_rate': 0.0008411883138559982, 'weight_decay': 5.5691003407806764e-05, 'beta_0': 0.8959425319228029, 'beta_1': 0.9882987055127403, 'epsilon': 1.8922777894392527e-08, 'balanced_loss': True, 'epochs': 151, 'early_stopping_patience': 22, 'plateau_patience': 11, 'plateau_divider': 4}. Best is trial 147 with value: 0.5890664194848952.
CUDA out of memory. Tried to allocate 804.00 MiB. GPU 0 has a total capacity of 44.56 GiB of which 536.69 MiB is free. Including non-PyTorch memory, this process has 44.03 GiB memory in use. Of the allocated memory 42.06 GiB is allocated by PyTorch, and 837.64 MiB is reserved by PyTorch but unallocated. If reserved but unallocated memory is large try setting PYTORCH_CUDA_ALLOC_CONF=expandable_segments:True to avoid fragmentation.  See documentation for Memory Management  (https://pytorch.org/docs/stable/notes/cuda.html#environment-variables)
[I 2025-03-04 18:44:20,202] Trial 310 finished with value: -1.0 and parameters: {'left_stride': 128, 'right_stride': 128, 'attention_pooling_operation': 'max', 'embedding_pooling_operation': 'min', 'threshold': 0.9356518817428848, 'batch_size': 38, 'attention_heads': 12, 'hidden_dimension': 76, 'number_of_hidden_layers': 2, 'dropout_rate': 0.33675203068324433, 'global_pooling': 'max', 'learning_rate': 0.00046319429321512107, 'weight_decay': 4.401038323485151e-05, 'beta_0': 0.8864915585967458, 'beta_1': 0.9876343903943104, 'epsilon': 2.5195434385821623e-05, 'balanced_loss': True, 'epochs': 147, 'early_stopping_patience': 21, 'plateau_patience': 10, 'plateau_divider': 5}. Best is trial 147 with value: 0.5890664194848952.
[I 2025-03-04 19:03:53,092] Trial 311 finished with value: 0.5230966229218883 and parameters: {'left_stride': 128, 'right_stride': 0, 'attention_pooling_operation': 'max', 'embedding_pooling_operation': 'max', 'threshold': 0.9444933247753248, 'batch_size': 32, 'attention_heads': 9, 'hidden_dimension': 96, 'number_of_hidden_layers': 2, 'dropout_rate': 0.42319899144776213, 'global_pooling': 'mean', 'learning_rate': 0.0011962565395271989, 'weight_decay': 1.142323736108833e-06, 'beta_0': 0.8980524182547043, 'beta_1': 0.9887335660716716, 'epsilon': 1.5352333265807625e-08, 'balanced_loss': True, 'epochs': 152, 'early_stopping_patience': 21, 'plateau_patience': 10, 'plateau_divider': 4}. Best is trial 147 with value: 0.5890664194848952.
[I 2025-03-04 19:22:41,904] Trial 312 finished with value: 0.5399449337033588 and parameters: {'left_stride': 256, 'right_stride': 0, 'attention_pooling_operation': 'max', 'embedding_pooling_operation': 'min', 'threshold': 0.949220506793018, 'batch_size': 34, 'attention_heads': 10, 'hidden_dimension': 71, 'number_of_hidden_layers': 2, 'dropout_rate': 0.47402946629594483, 'global_pooling': 'mean', 'learning_rate': 0.0007273398594867849, 'weight_decay': 2.6013483400526086e-05, 'beta_0': 0.8941291057069892, 'beta_1': 0.9880287979676233, 'epsilon': 2.1380891686885443e-08, 'balanced_loss': True, 'epochs': 155, 'early_stopping_patience': 23, 'plateau_patience': 10, 'plateau_divider': 5}. Best is trial 147 with value: 0.5890664194848952.
[I 2025-03-04 19:43:00,415] Trial 313 finished with value: 0.5491573808526996 and parameters: {'left_stride': 128, 'right_stride': 0, 'attention_pooling_operation': 'max', 'embedding_pooling_operation': 'min', 'threshold': 0.9528061179203107, 'batch_size': 36, 'attention_heads': 12, 'hidden_dimension': 83, 'number_of_hidden_layers': 2, 'dropout_rate': 0.33959174804515274, 'global_pooling': 'mean', 'learning_rate': 0.0003849184612430533, 'weight_decay': 5.717961224832955e-06, 'beta_0': 0.8964005523627114, 'beta_1': 0.9863625503465481, 'epsilon': 1.1973143320093187e-08, 'balanced_loss': True, 'epochs': 166, 'early_stopping_patience': 20, 'plateau_patience': 10, 'plateau_divider': 4}. Best is trial 147 with value: 0.5890664194848952.
[I 2025-03-04 20:03:22,274] Trial 314 finished with value: 0.5416668557480323 and parameters: {'left_stride': 128, 'right_stride': 0, 'attention_pooling_operation': 'max', 'embedding_pooling_operation': 'min', 'threshold': 0.9573525668683047, 'batch_size': 34, 'attention_heads': 11, 'hidden_dimension': 87, 'number_of_hidden_layers': 2, 'dropout_rate': 0.5455145514200279, 'global_pooling': 'mean', 'learning_rate': 0.000512760844543674, 'weight_decay': 1.038214591993724e-06, 'beta_0': 0.8903207161916346, 'beta_1': 0.987325726131279, 'epsilon': 2.7356845128261542e-08, 'balanced_loss': True, 'epochs': 162, 'early_stopping_patience': 22, 'plateau_patience': 11, 'plateau_divider': 4}. Best is trial 147 with value: 0.5890664194848952.
CUDA out of memory. Tried to allocate 936.00 MiB. GPU 0 has a total capacity of 44.56 GiB of which 656.69 MiB is free. Including non-PyTorch memory, this process has 43.91 GiB memory in use. Of the allocated memory 41.91 GiB is allocated by PyTorch, and 875.19 MiB is reserved by PyTorch but unallocated. If reserved but unallocated memory is large try setting PYTORCH_CUDA_ALLOC_CONF=expandable_segments:True to avoid fragmentation.  See documentation for Memory Management  (https://pytorch.org/docs/stable/notes/cuda.html#environment-variables)
[I 2025-03-04 20:16:07,225] Trial 315 finished with value: -1.0 and parameters: {'left_stride': 128, 'right_stride': 0, 'attention_pooling_operation': 'max', 'embedding_pooling_operation': 'min', 'threshold': 0.9391592139302742, 'batch_size': 40, 'attention_heads': 12, 'hidden_dimension': 66, 'number_of_hidden_layers': 2, 'dropout_rate': 0.36274709428826796, 'global_pooling': 'mean', 'learning_rate': 0.0005936255198690219, 'weight_decay': 2.9252542518844123e-05, 'beta_0': 0.899896508489427, 'beta_1': 0.9884496498192188, 'epsilon': 1.620039810066908e-08, 'balanced_loss': True, 'epochs': 145, 'early_stopping_patience': 21, 'plateau_patience': 10, 'plateau_divider': 3}. Best is trial 147 with value: 0.5890664194848952.
[I 2025-03-04 20:37:56,293] Trial 316 finished with value: 0.5466922596349741 and parameters: {'left_stride': 128, 'right_stride': 64, 'attention_pooling_operation': 'max', 'embedding_pooling_operation': 'min', 'threshold': 0.9476976243114369, 'batch_size': 32, 'attention_heads': 10, 'hidden_dimension': 103, 'number_of_hidden_layers': 2, 'dropout_rate': 0.33363996674787866, 'global_pooling': 'mean', 'learning_rate': 0.0004326199900362459, 'weight_decay': 1.3904559474171813e-06, 'beta_0': 0.8920951463462397, 'beta_1': 0.9891363852052074, 'epsilon': 1.3856821676881289e-08, 'balanced_loss': True, 'epochs': 137, 'early_stopping_patience': 23, 'plateau_patience': 18, 'plateau_divider': 4}. Best is trial 147 with value: 0.5890664194848952.
CUDA out of memory. Tried to allocate 616.00 MiB. GPU 0 has a total capacity of 44.56 GiB of which 244.69 MiB is free. Including non-PyTorch memory, this process has 44.31 GiB memory in use. Of the allocated memory 42.57 GiB is allocated by PyTorch, and 611.86 MiB is reserved by PyTorch but unallocated. If reserved but unallocated memory is large try setting PYTORCH_CUDA_ALLOC_CONF=expandable_segments:True to avoid fragmentation.  See documentation for Memory Management  (https://pytorch.org/docs/stable/notes/cuda.html#environment-variables)
[I 2025-03-04 20:55:16,963] Trial 317 finished with value: -1.0 and parameters: {'left_stride': 128, 'right_stride': 0, 'attention_pooling_operation': 'mean', 'embedding_pooling_operation': 'min', 'threshold': 0.9243066972643851, 'batch_size': 37, 'attention_heads': 11, 'hidden_dimension': 60, 'number_of_hidden_layers': 2, 'dropout_rate': 0.49439405247587015, 'global_pooling': 'mean', 'learning_rate': 0.0009777310658133892, 'weight_decay': 3.9448167453753445e-05, 'beta_0': 0.8945807897353151, 'beta_1': 0.9877384356686446, 'epsilon': 1.8659563743142245e-08, 'balanced_loss': True, 'epochs': 157, 'early_stopping_patience': 21, 'plateau_patience': 10, 'plateau_divider': 5}. Best is trial 147 with value: 0.5890664194848952.
slurmstepd: error: *** JOB 15090579 ON gpu032 CANCELLED AT 2025-03-04T21:01:21 DUE TO TIME LIMIT ***
