[I 2025-03-29 01:21:54,751] Trial 200 finished with value: 0.48247357989728973 and parameters: {'left_stride': 128, 'right_stride': 64, 'attention_pooling_operation': 'max', 'embedding_pooling_operation': 'max', 'threshold': 0.8856513270703914, 'batch_size': 52, 'attention_heads': 6, 'hidden_dimension': 205, 'number_of_hidden_layers': 1, 'dropout_rate': 0.4716135768075175, 'global_pooling': 'mean', 'learning_rate': 0.0004176347914153106, 'weight_decay': 8.244221654201162e-05, 'beta_0': 0.8615887621997943, 'beta_1': 0.9986145758272754, 'epsilon': 3.8617101251818637e-07, 'balanced_loss': False, 'epochs': 148, 'early_stopping_patience': 25, 'plateau_patience': 21, 'plateau_divider': 7}. Best is trial 131 with value: 0.5242140918743077.
[I 2025-03-29 01:33:57,001] Trial 201 finished with value: 0.47073831113623105 and parameters: {'left_stride': 0, 'right_stride': 64, 'attention_pooling_operation': 'max', 'embedding_pooling_operation': 'max', 'threshold': 0.8917369044128557, 'batch_size': 43, 'attention_heads': 6, 'hidden_dimension': 239, 'number_of_hidden_layers': 1, 'dropout_rate': 0.4993281764030332, 'global_pooling': 'mean', 'learning_rate': 0.001052184481488255, 'weight_decay': 0.00010856428707098626, 'beta_0': 0.8030033828465315, 'beta_1': 0.9987324113218868, 'epsilon': 7.549452253220777e-06, 'balanced_loss': False, 'epochs': 163, 'early_stopping_patience': 24, 'plateau_patience': 22, 'plateau_divider': 7}. Best is trial 131 with value: 0.5242140918743077.
[I 2025-03-29 01:46:22,244] Trial 202 finished with value: 0.497500527622221 and parameters: {'left_stride': 256, 'right_stride': 64, 'attention_pooling_operation': 'max', 'embedding_pooling_operation': 'max', 'threshold': 0.8875659469311236, 'batch_size': 45, 'attention_heads': 6, 'hidden_dimension': 249, 'number_of_hidden_layers': 1, 'dropout_rate': 0.48996783467493593, 'global_pooling': 'mean', 'learning_rate': 0.0008074277530807795, 'weight_decay': 7.437124353857034e-05, 'beta_0': 0.8641412959773974, 'beta_1': 0.9989985594828078, 'epsilon': 3.178308992285403e-07, 'balanced_loss': False, 'epochs': 159, 'early_stopping_patience': 25, 'plateau_patience': 18, 'plateau_divider': 7}. Best is trial 131 with value: 0.5242140918743077.
[I 2025-03-29 01:59:17,116] Trial 203 finished with value: 0.48058578165931076 and parameters: {'left_stride': 256, 'right_stride': 64, 'attention_pooling_operation': 'max', 'embedding_pooling_operation': 'max', 'threshold': 0.8807319008824304, 'batch_size': 45, 'attention_heads': 6, 'hidden_dimension': 249, 'number_of_hidden_layers': 1, 'dropout_rate': 0.4903131643621979, 'global_pooling': 'mean', 'learning_rate': 0.0007696501827829011, 'weight_decay': 6.619428996274247e-05, 'beta_0': 0.8652477385278431, 'beta_1': 0.998320205529434, 'epsilon': 3.1061194274424884e-07, 'balanced_loss': False, 'epochs': 159, 'early_stopping_patience': 25, 'plateau_patience': 23, 'plateau_divider': 7}. Best is trial 131 with value: 0.5242140918743077.
[I 2025-03-29 02:11:02,899] Trial 204 finished with value: 0.5031628405655579 and parameters: {'left_stride': 256, 'right_stride': 64, 'attention_pooling_operation': 'max', 'embedding_pooling_operation': 'max', 'threshold': 0.8875794345894624, 'batch_size': 46, 'attention_heads': 5, 'hidden_dimension': 243, 'number_of_hidden_layers': 1, 'dropout_rate': 0.5043099812443408, 'global_pooling': 'mean', 'learning_rate': 0.0005793845473491855, 'weight_decay': 7.674639805515142e-05, 'beta_0': 0.8631072477784838, 'beta_1': 0.9989989218769698, 'epsilon': 4.7216680866796615e-07, 'balanced_loss': False, 'epochs': 156, 'early_stopping_patience': 25, 'plateau_patience': 22, 'plateau_divider': 7}. Best is trial 131 with value: 0.5242140918743077.
[I 2025-03-29 02:26:06,909] Trial 205 finished with value: 0.4720918972328541 and parameters: {'left_stride': 256, 'right_stride': 64, 'attention_pooling_operation': 'max', 'embedding_pooling_operation': 'max', 'threshold': 0.8988852100932986, 'batch_size': 42, 'attention_heads': 11, 'hidden_dimension': 237, 'number_of_hidden_layers': 1, 'dropout_rate': 0.506187373441645, 'global_pooling': 'mean', 'learning_rate': 0.0006241191018601542, 'weight_decay': 7.801302987623662e-05, 'beta_0': 0.858655904208591, 'beta_1': 0.9971372644041921, 'epsilon': 3.729817597972912e-07, 'balanced_loss': False, 'epochs': 156, 'early_stopping_patience': 25, 'plateau_patience': 21, 'plateau_divider': 7}. Best is trial 131 with value: 0.5242140918743077.
[I 2025-03-29 02:37:13,333] Trial 206 finished with value: 0.4678849105971139 and parameters: {'left_stride': 256, 'right_stride': 64, 'attention_pooling_operation': 'max', 'embedding_pooling_operation': 'max', 'threshold': 0.89291956500036, 'batch_size': 47, 'attention_heads': 6, 'hidden_dimension': 256, 'number_of_hidden_layers': 1, 'dropout_rate': 0.5049644641025155, 'global_pooling': 'mean', 'learning_rate': 0.0005469081941064492, 'weight_decay': 5.285429096352274e-05, 'beta_0': 0.8634036352282689, 'beta_1': 0.9981810221363411, 'epsilon': 5.043226675003897e-07, 'balanced_loss': False, 'epochs': 167, 'early_stopping_patience': 12, 'plateau_patience': 22, 'plateau_divider': 7}. Best is trial 131 with value: 0.5242140918743077.
[I 2025-03-29 02:49:31,492] Trial 207 finished with value: 0.48213540610181066 and parameters: {'left_stride': 256, 'right_stride': 64, 'attention_pooling_operation': 'max', 'embedding_pooling_operation': 'mean', 'threshold': 0.8886753733971384, 'batch_size': 50, 'attention_heads': 5, 'hidden_dimension': 242, 'number_of_hidden_layers': 1, 'dropout_rate': 0.4933730538696602, 'global_pooling': 'max', 'learning_rate': 0.0007931328639662697, 'weight_decay': 6.443841187765742e-05, 'beta_0': 0.8608916938502555, 'beta_1': 0.9873114187274555, 'epsilon': 2.669285404851849e-07, 'balanced_loss': False, 'epochs': 160, 'early_stopping_patience': 25, 'plateau_patience': 22, 'plateau_divider': 7}. Best is trial 131 with value: 0.5242140918743077.
[I 2025-03-29 03:02:30,078] Trial 208 finished with value: 0.4881435354935228 and parameters: {'left_stride': 256, 'right_stride': 64, 'attention_pooling_operation': 'max', 'embedding_pooling_operation': 'max', 'threshold': 0.8968199805874429, 'batch_size': 44, 'attention_heads': 6, 'hidden_dimension': 249, 'number_of_hidden_layers': 1, 'dropout_rate': 0.5133228601556586, 'global_pooling': 'mean', 'learning_rate': 0.0006140129367462466, 'weight_decay': 9.616556648514418e-05, 'beta_0': 0.8569576417566855, 'beta_1': 0.9986290883176667, 'epsilon': 4.5434193934448684e-07, 'balanced_loss': False, 'epochs': 164, 'early_stopping_patience': 24, 'plateau_patience': 22, 'plateau_divider': 7}. Best is trial 131 with value: 0.5242140918743077.
[I 2025-03-29 03:15:40,398] Trial 209 finished with value: 0.4985206929165848 and parameters: {'left_stride': 256, 'right_stride': 64, 'attention_pooling_operation': 'mean', 'embedding_pooling_operation': 'max', 'threshold': 0.8871840086622804, 'batch_size': 42, 'attention_heads': 6, 'hidden_dimension': 244, 'number_of_hidden_layers': 1, 'dropout_rate': 0.4854728403209265, 'global_pooling': 'mean', 'learning_rate': 0.0009478174094106562, 'weight_decay': 4.3061154368400366e-05, 'beta_0': 0.8628301457061139, 'beta_1': 0.9978269034844647, 'epsilon': 3.273609977646113e-07, 'balanced_loss': False, 'epochs': 155, 'early_stopping_patience': 25, 'plateau_patience': 23, 'plateau_divider': 7}. Best is trial 131 with value: 0.5242140918743077.
[I 2025-03-29 03:28:04,089] Trial 210 finished with value: 0.46307854475125787 and parameters: {'left_stride': 256, 'right_stride': 64, 'attention_pooling_operation': 'mean', 'embedding_pooling_operation': 'max', 'threshold': 0.9048598567155026, 'batch_size': 40, 'attention_heads': 6, 'hidden_dimension': 244, 'number_of_hidden_layers': 1, 'dropout_rate': 0.5019734871959305, 'global_pooling': 'mean', 'learning_rate': 0.0010552986092004241, 'weight_decay': 5.669254327956565e-05, 'beta_0': 0.8618870272103272, 'beta_1': 0.9977971823403834, 'epsilon': 3.1746214277372047e-07, 'balanced_loss': False, 'epochs': 153, 'early_stopping_patience': 23, 'plateau_patience': 23, 'plateau_divider': 7}. Best is trial 131 with value: 0.5242140918743077.
[I 2025-03-29 03:40:49,544] Trial 211 finished with value: 0.47288385001000716 and parameters: {'left_stride': 256, 'right_stride': 64, 'attention_pooling_operation': 'mean', 'embedding_pooling_operation': 'max', 'threshold': 0.8877325152612358, 'batch_size': 42, 'attention_heads': 6, 'hidden_dimension': 248, 'number_of_hidden_layers': 1, 'dropout_rate': 0.4852253300719294, 'global_pooling': 'mean', 'learning_rate': 0.0009011939015516293, 'weight_decay': 3.631218682710455e-05, 'beta_0': 0.8643624733775437, 'beta_1': 0.9982513393444242, 'epsilon': 2.183789218868378e-07, 'balanced_loss': False, 'epochs': 157, 'early_stopping_patience': 25, 'plateau_patience': 24, 'plateau_divider': 7}. Best is trial 131 with value: 0.5242140918743077.
[I 2025-03-29 03:53:13,442] Trial 212 finished with value: 0.49054320365471865 and parameters: {'left_stride': 0, 'right_stride': 64, 'attention_pooling_operation': 'mean', 'embedding_pooling_operation': 'max', 'threshold': 0.8808076528100867, 'batch_size': 45, 'attention_heads': 5, 'hidden_dimension': 239, 'number_of_hidden_layers': 1, 'dropout_rate': 0.48886044589351496, 'global_pooling': 'mean', 'learning_rate': 0.0007152133484035118, 'weight_decay': 4.011230332457149e-05, 'beta_0': 0.8629743196937758, 'beta_1': 0.9989857726382748, 'epsilon': 1.544995698941566e-07, 'balanced_loss': False, 'epochs': 160, 'early_stopping_patience': 25, 'plateau_patience': 24, 'plateau_divider': 7}. Best is trial 131 with value: 0.5242140918743077.
[I 2025-03-29 04:05:13,318] Trial 213 finished with value: 0.4605947652132106 and parameters: {'left_stride': 256, 'right_stride': 64, 'attention_pooling_operation': 'mean', 'embedding_pooling_operation': 'max', 'threshold': 0.8920694705221663, 'batch_size': 42, 'attention_heads': 6, 'hidden_dimension': 234, 'number_of_hidden_layers': 1, 'dropout_rate': 0.4790828057097281, 'global_pooling': 'mean', 'learning_rate': 0.0012479543930507878, 'weight_decay': 7.632918795292585e-05, 'beta_0': 0.8709023824956929, 'beta_1': 0.9975104614474349, 'epsilon': 3.876653160137762e-07, 'balanced_loss': False, 'epochs': 155, 'early_stopping_patience': 24, 'plateau_patience': 23, 'plateau_divider': 7}. Best is trial 131 with value: 0.5242140918743077.
[I 2025-03-29 04:18:56,515] Trial 214 finished with value: 0.48871033332167374 and parameters: {'left_stride': 256, 'right_stride': 64, 'attention_pooling_operation': 'mean', 'embedding_pooling_operation': 'max', 'threshold': 0.8846367898751192, 'batch_size': 39, 'attention_heads': 7, 'hidden_dimension': 243, 'number_of_hidden_layers': 1, 'dropout_rate': 0.49519571367141313, 'global_pooling': 'mean', 'learning_rate': 0.000518535273031347, 'weight_decay': 7.105817452800939e-05, 'beta_0': 0.8683522772121096, 'beta_1': 0.9983874023702323, 'epsilon': 4.702866967379057e-07, 'balanced_loss': False, 'epochs': 169, 'early_stopping_patience': 25, 'plateau_patience': 21, 'plateau_divider': 7}. Best is trial 131 with value: 0.5242140918743077.
[I 2025-03-29 04:30:34,264] Trial 215 finished with value: 0.4827959044353365 and parameters: {'left_stride': 256, 'right_stride': 64, 'attention_pooling_operation': 'max', 'embedding_pooling_operation': 'max', 'threshold': 0.8951483102087688, 'batch_size': 47, 'attention_heads': 5, 'hidden_dimension': 252, 'number_of_hidden_layers': 1, 'dropout_rate': 0.48405258427395453, 'global_pooling': 'mean', 'learning_rate': 0.0006708168942809623, 'weight_decay': 4.3651694097150076e-05, 'beta_0': 0.8588600429725354, 'beta_1': 0.9978423071806646, 'epsilon': 2.817931310770239e-07, 'balanced_loss': False, 'epochs': 162, 'early_stopping_patience': 25, 'plateau_patience': 22, 'plateau_divider': 7}. Best is trial 131 with value: 0.5242140918743077.
[I 2025-03-29 04:42:43,721] Trial 216 finished with value: 0.4900206161044367 and parameters: {'left_stride': 256, 'right_stride': 64, 'attention_pooling_operation': 'max', 'embedding_pooling_operation': 'max', 'threshold': 0.8877463216894833, 'batch_size': 43, 'attention_heads': 6, 'hidden_dimension': 246, 'number_of_hidden_layers': 1, 'dropout_rate': 0.49135372692465584, 'global_pooling': 'mean', 'learning_rate': 0.0008059091486506705, 'weight_decay': 0.00012330030765121257, 'beta_0': 0.8656754672714063, 'beta_1': 0.9985996105115383, 'epsilon': 6.324406022938006e-07, 'balanced_loss': False, 'epochs': 146, 'early_stopping_patience': 25, 'plateau_patience': 25, 'plateau_divider': 7}. Best is trial 131 with value: 0.5242140918743077.
[I 2025-03-29 04:54:57,989] Trial 217 finished with value: 0.5027208715909872 and parameters: {'left_stride': 256, 'right_stride': 32, 'attention_pooling_operation': 'max', 'embedding_pooling_operation': 'max', 'threshold': 0.9004474283089898, 'batch_size': 40, 'attention_heads': 6, 'hidden_dimension': 239, 'number_of_hidden_layers': 1, 'dropout_rate': 0.5076943826700954, 'global_pooling': 'mean', 'learning_rate': 0.0005669564603421612, 'weight_decay': 4.9282805833090475e-05, 'beta_0': 0.861760083978001, 'beta_1': 0.997221730341674, 'epsilon': 3.561862201081754e-07, 'balanced_loss': False, 'epochs': 158, 'early_stopping_patience': 25, 'plateau_patience': 23, 'plateau_divider': 7}. Best is trial 131 with value: 0.5242140918743077.
[I 2025-03-29 05:06:58,984] Trial 218 finished with value: 0.4823324653250578 and parameters: {'left_stride': 256, 'right_stride': 64, 'attention_pooling_operation': 'max', 'embedding_pooling_operation': 'max', 'threshold': 0.8992917813488847, 'batch_size': 39, 'attention_heads': 6, 'hidden_dimension': 252, 'number_of_hidden_layers': 1, 'dropout_rate': 0.5061970117966581, 'global_pooling': 'mean', 'learning_rate': 0.0004806343486125566, 'weight_decay': 2.868149435622683e-05, 'beta_0': 0.8607028609298771, 'beta_1': 0.9970168364934041, 'epsilon': 3.1689759356459414e-07, 'balanced_loss': False, 'epochs': 166, 'early_stopping_patience': 24, 'plateau_patience': 23, 'plateau_divider': 7}. Best is trial 131 with value: 0.5242140918743077.
[I 2025-03-29 05:18:04,380] Trial 219 finished with value: 0.4687729477360046 and parameters: {'left_stride': 256, 'right_stride': 32, 'attention_pooling_operation': 'max', 'embedding_pooling_operation': 'max', 'threshold': 0.9056513549802462, 'batch_size': 36, 'attention_heads': 7, 'hidden_dimension': 241, 'number_of_hidden_layers': 1, 'dropout_rate': 0.5011448507971433, 'global_pooling': 'mean', 'learning_rate': 0.0009332434872983659, 'weight_decay': 4.616980076722623e-05, 'beta_0': 0.8646274508849698, 'beta_1': 0.9881579222943118, 'epsilon': 4.2960125692800717e-07, 'balanced_loss': False, 'epochs': 160, 'early_stopping_patience': 11, 'plateau_patience': 24, 'plateau_divider': 5}. Best is trial 131 with value: 0.5242140918743077.
[I 2025-03-29 05:30:37,398] Trial 220 finished with value: 0.4743674538209511 and parameters: {'left_stride': 256, 'right_stride': 32, 'attention_pooling_operation': 'max', 'embedding_pooling_operation': 'max', 'threshold': 0.8918467075564962, 'batch_size': 34, 'attention_heads': 6, 'hidden_dimension': 247, 'number_of_hidden_layers': 1, 'dropout_rate': 0.5097844827488174, 'global_pooling': 'mean', 'learning_rate': 0.0003778937207692336, 'weight_decay': 6.175813311319047e-05, 'beta_0': 0.8625280638773591, 'beta_1': 0.9973278428584662, 'epsilon': 3.550031899993961e-07, 'balanced_loss': False, 'epochs': 152, 'early_stopping_patience': 25, 'plateau_patience': 23, 'plateau_divider': 7}. Best is trial 131 with value: 0.5242140918743077.
[I 2025-03-29 05:42:36,031] Trial 221 finished with value: 0.48111196801705985 and parameters: {'left_stride': 256, 'right_stride': 32, 'attention_pooling_operation': 'max', 'embedding_pooling_operation': 'max', 'threshold': 0.9005732002461658, 'batch_size': 41, 'attention_heads': 6, 'hidden_dimension': 237, 'number_of_hidden_layers': 1, 'dropout_rate': 0.495993331906083, 'global_pooling': 'mean', 'learning_rate': 0.0005863620150326272, 'weight_decay': 4.6978066061197775e-05, 'beta_0': 0.867133871958332, 'beta_1': 0.998011920638663, 'epsilon': 5.34137810099254e-07, 'balanced_loss': False, 'epochs': 157, 'early_stopping_patience': 25, 'plateau_patience': 20, 'plateau_divider': 7}. Best is trial 131 with value: 0.5242140918743077.
[I 2025-03-29 05:55:00,509] Trial 222 finished with value: 0.4725372628296582 and parameters: {'left_stride': 0, 'right_stride': 32, 'attention_pooling_operation': 'max', 'embedding_pooling_operation': 'max', 'threshold': 0.8829810681067707, 'batch_size': 44, 'attention_heads': 6, 'hidden_dimension': 240, 'number_of_hidden_layers': 1, 'dropout_rate': 0.48381720985649523, 'global_pooling': 'mean', 'learning_rate': 0.000649278911084966, 'weight_decay': 3.4591672210771133e-06, 'beta_0': 0.8593501786596829, 'beta_1': 0.9983726630971611, 'epsilon': 4.0320720872704253e-07, 'balanced_loss': False, 'epochs': 164, 'early_stopping_patience': 25, 'plateau_patience': 23, 'plateau_divider': 7}. Best is trial 131 with value: 0.5242140918743077.
[I 2025-03-29 06:05:21,998] Trial 223 finished with value: 0.4757798962728218 and parameters: {'left_stride': 0, 'right_stride': 64, 'attention_pooling_operation': 'max', 'embedding_pooling_operation': 'max', 'threshold': 0.8947887154128794, 'batch_size': 45, 'attention_heads': 5, 'hidden_dimension': 232, 'number_of_hidden_layers': 1, 'dropout_rate': 0.5141756334261292, 'global_pooling': 'mean', 'learning_rate': 0.0005359239365480378, 'weight_decay': 5.256289903202256e-05, 'beta_0': 0.8630969790777826, 'beta_1': 0.9989927284967662, 'epsilon': 2.742841996228588e-07, 'balanced_loss': False, 'epochs': 159, 'early_stopping_patience': 13, 'plateau_patience': 23, 'plateau_divider': 7}. Best is trial 131 with value: 0.5242140918743077.
[I 2025-03-29 06:24:23,973] Trial 224 finished with value: 0.389657079712434 and parameters: {'left_stride': 256, 'right_stride': 32, 'attention_pooling_operation': 'max', 'embedding_pooling_operation': 'max', 'threshold': 0.878014649265531, 'batch_size': 41, 'attention_heads': 5, 'hidden_dimension': 244, 'number_of_hidden_layers': 1, 'dropout_rate': 0.4901360159650795, 'global_pooling': 'mean', 'learning_rate': 2.419576632437719e-05, 'weight_decay': 7.258679121736592e-05, 'beta_0': 0.865137623182527, 'beta_1': 0.9976062784486811, 'epsilon': 7.786344070348998e-07, 'balanced_loss': False, 'epochs': 155, 'early_stopping_patience': 25, 'plateau_patience': 18, 'plateau_divider': 7}. Best is trial 131 with value: 0.5242140918743077.
[I 2025-03-29 06:36:10,013] Trial 225 finished with value: 0.4981741267662262 and parameters: {'left_stride': 0, 'right_stride': 64, 'attention_pooling_operation': 'max', 'embedding_pooling_operation': 'max', 'threshold': 0.8891838401347812, 'batch_size': 48, 'attention_heads': 6, 'hidden_dimension': 251, 'number_of_hidden_layers': 1, 'dropout_rate': 0.45203967404208856, 'global_pooling': 'mean', 'learning_rate': 0.0007769098709725099, 'weight_decay': 6.231653612729094e-05, 'beta_0': 0.8609741169767597, 'beta_1': 0.9986300142189629, 'epsilon': 3.390399158188303e-07, 'balanced_loss': False, 'epochs': 162, 'early_stopping_patience': 24, 'plateau_patience': 22, 'plateau_divider': 7}. Best is trial 131 with value: 0.5242140918743077.
[I 2025-03-29 06:47:54,179] Trial 226 finished with value: 0.35153523798781733 and parameters: {'left_stride': 0, 'right_stride': 64, 'attention_pooling_operation': 'max', 'embedding_pooling_operation': 'max', 'threshold': 0.8893106775146535, 'batch_size': 49, 'attention_heads': 6, 'hidden_dimension': 251, 'number_of_hidden_layers': 1, 'dropout_rate': 0.45351165570105556, 'global_pooling': 'sum', 'learning_rate': 0.0007375758764399014, 'weight_decay': 6.1925764037821e-05, 'beta_0': 0.8613387952552652, 'beta_1': 0.9986538584238985, 'epsilon': 2.3630957897455898e-07, 'balanced_loss': False, 'epochs': 167, 'early_stopping_patience': 24, 'plateau_patience': 22, 'plateau_divider': 7}. Best is trial 131 with value: 0.5242140918743077.
[I 2025-03-29 06:58:50,044] Trial 227 finished with value: 0.4700615429371356 and parameters: {'left_stride': 128, 'right_stride': 128, 'attention_pooling_operation': 'max', 'embedding_pooling_operation': 'max', 'threshold': 0.8948011096220648, 'batch_size': 51, 'attention_heads': 6, 'hidden_dimension': 256, 'number_of_hidden_layers': 1, 'dropout_rate': 0.4473590585956278, 'global_pooling': 'mean', 'learning_rate': 0.0010635357229983346, 'weight_decay': 5.8695413705700285e-05, 'beta_0': 0.8562151638203561, 'beta_1': 0.9966946146245319, 'epsilon': 3.3002022597221585e-07, 'balanced_loss': False, 'epochs': 140, 'early_stopping_patience': 18, 'plateau_patience': 21, 'plateau_divider': 7}. Best is trial 131 with value: 0.5242140918743077.
[I 2025-03-29 07:10:43,828] Trial 228 finished with value: 0.4891452066986075 and parameters: {'left_stride': 0, 'right_stride': 64, 'attention_pooling_operation': 'max', 'embedding_pooling_operation': 'max', 'threshold': 0.8866589179401798, 'batch_size': 47, 'attention_heads': 6, 'hidden_dimension': 248, 'number_of_hidden_layers': 1, 'dropout_rate': 0.45339786247948055, 'global_pooling': 'mean', 'learning_rate': 0.0008548979238630095, 'weight_decay': 0.0008405779039399466, 'beta_0': 0.860798696556519, 'beta_1': 0.9980176162286661, 'epsilon': 4.50186558553287e-07, 'balanced_loss': False, 'epochs': 162, 'early_stopping_patience': 24, 'plateau_patience': 22, 'plateau_divider': 7}. Best is trial 131 with value: 0.5242140918743077.
