[I 2025-02-23 04:30:01,772] Using an existing study with name 'Ohsumed-GATv2-google-bert-bert-base-uncased-Surrogate-No_Aggregation-Single_Unitary_Weight-0.0-0.0' instead of creating a new one.
Token indices sequence length is longer than the specified maximum sequence length for this model (611 > 512). Running this sequence through the model will result in indexing errors
[I 2025-02-23 04:56:45,247] Trial 258 finished with value: 0.5256385692587497 and parameters: {'left_stride': 0, 'right_stride': 128, 'attention_pooling_operation': 'mean', 'embedding_pooling_operation': 'max', 'threshold': 0.9315023597965355, 'batch_size': 63, 'attention_heads': 16, 'hidden_dimension': 73, 'number_of_hidden_layers': 1, 'dropout_rate': 0.40390407576304616, 'global_pooling': 'sum', 'learning_rate': 0.000572987220998133, 'weight_decay': 7.248711793989736e-05, 'beta_0': 0.8119700720450259, 'beta_1': 0.9880510517899331, 'epsilon': 8.211605444193009e-08, 'balanced_loss': False, 'epochs': 53, 'early_stopping_patience': 19, 'plateau_patience': 12, 'plateau_divider': 10}. Best is trial 222 with value: 0.6575405977059186.
[I 2025-02-23 05:15:39,239] Trial 259 finished with value: 0.6311658099073842 and parameters: {'left_stride': 32, 'right_stride': 128, 'attention_pooling_operation': 'max', 'embedding_pooling_operation': 'max', 'threshold': 0.9205338909577091, 'batch_size': 68, 'attention_heads': 16, 'hidden_dimension': 68, 'number_of_hidden_layers': 1, 'dropout_rate': 0.40066728673376323, 'global_pooling': 'max', 'learning_rate': 0.0009818904104271786, 'weight_decay': 0.0008181609655909299, 'beta_0': 0.8102891003905827, 'beta_1': 0.9874221020258106, 'epsilon': 1.0132425756907282e-07, 'balanced_loss': False, 'epochs': 141, 'early_stopping_patience': 20, 'plateau_patience': 12, 'plateau_divider': 10}. Best is trial 222 with value: 0.6575405977059186.
[I 2025-02-23 05:35:01,181] Trial 260 finished with value: 0.6212311090522254 and parameters: {'left_stride': 0, 'right_stride': 128, 'attention_pooling_operation': 'max', 'embedding_pooling_operation': 'max', 'threshold': 0.9274178851873773, 'batch_size': 60, 'attention_heads': 16, 'hidden_dimension': 79, 'number_of_hidden_layers': 1, 'dropout_rate': 0.40787385693596034, 'global_pooling': 'max', 'learning_rate': 0.0007106199314922357, 'weight_decay': 0.0005860256169644333, 'beta_0': 0.8074987119697431, 'beta_1': 0.9882321783604425, 'epsilon': 7.331778924354839e-08, 'balanced_loss': False, 'epochs': 67, 'early_stopping_patience': 20, 'plateau_patience': 12, 'plateau_divider': 10}. Best is trial 222 with value: 0.6575405977059186.
[I 2025-02-23 05:56:00,079] Trial 261 finished with value: 0.6248137787064839 and parameters: {'left_stride': 32, 'right_stride': 64, 'attention_pooling_operation': 'max', 'embedding_pooling_operation': 'max', 'threshold': 0.9190327497104493, 'batch_size': 67, 'attention_heads': 16, 'hidden_dimension': 72, 'number_of_hidden_layers': 1, 'dropout_rate': 0.4106570410042536, 'global_pooling': 'max', 'learning_rate': 0.0010878238148105581, 'weight_decay': 1.0625006049394123e-06, 'beta_0': 0.8112062873933669, 'beta_1': 0.9877341256743645, 'epsilon': 9.183390395486452e-08, 'balanced_loss': False, 'epochs': 50, 'early_stopping_patience': 21, 'plateau_patience': 12, 'plateau_divider': 10}. Best is trial 222 with value: 0.6575405977059186.
[I 2025-02-23 06:16:07,979] Trial 262 finished with value: 0.6096455689204108 and parameters: {'left_stride': 256, 'right_stride': 128, 'attention_pooling_operation': 'max', 'embedding_pooling_operation': 'max', 'threshold': 0.9135753040984346, 'batch_size': 64, 'attention_heads': 16, 'hidden_dimension': 61, 'number_of_hidden_layers': 1, 'dropout_rate': 0.4304046018790845, 'global_pooling': 'max', 'learning_rate': 0.0008715271127749787, 'weight_decay': 3.4212001762098687e-06, 'beta_0': 0.8457211639028981, 'beta_1': 0.9870289108363309, 'epsilon': 1.172035599001448e-07, 'balanced_loss': False, 'epochs': 55, 'early_stopping_patience': 20, 'plateau_patience': 12, 'plateau_divider': 10}. Best is trial 222 with value: 0.6575405977059186.
[I 2025-02-23 06:39:26,672] Trial 263 finished with value: 0.6062229654007287 and parameters: {'left_stride': 0, 'right_stride': 128, 'attention_pooling_operation': 'mean', 'embedding_pooling_operation': 'max', 'threshold': 0.9237981415882595, 'batch_size': 70, 'attention_heads': 13, 'hidden_dimension': 76, 'number_of_hidden_layers': 1, 'dropout_rate': 0.42749160652111085, 'global_pooling': 'max', 'learning_rate': 0.0005342082141584867, 'weight_decay': 1.3459788084635387e-06, 'beta_0': 0.8131808186009242, 'beta_1': 0.9884768326196438, 'epsilon': 6.828122090053073e-08, 'balanced_loss': False, 'epochs': 62, 'early_stopping_patience': 19, 'plateau_patience': 12, 'plateau_divider': 10}. Best is trial 222 with value: 0.6575405977059186.
[I 2025-02-23 06:57:28,893] Trial 264 finished with value: 0.6120189040776064 and parameters: {'left_stride': 32, 'right_stride': 128, 'attention_pooling_operation': 'max', 'embedding_pooling_operation': 'max', 'threshold': 0.9354390955792876, 'batch_size': 67, 'attention_heads': 16, 'hidden_dimension': 66, 'number_of_hidden_layers': 1, 'dropout_rate': 0.4046608476161977, 'global_pooling': 'max', 'learning_rate': 0.0015306757786575417, 'weight_decay': 2.169853054754643e-06, 'beta_0': 0.8095716923863325, 'beta_1': 0.9881414134466324, 'epsilon': 8.11437380215421e-08, 'balanced_loss': False, 'epochs': 53, 'early_stopping_patience': 21, 'plateau_patience': 13, 'plateau_divider': 10}. Best is trial 222 with value: 0.6575405977059186.
[I 2025-02-23 07:16:28,534] Trial 265 finished with value: 0.6076140104225992 and parameters: {'left_stride': 32, 'right_stride': 128, 'attention_pooling_operation': 'max', 'embedding_pooling_operation': 'max', 'threshold': 0.9298615353446881, 'batch_size': 65, 'attention_heads': 16, 'hidden_dimension': 80, 'number_of_hidden_layers': 1, 'dropout_rate': 0.41556401115303954, 'global_pooling': 'max', 'learning_rate': 0.0012401070689842504, 'weight_decay': 0.0007007912073971064, 'beta_0': 0.8054034159377068, 'beta_1': 0.9876177681117836, 'epsilon': 4.909243322917867e-08, 'balanced_loss': False, 'epochs': 59, 'early_stopping_patience': 20, 'plateau_patience': 12, 'plateau_divider': 10}. Best is trial 222 with value: 0.6575405977059186.
[I 2025-02-23 07:40:16,469] Trial 266 finished with value: 0.6028813426061602 and parameters: {'left_stride': 0, 'right_stride': 0, 'attention_pooling_operation': 'max', 'embedding_pooling_operation': 'max', 'threshold': 0.9180853170087622, 'batch_size': 61, 'attention_heads': 16, 'hidden_dimension': 93, 'number_of_hidden_layers': 1, 'dropout_rate': 0.39896805920141865, 'global_pooling': 'max', 'learning_rate': 0.00036418667095592327, 'weight_decay': 0.0008693649027023662, 'beta_0': 0.8179525246186855, 'beta_1': 0.9893853953541984, 'epsilon': 2.5365269540909323e-08, 'balanced_loss': False, 'epochs': 50, 'early_stopping_patience': 21, 'plateau_patience': 11, 'plateau_divider': 10}. Best is trial 222 with value: 0.6575405977059186.
[I 2025-02-23 08:00:19,395] Trial 267 finished with value: 0.6299984348894337 and parameters: {'left_stride': 32, 'right_stride': 128, 'attention_pooling_operation': 'max', 'embedding_pooling_operation': 'max', 'threshold': 0.9258715673459617, 'batch_size': 71, 'attention_heads': 16, 'hidden_dimension': 71, 'number_of_hidden_layers': 1, 'dropout_rate': 0.39074295038164475, 'global_pooling': 'max', 'learning_rate': 0.0006860959071213866, 'weight_decay': 1.7875390830637867e-06, 'beta_0': 0.8084479243119669, 'beta_1': 0.9885728694616593, 'epsilon': 1.1076206158375134e-07, 'balanced_loss': False, 'epochs': 56, 'early_stopping_patience': 20, 'plateau_patience': 14, 'plateau_divider': 10}. Best is trial 222 with value: 0.6575405977059186.
[I 2025-02-23 08:24:58,269] Trial 268 finished with value: 0.6398391389541974 and parameters: {'left_stride': 0, 'right_stride': 128, 'attention_pooling_operation': 'mean', 'embedding_pooling_operation': 'max', 'threshold': 0.9211854782741091, 'batch_size': 62, 'attention_heads': 16, 'hidden_dimension': 75, 'number_of_hidden_layers': 1, 'dropout_rate': 0.43556688307004177, 'global_pooling': 'max', 'learning_rate': 0.0008328629678231326, 'weight_decay': 0.0006188131196453957, 'beta_0': 0.8139020428478418, 'beta_1': 0.9879935129881097, 'epsilon': 6.472655158010352e-08, 'balanced_loss': False, 'epochs': 53, 'early_stopping_patience': 19, 'plateau_patience': 13, 'plateau_divider': 10}. Best is trial 222 with value: 0.6575405977059186.
[I 2025-02-23 08:49:37,945] Trial 269 finished with value: 0.6416855907917209 and parameters: {'left_stride': 0, 'right_stride': 128, 'attention_pooling_operation': 'mean', 'embedding_pooling_operation': 'max', 'threshold': 0.9219836759697763, 'batch_size': 63, 'attention_heads': 16, 'hidden_dimension': 75, 'number_of_hidden_layers': 1, 'dropout_rate': 0.4375132656888579, 'global_pooling': 'max', 'learning_rate': 0.0008081461110312684, 'weight_decay': 0.0005660764339605984, 'beta_0': 0.8124177774912642, 'beta_1': 0.9872920336204623, 'epsilon': 6.367423484420472e-08, 'balanced_loss': False, 'epochs': 131, 'early_stopping_patience': 19, 'plateau_patience': 13, 'plateau_divider': 10}. Best is trial 222 with value: 0.6575405977059186.
[I 2025-02-23 09:13:33,380] Trial 270 finished with value: 0.6294056063451068 and parameters: {'left_stride': 0, 'right_stride': 128, 'attention_pooling_operation': 'mean', 'embedding_pooling_operation': 'max', 'threshold': 0.9222096283587595, 'batch_size': 62, 'attention_heads': 16, 'hidden_dimension': 68, 'number_of_hidden_layers': 1, 'dropout_rate': 0.43545598376346323, 'global_pooling': 'max', 'learning_rate': 0.0006093629738893623, 'weight_decay': 0.0005777031214159971, 'beta_0': 0.8163006340129133, 'beta_1': 0.9870932311709991, 'epsilon': 3.977629874169205e-08, 'balanced_loss': False, 'epochs': 133, 'early_stopping_patience': 19, 'plateau_patience': 13, 'plateau_divider': 10}. Best is trial 222 with value: 0.6575405977059186.
[I 2025-02-23 09:37:54,285] Trial 271 finished with value: 0.6183011433267002 and parameters: {'left_stride': 0, 'right_stride': 128, 'attention_pooling_operation': 'mean', 'embedding_pooling_operation': 'max', 'threshold': 0.9305656527264595, 'batch_size': 59, 'attention_heads': 16, 'hidden_dimension': 74, 'number_of_hidden_layers': 1, 'dropout_rate': 0.4343356350878666, 'global_pooling': 'max', 'learning_rate': 0.0004426862992382953, 'weight_decay': 0.0006320030549781687, 'beta_0': 0.8138204755873554, 'beta_1': 0.986681217389714, 'epsilon': 6.410006065226342e-08, 'balanced_loss': False, 'epochs': 131, 'early_stopping_patience': 19, 'plateau_patience': 13, 'plateau_divider': 10}. Best is trial 222 with value: 0.6575405977059186.
[I 2025-02-23 10:00:29,146] Trial 272 finished with value: 0.6149150851871681 and parameters: {'left_stride': 0, 'right_stride': 128, 'attention_pooling_operation': 'mean', 'embedding_pooling_operation': 'max', 'threshold': 0.9248827916432156, 'batch_size': 63, 'attention_heads': 16, 'hidden_dimension': 57, 'number_of_hidden_layers': 1, 'dropout_rate': 0.4388383622471105, 'global_pooling': 'max', 'learning_rate': 0.0007688180746907337, 'weight_decay': 0.0005371803437301516, 'beta_0': 0.8129098709684807, 'beta_1': 0.9880670193082248, 'epsilon': 4.82780750825608e-08, 'balanced_loss': False, 'epochs': 129, 'early_stopping_patience': 19, 'plateau_patience': 13, 'plateau_divider': 10}. Best is trial 222 with value: 0.6575405977059186.
[I 2025-02-23 10:45:30,454] Trial 273 finished with value: 0.3537151534117001 and parameters: {'left_stride': 0, 'right_stride': 128, 'attention_pooling_operation': 'mean', 'embedding_pooling_operation': 'max', 'threshold': 0.927765744512467, 'batch_size': 61, 'attention_heads': 16, 'hidden_dimension': 64, 'number_of_hidden_layers': 1, 'dropout_rate': 0.4157761159966402, 'global_pooling': 'max', 'learning_rate': 1.0993032231668202e-05, 'weight_decay': 0.0006756661170106875, 'beta_0': 0.8153304383933219, 'beta_1': 0.987832705935407, 'epsilon': 6.2508378000012e-08, 'balanced_loss': False, 'epochs': 126, 'early_stopping_patience': 19, 'plateau_patience': 14, 'plateau_divider': 10}. Best is trial 222 with value: 0.6575405977059186.
[I 2025-02-23 11:09:21,836] Trial 274 finished with value: 0.5919054407013346 and parameters: {'left_stride': 0, 'right_stride': 128, 'attention_pooling_operation': 'mean', 'embedding_pooling_operation': 'mean', 'threshold': 0.9339634693999601, 'batch_size': 64, 'attention_heads': 16, 'hidden_dimension': 81, 'number_of_hidden_layers': 1, 'dropout_rate': 0.5298721420781565, 'global_pooling': 'mean', 'learning_rate': 0.0008124852294941785, 'weight_decay': 5.3563515689477884e-05, 'beta_0': 0.8111956497929788, 'beta_1': 0.9882942584198223, 'epsilon': 5.392810543624258e-08, 'balanced_loss': False, 'epochs': 136, 'early_stopping_patience': 20, 'plateau_patience': 14, 'plateau_divider': 10}. Best is trial 222 with value: 0.6575405977059186.
[I 2025-02-23 11:29:12,136] Trial 275 finished with value: 0.5872738458657766 and parameters: {'left_stride': 0, 'right_stride': 128, 'attention_pooling_operation': 'min', 'embedding_pooling_operation': 'max', 'threshold': 0.9208345223264388, 'batch_size': 66, 'attention_heads': 16, 'hidden_dimension': 71, 'number_of_hidden_layers': 1, 'dropout_rate': 0.4451823971915498, 'global_pooling': 'max', 'learning_rate': 0.0005133821813268621, 'weight_decay': 0.0007631804540535563, 'beta_0': 0.8110697721537208, 'beta_1': 0.987288035017017, 'epsilon': 7.075360127130957e-08, 'balanced_loss': False, 'epochs': 54, 'early_stopping_patience': 18, 'plateau_patience': 13, 'plateau_divider': 10}. Best is trial 222 with value: 0.6575405977059186.
[I 2025-02-23 11:54:22,936] Trial 276 finished with value: 0.6486296270761911 and parameters: {'left_stride': 0, 'right_stride': 32, 'attention_pooling_operation': 'mean', 'embedding_pooling_operation': 'max', 'threshold': 0.9143397791033907, 'batch_size': 62, 'attention_heads': 16, 'hidden_dimension': 78, 'number_of_hidden_layers': 1, 'dropout_rate': 0.42585291945429343, 'global_pooling': 'max', 'learning_rate': 0.0006465548713910157, 'weight_decay': 2.0595101702052777e-05, 'beta_0': 0.8092914650893855, 'beta_1': 0.9877878744378943, 'epsilon': 3.5809002764696766e-08, 'balanced_loss': False, 'epochs': 52, 'early_stopping_patience': 17, 'plateau_patience': 13, 'plateau_divider': 10}. Best is trial 222 with value: 0.6575405977059186.
[I 2025-02-23 12:17:03,734] Trial 277 finished with value: 0.6271137752303211 and parameters: {'left_stride': 0, 'right_stride': 32, 'attention_pooling_operation': 'max', 'embedding_pooling_operation': 'max', 'threshold': 0.9236309822657477, 'batch_size': 59, 'attention_heads': 16, 'hidden_dimension': 86, 'number_of_hidden_layers': 1, 'dropout_rate': 0.4242741828231955, 'global_pooling': 'max', 'learning_rate': 0.0006933851216053907, 'weight_decay': 0.0008787094825600423, 'beta_0': 0.8064768584614274, 'beta_1': 0.987593945888534, 'epsilon': 3.114007393025508e-08, 'balanced_loss': False, 'epochs': 50, 'early_stopping_patience': 20, 'plateau_patience': 13, 'plateau_divider': 10}. Best is trial 222 with value: 0.6575405977059186.
[I 2025-02-23 12:39:19,537] Trial 278 finished with value: 0.6306228875576676 and parameters: {'left_stride': 0, 'right_stride': 32, 'attention_pooling_operation': 'max', 'embedding_pooling_operation': 'max', 'threshold': 0.9076560142430606, 'batch_size': 62, 'attention_heads': 16, 'hidden_dimension': 79, 'number_of_hidden_layers': 1, 'dropout_rate': 0.4390510831250125, 'global_pooling': 'max', 'learning_rate': 0.0009564282435637643, 'weight_decay': 0.00047415099243997374, 'beta_0': 0.8090051660385517, 'beta_1': 0.98705004059164, 'epsilon': 3.9858755590393854e-08, 'balanced_loss': False, 'epochs': 122, 'early_stopping_patience': 18, 'plateau_patience': 13, 'plateau_divider': 10}. Best is trial 222 with value: 0.6575405977059186.
[I 2025-02-23 13:03:59,507] Trial 279 finished with value: 0.6107467405131664 and parameters: {'left_stride': 0, 'right_stride': 32, 'attention_pooling_operation': 'mean', 'embedding_pooling_operation': 'max', 'threshold': 0.8988162786475429, 'batch_size': 60, 'attention_heads': 16, 'hidden_dimension': 63, 'number_of_hidden_layers': 1, 'dropout_rate': 0.42964724697601364, 'global_pooling': 'max', 'learning_rate': 0.0006302978649226162, 'weight_decay': 3.062651320307124e-05, 'beta_0': 0.8100345783522156, 'beta_1': 0.984973667399022, 'epsilon': 3.679502737166457e-08, 'balanced_loss': False, 'epochs': 53, 'early_stopping_patience': 17, 'plateau_patience': 14, 'plateau_divider': 3}. Best is trial 222 with value: 0.6575405977059186.
[I 2025-02-23 13:27:23,564] Trial 280 finished with value: 0.5462625372521862 and parameters: {'left_stride': 0, 'right_stride': 32, 'attention_pooling_operation': 'max', 'embedding_pooling_operation': 'max', 'threshold': 0.928038312071381, 'batch_size': 62, 'attention_heads': 16, 'hidden_dimension': 72, 'number_of_hidden_layers': 2, 'dropout_rate': 0.4216101861050357, 'global_pooling': 'sum', 'learning_rate': 0.0008470017114033557, 'weight_decay': 0.0005611069389527162, 'beta_0': 0.8062784709528306, 'beta_1': 0.9886015592396601, 'epsilon': 1.8810508212393652e-07, 'balanced_loss': False, 'epochs': 52, 'early_stopping_patience': 17, 'plateau_patience': 11, 'plateau_divider': 10}. Best is trial 222 with value: 0.6575405977059186.
[I 2025-02-23 13:56:30,352] Trial 281 finished with value: 0.23367264522315356 and parameters: {'left_stride': 0, 'right_stride': 32, 'attention_pooling_operation': 'max', 'embedding_pooling_operation': 'max', 'threshold': 0.919400272560025, 'batch_size': 66, 'attention_heads': 13, 'hidden_dimension': 89, 'number_of_hidden_layers': 1, 'dropout_rate': 0.4148424806650179, 'global_pooling': 'max', 'learning_rate': 0.01797522755588587, 'weight_decay': 0.000786169933580398, 'beta_0': 0.8120226166620664, 'beta_1': 0.9877936931056923, 'epsilon': 8.25916602164271e-08, 'balanced_loss': False, 'epochs': 59, 'early_stopping_patience': 16, 'plateau_patience': 13, 'plateau_divider': 10}. Best is trial 222 with value: 0.6575405977059186.
[I 2025-02-23 14:15:16,074] Trial 282 finished with value: 0.6275392393488517 and parameters: {'left_stride': 0, 'right_stride': 256, 'attention_pooling_operation': 'max', 'embedding_pooling_operation': 'max', 'threshold': 0.9135086050419964, 'batch_size': 68, 'attention_heads': 16, 'hidden_dimension': 67, 'number_of_hidden_layers': 1, 'dropout_rate': 0.4335938283314456, 'global_pooling': 'max', 'learning_rate': 0.0010585339409923268, 'weight_decay': 0.0009918024186850937, 'beta_0': 0.8041856458570746, 'beta_1': 0.9888691771084551, 'epsilon': 2.218763419265301e-08, 'balanced_loss': False, 'epochs': 56, 'early_stopping_patience': 17, 'plateau_patience': 13, 'plateau_divider': 10}. Best is trial 222 with value: 0.6575405977059186.
[I 2025-02-23 14:39:07,968] Trial 283 finished with value: 0.6152916921099929 and parameters: {'left_stride': 0, 'right_stride': 256, 'attention_pooling_operation': 'mean', 'embedding_pooling_operation': 'max', 'threshold': 0.9336200004696914, 'batch_size': 64, 'attention_heads': 16, 'hidden_dimension': 84, 'number_of_hidden_layers': 1, 'dropout_rate': 0.42349589307241997, 'global_pooling': 'max', 'learning_rate': 0.0007743632737352155, 'weight_decay': 0.0006739083787749071, 'beta_0': 0.8079940970197255, 'beta_1': 0.9883044189593069, 'epsilon': 1.2828001997620547e-07, 'balanced_loss': False, 'epochs': 50, 'early_stopping_patience': 18, 'plateau_patience': 13, 'plateau_divider': 10}. Best is trial 222 with value: 0.6575405977059186.
[I 2025-02-23 15:01:31,627] Trial 284 finished with value: 0.647126873428229 and parameters: {'left_stride': 128, 'right_stride': 64, 'attention_pooling_operation': 'max', 'embedding_pooling_operation': 'max', 'threshold': 0.921735442682995, 'batch_size': 66, 'attention_heads': 16, 'hidden_dimension': 78, 'number_of_hidden_layers': 1, 'dropout_rate': 0.4416531855649057, 'global_pooling': 'max', 'learning_rate': 0.0006198687165766308, 'weight_decay': 0.0006074799534758673, 'beta_0': 0.8102219556154048, 'beta_1': 0.9872698002375514, 'epsilon': 7.364171101277363e-08, 'balanced_loss': False, 'epochs': 125, 'early_stopping_patience': 21, 'plateau_patience': 11, 'plateau_divider': 10}. Best is trial 222 with value: 0.6575405977059186.
[I 2025-02-23 15:21:37,880] Trial 285 finished with value: 0.6248663886579531 and parameters: {'left_stride': 128, 'right_stride': 64, 'attention_pooling_operation': 'max', 'embedding_pooling_operation': 'max', 'threshold': 0.9168227322868958, 'batch_size': 60, 'attention_heads': 15, 'hidden_dimension': 56, 'number_of_hidden_layers': 1, 'dropout_rate': 0.4417308337416219, 'global_pooling': 'max', 'learning_rate': 0.0005943051201100795, 'weight_decay': 0.000475786361867946, 'beta_0': 0.8098038313781121, 'beta_1': 0.986744140391829, 'epsilon': 7.941378493213186e-07, 'balanced_loss': False, 'epochs': 124, 'early_stopping_patience': 21, 'plateau_patience': 15, 'plateau_divider': 10}. Best is trial 222 with value: 0.6575405977059186.
[I 2025-02-23 15:45:37,439] Trial 286 finished with value: 0.6132568335885903 and parameters: {'left_stride': 128, 'right_stride': 64, 'attention_pooling_operation': 'max', 'embedding_pooling_operation': 'max', 'threshold': 0.9099703536364584, 'batch_size': 67, 'attention_heads': 16, 'hidden_dimension': 74, 'number_of_hidden_layers': 1, 'dropout_rate': 0.5884039649668332, 'global_pooling': 'max', 'learning_rate': 0.0006562971020221594, 'weight_decay': 2.0314096342252886e-05, 'beta_0': 0.8082049163980985, 'beta_1': 0.9858482322302248, 'epsilon': 6.856035502213603e-05, 'balanced_loss': False, 'epochs': 130, 'early_stopping_patience': 21, 'plateau_patience': 11, 'plateau_divider': 10}. Best is trial 222 with value: 0.6575405977059186.
