[I 2025-03-27 21:02:27,197] Trial 56 finished with value: 0.43144545120501554 and parameters: {'left_stride': 32, 'right_stride': 64, 'attention_pooling_operation': 'max', 'embedding_pooling_operation': 'max', 'threshold': 0.8187026129767117, 'batch_size': 77, 'attention_heads': 14, 'hidden_dimension': 101, 'number_of_hidden_layers': 1, 'dropout_rate': 0.3810554485213465, 'global_pooling': 'mean', 'learning_rate': 5.795480183047488e-05, 'weight_decay': 9.671671045911798e-05, 'beta_0': 0.8282174792921436, 'beta_1': 0.9807757181373877, 'epsilon': 2.7893575422029483e-07, 'balanced_loss': True, 'epochs': 83, 'early_stopping_patience': 18, 'plateau_patience': 22, 'plateau_divider': 5}. Best is trial 21 with value: 0.5130344367738303.
CUDA out of memory. Tried to allocate 1.95 GiB. GPU 0 has a total capacity of 44.56 GiB of which 1.86 GiB is free. Including non-PyTorch memory, this process has 42.69 GiB memory in use. Of the allocated memory 40.12 GiB is allocated by PyTorch, and 1.42 GiB is reserved by PyTorch but unallocated. If reserved but unallocated memory is large try setting PYTORCH_CUDA_ALLOC_CONF=expandable_segments:True to avoid fragmentation.  See documentation for Memory Management  (https://pytorch.org/docs/stable/notes/cuda.html#environment-variables)
[I 2025-03-27 21:10:50,001] Trial 57 finished with value: -1.0 and parameters: {'left_stride': 0, 'right_stride': 0, 'attention_pooling_operation': 'max', 'embedding_pooling_operation': 'min', 'threshold': 0.837708609076966, 'batch_size': 104, 'attention_heads': 12, 'hidden_dimension': 119, 'number_of_hidden_layers': 2, 'dropout_rate': 0.3978193023151379, 'global_pooling': 'mean', 'learning_rate': 0.0004215640770795848, 'weight_decay': 1.9020390258806214e-06, 'beta_0': 0.8959623737551768, 'beta_1': 0.9892690090517529, 'epsilon': 4.253089601875941e-07, 'balanced_loss': True, 'epochs': 59, 'early_stopping_patience': 21, 'plateau_patience': 18, 'plateau_divider': 10}. Best is trial 21 with value: 0.5130344367738303.
[I 2025-03-27 21:19:37,798] Trial 58 finished with value: 0.09738251142181066 and parameters: {'left_stride': 0, 'right_stride': 64, 'attention_pooling_operation': 'max', 'embedding_pooling_operation': 'min', 'threshold': 0.9971344200736237, 'batch_size': 97, 'attention_heads': 16, 'hidden_dimension': 32, 'number_of_hidden_layers': 2, 'dropout_rate': 0.3666487482488525, 'global_pooling': 'mean', 'learning_rate': 0.0001653383607970527, 'weight_decay': 6.431935934128873e-05, 'beta_0': 0.8667025695535738, 'beta_1': 0.9825480440050153, 'epsilon': 1.5235462690639297e-07, 'balanced_loss': True, 'epochs': 69, 'early_stopping_patience': 22, 'plateau_patience': 21, 'plateau_divider': 2}. Best is trial 21 with value: 0.5130344367738303.
[I 2025-03-27 21:33:11,305] Trial 59 finished with value: 0.4248614997564623 and parameters: {'left_stride': 0, 'right_stride': 128, 'attention_pooling_operation': 'max', 'embedding_pooling_operation': 'min', 'threshold': 0.8534974294510663, 'batch_size': 116, 'attention_heads': 10, 'hidden_dimension': 141, 'number_of_hidden_layers': 1, 'dropout_rate': 0.33746686893892647, 'global_pooling': 'max', 'learning_rate': 0.0002662471506217429, 'weight_decay': 3.0493794775718627e-05, 'beta_0': 0.8346061934707503, 'beta_1': 0.99186655958944, 'epsilon': 6.432242025326187e-08, 'balanced_loss': True, 'epochs': 161, 'early_stopping_patience': 20, 'plateau_patience': 20, 'plateau_divider': 7}. Best is trial 21 with value: 0.5130344367738303.
[I 2025-03-27 21:43:29,245] Trial 60 finished with value: 0.4012726004883621 and parameters: {'left_stride': 0, 'right_stride': 32, 'attention_pooling_operation': 'mean', 'embedding_pooling_operation': 'min', 'threshold': 0.9126685919452545, 'batch_size': 59, 'attention_heads': 15, 'hidden_dimension': 76, 'number_of_hidden_layers': 0, 'dropout_rate': 0.31491668956243707, 'global_pooling': 'mean', 'learning_rate': 0.0005833687142429135, 'weight_decay': 0.00016765256253186892, 'beta_0': 0.8428303880872324, 'beta_1': 0.9854448385792717, 'epsilon': 7.576019914998267e-07, 'balanced_loss': True, 'epochs': 79, 'early_stopping_patience': 23, 'plateau_patience': 23, 'plateau_divider': 8}. Best is trial 21 with value: 0.5130344367738303.
[I 2025-03-27 21:56:14,171] Trial 61 finished with value: 0.4697204452605265 and parameters: {'left_stride': 64, 'right_stride': 0, 'attention_pooling_operation': 'max', 'embedding_pooling_operation': 'max', 'threshold': 0.9036545593842159, 'batch_size': 83, 'attention_heads': 9, 'hidden_dimension': 216, 'number_of_hidden_layers': 1, 'dropout_rate': 0.48262909094792333, 'global_pooling': 'mean', 'learning_rate': 0.0006783798820680041, 'weight_decay': 0.00039297333180699737, 'beta_0': 0.878431084921281, 'beta_1': 0.9902679483524947, 'epsilon': 1.762187355107991e-07, 'balanced_loss': False, 'epochs': 67, 'early_stopping_patience': 17, 'plateau_patience': 17, 'plateau_divider': 7}. Best is trial 21 with value: 0.5130344367738303.
[I 2025-03-27 22:09:04,858] Trial 62 finished with value: 0.47511231948534827 and parameters: {'left_stride': 64, 'right_stride': 0, 'attention_pooling_operation': 'max', 'embedding_pooling_operation': 'max', 'threshold': 0.8832005635939238, 'batch_size': 83, 'attention_heads': 9, 'hidden_dimension': 219, 'number_of_hidden_layers': 1, 'dropout_rate': 0.4660345942212164, 'global_pooling': 'mean', 'learning_rate': 0.0011068779268930793, 'weight_decay': 0.00042187881804491733, 'beta_0': 0.8770443815913964, 'beta_1': 0.9940753532217794, 'epsilon': 1.2364981418591583e-06, 'balanced_loss': False, 'epochs': 87, 'early_stopping_patience': 16, 'plateau_patience': 17, 'plateau_divider': 7}. Best is trial 21 with value: 0.5130344367738303.
[I 2025-03-27 22:20:11,866] Trial 63 finished with value: 0.4511578917026252 and parameters: {'left_stride': 64, 'right_stride': 0, 'attention_pooling_operation': 'max', 'embedding_pooling_operation': 'max', 'threshold': 0.9253944220924019, 'batch_size': 70, 'attention_heads': 9, 'hidden_dimension': 236, 'number_of_hidden_layers': 1, 'dropout_rate': 0.48491368924973194, 'global_pooling': 'mean', 'learning_rate': 0.0012419610544475081, 'weight_decay': 0.0005870623307841058, 'beta_0': 0.8798630922938303, 'beta_1': 0.9946298451095612, 'epsilon': 1.1503297163973974e-06, 'balanced_loss': False, 'epochs': 93, 'early_stopping_patience': 15, 'plateau_patience': 15, 'plateau_divider': 7}. Best is trial 21 with value: 0.5130344367738303.
[I 2025-03-27 22:35:31,319] Trial 64 finished with value: 0.4680381451740932 and parameters: {'left_stride': 64, 'right_stride': 0, 'attention_pooling_operation': 'max', 'embedding_pooling_operation': 'max', 'threshold': 0.8871457695795738, 'batch_size': 83, 'attention_heads': 10, 'hidden_dimension': 248, 'number_of_hidden_layers': 1, 'dropout_rate': 0.5317313406593787, 'global_pooling': 'mean', 'learning_rate': 0.00095504050895437, 'weight_decay': 0.0003888310623162264, 'beta_0': 0.8610922078032662, 'beta_1': 0.997776384147912, 'epsilon': 4.520068025071556e-06, 'balanced_loss': False, 'epochs': 112, 'early_stopping_patience': 16, 'plateau_patience': 16, 'plateau_divider': 7}. Best is trial 21 with value: 0.5130344367738303.
[I 2025-03-27 22:48:13,420] Trial 65 finished with value: 0.47468224563226336 and parameters: {'left_stride': 64, 'right_stride': 64, 'attention_pooling_operation': 'max', 'embedding_pooling_operation': 'max', 'threshold': 0.8863773651696629, 'batch_size': 81, 'attention_heads': 8, 'hidden_dimension': 241, 'number_of_hidden_layers': 1, 'dropout_rate': 0.5545870309241439, 'global_pooling': 'mean', 'learning_rate': 0.0017751698836786553, 'weight_decay': 0.00037455187186256564, 'beta_0': 0.8566339412642213, 'beta_1': 0.9975392814083066, 'epsilon': 3.2058200772528874e-06, 'balanced_loss': False, 'epochs': 129, 'early_stopping_patience': 16, 'plateau_patience': 15, 'plateau_divider': 6}. Best is trial 21 with value: 0.5130344367738303.
[I 2025-03-27 23:04:11,707] Trial 66 finished with value: 0.3948631477143623 and parameters: {'left_stride': 64, 'right_stride': 64, 'attention_pooling_operation': 'max', 'embedding_pooling_operation': 'max', 'threshold': 0.8998979886241543, 'batch_size': 80, 'attention_heads': 7, 'hidden_dimension': 254, 'number_of_hidden_layers': 1, 'dropout_rate': 0.5631846491134594, 'global_pooling': 'sum', 'learning_rate': 0.00264834015622735, 'weight_decay': 0.0003995925561935361, 'beta_0': 0.857861506758273, 'beta_1': 0.9966959654348735, 'epsilon': 4.752563993121354e-06, 'balanced_loss': False, 'epochs': 131, 'early_stopping_patience': 16, 'plateau_patience': 15, 'plateau_divider': 6}. Best is trial 21 with value: 0.5130344367738303.
[I 2025-03-27 23:17:05,739] Trial 67 finished with value: 0.46390213138472414 and parameters: {'left_stride': 64, 'right_stride': 64, 'attention_pooling_operation': 'max', 'embedding_pooling_operation': 'max', 'threshold': 0.8871003517076571, 'batch_size': 84, 'attention_heads': 8, 'hidden_dimension': 248, 'number_of_hidden_layers': 1, 'dropout_rate': 0.5346558217353993, 'global_pooling': 'mean', 'learning_rate': 0.0016688227126809738, 'weight_decay': 0.0007119126322018109, 'beta_0': 0.8543665394395977, 'beta_1': 0.9981233606708496, 'epsilon': 3.0928013708461214e-08, 'balanced_loss': False, 'epochs': 112, 'early_stopping_patience': 16, 'plateau_patience': 14, 'plateau_divider': 7}. Best is trial 21 with value: 0.5130344367738303.
[I 2025-03-27 23:26:31,163] Trial 68 finished with value: 0.4138062844914339 and parameters: {'left_stride': 64, 'right_stride': 64, 'attention_pooling_operation': 'max', 'embedding_pooling_operation': 'max', 'threshold': 0.9346091306969271, 'batch_size': 89, 'attention_heads': 6, 'hidden_dimension': 218, 'number_of_hidden_layers': 0, 'dropout_rate': 0.5767294063523589, 'global_pooling': 'mean', 'learning_rate': 0.0010275524577205819, 'weight_decay': 0.0008600309802375881, 'beta_0': 0.8464360009076545, 'beta_1': 0.9963569504757667, 'epsilon': 8.116539748173388e-06, 'balanced_loss': False, 'epochs': 177, 'early_stopping_patience': 14, 'plateau_patience': 16, 'plateau_divider': 6}. Best is trial 21 with value: 0.5130344367738303.
[I 2025-03-27 23:39:47,139] Trial 69 finished with value: 0.02791140326085221 and parameters: {'left_stride': 64, 'right_stride': 64, 'attention_pooling_operation': 'min', 'embedding_pooling_operation': 'max', 'threshold': 0.8907405483311006, 'batch_size': 75, 'attention_heads': 8, 'hidden_dimension': 233, 'number_of_hidden_layers': 2, 'dropout_rate': 0.5312760531546361, 'global_pooling': 'mean', 'learning_rate': 0.006516849111147599, 'weight_decay': 0.00033093920771171803, 'beta_0': 0.862795586534784, 'beta_1': 0.9976358667598181, 'epsilon': 2.562045255603745e-07, 'balanced_loss': False, 'epochs': 120, 'early_stopping_patience': 17, 'plateau_patience': 17, 'plateau_divider': 5}. Best is trial 21 with value: 0.5130344367738303.
[I 2025-03-27 23:52:45,277] Trial 70 finished with value: 0.41086133604510855 and parameters: {'left_stride': 64, 'right_stride': 64, 'attention_pooling_operation': 'max', 'embedding_pooling_operation': 'max', 'threshold': 0.9113448566135105, 'batch_size': 46, 'attention_heads': 12, 'hidden_dimension': 226, 'number_of_hidden_layers': 1, 'dropout_rate': 0.4493523214679612, 'global_pooling': 'mean', 'learning_rate': 0.0023863881045822176, 'weight_decay': 0.00044371721639692294, 'beta_0': 0.87062142681118, 'beta_1': 0.994760467390205, 'epsilon': 1.6170354169205267e-06, 'balanced_loss': False, 'epochs': 99, 'early_stopping_patience': 15, 'plateau_patience': 13, 'plateau_divider': 6}. Best is trial 21 with value: 0.5130344367738303.
[I 2025-03-28 00:07:03,919] Trial 71 finished with value: 0.45978486960582243 and parameters: {'left_stride': 64, 'right_stride': 0, 'attention_pooling_operation': 'max', 'embedding_pooling_operation': 'max', 'threshold': 0.8801159324099316, 'batch_size': 79, 'attention_heads': 9, 'hidden_dimension': 242, 'number_of_hidden_layers': 1, 'dropout_rate': 0.5029694911571266, 'global_pooling': 'mean', 'learning_rate': 0.0014443078127459453, 'weight_decay': 0.0002470905760094127, 'beta_0': 0.8754283610669275, 'beta_1': 0.9988619766498852, 'epsilon': 3.3137753838401712e-06, 'balanced_loss': False, 'epochs': 108, 'early_stopping_patience': 17, 'plateau_patience': 15, 'plateau_divider': 7}. Best is trial 21 with value: 0.5130344367738303.
[I 2025-03-28 00:22:05,009] Trial 72 finished with value: 0.46369226762937055 and parameters: {'left_stride': 64, 'right_stride': 256, 'attention_pooling_operation': 'max', 'embedding_pooling_operation': 'max', 'threshold': 0.8734998978588983, 'batch_size': 84, 'attention_heads': 10, 'hidden_dimension': 245, 'number_of_hidden_layers': 1, 'dropout_rate': 0.5551744656897029, 'global_pooling': 'mean', 'learning_rate': 0.0010054678922042748, 'weight_decay': 0.0005889797222610246, 'beta_0': 0.8777428401469333, 'beta_1': 0.9955841651125568, 'epsilon': 2.0146770284236436e-06, 'balanced_loss': False, 'epochs': 85, 'early_stopping_patience': 16, 'plateau_patience': 16, 'plateau_divider': 7}. Best is trial 21 with value: 0.5130344367738303.
[I 2025-03-28 00:33:38,914] Trial 73 finished with value: 0.4410646447658319 and parameters: {'left_stride': 64, 'right_stride': 64, 'attention_pooling_operation': 'max', 'embedding_pooling_operation': 'max', 'threshold': 0.9045852388805603, 'batch_size': 65, 'attention_heads': 9, 'hidden_dimension': 214, 'number_of_hidden_layers': 1, 'dropout_rate': 0.4346752611879283, 'global_pooling': 'mean', 'learning_rate': 0.0007882694153391616, 'weight_decay': 0.0003236548813011553, 'beta_0': 0.8096022798011724, 'beta_1': 0.9934332183885346, 'epsilon': 1.0584773726746508e-05, 'balanced_loss': False, 'epochs': 134, 'early_stopping_patience': 14, 'plateau_patience': 14, 'plateau_divider': 6}. Best is trial 21 with value: 0.5130344367738303.
[I 2025-03-28 00:46:50,108] Trial 74 finished with value: 0.48782783069043606 and parameters: {'left_stride': 32, 'right_stride': 0, 'attention_pooling_operation': 'max', 'embedding_pooling_operation': 'max', 'threshold': 0.8862466726966057, 'batch_size': 51, 'attention_heads': 8, 'hidden_dimension': 250, 'number_of_hidden_layers': 1, 'dropout_rate': 0.4630099656624323, 'global_pooling': 'mean', 'learning_rate': 0.00042932103074148605, 'weight_decay': 0.0005003694597285886, 'beta_0': 0.8732069845462931, 'beta_1': 0.9975747608775343, 'epsilon': 5.929705960145502e-06, 'balanced_loss': False, 'epochs': 115, 'early_stopping_patience': 16, 'plateau_patience': 17, 'plateau_divider': 7}. Best is trial 21 with value: 0.5130344367738303.
[I 2025-03-28 00:59:44,209] Trial 75 finished with value: 0.5013159585175189 and parameters: {'left_stride': 32, 'right_stride': 64, 'attention_pooling_operation': 'max', 'embedding_pooling_operation': 'max', 'threshold': 0.8946966070419456, 'batch_size': 52, 'attention_heads': 8, 'hidden_dimension': 250, 'number_of_hidden_layers': 1, 'dropout_rate': 0.4624990997693237, 'global_pooling': 'mean', 'learning_rate': 0.0004916443983079366, 'weight_decay': 0.00047325925049150684, 'beta_0': 0.8619243955341308, 'beta_1': 0.9974748281389566, 'epsilon': 5.311916570915445e-06, 'balanced_loss': False, 'epochs': 124, 'early_stopping_patience': 16, 'plateau_patience': 17, 'plateau_divider': 7}. Best is trial 21 with value: 0.5130344367738303.
[I 2025-03-28 01:16:01,154] Trial 76 finished with value: 0.4543746824233816 and parameters: {'left_stride': 32, 'right_stride': 64, 'attention_pooling_operation': 'mean', 'embedding_pooling_operation': 'max', 'threshold': 0.8943731127494465, 'batch_size': 53, 'attention_heads': 8, 'hidden_dimension': 241, 'number_of_hidden_layers': 2, 'dropout_rate': 0.46195547070049325, 'global_pooling': 'max', 'learning_rate': 0.00040047991256177536, 'weight_decay': 0.0006984497667704434, 'beta_0': 0.8669853863236668, 'beta_1': 0.9956590285558955, 'epsilon': 1.736746302146487e-05, 'balanced_loss': False, 'epochs': 127, 'early_stopping_patience': 18, 'plateau_patience': 17, 'plateau_divider': 6}. Best is trial 21 with value: 0.5130344367738303.
[I 2025-03-28 01:27:51,143] Trial 77 finished with value: 0.48342822275669234 and parameters: {'left_stride': 32, 'right_stride': 64, 'attention_pooling_operation': 'max', 'embedding_pooling_operation': 'max', 'threshold': 0.8832006004359151, 'batch_size': 47, 'attention_heads': 6, 'hidden_dimension': 255, 'number_of_hidden_layers': 1, 'dropout_rate': 0.474011157395777, 'global_pooling': 'mean', 'learning_rate': 0.0003200173139627509, 'weight_decay': 0.00023853215963459288, 'beta_0': 0.8709002922252114, 'beta_1': 0.9921006963241551, 'epsilon': 6.194325438178777e-06, 'balanced_loss': False, 'epochs': 148, 'early_stopping_patience': 15, 'plateau_patience': 17, 'plateau_divider': 7}. Best is trial 21 with value: 0.5130344367738303.
[I 2025-03-28 01:38:29,250] Trial 78 finished with value: 0.4481218270817446 and parameters: {'left_stride': 32, 'right_stride': 64, 'attention_pooling_operation': 'max', 'embedding_pooling_operation': 'max', 'threshold': 0.8833175478679546, 'batch_size': 38, 'attention_heads': 5, 'hidden_dimension': 229, 'number_of_hidden_layers': 1, 'dropout_rate': 0.47185486825675926, 'global_pooling': 'mean', 'learning_rate': 0.0005293679591029023, 'weight_decay': 0.00024250923190131734, 'beta_0': 0.8721274051683334, 'beta_1': 0.9919391529123684, 'epsilon': 3.38230951094419e-05, 'balanced_loss': False, 'epochs': 148, 'early_stopping_patience': 13, 'plateau_patience': 15, 'plateau_divider': 6}. Best is trial 21 with value: 0.5130344367738303.
[I 2025-03-28 01:49:05,715] Trial 79 finished with value: 0.4531391864369451 and parameters: {'left_stride': 32, 'right_stride': 64, 'attention_pooling_operation': 'max', 'embedding_pooling_operation': 'max', 'threshold': 0.9184904203176258, 'batch_size': 48, 'attention_heads': 5, 'hidden_dimension': 253, 'number_of_hidden_layers': 1, 'dropout_rate': 0.42555920701256766, 'global_pooling': 'mean', 'learning_rate': 0.00035145214554893926, 'weight_decay': 0.00046640354614558557, 'beta_0': 0.8540971821134913, 'beta_1': 0.9947050684871741, 'epsilon': 5.9173694297913145e-06, 'balanced_loss': False, 'epochs': 143, 'early_stopping_patience': 15, 'plateau_patience': 18, 'plateau_divider': 4}. Best is trial 21 with value: 0.5130344367738303.
[I 2025-03-28 02:00:00,004] Trial 80 finished with value: 0.3219482659725703 and parameters: {'left_stride': 32, 'right_stride': 64, 'attention_pooling_operation': 'max', 'embedding_pooling_operation': 'max', 'threshold': 0.8674835141227399, 'batch_size': 57, 'attention_heads': 7, 'hidden_dimension': 250, 'number_of_hidden_layers': 0, 'dropout_rate': 0.4641740544279176, 'global_pooling': 'sum', 'learning_rate': 0.0018567487348600206, 'weight_decay': 0.00021317306007028884, 'beta_0': 0.8598659218269294, 'beta_1': 0.9961248281731138, 'epsilon': 1.241960672305577e-05, 'balanced_loss': False, 'epochs': 153, 'early_stopping_patience': 16, 'plateau_patience': 17, 'plateau_divider': 5}. Best is trial 21 with value: 0.5130344367738303.
[I 2025-03-28 02:12:17,379] Trial 81 finished with value: 0.4942094238280637 and parameters: {'left_stride': 32, 'right_stride': 64, 'attention_pooling_operation': 'max', 'embedding_pooling_operation': 'max', 'threshold': 0.8776431062826384, 'batch_size': 43, 'attention_heads': 7, 'hidden_dimension': 235, 'number_of_hidden_layers': 1, 'dropout_rate': 0.48000506690091194, 'global_pooling': 'mean', 'learning_rate': 0.0007585193265212685, 'weight_decay': 0.0005233892288412227, 'beta_0': 0.8678281416605831, 'beta_1': 0.9972892029500451, 'epsilon': 2.3141425927781835e-06, 'balanced_loss': False, 'epochs': 161, 'early_stopping_patience': 17, 'plateau_patience': 17, 'plateau_divider': 7}. Best is trial 21 with value: 0.5130344367738303.
[I 2025-03-28 02:24:54,193] Trial 82 finished with value: 0.475034742116669 and parameters: {'left_stride': 32, 'right_stride': 64, 'attention_pooling_operation': 'max', 'embedding_pooling_operation': 'max', 'threshold': 0.8789075178452197, 'batch_size': 44, 'attention_heads': 7, 'hidden_dimension': 234, 'number_of_hidden_layers': 1, 'dropout_rate': 0.4555471137080477, 'global_pooling': 'mean', 'learning_rate': 0.0002535175818339945, 'weight_decay': 0.0005360401756842069, 'beta_0': 0.8667482958623979, 'beta_1': 0.9972034604877423, 'epsilon': 2.2881054626367937e-06, 'balanced_loss': False, 'epochs': 161, 'early_stopping_patience': 17, 'plateau_patience': 16, 'plateau_divider': 7}. Best is trial 21 with value: 0.5130344367738303.
[I 2025-03-28 02:36:33,387] Trial 83 finished with value: 0.4879182024183769 and parameters: {'left_stride': 32, 'right_stride': 64, 'attention_pooling_operation': 'max', 'embedding_pooling_operation': 'max', 'threshold': 0.8764312839537032, 'batch_size': 43, 'attention_heads': 6, 'hidden_dimension': 237, 'number_of_hidden_layers': 1, 'dropout_rate': 0.45551511899451813, 'global_pooling': 'mean', 'learning_rate': 0.0002788583450728268, 'weight_decay': 0.0008225737771803193, 'beta_0': 0.8676139996512319, 'beta_1': 0.9970890886560755, 'epsilon': 2.4984441297808047e-06, 'balanced_loss': False, 'epochs': 160, 'early_stopping_patience': 16, 'plateau_patience': 16, 'plateau_divider': 7}. Best is trial 21 with value: 0.5130344367738303.
[I 2025-03-28 02:48:06,808] Trial 84 finished with value: 0.43145110643112006 and parameters: {'left_stride': 32, 'right_stride': 64, 'attention_pooling_operation': 'max', 'embedding_pooling_operation': 'max', 'threshold': 0.8802763232554227, 'batch_size': 44, 'attention_heads': 6, 'hidden_dimension': 235, 'number_of_hidden_layers': 1, 'dropout_rate': 0.456483668467577, 'global_pooling': 'mean', 'learning_rate': 0.0002763974227925249, 'weight_decay': 0.0005516823198367991, 'beta_0': 0.8688407547991966, 'beta_1': 0.9968977664849386, 'epsilon': 2.5031858873553788e-06, 'balanced_loss': False, 'epochs': 156, 'early_stopping_patience': 14, 'plateau_patience': 16, 'plateau_divider': 7}. Best is trial 21 with value: 0.5130344367738303.
