[I 2025-03-28 13:59:58,208] Trial 142 finished with value: 0.49389628084620085 and parameters: {'left_stride': 32, 'right_stride': 64, 'attention_pooling_operation': 'max', 'embedding_pooling_operation': 'max', 'threshold': 0.88033395461224, 'batch_size': 43, 'attention_heads': 6, 'hidden_dimension': 245, 'number_of_hidden_layers': 1, 'dropout_rate': 0.4939978354563109, 'global_pooling': 'mean', 'learning_rate': 0.0003980520656357067, 'weight_decay': 0.00046972728257679483, 'beta_0': 0.8762331033398121, 'beta_1': 0.997745461552846, 'epsilon': 5.030094660339475e-07, 'balanced_loss': False, 'epochs': 159, 'early_stopping_patience': 18, 'plateau_patience': 17, 'plateau_divider': 7}. Best is trial 131 with value: 0.5242140918743077.
[I 2025-03-28 14:12:06,406] Trial 143 finished with value: 0.46089037852741577 and parameters: {'left_stride': 32, 'right_stride': 64, 'attention_pooling_operation': 'max', 'embedding_pooling_operation': 'max', 'threshold': 0.8814241742014757, 'batch_size': 40, 'attention_heads': 6, 'hidden_dimension': 246, 'number_of_hidden_layers': 1, 'dropout_rate': 0.4947539476846727, 'global_pooling': 'mean', 'learning_rate': 0.00039052282346613293, 'weight_decay': 0.0004470221537185395, 'beta_0': 0.8802386800603298, 'beta_1': 0.9979206803421621, 'epsilon': 3.2953943005275567e-07, 'balanced_loss': False, 'epochs': 158, 'early_stopping_patience': 18, 'plateau_patience': 17, 'plateau_divider': 6}. Best is trial 131 with value: 0.5242140918743077.
[I 2025-03-28 14:23:09,382] Trial 144 finished with value: 0.4811439785860121 and parameters: {'left_stride': 32, 'right_stride': 64, 'attention_pooling_operation': 'max', 'embedding_pooling_operation': 'max', 'threshold': 0.8904842804791095, 'batch_size': 34, 'attention_heads': 5, 'hidden_dimension': 241, 'number_of_hidden_layers': 1, 'dropout_rate': 0.5047374028778604, 'global_pooling': 'mean', 'learning_rate': 0.0004801164291588138, 'weight_decay': 0.000551908419609891, 'beta_0': 0.8762223078632937, 'beta_1': 0.9983156609643155, 'epsilon': 5.312326825724076e-07, 'balanced_loss': False, 'epochs': 166, 'early_stopping_patience': 17, 'plateau_patience': 17, 'plateau_divider': 7}. Best is trial 131 with value: 0.5242140918743077.
[I 2025-03-28 14:34:20,513] Trial 145 finished with value: 0.4846630998045658 and parameters: {'left_stride': 32, 'right_stride': 64, 'attention_pooling_operation': 'max', 'embedding_pooling_operation': 'max', 'threshold': 0.9050276168731258, 'batch_size': 32, 'attention_heads': 6, 'hidden_dimension': 232, 'number_of_hidden_layers': 1, 'dropout_rate': 0.48846050936586694, 'global_pooling': 'mean', 'learning_rate': 0.0005997908095531733, 'weight_decay': 0.0006955292237684065, 'beta_0': 0.8711834018303556, 'beta_1': 0.9973974720857905, 'epsilon': 4.1514352075441197e-07, 'balanced_loss': False, 'epochs': 162, 'early_stopping_patience': 18, 'plateau_patience': 18, 'plateau_divider': 7}. Best is trial 131 with value: 0.5242140918743077.
[I 2025-03-28 14:44:10,849] Trial 146 finished with value: 0.47226095763175124 and parameters: {'left_stride': 32, 'right_stride': 64, 'attention_pooling_operation': 'max', 'embedding_pooling_operation': 'max', 'threshold': 0.9010452085296359, 'batch_size': 36, 'attention_heads': 13, 'hidden_dimension': 58, 'number_of_hidden_layers': 1, 'dropout_rate': 0.4988763880842103, 'global_pooling': 'mean', 'learning_rate': 0.0007251508874071338, 'weight_decay': 0.0002959416144753329, 'beta_0': 0.8775828449585714, 'beta_1': 0.9968016108317608, 'epsilon': 6.110350394727305e-07, 'balanced_loss': True, 'epochs': 169, 'early_stopping_patience': 19, 'plateau_patience': 18, 'plateau_divider': 7}. Best is trial 131 with value: 0.5242140918743077.
[I 2025-03-28 14:54:53,571] Trial 147 finished with value: 0.49944132136086156 and parameters: {'left_stride': 0, 'right_stride': 64, 'attention_pooling_operation': 'max', 'embedding_pooling_operation': 'min', 'threshold': 0.8951963565940173, 'batch_size': 42, 'attention_heads': 6, 'hidden_dimension': 249, 'number_of_hidden_layers': 1, 'dropout_rate': 0.48586264251830474, 'global_pooling': 'mean', 'learning_rate': 0.0009047090811651289, 'weight_decay': 0.0004099628228318223, 'beta_0': 0.8638151636766308, 'beta_1': 0.9872303944138768, 'epsilon': 4.638706078464792e-07, 'balanced_loss': False, 'epochs': 153, 'early_stopping_patience': 12, 'plateau_patience': 17, 'plateau_divider': 4}. Best is trial 131 with value: 0.5242140918743077.
[I 2025-03-28 15:05:42,359] Trial 148 finished with value: 0.46870549670866485 and parameters: {'left_stride': 0, 'right_stride': 64, 'attention_pooling_operation': 'max', 'embedding_pooling_operation': 'min', 'threshold': 0.9202427355445274, 'batch_size': 44, 'attention_heads': 6, 'hidden_dimension': 256, 'number_of_hidden_layers': 1, 'dropout_rate': 0.48289134802416384, 'global_pooling': 'mean', 'learning_rate': 0.000867209462224485, 'weight_decay': 0.00036991037997828255, 'beta_0': 0.8698192654436065, 'beta_1': 0.9906008652700738, 'epsilon': 4.845921007731366e-07, 'balanced_loss': False, 'epochs': 153, 'early_stopping_patience': 12, 'plateau_patience': 17, 'plateau_divider': 4}. Best is trial 131 with value: 0.5242140918743077.
[I 2025-03-28 15:15:31,257] Trial 149 finished with value: 0.3451208905579787 and parameters: {'left_stride': 0, 'right_stride': 64, 'attention_pooling_operation': 'max', 'embedding_pooling_operation': 'min', 'threshold': 0.8953832050873839, 'batch_size': 38, 'attention_heads': 5, 'hidden_dimension': 250, 'number_of_hidden_layers': 1, 'dropout_rate': 0.4756249278174107, 'global_pooling': 'sum', 'learning_rate': 0.001016805506886875, 'weight_decay': 0.00043847262949611986, 'beta_0': 0.8658337240751546, 'beta_1': 0.99776982395646, 'epsilon': 6.949954818982316e-07, 'balanced_loss': False, 'epochs': 164, 'early_stopping_patience': 11, 'plateau_patience': 17, 'plateau_divider': 3}. Best is trial 131 with value: 0.5242140918743077.
[I 2025-03-28 15:26:24,070] Trial 150 finished with value: 0.47923853543522904 and parameters: {'left_stride': 0, 'right_stride': 64, 'attention_pooling_operation': 'max', 'embedding_pooling_operation': 'min', 'threshold': 0.911461822490913, 'batch_size': 42, 'attention_heads': 5, 'hidden_dimension': 246, 'number_of_hidden_layers': 1, 'dropout_rate': 0.49111618480743846, 'global_pooling': 'mean', 'learning_rate': 0.0007391116817590339, 'weight_decay': 0.0001251394837879247, 'beta_0': 0.8750962225452364, 'beta_1': 0.9963845495431647, 'epsilon': 3.903179774045356e-07, 'balanced_loss': False, 'epochs': 184, 'early_stopping_patience': 13, 'plateau_patience': 17, 'plateau_divider': 5}. Best is trial 131 with value: 0.5242140918743077.
[I 2025-03-28 15:37:17,806] Trial 151 finished with value: 0.47713432578785697 and parameters: {'left_stride': 0, 'right_stride': 64, 'attention_pooling_operation': 'max', 'embedding_pooling_operation': 'min', 'threshold': 0.8888218376060282, 'batch_size': 34, 'attention_heads': 6, 'hidden_dimension': 240, 'number_of_hidden_layers': 1, 'dropout_rate': 0.494004730478369, 'global_pooling': 'mean', 'learning_rate': 0.00045916023284360173, 'weight_decay': 0.0005230548946071297, 'beta_0': 0.8624981792414577, 'beta_1': 0.9865608068140542, 'epsilon': 1.0027179400035959e-06, 'balanced_loss': False, 'epochs': 156, 'early_stopping_patience': 11, 'plateau_patience': 17, 'plateau_divider': 5}. Best is trial 131 with value: 0.5242140918743077.
[I 2025-03-28 15:48:29,999] Trial 152 finished with value: 0.45686130482505305 and parameters: {'left_stride': 32, 'right_stride': 64, 'attention_pooling_operation': 'max', 'embedding_pooling_operation': 'min', 'threshold': 0.8926256913438254, 'batch_size': 40, 'attention_heads': 6, 'hidden_dimension': 251, 'number_of_hidden_layers': 1, 'dropout_rate': 0.4866185337987966, 'global_pooling': 'mean', 'learning_rate': 0.0003605724976537683, 'weight_decay': 0.0008614463952815562, 'beta_0': 0.8638884179756187, 'beta_1': 0.9875342113046854, 'epsilon': 2.2300258064111052e-07, 'balanced_loss': False, 'epochs': 158, 'early_stopping_patience': 12, 'plateau_patience': 18, 'plateau_divider': 2}. Best is trial 131 with value: 0.5242140918743077.
[I 2025-03-28 16:00:00,515] Trial 153 finished with value: 0.4665943218169145 and parameters: {'left_stride': 32, 'right_stride': 64, 'attention_pooling_operation': 'max', 'embedding_pooling_operation': 'max', 'threshold': 0.8833469155165762, 'batch_size': 36, 'attention_heads': 6, 'hidden_dimension': 227, 'number_of_hidden_layers': 1, 'dropout_rate': 0.5055133244689356, 'global_pooling': 'mean', 'learning_rate': 0.0005278957496997081, 'weight_decay': 0.0005927466300253972, 'beta_0': 0.8681900130210334, 'beta_1': 0.9869237110575592, 'epsilon': 8.070039677385587e-07, 'balanced_loss': False, 'epochs': 167, 'early_stopping_patience': 17, 'plateau_patience': 20, 'plateau_divider': 4}. Best is trial 131 with value: 0.5242140918743077.
[I 2025-03-28 16:12:04,653] Trial 154 finished with value: 0.5088073610241584 and parameters: {'left_stride': 0, 'right_stride': 64, 'attention_pooling_operation': 'max', 'embedding_pooling_operation': 'max', 'threshold': 0.9000816832785573, 'batch_size': 45, 'attention_heads': 7, 'hidden_dimension': 239, 'number_of_hidden_layers': 1, 'dropout_rate': 0.4993121793482516, 'global_pooling': 'mean', 'learning_rate': 0.0006256322767380053, 'weight_decay': 0.000725708202747584, 'beta_0': 0.8604811483942544, 'beta_1': 0.9884836736821766, 'epsilon': 3.2724829098046267e-07, 'balanced_loss': False, 'epochs': 162, 'early_stopping_patience': 18, 'plateau_patience': 18, 'plateau_divider': 7}. Best is trial 131 with value: 0.5242140918743077.
[I 2025-03-28 16:23:00,994] Trial 155 finished with value: 0.12422844513524396 and parameters: {'left_stride': 0, 'right_stride': 64, 'attention_pooling_operation': 'max', 'embedding_pooling_operation': 'min', 'threshold': 0.9017015067477604, 'batch_size': 44, 'attention_heads': 6, 'hidden_dimension': 94, 'number_of_hidden_layers': 1, 'dropout_rate': 0.4803547677176519, 'global_pooling': 'mean', 'learning_rate': 0.01399757018203373, 'weight_decay': 0.00047520412191685217, 'beta_0': 0.8597909738567168, 'beta_1': 0.9883973706721956, 'epsilon': 2.983197232311732e-07, 'balanced_loss': False, 'epochs': 171, 'early_stopping_patience': 18, 'plateau_patience': 17, 'plateau_divider': 7}. Best is trial 131 with value: 0.5242140918743077.
[I 2025-03-28 16:34:31,882] Trial 156 finished with value: 0.44986791781153235 and parameters: {'left_stride': 0, 'right_stride': 128, 'attention_pooling_operation': 'max', 'embedding_pooling_operation': 'max', 'threshold': 0.9070836915166978, 'batch_size': 47, 'attention_heads': 7, 'hidden_dimension': 246, 'number_of_hidden_layers': 1, 'dropout_rate': 0.4967782796124516, 'global_pooling': 'mean', 'learning_rate': 0.0009410072032881553, 'weight_decay': 0.0007359925149967491, 'beta_0': 0.872225656589677, 'beta_1': 0.9879617983250124, 'epsilon': 4.6059245300902453e-07, 'balanced_loss': True, 'epochs': 148, 'early_stopping_patience': 19, 'plateau_patience': 18, 'plateau_divider': 7}. Best is trial 131 with value: 0.5242140918743077.
[I 2025-03-28 16:45:36,056] Trial 157 finished with value: 0.5038252724212638 and parameters: {'left_stride': 0, 'right_stride': 32, 'attention_pooling_operation': 'max', 'embedding_pooling_operation': 'max', 'threshold': 0.8800436070639718, 'batch_size': 42, 'attention_heads': 5, 'hidden_dimension': 240, 'number_of_hidden_layers': 1, 'dropout_rate': 0.5138728011639073, 'global_pooling': 'mean', 'learning_rate': 0.0006284073397335904, 'weight_decay': 0.00035741899603762214, 'beta_0': 0.8614459818731733, 'beta_1': 0.9982448747786001, 'epsilon': 2.719758738371712e-07, 'balanced_loss': False, 'epochs': 163, 'early_stopping_patience': 18, 'plateau_patience': 17, 'plateau_divider': 7}. Best is trial 131 with value: 0.5242140918743077.
[I 2025-03-28 16:57:34,071] Trial 158 finished with value: 0.3878450688167944 and parameters: {'left_stride': 0, 'right_stride': 32, 'attention_pooling_operation': 'min', 'embedding_pooling_operation': 'max', 'threshold': 0.8786437871208366, 'batch_size': 42, 'attention_heads': 6, 'hidden_dimension': 252, 'number_of_hidden_layers': 1, 'dropout_rate': 0.5165546455092961, 'global_pooling': 'mean', 'learning_rate': 0.0006064588624433368, 'weight_decay': 0.0004451389545260559, 'beta_0': 0.8816667457959733, 'beta_1': 0.9889546873842221, 'epsilon': 2.462156067085647e-07, 'balanced_loss': False, 'epochs': 162, 'early_stopping_patience': 18, 'plateau_patience': 19, 'plateau_divider': 4}. Best is trial 131 with value: 0.5242140918743077.
[I 2025-03-28 17:10:00,708] Trial 159 finished with value: 0.48697343293540685 and parameters: {'left_stride': 0, 'right_stride': 32, 'attention_pooling_operation': 'max', 'embedding_pooling_operation': 'min', 'threshold': 0.8859849720662017, 'batch_size': 45, 'attention_heads': 7, 'hidden_dimension': 242, 'number_of_hidden_layers': 1, 'dropout_rate': 0.5091782531964717, 'global_pooling': 'mean', 'learning_rate': 0.0005360070558132745, 'weight_decay': 0.0003426576623250031, 'beta_0': 0.8580009164032215, 'beta_1': 0.9895866944670493, 'epsilon': 1.2616622531663755e-07, 'balanced_loss': False, 'epochs': 155, 'early_stopping_patience': 19, 'plateau_patience': 16, 'plateau_divider': 3}. Best is trial 131 with value: 0.5242140918743077.
[I 2025-03-28 17:21:05,446] Trial 160 finished with value: 0.47217966793794536 and parameters: {'left_stride': 0, 'right_stride': 32, 'attention_pooling_operation': 'max', 'embedding_pooling_operation': 'max', 'threshold': 0.8700032431156456, 'batch_size': 49, 'attention_heads': 4, 'hidden_dimension': 256, 'number_of_hidden_layers': 1, 'dropout_rate': 0.5206497897476289, 'global_pooling': 'mean', 'learning_rate': 0.0012846210021657185, 'weight_decay': 0.00040351645956003925, 'beta_0': 0.8157467417187544, 'beta_1': 0.9983983457312775, 'epsilon': 3.016861172160013e-07, 'balanced_loss': True, 'epochs': 165, 'early_stopping_patience': 18, 'plateau_patience': 17, 'plateau_divider': 6}. Best is trial 131 with value: 0.5242140918743077.
[I 2025-03-28 17:31:55,227] Trial 161 finished with value: 0.47471390566509664 and parameters: {'left_stride': 0, 'right_stride': 32, 'attention_pooling_operation': 'max', 'embedding_pooling_operation': 'max', 'threshold': 0.8981203007807181, 'batch_size': 38, 'attention_heads': 5, 'hidden_dimension': 239, 'number_of_hidden_layers': 1, 'dropout_rate': 0.49917613376368586, 'global_pooling': 'mean', 'learning_rate': 0.0007548953554757318, 'weight_decay': 5.604417549606888e-05, 'beta_0': 0.8613165442140358, 'beta_1': 0.9980738764109534, 'epsilon': 3.5331759548348635e-07, 'balanced_loss': False, 'epochs': 169, 'early_stopping_patience': 17, 'plateau_patience': 17, 'plateau_divider': 7}. Best is trial 131 with value: 0.5242140918743077.
[I 2025-03-28 17:44:05,468] Trial 162 finished with value: 0.4962193206154007 and parameters: {'left_stride': 0, 'right_stride': 64, 'attention_pooling_operation': 'max', 'embedding_pooling_operation': 'max', 'threshold': 0.8942018253306693, 'batch_size': 41, 'attention_heads': 5, 'hidden_dimension': 246, 'number_of_hidden_layers': 1, 'dropout_rate': 0.4892513967843965, 'global_pooling': 'mean', 'learning_rate': 0.000627309679788921, 'weight_decay': 0.0001684928807697753, 'beta_0': 0.8653372690810147, 'beta_1': 0.9989572656618506, 'epsilon': 5.145199226306858e-07, 'balanced_loss': False, 'epochs': 163, 'early_stopping_patience': 25, 'plateau_patience': 17, 'plateau_divider': 7}. Best is trial 131 with value: 0.5242140918743077.
[I 2025-03-28 17:56:14,204] Trial 163 finished with value: 0.5061369829295032 and parameters: {'left_stride': 0, 'right_stride': 64, 'attention_pooling_operation': 'max', 'embedding_pooling_operation': 'max', 'threshold': 0.8819328960111239, 'batch_size': 42, 'attention_heads': 6, 'hidden_dimension': 247, 'number_of_hidden_layers': 1, 'dropout_rate': 0.47273081316762394, 'global_pooling': 'mean', 'learning_rate': 0.0006572377822298284, 'weight_decay': 7.611619681984666e-05, 'beta_0': 0.8665133364623689, 'beta_1': 0.9989554335611392, 'epsilon': 5.80285589183315e-07, 'balanced_loss': False, 'epochs': 159, 'early_stopping_patience': 25, 'plateau_patience': 18, 'plateau_divider': 7}. Best is trial 131 with value: 0.5242140918743077.
[I 2025-03-28 18:08:03,527] Trial 164 finished with value: 0.49653844205194 and parameters: {'left_stride': 0, 'right_stride': 64, 'attention_pooling_operation': 'max', 'embedding_pooling_operation': 'max', 'threshold': 0.8844933924946466, 'batch_size': 46, 'attention_heads': 5, 'hidden_dimension': 245, 'number_of_hidden_layers': 1, 'dropout_rate': 0.47201115538655586, 'global_pooling': 'mean', 'learning_rate': 0.00044700803308550486, 'weight_decay': 8.5850667894336e-05, 'beta_0': 0.8667231578510965, 'beta_1': 0.998898199850121, 'epsilon': 5.682405016129217e-07, 'balanced_loss': False, 'epochs': 151, 'early_stopping_patience': 25, 'plateau_patience': 18, 'plateau_divider': 7}. Best is trial 131 with value: 0.5242140918743077.
[I 2025-03-28 18:19:16,775] Trial 165 finished with value: 0.493626625305481 and parameters: {'left_stride': 0, 'right_stride': 64, 'attention_pooling_operation': 'max', 'embedding_pooling_operation': 'max', 'threshold': 0.8849506568525312, 'batch_size': 46, 'attention_heads': 4, 'hidden_dimension': 249, 'number_of_hidden_layers': 1, 'dropout_rate': 0.4706689416712447, 'global_pooling': 'mean', 'learning_rate': 0.0006242350900215289, 'weight_decay': 7.160096396459876e-05, 'beta_0': 0.8667704927886827, 'beta_1': 0.9989812500006795, 'epsilon': 6.214724495939799e-07, 'balanced_loss': False, 'epochs': 153, 'early_stopping_patience': 25, 'plateau_patience': 18, 'plateau_divider': 7}. Best is trial 131 with value: 0.5242140918743077.
[I 2025-03-28 18:30:55,031] Trial 166 finished with value: 0.5058828937007408 and parameters: {'left_stride': 0, 'right_stride': 64, 'attention_pooling_operation': 'max', 'embedding_pooling_operation': 'max', 'threshold': 0.8893354542078751, 'batch_size': 41, 'attention_heads': 5, 'hidden_dimension': 240, 'number_of_hidden_layers': 1, 'dropout_rate': 0.4789711742742959, 'global_pooling': 'mean', 'learning_rate': 0.00045462275259754143, 'weight_decay': 7.55390273758825e-05, 'beta_0': 0.8666300480363386, 'beta_1': 0.9986534969328981, 'epsilon': 7.228427068932382e-07, 'balanced_loss': False, 'epochs': 141, 'early_stopping_patience': 25, 'plateau_patience': 18, 'plateau_divider': 6}. Best is trial 131 with value: 0.5242140918743077.
[I 2025-03-28 18:43:09,130] Trial 167 finished with value: 0.4509038424856643 and parameters: {'left_stride': 0, 'right_stride': 64, 'attention_pooling_operation': 'max', 'embedding_pooling_operation': 'mean', 'threshold': 0.8907395858887822, 'batch_size': 46, 'attention_heads': 5, 'hidden_dimension': 239, 'number_of_hidden_layers': 1, 'dropout_rate': 0.467763287458224, 'global_pooling': 'max', 'learning_rate': 0.0003298882905237867, 'weight_decay': 7.784182394638835e-05, 'beta_0': 0.8652857102065632, 'beta_1': 0.9986403817082989, 'epsilon': 5.5021394034759e-07, 'balanced_loss': False, 'epochs': 144, 'early_stopping_patience': 24, 'plateau_patience': 19, 'plateau_divider': 6}. Best is trial 131 with value: 0.5242140918743077.
[I 2025-03-28 18:54:53,014] Trial 168 finished with value: 0.48906640936296986 and parameters: {'left_stride': 0, 'right_stride': 32, 'attention_pooling_operation': 'max', 'embedding_pooling_operation': 'max', 'threshold': 0.8938645527543663, 'batch_size': 41, 'attention_heads': 5, 'hidden_dimension': 244, 'number_of_hidden_layers': 1, 'dropout_rate': 0.4751537234137564, 'global_pooling': 'mean', 'learning_rate': 0.0004864646468665932, 'weight_decay': 9.730861948645992e-05, 'beta_0': 0.8624654216587483, 'beta_1': 0.9989468784712812, 'epsilon': 7.441261306651061e-07, 'balanced_loss': False, 'epochs': 141, 'early_stopping_patience': 25, 'plateau_patience': 18, 'plateau_divider': 6}. Best is trial 131 with value: 0.5242140918743077.
[I 2025-03-28 19:06:42,689] Trial 169 finished with value: 0.4689680552185879 and parameters: {'left_stride': 0, 'right_stride': 64, 'attention_pooling_operation': 'mean', 'embedding_pooling_operation': 'max', 'threshold': 0.8963945348864266, 'batch_size': 40, 'attention_heads': 4, 'hidden_dimension': 247, 'number_of_hidden_layers': 1, 'dropout_rate': 0.4868021829900798, 'global_pooling': 'mean', 'learning_rate': 0.0004589276631368058, 'weight_decay': 0.00016894632570773905, 'beta_0': 0.87014165179834, 'beta_1': 0.9986004725726289, 'epsilon': 4.2464020972373644e-07, 'balanced_loss': False, 'epochs': 149, 'early_stopping_patience': 25, 'plateau_patience': 18, 'plateau_divider': 6}. Best is trial 131 with value: 0.5242140918743077.
[I 2025-03-28 19:18:23,486] Trial 170 finished with value: 0.4773642623615184 and parameters: {'left_stride': 0, 'right_stride': 64, 'attention_pooling_operation': 'max', 'embedding_pooling_operation': 'max', 'threshold': 0.8881724139163881, 'batch_size': 50, 'attention_heads': 5, 'hidden_dimension': 251, 'number_of_hidden_layers': 1, 'dropout_rate': 0.4768285049766, 'global_pooling': 'mean', 'learning_rate': 0.0010339264185979364, 'weight_decay': 0.00012814392812048855, 'beta_0': 0.8372173434529996, 'beta_1': 0.9983710143864077, 'epsilon': 8.161908829249039e-07, 'balanced_loss': False, 'epochs': 151, 'early_stopping_patience': 24, 'plateau_patience': 18, 'plateau_divider': 6}. Best is trial 131 with value: 0.5242140918743077.
