[I 2025-03-03 02:55:45,721] Using an existing study with name 'Ohsumed-GATv2-google-bert-bert-base-uncased-Surrogate-No_Aggregation-No_Ablation-1.0-0.5' instead of creating a new one.
Token indices sequence length is longer than the specified maximum sequence length for this model (611 > 512). Running this sequence through the model will result in indexing errors
CUDA out of memory. Tried to allocate 1.58 GiB. GPU 0 has a total capacity of 44.56 GiB of which 1.10 GiB is free. Including non-PyTorch memory, this process has 43.46 GiB memory in use. Of the allocated memory 41.44 GiB is allocated by PyTorch, and 884.35 MiB is reserved by PyTorch but unallocated. If reserved but unallocated memory is large try setting PYTORCH_CUDA_ALLOC_CONF=expandable_segments:True to avoid fragmentation.  See documentation for Memory Management  (https://pytorch.org/docs/stable/notes/cuda.html#environment-variables)
[I 2025-03-03 03:08:43,173] Trial 220 finished with value: -1.0 and parameters: {'left_stride': 128, 'right_stride': 0, 'attention_pooling_operation': 'max', 'embedding_pooling_operation': 'min', 'threshold': 0.9603403824414604, 'batch_size': 76, 'attention_heads': 12, 'hidden_dimension': 106, 'number_of_hidden_layers': 2, 'dropout_rate': 0.32870921433782885, 'global_pooling': 'mean', 'learning_rate': 0.0005521475235822329, 'weight_decay': 5.80141835533934e-06, 'beta_0': 0.8993546514310924, 'beta_1': 0.9895658041392318, 'epsilon': 1.2802216168868378e-08, 'balanced_loss': True, 'epochs': 152, 'early_stopping_patience': 21, 'plateau_patience': 11, 'plateau_divider': 4}. Best is trial 147 with value: 0.5890664194848952.
[I 2025-03-03 03:26:59,693] Trial 221 finished with value: 0.534656954788841 and parameters: {'left_stride': 128, 'right_stride': 0, 'attention_pooling_operation': 'max', 'embedding_pooling_operation': 'min', 'threshold': 0.9622982899943964, 'batch_size': 38, 'attention_heads': 11, 'hidden_dimension': 95, 'number_of_hidden_layers': 2, 'dropout_rate': 0.3174931949984399, 'global_pooling': 'mean', 'learning_rate': 0.0006935122079449788, 'weight_decay': 1.1161327170692643e-05, 'beta_0': 0.8962290360300743, 'beta_1': 0.9903356352678316, 'epsilon': 2.7391083973498057e-08, 'balanced_loss': True, 'epochs': 147, 'early_stopping_patience': 21, 'plateau_patience': 11, 'plateau_divider': 4}. Best is trial 147 with value: 0.5890664194848952.
[I 2025-03-03 03:46:06,642] Trial 222 finished with value: 0.5716807113801612 and parameters: {'left_stride': 128, 'right_stride': 0, 'attention_pooling_operation': 'max', 'embedding_pooling_operation': 'min', 'threshold': 0.9562752278326582, 'batch_size': 32, 'attention_heads': 12, 'hidden_dimension': 79, 'number_of_hidden_layers': 2, 'dropout_rate': 0.33313731103644134, 'global_pooling': 'mean', 'learning_rate': 0.0005354985183588972, 'weight_decay': 2.5674288809066155e-05, 'beta_0': 0.8958033736437961, 'beta_1': 0.9889566594675808, 'epsilon': 2.1628650632764296e-08, 'balanced_loss': True, 'epochs': 154, 'early_stopping_patience': 22, 'plateau_patience': 10, 'plateau_divider': 4}. Best is trial 147 with value: 0.5890664194848952.
[I 2025-03-03 04:05:40,390] Trial 223 finished with value: 0.5457585212517734 and parameters: {'left_stride': 128, 'right_stride': 0, 'attention_pooling_operation': 'max', 'embedding_pooling_operation': 'min', 'threshold': 0.9542252765219605, 'batch_size': 32, 'attention_heads': 12, 'hidden_dimension': 80, 'number_of_hidden_layers': 2, 'dropout_rate': 0.33512218980150604, 'global_pooling': 'mean', 'learning_rate': 0.0005242565674635313, 'weight_decay': 2.491243462994984e-05, 'beta_0': 0.8959334394562695, 'beta_1': 0.9890038420584484, 'epsilon': 2.2893369472220534e-08, 'balanced_loss': True, 'epochs': 153, 'early_stopping_patience': 22, 'plateau_patience': 10, 'plateau_divider': 4}. Best is trial 147 with value: 0.5890664194848952.
[I 2025-03-03 04:25:30,774] Trial 224 finished with value: 0.5532920094049728 and parameters: {'left_stride': 128, 'right_stride': 0, 'attention_pooling_operation': 'min', 'embedding_pooling_operation': 'min', 'threshold': 0.953338702993461, 'batch_size': 32, 'attention_heads': 12, 'hidden_dimension': 84, 'number_of_hidden_layers': 2, 'dropout_rate': 0.319567818120927, 'global_pooling': 'mean', 'learning_rate': 0.0008053923573085085, 'weight_decay': 3.6423060396747675e-05, 'beta_0': 0.8959029715382232, 'beta_1': 0.9891508882167067, 'epsilon': 1.678351441234989e-08, 'balanced_loss': True, 'epochs': 151, 'early_stopping_patience': 22, 'plateau_patience': 10, 'plateau_divider': 4}. Best is trial 147 with value: 0.5890664194848952.
[I 2025-03-03 04:44:55,700] Trial 225 finished with value: 0.5110045643874378 and parameters: {'left_stride': 128, 'right_stride': 0, 'attention_pooling_operation': 'min', 'embedding_pooling_operation': 'min', 'threshold': 0.952374293609325, 'batch_size': 32, 'attention_heads': 12, 'hidden_dimension': 77, 'number_of_hidden_layers': 2, 'dropout_rate': 0.32347045788028395, 'global_pooling': 'mean', 'learning_rate': 0.0008246140378106985, 'weight_decay': 2.6481236474255504e-05, 'beta_0': 0.8952662754233888, 'beta_1': 0.9890697040388786, 'epsilon': 1.42417538506619e-08, 'balanced_loss': True, 'epochs': 150, 'early_stopping_patience': 22, 'plateau_patience': 10, 'plateau_divider': 4}. Best is trial 147 with value: 0.5890664194848952.
[I 2025-03-03 05:05:59,270] Trial 226 finished with value: 0.5532734800200969 and parameters: {'left_stride': 128, 'right_stride': 0, 'attention_pooling_operation': 'min', 'embedding_pooling_operation': 'min', 'threshold': 0.9456305261063742, 'batch_size': 32, 'attention_heads': 12, 'hidden_dimension': 87, 'number_of_hidden_layers': 2, 'dropout_rate': 0.3313138084277344, 'global_pooling': 'mean', 'learning_rate': 0.0011940339285659443, 'weight_decay': 3.327592746063618e-05, 'beta_0': 0.889289934705273, 'beta_1': 0.9883781614841493, 'epsilon': 1.5327725680578074e-08, 'balanced_loss': True, 'epochs': 158, 'early_stopping_patience': 22, 'plateau_patience': 10, 'plateau_divider': 4}. Best is trial 147 with value: 0.5890664194848952.
[I 2025-03-03 05:26:12,250] Trial 227 finished with value: 0.5068973601236153 and parameters: {'left_stride': 128, 'right_stride': 0, 'attention_pooling_operation': 'min', 'embedding_pooling_operation': 'min', 'threshold': 0.9474518069681124, 'batch_size': 32, 'attention_heads': 12, 'hidden_dimension': 80, 'number_of_hidden_layers': 2, 'dropout_rate': 0.31822375418047116, 'global_pooling': 'mean', 'learning_rate': 0.0010363645258650708, 'weight_decay': 4.3200457900752444e-05, 'beta_0': 0.889153687274954, 'beta_1': 0.9885796764431471, 'epsilon': 1.6470161129891258e-08, 'balanced_loss': True, 'epochs': 157, 'early_stopping_patience': 22, 'plateau_patience': 10, 'plateau_divider': 4}. Best is trial 147 with value: 0.5890664194848952.
CUDA out of memory. Tried to allocate 1.30 GiB. GPU 0 has a total capacity of 44.56 GiB of which 1.19 GiB is free. Including non-PyTorch memory, this process has 43.37 GiB memory in use. Of the allocated memory 40.79 GiB is allocated by PyTorch, and 1.43 GiB is reserved by PyTorch but unallocated. If reserved but unallocated memory is large try setting PYTORCH_CUDA_ALLOC_CONF=expandable_segments:True to avoid fragmentation.  See documentation for Memory Management  (https://pytorch.org/docs/stable/notes/cuda.html#environment-variables)
[I 2025-03-03 05:39:14,017] Trial 228 finished with value: -1.0 and parameters: {'left_stride': 128, 'right_stride': 0, 'attention_pooling_operation': 'min', 'embedding_pooling_operation': 'min', 'threshold': 0.9536156929354025, 'batch_size': 80, 'attention_heads': 12, 'hidden_dimension': 85, 'number_of_hidden_layers': 2, 'dropout_rate': 0.33397431819719087, 'global_pooling': 'mean', 'learning_rate': 0.0013161904800620776, 'weight_decay': 2.6123529844045033e-05, 'beta_0': 0.8938774116026377, 'beta_1': 0.9894876642179274, 'epsilon': 1.4449104449110267e-08, 'balanced_loss': True, 'epochs': 154, 'early_stopping_patience': 22, 'plateau_patience': 10, 'plateau_divider': 4}. Best is trial 147 with value: 0.5890664194848952.
[I 2025-03-03 05:58:03,574] Trial 229 finished with value: 0.5285914242081896 and parameters: {'left_stride': 128, 'right_stride': 0, 'attention_pooling_operation': 'min', 'embedding_pooling_operation': 'min', 'threshold': 0.9646336486280367, 'batch_size': 34, 'attention_heads': 12, 'hidden_dimension': 88, 'number_of_hidden_layers': 2, 'dropout_rate': 0.32454175854091427, 'global_pooling': 'mean', 'learning_rate': 0.000668103230389588, 'weight_decay': 3.346805462404534e-05, 'beta_0': 0.8918126757874114, 'beta_1': 0.9882275763992137, 'epsilon': 1.0976697456315474e-08, 'balanced_loss': True, 'epochs': 151, 'early_stopping_patience': 22, 'plateau_patience': 20, 'plateau_divider': 4}. Best is trial 147 with value: 0.5890664194848952.
[I 2025-03-03 06:17:23,060] Trial 230 finished with value: 0.5344713665279542 and parameters: {'left_stride': 128, 'right_stride': 0, 'attention_pooling_operation': 'min', 'embedding_pooling_operation': 'min', 'threshold': 0.9562365421905237, 'batch_size': 32, 'attention_heads': 12, 'hidden_dimension': 81, 'number_of_hidden_layers': 2, 'dropout_rate': 0.3301298820382924, 'global_pooling': 'mean', 'learning_rate': 0.0008308113535596134, 'weight_decay': 3.749624842655086e-05, 'beta_0': 0.8966202904878101, 'beta_1': 0.9888582709242617, 'epsilon': 2.1372773946953264e-08, 'balanced_loss': True, 'epochs': 158, 'early_stopping_patience': 22, 'plateau_patience': 10, 'plateau_divider': 4}. Best is trial 147 with value: 0.5890664194848952.
[I 2025-03-03 06:37:59,332] Trial 231 finished with value: 0.5275292826463874 and parameters: {'left_stride': 128, 'right_stride': 0, 'attention_pooling_operation': 'min', 'embedding_pooling_operation': 'min', 'threshold': 0.9495067012573877, 'batch_size': 34, 'attention_heads': 12, 'hidden_dimension': 89, 'number_of_hidden_layers': 2, 'dropout_rate': 0.3188262607732111, 'global_pooling': 'mean', 'learning_rate': 0.0005958883532216851, 'weight_decay': 1.4412393193089938e-05, 'beta_0': 0.8963500053762838, 'beta_1': 0.9892691566017361, 'epsilon': 1.8330398455629462e-08, 'balanced_loss': True, 'epochs': 148, 'early_stopping_patience': 22, 'plateau_patience': 10, 'plateau_divider': 4}. Best is trial 147 with value: 0.5890664194848952.
CUDA out of memory. Tried to allocate 134.00 MiB. GPU 0 has a total capacity of 44.56 GiB of which 68.69 MiB is free. Including non-PyTorch memory, this process has 44.49 GiB memory in use. Of the allocated memory 42.70 GiB is allocated by PyTorch, and 647.13 MiB is reserved by PyTorch but unallocated. If reserved but unallocated memory is large try setting PYTORCH_CUDA_ALLOC_CONF=expandable_segments:True to avoid fragmentation.  See documentation for Memory Management  (https://pytorch.org/docs/stable/notes/cuda.html#environment-variables)
[I 2025-03-03 06:50:11,734] Trial 232 finished with value: -1.0 and parameters: {'left_stride': 128, 'right_stride': 0, 'attention_pooling_operation': 'min', 'embedding_pooling_operation': 'min', 'threshold': 0.9035201300744156, 'batch_size': 32, 'attention_heads': 12, 'hidden_dimension': 77, 'number_of_hidden_layers': 2, 'dropout_rate': 0.3278221210563132, 'global_pooling': 'mean', 'learning_rate': 0.0004958522113090037, 'weight_decay': 7.658287053979531e-06, 'beta_0': 0.8910855103316191, 'beta_1': 0.9884926542441567, 'epsilon': 2.4467000632621095e-08, 'balanced_loss': True, 'epochs': 156, 'early_stopping_patience': 23, 'plateau_patience': 10, 'plateau_divider': 4}. Best is trial 147 with value: 0.5890664194848952.
CUDA out of memory. Tried to allocate 846.00 MiB. GPU 0 has a total capacity of 44.56 GiB of which 832.69 MiB is free. Including non-PyTorch memory, this process has 43.74 GiB memory in use. Of the allocated memory 41.90 GiB is allocated by PyTorch, and 709.64 MiB is reserved by PyTorch but unallocated. If reserved but unallocated memory is large try setting PYTORCH_CUDA_ALLOC_CONF=expandable_segments:True to avoid fragmentation.  See documentation for Memory Management  (https://pytorch.org/docs/stable/notes/cuda.html#environment-variables)
[I 2025-03-03 07:03:12,566] Trial 233 finished with value: -1.0 and parameters: {'left_stride': 128, 'right_stride': 0, 'attention_pooling_operation': 'min', 'embedding_pooling_operation': 'min', 'threshold': 0.9184035973763064, 'batch_size': 34, 'attention_heads': 12, 'hidden_dimension': 85, 'number_of_hidden_layers': 2, 'dropout_rate': 0.3349479844920132, 'global_pooling': 'mean', 'learning_rate': 0.0006679587992913649, 'weight_decay': 5.204214062901245e-05, 'beta_0': 0.8863422470073592, 'beta_1': 0.9878323356298347, 'epsilon': 2.0072413200091736e-08, 'balanced_loss': True, 'epochs': 160, 'early_stopping_patience': 22, 'plateau_patience': 10, 'plateau_divider': 4}. Best is trial 147 with value: 0.5890664194848952.
[I 2025-03-03 07:22:54,401] Trial 234 finished with value: 0.4834467670790268 and parameters: {'left_stride': 128, 'right_stride': 0, 'attention_pooling_operation': 'min', 'embedding_pooling_operation': 'min', 'threshold': 0.9677896677720657, 'batch_size': 35, 'attention_heads': 12, 'hidden_dimension': 97, 'number_of_hidden_layers': 2, 'dropout_rate': 0.33936371178775665, 'global_pooling': 'max', 'learning_rate': 0.0009227409948363307, 'weight_decay': 8.873562684664641e-06, 'beta_0': 0.8998309203068711, 'beta_1': 0.9897420068640321, 'epsilon': 1.4552332648546245e-08, 'balanced_loss': True, 'epochs': 152, 'early_stopping_patience': 23, 'plateau_patience': 10, 'plateau_divider': 4}. Best is trial 147 with value: 0.5890664194848952.
[I 2025-03-03 08:07:26,509] Trial 235 finished with value: 0.47633095345983023 and parameters: {'left_stride': 128, 'right_stride': 0, 'attention_pooling_operation': 'max', 'embedding_pooling_operation': 'mean', 'threshold': 0.9637038700591547, 'batch_size': 32, 'attention_heads': 12, 'hidden_dimension': 91, 'number_of_hidden_layers': 2, 'dropout_rate': 0.3234672172467874, 'global_pooling': 'mean', 'learning_rate': 1.0993032231668202e-05, 'weight_decay': 2.3427448292753167e-05, 'beta_0': 0.8935704512029112, 'beta_1': 0.9889100821560179, 'epsilon': 2.3158145226246465e-08, 'balanced_loss': True, 'epochs': 144, 'early_stopping_patience': 19, 'plateau_patience': 10, 'plateau_divider': 4}. Best is trial 147 with value: 0.5890664194848952.
[I 2025-03-03 08:27:16,443] Trial 236 finished with value: 0.5482024696471782 and parameters: {'left_stride': 128, 'right_stride': 0, 'attention_pooling_operation': 'min', 'embedding_pooling_operation': 'min', 'threshold': 0.9442356079330788, 'batch_size': 34, 'attention_heads': 11, 'hidden_dimension': 74, 'number_of_hidden_layers': 2, 'dropout_rate': 0.34765456128438527, 'global_pooling': 'mean', 'learning_rate': 0.0007610511599733961, 'weight_decay': 6.427942569751426e-06, 'beta_0': 0.897608923599833, 'beta_1': 0.9882060605429394, 'epsilon': 1.773168822020248e-08, 'balanced_loss': True, 'epochs': 155, 'early_stopping_patience': 21, 'plateau_patience': 10, 'plateau_divider': 4}. Best is trial 147 with value: 0.5890664194848952.
[I 2025-03-03 08:46:09,747] Trial 237 finished with value: 0.5236736066360558 and parameters: {'left_stride': 128, 'right_stride': 0, 'attention_pooling_operation': 'min', 'embedding_pooling_operation': 'min', 'threshold': 0.9527957556498925, 'batch_size': 36, 'attention_heads': 11, 'hidden_dimension': 80, 'number_of_hidden_layers': 2, 'dropout_rate': 0.33115768689545144, 'global_pooling': 'mean', 'learning_rate': 0.0010850234293204957, 'weight_decay': 6.047466696942558e-06, 'beta_0': 0.89547968089612, 'beta_1': 0.9882416558053191, 'epsilon': 1.5695713906532252e-08, 'balanced_loss': True, 'epochs': 162, 'early_stopping_patience': 21, 'plateau_patience': 10, 'plateau_divider': 4}. Best is trial 147 with value: 0.5890664194848952.
[I 2025-03-03 09:06:30,777] Trial 238 finished with value: 0.5539137304133631 and parameters: {'left_stride': 128, 'right_stride': 0, 'attention_pooling_operation': 'max', 'embedding_pooling_operation': 'min', 'threshold': 0.9428509448596657, 'batch_size': 34, 'attention_heads': 11, 'hidden_dimension': 75, 'number_of_hidden_layers': 2, 'dropout_rate': 0.3488353002255207, 'global_pooling': 'mean', 'learning_rate': 0.0006972031118611269, 'weight_decay': 3.1773454613490525e-05, 'beta_0': 0.8979954278301778, 'beta_1': 0.9877937268492886, 'epsilon': 1.158637226259116e-08, 'balanced_loss': True, 'epochs': 155, 'early_stopping_patience': 22, 'plateau_patience': 10, 'plateau_divider': 4}. Best is trial 147 with value: 0.5890664194848952.
CUDA out of memory. Tried to allocate 1.04 GiB. GPU 0 has a total capacity of 44.56 GiB of which 514.69 MiB is free. Including non-PyTorch memory, this process has 44.05 GiB memory in use. Of the allocated memory 41.66 GiB is allocated by PyTorch, and 1.24 GiB is reserved by PyTorch but unallocated. If reserved but unallocated memory is large try setting PYTORCH_CUDA_ALLOC_CONF=expandable_segments:True to avoid fragmentation.  See documentation for Memory Management  (https://pytorch.org/docs/stable/notes/cuda.html#environment-variables)
[I 2025-03-03 09:19:42,120] Trial 239 finished with value: -1.0 and parameters: {'left_stride': 128, 'right_stride': 0, 'attention_pooling_operation': 'min', 'embedding_pooling_operation': 'min', 'threshold': 0.942966932851399, 'batch_size': 34, 'attention_heads': 16, 'hidden_dimension': 76, 'number_of_hidden_layers': 2, 'dropout_rate': 0.35015412337378415, 'global_pooling': 'mean', 'learning_rate': 0.0007815906654361112, 'weight_decay': 3.292096626598716e-05, 'beta_0': 0.8976286976647541, 'beta_1': 0.9875075709540811, 'epsilon': 1.056053610811191e-08, 'balanced_loss': True, 'epochs': 155, 'early_stopping_patience': 22, 'plateau_patience': 10, 'plateau_divider': 4}. Best is trial 147 with value: 0.5890664194848952.
[I 2025-03-03 09:39:07,120] Trial 240 finished with value: 0.5225417083779812 and parameters: {'left_stride': 128, 'right_stride': 0, 'attention_pooling_operation': 'min', 'embedding_pooling_operation': 'min', 'threshold': 0.9450931406568677, 'batch_size': 34, 'attention_heads': 11, 'hidden_dimension': 72, 'number_of_hidden_layers': 2, 'dropout_rate': 0.3452184070295416, 'global_pooling': 'mean', 'learning_rate': 0.0006120810178502111, 'weight_decay': 6.878668098212229e-06, 'beta_0': 0.8974143284830631, 'beta_1': 0.9878138026809834, 'epsilon': 1.7275197373173362e-08, 'balanced_loss': True, 'epochs': 156, 'early_stopping_patience': 22, 'plateau_patience': 10, 'plateau_divider': 4}. Best is trial 147 with value: 0.5890664194848952.
CUDA out of memory. Tried to allocate 912.00 MiB. GPU 0 has a total capacity of 44.56 GiB of which 912.69 MiB is free. Including non-PyTorch memory, this process has 43.66 GiB memory in use. Of the allocated memory 42.22 GiB is allocated by PyTorch, and 297.70 MiB is reserved by PyTorch but unallocated. If reserved but unallocated memory is large try setting PYTORCH_CUDA_ALLOC_CONF=expandable_segments:True to avoid fragmentation.  See documentation for Memory Management  (https://pytorch.org/docs/stable/notes/cuda.html#environment-variables)
[I 2025-03-03 09:52:20,607] Trial 241 finished with value: -1.0 and parameters: {'left_stride': 128, 'right_stride': 0, 'attention_pooling_operation': 'min', 'embedding_pooling_operation': 'min', 'threshold': 0.9377259497082141, 'batch_size': 36, 'attention_heads': 11, 'hidden_dimension': 84, 'number_of_hidden_layers': 2, 'dropout_rate': 0.3381272104481075, 'global_pooling': 'mean', 'learning_rate': 0.0015485218196959589, 'weight_decay': 3.73741507423993e-05, 'beta_0': 0.8929176282589851, 'beta_1': 0.9874461667138446, 'epsilon': 1.3933672179473234e-08, 'balanced_loss': True, 'epochs': 158, 'early_stopping_patience': 22, 'plateau_patience': 10, 'plateau_divider': 4}. Best is trial 147 with value: 0.5890664194848952.
[I 2025-03-03 10:11:57,653] Trial 242 finished with value: 0.5224308188214705 and parameters: {'left_stride': 128, 'right_stride': 0, 'attention_pooling_operation': 'min', 'embedding_pooling_operation': 'min', 'threshold': 0.9463679090153516, 'batch_size': 33, 'attention_heads': 11, 'hidden_dimension': 73, 'number_of_hidden_layers': 2, 'dropout_rate': 0.33447893527570616, 'global_pooling': 'mean', 'learning_rate': 0.0005404322256659779, 'weight_decay': 1.100736527955972e-05, 'beta_0': 0.8953699766370957, 'beta_1': 0.9882555718759728, 'epsilon': 1.160838761192296e-08, 'balanced_loss': True, 'epochs': 152, 'early_stopping_patience': 22, 'plateau_patience': 10, 'plateau_divider': 4}. Best is trial 147 with value: 0.5890664194848952.
[I 2025-03-03 10:32:08,174] Trial 243 finished with value: 0.5337777962222315 and parameters: {'left_stride': 128, 'right_stride': 0, 'attention_pooling_operation': 'max', 'embedding_pooling_operation': 'min', 'threshold': 0.950635795327423, 'batch_size': 32, 'attention_heads': 11, 'hidden_dimension': 93, 'number_of_hidden_layers': 2, 'dropout_rate': 0.3161897001909617, 'global_pooling': 'mean', 'learning_rate': 0.0007538401663669671, 'weight_decay': 3.129627838286824e-05, 'beta_0': 0.8978632901668481, 'beta_1': 0.9867573340336466, 'epsilon': 2.286382147055853e-08, 'balanced_loss': True, 'epochs': 125, 'early_stopping_patience': 21, 'plateau_patience': 10, 'plateau_divider': 4}. Best is trial 147 with value: 0.5890664194848952.
