[I 2025-03-28 03:00:35,153] Trial 85 finished with value: 0.4361510630964946 and parameters: {'left_stride': 32, 'right_stride': 64, 'attention_pooling_operation': 'max', 'embedding_pooling_operation': 'max', 'threshold': 0.8780212559560715, 'batch_size': 41, 'attention_heads': 7, 'hidden_dimension': 223, 'number_of_hidden_layers': 1, 'dropout_rate': 0.44427065101578367, 'global_pooling': 'mean', 'learning_rate': 0.00012457816119108614, 'weight_decay': 0.0008991320764502036, 'beta_0': 0.8736877068864827, 'beta_1': 0.9984285144385125, 'epsilon': 4.059680010244562e-06, 'balanced_loss': False, 'epochs': 164, 'early_stopping_patience': 17, 'plateau_patience': 17, 'plateau_divider': 7}. Best is trial 21 with value: 0.5130344367738303.
[I 2025-03-28 03:12:51,543] Trial 86 finished with value: 0.4858085919367316 and parameters: {'left_stride': 32, 'right_stride': 64, 'attention_pooling_operation': 'max', 'embedding_pooling_operation': 'max', 'threshold': 0.8933654509341054, 'batch_size': 34, 'attention_heads': 6, 'hidden_dimension': 256, 'number_of_hidden_layers': 1, 'dropout_rate': 0.4937197259964729, 'global_pooling': 'mean', 'learning_rate': 0.0004764939271431082, 'weight_decay': 0.000820756034605094, 'beta_0': 0.865417768010149, 'beta_1': 0.9971019010695639, 'epsilon': 6.515992843041028e-06, 'balanced_loss': False, 'epochs': 172, 'early_stopping_patience': 18, 'plateau_patience': 18, 'plateau_divider': 7}. Best is trial 21 with value: 0.5130344367738303.
[I 2025-03-28 03:24:11,448] Trial 87 finished with value: 0.4839913840101179 and parameters: {'left_stride': 32, 'right_stride': 64, 'attention_pooling_operation': 'max', 'embedding_pooling_operation': 'max', 'threshold': 0.8954320153511811, 'batch_size': 32, 'attention_heads': 6, 'hidden_dimension': 253, 'number_of_hidden_layers': 1, 'dropout_rate': 0.47657951103153146, 'global_pooling': 'mean', 'learning_rate': 0.00045763224125813535, 'weight_decay': 0.0007805441840120373, 'beta_0': 0.8626305134771369, 'beta_1': 0.9954278345495214, 'epsilon': 6.022820783792867e-06, 'balanced_loss': False, 'epochs': 166, 'early_stopping_patience': 15, 'plateau_patience': 18, 'plateau_divider': 8}. Best is trial 21 with value: 0.5130344367738303.
[I 2025-03-28 03:43:26,540] Trial 88 finished with value: 0.33600864848450385 and parameters: {'left_stride': 32, 'right_stride': 64, 'attention_pooling_operation': 'min', 'embedding_pooling_operation': 'max', 'threshold': 0.8938284623288689, 'batch_size': 32, 'attention_heads': 6, 'hidden_dimension': 255, 'number_of_hidden_layers': 4, 'dropout_rate': 0.4960078515912393, 'global_pooling': 'mean', 'learning_rate': 0.00044725402992761574, 'weight_decay': 0.0009992136642009081, 'beta_0': 0.850187211764388, 'beta_1': 0.9959036701651639, 'epsilon': 6.5660991449459045e-06, 'balanced_loss': False, 'epochs': 171, 'early_stopping_patience': 15, 'plateau_patience': 18, 'plateau_divider': 8}. Best is trial 21 with value: 0.5130344367738303.
[I 2025-03-28 03:53:08,410] Trial 89 finished with value: 0.41099174525661436 and parameters: {'left_stride': 32, 'right_stride': 64, 'attention_pooling_operation': 'max', 'embedding_pooling_operation': 'max', 'threshold': 0.8990257736985603, 'batch_size': 36, 'attention_heads': 4, 'hidden_dimension': 247, 'number_of_hidden_layers': 0, 'dropout_rate': 0.4771972024199609, 'global_pooling': 'mean', 'learning_rate': 0.00033196554022863037, 'weight_decay': 0.0007783834790200545, 'beta_0': 0.8632624513310563, 'beta_1': 0.9952514351766165, 'epsilon': 5.2546030486905865e-06, 'balanced_loss': False, 'epochs': 175, 'early_stopping_patience': 14, 'plateau_patience': 19, 'plateau_divider': 8}. Best is trial 21 with value: 0.5130344367738303.
[I 2025-03-28 04:04:21,749] Trial 90 finished with value: 0.4248847484069132 and parameters: {'left_stride': 32, 'right_stride': 64, 'attention_pooling_operation': 'max', 'embedding_pooling_operation': 'mean', 'threshold': 0.917642244317267, 'batch_size': 34, 'attention_heads': 5, 'hidden_dimension': 239, 'number_of_hidden_layers': 2, 'dropout_rate': 0.4908882701831348, 'global_pooling': 'max', 'learning_rate': 0.0005589666374431472, 'weight_decay': 0.0006761133127873997, 'beta_0': 0.8691359402723283, 'beta_1': 0.9965338299319269, 'epsilon': 1.0222205851665508e-05, 'balanced_loss': False, 'epochs': 183, 'early_stopping_patience': 10, 'plateau_patience': 18, 'plateau_divider': 8}. Best is trial 21 with value: 0.5130344367738303.
[I 2025-03-28 04:15:43,399] Trial 91 finished with value: 0.4932458618476745 and parameters: {'left_stride': 32, 'right_stride': 64, 'attention_pooling_operation': 'max', 'embedding_pooling_operation': 'max', 'threshold': 0.9097431291468192, 'batch_size': 38, 'attention_heads': 6, 'hidden_dimension': 256, 'number_of_hidden_layers': 1, 'dropout_rate': 0.5114162015108868, 'global_pooling': 'mean', 'learning_rate': 0.0006953073742730943, 'weight_decay': 0.00048521346935449333, 'beta_0': 0.8610395431805266, 'beta_1': 0.9940690785934456, 'epsilon': 2.474457454632952e-05, 'balanced_loss': False, 'epochs': 165, 'early_stopping_patience': 16, 'plateau_patience': 17, 'plateau_divider': 7}. Best is trial 21 with value: 0.5130344367738303.
[I 2025-03-28 04:27:39,945] Trial 92 finished with value: 0.4844999586828964 and parameters: {'left_stride': 32, 'right_stride': 64, 'attention_pooling_operation': 'max', 'embedding_pooling_operation': 'max', 'threshold': 0.9087506571727245, 'batch_size': 39, 'attention_heads': 6, 'hidden_dimension': 251, 'number_of_hidden_layers': 1, 'dropout_rate': 0.5162435799692648, 'global_pooling': 'mean', 'learning_rate': 0.0007111337899568011, 'weight_decay': 0.0007654586548230511, 'beta_0': 0.8655669318989969, 'beta_1': 0.9972089386404053, 'epsilon': 3.751111910405954e-05, 'balanced_loss': False, 'epochs': 166, 'early_stopping_patience': 15, 'plateau_patience': 19, 'plateau_divider': 7}. Best is trial 21 with value: 0.5130344367738303.
[I 2025-03-28 04:38:42,146] Trial 93 finished with value: 0.4674481930375886 and parameters: {'left_stride': 32, 'right_stride': 64, 'attention_pooling_operation': 'max', 'embedding_pooling_operation': 'max', 'threshold': 0.9085222371477568, 'batch_size': 39, 'attention_heads': 5, 'hidden_dimension': 246, 'number_of_hidden_layers': 1, 'dropout_rate': 0.5150183942569528, 'global_pooling': 'mean', 'learning_rate': 0.000827383092617192, 'weight_decay': 0.0007955345810247721, 'beta_0': 0.8603306675970016, 'beta_1': 0.9971036291113634, 'epsilon': 3.006001257254675e-05, 'balanced_loss': False, 'epochs': 168, 'early_stopping_patience': 18, 'plateau_patience': 19, 'plateau_divider': 7}. Best is trial 21 with value: 0.5130344367738303.
[I 2025-03-28 04:49:38,784] Trial 94 finished with value: 0.4726567986940616 and parameters: {'left_stride': 32, 'right_stride': 64, 'attention_pooling_operation': 'max', 'embedding_pooling_operation': 'max', 'threshold': 0.9219652033214312, 'batch_size': 41, 'attention_heads': 6, 'hidden_dimension': 250, 'number_of_hidden_layers': 1, 'dropout_rate': 0.5098354430250871, 'global_pooling': 'mean', 'learning_rate': 0.0004902594159096115, 'weight_decay': 0.0005928336556463154, 'beta_0': 0.8661179957032002, 'beta_1': 0.9983175972253411, 'epsilon': 2.3969678266089063e-05, 'balanced_loss': False, 'epochs': 188, 'early_stopping_patience': 11, 'plateau_patience': 18, 'plateau_divider': 3}. Best is trial 21 with value: 0.5130344367738303.
[I 2025-03-28 05:00:37,809] Trial 95 finished with value: 0.5062902466326374 and parameters: {'left_stride': 32, 'right_stride': 64, 'attention_pooling_operation': 'max', 'embedding_pooling_operation': 'max', 'threshold': 0.9083795066411443, 'batch_size': 34, 'attention_heads': 6, 'hidden_dimension': 243, 'number_of_hidden_layers': 1, 'dropout_rate': 0.49871022096746437, 'global_pooling': 'mean', 'learning_rate': 0.0006958910286514727, 'weight_decay': 0.00047810023826822597, 'beta_0': 0.8622976062132769, 'beta_1': 0.9988882601137904, 'epsilon': 6.0657410522333235e-05, 'balanced_loss': False, 'epochs': 165, 'early_stopping_patience': 13, 'plateau_patience': 19, 'plateau_divider': 7}. Best is trial 21 with value: 0.5130344367738303.
[I 2025-03-28 05:11:16,383] Trial 96 finished with value: 0.4770023104925182 and parameters: {'left_stride': 32, 'right_stride': 64, 'attention_pooling_operation': 'mean', 'embedding_pooling_operation': 'max', 'threshold': 0.907497993059434, 'batch_size': 35, 'attention_heads': 4, 'hidden_dimension': 229, 'number_of_hidden_layers': 1, 'dropout_rate': 0.5239344310462372, 'global_pooling': 'mean', 'learning_rate': 0.0006678013859855444, 'weight_decay': 0.00048117394753151863, 'beta_0': 0.8558776330833794, 'beta_1': 0.9988439421972864, 'epsilon': 7.582331502444674e-05, 'balanced_loss': False, 'epochs': 172, 'early_stopping_patience': 12, 'plateau_patience': 19, 'plateau_divider': 7}. Best is trial 21 with value: 0.5130344367738303.
[I 2025-03-28 05:24:06,771] Trial 97 finished with value: 0.45645581628182064 and parameters: {'left_stride': 32, 'right_stride': 128, 'attention_pooling_operation': 'max', 'embedding_pooling_operation': 'max', 'threshold': 0.9022922271947511, 'batch_size': 50, 'attention_heads': 7, 'hidden_dimension': 239, 'number_of_hidden_layers': 1, 'dropout_rate': 0.49913443475602914, 'global_pooling': 'mean', 'learning_rate': 0.0001977018749607876, 'weight_decay': 0.00031534525984826115, 'beta_0': 0.873122069532359, 'beta_1': 0.9974116148074789, 'epsilon': 5.603590034875732e-05, 'balanced_loss': False, 'epochs': 156, 'early_stopping_patience': 18, 'plateau_patience': 10, 'plateau_divider': 7}. Best is trial 21 with value: 0.5130344367738303.
[I 2025-03-28 05:34:15,316] Trial 98 finished with value: 0.4564724060314001 and parameters: {'left_stride': 32, 'right_stride': 32, 'attention_pooling_operation': 'max', 'embedding_pooling_operation': 'max', 'threshold': 0.9418903067886846, 'batch_size': 39, 'attention_heads': 5, 'hidden_dimension': 243, 'number_of_hidden_layers': 1, 'dropout_rate': 0.49020818234904984, 'global_pooling': 'mean', 'learning_rate': 0.000819570356416528, 'weight_decay': 0.0006437654306363925, 'beta_0': 0.8651630413982485, 'beta_1': 0.9984623895420178, 'epsilon': 5.073267774678669e-05, 'balanced_loss': False, 'epochs': 163, 'early_stopping_patience': 17, 'plateau_patience': 16, 'plateau_divider': 6}. Best is trial 21 with value: 0.5130344367738303.
[I 2025-03-28 05:45:03,914] Trial 99 finished with value: 0.4834769163292272 and parameters: {'left_stride': 32, 'right_stride': 64, 'attention_pooling_operation': 'max', 'embedding_pooling_operation': 'max', 'threshold': 0.9116300216454104, 'batch_size': 43, 'attention_heads': 6, 'hidden_dimension': 238, 'number_of_hidden_layers': 1, 'dropout_rate': 0.5094894237234249, 'global_pooling': 'mean', 'learning_rate': 0.000701949057237769, 'weight_decay': 0.0005210365389426547, 'beta_0': 0.8684943185631224, 'beta_1': 0.9978835469722237, 'epsilon': 4.3160077153917776e-05, 'balanced_loss': False, 'epochs': 176, 'early_stopping_patience': 13, 'plateau_patience': 18, 'plateau_divider': 7}. Best is trial 21 with value: 0.5130344367738303.
[I 2025-03-28 05:57:40,969] Trial 100 finished with value: 0.35112311376531374 and parameters: {'left_stride': 32, 'right_stride': 64, 'attention_pooling_operation': 'max', 'embedding_pooling_operation': 'mean', 'threshold': 0.8617406055899597, 'batch_size': 52, 'attention_heads': 6, 'hidden_dimension': 256, 'number_of_hidden_layers': 1, 'dropout_rate': 0.48605872890220786, 'global_pooling': 'sum', 'learning_rate': 0.0003713249071196139, 'weight_decay': 0.0002874552295294098, 'beta_0': 0.8514556346607677, 'beta_1': 0.9968791566558542, 'epsilon': 2.1298273435393846e-05, 'balanced_loss': False, 'epochs': 189, 'early_stopping_patience': 16, 'plateau_patience': 19, 'plateau_divider': 3}. Best is trial 21 with value: 0.5130344367738303.
[I 2025-03-28 06:09:10,141] Trial 101 finished with value: 0.4792478337723005 and parameters: {'left_stride': 32, 'right_stride': 64, 'attention_pooling_operation': 'max', 'embedding_pooling_operation': 'max', 'threshold': 0.8975348643991429, 'batch_size': 34, 'attention_heads': 6, 'hidden_dimension': 251, 'number_of_hidden_layers': 1, 'dropout_rate': 0.4811992919946363, 'global_pooling': 'mean', 'learning_rate': 0.0004575414758352012, 'weight_decay': 0.0007633178101954518, 'beta_0': 0.8622914544346036, 'beta_1': 0.9962918641900508, 'epsilon': 6.227484701816955e-05, 'balanced_loss': False, 'epochs': 166, 'early_stopping_patience': 15, 'plateau_patience': 18, 'plateau_divider': 8}. Best is trial 21 with value: 0.5130344367738303.
[I 2025-03-28 06:19:28,582] Trial 102 finished with value: 0.45165524058652573 and parameters: {'left_stride': 32, 'right_stride': 64, 'attention_pooling_operation': 'max', 'embedding_pooling_operation': 'max', 'threshold': 0.9289509774242579, 'batch_size': 37, 'attention_heads': 5, 'hidden_dimension': 246, 'number_of_hidden_layers': 1, 'dropout_rate': 0.4449303413438622, 'global_pooling': 'mean', 'learning_rate': 0.0005445612685630751, 'weight_decay': 0.0008693325398407245, 'beta_0': 0.8595459700360816, 'beta_1': 0.9952983120759213, 'epsilon': 1.332581756547864e-05, 'balanced_loss': False, 'epochs': 181, 'early_stopping_patience': 15, 'plateau_patience': 17, 'plateau_divider': 7}. Best is trial 21 with value: 0.5130344367738303.
[I 2025-03-28 06:31:58,990] Trial 103 finished with value: 0.48943807747782037 and parameters: {'left_stride': 32, 'right_stride': 64, 'attention_pooling_operation': 'max', 'embedding_pooling_operation': 'max', 'threshold': 0.8909459827753621, 'batch_size': 33, 'attention_heads': 7, 'hidden_dimension': 231, 'number_of_hidden_layers': 1, 'dropout_rate': 0.5017960935515591, 'global_pooling': 'mean', 'learning_rate': 0.0004190069896697705, 'weight_decay': 0.000981210965534245, 'beta_0': 0.8639169284031706, 'beta_1': 0.9871458013434881, 'epsilon': 9.680698598528401e-05, 'balanced_loss': False, 'epochs': 160, 'early_stopping_patience': 16, 'plateau_patience': 18, 'plateau_divider': 7}. Best is trial 21 with value: 0.5130344367738303.
[I 2025-03-28 06:43:17,872] Trial 104 finished with value: 0.44375176575029973 and parameters: {'left_stride': 128, 'right_stride': 64, 'attention_pooling_operation': 'max', 'embedding_pooling_operation': 'max', 'threshold': 0.891817563520699, 'batch_size': 45, 'attention_heads': 7, 'hidden_dimension': 231, 'number_of_hidden_layers': 1, 'dropout_rate': 0.5013427544646304, 'global_pooling': 'mean', 'learning_rate': 0.0012848831465628377, 'weight_decay': 0.0009951253173808433, 'beta_0': 0.8647566460639017, 'beta_1': 0.9870063858886434, 'epsilon': 9.343608034258414e-05, 'balanced_loss': False, 'epochs': 152, 'early_stopping_patience': 12, 'plateau_patience': 19, 'plateau_divider': 7}. Best is trial 21 with value: 0.5130344367738303.
[I 2025-03-28 06:55:21,742] Trial 105 finished with value: 0.45088657635274565 and parameters: {'left_stride': 32, 'right_stride': 256, 'attention_pooling_operation': 'max', 'embedding_pooling_operation': 'max', 'threshold': 0.8900921473743163, 'batch_size': 42, 'attention_heads': 7, 'hidden_dimension': 224, 'number_of_hidden_layers': 1, 'dropout_rate': 0.5197399599123459, 'global_pooling': 'mean', 'learning_rate': 0.00022456405239485065, 'weight_decay': 0.0006400902096132884, 'beta_0': 0.8479705176651674, 'beta_1': 0.9881046329969263, 'epsilon': 7.112176772326449e-05, 'balanced_loss': False, 'epochs': 158, 'early_stopping_patience': 16, 'plateau_patience': 16, 'plateau_divider': 7}. Best is trial 21 with value: 0.5130344367738303.
[I 2025-03-28 07:06:02,976] Trial 106 finished with value: 0.37511781948246553 and parameters: {'left_stride': 256, 'right_stride': 64, 'attention_pooling_operation': 'min', 'embedding_pooling_operation': 'max', 'threshold': 0.916008348301146, 'batch_size': 49, 'attention_heads': 7, 'hidden_dimension': 210, 'number_of_hidden_layers': 1, 'dropout_rate': 0.5134721396546937, 'global_pooling': 'mean', 'learning_rate': 0.0003117769622458315, 'weight_decay': 0.0005016438680113895, 'beta_0': 0.8699045804721477, 'beta_1': 0.9874679942118006, 'epsilon': 3.1110398044151085e-05, 'balanced_loss': False, 'epochs': 173, 'early_stopping_patience': 17, 'plateau_patience': 17, 'plateau_divider': 7}. Best is trial 21 with value: 0.5130344367738303.
[I 2025-03-28 07:16:34,770] Trial 107 finished with value: 0.03234163850105879 and parameters: {'left_stride': 32, 'right_stride': 64, 'attention_pooling_operation': 'max', 'embedding_pooling_operation': 'max', 'threshold': 0.8686724686400422, 'batch_size': 37, 'attention_heads': 6, 'hidden_dimension': 179, 'number_of_hidden_layers': 1, 'dropout_rate': 0.5279040772400305, 'global_pooling': 'mean', 'learning_rate': 0.05085444079005819, 'weight_decay': 0.0006887895152594363, 'beta_0': 0.856331528947554, 'beta_1': 0.9981701968681606, 'epsilon': 3.814612675693399e-05, 'balanced_loss': False, 'epochs': 122, 'early_stopping_patience': 19, 'plateau_patience': 19, 'plateau_divider': 6}. Best is trial 21 with value: 0.5130344367738303.
[I 2025-03-28 07:30:57,968] Trial 108 finished with value: 0.46129874124526404 and parameters: {'left_stride': 32, 'right_stride': 64, 'attention_pooling_operation': 'max', 'embedding_pooling_operation': 'max', 'threshold': 0.8997254749537831, 'batch_size': 34, 'attention_heads': 14, 'hidden_dimension': 237, 'number_of_hidden_layers': 1, 'dropout_rate': 0.46740940640283357, 'global_pooling': 'mean', 'learning_rate': 0.0007244239744820148, 'weight_decay': 0.0003399636044522546, 'beta_0': 0.839515668018667, 'beta_1': 0.9889641398328077, 'epsilon': 2.1237406658369125e-05, 'balanced_loss': False, 'epochs': 116, 'early_stopping_patience': 16, 'plateau_patience': 20, 'plateau_divider': 7}. Best is trial 21 with value: 0.5130344367738303.
[I 2025-03-28 07:42:40,187] Trial 109 finished with value: 0.4618991488768493 and parameters: {'left_stride': 32, 'right_stride': 64, 'attention_pooling_operation': 'max', 'embedding_pooling_operation': 'max', 'threshold': 0.9086931017957061, 'batch_size': 40, 'attention_heads': 7, 'hidden_dimension': 244, 'number_of_hidden_layers': 1, 'dropout_rate': 0.5070659203638224, 'global_pooling': 'mean', 'learning_rate': 0.00040171252015225236, 'weight_decay': 0.0006006979040552922, 'beta_0': 0.8672638195226935, 'beta_1': 0.9972826850483995, 'epsilon': 4.5386891993650135e-05, 'balanced_loss': False, 'epochs': 144, 'early_stopping_patience': 14, 'plateau_patience': 18, 'plateau_divider': 7}. Best is trial 21 with value: 0.5130344367738303.
[I 2025-03-28 08:00:44,571] Trial 110 finished with value: 0.45589209889585175 and parameters: {'left_stride': 32, 'right_stride': 64, 'attention_pooling_operation': 'max', 'embedding_pooling_operation': 'max', 'threshold': 0.8736936117641645, 'batch_size': 57, 'attention_heads': 13, 'hidden_dimension': 227, 'number_of_hidden_layers': 1, 'dropout_rate': 0.4879984259248692, 'global_pooling': 'max', 'learning_rate': 0.00015624285990380987, 'weight_decay': 0.0004393726900918223, 'beta_0': 0.8837811659148401, 'beta_1': 0.9977489095582924, 'epsilon': 7.480315001797688e-05, 'balanced_loss': False, 'epochs': 158, 'early_stopping_patience': 17, 'plateau_patience': 17, 'plateau_divider': 6}. Best is trial 21 with value: 0.5130344367738303.
[I 2025-03-28 08:12:29,894] Trial 111 finished with value: 0.4983671156343451 and parameters: {'left_stride': 32, 'right_stride': 64, 'attention_pooling_operation': 'max', 'embedding_pooling_operation': 'max', 'threshold': 0.8955610271840327, 'batch_size': 32, 'attention_heads': 6, 'hidden_dimension': 251, 'number_of_hidden_layers': 1, 'dropout_rate': 0.4957392912075289, 'global_pooling': 'mean', 'learning_rate': 0.0005322761222019268, 'weight_decay': 0.000822542586894957, 'beta_0': 0.8617990789735787, 'beta_1': 0.9987251664661785, 'epsilon': 9.855189997021669e-05, 'balanced_loss': False, 'epochs': 166, 'early_stopping_patience': 16, 'plateau_patience': 18, 'plateau_divider': 8}. Best is trial 21 with value: 0.5130344367738303.
[I 2025-03-28 08:23:34,945] Trial 112 finished with value: 0.46698679152661454 and parameters: {'left_stride': 32, 'right_stride': 64, 'attention_pooling_operation': 'max', 'embedding_pooling_operation': 'max', 'threshold': 0.9030563274539805, 'batch_size': 36, 'attention_heads': 5, 'hidden_dimension': 249, 'number_of_hidden_layers': 1, 'dropout_rate': 0.5402881751122057, 'global_pooling': 'mean', 'learning_rate': 0.0006140298032476542, 'weight_decay': 0.0008487514056830102, 'beta_0': 0.860758934565306, 'beta_1': 0.9986891412251999, 'epsilon': 8.86817838204037e-05, 'balanced_loss': False, 'epochs': 169, 'early_stopping_patience': 16, 'plateau_patience': 18, 'plateau_divider': 8}. Best is trial 21 with value: 0.5130344367738303.
[I 2025-03-28 08:34:25,418] Trial 113 finished with value: 0.49624010027206905 and parameters: {'left_stride': 32, 'right_stride': 64, 'attention_pooling_operation': 'max', 'embedding_pooling_operation': 'max', 'threshold': 0.888289019732648, 'batch_size': 32, 'attention_heads': 6, 'hidden_dimension': 164, 'number_of_hidden_layers': 1, 'dropout_rate': 0.4958011207270392, 'global_pooling': 'mean', 'learning_rate': 0.0009096550978119579, 'weight_decay': 0.0007223106818563559, 'beta_0': 0.8640119124558939, 'beta_1': 0.9989623053491047, 'epsilon': 8.238678798676859e-06, 'balanced_loss': False, 'epochs': 162, 'early_stopping_patience': 17, 'plateau_patience': 18, 'plateau_divider': 8}. Best is trial 21 with value: 0.5130344367738303.
