[I 2025-03-05 05:04:43,704] Using an existing study with name 'Ohsumed-GATv2-google-bert-bert-base-uncased-Surrogate-No_Aggregation-No_Ablation-1.0-0.75' instead of creating a new one.
Token indices sequence length is longer than the specified maximum sequence length for this model (611 > 512). Running this sequence through the model will result in indexing errors
[I 2025-03-05 05:27:03,637] Trial 292 finished with value: 0.4940349360570868 and parameters: {'left_stride': 128, 'right_stride': 256, 'attention_pooling_operation': 'max', 'embedding_pooling_operation': 'min', 'threshold': 0.9643537242188436, 'batch_size': 53, 'attention_heads': 13, 'hidden_dimension': 132, 'number_of_hidden_layers': 1, 'dropout_rate': 0.5553879164127112, 'global_pooling': 'max', 'learning_rate': 0.00045395497416552365, 'weight_decay': 6.299312862329407e-05, 'beta_0': 0.8356983150226621, 'beta_1': 0.9936177041527205, 'epsilon': 2.3583665632623603e-07, 'balanced_loss': True, 'epochs': 118, 'early_stopping_patience': 20, 'plateau_patience': 22, 'plateau_divider': 2}. Best is trial 214 with value: 0.5493008496774074.
The selected strides are greater or equal to the total chunk size.
[I 2025-03-05 05:27:05,528] Trial 293 finished with value: -1.0 and parameters: {'left_stride': 256, 'right_stride': 256, 'attention_pooling_operation': 'max', 'embedding_pooling_operation': 'min', 'threshold': 0.9762127570801817, 'batch_size': 55, 'attention_heads': 15, 'hidden_dimension': 140, 'number_of_hidden_layers': 1, 'dropout_rate': 0.5950679459209464, 'global_pooling': 'max', 'learning_rate': 0.00048787765235211076, 'weight_decay': 5.433316041065397e-05, 'beta_0': 0.8555994305903343, 'beta_1': 0.9922398789372365, 'epsilon': 1.9580941741974978e-07, 'balanced_loss': True, 'epochs': 115, 'early_stopping_patience': 17, 'plateau_patience': 23, 'plateau_divider': 2}. Best is trial 214 with value: 0.5493008496774074.
[I 2025-03-05 06:01:03,037] Trial 294 finished with value: 0.28148856888207935 and parameters: {'left_stride': 128, 'right_stride': 256, 'attention_pooling_operation': 'max', 'embedding_pooling_operation': 'min', 'threshold': 0.9706474670184673, 'batch_size': 49, 'attention_heads': 13, 'hidden_dimension': 117, 'number_of_hidden_layers': 4, 'dropout_rate': 0.5493419556144763, 'global_pooling': 'max', 'learning_rate': 0.0008997030869786621, 'weight_decay': 4.0851878368686114e-05, 'beta_0': 0.8488169736306647, 'beta_1': 0.9910475029215033, 'epsilon': 2.795169844051263e-07, 'balanced_loss': True, 'epochs': 104, 'early_stopping_patience': 18, 'plateau_patience': 23, 'plateau_divider': 2}. Best is trial 214 with value: 0.5493008496774074.
[I 2025-03-05 06:22:38,650] Trial 295 finished with value: 0.4873399770364913 and parameters: {'left_stride': 128, 'right_stride': 0, 'attention_pooling_operation': 'max', 'embedding_pooling_operation': 'min', 'threshold': 0.9813831280885619, 'batch_size': 58, 'attention_heads': 12, 'hidden_dimension': 164, 'number_of_hidden_layers': 1, 'dropout_rate': 0.5828958048219197, 'global_pooling': 'max', 'learning_rate': 0.0004107112418513581, 'weight_decay': 3.0429738846545556e-05, 'beta_0': 0.851928983804894, 'beta_1': 0.9915429385391783, 'epsilon': 1.3292404935153803e-06, 'balanced_loss': True, 'epochs': 96, 'early_stopping_patience': 19, 'plateau_patience': 24, 'plateau_divider': 2}. Best is trial 214 with value: 0.5493008496774074.
[I 2025-03-05 06:39:40,925] Trial 296 finished with value: 0.029222798251693657 and parameters: {'left_stride': 128, 'right_stride': 256, 'attention_pooling_operation': 'max', 'embedding_pooling_operation': 'min', 'threshold': 0.9735790223408902, 'batch_size': 55, 'attention_heads': 13, 'hidden_dimension': 124, 'number_of_hidden_layers': 1, 'dropout_rate': 0.528993234372063, 'global_pooling': 'max', 'learning_rate': 0.04111834324236489, 'weight_decay': 7.237713518711618e-05, 'beta_0': 0.8464264566885429, 'beta_1': 0.992500295308422, 'epsilon': 7.315903610684538e-07, 'balanced_loss': True, 'epochs': 122, 'early_stopping_patience': 18, 'plateau_patience': 23, 'plateau_divider': 2}. Best is trial 214 with value: 0.5493008496774074.
CUDA out of memory. Tried to allocate 242.00 MiB. GPU 0 has a total capacity of 44.56 GiB of which 86.69 MiB is free. Including non-PyTorch memory, this process has 44.47 GiB memory in use. Of the allocated memory 42.50 GiB is allocated by PyTorch, and 841.28 MiB is reserved by PyTorch but unallocated. If reserved but unallocated memory is large try setting PYTORCH_CUDA_ALLOC_CONF=expandable_segments:True to avoid fragmentation.  See documentation for Memory Management  (https://pytorch.org/docs/stable/notes/cuda.html#environment-variables)
[I 2025-03-05 06:48:07,224] Trial 297 finished with value: -1.0 and parameters: {'left_stride': 128, 'right_stride': 256, 'attention_pooling_operation': 'max', 'embedding_pooling_operation': 'min', 'threshold': 0.8470709509508436, 'batch_size': 74, 'attention_heads': 13, 'hidden_dimension': 145, 'number_of_hidden_layers': 1, 'dropout_rate': 0.5656257816159128, 'global_pooling': 'max', 'learning_rate': 0.00026903348936902806, 'weight_decay': 2.040369042469884e-05, 'beta_0': 0.8505839569167473, 'beta_1': 0.9929491243569318, 'epsilon': 9.253939256078482e-07, 'balanced_loss': True, 'epochs': 101, 'early_stopping_patience': 19, 'plateau_patience': 22, 'plateau_divider': 2}. Best is trial 214 with value: 0.5493008496774074.
CUDA out of memory. Tried to allocate 1.90 GiB. GPU 0 has a total capacity of 44.56 GiB of which 1.67 GiB is free. Including non-PyTorch memory, this process has 42.89 GiB memory in use. Of the allocated memory 39.65 GiB is allocated by PyTorch, and 2.09 GiB is reserved by PyTorch but unallocated. If reserved but unallocated memory is large try setting PYTORCH_CUDA_ALLOC_CONF=expandable_segments:True to avoid fragmentation.  See documentation for Memory Management  (https://pytorch.org/docs/stable/notes/cuda.html#environment-variables)
[I 2025-03-05 07:00:52,322] Trial 298 finished with value: -1.0 and parameters: {'left_stride': 128, 'right_stride': 256, 'attention_pooling_operation': 'max', 'embedding_pooling_operation': 'min', 'threshold': 0.959374550884483, 'batch_size': 51, 'attention_heads': 14, 'hidden_dimension': 175, 'number_of_hidden_layers': 1, 'dropout_rate': 0.5364315690196713, 'global_pooling': 'max', 'learning_rate': 0.0005793654493739569, 'weight_decay': 5.028586710556397e-05, 'beta_0': 0.8481725964822774, 'beta_1': 0.9933486860296292, 'epsilon': 1.1355993459029302e-06, 'balanced_loss': True, 'epochs': 118, 'early_stopping_patience': 20, 'plateau_patience': 25, 'plateau_divider': 2}. Best is trial 214 with value: 0.5493008496774074.
[I 2025-03-05 07:22:21,995] Trial 299 finished with value: 0.5188736608095956 and parameters: {'left_stride': 128, 'right_stride': 256, 'attention_pooling_operation': 'max', 'embedding_pooling_operation': 'min', 'threshold': 0.966195726239225, 'batch_size': 46, 'attention_heads': 14, 'hidden_dimension': 136, 'number_of_hidden_layers': 1, 'dropout_rate': 0.5447801628477978, 'global_pooling': 'max', 'learning_rate': 0.0007238808104613742, 'weight_decay': 9.77063958433665e-05, 'beta_0': 0.8419763935952943, 'beta_1': 0.9946081885388296, 'epsilon': 5.790481499893699e-07, 'balanced_loss': True, 'epochs': 108, 'early_stopping_patience': 19, 'plateau_patience': 24, 'plateau_divider': 2}. Best is trial 214 with value: 0.5493008496774074.
CUDA out of memory. Tried to allocate 2.03 GiB. GPU 0 has a total capacity of 44.56 GiB of which 1.33 GiB is free. Including non-PyTorch memory, this process has 43.22 GiB memory in use. Of the allocated memory 41.48 GiB is allocated by PyTorch, and 603.79 MiB is reserved by PyTorch but unallocated. If reserved but unallocated memory is large try setting PYTORCH_CUDA_ALLOC_CONF=expandable_segments:True to avoid fragmentation.  See documentation for Memory Management  (https://pytorch.org/docs/stable/notes/cuda.html#environment-variables)
[I 2025-03-05 07:35:12,383] Trial 300 finished with value: -1.0 and parameters: {'left_stride': 128, 'right_stride': 256, 'attention_pooling_operation': 'max', 'embedding_pooling_operation': 'min', 'threshold': 0.9518977454632976, 'batch_size': 64, 'attention_heads': 15, 'hidden_dimension': 131, 'number_of_hidden_layers': 1, 'dropout_rate': 0.5570978357167113, 'global_pooling': 'max', 'learning_rate': 0.000352075013154087, 'weight_decay': 3.4106789236008126e-05, 'beta_0': 0.8455834812740897, 'beta_1': 0.9939038376315734, 'epsilon': 3.2164689769031723e-07, 'balanced_loss': True, 'epochs': 113, 'early_stopping_patience': 19, 'plateau_patience': 23, 'plateau_divider': 2}. Best is trial 214 with value: 0.5493008496774074.
[I 2025-03-05 07:55:06,811] Trial 301 finished with value: 0.5145062067483209 and parameters: {'left_stride': 64, 'right_stride': 64, 'attention_pooling_operation': 'max', 'embedding_pooling_operation': 'min', 'threshold': 0.9856204583156493, 'batch_size': 57, 'attention_heads': 14, 'hidden_dimension': 169, 'number_of_hidden_layers': 1, 'dropout_rate': 0.5196913677708935, 'global_pooling': 'max', 'learning_rate': 0.0004860459208828726, 'weight_decay': 5.940131964149824e-05, 'beta_0': 0.853745613487836, 'beta_1': 0.9919023738534323, 'epsilon': 7.820797864489e-07, 'balanced_loss': True, 'epochs': 98, 'early_stopping_patience': 20, 'plateau_patience': 24, 'plateau_divider': 2}. Best is trial 214 with value: 0.5493008496774074.
[I 2025-03-05 08:16:18,955] Trial 302 finished with value: 0.5055380350271369 and parameters: {'left_stride': 128, 'right_stride': 256, 'attention_pooling_operation': 'max', 'embedding_pooling_operation': 'max', 'threshold': 0.9777696444319979, 'batch_size': 53, 'attention_heads': 13, 'hidden_dimension': 185, 'number_of_hidden_layers': 1, 'dropout_rate': 0.5408457335700323, 'global_pooling': 'max', 'learning_rate': 0.0004295961143613751, 'weight_decay': 2.784925793110817e-05, 'beta_0': 0.8439132261697259, 'beta_1': 0.9924589578762968, 'epsilon': 3.8329910998610887e-07, 'balanced_loss': True, 'epochs': 123, 'early_stopping_patience': 18, 'plateau_patience': 23, 'plateau_divider': 2}. Best is trial 214 with value: 0.5493008496774074.
CUDA out of memory. Tried to allocate 2.08 GiB. GPU 0 has a total capacity of 44.56 GiB of which 1.58 GiB is free. Including non-PyTorch memory, this process has 42.97 GiB memory in use. Of the allocated memory 39.78 GiB is allocated by PyTorch, and 2.03 GiB is reserved by PyTorch but unallocated. If reserved but unallocated memory is large try setting PYTORCH_CUDA_ALLOC_CONF=expandable_segments:True to avoid fragmentation.  See documentation for Memory Management  (https://pytorch.org/docs/stable/notes/cuda.html#environment-variables)
[I 2025-03-05 08:33:15,296] Trial 303 finished with value: -1.0 and parameters: {'left_stride': 128, 'right_stride': 32, 'attention_pooling_operation': 'max', 'embedding_pooling_operation': 'min', 'threshold': 0.9623078148834872, 'batch_size': 60, 'attention_heads': 13, 'hidden_dimension': 150, 'number_of_hidden_layers': 1, 'dropout_rate': 0.5516707178895225, 'global_pooling': 'max', 'learning_rate': 0.0002691953947515862, 'weight_decay': 4.079642973572802e-05, 'beta_0': 0.8403026230138966, 'beta_1': 0.9952842069096802, 'epsilon': 4.806321965015319e-07, 'balanced_loss': True, 'epochs': 105, 'early_stopping_patience': 21, 'plateau_patience': 25, 'plateau_divider': 3}. Best is trial 214 with value: 0.5493008496774074.
[I 2025-03-05 08:54:15,781] Trial 304 finished with value: 0.48749734748067847 and parameters: {'left_stride': 128, 'right_stride': 256, 'attention_pooling_operation': 'max', 'embedding_pooling_operation': 'min', 'threshold': 0.9708580127101836, 'batch_size': 48, 'attention_heads': 14, 'hidden_dimension': 143, 'number_of_hidden_layers': 1, 'dropout_rate': 0.5606627674049061, 'global_pooling': 'max', 'learning_rate': 0.0011151265349506547, 'weight_decay': 5.1395900123614525e-05, 'beta_0': 0.8471559273083626, 'beta_1': 0.9905477051079208, 'epsilon': 1.6344620988553247e-06, 'balanced_loss': True, 'epochs': 110, 'early_stopping_patience': 19, 'plateau_patience': 24, 'plateau_divider': 2}. Best is trial 214 with value: 0.5493008496774074.
[I 2025-03-05 09:18:37,674] Trial 305 finished with value: 0.5163721766555817 and parameters: {'left_stride': 128, 'right_stride': 256, 'attention_pooling_operation': 'mean', 'embedding_pooling_operation': 'min', 'threshold': 0.9669378991380823, 'batch_size': 55, 'attention_heads': 13, 'hidden_dimension': 127, 'number_of_hidden_layers': 1, 'dropout_rate': 0.5325088720137772, 'global_pooling': 'max', 'learning_rate': 0.0005589416873463329, 'weight_decay': 2.326115026118316e-05, 'beta_0': 0.8513862521037245, 'beta_1': 0.9928831883237019, 'epsilon': 2.5653571103012393e-07, 'balanced_loss': True, 'epochs': 132, 'early_stopping_patience': 18, 'plateau_patience': 23, 'plateau_divider': 2}. Best is trial 214 with value: 0.5493008496774074.
CUDA out of memory. Tried to allocate 3.73 GiB. GPU 0 has a total capacity of 44.56 GiB of which 1.69 GiB is free. Including non-PyTorch memory, this process has 42.86 GiB memory in use. Of the allocated memory 38.38 GiB is allocated by PyTorch, and 3.33 GiB is reserved by PyTorch but unallocated. If reserved but unallocated memory is large try setting PYTORCH_CUDA_ALLOC_CONF=expandable_segments:True to avoid fragmentation.  See documentation for Memory Management  (https://pytorch.org/docs/stable/notes/cuda.html#environment-variables)
[I 2025-03-05 09:31:30,142] Trial 306 finished with value: -1.0 and parameters: {'left_stride': 128, 'right_stride': 256, 'attention_pooling_operation': 'max', 'embedding_pooling_operation': 'min', 'threshold': 0.975074101096853, 'batch_size': 122, 'attention_heads': 15, 'hidden_dimension': 250, 'number_of_hidden_layers': 1, 'dropout_rate': 0.5450769141572526, 'global_pooling': 'max', 'learning_rate': 0.00021453065720217264, 'weight_decay': 8.221223855535881e-05, 'beta_0': 0.8377722865368464, 'beta_1': 0.9913273780975768, 'epsilon': 1.2170727301998982e-07, 'balanced_loss': True, 'epochs': 140, 'early_stopping_patience': 19, 'plateau_patience': 22, 'plateau_divider': 2}. Best is trial 214 with value: 0.5493008496774074.
CUDA out of memory. Tried to allocate 1.81 GiB. GPU 0 has a total capacity of 44.56 GiB of which 1.77 GiB is free. Including non-PyTorch memory, this process has 42.78 GiB memory in use. Of the allocated memory 40.08 GiB is allocated by PyTorch, and 1.55 GiB is reserved by PyTorch but unallocated. If reserved but unallocated memory is large try setting PYTORCH_CUDA_ALLOC_CONF=expandable_segments:True to avoid fragmentation.  See documentation for Memory Management  (https://pytorch.org/docs/stable/notes/cuda.html#environment-variables)
[I 2025-03-05 09:44:15,252] Trial 307 finished with value: -1.0 and parameters: {'left_stride': 128, 'right_stride': 0, 'attention_pooling_operation': 'max', 'embedding_pooling_operation': 'min', 'threshold': 0.955767890411622, 'batch_size': 50, 'attention_heads': 14, 'hidden_dimension': 139, 'number_of_hidden_layers': 1, 'dropout_rate': 0.572106432738275, 'global_pooling': 'max', 'learning_rate': 1.0993032231668202e-05, 'weight_decay': 6.56910852348649e-05, 'beta_0': 0.8585732546873982, 'beta_1': 0.9942170775832214, 'epsilon': 6.764552743944552e-07, 'balanced_loss': True, 'epochs': 116, 'early_stopping_patience': 20, 'plateau_patience': 24, 'plateau_divider': 2}. Best is trial 214 with value: 0.5493008496774074.
[I 2025-03-05 10:10:00,287] Trial 308 finished with value: 0.5091968210115823 and parameters: {'left_stride': 128, 'right_stride': 256, 'attention_pooling_operation': 'max', 'embedding_pooling_operation': 'min', 'threshold': 0.9711304552597457, 'batch_size': 42, 'attention_heads': 13, 'hidden_dimension': 161, 'number_of_hidden_layers': 1, 'dropout_rate': 0.5999729707047066, 'global_pooling': 'max', 'learning_rate': 0.00035922237665696356, 'weight_decay': 4.6324518597564407e-05, 'beta_0': 0.8486302521620056, 'beta_1': 0.9917962250073108, 'epsilon': 9.485278803727988e-07, 'balanced_loss': True, 'epochs': 121, 'early_stopping_patience': 19, 'plateau_patience': 24, 'plateau_divider': 2}. Best is trial 214 with value: 0.5493008496774074.
[I 2025-03-05 10:28:24,667] Trial 309 finished with value: 0.4998964395123804 and parameters: {'left_stride': 128, 'right_stride': 256, 'attention_pooling_operation': 'max', 'embedding_pooling_operation': 'min', 'threshold': 0.9817563488277014, 'batch_size': 53, 'attention_heads': 14, 'hidden_dimension': 134, 'number_of_hidden_layers': 1, 'dropout_rate': 0.5256848877710976, 'global_pooling': 'max', 'learning_rate': 0.0008353609357465767, 'weight_decay': 3.5866947536444426e-05, 'beta_0': 0.8457226215915525, 'beta_1': 0.9922934263002778, 'epsilon': 1.8305480415751517e-07, 'balanced_loss': True, 'epochs': 101, 'early_stopping_patience': 19, 'plateau_patience': 23, 'plateau_divider': 3}. Best is trial 214 with value: 0.5493008496774074.
CUDA out of memory. Tried to allocate 2.41 GiB. GPU 0 has a total capacity of 44.56 GiB of which 978.69 MiB is free. Including non-PyTorch memory, this process has 43.60 GiB memory in use. Of the allocated memory 42.15 GiB is allocated by PyTorch, and 299.70 MiB is reserved by PyTorch but unallocated. If reserved but unallocated memory is large try setting PYTORCH_CUDA_ALLOC_CONF=expandable_segments:True to avoid fragmentation.  See documentation for Memory Management  (https://pytorch.org/docs/stable/notes/cuda.html#environment-variables)
[I 2025-03-05 10:41:13,749] Trial 310 finished with value: -1.0 and parameters: {'left_stride': 128, 'right_stride': 256, 'attention_pooling_operation': 'max', 'embedding_pooling_operation': 'min', 'threshold': 0.96396973284583, 'batch_size': 94, 'attention_heads': 14, 'hidden_dimension': 154, 'number_of_hidden_layers': 1, 'dropout_rate': 0.5524711491880139, 'global_pooling': 'max', 'learning_rate': 0.0003202649650408326, 'weight_decay': 5.427552764245507e-05, 'beta_0': 0.8429385519861475, 'beta_1': 0.9936421510320371, 'epsilon': 3.434630769203648e-07, 'balanced_loss': True, 'epochs': 94, 'early_stopping_patience': 16, 'plateau_patience': 25, 'plateau_divider': 2}. Best is trial 214 with value: 0.5493008496774074.
[I 2025-03-05 11:01:57,194] Trial 311 finished with value: 0.5070050514454917 and parameters: {'left_stride': 128, 'right_stride': 256, 'attention_pooling_operation': 'max', 'embedding_pooling_operation': 'min', 'threshold': 0.9685644176921302, 'batch_size': 58, 'attention_heads': 13, 'hidden_dimension': 120, 'number_of_hidden_layers': 1, 'dropout_rate': 0.5784944279101323, 'global_pooling': 'max', 'learning_rate': 0.0006527511476720581, 'weight_decay': 4.232516660774543e-05, 'beta_0': 0.8493339602576132, 'beta_1': 0.9931865254080936, 'epsilon': 1.3111298228278794e-06, 'balanced_loss': True, 'epochs': 125, 'early_stopping_patience': 18, 'plateau_patience': 24, 'plateau_divider': 2}. Best is trial 214 with value: 0.5493008496774074.
[I 2025-03-05 11:20:05,762] Trial 312 finished with value: 0.35832805933596246 and parameters: {'left_stride': 128, 'right_stride': 256, 'attention_pooling_operation': 'max', 'embedding_pooling_operation': 'min', 'threshold': 0.9781597560645957, 'batch_size': 56, 'attention_heads': 14, 'hidden_dimension': 163, 'number_of_hidden_layers': 1, 'dropout_rate': 0.5399402707051854, 'global_pooling': 'sum', 'learning_rate': 0.0004744645750259041, 'weight_decay': 1.589841248158273e-05, 'beta_0': 0.8411789853797195, 'beta_1': 0.9926820583069411, 'epsilon': 5.642048935891222e-07, 'balanced_loss': True, 'epochs': 118, 'early_stopping_patience': 18, 'plateau_patience': 22, 'plateau_divider': 2}. Best is trial 214 with value: 0.5493008496774074.
[I 2025-03-05 11:39:33,777] Trial 313 finished with value: 0.503015096753017 and parameters: {'left_stride': 128, 'right_stride': 256, 'attention_pooling_operation': 'max', 'embedding_pooling_operation': 'min', 'threshold': 0.9733557319341791, 'batch_size': 60, 'attention_heads': 13, 'hidden_dimension': 114, 'number_of_hidden_layers': 1, 'dropout_rate': 0.564652571248863, 'global_pooling': 'max', 'learning_rate': 0.0003987816202075979, 'weight_decay': 6.320200129134463e-05, 'beta_0': 0.8449896356726032, 'beta_1': 0.9948629677933616, 'epsilon': 2.197336100444484e-07, 'balanced_loss': True, 'epochs': 112, 'early_stopping_patience': 19, 'plateau_patience': 24, 'plateau_divider': 2}. Best is trial 214 with value: 0.5493008496774074.
CUDA out of memory. Tried to allocate 3.19 GiB. GPU 0 has a total capacity of 44.56 GiB of which 2.73 GiB is free. Including non-PyTorch memory, this process has 41.83 GiB memory in use. Of the allocated memory 39.84 GiB is allocated by PyTorch, and 859.07 MiB is reserved by PyTorch but unallocated. If reserved but unallocated memory is large try setting PYTORCH_CUDA_ALLOC_CONF=expandable_segments:True to avoid fragmentation.  See documentation for Memory Management  (https://pytorch.org/docs/stable/notes/cuda.html#environment-variables)
[I 2025-03-05 11:52:16,178] Trial 314 finished with value: -1.0 and parameters: {'left_stride': 64, 'right_stride': 0, 'attention_pooling_operation': 'max', 'embedding_pooling_operation': 'min', 'threshold': 0.9599363746082081, 'batch_size': 110, 'attention_heads': 15, 'hidden_dimension': 149, 'number_of_hidden_layers': 1, 'dropout_rate': 0.5477977137631038, 'global_pooling': 'max', 'learning_rate': 0.0005347754794443557, 'weight_decay': 3.182444020083423e-05, 'beta_0': 0.8528074827235101, 'beta_1': 0.9915267078091942, 'epsilon': 4.2696899756216447e-07, 'balanced_loss': True, 'epochs': 130, 'early_stopping_patience': 19, 'plateau_patience': 23, 'plateau_divider': 2}. Best is trial 214 with value: 0.5493008496774074.
