[I 2025-03-28 19:30:16,639] Trial 171 finished with value: 0.49660755598024015 and parameters: {'left_stride': 0, 'right_stride': 64, 'attention_pooling_operation': 'max', 'embedding_pooling_operation': 'max', 'threshold': 0.8822547737259387, 'batch_size': 43, 'attention_heads': 5, 'hidden_dimension': 237, 'number_of_hidden_layers': 1, 'dropout_rate': 0.48361084535218635, 'global_pooling': 'mean', 'learning_rate': 0.0006033939998509502, 'weight_decay': 8.851875970302074e-05, 'beta_0': 0.8683724300886249, 'beta_1': 0.9982484018151517, 'epsilon': 1.21624082913151e-06, 'balanced_loss': False, 'epochs': 157, 'early_stopping_patience': 25, 'plateau_patience': 11, 'plateau_divider': 7}. Best is trial 131 with value: 0.5242140918743077.
[I 2025-03-28 19:42:02,773] Trial 172 finished with value: 0.48536037089279244 and parameters: {'left_stride': 0, 'right_stride': 64, 'attention_pooling_operation': 'max', 'embedding_pooling_operation': 'max', 'threshold': 0.8817341690313533, 'batch_size': 48, 'attention_heads': 5, 'hidden_dimension': 239, 'number_of_hidden_layers': 1, 'dropout_rate': 0.48277522505826287, 'global_pooling': 'mean', 'learning_rate': 0.0005712033465707341, 'weight_decay': 8.734036248160692e-05, 'beta_0': 0.8665519869885885, 'beta_1': 0.99897441389323, 'epsilon': 1.0869695377564494e-06, 'balanced_loss': False, 'epochs': 157, 'early_stopping_patience': 25, 'plateau_patience': 12, 'plateau_divider': 7}. Best is trial 131 with value: 0.5242140918743077.
[I 2025-03-28 19:53:42,114] Trial 173 finished with value: 0.5035495269653333 and parameters: {'left_stride': 0, 'right_stride': 64, 'attention_pooling_operation': 'max', 'embedding_pooling_operation': 'max', 'threshold': 0.8864681323544507, 'batch_size': 42, 'attention_heads': 5, 'hidden_dimension': 243, 'number_of_hidden_layers': 1, 'dropout_rate': 0.4707722119345443, 'global_pooling': 'mean', 'learning_rate': 0.0006270639370330796, 'weight_decay': 5.896436395924517e-05, 'beta_0': 0.8687432517006644, 'beta_1': 0.9982372946363022, 'epsilon': 3.8746058938313637e-07, 'balanced_loss': False, 'epochs': 162, 'early_stopping_patience': 24, 'plateau_patience': 11, 'plateau_divider': 7}. Best is trial 131 with value: 0.5242140918743077.
[I 2025-03-28 20:05:25,580] Trial 174 finished with value: 0.5124365338339895 and parameters: {'left_stride': 0, 'right_stride': 64, 'attention_pooling_operation': 'max', 'embedding_pooling_operation': 'max', 'threshold': 0.8872867296280206, 'batch_size': 42, 'attention_heads': 5, 'hidden_dimension': 243, 'number_of_hidden_layers': 1, 'dropout_rate': 0.4665169429505406, 'global_pooling': 'mean', 'learning_rate': 0.0006264479893285158, 'weight_decay': 6.001269042663062e-05, 'beta_0': 0.8692466050123298, 'beta_1': 0.9983465551516145, 'epsilon': 3.999230048057999e-07, 'balanced_loss': False, 'epochs': 154, 'early_stopping_patience': 25, 'plateau_patience': 10, 'plateau_divider': 7}. Best is trial 131 with value: 0.5242140918743077.
[I 2025-03-28 20:17:20,767] Trial 175 finished with value: 0.49101428196124963 and parameters: {'left_stride': 0, 'right_stride': 64, 'attention_pooling_operation': 'max', 'embedding_pooling_operation': 'max', 'threshold': 0.8856260775698561, 'batch_size': 127, 'attention_heads': 5, 'hidden_dimension': 230, 'number_of_hidden_layers': 1, 'dropout_rate': 0.46662716135351057, 'global_pooling': 'mean', 'learning_rate': 0.0009012447722122262, 'weight_decay': 5.8738803329494294e-05, 'beta_0': 0.8725462581123443, 'beta_1': 0.9982513593809619, 'epsilon': 1.77962802436525e-07, 'balanced_loss': False, 'epochs': 153, 'early_stopping_patience': 24, 'plateau_patience': 10, 'plateau_divider': 7}. Best is trial 131 with value: 0.5242140918743077.
[I 2025-03-28 20:28:33,241] Trial 176 finished with value: 0.4698391989813504 and parameters: {'left_stride': 0, 'right_stride': 64, 'attention_pooling_operation': 'max', 'embedding_pooling_operation': 'max', 'threshold': 0.8746488405280063, 'batch_size': 45, 'attention_heads': 4, 'hidden_dimension': 241, 'number_of_hidden_layers': 1, 'dropout_rate': 0.45735128560052135, 'global_pooling': 'mean', 'learning_rate': 0.0004235608894397953, 'weight_decay': 0.00011309061064250861, 'beta_0': 0.8696083215628013, 'beta_1': 0.9984093039427036, 'epsilon': 3.6260440805441634e-07, 'balanced_loss': False, 'epochs': 147, 'early_stopping_patience': 25, 'plateau_patience': 11, 'plateau_divider': 7}. Best is trial 131 with value: 0.5242140918743077.
[I 2025-03-28 20:40:08,560] Trial 177 finished with value: 0.4653211068140903 and parameters: {'left_stride': 0, 'right_stride': 64, 'attention_pooling_operation': 'max', 'embedding_pooling_operation': 'max', 'threshold': 0.8886552985061745, 'batch_size': 44, 'attention_heads': 5, 'hidden_dimension': 236, 'number_of_hidden_layers': 1, 'dropout_rate': 0.4745531567986584, 'global_pooling': 'mean', 'learning_rate': 0.00033652778666447595, 'weight_decay': 7.26130170386865e-05, 'beta_0': 0.8685294266332526, 'beta_1': 0.9977032278189355, 'epsilon': 2.4432107355665203e-07, 'balanced_loss': False, 'epochs': 155, 'early_stopping_patience': 24, 'plateau_patience': 10, 'plateau_divider': 7}. Best is trial 131 with value: 0.5242140918743077.
[I 2025-03-28 20:52:20,911] Trial 178 finished with value: 0.49801246928874227 and parameters: {'left_stride': 0, 'right_stride': 64, 'attention_pooling_operation': 'max', 'embedding_pooling_operation': 'max', 'threshold': 0.8833003697835133, 'batch_size': 42, 'attention_heads': 5, 'hidden_dimension': 249, 'number_of_hidden_layers': 1, 'dropout_rate': 0.4521103331880172, 'global_pooling': 'mean', 'learning_rate': 0.0005045551054898076, 'weight_decay': 7.888101248702723e-05, 'beta_0': 0.8631001310659557, 'beta_1': 0.9981229127277436, 'epsilon': 3.0873851422754985e-07, 'balanced_loss': False, 'epochs': 158, 'early_stopping_patience': 25, 'plateau_patience': 12, 'plateau_divider': 8}. Best is trial 131 with value: 0.5242140918743077.
[I 2025-03-28 21:03:35,520] Trial 179 finished with value: 0.47511278123070433 and parameters: {'left_stride': 0, 'right_stride': 64, 'attention_pooling_operation': 'max', 'embedding_pooling_operation': 'max', 'threshold': 0.8814733697855296, 'batch_size': 41, 'attention_heads': 4, 'hidden_dimension': 250, 'number_of_hidden_layers': 1, 'dropout_rate': 0.45950646393201855, 'global_pooling': 'mean', 'learning_rate': 0.0004513477939047411, 'weight_decay': 6.499747905637785e-05, 'beta_0': 0.8595358112012909, 'beta_1': 0.9981276342925153, 'epsilon': 2.813787525881942e-07, 'balanced_loss': False, 'epochs': 151, 'early_stopping_patience': 25, 'plateau_patience': 12, 'plateau_divider': 7}. Best is trial 131 with value: 0.5242140918743077.
[I 2025-03-28 21:15:19,699] Trial 180 finished with value: 0.47757901870552466 and parameters: {'left_stride': 0, 'right_stride': 64, 'attention_pooling_operation': 'max', 'embedding_pooling_operation': 'max', 'threshold': 0.8780855280442014, 'batch_size': 43, 'attention_heads': 5, 'hidden_dimension': 243, 'number_of_hidden_layers': 1, 'dropout_rate': 0.4506611621268982, 'global_pooling': 'mean', 'learning_rate': 0.0005341176933859447, 'weight_decay': 4.6865030818564625e-05, 'beta_0': 0.8677060165284332, 'beta_1': 0.9974225157784876, 'epsilon': 4.28260682518119e-07, 'balanced_loss': False, 'epochs': 131, 'early_stopping_patience': 25, 'plateau_patience': 11, 'plateau_divider': 8}. Best is trial 131 with value: 0.5242140918743077.
[I 2025-03-28 21:27:54,854] Trial 181 finished with value: 0.4918030270203825 and parameters: {'left_stride': 0, 'right_stride': 64, 'attention_pooling_operation': 'max', 'embedding_pooling_operation': 'max', 'threshold': 0.8847898395717649, 'batch_size': 39, 'attention_heads': 6, 'hidden_dimension': 248, 'number_of_hidden_layers': 1, 'dropout_rate': 0.4692594585363765, 'global_pooling': 'mean', 'learning_rate': 0.0006725694824237984, 'weight_decay': 8.444487059209263e-05, 'beta_0': 0.8634857759827176, 'beta_1': 0.9986246315925832, 'epsilon': 3.463373798944442e-07, 'balanced_loss': False, 'epochs': 161, 'early_stopping_patience': 25, 'plateau_patience': 11, 'plateau_divider': 8}. Best is trial 131 with value: 0.5242140918743077.
[I 2025-03-28 21:39:26,209] Trial 182 finished with value: 0.4927455591113035 and parameters: {'left_stride': 0, 'right_stride': 64, 'attention_pooling_operation': 'max', 'embedding_pooling_operation': 'max', 'threshold': 0.8897880182890189, 'batch_size': 46, 'attention_heads': 5, 'hidden_dimension': 252, 'number_of_hidden_layers': 1, 'dropout_rate': 0.46433356119961894, 'global_pooling': 'mean', 'learning_rate': 0.0008277826363965889, 'weight_decay': 0.00010628292483063357, 'beta_0': 0.8617998033489946, 'beta_1': 0.9981355679481986, 'epsilon': 6.464925829753567e-07, 'balanced_loss': False, 'epochs': 158, 'early_stopping_patience': 24, 'plateau_patience': 11, 'plateau_divider': 8}. Best is trial 131 with value: 0.5242140918743077.
[I 2025-03-28 21:51:07,731] Trial 183 finished with value: 0.4878225771835 and parameters: {'left_stride': 0, 'right_stride': 64, 'attention_pooling_operation': 'max', 'embedding_pooling_operation': 'max', 'threshold': 0.8979208419317384, 'batch_size': 36, 'attention_heads': 5, 'hidden_dimension': 237, 'number_of_hidden_layers': 1, 'dropout_rate': 0.4476949965426907, 'global_pooling': 'mean', 'learning_rate': 0.00037176992317320583, 'weight_decay': 6.178717747484271e-05, 'beta_0': 0.8715137029781088, 'beta_1': 0.9985895977555188, 'epsilon': 4.077088456889052e-07, 'balanced_loss': False, 'epochs': 163, 'early_stopping_patience': 25, 'plateau_patience': 10, 'plateau_divider': 8}. Best is trial 131 with value: 0.5242140918743077.
[I 2025-03-28 22:03:05,423] Trial 184 finished with value: 0.48224090018022997 and parameters: {'left_stride': 0, 'right_stride': 64, 'attention_pooling_operation': 'max', 'embedding_pooling_operation': 'max', 'threshold': 0.8832189564171548, 'batch_size': 42, 'attention_heads': 6, 'hidden_dimension': 240, 'number_of_hidden_layers': 1, 'dropout_rate': 0.4836054132137543, 'global_pooling': 'mean', 'learning_rate': 0.0005235689753268464, 'weight_decay': 7.303807859354485e-05, 'beta_0': 0.8661180673250991, 'beta_1': 0.9977547916418565, 'epsilon': 1.9477995742580958e-07, 'balanced_loss': False, 'epochs': 159, 'early_stopping_patience': 24, 'plateau_patience': 10, 'plateau_divider': 7}. Best is trial 131 with value: 0.5242140918743077.
[I 2025-03-28 22:26:16,710] Trial 185 finished with value: 0.36180491715250024 and parameters: {'left_stride': 0, 'right_stride': 64, 'attention_pooling_operation': 'max', 'embedding_pooling_operation': 'max', 'threshold': 0.8938292927637441, 'batch_size': 38, 'attention_heads': 6, 'hidden_dimension': 244, 'number_of_hidden_layers': 1, 'dropout_rate': 0.4726744998384038, 'global_pooling': 'mean', 'learning_rate': 1.300523946475396e-05, 'weight_decay': 8.748002686063661e-05, 'beta_0': 0.8636788063320434, 'beta_1': 0.9970267928467839, 'epsilon': 5.618498904866304e-07, 'balanced_loss': False, 'epochs': 126, 'early_stopping_patience': 25, 'plateau_patience': 11, 'plateau_divider': 8}. Best is trial 131 with value: 0.5242140918743077.
[I 2025-03-28 22:37:58,661] Trial 186 finished with value: 0.4843797016257831 and parameters: {'left_stride': 0, 'right_stride': 64, 'attention_pooling_operation': 'max', 'embedding_pooling_operation': 'max', 'threshold': 0.8890440494778453, 'batch_size': 48, 'attention_heads': 5, 'hidden_dimension': 233, 'number_of_hidden_layers': 1, 'dropout_rate': 0.4803800441172062, 'global_pooling': 'mean', 'learning_rate': 0.0005957045281008887, 'weight_decay': 5.160943207212331e-05, 'beta_0': 0.8558411866191673, 'beta_1': 0.9984662245213647, 'epsilon': 3.0748309101122524e-07, 'balanced_loss': False, 'epochs': 156, 'early_stopping_patience': 25, 'plateau_patience': 12, 'plateau_divider': 7}. Best is trial 131 with value: 0.5242140918743077.
[I 2025-03-28 22:49:06,346] Trial 187 finished with value: 0.42844378084204554 and parameters: {'left_stride': 0, 'right_stride': 64, 'attention_pooling_operation': 'max', 'embedding_pooling_operation': 'max', 'threshold': 0.8753204080492711, 'batch_size': 32, 'attention_heads': 4, 'hidden_dimension': 247, 'number_of_hidden_layers': 1, 'dropout_rate': 0.45758868350622767, 'global_pooling': 'sum', 'learning_rate': 0.0007065922502437395, 'weight_decay': 3.657955261604069e-05, 'beta_0': 0.8322262948830719, 'beta_1': 0.9980084179135758, 'epsilon': 1.0228804119807763e-08, 'balanced_loss': False, 'epochs': 166, 'early_stopping_patience': 25, 'plateau_patience': 11, 'plateau_divider': 8}. Best is trial 131 with value: 0.5242140918743077.
[I 2025-03-28 23:01:16,169] Trial 188 finished with value: 0.4855484698741676 and parameters: {'left_stride': 0, 'right_stride': 64, 'attention_pooling_operation': 'max', 'embedding_pooling_operation': 'max', 'threshold': 0.8801718604750037, 'batch_size': 35, 'attention_heads': 5, 'hidden_dimension': 253, 'number_of_hidden_layers': 1, 'dropout_rate': 0.5016423012889951, 'global_pooling': 'mean', 'learning_rate': 0.0004251918712478211, 'weight_decay': 0.00010287056024725692, 'beta_0': 0.8692542773177593, 'beta_1': 0.9975468348138687, 'epsilon': 7.025503182498243e-07, 'balanced_loss': False, 'epochs': 161, 'early_stopping_patience': 24, 'plateau_patience': 10, 'plateau_divider': 7}. Best is trial 131 with value: 0.5242140918743077.
[I 2025-03-28 23:13:44,520] Trial 189 finished with value: 0.48097592551847457 and parameters: {'left_stride': 0, 'right_stride': 128, 'attention_pooling_operation': 'max', 'embedding_pooling_operation': 'max', 'threshold': 0.8864379920502019, 'batch_size': 44, 'attention_heads': 6, 'hidden_dimension': 243, 'number_of_hidden_layers': 1, 'dropout_rate': 0.4649506342319438, 'global_pooling': 'mean', 'learning_rate': 0.000854030568279613, 'weight_decay': 8.066733775245382e-05, 'beta_0': 0.860141443425608, 'beta_1': 0.9986104028933409, 'epsilon': 8.927799569429084e-07, 'balanced_loss': False, 'epochs': 154, 'early_stopping_patience': 25, 'plateau_patience': 12, 'plateau_divider': 3}. Best is trial 131 with value: 0.5242140918743077.
[I 2025-03-28 23:23:35,138] Trial 190 finished with value: 0.4697254012824731 and parameters: {'left_stride': 0, 'right_stride': 64, 'attention_pooling_operation': 'max', 'embedding_pooling_operation': 'max', 'threshold': 0.8987702992993031, 'batch_size': 40, 'attention_heads': 5, 'hidden_dimension': 182, 'number_of_hidden_layers': 1, 'dropout_rate': 0.494859908032046, 'global_pooling': 'mean', 'learning_rate': 0.0003149138375060364, 'weight_decay': 5.64418250047213e-05, 'beta_0': 0.8665149618355578, 'beta_1': 0.9981925718043156, 'epsilon': 1.2765135002511716e-06, 'balanced_loss': False, 'epochs': 164, 'early_stopping_patience': 10, 'plateau_patience': 13, 'plateau_divider': 8}. Best is trial 131 with value: 0.5242140918743077.
[I 2025-03-28 23:35:31,700] Trial 191 finished with value: 0.4777391112608507 and parameters: {'left_stride': 0, 'right_stride': 64, 'attention_pooling_operation': 'max', 'embedding_pooling_operation': 'max', 'threshold': 0.8931807539347278, 'batch_size': 41, 'attention_heads': 5, 'hidden_dimension': 247, 'number_of_hidden_layers': 1, 'dropout_rate': 0.4875462700534517, 'global_pooling': 'mean', 'learning_rate': 0.0006375371982417152, 'weight_decay': 0.0001687414353758667, 'beta_0': 0.864854337527561, 'beta_1': 0.9989928778748706, 'epsilon': 4.870680477584395e-07, 'balanced_loss': False, 'epochs': 161, 'early_stopping_patience': 25, 'plateau_patience': 13, 'plateau_divider': 7}. Best is trial 131 with value: 0.5242140918743077.
[I 2025-03-28 23:47:23,476] Trial 192 finished with value: 0.5081436384988165 and parameters: {'left_stride': 0, 'right_stride': 64, 'attention_pooling_operation': 'max', 'embedding_pooling_operation': 'max', 'threshold': 0.8939392424020186, 'batch_size': 43, 'attention_heads': 5, 'hidden_dimension': 244, 'number_of_hidden_layers': 1, 'dropout_rate': 0.49163123995523816, 'global_pooling': 'mean', 'learning_rate': 0.0005005295412289827, 'weight_decay': 0.00011714700767975418, 'beta_0': 0.8644073233046272, 'beta_1': 0.9989972162283256, 'epsilon': 5.284687536865416e-07, 'balanced_loss': False, 'epochs': 163, 'early_stopping_patience': 25, 'plateau_patience': 22, 'plateau_divider': 7}. Best is trial 131 with value: 0.5242140918743077.
[I 2025-03-28 23:59:33,863] Trial 193 finished with value: 0.4933108232256321 and parameters: {'left_stride': 0, 'right_stride': 64, 'attention_pooling_operation': 'max', 'embedding_pooling_operation': 'max', 'threshold': 0.8904886619220278, 'batch_size': 45, 'attention_heads': 6, 'hidden_dimension': 236, 'number_of_hidden_layers': 1, 'dropout_rate': 0.47423965255255174, 'global_pooling': 'mean', 'learning_rate': 0.000502550187039794, 'weight_decay': 9.711442264631246e-05, 'beta_0': 0.8627453767723392, 'beta_1': 0.9886721906221907, 'epsilon': 3.54174050559462e-07, 'balanced_loss': False, 'epochs': 158, 'early_stopping_patience': 24, 'plateau_patience': 22, 'plateau_divider': 7}. Best is trial 131 with value: 0.5242140918743077.
[I 2025-03-29 00:11:32,692] Trial 194 finished with value: 0.4809629734454089 and parameters: {'left_stride': 0, 'right_stride': 64, 'attention_pooling_operation': 'max', 'embedding_pooling_operation': 'max', 'threshold': 0.8962361726385749, 'batch_size': 43, 'attention_heads': 6, 'hidden_dimension': 242, 'number_of_hidden_layers': 1, 'dropout_rate': 0.4806404237085666, 'global_pooling': 'mean', 'learning_rate': 0.000378959315934935, 'weight_decay': 0.00011786819188746388, 'beta_0': 0.869397533482915, 'beta_1': 0.9985569180463724, 'epsilon': 2.657121889238674e-07, 'balanced_loss': False, 'epochs': 166, 'early_stopping_patience': 25, 'plateau_patience': 11, 'plateau_divider': 7}. Best is trial 131 with value: 0.5242140918743077.
[I 2025-03-29 00:22:42,871] Trial 195 finished with value: 0.3824802633398539 and parameters: {'left_stride': 0, 'right_stride': 64, 'attention_pooling_operation': 'min', 'embedding_pooling_operation': 'max', 'threshold': 0.9026985402833815, 'batch_size': 38, 'attention_heads': 5, 'hidden_dimension': 253, 'number_of_hidden_layers': 1, 'dropout_rate': 0.49781291754147794, 'global_pooling': 'mean', 'learning_rate': 0.00047648000321239594, 'weight_decay': 6.841205573629917e-05, 'beta_0': 0.8576323889940028, 'beta_1': 0.9979756245595064, 'epsilon': 5.69345495750027e-07, 'balanced_loss': False, 'epochs': 173, 'early_stopping_patience': 24, 'plateau_patience': 22, 'plateau_divider': 7}. Best is trial 131 with value: 0.5242140918743077.
[I 2025-03-29 00:35:01,187] Trial 196 finished with value: 0.503122679059179 and parameters: {'left_stride': 0, 'right_stride': 64, 'attention_pooling_operation': 'max', 'embedding_pooling_operation': 'max', 'threshold': 0.8838197934757689, 'batch_size': 47, 'attention_heads': 6, 'hidden_dimension': 229, 'number_of_hidden_layers': 1, 'dropout_rate': 0.490619512439632, 'global_pooling': 'mean', 'learning_rate': 0.0007441062116130586, 'weight_decay': 0.0001447459899665964, 'beta_0': 0.8609543985386268, 'beta_1': 0.9985948821999756, 'epsilon': 4.4196073697385796e-07, 'balanced_loss': False, 'epochs': 152, 'early_stopping_patience': 25, 'plateau_patience': 21, 'plateau_divider': 7}. Best is trial 131 with value: 0.5242140918743077.
[I 2025-03-29 00:46:08,926] Trial 197 finished with value: 0.48831661626804107 and parameters: {'left_stride': 0, 'right_stride': 32, 'attention_pooling_operation': 'max', 'embedding_pooling_operation': 'max', 'threshold': 0.8829835183726017, 'batch_size': 49, 'attention_heads': 4, 'hidden_dimension': 231, 'number_of_hidden_layers': 1, 'dropout_rate': 0.4861961885507722, 'global_pooling': 'mean', 'learning_rate': 0.0005608528200750888, 'weight_decay': 9.270555300531218e-05, 'beta_0': 0.8602220037066755, 'beta_1': 0.9975374573654293, 'epsilon': 4.4304861497194997e-07, 'balanced_loss': False, 'epochs': 151, 'early_stopping_patience': 25, 'plateau_patience': 23, 'plateau_divider': 7}. Best is trial 131 with value: 0.5242140918743077.
[I 2025-03-29 00:58:16,473] Trial 198 finished with value: 0.49174580240226223 and parameters: {'left_stride': 0, 'right_stride': 64, 'attention_pooling_operation': 'max', 'embedding_pooling_operation': 'max', 'threshold': 0.8703819838619853, 'batch_size': 123, 'attention_heads': 5, 'hidden_dimension': 223, 'number_of_hidden_layers': 1, 'dropout_rate': 0.492062203670361, 'global_pooling': 'mean', 'learning_rate': 0.0007172271744932085, 'weight_decay': 0.00014169442918502965, 'beta_0': 0.8736156685617791, 'beta_1': 0.9981954828606027, 'epsilon': 2.2332128060606436e-07, 'balanced_loss': False, 'epochs': 154, 'early_stopping_patience': 25, 'plateau_patience': 22, 'plateau_divider': 7}. Best is trial 131 with value: 0.5242140918743077.
[I 2025-03-29 01:10:00,973] Trial 199 finished with value: 0.4901787307895527 and parameters: {'left_stride': 0, 'right_stride': 64, 'attention_pooling_operation': 'max', 'embedding_pooling_operation': 'max', 'threshold': 0.8769031661952185, 'batch_size': 47, 'attention_heads': 5, 'hidden_dimension': 227, 'number_of_hidden_layers': 1, 'dropout_rate': 0.4797152096015957, 'global_pooling': 'mean', 'learning_rate': 0.0002840510948883593, 'weight_decay': 0.00014240967319689227, 'beta_0': 0.8675545492519414, 'beta_1': 0.9977784510860697, 'epsilon': 6.988850230216354e-07, 'balanced_loss': False, 'epochs': 157, 'early_stopping_patience': 25, 'plateau_patience': 21, 'plateau_divider': 2}. Best is trial 131 with value: 0.5242140918743077.
