[I 2025-03-04 05:01:17,850] Using an existing study with name 'Ohsumed-GATv2-google-bert-bert-base-uncased-Surrogate-No_Aggregation-No_Ablation-1.0-0.5' instead of creating a new one.
Token indices sequence length is longer than the specified maximum sequence length for this model (611 > 512). Running this sequence through the model will result in indexing errors
[I 2025-03-04 05:20:35,031] Trial 271 finished with value: 0.5605093935353702 and parameters: {'left_stride': 256, 'right_stride': 0, 'attention_pooling_operation': 'max', 'embedding_pooling_operation': 'min', 'threshold': 0.9458911809811278, 'batch_size': 37, 'attention_heads': 11, 'hidden_dimension': 63, 'number_of_hidden_layers': 2, 'dropout_rate': 0.4612206486019623, 'global_pooling': 'max', 'learning_rate': 0.0005859676173638532, 'weight_decay': 4.47512291105633e-05, 'beta_0': 0.8899572495060014, 'beta_1': 0.9880528065908171, 'epsilon': 1.0942762797052787e-08, 'balanced_loss': True, 'epochs': 146, 'early_stopping_patience': 21, 'plateau_patience': 10, 'plateau_divider': 5}. Best is trial 147 with value: 0.5890664194848952.
[I 2025-03-04 05:39:22,326] Trial 272 finished with value: 0.5367146045698636 and parameters: {'left_stride': 256, 'right_stride': 0, 'attention_pooling_operation': 'max', 'embedding_pooling_operation': 'min', 'threshold': 0.9466599084801411, 'batch_size': 38, 'attention_heads': 11, 'hidden_dimension': 62, 'number_of_hidden_layers': 2, 'dropout_rate': 0.4594186841684653, 'global_pooling': 'mean', 'learning_rate': 0.0005872820338798973, 'weight_decay': 4.16411043347723e-05, 'beta_0': 0.8919002759240865, 'beta_1': 0.9882990718602406, 'epsilon': 1.0056116781210937e-08, 'balanced_loss': True, 'epochs': 145, 'early_stopping_patience': 21, 'plateau_patience': 10, 'plateau_divider': 5}. Best is trial 147 with value: 0.5890664194848952.
[I 2025-03-04 05:59:13,484] Trial 273 finished with value: 0.5333686582355108 and parameters: {'left_stride': 256, 'right_stride': 0, 'attention_pooling_operation': 'max', 'embedding_pooling_operation': 'min', 'threshold': 0.9389447068779071, 'batch_size': 36, 'attention_heads': 11, 'hidden_dimension': 69, 'number_of_hidden_layers': 2, 'dropout_rate': 0.4477900625987228, 'global_pooling': 'max', 'learning_rate': 0.0008657655281875433, 'weight_decay': 3.599299513298191e-05, 'beta_0': 0.8875327508367814, 'beta_1': 0.9878365610279272, 'epsilon': 1.2442060083204505e-08, 'balanced_loss': True, 'epochs': 149, 'early_stopping_patience': 21, 'plateau_patience': 10, 'plateau_divider': 5}. Best is trial 147 with value: 0.5890664194848952.
[I 2025-03-04 06:20:01,223] Trial 274 finished with value: 0.546572112391079 and parameters: {'left_stride': 256, 'right_stride': 0, 'attention_pooling_operation': 'max', 'embedding_pooling_operation': 'mean', 'threshold': 0.943597471259055, 'batch_size': 38, 'attention_heads': 11, 'hidden_dimension': 75, 'number_of_hidden_layers': 2, 'dropout_rate': 0.4549586338574811, 'global_pooling': 'max', 'learning_rate': 0.0004678804463876288, 'weight_decay': 5.2245662954712956e-05, 'beta_0': 0.8910958662402073, 'beta_1': 0.9872550032509299, 'epsilon': 1.033827533737635e-08, 'balanced_loss': True, 'epochs': 142, 'early_stopping_patience': 21, 'plateau_patience': 10, 'plateau_divider': 5}. Best is trial 147 with value: 0.5890664194848952.
[I 2025-03-04 06:42:51,819] Trial 275 finished with value: 0.4092515638741138 and parameters: {'left_stride': 256, 'right_stride': 0, 'attention_pooling_operation': 'max', 'embedding_pooling_operation': 'min', 'threshold': 0.9478101208180534, 'batch_size': 35, 'attention_heads': 11, 'hidden_dimension': 65, 'number_of_hidden_layers': 4, 'dropout_rate': 0.46891923996664814, 'global_pooling': 'max', 'learning_rate': 0.0007385757994219206, 'weight_decay': 4.809747331153146e-05, 'beta_0': 0.8936650084741906, 'beta_1': 0.9881762382936343, 'epsilon': 1.4797183902606343e-08, 'balanced_loss': True, 'epochs': 146, 'early_stopping_patience': 21, 'plateau_patience': 10, 'plateau_divider': 5}. Best is trial 147 with value: 0.5890664194848952.
[I 2025-03-04 07:02:14,391] Trial 276 finished with value: 0.5368840889233051 and parameters: {'left_stride': 32, 'right_stride': 0, 'attention_pooling_operation': 'max', 'embedding_pooling_operation': 'min', 'threshold': 0.9485718116112392, 'batch_size': 62, 'attention_heads': 11, 'hidden_dimension': 71, 'number_of_hidden_layers': 2, 'dropout_rate': 0.4659229916622657, 'global_pooling': 'max', 'learning_rate': 0.0005589634584300946, 'weight_decay': 3.525531063810077e-05, 'beta_0': 0.8901116336509551, 'beta_1': 0.9885295652403724, 'epsilon': 1.2332235797615513e-08, 'balanced_loss': True, 'epochs': 149, 'early_stopping_patience': 21, 'plateau_patience': 10, 'plateau_divider': 5}. Best is trial 147 with value: 0.5890664194848952.
CUDA out of memory. Tried to allocate 892.00 MiB. GPU 0 has a total capacity of 44.56 GiB of which 874.69 MiB is free. Including non-PyTorch memory, this process has 43.70 GiB memory in use. Of the allocated memory 41.76 GiB is allocated by PyTorch, and 805.78 MiB is reserved by PyTorch but unallocated. If reserved but unallocated memory is large try setting PYTORCH_CUDA_ALLOC_CONF=expandable_segments:True to avoid fragmentation.  See documentation for Memory Management  (https://pytorch.org/docs/stable/notes/cuda.html#environment-variables)
[I 2025-03-04 07:14:51,146] Trial 277 finished with value: -1.0 and parameters: {'left_stride': 128, 'right_stride': 0, 'attention_pooling_operation': 'min', 'embedding_pooling_operation': 'min', 'threshold': 0.9382251659765987, 'batch_size': 37, 'attention_heads': 11, 'hidden_dimension': 74, 'number_of_hidden_layers': 2, 'dropout_rate': 0.44319128047178546, 'global_pooling': 'max', 'learning_rate': 0.001006617694261175, 'weight_decay': 4.326715151096758e-05, 'beta_0': 0.8964980445746473, 'beta_1': 0.9876541056414172, 'epsilon': 1.0055033501252046e-08, 'balanced_loss': True, 'epochs': 142, 'early_stopping_patience': 21, 'plateau_patience': 10, 'plateau_divider': 5}. Best is trial 147 with value: 0.5890664194848952.
[I 2025-03-04 07:34:37,272] Trial 278 finished with value: 0.5196318352328481 and parameters: {'left_stride': 128, 'right_stride': 0, 'attention_pooling_operation': 'max', 'embedding_pooling_operation': 'min', 'threshold': 0.9519649363075972, 'batch_size': 34, 'attention_heads': 11, 'hidden_dimension': 78, 'number_of_hidden_layers': 2, 'dropout_rate': 0.45987794607735855, 'global_pooling': 'mean', 'learning_rate': 0.00040881866411645955, 'weight_decay': 2.972004715471071e-05, 'beta_0': 0.8856799679382246, 'beta_1': 0.9881060117251698, 'epsilon': 1.4655895635178556e-08, 'balanced_loss': True, 'epochs': 150, 'early_stopping_patience': 21, 'plateau_patience': 10, 'plateau_divider': 6}. Best is trial 147 with value: 0.5890664194848952.
CUDA out of memory. Tried to allocate 1.03 GiB. GPU 0 has a total capacity of 44.56 GiB of which 734.69 MiB is free. Including non-PyTorch memory, this process has 43.84 GiB memory in use. Of the allocated memory 41.84 GiB is allocated by PyTorch, and 867.17 MiB is reserved by PyTorch but unallocated. If reserved but unallocated memory is large try setting PYTORCH_CUDA_ALLOC_CONF=expandable_segments:True to avoid fragmentation.  See documentation for Memory Management  (https://pytorch.org/docs/stable/notes/cuda.html#environment-variables)
[I 2025-03-04 07:47:08,064] Trial 279 finished with value: -1.0 and parameters: {'left_stride': 128, 'right_stride': 0, 'attention_pooling_operation': 'max', 'embedding_pooling_operation': 'min', 'threshold': 0.9428836622863865, 'batch_size': 85, 'attention_heads': 10, 'hidden_dimension': 63, 'number_of_hidden_layers': 2, 'dropout_rate': 0.46623752279563524, 'global_pooling': 'mean', 'learning_rate': 0.0006260163797980606, 'weight_decay': 2.2437300160043873e-05, 'beta_0': 0.8944080818826436, 'beta_1': 0.9885788056132239, 'epsilon': 1.610900897989297e-08, 'balanced_loss': True, 'epochs': 146, 'early_stopping_patience': 22, 'plateau_patience': 10, 'plateau_divider': 5}. Best is trial 147 with value: 0.5890664194848952.
[I 2025-03-04 08:07:30,831] Trial 280 finished with value: 0.5518647426109929 and parameters: {'left_stride': 128, 'right_stride': 0, 'attention_pooling_operation': 'max', 'embedding_pooling_operation': 'min', 'threshold': 0.946718840568824, 'batch_size': 35, 'attention_heads': 11, 'hidden_dimension': 86, 'number_of_hidden_layers': 2, 'dropout_rate': 0.44949434781634684, 'global_pooling': 'mean', 'learning_rate': 0.0008299952781416725, 'weight_decay': 3.853533863802405e-05, 'beta_0': 0.8974391946542528, 'beta_1': 0.9878599025724647, 'epsilon': 1.855609346476931e-08, 'balanced_loss': True, 'epochs': 140, 'early_stopping_patience': 22, 'plateau_patience': 10, 'plateau_divider': 5}. Best is trial 147 with value: 0.5890664194848952.
[I 2025-03-04 08:27:52,726] Trial 281 finished with value: 0.52048147900624 and parameters: {'left_stride': 128, 'right_stride': 0, 'attention_pooling_operation': 'max', 'embedding_pooling_operation': 'min', 'threshold': 0.9449233056570147, 'batch_size': 39, 'attention_heads': 10, 'hidden_dimension': 87, 'number_of_hidden_layers': 2, 'dropout_rate': 0.47846699025423967, 'global_pooling': 'max', 'learning_rate': 0.0008390338818904611, 'weight_decay': 4.014316953278311e-05, 'beta_0': 0.8976725214931011, 'beta_1': 0.9876619450642594, 'epsilon': 1.9029281405298163e-08, 'balanced_loss': True, 'epochs': 140, 'early_stopping_patience': 21, 'plateau_patience': 10, 'plateau_divider': 5}. Best is trial 147 with value: 0.5890664194848952.
[I 2025-03-04 08:48:06,442] Trial 282 finished with value: 0.545392488592199 and parameters: {'left_stride': 128, 'right_stride': 0, 'attention_pooling_operation': 'max', 'embedding_pooling_operation': 'min', 'threshold': 0.9481987535405632, 'batch_size': 36, 'attention_heads': 11, 'hidden_dimension': 82, 'number_of_hidden_layers': 2, 'dropout_rate': 0.4732707522091837, 'global_pooling': 'mean', 'learning_rate': 0.0007535865874393713, 'weight_decay': 3.387897351680767e-05, 'beta_0': 0.8972975254767369, 'beta_1': 0.9865766825132557, 'epsilon': 1.5993502243474526e-08, 'balanced_loss': True, 'epochs': 136, 'early_stopping_patience': 21, 'plateau_patience': 10, 'plateau_divider': 5}. Best is trial 147 with value: 0.5890664194848952.
CUDA out of memory. Tried to allocate 840.00 MiB. GPU 0 has a total capacity of 44.56 GiB of which 666.69 MiB is free. Including non-PyTorch memory, this process has 43.90 GiB memory in use. Of the allocated memory 42.20 GiB is allocated by PyTorch, and 564.13 MiB is reserved by PyTorch but unallocated. If reserved but unallocated memory is large try setting PYTORCH_CUDA_ALLOC_CONF=expandable_segments:True to avoid fragmentation.  See documentation for Memory Management  (https://pytorch.org/docs/stable/notes/cuda.html#environment-variables)
[I 2025-03-04 09:00:50,889] Trial 283 finished with value: -1.0 and parameters: {'left_stride': 256, 'right_stride': 0, 'attention_pooling_operation': 'min', 'embedding_pooling_operation': 'min', 'threshold': 0.9362983625602114, 'batch_size': 35, 'attention_heads': 11, 'hidden_dimension': 89, 'number_of_hidden_layers': 2, 'dropout_rate': 0.5000413755644155, 'global_pooling': 'mean', 'learning_rate': 0.001139844620146523, 'weight_decay': 4.2421410036229375e-05, 'beta_0': 0.8951182508473962, 'beta_1': 0.9879821129565965, 'epsilon': 1.9994478202414607e-08, 'balanced_loss': True, 'epochs': 139, 'early_stopping_patience': 22, 'plateau_patience': 10, 'plateau_divider': 5}. Best is trial 147 with value: 0.5890664194848952.
CUDA out of memory. Tried to allocate 1.10 GiB. GPU 0 has a total capacity of 44.56 GiB of which 270.69 MiB is free. Including non-PyTorch memory, this process has 44.29 GiB memory in use. Of the allocated memory 42.97 GiB is allocated by PyTorch, and 175.32 MiB is reserved by PyTorch but unallocated. If reserved but unallocated memory is large try setting PYTORCH_CUDA_ALLOC_CONF=expandable_segments:True to avoid fragmentation.  See documentation for Memory Management  (https://pytorch.org/docs/stable/notes/cuda.html#environment-variables)
[I 2025-03-04 09:15:28,405] Trial 284 finished with value: -1.0 and parameters: {'left_stride': 128, 'right_stride': 128, 'attention_pooling_operation': 'max', 'embedding_pooling_operation': 'min', 'threshold': 0.9421852122921855, 'batch_size': 37, 'attention_heads': 11, 'hidden_dimension': 84, 'number_of_hidden_layers': 2, 'dropout_rate': 0.45435389435503376, 'global_pooling': 'mean', 'learning_rate': 0.0014626203838988203, 'weight_decay': 6.492981952115682e-05, 'beta_0': 0.8771649128352671, 'beta_1': 0.9870618369098606, 'epsilon': 1.1959033627141338e-08, 'balanced_loss': True, 'epochs': 143, 'early_stopping_patience': 21, 'plateau_patience': 10, 'plateau_divider': 5}. Best is trial 147 with value: 0.5890664194848952.
CUDA out of memory. Tried to allocate 1.82 GiB. GPU 0 has a total capacity of 44.56 GiB of which 1.79 GiB is free. Including non-PyTorch memory, this process has 42.77 GiB memory in use. Of the allocated memory 41.12 GiB is allocated by PyTorch, and 508.10 MiB is reserved by PyTorch but unallocated. If reserved but unallocated memory is large try setting PYTORCH_CUDA_ALLOC_CONF=expandable_segments:True to avoid fragmentation.  See documentation for Memory Management  (https://pytorch.org/docs/stable/notes/cuda.html#environment-variables)
[I 2025-03-04 09:28:02,921] Trial 285 finished with value: -1.0 and parameters: {'left_stride': 128, 'right_stride': 0, 'attention_pooling_operation': 'max', 'embedding_pooling_operation': 'min', 'threshold': 0.9300681583989076, 'batch_size': 92, 'attention_heads': 11, 'hidden_dimension': 79, 'number_of_hidden_layers': 2, 'dropout_rate': 0.4604597456227617, 'global_pooling': 'mean', 'learning_rate': 0.0006423753010085326, 'weight_decay': 3.202048896853372e-05, 'beta_0': 0.8822747415111527, 'beta_1': 0.9873623299345949, 'epsilon': 1.5120452734227926e-08, 'balanced_loss': True, 'epochs': 152, 'early_stopping_patience': 22, 'plateau_patience': 10, 'plateau_divider': 5}. Best is trial 147 with value: 0.5890664194848952.
[I 2025-03-04 09:53:52,425] Trial 286 finished with value: 0.5554841543125728 and parameters: {'left_stride': 128, 'right_stride': 0, 'attention_pooling_operation': 'mean', 'embedding_pooling_operation': 'mean', 'threshold': 0.9512495369801593, 'batch_size': 34, 'attention_heads': 11, 'hidden_dimension': 91, 'number_of_hidden_layers': 2, 'dropout_rate': 0.44647357624853606, 'global_pooling': 'mean', 'learning_rate': 0.0009023986468530483, 'weight_decay': 1.1088174769680277e-06, 'beta_0': 0.8976659273904432, 'beta_1': 0.9883134927763537, 'epsilon': 1.8130537708995032e-08, 'balanced_loss': True, 'epochs': 152, 'early_stopping_patience': 21, 'plateau_patience': 10, 'plateau_divider': 5}. Best is trial 147 with value: 0.5890664194848952.
[I 2025-03-04 10:18:42,976] Trial 287 finished with value: 0.5366600187440131 and parameters: {'left_stride': 128, 'right_stride': 0, 'attention_pooling_operation': 'mean', 'embedding_pooling_operation': 'mean', 'threshold': 0.9509717520745131, 'batch_size': 40, 'attention_heads': 10, 'hidden_dimension': 90, 'number_of_hidden_layers': 2, 'dropout_rate': 0.43045972793827925, 'global_pooling': 'mean', 'learning_rate': 0.0005257594987852048, 'weight_decay': 1.476624792687571e-06, 'beta_0': 0.895519934822007, 'beta_1': 0.987751176046393, 'epsilon': 1.3758827751578325e-08, 'balanced_loss': True, 'epochs': 145, 'early_stopping_patience': 20, 'plateau_patience': 10, 'plateau_divider': 5}. Best is trial 147 with value: 0.5890664194848952.
[I 2025-03-04 10:44:05,068] Trial 288 finished with value: 0.5193041068284279 and parameters: {'left_stride': 128, 'right_stride': 64, 'attention_pooling_operation': 'mean', 'embedding_pooling_operation': 'mean', 'threshold': 0.9512200585761613, 'batch_size': 35, 'attention_heads': 11, 'hidden_dimension': 85, 'number_of_hidden_layers': 2, 'dropout_rate': 0.44861340853544746, 'global_pooling': 'mean', 'learning_rate': 0.0008653629833240648, 'weight_decay': 1.1722397286846687e-06, 'beta_0': 0.8894052157209745, 'beta_1': 0.9883266082361756, 'epsilon': 2.1023018992350778e-08, 'balanced_loss': True, 'epochs': 151, 'early_stopping_patience': 22, 'plateau_patience': 11, 'plateau_divider': 6}. Best is trial 147 with value: 0.5890664194848952.
[I 2025-03-04 11:08:59,471] Trial 289 finished with value: 0.4970538074089287 and parameters: {'left_stride': 128, 'right_stride': 0, 'attention_pooling_operation': 'mean', 'embedding_pooling_operation': 'mean', 'threshold': 0.9477242735052421, 'batch_size': 37, 'attention_heads': 11, 'hidden_dimension': 90, 'number_of_hidden_layers': 2, 'dropout_rate': 0.47482026284582357, 'global_pooling': 'mean', 'learning_rate': 0.0010108433133440222, 'weight_decay': 1.1259332511117454e-06, 'beta_0': 0.8928990385965992, 'beta_1': 0.9885785642976451, 'epsilon': 1.2348355327176182e-08, 'balanced_loss': True, 'epochs': 150, 'early_stopping_patience': 21, 'plateau_patience': 10, 'plateau_divider': 5}. Best is trial 147 with value: 0.5890664194848952.
[I 2025-03-04 11:33:24,706] Trial 290 finished with value: 0.522000869082689 and parameters: {'left_stride': 128, 'right_stride': 0, 'attention_pooling_operation': 'mean', 'embedding_pooling_operation': 'mean', 'threshold': 0.9526222277568686, 'batch_size': 34, 'attention_heads': 10, 'hidden_dimension': 81, 'number_of_hidden_layers': 2, 'dropout_rate': 0.4418887745648528, 'global_pooling': 'mean', 'learning_rate': 0.0003625807281804739, 'weight_decay': 4.6242400035320586e-05, 'beta_0': 0.8980362225846533, 'beta_1': 0.9878993697903155, 'epsilon': 1.7949765353929352e-08, 'balanced_loss': True, 'epochs': 141, 'early_stopping_patience': 23, 'plateau_patience': 11, 'plateau_divider': 5}. Best is trial 147 with value: 0.5890664194848952.
[I 2025-03-04 12:00:35,365] Trial 291 finished with value: 0.5142203200275373 and parameters: {'left_stride': 128, 'right_stride': 0, 'attention_pooling_operation': 'mean', 'embedding_pooling_operation': 'mean', 'threshold': 0.9475421868083275, 'batch_size': 34, 'attention_heads': 11, 'hidden_dimension': 98, 'number_of_hidden_layers': 2, 'dropout_rate': 0.5778693289456123, 'global_pooling': 'mean', 'learning_rate': 0.0004586261529167774, 'weight_decay': 1.3535491181676743e-06, 'beta_0': 0.8946276051608819, 'beta_1': 0.9888626655042264, 'epsilon': 1.027032219471603e-08, 'balanced_loss': True, 'epochs': 147, 'early_stopping_patience': 20, 'plateau_patience': 10, 'plateau_divider': 5}. Best is trial 147 with value: 0.5890664194848952.
[I 2025-03-04 12:20:34,172] Trial 292 finished with value: 0.49965581911029333 and parameters: {'left_stride': 128, 'right_stride': 0, 'attention_pooling_operation': 'max', 'embedding_pooling_operation': 'mean', 'threshold': 0.9541751057878542, 'batch_size': 39, 'attention_heads': 11, 'hidden_dimension': 84, 'number_of_hidden_layers': 2, 'dropout_rate': 0.45136261134302325, 'global_pooling': 'mean', 'learning_rate': 0.0012528532512510566, 'weight_decay': 5.557762622503009e-05, 'beta_0': 0.8967403090430905, 'beta_1': 0.9874159996347487, 'epsilon': 2.6379534329623995e-08, 'balanced_loss': True, 'epochs': 134, 'early_stopping_patience': 24, 'plateau_patience': 10, 'plateau_divider': 5}. Best is trial 147 with value: 0.5890664194848952.
CUDA out of memory. Tried to allocate 1.03 GiB. GPU 0 has a total capacity of 44.56 GiB of which 172.69 MiB is free. Including non-PyTorch memory, this process has 44.38 GiB memory in use. Of the allocated memory 42.10 GiB is allocated by PyTorch, and 1.13 GiB is reserved by PyTorch but unallocated. If reserved but unallocated memory is large try setting PYTORCH_CUDA_ALLOC_CONF=expandable_segments:True to avoid fragmentation.  See documentation for Memory Management  (https://pytorch.org/docs/stable/notes/cuda.html#environment-variables)
[I 2025-03-04 12:33:25,522] Trial 293 finished with value: -1.0 and parameters: {'left_stride': 32, 'right_stride': 0, 'attention_pooling_operation': 'max', 'embedding_pooling_operation': 'min', 'threshold': 0.941364763746378, 'batch_size': 37, 'attention_heads': 11, 'hidden_dimension': 93, 'number_of_hidden_layers': 2, 'dropout_rate': 0.4599614819404943, 'global_pooling': 'mean', 'learning_rate': 0.0005989877373496021, 'weight_decay': 3.736156927290321e-05, 'beta_0': 0.8920822651284016, 'beta_1': 0.9881305478272748, 'epsilon': 1.5353803954825086e-08, 'balanced_loss': True, 'epochs': 144, 'early_stopping_patience': 21, 'plateau_patience': 10, 'plateau_divider': 5}. Best is trial 147 with value: 0.5890664194848952.
[I 2025-03-04 12:58:31,194] Trial 294 finished with value: 0.5511303367547271 and parameters: {'left_stride': 128, 'right_stride': 0, 'attention_pooling_operation': 'mean', 'embedding_pooling_operation': 'min', 'threshold': 0.9498373305486765, 'batch_size': 34, 'attention_heads': 10, 'hidden_dimension': 86, 'number_of_hidden_layers': 2, 'dropout_rate': 0.4856551031891474, 'global_pooling': 'mean', 'learning_rate': 0.00038983601526837203, 'weight_decay': 2.9801537388897106e-05, 'beta_0': 0.8982787126002102, 'beta_1': 0.9868874048887508, 'epsilon': 2.012876559015522e-08, 'balanced_loss': True, 'epochs': 150, 'early_stopping_patience': 22, 'plateau_patience': 11, 'plateau_divider': 5}. Best is trial 147 with value: 0.5890664194848952.
