[I 2025-03-29 07:22:16,246] Trial 229 finished with value: 0.45333601429422204 and parameters: {'left_stride': 256, 'right_stride': 64, 'attention_pooling_operation': 'max', 'embedding_pooling_operation': 'min', 'threshold': 0.9004625271640698, 'batch_size': 46, 'attention_heads': 7, 'hidden_dimension': 245, 'number_of_hidden_layers': 1, 'dropout_rate': 0.4421176762984589, 'global_pooling': 'mean', 'learning_rate': 0.00045942715701961285, 'weight_decay': 6.827892361515332e-05, 'beta_0': 0.8580969127534795, 'beta_1': 0.9986865571981404, 'epsilon': 3.5335847608431436e-07, 'balanced_loss': False, 'epochs': 171, 'early_stopping_patience': 18, 'plateau_patience': 24, 'plateau_divider': 7}. Best is trial 131 with value: 0.5242140918743077.
[I 2025-03-29 07:34:06,401] Trial 230 finished with value: 0.3697817331991894 and parameters: {'left_stride': 0, 'right_stride': 64, 'attention_pooling_operation': 'min', 'embedding_pooling_operation': 'max', 'threshold': 0.8894238029560494, 'batch_size': 38, 'attention_heads': 6, 'hidden_dimension': 253, 'number_of_hidden_layers': 1, 'dropout_rate': 0.46082309708874886, 'global_pooling': 'mean', 'learning_rate': 0.001520519867710462, 'weight_decay': 5.55569627422856e-05, 'beta_0': 0.8637299812900762, 'beta_1': 0.9973221979334356, 'epsilon': 5.916544111002729e-07, 'balanced_loss': False, 'epochs': 123, 'early_stopping_patience': 25, 'plateau_patience': 14, 'plateau_divider': 7}. Best is trial 131 with value: 0.5242140918743077.
[I 2025-03-29 07:45:46,764] Trial 231 finished with value: 0.5145650701092391 and parameters: {'left_stride': 0, 'right_stride': 64, 'attention_pooling_operation': 'max', 'embedding_pooling_operation': 'max', 'threshold': 0.882964734301868, 'batch_size': 43, 'attention_heads': 5, 'hidden_dimension': 237, 'number_of_hidden_layers': 1, 'dropout_rate': 0.47748183747789213, 'global_pooling': 'mean', 'learning_rate': 0.0006353808581286339, 'weight_decay': 8.432551220877715e-05, 'beta_0': 0.8699132541558362, 'beta_1': 0.9982427104272703, 'epsilon': 4.970629801259948e-07, 'balanced_loss': False, 'epochs': 158, 'early_stopping_patience': 25, 'plateau_patience': 23, 'plateau_divider': 7}. Best is trial 131 with value: 0.5242140918743077.
[I 2025-03-29 08:02:04,210] Trial 232 finished with value: 0.480674217618539 and parameters: {'left_stride': 0, 'right_stride': 64, 'attention_pooling_operation': 'max', 'embedding_pooling_operation': 'max', 'threshold': 0.8917146166997099, 'batch_size': 43, 'attention_heads': 12, 'hidden_dimension': 241, 'number_of_hidden_layers': 1, 'dropout_rate': 0.4765034413419021, 'global_pooling': 'mean', 'learning_rate': 0.0006887643057633435, 'weight_decay': 7.746463257773545e-05, 'beta_0': 0.8664089084292592, 'beta_1': 0.9983915274902507, 'epsilon': 4.842673794132967e-07, 'balanced_loss': False, 'epochs': 160, 'early_stopping_patience': 25, 'plateau_patience': 23, 'plateau_divider': 7}. Best is trial 131 with value: 0.5242140918743077.
[I 2025-03-29 08:14:16,990] Trial 233 finished with value: 0.4716397850470268 and parameters: {'left_stride': 0, 'right_stride': 64, 'attention_pooling_operation': 'max', 'embedding_pooling_operation': 'max', 'threshold': 0.8855160906213859, 'batch_size': 45, 'attention_heads': 6, 'hidden_dimension': 249, 'number_of_hidden_layers': 1, 'dropout_rate': 0.4645381914485751, 'global_pooling': 'mean', 'learning_rate': 0.0005214790769126159, 'weight_decay': 9.331162919659747e-05, 'beta_0': 0.8198947400941095, 'beta_1': 0.987859272901174, 'epsilon': 3.758509062695676e-07, 'balanced_loss': False, 'epochs': 164, 'early_stopping_patience': 25, 'plateau_patience': 22, 'plateau_divider': 7}. Best is trial 131 with value: 0.5242140918743077.
[I 2025-03-29 08:26:23,184] Trial 234 finished with value: 0.46853570051384275 and parameters: {'left_stride': 0, 'right_stride': 64, 'attention_pooling_operation': 'max', 'embedding_pooling_operation': 'max', 'threshold': 0.8736743240377994, 'batch_size': 40, 'attention_heads': 5, 'hidden_dimension': 244, 'number_of_hidden_layers': 1, 'dropout_rate': 0.4995163566554847, 'global_pooling': 'mean', 'learning_rate': 0.0007692395071446043, 'weight_decay': 0.00010875640030234298, 'beta_0': 0.8624052819430353, 'beta_1': 0.9979561109018813, 'epsilon': 5.872030727054805e-07, 'balanced_loss': False, 'epochs': 154, 'early_stopping_patience': 23, 'plateau_patience': 23, 'plateau_divider': 4}. Best is trial 131 with value: 0.5242140918743077.
[I 2025-03-29 08:37:25,778] Trial 235 finished with value: 0.49219092741251225 and parameters: {'left_stride': 0, 'right_stride': 64, 'attention_pooling_operation': 'max', 'embedding_pooling_operation': 'max', 'threshold': 0.8801650435179932, 'batch_size': 48, 'attention_heads': 4, 'hidden_dimension': 235, 'number_of_hidden_layers': 1, 'dropout_rate': 0.4701003766401127, 'global_pooling': 'mean', 'learning_rate': 0.0005929907261124773, 'weight_decay': 8.57127187318249e-05, 'beta_0': 0.8708457915550482, 'beta_1': 0.9985962704021132, 'epsilon': 2.8699938492138794e-07, 'balanced_loss': False, 'epochs': 159, 'early_stopping_patience': 24, 'plateau_patience': 23, 'plateau_divider': 7}. Best is trial 131 with value: 0.5242140918743077.
[I 2025-03-29 08:47:47,172] Trial 236 finished with value: 0.4840710318417457 and parameters: {'left_stride': 0, 'right_stride': 64, 'attention_pooling_operation': 'max', 'embedding_pooling_operation': 'max', 'threshold': 0.8948130639434658, 'batch_size': 32, 'attention_heads': 6, 'hidden_dimension': 240, 'number_of_hidden_layers': 1, 'dropout_rate': 0.43303079068826456, 'global_pooling': 'mean', 'learning_rate': 0.0004186249040477964, 'weight_decay': 6.486548269363468e-05, 'beta_0': 0.868676940825566, 'beta_1': 0.9915018400357789, 'epsilon': 4.4662205663659296e-07, 'balanced_loss': False, 'epochs': 150, 'early_stopping_patience': 14, 'plateau_patience': 18, 'plateau_divider': 7}. Best is trial 131 with value: 0.5242140918743077.
[I 2025-03-29 09:00:18,946] Trial 237 finished with value: 0.46326197591023865 and parameters: {'left_stride': 0, 'right_stride': 64, 'attention_pooling_operation': 'mean', 'embedding_pooling_operation': 'max', 'threshold': 0.886082328702596, 'batch_size': 42, 'attention_heads': 6, 'hidden_dimension': 249, 'number_of_hidden_layers': 1, 'dropout_rate': 0.477024340703063, 'global_pooling': 'mean', 'learning_rate': 0.0009181094548405477, 'weight_decay': 4.9325995980325055e-05, 'beta_0': 0.8597135952008835, 'beta_1': 0.9977876642974681, 'epsilon': 6.684343502853731e-07, 'balanced_loss': False, 'epochs': 163, 'early_stopping_patience': 25, 'plateau_patience': 22, 'plateau_divider': 7}. Best is trial 131 with value: 0.5242140918743077.
[I 2025-03-29 09:12:13,315] Trial 238 finished with value: 0.4763987075884775 and parameters: {'left_stride': 0, 'right_stride': 32, 'attention_pooling_operation': 'max', 'embedding_pooling_operation': 'max', 'threshold': 0.8902711576427127, 'batch_size': 36, 'attention_heads': 5, 'hidden_dimension': 245, 'number_of_hidden_layers': 1, 'dropout_rate': 0.4958610490926898, 'global_pooling': 'mean', 'learning_rate': 0.0006796121636681558, 'weight_decay': 0.0008947596582831686, 'beta_0': 0.8661078863273398, 'beta_1': 0.9926017549188202, 'epsilon': 7.368216029292306e-05, 'balanced_loss': False, 'epochs': 157, 'early_stopping_patience': 25, 'plateau_patience': 22, 'plateau_divider': 7}. Best is trial 131 with value: 0.5242140918743077.
[I 2025-03-29 09:23:21,232] Trial 239 finished with value: 0.45545344427993784 and parameters: {'left_stride': 256, 'right_stride': 64, 'attention_pooling_operation': 'max', 'embedding_pooling_operation': 'max', 'threshold': 0.8976991533322006, 'batch_size': 44, 'attention_heads': 5, 'hidden_dimension': 232, 'number_of_hidden_layers': 1, 'dropout_rate': 0.48787230287538774, 'global_pooling': 'mean', 'learning_rate': 0.0004939728103942795, 'weight_decay': 0.0002620451526439151, 'beta_0': 0.8641142503789419, 'beta_1': 0.998909141709135, 'epsilon': 8.768728544531667e-07, 'balanced_loss': False, 'epochs': 167, 'early_stopping_patience': 24, 'plateau_patience': 18, 'plateau_divider': 7}. Best is trial 131 with value: 0.5242140918743077.
[I 2025-03-29 09:36:21,125] Trial 240 finished with value: 0.5211253576933883 and parameters: {'left_stride': 0, 'right_stride': 64, 'attention_pooling_operation': 'max', 'embedding_pooling_operation': 'max', 'threshold': 0.8834107823528743, 'batch_size': 40, 'attention_heads': 6, 'hidden_dimension': 252, 'number_of_hidden_layers': 1, 'dropout_rate': 0.5008701719218862, 'global_pooling': 'mean', 'learning_rate': 0.0003762150204906787, 'weight_decay': 0.0006430652318620836, 'beta_0': 0.8621770032165196, 'beta_1': 0.9982521456240936, 'epsilon': 5.264824771427924e-07, 'balanced_loss': False, 'epochs': 161, 'early_stopping_patience': 25, 'plateau_patience': 23, 'plateau_divider': 3}. Best is trial 131 with value: 0.5242140918743077.
[I 2025-03-29 09:49:02,373] Trial 241 finished with value: 0.49272746348891233 and parameters: {'left_stride': 0, 'right_stride': 64, 'attention_pooling_operation': 'max', 'embedding_pooling_operation': 'max', 'threshold': 0.8838113030691962, 'batch_size': 41, 'attention_heads': 6, 'hidden_dimension': 256, 'number_of_hidden_layers': 1, 'dropout_rate': 0.5060323765588781, 'global_pooling': 'mean', 'learning_rate': 0.000354964465672581, 'weight_decay': 0.0006250190841104356, 'beta_0': 0.8616237969758744, 'beta_1': 0.9982439385327841, 'epsilon': 5.273605409869653e-07, 'balanced_loss': False, 'epochs': 161, 'early_stopping_patience': 25, 'plateau_patience': 23, 'plateau_divider': 3}. Best is trial 131 with value: 0.5242140918743077.
slurmstepd: error: *** JOB 15544598 ON gpu015 CANCELLED AT 2025-03-29T09:56:03 DUE TO TIME LIMIT ***
