[I 2025-03-05 12:13:53,547] Trial 315 finished with value: 0.47121316702974325 and parameters: {'left_stride': 128, 'right_stride': 64, 'attention_pooling_operation': 'max', 'embedding_pooling_operation': 'min', 'threshold': 0.988732727825156, 'batch_size': 62, 'attention_heads': 11, 'hidden_dimension': 128, 'number_of_hidden_layers': 1, 'dropout_rate': 0.5893931808958179, 'global_pooling': 'max', 'learning_rate': 0.00025943855541058413, 'weight_decay': 1.890699064397152e-05, 'beta_0': 0.8468676800157443, 'beta_1': 0.9921341884153587, 'epsilon': 1.0940046024307906e-06, 'balanced_loss': True, 'epochs': 107, 'early_stopping_patience': 18, 'plateau_patience': 21, 'plateau_divider': 2}. Best is trial 214 with value: 0.5493008496774074.
[I 2025-03-05 12:33:57,873] Trial 316 finished with value: 0.5217614113487933 and parameters: {'left_stride': 128, 'right_stride': 256, 'attention_pooling_operation': 'max', 'embedding_pooling_operation': 'min', 'threshold': 0.9665200499499973, 'batch_size': 52, 'attention_heads': 12, 'hidden_dimension': 143, 'number_of_hidden_layers': 1, 'dropout_rate': 0.5341105637321116, 'global_pooling': 'max', 'learning_rate': 0.0003204354641670398, 'weight_decay': 2.597645349544938e-05, 'beta_0': 0.8505923608987024, 'beta_1': 0.9909193295964979, 'epsilon': 8.285455528723048e-07, 'balanced_loss': True, 'epochs': 121, 'early_stopping_patience': 17, 'plateau_patience': 25, 'plateau_divider': 3}. Best is trial 214 with value: 0.5493008496774074.
The selected strides are greater or equal to the total chunk size.
[I 2025-03-05 12:33:59,616] Trial 317 finished with value: -1.0 and parameters: {'left_stride': 256, 'right_stride': 256, 'attention_pooling_operation': 'max', 'embedding_pooling_operation': 'min', 'threshold': 0.9723059889872339, 'batch_size': 43, 'attention_heads': 14, 'hidden_dimension': 138, 'number_of_hidden_layers': 1, 'dropout_rate': 0.5593468264441174, 'global_pooling': 'max', 'learning_rate': 0.00041055232913391143, 'weight_decay': 5.4201899012547096e-05, 'beta_0': 0.8433174859673958, 'beta_1': 0.9941088636601073, 'epsilon': 2.9500848777997913e-07, 'balanced_loss': True, 'epochs': 103, 'early_stopping_patience': 20, 'plateau_patience': 24, 'plateau_divider': 2}. Best is trial 214 with value: 0.5493008496774074.
[I 2025-03-05 12:51:05,419] Trial 318 finished with value: 0.502388666872936 and parameters: {'left_stride': 0, 'right_stride': 256, 'attention_pooling_operation': 'max', 'embedding_pooling_operation': 'min', 'threshold': 0.9777585522297565, 'batch_size': 54, 'attention_heads': 13, 'hidden_dimension': 102, 'number_of_hidden_layers': 1, 'dropout_rate': 0.5391567153405302, 'global_pooling': 'max', 'learning_rate': 0.0007036406263750718, 'weight_decay': 7.11740492874382e-05, 'beta_0': 0.8562746876340358, 'beta_1': 0.9956793050328167, 'epsilon': 6.500468879458779e-07, 'balanced_loss': True, 'epochs': 126, 'early_stopping_patience': 19, 'plateau_patience': 23, 'plateau_divider': 2}. Best is trial 214 with value: 0.5493008496774074.
[I 2025-03-05 13:09:46,459] Trial 319 finished with value: 0.5165022007634916 and parameters: {'left_stride': 128, 'right_stride': 256, 'attention_pooling_operation': 'max', 'embedding_pooling_operation': 'min', 'threshold': 0.962038177146687, 'batch_size': 50, 'attention_heads': 14, 'hidden_dimension': 85, 'number_of_hidden_layers': 1, 'dropout_rate': 0.5538813855192467, 'global_pooling': 'max', 'learning_rate': 0.000606349331866414, 'weight_decay': 4.766458302255701e-05, 'beta_0': 0.8481189080694037, 'beta_1': 0.9945245907276026, 'epsilon': 5.46165813050294e-07, 'balanced_loss': True, 'epochs': 91, 'early_stopping_patience': 19, 'plateau_patience': 23, 'plateau_divider': 2}. Best is trial 214 with value: 0.5493008496774074.
[I 2025-03-05 13:31:58,367] Trial 320 finished with value: 0.5149404296342965 and parameters: {'left_stride': 128, 'right_stride': 256, 'attention_pooling_operation': 'max', 'embedding_pooling_operation': 'min', 'threshold': 0.9687853637165796, 'batch_size': 57, 'attention_heads': 13, 'hidden_dimension': 169, 'number_of_hidden_layers': 1, 'dropout_rate': 0.5451659840265424, 'global_pooling': 'max', 'learning_rate': 0.0004714647570422115, 'weight_decay': 3.997527552755829e-05, 'beta_0': 0.8400547005693549, 'beta_1': 0.9830181316508826, 'epsilon': 1.5385136606733837e-07, 'balanced_loss': True, 'epochs': 98, 'early_stopping_patience': 18, 'plateau_patience': 24, 'plateau_divider': 2}. Best is trial 214 with value: 0.5493008496774074.
[I 2025-03-05 13:53:07,620] Trial 321 finished with value: 0.5049002282939763 and parameters: {'left_stride': 128, 'right_stride': 256, 'attention_pooling_operation': 'max', 'embedding_pooling_operation': 'min', 'threshold': 0.975212843695156, 'batch_size': 55, 'attention_heads': 14, 'hidden_dimension': 157, 'number_of_hidden_layers': 1, 'dropout_rate': 0.569583570979237, 'global_pooling': 'max', 'learning_rate': 0.0009231704438233103, 'weight_decay': 2.1999497328685237e-05, 'beta_0': 0.8455183002006502, 'beta_1': 0.9935552133457719, 'epsilon': 1.213965801256414e-08, 'balanced_loss': True, 'epochs': 136, 'early_stopping_patience': 19, 'plateau_patience': 25, 'plateau_divider': 2}. Best is trial 214 with value: 0.5493008496774074.
[I 2025-03-05 14:14:47,874] Trial 322 finished with value: 0.521611802071433 and parameters: {'left_stride': 128, 'right_stride': 256, 'attention_pooling_operation': 'max', 'embedding_pooling_operation': 'min', 'threshold': 0.9825537457955403, 'batch_size': 45, 'attention_heads': 15, 'hidden_dimension': 133, 'number_of_hidden_layers': 1, 'dropout_rate': 0.5317810354802431, 'global_pooling': 'max', 'learning_rate': 0.0003731575234164561, 'weight_decay': 2.945214910736167e-05, 'beta_0': 0.842406611759627, 'beta_1': 0.9930496627275769, 'epsilon': 3.825402656927819e-07, 'balanced_loss': True, 'epochs': 115, 'early_stopping_patience': 20, 'plateau_patience': 24, 'plateau_divider': 2}. Best is trial 214 with value: 0.5493008496774074.
[I 2025-03-05 14:34:17,308] Trial 323 finished with value: 0.4987608193374425 and parameters: {'left_stride': 128, 'right_stride': 0, 'attention_pooling_operation': 'max', 'embedding_pooling_operation': 'min', 'threshold': 0.9658103870545373, 'batch_size': 48, 'attention_heads': 12, 'hidden_dimension': 147, 'number_of_hidden_layers': 1, 'dropout_rate': 0.5496623193769294, 'global_pooling': 'max', 'learning_rate': 0.001390167653250733, 'weight_decay': 6.145754020901382e-05, 'beta_0': 0.8498069105323648, 'beta_1': 0.9924694892141354, 'epsilon': 7.731716770113522e-07, 'balanced_loss': True, 'epochs': 123, 'early_stopping_patience': 18, 'plateau_patience': 22, 'plateau_divider': 3}. Best is trial 214 with value: 0.5493008496774074.
CUDA out of memory. Tried to allocate 1.93 GiB. GPU 0 has a total capacity of 44.56 GiB of which 1.75 GiB is free. Including non-PyTorch memory, this process has 42.80 GiB memory in use. Of the allocated memory 41.08 GiB is allocated by PyTorch, and 581.97 MiB is reserved by PyTorch but unallocated. If reserved but unallocated memory is large try setting PYTORCH_CUDA_ALLOC_CONF=expandable_segments:True to avoid fragmentation.  See documentation for Memory Management  (https://pytorch.org/docs/stable/notes/cuda.html#environment-variables)
[I 2025-03-05 14:47:13,295] Trial 324 finished with value: -1.0 and parameters: {'left_stride': 128, 'right_stride': 256, 'attention_pooling_operation': 'max', 'embedding_pooling_operation': 'max', 'threshold': 0.9562767424386173, 'batch_size': 59, 'attention_heads': 14, 'hidden_dimension': 122, 'number_of_hidden_layers': 1, 'dropout_rate': 0.524735159761014, 'global_pooling': 'max', 'learning_rate': 0.0001858120919249315, 'weight_decay': 0.0001531413658770134, 'beta_0': 0.8466011153647872, 'beta_1': 0.9916538357696502, 'epsilon': 9.786429464655924e-07, 'balanced_loss': True, 'epochs': 109, 'early_stopping_patience': 17, 'plateau_patience': 24, 'plateau_divider': 2}. Best is trial 214 with value: 0.5493008496774074.
[I 2025-03-05 15:10:41,060] Trial 325 finished with value: 0.527324143949114 and parameters: {'left_stride': 128, 'right_stride': 256, 'attention_pooling_operation': 'max', 'embedding_pooling_operation': 'min', 'threshold': 0.970949354431923, 'batch_size': 52, 'attention_heads': 13, 'hidden_dimension': 139, 'number_of_hidden_layers': 1, 'dropout_rate': 0.5569323979262466, 'global_pooling': 'max', 'learning_rate': 0.0002961636170337929, 'weight_decay': 3.7205639147207335e-05, 'beta_0': 0.8441544816566313, 'beta_1': 0.9919934958928607, 'epsilon': 2.502549253080173e-07, 'balanced_loss': True, 'epochs': 119, 'early_stopping_patience': 19, 'plateau_patience': 25, 'plateau_divider': 2}. Best is trial 214 with value: 0.5493008496774074.
[I 2025-03-05 15:37:17,645] Trial 326 finished with value: 0.518639443175446 and parameters: {'left_stride': 128, 'right_stride': 256, 'attention_pooling_operation': 'max', 'embedding_pooling_operation': 'min', 'threshold': 0.9722818699319805, 'batch_size': 51, 'attention_heads': 13, 'hidden_dimension': 142, 'number_of_hidden_layers': 1, 'dropout_rate': 0.5607864401648389, 'global_pooling': 'max', 'learning_rate': 0.0002630030652781853, 'weight_decay': 3.542687066125154e-05, 'beta_0': 0.8381522323302147, 'beta_1': 0.9913115011405664, 'epsilon': 2.3876500979508724e-07, 'balanced_loss': True, 'epochs': 129, 'early_stopping_patience': 19, 'plateau_patience': 25, 'plateau_divider': 2}. Best is trial 214 with value: 0.5493008496774074.
[I 2025-03-05 16:07:41,168] Trial 327 finished with value: 0.5030099506588195 and parameters: {'left_stride': 128, 'right_stride': 32, 'attention_pooling_operation': 'mean', 'embedding_pooling_operation': 'min', 'threshold': 0.9774116482089833, 'batch_size': 53, 'attention_heads': 13, 'hidden_dimension': 137, 'number_of_hidden_layers': 1, 'dropout_rate': 0.556494959016325, 'global_pooling': 'max', 'learning_rate': 0.00021891247892013332, 'weight_decay': 3.142914825280314e-05, 'beta_0': 0.85421101864899, 'beta_1': 0.9808939971297365, 'epsilon': 2.994710075667424e-07, 'balanced_loss': True, 'epochs': 105, 'early_stopping_patience': 19, 'plateau_patience': 25, 'plateau_divider': 2}. Best is trial 214 with value: 0.5493008496774074.
[I 2025-03-05 16:33:19,294] Trial 328 finished with value: 0.5339208900190613 and parameters: {'left_stride': 128, 'right_stride': 256, 'attention_pooling_operation': 'max', 'embedding_pooling_operation': 'min', 'threshold': 0.9692806335933826, 'batch_size': 56, 'attention_heads': 13, 'hidden_dimension': 151, 'number_of_hidden_layers': 1, 'dropout_rate': 0.5671492564627647, 'global_pooling': 'max', 'learning_rate': 0.00029745518692778517, 'weight_decay': 3.875932086531203e-05, 'beta_0': 0.8513052293291054, 'beta_1': 0.9927866984897575, 'epsilon': 2.1003181163714847e-07, 'balanced_loss': True, 'epochs': 119, 'early_stopping_patience': 19, 'plateau_patience': 25, 'plateau_divider': 2}. Best is trial 214 with value: 0.5493008496774074.
[I 2025-03-05 16:54:52,207] Trial 329 finished with value: 0.5021309302464461 and parameters: {'left_stride': 64, 'right_stride': 256, 'attention_pooling_operation': 'max', 'embedding_pooling_operation': 'min', 'threshold': 0.9828378449206505, 'batch_size': 53, 'attention_heads': 13, 'hidden_dimension': 153, 'number_of_hidden_layers': 1, 'dropout_rate': 0.5769671037076797, 'global_pooling': 'max', 'learning_rate': 0.0003556204107786287, 'weight_decay': 3.628290911730078e-05, 'beta_0': 0.8521082009525599, 'beta_1': 0.9927980768201503, 'epsilon': 1.8688702419848796e-07, 'balanced_loss': True, 'epochs': 119, 'early_stopping_patience': 18, 'plateau_patience': 25, 'plateau_divider': 2}. Best is trial 214 with value: 0.5493008496774074.
[I 2025-03-05 17:18:43,302] Trial 330 finished with value: 0.5021318239300419 and parameters: {'left_stride': 128, 'right_stride': 256, 'attention_pooling_operation': 'max', 'embedding_pooling_operation': 'min', 'threshold': 0.9729526316022595, 'batch_size': 55, 'attention_heads': 13, 'hidden_dimension': 166, 'number_of_hidden_layers': 1, 'dropout_rate': 0.5673604208145244, 'global_pooling': 'max', 'learning_rate': 0.0003012053990777791, 'weight_decay': 2.606671258865113e-05, 'beta_0': 0.8514307234624033, 'beta_1': 0.9932390281340576, 'epsilon': 2.1982925775465006e-07, 'balanced_loss': True, 'epochs': 120, 'early_stopping_patience': 19, 'plateau_patience': 25, 'plateau_divider': 2}. Best is trial 214 with value: 0.5493008496774074.
[I 2025-03-05 17:41:31,104] Trial 331 finished with value: 0.48537080637286956 and parameters: {'left_stride': 128, 'right_stride': 256, 'attention_pooling_operation': 'max', 'embedding_pooling_operation': 'min', 'threshold': 0.979014526955471, 'batch_size': 50, 'attention_heads': 13, 'hidden_dimension': 150, 'number_of_hidden_layers': 1, 'dropout_rate': 0.5846917870709746, 'global_pooling': 'max', 'learning_rate': 0.0002469537458114337, 'weight_decay': 4.278289247561347e-05, 'beta_0': 0.849119260371464, 'beta_1': 0.9920587045989065, 'epsilon': 2.8145817934158953e-07, 'balanced_loss': True, 'epochs': 125, 'early_stopping_patience': 19, 'plateau_patience': 25, 'plateau_divider': 2}. Best is trial 214 with value: 0.5493008496774074.
[I 2025-03-05 18:03:10,021] Trial 332 finished with value: 0.5104216103436915 and parameters: {'left_stride': 128, 'right_stride': 256, 'attention_pooling_operation': 'max', 'embedding_pooling_operation': 'min', 'threshold': 0.9694322016933768, 'batch_size': 56, 'attention_heads': 13, 'hidden_dimension': 158, 'number_of_hidden_layers': 1, 'dropout_rate': 0.5646592751584248, 'global_pooling': 'max', 'learning_rate': 0.00040103856069531905, 'weight_decay': 3.257890750394524e-05, 'beta_0': 0.8549356495936897, 'beta_1': 0.9924692027677279, 'epsilon': 1.5326382768859276e-07, 'balanced_loss': True, 'epochs': 122, 'early_stopping_patience': 18, 'plateau_patience': 25, 'plateau_divider': 2}. Best is trial 214 with value: 0.5493008496774074.
