[I 2025-04-04 09:14:48,119] Trial 233 finished with value: 0.9454545454545454 and parameters: {'left_stride': 256, 'right_stride': 0, 'co_occurrence_pooling_operation': 'sum', 'embedding_pooling_operation': 'mean', 'window_size': 5, 'batch_size': 54, 'attention_heads': 5, 'hidden_dimension': 56, 'number_of_hidden_layers': 4, 'dropout_rate': 0.5110801012792506, 'global_pooling': 'mean', 'learning_rate': 3.285107979255985e-05, 'weight_decay': 3.877635340620931e-05, 'beta_0': 0.8757773737760516, 'beta_1': 0.9824846366993524, 'epsilon': 2.393379419502834e-08, 'balanced_loss': True, 'epochs': 140, 'early_stopping_patience': 19, 'plateau_patience': 16, 'plateau_divider': 2}. Best is trial 44 with value: 0.9575757575757575.
[I 2025-04-04 09:24:26,606] Trial 234 finished with value: 0.9515151515151515 and parameters: {'left_stride': 32, 'right_stride': 128, 'co_occurrence_pooling_operation': 'sum', 'embedding_pooling_operation': 'mean', 'window_size': 7, 'batch_size': 21, 'attention_heads': 4, 'hidden_dimension': 167, 'number_of_hidden_layers': 4, 'dropout_rate': 0.4902618340306686, 'global_pooling': 'mean', 'learning_rate': 0.0013342335268526372, 'weight_decay': 0.00027944861519546555, 'beta_0': 0.8348734110882555, 'beta_1': 0.9934150728586747, 'epsilon': 3.036683431917243e-08, 'balanced_loss': True, 'epochs': 135, 'early_stopping_patience': 17, 'plateau_patience': 17, 'plateau_divider': 3}. Best is trial 44 with value: 0.9575757575757575.
[I 2025-04-04 09:31:53,213] Trial 235 finished with value: 0.9393939393939394 and parameters: {'left_stride': 32, 'right_stride': 32, 'co_occurrence_pooling_operation': 'sum', 'embedding_pooling_operation': 'mean', 'window_size': 4, 'batch_size': 59, 'attention_heads': 5, 'hidden_dimension': 50, 'number_of_hidden_layers': 4, 'dropout_rate': 0.5168937758616106, 'global_pooling': 'sum', 'learning_rate': 0.00020227145250946795, 'weight_decay': 6.168225222694454e-05, 'beta_0': 0.830059385457993, 'beta_1': 0.989577976621316, 'epsilon': 1.6666534212358895e-05, 'balanced_loss': True, 'epochs': 120, 'early_stopping_patience': 18, 'plateau_patience': 20, 'plateau_divider': 5}. Best is trial 44 with value: 0.9575757575757575.
[I 2025-04-04 09:41:10,426] Trial 236 finished with value: 0.9454545454545454 and parameters: {'left_stride': 32, 'right_stride': 128, 'co_occurrence_pooling_operation': 'sum', 'embedding_pooling_operation': 'mean', 'window_size': 6, 'batch_size': 19, 'attention_heads': 4, 'hidden_dimension': 150, 'number_of_hidden_layers': 4, 'dropout_rate': 0.5763668034677806, 'global_pooling': 'mean', 'learning_rate': 0.00011582986937497638, 'weight_decay': 4.237638512599579e-05, 'beta_0': 0.866773882363788, 'beta_1': 0.9885413053442205, 'epsilon': 1.688695299634553e-07, 'balanced_loss': False, 'epochs': 126, 'early_stopping_patience': 19, 'plateau_patience': 16, 'plateau_divider': 9}. Best is trial 44 with value: 0.9575757575757575.
[I 2025-04-04 09:49:14,487] Trial 237 finished with value: 0.9333333333333333 and parameters: {'left_stride': 32, 'right_stride': 128, 'co_occurrence_pooling_operation': 'sum', 'embedding_pooling_operation': 'mean', 'window_size': 5, 'batch_size': 39, 'attention_heads': 4, 'hidden_dimension': 158, 'number_of_hidden_layers': 1, 'dropout_rate': 0.4976694674767466, 'global_pooling': 'mean', 'learning_rate': 5.3322883670670466e-05, 'weight_decay': 3.340816467316061e-05, 'beta_0': 0.8148615552877625, 'beta_1': 0.9901677288997602, 'epsilon': 4.8497911614888384e-08, 'balanced_loss': True, 'epochs': 131, 'early_stopping_patience': 20, 'plateau_patience': 18, 'plateau_divider': 4}. Best is trial 44 with value: 0.9575757575757575.
[I 2025-04-04 09:59:16,096] Trial 238 finished with value: 0.9393939393939394 and parameters: {'left_stride': 32, 'right_stride': 128, 'co_occurrence_pooling_operation': 'sum', 'embedding_pooling_operation': 'mean', 'window_size': 4, 'batch_size': 21, 'attention_heads': 5, 'hidden_dimension': 173, 'number_of_hidden_layers': 4, 'dropout_rate': 0.504828280647801, 'global_pooling': 'mean', 'learning_rate': 2.3115488238581107e-05, 'weight_decay': 2.946662872122423e-05, 'beta_0': 0.8624601978400167, 'beta_1': 0.9954174153115264, 'epsilon': 2.165003384451252e-08, 'balanced_loss': True, 'epochs': 128, 'early_stopping_patience': 18, 'plateau_patience': 24, 'plateau_divider': 4}. Best is trial 44 with value: 0.9575757575757575.
[I 2025-04-04 10:09:11,923] Trial 239 finished with value: 0.9575757575757575 and parameters: {'left_stride': 32, 'right_stride': 128, 'co_occurrence_pooling_operation': 'sum', 'embedding_pooling_operation': 'mean', 'window_size': 4, 'batch_size': 20, 'attention_heads': 5, 'hidden_dimension': 178, 'number_of_hidden_layers': 4, 'dropout_rate': 0.46014992740436134, 'global_pooling': 'mean', 'learning_rate': 1.745783436171953e-05, 'weight_decay': 5.056599477527058e-05, 'beta_0': 0.8246410444233893, 'beta_1': 0.99429228264547, 'epsilon': 3.376041963453874e-08, 'balanced_loss': True, 'epochs': 137, 'early_stopping_patience': 18, 'plateau_patience': 16, 'plateau_divider': 4}. Best is trial 44 with value: 0.9575757575757575.
[I 2025-04-04 10:20:07,680] Trial 240 finished with value: 0.9454545454545454 and parameters: {'left_stride': 32, 'right_stride': 128, 'co_occurrence_pooling_operation': 'sum', 'embedding_pooling_operation': 'mean', 'window_size': 4, 'batch_size': 20, 'attention_heads': 5, 'hidden_dimension': 183, 'number_of_hidden_layers': 4, 'dropout_rate': 0.45878434477080143, 'global_pooling': 'mean', 'learning_rate': 1.525577339389615e-05, 'weight_decay': 5.089863149211133e-05, 'beta_0': 0.8251824986649874, 'beta_1': 0.9943401361968349, 'epsilon': 3.439554248260676e-08, 'balanced_loss': True, 'epochs': 138, 'early_stopping_patience': 18, 'plateau_patience': 16, 'plateau_divider': 4}. Best is trial 44 with value: 0.9575757575757575.
[I 2025-04-04 10:30:13,678] Trial 241 finished with value: 0.9575757575757575 and parameters: {'left_stride': 32, 'right_stride': 128, 'co_occurrence_pooling_operation': 'sum', 'embedding_pooling_operation': 'mean', 'window_size': 4, 'batch_size': 22, 'attention_heads': 5, 'hidden_dimension': 178, 'number_of_hidden_layers': 4, 'dropout_rate': 0.4471905875616492, 'global_pooling': 'mean', 'learning_rate': 1.971250219981129e-05, 'weight_decay': 4.6715434106280466e-05, 'beta_0': 0.8245415901220172, 'beta_1': 0.9949478517848958, 'epsilon': 3.9683576275161787e-08, 'balanced_loss': True, 'epochs': 143, 'early_stopping_patience': 17, 'plateau_patience': 16, 'plateau_divider': 4}. Best is trial 44 with value: 0.9575757575757575.
[I 2025-04-04 10:41:22,860] Trial 242 finished with value: 0.9515151515151515 and parameters: {'left_stride': 32, 'right_stride': 128, 'co_occurrence_pooling_operation': 'sum', 'embedding_pooling_operation': 'mean', 'window_size': 4, 'batch_size': 22, 'attention_heads': 5, 'hidden_dimension': 178, 'number_of_hidden_layers': 4, 'dropout_rate': 0.32663753922412314, 'global_pooling': 'mean', 'learning_rate': 1.0901453426001211e-05, 'weight_decay': 5.011562155830791e-05, 'beta_0': 0.8229846372519295, 'beta_1': 0.994930893396375, 'epsilon': 4.660878790254351e-08, 'balanced_loss': True, 'epochs': 143, 'early_stopping_patience': 17, 'plateau_patience': 16, 'plateau_divider': 8}. Best is trial 44 with value: 0.9575757575757575.
[I 2025-04-04 10:52:54,525] Trial 243 finished with value: 0.9454545454545454 and parameters: {'left_stride': 32, 'right_stride': 128, 'co_occurrence_pooling_operation': 'sum', 'embedding_pooling_operation': 'mean', 'window_size': 4, 'batch_size': 63, 'attention_heads': 5, 'hidden_dimension': 177, 'number_of_hidden_layers': 4, 'dropout_rate': 0.4188660044491129, 'global_pooling': 'mean', 'learning_rate': 1.775891927809678e-05, 'weight_decay': 4.306955182811e-05, 'beta_0': 0.8241519191732402, 'beta_1': 0.9945456936428497, 'epsilon': 3.9321833950889407e-08, 'balanced_loss': True, 'epochs': 155, 'early_stopping_patience': 18, 'plateau_patience': 16, 'plateau_divider': 4}. Best is trial 44 with value: 0.9575757575757575.
[I 2025-04-04 11:12:13,443] Trial 244 finished with value: 0.9454545454545454 and parameters: {'left_stride': 32, 'right_stride': 128, 'co_occurrence_pooling_operation': 'sum', 'embedding_pooling_operation': 'min', 'window_size': 8, 'batch_size': 24, 'attention_heads': 6, 'hidden_dimension': 181, 'number_of_hidden_layers': 4, 'dropout_rate': 0.5285600809902374, 'global_pooling': 'mean', 'learning_rate': 1.8472269165243993e-05, 'weight_decay': 5.8941372817321045e-05, 'beta_0': 0.8217395394118406, 'beta_1': 0.9950240580681714, 'epsilon': 2.8964712989239703e-08, 'balanced_loss': True, 'epochs': 146, 'early_stopping_patience': 19, 'plateau_patience': 16, 'plateau_divider': 4}. Best is trial 44 with value: 0.9575757575757575.
[I 2025-04-04 11:21:08,112] Trial 245 finished with value: 0.9515151515151515 and parameters: {'left_stride': 32, 'right_stride': 128, 'co_occurrence_pooling_operation': 'sum', 'embedding_pooling_operation': 'mean', 'window_size': 3, 'batch_size': 22, 'attention_heads': 5, 'hidden_dimension': 194, 'number_of_hidden_layers': 4, 'dropout_rate': 0.5111680220405974, 'global_pooling': 'mean', 'learning_rate': 2.6087354015677222e-05, 'weight_decay': 3.62855042188609e-05, 'beta_0': 0.8198417685302755, 'beta_1': 0.9941047591420484, 'epsilon': 1.008731421727775e-08, 'balanced_loss': True, 'epochs': 141, 'early_stopping_patience': 17, 'plateau_patience': 17, 'plateau_divider': 4}. Best is trial 44 with value: 0.9575757575757575.
[I 2025-04-04 11:33:24,347] Trial 246 finished with value: 0.9515151515151515 and parameters: {'left_stride': 32, 'right_stride': 128, 'co_occurrence_pooling_operation': 'sum', 'embedding_pooling_operation': 'mean', 'window_size': 5, 'batch_size': 18, 'attention_heads': 5, 'hidden_dimension': 189, 'number_of_hidden_layers': 4, 'dropout_rate': 0.5220947593495036, 'global_pooling': 'mean', 'learning_rate': 1.3421827690830017e-05, 'weight_decay': 8.066827843063506e-05, 'beta_0': 0.8261550804236866, 'beta_1': 0.9937197857638029, 'epsilon': 3.672189397301838e-08, 'balanced_loss': True, 'epochs': 136, 'early_stopping_patience': 18, 'plateau_patience': 16, 'plateau_divider': 4}. Best is trial 44 with value: 0.9575757575757575.
[I 2025-04-04 11:47:29,266] Trial 247 finished with value: 0.9454545454545454 and parameters: {'left_stride': 0, 'right_stride': 128, 'co_occurrence_pooling_operation': 'sum', 'embedding_pooling_operation': 'mean', 'window_size': 10, 'batch_size': 20, 'attention_heads': 5, 'hidden_dimension': 171, 'number_of_hidden_layers': 4, 'dropout_rate': 0.5135264169359784, 'global_pooling': 'mean', 'learning_rate': 2.2772524978235164e-05, 'weight_decay': 4.5100466384799804e-05, 'beta_0': 0.823731918564753, 'beta_1': 0.9957368380991544, 'epsilon': 5.728447246482931e-08, 'balanced_loss': True, 'epochs': 139, 'early_stopping_patience': 18, 'plateau_patience': 17, 'plateau_divider': 4}. Best is trial 44 with value: 0.9575757575757575.
[I 2025-04-04 11:59:09,609] Trial 248 finished with value: 0.9515151515151515 and parameters: {'left_stride': 32, 'right_stride': 128, 'co_occurrence_pooling_operation': 'sum', 'embedding_pooling_operation': 'mean', 'window_size': 4, 'batch_size': 19, 'attention_heads': 7, 'hidden_dimension': 164, 'number_of_hidden_layers': 4, 'dropout_rate': 0.4509782919509942, 'global_pooling': 'mean', 'learning_rate': 1.9752052252444792e-05, 'weight_decay': 4.9915112633689965e-05, 'beta_0': 0.805236330416092, 'beta_1': 0.9924068683940498, 'epsilon': 2.5333514923781115e-08, 'balanced_loss': True, 'epochs': 137, 'early_stopping_patience': 17, 'plateau_patience': 15, 'plateau_divider': 4}. Best is trial 44 with value: 0.9575757575757575.
[I 2025-04-04 12:06:31,449] Trial 249 finished with value: 0.9515151515151515 and parameters: {'left_stride': 128, 'right_stride': 128, 'co_occurrence_pooling_operation': 'sum', 'embedding_pooling_operation': 'mean', 'window_size': 4, 'batch_size': 23, 'attention_heads': 4, 'hidden_dimension': 41, 'number_of_hidden_layers': 4, 'dropout_rate': 0.45520327116869086, 'global_pooling': 'mean', 'learning_rate': 8.840929983157709e-05, 'weight_decay': 5.7354966324978755e-05, 'beta_0': 0.8726777710051163, 'beta_1': 0.9930474196555903, 'epsilon': 4.143440009142319e-07, 'balanced_loss': True, 'epochs': 134, 'early_stopping_patience': 15, 'plateau_patience': 16, 'plateau_divider': 4}. Best is trial 44 with value: 0.9575757575757575.
[I 2025-04-04 12:19:59,956] Trial 250 finished with value: 0.9212121212121213 and parameters: {'left_stride': 32, 'right_stride': 128, 'co_occurrence_pooling_operation': 'sum', 'embedding_pooling_operation': 'mean', 'window_size': 9, 'batch_size': 20, 'attention_heads': 5, 'hidden_dimension': 182, 'number_of_hidden_layers': 4, 'dropout_rate': 0.46237550777222153, 'global_pooling': 'max', 'learning_rate': 2.9541185029187434e-05, 'weight_decay': 6.46254854826456e-05, 'beta_0': 0.8706445365695373, 'beta_1': 0.9946981364049106, 'epsilon': 8.258729954983441e-07, 'balanced_loss': True, 'epochs': 143, 'early_stopping_patience': 17, 'plateau_patience': 16, 'plateau_divider': 4}. Best is trial 44 with value: 0.9575757575757575.
[I 2025-04-04 12:27:43,737] Trial 251 finished with value: 0.9393939393939394 and parameters: {'left_stride': 32, 'right_stride': 0, 'co_occurrence_pooling_operation': 'sum', 'embedding_pooling_operation': 'mean', 'window_size': 4, 'batch_size': 17, 'attention_heads': 4, 'hidden_dimension': 175, 'number_of_hidden_layers': 4, 'dropout_rate': 0.4800887907476449, 'global_pooling': 'mean', 'learning_rate': 0.00033339799086860335, 'weight_decay': 3.961706301167988e-05, 'beta_0': 0.8275855763226813, 'beta_1': 0.9926454722593978, 'epsilon': 1.7218021991625507e-08, 'balanced_loss': True, 'epochs': 140, 'early_stopping_patience': 16, 'plateau_patience': 15, 'plateau_divider': 10}. Best is trial 44 with value: 0.9575757575757575.
[I 2025-04-04 12:36:35,106] Trial 252 finished with value: 0.9454545454545454 and parameters: {'left_stride': 32, 'right_stride': 128, 'co_occurrence_pooling_operation': 'sum', 'embedding_pooling_operation': 'mean', 'window_size': 4, 'batch_size': 18, 'attention_heads': 4, 'hidden_dimension': 185, 'number_of_hidden_layers': 4, 'dropout_rate': 0.49541695710582545, 'global_pooling': 'sum', 'learning_rate': 7.068546760181964e-05, 'weight_decay': 5.2261592810760834e-05, 'beta_0': 0.8756277487306979, 'beta_1': 0.9940817180113389, 'epsilon': 1.4072345459040815e-08, 'balanced_loss': True, 'epochs': 150, 'early_stopping_patience': 18, 'plateau_patience': 17, 'plateau_divider': 4}. Best is trial 44 with value: 0.9575757575757575.
[I 2025-04-04 12:45:10,093] Trial 253 finished with value: 0.9090909090909091 and parameters: {'left_stride': 32, 'right_stride': 128, 'co_occurrence_pooling_operation': 'sum', 'embedding_pooling_operation': 'mean', 'window_size': 4, 'batch_size': 21, 'attention_heads': 5, 'hidden_dimension': 170, 'number_of_hidden_layers': 4, 'dropout_rate': 0.48449995621177216, 'global_pooling': 'mean', 'learning_rate': 0.0062430408626381355, 'weight_decay': 6.968948609584877e-05, 'beta_0': 0.8741139723322295, 'beta_1': 0.9918254829687093, 'epsilon': 4.208942924747233e-06, 'balanced_loss': True, 'epochs': 116, 'early_stopping_patience': 19, 'plateau_patience': 21, 'plateau_divider': 2}. Best is trial 44 with value: 0.9575757575757575.
CUDA out of memory. Tried to allocate 1.96 GiB. GPU 0 has a total capacity of 44.56 GiB of which 488.69 MiB is free. Including non-PyTorch memory, this process has 44.08 GiB memory in use. Of the allocated memory 41.46 GiB is allocated by PyTorch, and 1.47 GiB is reserved by PyTorch but unallocated. If reserved but unallocated memory is large try setting PYTORCH_CUDA_ALLOC_CONF=expandable_segments:True to avoid fragmentation.  See documentation for Memory Management  (https://pytorch.org/docs/stable/notes/cuda.html#environment-variables)
[I 2025-04-04 12:52:04,438] Trial 254 finished with value: -1.0 and parameters: {'left_stride': 64, 'right_stride': 128, 'co_occurrence_pooling_operation': 'sum', 'embedding_pooling_operation': 'mean', 'window_size': 4, 'batch_size': 49, 'attention_heads': 12, 'hidden_dimension': 244, 'number_of_hidden_layers': 4, 'dropout_rate': 0.4666437178997237, 'global_pooling': 'mean', 'learning_rate': 0.009351260101436413, 'weight_decay': 4.484973581625376e-05, 'beta_0': 0.8719181640774858, 'beta_1': 0.9930923857878707, 'epsilon': 3.955703687330541e-08, 'balanced_loss': True, 'epochs': 137, 'early_stopping_patience': 18, 'plateau_patience': 20, 'plateau_divider': 6}. Best is trial 44 with value: 0.9575757575757575.
[I 2025-04-04 13:00:36,018] Trial 255 finished with value: 0.9575757575757575 and parameters: {'left_stride': 128, 'right_stride': 64, 'co_occurrence_pooling_operation': 'sum', 'embedding_pooling_operation': 'mean', 'window_size': 5, 'batch_size': 16, 'attention_heads': 4, 'hidden_dimension': 164, 'number_of_hidden_layers': 4, 'dropout_rate': 0.5044003090161491, 'global_pooling': 'mean', 'learning_rate': 0.0001693313133375829, 'weight_decay': 5.619960667084653e-05, 'beta_0': 0.8780748346119387, 'beta_1': 0.9934608899903576, 'epsilon': 2.9698381812728088e-08, 'balanced_loss': False, 'epochs': 147, 'early_stopping_patience': 17, 'plateau_patience': 17, 'plateau_divider': 7}. Best is trial 44 with value: 0.9575757575757575.
[I 2025-04-04 13:12:43,232] Trial 256 finished with value: 0.9393939393939394 and parameters: {'left_stride': 32, 'right_stride': 64, 'co_occurrence_pooling_operation': 'sum', 'embedding_pooling_operation': 'mean', 'window_size': 5, 'batch_size': 16, 'attention_heads': 13, 'hidden_dimension': 166, 'number_of_hidden_layers': 4, 'dropout_rate': 0.5050090758097855, 'global_pooling': 'mean', 'learning_rate': 0.00015723024100827802, 'weight_decay': 0.00010483708495628143, 'beta_0': 0.8693774636739264, 'beta_1': 0.9935638808852078, 'epsilon': 3.143854295197752e-08, 'balanced_loss': True, 'epochs': 147, 'early_stopping_patience': 17, 'plateau_patience': 17, 'plateau_divider': 8}. Best is trial 44 with value: 0.9575757575757575.
[I 2025-04-04 13:22:19,845] Trial 257 finished with value: 0.9454545454545454 and parameters: {'left_stride': 128, 'right_stride': 0, 'co_occurrence_pooling_operation': 'sum', 'embedding_pooling_operation': 'mean', 'window_size': 5, 'batch_size': 52, 'attention_heads': 5, 'hidden_dimension': 177, 'number_of_hidden_layers': 4, 'dropout_rate': 0.5012895132973737, 'global_pooling': 'mean', 'learning_rate': 0.002090425918685501, 'weight_decay': 5.820033815467055e-05, 'beta_0': 0.8211182605130338, 'beta_1': 0.992814530262573, 'epsilon': 2.161810879371464e-08, 'balanced_loss': False, 'epochs': 145, 'early_stopping_patience': 17, 'plateau_patience': 18, 'plateau_divider': 7}. Best is trial 44 with value: 0.9575757575757575.
[I 2025-04-04 13:30:54,823] Trial 258 finished with value: 0.9515151515151515 and parameters: {'left_stride': 32, 'right_stride': 128, 'co_occurrence_pooling_operation': 'sum', 'embedding_pooling_operation': 'mean', 'window_size': 5, 'batch_size': 16, 'attention_heads': 4, 'hidden_dimension': 173, 'number_of_hidden_layers': 4, 'dropout_rate': 0.5518042308812046, 'global_pooling': 'mean', 'learning_rate': 0.00018985460465526205, 'weight_decay': 5.225484122127895e-05, 'beta_0': 0.8248366744209384, 'beta_1': 0.99441470489298, 'epsilon': 2.905171229596211e-08, 'balanced_loss': True, 'epochs': 149, 'early_stopping_patience': 18, 'plateau_patience': 17, 'plateau_divider': 7}. Best is trial 44 with value: 0.9575757575757575.
[I 2025-04-04 13:40:10,660] Trial 259 finished with value: 0.9575757575757575 and parameters: {'left_stride': 32, 'right_stride': 64, 'co_occurrence_pooling_operation': 'sum', 'embedding_pooling_operation': 'mean', 'window_size': 5, 'batch_size': 17, 'attention_heads': 5, 'hidden_dimension': 161, 'number_of_hidden_layers': 4, 'dropout_rate': 0.4413261358611076, 'global_pooling': 'mean', 'learning_rate': 0.00010260151645234282, 'weight_decay': 7.24264082316765e-05, 'beta_0': 0.8780889599577698, 'beta_1': 0.9922217440461336, 'epsilon': 2.6842899005835485e-05, 'balanced_loss': True, 'epochs': 153, 'early_stopping_patience': 19, 'plateau_patience': 17, 'plateau_divider': 7}. Best is trial 44 with value: 0.9575757575757575.
[I 2025-04-04 13:49:01,098] Trial 260 finished with value: 0.9515151515151515 and parameters: {'left_stride': 32, 'right_stride': 64, 'co_occurrence_pooling_operation': 'sum', 'embedding_pooling_operation': 'mean', 'window_size': 5, 'batch_size': 17, 'attention_heads': 4, 'hidden_dimension': 162, 'number_of_hidden_layers': 4, 'dropout_rate': 0.5080607187150071, 'global_pooling': 'mean', 'learning_rate': 0.00013050243409702848, 'weight_decay': 7.84532756132684e-05, 'beta_0': 0.8787945691617415, 'beta_1': 0.99400245528077, 'epsilon': 2.7096576828921958e-05, 'balanced_loss': True, 'epochs': 150, 'early_stopping_patience': 19, 'plateau_patience': 16, 'plateau_divider': 6}. Best is trial 44 with value: 0.9575757575757575.
[I 2025-04-04 13:57:35,503] Trial 261 finished with value: 0.9393939393939394 and parameters: {'left_stride': 32, 'right_stride': 64, 'co_occurrence_pooling_operation': 'sum', 'embedding_pooling_operation': 'min', 'window_size': 5, 'batch_size': 17, 'attention_heads': 5, 'hidden_dimension': 154, 'number_of_hidden_layers': 0, 'dropout_rate': 0.491638575875098, 'global_pooling': 'mean', 'learning_rate': 0.00010857173833139403, 'weight_decay': 0.0001258700306874625, 'beta_0': 0.8773096957020777, 'beta_1': 0.9920771347147612, 'epsilon': 4.0125941848396644e-05, 'balanced_loss': True, 'epochs': 159, 'early_stopping_patience': 19, 'plateau_patience': 22, 'plateau_divider': 2}. Best is trial 44 with value: 0.9575757575757575.
