[I 2025-04-04 03:45:35,547] Using an existing study with name 'IMDb-top_1000-GATv2-facebook-bart-large-Grouped-Sliding_Windows' instead of creating a new one.
Token indices sequence length is longer than the specified maximum sequence length for this model (1113 > 1024). Running this sequence through the model will result in indexing errors
[I 2025-04-04 04:00:59,756] Trial 204 finished with value: 0.9212121212121213 and parameters: {'left_stride': 128, 'right_stride': 128, 'co_occurrence_pooling_operation': 'sum', 'embedding_pooling_operation': 'mean', 'window_size': 4, 'batch_size': 19, 'attention_heads': 15, 'hidden_dimension': 185, 'number_of_hidden_layers': 4, 'dropout_rate': 0.5048187489461499, 'global_pooling': 'max', 'learning_rate': 0.0003017525941862149, 'weight_decay': 4.492238060029452e-05, 'beta_0': 0.8662903700776539, 'beta_1': 0.9946381957895956, 'epsilon': 5.986933754628717e-06, 'balanced_loss': True, 'epochs': 131, 'early_stopping_patience': 18, 'plateau_patience': 20, 'plateau_divider': 5}. Best is trial 44 with value: 0.9575757575757575.
[I 2025-04-04 04:12:57,763] Trial 205 finished with value: 0.9454545454545454 and parameters: {'left_stride': 32, 'right_stride': 128, 'co_occurrence_pooling_operation': 'sum', 'embedding_pooling_operation': 'mean', 'window_size': 4, 'batch_size': 18, 'attention_heads': 12, 'hidden_dimension': 213, 'number_of_hidden_layers': 4, 'dropout_rate': 0.4267195023224263, 'global_pooling': 'mean', 'learning_rate': 0.00016903541420300444, 'weight_decay': 5.13161594198782e-05, 'beta_0': 0.8736827929784617, 'beta_1': 0.9931840222697167, 'epsilon': 6.439726683128718e-08, 'balanced_loss': True, 'epochs': 146, 'early_stopping_patience': 15, 'plateau_patience': 16, 'plateau_divider': 4}. Best is trial 44 with value: 0.9575757575757575.
[I 2025-04-04 04:23:09,257] Trial 206 finished with value: 0.9454545454545454 and parameters: {'left_stride': 32, 'right_stride': 64, 'co_occurrence_pooling_operation': 'sum', 'embedding_pooling_operation': 'mean', 'window_size': 6, 'batch_size': 26, 'attention_heads': 4, 'hidden_dimension': 162, 'number_of_hidden_layers': 4, 'dropout_rate': 0.4971666682970395, 'global_pooling': 'mean', 'learning_rate': 5.0009079028984286e-05, 'weight_decay': 5.906429393878188e-05, 'beta_0': 0.870637053127346, 'beta_1': 0.994001975595817, 'epsilon': 1.0883430712334934e-05, 'balanced_loss': True, 'epochs': 137, 'early_stopping_patience': 18, 'plateau_patience': 16, 'plateau_divider': 4}. Best is trial 44 with value: 0.9575757575757575.
[I 2025-04-04 04:30:29,750] Trial 207 finished with value: 0.9454545454545454 and parameters: {'left_stride': 32, 'right_stride': 128, 'co_occurrence_pooling_operation': 'sum', 'embedding_pooling_operation': 'mean', 'window_size': 3, 'batch_size': 20, 'attention_heads': 4, 'hidden_dimension': 174, 'number_of_hidden_layers': 4, 'dropout_rate': 0.537347435368181, 'global_pooling': 'mean', 'learning_rate': 0.00041901240840356814, 'weight_decay': 4.067405388826301e-05, 'beta_0': 0.8798008310258505, 'beta_1': 0.992167116861952, 'epsilon': 1.1618158034022919e-08, 'balanced_loss': True, 'epochs': 149, 'early_stopping_patience': 19, 'plateau_patience': 18, 'plateau_divider': 4}. Best is trial 44 with value: 0.9575757575757575.
[I 2025-04-04 04:40:58,080] Trial 208 finished with value: 0.9393939393939394 and parameters: {'left_stride': 128, 'right_stride': 128, 'co_occurrence_pooling_operation': 'sum', 'embedding_pooling_operation': 'mean', 'window_size': 8, 'batch_size': 36, 'attention_heads': 4, 'hidden_dimension': 158, 'number_of_hidden_layers': 3, 'dropout_rate': 0.47836867699746083, 'global_pooling': 'sum', 'learning_rate': 0.00027008215866598204, 'weight_decay': 0.0005183593618713027, 'beta_0': 0.8745362015550895, 'beta_1': 0.9924935666832432, 'epsilon': 1.1298553788312857e-07, 'balanced_loss': False, 'epochs': 102, 'early_stopping_patience': 15, 'plateau_patience': 15, 'plateau_divider': 2}. Best is trial 44 with value: 0.9575757575757575.
[I 2025-04-04 04:48:45,827] Trial 209 finished with value: 0.9454545454545454 and parameters: {'left_stride': 128, 'right_stride': 128, 'co_occurrence_pooling_operation': 'sum', 'embedding_pooling_operation': 'mean', 'window_size': 4, 'batch_size': 34, 'attention_heads': 4, 'hidden_dimension': 159, 'number_of_hidden_layers': 3, 'dropout_rate': 0.44444837721493463, 'global_pooling': 'sum', 'learning_rate': 0.0003666049655882325, 'weight_decay': 0.00022813509379630424, 'beta_0': 0.8783384388381169, 'beta_1': 0.984381908660112, 'epsilon': 2.4181589757760283e-08, 'balanced_loss': False, 'epochs': 98, 'early_stopping_patience': 15, 'plateau_patience': 15, 'plateau_divider': 10}. Best is trial 44 with value: 0.9575757575757575.
[I 2025-04-04 04:57:11,269] Trial 210 finished with value: 0.9454545454545454 and parameters: {'left_stride': 128, 'right_stride': 128, 'co_occurrence_pooling_operation': 'sum', 'embedding_pooling_operation': 'mean', 'window_size': 4, 'batch_size': 38, 'attention_heads': 5, 'hidden_dimension': 151, 'number_of_hidden_layers': 4, 'dropout_rate': 0.49125151765750297, 'global_pooling': 'sum', 'learning_rate': 0.0006621655541149173, 'weight_decay': 0.0003800457932664986, 'beta_0': 0.8814903550149837, 'beta_1': 0.9933980790823507, 'epsilon': 3.3187417285989546e-08, 'balanced_loss': False, 'epochs': 94, 'early_stopping_patience': 16, 'plateau_patience': 17, 'plateau_divider': 10}. Best is trial 44 with value: 0.9575757575757575.
[I 2025-04-04 05:05:21,295] Trial 211 finished with value: 0.9393939393939394 and parameters: {'left_stride': 128, 'right_stride': 128, 'co_occurrence_pooling_operation': 'sum', 'embedding_pooling_operation': 'mean', 'window_size': 4, 'batch_size': 45, 'attention_heads': 4, 'hidden_dimension': 166, 'number_of_hidden_layers': 3, 'dropout_rate': 0.3665302926891571, 'global_pooling': 'sum', 'learning_rate': 0.00021551151456241844, 'weight_decay': 0.0008501400469568169, 'beta_0': 0.8726520933127531, 'beta_1': 0.9881956209943586, 'epsilon': 3.2589813201711713e-07, 'balanced_loss': False, 'epochs': 142, 'early_stopping_patience': 16, 'plateau_patience': 15, 'plateau_divider': 10}. Best is trial 44 with value: 0.9575757575757575.
[I 2025-04-04 05:13:25,268] Trial 212 finished with value: 0.9454545454545454 and parameters: {'left_stride': 64, 'right_stride': 128, 'co_occurrence_pooling_operation': 'sum', 'embedding_pooling_operation': 'mean', 'window_size': 5, 'batch_size': 18, 'attention_heads': 5, 'hidden_dimension': 70, 'number_of_hidden_layers': 4, 'dropout_rate': 0.4869453274059077, 'global_pooling': 'sum', 'learning_rate': 0.00030929079249679403, 'weight_decay': 0.00031472932229176714, 'beta_0': 0.8762889635562716, 'beta_1': 0.9951411302445898, 'epsilon': 1.2956436129333044e-07, 'balanced_loss': False, 'epochs': 89, 'early_stopping_patience': 17, 'plateau_patience': 22, 'plateau_divider': 10}. Best is trial 44 with value: 0.9575757575757575.
[I 2025-04-04 05:21:35,947] Trial 213 finished with value: 0.9454545454545454 and parameters: {'left_stride': 128, 'right_stride': 128, 'co_occurrence_pooling_operation': 'sum', 'embedding_pooling_operation': 'mean', 'window_size': 4, 'batch_size': 29, 'attention_heads': 4, 'hidden_dimension': 154, 'number_of_hidden_layers': 4, 'dropout_rate': 0.35602445228647284, 'global_pooling': 'mean', 'learning_rate': 0.0001075984171506481, 'weight_decay': 4.9130365206967456e-05, 'beta_0': 0.8695391122559134, 'beta_1': 0.9928781845209015, 'epsilon': 4.457343631137971e-08, 'balanced_loss': True, 'epochs': 134, 'early_stopping_patience': 17, 'plateau_patience': 21, 'plateau_divider': 9}. Best is trial 44 with value: 0.9575757575757575.
[I 2025-04-04 05:30:10,545] Trial 214 finished with value: 0.9393939393939394 and parameters: {'left_stride': 32, 'right_stride': 0, 'co_occurrence_pooling_operation': 'sum', 'embedding_pooling_operation': 'mean', 'window_size': 4, 'batch_size': 23, 'attention_heads': 9, 'hidden_dimension': 114, 'number_of_hidden_layers': 4, 'dropout_rate': 0.503228876777488, 'global_pooling': 'mean', 'learning_rate': 0.00018126809306006313, 'weight_decay': 0.00017509514847246027, 'beta_0': 0.872062322115312, 'beta_1': 0.991238981050991, 'epsilon': 8.708714497362774e-08, 'balanced_loss': True, 'epochs': 83, 'early_stopping_patience': 18, 'plateau_patience': 14, 'plateau_divider': 4}. Best is trial 44 with value: 0.9575757575757575.
[I 2025-04-04 05:38:36,941] Trial 215 finished with value: 0.9454545454545454 and parameters: {'left_stride': 32, 'right_stride': 128, 'co_occurrence_pooling_operation': 'sum', 'embedding_pooling_operation': 'mean', 'window_size': 4, 'batch_size': 41, 'attention_heads': 5, 'hidden_dimension': 169, 'number_of_hidden_layers': 4, 'dropout_rate': 0.39174586600894556, 'global_pooling': 'mean', 'learning_rate': 0.003156732768012908, 'weight_decay': 6.643744036478537e-05, 'beta_0': 0.8795979396503026, 'beta_1': 0.9873326567188158, 'epsilon': 1.667816469370438e-08, 'balanced_loss': True, 'epochs': 106, 'early_stopping_patience': 18, 'plateau_patience': 17, 'plateau_divider': 10}. Best is trial 44 with value: 0.9575757575757575.
[I 2025-04-04 05:47:03,136] Trial 216 finished with value: 0.5333333333333333 and parameters: {'left_stride': 0, 'right_stride': 128, 'co_occurrence_pooling_operation': 'sum', 'embedding_pooling_operation': 'min', 'window_size': 5, 'batch_size': 61, 'attention_heads': 4, 'hidden_dimension': 180, 'number_of_hidden_layers': 4, 'dropout_rate': 0.48329097410189614, 'global_pooling': 'mean', 'learning_rate': 0.030196269585235073, 'weight_decay': 0.0004564900923678215, 'beta_0': 0.8747858687774903, 'beta_1': 0.9917485501382762, 'epsilon': 3.7002176006442035e-05, 'balanced_loss': False, 'epochs': 130, 'early_stopping_patience': 19, 'plateau_patience': 20, 'plateau_divider': 2}. Best is trial 44 with value: 0.9575757575757575.
[I 2025-04-04 05:59:56,305] Trial 217 finished with value: 0.9515151515151515 and parameters: {'left_stride': 32, 'right_stride': 128, 'co_occurrence_pooling_operation': 'sum', 'embedding_pooling_operation': 'mean', 'window_size': 5, 'batch_size': 33, 'attention_heads': 11, 'hidden_dimension': 209, 'number_of_hidden_layers': 2, 'dropout_rate': 0.47417210483312655, 'global_pooling': 'sum', 'learning_rate': 8.238986506379963e-05, 'weight_decay': 3.682103364328304e-05, 'beta_0': 0.8213965224097297, 'beta_1': 0.99410558605155, 'epsilon': 2.2631555806715035e-07, 'balanced_loss': True, 'epochs': 86, 'early_stopping_patience': 17, 'plateau_patience': 16, 'plateau_divider': 6}. Best is trial 44 with value: 0.9575757575757575.
[I 2025-04-04 06:09:11,929] Trial 218 finished with value: 0.9515151515151515 and parameters: {'left_stride': 32, 'right_stride': 128, 'co_occurrence_pooling_operation': 'sum', 'embedding_pooling_operation': 'mean', 'window_size': 4, 'batch_size': 21, 'attention_heads': 6, 'hidden_dimension': 172, 'number_of_hidden_layers': 4, 'dropout_rate': 0.4698607029253748, 'global_pooling': 'mean', 'learning_rate': 6.096169329545199e-05, 'weight_decay': 2.9206303818477864e-05, 'beta_0': 0.8572102671051907, 'beta_1': 0.994779634266806, 'epsilon': 2.9286262674003878e-08, 'balanced_loss': True, 'epochs': 124, 'early_stopping_patience': 18, 'plateau_patience': 16, 'plateau_divider': 4}. Best is trial 44 with value: 0.9575757575757575.
[I 2025-04-04 06:19:23,736] Trial 219 finished with value: 0.9454545454545454 and parameters: {'left_stride': 32, 'right_stride': 128, 'co_occurrence_pooling_operation': 'sum', 'embedding_pooling_operation': 'mean', 'window_size': 4, 'batch_size': 21, 'attention_heads': 5, 'hidden_dimension': 175, 'number_of_hidden_layers': 4, 'dropout_rate': 0.49328025810069637, 'global_pooling': 'mean', 'learning_rate': 1.8857810093952093e-05, 'weight_decay': 3.446633452907796e-05, 'beta_0': 0.8681191052500086, 'beta_1': 0.9936645154473472, 'epsilon': 2.598809741113176e-08, 'balanced_loss': True, 'epochs': 129, 'early_stopping_patience': 16, 'plateau_patience': 16, 'plateau_divider': 4}. Best is trial 44 with value: 0.9575757575757575.
[I 2025-04-04 06:31:56,160] Trial 220 finished with value: 0.9575757575757575 and parameters: {'left_stride': 32, 'right_stride': 128, 'co_occurrence_pooling_operation': 'sum', 'embedding_pooling_operation': 'mean', 'window_size': 7, 'batch_size': 20, 'attention_heads': 5, 'hidden_dimension': 164, 'number_of_hidden_layers': 4, 'dropout_rate': 0.5134718436258361, 'global_pooling': 'mean', 'learning_rate': 2.6856781083213806e-05, 'weight_decay': 4.366339613190767e-05, 'beta_0': 0.8711971527392632, 'beta_1': 0.9944031029773323, 'epsilon': 3.6047858593523074e-08, 'balanced_loss': True, 'epochs': 138, 'early_stopping_patience': 18, 'plateau_patience': 16, 'plateau_divider': 4}. Best is trial 44 with value: 0.9575757575757575.
[I 2025-04-04 06:43:23,696] Trial 221 finished with value: 0.9454545454545454 and parameters: {'left_stride': 32, 'right_stride': 128, 'co_occurrence_pooling_operation': 'sum', 'embedding_pooling_operation': 'mean', 'window_size': 7, 'batch_size': 19, 'attention_heads': 5, 'hidden_dimension': 162, 'number_of_hidden_layers': 4, 'dropout_rate': 0.5148997806998756, 'global_pooling': 'mean', 'learning_rate': 2.8219371574922763e-05, 'weight_decay': 4.4871580061532516e-05, 'beta_0': 0.8720051596252921, 'beta_1': 0.9944193470886891, 'epsilon': 5.3791205789789426e-08, 'balanced_loss': True, 'epochs': 139, 'early_stopping_patience': 18, 'plateau_patience': 17, 'plateau_divider': 4}. Best is trial 44 with value: 0.9575757575757575.
[I 2025-04-04 06:54:32,875] Trial 222 finished with value: 0.9515151515151515 and parameters: {'left_stride': 32, 'right_stride': 128, 'co_occurrence_pooling_operation': 'sum', 'embedding_pooling_operation': 'mean', 'window_size': 7, 'batch_size': 17, 'attention_heads': 5, 'hidden_dimension': 156, 'number_of_hidden_layers': 4, 'dropout_rate': 0.5081956251189548, 'global_pooling': 'mean', 'learning_rate': 3.983829776135481e-05, 'weight_decay': 5.613221263134826e-05, 'beta_0': 0.870788833770114, 'beta_1': 0.9923473346451633, 'epsilon': 4.096117270765847e-08, 'balanced_loss': True, 'epochs': 137, 'early_stopping_patience': 18, 'plateau_patience': 14, 'plateau_divider': 4}. Best is trial 44 with value: 0.9575757575757575.
[I 2025-04-04 07:08:46,730] Trial 223 finished with value: 0.9575757575757575 and parameters: {'left_stride': 32, 'right_stride': 128, 'co_occurrence_pooling_operation': 'sum', 'embedding_pooling_operation': 'mean', 'window_size': 7, 'batch_size': 20, 'attention_heads': 4, 'hidden_dimension': 167, 'number_of_hidden_layers': 4, 'dropout_rate': 0.5251608810554562, 'global_pooling': 'mean', 'learning_rate': 2.509949145241228e-05, 'weight_decay': 4.995249105478138e-05, 'beta_0': 0.8240851894974873, 'beta_1': 0.9892909762565096, 'epsilon': 9.544357644424635e-05, 'balanced_loss': True, 'epochs': 134, 'early_stopping_patience': 19, 'plateau_patience': 24, 'plateau_divider': 4}. Best is trial 44 with value: 0.9575757575757575.
[I 2025-04-04 07:22:13,618] Trial 224 finished with value: 0.9515151515151515 and parameters: {'left_stride': 32, 'right_stride': 256, 'co_occurrence_pooling_operation': 'sum', 'embedding_pooling_operation': 'mean', 'window_size': 8, 'batch_size': 20, 'attention_heads': 4, 'hidden_dimension': 178, 'number_of_hidden_layers': 4, 'dropout_rate': 0.5260746787456725, 'global_pooling': 'mean', 'learning_rate': 2.4353871734807944e-05, 'weight_decay': 4.8681082908836e-05, 'beta_0': 0.8690840589776635, 'beta_1': 0.992929916378768, 'epsilon': 2.0875416991478347e-05, 'balanced_loss': True, 'epochs': 133, 'early_stopping_patience': 19, 'plateau_patience': 24, 'plateau_divider': 4}. Best is trial 44 with value: 0.9575757575757575.
[I 2025-04-04 07:32:56,138] Trial 225 finished with value: 0.9515151515151515 and parameters: {'left_stride': 32, 'right_stride': 128, 'co_occurrence_pooling_operation': 'sum', 'embedding_pooling_operation': 'mean', 'window_size': 6, 'batch_size': 20, 'attention_heads': 5, 'hidden_dimension': 103, 'number_of_hidden_layers': 4, 'dropout_rate': 0.5197417762878007, 'global_pooling': 'mean', 'learning_rate': 4.540997569139708e-05, 'weight_decay': 4.208600920130405e-05, 'beta_0': 0.8228929386433408, 'beta_1': 0.9931881195081089, 'epsilon': 9.317354117592007e-05, 'balanced_loss': True, 'epochs': 142, 'early_stopping_patience': 19, 'plateau_patience': 17, 'plateau_divider': 4}. Best is trial 44 with value: 0.9575757575757575.
[I 2025-04-04 07:58:51,037] Trial 226 finished with value: 0.9454545454545454 and parameters: {'left_stride': 32, 'right_stride': 64, 'co_occurrence_pooling_operation': 'sum', 'embedding_pooling_operation': 'max', 'window_size': 5, 'batch_size': 18, 'attention_heads': 10, 'hidden_dimension': 166, 'number_of_hidden_layers': 4, 'dropout_rate': 0.5325481027405486, 'global_pooling': 'mean', 'learning_rate': 1.6133913994388003e-05, 'weight_decay': 5.503452194330943e-05, 'beta_0': 0.828207948569686, 'beta_1': 0.9938313350746496, 'epsilon': 7.851339876205954e-05, 'balanced_loss': True, 'epochs': 136, 'early_stopping_patience': 19, 'plateau_patience': 25, 'plateau_divider': 4}. Best is trial 44 with value: 0.9575757575757575.
[I 2025-04-04 08:18:56,480] Trial 227 finished with value: 0.9515151515151515 and parameters: {'left_stride': 32, 'right_stride': 128, 'co_occurrence_pooling_operation': 'sum', 'embedding_pooling_operation': 'mean', 'window_size': 7, 'batch_size': 22, 'attention_heads': 6, 'hidden_dimension': 233, 'number_of_hidden_layers': 4, 'dropout_rate': 0.5168340930465563, 'global_pooling': 'mean', 'learning_rate': 2.1817009819673847e-05, 'weight_decay': 7.342928660125934e-05, 'beta_0': 0.8742137840524001, 'beta_1': 0.9922370006809381, 'epsilon': 4.98533975368082e-05, 'balanced_loss': True, 'epochs': 138, 'early_stopping_patience': 18, 'plateau_patience': 23, 'plateau_divider': 4}. Best is trial 44 with value: 0.9575757575757575.
[I 2025-04-04 08:29:49,527] Trial 228 finished with value: 0.9454545454545454 and parameters: {'left_stride': 32, 'right_stride': 128, 'co_occurrence_pooling_operation': 'sum', 'embedding_pooling_operation': 'mean', 'window_size': 7, 'batch_size': 19, 'attention_heads': 4, 'hidden_dimension': 170, 'number_of_hidden_layers': 4, 'dropout_rate': 0.49959755483638907, 'global_pooling': 'mean', 'learning_rate': 2.6935788062648367e-05, 'weight_decay': 2.3702482053330278e-05, 'beta_0': 0.818023356706971, 'beta_1': 0.998251946555263, 'epsilon': 3.46443311533943e-08, 'balanced_loss': True, 'epochs': 140, 'early_stopping_patience': 18, 'plateau_patience': 15, 'plateau_divider': 4}. Best is trial 44 with value: 0.9575757575757575.
[I 2025-04-04 08:40:43,001] Trial 229 finished with value: 0.9151515151515152 and parameters: {'left_stride': 32, 'right_stride': 128, 'co_occurrence_pooling_operation': 'sum', 'embedding_pooling_operation': 'mean', 'window_size': 7, 'batch_size': 18, 'attention_heads': 4, 'hidden_dimension': 187, 'number_of_hidden_layers': 4, 'dropout_rate': 0.5107264099444154, 'global_pooling': 'max', 'learning_rate': 3.531610405718411e-05, 'weight_decay': 4.729974486469447e-05, 'beta_0': 0.8770713386312476, 'beta_1': 0.9891280116195379, 'epsilon': 1.873911955366742e-08, 'balanced_loss': True, 'epochs': 92, 'early_stopping_patience': 14, 'plateau_patience': 25, 'plateau_divider': 2}. Best is trial 44 with value: 0.9575757575757575.
[I 2025-04-04 08:50:09,109] Trial 230 finished with value: 0.9454545454545454 and parameters: {'left_stride': 32, 'right_stride': 128, 'co_occurrence_pooling_operation': 'sum', 'embedding_pooling_operation': 'mean', 'window_size': 7, 'batch_size': 17, 'attention_heads': 4, 'hidden_dimension': 146, 'number_of_hidden_layers': 4, 'dropout_rate': 0.5241255795993156, 'global_pooling': 'mean', 'learning_rate': 0.00026636080220686207, 'weight_decay': 6.448581406307277e-05, 'beta_0': 0.8256207531257, 'beta_1': 0.9926991591727661, 'epsilon': 1.3555724097433851e-08, 'balanced_loss': True, 'epochs': 144, 'early_stopping_patience': 17, 'plateau_patience': 24, 'plateau_divider': 4}. Best is trial 44 with value: 0.9575757575757575.
[I 2025-04-04 08:57:20,563] Trial 231 finished with value: 0.9454545454545454 and parameters: {'left_stride': 128, 'right_stride': 128, 'co_occurrence_pooling_operation': 'sum', 'embedding_pooling_operation': 'mean', 'window_size': 2, 'batch_size': 16, 'attention_heads': 5, 'hidden_dimension': 161, 'number_of_hidden_layers': 4, 'dropout_rate': 0.5052484707460735, 'global_pooling': 'mean', 'learning_rate': 0.00014380301761924926, 'weight_decay': 5.530618212266241e-05, 'beta_0': 0.8731960825513212, 'beta_1': 0.989301708732196, 'epsilon': 6.448096722578648e-05, 'balanced_loss': True, 'epochs': 134, 'early_stopping_patience': 18, 'plateau_patience': 19, 'plateau_divider': 5}. Best is trial 44 with value: 0.9575757575757575.
[I 2025-04-04 09:05:07,767] Trial 232 finished with value: 0.9515151515151515 and parameters: {'left_stride': 32, 'right_stride': 128, 'co_occurrence_pooling_operation': 'sum', 'embedding_pooling_operation': 'mean', 'window_size': 4, 'batch_size': 19, 'attention_heads': 4, 'hidden_dimension': 135, 'number_of_hidden_layers': 4, 'dropout_rate': 0.4997815956510601, 'global_pooling': 'mean', 'learning_rate': 0.0002344431917392992, 'weight_decay': 1.855799378521822e-05, 'beta_0': 0.8707633209873965, 'beta_1': 0.9905430595416087, 'epsilon': 1.5039259700132204e-06, 'balanced_loss': True, 'epochs': 133, 'early_stopping_patience': 18, 'plateau_patience': 16, 'plateau_divider': 4}. Best is trial 44 with value: 0.9575757575757575.
