[I 2025-04-04 14:07:17,060] Trial 262 finished with value: 0.9454545454545454 and parameters: {'left_stride': 32, 'right_stride': 64, 'co_occurrence_pooling_operation': 'sum', 'embedding_pooling_operation': 'mean', 'window_size': 5, 'batch_size': 16, 'attention_heads': 4, 'hidden_dimension': 160, 'number_of_hidden_layers': 4, 'dropout_rate': 0.4368753792194293, 'global_pooling': 'mean', 'learning_rate': 4.228499953133626e-05, 'weight_decay': 8.656409163287523e-05, 'beta_0': 0.8018477902038778, 'beta_1': 0.9866275524874885, 'epsilon': 3.248435424676261e-05, 'balanced_loss': True, 'epochs': 153, 'early_stopping_patience': 19, 'plateau_patience': 17, 'plateau_divider': 7}. Best is trial 44 with value: 0.9575757575757575.
[I 2025-04-04 14:18:31,108] Trial 263 finished with value: 0.9454545454545454 and parameters: {'left_stride': 0, 'right_stride': 64, 'co_occurrence_pooling_operation': 'sum', 'embedding_pooling_operation': 'max', 'window_size': 5, 'batch_size': 18, 'attention_heads': 8, 'hidden_dimension': 219, 'number_of_hidden_layers': 4, 'dropout_rate': 0.4411612844166291, 'global_pooling': 'mean', 'learning_rate': 0.0008874452456916757, 'weight_decay': 6.913272407079342e-05, 'beta_0': 0.8318143323334216, 'beta_1': 0.9935183268024781, 'epsilon': 4.2000684054782404e-08, 'balanced_loss': True, 'epochs': 143, 'early_stopping_patience': 20, 'plateau_patience': 19, 'plateau_divider': 7}. Best is trial 44 with value: 0.9575757575757575.
[I 2025-04-04 14:28:53,882] Trial 264 finished with value: 0.9454545454545454 and parameters: {'left_stride': 32, 'right_stride': 64, 'co_occurrence_pooling_operation': 'sum', 'embedding_pooling_operation': 'mean', 'window_size': 7, 'batch_size': 17, 'attention_heads': 5, 'hidden_dimension': 251, 'number_of_hidden_layers': 2, 'dropout_rate': 0.4476370317477387, 'global_pooling': 'mean', 'learning_rate': 0.00016939134733791206, 'weight_decay': 6.354039142325109e-05, 'beta_0': 0.883045531052116, 'beta_1': 0.9923697798865351, 'epsilon': 4.918248511435157e-05, 'balanced_loss': True, 'epochs': 146, 'early_stopping_patience': 19, 'plateau_patience': 16, 'plateau_divider': 8}. Best is trial 44 with value: 0.9575757575757575.
[I 2025-04-04 14:39:37,380] Trial 265 finished with value: 0.5454545454545454 and parameters: {'left_stride': 128, 'right_stride': 64, 'co_occurrence_pooling_operation': 'sum', 'embedding_pooling_operation': 'mean', 'window_size': 5, 'batch_size': 18, 'attention_heads': 11, 'hidden_dimension': 168, 'number_of_hidden_layers': 4, 'dropout_rate': 0.38025458114127675, 'global_pooling': 'mean', 'learning_rate': 0.05828886954108726, 'weight_decay': 9.459074677615525e-05, 'beta_0': 0.8744155120586444, 'beta_1': 0.9953152331182884, 'epsilon': 7.152428805516889e-06, 'balanced_loss': False, 'epochs': 155, 'early_stopping_patience': 18, 'plateau_patience': 17, 'plateau_divider': 3}. Best is trial 44 with value: 0.9575757575757575.

[TRIAL] 223 [VALIDATION PERFORMANCE] 0.9575757575757575 [TRAINING LOSS] 0.08161651939153672 [VALIDATION LOSS] 0.13741154038709485 

number                                         223
value                                     0.957576
params_window_size                               7
params_attention_heads                           4
params_balanced_loss                          True
params_embedding_pooling_operation            mean
params_co_occurrence_pooling_operation         sum
params_batch_size                               20
params_dropout_rate                       0.525161
params_early_stopping_patience                  19
params_epochs                                  134
params_global_pooling                         mean
params_hidden_dimension                        167
params_learning_rate                      0.000025
params_number_of_hidden_layers                   4
params_plateau_divider                           4
params_plateau_patience                         24
params_weight_decay                        0.00005
params_beta_0                             0.824085
params_beta_1                             0.989291
params_epsilon                            0.000095
user_attrs_epoch                              57.0
user_attrs_training_loss                  0.081617
user_attrs_validation_loss                0.137412
params_left_stride                              32
params_right_stride                            128
Name: 223, dtype: object
37 Val: 0.9515151515151515 Test: 0.9522388059701492
38 Val: 0.9515151515151515 Test: 0.9492537313432836
39 Val: 0.9454545454545454 Test: 0.9402985074626866
40 Val: 0.9515151515151515 Test: 0.9373134328358209
41 Val: 0.9575757575757575 Test: 0.9402985074626866
42 Val: 0.9575757575757575 Test: 0.9432835820895522
43 Val: 0.9515151515151515 Test: 0.9402985074626866
44 Val: 0.9515151515151515 Test: 0.9522388059701492
45 Val: 0.9515151515151515 Test: 0.9492537313432836
46 Val: 0.9454545454545454 Test: 0.9402985074626866
Validation performance: 94.55 & 95.15 ± 0.4 & 95.76
Testing performance: 93.73 & 94.45 ± 0.57 & 95.22

[TRIAL] 53 [VALIDATION PERFORMANCE] 0.9575757575757575 [TRAINING LOSS] 0.06839628924249805 [VALIDATION LOSS] 0.15263391241896898 

number                                          53
value                                     0.957576
params_window_size                               4
params_attention_heads                           4
params_balanced_loss                          True
params_embedding_pooling_operation            mean
params_co_occurrence_pooling_operation         sum
params_batch_size                               18
params_dropout_rate                       0.519448
params_early_stopping_patience                  18
params_epochs                                  138
params_global_pooling                         mean
params_hidden_dimension                        184
params_learning_rate                      0.000046
params_number_of_hidden_layers                   4
params_plateau_divider                           5
params_plateau_patience                         16
params_weight_decay                       0.000053
params_beta_0                             0.874979
params_beta_1                             0.992559
params_epsilon                                 0.0
user_attrs_epoch                              20.0
user_attrs_training_loss                  0.068396
user_attrs_validation_loss                0.152634
params_left_stride                              32
params_right_stride                            128
Name: 53, dtype: object
Parent directory /checkpoint/pimentel/15605175 does not exist.
37 Exception...
Parent directory /checkpoint/pimentel/15605175 does not exist.
38 Exception...
Parent directory /checkpoint/pimentel/15605175 does not exist.
39 Exception...
Parent directory /checkpoint/pimentel/15605175 does not exist.
40 Exception...
Parent directory /checkpoint/pimentel/15605175 does not exist.
41 Exception...
Parent directory /checkpoint/pimentel/15605175 does not exist.
42 Exception...
Parent directory /checkpoint/pimentel/15605175 does not exist.
43 Exception...
Parent directory /checkpoint/pimentel/15605175 does not exist.
44 Exception...
Parent directory /checkpoint/pimentel/15605175 does not exist.
45 Exception...
Parent directory /checkpoint/pimentel/15605175 does not exist.
46 Exception...
Traceback (most recent call last):
  File "/fs01/home/pimentel/DynamicCOO/src/sliding_windows/main.py", line 664, in <module>
    round(min(validation_performances) * 100, 2), '&',
ValueError: min() arg is an empty sequence
