Some weights of RobertaModel were not initialized from the model checkpoint at FacebookAI/roberta-large and are newly initialized: ['roberta.pooler.dense.bias', 'roberta.pooler.dense.weight']
You should probably TRAIN this model on a down-stream task to be able to use it for predictions and inference.
[I 2024-12-20 05:55:35,842] Using an existing study with name 'SST-2-GATv2-FacebookAI-roberta-large-Surrogate-No_Aggregation' instead of creating a new one.
[I 2024-12-20 06:07:23,064] Trial 163 finished with value: 0.930045871559633 and parameters: {'attention_pooling_operation': 'mean', 'embedding_pooling_operation': 'max', 'threshold': 0.4976678207775401, 'batch_size': 200, 'attention_heads': 7, 'hidden_dimension': 234, 'number_of_hidden_layers': 4, 'dropout_rate': 0.40582773555077833, 'global_pooling': 'sum', 'learning_rate': 0.001470819911005853, 'weight_decay': 0.000529577280258491, 'beta_0': 0.8848702916643932, 'beta_1': 0.9875159039572005, 'epsilon': 2.262931574445324e-08, 'balanced_loss': False, 'epochs': 156, 'early_stopping_patience': 19, 'plateau_patience': 12, 'plateau_divider': 8}. Best is trial 130 with value: 0.9369266055045872.
[I 2024-12-20 06:14:30,519] Trial 164 finished with value: 0.926605504587156 and parameters: {'attention_pooling_operation': 'mean', 'embedding_pooling_operation': 'max', 'threshold': 0.47677398911301955, 'batch_size': 211, 'attention_heads': 6, 'hidden_dimension': 108, 'number_of_hidden_layers': 4, 'dropout_rate': 0.39421670675478027, 'global_pooling': 'sum', 'learning_rate': 0.0010968795464364343, 'weight_decay': 0.0004441275059526398, 'beta_0': 0.88828662802181, 'beta_1': 0.9871476552913326, 'epsilon': 3.4390887588050334e-08, 'balanced_loss': False, 'epochs': 143, 'early_stopping_patience': 18, 'plateau_patience': 13, 'plateau_divider': 8}. Best is trial 130 with value: 0.9369266055045872.
[I 2024-12-20 06:22:57,135] Trial 165 finished with value: 0.930045871559633 and parameters: {'attention_pooling_operation': 'mean', 'embedding_pooling_operation': 'max', 'threshold': 0.5160204082805158, 'batch_size': 179, 'attention_heads': 5, 'hidden_dimension': 249, 'number_of_hidden_layers': 4, 'dropout_rate': 0.38074544749949346, 'global_pooling': 'sum', 'learning_rate': 0.0007758170820469974, 'weight_decay': 0.0006603872963419588, 'beta_0': 0.8829725274444777, 'beta_1': 0.9866327471685103, 'epsilon': 6.427589049021983e-08, 'balanced_loss': False, 'epochs': 151, 'early_stopping_patience': 18, 'plateau_patience': 11, 'plateau_divider': 8}. Best is trial 130 with value: 0.9369266055045872.
[I 2024-12-20 06:29:22,973] Trial 166 finished with value: 0.9243119266055045 and parameters: {'attention_pooling_operation': 'mean', 'embedding_pooling_operation': 'max', 'threshold': 0.5552425465731321, 'batch_size': 193, 'attention_heads': 6, 'hidden_dimension': 122, 'number_of_hidden_layers': 4, 'dropout_rate': 0.4121650471073535, 'global_pooling': 'sum', 'learning_rate': 0.001247417557789645, 'weight_decay': 0.0005910719043375837, 'beta_0': 0.8755878672614563, 'beta_1': 0.9884683145077273, 'epsilon': 1.201299177969457e-08, 'balanced_loss': False, 'epochs': 165, 'early_stopping_patience': 17, 'plateau_patience': 12, 'plateau_divider': 8}. Best is trial 130 with value: 0.9369266055045872.
[I 2024-12-20 06:39:49,586] Trial 167 finished with value: 0.9357798165137615 and parameters: {'attention_pooling_operation': 'mean', 'embedding_pooling_operation': 'max', 'threshold': 0.49000568475605777, 'batch_size': 215, 'attention_heads': 7, 'hidden_dimension': 242, 'number_of_hidden_layers': 4, 'dropout_rate': 0.3985474476464194, 'global_pooling': 'sum', 'learning_rate': 0.001855612890166133, 'weight_decay': 0.0004835116738853893, 'beta_0': 0.8865753191659935, 'beta_1': 0.9878607542570602, 'epsilon': 8.618074103299726e-08, 'balanced_loss': False, 'epochs': 158, 'early_stopping_patience': 18, 'plateau_patience': 14, 'plateau_divider': 8}. Best is trial 130 with value: 0.9369266055045872.
[I 2024-12-20 06:52:19,162] Trial 168 finished with value: 0.9311926605504587 and parameters: {'attention_pooling_operation': 'mean', 'embedding_pooling_operation': 'max', 'threshold': 0.5024176240040127, 'batch_size': 207, 'attention_heads': 7, 'hidden_dimension': 240, 'number_of_hidden_layers': 4, 'dropout_rate': 0.42802959160247356, 'global_pooling': 'sum', 'learning_rate': 0.0031187419839663, 'weight_decay': 0.0003785401987206017, 'beta_0': 0.8668800663551993, 'beta_1': 0.9878594956819741, 'epsilon': 4.992656388399615e-08, 'balanced_loss': False, 'epochs': 159, 'early_stopping_patience': 17, 'plateau_patience': 14, 'plateau_divider': 8}. Best is trial 130 with value: 0.9369266055045872.
[I 2024-12-20 06:59:15,786] Trial 169 finished with value: 0.9208715596330275 and parameters: {'attention_pooling_operation': 'mean', 'embedding_pooling_operation': 'max', 'threshold': 0.9337088926959929, 'batch_size': 218, 'attention_heads': 7, 'hidden_dimension': 223, 'number_of_hidden_layers': 4, 'dropout_rate': 0.3873782701321556, 'global_pooling': 'sum', 'learning_rate': 0.0018969739056285705, 'weight_decay': 0.0007078480503552846, 'beta_0': 0.869423437951819, 'beta_1': 0.9887886806205398, 'epsilon': 8.827931609315184e-08, 'balanced_loss': False, 'epochs': 153, 'early_stopping_patience': 19, 'plateau_patience': 14, 'plateau_divider': 7}. Best is trial 130 with value: 0.9369266055045872.
[I 2024-12-20 07:08:21,215] Trial 170 finished with value: 0.9346330275229358 and parameters: {'attention_pooling_operation': 'mean', 'embedding_pooling_operation': 'max', 'threshold': 0.5358646698322669, 'batch_size': 213, 'attention_heads': 5, 'hidden_dimension': 243, 'number_of_hidden_layers': 4, 'dropout_rate': 0.42160308697524995, 'global_pooling': 'sum', 'learning_rate': 0.000945386168703047, 'weight_decay': 0.0009151643119911092, 'beta_0': 0.8859687336112391, 'beta_1': 0.9881675974844331, 'epsilon': 1.0888546548233909e-07, 'balanced_loss': False, 'epochs': 158, 'early_stopping_patience': 18, 'plateau_patience': 13, 'plateau_divider': 9}. Best is trial 130 with value: 0.9369266055045872.
[I 2024-12-20 07:14:15,243] Trial 171 finished with value: 0.9311926605504587 and parameters: {'attention_pooling_operation': 'mean', 'embedding_pooling_operation': 'max', 'threshold': 0.5425788652106922, 'batch_size': 216, 'attention_heads': 5, 'hidden_dimension': 45, 'number_of_hidden_layers': 4, 'dropout_rate': 0.4157525322860329, 'global_pooling': 'sum', 'learning_rate': 0.0009380289615459321, 'weight_decay': 0.000992406055159353, 'beta_0': 0.8859841658627212, 'beta_1': 0.9883156261502591, 'epsilon': 1.2465369762681194e-07, 'balanced_loss': False, 'epochs': 159, 'early_stopping_patience': 16, 'plateau_patience': 14, 'plateau_divider': 9}. Best is trial 130 with value: 0.9369266055045872.
[I 2024-12-20 07:21:38,031] Trial 172 finished with value: 0.9220183486238532 and parameters: {'attention_pooling_operation': 'min', 'embedding_pooling_operation': 'max', 'threshold': 0.5200818273055118, 'batch_size': 225, 'attention_heads': 5, 'hidden_dimension': 232, 'number_of_hidden_layers': 2, 'dropout_rate': 0.42042747673802755, 'global_pooling': 'sum', 'learning_rate': 0.0021476005680107157, 'weight_decay': 0.000818522215080933, 'beta_0': 0.8806969190877573, 'beta_1': 0.9892264853181487, 'epsilon': 1.7672995143328896e-07, 'balanced_loss': False, 'epochs': 163, 'early_stopping_patience': 19, 'plateau_patience': 13, 'plateau_divider': 9}. Best is trial 130 with value: 0.9369266055045872.
[I 2024-12-20 07:29:45,592] Trial 173 finished with value: 0.9334862385321101 and parameters: {'attention_pooling_operation': 'mean', 'embedding_pooling_operation': 'max', 'threshold': 0.5296957784050785, 'batch_size': 204, 'attention_heads': 4, 'hidden_dimension': 242, 'number_of_hidden_layers': 4, 'dropout_rate': 0.405980093763826, 'global_pooling': 'sum', 'learning_rate': 0.0010363214065175672, 'weight_decay': 0.0005827447000131032, 'beta_0': 0.8835662079928731, 'beta_1': 0.9881124161761169, 'epsilon': 9.937920269329375e-08, 'balanced_loss': False, 'epochs': 158, 'early_stopping_patience': 18, 'plateau_patience': 13, 'plateau_divider': 8}. Best is trial 130 with value: 0.9369266055045872.
[I 2024-12-20 07:38:58,000] Trial 174 finished with value: 0.9311926605504587 and parameters: {'attention_pooling_operation': 'mean', 'embedding_pooling_operation': 'max', 'threshold': 0.49092959248948004, 'batch_size': 212, 'attention_heads': 5, 'hidden_dimension': 251, 'number_of_hidden_layers': 4, 'dropout_rate': 0.3964728456764964, 'global_pooling': 'sum', 'learning_rate': 0.0007957995215370786, 'weight_decay': 0.000890130026668092, 'beta_0': 0.87830804679086, 'beta_1': 0.9886666448345559, 'epsilon': 7.272255286169655e-08, 'balanced_loss': False, 'epochs': 168, 'early_stopping_patience': 17, 'plateau_patience': 13, 'plateau_divider': 8}. Best is trial 130 with value: 0.9369266055045872.
[I 2024-12-20 07:49:58,014] Trial 175 finished with value: 0.9311926605504587 and parameters: {'attention_pooling_operation': 'mean', 'embedding_pooling_operation': 'max', 'threshold': 0.5020119263908743, 'batch_size': 229, 'attention_heads': 6, 'hidden_dimension': 247, 'number_of_hidden_layers': 4, 'dropout_rate': 0.4230137300926625, 'global_pooling': 'sum', 'learning_rate': 0.0013041744122164222, 'weight_decay': 0.0007485391217779106, 'beta_0': 0.8819044359078212, 'beta_1': 0.9879562980182566, 'epsilon': 1.5679932764818643e-07, 'balanced_loss': False, 'epochs': 155, 'early_stopping_patience': 18, 'plateau_patience': 14, 'plateau_divider': 8}. Best is trial 130 with value: 0.9369266055045872.
[I 2024-12-20 07:56:39,251] Trial 176 finished with value: 0.9254587155963303 and parameters: {'attention_pooling_operation': 'mean', 'embedding_pooling_operation': 'max', 'threshold': 0.5397943920933602, 'batch_size': 216, 'attention_heads': 7, 'hidden_dimension': 94, 'number_of_hidden_layers': 4, 'dropout_rate': 0.40618263081884487, 'global_pooling': 'sum', 'learning_rate': 0.0016127778279525174, 'weight_decay': 0.0005163719324318176, 'beta_0': 0.894316847575183, 'beta_1': 0.9877606205426227, 'epsilon': 1.143171487856588e-07, 'balanced_loss': False, 'epochs': 147, 'early_stopping_patience': 18, 'plateau_patience': 13, 'plateau_divider': 9}. Best is trial 130 with value: 0.9369266055045872.
[I 2024-12-20 08:04:51,967] Trial 177 finished with value: 0.9311926605504587 and parameters: {'attention_pooling_operation': 'mean', 'embedding_pooling_operation': 'max', 'threshold': 0.46179895835858875, 'batch_size': 204, 'attention_heads': 4, 'hidden_dimension': 244, 'number_of_hidden_layers': 4, 'dropout_rate': 0.3991935027863878, 'global_pooling': 'sum', 'learning_rate': 0.0011627004832190345, 'weight_decay': 0.0006795397193420518, 'beta_0': 0.8855947671477271, 'beta_1': 0.989616528753493, 'epsilon': 4.95637523719405e-08, 'balanced_loss': False, 'epochs': 175, 'early_stopping_patience': 17, 'plateau_patience': 14, 'plateau_divider': 8}. Best is trial 130 with value: 0.9369266055045872.
[I 2024-12-20 08:14:18,880] Trial 178 finished with value: 0.9346330275229358 and parameters: {'attention_pooling_operation': 'mean', 'embedding_pooling_operation': 'max', 'threshold': 0.5572206349603227, 'batch_size': 238, 'attention_heads': 5, 'hidden_dimension': 251, 'number_of_hidden_layers': 4, 'dropout_rate': 0.39217124487606647, 'global_pooling': 'sum', 'learning_rate': 0.0007155120159222438, 'weight_decay': 0.0008651171693268236, 'beta_0': 0.8767484951554602, 'beta_1': 0.9890229252242443, 'epsilon': 4.328080647060665e-08, 'balanced_loss': False, 'epochs': 144, 'early_stopping_patience': 18, 'plateau_patience': 13, 'plateau_divider': 9}. Best is trial 130 with value: 0.9369266055045872.
[I 2024-12-20 08:23:11,681] Trial 179 finished with value: 0.9288990825688074 and parameters: {'attention_pooling_operation': 'mean', 'embedding_pooling_operation': 'max', 'threshold': 0.5617020950672245, 'batch_size': 235, 'attention_heads': 5, 'hidden_dimension': 237, 'number_of_hidden_layers': 4, 'dropout_rate': 0.3905222100140904, 'global_pooling': 'sum', 'learning_rate': 0.0006792297455236736, 'weight_decay': 0.0008832593079383984, 'beta_0': 0.8732316969452992, 'beta_1': 0.9888983129528945, 'epsilon': 6.206813763013284e-08, 'balanced_loss': False, 'epochs': 144, 'early_stopping_patience': 19, 'plateau_patience': 13, 'plateau_divider': 9}. Best is trial 130 with value: 0.9369266055045872.
[I 2024-12-20 08:31:21,339] Trial 180 finished with value: 0.9231651376146789 and parameters: {'attention_pooling_operation': 'mean', 'embedding_pooling_operation': 'max', 'threshold': 0.5915538421745851, 'batch_size': 239, 'attention_heads': 5, 'hidden_dimension': 229, 'number_of_hidden_layers': 4, 'dropout_rate': 0.3570854045055187, 'global_pooling': 'sum', 'learning_rate': 0.0007082638205041837, 'weight_decay': 0.0009958643851306235, 'beta_0': 0.8778227390181198, 'beta_1': 0.9892274046278692, 'epsilon': 5.324476758925626e-07, 'balanced_loss': False, 'epochs': 140, 'early_stopping_patience': 17, 'plateau_patience': 12, 'plateau_divider': 9}. Best is trial 130 with value: 0.9369266055045872.
[I 2024-12-20 08:40:11,249] Trial 181 finished with value: 0.9288990825688074 and parameters: {'attention_pooling_operation': 'mean', 'embedding_pooling_operation': 'max', 'threshold': 0.553808093482496, 'batch_size': 241, 'attention_heads': 5, 'hidden_dimension': 137, 'number_of_hidden_layers': 4, 'dropout_rate': 0.5091888168015606, 'global_pooling': 'sum', 'learning_rate': 0.0005509358096013076, 'weight_decay': 0.0007751379200873412, 'beta_0': 0.8755466484493415, 'beta_1': 0.9904457012161647, 'epsilon': 8.094670437347202e-08, 'balanced_loss': False, 'epochs': 136, 'early_stopping_patience': 18, 'plateau_patience': 14, 'plateau_divider': 9}. Best is trial 130 with value: 0.9369266055045872.
[I 2024-12-20 08:47:52,577] Trial 182 finished with value: 0.9311926605504587 and parameters: {'attention_pooling_operation': 'mean', 'embedding_pooling_operation': 'max', 'threshold': 0.5326476900143672, 'batch_size': 225, 'attention_heads': 4, 'hidden_dimension': 251, 'number_of_hidden_layers': 4, 'dropout_rate': 0.38009861427826835, 'global_pooling': 'sum', 'learning_rate': 0.0008521758152772082, 'weight_decay': 0.0006176813692012299, 'beta_0': 0.8803162324006067, 'beta_1': 0.9884945308085787, 'epsilon': 1.2857103721144777e-07, 'balanced_loss': False, 'epochs': 148, 'early_stopping_patience': 18, 'plateau_patience': 13, 'plateau_divider': 9}. Best is trial 130 with value: 0.9369266055045872.
[I 2024-12-20 08:57:40,744] Trial 183 finished with value: 0.9346330275229358 and parameters: {'attention_pooling_operation': 'mean', 'embedding_pooling_operation': 'max', 'threshold': 0.5133411318420792, 'batch_size': 196, 'attention_heads': 6, 'hidden_dimension': 247, 'number_of_hidden_layers': 4, 'dropout_rate': 0.4098138972301068, 'global_pooling': 'sum', 'learning_rate': 0.000984296172601949, 'weight_decay': 0.0004310653291785957, 'beta_0': 0.8837862283469502, 'beta_1': 0.9876073692006682, 'epsilon': 4.220822136021112e-08, 'balanced_loss': False, 'epochs': 163, 'early_stopping_patience': 18, 'plateau_patience': 13, 'plateau_divider': 8}. Best is trial 130 with value: 0.9369266055045872.
[I 2024-12-20 09:07:30,781] Trial 184 finished with value: 0.930045871559633 and parameters: {'attention_pooling_operation': 'mean', 'embedding_pooling_operation': 'max', 'threshold': 0.5132576002135913, 'batch_size': 209, 'attention_heads': 6, 'hidden_dimension': 242, 'number_of_hidden_layers': 4, 'dropout_rate': 0.4100907779724277, 'global_pooling': 'sum', 'learning_rate': 0.001022063576845107, 'weight_decay': 0.0005138038479761401, 'beta_0': 0.8906451384855079, 'beta_1': 0.9875014128910911, 'epsilon': 3.410111549286884e-08, 'balanced_loss': False, 'epochs': 154, 'early_stopping_patience': 18, 'plateau_patience': 13, 'plateau_divider': 8}. Best is trial 130 with value: 0.9369266055045872.
[I 2024-12-20 09:17:56,100] Trial 185 finished with value: 0.9426605504587156 and parameters: {'attention_pooling_operation': 'mean', 'embedding_pooling_operation': 'max', 'threshold': 0.5470445961552275, 'batch_size': 231, 'attention_heads': 6, 'hidden_dimension': 247, 'number_of_hidden_layers': 4, 'dropout_rate': 0.42853929651449907, 'global_pooling': 'sum', 'learning_rate': 0.0014658809805294703, 'weight_decay': 0.0007113251274615779, 'beta_0': 0.8798764712626398, 'beta_1': 0.9883179343147823, 'epsilon': 2.786828588914535e-08, 'balanced_loss': False, 'epochs': 162, 'early_stopping_patience': 15, 'plateau_patience': 11, 'plateau_divider': 8}. Best is trial 185 with value: 0.9426605504587156.
[I 2024-12-20 09:26:51,792] Trial 186 finished with value: 0.9254587155963303 and parameters: {'attention_pooling_operation': 'mean', 'embedding_pooling_operation': 'max', 'threshold': 0.5484658367118732, 'batch_size': 231, 'attention_heads': 5, 'hidden_dimension': 236, 'number_of_hidden_layers': 4, 'dropout_rate': 0.438663293090669, 'global_pooling': 'sum', 'learning_rate': 0.000941625826205328, 'weight_decay': 0.0008238479312801184, 'beta_0': 0.8867007395013495, 'beta_1': 0.9882505775322155, 'epsilon': 2.8621795932672432e-08, 'balanced_loss': False, 'epochs': 162, 'early_stopping_patience': 15, 'plateau_patience': 11, 'plateau_divider': 10}. Best is trial 185 with value: 0.9426605504587156.
[I 2024-12-20 09:37:41,446] Trial 187 finished with value: 0.9323394495412844 and parameters: {'attention_pooling_operation': 'mean', 'embedding_pooling_operation': 'max', 'threshold': 0.5666488858254369, 'batch_size': 200, 'attention_heads': 7, 'hidden_dimension': 246, 'number_of_hidden_layers': 4, 'dropout_rate': 0.42810307140031345, 'global_pooling': 'sum', 'learning_rate': 0.0013333533703038425, 'weight_decay': 0.0007451929283412886, 'beta_0': 0.8817163400362968, 'beta_1': 0.9869015448436659, 'epsilon': 2.2331302526201858e-08, 'balanced_loss': False, 'epochs': 168, 'early_stopping_patience': 15, 'plateau_patience': 11, 'plateau_divider': 8}. Best is trial 185 with value: 0.9426605504587156.
[I 2024-12-20 09:46:39,283] Trial 188 finished with value: 0.9311926605504587 and parameters: {'attention_pooling_operation': 'mean', 'embedding_pooling_operation': 'max', 'threshold': 0.5815428809496715, 'batch_size': 244, 'attention_heads': 6, 'hidden_dimension': 241, 'number_of_hidden_layers': 4, 'dropout_rate': 0.4179435250560133, 'global_pooling': 'sum', 'learning_rate': 0.0008070781887293363, 'weight_decay': 0.0006569811182254373, 'beta_0': 0.8843878048151501, 'beta_1': 0.9886984845228589, 'epsilon': 3.786392612355237e-08, 'balanced_loss': False, 'epochs': 160, 'early_stopping_patience': 14, 'plateau_patience': 13, 'plateau_divider': 8}. Best is trial 185 with value: 0.9426605504587156.
[I 2024-12-20 09:54:55,971] Trial 189 finished with value: 0.9369266055045872 and parameters: {'attention_pooling_operation': 'mean', 'embedding_pooling_operation': 'max', 'threshold': 0.5417863325151385, 'batch_size': 235, 'attention_heads': 5, 'hidden_dimension': 249, 'number_of_hidden_layers': 2, 'dropout_rate': 0.4564451156883859, 'global_pooling': 'sum', 'learning_rate': 0.001895461018098464, 'weight_decay': 0.0008933903804145271, 'beta_0': 0.8795027031029676, 'beta_1': 0.9880877558538419, 'epsilon': 4.3795812150263126e-08, 'balanced_loss': False, 'epochs': 163, 'early_stopping_patience': 18, 'plateau_patience': 14, 'plateau_divider': 8}. Best is trial 185 with value: 0.9426605504587156.
[I 2024-12-20 10:01:43,860] Trial 190 finished with value: 0.926605504587156 and parameters: {'attention_pooling_operation': 'mean', 'embedding_pooling_operation': 'max', 'threshold': 0.6023614053515687, 'batch_size': 234, 'attention_heads': 5, 'hidden_dimension': 250, 'number_of_hidden_layers': 2, 'dropout_rate': 0.3721134927898392, 'global_pooling': 'sum', 'learning_rate': 0.002601823606310855, 'weight_decay': 0.0006089589730076053, 'beta_0': 0.8795113506609379, 'beta_1': 0.9883442366140747, 'epsilon': 4.422838493494699e-08, 'balanced_loss': False, 'epochs': 164, 'early_stopping_patience': 18, 'plateau_patience': 10, 'plateau_divider': 9}. Best is trial 185 with value: 0.9426605504587156.
[I 2024-12-20 10:11:34,589] Trial 191 finished with value: 0.9392201834862385 and parameters: {'attention_pooling_operation': 'mean', 'embedding_pooling_operation': 'max', 'threshold': 0.5441325857165912, 'batch_size': 238, 'attention_heads': 8, 'hidden_dimension': 246, 'number_of_hidden_layers': 2, 'dropout_rate': 0.4646702608088124, 'global_pooling': 'sum', 'learning_rate': 0.0017863046638494854, 'weight_decay': 0.0007238038583640126, 'beta_0': 0.8776603091202142, 'beta_1': 0.9873744127249384, 'epsilon': 2.5808667685159984e-08, 'balanced_loss': False, 'epochs': 157, 'early_stopping_patience': 19, 'plateau_patience': 14, 'plateau_divider': 7}. Best is trial 185 with value: 0.9426605504587156.
[I 2024-12-20 10:20:37,756] Trial 192 finished with value: 0.9323394495412844 and parameters: {'attention_pooling_operation': 'mean', 'embedding_pooling_operation': 'max', 'threshold': 0.5458887388353448, 'batch_size': 252, 'attention_heads': 8, 'hidden_dimension': 246, 'number_of_hidden_layers': 2, 'dropout_rate': 0.4443502127531867, 'global_pooling': 'sum', 'learning_rate': 0.0019196149487232868, 'weight_decay': 0.0005543416389292889, 'beta_0': 0.877000540260566, 'beta_1': 0.9873380818130143, 'epsilon': 2.6448258823789833e-08, 'balanced_loss': False, 'epochs': 158, 'early_stopping_patience': 19, 'plateau_patience': 14, 'plateau_divider': 7}. Best is trial 185 with value: 0.9426605504587156.
