[I 2024-12-20 14:45:53,103] Trial 224 finished with value: 0.9346330275229358 and parameters: {'attention_pooling_operation': 'mean', 'embedding_pooling_operation': 'max', 'threshold': 0.5369593671735448, 'batch_size': 184, 'attention_heads': 4, 'hidden_dimension': 243, 'number_of_hidden_layers': 4, 'dropout_rate': 0.44180239736273774, 'global_pooling': 'sum', 'learning_rate': 0.0007653052724442408, 'weight_decay': 0.0006000291100211353, 'beta_0': 0.8815182058508354, 'beta_1': 0.9892335979602198, 'epsilon': 3.208399736677063e-08, 'balanced_loss': False, 'epochs': 166, 'early_stopping_patience': 18, 'plateau_patience': 13, 'plateau_divider': 8}. Best is trial 185 with value: 0.9426605504587156.
[I 2024-12-20 14:53:49,616] Trial 225 finished with value: 0.9277522935779816 and parameters: {'attention_pooling_operation': 'mean', 'embedding_pooling_operation': 'max', 'threshold': 0.4904529216253045, 'batch_size': 190, 'attention_heads': 4, 'hidden_dimension': 251, 'number_of_hidden_layers': 4, 'dropout_rate': 0.4141449509432652, 'global_pooling': 'sum', 'learning_rate': 0.0012029349873718862, 'weight_decay': 0.0006506152126512268, 'beta_0': 0.8790939747122787, 'beta_1': 0.9884898985055983, 'epsilon': 3.876255966275486e-08, 'balanced_loss': False, 'epochs': 158, 'early_stopping_patience': 18, 'plateau_patience': 13, 'plateau_divider': 8}. Best is trial 185 with value: 0.9426605504587156.
[I 2024-12-20 15:04:07,634] Trial 226 finished with value: 0.9311926605504587 and parameters: {'attention_pooling_operation': 'mean', 'embedding_pooling_operation': 'max', 'threshold': 0.5066232896504987, 'batch_size': 233, 'attention_heads': 6, 'hidden_dimension': 238, 'number_of_hidden_layers': 4, 'dropout_rate': 0.4248417884784346, 'global_pooling': 'sum', 'learning_rate': 0.0007507166310709411, 'weight_decay': 0.0008168085028296927, 'beta_0': 0.8848805037348143, 'beta_1': 0.987772997347091, 'epsilon': 1.7561027677544596e-08, 'balanced_loss': False, 'epochs': 163, 'early_stopping_patience': 18, 'plateau_patience': 14, 'plateau_divider': 8}. Best is trial 185 with value: 0.9426605504587156.
[I 2024-12-20 15:14:46,618] Trial 227 finished with value: 0.930045871559633 and parameters: {'attention_pooling_operation': 'mean', 'embedding_pooling_operation': 'max', 'threshold': 0.5252650562995624, 'batch_size': 223, 'attention_heads': 6, 'hidden_dimension': 248, 'number_of_hidden_layers': 4, 'dropout_rate': 0.3876190832396734, 'global_pooling': 'sum', 'learning_rate': 0.0014456624377385662, 'weight_decay': 0.0005339865330929107, 'beta_0': 0.8759016418791298, 'beta_1': 0.9872943367652226, 'epsilon': 6.398858593838893e-08, 'balanced_loss': False, 'epochs': 156, 'early_stopping_patience': 19, 'plateau_patience': 12, 'plateau_divider': 8}. Best is trial 185 with value: 0.9426605504587156.
[I 2024-12-20 15:27:15,949] Trial 228 finished with value: 0.9323394495412844 and parameters: {'attention_pooling_operation': 'mean', 'embedding_pooling_operation': 'max', 'threshold': 0.5487702867047969, 'batch_size': 214, 'attention_heads': 7, 'hidden_dimension': 256, 'number_of_hidden_layers': 4, 'dropout_rate': 0.3945807808056912, 'global_pooling': 'sum', 'learning_rate': 0.0017669381753298626, 'weight_decay': 0.0007476170907474744, 'beta_0': 0.8819979726701223, 'beta_1': 0.9888004903658887, 'epsilon': 4.983002892336054e-08, 'balanced_loss': False, 'epochs': 164, 'early_stopping_patience': 18, 'plateau_patience': 13, 'plateau_divider': 8}. Best is trial 185 with value: 0.9426605504587156.
[I 2024-12-20 15:37:56,723] Trial 229 finished with value: 0.9323394495412844 and parameters: {'attention_pooling_operation': 'mean', 'embedding_pooling_operation': 'max', 'threshold': 0.4809525779146988, 'batch_size': 237, 'attention_heads': 5, 'hidden_dimension': 244, 'number_of_hidden_layers': 4, 'dropout_rate': 0.4295008590360943, 'global_pooling': 'sum', 'learning_rate': 0.0008571557144617417, 'weight_decay': 0.0004522828727865312, 'beta_0': 0.8863444568290116, 'beta_1': 0.9901449528330661, 'epsilon': 2.721872138541991e-08, 'balanced_loss': False, 'epochs': 160, 'early_stopping_patience': 18, 'plateau_patience': 14, 'plateau_divider': 8}. Best is trial 185 with value: 0.9426605504587156.
[I 2024-12-20 15:46:27,499] Trial 230 finished with value: 0.926605504587156 and parameters: {'attention_pooling_operation': 'mean', 'embedding_pooling_operation': 'max', 'threshold': 0.5004375522193444, 'batch_size': 227, 'attention_heads': 4, 'hidden_dimension': 251, 'number_of_hidden_layers': 2, 'dropout_rate': 0.527450736112571, 'global_pooling': 'sum', 'learning_rate': 0.0005826422403457954, 'weight_decay': 0.0006528591636295597, 'beta_0': 0.872543082089495, 'beta_1': 0.9883058725656533, 'epsilon': 7.52843808745987e-08, 'balanced_loss': False, 'epochs': 155, 'early_stopping_patience': 14, 'plateau_patience': 13, 'plateau_divider': 8}. Best is trial 185 with value: 0.9426605504587156.
[I 2024-12-20 15:57:04,426] Trial 231 finished with value: 0.9380733944954128 and parameters: {'attention_pooling_operation': 'mean', 'embedding_pooling_operation': 'max', 'threshold': 0.5153782925806076, 'batch_size': 201, 'attention_heads': 6, 'hidden_dimension': 247, 'number_of_hidden_layers': 4, 'dropout_rate': 0.41236625379520336, 'global_pooling': 'sum', 'learning_rate': 0.001291883450099932, 'weight_decay': 0.0003518989588285794, 'beta_0': 0.8790362642363618, 'beta_1': 0.9880348543237074, 'epsilon': 3.6510732422840484e-08, 'balanced_loss': False, 'epochs': 168, 'early_stopping_patience': 19, 'plateau_patience': 11, 'plateau_divider': 8}. Best is trial 185 with value: 0.9426605504587156.
[I 2024-12-20 16:07:06,595] Trial 232 finished with value: 0.9254587155963303 and parameters: {'attention_pooling_operation': 'mean', 'embedding_pooling_operation': 'max', 'threshold': 0.527857001840711, 'batch_size': 234, 'attention_heads': 7, 'hidden_dimension': 238, 'number_of_hidden_layers': 4, 'dropout_rate': 0.40199119202383393, 'global_pooling': 'sum', 'learning_rate': 0.002315332263424852, 'weight_decay': 0.00032780543241462496, 'beta_0': 0.8791889712368852, 'beta_1': 0.9890592390323778, 'epsilon': 2.3313204916403858e-08, 'balanced_loss': False, 'epochs': 166, 'early_stopping_patience': 19, 'plateau_patience': 11, 'plateau_divider': 8}. Best is trial 185 with value: 0.9426605504587156.
[I 2024-12-20 16:16:30,026] Trial 233 finished with value: 0.9288990825688074 and parameters: {'attention_pooling_operation': 'mean', 'embedding_pooling_operation': 'max', 'threshold': 0.5120657408953844, 'batch_size': 199, 'attention_heads': 6, 'hidden_dimension': 246, 'number_of_hidden_layers': 4, 'dropout_rate': 0.41133114224592704, 'global_pooling': 'sum', 'learning_rate': 0.001167904747171817, 'weight_decay': 0.00040637624843435974, 'beta_0': 0.8775394146601687, 'beta_1': 0.9878276382245318, 'epsilon': 3.777258620338198e-08, 'balanced_loss': False, 'epochs': 162, 'early_stopping_patience': 19, 'plateau_patience': 11, 'plateau_divider': 8}. Best is trial 185 with value: 0.9426605504587156.
[I 2024-12-20 16:26:28,698] Trial 234 finished with value: 0.9380733944954128 and parameters: {'attention_pooling_operation': 'mean', 'embedding_pooling_operation': 'max', 'threshold': 0.5390575195917032, 'batch_size': 203, 'attention_heads': 6, 'hidden_dimension': 252, 'number_of_hidden_layers': 4, 'dropout_rate': 0.4165119578736484, 'global_pooling': 'sum', 'learning_rate': 0.0013600767867045526, 'weight_decay': 0.0003760650556426643, 'beta_0': 0.8814013826050774, 'beta_1': 0.9882547280902462, 'epsilon': 3.526340915999733e-08, 'balanced_loss': False, 'epochs': 168, 'early_stopping_patience': 18, 'plateau_patience': 10, 'plateau_divider': 8}. Best is trial 185 with value: 0.9426605504587156.
[I 2024-12-20 16:36:49,799] Trial 235 finished with value: 0.9254587155963303 and parameters: {'attention_pooling_operation': 'mean', 'embedding_pooling_operation': 'max', 'threshold': 0.5403322303730301, 'batch_size': 210, 'attention_heads': 6, 'hidden_dimension': 252, 'number_of_hidden_layers': 4, 'dropout_rate': 0.41994014000011864, 'global_pooling': 'sum', 'learning_rate': 0.001341878268102429, 'weight_decay': 0.00034060904724567473, 'beta_0': 0.8818399386178642, 'beta_1': 0.9882595790738844, 'epsilon': 3.178955917291926e-08, 'balanced_loss': False, 'epochs': 169, 'early_stopping_patience': 20, 'plateau_patience': 10, 'plateau_divider': 8}. Best is trial 185 with value: 0.9426605504587156.
[I 2024-12-20 16:44:13,262] Trial 236 finished with value: 0.926605504587156 and parameters: {'attention_pooling_operation': 'mean', 'embedding_pooling_operation': 'max', 'threshold': 0.8406173134890713, 'batch_size': 207, 'attention_heads': 5, 'hidden_dimension': 256, 'number_of_hidden_layers': 4, 'dropout_rate': 0.3966572002441397, 'global_pooling': 'sum', 'learning_rate': 0.001761659711435239, 'weight_decay': 0.0005461685369400976, 'beta_0': 0.8754103760012237, 'beta_1': 0.9885548605944674, 'epsilon': 2.9260484174726602e-08, 'balanced_loss': False, 'epochs': 166, 'early_stopping_patience': 18, 'plateau_patience': 11, 'plateau_divider': 8}. Best is trial 185 with value: 0.9426605504587156.
[I 2024-12-20 16:54:27,998] Trial 237 finished with value: 0.9208715596330275 and parameters: {'attention_pooling_operation': 'mean', 'embedding_pooling_operation': 'max', 'threshold': 0.555269605314556, 'batch_size': 201, 'attention_heads': 6, 'hidden_dimension': 242, 'number_of_hidden_layers': 4, 'dropout_rate': 0.43304272914847697, 'global_pooling': 'sum', 'learning_rate': 0.001399278067330552, 'weight_decay': 0.0008626083931318245, 'beta_0': 0.8805856001011986, 'beta_1': 0.988162283333089, 'epsilon': 5.270746959115695e-08, 'balanced_loss': False, 'epochs': 172, 'early_stopping_patience': 19, 'plateau_patience': 10, 'plateau_divider': 8}. Best is trial 185 with value: 0.9426605504587156.
[I 2024-12-20 17:06:40,165] Trial 238 finished with value: 0.9254587155963303 and parameters: {'attention_pooling_operation': 'mean', 'embedding_pooling_operation': 'max', 'threshold': 0.5463386792097025, 'batch_size': 216, 'attention_heads': 7, 'hidden_dimension': 251, 'number_of_hidden_layers': 4, 'dropout_rate': 0.4250890092296658, 'global_pooling': 'sum', 'learning_rate': 0.0019211924311517354, 'weight_decay': 0.00038036926686263423, 'beta_0': 0.8784607037684835, 'beta_1': 0.9894457838300331, 'epsilon': 3.568131686868402e-08, 'balanced_loss': False, 'epochs': 158, 'early_stopping_patience': 18, 'plateau_patience': 10, 'plateau_divider': 8}. Best is trial 185 with value: 0.9426605504587156.
[I 2024-12-20 17:17:06,314] Trial 239 finished with value: 0.9334862385321101 and parameters: {'attention_pooling_operation': 'mean', 'embedding_pooling_operation': 'max', 'threshold': 0.5336880174190667, 'batch_size': 204, 'attention_heads': 6, 'hidden_dimension': 249, 'number_of_hidden_layers': 4, 'dropout_rate': 0.41323073993931525, 'global_pooling': 'sum', 'learning_rate': 0.001506193423677524, 'weight_decay': 0.0007633106891313105, 'beta_0': 0.882914781491526, 'beta_1': 0.988802643100757, 'epsilon': 1.4762305746745776e-08, 'balanced_loss': False, 'epochs': 173, 'early_stopping_patience': 19, 'plateau_patience': 10, 'plateau_divider': 8}. Best is trial 185 with value: 0.9426605504587156.
[I 2024-12-20 17:24:43,383] Trial 240 finished with value: 0.9346330275229358 and parameters: {'attention_pooling_operation': 'mean', 'embedding_pooling_operation': 'max', 'threshold': 0.4468494526301268, 'batch_size': 239, 'attention_heads': 5, 'hidden_dimension': 245, 'number_of_hidden_layers': 2, 'dropout_rate': 0.40521610304614136, 'global_pooling': 'sum', 'learning_rate': 0.001170853797122501, 'weight_decay': 0.0004963753141897137, 'beta_0': 0.8850807492275286, 'beta_1': 0.9873114940780119, 'epsilon': 2.046378166418176e-08, 'balanced_loss': False, 'epochs': 151, 'early_stopping_patience': 18, 'plateau_patience': 12, 'plateau_divider': 8}. Best is trial 185 with value: 0.9426605504587156.
[I 2024-12-20 17:38:08,351] Trial 241 finished with value: 0.9311926605504587 and parameters: {'attention_pooling_operation': 'mean', 'embedding_pooling_operation': 'max', 'threshold': 0.5191163930536014, 'batch_size': 192, 'attention_heads': 8, 'hidden_dimension': 252, 'number_of_hidden_layers': 4, 'dropout_rate': 0.38875645859885394, 'global_pooling': 'sum', 'learning_rate': 0.0010759891499258307, 'weight_decay': 0.0006319110438609131, 'beta_0': 0.8801610612938553, 'beta_1': 0.9880088319285997, 'epsilon': 4.634422263105871e-08, 'balanced_loss': False, 'epochs': 160, 'early_stopping_patience': 17, 'plateau_patience': 11, 'plateau_divider': 8}. Best is trial 185 with value: 0.9426605504587156.
[I 2024-12-20 17:46:48,775] Trial 242 finished with value: 0.926605504587156 and parameters: {'attention_pooling_operation': 'mean', 'embedding_pooling_operation': 'mean', 'threshold': 0.5645751497403748, 'batch_size': 230, 'attention_heads': 5, 'hidden_dimension': 235, 'number_of_hidden_layers': 4, 'dropout_rate': 0.376759598073706, 'global_pooling': 'sum', 'learning_rate': 0.001653394590672655, 'weight_decay': 0.0008842687912830367, 'beta_0': 0.8708933025924566, 'beta_1': 0.9891297255392597, 'epsilon': 8.680392287076123e-08, 'balanced_loss': False, 'epochs': 155, 'early_stopping_patience': 18, 'plateau_patience': 15, 'plateau_divider': 7}. Best is trial 185 with value: 0.9426605504587156.
slurmstepd: error: *** JOB 14126166 ON gpu043 CANCELLED AT 2024-12-20T17:55:41 DUE TO TIME LIMIT ***
