[I 2024-11-28 11:45:08,711] Trial 62 finished with value: 0.9013761467889908 and parameters: {'attention_pooling_operation': 'max', 'embedding_pooling_operation': 'mean', 'threshold': 0.4571273988720294, 'batch_size': 246, 'attention_heads': 13, 'hidden_dimension': 179, 'number_of_hidden_layers': 2, 'dropout_rate': 0.35713999300579685, 'global_pooling': 'max', 'learning_rate': 0.0015107143951700493, 'weight_decay': 3.0426310356640787e-05, 'beta_0': 0.8665495225351195, 'beta_1': 0.99083493111268, 'epsilon': 5.667376168163346e-07, 'balanced_loss': False, 'epochs': 115, 'early_stopping_patience': 14, 'plateau_patience': 16, 'plateau_divider': 8}. Best is trial 46 with value: 0.9071100917431193.
[I 2024-11-28 11:53:05,078] Trial 63 finished with value: 0.8910550458715596 and parameters: {'attention_pooling_operation': 'max', 'embedding_pooling_operation': 'mean', 'threshold': 0.4532193447034673, 'batch_size': 247, 'attention_heads': 15, 'hidden_dimension': 155, 'number_of_hidden_layers': 2, 'dropout_rate': 0.5792819587223381, 'global_pooling': 'max', 'learning_rate': 7.919688471589002e-05, 'weight_decay': 3.9551362796303316e-05, 'beta_0': 0.8857494891152051, 'beta_1': 0.9923322486326249, 'epsilon': 2.7674036637934395e-07, 'balanced_loss': False, 'epochs': 116, 'early_stopping_patience': 11, 'plateau_patience': 16, 'plateau_divider': 8}. Best is trial 46 with value: 0.9071100917431193.
[I 2024-11-28 11:58:25,110] Trial 64 finished with value: 0.9048165137614679 and parameters: {'attention_pooling_operation': 'max', 'embedding_pooling_operation': 'mean', 'threshold': 0.4857615588892972, 'batch_size': 233, 'attention_heads': 14, 'hidden_dimension': 166, 'number_of_hidden_layers': 2, 'dropout_rate': 0.31843197430770176, 'global_pooling': 'max', 'learning_rate': 0.0015387908033296328, 'weight_decay': 3.080735639854049e-05, 'beta_0': 0.8566801399969509, 'beta_1': 0.9905840370145221, 'epsilon': 5.72144251587591e-07, 'balanced_loss': False, 'epochs': 115, 'early_stopping_patience': 18, 'plateau_patience': 17, 'plateau_divider': 9}. Best is trial 46 with value: 0.9071100917431193.
[I 2024-11-28 12:03:00,108] Trial 65 finished with value: 0.8956422018348624 and parameters: {'attention_pooling_operation': 'max', 'embedding_pooling_operation': 'mean', 'threshold': 0.5750213352989361, 'batch_size': 233, 'attention_heads': 11, 'hidden_dimension': 165, 'number_of_hidden_layers': 2, 'dropout_rate': 0.31596684662446856, 'global_pooling': 'max', 'learning_rate': 0.0014048255337960169, 'weight_decay': 5.175252015713038e-05, 'beta_0': 0.8575102954045667, 'beta_1': 0.9900566823424387, 'epsilon': 5.537036734909175e-07, 'balanced_loss': False, 'epochs': 114, 'early_stopping_patience': 18, 'plateau_patience': 17, 'plateau_divider': 9}. Best is trial 46 with value: 0.9071100917431193.
[I 2024-11-28 12:08:48,999] Trial 66 finished with value: 0.8922018348623854 and parameters: {'attention_pooling_operation': 'max', 'embedding_pooling_operation': 'mean', 'threshold': 0.48550945222734476, 'batch_size': 244, 'attention_heads': 14, 'hidden_dimension': 181, 'number_of_hidden_layers': 2, 'dropout_rate': 0.46244905457200436, 'global_pooling': 'max', 'learning_rate': 0.001673759182833474, 'weight_decay': 3.133685598416912e-05, 'beta_0': 0.8610656172541103, 'beta_1': 0.9907155008330777, 'epsilon': 8.941351938069135e-07, 'balanced_loss': False, 'epochs': 107, 'early_stopping_patience': 19, 'plateau_patience': 16, 'plateau_divider': 5}. Best is trial 46 with value: 0.9071100917431193.
[I 2024-11-28 12:14:00,877] Trial 67 finished with value: 0.9002293577981652 and parameters: {'attention_pooling_operation': 'max', 'embedding_pooling_operation': 'mean', 'threshold': 0.5398339092177968, 'batch_size': 218, 'attention_heads': 14, 'hidden_dimension': 136, 'number_of_hidden_layers': 3, 'dropout_rate': 0.333043693412083, 'global_pooling': 'max', 'learning_rate': 0.0009482488410348999, 'weight_decay': 1.3590196932870138e-05, 'beta_0': 0.8509837382984347, 'beta_1': 0.9917114454779138, 'epsilon': 1.4657573053382875e-07, 'balanced_loss': False, 'epochs': 124, 'early_stopping_patience': 18, 'plateau_patience': 14, 'plateau_divider': 9}. Best is trial 46 with value: 0.9071100917431193.
[I 2024-11-28 12:18:15,130] Trial 68 finished with value: 0.8956422018348624 and parameters: {'attention_pooling_operation': 'mean', 'embedding_pooling_operation': 'min', 'threshold': 0.4574074890177767, 'batch_size': 99, 'attention_heads': 12, 'hidden_dimension': 117, 'number_of_hidden_layers': 2, 'dropout_rate': 0.3236314740820574, 'global_pooling': 'max', 'learning_rate': 0.003891507237139411, 'weight_decay': 0.00014839003847127812, 'beta_0': 0.8546993362688802, 'beta_1': 0.9889806797387554, 'epsilon': 5.440545537207599e-07, 'balanced_loss': False, 'epochs': 92, 'early_stopping_patience': 14, 'plateau_patience': 18, 'plateau_divider': 10}. Best is trial 46 with value: 0.9071100917431193.
[I 2024-11-28 12:23:19,265] Trial 69 finished with value: 0.9036697247706422 and parameters: {'attention_pooling_operation': 'max', 'embedding_pooling_operation': 'mean', 'threshold': 0.4186034006998564, 'batch_size': 225, 'attention_heads': 13, 'hidden_dimension': 150, 'number_of_hidden_layers': 2, 'dropout_rate': 0.35874694707457905, 'global_pooling': 'max', 'learning_rate': 0.002200340248556819, 'weight_decay': 1.848157246233534e-05, 'beta_0': 0.8725342727579419, 'beta_1': 0.9927874333788194, 'epsilon': 2.0513208728791135e-06, 'balanced_loss': False, 'epochs': 98, 'early_stopping_patience': 20, 'plateau_patience': 19, 'plateau_divider': 6}. Best is trial 46 with value: 0.9071100917431193.
[I 2024-11-28 12:28:36,722] Trial 70 finished with value: 0.893348623853211 and parameters: {'attention_pooling_operation': 'max', 'embedding_pooling_operation': 'mean', 'threshold': 0.4264475769760564, 'batch_size': 228, 'attention_heads': 10, 'hidden_dimension': 148, 'number_of_hidden_layers': 3, 'dropout_rate': 0.38378808740869436, 'global_pooling': 'max', 'learning_rate': 0.002307812621183202, 'weight_decay': 6.306339606313882e-06, 'beta_0': 0.8719281558259259, 'beta_1': 0.9953779939091384, 'epsilon': 1.7338922535304546e-06, 'balanced_loss': False, 'epochs': 87, 'early_stopping_patience': 21, 'plateau_patience': 19, 'plateau_divider': 6}. Best is trial 46 with value: 0.9071100917431193.
[I 2024-11-28 12:33:58,367] Trial 71 finished with value: 0.8979357798165137 and parameters: {'attention_pooling_operation': 'max', 'embedding_pooling_operation': 'mean', 'threshold': 0.4849588888371243, 'batch_size': 225, 'attention_heads': 13, 'hidden_dimension': 167, 'number_of_hidden_layers': 2, 'dropout_rate': 0.35991265481882284, 'global_pooling': 'max', 'learning_rate': 0.0012624924205270126, 'weight_decay': 3.06610040618627e-05, 'beta_0': 0.8783913299603121, 'beta_1': 0.992723666822601, 'epsilon': 1.0911376902163347e-06, 'balanced_loss': False, 'epochs': 100, 'early_stopping_patience': 20, 'plateau_patience': 20, 'plateau_divider': 5}. Best is trial 46 with value: 0.9071100917431193.
[I 2024-11-28 12:39:30,204] Trial 72 finished with value: 0.8990825688073395 and parameters: {'attention_pooling_operation': 'max', 'embedding_pooling_operation': 'mean', 'threshold': 0.43949030429935204, 'batch_size': 239, 'attention_heads': 13, 'hidden_dimension': 148, 'number_of_hidden_layers': 2, 'dropout_rate': 0.34473391771886075, 'global_pooling': 'max', 'learning_rate': 0.0033693156200429518, 'weight_decay': 1.761054834302555e-05, 'beta_0': 0.8636503976367207, 'beta_1': 0.9912885963732442, 'epsilon': 2.3640419564428207e-06, 'balanced_loss': False, 'epochs': 111, 'early_stopping_patience': 22, 'plateau_patience': 17, 'plateau_divider': 6}. Best is trial 46 with value: 0.9071100917431193.
[I 2024-11-28 12:44:40,082] Trial 73 finished with value: 0.908256880733945 and parameters: {'attention_pooling_operation': 'max', 'embedding_pooling_operation': 'mean', 'threshold': 0.411077003160766, 'batch_size': 213, 'attention_heads': 12, 'hidden_dimension': 176, 'number_of_hidden_layers': 2, 'dropout_rate': 0.33375762103254514, 'global_pooling': 'max', 'learning_rate': 0.0008792406387811108, 'weight_decay': 7.482469408453885e-05, 'beta_0': 0.8438875612230895, 'beta_1': 0.9906766642738268, 'epsilon': 3.646141732558087e-07, 'balanced_loss': False, 'epochs': 118, 'early_stopping_patience': 17, 'plateau_patience': 16, 'plateau_divider': 6}. Best is trial 73 with value: 0.908256880733945.
[I 2024-11-28 12:50:01,608] Trial 74 finished with value: 0.8956422018348624 and parameters: {'attention_pooling_operation': 'max', 'embedding_pooling_operation': 'mean', 'threshold': 0.4136604346580434, 'batch_size': 202, 'attention_heads': 12, 'hidden_dimension': 195, 'number_of_hidden_layers': 2, 'dropout_rate': 0.3338739474904727, 'global_pooling': 'max', 'learning_rate': 0.007085946286195698, 'weight_decay': 6.772369936449519e-05, 'beta_0': 0.842698401808932, 'beta_1': 0.9941304524435922, 'epsilon': 2.4340706183310424e-07, 'balanced_loss': False, 'epochs': 98, 'early_stopping_patience': 17, 'plateau_patience': 18, 'plateau_divider': 5}. Best is trial 73 with value: 0.908256880733945.
[I 2024-11-28 12:54:37,292] Trial 75 finished with value: 0.8956422018348624 and parameters: {'attention_pooling_operation': 'max', 'embedding_pooling_operation': 'mean', 'threshold': 0.5346186875785572, 'batch_size': 214, 'attention_heads': 11, 'hidden_dimension': 160, 'number_of_hidden_layers': 2, 'dropout_rate': 0.3081380071839928, 'global_pooling': 'max', 'learning_rate': 0.0055273992187723645, 'weight_decay': 0.000430576824603593, 'beta_0': 0.8361355861066689, 'beta_1': 0.993523070903772, 'epsilon': 1.7892156900135651e-07, 'balanced_loss': False, 'epochs': 119, 'early_stopping_patience': 19, 'plateau_patience': 16, 'plateau_divider': 6}. Best is trial 73 with value: 0.908256880733945.
[I 2024-11-28 12:59:44,808] Trial 76 finished with value: 0.8967889908256881 and parameters: {'attention_pooling_operation': 'min', 'embedding_pooling_operation': 'min', 'threshold': 0.40097404653760577, 'batch_size': 220, 'attention_heads': 14, 'hidden_dimension': 125, 'number_of_hidden_layers': 2, 'dropout_rate': 0.31549323329038315, 'global_pooling': 'max', 'learning_rate': 0.0020920463981513493, 'weight_decay': 5.2218908709254945e-05, 'beta_0': 0.8466730859575111, 'beta_1': 0.9879685467053728, 'epsilon': 3.857742860077259e-07, 'balanced_loss': False, 'epochs': 130, 'early_stopping_patience': 20, 'plateau_patience': 17, 'plateau_divider': 6}. Best is trial 73 with value: 0.908256880733945.
[I 2024-11-28 13:05:24,411] Trial 77 finished with value: 0.8956422018348624 and parameters: {'attention_pooling_operation': 'max', 'embedding_pooling_operation': 'mean', 'threshold': 0.5067899280136832, 'batch_size': 198, 'attention_heads': 15, 'hidden_dimension': 174, 'number_of_hidden_layers': 2, 'dropout_rate': 0.39540632631679296, 'global_pooling': 'max', 'learning_rate': 0.0007700211314575756, 'weight_decay': 1.9406202965537342e-05, 'beta_0': 0.8531179880851036, 'beta_1': 0.9973944849696597, 'epsilon': 3.72841501166559e-06, 'balanced_loss': False, 'epochs': 106, 'early_stopping_patience': 19, 'plateau_patience': 14, 'plateau_divider': 7}. Best is trial 73 with value: 0.908256880733945.
[I 2024-11-28 13:11:22,462] Trial 78 finished with value: 0.8887614678899083 and parameters: {'attention_pooling_operation': 'max', 'embedding_pooling_operation': 'mean', 'threshold': 0.4209280583705862, 'batch_size': 210, 'attention_heads': 14, 'hidden_dimension': 136, 'number_of_hidden_layers': 3, 'dropout_rate': 0.30047975852937864, 'global_pooling': 'sum', 'learning_rate': 0.0005000389007194951, 'weight_decay': 1.4472636694906505e-05, 'beta_0': 0.8582189522224596, 'beta_1': 0.9919925503182883, 'epsilon': 9.512504830252343e-08, 'balanced_loss': True, 'epochs': 65, 'early_stopping_patience': 21, 'plateau_patience': 19, 'plateau_divider': 6}. Best is trial 73 with value: 0.908256880733945.
[I 2024-11-28 13:15:22,421] Trial 79 finished with value: 0.8990825688073395 and parameters: {'attention_pooling_operation': 'max', 'embedding_pooling_operation': 'max', 'threshold': 0.4720134682403757, 'batch_size': 76, 'attention_heads': 9, 'hidden_dimension': 155, 'number_of_hidden_layers': 1, 'dropout_rate': 0.37521951249551144, 'global_pooling': 'max', 'learning_rate': 0.003033459991485692, 'weight_decay': 0.0001405839720097101, 'beta_0': 0.8443566695310413, 'beta_1': 0.9890791355488666, 'epsilon': 7.523637700697051e-07, 'balanced_loss': False, 'epochs': 138, 'early_stopping_patience': 18, 'plateau_patience': 16, 'plateau_divider': 7}. Best is trial 73 with value: 0.908256880733945.
[I 2024-11-28 13:22:29,222] Trial 80 finished with value: 0.8841743119266054 and parameters: {'attention_pooling_operation': 'mean', 'embedding_pooling_operation': 'mean', 'threshold': 0.4342421346712521, 'batch_size': 189, 'attention_heads': 15, 'hidden_dimension': 164, 'number_of_hidden_layers': 2, 'dropout_rate': 0.32387955142958, 'global_pooling': 'max', 'learning_rate': 2.921284787874865e-05, 'weight_decay': 7.44976849201857e-05, 'beta_0': 0.848898954193466, 'beta_1': 0.9899684311523675, 'epsilon': 1.125181264395064e-06, 'balanced_loss': False, 'epochs': 147, 'early_stopping_patience': 17, 'plateau_patience': 15, 'plateau_divider': 5}. Best is trial 73 with value: 0.908256880733945.
[I 2024-11-28 13:27:09,830] Trial 81 finished with value: 0.8979357798165137 and parameters: {'attention_pooling_operation': 'max', 'embedding_pooling_operation': 'mean', 'threshold': 0.45618790869931625, 'batch_size': 252, 'attention_heads': 12, 'hidden_dimension': 176, 'number_of_hidden_layers': 2, 'dropout_rate': 0.3553057826909576, 'global_pooling': 'max', 'learning_rate': 0.0013814560487308385, 'weight_decay': 3.5497924766211716e-05, 'beta_0': 0.8673539709077017, 'beta_1': 0.9909117693216333, 'epsilon': 6.383157290505078e-07, 'balanced_loss': False, 'epochs': 118, 'early_stopping_patience': 13, 'plateau_patience': 16, 'plateau_divider': 6}. Best is trial 73 with value: 0.908256880733945.
[I 2024-11-28 13:32:42,827] Trial 82 finished with value: 0.9036697247706422 and parameters: {'attention_pooling_operation': 'max', 'embedding_pooling_operation': 'mean', 'threshold': 0.4624270423256945, 'batch_size': 239, 'attention_heads': 13, 'hidden_dimension': 181, 'number_of_hidden_layers': 2, 'dropout_rate': 0.3444364686196924, 'global_pooling': 'max', 'learning_rate': 0.0009487098080346368, 'weight_decay': 2.9682589684865145e-05, 'beta_0': 0.86207087685165, 'beta_1': 0.9904151931850282, 'epsilon': 3.806479854918531e-07, 'balanced_loss': False, 'epochs': 126, 'early_stopping_patience': 19, 'plateau_patience': 17, 'plateau_divider': 7}. Best is trial 73 with value: 0.908256880733945.
[I 2024-11-28 13:37:42,933] Trial 83 finished with value: 0.9013761467889908 and parameters: {'attention_pooling_operation': 'max', 'embedding_pooling_operation': 'mean', 'threshold': 0.4393651436279954, 'batch_size': 239, 'attention_heads': 13, 'hidden_dimension': 142, 'number_of_hidden_layers': 2, 'dropout_rate': 0.3382715555418125, 'global_pooling': 'max', 'learning_rate': 0.0010097889360697833, 'weight_decay': 0.00020640547039348946, 'beta_0': 0.8621403535215743, 'beta_1': 0.9885472980032516, 'epsilon': 4.4841273308021825e-07, 'balanced_loss': False, 'epochs': 128, 'early_stopping_patience': 19, 'plateau_patience': 17, 'plateau_divider': 7}. Best is trial 73 with value: 0.908256880733945.
[I 2024-11-28 13:43:41,040] Trial 84 finished with value: 0.9002293577981652 and parameters: {'attention_pooling_operation': 'max', 'embedding_pooling_operation': 'mean', 'threshold': 0.4896617718455888, 'batch_size': 232, 'attention_heads': 13, 'hidden_dimension': 184, 'number_of_hidden_layers': 2, 'dropout_rate': 0.5162831598215306, 'global_pooling': 'max', 'learning_rate': 0.0003938257416816783, 'weight_decay': 5.398361307494047e-05, 'beta_0': 0.8513267850890016, 'beta_1': 0.9905341064383488, 'epsilon': 2.9434076371091506e-07, 'balanced_loss': False, 'epochs': 126, 'early_stopping_patience': 20, 'plateau_patience': 18, 'plateau_divider': 7}. Best is trial 73 with value: 0.908256880733945.
[I 2024-11-28 13:48:28,501] Trial 85 finished with value: 0.7798165137614679 and parameters: {'attention_pooling_operation': 'max', 'embedding_pooling_operation': 'min', 'threshold': 0.520054276848648, 'batch_size': 222, 'attention_heads': 10, 'hidden_dimension': 194, 'number_of_hidden_layers': 2, 'dropout_rate': 0.3440471814784617, 'global_pooling': 'max', 'learning_rate': 0.09377328193391764, 'weight_decay': 2.7540942120679844e-05, 'beta_0': 0.8564861988435907, 'beta_1': 0.9928093963841879, 'epsilon': 1.7412173638969693e-06, 'balanced_loss': False, 'epochs': 103, 'early_stopping_patience': 17, 'plateau_patience': 17, 'plateau_divider': 7}. Best is trial 73 with value: 0.908256880733945.
[I 2024-11-28 13:52:35,140] Trial 86 finished with value: 0.8956422018348624 and parameters: {'attention_pooling_operation': 'max', 'embedding_pooling_operation': 'mean', 'threshold': 0.7249592559084124, 'batch_size': 206, 'attention_heads': 14, 'hidden_dimension': 169, 'number_of_hidden_layers': 1, 'dropout_rate': 0.3307607904391235, 'global_pooling': 'max', 'learning_rate': 0.0018212542151737456, 'weight_decay': 9.099834707914392e-05, 'beta_0': 0.8713732034682297, 'beta_1': 0.9913565551668314, 'epsilon': 2.0473156928056932e-07, 'balanced_loss': False, 'epochs': 111, 'early_stopping_patience': 18, 'plateau_patience': 19, 'plateau_divider': 6}. Best is trial 73 with value: 0.908256880733945.
[I 2024-11-28 13:59:04,850] Trial 87 finished with value: 0.8990825688073395 and parameters: {'attention_pooling_operation': 'max', 'embedding_pooling_operation': 'mean', 'threshold': 0.41399746517244607, 'batch_size': 121, 'attention_heads': 13, 'hidden_dimension': 154, 'number_of_hidden_layers': 2, 'dropout_rate': 0.36408247878035827, 'global_pooling': 'max', 'learning_rate': 0.004353015933308167, 'weight_decay': 1.2656549192277607e-06, 'beta_0': 0.8735792075148462, 'beta_1': 0.9899418538247796, 'epsilon': 7.261524367582688e-06, 'balanced_loss': False, 'epochs': 122, 'early_stopping_patience': 22, 'plateau_patience': 14, 'plateau_divider': 6}. Best is trial 73 with value: 0.908256880733945.
[I 2024-11-28 14:03:11,989] Trial 88 finished with value: 0.8910550458715596 and parameters: {'attention_pooling_operation': 'max', 'embedding_pooling_operation': 'mean', 'threshold': 0.7848899639297641, 'batch_size': 215, 'attention_heads': 12, 'hidden_dimension': 148, 'number_of_hidden_layers': 2, 'dropout_rate': 0.3172074415777996, 'global_pooling': 'mean', 'learning_rate': 0.0002372450305944677, 'weight_decay': 1.097180221005124e-05, 'beta_0': 0.8407574246492668, 'beta_1': 0.9890990543619093, 'epsilon': 3.474002966989897e-07, 'balanced_loss': False, 'epochs': 51, 'early_stopping_patience': 19, 'plateau_patience': 15, 'plateau_divider': 10}. Best is trial 73 with value: 0.908256880733945.
[I 2024-11-28 14:09:31,372] Trial 89 finished with value: 0.8899082568807339 and parameters: {'attention_pooling_operation': 'min', 'embedding_pooling_operation': 'mean', 'threshold': 0.5560787601567809, 'batch_size': 230, 'attention_heads': 15, 'hidden_dimension': 188, 'number_of_hidden_layers': 4, 'dropout_rate': 0.43596862256600344, 'global_pooling': 'max', 'learning_rate': 0.0008853667955442423, 'weight_decay': 2.0601321417642107e-05, 'beta_0': 0.8182528938210334, 'beta_1': 0.9820666319500478, 'epsilon': 6.849026742710572e-07, 'balanced_loss': True, 'epochs': 133, 'early_stopping_patience': 10, 'plateau_patience': 20, 'plateau_divider': 9}. Best is trial 73 with value: 0.908256880733945.
[I 2024-11-28 14:17:04,754] Trial 90 finished with value: 0.8979357798165137 and parameters: {'attention_pooling_operation': 'max', 'embedding_pooling_operation': 'min', 'threshold': 0.4765638060071157, 'batch_size': 131, 'attention_heads': 14, 'hidden_dimension': 199, 'number_of_hidden_layers': 3, 'dropout_rate': 0.3708397627266006, 'global_pooling': 'sum', 'learning_rate': 0.0022876976526540714, 'weight_decay': 1.7829626892191818e-06, 'beta_0': 0.8584008471224502, 'beta_1': 0.9810219768612463, 'epsilon': 2.1421698315738233e-06, 'balanced_loss': False, 'epochs': 88, 'early_stopping_patience': 20, 'plateau_patience': 18, 'plateau_divider': 5}. Best is trial 73 with value: 0.908256880733945.
[I 2024-11-28 14:21:54,258] Trial 91 finished with value: 0.8967889908256881 and parameters: {'attention_pooling_operation': 'max', 'embedding_pooling_operation': 'mean', 'threshold': 0.4545243264025773, 'batch_size': 248, 'attention_heads': 13, 'hidden_dimension': 178, 'number_of_hidden_layers': 2, 'dropout_rate': 0.35439534970222525, 'global_pooling': 'max', 'learning_rate': 0.001747848307798672, 'weight_decay': 3.87518738737462e-05, 'beta_0': 0.8656598445879593, 'beta_1': 0.9905638703747207, 'epsilon': 8.984429148912945e-07, 'balanced_loss': False, 'epochs': 114, 'early_stopping_patience': 12, 'plateau_patience': 16, 'plateau_divider': 8}. Best is trial 73 with value: 0.908256880733945.
[I 2024-11-28 14:26:31,587] Trial 92 finished with value: 0.8944954128440367 and parameters: {'attention_pooling_operation': 'max', 'embedding_pooling_operation': 'mean', 'threshold': 0.46573584083151826, 'batch_size': 243, 'attention_heads': 13, 'hidden_dimension': 160, 'number_of_hidden_layers': 2, 'dropout_rate': 0.33766644245347344, 'global_pooling': 'max', 'learning_rate': 0.0012222554462506976, 'weight_decay': 2.7833678621489128e-05, 'beta_0': 0.8611894615367952, 'beta_1': 0.991873513814499, 'epsilon': 5.229027589312136e-07, 'balanced_loss': False, 'epochs': 117, 'early_stopping_patience': 13, 'plateau_patience': 15, 'plateau_divider': 8}. Best is trial 73 with value: 0.908256880733945.
