[I 2024-11-12 07:10:53,798] Trial 176 finished with value: 0.9013761467889908 and parameters: {'attention_pooling_operation': 'mean', 'embedding_pooling_operation': 'mean', 'threshold': 0.5939392585080563, 'batch_size': 66, 'attention_heads': 5, 'hidden_dimension': 227, 'number_of_hidden_layers': 1, 'dropout_rate': 0.3285510069252493, 'global_pooling': 'mean', 'learning_rate': 0.0001942151560680624, 'weight_decay': 0.0009338569184342144, 'beta_0': 0.8918577323791459, 'beta_1': 0.9841644689838378, 'epsilon': 1.0048782959243282e-08, 'balanced_loss': False, 'epochs': 69, 'early_stopping_patience': 22, 'plateau_patience': 23, 'plateau_divider': 9}. Best is trial 94 with value: 0.908256880733945.
[I 2024-11-12 07:16:03,571] Trial 177 finished with value: 0.893348623853211 and parameters: {'attention_pooling_operation': 'mean', 'embedding_pooling_operation': 'mean', 'threshold': 0.6064503788381959, 'batch_size': 54, 'attention_heads': 15, 'hidden_dimension': 234, 'number_of_hidden_layers': 1, 'dropout_rate': 0.314616200413221, 'global_pooling': 'mean', 'learning_rate': 0.0003433569843104772, 'weight_decay': 0.0009951841570102712, 'beta_0': 0.895890527858854, 'beta_1': 0.9849798152982794, 'epsilon': 4.313839986070692e-07, 'balanced_loss': False, 'epochs': 80, 'early_stopping_patience': 23, 'plateau_patience': 13, 'plateau_divider': 9}. Best is trial 94 with value: 0.908256880733945.
[I 2024-11-12 07:21:16,617] Trial 178 finished with value: 0.9036697247706422 and parameters: {'attention_pooling_operation': 'mean', 'embedding_pooling_operation': 'mean', 'threshold': 0.5780514154641813, 'batch_size': 47, 'attention_heads': 14, 'hidden_dimension': 214, 'number_of_hidden_layers': 1, 'dropout_rate': 0.33977339968138487, 'global_pooling': 'mean', 'learning_rate': 0.00025749926675121764, 'weight_decay': 0.0005923541472799772, 'beta_0': 0.8889342353982012, 'beta_1': 0.9851887484513862, 'epsilon': 1.2704361922509348e-08, 'balanced_loss': False, 'epochs': 73, 'early_stopping_patience': 24, 'plateau_patience': 17, 'plateau_divider': 10}. Best is trial 94 with value: 0.908256880733945.
[I 2024-11-12 07:26:29,910] Trial 179 finished with value: 0.893348623853211 and parameters: {'attention_pooling_operation': 'mean', 'embedding_pooling_operation': 'mean', 'threshold': 0.5758917964718985, 'batch_size': 44, 'attention_heads': 14, 'hidden_dimension': 211, 'number_of_hidden_layers': 1, 'dropout_rate': 0.33904371306276077, 'global_pooling': 'mean', 'learning_rate': 0.00026342882963413685, 'weight_decay': 0.0007676761428841077, 'beta_0': 0.8889849079919792, 'beta_1': 0.9853268741064521, 'epsilon': 1.2774595549576958e-08, 'balanced_loss': False, 'epochs': 74, 'early_stopping_patience': 24, 'plateau_patience': 17, 'plateau_divider': 10}. Best is trial 94 with value: 0.908256880733945.
[I 2024-11-12 07:31:31,254] Trial 180 finished with value: 0.8944954128440367 and parameters: {'attention_pooling_operation': 'mean', 'embedding_pooling_operation': 'mean', 'threshold': 0.6159116713022874, 'batch_size': 47, 'attention_heads': 14, 'hidden_dimension': 219, 'number_of_hidden_layers': 1, 'dropout_rate': 0.3079720679097674, 'global_pooling': 'mean', 'learning_rate': 0.0003231348593018968, 'weight_decay': 0.0005880011616032931, 'beta_0': 0.8841162655753123, 'beta_1': 0.9846174715507349, 'epsilon': 1.2604254601048448e-08, 'balanced_loss': False, 'epochs': 88, 'early_stopping_patience': 24, 'plateau_patience': 16, 'plateau_divider': 10}. Best is trial 94 with value: 0.908256880733945.
[I 2024-11-12 07:36:29,672] Trial 181 finished with value: 0.8922018348623854 and parameters: {'attention_pooling_operation': 'mean', 'embedding_pooling_operation': 'mean', 'threshold': 0.6708338892105317, 'batch_size': 59, 'attention_heads': 14, 'hidden_dimension': 248, 'number_of_hidden_layers': 1, 'dropout_rate': 0.3495790219826797, 'global_pooling': 'mean', 'learning_rate': 0.00017541043241022194, 'weight_decay': 1.0087760785953916e-06, 'beta_0': 0.8926814799357584, 'beta_1': 0.9848870796867824, 'epsilon': 1.501936327232034e-08, 'balanced_loss': False, 'epochs': 72, 'early_stopping_patience': 22, 'plateau_patience': 16, 'plateau_divider': 10}. Best is trial 94 with value: 0.908256880733945.
[I 2024-11-12 07:40:45,503] Trial 182 finished with value: 0.8967889908256881 and parameters: {'attention_pooling_operation': 'mean', 'embedding_pooling_operation': 'mean', 'threshold': 0.5905635853326452, 'batch_size': 55, 'attention_heads': 8, 'hidden_dimension': 215, 'number_of_hidden_layers': 1, 'dropout_rate': 0.3199180457336018, 'global_pooling': 'mean', 'learning_rate': 0.00039801199900636676, 'weight_decay': 0.0005243536895343428, 'beta_0': 0.8877350615635526, 'beta_1': 0.9856142901581486, 'epsilon': 2.1954949208401145e-08, 'balanced_loss': False, 'epochs': 62, 'early_stopping_patience': 23, 'plateau_patience': 18, 'plateau_divider': 10}. Best is trial 94 with value: 0.908256880733945.
[I 2024-11-12 07:46:09,291] Trial 183 finished with value: 0.8979357798165137 and parameters: {'attention_pooling_operation': 'mean', 'embedding_pooling_operation': 'mean', 'threshold': 0.5798980292024862, 'batch_size': 63, 'attention_heads': 15, 'hidden_dimension': 229, 'number_of_hidden_layers': 1, 'dropout_rate': 0.3304555569583544, 'global_pooling': 'mean', 'learning_rate': 0.0002473905224604767, 'weight_decay': 0.0006442889993875067, 'beta_0': 0.8907512409325192, 'beta_1': 0.9839466543333075, 'epsilon': 1.1359640350103412e-08, 'balanced_loss': False, 'epochs': 78, 'early_stopping_patience': 25, 'plateau_patience': 17, 'plateau_divider': 9}. Best is trial 94 with value: 0.908256880733945.
[I 2024-11-12 07:51:10,702] Trial 184 finished with value: 0.8956422018348624 and parameters: {'attention_pooling_operation': 'mean', 'embedding_pooling_operation': 'mean', 'threshold': 0.560127338091407, 'batch_size': 72, 'attention_heads': 14, 'hidden_dimension': 206, 'number_of_hidden_layers': 1, 'dropout_rate': 0.31443399005419703, 'global_pooling': 'mean', 'learning_rate': 0.0005119679305445234, 'weight_decay': 0.0004636354314803066, 'beta_0': 0.8854185114181332, 'beta_1': 0.9821403334626967, 'epsilon': 1.5820271330264498e-08, 'balanced_loss': False, 'epochs': 66, 'early_stopping_patience': 24, 'plateau_patience': 12, 'plateau_divider': 9}. Best is trial 94 with value: 0.908256880733945.
[I 2024-11-12 07:56:09,747] Trial 185 finished with value: 0.9048165137614679 and parameters: {'attention_pooling_operation': 'mean', 'embedding_pooling_operation': 'mean', 'threshold': 0.5998723455262057, 'batch_size': 49, 'attention_heads': 13, 'hidden_dimension': 242, 'number_of_hidden_layers': 1, 'dropout_rate': 0.3075725530941728, 'global_pooling': 'mean', 'learning_rate': 0.0002934716604467198, 'weight_decay': 0.0007503918065824407, 'beta_0': 0.895966490702411, 'beta_1': 0.9852192069888419, 'epsilon': 7.116231016390244e-07, 'balanced_loss': False, 'epochs': 76, 'early_stopping_patience': 23, 'plateau_patience': 24, 'plateau_divider': 10}. Best is trial 94 with value: 0.908256880733945.
[I 2024-11-12 08:01:12,019] Trial 186 finished with value: 0.8956422018348624 and parameters: {'attention_pooling_operation': 'mean', 'embedding_pooling_operation': 'mean', 'threshold': 0.603017303588337, 'batch_size': 46, 'attention_heads': 13, 'hidden_dimension': 243, 'number_of_hidden_layers': 1, 'dropout_rate': 0.30592500658400507, 'global_pooling': 'mean', 'learning_rate': 0.00020907967644889482, 'weight_decay': 0.0008742741699031405, 'beta_0': 0.8958892623252588, 'beta_1': 0.9851535896729272, 'epsilon': 6.902527298248264e-07, 'balanced_loss': False, 'epochs': 75, 'early_stopping_patience': 23, 'plateau_patience': 15, 'plateau_divider': 10}. Best is trial 94 with value: 0.908256880733945.
[I 2024-11-12 08:05:56,167] Trial 187 finished with value: 0.9013761467889908 and parameters: {'attention_pooling_operation': 'mean', 'embedding_pooling_operation': 'mean', 'threshold': 0.6293026743337983, 'batch_size': 155, 'attention_heads': 13, 'hidden_dimension': 236, 'number_of_hidden_layers': 1, 'dropout_rate': 0.32503394171479444, 'global_pooling': 'mean', 'learning_rate': 0.0002884444994811333, 'weight_decay': 0.0007387782860231837, 'beta_0': 0.8984355319745359, 'beta_1': 0.9906470569443525, 'epsilon': 9.522800861220646e-07, 'balanced_loss': False, 'epochs': 71, 'early_stopping_patience': 22, 'plateau_patience': 24, 'plateau_divider': 10}. Best is trial 94 with value: 0.908256880733945.
[I 2024-11-12 08:10:52,591] Trial 188 finished with value: 0.9013761467889908 and parameters: {'attention_pooling_operation': 'mean', 'embedding_pooling_operation': 'mean', 'threshold': 0.6563832590174796, 'batch_size': 51, 'attention_heads': 13, 'hidden_dimension': 248, 'number_of_hidden_layers': 1, 'dropout_rate': 0.3119650287895976, 'global_pooling': 'mean', 'learning_rate': 0.0003751088222179241, 'weight_decay': 0.0006157000600027053, 'beta_0': 0.8324896189277669, 'beta_1': 0.9842707807870373, 'epsilon': 4.868633287415851e-07, 'balanced_loss': False, 'epochs': 80, 'early_stopping_patience': 23, 'plateau_patience': 24, 'plateau_divider': 10}. Best is trial 94 with value: 0.908256880733945.
[I 2024-11-12 08:15:51,207] Trial 189 finished with value: 0.8956422018348624 and parameters: {'attention_pooling_operation': 'mean', 'embedding_pooling_operation': 'mean', 'threshold': 0.6162827028183364, 'batch_size': 181, 'attention_heads': 14, 'hidden_dimension': 240, 'number_of_hidden_layers': 1, 'dropout_rate': 0.33299373882029465, 'global_pooling': 'mean', 'learning_rate': 0.0006379501184278531, 'weight_decay': 0.0007347842786028344, 'beta_0': 0.894040485877378, 'beta_1': 0.9830377389247804, 'epsilon': 1.846236173846642e-08, 'balanced_loss': False, 'epochs': 76, 'early_stopping_patience': 23, 'plateau_patience': 16, 'plateau_divider': 10}. Best is trial 94 with value: 0.908256880733945.
[I 2024-11-12 08:20:58,412] Trial 190 finished with value: 0.9094036697247706 and parameters: {'attention_pooling_operation': 'mean', 'embedding_pooling_operation': 'mean', 'threshold': 0.5974013952556764, 'batch_size': 40, 'attention_heads': 14, 'hidden_dimension': 225, 'number_of_hidden_layers': 1, 'dropout_rate': 0.3005653419269329, 'global_pooling': 'mean', 'learning_rate': 0.00045233782427737376, 'weight_decay': 1.2111591662867023e-06, 'beta_0': 0.8807082360861178, 'beta_1': 0.9859340471079557, 'epsilon': 6.761528303812467e-07, 'balanced_loss': False, 'epochs': 68, 'early_stopping_patience': 24, 'plateau_patience': 23, 'plateau_divider': 10}. Best is trial 190 with value: 0.9094036697247706.
[I 2024-11-12 08:26:03,196] Trial 191 finished with value: 0.8990825688073395 and parameters: {'attention_pooling_operation': 'mean', 'embedding_pooling_operation': 'mean', 'threshold': 0.6382394532334348, 'batch_size': 41, 'attention_heads': 14, 'hidden_dimension': 222, 'number_of_hidden_layers': 1, 'dropout_rate': 0.30773505266546586, 'global_pooling': 'mean', 'learning_rate': 0.0004503773311518903, 'weight_decay': 1.175166304250067e-06, 'beta_0': 0.8151805447615116, 'beta_1': 0.9857462307123251, 'epsilon': 7.949959791297196e-07, 'balanced_loss': False, 'epochs': 60, 'early_stopping_patience': 24, 'plateau_patience': 23, 'plateau_divider': 10}. Best is trial 190 with value: 0.9094036697247706.
[I 2024-11-12 08:31:15,809] Trial 192 finished with value: 0.8922018348623854 and parameters: {'attention_pooling_operation': 'mean', 'embedding_pooling_operation': 'mean', 'threshold': 0.5971363253002655, 'batch_size': 37, 'attention_heads': 14, 'hidden_dimension': 230, 'number_of_hidden_layers': 1, 'dropout_rate': 0.3036387499149299, 'global_pooling': 'mean', 'learning_rate': 0.00031784960728197735, 'weight_decay': 1.2151512404906116e-06, 'beta_0': 0.880293900861992, 'beta_1': 0.9852138053128753, 'epsilon': 6.464634642501926e-07, 'balanced_loss': False, 'epochs': 68, 'early_stopping_patience': 24, 'plateau_patience': 24, 'plateau_divider': 10}. Best is trial 190 with value: 0.9094036697247706.
[I 2024-11-12 08:36:09,879] Trial 193 finished with value: 0.8956422018348624 and parameters: {'attention_pooling_operation': 'mean', 'embedding_pooling_operation': 'mean', 'threshold': 0.5899459172691032, 'batch_size': 47, 'attention_heads': 13, 'hidden_dimension': 225, 'number_of_hidden_layers': 1, 'dropout_rate': 0.311308892694961, 'global_pooling': 'mean', 'learning_rate': 0.0005223659150209095, 'weight_decay': 0.0008328864554058039, 'beta_0': 0.8825186601766104, 'beta_1': 0.9847893608803278, 'epsilon': 1.1667596654617737e-06, 'balanced_loss': False, 'epochs': 65, 'early_stopping_patience': 22, 'plateau_patience': 17, 'plateau_divider': 10}. Best is trial 190 with value: 0.9094036697247706.
[I 2024-11-12 08:41:16,662] Trial 194 finished with value: 0.8979357798165137 and parameters: {'attention_pooling_operation': 'mean', 'embedding_pooling_operation': 'mean', 'threshold': 0.6064654280417303, 'batch_size': 56, 'attention_heads': 14, 'hidden_dimension': 233, 'number_of_hidden_layers': 1, 'dropout_rate': 0.3002835531042098, 'global_pooling': 'mean', 'learning_rate': 0.00023503678098915653, 'weight_decay': 0.0005681670615037127, 'beta_0': 0.8771908449185986, 'beta_1': 0.986066604636062, 'epsilon': 5.66407196450867e-07, 'balanced_loss': False, 'epochs': 84, 'early_stopping_patience': 25, 'plateau_patience': 24, 'plateau_divider': 10}. Best is trial 190 with value: 0.9094036697247706.
[I 2024-11-12 08:46:52,723] Trial 195 finished with value: 0.9013761467889908 and parameters: {'attention_pooling_operation': 'mean', 'embedding_pooling_operation': 'mean', 'threshold': 0.5751764106893927, 'batch_size': 50, 'attention_heads': 15, 'hidden_dimension': 244, 'number_of_hidden_layers': 1, 'dropout_rate': 0.3209534921985928, 'global_pooling': 'mean', 'learning_rate': 0.0004173338182924099, 'weight_decay': 1.3889467029174245e-06, 'beta_0': 0.8923280695146099, 'beta_1': 0.9814223832009465, 'epsilon': 3.827398070796276e-07, 'balanced_loss': False, 'epochs': 70, 'early_stopping_patience': 23, 'plateau_patience': 25, 'plateau_divider': 9}. Best is trial 190 with value: 0.9094036697247706.
[I 2024-11-12 08:52:10,911] Trial 196 finished with value: 0.8956422018348624 and parameters: {'attention_pooling_operation': 'mean', 'embedding_pooling_operation': 'mean', 'threshold': 0.5974301317426342, 'batch_size': 41, 'attention_heads': 13, 'hidden_dimension': 252, 'number_of_hidden_layers': 1, 'dropout_rate': 0.3174218213915316, 'global_pooling': 'mean', 'learning_rate': 0.0007339205970974201, 'weight_decay': 0.0004085115338802725, 'beta_0': 0.8971609081817664, 'beta_1': 0.986322957216969, 'epsilon': 7.740297593668085e-07, 'balanced_loss': False, 'epochs': 104, 'early_stopping_patience': 24, 'plateau_patience': 24, 'plateau_divider': 10}. Best is trial 190 with value: 0.9094036697247706.
[I 2024-11-12 08:57:34,815] Trial 197 finished with value: 0.8990825688073395 and parameters: {'attention_pooling_operation': 'mean', 'embedding_pooling_operation': 'mean', 'threshold': 0.584517580430271, 'batch_size': 56, 'attention_heads': 14, 'hidden_dimension': 256, 'number_of_hidden_layers': 1, 'dropout_rate': 0.4037091903527528, 'global_pooling': 'mean', 'learning_rate': 0.000340358711703041, 'weight_decay': 0.0005052903276452931, 'beta_0': 0.8813847251916421, 'beta_1': 0.9854509028297563, 'epsilon': 9.097243997687765e-07, 'balanced_loss': False, 'epochs': 68, 'early_stopping_patience': 23, 'plateau_patience': 23, 'plateau_divider': 10}. Best is trial 190 with value: 0.9094036697247706.
[I 2024-11-12 09:02:03,052] Trial 198 finished with value: 0.9036697247706422 and parameters: {'attention_pooling_operation': 'mean', 'embedding_pooling_operation': 'mean', 'threshold': 0.44309829313393423, 'batch_size': 206, 'attention_heads': 13, 'hidden_dimension': 237, 'number_of_hidden_layers': 1, 'dropout_rate': 0.41242563261715176, 'global_pooling': 'mean', 'learning_rate': 0.0005937708227518758, 'weight_decay': 0.0006764397400037504, 'beta_0': 0.8893105713008086, 'beta_1': 0.9845215931043388, 'epsilon': 4.889196701111288e-07, 'balanced_loss': False, 'epochs': 76, 'early_stopping_patience': 14, 'plateau_patience': 25, 'plateau_divider': 10}. Best is trial 190 with value: 0.9094036697247706.
[I 2024-11-12 09:06:40,361] Trial 199 finished with value: 0.9025229357798165 and parameters: {'attention_pooling_operation': 'mean', 'embedding_pooling_operation': 'mean', 'threshold': 0.44451016569633184, 'batch_size': 193, 'attention_heads': 13, 'hidden_dimension': 237, 'number_of_hidden_layers': 1, 'dropout_rate': 0.41601780550086087, 'global_pooling': 'mean', 'learning_rate': 0.0006395751931033231, 'weight_decay': 0.0005841647588021663, 'beta_0': 0.8892371415776914, 'beta_1': 0.9843891744708186, 'epsilon': 4.873003071660064e-07, 'balanced_loss': False, 'epochs': 74, 'early_stopping_patience': 14, 'plateau_patience': 25, 'plateau_divider': 10}. Best is trial 190 with value: 0.9094036697247706.
[I 2024-11-12 09:10:42,577] Trial 200 finished with value: 0.9025229357798165 and parameters: {'attention_pooling_operation': 'mean', 'embedding_pooling_operation': 'max', 'threshold': 0.419198000820079, 'batch_size': 204, 'attention_heads': 5, 'hidden_dimension': 249, 'number_of_hidden_layers': 1, 'dropout_rate': 0.41024102815681107, 'global_pooling': 'mean', 'learning_rate': 0.0005715450176308449, 'weight_decay': 0.0006787910675703407, 'beta_0': 0.8869386202186343, 'beta_1': 0.9846687736363541, 'epsilon': 3.032849192436927e-07, 'balanced_loss': False, 'epochs': 82, 'early_stopping_patience': 15, 'plateau_patience': 25, 'plateau_divider': 10}. Best is trial 190 with value: 0.9094036697247706.
[I 2024-11-12 09:16:28,794] Trial 201 finished with value: 0.8910550458715596 and parameters: {'attention_pooling_operation': 'max', 'embedding_pooling_operation': 'mean', 'threshold': 0.4408377916205941, 'batch_size': 199, 'attention_heads': 13, 'hidden_dimension': 243, 'number_of_hidden_layers': 1, 'dropout_rate': 0.4210179105019358, 'global_pooling': 'sum', 'learning_rate': 0.00664429010400402, 'weight_decay': 1.5870331628593046e-06, 'beta_0': 0.8840821014895932, 'beta_1': 0.9834697247935461, 'epsilon': 4.04141364317611e-07, 'balanced_loss': False, 'epochs': 79, 'early_stopping_patience': 14, 'plateau_patience': 25, 'plateau_divider': 10}. Best is trial 190 with value: 0.9094036697247706.
[I 2024-11-12 09:21:50,765] Trial 202 finished with value: 0.908256880733945 and parameters: {'attention_pooling_operation': 'mean', 'embedding_pooling_operation': 'mean', 'threshold': 0.6134654562907188, 'batch_size': 32, 'attention_heads': 13, 'hidden_dimension': 233, 'number_of_hidden_layers': 1, 'dropout_rate': 0.30048352951647916, 'global_pooling': 'mean', 'learning_rate': 0.0008360771378798537, 'weight_decay': 0.000989242416131057, 'beta_0': 0.8940730255121839, 'beta_1': 0.984979167538011, 'epsilon': 6.459529447285492e-07, 'balanced_loss': False, 'epochs': 72, 'early_stopping_patience': 24, 'plateau_patience': 24, 'plateau_divider': 10}. Best is trial 190 with value: 0.9094036697247706.
[I 2024-11-12 09:27:32,759] Trial 203 finished with value: 0.9036697247706422 and parameters: {'attention_pooling_operation': 'mean', 'embedding_pooling_operation': 'mean', 'threshold': 0.4594284120549479, 'batch_size': 33, 'attention_heads': 13, 'hidden_dimension': 236, 'number_of_hidden_layers': 1, 'dropout_rate': 0.3957045227342207, 'global_pooling': 'mean', 'learning_rate': 0.00093278114845348, 'weight_decay': 0.000797524296365833, 'beta_0': 0.8954254999937892, 'beta_1': 0.9839494765583316, 'epsilon': 5.711306870207291e-07, 'balanced_loss': False, 'epochs': 73, 'early_stopping_patience': 24, 'plateau_patience': 24, 'plateau_divider': 10}. Best is trial 190 with value: 0.9094036697247706.
[I 2024-11-12 09:33:09,986] Trial 204 finished with value: 0.893348623853211 and parameters: {'attention_pooling_operation': 'mean', 'embedding_pooling_operation': 'mean', 'threshold': 0.4542060333585887, 'batch_size': 32, 'attention_heads': 13, 'hidden_dimension': 240, 'number_of_hidden_layers': 1, 'dropout_rate': 0.3949489140311767, 'global_pooling': 'mean', 'learning_rate': 0.0008162893099930161, 'weight_decay': 0.0008065074454183024, 'beta_0': 0.8944383853284625, 'beta_1': 0.983678889886522, 'epsilon': 6.339311503312225e-07, 'balanced_loss': False, 'epochs': 75, 'early_stopping_patience': 24, 'plateau_patience': 24, 'plateau_divider': 10}. Best is trial 190 with value: 0.9094036697247706.
[I 2024-11-12 09:38:41,391] Trial 205 finished with value: 0.8990825688073395 and parameters: {'attention_pooling_operation': 'mean', 'embedding_pooling_operation': 'mean', 'threshold': 0.4807904951257461, 'batch_size': 34, 'attention_heads': 13, 'hidden_dimension': 232, 'number_of_hidden_layers': 1, 'dropout_rate': 0.3978038069850401, 'global_pooling': 'mean', 'learning_rate': 0.0007732482861262993, 'weight_decay': 0.0006890250540262476, 'beta_0': 0.8993702167271208, 'beta_1': 0.9824526874209378, 'epsilon': 7.550917159131614e-07, 'balanced_loss': False, 'epochs': 73, 'early_stopping_patience': 25, 'plateau_patience': 24, 'plateau_divider': 10}. Best is trial 190 with value: 0.9094036697247706.
[I 2024-11-12 09:43:39,701] Trial 206 finished with value: 0.9025229357798165 and parameters: {'attention_pooling_operation': 'mean', 'embedding_pooling_operation': 'mean', 'threshold': 0.46282108337965416, 'batch_size': 37, 'attention_heads': 13, 'hidden_dimension': 148, 'number_of_hidden_layers': 1, 'dropout_rate': 0.39226777525448, 'global_pooling': 'mean', 'learning_rate': 0.0011118980142493203, 'weight_decay': 0.0008808241831074308, 'beta_0': 0.8943336073562823, 'beta_1': 0.9916800523816965, 'epsilon': 1.0386513964880294e-06, 'balanced_loss': False, 'epochs': 76, 'early_stopping_patience': 24, 'plateau_patience': 25, 'plateau_divider': 10}. Best is trial 190 with value: 0.9094036697247706.
