[I 2024-11-28 16:47:16,784] Trial 124 finished with value: 0.8944954128440367 and parameters: {'attention_pooling_operation': 'max', 'embedding_pooling_operation': 'mean', 'threshold': 0.6515816182444181, 'batch_size': 141, 'attention_heads': 10, 'hidden_dimension': 231, 'number_of_hidden_layers': 2, 'dropout_rate': 0.31767060498725797, 'global_pooling': 'max', 'learning_rate': 0.002128467207537879, 'weight_decay': 0.0006706562701999233, 'beta_0': 0.8832954303182372, 'beta_1': 0.9907434787721962, 'epsilon': 5.949599239483752e-05, 'balanced_loss': False, 'epochs': 141, 'early_stopping_patience': 24, 'plateau_patience': 14, 'plateau_divider': 9}. Best is trial 35 with value: 0.9105504587155964.
[I 2024-11-28 16:51:42,697] Trial 125 finished with value: 0.8956422018348624 and parameters: {'attention_pooling_operation': 'max', 'embedding_pooling_operation': 'mean', 'threshold': 0.6822423352697186, 'batch_size': 127, 'attention_heads': 5, 'hidden_dimension': 249, 'number_of_hidden_layers': 2, 'dropout_rate': 0.49463522446352326, 'global_pooling': 'max', 'learning_rate': 0.001762301916525424, 'weight_decay': 0.0005157294096190132, 'beta_0': 0.8695790693410855, 'beta_1': 0.9898992647735283, 'epsilon': 1.2740197606251117e-08, 'balanced_loss': False, 'epochs': 178, 'early_stopping_patience': 25, 'plateau_patience': 17, 'plateau_divider': 2}. Best is trial 35 with value: 0.9105504587155964.
[I 2024-11-28 16:58:42,235] Trial 126 finished with value: 0.8899082568807339 and parameters: {'attention_pooling_operation': 'mean', 'embedding_pooling_operation': 'min', 'threshold': 0.8309771399416814, 'batch_size': 118, 'attention_heads': 16, 'hidden_dimension': 243, 'number_of_hidden_layers': 2, 'dropout_rate': 0.5223721888495386, 'global_pooling': 'max', 'learning_rate': 0.002582425361869363, 'weight_decay': 0.0007693810041525751, 'beta_0': 0.8816269180052885, 'beta_1': 0.9943854293614689, 'epsilon': 3.943638813528337e-06, 'balanced_loss': False, 'epochs': 169, 'early_stopping_patience': 21, 'plateau_patience': 15, 'plateau_divider': 6}. Best is trial 35 with value: 0.9105504587155964.
[I 2024-11-28 17:02:28,670] Trial 127 finished with value: 0.8956422018348624 and parameters: {'attention_pooling_operation': 'max', 'embedding_pooling_operation': 'max', 'threshold': 0.6710359550050515, 'batch_size': 133, 'attention_heads': 4, 'hidden_dimension': 165, 'number_of_hidden_layers': 2, 'dropout_rate': 0.3376343835492945, 'global_pooling': 'max', 'learning_rate': 0.0007077935145229227, 'weight_decay': 0.00034497586832443544, 'beta_0': 0.8761185106518805, 'beta_1': 0.9927490768205828, 'epsilon': 7.550771614349044e-06, 'balanced_loss': False, 'epochs': 163, 'early_stopping_patience': 24, 'plateau_patience': 13, 'plateau_divider': 8}. Best is trial 35 with value: 0.9105504587155964.
[I 2024-11-28 17:06:55,015] Trial 128 finished with value: 0.8990825688073395 and parameters: {'attention_pooling_operation': 'max', 'embedding_pooling_operation': 'min', 'threshold': 0.5957418508570717, 'batch_size': 148, 'attention_heads': 5, 'hidden_dimension': 253, 'number_of_hidden_layers': 2, 'dropout_rate': 0.4771853829148092, 'global_pooling': 'max', 'learning_rate': 0.0011262557035589154, 'weight_decay': 0.0005997706036857473, 'beta_0': 0.8899233128432605, 'beta_1': 0.9915953882232057, 'epsilon': 2.3040925041079153e-05, 'balanced_loss': False, 'epochs': 136, 'early_stopping_patience': 25, 'plateau_patience': 12, 'plateau_divider': 6}. Best is trial 35 with value: 0.9105504587155964.
[I 2024-11-28 17:13:09,460] Trial 129 finished with value: 0.8841743119266054 and parameters: {'attention_pooling_operation': 'max', 'embedding_pooling_operation': 'mean', 'threshold': 0.6118051919157875, 'batch_size': 123, 'attention_heads': 13, 'hidden_dimension': 237, 'number_of_hidden_layers': 2, 'dropout_rate': 0.5055057243604894, 'global_pooling': 'max', 'learning_rate': 0.006437562175644978, 'weight_decay': 0.0009866842130398352, 'beta_0': 0.867302049379825, 'beta_1': 0.9935340314537732, 'epsilon': 1.0345417665392464e-05, 'balanced_loss': False, 'epochs': 130, 'early_stopping_patience': 23, 'plateau_patience': 12, 'plateau_divider': 7}. Best is trial 35 with value: 0.9105504587155964.
[I 2024-11-28 17:19:41,257] Trial 130 finished with value: 0.908256880733945 and parameters: {'attention_pooling_operation': 'max', 'embedding_pooling_operation': 'min', 'threshold': 0.6401356342409892, 'batch_size': 141, 'attention_heads': 14, 'hidden_dimension': 228, 'number_of_hidden_layers': 2, 'dropout_rate': 0.32790031711347767, 'global_pooling': 'max', 'learning_rate': 0.000864168203035899, 'weight_decay': 0.000402679074935225, 'beta_0': 0.884664220178354, 'beta_1': 0.9962115252688104, 'epsilon': 9.850154572182515e-05, 'balanced_loss': True, 'epochs': 126, 'early_stopping_patience': 21, 'plateau_patience': 16, 'plateau_divider': 8}. Best is trial 35 with value: 0.9105504587155964.
[I 2024-11-28 17:25:44,145] Trial 131 finished with value: 0.893348623853211 and parameters: {'attention_pooling_operation': 'max', 'embedding_pooling_operation': 'min', 'threshold': 0.6369556096052222, 'batch_size': 139, 'attention_heads': 14, 'hidden_dimension': 225, 'number_of_hidden_layers': 2, 'dropout_rate': 0.31422094405843876, 'global_pooling': 'max', 'learning_rate': 0.0014053851833665605, 'weight_decay': 0.0004032548386690809, 'beta_0': 0.8849747889806224, 'beta_1': 0.9976177364083462, 'epsilon': 8.767595939978873e-05, 'balanced_loss': True, 'epochs': 127, 'early_stopping_patience': 21, 'plateau_patience': 16, 'plateau_divider': 8}. Best is trial 35 with value: 0.9105504587155964.
[I 2024-11-28 17:31:42,312] Trial 132 finished with value: 0.8967889908256881 and parameters: {'attention_pooling_operation': 'max', 'embedding_pooling_operation': 'min', 'threshold': 0.6605264381189896, 'batch_size': 150, 'attention_heads': 14, 'hidden_dimension': 231, 'number_of_hidden_layers': 2, 'dropout_rate': 0.32647183972448385, 'global_pooling': 'max', 'learning_rate': 0.0009298911956707079, 'weight_decay': 0.0004829055706072502, 'beta_0': 0.8876540839064389, 'beta_1': 0.9959011280628449, 'epsilon': 7.345549540339663e-05, 'balanced_loss': True, 'epochs': 123, 'early_stopping_patience': 20, 'plateau_patience': 15, 'plateau_divider': 8}. Best is trial 35 with value: 0.9105504587155964.
[I 2024-11-28 17:36:30,521] Trial 133 finished with value: 0.9002293577981652 and parameters: {'attention_pooling_operation': 'max', 'embedding_pooling_operation': 'min', 'threshold': 0.6267660539157975, 'batch_size': 131, 'attention_heads': 8, 'hidden_dimension': 241, 'number_of_hidden_layers': 2, 'dropout_rate': 0.3231097102087578, 'global_pooling': 'max', 'learning_rate': 0.003901107510931052, 'weight_decay': 0.00018905833287617316, 'beta_0': 0.8813685892205431, 'beta_1': 0.9908900133558155, 'epsilon': 9.826227480428988e-05, 'balanced_loss': True, 'epochs': 166, 'early_stopping_patience': 20, 'plateau_patience': 16, 'plateau_divider': 8}. Best is trial 35 with value: 0.9105504587155964.
[I 2024-11-28 17:40:24,712] Trial 134 finished with value: 0.9002293577981652 and parameters: {'attention_pooling_operation': 'max', 'embedding_pooling_operation': 'min', 'threshold': 0.6461011789276143, 'batch_size': 142, 'attention_heads': 14, 'hidden_dimension': 218, 'number_of_hidden_layers': 0, 'dropout_rate': 0.30868760243157345, 'global_pooling': 'max', 'learning_rate': 0.0028369477788196948, 'weight_decay': 0.0007204748974950854, 'beta_0': 0.8779369488467176, 'beta_1': 0.9912654390953796, 'epsilon': 2.7095336988746164e-07, 'balanced_loss': True, 'epochs': 171, 'early_stopping_patience': 22, 'plateau_patience': 14, 'plateau_divider': 6}. Best is trial 35 with value: 0.9105504587155964.
[I 2024-11-28 17:47:15,904] Trial 135 finished with value: 0.9048165137614679 and parameters: {'attention_pooling_operation': 'max', 'embedding_pooling_operation': 'min', 'threshold': 0.6551281693361474, 'batch_size': 135, 'attention_heads': 15, 'hidden_dimension': 246, 'number_of_hidden_layers': 2, 'dropout_rate': 0.3409963419358336, 'global_pooling': 'max', 'learning_rate': 0.0008085297885320236, 'weight_decay': 0.0006180450274228284, 'beta_0': 0.8842675656546753, 'beta_1': 0.9968302314968216, 'epsilon': 5.1420611903861096e-05, 'balanced_loss': True, 'epochs': 133, 'early_stopping_patience': 21, 'plateau_patience': 16, 'plateau_divider': 9}. Best is trial 35 with value: 0.9105504587155964.
[I 2024-11-28 17:58:33,860] Trial 136 finished with value: 0.8795871559633027 and parameters: {'attention_pooling_operation': 'max', 'embedding_pooling_operation': 'min', 'threshold': 0.6737434315322355, 'batch_size': 155, 'attention_heads': 15, 'hidden_dimension': 199, 'number_of_hidden_layers': 4, 'dropout_rate': 0.3307958042584757, 'global_pooling': 'max', 'learning_rate': 1.2819914787943077e-05, 'weight_decay': 0.0007872767531056434, 'beta_0': 0.8839488375279411, 'beta_1': 0.9971553181391475, 'epsilon': 5.742701066703196e-05, 'balanced_loss': True, 'epochs': 134, 'early_stopping_patience': 21, 'plateau_patience': 16, 'plateau_divider': 9}. Best is trial 35 with value: 0.9105504587155964.
[I 2024-11-28 18:05:34,225] Trial 137 finished with value: 0.8967889908256881 and parameters: {'attention_pooling_operation': 'max', 'embedding_pooling_operation': 'min', 'threshold': 0.6584254083909862, 'batch_size': 135, 'attention_heads': 15, 'hidden_dimension': 249, 'number_of_hidden_layers': 2, 'dropout_rate': 0.3380886764247299, 'global_pooling': 'max', 'learning_rate': 0.0007927792126133371, 'weight_decay': 0.00027384920311972286, 'beta_0': 0.886611076734501, 'beta_1': 0.9982105586913814, 'epsilon': 4.793810719990639e-05, 'balanced_loss': True, 'epochs': 120, 'early_stopping_patience': 21, 'plateau_patience': 17, 'plateau_divider': 9}. Best is trial 35 with value: 0.9105504587155964.
slurmstepd: error: *** JOB 14024086 ON gpu011 CANCELLED AT 2024-11-28T18:10:11 DUE TO TIME LIMIT ***
