[I 2024-11-28 17:26:55,313] Trial 124 finished with value: 0.8967889908256881 and parameters: {'attention_pooling_operation': 'max', 'embedding_pooling_operation': 'mean', 'threshold': 0.41926178859797286, 'batch_size': 112, 'attention_heads': 14, 'hidden_dimension': 256, 'number_of_hidden_layers': 2, 'dropout_rate': 0.4769094717360716, 'global_pooling': 'max', 'learning_rate': 0.0016444422491164914, 'weight_decay': 0.0004817459580370033, 'beta_0': 0.8380792835963857, 'beta_1': 0.9893037886358039, 'epsilon': 4.080762368371706e-06, 'balanced_loss': False, 'epochs': 120, 'early_stopping_patience': 18, 'plateau_patience': 16, 'plateau_divider': 6}. Best is trial 121 with value: 0.9094036697247706.
[I 2024-11-28 17:33:00,119] Trial 125 finished with value: 0.8153669724770642 and parameters: {'attention_pooling_operation': 'max', 'embedding_pooling_operation': 'mean', 'threshold': 0.4747982960028188, 'batch_size': 93, 'attention_heads': 13, 'hidden_dimension': 233, 'number_of_hidden_layers': 2, 'dropout_rate': 0.3065539580340099, 'global_pooling': 'max', 'learning_rate': 0.0335100042497225, 'weight_decay': 0.0007325722695408843, 'beta_0': 0.8433574496430367, 'beta_1': 0.9888328427542619, 'epsilon': 1.5548163518159986e-06, 'balanced_loss': False, 'epochs': 124, 'early_stopping_patience': 19, 'plateau_patience': 15, 'plateau_divider': 6}. Best is trial 121 with value: 0.9094036697247706.
[I 2024-11-28 17:39:48,225] Trial 126 finished with value: 0.8967889908256881 and parameters: {'attention_pooling_operation': 'max', 'embedding_pooling_operation': 'mean', 'threshold': 0.4490562825274682, 'batch_size': 123, 'attention_heads': 13, 'hidden_dimension': 249, 'number_of_hidden_layers': 2, 'dropout_rate': 0.3277437513700761, 'global_pooling': 'max', 'learning_rate': 0.002448455272405207, 'weight_decay': 5.094164249719428e-06, 'beta_0': 0.8537924402449214, 'beta_1': 0.9908494159326445, 'epsilon': 4.977623536162734e-07, 'balanced_loss': False, 'epochs': 117, 'early_stopping_patience': 20, 'plateau_patience': 17, 'plateau_divider': 8}. Best is trial 121 with value: 0.9094036697247706.
[I 2024-11-28 17:46:36,783] Trial 127 finished with value: 0.8990825688073395 and parameters: {'attention_pooling_operation': 'max', 'embedding_pooling_operation': 'mean', 'threshold': 0.48535278656478203, 'batch_size': 103, 'attention_heads': 15, 'hidden_dimension': 246, 'number_of_hidden_layers': 2, 'dropout_rate': 0.3120582361835346, 'global_pooling': 'max', 'learning_rate': 0.0011498880323805014, 'weight_decay': 0.0002616851735217115, 'beta_0': 0.8399699513035264, 'beta_1': 0.990148114625889, 'epsilon': 3.9416043092987807e-07, 'balanced_loss': False, 'epochs': 137, 'early_stopping_patience': 16, 'plateau_patience': 16, 'plateau_divider': 6}. Best is trial 121 with value: 0.9094036697247706.
[I 2024-11-28 17:51:33,715] Trial 128 finished with value: 0.9059633027522935 and parameters: {'attention_pooling_operation': 'max', 'embedding_pooling_operation': 'min', 'threshold': 0.43108973916796534, 'batch_size': 129, 'attention_heads': 13, 'hidden_dimension': 168, 'number_of_hidden_layers': 2, 'dropout_rate': 0.31830680488415614, 'global_pooling': 'max', 'learning_rate': 0.0020435429561242286, 'weight_decay': 1.5858101492397876e-06, 'beta_0': 0.8957721446148845, 'beta_1': 0.9870816563863163, 'epsilon': 7.867671368431524e-07, 'balanced_loss': True, 'epochs': 55, 'early_stopping_patience': 15, 'plateau_patience': 18, 'plateau_divider': 7}. Best is trial 121 with value: 0.9094036697247706.
[I 2024-11-28 17:56:16,415] Trial 129 finished with value: 0.8990825688073395 and parameters: {'attention_pooling_operation': 'max', 'embedding_pooling_operation': 'min', 'threshold': 0.40213364892050396, 'batch_size': 140, 'attention_heads': 10, 'hidden_dimension': 182, 'number_of_hidden_layers': 2, 'dropout_rate': 0.33534009109251794, 'global_pooling': 'max', 'learning_rate': 0.0008401970541521911, 'weight_decay': 1.4850722499156513e-06, 'beta_0': 0.8842968302465876, 'beta_1': 0.9871280561930976, 'epsilon': 6.913381903314574e-07, 'balanced_loss': True, 'epochs': 54, 'early_stopping_patience': 15, 'plateau_patience': 18, 'plateau_divider': 7}. Best is trial 121 with value: 0.9094036697247706.
[I 2024-11-28 18:02:12,494] Trial 130 finished with value: 0.8990825688073395 and parameters: {'attention_pooling_operation': 'max', 'embedding_pooling_operation': 'min', 'threshold': 0.43050104627726254, 'batch_size': 119, 'attention_heads': 12, 'hidden_dimension': 240, 'number_of_hidden_layers': 2, 'dropout_rate': 0.3174878970320177, 'global_pooling': 'mean', 'learning_rate': 0.0013487529283434084, 'weight_decay': 0.0003990994620289463, 'beta_0': 0.8952501887539724, 'beta_1': 0.9920769099918305, 'epsilon': 9.075354185030004e-07, 'balanced_loss': True, 'epochs': 61, 'early_stopping_patience': 17, 'plateau_patience': 18, 'plateau_divider': 7}. Best is trial 121 with value: 0.9094036697247706.
[I 2024-11-28 18:07:36,005] Trial 131 finished with value: 0.8990825688073395 and parameters: {'attention_pooling_operation': 'max', 'embedding_pooling_operation': 'min', 'threshold': 0.46068965654393107, 'batch_size': 134, 'attention_heads': 13, 'hidden_dimension': 167, 'number_of_hidden_layers': 2, 'dropout_rate': 0.32315445812225974, 'global_pooling': 'max', 'learning_rate': 0.0020534699915931635, 'weight_decay': 1.232634140983593e-06, 'beta_0': 0.8930502663161396, 'beta_1': 0.9884563896746731, 'epsilon': 7.870435899696641e-07, 'balanced_loss': True, 'epochs': 57, 'early_stopping_patience': 18, 'plateau_patience': 19, 'plateau_divider': 7}. Best is trial 121 with value: 0.9094036697247706.
slurmstepd: error: *** JOB 14024087 ON gpu035 CANCELLED AT 2024-11-28T18:10:11 DUE TO TIME LIMIT ***
