[I 2024-11-12 09:48:42,751] Trial 207 finished with value: 0.8967889908256881 and parameters: {'attention_pooling_operation': 'max', 'embedding_pooling_operation': 'mean', 'threshold': 0.4339365674847753, 'batch_size': 43, 'attention_heads': 13, 'hidden_dimension': 225, 'number_of_hidden_layers': 1, 'dropout_rate': 0.40447238958509424, 'global_pooling': 'mean', 'learning_rate': 0.000953033447925328, 'weight_decay': 0.0007283914441872964, 'beta_0': 0.8792424317271426, 'beta_1': 0.983891434241541, 'epsilon': 5.70511508937691e-07, 'balanced_loss': False, 'epochs': 94, 'early_stopping_patience': 19, 'plateau_patience': 24, 'plateau_divider': 10}. Best is trial 190 with value: 0.9094036697247706.
[I 2024-11-12 09:52:59,846] Trial 208 finished with value: 0.8956422018348624 and parameters: {'attention_pooling_operation': 'max', 'embedding_pooling_operation': 'mean', 'threshold': 0.6233732356853461, 'batch_size': 32, 'attention_heads': 14, 'hidden_dimension': 44, 'number_of_hidden_layers': 1, 'dropout_rate': 0.37267296805165534, 'global_pooling': 'max', 'learning_rate': 0.0006726416066894748, 'weight_decay': 0.0006238610853529642, 'beta_0': 0.8960192159231521, 'beta_1': 0.9843850081851465, 'epsilon': 2.1674385007285272e-05, 'balanced_loss': False, 'epochs': 117, 'early_stopping_patience': 24, 'plateau_patience': 25, 'plateau_divider': 10}. Best is trial 190 with value: 0.9094036697247706.
[I 2024-11-12 09:57:35,981] Trial 209 finished with value: 0.8979357798165137 and parameters: {'attention_pooling_operation': 'mean', 'embedding_pooling_operation': 'mean', 'threshold': 0.42855243318297015, 'batch_size': 39, 'attention_heads': 13, 'hidden_dimension': 177, 'number_of_hidden_layers': 1, 'dropout_rate': 0.38771079295991634, 'global_pooling': 'mean', 'learning_rate': 0.00048271759887443254, 'weight_decay': 0.0008300156375950071, 'beta_0': 0.8971218369698892, 'beta_1': 0.9859098545547587, 'epsilon': 1.6558330186053831e-06, 'balanced_loss': False, 'epochs': 79, 'early_stopping_patience': 16, 'plateau_patience': 24, 'plateau_divider': 10}. Best is trial 190 with value: 0.9094036697247706.
[I 2024-11-12 10:02:18,507] Trial 210 finished with value: 0.8979357798165137 and parameters: {'attention_pooling_operation': 'max', 'embedding_pooling_operation': 'mean', 'threshold': 0.6494193756605509, 'batch_size': 206, 'attention_heads': 13, 'hidden_dimension': 246, 'number_of_hidden_layers': 1, 'dropout_rate': 0.41511579536115234, 'global_pooling': 'mean', 'learning_rate': 0.0008763849956556221, 'weight_decay': 0.0005109808458052357, 'beta_0': 0.8908217919420988, 'beta_1': 0.983210870989063, 'epsilon': 6.437572419905893e-07, 'balanced_loss': False, 'epochs': 87, 'early_stopping_patience': 24, 'plateau_patience': 25, 'plateau_divider': 10}. Best is trial 190 with value: 0.9094036697247706.
[I 2024-11-12 10:06:44,220] Trial 211 finished with value: 0.9059633027522935 and parameters: {'attention_pooling_operation': 'mean', 'embedding_pooling_operation': 'mean', 'threshold': 0.6159819468153181, 'batch_size': 185, 'attention_heads': 13, 'hidden_dimension': 252, 'number_of_hidden_layers': 1, 'dropout_rate': 0.4103595930909498, 'global_pooling': 'max', 'learning_rate': 0.000590353806839999, 'weight_decay': 0.0007830040447442304, 'beta_0': 0.8857138527975842, 'beta_1': 0.9818469624887827, 'epsilon': 5.332646370396143e-07, 'balanced_loss': False, 'epochs': 191, 'early_stopping_patience': 14, 'plateau_patience': 23, 'plateau_divider': 7}. Best is trial 190 with value: 0.9094036697247706.
[I 2024-11-12 10:11:09,503] Trial 212 finished with value: 0.8990825688073395 and parameters: {'attention_pooling_operation': 'mean', 'embedding_pooling_operation': 'mean', 'threshold': 0.6130591725732837, 'batch_size': 182, 'attention_heads': 13, 'hidden_dimension': 253, 'number_of_hidden_layers': 1, 'dropout_rate': 0.4020667096409189, 'global_pooling': 'max', 'learning_rate': 0.0005914070026467406, 'weight_decay': 0.0007789790294782797, 'beta_0': 0.8835336431193739, 'beta_1': 0.9808597611810627, 'epsilon': 5.353398507631286e-07, 'balanced_loss': False, 'epochs': 193, 'early_stopping_patience': 14, 'plateau_patience': 23, 'plateau_divider': 7}. Best is trial 190 with value: 0.9094036697247706.
[I 2024-11-12 10:15:32,763] Trial 213 finished with value: 0.8910550458715596 and parameters: {'attention_pooling_operation': 'mean', 'embedding_pooling_operation': 'mean', 'threshold': 0.6306476200912715, 'batch_size': 186, 'attention_heads': 13, 'hidden_dimension': 249, 'number_of_hidden_layers': 1, 'dropout_rate': 0.41236625379520336, 'global_pooling': 'max', 'learning_rate': 0.0007714708580235091, 'weight_decay': 0.0009203557032339359, 'beta_0': 0.8860941064649465, 'beta_1': 0.9816796404124067, 'epsilon': 8.164692482619097e-07, 'balanced_loss': False, 'epochs': 195, 'early_stopping_patience': 14, 'plateau_patience': 23, 'plateau_divider': 7}. Best is trial 190 with value: 0.9094036697247706.
[I 2024-11-12 10:20:49,021] Trial 214 finished with value: 0.8899082568807339 and parameters: {'attention_pooling_operation': 'mean', 'embedding_pooling_operation': 'mean', 'threshold': 0.46048000570998654, 'batch_size': 216, 'attention_heads': 12, 'hidden_dimension': 256, 'number_of_hidden_layers': 1, 'dropout_rate': 0.40501538730139697, 'global_pooling': 'max', 'learning_rate': 0.00047310251438629537, 'weight_decay': 0.0006662720336900761, 'beta_0': 0.8812528193602522, 'beta_1': 0.9817406451122731, 'epsilon': 6.969941758176198e-07, 'balanced_loss': False, 'epochs': 189, 'early_stopping_patience': 25, 'plateau_patience': 24, 'plateau_divider': 7}. Best is trial 190 with value: 0.9094036697247706.
[I 2024-11-12 10:25:34,125] Trial 215 finished with value: 0.9025229357798165 and parameters: {'attention_pooling_operation': 'mean', 'embedding_pooling_operation': 'mean', 'threshold': 0.6163954766671176, 'batch_size': 176, 'attention_heads': 14, 'hidden_dimension': 241, 'number_of_hidden_layers': 1, 'dropout_rate': 0.4227529688284403, 'global_pooling': 'max', 'learning_rate': 0.0005423329472582237, 'weight_decay': 3.219660984507222e-05, 'beta_0': 0.8880867588940842, 'beta_1': 0.9826333032630855, 'epsilon': 4.6127035892457106e-07, 'balanced_loss': False, 'epochs': 186, 'early_stopping_patience': 14, 'plateau_patience': 25, 'plateau_divider': 7}. Best is trial 190 with value: 0.9094036697247706.
[I 2024-11-12 10:30:23,239] Trial 216 finished with value: 0.8956422018348624 and parameters: {'attention_pooling_operation': 'max', 'embedding_pooling_operation': 'mean', 'threshold': 0.47137501452450414, 'batch_size': 45, 'attention_heads': 13, 'hidden_dimension': 233, 'number_of_hidden_layers': 1, 'dropout_rate': 0.4099237629603127, 'global_pooling': 'max', 'learning_rate': 0.0007003005126786433, 'weight_decay': 0.0009955761414094857, 'beta_0': 0.8777774802822105, 'beta_1': 0.9841192545540757, 'epsilon': 8.870217779638184e-07, 'balanced_loss': False, 'epochs': 192, 'early_stopping_patience': 15, 'plateau_patience': 23, 'plateau_divider': 3}. Best is trial 190 with value: 0.9094036697247706.
[I 2024-11-12 10:36:13,164] Trial 217 finished with value: 0.8990825688073395 and parameters: {'attention_pooling_operation': 'mean', 'embedding_pooling_operation': 'mean', 'threshold': 0.4471217675402815, 'batch_size': 190, 'attention_heads': 12, 'hidden_dimension': 245, 'number_of_hidden_layers': 1, 'dropout_rate': 0.39624019971010893, 'global_pooling': 'mean', 'learning_rate': 0.004882185497922782, 'weight_decay': 2.0389782242860375e-05, 'beta_0': 0.8916429332488149, 'beta_1': 0.9854720239207193, 'epsilon': 3.5994362817475784e-07, 'balanced_loss': False, 'epochs': 72, 'early_stopping_patience': 24, 'plateau_patience': 24, 'plateau_divider': 8}. Best is trial 190 with value: 0.9094036697247706.
[I 2024-11-12 10:41:00,566] Trial 218 finished with value: 0.9048165137614679 and parameters: {'attention_pooling_operation': 'max', 'embedding_pooling_operation': 'mean', 'threshold': 0.6062517011344664, 'batch_size': 35, 'attention_heads': 14, 'hidden_dimension': 251, 'number_of_hidden_layers': 1, 'dropout_rate': 0.3792418922209126, 'global_pooling': 'max', 'learning_rate': 0.0009598410419130713, 'weight_decay': 0.0007263517967354136, 'beta_0': 0.885395868362029, 'beta_1': 0.9868268044152164, 'epsilon': 5.56875448100057e-07, 'balanced_loss': False, 'epochs': 189, 'early_stopping_patience': 15, 'plateau_patience': 25, 'plateau_divider': 7}. Best is trial 190 with value: 0.9094036697247706.
[I 2024-11-12 10:45:25,330] Trial 219 finished with value: 0.8727064220183486 and parameters: {'attention_pooling_operation': 'mean', 'embedding_pooling_operation': 'mean', 'threshold': 0.6379463688392847, 'batch_size': 37, 'attention_heads': 14, 'hidden_dimension': 238, 'number_of_hidden_layers': 1, 'dropout_rate': 0.38529188944891357, 'global_pooling': 'mean', 'learning_rate': 0.009843309519291661, 'weight_decay': 0.0007949797449842421, 'beta_0': 0.8850168604728029, 'beta_1': 0.9867481986841748, 'epsilon': 6.63531542314737e-07, 'balanced_loss': False, 'epochs': 188, 'early_stopping_patience': 14, 'plateau_patience': 24, 'plateau_divider': 7}. Best is trial 190 with value: 0.9094036697247706.
[I 2024-11-12 10:48:59,801] Trial 220 finished with value: 0.8944954128440367 and parameters: {'attention_pooling_operation': 'max', 'embedding_pooling_operation': 'max', 'threshold': 0.6208515331758425, 'batch_size': 194, 'attention_heads': 4, 'hidden_dimension': 231, 'number_of_hidden_layers': 1, 'dropout_rate': 0.3763464978126089, 'global_pooling': 'max', 'learning_rate': 0.0009477212189737933, 'weight_decay': 0.0007244888770266636, 'beta_0': 0.8883045609061412, 'beta_1': 0.9908961779102371, 'epsilon': 1.0958929933676833e-06, 'balanced_loss': False, 'epochs': 183, 'early_stopping_patience': 15, 'plateau_patience': 25, 'plateau_divider': 7}. Best is trial 190 with value: 0.9094036697247706.
[I 2024-11-12 10:53:34,945] Trial 221 finished with value: 0.9013761467889908 and parameters: {'attention_pooling_operation': 'max', 'embedding_pooling_operation': 'mean', 'threshold': 0.6113073887011555, 'batch_size': 35, 'attention_heads': 14, 'hidden_dimension': 250, 'number_of_hidden_layers': 1, 'dropout_rate': 0.36738487260868113, 'global_pooling': 'mean', 'learning_rate': 0.00042079452474066455, 'weight_decay': 0.0006255677216286301, 'beta_0': 0.8948931549667389, 'beta_1': 0.9866063537813028, 'epsilon': 4.259188179194068e-07, 'balanced_loss': False, 'epochs': 190, 'early_stopping_patience': 15, 'plateau_patience': 24, 'plateau_divider': 7}. Best is trial 190 with value: 0.9094036697247706.
[I 2024-11-12 10:58:32,324] Trial 222 finished with value: 0.8944954128440367 and parameters: {'attention_pooling_operation': 'max', 'embedding_pooling_operation': 'mean', 'threshold': 0.6061212433295105, 'batch_size': 40, 'attention_heads': 14, 'hidden_dimension': 253, 'number_of_hidden_layers': 1, 'dropout_rate': 0.418140655256805, 'global_pooling': 'max', 'learning_rate': 0.0012034657882886905, 'weight_decay': 0.0005652244340602075, 'beta_0': 0.8826261193146384, 'beta_1': 0.9863262389992092, 'epsilon': 6.372068987704559e-07, 'balanced_loss': False, 'epochs': 200, 'early_stopping_patience': 17, 'plateau_patience': 25, 'plateau_divider': 7}. Best is trial 190 with value: 0.9094036697247706.
[I 2024-11-12 11:02:51,425] Trial 223 finished with value: 0.9025229357798165 and parameters: {'attention_pooling_operation': 'max', 'embedding_pooling_operation': 'mean', 'threshold': 0.6027502557143992, 'batch_size': 46, 'attention_heads': 12, 'hidden_dimension': 248, 'number_of_hidden_layers': 1, 'dropout_rate': 0.37859432704561946, 'global_pooling': 'max', 'learning_rate': 0.0006108790314589139, 'weight_decay': 1.1319480187077435e-06, 'beta_0': 0.8804970149708513, 'beta_1': 0.9858220453434271, 'epsilon': 5.386139591185605e-07, 'balanced_loss': False, 'epochs': 186, 'early_stopping_patience': 14, 'plateau_patience': 25, 'plateau_divider': 7}. Best is trial 190 with value: 0.9094036697247706.
[I 2024-11-12 11:07:11,210] Trial 224 finished with value: 0.9025229357798165 and parameters: {'attention_pooling_operation': 'max', 'embedding_pooling_operation': 'mean', 'threshold': 0.6296307399425122, 'batch_size': 41, 'attention_heads': 13, 'hidden_dimension': 243, 'number_of_hidden_layers': 1, 'dropout_rate': 0.31032949586508685, 'global_pooling': 'max', 'learning_rate': 0.0010002603097210368, 'weight_decay': 0.0008244669921310527, 'beta_0': 0.8856627836862185, 'beta_1': 0.984855005096013, 'epsilon': 5.604030873310144e-07, 'balanced_loss': False, 'epochs': 196, 'early_stopping_patience': 13, 'plateau_patience': 25, 'plateau_divider': 8}. Best is trial 190 with value: 0.9094036697247706.
[I 2024-11-12 11:12:16,381] Trial 225 finished with value: 0.8944954128440367 and parameters: {'attention_pooling_operation': 'max', 'embedding_pooling_operation': 'mean', 'threshold': 0.5816896634245438, 'batch_size': 250, 'attention_heads': 14, 'hidden_dimension': 237, 'number_of_hidden_layers': 1, 'dropout_rate': 0.300130560261328, 'global_pooling': 'max', 'learning_rate': 0.0007644092693865326, 'weight_decay': 0.0006733692261173634, 'beta_0': 0.8897360011098361, 'beta_1': 0.9846470067839324, 'epsilon': 7.542905876209575e-07, 'balanced_loss': False, 'epochs': 64, 'early_stopping_patience': 24, 'plateau_patience': 25, 'plateau_divider': 10}. Best is trial 190 with value: 0.9094036697247706.
[I 2024-11-12 11:16:39,180] Trial 226 finished with value: 0.8990825688073395 and parameters: {'attention_pooling_operation': 'max', 'embedding_pooling_operation': 'mean', 'threshold': 0.6488732890090047, 'batch_size': 169, 'attention_heads': 13, 'hidden_dimension': 256, 'number_of_hidden_layers': 1, 'dropout_rate': 0.4116914884945474, 'global_pooling': 'max', 'learning_rate': 0.0005674467287186249, 'weight_decay': 0.0004931845897014924, 'beta_0': 0.8925532823556575, 'beta_1': 0.9922256045677481, 'epsilon': 4.94147852726381e-07, 'balanced_loss': False, 'epochs': 73, 'early_stopping_patience': 13, 'plateau_patience': 24, 'plateau_divider': 10}. Best is trial 190 with value: 0.9094036697247706.
[I 2024-11-12 11:22:12,101] Trial 227 finished with value: 0.9002293577981652 and parameters: {'attention_pooling_operation': 'mean', 'embedding_pooling_operation': 'mean', 'threshold': 0.6059733803536103, 'batch_size': 35, 'attention_heads': 14, 'hidden_dimension': 251, 'number_of_hidden_layers': 1, 'dropout_rate': 0.3998960072227322, 'global_pooling': 'max', 'learning_rate': 0.0004008983383998752, 'weight_decay': 0.0008814153403199094, 'beta_0': 0.8845867514263136, 'beta_1': 0.9811753178842029, 'epsilon': 8.744863139059462e-07, 'balanced_loss': False, 'epochs': 78, 'early_stopping_patience': 23, 'plateau_patience': 24, 'plateau_divider': 8}. Best is trial 190 with value: 0.9094036697247706.
[I 2024-11-12 11:26:59,132] Trial 228 finished with value: 0.9002293577981652 and parameters: {'attention_pooling_operation': 'max', 'embedding_pooling_operation': 'mean', 'threshold': 0.4324503787786751, 'batch_size': 198, 'attention_heads': 10, 'hidden_dimension': 227, 'number_of_hidden_layers': 1, 'dropout_rate': 0.36182730789152845, 'global_pooling': 'mean', 'learning_rate': 0.007717430846584902, 'weight_decay': 0.0007372207214879473, 'beta_0': 0.87619935545368, 'beta_1': 0.9900179337422425, 'epsilon': 2.5220276539197336e-07, 'balanced_loss': False, 'epochs': 123, 'early_stopping_patience': 24, 'plateau_patience': 22, 'plateau_divider': 7}. Best is trial 190 with value: 0.9094036697247706.
[I 2024-11-12 11:31:35,719] Trial 229 finished with value: 0.9013761467889908 and parameters: {'attention_pooling_operation': 'mean', 'embedding_pooling_operation': 'mean', 'threshold': 0.6225587683219654, 'batch_size': 45, 'attention_heads': 13, 'hidden_dimension': 246, 'number_of_hidden_layers': 1, 'dropout_rate': 0.30719179560024723, 'global_pooling': 'mean', 'learning_rate': 0.0004736884086181115, 'weight_decay': 0.0005848188462403076, 'beta_0': 0.8873525764944685, 'beta_1': 0.98702341231906, 'epsilon': 2.8205525357961143e-05, 'balanced_loss': False, 'epochs': 98, 'early_stopping_patience': 15, 'plateau_patience': 24, 'plateau_divider': 10}. Best is trial 190 with value: 0.9094036697247706.
[I 2024-11-12 11:37:11,926] Trial 230 finished with value: 0.8899082568807339 and parameters: {'attention_pooling_operation': 'max', 'embedding_pooling_operation': 'mean', 'threshold': 0.5708360477906744, 'batch_size': 32, 'attention_heads': 14, 'hidden_dimension': 239, 'number_of_hidden_layers': 1, 'dropout_rate': 0.4066020531002573, 'global_pooling': 'max', 'learning_rate': 0.0028655341572274215, 'weight_decay': 1.260248340060883e-05, 'beta_0': 0.879704106962268, 'beta_1': 0.982364873755015, 'epsilon': 3.439559238954042e-07, 'balanced_loss': False, 'epochs': 71, 'early_stopping_patience': 24, 'plateau_patience': 25, 'plateau_divider': 10}. Best is trial 190 with value: 0.9094036697247706.
[I 2024-11-12 11:41:23,544] Trial 231 finished with value: 0.8979357798165137 and parameters: {'attention_pooling_operation': 'max', 'embedding_pooling_operation': 'mean', 'threshold': 0.6369422876116289, 'batch_size': 114, 'attention_heads': 13, 'hidden_dimension': 222, 'number_of_hidden_layers': 1, 'dropout_rate': 0.3268053392596923, 'global_pooling': 'mean', 'learning_rate': 0.0009109025312503742, 'weight_decay': 1.382640868892858e-06, 'beta_0': 0.8825911456779906, 'beta_1': 0.9854788242082867, 'epsilon': 4.0082883193996354e-07, 'balanced_loss': False, 'epochs': 190, 'early_stopping_patience': 14, 'plateau_patience': 25, 'plateau_divider': 7}. Best is trial 190 with value: 0.9094036697247706.
[I 2024-11-12 11:45:53,727] Trial 232 finished with value: 0.8944954128440367 and parameters: {'attention_pooling_operation': 'mean', 'embedding_pooling_operation': 'mean', 'threshold': 0.5927334014187844, 'batch_size': 61, 'attention_heads': 10, 'hidden_dimension': 233, 'number_of_hidden_layers': 1, 'dropout_rate': 0.3011733052184874, 'global_pooling': 'mean', 'learning_rate': 0.0002543533452942854, 'weight_decay': 0.0004127170536422042, 'beta_0': 0.8902152114614226, 'beta_1': 0.9851868773121628, 'epsilon': 4.302981867052576e-07, 'balanced_loss': False, 'epochs': 68, 'early_stopping_patience': 23, 'plateau_patience': 23, 'plateau_divider': 10}. Best is trial 190 with value: 0.9094036697247706.
[I 2024-11-12 11:50:52,622] Trial 233 finished with value: 0.893348623853211 and parameters: {'attention_pooling_operation': 'mean', 'embedding_pooling_operation': 'mean', 'threshold': 0.5885002676184475, 'batch_size': 51, 'attention_heads': 12, 'hidden_dimension': 241, 'number_of_hidden_layers': 1, 'dropout_rate': 0.30810908917966395, 'global_pooling': 'mean', 'learning_rate': 0.00020052841171471752, 'weight_decay': 0.00035992536874289785, 'beta_0': 0.8929308477022299, 'beta_1': 0.9850044454105801, 'epsilon': 5.200946187273641e-07, 'balanced_loss': False, 'epochs': 75, 'early_stopping_patience': 23, 'plateau_patience': 24, 'plateau_divider': 10}. Best is trial 190 with value: 0.9094036697247706.
[I 2024-11-12 11:54:46,607] Trial 234 finished with value: 0.8979357798165137 and parameters: {'attention_pooling_operation': 'mean', 'embedding_pooling_operation': 'mean', 'threshold': 0.598658828152308, 'batch_size': 67, 'attention_heads': 10, 'hidden_dimension': 32, 'number_of_hidden_layers': 1, 'dropout_rate': 0.30670945610456524, 'global_pooling': 'mean', 'learning_rate': 0.0002795598162468122, 'weight_decay': 0.0004941144481217908, 'beta_0': 0.8893817185167823, 'beta_1': 0.9841048894356068, 'epsilon': 6.530124542931356e-07, 'balanced_loss': False, 'epochs': 70, 'early_stopping_patience': 23, 'plateau_patience': 24, 'plateau_divider': 10}. Best is trial 190 with value: 0.9094036697247706.
[I 2024-11-12 12:00:07,354] Trial 235 finished with value: 0.8979357798165137 and parameters: {'attention_pooling_operation': 'mean', 'embedding_pooling_operation': 'mean', 'threshold': 0.6142787533537386, 'batch_size': 50, 'attention_heads': 15, 'hidden_dimension': 235, 'number_of_hidden_layers': 1, 'dropout_rate': 0.3000682777454988, 'global_pooling': 'mean', 'learning_rate': 0.0001526551398865824, 'weight_decay': 0.00043612350673775415, 'beta_0': 0.8959326872488472, 'beta_1': 0.9857829456705185, 'epsilon': 4.666950043350711e-07, 'balanced_loss': False, 'epochs': 67, 'early_stopping_patience': 23, 'plateau_patience': 24, 'plateau_divider': 10}. Best is trial 190 with value: 0.9094036697247706.
[I 2024-11-12 12:05:09,367] Trial 236 finished with value: 0.8967889908256881 and parameters: {'attention_pooling_operation': 'mean', 'embedding_pooling_operation': 'mean', 'threshold': 0.5857891546606006, 'batch_size': 256, 'attention_heads': 14, 'hidden_dimension': 235, 'number_of_hidden_layers': 1, 'dropout_rate': 0.31530674521530017, 'global_pooling': 'mean', 'learning_rate': 0.0006452511104118622, 'weight_decay': 0.0006644103830630737, 'beta_0': 0.8267062212937936, 'beta_1': 0.9844260929175743, 'epsilon': 1.9301598071322532e-05, 'balanced_loss': False, 'epochs': 76, 'early_stopping_patience': 24, 'plateau_patience': 24, 'plateau_divider': 10}. Best is trial 190 with value: 0.9094036697247706.
[I 2024-11-12 12:10:04,601] Trial 237 finished with value: 0.8887614678899083 and parameters: {'attention_pooling_operation': 'mean', 'embedding_pooling_operation': 'mean', 'threshold': 0.4131367246488531, 'batch_size': 59, 'attention_heads': 16, 'hidden_dimension': 228, 'number_of_hidden_layers': 1, 'dropout_rate': 0.4138090279538012, 'global_pooling': 'sum', 'learning_rate': 0.000363824738924271, 'weight_decay': 0.0005470273342355897, 'beta_0': 0.8999560914077211, 'beta_1': 0.9819939769214905, 'epsilon': 3.5026496137929324e-05, 'balanced_loss': False, 'epochs': 82, 'early_stopping_patience': 14, 'plateau_patience': 25, 'plateau_divider': 10}. Best is trial 190 with value: 0.9094036697247706.
