[I 2024-11-12 12:15:26,025] Trial 238 finished with value: 0.8830275229357798 and parameters: {'attention_pooling_operation': 'max', 'embedding_pooling_operation': 'mean', 'threshold': 0.5971513820344202, 'batch_size': 223, 'attention_heads': 13, 'hidden_dimension': 196, 'number_of_hidden_layers': 1, 'dropout_rate': 0.5245413853969971, 'global_pooling': 'mean', 'learning_rate': 0.012384202298059675, 'weight_decay': 0.0008779907833327196, 'beta_0': 0.8909114027773712, 'beta_1': 0.9863631998372762, 'epsilon': 1.5117241566016367e-05, 'balanced_loss': False, 'epochs': 61, 'early_stopping_patience': 23, 'plateau_patience': 25, 'plateau_divider': 8}. Best is trial 190 with value: 0.9094036697247706.
[I 2024-11-12 12:20:36,212] Trial 239 finished with value: 0.8979357798165137 and parameters: {'attention_pooling_operation': 'mean', 'embedding_pooling_operation': 'max', 'threshold': 0.6093729924008002, 'batch_size': 38, 'attention_heads': 12, 'hidden_dimension': 245, 'number_of_hidden_layers': 1, 'dropout_rate': 0.3912025097183209, 'global_pooling': 'max', 'learning_rate': 0.00028536334664469934, 'weight_decay': 0.000783686887494024, 'beta_0': 0.8878655361915173, 'beta_1': 0.9838861234467392, 'epsilon': 5.820579835848923e-07, 'balanced_loss': False, 'epochs': 73, 'early_stopping_patience': 23, 'plateau_patience': 23, 'plateau_divider': 10}. Best is trial 190 with value: 0.9094036697247706.
[I 2024-11-12 12:25:11,753] Trial 240 finished with value: 0.9048165137614679 and parameters: {'attention_pooling_operation': 'max', 'embedding_pooling_operation': 'mean', 'threshold': 0.6224381824230345, 'batch_size': 243, 'attention_heads': 10, 'hidden_dimension': 250, 'number_of_hidden_layers': 1, 'dropout_rate': 0.38183064817870166, 'global_pooling': 'mean', 'learning_rate': 0.001311725740789672, 'weight_decay': 1.7374938309746429e-06, 'beta_0': 0.8859191267105814, 'beta_1': 0.984755828011567, 'epsilon': 3.158060087086032e-07, 'balanced_loss': False, 'epochs': 65, 'early_stopping_patience': 25, 'plateau_patience': 24, 'plateau_divider': 7}. Best is trial 190 with value: 0.9094036697247706.
[I 2024-11-12 12:29:46,870] Trial 241 finished with value: 0.893348623853211 and parameters: {'attention_pooling_operation': 'max', 'embedding_pooling_operation': 'mean', 'threshold': 0.626942314878289, 'batch_size': 250, 'attention_heads': 10, 'hidden_dimension': 252, 'number_of_hidden_layers': 1, 'dropout_rate': 0.38622493125446994, 'global_pooling': 'mean', 'learning_rate': 0.0013216326539697198, 'weight_decay': 1.8807546733050963e-06, 'beta_0': 0.8841437893815326, 'beta_1': 0.9835474071750016, 'epsilon': 1.1110343420337143e-07, 'balanced_loss': False, 'epochs': 56, 'early_stopping_patience': 25, 'plateau_patience': 24, 'plateau_divider': 7}. Best is trial 190 with value: 0.9094036697247706.
[I 2024-11-12 12:34:20,989] Trial 242 finished with value: 0.8967889908256881 and parameters: {'attention_pooling_operation': 'max', 'embedding_pooling_operation': 'mean', 'threshold': 0.6177261264824069, 'batch_size': 241, 'attention_heads': 10, 'hidden_dimension': 249, 'number_of_hidden_layers': 1, 'dropout_rate': 0.3790983416280718, 'global_pooling': 'mean', 'learning_rate': 0.0016475393577026617, 'weight_decay': 1.255647886634385e-06, 'beta_0': 0.8857155083891408, 'beta_1': 0.984865693508663, 'epsilon': 3.228384593110087e-07, 'balanced_loss': False, 'epochs': 64, 'early_stopping_patience': 25, 'plateau_patience': 24, 'plateau_divider': 7}. Best is trial 190 with value: 0.9094036697247706.
[I 2024-11-12 12:38:59,278] Trial 243 finished with value: 0.9002293577981652 and parameters: {'attention_pooling_operation': 'max', 'embedding_pooling_operation': 'mean', 'threshold': 0.6433328201788237, 'batch_size': 43, 'attention_heads': 11, 'hidden_dimension': 242, 'number_of_hidden_layers': 1, 'dropout_rate': 0.34522841551059913, 'global_pooling': 'mean', 'learning_rate': 0.0011047995258816228, 'weight_decay': 1.0299261660969301e-06, 'beta_0': 0.8813049584395282, 'beta_1': 0.9853100641050851, 'epsilon': 7.424786170778485e-07, 'balanced_loss': False, 'epochs': 66, 'early_stopping_patience': 20, 'plateau_patience': 24, 'plateau_divider': 7}. Best is trial 190 with value: 0.9094036697247706.
[I 2024-11-12 12:43:21,422] Trial 244 finished with value: 0.9013761467889908 and parameters: {'attention_pooling_operation': 'max', 'embedding_pooling_operation': 'mean', 'threshold': 0.6007856043964847, 'batch_size': 245, 'attention_heads': 8, 'hidden_dimension': 256, 'number_of_hidden_layers': 1, 'dropout_rate': 0.40065149829576674, 'global_pooling': 'mean', 'learning_rate': 0.002197052837800347, 'weight_decay': 0.0009842590590009462, 'beta_0': 0.8866442940305328, 'beta_1': 0.9845952444254871, 'epsilon': 3.01492172757289e-07, 'balanced_loss': False, 'epochs': 70, 'early_stopping_patience': 25, 'plateau_patience': 25, 'plateau_divider': 7}. Best is trial 190 with value: 0.9094036697247706.
[I 2024-11-12 12:47:44,391] Trial 245 finished with value: 0.9025229357798165 and parameters: {'attention_pooling_operation': 'max', 'embedding_pooling_operation': 'mean', 'threshold': 0.5772405052262204, 'batch_size': 211, 'attention_heads': 9, 'hidden_dimension': 237, 'number_of_hidden_layers': 1, 'dropout_rate': 0.3117037118438536, 'global_pooling': 'mean', 'learning_rate': 0.0007748059460160419, 'weight_decay': 1.3900504343377694e-06, 'beta_0': 0.894098261326463, 'beta_1': 0.9849893349456113, 'epsilon': 4.160475166963834e-07, 'balanced_loss': False, 'epochs': 183, 'early_stopping_patience': 24, 'plateau_patience': 24, 'plateau_divider': 7}. Best is trial 190 with value: 0.9094036697247706.
[I 2024-11-12 12:51:40,061] Trial 246 finished with value: 0.8967889908256881 and parameters: {'attention_pooling_operation': 'mean', 'embedding_pooling_operation': 'mean', 'threshold': 0.6083266612939647, 'batch_size': 184, 'attention_heads': 7, 'hidden_dimension': 248, 'number_of_hidden_layers': 1, 'dropout_rate': 0.40796002830002304, 'global_pooling': 'mean', 'learning_rate': 0.000554426824057978, 'weight_decay': 1.6591898655412931e-06, 'beta_0': 0.8891905189231992, 'beta_1': 0.9860223327936521, 'epsilon': 9.22034823271483e-07, 'balanced_loss': False, 'epochs': 194, 'early_stopping_patience': 18, 'plateau_patience': 25, 'plateau_divider': 8}. Best is trial 190 with value: 0.9094036697247706.
[I 2024-11-12 12:55:37,389] Trial 247 finished with value: 0.8314220183486238 and parameters: {'attention_pooling_operation': 'max', 'embedding_pooling_operation': 'mean', 'threshold': 0.9490343030489861, 'batch_size': 240, 'attention_heads': 13, 'hidden_dimension': 231, 'number_of_hidden_layers': 1, 'dropout_rate': 0.39502882642383486, 'global_pooling': 'max', 'learning_rate': 0.030004990462751315, 'weight_decay': 0.0006601596461362137, 'beta_0': 0.8916306177962576, 'beta_1': 0.9844845303479047, 'epsilon': 5.235652999762077e-07, 'balanced_loss': False, 'epochs': 111, 'early_stopping_patience': 23, 'plateau_patience': 24, 'plateau_divider': 10}. Best is trial 190 with value: 0.9094036697247706.
[I 2024-11-12 13:00:00,561] Trial 248 finished with value: 0.9002293577981652 and parameters: {'attention_pooling_operation': 'mean', 'embedding_pooling_operation': 'mean', 'threshold': 0.6584259290116454, 'batch_size': 48, 'attention_heads': 14, 'hidden_dimension': 244, 'number_of_hidden_layers': 1, 'dropout_rate': 0.42007748206760154, 'global_pooling': 'mean', 'learning_rate': 0.0012913009796232384, 'weight_decay': 2.10692124405838e-06, 'beta_0': 0.8835080997840804, 'beta_1': 0.9856082522247439, 'epsilon': 2.391944248221787e-05, 'balanced_loss': False, 'epochs': 71, 'early_stopping_patience': 14, 'plateau_patience': 23, 'plateau_divider': 10}. Best is trial 190 with value: 0.9094036697247706.
[I 2024-11-12 13:04:20,865] Trial 249 finished with value: 0.9048165137614679 and parameters: {'attention_pooling_operation': 'max', 'embedding_pooling_operation': 'mean', 'threshold': 0.6320676990332683, 'batch_size': 245, 'attention_heads': 10, 'hidden_dimension': 216, 'number_of_hidden_layers': 1, 'dropout_rate': 0.3542246675202107, 'global_pooling': 'mean', 'learning_rate': 0.00021586651474794403, 'weight_decay': 1.1624886689725472e-06, 'beta_0': 0.8785896886701521, 'beta_1': 0.9841070588839724, 'epsilon': 1.3847478919616588e-06, 'balanced_loss': False, 'epochs': 77, 'early_stopping_patience': 24, 'plateau_patience': 24, 'plateau_divider': 7}. Best is trial 190 with value: 0.9094036697247706.
[I 2024-11-12 13:09:05,962] Trial 250 finished with value: 0.8956422018348624 and parameters: {'attention_pooling_operation': 'max', 'embedding_pooling_operation': 'mean', 'threshold': 0.633097887417896, 'batch_size': 247, 'attention_heads': 10, 'hidden_dimension': 217, 'number_of_hidden_layers': 1, 'dropout_rate': 0.3830577912754688, 'global_pooling': 'max', 'learning_rate': 0.00017468579493371325, 'weight_decay': 1.2317169726979644e-06, 'beta_0': 0.8780411571737109, 'beta_1': 0.9839304992430901, 'epsilon': 1.2182556789021411e-06, 'balanced_loss': False, 'epochs': 78, 'early_stopping_patience': 24, 'plateau_patience': 25, 'plateau_divider': 7}. Best is trial 190 with value: 0.9094036697247706.

[TRIAL] 190 [VALIDATION PERFORMANCE] 0.9094036697247706 [TRAINING LOSS] 0.05182687228988329 [VALIDATION LOSS] 0.44266438772055233 

number                                     190
value                                 0.909404
params_threshold                      0.597401
params_attention_heads                      14
params_balanced_loss                     False
params_embedding_pooling_operation        mean
params_attention_pooling_operation        mean
params_batch_size                           40
params_dropout_rate                   0.300565
params_early_stopping_patience              24
params_epochs                               68
params_global_pooling                     mean
params_hidden_dimension                    225
params_learning_rate                  0.000452
params_number_of_hidden_layers               1
params_plateau_divider                      10
params_plateau_patience                     23
params_weight_decay                   0.000001
params_beta_0                         0.880708
params_beta_1                         0.985934
params_epsilon                        0.000001
user_attrs_epoch                          15.0
user_attrs_training_loss              0.051827
user_attrs_validation_loss            0.442664
Name: 190, dtype: object
37 Val: 0.8979357798165137 Test: 0.8874244920373421
38 Val: 0.8979357798165137 Test: 0.8753432180120813
39 Val: 0.8990825688073395 Test: 0.8901702361339923
40 Val: 0.8944954128440367 Test: 0.8934651290499726
41 Val: 0.8956422018348624 Test: 0.8901702361339923
42 Val: 0.8967889908256881 Test: 0.8896210873146623
43 Val: 0.8967889908256881 Test: 0.8797364085667215
44 Val: 0.8956422018348624 Test: 0.8984074684239429
45 Val: 0.893348623853211 Test: 0.8885227896760022
46 Val: 0.893348623853211 Test: 0.8830313014827018
Validation performance: 89.33 & 89.61 ± 0.2 & 89.91
Testing performance: 87.53 & 88.76 ± 0.67 & 89.84

[TRIAL] 202 [VALIDATION PERFORMANCE] 0.908256880733945 [TRAINING LOSS] 0.21779967899421393 [VALIDATION LOSS] 0.28127893645848545 

number                                     202
value                                 0.908257
params_threshold                      0.613465
params_attention_heads                      13
params_balanced_loss                     False
params_embedding_pooling_operation        mean
params_attention_pooling_operation        mean
params_batch_size                           32
params_dropout_rate                   0.300484
params_early_stopping_patience              24
params_epochs                               72
params_global_pooling                     mean
params_hidden_dimension                    233
params_learning_rate                  0.000836
params_number_of_hidden_layers               1
params_plateau_divider                      10
params_plateau_patience                     24
params_weight_decay                   0.000989
params_beta_0                         0.894073
params_beta_1                         0.984979
params_epsilon                        0.000001
user_attrs_epoch                           4.0
user_attrs_training_loss                0.2178
user_attrs_validation_loss            0.281279
Name: 202, dtype: object
37 Val: 0.8944954128440367 Test: 0.8945634266886326
38 Val: 0.8990825688073395 Test: 0.8951125755079626
39 Val: 0.9013761467889908 Test: 0.886326194398682
40 Val: 0.893348623853211 Test: 0.8890719384953323
41 Val: 0.8990825688073395 Test: 0.8923668314113125
42 Val: 0.8990825688073395 Test: 0.8923668314113125
43 Val: 0.8990825688073395 Test: 0.8890719384953323
44 Val: 0.8956422018348624 Test: 0.8951125755079626
45 Val: 0.8944954128440367 Test: 0.8874244920373421
46 Val: 0.8979357798165137 Test: 0.8846787479406919
Validation performance: 89.33 & 89.74 ± 0.27 & 90.14
Testing performance: 88.47 & 89.06 ± 0.38 & 89.51

[TRIAL] 94 [VALIDATION PERFORMANCE] 0.908256880733945 [TRAINING LOSS] 0.17798148134145245 [VALIDATION LOSS] 0.29812647673216736 

number                                      94
value                                 0.908257
params_threshold                       0.58853
params_attention_heads                      14
params_balanced_loss                     False
params_embedding_pooling_operation        mean
params_attention_pooling_operation         max
params_batch_size                           80
params_dropout_rate                   0.411795
params_early_stopping_patience              22
params_epochs                              187
params_global_pooling                      max
params_hidden_dimension                    253
params_learning_rate                  0.002988
params_number_of_hidden_layers               1
params_plateau_divider                       7
params_plateau_patience                     24
params_weight_decay                   0.000771
params_beta_0                         0.875457
params_beta_1                         0.991395
params_epsilon                             0.0
user_attrs_epoch                          13.0
user_attrs_training_loss              0.177981
user_attrs_validation_loss            0.298126
Name: 94, dtype: object
37 Val: 0.9048165137614679 Test: 0.8923668314113125
38 Val: 0.8944954128440367 Test: 0.8819330038440417
39 Val: 0.9002293577981652 Test: 0.8835804503020318
40 Val: 0.9002293577981652 Test: 0.8907193849533224
41 Val: 0.8944954128440367 Test: 0.8967600219659527
42 Val: 0.9002293577981652 Test: 0.8879736408566722
43 Val: 0.8967889908256881 Test: 0.8879736408566722
44 Val: 0.8956422018348624 Test: 0.8890719384953323
45 Val: 0.8967889908256881 Test: 0.8940142778693025
46 Val: 0.9048165137614679 Test: 0.8846787479406919
Validation performance: 89.45 & 89.89 ± 0.39 & 90.48
Testing performance: 88.19 & 88.89 ± 0.47 & 89.68

[TRIAL] 166 [VALIDATION PERFORMANCE] 0.908256880733945 [TRAINING LOSS] 0.04968800110891309 [VALIDATION LOSS] 0.4385171961039305 

number                                     166
value                                 0.908257
params_threshold                      0.633981
params_attention_heads                      10
params_balanced_loss                     False
params_embedding_pooling_operation        mean
params_attention_pooling_operation        mean
params_batch_size                           57
params_dropout_rate                   0.316009
params_early_stopping_patience              23
params_epochs                               76
params_global_pooling                     mean
params_hidden_dimension                    234
params_learning_rate                  0.000231
params_number_of_hidden_layers               1
params_plateau_divider                      10
params_plateau_patience                     24
params_weight_decay                   0.000857
params_beta_0                         0.886186
params_beta_1                         0.985706
params_epsilon                        0.000001
user_attrs_epoch                          16.0
user_attrs_training_loss              0.049688
user_attrs_validation_loss            0.438517
Name: 166, dtype: object
37 Val: 0.893348623853211 Test: 0.8945634266886326
38 Val: 0.893348623853211 Test: 0.8912685337726524
39 Val: 0.9013761467889908 Test: 0.8929159802306426
40 Val: 0.9025229357798165 Test: 0.8940142778693025
41 Val: 0.8956422018348624 Test: 0.8896210873146623
42 Val: 0.8967889908256881 Test: 0.8918176825919825
43 Val: 0.9013761467889908 Test: 0.8973091707852828
44 Val: 0.9025229357798165 Test: 0.8918176825919825
45 Val: 0.8979357798165137 Test: 0.8890719384953323
46 Val: 0.8979357798165137 Test: 0.8901702361339923
Validation performance: 89.33 & 89.83 ± 0.35 & 90.25
Testing performance: 88.91 & 89.23 ± 0.25 & 89.73

[TRIAL] 113 [VALIDATION PERFORMANCE] 0.9071100917431193 [TRAINING LOSS] 0.05152773817202875 [VALIDATION LOSS] 0.4090126287192106 

number                                     113
value                                  0.90711
params_threshold                      0.645827
params_attention_heads                      12
params_balanced_loss                     False
params_embedding_pooling_operation        mean
params_attention_pooling_operation         max
params_batch_size                          251
params_dropout_rate                   0.381647
params_early_stopping_patience              23
params_epochs                              124
params_global_pooling                      max
params_hidden_dimension                    232
params_learning_rate                  0.002432
params_number_of_hidden_layers               1
params_plateau_divider                       7
params_plateau_patience                     25
params_weight_decay                   0.000007
params_beta_0                         0.896675
params_beta_1                         0.982075
params_epsilon                             0.0
user_attrs_epoch                          24.0
user_attrs_training_loss              0.051528
user_attrs_validation_loss            0.409013
Name: 113, dtype: object
37 Val: 0.9013761467889908 Test: 0.8874244920373421
slurmstepd: error: *** JOB 13915598 ON gpu029 CANCELLED AT 2024-11-12T16:43:19 DUE TO TIME LIMIT ***
