[I 2024-12-02 17:44:02,080] Trial 92 finished with value: 0.9208715596330275 and parameters: {'attention_pooling_operation': 'mean', 'embedding_pooling_operation': 'min', 'threshold': 0.6392451811157572, 'batch_size': 118, 'attention_heads': 11, 'hidden_dimension': 127, 'number_of_hidden_layers': 1, 'dropout_rate': 0.5582585979619418, 'global_pooling': 'max', 'learning_rate': 0.001347418297871004, 'weight_decay': 1.592083963382839e-05, 'beta_0': 0.8114823802129765, 'beta_1': 0.9968477797851607, 'epsilon': 3.270013684080685e-05, 'balanced_loss': True, 'epochs': 184, 'early_stopping_patience': 10, 'plateau_patience': 15, 'plateau_divider': 8}. Best is trial 85 with value: 0.9254587155963303.
[I 2024-12-02 17:48:39,823] Trial 93 finished with value: 0.9220183486238532 and parameters: {'attention_pooling_operation': 'mean', 'embedding_pooling_operation': 'min', 'threshold': 0.6259712413915862, 'batch_size': 134, 'attention_heads': 12, 'hidden_dimension': 160, 'number_of_hidden_layers': 1, 'dropout_rate': 0.5472325351686217, 'global_pooling': 'max', 'learning_rate': 0.0005193439185337856, 'weight_decay': 3.558419960961618e-05, 'beta_0': 0.805575340299145, 'beta_1': 0.9982592049349568, 'epsilon': 4.1393213051664576e-05, 'balanced_loss': True, 'epochs': 178, 'early_stopping_patience': 12, 'plateau_patience': 14, 'plateau_divider': 8}. Best is trial 85 with value: 0.9254587155963303.
[I 2024-12-02 17:52:49,885] Trial 94 finished with value: 0.9208715596330275 and parameters: {'attention_pooling_operation': 'mean', 'embedding_pooling_operation': 'min', 'threshold': 0.6798685743065835, 'batch_size': 150, 'attention_heads': 13, 'hidden_dimension': 153, 'number_of_hidden_layers': 1, 'dropout_rate': 0.4566495433609936, 'global_pooling': 'max', 'learning_rate': 0.002339908929022536, 'weight_decay': 5.2411482885988604e-05, 'beta_0': 0.8168437129501331, 'beta_1': 0.9966554897736573, 'epsilon': 2.80444604595162e-05, 'balanced_loss': True, 'epochs': 169, 'early_stopping_patience': 12, 'plateau_patience': 16, 'plateau_divider': 9}. Best is trial 85 with value: 0.9254587155963303.
[I 2024-12-02 17:57:05,709] Trial 95 finished with value: 0.9197247706422018 and parameters: {'attention_pooling_operation': 'mean', 'embedding_pooling_operation': 'min', 'threshold': 0.5952023210880056, 'batch_size': 121, 'attention_heads': 10, 'hidden_dimension': 144, 'number_of_hidden_layers': 1, 'dropout_rate': 0.4681400642596766, 'global_pooling': 'max', 'learning_rate': 0.003335292647433779, 'weight_decay': 4.286069824017419e-05, 'beta_0': 0.8230803553106643, 'beta_1': 0.9979882471990756, 'epsilon': 1.8199649276299733e-05, 'balanced_loss': True, 'epochs': 173, 'early_stopping_patience': 13, 'plateau_patience': 15, 'plateau_divider': 7}. Best is trial 85 with value: 0.9254587155963303.
[I 2024-12-02 18:01:09,966] Trial 96 finished with value: 0.8876146788990825 and parameters: {'attention_pooling_operation': 'mean', 'embedding_pooling_operation': 'min', 'threshold': 0.6115659022224121, 'batch_size': 158, 'attention_heads': 11, 'hidden_dimension': 166, 'number_of_hidden_layers': 1, 'dropout_rate': 0.5220954254000753, 'global_pooling': 'max', 'learning_rate': 0.026872415906226292, 'weight_decay': 2.5111128116474732e-05, 'beta_0': 0.8088222759286643, 'beta_1': 0.9975643062890446, 'epsilon': 5.948370318000061e-05, 'balanced_loss': True, 'epochs': 59, 'early_stopping_patience': 10, 'plateau_patience': 13, 'plateau_divider': 7}. Best is trial 85 with value: 0.9254587155963303.
[I 2024-12-02 18:05:49,015] Trial 97 finished with value: 0.9151376146788991 and parameters: {'attention_pooling_operation': 'mean', 'embedding_pooling_operation': 'min', 'threshold': 0.6494306611937237, 'batch_size': 138, 'attention_heads': 12, 'hidden_dimension': 132, 'number_of_hidden_layers': 1, 'dropout_rate': 0.5909546517637475, 'global_pooling': 'max', 'learning_rate': 0.0003394719172234756, 'weight_decay': 8.96680089106433e-06, 'beta_0': 0.8135339958515447, 'beta_1': 0.9948832454779242, 'epsilon': 3.903009680121865e-05, 'balanced_loss': True, 'epochs': 163, 'early_stopping_patience': 11, 'plateau_patience': 18, 'plateau_divider': 8}. Best is trial 85 with value: 0.9254587155963303.
[I 2024-12-02 18:10:23,603] Trial 98 finished with value: 0.9208715596330275 and parameters: {'attention_pooling_operation': 'mean', 'embedding_pooling_operation': 'min', 'threshold': 0.5686145121830313, 'batch_size': 145, 'attention_heads': 13, 'hidden_dimension': 86, 'number_of_hidden_layers': 1, 'dropout_rate': 0.4872921350159684, 'global_pooling': 'max', 'learning_rate': 0.00023751836555502328, 'weight_decay': 3.6068498066338844e-05, 'beta_0': 0.8321728865078152, 'beta_1': 0.9959458409844123, 'epsilon': 7.062421881013877e-05, 'balanced_loss': True, 'epochs': 53, 'early_stopping_patience': 11, 'plateau_patience': 16, 'plateau_divider': 9}. Best is trial 85 with value: 0.9254587155963303.
[I 2024-12-02 18:15:32,111] Trial 99 finished with value: 0.9208715596330275 and parameters: {'attention_pooling_operation': 'mean', 'embedding_pooling_operation': 'min', 'threshold': 0.7183182916202885, 'batch_size': 165, 'attention_heads': 13, 'hidden_dimension': 122, 'number_of_hidden_layers': 2, 'dropout_rate': 0.531457980332868, 'global_pooling': 'max', 'learning_rate': 0.0006888041725051226, 'weight_decay': 2.1200028641358156e-05, 'beta_0': 0.8285650600202731, 'beta_1': 0.9961592117547938, 'epsilon': 1.6287378439609153e-05, 'balanced_loss': True, 'epochs': 187, 'early_stopping_patience': 12, 'plateau_patience': 14, 'plateau_divider': 6}. Best is trial 85 with value: 0.9254587155963303.
[I 2024-12-02 18:20:23,670] Trial 100 finished with value: 0.9197247706422018 and parameters: {'attention_pooling_operation': 'mean', 'embedding_pooling_operation': 'min', 'threshold': 0.8482835392354121, 'batch_size': 187, 'attention_heads': 14, 'hidden_dimension': 151, 'number_of_hidden_layers': 1, 'dropout_rate': 0.5091662685570757, 'global_pooling': 'max', 'learning_rate': 0.0004795755925814653, 'weight_decay': 1.6593168597702922e-05, 'beta_0': 0.8204613759620455, 'beta_1': 0.9989040855248301, 'epsilon': 9.343197398696666e-05, 'balanced_loss': True, 'epochs': 66, 'early_stopping_patience': 14, 'plateau_patience': 17, 'plateau_divider': 7}. Best is trial 85 with value: 0.9254587155963303.
[I 2024-12-02 18:26:10,093] Trial 101 finished with value: 0.9243119266055045 and parameters: {'attention_pooling_operation': 'mean', 'embedding_pooling_operation': 'max', 'threshold': 0.6564313317602922, 'batch_size': 195, 'attention_heads': 13, 'hidden_dimension': 179, 'number_of_hidden_layers': 1, 'dropout_rate': 0.523077149707898, 'global_pooling': 'max', 'learning_rate': 0.0004067159026778456, 'weight_decay': 5.026796881366617e-05, 'beta_0': 0.8176884487948879, 'beta_1': 0.997393146560571, 'epsilon': 2.6623224135080507e-05, 'balanced_loss': True, 'epochs': 176, 'early_stopping_patience': 20, 'plateau_patience': 22, 'plateau_divider': 8}. Best is trial 85 with value: 0.9254587155963303.
[I 2024-12-02 18:31:24,368] Trial 102 finished with value: 0.9162844036697247 and parameters: {'attention_pooling_operation': 'mean', 'embedding_pooling_operation': 'max', 'threshold': 0.654578934486583, 'batch_size': 171, 'attention_heads': 13, 'hidden_dimension': 179, 'number_of_hidden_layers': 1, 'dropout_rate': 0.544420469334128, 'global_pooling': 'max', 'learning_rate': 0.00017825666794191915, 'weight_decay': 4.887685452998214e-05, 'beta_0': 0.8173669404168957, 'beta_1': 0.9973471234617636, 'epsilon': 2.3314857835574226e-05, 'balanced_loss': True, 'epochs': 171, 'early_stopping_patience': 23, 'plateau_patience': 15, 'plateau_divider': 8}. Best is trial 85 with value: 0.9254587155963303.
[I 2024-12-02 18:36:33,166] Trial 103 finished with value: 0.9185779816513762 and parameters: {'attention_pooling_operation': 'mean', 'embedding_pooling_operation': 'max', 'threshold': 0.6973178607505823, 'batch_size': 112, 'attention_heads': 14, 'hidden_dimension': 156, 'number_of_hidden_layers': 1, 'dropout_rate': 0.4931324503491729, 'global_pooling': 'max', 'learning_rate': 0.004780815691615038, 'weight_decay': 6.114750575063899e-05, 'beta_0': 0.8102503072950961, 'beta_1': 0.9955391350844488, 'epsilon': 1.2215232291495683e-05, 'balanced_loss': True, 'epochs': 165, 'early_stopping_patience': 22, 'plateau_patience': 21, 'plateau_divider': 8}. Best is trial 85 with value: 0.9254587155963303.
[I 2024-12-02 18:41:30,541] Trial 104 finished with value: 0.926605504587156 and parameters: {'attention_pooling_operation': 'mean', 'embedding_pooling_operation': 'max', 'threshold': 0.663891204251999, 'batch_size': 197, 'attention_heads': 13, 'hidden_dimension': 162, 'number_of_hidden_layers': 1, 'dropout_rate': 0.5251681824516831, 'global_pooling': 'max', 'learning_rate': 0.0010309084048391326, 'weight_decay': 1.973784129013931e-05, 'beta_0': 0.8230751581429963, 'beta_1': 0.9977933024011307, 'epsilon': 2.8891799807228356e-05, 'balanced_loss': True, 'epochs': 178, 'early_stopping_patience': 11, 'plateau_patience': 23, 'plateau_divider': 9}. Best is trial 104 with value: 0.926605504587156.
[I 2024-12-02 18:46:24,016] Trial 105 finished with value: 0.9208715596330275 and parameters: {'attention_pooling_operation': 'mean', 'embedding_pooling_operation': 'max', 'threshold': 0.6636102130971703, 'batch_size': 197, 'attention_heads': 12, 'hidden_dimension': 171, 'number_of_hidden_layers': 1, 'dropout_rate': 0.5225983942772503, 'global_pooling': 'max', 'learning_rate': 0.001201384043377806, 'weight_decay': 1.1827999101477669e-05, 'beta_0': 0.8140397935017533, 'beta_1': 0.9934465051844835, 'epsilon': 4.3403589129990476e-05, 'balanced_loss': True, 'epochs': 181, 'early_stopping_patience': 20, 'plateau_patience': 23, 'plateau_divider': 10}. Best is trial 104 with value: 0.926605504587156.
[I 2024-12-02 18:51:11,385] Trial 106 finished with value: 0.9243119266055045 and parameters: {'attention_pooling_operation': 'mean', 'embedding_pooling_operation': 'max', 'threshold': 0.6860262013404327, 'batch_size': 212, 'attention_heads': 13, 'hidden_dimension': 164, 'number_of_hidden_layers': 1, 'dropout_rate': 0.4994644439280099, 'global_pooling': 'max', 'learning_rate': 0.0018352855733720097, 'weight_decay': 1.949586120809394e-05, 'beta_0': 0.8158258530956762, 'beta_1': 0.9976245254327256, 'epsilon': 5.122732828861041e-05, 'balanced_loss': True, 'epochs': 187, 'early_stopping_patience': 20, 'plateau_patience': 22, 'plateau_divider': 9}. Best is trial 104 with value: 0.926605504587156.
[I 2024-12-02 18:56:27,374] Trial 107 finished with value: 0.9220183486238532 and parameters: {'attention_pooling_operation': 'mean', 'embedding_pooling_operation': 'max', 'threshold': 0.7413295378322109, 'batch_size': 223, 'attention_heads': 14, 'hidden_dimension': 174, 'number_of_hidden_layers': 1, 'dropout_rate': 0.5001312315576177, 'global_pooling': 'max', 'learning_rate': 0.0017476413088029904, 'weight_decay': 1.949956673745398e-05, 'beta_0': 0.8154830923518465, 'beta_1': 0.9978607457023537, 'epsilon': 4.7501482961140594e-05, 'balanced_loss': True, 'epochs': 189, 'early_stopping_patience': 18, 'plateau_patience': 22, 'plateau_divider': 9}. Best is trial 104 with value: 0.926605504587156.
[I 2024-12-02 19:01:18,436] Trial 108 finished with value: 0.9197247706422018 and parameters: {'attention_pooling_operation': 'mean', 'embedding_pooling_operation': 'max', 'threshold': 0.6883717437522006, 'batch_size': 214, 'attention_heads': 13, 'hidden_dimension': 163, 'number_of_hidden_layers': 1, 'dropout_rate': 0.5118193061867791, 'global_pooling': 'max', 'learning_rate': 0.0007713424292030567, 'weight_decay': 3.2637808034832e-05, 'beta_0': 0.8185948782019472, 'beta_1': 0.995046786499363, 'epsilon': 2.082744193747802e-05, 'balanced_loss': True, 'epochs': 191, 'early_stopping_patience': 19, 'plateau_patience': 23, 'plateau_divider': 10}. Best is trial 104 with value: 0.926605504587156.
[I 2024-12-02 19:06:50,601] Trial 109 finished with value: 0.9185779816513762 and parameters: {'attention_pooling_operation': 'mean', 'embedding_pooling_operation': 'max', 'threshold': 0.7262661370549395, 'batch_size': 209, 'attention_heads': 14, 'hidden_dimension': 183, 'number_of_hidden_layers': 1, 'dropout_rate': 0.5275572906318773, 'global_pooling': 'max', 'learning_rate': 0.0009821552845636586, 'weight_decay': 0.00013565750508983844, 'beta_0': 0.825194702087466, 'beta_1': 0.9970433906864632, 'epsilon': 5.490144232134125e-05, 'balanced_loss': True, 'epochs': 176, 'early_stopping_patience': 21, 'plateau_patience': 22, 'plateau_divider': 9}. Best is trial 104 with value: 0.926605504587156.
[I 2024-12-02 19:10:39,073] Trial 110 finished with value: 0.911697247706422 and parameters: {'attention_pooling_operation': 'mean', 'embedding_pooling_operation': 'max', 'threshold': 0.6711291441691537, 'batch_size': 187, 'attention_heads': 4, 'hidden_dimension': 191, 'number_of_hidden_layers': 0, 'dropout_rate': 0.536261781632019, 'global_pooling': 'sum', 'learning_rate': 0.0017916722980148422, 'weight_decay': 4.162171615411686e-05, 'beta_0': 0.805955576517246, 'beta_1': 0.9945585974494341, 'epsilon': 1.5237584924444004e-05, 'balanced_loss': True, 'epochs': 183, 'early_stopping_patience': 22, 'plateau_patience': 21, 'plateau_divider': 9}. Best is trial 104 with value: 0.926605504587156.
[I 2024-12-02 19:15:26,614] Trial 111 finished with value: 0.9197247706422018 and parameters: {'attention_pooling_operation': 'mean', 'embedding_pooling_operation': 'max', 'threshold': 0.6451228335339045, 'batch_size': 202, 'attention_heads': 13, 'hidden_dimension': 169, 'number_of_hidden_layers': 1, 'dropout_rate': 0.48242120349816897, 'global_pooling': 'max', 'learning_rate': 0.0024435543630581544, 'weight_decay': 2.8308701062404283e-05, 'beta_0': 0.8115425875275207, 'beta_1': 0.9976614323071032, 'epsilon': 2.852436430277561e-05, 'balanced_loss': True, 'epochs': 73, 'early_stopping_patience': 20, 'plateau_patience': 22, 'plateau_divider': 9}. Best is trial 104 with value: 0.926605504587156.
[I 2024-12-02 19:20:10,069] Trial 112 finished with value: 0.9139908256880734 and parameters: {'attention_pooling_operation': 'mean', 'embedding_pooling_operation': 'max', 'threshold': 0.6376530880874764, 'batch_size': 178, 'attention_heads': 12, 'hidden_dimension': 158, 'number_of_hidden_layers': 1, 'dropout_rate': 0.474733458344776, 'global_pooling': 'max', 'learning_rate': 0.001371920404661968, 'weight_decay': 4.814404620042388e-05, 'beta_0': 0.8031560194823192, 'beta_1': 0.998208522253407, 'epsilon': 8.05079253412031e-05, 'balanced_loss': True, 'epochs': 196, 'early_stopping_patience': 20, 'plateau_patience': 23, 'plateau_divider': 9}. Best is trial 104 with value: 0.926605504587156.
[I 2024-12-02 19:24:31,754] Trial 113 finished with value: 0.9208715596330275 and parameters: {'attention_pooling_operation': 'mean', 'embedding_pooling_operation': 'max', 'threshold': 0.6853839927638391, 'batch_size': 194, 'attention_heads': 13, 'hidden_dimension': 136, 'number_of_hidden_layers': 1, 'dropout_rate': 0.4963416039868514, 'global_pooling': 'max', 'learning_rate': 0.0010038528215971017, 'weight_decay': 8.537587510825144e-05, 'beta_0': 0.8167887343218156, 'beta_1': 0.9985854372384193, 'epsilon': 3.812534088163316e-05, 'balanced_loss': True, 'epochs': 57, 'early_stopping_patience': 13, 'plateau_patience': 24, 'plateau_divider': 5}. Best is trial 104 with value: 0.926605504587156.
[I 2024-12-02 19:29:09,722] Trial 114 finished with value: 0.9197247706422018 and parameters: {'attention_pooling_operation': 'mean', 'embedding_pooling_operation': 'max', 'threshold': 0.655255572358069, 'batch_size': 217, 'attention_heads': 12, 'hidden_dimension': 165, 'number_of_hidden_layers': 1, 'dropout_rate': 0.4663305775592592, 'global_pooling': 'max', 'learning_rate': 0.002108266345145587, 'weight_decay': 1.7718134428320813e-05, 'beta_0': 0.8088427747135053, 'beta_1': 0.9963666510967424, 'epsilon': 2.4046846689539176e-05, 'balanced_loss': True, 'epochs': 186, 'early_stopping_patience': 19, 'plateau_patience': 22, 'plateau_divider': 8}. Best is trial 104 with value: 0.926605504587156.
[I 2024-12-02 19:33:29,336] Trial 115 finished with value: 0.9220183486238532 and parameters: {'attention_pooling_operation': 'mean', 'embedding_pooling_operation': 'max', 'threshold': 0.6304131470469037, 'batch_size': 204, 'attention_heads': 13, 'hidden_dimension': 148, 'number_of_hidden_layers': 1, 'dropout_rate': 0.5055651010513535, 'global_pooling': 'max', 'learning_rate': 0.0015813265032548869, 'weight_decay': 1.4195758270029603e-05, 'beta_0': 0.8127868698342264, 'beta_1': 0.9972824133554586, 'epsilon': 3.953619075069489e-08, 'balanced_loss': True, 'epochs': 62, 'early_stopping_patience': 10, 'plateau_patience': 19, 'plateau_divider': 7}. Best is trial 104 with value: 0.926605504587156.
[I 2024-12-02 19:37:45,166] Trial 116 finished with value: 0.9151376146788991 and parameters: {'attention_pooling_operation': 'min', 'embedding_pooling_operation': 'max', 'threshold': 0.6006449683616786, 'batch_size': 228, 'attention_heads': 11, 'hidden_dimension': 140, 'number_of_hidden_layers': 1, 'dropout_rate': 0.48498622969827787, 'global_pooling': 'max', 'learning_rate': 0.0012135728605890091, 'weight_decay': 3.820275936580407e-05, 'beta_0': 0.8208925534824372, 'beta_1': 0.9919190473728627, 'epsilon': 3.093720148835095e-05, 'balanced_loss': True, 'epochs': 180, 'early_stopping_patience': 13, 'plateau_patience': 21, 'plateau_divider': 6}. Best is trial 104 with value: 0.926605504587156.
[I 2024-12-02 19:42:07,505] Trial 117 finished with value: 0.9151376146788991 and parameters: {'attention_pooling_operation': 'mean', 'embedding_pooling_operation': 'max', 'threshold': 0.6781329163962249, 'batch_size': 212, 'attention_heads': 14, 'hidden_dimension': 160, 'number_of_hidden_layers': 1, 'dropout_rate': 0.46243129952594564, 'global_pooling': 'max', 'learning_rate': 0.0007610413649915382, 'weight_decay': 9.813216528130381e-05, 'beta_0': 0.8148766052988461, 'beta_1': 0.9957841817651718, 'epsilon': 1.8966431048301004e-05, 'balanced_loss': True, 'epochs': 168, 'early_stopping_patience': 11, 'plateau_patience': 16, 'plateau_divider': 9}. Best is trial 104 with value: 0.926605504587156.
[I 2024-12-02 19:46:37,224] Trial 118 finished with value: 0.9197247706422018 and parameters: {'attention_pooling_operation': 'min', 'embedding_pooling_operation': 'mean', 'threshold': 0.7597609888944582, 'batch_size': 48, 'attention_heads': 12, 'hidden_dimension': 153, 'number_of_hidden_layers': 1, 'dropout_rate': 0.5164047240744972, 'global_pooling': 'max', 'learning_rate': 0.003760412193566534, 'weight_decay': 6.336187191539356e-05, 'beta_0': 0.8104862980136076, 'beta_1': 0.9941314348244117, 'epsilon': 6.427267434993631e-05, 'balanced_loss': True, 'epochs': 194, 'early_stopping_patience': 21, 'plateau_patience': 20, 'plateau_divider': 8}. Best is trial 104 with value: 0.926605504587156.
[I 2024-12-02 19:51:04,205] Trial 119 finished with value: 0.9174311926605505 and parameters: {'attention_pooling_operation': 'mean', 'embedding_pooling_operation': 'max', 'threshold': 0.6624296851849334, 'batch_size': 184, 'attention_heads': 13, 'hidden_dimension': 176, 'number_of_hidden_layers': 1, 'dropout_rate': 0.4940699227888653, 'global_pooling': 'max', 'learning_rate': 0.0005602417894152966, 'weight_decay': 3.106216991993614e-05, 'beta_0': 0.8184858843578324, 'beta_1': 0.9900683836873804, 'epsilon': 1.0632057362702938e-06, 'balanced_loss': True, 'epochs': 158, 'early_stopping_patience': 10, 'plateau_patience': 23, 'plateau_divider': 6}. Best is trial 104 with value: 0.926605504587156.
[I 2024-12-02 19:56:30,578] Trial 120 finished with value: 0.9208715596330275 and parameters: {'attention_pooling_operation': 'min', 'embedding_pooling_operation': 'mean', 'threshold': 0.7063768379816968, 'batch_size': 198, 'attention_heads': 14, 'hidden_dimension': 195, 'number_of_hidden_layers': 1, 'dropout_rate': 0.4896954339829158, 'global_pooling': 'max', 'learning_rate': 0.0004268844048517467, 'weight_decay': 0.0001898315254265773, 'beta_0': 0.8078718062662619, 'beta_1': 0.9968796604928581, 'epsilon': 5.038673049064104e-05, 'balanced_loss': True, 'epochs': 52, 'early_stopping_patience': 12, 'plateau_patience': 16, 'plateau_divider': 5}. Best is trial 104 with value: 0.926605504587156.
[I 2024-12-02 20:01:28,789] Trial 121 finished with value: 0.9243119266055045 and parameters: {'attention_pooling_operation': 'mean', 'embedding_pooling_operation': 'min', 'threshold': 0.6098711914379024, 'batch_size': 153, 'attention_heads': 13, 'hidden_dimension': 143, 'number_of_hidden_layers': 1, 'dropout_rate': 0.5537413408325749, 'global_pooling': 'max', 'learning_rate': 0.0003089247609980513, 'weight_decay': 2.4893331547622964e-05, 'beta_0': 0.822079611907359, 'beta_1': 0.9964371229549048, 'epsilon': 3.1741911583285595e-05, 'balanced_loss': True, 'epochs': 177, 'early_stopping_patience': 11, 'plateau_patience': 14, 'plateau_divider': 8}. Best is trial 104 with value: 0.926605504587156.
[I 2024-12-02 20:06:42,344] Trial 122 finished with value: 0.9174311926605505 and parameters: {'attention_pooling_operation': 'mean', 'embedding_pooling_operation': 'min', 'threshold': 0.6146711667058757, 'batch_size': 157, 'attention_heads': 13, 'hidden_dimension': 166, 'number_of_hidden_layers': 1, 'dropout_rate': 0.5815946007781835, 'global_pooling': 'max', 'learning_rate': 0.0002570233313056283, 'weight_decay': 2.5939526493301308e-05, 'beta_0': 0.8229017733187801, 'beta_1': 0.9977328358856984, 'epsilon': 2.648689569060385e-05, 'balanced_loss': True, 'epochs': 175, 'early_stopping_patience': 11, 'plateau_patience': 14, 'plateau_divider': 8}. Best is trial 104 with value: 0.926605504587156.
