[I 2024-11-28 14:18:18,383] Trial 93 finished with value: 0.9013761467889908 and parameters: {'attention_pooling_operation': 'max', 'embedding_pooling_operation': 'mean', 'threshold': 0.6933387410296423, 'batch_size': 152, 'attention_heads': 4, 'hidden_dimension': 240, 'number_of_hidden_layers': 2, 'dropout_rate': 0.5621433086248867, 'global_pooling': 'max', 'learning_rate': 0.0020840301275215746, 'weight_decay': 0.00041907306352970564, 'beta_0': 0.8715624081695394, 'beta_1': 0.9844885316435984, 'epsilon': 2.0259189826652042e-07, 'balanced_loss': False, 'epochs': 160, 'early_stopping_patience': 21, 'plateau_patience': 12, 'plateau_divider': 6}. Best is trial 35 with value: 0.9105504587155964.
[I 2024-11-28 14:25:30,833] Trial 94 finished with value: 0.893348623853211 and parameters: {'attention_pooling_operation': 'max', 'embedding_pooling_operation': 'mean', 'threshold': 0.6776358225527183, 'batch_size': 120, 'attention_heads': 14, 'hidden_dimension': 209, 'number_of_hidden_layers': 3, 'dropout_rate': 0.5218264649172426, 'global_pooling': 'max', 'learning_rate': 0.0036603484836273585, 'weight_decay': 0.0006262539280830585, 'beta_0': 0.8786948134245068, 'beta_1': 0.9901424623854864, 'epsilon': 3.571245904490029e-08, 'balanced_loss': False, 'epochs': 176, 'early_stopping_patience': 25, 'plateau_patience': 14, 'plateau_divider': 8}. Best is trial 35 with value: 0.9105504587155964.
[I 2024-11-28 14:29:43,009] Trial 95 finished with value: 0.8830275229357798 and parameters: {'attention_pooling_operation': 'max', 'embedding_pooling_operation': 'mean', 'threshold': 0.658336836111906, 'batch_size': 149, 'attention_heads': 5, 'hidden_dimension': 226, 'number_of_hidden_layers': 2, 'dropout_rate': 0.4042237471592314, 'global_pooling': 'max', 'learning_rate': 0.006678201081726269, 'weight_decay': 0.00046821972656469884, 'beta_0': 0.8892019582230687, 'beta_1': 0.9908009004425313, 'epsilon': 1.0091324391883072e-08, 'balanced_loss': False, 'epochs': 145, 'early_stopping_patience': 24, 'plateau_patience': 16, 'plateau_divider': 9}. Best is trial 35 with value: 0.9105504587155964.
[I 2024-11-28 14:34:32,487] Trial 96 finished with value: 0.8899082568807339 and parameters: {'attention_pooling_operation': 'max', 'embedding_pooling_operation': 'max', 'threshold': 0.4558169873030839, 'batch_size': 137, 'attention_heads': 6, 'hidden_dimension': 234, 'number_of_hidden_layers': 2, 'dropout_rate': 0.5266591963080215, 'global_pooling': 'sum', 'learning_rate': 0.0012271538579255957, 'weight_decay': 0.0008566093156118393, 'beta_0': 0.8684062623890038, 'beta_1': 0.9911746963893167, 'epsilon': 6.940242049900475e-05, 'balanced_loss': False, 'epochs': 140, 'early_stopping_patience': 24, 'plateau_patience': 10, 'plateau_divider': 5}. Best is trial 35 with value: 0.9105504587155964.
[I 2024-11-28 14:39:41,321] Trial 97 finished with value: 0.8979357798165137 and parameters: {'attention_pooling_operation': 'max', 'embedding_pooling_operation': 'min', 'threshold': 0.6319520659474581, 'batch_size': 116, 'attention_heads': 11, 'hidden_dimension': 247, 'number_of_hidden_layers': 1, 'dropout_rate': 0.4683176387379136, 'global_pooling': 'max', 'learning_rate': 0.0025854957943627775, 'weight_decay': 6.560172938481193e-05, 'beta_0': 0.8829402278396742, 'beta_1': 0.9895489764328967, 'epsilon': 4.4644306204606546e-05, 'balanced_loss': False, 'epochs': 127, 'early_stopping_patience': 21, 'plateau_patience': 13, 'plateau_divider': 7}. Best is trial 35 with value: 0.9105504587155964.
[I 2024-11-28 14:43:18,560] Trial 98 finished with value: 0.8922018348623854 and parameters: {'attention_pooling_operation': 'min', 'embedding_pooling_operation': 'min', 'threshold': 0.5885002676184475, 'batch_size': 101, 'attention_heads': 4, 'hidden_dimension': 109, 'number_of_hidden_layers': 2, 'dropout_rate': 0.3382131053706219, 'global_pooling': 'max', 'learning_rate': 0.0002624094547301054, 'weight_decay': 0.00031448223992585223, 'beta_0': 0.8933886125459036, 'beta_1': 0.9838768135535986, 'epsilon': 5.082822907787596e-07, 'balanced_loss': True, 'epochs': 188, 'early_stopping_patience': 19, 'plateau_patience': 12, 'plateau_divider': 4}. Best is trial 35 with value: 0.9105504587155964.
[I 2024-11-28 14:47:12,036] Trial 99 finished with value: 0.8967889908256881 and parameters: {'attention_pooling_operation': 'max', 'embedding_pooling_operation': 'mean', 'threshold': 0.5994939827064398, 'batch_size': 158, 'attention_heads': 7, 'hidden_dimension': 74, 'number_of_hidden_layers': 3, 'dropout_rate': 0.35747451913180156, 'global_pooling': 'mean', 'learning_rate': 0.0015556000026634626, 'weight_decay': 0.00055103776195602, 'beta_0': 0.8762279243445179, 'beta_1': 0.9922646415459542, 'epsilon': 9.088650510005212e-07, 'balanced_loss': False, 'epochs': 150, 'early_stopping_patience': 25, 'plateau_patience': 11, 'plateau_divider': 8}. Best is trial 35 with value: 0.9105504587155964.
[I 2024-11-28 14:52:21,625] Trial 100 finished with value: 0.8944954128440367 and parameters: {'attention_pooling_operation': 'max', 'embedding_pooling_operation': 'max', 'threshold': 0.5295713046800077, 'batch_size': 131, 'attention_heads': 15, 'hidden_dimension': 138, 'number_of_hidden_layers': 2, 'dropout_rate': 0.32174163122593424, 'global_pooling': 'max', 'learning_rate': 0.005035564200852076, 'weight_decay': 0.0009692205560326299, 'beta_0': 0.862950031322665, 'beta_1': 0.9931986675451923, 'epsilon': 1.591631644884274e-07, 'balanced_loss': False, 'epochs': 156, 'early_stopping_patience': 20, 'plateau_patience': 14, 'plateau_divider': 6}. Best is trial 35 with value: 0.9105504587155964.
[I 2024-11-28 14:56:40,610] Trial 101 finished with value: 0.9071100917431193 and parameters: {'attention_pooling_operation': 'max', 'embedding_pooling_operation': 'mean', 'threshold': 0.6543314794042133, 'batch_size': 155, 'attention_heads': 4, 'hidden_dimension': 244, 'number_of_hidden_layers': 2, 'dropout_rate': 0.5022358206787374, 'global_pooling': 'max', 'learning_rate': 0.001477255642801788, 'weight_decay': 0.0006996599330783879, 'beta_0': 0.8772373379286315, 'beta_1': 0.9910162439139447, 'epsilon': 8.606256592273516e-05, 'balanced_loss': False, 'epochs': 168, 'early_stopping_patience': 25, 'plateau_patience': 15, 'plateau_divider': 6}. Best is trial 35 with value: 0.9105504587155964.
[I 2024-11-28 15:00:53,703] Trial 102 finished with value: 0.9002293577981652 and parameters: {'attention_pooling_operation': 'max', 'embedding_pooling_operation': 'mean', 'threshold': 0.6524790821438976, 'batch_size': 142, 'attention_heads': 4, 'hidden_dimension': 239, 'number_of_hidden_layers': 2, 'dropout_rate': 0.49988512104784855, 'global_pooling': 'max', 'learning_rate': 0.0007979206282269279, 'weight_decay': 0.0007087253514603935, 'beta_0': 0.8797605852906679, 'beta_1': 0.9920468890932143, 'epsilon': 9.9255310475358e-05, 'balanced_loss': False, 'epochs': 174, 'early_stopping_patience': 25, 'plateau_patience': 15, 'plateau_divider': 6}. Best is trial 35 with value: 0.9105504587155964.
[I 2024-11-28 15:05:30,266] Trial 103 finished with value: 0.9048165137614679 and parameters: {'attention_pooling_operation': 'max', 'embedding_pooling_operation': 'mean', 'threshold': 0.6188692147937226, 'batch_size': 155, 'attention_heads': 5, 'hidden_dimension': 252, 'number_of_hidden_layers': 2, 'dropout_rate': 0.48724080023609384, 'global_pooling': 'max', 'learning_rate': 0.0022904342288999173, 'weight_decay': 0.0007161731025110399, 'beta_0': 0.8850278576101733, 'beta_1': 0.9915298366803392, 'epsilon': 6.672216961607413e-05, 'balanced_loss': False, 'epochs': 168, 'early_stopping_patience': 24, 'plateau_patience': 15, 'plateau_divider': 6}. Best is trial 35 with value: 0.9105504587155964.
[I 2024-11-28 15:10:05,105] Trial 104 finished with value: 0.8956422018348624 and parameters: {'attention_pooling_operation': 'max', 'embedding_pooling_operation': 'mean', 'threshold': 0.6225760536020482, 'batch_size': 166, 'attention_heads': 5, 'hidden_dimension': 253, 'number_of_hidden_layers': 2, 'dropout_rate': 0.48816395854799494, 'global_pooling': 'max', 'learning_rate': 0.00184744872403374, 'weight_decay': 0.000844356673284827, 'beta_0': 0.8860648671365436, 'beta_1': 0.9901941147429055, 'epsilon': 8.339512660206166e-05, 'balanced_loss': False, 'epochs': 183, 'early_stopping_patience': 24, 'plateau_patience': 16, 'plateau_divider': 6}. Best is trial 35 with value: 0.9105504587155964.
[I 2024-11-28 15:14:37,438] Trial 105 finished with value: 0.9002293577981652 and parameters: {'attention_pooling_operation': 'max', 'embedding_pooling_operation': 'mean', 'threshold': 0.5804307924836888, 'batch_size': 172, 'attention_heads': 5, 'hidden_dimension': 247, 'number_of_hidden_layers': 2, 'dropout_rate': 0.4544122580263368, 'global_pooling': 'max', 'learning_rate': 0.0029551517468546277, 'weight_decay': 0.0007410984370526131, 'beta_0': 0.8730603081652025, 'beta_1': 0.9907582936466661, 'epsilon': 6.815672346148462e-05, 'balanced_loss': False, 'epochs': 169, 'early_stopping_patience': 23, 'plateau_patience': 13, 'plateau_divider': 5}. Best is trial 35 with value: 0.9105504587155964.
[I 2024-11-28 15:19:29,544] Trial 106 finished with value: 0.8979357798165137 and parameters: {'attention_pooling_operation': 'mean', 'embedding_pooling_operation': 'min', 'threshold': 0.5051069828822289, 'batch_size': 154, 'attention_heads': 6, 'hidden_dimension': 231, 'number_of_hidden_layers': 2, 'dropout_rate': 0.5091819208419355, 'global_pooling': 'max', 'learning_rate': 0.004164315434229042, 'weight_decay': 0.00038132062783691157, 'beta_0': 0.8902916985042046, 'beta_1': 0.9826917206796758, 'epsilon': 5.6148462156463664e-05, 'balanced_loss': False, 'epochs': 88, 'early_stopping_patience': 24, 'plateau_patience': 18, 'plateau_divider': 6}. Best is trial 35 with value: 0.9105504587155964.
[I 2024-11-28 15:23:31,098] Trial 107 finished with value: 0.9036697247706422 and parameters: {'attention_pooling_operation': 'max', 'embedding_pooling_operation': 'min', 'threshold': 0.6398865639956316, 'batch_size': 148, 'attention_heads': 5, 'hidden_dimension': 220, 'number_of_hidden_layers': 2, 'dropout_rate': 0.43897819462515497, 'global_pooling': 'max', 'learning_rate': 0.002165610529942078, 'weight_decay': 1.9921072199111538e-06, 'beta_0': 0.8971284652101426, 'beta_1': 0.9806576337004822, 'epsilon': 3.90977776417879e-05, 'balanced_loss': False, 'epochs': 172, 'early_stopping_patience': 20, 'plateau_patience': 15, 'plateau_divider': 5}. Best is trial 35 with value: 0.9105504587155964.
[I 2024-11-28 15:28:20,526] Trial 108 finished with value: 0.9013761467889908 and parameters: {'attention_pooling_operation': 'max', 'embedding_pooling_operation': 'min', 'threshold': 0.6123532640576735, 'batch_size': 179, 'attention_heads': 13, 'hidden_dimension': 129, 'number_of_hidden_layers': 2, 'dropout_rate': 0.48346621667022655, 'global_pooling': 'max', 'learning_rate': 0.0032867917712673675, 'weight_decay': 0.0009899143064078296, 'beta_0': 0.8581437604956568, 'beta_1': 0.9913907270400965, 'epsilon': 1.2127721682000636e-05, 'balanced_loss': False, 'epochs': 166, 'early_stopping_patience': 23, 'plateau_patience': 12, 'plateau_divider': 6}. Best is trial 35 with value: 0.9105504587155964.
[I 2024-11-28 15:34:24,446] Trial 109 finished with value: 0.9002293577981652 and parameters: {'attention_pooling_operation': 'max', 'embedding_pooling_operation': 'max', 'threshold': 0.6909729786037813, 'batch_size': 160, 'attention_heads': 14, 'hidden_dimension': 236, 'number_of_hidden_layers': 2, 'dropout_rate': 0.517205659371653, 'global_pooling': 'max', 'learning_rate': 0.0025184095348820545, 'weight_decay': 0.0005845026575679519, 'beta_0': 0.8822073569718223, 'beta_1': 0.9895141079404088, 'epsilon': 4.869974436095841e-05, 'balanced_loss': True, 'epochs': 120, 'early_stopping_patience': 18, 'plateau_patience': 14, 'plateau_divider': 5}. Best is trial 35 with value: 0.9105504587155964.
[I 2024-11-28 15:38:52,779] Trial 110 finished with value: 0.8509174311926605 and parameters: {'attention_pooling_operation': 'max', 'embedding_pooling_operation': 'mean', 'threshold': 0.6276475196189315, 'batch_size': 47, 'attention_heads': 7, 'hidden_dimension': 214, 'number_of_hidden_layers': 2, 'dropout_rate': 0.3455315012379534, 'global_pooling': 'max', 'learning_rate': 0.008632259145808079, 'weight_decay': 0.0004801505371542071, 'beta_0': 0.8842127294201306, 'beta_1': 0.9853019718960532, 'epsilon': 3.404785613410538e-05, 'balanced_loss': False, 'epochs': 96, 'early_stopping_patience': 22, 'plateau_patience': 17, 'plateau_divider': 6}. Best is trial 35 with value: 0.9105504587155964.
[I 2024-11-28 15:43:09,606] Trial 111 finished with value: 0.9059633027522935 and parameters: {'attention_pooling_operation': 'max', 'embedding_pooling_operation': 'mean', 'threshold': 0.6729071449558821, 'batch_size': 136, 'attention_heads': 4, 'hidden_dimension': 242, 'number_of_hidden_layers': 2, 'dropout_rate': 0.5058416508500807, 'global_pooling': 'max', 'learning_rate': 0.0012975112088324198, 'weight_decay': 0.0006340415562282462, 'beta_0': 0.8406292636703346, 'beta_1': 0.9915791675680744, 'epsilon': 6.238456276154895e-05, 'balanced_loss': False, 'epochs': 159, 'early_stopping_patience': 25, 'plateau_patience': 15, 'plateau_divider': 6}. Best is trial 35 with value: 0.9105504587155964.
[I 2024-11-28 15:47:25,975] Trial 112 finished with value: 0.8967889908256881 and parameters: {'attention_pooling_operation': 'max', 'embedding_pooling_operation': 'mean', 'threshold': 0.6732492075856295, 'batch_size': 141, 'attention_heads': 4, 'hidden_dimension': 243, 'number_of_hidden_layers': 2, 'dropout_rate': 0.5325376259520126, 'global_pooling': 'max', 'learning_rate': 0.0016197267969057275, 'weight_decay': 0.0007109716169145092, 'beta_0': 0.8379873283384112, 'beta_1': 0.988493471544459, 'epsilon': 6.442587064561549e-05, 'balanced_loss': False, 'epochs': 134, 'early_stopping_patience': 24, 'plateau_patience': 16, 'plateau_divider': 6}. Best is trial 35 with value: 0.9105504587155964.
[I 2024-11-28 15:51:44,639] Trial 113 finished with value: 0.8979357798165137 and parameters: {'attention_pooling_operation': 'max', 'embedding_pooling_operation': 'mean', 'threshold': 0.6407750818165524, 'batch_size': 136, 'attention_heads': 5, 'hidden_dimension': 251, 'number_of_hidden_layers': 2, 'dropout_rate': 0.471367359633337, 'global_pooling': 'max', 'learning_rate': 0.001354581381646663, 'weight_decay': 0.0008229534967076728, 'beta_0': 0.8353821577342412, 'beta_1': 0.9946499310892728, 'epsilon': 8.490012559334702e-05, 'balanced_loss': False, 'epochs': 153, 'early_stopping_patience': 25, 'plateau_patience': 14, 'plateau_divider': 6}. Best is trial 35 with value: 0.9105504587155964.
[I 2024-11-28 15:56:38,340] Trial 114 finished with value: 0.9002293577981652 and parameters: {'attention_pooling_operation': 'max', 'embedding_pooling_operation': 'mean', 'threshold': 0.6594766525361093, 'batch_size': 145, 'attention_heads': 6, 'hidden_dimension': 256, 'number_of_hidden_layers': 2, 'dropout_rate': 0.5081870944093844, 'global_pooling': 'max', 'learning_rate': 0.0009798588762347557, 'weight_decay': 1.3400539582062313e-05, 'beta_0': 0.832349213527491, 'beta_1': 0.9929902582849396, 'epsilon': 2.5708646100042583e-05, 'balanced_loss': False, 'epochs': 185, 'early_stopping_patience': 25, 'plateau_patience': 15, 'plateau_divider': 6}. Best is trial 35 with value: 0.9105504587155964.
[I 2024-11-28 16:00:26,745] Trial 115 finished with value: 0.8979357798165137 and parameters: {'attention_pooling_operation': 'max', 'embedding_pooling_operation': 'mean', 'threshold': 0.6076402107563443, 'batch_size': 156, 'attention_heads': 4, 'hidden_dimension': 223, 'number_of_hidden_layers': 2, 'dropout_rate': 0.4789951875224593, 'global_pooling': 'max', 'learning_rate': 0.0017631464367711624, 'weight_decay': 0.0006788343880183167, 'beta_0': 0.843466047667915, 'beta_1': 0.9935995014258621, 'epsilon': 1.8069730803588373e-05, 'balanced_loss': False, 'epochs': 168, 'early_stopping_patience': 19, 'plateau_patience': 12, 'plateau_divider': 6}. Best is trial 35 with value: 0.9105504587155964.
[I 2024-11-28 16:04:19,176] Trial 116 finished with value: 0.8979357798165137 and parameters: {'attention_pooling_operation': 'max', 'embedding_pooling_operation': 'min', 'threshold': 0.6804030314518573, 'batch_size': 188, 'attention_heads': 5, 'hidden_dimension': 157, 'number_of_hidden_layers': 2, 'dropout_rate': 0.3324660195042569, 'global_pooling': 'sum', 'learning_rate': 0.0022741738289388086, 'weight_decay': 0.00023209544518311556, 'beta_0': 0.8404191225589598, 'beta_1': 0.9910965047675074, 'epsilon': 8.739844537246903e-05, 'balanced_loss': False, 'epochs': 138, 'early_stopping_patience': 23, 'plateau_patience': 11, 'plateau_divider': 6}. Best is trial 35 with value: 0.9105504587155964.
[I 2024-11-28 16:10:58,328] Trial 117 finished with value: 0.8853211009174312 and parameters: {'attention_pooling_operation': 'min', 'embedding_pooling_operation': 'min', 'threshold': 0.5708918928910801, 'batch_size': 135, 'attention_heads': 13, 'hidden_dimension': 228, 'number_of_hidden_layers': 2, 'dropout_rate': 0.48824346387437023, 'global_pooling': 'max', 'learning_rate': 0.0005981770431997997, 'weight_decay': 0.000544225906748064, 'beta_0': 0.8879114460807208, 'beta_1': 0.9916531132224148, 'epsilon': 5.973245764432952e-05, 'balanced_loss': False, 'epochs': 175, 'early_stopping_patience': 21, 'plateau_patience': 14, 'plateau_divider': 6}. Best is trial 35 with value: 0.9105504587155964.
[I 2024-11-28 16:20:09,021] Trial 118 finished with value: 0.9002293577981652 and parameters: {'attention_pooling_operation': 'max', 'embedding_pooling_operation': 'max', 'threshold': 0.6966225516019883, 'batch_size': 123, 'attention_heads': 14, 'hidden_dimension': 235, 'number_of_hidden_layers': 3, 'dropout_rate': 0.38256750572687787, 'global_pooling': 'max', 'learning_rate': 0.0036876218572697173, 'weight_decay': 0.0008347090211499558, 'beta_0': 0.8509801312696819, 'beta_1': 0.9819723646590546, 'epsilon': 4.012723529643278e-05, 'balanced_loss': False, 'epochs': 164, 'early_stopping_patience': 24, 'plateau_patience': 11, 'plateau_divider': 6}. Best is trial 35 with value: 0.9105504587155964.
[I 2024-11-28 16:24:03,972] Trial 119 finished with value: 0.8979357798165137 and parameters: {'attention_pooling_operation': 'max', 'embedding_pooling_operation': 'mean', 'threshold': 0.7149845890758064, 'batch_size': 152, 'attention_heads': 6, 'hidden_dimension': 192, 'number_of_hidden_layers': 2, 'dropout_rate': 0.4626072400931593, 'global_pooling': 'max', 'learning_rate': 0.003005653983863264, 'weight_decay': 0.0004339655392301836, 'beta_0': 0.8776922975597888, 'beta_1': 0.9890522340550185, 'epsilon': 7.18424153357087e-05, 'balanced_loss': True, 'epochs': 159, 'early_stopping_patience': 20, 'plateau_patience': 13, 'plateau_divider': 7}. Best is trial 35 with value: 0.9105504587155964.
[I 2024-11-28 16:28:40,923] Trial 120 finished with value: 0.9013761467889908 and parameters: {'attention_pooling_operation': 'max', 'embedding_pooling_operation': 'min', 'threshold': 0.6216673312600932, 'batch_size': 163, 'attention_heads': 11, 'hidden_dimension': 148, 'number_of_hidden_layers': 2, 'dropout_rate': 0.3517668454243525, 'global_pooling': 'mean', 'learning_rate': 0.004819973970131072, 'weight_decay': 2.9611000531601257e-05, 'beta_0': 0.8741352949035122, 'beta_1': 0.9953318304377868, 'epsilon': 3.102549352144801e-05, 'balanced_loss': False, 'epochs': 144, 'early_stopping_patience': 25, 'plateau_patience': 10, 'plateau_divider': 6}. Best is trial 35 with value: 0.9105504587155964.
[I 2024-11-28 16:32:54,761] Trial 121 finished with value: 0.9036697247706422 and parameters: {'attention_pooling_operation': 'max', 'embedding_pooling_operation': 'mean', 'threshold': 0.6483672114979656, 'batch_size': 129, 'attention_heads': 4, 'hidden_dimension': 241, 'number_of_hidden_layers': 2, 'dropout_rate': 0.49844648364037347, 'global_pooling': 'max', 'learning_rate': 0.001164262624097902, 'weight_decay': 0.0006120856615358326, 'beta_0': 0.880614458987454, 'beta_1': 0.9922904669825651, 'epsilon': 5.64422197497747e-06, 'balanced_loss': False, 'epochs': 160, 'early_stopping_patience': 25, 'plateau_patience': 15, 'plateau_divider': 7}. Best is trial 35 with value: 0.9105504587155964.
[I 2024-11-28 16:37:09,791] Trial 122 finished with value: 0.9013761467889908 and parameters: {'attention_pooling_operation': 'max', 'embedding_pooling_operation': 'mean', 'threshold': 0.6339583371903941, 'batch_size': 111, 'attention_heads': 4, 'hidden_dimension': 246, 'number_of_hidden_layers': 2, 'dropout_rate': 0.5269463624230645, 'global_pooling': 'max', 'learning_rate': 0.00043382356417588755, 'weight_decay': 4.42441817379993e-05, 'beta_0': 0.8860743568401854, 'beta_1': 0.9918434785584014, 'epsilon': 6.118422339564907e-08, 'balanced_loss': False, 'epochs': 148, 'early_stopping_patience': 24, 'plateau_patience': 15, 'plateau_divider': 7}. Best is trial 35 with value: 0.9105504587155964.
[I 2024-11-28 16:41:30,251] Trial 123 finished with value: 0.8990825688073395 and parameters: {'attention_pooling_operation': 'max', 'embedding_pooling_operation': 'mean', 'threshold': 0.6645457436378881, 'batch_size': 145, 'attention_heads': 4, 'hidden_dimension': 238, 'number_of_hidden_layers': 2, 'dropout_rate': 0.5127673700869569, 'global_pooling': 'max', 'learning_rate': 0.0013655372071801797, 'weight_decay': 0.000903929810938751, 'beta_0': 0.8788878766788024, 'beta_1': 0.9902566589441288, 'epsilon': 4.6151560114622495e-05, 'balanced_loss': False, 'epochs': 155, 'early_stopping_patience': 25, 'plateau_patience': 16, 'plateau_divider': 7}. Best is trial 35 with value: 0.9105504587155964.
