[I 2024-12-18 13:18:27,018] Trial 62 finished with value: 0.944954128440367 and parameters: {'attention_pooling_operation': 'min', 'embedding_pooling_operation': 'min', 'threshold': 0.657126199086802, 'batch_size': 188, 'attention_heads': 6, 'hidden_dimension': 65, 'number_of_hidden_layers': 1, 'dropout_rate': 0.5654820539133256, 'global_pooling': 'max', 'learning_rate': 0.0014414070829232271, 'weight_decay': 3.1886872552861765e-06, 'beta_0': 0.8518427583652847, 'beta_1': 0.9887477296636108, 'epsilon': 3.0222705884115247e-07, 'balanced_loss': True, 'epochs': 183, 'early_stopping_patience': 13, 'plateau_patience': 14, 'plateau_divider': 3}. Best is trial 38 with value: 0.9495412844036697.
[I 2024-12-18 13:23:59,368] Trial 63 finished with value: 0.944954128440367 and parameters: {'attention_pooling_operation': 'min', 'embedding_pooling_operation': 'min', 'threshold': 0.5667495098389381, 'batch_size': 177, 'attention_heads': 5, 'hidden_dimension': 37, 'number_of_hidden_layers': 1, 'dropout_rate': 0.5845318205168862, 'global_pooling': 'max', 'learning_rate': 0.004389684865444202, 'weight_decay': 2.3843161027106182e-06, 'beta_0': 0.8268080989408948, 'beta_1': 0.9851595212215157, 'epsilon': 5.5250602260046e-07, 'balanced_loss': True, 'epochs': 170, 'early_stopping_patience': 16, 'plateau_patience': 12, 'plateau_divider': 2}. Best is trial 38 with value: 0.9495412844036697.
[I 2024-12-18 13:29:47,860] Trial 64 finished with value: 0.9415137614678899 and parameters: {'attention_pooling_operation': 'min', 'embedding_pooling_operation': 'min', 'threshold': 0.6075010189243525, 'batch_size': 143, 'attention_heads': 15, 'hidden_dimension': 76, 'number_of_hidden_layers': 1, 'dropout_rate': 0.5202647145146563, 'global_pooling': 'max', 'learning_rate': 0.002959881956529899, 'weight_decay': 4.256083480745893e-06, 'beta_0': 0.8443958948223095, 'beta_1': 0.9872546748216439, 'epsilon': 1.815726111349465e-07, 'balanced_loss': True, 'epochs': 190, 'early_stopping_patience': 12, 'plateau_patience': 16, 'plateau_divider': 6}. Best is trial 38 with value: 0.9495412844036697.
[I 2024-12-18 13:35:22,511] Trial 65 finished with value: 0.9426605504587156 and parameters: {'attention_pooling_operation': 'min', 'embedding_pooling_operation': 'min', 'threshold': 0.5241198964700103, 'batch_size': 127, 'attention_heads': 7, 'hidden_dimension': 88, 'number_of_hidden_layers': 0, 'dropout_rate': 0.49141163521445436, 'global_pooling': 'max', 'learning_rate': 0.0007215033001173879, 'weight_decay': 1.7400858856647375e-06, 'beta_0': 0.8595680856138367, 'beta_1': 0.98277886039284, 'epsilon': 1.5097943263227203e-06, 'balanced_loss': True, 'epochs': 160, 'early_stopping_patience': 14, 'plateau_patience': 19, 'plateau_divider': 3}. Best is trial 38 with value: 0.9495412844036697.
[I 2024-12-18 13:41:19,991] Trial 66 finished with value: 0.944954128440367 and parameters: {'attention_pooling_operation': 'min', 'embedding_pooling_operation': 'min', 'threshold': 0.6434482453472974, 'batch_size': 60, 'attention_heads': 4, 'hidden_dimension': 48, 'number_of_hidden_layers': 1, 'dropout_rate': 0.5528737340249148, 'global_pooling': 'max', 'learning_rate': 0.005647285553151444, 'weight_decay': 6.787034870801804e-06, 'beta_0': 0.8488561947592025, 'beta_1': 0.991021004323369, 'epsilon': 1.2341029766282632e-07, 'balanced_loss': True, 'epochs': 180, 'early_stopping_patience': 12, 'plateau_patience': 12, 'plateau_divider': 4}. Best is trial 38 with value: 0.9495412844036697.
[I 2024-12-18 13:47:08,238] Trial 67 finished with value: 0.9438073394495413 and parameters: {'attention_pooling_operation': 'min', 'embedding_pooling_operation': 'min', 'threshold': 0.5830232713478491, 'batch_size': 107, 'attention_heads': 6, 'hidden_dimension': 70, 'number_of_hidden_layers': 2, 'dropout_rate': 0.5304013164946336, 'global_pooling': 'max', 'learning_rate': 0.0014184027803426599, 'weight_decay': 2.870146587497647e-06, 'beta_0': 0.8306218299770901, 'beta_1': 0.9835322732828299, 'epsilon': 5.30302550483974e-05, 'balanced_loss': False, 'epochs': 97, 'early_stopping_patience': 17, 'plateau_patience': 14, 'plateau_divider': 5}. Best is trial 38 with value: 0.9495412844036697.
[I 2024-12-18 13:52:57,281] Trial 68 finished with value: 0.944954128440367 and parameters: {'attention_pooling_operation': 'mean', 'embedding_pooling_operation': 'min', 'threshold': 0.6204480808962028, 'batch_size': 149, 'attention_heads': 5, 'hidden_dimension': 153, 'number_of_hidden_layers': 1, 'dropout_rate': 0.5652908732282925, 'global_pooling': 'max', 'learning_rate': 0.0035075491864895326, 'weight_decay': 2.047646344527206e-06, 'beta_0': 0.839938879063548, 'beta_1': 0.9885843420147752, 'epsilon': 5.972993821278907e-06, 'balanced_loss': False, 'epochs': 175, 'early_stopping_patience': 15, 'plateau_patience': 15, 'plateau_divider': 4}. Best is trial 38 with value: 0.9495412844036697.
[I 2024-12-18 13:58:48,440] Trial 69 finished with value: 0.9369266055045872 and parameters: {'attention_pooling_operation': 'min', 'embedding_pooling_operation': 'mean', 'threshold': 0.7455724350888427, 'batch_size': 175, 'attention_heads': 14, 'hidden_dimension': 57, 'number_of_hidden_layers': 3, 'dropout_rate': 0.5805989663296618, 'global_pooling': 'max', 'learning_rate': 0.010253187814752098, 'weight_decay': 1.4799864855135713e-06, 'beta_0': 0.8658110034609006, 'beta_1': 0.982474714126537, 'epsilon': 9.037406722963639e-08, 'balanced_loss': True, 'epochs': 111, 'early_stopping_patience': 13, 'plateau_patience': 17, 'plateau_divider': 3}. Best is trial 38 with value: 0.9495412844036697.
[I 2024-12-18 14:04:38,240] Trial 70 finished with value: 0.9415137614678899 and parameters: {'attention_pooling_operation': 'max', 'embedding_pooling_operation': 'min', 'threshold': 0.49963948982834056, 'batch_size': 160, 'attention_heads': 4, 'hidden_dimension': 98, 'number_of_hidden_layers': 2, 'dropout_rate': 0.5883399484560359, 'global_pooling': 'sum', 'learning_rate': 0.000483398661690127, 'weight_decay': 9.023441848405016e-06, 'beta_0': 0.8374997168108526, 'beta_1': 0.9862265554693331, 'epsilon': 2.3255239838992667e-05, 'balanced_loss': False, 'epochs': 192, 'early_stopping_patience': 10, 'plateau_patience': 11, 'plateau_divider': 6}. Best is trial 38 with value: 0.9495412844036697.
[I 2024-12-18 14:10:38,765] Trial 71 finished with value: 0.9472477064220184 and parameters: {'attention_pooling_operation': 'min', 'embedding_pooling_operation': 'min', 'threshold': 0.5819353321096361, 'batch_size': 168, 'attention_heads': 5, 'hidden_dimension': 78, 'number_of_hidden_layers': 1, 'dropout_rate': 0.5623271804415596, 'global_pooling': 'max', 'learning_rate': 0.006277763472603579, 'weight_decay': 3.150104762534368e-06, 'beta_0': 0.8441417235867382, 'beta_1': 0.9897852921948515, 'epsilon': 2.6043503165635053e-07, 'balanced_loss': True, 'epochs': 200, 'early_stopping_patience': 14, 'plateau_patience': 14, 'plateau_divider': 2}. Best is trial 38 with value: 0.9495412844036697.
[I 2024-12-18 14:16:07,625] Trial 72 finished with value: 0.948394495412844 and parameters: {'attention_pooling_operation': 'min', 'embedding_pooling_operation': 'min', 'threshold': 0.5598998760245947, 'batch_size': 196, 'attention_heads': 5, 'hidden_dimension': 66, 'number_of_hidden_layers': 1, 'dropout_rate': 0.5429259752035736, 'global_pooling': 'max', 'learning_rate': 0.0046824624049388, 'weight_decay': 0.0007183491321679992, 'beta_0': 0.8536973821028428, 'beta_1': 0.9892119284672508, 'epsilon': 7.562973846022092e-08, 'balanced_loss': True, 'epochs': 186, 'early_stopping_patience': 12, 'plateau_patience': 13, 'plateau_divider': 2}. Best is trial 38 with value: 0.9495412844036697.
[I 2024-12-18 14:21:36,621] Trial 73 finished with value: 0.9438073394495413 and parameters: {'attention_pooling_operation': 'min', 'embedding_pooling_operation': 'min', 'threshold': 0.5505438301458743, 'batch_size': 200, 'attention_heads': 6, 'hidden_dimension': 67, 'number_of_hidden_layers': 1, 'dropout_rate': 0.5114516797416633, 'global_pooling': 'max', 'learning_rate': 0.0021684179823762326, 'weight_decay': 0.0007516042321310941, 'beta_0': 0.8722172396340988, 'beta_1': 0.987371717604018, 'epsilon': 8.520465135159612e-08, 'balanced_loss': True, 'epochs': 187, 'early_stopping_patience': 11, 'plateau_patience': 13, 'plateau_divider': 2}. Best is trial 38 with value: 0.9495412844036697.
[I 2024-12-18 14:27:03,302] Trial 74 finished with value: 0.9438073394495413 and parameters: {'attention_pooling_operation': 'min', 'embedding_pooling_operation': 'min', 'threshold': 0.6280649250152093, 'batch_size': 193, 'attention_heads': 5, 'hidden_dimension': 43, 'number_of_hidden_layers': 1, 'dropout_rate': 0.5509390375391607, 'global_pooling': 'max', 'learning_rate': 0.014766663207952157, 'weight_decay': 0.0004885116457467537, 'beta_0': 0.8523925780452052, 'beta_1': 0.9882797977961525, 'epsilon': 2.136461194443443e-08, 'balanced_loss': True, 'epochs': 194, 'early_stopping_patience': 12, 'plateau_patience': 13, 'plateau_divider': 2}. Best is trial 38 with value: 0.9495412844036697.
[I 2024-12-18 14:33:30,395] Trial 75 finished with value: 0.9472477064220184 and parameters: {'attention_pooling_operation': 'min', 'embedding_pooling_operation': 'max', 'threshold': 0.6022402064128146, 'batch_size': 230, 'attention_heads': 16, 'hidden_dimension': 129, 'number_of_hidden_layers': 1, 'dropout_rate': 0.5447464456539779, 'global_pooling': 'max', 'learning_rate': 0.004774596424570232, 'weight_decay': 0.00041047946981589463, 'beta_0': 0.8489577882243574, 'beta_1': 0.9903853837148988, 'epsilon': 3.96531770061233e-08, 'balanced_loss': True, 'epochs': 59, 'early_stopping_patience': 11, 'plateau_patience': 12, 'plateau_divider': 3}. Best is trial 38 with value: 0.9495412844036697.
[I 2024-12-18 14:39:08,266] Trial 76 finished with value: 0.9461009174311926 and parameters: {'attention_pooling_operation': 'min', 'embedding_pooling_operation': 'min', 'threshold': 0.5281000976430154, 'batch_size': 218, 'attention_heads': 7, 'hidden_dimension': 32, 'number_of_hidden_layers': 1, 'dropout_rate': 0.5355054563586427, 'global_pooling': 'max', 'learning_rate': 0.008438416589990453, 'weight_decay': 0.0006738505147258245, 'beta_0': 0.8552591404819677, 'beta_1': 0.9814902329563773, 'epsilon': 2.2858463589629134e-06, 'balanced_loss': True, 'epochs': 122, 'early_stopping_patience': 12, 'plateau_patience': 16, 'plateau_divider': 5}. Best is trial 38 with value: 0.9495412844036697.
[I 2024-12-18 14:44:57,730] Trial 77 finished with value: 0.9415137614678899 and parameters: {'attention_pooling_operation': 'min', 'embedding_pooling_operation': 'max', 'threshold': 0.7208987741303662, 'batch_size': 75, 'attention_heads': 4, 'hidden_dimension': 51, 'number_of_hidden_layers': 2, 'dropout_rate': 0.5916005462218207, 'global_pooling': 'mean', 'learning_rate': 0.003038396446096344, 'weight_decay': 0.0008408320276678845, 'beta_0': 0.8111730083833036, 'beta_1': 0.989275716894114, 'epsilon': 4.4175822413638773e-07, 'balanced_loss': True, 'epochs': 74, 'early_stopping_patience': 13, 'plateau_patience': 13, 'plateau_divider': 3}. Best is trial 38 with value: 0.9495412844036697.
[I 2024-12-18 14:50:56,840] Trial 78 finished with value: 0.9461009174311926 and parameters: {'attention_pooling_operation': 'min', 'embedding_pooling_operation': 'min', 'threshold': 0.6610855702704488, 'batch_size': 189, 'attention_heads': 15, 'hidden_dimension': 85, 'number_of_hidden_layers': 1, 'dropout_rate': 0.5258359141627561, 'global_pooling': 'max', 'learning_rate': 0.0015816698848495473, 'weight_decay': 0.00031746949893372855, 'beta_0': 0.8597053114417312, 'beta_1': 0.9914550192149074, 'epsilon': 8.357624714772514e-07, 'balanced_loss': False, 'epochs': 134, 'early_stopping_patience': 16, 'plateau_patience': 24, 'plateau_divider': 4}. Best is trial 38 with value: 0.9495412844036697.
[I 2024-12-18 14:56:24,018] Trial 79 finished with value: 0.9357798165137615 and parameters: {'attention_pooling_operation': 'min', 'embedding_pooling_operation': 'max', 'threshold': 0.687781845159281, 'batch_size': 140, 'attention_heads': 9, 'hidden_dimension': 59, 'number_of_hidden_layers': 0, 'dropout_rate': 0.33268913266743294, 'global_pooling': 'sum', 'learning_rate': 0.019703086735379714, 'weight_decay': 4.068404185000471e-05, 'beta_0': 0.8568207820844747, 'beta_1': 0.9931043418231428, 'epsilon': 8.219110040897084e-05, 'balanced_loss': True, 'epochs': 170, 'early_stopping_patience': 12, 'plateau_patience': 10, 'plateau_divider': 5}. Best is trial 38 with value: 0.9495412844036697.
[I 2024-12-18 15:04:05,232] Trial 80 finished with value: 0.9403669724770642 and parameters: {'attention_pooling_operation': 'min', 'embedding_pooling_operation': 'min', 'threshold': 0.7642846059486118, 'batch_size': 33, 'attention_heads': 6, 'hidden_dimension': 38, 'number_of_hidden_layers': 1, 'dropout_rate': 0.5807217248058197, 'global_pooling': 'max', 'learning_rate': 2.921284787874865e-05, 'weight_decay': 4.904942600626157e-06, 'beta_0': 0.8490816644868336, 'beta_1': 0.9807506929345566, 'epsilon': 2.9403478506611572e-05, 'balanced_loss': False, 'epochs': 113, 'early_stopping_patience': 14, 'plateau_patience': 20, 'plateau_divider': 2}. Best is trial 38 with value: 0.9495412844036697.
[I 2024-12-18 15:09:53,360] Trial 81 finished with value: 0.9426605504587156 and parameters: {'attention_pooling_operation': 'min', 'embedding_pooling_operation': 'min', 'threshold': 0.575023070224661, 'batch_size': 171, 'attention_heads': 5, 'hidden_dimension': 94, 'number_of_hidden_layers': 1, 'dropout_rate': 0.5640748535220286, 'global_pooling': 'max', 'learning_rate': 0.0045335543825601185, 'weight_decay': 3.607885301483537e-06, 'beta_0': 0.8421108163047091, 'beta_1': 0.9896872856231489, 'epsilon': 1.2010971174690907e-07, 'balanced_loss': True, 'epochs': 184, 'early_stopping_patience': 14, 'plateau_patience': 14, 'plateau_divider': 2}. Best is trial 38 with value: 0.9495412844036697.
[I 2024-12-18 15:15:25,035] Trial 82 finished with value: 0.948394495412844 and parameters: {'attention_pooling_operation': 'min', 'embedding_pooling_operation': 'min', 'threshold': 0.5917512550038518, 'batch_size': 160, 'attention_heads': 5, 'hidden_dimension': 81, 'number_of_hidden_layers': 1, 'dropout_rate': 0.5714395128619623, 'global_pooling': 'max', 'learning_rate': 0.005438925496681226, 'weight_decay': 2.085405576931227e-06, 'beta_0': 0.8445206520127452, 'beta_1': 0.9856643981037881, 'epsilon': 7.495973049580284e-08, 'balanced_loss': True, 'epochs': 187, 'early_stopping_patience': 13, 'plateau_patience': 14, 'plateau_divider': 2}. Best is trial 38 with value: 0.9495412844036697.
[I 2024-12-18 15:20:58,669] Trial 83 finished with value: 0.9438073394495413 and parameters: {'attention_pooling_operation': 'min', 'embedding_pooling_operation': 'min', 'threshold': 0.5625642813943532, 'batch_size': 185, 'attention_heads': 5, 'hidden_dimension': 72, 'number_of_hidden_layers': 1, 'dropout_rate': 0.5721209169085699, 'global_pooling': 'max', 'learning_rate': 0.002405320557356492, 'weight_decay': 0.00010515236571032009, 'beta_0': 0.8389826999437263, 'beta_1': 0.9867665565682106, 'epsilon': 9.844762737919847e-08, 'balanced_loss': True, 'epochs': 195, 'early_stopping_patience': 13, 'plateau_patience': 15, 'plateau_divider': 2}. Best is trial 38 with value: 0.9495412844036697.
[I 2024-12-18 15:26:42,928] Trial 84 finished with value: 0.9495412844036697 and parameters: {'attention_pooling_operation': 'min', 'embedding_pooling_operation': 'min', 'threshold': 0.593676173820639, 'batch_size': 178, 'attention_heads': 4, 'hidden_dimension': 47, 'number_of_hidden_layers': 2, 'dropout_rate': 0.5982157963320043, 'global_pooling': 'max', 'learning_rate': 0.003317372178433627, 'weight_decay': 2.4344001566722177e-06, 'beta_0': 0.8350926179644306, 'beta_1': 0.9846472622249753, 'epsilon': 2.974494998201832e-08, 'balanced_loss': True, 'epochs': 188, 'early_stopping_patience': 13, 'plateau_patience': 14, 'plateau_divider': 3}. Best is trial 38 with value: 0.9495412844036697.
[I 2024-12-18 15:32:23,563] Trial 85 finished with value: 0.944954128440367 and parameters: {'attention_pooling_operation': 'min', 'embedding_pooling_operation': 'min', 'threshold': 0.5971497242718172, 'batch_size': 181, 'attention_heads': 4, 'hidden_dimension': 45, 'number_of_hidden_layers': 2, 'dropout_rate': 0.5991365320298793, 'global_pooling': 'max', 'learning_rate': 0.0037003869626608035, 'weight_decay': 1.3637702320334129e-06, 'beta_0': 0.8329678580473403, 'beta_1': 0.9846056672925062, 'epsilon': 6.730722438507313e-08, 'balanced_loss': True, 'epochs': 190, 'early_stopping_patience': 13, 'plateau_patience': 15, 'plateau_divider': 3}. Best is trial 38 with value: 0.9495412844036697.
[I 2024-12-18 15:38:02,462] Trial 86 finished with value: 0.9426605504587156 and parameters: {'attention_pooling_operation': 'max', 'embedding_pooling_operation': 'max', 'threshold': 0.5395370035228716, 'batch_size': 161, 'attention_heads': 4, 'hidden_dimension': 64, 'number_of_hidden_layers': 2, 'dropout_rate': 0.5921553518801324, 'global_pooling': 'max', 'learning_rate': 0.001996123384506736, 'weight_decay': 2.4287156656777192e-06, 'beta_0': 0.83617381715104, 'beta_1': 0.9853582811893435, 'epsilon': 3.4210074830396635e-08, 'balanced_loss': True, 'epochs': 173, 'early_stopping_patience': 11, 'plateau_patience': 12, 'plateau_divider': 4}. Best is trial 38 with value: 0.9495412844036697.
[I 2024-12-18 15:44:22,905] Trial 87 finished with value: 0.9426605504587156 and parameters: {'attention_pooling_operation': 'mean', 'embedding_pooling_operation': 'min', 'threshold': 0.5918976953093422, 'batch_size': 118, 'attention_heads': 13, 'hidden_dimension': 53, 'number_of_hidden_layers': 2, 'dropout_rate': 0.5802462670086109, 'global_pooling': 'max', 'learning_rate': 0.0008742414521429644, 'weight_decay': 1.1251767398933983e-06, 'beta_0': 0.8286486307937385, 'beta_1': 0.9857845942791174, 'epsilon': 1.824104552550845e-08, 'balanced_loss': False, 'epochs': 93, 'early_stopping_patience': 20, 'plateau_patience': 13, 'plateau_divider': 3}. Best is trial 38 with value: 0.9495412844036697.
[I 2024-12-18 15:50:01,348] Trial 88 finished with value: 0.9438073394495413 and parameters: {'attention_pooling_operation': 'min', 'embedding_pooling_operation': 'mean', 'threshold': 0.5588842640761413, 'batch_size': 207, 'attention_heads': 4, 'hidden_dimension': 38, 'number_of_hidden_layers': 2, 'dropout_rate': 0.575402958076628, 'global_pooling': 'sum', 'learning_rate': 0.008300838059474226, 'weight_decay': 1.975728252759218e-06, 'beta_0': 0.8434603490522924, 'beta_1': 0.983758197629997, 'epsilon': 1.5722499860400494e-05, 'balanced_loss': True, 'epochs': 102, 'early_stopping_patience': 12, 'plateau_patience': 16, 'plateau_divider': 10}. Best is trial 38 with value: 0.9495412844036697.
[I 2024-12-18 15:56:16,549] Trial 89 finished with value: 0.9461009174311926 and parameters: {'attention_pooling_operation': 'min', 'embedding_pooling_operation': 'min', 'threshold': 0.6132900909815425, 'batch_size': 43, 'attention_heads': 6, 'hidden_dimension': 49, 'number_of_hidden_layers': 3, 'dropout_rate': 0.591152624306822, 'global_pooling': 'max', 'learning_rate': 0.0012550819667062128, 'weight_decay': 0.000604685455986806, 'beta_0': 0.8225502702293319, 'beta_1': 0.9844571291016473, 'epsilon': 4.3728146223555526e-08, 'balanced_loss': True, 'epochs': 119, 'early_stopping_patience': 13, 'plateau_patience': 18, 'plateau_divider': 3}. Best is trial 38 with value: 0.9495412844036697.
[I 2024-12-18 16:02:05,597] Trial 90 finished with value: 0.9415137614678899 and parameters: {'attention_pooling_operation': 'min', 'embedding_pooling_operation': 'max', 'threshold': 0.6453985903571826, 'batch_size': 200, 'attention_heads': 10, 'hidden_dimension': 56, 'number_of_hidden_layers': 4, 'dropout_rate': 0.5455595377181762, 'global_pooling': 'mean', 'learning_rate': 0.0029084217515979636, 'weight_decay': 2.6335470765010115e-06, 'beta_0': 0.8729880824779883, 'beta_1': 0.9801825491511645, 'epsilon': 2.6937815386397098e-08, 'balanced_loss': False, 'epochs': 81, 'early_stopping_patience': 12, 'plateau_patience': 15, 'plateau_divider': 5}. Best is trial 38 with value: 0.9495412844036697.
[I 2024-12-18 16:07:40,597] Trial 91 finished with value: 0.9461009174311926 and parameters: {'attention_pooling_operation': 'min', 'embedding_pooling_operation': 'min', 'threshold': 0.6266849296065813, 'batch_size': 178, 'attention_heads': 5, 'hidden_dimension': 81, 'number_of_hidden_layers': 1, 'dropout_rate': 0.5588957625098279, 'global_pooling': 'max', 'learning_rate': 0.005181546496096611, 'weight_decay': 4.030642490084437e-06, 'beta_0': 0.8527997844332137, 'beta_1': 0.9859772527589041, 'epsilon': 6.232035420991011e-05, 'balanced_loss': True, 'epochs': 178, 'early_stopping_patience': 15, 'plateau_patience': 14, 'plateau_divider': 2}. Best is trial 38 with value: 0.9495412844036697.
[I 2024-12-18 16:13:27,873] Trial 92 finished with value: 0.9438073394495413 and parameters: {'attention_pooling_operation': 'min', 'embedding_pooling_operation': 'min', 'threshold': 0.6663866187462025, 'batch_size': 152, 'attention_heads': 5, 'hidden_dimension': 66, 'number_of_hidden_layers': 1, 'dropout_rate': 0.5680122615082904, 'global_pooling': 'max', 'learning_rate': 0.011887089094950707, 'weight_decay': 1.9115458706898905e-06, 'beta_0': 0.8467634144580493, 'beta_1': 0.9849691711608962, 'epsilon': 1.2652417150082597e-08, 'balanced_loss': True, 'epochs': 183, 'early_stopping_patience': 14, 'plateau_patience': 13, 'plateau_divider': 2}. Best is trial 38 with value: 0.9495412844036697.
