[I 2024-12-02 12:49:36,397] Trial 30 finished with value: 0.908256880733945 and parameters: {'attention_pooling_operation': 'mean', 'embedding_pooling_operation': 'mean', 'threshold': 0.6053177765263524, 'batch_size': 255, 'attention_heads': 12, 'hidden_dimension': 170, 'number_of_hidden_layers': 1, 'dropout_rate': 0.3442291617903467, 'global_pooling': 'mean', 'learning_rate': 3.25375441995887e-05, 'weight_decay': 4.795900312677642e-06, 'beta_0': 0.8435704286725415, 'beta_1': 0.9839075109109112, 'epsilon': 3.4472976463016664e-05, 'balanced_loss': False, 'epochs': 113, 'early_stopping_patience': 25, 'plateau_patience': 24, 'plateau_divider': 8}. Best is trial 12 with value: 0.9220183486238532.
[I 2024-12-02 12:56:45,856] Trial 31 finished with value: 0.9162844036697247 and parameters: {'attention_pooling_operation': 'max', 'embedding_pooling_operation': 'min', 'threshold': 0.5405126797029913, 'batch_size': 229, 'attention_heads': 15, 'hidden_dimension': 198, 'number_of_hidden_layers': 2, 'dropout_rate': 0.5882098034663866, 'global_pooling': 'mean', 'learning_rate': 0.0004562080462174452, 'weight_decay': 6.853812320432655e-06, 'beta_0': 0.8073439563802696, 'beta_1': 0.9849730081222164, 'epsilon': 8.602338611343137e-07, 'balanced_loss': False, 'epochs': 178, 'early_stopping_patience': 16, 'plateau_patience': 17, 'plateau_divider': 6}. Best is trial 12 with value: 0.9220183486238532.
[I 2024-12-02 13:01:31,671] Trial 32 finished with value: 0.9174311926605505 and parameters: {'attention_pooling_operation': 'max', 'embedding_pooling_operation': 'min', 'threshold': 0.43536460034622293, 'batch_size': 237, 'attention_heads': 7, 'hidden_dimension': 208, 'number_of_hidden_layers': 1, 'dropout_rate': 0.5011159208071598, 'global_pooling': 'mean', 'learning_rate': 0.0002914125812095282, 'weight_decay': 5.064056786906885e-06, 'beta_0': 0.8719939256998518, 'beta_1': 0.9872043192880285, 'epsilon': 1.8552961690674742e-06, 'balanced_loss': True, 'epochs': 166, 'early_stopping_patience': 18, 'plateau_patience': 21, 'plateau_divider': 7}. Best is trial 12 with value: 0.9220183486238532.
[I 2024-12-02 13:10:02,732] Trial 33 finished with value: 0.9139908256880734 and parameters: {'attention_pooling_operation': 'max', 'embedding_pooling_operation': 'mean', 'threshold': 0.40197019551655677, 'batch_size': 209, 'attention_heads': 16, 'hidden_dimension': 230, 'number_of_hidden_layers': 2, 'dropout_rate': 0.5993709873006535, 'global_pooling': 'mean', 'learning_rate': 0.000863125180457001, 'weight_decay': 2.237030509302009e-06, 'beta_0': 0.885245846457442, 'beta_1': 0.9822094095331544, 'epsilon': 1.8432065244372976e-07, 'balanced_loss': False, 'epochs': 132, 'early_stopping_patience': 12, 'plateau_patience': 22, 'plateau_divider': 6}. Best is trial 12 with value: 0.9220183486238532.
[I 2024-12-02 13:13:48,689] Trial 34 finished with value: 0.8990825688073395 and parameters: {'attention_pooling_operation': 'max', 'embedding_pooling_operation': 'min', 'threshold': 0.9385391981804541, 'batch_size': 132, 'attention_heads': 10, 'hidden_dimension': 192, 'number_of_hidden_layers': 1, 'dropout_rate': 0.4630375645248093, 'global_pooling': 'mean', 'learning_rate': 0.0010371550360612405, 'weight_decay': 1.3437784395399079e-06, 'beta_0': 0.8966288619788193, 'beta_1': 0.9914166091789938, 'epsilon': 2.492352161511689e-07, 'balanced_loss': False, 'epochs': 159, 'early_stopping_patience': 11, 'plateau_patience': 20, 'plateau_divider': 5}. Best is trial 12 with value: 0.9220183486238532.
[I 2024-12-02 13:22:57,501] Trial 35 finished with value: 0.9162844036697247 and parameters: {'attention_pooling_operation': 'max', 'embedding_pooling_operation': 'min', 'threshold': 0.5815428809496715, 'batch_size': 108, 'attention_heads': 14, 'hidden_dimension': 217, 'number_of_hidden_layers': 3, 'dropout_rate': 0.5547972590742798, 'global_pooling': 'mean', 'learning_rate': 0.0002482535235619443, 'weight_decay': 1.3950771330412246e-06, 'beta_0': 0.856077223431279, 'beta_1': 0.9890369370198889, 'epsilon': 3.452640604126396e-07, 'balanced_loss': False, 'epochs': 147, 'early_stopping_patience': 20, 'plateau_patience': 18, 'plateau_divider': 4}. Best is trial 12 with value: 0.9220183486238532.
[I 2024-12-02 13:27:48,610] Trial 36 finished with value: 0.9197247706422018 and parameters: {'attention_pooling_operation': 'min', 'embedding_pooling_operation': 'max', 'threshold': 0.5271129797923882, 'batch_size': 174, 'attention_heads': 9, 'hidden_dimension': 242, 'number_of_hidden_layers': 1, 'dropout_rate': 0.32400986164224527, 'global_pooling': 'mean', 'learning_rate': 0.0017915806990570298, 'weight_decay': 2.4003627491773583e-06, 'beta_0': 0.8434061480240568, 'beta_1': 0.9850931828177224, 'epsilon': 9.764552527382297e-08, 'balanced_loss': False, 'epochs': 161, 'early_stopping_patience': 23, 'plateau_patience': 24, 'plateau_divider': 7}. Best is trial 12 with value: 0.9220183486238532.
[I 2024-12-02 13:33:46,097] Trial 37 finished with value: 0.9059633027522935 and parameters: {'attention_pooling_operation': 'max', 'embedding_pooling_operation': 'mean', 'threshold': 0.4491257162348649, 'batch_size': 245, 'attention_heads': 8, 'hidden_dimension': 177, 'number_of_hidden_layers': 0, 'dropout_rate': 0.4027955965489751, 'global_pooling': 'max', 'learning_rate': 2.362365785355186e-05, 'weight_decay': 1.1249462681530584e-05, 'beta_0': 0.817995657516381, 'beta_1': 0.9859582732493414, 'epsilon': 5.281708316996964e-06, 'balanced_loss': True, 'epochs': 183, 'early_stopping_patience': 14, 'plateau_patience': 25, 'plateau_divider': 6}. Best is trial 12 with value: 0.9220183486238532.
[I 2024-12-02 13:41:07,863] Trial 38 finished with value: 0.9174311926605505 and parameters: {'attention_pooling_operation': 'max', 'embedding_pooling_operation': 'min', 'threshold': 0.7139659850849963, 'batch_size': 80, 'attention_heads': 13, 'hidden_dimension': 212, 'number_of_hidden_layers': 3, 'dropout_rate': 0.36400273823349955, 'global_pooling': 'sum', 'learning_rate': 0.0001292847620415283, 'weight_decay': 4.4029028803882436e-06, 'beta_0': 0.8291504411918528, 'beta_1': 0.9902832760178972, 'epsilon': 6.718504133656041e-07, 'balanced_loss': False, 'epochs': 129, 'early_stopping_patience': 16, 'plateau_patience': 23, 'plateau_divider': 8}. Best is trial 12 with value: 0.9220183486238532.
[I 2024-12-02 13:46:23,316] Trial 39 finished with value: 0.9243119266055045 and parameters: {'attention_pooling_operation': 'min', 'embedding_pooling_operation': 'mean', 'threshold': 0.8009269511074175, 'batch_size': 54, 'attention_heads': 16, 'hidden_dimension': 193, 'number_of_hidden_layers': 1, 'dropout_rate': 0.5729279322380856, 'global_pooling': 'max', 'learning_rate': 0.0007018770586439215, 'weight_decay': 7.909016120236349e-05, 'beta_0': 0.807172138918695, 'beta_1': 0.9940414192194085, 'epsilon': 2.790646345374876e-06, 'balanced_loss': True, 'epochs': 51, 'early_stopping_patience': 12, 'plateau_patience': 19, 'plateau_divider': 5}. Best is trial 39 with value: 0.9243119266055045.
[I 2024-12-02 13:50:47,765] Trial 40 finished with value: 0.9231651376146789 and parameters: {'attention_pooling_operation': 'min', 'embedding_pooling_operation': 'mean', 'threshold': 0.6716212122327833, 'batch_size': 220, 'attention_heads': 16, 'hidden_dimension': 159, 'number_of_hidden_layers': 1, 'dropout_rate': 0.4802328656888543, 'global_pooling': 'max', 'learning_rate': 0.0014173701341392338, 'weight_decay': 0.00011503867542374306, 'beta_0': 0.8060040121976655, 'beta_1': 0.9940758208464141, 'epsilon': 2.987354717518432e-06, 'balanced_loss': False, 'epochs': 52, 'early_stopping_patience': 12, 'plateau_patience': 16, 'plateau_divider': 4}. Best is trial 39 with value: 0.9243119266055045.
[I 2024-12-02 13:55:17,986] Trial 41 finished with value: 0.9243119266055045 and parameters: {'attention_pooling_operation': 'min', 'embedding_pooling_operation': 'mean', 'threshold': 0.6463167101156072, 'batch_size': 221, 'attention_heads': 16, 'hidden_dimension': 159, 'number_of_hidden_layers': 1, 'dropout_rate': 0.4817274061590874, 'global_pooling': 'max', 'learning_rate': 0.0017208103093890193, 'weight_decay': 0.00011426819446169171, 'beta_0': 0.8096747686708693, 'beta_1': 0.9941106231436705, 'epsilon': 3.0462859211466087e-06, 'balanced_loss': False, 'epochs': 56, 'early_stopping_patience': 12, 'plateau_patience': 15, 'plateau_divider': 3}. Best is trial 39 with value: 0.9243119266055045.
[I 2024-12-02 13:59:39,377] Trial 42 finished with value: 0.9220183486238532 and parameters: {'attention_pooling_operation': 'min', 'embedding_pooling_operation': 'mean', 'threshold': 0.6490584688006906, 'batch_size': 206, 'attention_heads': 16, 'hidden_dimension': 137, 'number_of_hidden_layers': 1, 'dropout_rate': 0.47521547983578594, 'global_pooling': 'max', 'learning_rate': 0.0013716433139626604, 'weight_decay': 0.00011577023489688644, 'beta_0': 0.8075878936336582, 'beta_1': 0.9940110183754802, 'epsilon': 3.5617978818556784e-06, 'balanced_loss': False, 'epochs': 55, 'early_stopping_patience': 12, 'plateau_patience': 16, 'plateau_divider': 3}. Best is trial 39 with value: 0.9243119266055045.
[I 2024-12-02 14:04:01,312] Trial 43 finished with value: 0.9151376146788991 and parameters: {'attention_pooling_operation': 'min', 'embedding_pooling_operation': 'mean', 'threshold': 0.6671940715993117, 'batch_size': 246, 'attention_heads': 16, 'hidden_dimension': 155, 'number_of_hidden_layers': 1, 'dropout_rate': 0.45045928860186013, 'global_pooling': 'max', 'learning_rate': 0.002328872786532878, 'weight_decay': 0.00013903516998925761, 'beta_0': 0.8073100760942657, 'beta_1': 0.9949183583342892, 'epsilon': 9.115085859004043e-06, 'balanced_loss': False, 'epochs': 64, 'early_stopping_patience': 14, 'plateau_patience': 15, 'plateau_divider': 3}. Best is trial 39 with value: 0.9243119266055045.
[I 2024-12-02 14:07:40,265] Trial 44 finished with value: 0.9128440366972477 and parameters: {'attention_pooling_operation': 'min', 'embedding_pooling_operation': 'mean', 'threshold': 0.6942226403506006, 'batch_size': 183, 'attention_heads': 15, 'hidden_dimension': 162, 'number_of_hidden_layers': 0, 'dropout_rate': 0.4854985429638924, 'global_pooling': 'max', 'learning_rate': 0.00990062660656131, 'weight_decay': 8.673323969461649e-05, 'beta_0': 0.8181879110118934, 'beta_1': 0.9924604123166189, 'epsilon': 2.503945782028555e-06, 'balanced_loss': False, 'epochs': 50, 'early_stopping_patience': 11, 'plateau_patience': 13, 'plateau_divider': 2}. Best is trial 39 with value: 0.9243119266055045.
[I 2024-12-02 14:11:47,819] Trial 45 finished with value: 0.9151376146788991 and parameters: {'attention_pooling_operation': 'min', 'embedding_pooling_operation': 'mean', 'threshold': 0.7808374163898694, 'batch_size': 160, 'attention_heads': 15, 'hidden_dimension': 126, 'number_of_hidden_layers': 1, 'dropout_rate': 0.5167045485444862, 'global_pooling': 'max', 'learning_rate': 0.0006791845677232108, 'weight_decay': 0.00029356930156934765, 'beta_0': 0.8002402222569709, 'beta_1': 0.9958649173694236, 'epsilon': 7.863921245235525e-06, 'balanced_loss': False, 'epochs': 80, 'early_stopping_patience': 12, 'plateau_patience': 16, 'plateau_divider': 4}. Best is trial 39 with value: 0.9243119266055045.
[I 2024-12-02 14:17:42,125] Trial 46 finished with value: 0.9197247706422018 and parameters: {'attention_pooling_operation': 'min', 'embedding_pooling_operation': 'mean', 'threshold': 0.8703793077254776, 'batch_size': 222, 'attention_heads': 16, 'hidden_dimension': 176, 'number_of_hidden_layers': 2, 'dropout_rate': 0.5741440571137575, 'global_pooling': 'max', 'learning_rate': 0.001120208470071884, 'weight_decay': 5.662159487060873e-05, 'beta_0': 0.8048892815887962, 'beta_1': 0.9970409867048661, 'epsilon': 5.50968114492612e-06, 'balanced_loss': True, 'epochs': 66, 'early_stopping_patience': 13, 'plateau_patience': 16, 'plateau_divider': 3}. Best is trial 39 with value: 0.9243119266055045.
[I 2024-12-02 14:21:59,220] Trial 47 finished with value: 0.9151376146788991 and parameters: {'attention_pooling_operation': 'min', 'embedding_pooling_operation': 'mean', 'threshold': 0.5772463170120656, 'batch_size': 239, 'attention_heads': 16, 'hidden_dimension': 101, 'number_of_hidden_layers': 1, 'dropout_rate': 0.5062219042637873, 'global_pooling': 'max', 'learning_rate': 0.0033397131467660054, 'weight_decay': 3.993683517153607e-05, 'beta_0': 0.8122708710084989, 'beta_1': 0.9929718656504993, 'epsilon': 1.367852504626127e-06, 'balanced_loss': False, 'epochs': 58, 'early_stopping_patience': 12, 'plateau_patience': 14, 'plateau_divider': 5}. Best is trial 39 with value: 0.9243119266055045.
[I 2024-12-02 14:25:48,129] Trial 48 finished with value: 0.9162844036697247 and parameters: {'attention_pooling_operation': 'min', 'embedding_pooling_operation': 'mean', 'threshold': 0.7096834290465641, 'batch_size': 49, 'attention_heads': 15, 'hidden_dimension': 186, 'number_of_hidden_layers': 0, 'dropout_rate': 0.4430936609685425, 'global_pooling': 'max', 'learning_rate': 0.001604892611187145, 'weight_decay': 0.00015874991270512203, 'beta_0': 0.8169224247416891, 'beta_1': 0.9944363975343462, 'epsilon': 4.3416580023182466e-06, 'balanced_loss': True, 'epochs': 78, 'early_stopping_patience': 11, 'plateau_patience': 11, 'plateau_divider': 2}. Best is trial 39 with value: 0.9243119266055045.
[I 2024-12-02 14:32:01,448] Trial 49 finished with value: 0.9105504587155964 and parameters: {'attention_pooling_operation': 'min', 'embedding_pooling_operation': 'mean', 'threshold': 0.6220160786894117, 'batch_size': 199, 'attention_heads': 16, 'hidden_dimension': 222, 'number_of_hidden_layers': 2, 'dropout_rate': 0.5351431267429576, 'global_pooling': 'max', 'learning_rate': 0.004105617866115394, 'weight_decay': 0.00023837545888111746, 'beta_0': 0.8091805952730047, 'beta_1': 0.9952568112381072, 'epsilon': 1.5690831870088815e-05, 'balanced_loss': False, 'epochs': 72, 'early_stopping_patience': 10, 'plateau_patience': 13, 'plateau_divider': 3}. Best is trial 39 with value: 0.9243119266055045.
[I 2024-12-02 14:36:30,646] Trial 50 finished with value: 0.9243119266055045 and parameters: {'attention_pooling_operation': 'min', 'embedding_pooling_operation': 'max', 'threshold': 0.6686777539475881, 'batch_size': 186, 'attention_heads': 13, 'hidden_dimension': 147, 'number_of_hidden_layers': 1, 'dropout_rate': 0.47861595571906174, 'global_pooling': 'max', 'learning_rate': 0.011982336920481639, 'weight_decay': 0.00034298293662907213, 'beta_0': 0.8209191718995879, 'beta_1': 0.9914306540554801, 'epsilon': 2.3350320615634595e-05, 'balanced_loss': True, 'epochs': 58, 'early_stopping_patience': 13, 'plateau_patience': 18, 'plateau_divider': 4}. Best is trial 39 with value: 0.9243119266055045.
[I 2024-12-02 14:40:43,477] Trial 51 finished with value: 0.9048165137614679 and parameters: {'attention_pooling_operation': 'min', 'embedding_pooling_operation': 'max', 'threshold': 0.6563540199718777, 'batch_size': 187, 'attention_heads': 13, 'hidden_dimension': 163, 'number_of_hidden_layers': 1, 'dropout_rate': 0.47689497679038223, 'global_pooling': 'max', 'learning_rate': 0.018794642066417955, 'weight_decay': 0.00046749742096314475, 'beta_0': 0.8045383870451207, 'beta_1': 0.9913728310653839, 'epsilon': 7.919582293951212e-05, 'balanced_loss': True, 'epochs': 60, 'early_stopping_patience': 14, 'plateau_patience': 15, 'plateau_divider': 4}. Best is trial 39 with value: 0.9243119266055045.
[I 2024-12-02 14:45:00,801] Trial 52 finished with value: 0.9162844036697247 and parameters: {'attention_pooling_operation': 'min', 'embedding_pooling_operation': 'max', 'threshold': 0.7254205159591681, 'batch_size': 201, 'attention_heads': 15, 'hidden_dimension': 147, 'number_of_hidden_layers': 1, 'dropout_rate': 0.43038100371364746, 'global_pooling': 'max', 'learning_rate': 0.008315795019607023, 'weight_decay': 0.0003555661311785624, 'beta_0': 0.8212166533246881, 'beta_1': 0.9936807015903067, 'epsilon': 5.1554140241581546e-05, 'balanced_loss': True, 'epochs': 51, 'early_stopping_patience': 13, 'plateau_patience': 18, 'plateau_divider': 4}. Best is trial 39 with value: 0.9243119266055045.
[I 2024-12-02 14:49:19,756] Trial 53 finished with value: 0.9162844036697247 and parameters: {'attention_pooling_operation': 'min', 'embedding_pooling_operation': 'max', 'threshold': 0.6852644321382491, 'batch_size': 141, 'attention_heads': 14, 'hidden_dimension': 131, 'number_of_hidden_layers': 1, 'dropout_rate': 0.49329648225416045, 'global_pooling': 'max', 'learning_rate': 0.0006660748066369471, 'weight_decay': 9.063028918969784e-05, 'beta_0': 0.8107986281660259, 'beta_1': 0.9918051754163275, 'epsilon': 2.6691027858519933e-05, 'balanced_loss': True, 'epochs': 70, 'early_stopping_patience': 11, 'plateau_patience': 16, 'plateau_divider': 4}. Best is trial 39 with value: 0.9243119266055045.
[I 2024-12-02 14:54:05,778] Trial 54 finished with value: 0.9151376146788991 and parameters: {'attention_pooling_operation': 'min', 'embedding_pooling_operation': 'max', 'threshold': 0.7707549968736512, 'batch_size': 218, 'attention_heads': 16, 'hidden_dimension': 173, 'number_of_hidden_layers': 1, 'dropout_rate': 0.4532190161386931, 'global_pooling': 'max', 'learning_rate': 0.00044486191031518506, 'weight_decay': 2.7415195945953857e-05, 'beta_0': 0.827092306998314, 'beta_1': 0.9974943419777085, 'epsilon': 6.7367850007221915e-06, 'balanced_loss': True, 'epochs': 60, 'early_stopping_patience': 12, 'plateau_patience': 17, 'plateau_divider': 5}. Best is trial 39 with value: 0.9243119266055045.
[I 2024-12-02 14:58:23,361] Trial 55 finished with value: 0.6731651376146789 and parameters: {'attention_pooling_operation': 'min', 'embedding_pooling_operation': 'max', 'threshold': 0.6022207689994067, 'batch_size': 165, 'attention_heads': 12, 'hidden_dimension': 156, 'number_of_hidden_layers': 2, 'dropout_rate': 0.5173924120482902, 'global_pooling': 'max', 'learning_rate': 0.03957777403179139, 'weight_decay': 0.00018851519047187232, 'beta_0': 0.8355436362901005, 'beta_1': 0.9908912074580536, 'epsilon': 2.483404396512076e-06, 'balanced_loss': True, 'epochs': 98, 'early_stopping_patience': 14, 'plateau_patience': 19, 'plateau_divider': 3}. Best is trial 39 with value: 0.9243119266055045.
[I 2024-12-02 15:02:26,627] Trial 56 finished with value: 0.9243119266055045 and parameters: {'attention_pooling_operation': 'min', 'embedding_pooling_operation': 'mean', 'threshold': 0.5564522143227613, 'batch_size': 111, 'attention_heads': 14, 'hidden_dimension': 116, 'number_of_hidden_layers': 1, 'dropout_rate': 0.48036514790073986, 'global_pooling': 'max', 'learning_rate': 0.0015549806436476778, 'weight_decay': 9.287354037751462e-05, 'beta_0': 0.8148443606993176, 'beta_1': 0.9931856555152124, 'epsilon': 1.7815310347299286e-05, 'balanced_loss': True, 'epochs': 78, 'early_stopping_patience': 10, 'plateau_patience': 14, 'plateau_divider': 5}. Best is trial 39 with value: 0.9243119266055045.
[I 2024-12-02 15:06:03,468] Trial 57 finished with value: 0.9162844036697247 and parameters: {'attention_pooling_operation': 'min', 'embedding_pooling_operation': 'mean', 'threshold': 0.8221091368791951, 'batch_size': 63, 'attention_heads': 13, 'hidden_dimension': 82, 'number_of_hidden_layers': 0, 'dropout_rate': 0.45795782672861013, 'global_pooling': 'max', 'learning_rate': 0.002386906706126079, 'weight_decay': 8.297645081460452e-05, 'beta_0': 0.8148578768772654, 'beta_1': 0.992965958235372, 'epsilon': 1.794947829814051e-05, 'balanced_loss': True, 'epochs': 78, 'early_stopping_patience': 13, 'plateau_patience': 14, 'plateau_divider': 5}. Best is trial 39 with value: 0.9243119266055045.
[I 2024-12-02 15:10:06,172] Trial 58 finished with value: 0.9013761467889908 and parameters: {'attention_pooling_operation': 'min', 'embedding_pooling_operation': 'mean', 'threshold': 0.6309872461472318, 'batch_size': 110, 'attention_heads': 14, 'hidden_dimension': 115, 'number_of_hidden_layers': 1, 'dropout_rate': 0.4791844014782839, 'global_pooling': 'max', 'learning_rate': 0.015350911921111246, 'weight_decay': 0.00012612372373163982, 'beta_0': 0.8218380097241396, 'beta_1': 0.9930553164839027, 'epsilon': 1.2500668085288396e-05, 'balanced_loss': True, 'epochs': 66, 'early_stopping_patience': 15, 'plateau_patience': 14, 'plateau_divider': 4}. Best is trial 39 with value: 0.9243119266055045.
[I 2024-12-02 15:14:28,722] Trial 59 finished with value: 0.9128440366972477 and parameters: {'attention_pooling_operation': 'min', 'embedding_pooling_operation': 'max', 'threshold': 0.5573356743395661, 'batch_size': 90, 'attention_heads': 11, 'hidden_dimension': 121, 'number_of_hidden_layers': 2, 'dropout_rate': 0.546124701678348, 'global_pooling': 'max', 'learning_rate': 0.0018428654540517731, 'weight_decay': 0.0006875838502737255, 'beta_0': 0.8049267689875215, 'beta_1': 0.9895078644117131, 'epsilon': 4.7372777417996724e-05, 'balanced_loss': True, 'epochs': 85, 'early_stopping_patience': 11, 'plateau_patience': 12, 'plateau_divider': 5}. Best is trial 39 with value: 0.9243119266055045.
[I 2024-12-02 15:19:06,113] Trial 60 finished with value: 0.9185779816513762 and parameters: {'attention_pooling_operation': 'min', 'embedding_pooling_operation': 'mean', 'threshold': 0.6708666705462613, 'batch_size': 119, 'attention_heads': 15, 'hidden_dimension': 105, 'number_of_hidden_layers': 1, 'dropout_rate': 0.5267591001789075, 'global_pooling': 'max', 'learning_rate': 0.006000529321385455, 'weight_decay': 6.704393554507788e-05, 'beta_0': 0.8152940410431437, 'beta_1': 0.9943338692823801, 'epsilon': 1.2098050692581997e-06, 'balanced_loss': True, 'epochs': 54, 'early_stopping_patience': 12, 'plateau_patience': 15, 'plateau_divider': 5}. Best is trial 39 with value: 0.9243119266055045.
