[I 2024-11-28 14:31:25,554] Trial 93 finished with value: 0.8990825688073395 and parameters: {'attention_pooling_operation': 'max', 'embedding_pooling_operation': 'mean', 'threshold': 0.5051107333377834, 'batch_size': 238, 'attention_heads': 12, 'hidden_dimension': 180, 'number_of_hidden_layers': 2, 'dropout_rate': 0.34907748282902534, 'global_pooling': 'max', 'learning_rate': 0.0006022064758764833, 'weight_decay': 1.768429528145511e-05, 'beta_0': 0.8553158424145865, 'beta_1': 0.9911219703260892, 'epsilon': 3.6491611315493667e-07, 'balanced_loss': False, 'epochs': 95, 'early_stopping_patience': 16, 'plateau_patience': 16, 'plateau_divider': 7}. Best is trial 73 with value: 0.908256880733945.
[I 2024-11-28 14:38:20,475] Trial 94 finished with value: 0.9013761467889908 and parameters: {'attention_pooling_operation': 'max', 'embedding_pooling_operation': 'mean', 'threshold': 0.44432641006823487, 'batch_size': 255, 'attention_heads': 13, 'hidden_dimension': 175, 'number_of_hidden_layers': 3, 'dropout_rate': 0.32758996530571854, 'global_pooling': 'max', 'learning_rate': 0.0016410721911207828, 'weight_decay': 4.956818561754786e-05, 'beta_0': 0.8770283915944043, 'beta_1': 0.99356130884964, 'epsilon': 2.9469240375573476e-06, 'balanced_loss': False, 'epochs': 101, 'early_stopping_patience': 24, 'plateau_patience': 16, 'plateau_divider': 9}. Best is trial 73 with value: 0.908256880733945.
[I 2024-11-28 14:42:57,268] Trial 95 finished with value: 0.8979357798165137 and parameters: {'attention_pooling_operation': 'max', 'embedding_pooling_operation': 'mean', 'threshold': 0.49104308052951046, 'batch_size': 105, 'attention_heads': 14, 'hidden_dimension': 166, 'number_of_hidden_layers': 1, 'dropout_rate': 0.4056620457030404, 'global_pooling': 'max', 'learning_rate': 0.0024006637980765848, 'weight_decay': 3.511491860972841e-05, 'beta_0': 0.8822023103725566, 'beta_1': 0.9924830146241338, 'epsilon': 1.2820856619488145e-06, 'balanced_loss': False, 'epochs': 122, 'early_stopping_patience': 20, 'plateau_patience': 17, 'plateau_divider': 7}. Best is trial 73 with value: 0.908256880733945.
[I 2024-11-28 14:47:57,965] Trial 96 finished with value: 0.8979357798165137 and parameters: {'attention_pooling_operation': 'max', 'embedding_pooling_operation': 'mean', 'threshold': 0.5838285099583054, 'batch_size': 226, 'attention_heads': 12, 'hidden_dimension': 204, 'number_of_hidden_layers': 2, 'dropout_rate': 0.30598113202754385, 'global_pooling': 'max', 'learning_rate': 0.0011714585790426923, 'weight_decay': 2.615215026107198e-05, 'beta_0': 0.8873054648493901, 'beta_1': 0.9903057610677966, 'epsilon': 2.3614854686910922e-07, 'balanced_loss': False, 'epochs': 127, 'early_stopping_patience': 19, 'plateau_patience': 21, 'plateau_divider': 8}. Best is trial 73 with value: 0.908256880733945.
[I 2024-11-28 14:51:59,447] Trial 97 finished with value: 0.9002293577981652 and parameters: {'attention_pooling_operation': 'max', 'embedding_pooling_operation': 'max', 'threshold': 0.4651365411079383, 'batch_size': 95, 'attention_heads': 13, 'hidden_dimension': 172, 'number_of_hidden_layers': 1, 'dropout_rate': 0.357816601357704, 'global_pooling': 'mean', 'learning_rate': 0.0028537466048763364, 'weight_decay': 8.96680089106433e-06, 'beta_0': 0.8640434582446069, 'beta_1': 0.9831008420512573, 'epsilon': 4.2837907143284013e-07, 'balanced_loss': False, 'epochs': 83, 'early_stopping_patience': 11, 'plateau_patience': 15, 'plateau_divider': 6}. Best is trial 73 with value: 0.908256880733945.
[I 2024-11-28 14:57:42,107] Trial 98 finished with value: 0.8876146788990825 and parameters: {'attention_pooling_operation': 'max', 'embedding_pooling_operation': 'mean', 'threshold': 0.529742108269154, 'batch_size': 161, 'attention_heads': 14, 'hidden_dimension': 192, 'number_of_hidden_layers': 2, 'dropout_rate': 0.3428510687220308, 'global_pooling': 'max', 'learning_rate': 0.005519598983947645, 'weight_decay': 2.430928648912622e-06, 'beta_0': 0.8678337253445302, 'beta_1': 0.9892066643665235, 'epsilon': 5.938990967466251e-07, 'balanced_loss': False, 'epochs': 106, 'early_stopping_patience': 14, 'plateau_patience': 17, 'plateau_divider': 6}. Best is trial 73 with value: 0.908256880733945.
[I 2024-11-28 15:01:13,586] Trial 99 finished with value: 0.8899082568807339 and parameters: {'attention_pooling_operation': 'mean', 'embedding_pooling_operation': 'mean', 'threshold': 0.6309925518230564, 'batch_size': 249, 'attention_heads': 15, 'hidden_dimension': 74, 'number_of_hidden_layers': 0, 'dropout_rate': 0.32085657422984876, 'global_pooling': 'max', 'learning_rate': 0.004034532408058559, 'weight_decay': 4.3158727474487526e-05, 'beta_0': 0.8478339926431643, 'beta_1': 0.9881951443277813, 'epsilon': 1.479195593514464e-07, 'balanced_loss': False, 'epochs': 109, 'early_stopping_patience': 21, 'plateau_patience': 15, 'plateau_divider': 9}. Best is trial 73 with value: 0.908256880733945.
[I 2024-11-28 15:05:19,128] Trial 100 finished with value: 0.8990825688073395 and parameters: {'attention_pooling_operation': 'max', 'embedding_pooling_operation': 'mean', 'threshold': 0.5476115813262583, 'batch_size': 111, 'attention_heads': 11, 'hidden_dimension': 138, 'number_of_hidden_layers': 2, 'dropout_rate': 0.3685519494815837, 'global_pooling': 'max', 'learning_rate': 0.0008015001398247705, 'weight_decay': 1.2820162416185682e-05, 'beta_0': 0.8505529514266641, 'beta_1': 0.9953326580948687, 'epsilon': 9.352655574575146e-07, 'balanced_loss': False, 'epochs': 138, 'early_stopping_patience': 12, 'plateau_patience': 14, 'plateau_divider': 8}. Best is trial 73 with value: 0.908256880733945.
[I 2024-11-28 15:10:24,122] Trial 101 finished with value: 0.8944954128440367 and parameters: {'attention_pooling_operation': 'max', 'embedding_pooling_operation': 'mean', 'threshold': 0.4289851960271928, 'batch_size': 241, 'attention_heads': 13, 'hidden_dimension': 144, 'number_of_hidden_layers': 2, 'dropout_rate': 0.33770742174617907, 'global_pooling': 'max', 'learning_rate': 0.001477255642801788, 'weight_decay': 0.00021881120308831224, 'beta_0': 0.8628779471258631, 'beta_1': 0.9886301808648398, 'epsilon': 4.717255167135572e-07, 'balanced_loss': False, 'epochs': 129, 'early_stopping_patience': 19, 'plateau_patience': 17, 'plateau_divider': 7}. Best is trial 73 with value: 0.908256880733945.
[I 2024-11-28 15:15:30,147] Trial 102 finished with value: 0.9025229357798165 and parameters: {'attention_pooling_operation': 'max', 'embedding_pooling_operation': 'mean', 'threshold': 0.4420467180002412, 'batch_size': 235, 'attention_heads': 13, 'hidden_dimension': 143, 'number_of_hidden_layers': 2, 'dropout_rate': 0.3303069764924261, 'global_pooling': 'max', 'learning_rate': 0.000985554603976642, 'weight_decay': 0.0003526087304388707, 'beta_0': 0.8440563507952954, 'beta_1': 0.9895433966108153, 'epsilon': 2.9812338476096775e-07, 'balanced_loss': False, 'epochs': 131, 'early_stopping_patience': 18, 'plateau_patience': 16, 'plateau_divider': 7}. Best is trial 73 with value: 0.908256880733945.
[I 2024-11-28 15:20:28,013] Trial 103 finished with value: 0.8956422018348624 and parameters: {'attention_pooling_operation': 'max', 'embedding_pooling_operation': 'mean', 'threshold': 0.4186448540867904, 'batch_size': 235, 'attention_heads': 12, 'hidden_dimension': 156, 'number_of_hidden_layers': 2, 'dropout_rate': 0.31147934914603553, 'global_pooling': 'max', 'learning_rate': 0.0011174075290493574, 'weight_decay': 0.00041974606892394904, 'beta_0': 0.8326455495348248, 'beta_1': 0.990795793598435, 'epsilon': 2.8344445423558036e-07, 'balanced_loss': False, 'epochs': 113, 'early_stopping_patience': 18, 'plateau_patience': 16, 'plateau_divider': 6}. Best is trial 73 with value: 0.908256880733945.
[I 2024-11-28 15:25:27,813] Trial 104 finished with value: 0.8956422018348624 and parameters: {'attention_pooling_operation': 'max', 'embedding_pooling_operation': 'mean', 'threshold': 0.5127873798010255, 'batch_size': 220, 'attention_heads': 14, 'hidden_dimension': 151, 'number_of_hidden_layers': 2, 'dropout_rate': 0.32812279661398386, 'global_pooling': 'max', 'learning_rate': 0.003215533840289968, 'weight_decay': 0.0006911249583208913, 'beta_0': 0.8599343999050411, 'beta_1': 0.9896447998904526, 'epsilon': 3.3130909358915007e-07, 'balanced_loss': False, 'epochs': 120, 'early_stopping_patience': 17, 'plateau_patience': 16, 'plateau_divider': 7}. Best is trial 73 with value: 0.908256880733945.
[I 2024-11-28 15:29:17,747] Trial 105 finished with value: 0.908256880733945 and parameters: {'attention_pooling_operation': 'max', 'embedding_pooling_operation': 'mean', 'threshold': 0.47891727696614644, 'batch_size': 229, 'attention_heads': 13, 'hidden_dimension': 46, 'number_of_hidden_layers': 2, 'dropout_rate': 0.3493885580428439, 'global_pooling': 'max', 'learning_rate': 0.0020511785534695097, 'weight_decay': 0.00038463679065511445, 'beta_0': 0.8393614478851716, 'beta_1': 0.9863822102195758, 'epsilon': 6.237671336402228e-08, 'balanced_loss': False, 'epochs': 116, 'early_stopping_patience': 18, 'plateau_patience': 16, 'plateau_divider': 7}. Best is trial 73 with value: 0.908256880733945.
[I 2024-11-28 15:33:49,752] Trial 106 finished with value: 0.893348623853211 and parameters: {'attention_pooling_operation': 'max', 'embedding_pooling_operation': 'min', 'threshold': 0.4830572680111817, 'batch_size': 230, 'attention_heads': 14, 'hidden_dimension': 93, 'number_of_hidden_layers': 2, 'dropout_rate': 0.3489094948949976, 'global_pooling': 'mean', 'learning_rate': 0.00010964683116419347, 'weight_decay': 0.0003139466914542082, 'beta_0': 0.8449827602680194, 'beta_1': 0.984786526660928, 'epsilon': 7.017916846303114e-08, 'balanced_loss': False, 'epochs': 134, 'early_stopping_patience': 18, 'plateau_patience': 15, 'plateau_divider': 7}. Best is trial 73 with value: 0.908256880733945.
[I 2024-11-28 15:37:57,738] Trial 107 finished with value: 0.9013761467889908 and parameters: {'attention_pooling_operation': 'max', 'embedding_pooling_operation': 'mean', 'threshold': 0.40558201356835605, 'batch_size': 104, 'attention_heads': 12, 'hidden_dimension': 65, 'number_of_hidden_layers': 2, 'dropout_rate': 0.4539109126158808, 'global_pooling': 'max', 'learning_rate': 0.0020284552417488646, 'weight_decay': 0.0005875698975111449, 'beta_0': 0.8388550074040229, 'beta_1': 0.9872542657507188, 'epsilon': 5.321857795918814e-08, 'balanced_loss': False, 'epochs': 143, 'early_stopping_patience': 18, 'plateau_patience': 18, 'plateau_divider': 6}. Best is trial 73 with value: 0.908256880733945.
[I 2024-11-28 15:41:46,308] Trial 108 finished with value: 0.8899082568807339 and parameters: {'attention_pooling_operation': 'max', 'embedding_pooling_operation': 'mean', 'threshold': 0.47923238680683417, 'batch_size': 211, 'attention_heads': 9, 'hidden_dimension': 51, 'number_of_hidden_layers': 2, 'dropout_rate': 0.333304072803192, 'global_pooling': 'max', 'learning_rate': 0.0003449933992614034, 'weight_decay': 0.0003299748193179466, 'beta_0': 0.8350900957701107, 'beta_1': 0.9877371747815525, 'epsilon': 1.068450241965489e-07, 'balanced_loss': True, 'epochs': 123, 'early_stopping_patience': 19, 'plateau_patience': 17, 'plateau_divider': 7}. Best is trial 73 with value: 0.908256880733945.
[I 2024-11-28 15:46:02,021] Trial 109 finished with value: 0.8922018348623854 and parameters: {'attention_pooling_operation': 'max', 'embedding_pooling_operation': 'mean', 'threshold': 0.5001907623941338, 'batch_size': 218, 'attention_heads': 13, 'hidden_dimension': 101, 'number_of_hidden_layers': 2, 'dropout_rate': 0.31458238121927384, 'global_pooling': 'max', 'learning_rate': 0.000642654614269909, 'weight_decay': 0.0002830309027086937, 'beta_0': 0.8530218773145268, 'beta_1': 0.9866182149456161, 'epsilon': 2.1640885653784198e-08, 'balanced_loss': False, 'epochs': 116, 'early_stopping_patience': 16, 'plateau_patience': 14, 'plateau_divider': 6}. Best is trial 73 with value: 0.908256880733945.
[I 2024-11-28 15:51:36,951] Trial 110 finished with value: 0.8727064220183486 and parameters: {'attention_pooling_operation': 'min', 'embedding_pooling_operation': 'mean', 'threshold': 0.44079646738419076, 'batch_size': 224, 'attention_heads': 14, 'hidden_dimension': 133, 'number_of_hidden_layers': 2, 'dropout_rate': 0.32257279180381393, 'global_pooling': 'sum', 'learning_rate': 0.009280467826718014, 'weight_decay': 0.00017723334989559812, 'beta_0': 0.8413560259681502, 'beta_1': 0.9839847894612748, 'epsilon': 3.461469086121817e-08, 'balanced_loss': False, 'epochs': 131, 'early_stopping_patience': 18, 'plateau_patience': 15, 'plateau_divider': 6}. Best is trial 73 with value: 0.908256880733945.
[I 2024-11-28 15:57:49,543] Trial 111 finished with value: 0.9036697247706422 and parameters: {'attention_pooling_operation': 'max', 'embedding_pooling_operation': 'mean', 'threshold': 0.45972652691458843, 'batch_size': 233, 'attention_heads': 13, 'hidden_dimension': 230, 'number_of_hidden_layers': 2, 'dropout_rate': 0.34341610372063647, 'global_pooling': 'max', 'learning_rate': 0.0015870218609605605, 'weight_decay': 0.0005630244366871066, 'beta_0': 0.892556308569855, 'beta_1': 0.9893899317291089, 'epsilon': 6.223681312842835e-07, 'balanced_loss': False, 'epochs': 114, 'early_stopping_patience': 17, 'plateau_patience': 16, 'plateau_divider': 8}. Best is trial 73 with value: 0.908256880733945.
[I 2024-11-28 16:06:50,699] Trial 112 finished with value: 0.8990825688073395 and parameters: {'attention_pooling_operation': 'max', 'embedding_pooling_operation': 'mean', 'threshold': 0.4475822868016598, 'batch_size': 235, 'attention_heads': 13, 'hidden_dimension': 229, 'number_of_hidden_layers': 4, 'dropout_rate': 0.34714791511869664, 'global_pooling': 'max', 'learning_rate': 0.0025434337013494593, 'weight_decay': 0.0003516420451614338, 'beta_0': 0.8907799521451679, 'beta_1': 0.9862218615971319, 'epsilon': 7.899545592548993e-07, 'balanced_loss': False, 'epochs': 125, 'early_stopping_patience': 17, 'plateau_patience': 16, 'plateau_divider': 8}. Best is trial 73 with value: 0.908256880733945.
[I 2024-11-28 16:13:46,226] Trial 113 finished with value: 0.9048165137614679 and parameters: {'attention_pooling_operation': 'max', 'embedding_pooling_operation': 'mean', 'threshold': 0.46025827297498373, 'batch_size': 226, 'attention_heads': 13, 'hidden_dimension': 248, 'number_of_hidden_layers': 2, 'dropout_rate': 0.3330754432043561, 'global_pooling': 'max', 'learning_rate': 0.001887651338629914, 'weight_decay': 0.0004544568556204626, 'beta_0': 0.8972985102707811, 'beta_1': 0.9898002064353992, 'epsilon': 8.779918334656253e-08, 'balanced_loss': False, 'epochs': 119, 'early_stopping_patience': 17, 'plateau_patience': 16, 'plateau_divider': 7}. Best is trial 73 with value: 0.908256880733945.
[I 2024-11-28 16:19:55,652] Trial 114 finished with value: 0.8967889908256881 and parameters: {'attention_pooling_operation': 'max', 'embedding_pooling_operation': 'mean', 'threshold': 0.49238099751584324, 'batch_size': 228, 'attention_heads': 13, 'hidden_dimension': 249, 'number_of_hidden_layers': 2, 'dropout_rate': 0.3412971027816898, 'global_pooling': 'max', 'learning_rate': 0.0018991804190799655, 'weight_decay': 0.0008776128237618158, 'beta_0': 0.8945186592217493, 'beta_1': 0.9904241854973588, 'epsilon': 8.753277507031196e-08, 'balanced_loss': False, 'epochs': 108, 'early_stopping_patience': 16, 'plateau_patience': 17, 'plateau_divider': 8}. Best is trial 73 with value: 0.908256880733945.
[I 2024-11-28 16:25:35,730] Trial 115 finished with value: 0.9002293577981652 and parameters: {'attention_pooling_operation': 'max', 'embedding_pooling_operation': 'mean', 'threshold': 0.4699660604029109, 'batch_size': 199, 'attention_heads': 14, 'hidden_dimension': 163, 'number_of_hidden_layers': 2, 'dropout_rate': 0.3633395022189097, 'global_pooling': 'max', 'learning_rate': 0.0035613772126253675, 'weight_decay': 0.0005941519528972085, 'beta_0': 0.898204912004869, 'beta_1': 0.9898008882414767, 'epsilon': 1.6104257852463715e-08, 'balanced_loss': False, 'epochs': 112, 'early_stopping_patience': 17, 'plateau_patience': 16, 'plateau_divider': 9}. Best is trial 73 with value: 0.908256880733945.
[I 2024-11-28 16:32:19,931] Trial 116 finished with value: 0.9002293577981652 and parameters: {'attention_pooling_operation': 'max', 'embedding_pooling_operation': 'min', 'threshold': 0.5181270799305109, 'batch_size': 231, 'attention_heads': 11, 'hidden_dimension': 243, 'number_of_hidden_layers': 3, 'dropout_rate': 0.3353335653186913, 'global_pooling': 'max', 'learning_rate': 0.0025633542321534934, 'weight_decay': 0.000413797889856568, 'beta_0': 0.8936262119003093, 'beta_1': 0.9853182358490822, 'epsilon': 5.3901274991699864e-08, 'balanced_loss': False, 'epochs': 118, 'early_stopping_patience': 20, 'plateau_patience': 15, 'plateau_divider': 7}. Best is trial 73 with value: 0.908256880733945.
[I 2024-11-28 16:41:14,983] Trial 117 finished with value: 0.8899082568807339 and parameters: {'attention_pooling_operation': 'max', 'embedding_pooling_operation': 'mean', 'threshold': 0.4631077220990442, 'batch_size': 208, 'attention_heads': 12, 'hidden_dimension': 253, 'number_of_hidden_layers': 2, 'dropout_rate': 0.32285070065794375, 'global_pooling': 'max', 'learning_rate': 1.681750815534691e-05, 'weight_decay': 0.0005164626320071219, 'beta_0': 0.8974326354445852, 'beta_1': 0.9882223325869998, 'epsilon': 1.2491575656842292e-07, 'balanced_loss': False, 'epochs': 103, 'early_stopping_patience': 17, 'plateau_patience': 17, 'plateau_divider': 6}. Best is trial 73 with value: 0.908256880733945.
[I 2024-11-28 16:45:50,289] Trial 118 finished with value: 0.8956422018348624 and parameters: {'attention_pooling_operation': 'max', 'embedding_pooling_operation': 'max', 'threshold': 0.530971443735697, 'batch_size': 214, 'attention_heads': 10, 'hidden_dimension': 234, 'number_of_hidden_layers': 1, 'dropout_rate': 0.37434078690512684, 'global_pooling': 'mean', 'learning_rate': 0.0013170062089218621, 'weight_decay': 0.00012230628215826271, 'beta_0': 0.8920432019407817, 'beta_1': 0.9915282452070767, 'epsilon': 3.475923730191262e-08, 'balanced_loss': False, 'epochs': 121, 'early_stopping_patience': 19, 'plateau_patience': 18, 'plateau_divider': 9}. Best is trial 73 with value: 0.908256880733945.
[I 2024-11-28 16:52:11,213] Trial 119 finished with value: 0.8910550458715596 and parameters: {'attention_pooling_operation': 'mean', 'embedding_pooling_operation': 'mean', 'threshold': 0.49871745261130734, 'batch_size': 224, 'attention_heads': 13, 'hidden_dimension': 238, 'number_of_hidden_layers': 2, 'dropout_rate': 0.38423018972024214, 'global_pooling': 'max', 'learning_rate': 0.001661891916359674, 'weight_decay': 0.0008026042008092246, 'beta_0': 0.8881054619515384, 'beta_1': 0.989335981549773, 'epsilon': 7.033964360688006e-08, 'balanced_loss': False, 'epochs': 182, 'early_stopping_patience': 21, 'plateau_patience': 16, 'plateau_divider': 7}. Best is trial 73 with value: 0.908256880733945.
[I 2024-11-28 16:57:45,867] Trial 120 finished with value: 0.893348623853211 and parameters: {'attention_pooling_operation': 'max', 'embedding_pooling_operation': 'mean', 'threshold': 0.43081417197566907, 'batch_size': 178, 'attention_heads': 12, 'hidden_dimension': 223, 'number_of_hidden_layers': 2, 'dropout_rate': 0.5387937011284031, 'global_pooling': 'max', 'learning_rate': 0.00476061613801003, 'weight_decay': 1.169922825162247e-06, 'beta_0': 0.8998058474556165, 'beta_1': 0.9888272634202501, 'epsilon': 1.919109945055742e-07, 'balanced_loss': False, 'epochs': 110, 'early_stopping_patience': 11, 'plateau_patience': 15, 'plateau_divider': 5}. Best is trial 73 with value: 0.908256880733945.
[I 2024-11-28 17:04:42,937] Trial 121 finished with value: 0.9094036697247706 and parameters: {'attention_pooling_operation': 'max', 'embedding_pooling_operation': 'mean', 'threshold': 0.4494113594010952, 'batch_size': 119, 'attention_heads': 13, 'hidden_dimension': 248, 'number_of_hidden_layers': 2, 'dropout_rate': 0.3294411489151017, 'global_pooling': 'max', 'learning_rate': 0.0021170830070329064, 'weight_decay': 0.000553275985356348, 'beta_0': 0.8432007234378966, 'beta_1': 0.9900582169341691, 'epsilon': 6.474790416516626e-07, 'balanced_loss': False, 'epochs': 126, 'early_stopping_patience': 18, 'plateau_patience': 16, 'plateau_divider': 7}. Best is trial 121 with value: 0.9094036697247706.
[I 2024-11-28 17:12:01,722] Trial 122 finished with value: 0.8990825688073395 and parameters: {'attention_pooling_operation': 'max', 'embedding_pooling_operation': 'mean', 'threshold': 0.47843629647669594, 'batch_size': 117, 'attention_heads': 13, 'hidden_dimension': 243, 'number_of_hidden_layers': 2, 'dropout_rate': 0.3514666512958533, 'global_pooling': 'max', 'learning_rate': 0.003100150560779471, 'weight_decay': 0.000542148400012137, 'beta_0': 0.8483610531966455, 'beta_1': 0.9899930256399795, 'epsilon': 6.393731631233966e-07, 'balanced_loss': False, 'epochs': 115, 'early_stopping_patience': 18, 'plateau_patience': 16, 'plateau_divider': 7}. Best is trial 121 with value: 0.9094036697247706.
[I 2024-11-28 17:19:53,631] Trial 123 finished with value: 0.8944954128440367 and parameters: {'attention_pooling_operation': 'max', 'embedding_pooling_operation': 'mean', 'threshold': 0.4557455057040121, 'batch_size': 85, 'attention_heads': 14, 'hidden_dimension': 251, 'number_of_hidden_layers': 2, 'dropout_rate': 0.3427037125614331, 'global_pooling': 'max', 'learning_rate': 0.002094551517037432, 'weight_decay': 0.0008206344809723208, 'beta_0': 0.8464056339875713, 'beta_1': 0.9902726789329077, 'epsilon': 1.1377364943697588e-06, 'balanced_loss': False, 'epochs': 126, 'early_stopping_patience': 17, 'plateau_patience': 17, 'plateau_divider': 7}. Best is trial 121 with value: 0.9094036697247706.
