[I 2024-12-02 15:23:22,400] Trial 61 finished with value: 0.9220183486238532 and parameters: {'attention_pooling_operation': 'mean', 'embedding_pooling_operation': 'mean', 'threshold': 0.5868456513917768, 'batch_size': 181, 'attention_heads': 14, 'hidden_dimension': 148, 'number_of_hidden_layers': 1, 'dropout_rate': 0.4979720678297598, 'global_pooling': 'max', 'learning_rate': 0.0010569489017923917, 'weight_decay': 4.272200968711462e-05, 'beta_0': 0.8186606431826908, 'beta_1': 0.995466545893592, 'epsilon': 2.2042821379981226e-05, 'balanced_loss': True, 'epochs': 70, 'early_stopping_patience': 10, 'plateau_patience': 17, 'plateau_divider': 4}. Best is trial 39 with value: 0.9243119266055045.
[I 2024-12-02 15:27:34,799] Trial 62 finished with value: 0.9128440366972477 and parameters: {'attention_pooling_operation': 'min', 'embedding_pooling_operation': 'mean', 'threshold': 0.6151012642220594, 'batch_size': 95, 'attention_heads': 15, 'hidden_dimension': 139, 'number_of_hidden_layers': 1, 'dropout_rate': 0.48741316024070436, 'global_pooling': 'sum', 'learning_rate': 0.0006503394078498719, 'weight_decay': 0.0001044387197464303, 'beta_0': 0.8111898013717651, 'beta_1': 0.9923503238506435, 'epsilon': 1.9213220225091754e-06, 'balanced_loss': False, 'epochs': 60, 'early_stopping_patience': 10, 'plateau_patience': 15, 'plateau_divider': 3}. Best is trial 39 with value: 0.9243119266055045.
[I 2024-12-02 15:31:46,321] Trial 63 finished with value: 0.9185779816513762 and parameters: {'attention_pooling_operation': 'min', 'embedding_pooling_operation': 'mean', 'threshold': 0.5234091442361251, 'batch_size': 51, 'attention_heads': 16, 'hidden_dimension': 54, 'number_of_hidden_layers': 1, 'dropout_rate': 0.5102740820209614, 'global_pooling': 'max', 'learning_rate': 0.0004250147763602888, 'weight_decay': 2.983830434311238e-05, 'beta_0': 0.8028007555111586, 'beta_1': 0.9965164284346596, 'epsilon': 4.317382704700518e-06, 'balanced_loss': True, 'epochs': 50, 'early_stopping_patience': 10, 'plateau_patience': 18, 'plateau_divider': 5}. Best is trial 39 with value: 0.9243119266055045.
[I 2024-12-02 15:35:54,846] Trial 64 finished with value: 0.9162844036697247 and parameters: {'attention_pooling_operation': 'min', 'embedding_pooling_operation': 'mean', 'threshold': 0.733526008441032, 'batch_size': 225, 'attention_heads': 13, 'hidden_dimension': 192, 'number_of_hidden_layers': 1, 'dropout_rate': 0.47501602806094406, 'global_pooling': 'max', 'learning_rate': 0.0011729592862022797, 'weight_decay': 0.0001761851703233006, 'beta_0': 0.8309007485031106, 'beta_1': 0.9932846984330584, 'epsilon': 3.165370624676243e-06, 'balanced_loss': False, 'epochs': 56, 'early_stopping_patience': 11, 'plateau_patience': 20, 'plateau_divider': 4}. Best is trial 39 with value: 0.9243119266055045.
[I 2024-12-02 15:40:11,333] Trial 65 finished with value: 0.8600917431192661 and parameters: {'attention_pooling_operation': 'mean', 'embedding_pooling_operation': 'mean', 'threshold': 0.761722582034389, 'batch_size': 213, 'attention_heads': 16, 'hidden_dimension': 178, 'number_of_hidden_layers': 1, 'dropout_rate': 0.4398051879160762, 'global_pooling': 'max', 'learning_rate': 0.06153083841174543, 'weight_decay': 6.856670848407412e-05, 'beta_0': 0.8240854887744012, 'beta_1': 0.9948603287201921, 'epsilon': 1.059740207437781e-05, 'balanced_loss': False, 'epochs': 64, 'early_stopping_patience': 13, 'plateau_patience': 21, 'plateau_divider': 10}. Best is trial 39 with value: 0.9243119266055045.
[I 2024-12-02 15:43:50,014] Trial 66 finished with value: 0.908256880733945 and parameters: {'attention_pooling_operation': 'min', 'embedding_pooling_operation': 'mean', 'threshold': 0.5512813029676662, 'batch_size': 74, 'attention_heads': 11, 'hidden_dimension': 158, 'number_of_hidden_layers': 0, 'dropout_rate': 0.4679057489046555, 'global_pooling': 'max', 'learning_rate': 0.012108104680317783, 'weight_decay': 2.013740077098999e-05, 'beta_0': 0.8093647966709774, 'beta_1': 0.9939924670492261, 'epsilon': 4.138403316804397e-05, 'balanced_loss': True, 'epochs': 75, 'early_stopping_patience': 11, 'plateau_patience': 22, 'plateau_divider': 8}. Best is trial 39 with value: 0.9243119266055045.
[I 2024-12-02 15:49:50,910] Trial 67 finished with value: 0.9139908256880734 and parameters: {'attention_pooling_operation': 'min', 'embedding_pooling_operation': 'mean', 'threshold': 0.8909026138137124, 'batch_size': 146, 'attention_heads': 15, 'hidden_dimension': 169, 'number_of_hidden_layers': 2, 'dropout_rate': 0.5304013164946336, 'global_pooling': 'sum', 'learning_rate': 0.0001971026391403157, 'weight_decay': 0.0002507977358230735, 'beta_0': 0.8135626749861908, 'beta_1': 0.9907824617756067, 'epsilon': 5.8114392680348525e-06, 'balanced_loss': False, 'epochs': 84, 'early_stopping_patience': 12, 'plateau_patience': 17, 'plateau_divider': 9}. Best is trial 39 with value: 0.9243119266055045.
[I 2024-12-02 15:55:43,935] Trial 68 finished with value: 0.9220183486238532 and parameters: {'attention_pooling_operation': 'min', 'embedding_pooling_operation': 'mean', 'threshold': 0.8099715037966905, 'batch_size': 195, 'attention_heads': 14, 'hidden_dimension': 208, 'number_of_hidden_layers': 1, 'dropout_rate': 0.5645317525241018, 'global_pooling': 'max', 'learning_rate': 0.0003609662047938335, 'weight_decay': 0.0004053570517455339, 'beta_0': 0.8417887417248207, 'beta_1': 0.992492655373342, 'epsilon': 2.4629946329546476e-06, 'balanced_loss': True, 'epochs': 89, 'early_stopping_patience': 17, 'plateau_patience': 19, 'plateau_divider': 6}. Best is trial 39 with value: 0.9243119266055045.
[I 2024-12-02 16:00:20,327] Trial 69 finished with value: 0.9094036697247706 and parameters: {'attention_pooling_operation': 'mean', 'embedding_pooling_operation': 'max', 'threshold': 0.6422771001656912, 'batch_size': 251, 'attention_heads': 13, 'hidden_dimension': 183, 'number_of_hidden_layers': 1, 'dropout_rate': 0.4298143578834156, 'global_pooling': 'max', 'learning_rate': 0.003776051951083504, 'weight_decay': 4.7676205273739835e-05, 'beta_0': 0.8196188567803567, 'beta_1': 0.9875288693654142, 'epsilon': 7.943891637406866e-07, 'balanced_loss': False, 'epochs': 145, 'early_stopping_patience': 19, 'plateau_patience': 25, 'plateau_divider': 3}. Best is trial 39 with value: 0.9243119266055045.
[I 2024-12-02 16:04:01,942] Trial 70 finished with value: 0.9185779816513762 and parameters: {'attention_pooling_operation': 'min', 'embedding_pooling_operation': 'mean', 'threshold': 0.5007844656603805, 'batch_size': 237, 'attention_heads': 6, 'hidden_dimension': 197, 'number_of_hidden_layers': 0, 'dropout_rate': 0.46003142393885305, 'global_pooling': 'mean', 'learning_rate': 0.000823482258981513, 'weight_decay': 0.0006298789476657841, 'beta_0': 0.8036294540012711, 'beta_1': 0.9836105004808732, 'epsilon': 1.595798997745134e-06, 'balanced_loss': False, 'epochs': 120, 'early_stopping_patience': 10, 'plateau_patience': 20, 'plateau_divider': 7}. Best is trial 39 with value: 0.9243119266055045.
[I 2024-12-02 16:08:35,577] Trial 71 finished with value: 0.9208715596330275 and parameters: {'attention_pooling_operation': 'min', 'embedding_pooling_operation': 'mean', 'threshold': 0.650720724366879, 'batch_size': 208, 'attention_heads': 16, 'hidden_dimension': 133, 'number_of_hidden_layers': 1, 'dropout_rate': 0.4803696653702158, 'global_pooling': 'max', 'learning_rate': 0.001201731138447243, 'weight_decay': 0.0001167431023434085, 'beta_0': 0.8068857183043103, 'beta_1': 0.9940816102833693, 'epsilon': 3.428744822539802e-06, 'balanced_loss': False, 'epochs': 54, 'early_stopping_patience': 12, 'plateau_patience': 16, 'plateau_divider': 2}. Best is trial 39 with value: 0.9243119266055045.
[I 2024-12-02 16:12:51,955] Trial 72 finished with value: 0.9174311926605505 and parameters: {'attention_pooling_operation': 'min', 'embedding_pooling_operation': 'mean', 'threshold': 0.6928887762379304, 'batch_size': 205, 'attention_heads': 16, 'hidden_dimension': 141, 'number_of_hidden_layers': 1, 'dropout_rate': 0.47190597169707726, 'global_pooling': 'max', 'learning_rate': 0.00155300818611492, 'weight_decay': 0.00015212063912983312, 'beta_0': 0.8082976679105477, 'beta_1': 0.9917224632423871, 'epsilon': 8.186205211425073e-06, 'balanced_loss': False, 'epochs': 56, 'early_stopping_patience': 12, 'plateau_patience': 16, 'plateau_divider': 3}. Best is trial 39 with value: 0.9243119266055045.
[I 2024-12-02 16:17:54,647] Trial 73 finished with value: 0.9220183486238532 and parameters: {'attention_pooling_operation': 'min', 'embedding_pooling_operation': 'mean', 'threshold': 0.42090900858040375, 'batch_size': 32, 'attention_heads': 15, 'hidden_dimension': 138, 'number_of_hidden_layers': 1, 'dropout_rate': 0.5053968043264403, 'global_pooling': 'max', 'learning_rate': 0.0005856829028081399, 'weight_decay': 0.00022019965120514463, 'beta_0': 0.8000082977531716, 'beta_1': 0.9937614232550298, 'epsilon': 3.50403796439932e-06, 'balanced_loss': False, 'epochs': 63, 'early_stopping_patience': 13, 'plateau_patience': 16, 'plateau_divider': 3}. Best is trial 39 with value: 0.9243119266055045.
[I 2024-12-02 16:22:12,985] Trial 74 finished with value: 0.9185779816513762 and parameters: {'attention_pooling_operation': 'min', 'embedding_pooling_operation': 'mean', 'threshold': 0.475057287051535, 'batch_size': 217, 'attention_heads': 16, 'hidden_dimension': 125, 'number_of_hidden_layers': 1, 'dropout_rate': 0.49669792183944617, 'global_pooling': 'max', 'learning_rate': 0.0020650484320882127, 'weight_decay': 0.00011055781555495859, 'beta_0': 0.815534581135492, 'beta_1': 0.9946501646851467, 'epsilon': 1.4175877968186265e-05, 'balanced_loss': False, 'epochs': 69, 'early_stopping_patience': 11, 'plateau_patience': 14, 'plateau_divider': 4}. Best is trial 39 with value: 0.9243119266055045.
[I 2024-12-02 16:27:22,864] Trial 75 finished with value: 0.9128440366972477 and parameters: {'attention_pooling_operation': 'max', 'embedding_pooling_operation': 'mean', 'threshold': 0.6647507303735827, 'batch_size': 190, 'attention_heads': 12, 'hidden_dimension': 151, 'number_of_hidden_layers': 4, 'dropout_rate': 0.48252467609405, 'global_pooling': 'max', 'learning_rate': 0.0013680080347751819, 'weight_decay': 6.0073002020108946e-05, 'beta_0': 0.8260407367262829, 'beta_1': 0.9842989390889044, 'epsilon': 5.101623433848748e-07, 'balanced_loss': False, 'epochs': 106, 'early_stopping_patience': 14, 'plateau_patience': 18, 'plateau_divider': 2}. Best is trial 39 with value: 0.9243119266055045.
[I 2024-12-02 16:31:28,906] Trial 76 finished with value: 0.9151376146788991 and parameters: {'attention_pooling_operation': 'min', 'embedding_pooling_operation': 'mean', 'threshold': 0.7079126774276767, 'batch_size': 229, 'attention_heads': 15, 'hidden_dimension': 96, 'number_of_hidden_layers': 1, 'dropout_rate': 0.4470038336775289, 'global_pooling': 'mean', 'learning_rate': 0.0029335051678736506, 'weight_decay': 0.0003056514552454374, 'beta_0': 0.8519216148510595, 'beta_1': 0.9957190062557136, 'epsilon': 5.0845471461226215e-06, 'balanced_loss': False, 'epochs': 56, 'early_stopping_patience': 21, 'plateau_patience': 15, 'plateau_divider': 3}. Best is trial 39 with value: 0.9243119266055045.
[I 2024-12-02 16:36:34,530] Trial 77 finished with value: 0.9185779816513762 and parameters: {'attention_pooling_operation': 'min', 'embedding_pooling_operation': 'mean', 'threshold': 0.6801075344788837, 'batch_size': 101, 'attention_heads': 16, 'hidden_dimension': 165, 'number_of_hidden_layers': 1, 'dropout_rate': 0.39540632631679296, 'global_pooling': 'sum', 'learning_rate': 0.00027669901891986913, 'weight_decay': 7.730934298332408e-05, 'beta_0': 0.8125568246402647, 'beta_1': 0.9828478020852675, 'epsilon': 9.551377667495248e-05, 'balanced_loss': False, 'epochs': 50, 'early_stopping_patience': 12, 'plateau_patience': 19, 'plateau_divider': 4}. Best is trial 39 with value: 0.9243119266055045.
[I 2024-12-02 16:40:49,139] Trial 78 finished with value: 0.9174311926605505 and parameters: {'attention_pooling_operation': 'max', 'embedding_pooling_operation': 'mean', 'threshold': 0.5921868150939018, 'batch_size': 168, 'attention_heads': 15, 'hidden_dimension': 118, 'number_of_hidden_layers': 1, 'dropout_rate': 0.49052643756859504, 'global_pooling': 'max', 'learning_rate': 0.0008976563786873727, 'weight_decay': 1.5348379423679682e-06, 'beta_0': 0.8068255440514638, 'beta_1': 0.9816796404124067, 'epsilon': 2.3765507134394907e-06, 'balanced_loss': True, 'epochs': 199, 'early_stopping_patience': 10, 'plateau_patience': 17, 'plateau_divider': 6}. Best is trial 39 with value: 0.9243119266055045.
[I 2024-12-02 16:45:43,883] Trial 79 finished with value: 0.9105504587155964 and parameters: {'attention_pooling_operation': 'min', 'embedding_pooling_operation': 'mean', 'threshold': 0.5686023748542678, 'batch_size': 202, 'attention_heads': 14, 'hidden_dimension': 111, 'number_of_hidden_layers': 1, 'dropout_rate': 0.32053774168431654, 'global_pooling': 'mean', 'learning_rate': 0.00010113322472189034, 'weight_decay': 9.776234201618609e-05, 'beta_0': 0.874647522579207, 'beta_1': 0.9865998866819646, 'epsilon': 7.084680446801139e-06, 'balanced_loss': False, 'epochs': 62, 'early_stopping_patience': 15, 'plateau_patience': 13, 'plateau_divider': 5}. Best is trial 39 with value: 0.9243119266055045.
[I 2024-12-02 16:51:07,749] Trial 80 finished with value: 0.9094036697247706 and parameters: {'attention_pooling_operation': 'max', 'embedding_pooling_operation': 'max', 'threshold': 0.6113053488167924, 'batch_size': 181, 'attention_heads': 16, 'hidden_dimension': 143, 'number_of_hidden_layers': 2, 'dropout_rate': 0.5807217248058197, 'global_pooling': 'max', 'learning_rate': 0.005536482279154125, 'weight_decay': 1.151037452355339e-06, 'beta_0': 0.8021044267395163, 'beta_1': 0.9926977908798451, 'epsilon': 3.843866373140888e-06, 'balanced_loss': False, 'epochs': 135, 'early_stopping_patience': 11, 'plateau_patience': 24, 'plateau_divider': 9}. Best is trial 39 with value: 0.9243119266055045.
[I 2024-12-02 16:55:23,430] Trial 81 finished with value: 0.9197247706422018 and parameters: {'attention_pooling_operation': 'mean', 'embedding_pooling_operation': 'mean', 'threshold': 0.5397889619967531, 'batch_size': 179, 'attention_heads': 14, 'hidden_dimension': 134, 'number_of_hidden_layers': 1, 'dropout_rate': 0.502376368793249, 'global_pooling': 'max', 'learning_rate': 0.0009762766661345137, 'weight_decay': 7.382672756764286e-05, 'beta_0': 0.8194393160399599, 'beta_1': 0.9953005340145561, 'epsilon': 2.033995762039482e-05, 'balanced_loss': True, 'epochs': 74, 'early_stopping_patience': 10, 'plateau_patience': 17, 'plateau_divider': 4}. Best is trial 39 with value: 0.9243119266055045.
[I 2024-12-02 16:59:45,827] Trial 82 finished with value: 0.9231651376146789 and parameters: {'attention_pooling_operation': 'mean', 'embedding_pooling_operation': 'mean', 'threshold': 0.6335851670571787, 'batch_size': 194, 'attention_heads': 13, 'hidden_dimension': 147, 'number_of_hidden_layers': 1, 'dropout_rate': 0.497119628592005, 'global_pooling': 'max', 'learning_rate': 0.0012740718508872707, 'weight_decay': 3.841373878098083e-05, 'beta_0': 0.8166703683343413, 'beta_1': 0.9963662992608249, 'epsilon': 2.0593180522490373e-05, 'balanced_loss': True, 'epochs': 67, 'early_stopping_patience': 10, 'plateau_patience': 16, 'plateau_divider': 8}. Best is trial 39 with value: 0.9243119266055045.
[I 2024-12-02 17:04:11,349] Trial 83 finished with value: 0.9231651376146789 and parameters: {'attention_pooling_operation': 'mean', 'embedding_pooling_operation': 'mean', 'threshold': 0.6376023369608358, 'batch_size': 194, 'attention_heads': 12, 'hidden_dimension': 147, 'number_of_hidden_layers': 1, 'dropout_rate': 0.4674392998789042, 'global_pooling': 'max', 'learning_rate': 0.0013560980418221723, 'weight_decay': 2.5914543934943276e-05, 'beta_0': 0.8095044491173368, 'beta_1': 0.9985047681896712, 'epsilon': 2.748089228889792e-05, 'balanced_loss': True, 'epochs': 68, 'early_stopping_patience': 13, 'plateau_patience': 16, 'plateau_divider': 8}. Best is trial 39 with value: 0.9243119266055045.
[I 2024-12-02 17:08:45,904] Trial 84 finished with value: 0.9208715596330275 and parameters: {'attention_pooling_operation': 'mean', 'embedding_pooling_operation': 'mean', 'threshold': 0.6364205841091832, 'batch_size': 191, 'attention_heads': 12, 'hidden_dimension': 159, 'number_of_hidden_layers': 1, 'dropout_rate': 0.5131015467921037, 'global_pooling': 'max', 'learning_rate': 0.0008013738530490058, 'weight_decay': 1.4652162365065293e-05, 'beta_0': 0.8104404653628008, 'beta_1': 0.9984113709726411, 'epsilon': 9.603745237370105e-06, 'balanced_loss': True, 'epochs': 68, 'early_stopping_patience': 13, 'plateau_patience': 15, 'plateau_divider': 8}. Best is trial 39 with value: 0.9243119266055045.
[I 2024-12-02 17:13:22,042] Trial 85 finished with value: 0.9254587155963303 and parameters: {'attention_pooling_operation': 'mean', 'embedding_pooling_operation': 'min', 'threshold': 0.6281965486658245, 'batch_size': 154, 'attention_heads': 13, 'hidden_dimension': 152, 'number_of_hidden_layers': 1, 'dropout_rate': 0.5252493520307854, 'global_pooling': 'max', 'learning_rate': 0.0005363886115985216, 'weight_decay': 2.6223386060726745e-05, 'beta_0': 0.8163985988242933, 'beta_1': 0.9964401909795313, 'epsilon': 3.3560586094590683e-05, 'balanced_loss': True, 'epochs': 172, 'early_stopping_patience': 11, 'plateau_patience': 22, 'plateau_divider': 8}. Best is trial 85 with value: 0.9254587155963303.
[I 2024-12-02 17:18:15,169] Trial 86 finished with value: 0.9231651376146789 and parameters: {'attention_pooling_operation': 'mean', 'embedding_pooling_operation': 'min', 'threshold': 0.621922295650435, 'batch_size': 138, 'attention_heads': 13, 'hidden_dimension': 145, 'number_of_hidden_layers': 1, 'dropout_rate': 0.548392240635811, 'global_pooling': 'max', 'learning_rate': 0.0003583184968972308, 'weight_decay': 2.4462351473936964e-05, 'beta_0': 0.8230898332264333, 'beta_1': 0.9966911703187863, 'epsilon': 3.2200379201287704e-05, 'balanced_loss': True, 'epochs': 174, 'early_stopping_patience': 11, 'plateau_patience': 15, 'plateau_divider': 8}. Best is trial 85 with value: 0.9254587155963303.
[I 2024-12-02 17:22:50,924] Trial 87 finished with value: 0.9185779816513762 and parameters: {'attention_pooling_operation': 'mean', 'embedding_pooling_operation': 'min', 'threshold': 0.6222147999619045, 'batch_size': 152, 'attention_heads': 13, 'hidden_dimension': 146, 'number_of_hidden_layers': 1, 'dropout_rate': 0.5504547390979176, 'global_pooling': 'max', 'learning_rate': 0.0005855847688985182, 'weight_decay': 2.870265150079335e-05, 'beta_0': 0.8241434091898402, 'beta_1': 0.9988114775525395, 'epsilon': 3.364792505930056e-05, 'balanced_loss': True, 'epochs': 173, 'early_stopping_patience': 11, 'plateau_patience': 14, 'plateau_divider': 8}. Best is trial 85 with value: 0.9254587155963303.
[I 2024-12-02 17:27:12,127] Trial 88 finished with value: 0.9243119266055045 and parameters: {'attention_pooling_operation': 'mean', 'embedding_pooling_operation': 'min', 'threshold': 0.6647237226804977, 'batch_size': 140, 'attention_heads': 12, 'hidden_dimension': 152, 'number_of_hidden_layers': 1, 'dropout_rate': 0.5239292255990197, 'global_pooling': 'max', 'learning_rate': 0.002311988176578546, 'weight_decay': 3.6230086110338285e-05, 'beta_0': 0.8160362647929514, 'beta_1': 0.9965966646114159, 'epsilon': 6.167275982920592e-05, 'balanced_loss': True, 'epochs': 172, 'early_stopping_patience': 11, 'plateau_patience': 15, 'plateau_divider': 7}. Best is trial 85 with value: 0.9254587155963303.
[I 2024-12-02 17:30:58,537] Trial 89 finished with value: 0.9139908256880734 and parameters: {'attention_pooling_operation': 'mean', 'embedding_pooling_operation': 'min', 'threshold': 0.6591460549165603, 'batch_size': 127, 'attention_heads': 12, 'hidden_dimension': 153, 'number_of_hidden_layers': 0, 'dropout_rate': 0.5223178120782747, 'global_pooling': 'max', 'learning_rate': 0.002017478980105108, 'weight_decay': 3.482442855176853e-05, 'beta_0': 0.8137003033465745, 'beta_1': 0.9979702545411318, 'epsilon': 6.98525569329175e-05, 'balanced_loss': True, 'epochs': 192, 'early_stopping_patience': 12, 'plateau_patience': 16, 'plateau_divider': 7}. Best is trial 85 with value: 0.9254587155963303.
[I 2024-12-02 17:35:27,968] Trial 90 finished with value: 0.9220183486238532 and parameters: {'attention_pooling_operation': 'mean', 'embedding_pooling_operation': 'min', 'threshold': 0.7017259775129632, 'batch_size': 160, 'attention_heads': 12, 'hidden_dimension': 171, 'number_of_hidden_layers': 1, 'dropout_rate': 0.53832094176497, 'global_pooling': 'max', 'learning_rate': 0.002821881759703262, 'weight_decay': 2.282734548846164e-05, 'beta_0': 0.8165177956639437, 'beta_1': 0.9963286356664495, 'epsilon': 5.661394253017476e-05, 'balanced_loss': True, 'epochs': 81, 'early_stopping_patience': 11, 'plateau_patience': 12, 'plateau_divider': 7}. Best is trial 85 with value: 0.9254587155963303.
[I 2024-12-02 17:39:51,634] Trial 91 finished with value: 0.9151376146788991 and parameters: {'attention_pooling_operation': 'mean', 'embedding_pooling_operation': 'min', 'threshold': 0.672206342391272, 'batch_size': 140, 'attention_heads': 13, 'hidden_dimension': 148, 'number_of_hidden_layers': 1, 'dropout_rate': 0.5690219042420942, 'global_pooling': 'max', 'learning_rate': 0.0015333545667205295, 'weight_decay': 2.420689173687341e-05, 'beta_0': 0.8210531820861926, 'beta_1': 0.997151876816042, 'epsilon': 2.4751455718946135e-05, 'balanced_loss': True, 'epochs': 155, 'early_stopping_patience': 11, 'plateau_patience': 15, 'plateau_divider': 8}. Best is trial 85 with value: 0.9254587155963303.
