[I 2024-12-18 10:06:35,225] Trial 31 finished with value: 0.944954128440367 and parameters: {'attention_pooling_operation': 'min', 'embedding_pooling_operation': 'max', 'threshold': 0.7985719765267519, 'batch_size': 45, 'attention_heads': 11, 'hidden_dimension': 107, 'number_of_hidden_layers': 1, 'dropout_rate': 0.5441587501111237, 'global_pooling': 'max', 'learning_rate': 0.0017292854934232219, 'weight_decay': 5.9047524411968446e-05, 'beta_0': 0.8583969584322158, 'beta_1': 0.980345032618974, 'epsilon': 2.446183448916564e-05, 'balanced_loss': True, 'epochs': 78, 'early_stopping_patience': 16, 'plateau_patience': 16, 'plateau_divider': 9}. Best is trial 11 with value: 0.948394495412844.
[I 2024-12-18 10:12:40,972] Trial 32 finished with value: 0.9426605504587156 and parameters: {'attention_pooling_operation': 'min', 'embedding_pooling_operation': 'max', 'threshold': 0.6549459806374862, 'batch_size': 64, 'attention_heads': 12, 'hidden_dimension': 70, 'number_of_hidden_layers': 2, 'dropout_rate': 0.476253879199215, 'global_pooling': 'max', 'learning_rate': 0.0011176994692073474, 'weight_decay': 0.0002384284155887982, 'beta_0': 0.8828804868799902, 'beta_1': 0.9838966733414544, 'epsilon': 3.0389090039848384e-06, 'balanced_loss': True, 'epochs': 92, 'early_stopping_patience': 12, 'plateau_patience': 17, 'plateau_divider': 5}. Best is trial 11 with value: 0.948394495412844.
[I 2024-12-18 10:19:11,669] Trial 33 finished with value: 0.944954128440367 and parameters: {'attention_pooling_operation': 'min', 'embedding_pooling_operation': 'max', 'threshold': 0.4673957762693792, 'batch_size': 47, 'attention_heads': 14, 'hidden_dimension': 93, 'number_of_hidden_layers': 1, 'dropout_rate': 0.5044329575682354, 'global_pooling': 'max', 'learning_rate': 0.0035645602199215792, 'weight_decay': 3.5031842516328713e-05, 'beta_0': 0.8424093968189734, 'beta_1': 0.9819752898406132, 'epsilon': 5.0352876005443235e-06, 'balanced_loss': True, 'epochs': 116, 'early_stopping_patience': 18, 'plateau_patience': 23, 'plateau_divider': 2}. Best is trial 11 with value: 0.948394495412844.
[I 2024-12-18 10:28:30,686] Trial 34 finished with value: 0.9426605504587156 and parameters: {'attention_pooling_operation': 'min', 'embedding_pooling_operation': 'max', 'threshold': 0.5947901087612865, 'batch_size': 226, 'attention_heads': 16, 'hidden_dimension': 134, 'number_of_hidden_layers': 3, 'dropout_rate': 0.4416327305048325, 'global_pooling': 'max', 'learning_rate': 0.009799451408239686, 'weight_decay': 0.0001853464367499949, 'beta_0': 0.8966288619788193, 'beta_1': 0.985511500206773, 'epsilon': 5.9144844691051786e-05, 'balanced_loss': False, 'epochs': 62, 'early_stopping_patience': 24, 'plateau_patience': 18, 'plateau_divider': 8}. Best is trial 11 with value: 0.948394495412844.
[I 2024-12-18 10:35:20,217] Trial 35 finished with value: 0.9415137614678899 and parameters: {'attention_pooling_operation': 'max', 'embedding_pooling_operation': 'min', 'threshold': 0.4390773328456906, 'batch_size': 84, 'attention_heads': 9, 'hidden_dimension': 53, 'number_of_hidden_layers': 2, 'dropout_rate': 0.5199551192523004, 'global_pooling': 'max', 'learning_rate': 0.00016462491326044775, 'weight_decay': 0.0001060073250985265, 'beta_0': 0.8561090301325283, 'beta_1': 0.9834454564096289, 'epsilon': 1.741464631056169e-05, 'balanced_loss': False, 'epochs': 109, 'early_stopping_patience': 20, 'plateau_patience': 11, 'plateau_divider': 4}. Best is trial 11 with value: 0.948394495412844.
[I 2024-12-18 10:41:47,483] Trial 36 finished with value: 0.944954128440367 and parameters: {'attention_pooling_operation': 'min', 'embedding_pooling_operation': 'mean', 'threshold': 0.5557477797282399, 'batch_size': 67, 'attention_heads': 11, 'hidden_dimension': 104, 'number_of_hidden_layers': 1, 'dropout_rate': 0.4677667841049691, 'global_pooling': 'mean', 'learning_rate': 0.000817713049754963, 'weight_decay': 0.00031081158998029414, 'beta_0': 0.8162515693111878, 'beta_1': 0.9812881431580709, 'epsilon': 7.893288332655819e-06, 'balanced_loss': False, 'epochs': 88, 'early_stopping_patience': 22, 'plateau_patience': 16, 'plateau_divider': 6}. Best is trial 11 with value: 0.948394495412844.
[I 2024-12-18 10:48:46,505] Trial 37 finished with value: 0.9380733944954128 and parameters: {'attention_pooling_operation': 'min', 'embedding_pooling_operation': 'max', 'threshold': 0.6949087578465372, 'batch_size': 39, 'attention_heads': 13, 'hidden_dimension': 81, 'number_of_hidden_layers': 3, 'dropout_rate': 0.42978439720293066, 'global_pooling': 'max', 'learning_rate': 4.961573232049952e-05, 'weight_decay': 4.736814512295173e-05, 'beta_0': 0.8721668592456929, 'beta_1': 0.9847185821816024, 'epsilon': 3.828274359845777e-05, 'balanced_loss': True, 'epochs': 123, 'early_stopping_patience': 11, 'plateau_patience': 20, 'plateau_divider': 7}. Best is trial 11 with value: 0.948394495412844.
[I 2024-12-18 10:54:43,821] Trial 38 finished with value: 0.9495412844036697 and parameters: {'attention_pooling_operation': 'min', 'embedding_pooling_operation': 'min', 'threshold': 0.651610762789382, 'batch_size': 94, 'attention_heads': 6, 'hidden_dimension': 63, 'number_of_hidden_layers': 2, 'dropout_rate': 0.5991808364925612, 'global_pooling': 'max', 'learning_rate': 0.0013835433216055108, 'weight_decay': 1.347083384402479e-05, 'beta_0': 0.8450390196308322, 'beta_1': 0.9804105675377759, 'epsilon': 6.601317701139153e-05, 'balanced_loss': False, 'epochs': 102, 'early_stopping_patience': 14, 'plateau_patience': 14, 'plateau_divider': 5}. Best is trial 38 with value: 0.9495412844036697.
[I 2024-12-18 11:00:32,517] Trial 39 finished with value: 0.9472477064220184 and parameters: {'attention_pooling_operation': 'min', 'embedding_pooling_operation': 'min', 'threshold': 0.6508896024693364, 'batch_size': 108, 'attention_heads': 4, 'hidden_dimension': 41, 'number_of_hidden_layers': 1, 'dropout_rate': 0.5981079443947587, 'global_pooling': 'sum', 'learning_rate': 0.001880823160120499, 'weight_decay': 5.279091959517985e-06, 'beta_0': 0.8445350144488537, 'beta_1': 0.9913229678227468, 'epsilon': 9.862327063224285e-05, 'balanced_loss': True, 'epochs': 141, 'early_stopping_patience': 14, 'plateau_patience': 14, 'plateau_divider': 5}. Best is trial 38 with value: 0.9495412844036697.
[I 2024-12-18 11:06:10,065] Trial 40 finished with value: 0.9380733944954128 and parameters: {'attention_pooling_operation': 'max', 'embedding_pooling_operation': 'min', 'threshold': 0.6577922523547218, 'batch_size': 101, 'attention_heads': 4, 'hidden_dimension': 62, 'number_of_hidden_layers': 0, 'dropout_rate': 0.5748316310993201, 'global_pooling': 'sum', 'learning_rate': 0.001781924387636982, 'weight_decay': 4.120875328569945e-06, 'beta_0': 0.8459623325052188, 'beta_1': 0.9915187617828173, 'epsilon': 9.974222499431082e-05, 'balanced_loss': True, 'epochs': 151, 'early_stopping_patience': 14, 'plateau_patience': 15, 'plateau_divider': 2}. Best is trial 38 with value: 0.9495412844036697.
[I 2024-12-18 11:12:00,969] Trial 41 finished with value: 0.9461009174311926 and parameters: {'attention_pooling_operation': 'min', 'embedding_pooling_operation': 'min', 'threshold': 0.5891151380139794, 'batch_size': 117, 'attention_heads': 6, 'hidden_dimension': 38, 'number_of_hidden_layers': 1, 'dropout_rate': 0.5955298098726011, 'global_pooling': 'sum', 'learning_rate': 0.004573910080362649, 'weight_decay': 4.139454904572529e-06, 'beta_0': 0.8504725368958588, 'beta_1': 0.9940576587807591, 'epsilon': 6.205987563396776e-05, 'balanced_loss': True, 'epochs': 137, 'early_stopping_patience': 13, 'plateau_patience': 13, 'plateau_divider': 5}. Best is trial 38 with value: 0.9495412844036697.
[I 2024-12-18 11:17:41,810] Trial 42 finished with value: 0.9438073394495413 and parameters: {'attention_pooling_operation': 'min', 'embedding_pooling_operation': 'min', 'threshold': 0.5493338782425887, 'batch_size': 95, 'attention_heads': 4, 'hidden_dimension': 44, 'number_of_hidden_layers': 1, 'dropout_rate': 0.5597194005389605, 'global_pooling': 'sum', 'learning_rate': 0.0012282789521937951, 'weight_decay': 1.387212727684696e-05, 'beta_0': 0.837239309386156, 'beta_1': 0.9936987593963266, 'epsilon': 2.8905723817967513e-05, 'balanced_loss': True, 'epochs': 154, 'early_stopping_patience': 14, 'plateau_patience': 10, 'plateau_divider': 4}. Best is trial 38 with value: 0.9495412844036697.
[I 2024-12-18 11:23:22,772] Trial 43 finished with value: 0.9426605504587156 and parameters: {'attention_pooling_operation': 'min', 'embedding_pooling_operation': 'min', 'threshold': 0.7027284227868351, 'batch_size': 77, 'attention_heads': 5, 'hidden_dimension': 57, 'number_of_hidden_layers': 0, 'dropout_rate': 0.5809285365806264, 'global_pooling': 'sum', 'learning_rate': 0.0025440882565780356, 'weight_decay': 1.1883111740036365e-06, 'beta_0': 0.824829406865107, 'beta_1': 0.9890832090389465, 'epsilon': 6.772337810718806e-05, 'balanced_loss': True, 'epochs': 165, 'early_stopping_patience': 16, 'plateau_patience': 14, 'plateau_divider': 6}. Best is trial 38 with value: 0.9495412844036697.
[I 2024-12-18 11:29:07,731] Trial 44 finished with value: 0.9461009174311926 and parameters: {'attention_pooling_operation': 'min', 'embedding_pooling_operation': 'min', 'threshold': 0.6347473502203353, 'batch_size': 111, 'attention_heads': 4, 'hidden_dimension': 32, 'number_of_hidden_layers': 2, 'dropout_rate': 0.5991680372803693, 'global_pooling': 'sum', 'learning_rate': 0.007433724532269449, 'weight_decay': 9.084326144088434e-06, 'beta_0': 0.8534833953797057, 'beta_1': 0.9907182678792595, 'epsilon': 3.44025748954611e-05, 'balanced_loss': True, 'epochs': 127, 'early_stopping_patience': 13, 'plateau_patience': 11, 'plateau_divider': 6}. Best is trial 38 with value: 0.9495412844036697.
[I 2024-12-18 11:34:46,738] Trial 45 finished with value: 0.944954128440367 and parameters: {'attention_pooling_operation': 'min', 'embedding_pooling_operation': 'min', 'threshold': 0.5129844123778471, 'batch_size': 129, 'attention_heads': 7, 'hidden_dimension': 50, 'number_of_hidden_layers': 1, 'dropout_rate': 0.5533916158213078, 'global_pooling': 'mean', 'learning_rate': 0.014048291507766441, 'weight_decay': 1.0526966932938845e-05, 'beta_0': 0.8456534672958658, 'beta_1': 0.9959429658557856, 'epsilon': 1.8484939341690645e-05, 'balanced_loss': False, 'epochs': 148, 'early_stopping_patience': 11, 'plateau_patience': 10, 'plateau_divider': 5}. Best is trial 38 with value: 0.9495412844036697.
[I 2024-12-18 11:40:44,515] Trial 46 finished with value: 0.8623853211009175 and parameters: {'attention_pooling_operation': 'mean', 'embedding_pooling_operation': 'min', 'threshold': 0.6743991783766169, 'batch_size': 43, 'attention_heads': 6, 'hidden_dimension': 72, 'number_of_hidden_layers': 2, 'dropout_rate': 0.5303928878533497, 'global_pooling': 'max', 'learning_rate': 0.022598758945687795, 'weight_decay': 5.281765324946814e-06, 'beta_0': 0.8003959441796663, 'beta_1': 0.9928012354119641, 'epsilon': 8.841426121364553e-05, 'balanced_loss': True, 'epochs': 107, 'early_stopping_patience': 15, 'plateau_patience': 13, 'plateau_divider': 4}. Best is trial 38 with value: 0.9495412844036697.
[I 2024-12-18 11:46:25,286] Trial 47 finished with value: 0.9495412844036697 and parameters: {'attention_pooling_operation': 'min', 'embedding_pooling_operation': 'min', 'threshold': 0.5775704844079919, 'batch_size': 149, 'attention_heads': 6, 'hidden_dimension': 41, 'number_of_hidden_layers': 1, 'dropout_rate': 0.5648968410077465, 'global_pooling': 'max', 'learning_rate': 0.0016875966016687105, 'weight_decay': 1.922103620247834e-06, 'beta_0': 0.8319417101942895, 'beta_1': 0.9867582388816132, 'epsilon': 1.5431010598582963e-05, 'balanced_loss': False, 'epochs': 119, 'early_stopping_patience': 12, 'plateau_patience': 12, 'plateau_divider': 3}. Best is trial 38 with value: 0.9495412844036697.
[I 2024-12-18 11:52:39,323] Trial 48 finished with value: 0.9426605504587156 and parameters: {'attention_pooling_operation': 'min', 'embedding_pooling_operation': 'min', 'threshold': 0.6024256253570982, 'batch_size': 155, 'attention_heads': 6, 'hidden_dimension': 185, 'number_of_hidden_layers': 1, 'dropout_rate': 0.5700481771672073, 'global_pooling': 'max', 'learning_rate': 0.001818633699589426, 'weight_decay': 1.7711222424815629e-06, 'beta_0': 0.8309953735299818, 'beta_1': 0.988050588381824, 'epsilon': 1.1592749062614741e-08, 'balanced_loss': False, 'epochs': 137, 'early_stopping_patience': 12, 'plateau_patience': 15, 'plateau_divider': 3}. Best is trial 38 with value: 0.9495412844036697.
[I 2024-12-18 11:58:10,420] Trial 49 finished with value: 0.944954128440367 and parameters: {'attention_pooling_operation': 'min', 'embedding_pooling_operation': 'min', 'threshold': 0.7097389553708933, 'batch_size': 146, 'attention_heads': 7, 'hidden_dimension': 62, 'number_of_hidden_layers': 0, 'dropout_rate': 0.584790318766054, 'global_pooling': 'sum', 'learning_rate': 0.0009294381447881918, 'weight_decay': 2.152920088053486e-06, 'beta_0': 0.8392419801441483, 'beta_1': 0.9864431383602336, 'epsilon': 1.4209415369909946e-05, 'balanced_loss': False, 'epochs': 117, 'early_stopping_patience': 11, 'plateau_patience': 12, 'plateau_divider': 3}. Best is trial 38 with value: 0.9495412844036697.
[I 2024-12-18 12:03:55,815] Trial 50 finished with value: 0.9472477064220184 and parameters: {'attention_pooling_operation': 'min', 'embedding_pooling_operation': 'min', 'threshold': 0.6365036265366457, 'batch_size': 171, 'attention_heads': 5, 'hidden_dimension': 84, 'number_of_hidden_layers': 1, 'dropout_rate': 0.5629537509603023, 'global_pooling': 'max', 'learning_rate': 0.005080275286463654, 'weight_decay': 3.0399495798387543e-06, 'beta_0': 0.8484938708092814, 'beta_1': 0.987525457588277, 'epsilon': 2.7208410930417145e-07, 'balanced_loss': True, 'epochs': 179, 'early_stopping_patience': 14, 'plateau_patience': 14, 'plateau_divider': 2}. Best is trial 38 with value: 0.9495412844036697.
[I 2024-12-18 12:09:51,523] Trial 51 finished with value: 0.9472477064220184 and parameters: {'attention_pooling_operation': 'min', 'embedding_pooling_operation': 'min', 'threshold': 0.5790998647807695, 'batch_size': 170, 'attention_heads': 5, 'hidden_dimension': 81, 'number_of_hidden_layers': 1, 'dropout_rate': 0.5635324120848154, 'global_pooling': 'max', 'learning_rate': 0.004913080930203839, 'weight_decay': 3.0172315467562077e-06, 'beta_0': 0.8455622489712276, 'beta_1': 0.9894777173233583, 'epsilon': 1.298887512938936e-07, 'balanced_loss': True, 'epochs': 186, 'early_stopping_patience': 14, 'plateau_patience': 14, 'plateau_divider': 2}. Best is trial 38 with value: 0.9495412844036697.
[I 2024-12-18 12:15:39,307] Trial 52 finished with value: 0.944954128440367 and parameters: {'attention_pooling_operation': 'min', 'embedding_pooling_operation': 'min', 'threshold': 0.6369313089635997, 'batch_size': 197, 'attention_heads': 5, 'hidden_dimension': 100, 'number_of_hidden_layers': 1, 'dropout_rate': 0.5428724998621672, 'global_pooling': 'max', 'learning_rate': 0.0020515983471531976, 'weight_decay': 1.005608228353467e-06, 'beta_0': 0.8504991790091587, 'beta_1': 0.9876595603296207, 'epsilon': 3.424818311459144e-07, 'balanced_loss': True, 'epochs': 178, 'early_stopping_patience': 15, 'plateau_patience': 11, 'plateau_divider': 2}. Best is trial 38 with value: 0.9495412844036697.
[I 2024-12-18 12:21:27,345] Trial 53 finished with value: 0.944954128440367 and parameters: {'attention_pooling_operation': 'min', 'embedding_pooling_operation': 'min', 'threshold': 0.6740152041457823, 'batch_size': 156, 'attention_heads': 4, 'hidden_dimension': 41, 'number_of_hidden_layers': 1, 'dropout_rate': 0.5566025408452632, 'global_pooling': 'max', 'learning_rate': 0.007436274212319372, 'weight_decay': 5.126929350605166e-06, 'beta_0': 0.8342614776626148, 'beta_1': 0.986687230870611, 'epsilon': 5.6013068093363765e-08, 'balanced_loss': True, 'epochs': 164, 'early_stopping_patience': 17, 'plateau_patience': 12, 'plateau_divider': 3}. Best is trial 38 with value: 0.9495412844036697.
[I 2024-12-18 12:28:11,220] Trial 54 finished with value: 0.948394495412844 and parameters: {'attention_pooling_operation': 'min', 'embedding_pooling_operation': 'min', 'threshold': 0.6461392291000441, 'batch_size': 198, 'attention_heads': 8, 'hidden_dimension': 255, 'number_of_hidden_layers': 1, 'dropout_rate': 0.5881655374962519, 'global_pooling': 'max', 'learning_rate': 0.004561934338711685, 'weight_decay': 3.4250923173028274e-06, 'beta_0': 0.8628818127955739, 'beta_1': 0.9913450956540986, 'epsilon': 8.326309408008635e-07, 'balanced_loss': True, 'epochs': 199, 'early_stopping_patience': 12, 'plateau_patience': 15, 'plateau_divider': 4}. Best is trial 38 with value: 0.9495412844036697.
[I 2024-12-18 12:33:51,172] Trial 55 finished with value: 0.9438073394495413 and parameters: {'attention_pooling_operation': 'min', 'embedding_pooling_operation': 'min', 'threshold': 0.6104932080664285, 'batch_size': 206, 'attention_heads': 8, 'hidden_dimension': 205, 'number_of_hidden_layers': 0, 'dropout_rate': 0.5855799779517693, 'global_pooling': 'max', 'learning_rate': 0.0011460051027916982, 'weight_decay': 7.67893744312912e-06, 'beta_0': 0.8549447586801582, 'beta_1': 0.9909556797073333, 'epsilon': 7.866144158994192e-07, 'balanced_loss': False, 'epochs': 118, 'early_stopping_patience': 13, 'plateau_patience': 13, 'plateau_divider': 4}. Best is trial 38 with value: 0.9495412844036697.
[I 2024-12-18 12:40:38,904] Trial 56 finished with value: 0.5252293577981652 and parameters: {'attention_pooling_operation': 'max', 'embedding_pooling_operation': 'mean', 'threshold': 0.7272047493304329, 'batch_size': 255, 'attention_heads': 8, 'hidden_dimension': 250, 'number_of_hidden_layers': 4, 'dropout_rate': 0.5913341563352177, 'global_pooling': 'max', 'learning_rate': 0.03106790853673977, 'weight_decay': 2.377627233108745e-05, 'beta_0': 0.8617095200428518, 'beta_1': 0.9925872955006453, 'epsilon': 1.2965770795194296e-06, 'balanced_loss': True, 'epochs': 103, 'early_stopping_patience': 12, 'plateau_patience': 15, 'plateau_divider': 4}. Best is trial 38 with value: 0.9495412844036697.
[I 2024-12-18 12:46:52,100] Trial 57 finished with value: 0.9438073394495413 and parameters: {'attention_pooling_operation': 'min', 'embedding_pooling_operation': 'min', 'threshold': 0.5714977115512483, 'batch_size': 207, 'attention_heads': 9, 'hidden_dimension': 172, 'number_of_hidden_layers': 1, 'dropout_rate': 0.5753201802712051, 'global_pooling': 'max', 'learning_rate': 0.002382201323163113, 'weight_decay': 1.6236247849277187e-06, 'beta_0': 0.8418046538842445, 'beta_1': 0.9819481828059963, 'epsilon': 7.343968474021604e-05, 'balanced_loss': False, 'epochs': 144, 'early_stopping_patience': 10, 'plateau_patience': 17, 'plateau_divider': 5}. Best is trial 38 with value: 0.9495412844036697.
[I 2024-12-18 12:54:08,950] Trial 58 finished with value: 0.9438073394495413 and parameters: {'attention_pooling_operation': 'mean', 'embedding_pooling_operation': 'min', 'threshold': 0.5405677220221731, 'batch_size': 217, 'attention_heads': 7, 'hidden_dimension': 228, 'number_of_hidden_layers': 2, 'dropout_rate': 0.5983727915655912, 'global_pooling': 'max', 'learning_rate': 0.0002665613059442267, 'weight_decay': 1.2205878577381307e-05, 'beta_0': 0.8202182075726062, 'beta_1': 0.9918533101829705, 'epsilon': 5.509794940817329e-07, 'balanced_loss': False, 'epochs': 136, 'early_stopping_patience': 11, 'plateau_patience': 18, 'plateau_divider': 5}. Best is trial 38 with value: 0.9495412844036697.
[I 2024-12-18 12:59:43,119] Trial 59 finished with value: 0.9461009174311926 and parameters: {'attention_pooling_operation': 'min', 'embedding_pooling_operation': 'min', 'threshold': 0.6431892156345114, 'batch_size': 90, 'attention_heads': 6, 'hidden_dimension': 53, 'number_of_hidden_layers': 1, 'dropout_rate': 0.5493808448525437, 'global_pooling': 'sum', 'learning_rate': 0.003898020057369327, 'weight_decay': 6.074184516870629e-06, 'beta_0': 0.8346123215956277, 'beta_1': 0.9807571400336679, 'epsilon': 3.3207389103237426e-05, 'balanced_loss': True, 'epochs': 198, 'early_stopping_patience': 13, 'plateau_patience': 13, 'plateau_divider': 4}. Best is trial 38 with value: 0.9495412844036697.
[I 2024-12-18 13:06:51,402] Trial 60 finished with value: 0.9415137614678899 and parameters: {'attention_pooling_operation': 'min', 'embedding_pooling_operation': 'mean', 'threshold': 0.6782598492406452, 'batch_size': 136, 'attention_heads': 8, 'hidden_dimension': 242, 'number_of_hidden_layers': 2, 'dropout_rate': 0.536032105031778, 'global_pooling': 'mean', 'learning_rate': 0.011637298032840809, 'weight_decay': 1.7539617784291178e-05, 'beta_0': 0.8626248892159566, 'beta_1': 0.9986511030865479, 'epsilon': 4.77672731483309e-05, 'balanced_loss': False, 'epochs': 128, 'early_stopping_patience': 15, 'plateau_patience': 15, 'plateau_divider': 3}. Best is trial 38 with value: 0.9495412844036697.
[I 2024-12-18 13:12:45,449] Trial 61 finished with value: 0.9461009174311926 and parameters: {'attention_pooling_operation': 'min', 'embedding_pooling_operation': 'min', 'threshold': 0.6198501457253004, 'batch_size': 165, 'attention_heads': 5, 'hidden_dimension': 121, 'number_of_hidden_layers': 1, 'dropout_rate': 0.5718678312973752, 'global_pooling': 'max', 'learning_rate': 0.006653449045138149, 'weight_decay': 3.1877780749001043e-06, 'beta_0': 0.8468801820529032, 'beta_1': 0.9901233577759343, 'epsilon': 2.0659779494912763e-07, 'balanced_loss': True, 'epochs': 198, 'early_stopping_patience': 14, 'plateau_patience': 14, 'plateau_divider': 2}. Best is trial 38 with value: 0.9495412844036697.
