Some weights of RobertaModel were not initialized from the model checkpoint at FacebookAI/roberta-base and are newly initialized: ['roberta.pooler.dense.bias', 'roberta.pooler.dense.weight']
You should probably TRAIN this model on a down-stream task to be able to use it for predictions and inference.
[I 2024-12-02 09:53:01,353] A new study created in RDB with name: SST-2-GATv2-FacebookAI-roberta-base-Grouped-No_Aggregation
[I 2024-12-02 09:58:40,815] Trial 0 finished with value: 0.9036697247706422 and parameters: {'attention_pooling_operation': 'mean', 'embedding_pooling_operation': 'min', 'threshold': 0.4319459866925097, 'batch_size': 226, 'attention_heads': 11, 'hidden_dimension': 191, 'number_of_hidden_layers': 0, 'dropout_rate': 0.5909729556485983, 'global_pooling': 'mean', 'learning_rate': 5.415244119402538e-05, 'weight_decay': 8.179499475211674e-06, 'beta_0': 0.8510059609290175, 'beta_1': 0.9881622148267181, 'epsilon': 1.4618962793704927e-07, 'balanced_loss': True, 'epochs': 94, 'early_stopping_patience': 15, 'plateau_patience': 17, 'plateau_divider': 9}. Best is trial 0 with value: 0.9036697247706422.
[I 2024-12-02 10:03:48,555] Trial 1 finished with value: 0.9185779816513762 and parameters: {'attention_pooling_operation': 'max', 'embedding_pooling_operation': 'mean', 'threshold': 0.43577837614190373, 'batch_size': 245, 'attention_heads': 16, 'hidden_dimension': 213, 'number_of_hidden_layers': 1, 'dropout_rate': 0.32930163420191516, 'global_pooling': 'mean', 'learning_rate': 0.0009565499215943821, 'weight_decay': 1.2681352169084602e-06, 'beta_0': 0.8904386843107996, 'beta_1': 0.9848818831861611, 'epsilon': 4.467752817973898e-06, 'balanced_loss': False, 'epochs': 132, 'early_stopping_patience': 12, 'plateau_patience': 25, 'plateau_divider': 8}. Best is trial 1 with value: 0.9185779816513762.
[I 2024-12-02 10:09:32,451] Trial 2 finished with value: 0.5997706422018348 and parameters: {'attention_pooling_operation': 'min', 'embedding_pooling_operation': 'min', 'threshold': 0.42487500890079594, 'batch_size': 105, 'attention_heads': 9, 'hidden_dimension': 93, 'number_of_hidden_layers': 4, 'dropout_rate': 0.40702599800807676, 'global_pooling': 'sum', 'learning_rate': 0.016172900811143146, 'weight_decay': 1.6736010167825795e-06, 'beta_0': 0.8986110261361376, 'beta_1': 0.9946405101730994, 'epsilon': 6.235377135673148e-08, 'balanced_loss': False, 'epochs': 156, 'early_stopping_patience': 21, 'plateau_patience': 22, 'plateau_divider': 2}. Best is trial 1 with value: 0.9185779816513762.
[I 2024-12-02 10:16:59,831] Trial 3 finished with value: 0.9174311926605505 and parameters: {'attention_pooling_operation': 'max', 'embedding_pooling_operation': 'min', 'threshold': 0.5710402769436143, 'batch_size': 105, 'attention_heads': 13, 'hidden_dimension': 175, 'number_of_hidden_layers': 4, 'dropout_rate': 0.44166447754858473, 'global_pooling': 'max', 'learning_rate': 0.0017583640270008513, 'weight_decay': 0.00020554245520150764, 'beta_0': 0.8479082820660899, 'beta_1': 0.9898864065152503, 'epsilon': 5.130551760589827e-07, 'balanced_loss': False, 'epochs': 54, 'early_stopping_patience': 20, 'plateau_patience': 15, 'plateau_divider': 6}. Best is trial 1 with value: 0.9185779816513762.
[I 2024-12-02 10:28:10,403] Trial 4 finished with value: 0.911697247706422 and parameters: {'attention_pooling_operation': 'min', 'embedding_pooling_operation': 'min', 'threshold': 0.5593632991025724, 'batch_size': 68, 'attention_heads': 16, 'hidden_dimension': 213, 'number_of_hidden_layers': 3, 'dropout_rate': 0.5614381770563153, 'global_pooling': 'max', 'learning_rate': 0.0014367095138664223, 'weight_decay': 0.00026443593078398644, 'beta_0': 0.889052315352582, 'beta_1': 0.9860025494147586, 'epsilon': 2.755546207779655e-08, 'balanced_loss': False, 'epochs': 173, 'early_stopping_patience': 23, 'plateau_patience': 10, 'plateau_divider': 6}. Best is trial 1 with value: 0.9185779816513762.
[I 2024-12-02 10:39:06,806] Trial 5 finished with value: 0.8967889908256881 and parameters: {'attention_pooling_operation': 'min', 'embedding_pooling_operation': 'mean', 'threshold': 0.6853348419588514, 'batch_size': 190, 'attention_heads': 8, 'hidden_dimension': 250, 'number_of_hidden_layers': 4, 'dropout_rate': 0.3755346887476092, 'global_pooling': 'mean', 'learning_rate': 1.4045842344024695e-05, 'weight_decay': 6.740513796374044e-05, 'beta_0': 0.8487959271998592, 'beta_1': 0.9809692144821089, 'epsilon': 1.3019246714361555e-07, 'balanced_loss': True, 'epochs': 71, 'early_stopping_patience': 17, 'plateau_patience': 25, 'plateau_divider': 4}. Best is trial 1 with value: 0.9185779816513762.
[I 2024-12-02 10:45:12,408] Trial 6 finished with value: 0.8979357798165137 and parameters: {'attention_pooling_operation': 'mean', 'embedding_pooling_operation': 'min', 'threshold': 0.748441340918492, 'batch_size': 152, 'attention_heads': 5, 'hidden_dimension': 219, 'number_of_hidden_layers': 1, 'dropout_rate': 0.35595555311995625, 'global_pooling': 'max', 'learning_rate': 1.1650681118986128e-05, 'weight_decay': 3.4377886617795816e-05, 'beta_0': 0.8216291089982651, 'beta_1': 0.9922164838130152, 'epsilon': 4.9827112000811335e-08, 'balanced_loss': True, 'epochs': 191, 'early_stopping_patience': 12, 'plateau_patience': 15, 'plateau_divider': 3}. Best is trial 1 with value: 0.9185779816513762.
[I 2024-12-02 10:49:15,272] Trial 7 finished with value: 0.518348623853211 and parameters: {'attention_pooling_operation': 'min', 'embedding_pooling_operation': 'mean', 'threshold': 0.6913078180958036, 'batch_size': 86, 'attention_heads': 5, 'hidden_dimension': 233, 'number_of_hidden_layers': 4, 'dropout_rate': 0.48993043718198037, 'global_pooling': 'max', 'learning_rate': 0.0387651117091163, 'weight_decay': 0.00045841547801363794, 'beta_0': 0.8769656613172253, 'beta_1': 0.9921566381933148, 'epsilon': 2.1705003488711103e-08, 'balanced_loss': False, 'epochs': 141, 'early_stopping_patience': 10, 'plateau_patience': 11, 'plateau_divider': 7}. Best is trial 1 with value: 0.9185779816513762.
[I 2024-12-02 10:54:19,558] Trial 8 finished with value: 0.9197247706422018 and parameters: {'attention_pooling_operation': 'max', 'embedding_pooling_operation': 'min', 'threshold': 0.7916985717411447, 'batch_size': 85, 'attention_heads': 8, 'hidden_dimension': 199, 'number_of_hidden_layers': 3, 'dropout_rate': 0.5547670231482533, 'global_pooling': 'mean', 'learning_rate': 0.0002957080941494348, 'weight_decay': 6.24607368131809e-06, 'beta_0': 0.8233238054292655, 'beta_1': 0.9984823954805346, 'epsilon': 3.7358626308127487e-07, 'balanced_loss': True, 'epochs': 170, 'early_stopping_patience': 18, 'plateau_patience': 19, 'plateau_divider': 6}. Best is trial 8 with value: 0.9197247706422018.
[I 2024-12-02 10:58:07,668] Trial 9 finished with value: 0.9013761467889908 and parameters: {'attention_pooling_operation': 'mean', 'embedding_pooling_operation': 'mean', 'threshold': 0.9172522213941028, 'batch_size': 246, 'attention_heads': 15, 'hidden_dimension': 115, 'number_of_hidden_layers': 0, 'dropout_rate': 0.5784955687763176, 'global_pooling': 'sum', 'learning_rate': 0.025824850844906145, 'weight_decay': 7.644457600399742e-06, 'beta_0': 0.8371219067759552, 'beta_1': 0.9961484316107455, 'epsilon': 1.8522006003174358e-07, 'balanced_loss': False, 'epochs': 191, 'early_stopping_patience': 21, 'plateau_patience': 19, 'plateau_divider': 2}. Best is trial 8 with value: 0.9197247706422018.
[I 2024-12-02 11:05:39,389] Trial 10 finished with value: 0.9162844036697247 and parameters: {'attention_pooling_operation': 'max', 'embedding_pooling_operation': 'max', 'threshold': 0.8684877910645998, 'batch_size': 36, 'attention_heads': 7, 'hidden_dimension': 40, 'number_of_hidden_layers': 2, 'dropout_rate': 0.5069924419974332, 'global_pooling': 'mean', 'learning_rate': 0.00011015753215781712, 'weight_decay': 6.954771451368797e-06, 'beta_0': 0.8011183479951905, 'beta_1': 0.997553073267282, 'epsilon': 6.646086576758891e-05, 'balanced_loss': True, 'epochs': 108, 'early_stopping_patience': 25, 'plateau_patience': 20, 'plateau_divider': 5}. Best is trial 8 with value: 0.9197247706422018.
[I 2024-12-02 11:10:00,940] Trial 11 finished with value: 0.9151376146788991 and parameters: {'attention_pooling_operation': 'max', 'embedding_pooling_operation': 'max', 'threshold': 0.8317879907182189, 'batch_size': 160, 'attention_heads': 11, 'hidden_dimension': 153, 'number_of_hidden_layers': 2, 'dropout_rate': 0.3060024389495355, 'global_pooling': 'mean', 'learning_rate': 0.0003567326821027195, 'weight_decay': 1.0120397003565907e-06, 'beta_0': 0.8712837297046075, 'beta_1': 0.9835858868877497, 'epsilon': 6.140803240280745e-06, 'balanced_loss': True, 'epochs': 132, 'early_stopping_patience': 14, 'plateau_patience': 25, 'plateau_divider': 9}. Best is trial 8 with value: 0.9197247706422018.
[I 2024-12-02 11:15:31,718] Trial 12 finished with value: 0.9220183486238532 and parameters: {'attention_pooling_operation': 'max', 'embedding_pooling_operation': 'mean', 'threshold': 0.5453325605482465, 'batch_size': 201, 'attention_heads': 13, 'hidden_dimension': 187, 'number_of_hidden_layers': 1, 'dropout_rate': 0.5167030793701302, 'global_pooling': 'mean', 'learning_rate': 0.0003898686089917942, 'weight_decay': 2.8122211944457527e-06, 'beta_0': 0.8185762180011409, 'beta_1': 0.9846525810358804, 'epsilon': 3.7131887794744256e-06, 'balanced_loss': False, 'epochs': 161, 'early_stopping_patience': 17, 'plateau_patience': 22, 'plateau_divider': 8}. Best is trial 12 with value: 0.9220183486238532.
[I 2024-12-02 11:21:54,512] Trial 13 finished with value: 0.9151376146788991 and parameters: {'attention_pooling_operation': 'max', 'embedding_pooling_operation': 'mean', 'threshold': 0.5514503672356021, 'batch_size': 194, 'attention_heads': 13, 'hidden_dimension': 151, 'number_of_hidden_layers': 3, 'dropout_rate': 0.5267613628478982, 'global_pooling': 'mean', 'learning_rate': 0.005610538260615647, 'weight_decay': 3.63025239676856e-06, 'beta_0': 0.8130661547802587, 'beta_1': 0.9815462820727995, 'epsilon': 1.9713233678624386e-06, 'balanced_loss': True, 'epochs': 166, 'early_stopping_patience': 18, 'plateau_patience': 22, 'plateau_divider': 10}. Best is trial 12 with value: 0.9220183486238532.
[I 2024-12-02 11:27:02,333] Trial 14 finished with value: 0.9139908256880734 and parameters: {'attention_pooling_operation': 'max', 'embedding_pooling_operation': 'max', 'threshold': 0.7990486314992181, 'batch_size': 128, 'attention_heads': 13, 'hidden_dimension': 181, 'number_of_hidden_layers': 1, 'dropout_rate': 0.46821975780543795, 'global_pooling': 'mean', 'learning_rate': 0.00018720643140312905, 'weight_decay': 2.0298325801998388e-05, 'beta_0': 0.823090499002235, 'beta_1': 0.9984801579753145, 'epsilon': 1.9787837608712487e-05, 'balanced_loss': False, 'epochs': 153, 'early_stopping_patience': 17, 'plateau_patience': 22, 'plateau_divider': 7}. Best is trial 12 with value: 0.9220183486238532.
[I 2024-12-02 11:31:33,704] Trial 15 finished with value: 0.911697247706422 and parameters: {'attention_pooling_operation': 'max', 'embedding_pooling_operation': 'min', 'threshold': 0.5994956725856639, 'batch_size': 193, 'attention_heads': 7, 'hidden_dimension': 112, 'number_of_hidden_layers': 3, 'dropout_rate': 0.5411704743828452, 'global_pooling': 'sum', 'learning_rate': 0.0004924695679622553, 'weight_decay': 3.1579488167215517e-06, 'beta_0': 0.8016372935410753, 'beta_1': 0.9868823583634797, 'epsilon': 6.124842392044604e-07, 'balanced_loss': True, 'epochs': 200, 'early_stopping_patience': 19, 'plateau_patience': 17, 'plateau_divider': 5}. Best is trial 12 with value: 0.9220183486238532.
[I 2024-12-02 11:38:04,468] Trial 16 finished with value: 0.9139908256880734 and parameters: {'attention_pooling_operation': 'max', 'embedding_pooling_operation': 'mean', 'threshold': 0.6285663053910195, 'batch_size': 38, 'attention_heads': 10, 'hidden_dimension': 255, 'number_of_hidden_layers': 2, 'dropout_rate': 0.4365012341967372, 'global_pooling': 'mean', 'learning_rate': 4.668445840493255e-05, 'weight_decay': 1.7892179812052506e-05, 'beta_0': 0.8316555428390284, 'beta_1': 0.990398304862839, 'epsilon': 1.5333660275606415e-06, 'balanced_loss': True, 'epochs': 179, 'early_stopping_patience': 15, 'plateau_patience': 20, 'plateau_divider': 8}. Best is trial 12 with value: 0.9220183486238532.
[I 2024-12-02 11:42:38,990] Trial 17 finished with value: 0.9162844036697247 and parameters: {'attention_pooling_operation': 'max', 'embedding_pooling_operation': 'mean', 'threshold': 0.5071430108500481, 'batch_size': 175, 'attention_heads': 4, 'hidden_dimension': 184, 'number_of_hidden_layers': 2, 'dropout_rate': 0.5368524460819151, 'global_pooling': 'mean', 'learning_rate': 0.007023757287443475, 'weight_decay': 3.0875006959653776e-06, 'beta_0': 0.8122778072828273, 'beta_1': 0.9830101866924681, 'epsilon': 7.735296961565823e-06, 'balanced_loss': False, 'epochs': 118, 'early_stopping_patience': 16, 'plateau_patience': 14, 'plateau_divider': 7}. Best is trial 12 with value: 0.9220183486238532.
[I 2024-12-02 11:46:57,360] Trial 18 finished with value: 0.9162844036697247 and parameters: {'attention_pooling_operation': 'max', 'embedding_pooling_operation': 'min', 'threshold': 0.7443041948573398, 'batch_size': 127, 'attention_heads': 14, 'hidden_dimension': 129, 'number_of_hidden_layers': 1, 'dropout_rate': 0.4921462512057554, 'global_pooling': 'mean', 'learning_rate': 0.0027414092941971144, 'weight_decay': 5.40847949533153e-05, 'beta_0': 0.8360434934883444, 'beta_1': 0.993480301637365, 'epsilon': 2.8615008918264378e-05, 'balanced_loss': False, 'epochs': 150, 'early_stopping_patience': 22, 'plateau_patience': 23, 'plateau_divider': 10}. Best is trial 12 with value: 0.9220183486238532.
[I 2024-12-02 11:51:44,164] Trial 19 finished with value: 0.9162844036697247 and parameters: {'attention_pooling_operation': 'mean', 'embedding_pooling_operation': 'max', 'threshold': 0.5032065302421345, 'batch_size': 214, 'attention_heads': 11, 'hidden_dimension': 72, 'number_of_hidden_layers': 3, 'dropout_rate': 0.5635189477826367, 'global_pooling': 'sum', 'learning_rate': 0.000537579729072797, 'weight_decay': 1.3104932562545273e-05, 'beta_0': 0.8145568669915408, 'beta_1': 0.9878251926850784, 'epsilon': 1.0819909670413662e-08, 'balanced_loss': True, 'epochs': 167, 'early_stopping_patience': 19, 'plateau_patience': 19, 'plateau_divider': 5}. Best is trial 12 with value: 0.9220183486238532.
[I 2024-12-02 11:55:48,405] Trial 20 finished with value: 0.9094036697247706 and parameters: {'attention_pooling_operation': 'max', 'embedding_pooling_operation': 'mean', 'threshold': 0.7456897919209434, 'batch_size': 64, 'attention_heads': 9, 'hidden_dimension': 162, 'number_of_hidden_layers': 0, 'dropout_rate': 0.5177977580026261, 'global_pooling': 'mean', 'learning_rate': 0.00015318290595960865, 'weight_decay': 2.7085789424511774e-06, 'beta_0': 0.826036297271089, 'beta_1': 0.9960734101046033, 'epsilon': 3.8692941423321504e-07, 'balanced_loss': True, 'epochs': 94, 'early_stopping_patience': 13, 'plateau_patience': 13, 'plateau_divider': 8}. Best is trial 12 with value: 0.9220183486238532.
[I 2024-12-02 12:01:00,689] Trial 21 finished with value: 0.9220183486238532 and parameters: {'attention_pooling_operation': 'max', 'embedding_pooling_operation': 'mean', 'threshold': 0.4735073965850337, 'batch_size': 254, 'attention_heads': 16, 'hidden_dimension': 206, 'number_of_hidden_layers': 1, 'dropout_rate': 0.32746486311101924, 'global_pooling': 'mean', 'learning_rate': 0.0006858269916562865, 'weight_decay': 1.4059991381184692e-06, 'beta_0': 0.8680735514401137, 'beta_1': 0.9851365561696629, 'epsilon': 3.649252958553658e-06, 'balanced_loss': False, 'epochs': 134, 'early_stopping_patience': 10, 'plateau_patience': 24, 'plateau_divider': 8}. Best is trial 12 with value: 0.9220183486238532.
[I 2024-12-02 12:06:05,380] Trial 22 finished with value: 0.9208715596330275 and parameters: {'attention_pooling_operation': 'max', 'embedding_pooling_operation': 'mean', 'threshold': 0.4893723682189664, 'batch_size': 220, 'attention_heads': 14, 'hidden_dimension': 201, 'number_of_hidden_layers': 1, 'dropout_rate': 0.41318516529553284, 'global_pooling': 'mean', 'learning_rate': 0.00033126725307600487, 'weight_decay': 1.9371107238848213e-06, 'beta_0': 0.8685671412926684, 'beta_1': 0.9851105895634675, 'epsilon': 2.0015239976355745e-06, 'balanced_loss': False, 'epochs': 139, 'early_stopping_patience': 10, 'plateau_patience': 23, 'plateau_divider': 6}. Best is trial 12 with value: 0.9220183486238532.
[I 2024-12-02 12:10:31,203] Trial 23 finished with value: 0.8509174311926605 and parameters: {'attention_pooling_operation': 'max', 'embedding_pooling_operation': 'mean', 'threshold': 0.47598772447124205, 'batch_size': 221, 'attention_heads': 14, 'hidden_dimension': 225, 'number_of_hidden_layers': 1, 'dropout_rate': 0.3894703546718379, 'global_pooling': 'mean', 'learning_rate': 0.0866438695660128, 'weight_decay': 1.7989696719450237e-06, 'beta_0': 0.8635773926855573, 'beta_1': 0.9844175625049748, 'epsilon': 2.915799851673619e-06, 'balanced_loss': False, 'epochs': 118, 'early_stopping_patience': 10, 'plateau_patience': 23, 'plateau_divider': 9}. Best is trial 12 with value: 0.9220183486238532.
[I 2024-12-02 12:15:54,485] Trial 24 finished with value: 0.9185779816513762 and parameters: {'attention_pooling_operation': 'max', 'embedding_pooling_operation': 'mean', 'threshold': 0.49080315819386966, 'batch_size': 256, 'attention_heads': 14, 'hidden_dimension': 201, 'number_of_hidden_layers': 1, 'dropout_rate': 0.41595841237283065, 'global_pooling': 'mean', 'learning_rate': 0.000800356485804232, 'weight_decay': 1.0100666579199853e-06, 'beta_0': 0.861648629525711, 'beta_1': 0.9825183135323353, 'epsilon': 1.2860000789150702e-05, 'balanced_loss': False, 'epochs': 141, 'early_stopping_patience': 11, 'plateau_patience': 24, 'plateau_divider': 7}. Best is trial 12 with value: 0.9220183486238532.
[I 2024-12-02 12:21:36,358] Trial 25 finished with value: 0.9105504587155964 and parameters: {'attention_pooling_operation': 'max', 'embedding_pooling_operation': 'mean', 'threshold': 0.40348596808651593, 'batch_size': 233, 'attention_heads': 15, 'hidden_dimension': 167, 'number_of_hidden_layers': 0, 'dropout_rate': 0.34597187943890806, 'global_pooling': 'mean', 'learning_rate': 6.165718569081188e-05, 'weight_decay': 2.0627165720264792e-06, 'beta_0': 0.8795937604145772, 'beta_1': 0.98008586235214, 'epsilon': 9.644604752574056e-07, 'balanced_loss': False, 'epochs': 104, 'early_stopping_patience': 13, 'plateau_patience': 21, 'plateau_divider': 8}. Best is trial 12 with value: 0.9220183486238532.
[I 2024-12-02 12:26:04,123] Trial 26 finished with value: 0.9162844036697247 and parameters: {'attention_pooling_operation': 'max', 'embedding_pooling_operation': 'mean', 'threshold': 0.6413647217291369, 'batch_size': 199, 'attention_heads': 12, 'hidden_dimension': 239, 'number_of_hidden_layers': 1, 'dropout_rate': 0.4661566964456507, 'global_pooling': 'mean', 'learning_rate': 0.004554305118308873, 'weight_decay': 4.5693285163892025e-06, 'beta_0': 0.8566730247743617, 'beta_1': 0.9855081970709968, 'epsilon': 3.0362745529872767e-06, 'balanced_loss': False, 'epochs': 140, 'early_stopping_patience': 11, 'plateau_patience': 23, 'plateau_divider': 4}. Best is trial 12 with value: 0.9220183486238532.
[I 2024-12-02 12:30:31,153] Trial 27 finished with value: 0.9162844036697247 and parameters: {'attention_pooling_operation': 'max', 'embedding_pooling_operation': 'mean', 'threshold': 0.5233901887523633, 'batch_size': 210, 'attention_heads': 15, 'hidden_dimension': 140, 'number_of_hidden_layers': 2, 'dropout_rate': 0.30314585972161534, 'global_pooling': 'mean', 'learning_rate': 0.00280294038689059, 'weight_decay': 0.0009514745498470655, 'beta_0': 0.8669080949405052, 'beta_1': 0.9882711429533634, 'epsilon': 1.2972516076969675e-06, 'balanced_loss': False, 'epochs': 125, 'early_stopping_patience': 10, 'plateau_patience': 24, 'plateau_divider': 9}. Best is trial 12 with value: 0.9220183486238532.
[I 2024-12-02 12:35:04,006] Trial 28 finished with value: 0.9094036697247706 and parameters: {'attention_pooling_operation': 'mean', 'embedding_pooling_operation': 'mean', 'threshold': 0.46436715054236155, 'batch_size': 173, 'attention_heads': 16, 'hidden_dimension': 203, 'number_of_hidden_layers': 0, 'dropout_rate': 0.42135373640945395, 'global_pooling': 'sum', 'learning_rate': 0.00021110230566252474, 'weight_decay': 1.7461027321960969e-06, 'beta_0': 0.878426276083472, 'beta_1': 0.9865086859751212, 'epsilon': 1.0877889816776759e-05, 'balanced_loss': False, 'epochs': 151, 'early_stopping_patience': 13, 'plateau_patience': 21, 'plateau_divider': 6}. Best is trial 12 with value: 0.9220183486238532.
[I 2024-12-02 12:40:31,524] Trial 29 finished with value: 0.9151376146788991 and parameters: {'attention_pooling_operation': 'min', 'embedding_pooling_operation': 'mean', 'threshold': 0.45874707836413, 'batch_size': 232, 'attention_heads': 12, 'hidden_dimension': 189, 'number_of_hidden_layers': 0, 'dropout_rate': 0.3801892964326263, 'global_pooling': 'max', 'learning_rate': 7.956037214706595e-05, 'weight_decay': 1.0713631743728972e-05, 'beta_0': 0.8562578753118485, 'beta_1': 0.9885104655451425, 'epsilon': 4.071007164799218e-06, 'balanced_loss': False, 'epochs': 87, 'early_stopping_patience': 15, 'plateau_patience': 18, 'plateau_divider': 9}. Best is trial 12 with value: 0.9220183486238532.
