[I 2024-11-28 08:55:49,337] Trial 31 finished with value: 0.9071100917431193 and parameters: {'attention_pooling_operation': 'max', 'embedding_pooling_operation': 'max', 'threshold': 0.5682792299179639, 'batch_size': 141, 'attention_heads': 13, 'hidden_dimension': 157, 'number_of_hidden_layers': 2, 'dropout_rate': 0.45944602435276866, 'global_pooling': 'max', 'learning_rate': 0.002207640716145911, 'weight_decay': 0.00012561484305720783, 'beta_0': 0.8705560077127447, 'beta_1': 0.9852800297588035, 'epsilon': 3.366584976270358e-06, 'balanced_loss': False, 'epochs': 73, 'early_stopping_patience': 24, 'plateau_patience': 14, 'plateau_divider': 8}. Best is trial 31 with value: 0.9071100917431193.
[I 2024-11-28 09:01:16,607] Trial 32 finished with value: 0.893348623853211 and parameters: {'attention_pooling_operation': 'max', 'embedding_pooling_operation': 'max', 'threshold': 0.5281297317783684, 'batch_size': 143, 'attention_heads': 12, 'hidden_dimension': 177, 'number_of_hidden_layers': 2, 'dropout_rate': 0.4554039569662152, 'global_pooling': 'max', 'learning_rate': 0.001130383958519252, 'weight_decay': 4.2269496431565524e-05, 'beta_0': 0.8828804868799902, 'beta_1': 0.984632921775849, 'epsilon': 5.941274990678936e-06, 'balanced_loss': False, 'epochs': 74, 'early_stopping_patience': 24, 'plateau_patience': 16, 'plateau_divider': 7}. Best is trial 31 with value: 0.9071100917431193.
[I 2024-11-28 09:05:56,220] Trial 33 finished with value: 0.9002293577981652 and parameters: {'attention_pooling_operation': 'max', 'embedding_pooling_operation': 'max', 'threshold': 0.43986476127221297, 'batch_size': 159, 'attention_heads': 14, 'hidden_dimension': 143, 'number_of_hidden_layers': 1, 'dropout_rate': 0.39918153388218347, 'global_pooling': 'max', 'learning_rate': 0.003273939336644071, 'weight_decay': 8.155198088182789e-05, 'beta_0': 0.8726145420186078, 'beta_1': 0.9828641657214886, 'epsilon': 3.269517353104555e-06, 'balanced_loss': False, 'epochs': 60, 'early_stopping_patience': 22, 'plateau_patience': 17, 'plateau_divider': 8}. Best is trial 31 with value: 0.9071100917431193.
[I 2024-11-28 09:12:58,487] Trial 34 finished with value: 0.6594036697247706 and parameters: {'attention_pooling_operation': 'max', 'embedding_pooling_operation': 'max', 'threshold': 0.5689786274910701, 'batch_size': 108, 'attention_heads': 16, 'hidden_dimension': 168, 'number_of_hidden_layers': 3, 'dropout_rate': 0.47519288083573974, 'global_pooling': 'max', 'learning_rate': 0.011342621742707504, 'weight_decay': 0.00014513493020845505, 'beta_0': 0.8969233313812792, 'beta_1': 0.9858821353575538, 'epsilon': 1.8327352105934396e-06, 'balanced_loss': False, 'epochs': 91, 'early_stopping_patience': 24, 'plateau_patience': 10, 'plateau_divider': 8}. Best is trial 31 with value: 0.9071100917431193.
[I 2024-11-28 09:18:01,460] Trial 35 finished with value: 0.9105504587155964 and parameters: {'attention_pooling_operation': 'max', 'embedding_pooling_operation': 'min', 'threshold': 0.641679027236095, 'batch_size': 138, 'attention_heads': 11, 'hidden_dimension': 190, 'number_of_hidden_layers': 2, 'dropout_rate': 0.42116343124053396, 'global_pooling': 'max', 'learning_rate': 0.0007471621415336176, 'weight_decay': 0.00048103700985461265, 'beta_0': 0.8844399918010942, 'beta_1': 0.9907122965977735, 'epsilon': 1.5694473645309e-05, 'balanced_loss': True, 'epochs': 129, 'early_stopping_patience': 20, 'plateau_patience': 11, 'plateau_divider': 6}. Best is trial 35 with value: 0.9105504587155964.
[I 2024-11-28 09:23:05,052] Trial 36 finished with value: 0.8910550458715596 and parameters: {'attention_pooling_operation': 'min', 'embedding_pooling_operation': 'min', 'threshold': 0.7227869467191472, 'batch_size': 94, 'attention_heads': 9, 'hidden_dimension': 194, 'number_of_hidden_layers': 3, 'dropout_rate': 0.4449076838227105, 'global_pooling': 'mean', 'learning_rate': 0.0009349627055770706, 'weight_decay': 0.0005512673905328896, 'beta_0': 0.8912714405827317, 'beta_1': 0.9945345349603516, 'epsilon': 1.527938998332634e-05, 'balanced_loss': False, 'epochs': 128, 'early_stopping_patience': 20, 'plateau_patience': 11, 'plateau_divider': 6}. Best is trial 35 with value: 0.9105504587155964.
[I 2024-11-28 09:28:54,021] Trial 37 finished with value: 0.9036697247706422 and parameters: {'attention_pooling_operation': 'max', 'embedding_pooling_operation': 'min', 'threshold': 0.6622320954399106, 'batch_size': 137, 'attention_heads': 13, 'hidden_dimension': 230, 'number_of_hidden_layers': 2, 'dropout_rate': 0.3504228813029271, 'global_pooling': 'max', 'learning_rate': 0.0028303066819466145, 'weight_decay': 0.0008770240288883199, 'beta_0': 0.8840726445835284, 'beta_1': 0.9901960670060076, 'epsilon': 6.958911977111005e-05, 'balanced_loss': False, 'epochs': 142, 'early_stopping_patience': 21, 'plateau_patience': 12, 'plateau_divider': 6}. Best is trial 35 with value: 0.9105504587155964.
[I 2024-11-28 09:33:09,466] Trial 38 finished with value: 0.908256880733945 and parameters: {'attention_pooling_operation': 'max', 'embedding_pooling_operation': 'min', 'threshold': 0.6568860999099063, 'batch_size': 117, 'attention_heads': 6, 'hidden_dimension': 243, 'number_of_hidden_layers': 2, 'dropout_rate': 0.3325036296660819, 'global_pooling': 'max', 'learning_rate': 0.0021559525603043394, 'weight_decay': 0.0009441970303699162, 'beta_0': 0.885424747370929, 'beta_1': 0.9908747825345423, 'epsilon': 6.266851308908943e-05, 'balanced_loss': False, 'epochs': 143, 'early_stopping_patience': 21, 'plateau_patience': 12, 'plateau_divider': 6}. Best is trial 35 with value: 0.9105504587155964.
[I 2024-11-28 09:37:32,529] Trial 39 finished with value: 0.8922018348623854 and parameters: {'attention_pooling_operation': 'min', 'embedding_pooling_operation': 'min', 'threshold': 0.7035826358846425, 'batch_size': 60, 'attention_heads': 4, 'hidden_dimension': 249, 'number_of_hidden_layers': 3, 'dropout_rate': 0.32982675492288915, 'global_pooling': 'sum', 'learning_rate': 0.0018552625265662761, 'weight_decay': 0.0004662771668602486, 'beta_0': 0.8918569317342201, 'beta_1': 0.9940414192194085, 'epsilon': 5.1505554318695785e-05, 'balanced_loss': False, 'epochs': 144, 'early_stopping_patience': 24, 'plateau_patience': 11, 'plateau_divider': 5}. Best is trial 35 with value: 0.9105504587155964.
[I 2024-11-28 09:41:44,378] Trial 40 finished with value: 0.8910550458715596 and parameters: {'attention_pooling_operation': 'max', 'embedding_pooling_operation': 'min', 'threshold': 0.7897213753530725, 'batch_size': 114, 'attention_heads': 8, 'hidden_dimension': 218, 'number_of_hidden_layers': 2, 'dropout_rate': 0.3021097584589038, 'global_pooling': 'max', 'learning_rate': 0.0003782158369287945, 'weight_decay': 0.00034551405108451823, 'beta_0': 0.8847295062498813, 'beta_1': 0.9910819070980194, 'epsilon': 4.409842018498267e-05, 'balanced_loss': False, 'epochs': 165, 'early_stopping_patience': 17, 'plateau_patience': 14, 'plateau_divider': 4}. Best is trial 35 with value: 0.9105504587155964.
[I 2024-11-28 09:46:22,530] Trial 41 finished with value: 0.9036697247706422 and parameters: {'attention_pooling_operation': 'max', 'embedding_pooling_operation': 'min', 'threshold': 0.6424104636443091, 'batch_size': 136, 'attention_heads': 7, 'hidden_dimension': 233, 'number_of_hidden_layers': 2, 'dropout_rate': 0.33393722836993833, 'global_pooling': 'max', 'learning_rate': 0.003369608038314691, 'weight_decay': 0.0008666174690951539, 'beta_0': 0.8777667609510721, 'beta_1': 0.9934168920399844, 'epsilon': 8.7193910939081e-05, 'balanced_loss': False, 'epochs': 140, 'early_stopping_patience': 20, 'plateau_patience': 12, 'plateau_divider': 6}. Best is trial 35 with value: 0.9105504587155964.
[I 2024-11-28 09:50:48,689] Trial 42 finished with value: 0.9013761467889908 and parameters: {'attention_pooling_operation': 'max', 'embedding_pooling_operation': 'min', 'threshold': 0.6717485842331389, 'batch_size': 123, 'attention_heads': 6, 'hidden_dimension': 231, 'number_of_hidden_layers': 2, 'dropout_rate': 0.34863416283177173, 'global_pooling': 'max', 'learning_rate': 0.0017324383076887143, 'weight_decay': 0.0007083880804732431, 'beta_0': 0.8995497075928239, 'beta_1': 0.989941151491716, 'epsilon': 5.94684569805439e-05, 'balanced_loss': False, 'epochs': 120, 'early_stopping_patience': 21, 'plateau_patience': 12, 'plateau_divider': 4}. Best is trial 35 with value: 0.9105504587155964.
[I 2024-11-28 09:57:12,669] Trial 43 finished with value: 0.8715596330275229 and parameters: {'attention_pooling_operation': 'max', 'embedding_pooling_operation': 'min', 'threshold': 0.6671940715993117, 'batch_size': 97, 'attention_heads': 13, 'hidden_dimension': 245, 'number_of_hidden_layers': 2, 'dropout_rate': 0.31603904801618055, 'global_pooling': 'max', 'learning_rate': 0.00803775262531521, 'weight_decay': 0.0004004867235345339, 'beta_0': 0.8859079985457743, 'beta_1': 0.9908944617425646, 'epsilon': 2.5908525977995357e-05, 'balanced_loss': False, 'epochs': 156, 'early_stopping_patience': 22, 'plateau_patience': 10, 'plateau_divider': 6}. Best is trial 35 with value: 0.9105504587155964.
[I 2024-11-28 10:03:39,432] Trial 44 finished with value: 0.8474770642201835 and parameters: {'attention_pooling_operation': 'max', 'embedding_pooling_operation': 'min', 'threshold': 0.6328900251153562, 'batch_size': 152, 'attention_heads': 15, 'hidden_dimension': 208, 'number_of_hidden_layers': 2, 'dropout_rate': 0.37394758504787007, 'global_pooling': 'mean', 'learning_rate': 0.023416498580020994, 'weight_decay': 0.0007483039233890153, 'beta_0': 0.8743883131731051, 'beta_1': 0.9892705246571559, 'epsilon': 1.151850516574636e-05, 'balanced_loss': False, 'epochs': 135, 'early_stopping_patience': 21, 'plateau_patience': 14, 'plateau_divider': 5}. Best is trial 35 with value: 0.9105504587155964.
[I 2024-11-28 10:10:57,433] Trial 45 finished with value: 0.8910550458715596 and parameters: {'attention_pooling_operation': 'mean', 'embedding_pooling_operation': 'min', 'threshold': 0.5530407676710938, 'batch_size': 80, 'attention_heads': 13, 'hidden_dimension': 184, 'number_of_hidden_layers': 3, 'dropout_rate': 0.3419071987964342, 'global_pooling': 'max', 'learning_rate': 0.002420543629428737, 'weight_decay': 0.00024873840371775517, 'beta_0': 0.8813352278901567, 'beta_1': 0.992635490037473, 'epsilon': 6.392958549048768e-05, 'balanced_loss': False, 'epochs': 181, 'early_stopping_patience': 23, 'plateau_patience': 12, 'plateau_divider': 6}. Best is trial 35 with value: 0.9105504587155964.
[I 2024-11-28 10:15:43,484] Trial 46 finished with value: 0.9002293577981652 and parameters: {'attention_pooling_operation': 'max', 'embedding_pooling_operation': 'min', 'threshold': 0.703366377634203, 'batch_size': 137, 'attention_heads': 6, 'hidden_dimension': 256, 'number_of_hidden_layers': 2, 'dropout_rate': 0.5972523781582937, 'global_pooling': 'max', 'learning_rate': 0.0012230229915902928, 'weight_decay': 0.0004839686587587185, 'beta_0': 0.8683769688499449, 'beta_1': 0.9904556171364188, 'epsilon': 2.0352888817427235e-05, 'balanced_loss': False, 'epochs': 148, 'early_stopping_patience': 18, 'plateau_patience': 11, 'plateau_divider': 3}. Best is trial 35 with value: 0.9105504587155964.
[I 2024-11-28 10:20:09,551] Trial 47 finished with value: 0.8853211009174312 and parameters: {'attention_pooling_operation': 'min', 'embedding_pooling_operation': 'mean', 'threshold': 0.778048672646298, 'batch_size': 121, 'attention_heads': 11, 'hidden_dimension': 222, 'number_of_hidden_layers': 2, 'dropout_rate': 0.3641851569087716, 'global_pooling': 'max', 'learning_rate': 0.004175839268157746, 'weight_decay': 0.00020592261524107476, 'beta_0': 0.8942974018813213, 'beta_1': 0.9887365101419231, 'epsilon': 3.6779562860651576e-05, 'balanced_loss': False, 'epochs': 124, 'early_stopping_patience': 10, 'plateau_patience': 13, 'plateau_divider': 7}. Best is trial 35 with value: 0.9105504587155964.
[I 2024-11-28 10:28:07,510] Trial 48 finished with value: 0.9048165137614679 and parameters: {'attention_pooling_operation': 'max', 'embedding_pooling_operation': 'min', 'threshold': 0.5925604714656125, 'batch_size': 148, 'attention_heads': 14, 'hidden_dimension': 239, 'number_of_hidden_layers': 3, 'dropout_rate': 0.32432552737594633, 'global_pooling': 'max', 'learning_rate': 0.0022277752349648718, 'weight_decay': 0.0008622682245326734, 'beta_0': 0.8872971669092556, 'beta_1': 0.9954057011274009, 'epsilon': 1.1592749062614741e-08, 'balanced_loss': False, 'epochs': 164, 'early_stopping_patience': 21, 'plateau_patience': 10, 'plateau_divider': 7}. Best is trial 35 with value: 0.9105504587155964.
[I 2024-11-28 10:36:47,706] Trial 49 finished with value: 0.9013761467889908 and parameters: {'attention_pooling_operation': 'max', 'embedding_pooling_operation': 'min', 'threshold': 0.5859922874032231, 'batch_size': 151, 'attention_heads': 16, 'hidden_dimension': 196, 'number_of_hidden_layers': 4, 'dropout_rate': 0.49157027373295725, 'global_pooling': 'mean', 'learning_rate': 0.0006948997264694684, 'weight_decay': 0.0005824088336215123, 'beta_0': 0.8880262075471155, 'beta_1': 0.9958543265800048, 'epsilon': 1.5466485412044256e-08, 'balanced_loss': False, 'epochs': 199, 'early_stopping_patience': 19, 'plateau_patience': 10, 'plateau_divider': 8}. Best is trial 35 with value: 0.9105504587155964.
[I 2024-11-28 10:44:58,285] Trial 50 finished with value: 0.8944954128440367 and parameters: {'attention_pooling_operation': 'max', 'embedding_pooling_operation': 'min', 'threshold': 0.5209744823242846, 'batch_size': 105, 'attention_heads': 14, 'hidden_dimension': 244, 'number_of_hidden_layers': 3, 'dropout_rate': 0.3153002476805175, 'global_pooling': 'sum', 'learning_rate': 0.0015015158188603926, 'weight_decay': 0.0009938500885293548, 'beta_0': 0.865767392863534, 'beta_1': 0.9978701436582945, 'epsilon': 8.422567245393428e-08, 'balanced_loss': False, 'epochs': 163, 'early_stopping_patience': 20, 'plateau_patience': 11, 'plateau_divider': 7}. Best is trial 35 with value: 0.9105504587155964.
[I 2024-11-28 10:50:42,721] Trial 51 finished with value: 0.8979357798165137 and parameters: {'attention_pooling_operation': 'max', 'embedding_pooling_operation': 'min', 'threshold': 0.6246158727941598, 'batch_size': 144, 'attention_heads': 13, 'hidden_dimension': 229, 'number_of_hidden_layers': 2, 'dropout_rate': 0.3199764904216597, 'global_pooling': 'max', 'learning_rate': 0.002167773435243923, 'weight_decay': 0.0007392456158801151, 'beta_0': 0.8766266950297777, 'beta_1': 0.9956846616268182, 'epsilon': 4.801812583192337e-08, 'balanced_loss': False, 'epochs': 179, 'early_stopping_patience': 21, 'plateau_patience': 14, 'plateau_divider': 6}. Best is trial 35 with value: 0.9105504587155964.
[I 2024-11-28 10:58:16,065] Trial 52 finished with value: 0.8864678899082569 and parameters: {'attention_pooling_operation': 'max', 'embedding_pooling_operation': 'min', 'threshold': 0.6891225695744292, 'batch_size': 134, 'attention_heads': 15, 'hidden_dimension': 212, 'number_of_hidden_layers': 3, 'dropout_rate': 0.34989554144721663, 'global_pooling': 'max', 'learning_rate': 0.004585100162718237, 'weight_decay': 0.0004217344365316117, 'beta_0': 0.8824254391356212, 'beta_1': 0.9925938914747278, 'epsilon': 1.0392414788685075e-08, 'balanced_loss': False, 'epochs': 152, 'early_stopping_patience': 24, 'plateau_patience': 13, 'plateau_divider': 6}. Best is trial 35 with value: 0.9105504587155964.
[I 2024-11-28 11:05:51,929] Trial 53 finished with value: 0.8841743119266054 and parameters: {'attention_pooling_operation': 'max', 'embedding_pooling_operation': 'min', 'threshold': 0.5570987242585361, 'batch_size': 181, 'attention_heads': 14, 'hidden_dimension': 237, 'number_of_hidden_layers': 2, 'dropout_rate': 0.4722711066393644, 'global_pooling': 'max', 'learning_rate': 0.007685923156742224, 'weight_decay': 0.0009624011600711829, 'beta_0': 0.8875850935342691, 'beta_1': 0.9968299800274254, 'epsilon': 1.02109708193779e-05, 'balanced_loss': False, 'epochs': 135, 'early_stopping_patience': 21, 'plateau_patience': 12, 'plateau_divider': 7}. Best is trial 35 with value: 0.9105504587155964.
[I 2024-11-28 11:13:02,873] Trial 54 finished with value: 0.8979357798165137 and parameters: {'attention_pooling_operation': 'max', 'embedding_pooling_operation': 'min', 'threshold': 0.5940536501109835, 'batch_size': 146, 'attention_heads': 13, 'hidden_dimension': 222, 'number_of_hidden_layers': 3, 'dropout_rate': 0.3376628843511495, 'global_pooling': 'max', 'learning_rate': 0.0024216750305939335, 'weight_decay': 0.00029182412045512335, 'beta_0': 0.8948148851701393, 'beta_1': 0.9872374699008999, 'epsilon': 6.129707137355486e-06, 'balanced_loss': False, 'epochs': 111, 'early_stopping_patience': 23, 'plateau_patience': 10, 'plateau_divider': 8}. Best is trial 35 with value: 0.9105504587155964.
[I 2024-11-28 11:17:15,688] Trial 55 finished with value: 0.9036697247706422 and parameters: {'attention_pooling_operation': 'max', 'embedding_pooling_operation': 'mean', 'threshold': 0.6508051726259039, 'batch_size': 127, 'attention_heads': 4, 'hidden_dimension': 240, 'number_of_hidden_layers': 2, 'dropout_rate': 0.4963532865319158, 'global_pooling': 'max', 'learning_rate': 0.0012233425749838996, 'weight_decay': 0.0006360967746173638, 'beta_0': 0.8802180063370068, 'beta_1': 0.9917519471966187, 'epsilon': 6.740998544779115e-07, 'balanced_loss': False, 'epochs': 161, 'early_stopping_patience': 25, 'plateau_patience': 15, 'plateau_divider': 7}. Best is trial 35 with value: 0.9105504587155964.
[I 2024-11-28 11:24:18,947] Trial 56 finished with value: 0.8371559633027523 and parameters: {'attention_pooling_operation': 'max', 'embedding_pooling_operation': 'min', 'threshold': 0.6175845950359147, 'batch_size': 115, 'attention_heads': 15, 'hidden_dimension': 254, 'number_of_hidden_layers': 2, 'dropout_rate': 0.3873043032841081, 'global_pooling': 'max', 'learning_rate': 0.01361536822949667, 'weight_decay': 0.00016317646198728625, 'beta_0': 0.8911509457020663, 'beta_1': 0.9932965135264806, 'epsilon': 1.883339000005121e-05, 'balanced_loss': False, 'epochs': 146, 'early_stopping_patience': 22, 'plateau_patience': 13, 'plateau_divider': 6}. Best is trial 35 with value: 0.9105504587155964.
[I 2024-11-28 11:29:13,186] Trial 57 finished with value: 0.893348623853211 and parameters: {'attention_pooling_operation': 'mean', 'embedding_pooling_operation': 'min', 'threshold': 0.5386339712415553, 'batch_size': 152, 'attention_heads': 14, 'hidden_dimension': 153, 'number_of_hidden_layers': 2, 'dropout_rate': 0.37365008879997086, 'global_pooling': 'max', 'learning_rate': 0.00036718911372132405, 'weight_decay': 0.00012227103067391617, 'beta_0': 0.8751728187251303, 'beta_1': 0.9817264270110768, 'epsilon': 9.882301746556804e-05, 'balanced_loss': False, 'epochs': 173, 'early_stopping_patience': 17, 'plateau_patience': 11, 'plateau_divider': 5}. Best is trial 35 with value: 0.9105504587155964.
[I 2024-11-28 11:35:36,277] Trial 58 finished with value: 0.8990825688073395 and parameters: {'attention_pooling_operation': 'max', 'embedding_pooling_operation': 'min', 'threshold': 0.5732838252082281, 'batch_size': 132, 'attention_heads': 11, 'hidden_dimension': 204, 'number_of_hidden_layers': 4, 'dropout_rate': 0.32046100517022713, 'global_pooling': 'max', 'learning_rate': 0.002865612636516218, 'weight_decay': 0.00036800971392277315, 'beta_0': 0.8530732433680005, 'beta_1': 0.9876927791955923, 'epsilon': 3.92854022690494e-05, 'balanced_loss': False, 'epochs': 140, 'early_stopping_patience': 20, 'plateau_patience': 12, 'plateau_divider': 8}. Best is trial 35 with value: 0.9105504587155964.
[I 2024-11-28 11:39:23,742] Trial 59 finished with value: 0.8853211009174312 and parameters: {'attention_pooling_operation': 'max', 'embedding_pooling_operation': 'mean', 'threshold': 0.9029975246580153, 'batch_size': 158, 'attention_heads': 7, 'hidden_dimension': 172, 'number_of_hidden_layers': 2, 'dropout_rate': 0.3103871466317557, 'global_pooling': 'max', 'learning_rate': 0.004591533472611772, 'weight_decay': 0.0007887187969504571, 'beta_0': 0.8708368302206811, 'beta_1': 0.9835542975056194, 'epsilon': 8.764084709591564e-06, 'balanced_loss': False, 'epochs': 125, 'early_stopping_patience': 23, 'plateau_patience': 13, 'plateau_divider': 7}. Best is trial 35 with value: 0.9105504587155964.
[I 2024-11-28 11:43:26,846] Trial 60 finished with value: 0.893348623853211 and parameters: {'attention_pooling_operation': 'max', 'embedding_pooling_operation': 'min', 'threshold': 0.7335367216462907, 'batch_size': 174, 'attention_heads': 9, 'hidden_dimension': 122, 'number_of_hidden_layers': 3, 'dropout_rate': 0.5095884694351905, 'global_pooling': 'max', 'learning_rate': 0.0007142560575679905, 'weight_decay': 2.0785878756815245e-05, 'beta_0': 0.866978244628211, 'beta_1': 0.9904853966276956, 'epsilon': 4.568261992430584e-06, 'balanced_loss': False, 'epochs': 116, 'early_stopping_patience': 18, 'plateau_patience': 14, 'plateau_divider': 6}. Best is trial 35 with value: 0.9105504587155964.
[I 2024-11-28 11:47:44,506] Trial 61 finished with value: 0.9059633027522935 and parameters: {'attention_pooling_operation': 'max', 'embedding_pooling_operation': 'min', 'threshold': 0.643808321123127, 'batch_size': 135, 'attention_heads': 7, 'hidden_dimension': 224, 'number_of_hidden_layers': 2, 'dropout_rate': 0.33142634772879237, 'global_pooling': 'max', 'learning_rate': 0.0033025770287214502, 'weight_decay': 0.0009024607149187432, 'beta_0': 0.8786995315187721, 'beta_1': 0.9934657425745028, 'epsilon': 7.409840396093514e-05, 'balanced_loss': False, 'epochs': 138, 'early_stopping_patience': 19, 'plateau_patience': 12, 'plateau_divider': 6}. Best is trial 35 with value: 0.9105504587155964.
