[I 2024-11-28 11:51:45,267] Trial 62 finished with value: 0.8967889908256881 and parameters: {'attention_pooling_operation': 'max', 'embedding_pooling_operation': 'min', 'threshold': 0.665802399953619, 'batch_size': 139, 'attention_heads': 5, 'hidden_dimension': 226, 'number_of_hidden_layers': 2, 'dropout_rate': 0.35860652720743647, 'global_pooling': 'max', 'learning_rate': 0.007719859904703445, 'weight_decay': 0.0005522404307520691, 'beta_0': 0.8851399655605777, 'beta_1': 0.9946787243065803, 'epsilon': 6.897178533649352e-05, 'balanced_loss': False, 'epochs': 130, 'early_stopping_patience': 19, 'plateau_patience': 10, 'plateau_divider': 5}. Best is trial 35 with value: 0.9105504587155964.
[I 2024-11-28 11:56:18,469] Trial 63 finished with value: 0.9013761467889908 and parameters: {'attention_pooling_operation': 'max', 'embedding_pooling_operation': 'min', 'threshold': 0.609508003561261, 'batch_size': 119, 'attention_heads': 7, 'hidden_dimension': 238, 'number_of_hidden_layers': 2, 'dropout_rate': 0.3427601911929494, 'global_pooling': 'max', 'learning_rate': 0.0015793382545062488, 'weight_decay': 0.0007635546465680374, 'beta_0': 0.8790353302877318, 'beta_1': 0.9951991465523866, 'epsilon': 7.849437008043514e-05, 'balanced_loss': False, 'epochs': 157, 'early_stopping_patience': 21, 'plateau_patience': 11, 'plateau_divider': 7}. Best is trial 35 with value: 0.9105504587155964.
[I 2024-11-28 12:00:29,698] Trial 64 finished with value: 0.8944954128440367 and parameters: {'attention_pooling_operation': 'max', 'embedding_pooling_operation': 'min', 'threshold': 0.708475956443766, 'batch_size': 128, 'attention_heads': 6, 'hidden_dimension': 217, 'number_of_hidden_layers': 2, 'dropout_rate': 0.3244354574117162, 'global_pooling': 'max', 'learning_rate': 0.006364369703254134, 'weight_decay': 0.0004837178070277514, 'beta_0': 0.8729273275655722, 'beta_1': 0.9932215973103652, 'epsilon': 2.122076138908598e-05, 'balanced_loss': False, 'epochs': 136, 'early_stopping_patience': 19, 'plateau_patience': 12, 'plateau_divider': 6}. Best is trial 35 with value: 0.9105504587155964.
[I 2024-11-28 12:04:26,131] Trial 65 finished with value: 0.8807339449541285 and parameters: {'attention_pooling_operation': 'max', 'embedding_pooling_operation': 'min', 'threshold': 0.682316150133917, 'batch_size': 146, 'attention_heads': 5, 'hidden_dimension': 188, 'number_of_hidden_layers': 1, 'dropout_rate': 0.479743981307316, 'global_pooling': 'sum', 'learning_rate': 0.01991271085294275, 'weight_decay': 0.0009618605746320223, 'beta_0': 0.8614612481253544, 'beta_1': 0.9967825210311834, 'epsilon': 4.3291965673111045e-05, 'balanced_loss': False, 'epochs': 149, 'early_stopping_patience': 20, 'plateau_patience': 11, 'plateau_divider': 6}. Best is trial 35 with value: 0.9105504587155964.
[I 2024-11-28 12:09:10,084] Trial 66 finished with value: 0.9013761467889908 and parameters: {'attention_pooling_operation': 'max', 'embedding_pooling_operation': 'min', 'threshold': 0.6434482453472974, 'batch_size': 109, 'attention_heads': 12, 'hidden_dimension': 154, 'number_of_hidden_layers': 2, 'dropout_rate': 0.3008053600555182, 'global_pooling': 'max', 'learning_rate': 0.004093605880838007, 'weight_decay': 0.00021862297143923404, 'beta_0': 0.8888834688361028, 'beta_1': 0.991514968780453, 'epsilon': 3.354849626534165e-05, 'balanced_loss': True, 'epochs': 120, 'early_stopping_patience': 22, 'plateau_patience': 16, 'plateau_divider': 8}. Best is trial 35 with value: 0.9105504587155964.
[I 2024-11-28 12:14:22,738] Trial 67 finished with value: 0.8922018348623854 and parameters: {'attention_pooling_operation': 'min', 'embedding_pooling_operation': 'min', 'threshold': 0.4953378823806469, 'batch_size': 93, 'attention_heads': 13, 'hidden_dimension': 212, 'number_of_hidden_layers': 2, 'dropout_rate': 0.41336647425460654, 'global_pooling': 'max', 'learning_rate': 0.0008941863206687302, 'weight_decay': 5.014966963983882e-06, 'beta_0': 0.8811537306793272, 'beta_1': 0.9850711773345555, 'epsilon': 2.90991419957579e-06, 'balanced_loss': False, 'epochs': 105, 'early_stopping_patience': 13, 'plateau_patience': 13, 'plateau_divider': 7}. Best is trial 35 with value: 0.9105504587155964.
[I 2024-11-28 12:20:10,095] Trial 68 finished with value: 0.8979357798165137 and parameters: {'attention_pooling_operation': 'max', 'embedding_pooling_operation': 'mean', 'threshold': 0.6316472831889781, 'batch_size': 156, 'attention_heads': 14, 'hidden_dimension': 248, 'number_of_hidden_layers': 1, 'dropout_rate': 0.5781835899902623, 'global_pooling': 'max', 'learning_rate': 0.0026930915987722443, 'weight_decay': 3.7027196276892454e-05, 'beta_0': 0.8946891277491946, 'beta_1': 0.988869710927697, 'epsilon': 3.430728892150646e-07, 'balanced_loss': True, 'epochs': 168, 'early_stopping_patience': 18, 'plateau_patience': 12, 'plateau_divider': 5}. Best is trial 35 with value: 0.9105504587155964.
[I 2024-11-28 12:25:43,219] Trial 69 finished with value: 0.8944954128440367 and parameters: {'attention_pooling_operation': 'mean', 'embedding_pooling_operation': 'max', 'threshold': 0.6032997981157433, 'batch_size': 168, 'attention_heads': 13, 'hidden_dimension': 199, 'number_of_hidden_layers': 2, 'dropout_rate': 0.32975366129808337, 'global_pooling': 'mean', 'learning_rate': 0.002002797619313235, 'weight_decay': 0.00010163054899468637, 'beta_0': 0.8838399828629643, 'beta_1': 0.9921319995521539, 'epsilon': 7.19513740073122e-06, 'balanced_loss': False, 'epochs': 143, 'early_stopping_patience': 22, 'plateau_patience': 10, 'plateau_divider': 6}. Best is trial 35 with value: 0.9105504587155964.
[I 2024-11-28 12:30:43,701] Trial 70 finished with value: 0.8956422018348624 and parameters: {'attention_pooling_operation': 'max', 'embedding_pooling_operation': 'min', 'threshold': 0.5814171070635341, 'batch_size': 253, 'attention_heads': 8, 'hidden_dimension': 136, 'number_of_hidden_layers': 3, 'dropout_rate': 0.46003142393885305, 'global_pooling': 'max', 'learning_rate': 0.000483398661690127, 'weight_decay': 0.0006298789476657841, 'beta_0': 0.8644224571657851, 'beta_1': 0.9898662939692163, 'epsilon': 5.17653560447425e-05, 'balanced_loss': False, 'epochs': 182, 'early_stopping_patience': 25, 'plateau_patience': 15, 'plateau_divider': 7}. Best is trial 35 with value: 0.9105504587155964.
[I 2024-11-28 12:35:05,294] Trial 71 finished with value: 0.9013761467889908 and parameters: {'attention_pooling_operation': 'max', 'embedding_pooling_operation': 'min', 'threshold': 0.6521533216240799, 'batch_size': 138, 'attention_heads': 7, 'hidden_dimension': 235, 'number_of_hidden_layers': 2, 'dropout_rate': 0.33483555832157613, 'global_pooling': 'max', 'learning_rate': 0.0035637614946391286, 'weight_decay': 0.0007945617802859864, 'beta_0': 0.8780603871706942, 'beta_1': 0.9931144825369631, 'epsilon': 7.877010917426415e-05, 'balanced_loss': False, 'epochs': 138, 'early_stopping_patience': 20, 'plateau_patience': 12, 'plateau_divider': 6}. Best is trial 35 with value: 0.9105504587155964.
[I 2024-11-28 12:39:42,422] Trial 72 finished with value: 0.8979357798165137 and parameters: {'attention_pooling_operation': 'max', 'embedding_pooling_operation': 'min', 'threshold': 0.6422338997849238, 'batch_size': 133, 'attention_heads': 8, 'hidden_dimension': 230, 'number_of_hidden_layers': 2, 'dropout_rate': 0.3095814069872234, 'global_pooling': 'max', 'learning_rate': 0.005578350111030066, 'weight_decay': 0.0008523939005339545, 'beta_0': 0.8700914235813287, 'beta_1': 0.9939088903038746, 'epsilon': 9.710672701874295e-05, 'balanced_loss': False, 'epochs': 129, 'early_stopping_patience': 20, 'plateau_patience': 11, 'plateau_divider': 6}. Best is trial 35 with value: 0.9105504587155964.
[I 2024-11-28 12:43:54,455] Trial 73 finished with value: 0.9025229357798165 and parameters: {'attention_pooling_operation': 'max', 'embedding_pooling_operation': 'min', 'threshold': 0.6672329245800622, 'batch_size': 125, 'attention_heads': 6, 'hidden_dimension': 243, 'number_of_hidden_layers': 2, 'dropout_rate': 0.351776115744489, 'global_pooling': 'max', 'learning_rate': 0.003079928749591543, 'weight_decay': 0.0005246779369907596, 'beta_0': 0.8775238783829189, 'beta_1': 0.9910321980297142, 'epsilon': 5.551654025670315e-05, 'balanced_loss': False, 'epochs': 142, 'early_stopping_patience': 19, 'plateau_patience': 12, 'plateau_divider': 6}. Best is trial 35 with value: 0.9105504587155964.
[I 2024-11-28 12:48:24,236] Trial 74 finished with value: 0.8967889908256881 and parameters: {'attention_pooling_operation': 'max', 'embedding_pooling_operation': 'min', 'threshold': 0.61230080304843, 'batch_size': 146, 'attention_heads': 7, 'hidden_dimension': 225, 'number_of_hidden_layers': 2, 'dropout_rate': 0.3658456326624564, 'global_pooling': 'max', 'learning_rate': 0.0014206660752963715, 'weight_decay': 0.0006463966367537421, 'beta_0': 0.8868623685298661, 'beta_1': 0.9941304524435922, 'epsilon': 1.5156448678173965e-05, 'balanced_loss': False, 'epochs': 151, 'early_stopping_patience': 20, 'plateau_patience': 24, 'plateau_divider': 5}. Best is trial 35 with value: 0.9105504587155964.
[I 2024-11-28 12:52:06,432] Trial 75 finished with value: 0.8944954128440367 and parameters: {'attention_pooling_operation': 'max', 'embedding_pooling_operation': 'max', 'threshold': 0.6853719934532675, 'batch_size': 103, 'attention_heads': 5, 'hidden_dimension': 38, 'number_of_hidden_layers': 2, 'dropout_rate': 0.4389037823866329, 'global_pooling': 'max', 'learning_rate': 0.001869088071125884, 'weight_decay': 0.0003771988402164228, 'beta_0': 0.8747255463766399, 'beta_1': 0.9936408117004197, 'epsilon': 2.4721619421979454e-05, 'balanced_loss': False, 'epochs': 158, 'early_stopping_patience': 21, 'plateau_patience': 13, 'plateau_divider': 9}. Best is trial 35 with value: 0.9105504587155964.
[I 2024-11-28 12:57:11,816] Trial 76 finished with value: 0.8956422018348624 and parameters: {'attention_pooling_operation': 'max', 'embedding_pooling_operation': 'min', 'threshold': 0.6271331849353641, 'batch_size': 139, 'attention_heads': 12, 'hidden_dimension': 181, 'number_of_hidden_layers': 2, 'dropout_rate': 0.33305253963787146, 'global_pooling': 'max', 'learning_rate': 0.0010178472910452397, 'weight_decay': 0.000987868049211425, 'beta_0': 0.8911964785751697, 'beta_1': 0.9926040367623123, 'epsilon': 2.000409045498069e-07, 'balanced_loss': True, 'epochs': 132, 'early_stopping_patience': 23, 'plateau_patience': 11, 'plateau_divider': 7}. Best is trial 35 with value: 0.9105504587155964.
[I 2024-11-28 13:01:46,559] Trial 77 finished with value: 0.8555045871559633 and parameters: {'attention_pooling_operation': 'max', 'embedding_pooling_operation': 'max', 'threshold': 0.7654299906296402, 'batch_size': 112, 'attention_heads': 14, 'hidden_dimension': 251, 'number_of_hidden_layers': 1, 'dropout_rate': 0.4662986554421134, 'global_pooling': 'max', 'learning_rate': 0.05021760587943002, 'weight_decay': 0.0002841872644942707, 'beta_0': 0.8726196165567571, 'beta_1': 0.9950834101841445, 'epsilon': 1.6479759254573209e-06, 'balanced_loss': False, 'epochs': 123, 'early_stopping_patience': 19, 'plateau_patience': 14, 'plateau_divider': 5}. Best is trial 35 with value: 0.9105504587155964.
[I 2024-11-28 13:07:34,281] Trial 78 finished with value: 0.8188073394495413 and parameters: {'attention_pooling_operation': 'min', 'embedding_pooling_operation': 'min', 'threshold': 0.4189266902437078, 'batch_size': 164, 'attention_heads': 10, 'hidden_dimension': 234, 'number_of_hidden_layers': 2, 'dropout_rate': 0.45026962459883196, 'global_pooling': 'sum', 'learning_rate': 0.009945899992420274, 'weight_decay': 0.0004326523878259712, 'beta_0': 0.8828335931737663, 'beta_1': 0.9904327447888881, 'epsilon': 7.805789359538684e-05, 'balanced_loss': False, 'epochs': 114, 'early_stopping_patience': 11, 'plateau_patience': 12, 'plateau_divider': 8}. Best is trial 35 with value: 0.9105504587155964.
[I 2024-11-28 13:11:55,202] Trial 79 finished with value: 0.8967889908256881 and parameters: {'attention_pooling_operation': 'max', 'embedding_pooling_operation': 'min', 'threshold': 0.7146645551227637, 'batch_size': 120, 'attention_heads': 8, 'hidden_dimension': 216, 'number_of_hidden_layers': 1, 'dropout_rate': 0.4234190592671116, 'global_pooling': 'max', 'learning_rate': 0.005624373570905244, 'weight_decay': 0.0008543855872548591, 'beta_0': 0.8799450749309703, 'beta_1': 0.9965563199231932, 'epsilon': 3.320148415789431e-08, 'balanced_loss': True, 'epochs': 138, 'early_stopping_patience': 24, 'plateau_patience': 10, 'plateau_divider': 7}. Best is trial 35 with value: 0.9105504587155964.
[I 2024-11-28 13:16:05,524] Trial 80 finished with value: 0.8979357798165137 and parameters: {'attention_pooling_operation': 'max', 'embedding_pooling_operation': 'max', 'threshold': 0.5980048299794181, 'batch_size': 129, 'attention_heads': 6, 'hidden_dimension': 205, 'number_of_hidden_layers': 3, 'dropout_rate': 0.3266208669419456, 'global_pooling': 'max', 'learning_rate': 0.0037715532595714732, 'weight_decay': 0.0006570441931355018, 'beta_0': 0.8467050535012095, 'beta_1': 0.9917911202039339, 'epsilon': 3.0773356801270866e-05, 'balanced_loss': False, 'epochs': 147, 'early_stopping_patience': 16, 'plateau_patience': 11, 'plateau_divider': 6}. Best is trial 35 with value: 0.9105504587155964.
[I 2024-11-28 13:20:18,094] Trial 81 finished with value: 0.9013761467889908 and parameters: {'attention_pooling_operation': 'max', 'embedding_pooling_operation': 'mean', 'threshold': 0.6380001104671027, 'batch_size': 127, 'attention_heads': 4, 'hidden_dimension': 239, 'number_of_hidden_layers': 2, 'dropout_rate': 0.49276454021254457, 'global_pooling': 'max', 'learning_rate': 0.0012046423458351677, 'weight_decay': 0.0006349961456163195, 'beta_0': 0.880048728932324, 'beta_1': 0.9918512031403408, 'epsilon': 7.073608850214433e-07, 'balanced_loss': False, 'epochs': 154, 'early_stopping_patience': 25, 'plateau_patience': 15, 'plateau_divider': 7}. Best is trial 35 with value: 0.9105504587155964.
[I 2024-11-28 13:24:30,546] Trial 82 finished with value: 0.9036697247706422 and parameters: {'attention_pooling_operation': 'max', 'embedding_pooling_operation': 'mean', 'threshold': 0.6508970728469722, 'batch_size': 155, 'attention_heads': 4, 'hidden_dimension': 245, 'number_of_hidden_layers': 2, 'dropout_rate': 0.5005537517326415, 'global_pooling': 'max', 'learning_rate': 0.0013562748642561447, 'weight_decay': 0.0005054451707472582, 'beta_0': 0.876912056702072, 'beta_1': 0.9913633605410663, 'epsilon': 5.138993687061405e-05, 'balanced_loss': False, 'epochs': 162, 'early_stopping_patience': 25, 'plateau_patience': 15, 'plateau_divider': 6}. Best is trial 35 with value: 0.9105504587155964.
[I 2024-11-28 13:29:03,843] Trial 83 finished with value: 0.9059633027522935 and parameters: {'attention_pooling_operation': 'max', 'embedding_pooling_operation': 'mean', 'threshold': 0.6619036842695559, 'batch_size': 148, 'attention_heads': 5, 'hidden_dimension': 239, 'number_of_hidden_layers': 2, 'dropout_rate': 0.5246820923011923, 'global_pooling': 'max', 'learning_rate': 0.002656390743904101, 'weight_decay': 0.00033372252450885914, 'beta_0': 0.8851723597787957, 'beta_1': 0.9899005632269694, 'epsilon': 1.0148036342971408e-07, 'balanced_loss': False, 'epochs': 171, 'early_stopping_patience': 24, 'plateau_patience': 13, 'plateau_divider': 7}. Best is trial 35 with value: 0.9105504587155964.
[I 2024-11-28 13:33:43,096] Trial 84 finished with value: 0.8967889908256881 and parameters: {'attention_pooling_operation': 'max', 'embedding_pooling_operation': 'mean', 'threshold': 0.7003777168180629, 'batch_size': 144, 'attention_heads': 7, 'hidden_dimension': 227, 'number_of_hidden_layers': 2, 'dropout_rate': 0.5402026065041301, 'global_pooling': 'max', 'learning_rate': 0.0024416746630151623, 'weight_decay': 0.0003355680945113126, 'beta_0': 0.8966396538331637, 'beta_1': 0.9893726608312928, 'epsilon': 1.9141326292448105e-08, 'balanced_loss': False, 'epochs': 190, 'early_stopping_patience': 24, 'plateau_patience': 13, 'plateau_divider': 8}. Best is trial 35 with value: 0.9105504587155964.
[I 2024-11-28 13:37:58,603] Trial 85 finished with value: 0.8944954128440367 and parameters: {'attention_pooling_operation': 'max', 'embedding_pooling_operation': 'mean', 'threshold': 0.675812493423091, 'batch_size': 149, 'attention_heads': 5, 'hidden_dimension': 232, 'number_of_hidden_layers': 2, 'dropout_rate': 0.5150648087838009, 'global_pooling': 'mean', 'learning_rate': 0.0028036715765576933, 'weight_decay': 0.00017680548898104436, 'beta_0': 0.8843354983818084, 'beta_1': 0.9898575256607626, 'epsilon': 9.00096966581888e-08, 'balanced_loss': False, 'epochs': 171, 'early_stopping_patience': 23, 'plateau_patience': 13, 'plateau_divider': 6}. Best is trial 35 with value: 0.9105504587155964.
[I 2024-11-28 13:42:36,194] Trial 86 finished with value: 0.8841743119266054 and parameters: {'attention_pooling_operation': 'max', 'embedding_pooling_operation': 'min', 'threshold': 0.6656757258572812, 'batch_size': 138, 'attention_heads': 6, 'hidden_dimension': 256, 'number_of_hidden_layers': 2, 'dropout_rate': 0.5366568116242711, 'global_pooling': 'max', 'learning_rate': 0.004848325929398815, 'weight_decay': 0.00025814358253653335, 'beta_0': 0.8890272890270258, 'beta_1': 0.9878603681541115, 'epsilon': 1.1497494176185176e-07, 'balanced_loss': False, 'epochs': 178, 'early_stopping_patience': 22, 'plateau_patience': 12, 'plateau_divider': 8}. Best is trial 35 with value: 0.9105504587155964.
[I 2024-11-28 13:48:39,746] Trial 87 finished with value: 0.9013761467889908 and parameters: {'attention_pooling_operation': 'mean', 'embedding_pooling_operation': 'mean', 'threshold': 0.563823378519811, 'batch_size': 161, 'attention_heads': 13, 'hidden_dimension': 221, 'number_of_hidden_layers': 2, 'dropout_rate': 0.34393381466529993, 'global_pooling': 'max', 'learning_rate': 0.0019995317844311057, 'weight_decay': 0.00012650221394742463, 'beta_0': 0.8924595535865818, 'beta_1': 0.9868323441563834, 'epsilon': 2.326760115998557e-06, 'balanced_loss': False, 'epochs': 132, 'early_stopping_patience': 21, 'plateau_patience': 14, 'plateau_divider': 7}. Best is trial 35 with value: 0.9105504587155964.
[I 2024-11-28 13:53:24,881] Trial 88 finished with value: 0.9036697247706422 and parameters: {'attention_pooling_operation': 'max', 'embedding_pooling_operation': 'max', 'threshold': 0.5473087772973985, 'batch_size': 142, 'attention_heads': 9, 'hidden_dimension': 149, 'number_of_hidden_layers': 2, 'dropout_rate': 0.4833821635902632, 'global_pooling': 'max', 'learning_rate': 0.0032979373330291072, 'weight_decay': 5.313572846752783e-05, 'beta_0': 0.8752123648185165, 'beta_1': 0.9857452310660942, 'epsilon': 3.782331109030386e-06, 'balanced_loss': True, 'epochs': 75, 'early_stopping_patience': 20, 'plateau_patience': 12, 'plateau_divider': 6}. Best is trial 35 with value: 0.9105504587155964.
[I 2024-11-28 13:58:40,725] Trial 89 finished with value: 0.8990825688073395 and parameters: {'attention_pooling_operation': 'max', 'embedding_pooling_operation': 'min', 'threshold': 0.6194748783062123, 'batch_size': 131, 'attention_heads': 12, 'hidden_dimension': 163, 'number_of_hidden_layers': 2, 'dropout_rate': 0.5486413276897004, 'global_pooling': 'max', 'learning_rate': 0.0005813694010739491, 'weight_decay': 8.18150740895882e-05, 'beta_0': 0.8870392253721666, 'beta_1': 0.9888300661801799, 'epsilon': 5.175376316854489e-07, 'balanced_loss': False, 'epochs': 107, 'early_stopping_patience': 23, 'plateau_patience': 11, 'plateau_divider': 7}. Best is trial 35 with value: 0.9105504587155964.
[I 2024-11-28 14:05:17,038] Trial 90 finished with value: 0.8956422018348624 and parameters: {'attention_pooling_operation': 'max', 'embedding_pooling_operation': 'min', 'threshold': 0.7259750268788925, 'batch_size': 175, 'attention_heads': 15, 'hidden_dimension': 172, 'number_of_hidden_layers': 4, 'dropout_rate': 0.31102237387901, 'global_pooling': 'max', 'learning_rate': 0.0008118308003086381, 'weight_decay': 0.0008540048289418016, 'beta_0': 0.8997799071193004, 'beta_1': 0.9975990166585779, 'epsilon': 4.6725296425527315e-08, 'balanced_loss': False, 'epochs': 56, 'early_stopping_patience': 22, 'plateau_patience': 14, 'plateau_divider': 10}. Best is trial 35 with value: 0.9105504587155964.
[I 2024-11-28 14:09:29,650] Trial 91 finished with value: 0.9036697247706422 and parameters: {'attention_pooling_operation': 'max', 'embedding_pooling_operation': 'mean', 'threshold': 0.6611866773226066, 'batch_size': 134, 'attention_heads': 4, 'hidden_dimension': 242, 'number_of_hidden_layers': 2, 'dropout_rate': 0.5042521291464959, 'global_pooling': 'max', 'learning_rate': 0.001576303423932092, 'weight_decay': 0.0005603550779318646, 'beta_0': 0.881375757652839, 'beta_1': 0.9905427060679286, 'epsilon': 7.693402091188363e-07, 'balanced_loss': False, 'epochs': 162, 'early_stopping_patience': 25, 'plateau_patience': 13, 'plateau_divider': 7}. Best is trial 35 with value: 0.9105504587155964.
[I 2024-11-28 14:13:58,337] Trial 92 finished with value: 0.8956422018348624 and parameters: {'attention_pooling_operation': 'max', 'embedding_pooling_operation': 'mean', 'threshold': 0.6476826313593315, 'batch_size': 125, 'attention_heads': 5, 'hidden_dimension': 250, 'number_of_hidden_layers': 2, 'dropout_rate': 0.4945795326808952, 'global_pooling': 'max', 'learning_rate': 0.0010369413950483254, 'weight_decay': 0.0007259796156441389, 'beta_0': 0.885300108942289, 'beta_1': 0.992509070729356, 'epsilon': 1.4211248396619027e-06, 'balanced_loss': False, 'epochs': 166, 'early_stopping_patience': 24, 'plateau_patience': 13, 'plateau_divider': 7}. Best is trial 35 with value: 0.9105504587155964.
